video_id,title,publishedAt,channelId,channelTitle,categoryId,trending_date,tags,view_count,likes,dislikes,comment_count,thumbnail_link,comments_disabled,ratings_disabled,description
"XuwBwqx9D2w","चवदार मुग डाळीचा हलवा | Moong Dal Halwa Recipe | MadhurasRecipe | Ep - 481","2018-12-03T05:30:01.000Z","UCmbua9iiakRr6nuCXxxsKSQ","MadhurasRecipe Marathi","26","18.05.12","Madhurasrecipe,Marathi Recipe,Maharashtrian Padarth,मुग डाळीचा हलवा,मुगाच्या डाळीचा हलवा,moong dal ka halwa,moong dal halwa,instant moong dal halwa,moong dal halwa recipe,moong dal halwa recipe in hindi,moong ka halwa,halwa,instant moong dal halwa recipe,moong ki dal ka halwa,moong dal recipe,halwa recipe,soaked moong dal halwa recipe,moong dal sheera,moong dal,moong daal halwa,how to make moong dal halwa,indian dessert recipes,moong dal halwa video","82645","2359","102","918","https://i.ytimg.com/vi/XuwBwqx9D2w/default.jpg","False","False","Please take a moment to like and subscribe ✿◕ ‿ ◕✿http://www.youtube.com/c/MadhurasRecipeMarathi?sub_confirmation=1मधुराजरेसिपी चे मसाले ऑर्डर करण्यासाठी इथे क्लीक करा - https://amzn.to/2Cq0jz4#MadhurasRecipeMasale / #MRM मधुराजरेसिपी चे पुस्तक ऑर्डर करण्यासाठी इथे क्लीक करा https://amzn.to/2SuyATBhttp://amzn.in/d/jl7MY8lमधुरजरेसीपी पुस्तक घरपोहच मिळण्याकरता, तुमचे नाव आणि पत्ता ९८८११८६६६३ नंबरवर व्हाट्सअँप करा. हा नंबर मधुराच्या नसून हा माय मिरर पुब्लिकेशनचा नंबर आहे. मधुराज रेसिपी बुक किंवा मसाले ऑर्डर कसे करायचे यासाठी हा विडिओ पहाhttps://youtu.be/9Db_owqWJe4---------------------------------------------------------------------------------------------Click for detail Recipe - http://www.madhurasrecipe.com/regional-recipe/marathi-video-recipesVisit Facebook page - https://business.facebook.com/madhurasrecipeFor Business inquiries please email us on madhurasrecipe@gmail.com Madhurasrecipe facebook group link - https://www.facebook.com/groups/madhurasrecipe/Moong dal halwa is a rich, delicious and healthy north Indian recipe. This dessert is sweet and rich with lots of dry nuts and ghee. It is specially consumed during winter as it is supposed to keep the body warm and protect from cold winter. Do try this delicious recipe at home and drop a comment for me. Do not forget to like, share and subscribe.Ingredients:• 1/2 cup Moong dal• A little less than 1/2 cup Ghee• 1 cup hot Milk• Chopped Cashew nuts• Chopped Almonds• Saffron milk• 3/4 cup Sugar• 125 grams Khoya / Mawa (Optional)• 1/4 tsp Cardamom powderMethod:• Wash moong dal really good and soak it in water for about 4   hours. • Drain the water and transfer the soaked dal into a blender jar. • Blend dal into as smooth paste as possible. • Heat up a pan on medium heat. • Add ghee and blended dal. • Mix well and fry the paste on medium heat for about 8-10   minutes. • The dal should get coarse texture and raw smell of it should be   removed. • No lumps of dal should be formed. Stir continuously while frying   the dal. • Do not roast on high heat. • When the dal dried up and it gets coarse texture like roasted rava,   when it begins to release ghee add cashew nuts, almonds, hot   milk. • Stir quickly after adding the milk so as the lumps of dal are not   formed. • Add saffron milk and mix well. • When milk gets well absorbed add sugar, khoya and mix well. • Adding khoya is optional. You can skip it if you don’t want to add. • Then in that case add 1/2 cup sugar for 1/2 cup dal. • Mix well and let khoya and sugar melt. • Fry for another 4-5 minutes after adding khoya and sugar. • Add cardamom powder and mix well. • Moong dal halwa is already. • This moong dal halwa remains good for 4-5 days at room   temperature. • You can serve halwa hot as it is or it tastes nice when cold too.Subscribe to my other channelsMadharasrecipehttp://www.youtube.com/c/madhurasrecipe?sub_confirmation=1Hindi channelhttps://www.youtube.com/channel/UCIdtPLjTb111r4iubQ9Mq5A?sub_confirmation=1For more Such Recipesगाजराचा हलवा | Gajar ka Halwa | Carrot Halwa by madhurasRecipehttps://www.youtube.com/watch?v=8csKwHfD2WIशिरा / Sheera Recipe / Suji Ka Halwa by madhurasrecipe | Perfect Desi Ghee Suji Halwahttps://www.youtube.com/watch?v=6C5lZX4cdfgमुंबई कराची हलवा | Bombay Karachi Halwa | Corn Flour Halwa | MadhurasRecipehttps://www.youtube.com/watch?v=6SK7aIlfHQsसत्यनारायणाचा प्रसाद | Prasadacha Sheera | MadhurasRecipe |https://www.youtube.com/watch?v=ueYf2Te1BCA&t=40sलाल भोपळ्याचा हलवा | Lal Bhoplyacha Halwa | Navratra Sweet Recipe | MadhurasRecipehttps://www.youtube.com/watch?v=cMSTfO1qJM4झटपट तांदुळाची खीर | Tandalachi kheer Recipe | MadhurasRecipe | Ep - 444https://www.youtube.com/watch?v=ymZVc3z1De8&t=1sगव्हाची खीर | Gavhachi kheer | How to make Wheat Kheer | MadhurasRecipe | Ep - 280https://www.youtube.com/watch?v=Vnh5lRUW6dAबासुंदी | How to make Basundi | Authentic Maharashtrian Sweet Recipe | MadhurasRecipehttps://www.youtube.com/watch?v=D9jiU58Hkswबोटव्याची खीर | Botwyachi Kheer | Authentic Maharashtrian Recipe | Madhurasrecipe | Ep - 359https://www.youtube.com/watch?v=4anyGjgSI3Mलाल भोपळ्याची खीर | Lal Bhoplyachi Kheer by madhurasrecipe | Navratri Farali Recipeshttps://www.youtube.com/watch?v=T9P0wz6oexY"
"sMNWTB_HTuY","7 AM | ETV Telugu News | 4th December 2018","2018-12-04T02:25:21.000Z","UCJi8M0hRKjz8SLPvJKEVTOg","ETV Andhra Pradesh","25","18.05.12","ETV,ETV Telugu,ETV NewsVideo,National News Video,ETV World,ETV Andhravani,AndhravaniVideo,ETV Talkies,Etv2,Etv Andhra News,Andhravani,Etv2 Ghantaravam,Etv2 India,Telugu News,Etv AP,AP News,AP,Etv Telugu,Etv News Live Video,Etv Sakhi,Etv Sukhibhava,Health Magazine,Health Show,Etv Margadarsi,ETV Aaha,etv2india,Latest News Videos,Mundhadugu,Lakshyam,ETV Telangana,Telangana News,Telangana Latest News,Telangana Updates,ETV Live,Live TV","253775","1540","271","206","https://i.ytimg.com/vi/sMNWTB_HTuY/default.jpg","False","False","7 AM | ETV Telugu News | 4th December 2018"
"1-j_sQEAEqE","Awara Dil Mo Kahe | Romantic Song of Love Express Releasing 1st January 2019 | Human & Nibedita","2018-12-04T11:28:18.000Z","UCbBWncD3X_dfXwxmj4KwJnA","Sidharth TV","24","18.05.12","odia hit song,sarthak,sarthak music,odia film,odia movie,odia hd,sarthak film,odia album,hd 1080,new,latest,odia music,2019,2018,jukebox,new odia song,odia non film song,oriya,odia video song,odia song,odia gita,odia gana,odia jatra,odia bhajan,sidharth,sidharth music,sidharth tv,sidharthmusic,sidharthtv,Awara Dil Mo Kahe,Human Sagar,Nibedita,Nivedita,Love express song video,swaraj,sunmeera,love express song","337272","4860","415","393","https://i.ytimg.com/vi/1-j_sQEAEqE/default.jpg","False","False","Love Express  (A Film by Sidharth Music & Sidharth TV)Releasing this New Year (1st Jan 2019)Starring - Swaraj & Sunmeera  Song(Studio Version) : Awara Dil Mo Kahe - Ore Sathi Ore SathiSinger : Humane Sagar & NibeditaLyrics : Arun MantriMusic : Baidyanath DashMusic Arranger : ChelaChoreographer : Amit NayakDialogue : Dr. Nirmal NayakVFX & Graphics : Binay SutarDOP : Pratap RoutCo-Director & Editor : Rajesh DashDirector : Ramesh RoutDI, Graphics & Studio Version Video Direction : Binay SutarSong Mixing : Sitaram Agrawalla & Swapnajit SabathProducer : Sitaram Agrawalla & Namita AgrawallaBanner & Music Label : Sidharth Music &  Sidharth TVSidharth TV ଏବଂ Sidharth Music ପ୍ରସ୍ତୁତ ଏହି ଭିଡିଓଟି ଯଦି ଭଲଲାଗିଥାଏ ତେବେ ଆମ channel କୁ Like ଏବଂ Share କରନ୍ତୁ I ଆମ ସହ ଯୋଡିହୋଇ ରହିବା ପାଇଁ ଏବଂ ସବୁଦିନ ନୂଆ ନୂଆ video ର  Notification ପାଇବା ପାଇଁ  Sidharth TV ଏବଂ Sidharth Music ର YouTube Channelକୁ Subscribe କରନ୍ତୁ ଓ Bell 🔔 ର Button ନିଶ୍ଚୟ ପ୍ରେସ୍ କରନ୍ତୁ I ଧନ୍ୟବାଦ୍ ILike us on Facebookhttps://www.facebook.com/sidharthtvofficial/https://www.facebook.com/SarthakFM/https://www.facebook.com/odiaenews/#SidharthMusic #SidharthTV #SitaramAgrawal #NamitaAgrawal #OdiaAgana#AwaraDilMoKahe #LoveExpress"
"tRHKQrJ02Jw","Types Of Singles | Narikootam #16","2018-12-03T14:48:01.000Z","UC38PDlv1vGvi8djaFf4fdKA","Nari Kootam","23","18.05.12","narikootam,funny,spoof,comedy,tamil,tamil video,latest video,comedy spoof,narikoottam,shortfilm,singles,singles atrocities,fun,tamilnadu","98106","4742","633","218","https://i.ytimg.com/vi/tRHKQrJ02Jw/default.jpg","False","False","Hope You Enjoyed This Video 😍😎To Download The App 👇🏻http://bit.ly/2DYiQmUShare With Your Relatable One And Comment Your Views 😁Keep Supporting #Narikootam & Follow Us On Facebook  : https://www.facebook.com/NarikootamOfficialInstagram : https://www.instagram.com/Narikootam"
"hIi_K97qoVw","DUCK!!! 4 DUCK Varuval prepared by my daddy Arumugam / Village food factory","2018-12-03T08:58:58.000Z","UC-j7LP4at37y3uNTdWLq-vQ","Village food factory","24","18.05.12","village,food,factory,village food,daddy,duck curry,vaathu masala,vaaththu varuval","617175","10205","1191","1031","https://i.ytimg.com/vi/hIi_K97qoVw/default.jpg","False","False","Village food factory"
"_AdlBF-K2z0","I Am Villain 2K Video Song 2018 | The Villain | Dr.ShivarajKumar | Sudeepa | Prem | Arjun Janya","2018-12-02T03:30:02.000Z","UCLtCejNl8eAg4PO_9lf2TIg","Anand Audio","24","18.05.12","#the villain,#thevillainsong,#i am villain full song,#thevillain sudeep song,the villain kannada movie,i am villain video song,the villain official teaser,the villain new updates,the villain full moive,the villain trailer,arjun janya musical hits,arjun janya hits,sudeep hits movies,sudeep hits songs,sudeep hits kannada,sudeep hits kannada movie,sudeep hits video songs,sudeep hits in kannada,sudeep latest hits,sudeep new hits,hits of sudeep","1107009","22175","1543","1763","https://i.ytimg.com/vi/_AdlBF-K2z0/default.jpg","False","False","IMPORTANT NOTICE : Re Uploading of this video may have a strike on your Channel which MAY BLOCK your Channel permanently..!!!----------------------------------------­--------------------------------------------------------Watch Full 2K Video Song I Am Villain from the movie #THEVILLAIN (Ram or Ravan) Starring: Karunaada Chakravarthi Dr.Shivarajkumar, Abhinaya Chakravarthi Kichcha Sudeepa, Amy Jackson & Others Exclusive Only On Anand Audio..!!! ----------------------------------------­--------------------------------------------------------#TheVillain #Shivarajkumar #Sudeep #Amyjackson #Arjunjanya ----------------------------------------­--------------------------------------------------------Film:  #THEVILLAIN (Ram or Ravan)Music:  ARJUN JANYAStarcast: Karunaada Chakravarthi Dr.SHIVARAJKUMAR, Abhinaya Chakravarthi KICHCHA SUDEEPA, AMY JACKSONDirector: PREM (Jogi)Producer: Dr.C.R. MANOHARBanner: TANVI SHANVI FILMSRecord Label: AANANDA AUDIO VIDEO----------------------------------------­--------------------------------------------------------Song: I AM VILLAIN Singer: SHANKAR MAHADEVAN & CHORUSLyrics: PREM’S ----------------------------------------­--------------------------------------------------------You can also Download Anand Audio App https://play.google.com/store/apps/details?id=com.anandaudio.app----------------------------------------­--------------------------------------------------------*YouTube: http://goo.gl/JtObUW                  **Twitter: https://twitter.com/aanandaaudio            **Google+: https://plus.google.com/+AnandAudio         **Facebook: https://www.facebook.com/aanandaaudio *----------------------------------------­--------------------------------------------------------You can also download this album fromiTunes : https://itunes.apple.com/in/album/the-villain-original-motion-picture-soundtrack/1434303367?app=itunes&ign-mpt=uo%3D4  Saavn :  https://www.saavn.com/s/album/kannada/The-Villain-2018/kPp2EFydoyM_Hungama :  http://www.hungama.com/album/the-villain/37113645/Wynk :  https://wynk.in/music/album/The-Villain/si_18273idea :  http://www.ideamusic.in/mobileshare/?es=dHlwZT1hbGJ1bSZpZD0zODE2ODA=Listen & Download in HD on JioMusic :  https://bit.ly/2lHWsnvGoogle Music: https://play.google.com/store/music/album?id=Bn4gd5xmi3wjwvedzc3sbndumouGaan Music: https://gaana.com/album/the-villain-kannadaJukebox : https://www.youtube.com/watch?v=N2ds_zDBQv0----------------------------------------­--------------------------------------------------------Operator Codes1)To Set I Am Villain as Your Caller Tune!!!AirTel Users Dial 5432116554676Vodafone Users Dial 53710553422Idea Users Dial 5678910553422BSNL Users SMS BT 10553422 to 56700 ----------------------------------------------------Airtel Helo Tune To Set This As Your Hellotune Click Here01.I Am Villain : https://bsq2f.app.goo.gl/sCwtZxNbM6SBsZZ2A02.Aapka Naam: https://bsq2f.app.goo.gl/hotTwY2gCidxU4TQ803.Onde Aettu: https://bsq2f.app.goo.gl/gU2v5F4zj3TbLVxF904.Illi Kedinu: https://bsq2f.app.goo.gl/GBrS8MYz1bXRdJT3605.Naane Kingu:  https://bsq2f.app.goo.gl/7SAhHEjiQDeaNrX7A06.Theme Of Villain:  https://bsq2f.app.goo.gl/xo71grLiAYiMr3ix707.Machhu Gichhu: ttps://bsq2f.app.goo.gl/m2Z7T6ZNbvKHeieE908.Nanna Story: https://bsq2f.app.goo.gl/CLEsz9tVMK6xEeXF609.Gangster:  https://bsq2f.app.goo.gl/DhNAZD6bJTJijjF1610.Rajya Kattole: https://bsq2f.app.goo.gl/gd1VyAMUbw4VdiLEA11.Kailli Kasiddre: https://bsq2f.app.goo.gl/xgzw8uFCPr3YfoU87 ----------------------------------------­--------------------------------------------------------Anand Audio is a largest music company in Kannada has released audio of super hit movies like Yejamana, Snehaloka, Chandra Chakori, Tavarige Baa Thangi, Mungaru Male, Milana, Jackie, Maanikya, Kotigobba 2, Chowka, Chakravarthy, Raambo-2, The Villain & others. We have worked with almost big stars like Sudeep, Puneeth Rajkumar, Yash, Dharshan, Radhika Pandith, Sharan, Sadhu Kokila, Shivrajkumar, Upendra, Ganesh & others.----------------------------------------­--------------------------------------------------------VISIT OUR OTHER CHANNELS:-Anand Audio Devotional: https://goo.gl/73RHJRAnand Audio NaaduNudi: https://goo.gl/UCLZLjAnand Audio Evergreen: https://goo.gl/dLSjmKAnand Audio Tulu: https://goo.gl/v4cgYqAnand Audio Entertainment: https://goo.gl/G2yx6XAnand Audio Kannada Comedy: https://goo.gl/UFXUhq"
"pyzRrNXbWx0","ఈ బలి నక్షత్రాల్లో మీది ఉందేమో ఒకసారి  చూసుకోండి Chirravuri Foundation Jayam  nakshatra bali","2018-12-04T05:23:49.000Z","UCKyQqZFXizXrQcHhciGvKIQ","CHIRRAVURI FOUNDATION","22","18.05.12","Chirravuri,Foundation,chirravuri,jayam,star,maa,youtube,channel,latest,krishna,kishore,sarma,pooja,tv,lakshmi,nitya,puja,aishwaryam,telugu,astrology,jathakam,pariharalu,group,amavasya,pournami,deepam,hindu,god,vidhanam,nakshatra,bali","19645","113","29","0","https://i.ytimg.com/vi/pyzRrNXbWx0/default.jpg","True","False","WhatsApp to 8885569579...CHIRRAVURI FOUNDATION.☛Subsctibe To Chirravuri Foundation : https://goo.gl/xWmqDO☛Subscribe To Chirravuri Group : https://goo.gl/iksPp8☛Subscribe To Chirravuri TV : https://goo.gl/PehXm6"
"LKTmaGtwxPw","Modi को गाली से मिलेगी Owaisi को ‘ताली’? देखिए Dangal Rohit Sardana के साथ","2018-12-03T13:29:47.000Z","UCt4t-jeY85JegMlZ-E5UWtA","Aaj Tak","25","18.05.12","aajtak,aaj tak,aaj tak videos,hindi news,news video,latest news,aajtak tv,aajtak channel news,आज तक,asaduddin owaisi,yogi adityanath,yogi adityanath vs asaduddin owaisi,yogi adityanath vs owaisi,asaduddin owaisi news,asaduddin owaisi latest speech,asaduddin owaisi vs yogi adityanath,yogi adityanath speech,asaduddin owaisi yogi adityanath,telangana Election,telangana assembly elections,dangal aajtak,rohit sardana debate,dangal","281585","2219","857","1777","https://i.ytimg.com/vi/LKTmaGtwxPw/default.jpg","False","False","The Owaisi brothers lashed out at Narendra Modi and Yogi Adityanath while addressing campaign rallies in two different places. Akbaruddin Owaisi especially took it too far by making the 'Chaiwala jibe' at PM Modi at least a dozen times in his speech. In Today's Dangal, Rohit Sardana debates whether such derogatory remarks are a necessity in an election speech to earn a few claps? तेलंगाना से भगाने वाले योगी आदित्यनाथ के बयान पर ओवैसी बंधुओं ने रविवार को जोरदा पलटवार किया. मलकापेट में ललकार कर पूछा, क्या ये मुल्क सिर्फ आपका है? तेलंगाना में सीएम योगी ने कहा था बीजेपी की सरकार बनने पर ओवैसी को हैदराबाद के निजाम की तरह भगा देंगे. असदुद्दीन के छोटे भाई अकबरुद्दीन भी योगी आदित्यनाथ पर बरसे, बोले- योगी जैसे 56 आए और चले गए.#TelanganaElections #AkbaruddinOwaisi #PMModi-------------------------------------------------------------------------------------------------------------AajTak Live TV Watch the latest Hindi news Live on the World's Most Subscribed News Channel on YouTube. Aaj Tak News Channel: आज तक भारत का सर्वश्रेष्ठ हिंदी न्‍यूज चैनल है । आज तक न्‍यूज चैनल राजनीति, मनोरंजन, बॉलीवुड, व्यापार और खेल में नवीनतम समाचारों को शामिल करता है। आज तक न्‍यूज चैनल की लाइव खबरें एवं ब्रेकिंग न्यूज के लिए बने रहें । Aaj Tak is India's best Hindi News Channel. Aaj Tak news channel covers latest news in politics, entertainment, Bollywood, business and sports. Stay tuned for all the breaking news in Hindi ! Download India’s No. 1 Hindi News Mobile App : https://aajtak.app.link/QFAp3ZaHmQSubscribe To Our Channel: http://bit.ly/2xTASBc Official website: https://aajtak.intoday.in/ Like us on Facebook http://www.facebook.com/aajtak Follow us on Twitter http://twitter.com/aajtak Subscribe to our other network channels: The Lallantop https://www.youtube.com/c/thelallantop India Today: http://www.youtube.com/channel/UCYPvA... SoSorry: https://www.youtube.com/user/sosorryp... Tez: http://www.youtube.com/user/teztvnews Dilli Aajtak: http://www.youtube.com/user/DilliAajtak"
"gYAQ2xTnNd0","🔴 [Live] Dolon Kalan (Ludhiana) Kabaddi Tournament 04 Dec 2018","2018-12-04T20:54:22.000Z","UCw3P0coE7lUv5v0HoQfRZhw","Kabaddi365.com","17","18.05.12","Kabaddi365.com,kabbadi tournament,kabaddi videos,kabaddi photos,365kabaddi,kabbadi,kabaddi live,livekabaddi,Live,Dolon Kalan,Ludhiana,Kabaddi,Tournament,04 Dec 2018,Live Kabaddi365,Kabaddi365 Live,Live 365,365 Live,Live Match,Live Today,365 Today","383668","4275","246","12","https://i.ytimg.com/vi/gYAQ2xTnNd0/default.jpg","False","False","🔴 [Live] Dolon Kalan (Ludhiana) Kabaddi Tournament 04 Dec 2018🖐🏿👉Don't Forget to Like, Comment, Share and Subscribe to Kabaddi365.com Youtube Channel👉ਤੁਸੀ ਆਪਣੇ Android ਤੇ iPhone ਫੋਨ ਲਈ Kabaddi365 ਦੀ ਐਪ ਇਨਸਟਾਲ ਕਰਨ ਲਈ ਥੱਲੇ ਦਿੱਤੇ ਲਿੰਕ ਤੇ ਕਲਿਕ ਕਰੋ ! http://www.kabaddi365.com/app👉ਬੈਸਟ ਕਬੱਡੀ ਮੈਚ ਦੇਖੋ : http://www.youtube.com/user/365kabaddi👉ਫੇਸਬੁੱਕ ਪੇਜ:- http://www.facebook.com/kabaddi365👉ਸਾਰਾ ਟੂਰਨਾਂਮੈਂਟ ਦੇਖਣ ਲਈ: http://www.youtube.com/user/kabaddi365f👉Best Video Channel:- http://www.youtube.com/user/365kabaddi👉Facebook Page:- http://www.facebook.com/kabaddi365👉Full Video Channel:- http://www.youtube.com/user/kabaddi365f"
"U5ATWkl2GVc","సమైక్య క్రిస్మస్ రాజమండ్రిలో  దైవజనులు జాన్ వెస్లీ గారి వర్తమానం","2018-12-04T08:08:02.000Z","UCMgbYmq6I5zcQUiCN-k_pFA","Young Holy Team","10","18.05.12","John Wesly,Young Holy Team,Christ Worship Centre,India Christian Messages,Telugu Messages,Latest Sermons,Inspiring Sermons,Telugu Songs,Edward williams,P J Stephen Paul,Raj Prakash Paul,Paul Emmanuel,BOUI,I for God,Satish Kumar,Calvary Temple,Kings Temple,Blessie Wesly,Sharon Sisters,J K Christopher,A R Stevenson,Samuel Karmoji,Jyothi Raju,Manna Ministries,Lyrics Studio,Jonah Samuel,Christianity,Shyam Kishore,Close encounter,TV9 interview","44695","1825","54","208","https://i.ytimg.com/vi/U5ATWkl2GVc/default.jpg","False","False","For more information:www.johnwesly.comCall us: 9000 333 555, 9000 333 777God bless India"
"mc03JyqNOOA","Muddha Mandaram - ముద్ద మందారం | Episode - 1256 - Preview | 04 Dec 2018 | Zee Telugu Serial","2018-12-04T07:25:02.000Z","UC3PYGKK29qJ0zu-eEthHK4g","Zee Telugu","24","18.05.12","Muddha Mandaram,muddha mandaram telugu serial latest episode,muddha mandaram today episode live,muddha mandaram today episode,muddha mandaram latest episode today,zee telugu mudda mandaram,zee telugu mudda mandaram serial,zee telugu mudda mandaram full episode,zee telugu,#telugu,zee tv serial,zee tv shows,zee5,#drama,family drama,zee telugu live,zee telugu serials,telugu tv serials in zee telugu,latest episode,watch online","24932","107","7","5","https://i.ytimg.com/vi/mc03JyqNOOA/default.jpg","False","False","ZEE5 Now available in 190+ countries. Click Here http://bit.ly/WatchNowOnZEE5  Subscribe to your favourite Channel 👉 http://bit.ly/ZeeTelugu_Subscribe Get notified about our Latest update by Clicking the Bell Icon 🔔  To watch FULL episode of #MuddhaMandaram, CLICK here - https://www.zee5.com/tvshows/details/muddha-mandaram/0-6-93  The show will explore mindset and class conflict of two different personalities 'Akhilandeshwari' and 'Parvathi'.Kalavari Kodalu fame #Haritha is playing the role of Akhilandeshwari and as #ZeeTelugu is famous for bringing new faces on small screen, is repeating it by launching a new girl Tanuja as the leading protagonist 'Parvathi' in Mudda Mandaram. Also #Tollywood Star Hero King #Nagarjuna promoted this show by accepting Muddha Mandaram plant from Parvathi which she bought from her village and he further gifted it to his better half 'Amala' and expected this chain to continue by inviting people to gift a mandaram plant to their beloved ones.  To Feel ZEE5 in Your Language (Apni Bhasha Mein Feel Hai) | To DOWNLOAD the app click below links    Now enjoy ZEE5 Globally. Available in over 190 countries*   - Playstore: http://bit.ly/2K8zBw9 - iTunes: http://bit.ly/2JpqI0h  Visit our website - https://www.zee5.com   Connect with us on Social Media:  - Facebook - https://www.facebook.com/ZEE5/  - Instagram - https://www.instagram.com/zee5  - Twitter - https://twitter.com/ZEE5India  #telugu #zeetelugu #teluguserials #zeeserials #telugudrama #entertainment #zeetelugushow #zee5"
"I1zPb1k3rWY","Rakhi Sawant Reveals DIRTY Secrets Of Deepak Kalal | EXCLUSIVE Interview | LehrenTV","2018-12-01T15:45:45.000Z","UCxcriVvVwJQ81AHoRwfcd-Q","Lehren TV","24","18.05.12","rakhi sawant and deepak kalals interview,rakhi sawant press conference,rakhi sawant wedding,rakhi sawant live video,rakhi sawant announces wedding with deepak kalal,rakhi sawant wedding video,rakhi sawant interview deepak kalal,rakhi sawant and deepak kalal wedding,rakhi sawant and deepak kalal press conference,rakhi sawant live with deepak kalal,rakhi sawant marriage video,deepak kalal rakhi sawant video call","318103","2300","6079","1782","https://i.ytimg.com/vi/I1zPb1k3rWY/default.jpg","False","False","Drama queen Rakhi Sawant recently announced her marriage with Deepak Kalal. Rakhi held a press conference to announce her wedding. Check out Rakhi Sawant's press conference LIVE right.  #RakhiSawantWedding,#RakhiSawantLive,#RakhiSawant,For More Such News & Gossips Subscribe now! https://bit.ly/LehrenTVLog On To Our Official Website: http://www.lehren.comFollow us on Dailymotion: http://bit.ly/1jnCOoKInstagram: https://www.instagram.com/lehrennetworksFacebook: https://www.facebook.com/LehrenNetworksTwitter: https://twitter.com/LehrenNetworksPinterest: https://in.pinterest.com/lehrenNetworksGoogle+ : https://plus.google.com/+LehrenCo"
