video_id,title,publishedAt,channelId,channelTitle,categoryId,trending_date,tags,view_count,likes,dislikes,comment_count,thumbnail_link,comments_disabled,ratings_disabled,description
"hA6hldpSTF8","Marvel Studios' Avengers - Official Trailer","2018-12-07T13:01:21.000Z","UCvC4D8onUfXzvjTOM-dBfEA","Marvel Entertainment","24","18.09.12","marvel,comics,avengers,avengers 4,trailer,official,a4,mcu","50539730","2704617","33467","281018","https://i.ytimg.com/vi/hA6hldpSTF8/default.jpg","False","False","Part of the journey is the end.► Subscribe to Marvel: http://bit.ly/WeO3YJLearn more: https://bit.ly/2QD3Z85---Follow Marvel on Twitter: ‪https://twitter.com/marvelLike Marvel on FaceBook: ‪https://www.facebook.com/MarvelFor even more news, stay tuned to:Tumblr: ‪http://marvelentertainment.tumblr.com/Instagram: https://www.instagram.com/marvelGoogle+: ‪https://plus.google.com/+marvelPinterest: ‪http://pinterest.com/marvelofficial"
"lXQgSJsqLyw","BB Ki Vines- | Ghar Ke Kaagaz |","2018-12-08T14:04:52.000Z","UCqwUrj10mAEsqezcItqvwEw","BB Ki Vines","24","18.09.12","BB Ki Vines,Bhuvan Bam,Titu mama,family,comedy,drunk,confession,humour,hilarious,bollywood,movies","4770033","655034","13640","52780","https://i.ytimg.com/vi/lXQgSJsqLyw/default.jpg","False","False","Titu mama comes home drunk to confess in front of Babloo and Janki. What happens next?Games Khelo aur Paise Jeeto!Jeetiye 1 lakh Rupaye harr roz -MPL App download kariye abhi aur shuru ho jaiye apne favourite games ke saath -https://www.mpl.liveMy favorite Mivi Wireless Earphones : https://mivi.shop/ed8eSpecial Coupon Code for BB Army: BBDECBuy BB Ki Vines Official Merchandise here:https://youthiapa.com/Facebook► https://www.facebook.com/BBkiVines/Instagram► bhuvan.bam22Snapchat► bbkv22Twitter►https://twitter.com/Bhuvan_Bam and https://twitter.com/BBkv22.This is an all original work of BB Ki Vines."
"_KhQT-LGb-4","SIMMBA: Aankh Marey | Ranveer Singh, Sara Ali Khan | Tanishk Bagchi, Mika, Neha Kakkar,  Kumar Sanu","2018-12-06T05:30:01.000Z","UCq-Fj5jknLsUf-MWSy4_brA","T-Series","10","18.09.12","latest hindi songs,bollywood songs,songs,hindi songs,songs2018,Aankh Marey,aankh mare ladki aankh mare,hindi songs 2018,Simmba,simmba movie,simmba movie song,simmba 2018,sara ali khan,ranveer singh simmba,ranveer singh,simmba ranveer singh movie,simmba sara ali khan,simbaa,zero,deepika padukone,karan johar,bollywood,simba,sonu sood,aankh mare simba,simba movie songs,t series,t series songs,ankh marey arshad varsi,simmba songs","38385345","691267","86230","56156","https://i.ytimg.com/vi/_KhQT-LGb-4/default.jpg","False","False","Presenting the first video song Aankh Marey from the Bollywood Movie Simmba , The movie features Ranveer Singh, Sara Ali Khan, Sonu Sood along with Siddharth Jadhav, Ashutosh Rana in leading roles, produced by Hiroo Johar, Rohit Shetty, Apoorva Mehta & Karan Johar.Releasing Worldwide on ►December 28, 2018 Ankh Marey | Aankh Mare Ladki Aankh Mare Song | New Songs 2018 Hindi #AankhMarey #SimmbaSongs #Ranveersingh #SaraAliKhan Streaming On:♪ iTunes : http://bit.ly/Aankh-Marey-Simmba-iTunes-Store♪ Hungama : http://bit.ly/Aankh-Marey-Simmba-Hungama ♪ Saavn : http://bit.ly/Aankh-Marey-Simmba-Saavn♪ Gaana : http://bit.ly/Aankh-Marey-Simmba-Gaana♪ Apple Music : http://bit.ly/Aankh-Marey-Simmba-Apple-Music ♪ Amazon Prime Music : http://bit.ly/Aankh-Marey-Simmba-Amazon-Prime-Music♪ Google Play : http://bit.ly/Aankh-Marey-Simmba-Google-Play♪ Wynk : http://bit.ly/Aankh-Marey-Simmba-Wynk♪ Idea Music : http://bit.ly/Aankh-Marey-Simmba-Idea-Music------------------------------------------------------------------------------------------------------Produced by : Hiroo Johar, Rohit Shetty, Apoorva Mehta & Karan JoharDirected by: Rohit Shetty Star Cast : Ranveer Singh, Sara Ali Khan, Sonu Sood along with Siddharth Jadhav, Ashutosh Rana Song -Aankh MareySingers - Neha Kakkar, Mika Singh And Kumar Sanu.Music - Tanishk BagchiRe-Created And Programmed: Tanishk BagchiLyrics - Shabbir AhmedAdditional Percussions: Krishna Kishor And TeamMusic Supervisor - Azeem DayaniVoice over and special thanks -Rajnigandha ShekhawatSongs Mixed And Mastered By Eric Pillai@Future Sound Of BombayMix Assistant Engineers - Michael Edwin PillaiQuirks – Azeem Dayani♫ ORIGINAL SONG CREDITS ♫Song : Aankh Maare O Ladka Aankh MaareMovie : Tere Mere SapneSinger : Kumar Sanu, Kavita KrishnamurthyLyricist : Anand BakshiMusic Director : Viju ShahArtist : Arshad Warsi, Chandrachur Singh, Priya GillMusic Label : T-Series___Enjoy & stay connected with us!► Subscribe to T-Series: http://bit.ly/TSeriesYouTube► Like us on Facebook: https://www.facebook.com/tseriesmusic► Follow us on Twitter: https://twitter.com/tseries► Follow us on Instagram: http://bit.ly/InstagramTseries"
"YbJOTdZBX1g","YouTube Rewind 2018: Everyone Controls Rewind | #YouTubeRewind","2018-12-06T17:58:29.000Z","UCBR8-60-B28hp2BmDPdntcQ","YouTube Spotlight","24","18.09.12","Rewind,Rewind 2018,youtube rewind 2018,#YouTubeRewind,Rewind 2017,Lilly Singh,Markiplier,Swoozie,Liza Koshy,Dolan Twins,Lele Pons,Rudy Mancuso,Casey Neistat,LaurDIY,Merrell Twins,Collins Key,Safiya Nygaard,Luisito Comunica,BB Ki Vines,Bie The Ska,Authentic Games,Manual do Mundo,Fortnite,Kiki Challenge,Mukbang,Ninja,BTS,Idol,Marshmello,Cardi B,Year in Review,In my feelings challenge","70953976","1802759","5599753","1493810","https://i.ytimg.com/vi/YbJOTdZBX1g/default.jpg","False","False","YouTube Rewind 2018. Celebrating the videos, people, music and moments that defined 2018. #YouTubeRewindIt wouldn’t be Rewind without the creators: https://rewind.youtube/creatorsExplore the videos, music and trends that defined YouTube in 2018: https://rewind.youtubeWatch the Behind the Scenes video: https://youtu.be/8qTQbk2A02M  See all the Easter Eggs: https://goo.gl/xr3uUn  Music by The Hood InternetYouTube Rewind 2018 produced by Portal A Starring:10OcupadosAdam RipponAfros e Afins por Nátaly NeriAlisha MarieAmi Rodriguez Anwar JibawiAsapSCIENCEAuthenticGamesBB Ki VinesBearhugBie The SkaBilingirl ChikaBokyem TVCajuTVCasey NeistatCasparCherrygummsCollins KeyDagi BeeDesimpedidosDiva DepressãoDolan TwinsDomicsDotty TVElle Millsemma chamberlainEnes BaturEnjoyPhoenixEroldStoryFAP TVFavijTVFischer'sFurious JumperGabbie HannaGamingWithKevGEN HALILINTARGongdaesanggymvirtualHannah StockingHikakinTVHow RidiculousillymationItsFunnehJaidenAnimations James CharlesJohn OliverJordindian Jubilee MediaJukiLopjulioprofeKatya ZamolodchikovaKaykai Salaider Kelly MissesVlogKrystal Yam & familyLA LATALachlanLaurDIYLele PonsLife NogginLilly SinghLiza KoshyLosPolinesiosLucas the SpiderLuisito Comunica (Rey Palomo)LuzuLynaManual do MundoMarkiplier Marques BrownleeMarshmelloMason RamseyMe Poupe!Merrell TwinsMichael Dapaah MissRemiAshtenmmoshayaMolly BurkeMs YeahMuro PequenoNick Eh 30NikkieTutorials NinjaNoor Stars PautipsPinkfong Baby SharkPozziPrimitive TechnologyRobleisIUTURosanna PansinoRudy MancusoSafiya NygaardSam TsuiSamHarveyUKSHALOM BLACSimone Giertzskinnyindonesian24Sofia Castro @StrayRogue and @DitzyFlama (Bongo Cat)sWooZieTabbesTechnical Guruji The Try GuysTheKateClappTheOdd1sOutTiền Zombie v4 Trevor NoahTrixie MattelWengieWhinderssonNunesWill SmithYammy Yes TheoryAll comments featured in Rewind inspired by real comments from the YouTube community."
"iP2mL74yVB4","Girls Hostel | Episode 1 - The Bra Chor || Girliyapa Originals","2018-12-08T09:31:28.000Z","UCdxbhKxr8pyWTx1ExCSmJRw","Girliyapa","24","18.09.12","Girls Hostel | Episode 1 - The Bra Chor || Girliyapa Originals,Girls Hostel,girls,hostel,episode 1,episode,girls hostel serial,girls hostel girliyapa,girls hostel episode 1,the,bra,chor,Girliyapa Originals,girliyapa,originals,lost my bra,bra thieves,funny videos,girlfriends,girl friends,hostel friends,hostel life,whisper,girls hostel full episode,clothes,hostel funny,girliyapa girls hostel,girliyapa new,girliyapa new videos,hostel remix,web show,tvfplay","1612385","83607","2769","4777","https://i.ytimg.com/vi/iP2mL74yVB4/default.jpg","False","False","Richa wants to live life by her terms and she starts this journey in SVM’s Dental College Girls hostel. On her first day she meets sweet and innocent Milli but she doesn’t anticipate that she would meet Jo and Zahira, her seniors who rule over the hostel. Amidst all the drama, there has been a thief hiding in plain sight who steals clothes from all the girls in the hostel. Will Richa, Milli and Jo be able to find the thief? Will Richa be able to live her life by her own rules? Watch the first episode of Whisper presents Girls Hostel to find out!Written by: Shreyasi SharmaDirected by: Chaitanya KumbhakonumEdited by: Akash BundhooMusic by: Vaibhav BundhooCast: Ahsaas Channa, Srishti Shrivastava, Parul Gulati, Simran Natekar, Shreya Mehta, Gagan Arora Wardrobe Courtesy: Bewakoof, Mystere Paris, Vero Moda#Girliyapa #GirliyapaOriginalsFollow Girliyapa on: Instagram: https://www.instagram.com/girliyapa/ Facebook: https://www.facebook.com/Girliyapa/ Twitter: https://twitter.com/GirliyapaWant more awesome original videos?Head to https://tvfplay.com/Download TVFPlay now:Android: http://bit.ly/tvfplayandroid iOS: http://bit.ly/tvfplayios"
"NspqGM0DbbQ","Game of Thrones | Season 8 | Official Tease: Dragonstone (HBO)","2018-12-06T21:43:43.000Z","UCQzdMyuz0Lf4zo4uGcEujFw","GameofThrones","1","18.09.12","Game of Thrones,For The Throne,Season 8,Stark,Lannister,HBO,Final Season,GoT,Dragonstone,Tease","10315773","209867","7842","13901","https://i.ytimg.com/vi/NspqGM0DbbQ/default.jpg","False","False","Fire and ice. The final season of Game of Thrones begins this April. #GoTS8"
"HXG9WcmySME","Maanam Thudukkanu | Odiyan Official Video Song HD | #Mohanlal #ManjuWarrier #ShreyaGhoshal | M J","2018-12-08T15:12:11.000Z","UCpJmCkjsJbqIBdvTRx2zt-w","satyamvideos","10","18.09.12","Odiyan Official Video Song HD,Maanam Thudukkanu,Shreya Ghoshal,M Jayachandran,New Film Song,K. Harikrishnan,Aashirvad Cinemas,V. A. Shrikumar Menon,Rafeeq Ahamed,Satyam Audios,Satyam Videos","1041339","65014","2425","4283","https://i.ytimg.com/vi/HXG9WcmySME/default.jpg","False","False","Singer : Shreya GhoshalLyrics : Rafeeq AhamedMusic: M JayachandranOdiyan is an upcoming Malayalam-language Indian fantasy thriller film directed by V. A. Shrikumar Menon in his feature film debut, written by K. Harikrishnan. It is based on the legend of Odiyan, who in Kerala folklore are men possessing shapeshifting abilities, who could assume animal form. Odiyans are said to have inhabited the Malabar region of Kerala before the era of electricity. The film stars Mohanlal in the lead role, with Prakash Raj and Manju Warrier; produced by Aashirvad Cinemas & Action choreographed by Peter Hein. The songs featured in the film is composed by M. Jayachandran while the lyrics are written by Rafeeq Ahamed and Lakshmi Shrikumar.Subscribe Now  Satyam Jukebox: https://www.youtube.com/user/satyamju...Satyam Videos: https://www.youtube.com/user/satyamvi... Satyam Audios: https://www.youtube.com/user/SatyamAudioFollow usSatyam Audios Facebook - https://www.facebook.com/SatyamAudiosSatyam Audios Twitter - https://twitter.com/satyamaudiosSatyam Audios Website -  http://satyamaudios.com/Satyam Audios Pinterest - https://www.pinterest.com/satyamaudios/#Mohanlal #ManjuWarrier #Odiyan #MJayachandran #ShreyaGhosal"
"aazkd8Ha-GM","Advantage India in Adelaide arm-wrestle | First Domain Test","2018-12-08T09:27:49.000Z","UCkBY0aHJP9BwjZLDYxAQrKg","cricket.com.au","17","18.09.12","sp:ty=play,sp:dt=2018-12-06T00:00:00Z,sp:st=cricket,sp:li=icc,sp:ti:home=AUS,sp:ti:away=IND,Australia,India,First Test,Adelaide,highlights,2018","7461490","54532","3122","3269","https://i.ytimg.com/vi/aazkd8Ha-GM/default.jpg","False","False","India claimed a 15-run lead on the first innings after bowling Australia out, and extended that to 166 by stumps on day three with Cheteshwar Pujara's unbeaten 40 the key, but Nathan Lyon's late dismissal of captain Virat Kohli gave the Aussies a massive lift"
"QelwptdEaAA","Megha Dhade SLAMS Deepak And Rohit | Bigg Boss 12 | Exclusive Interview","2018-12-08T16:30:01.000Z","UCjZfuDrU3FkjPJroH6s1-pA","Lehren Small Screen","24","18.09.12","megha dhade elimination interview,megha dhade first interview after eviction,megha dhade interview will shock you,megha dhades shocking interview,megha rohit fight,deepak romil fight,megha dhade angry after bigg boss 12,megha dhade bigg boss 12 interview,Bigg Boss 12 interview,Bigg Boss 12 full episode,Bigg Boss 12 latest episode,Bigg Boss 12 eviction interview,megha dhade jasleen matharu out of bigg boss","250508","3170","845","2567","https://i.ytimg.com/vi/QelwptdEaAA/default.jpg","False","False","Bigg Boss Marathi contestant Megha Dhade ends here First Interview After Eviction Will Shock You | Bigg Boss 12Catch up on all the drama of your favourite TV shows, subscribe now: http://bit.ly/LehrenSmallScreenLog On To Our Official Website : http://www.lehren.comFacebook : https://bit.ly/LehrenFacebookTwitter: https://bit.ly/LehrenTwitter"
"JNdQDZZ5QG0","Desi Doctor Desi Mareez - | Lalit Shokeen Films |","2018-12-08T08:23:32.000Z","UCsLOXfgwzeLAl9E-6Flu3Bg","LShokeen Films","24","18.09.12","lalit shokeen,lalit shokeen films,lshokeen films,lalit shokeen videos,lalit shokeen latest video,desi doctor desi mareez,desi doctor,simmba,haryanvi comedy,desi comedy,haryanvi taau,youtube rewind,desi prem kahani,hot nurse,hospital,trending,top trending,desi patients,haryanvi songs,bollywood,punjabi songs,doctor,nurse,desi mom,desi dad,india,cricket","1068707","50581","2340","3784","https://i.ytimg.com/vi/JNdQDZZ5QG0/default.jpg","False","False","Enjoy the types of Desi Doctors and Desi Patients. #lalitshokeen #desiDownload LIKE app: https://like.onelink.me/FvnB/fce5580cContact for advertising and business enquiries:Email: lshokeenfilms@gmail.com            lalit.shokeen@gmail.comFACEBOOK: https://www.facebook.com/lshokeenfilmsYOUTUBE: http://www.youtube.com/c/LShokeenFilms86TWITTER: https://twitter.com/lalitshokeenINSTAGRAM: https://www.instagram.com/lalitshokeen1515SNAPCHAT: lalit.shokeenMusic Credits: Fluffing a Duck by Kevin MacLeod is licensed under a Creative Commons Attribution license (https://creativecommons.org/licenses/by/4.0/)Source: http://incompetech.com/music/royalty-free/index.html?isrc=USUAN1100768Artist: http://incompetech.com/Aunt Tagonist - Silent Film Dark by Kevin MacLeod is licensed under a Creative Commons Attribution license (https://creativecommons.org/licenses/by/4.0/)Source: http://incompetech.com/music/royalty-free/index.html?isrc=USUAN1100320Artist: http://incompetech.com/"
"B5vtCwESLeU","బేబీ పాటకి ఫిదా అయిన బాబు : Singer Baby Meets Chandrababu | Vanitha TV","2018-12-08T09:07:49.000Z","UCTcH-GOkexQHWKBWSfOjhPQ","Vanitha TV","24","18.09.12","Singer Baby Meets Chandrababu,Baby Meets Chandrababu,Singer Baby,singer baby,singer baby songs,singer baby songs in telugu,singer baby east godavari,singer baby telugu,baby,east godavari baby song,rangampeta baby song,village singer baby,village singer,village singer baby song,village singer baby interview,village singer bebi,baby meets chiranjeevi,bebi,baby interview,vanitha tv,vanitha news,vanitha tv baby","669211","9208","754","1219","https://i.ytimg.com/vi/B5vtCwESLeU/default.jpg","False","False","బేబీ పాటకి ఫిదా అయిన బాబు : #SingerBaby Meets Chandrababu | #VanithaTV#Baby#KarthikaMasam Special #ShivaSongs:ఈ శివుడి పాట మీ ఇంటికి సిరిసంపదలను తెస్తుంది : https://goo.gl/upbx22Lord Shiva Most Popular Song | #KotiDeepotsavam Song : https://goo.gl/bbnhymWatch Vanitha TV, the First Women Centric Channel in India by Rachana Television. Tune in for programs on infotainment, health and welfare of women, women power and women's fashion.For More Latest Details ☟☞ Watch Vanitha TV Live : https://goo.gl/QmDp33☞ Subscribe to Vanitha TV : https://goo.gl/ASrUwh☞ Like us on Facebook : https://goo.gl/1pHFWv☞ Follow on Vanitha TV Website : https://goo.gl/279L8d"
"O899mrCqkHA","Megha Dhade EVICTION Interview | Bigg Boss 12 | EXCLUSIVE | TellyMasala","2018-12-08T16:45:01.000Z","UCycyxZMoPwg9cuRDMyQE7PQ","TellyMasala","24","18.09.12","tellymasala,telly masala,tellymasala latest news,telly gossips,Megha Dhade,megha dhade eviction interview,megha dhade eviction,Megha Dhade with tellymasala,Megha Dhade tellymasala,megha dhade evicted from bigg boss,megha dhade in bigg boss 12,Megha Dhade exclusive interview,Megha Dhade latest interview 2018,Megha Dhade first interview after eviction,bigg boss 12 megha dhade,tellymasala megha dhade","323209","5442","643","1894","https://i.ytimg.com/vi/O899mrCqkHA/default.jpg","False","False","Marathi Bigg Boss winner #MeghaDhade got evicted from the #BiggBoss12 house. Watch the video for her exclusive interview with #TellyMasala. Reporter: Neha SinghEditor: Kamlesh KandpalSubscribe Now http://bit.ly/SubscribeToTellyMasalaLike Us on Facebook https://www.facebook.com/TellyMasalaFollow Us on Twitter https://twitter.com/TellyMasalaFollow Us for more updates on Dailymotion http://www.dailymotion.com/user/TellyMasala/1 Follow Us on Google+ https://plus.google.com/u/0/113985400750240490690/posts"
"mW1LZNuXPY4","Sabarimala Swamigal - the current scenario","2018-12-07T12:28:29.000Z","UCpPOf9BQPwa4K11Zjxu1ZPw","Jump Cuts","23","18.09.12","Jump cuts,Jumpcuts,Tamil comedy,Tamil Comedy Videos,jumpcuts new video,jumpcuts haribaskae,jumpcuts naresh,haribaskar videos,jumpcuts sabarimalai,jumpcuts swami comedy,jumpcuts boys vs girls,jumpcuts proposing girls,jumpcuts local loganathan,kanaga jumpcuts comedy","720591","52665","2064","2840","https://i.ytimg.com/vi/mW1LZNuXPY4/default.jpg","False","False","Jump Cuts is a Tamil Entertainment channel by Hari and Naresh. We love telling our stories that we have came across in our life, friends, neighbourhood and bring it to you in our own way through the jump cut editing ✂️.We are here to entertain and if you like us, do share, like and subscribeFollow us on Facebook : https://www.facebook.com/jumpcutz/Follow us on Instagram : jump_cutsFollow us on Twitter : @jumpcuts7Thank you keep supportingJ U M P C U T S"
"ORZltL9glEA","Maari 2 - Official Trailer (Tamil) - Dhanush | Balaji Mohan | Yuvan Shankar Raja","2018-12-05T05:32:08.000Z","UCIx3RWYwikMlDiJeCEUbfEA","Wunderbar Studios","1","18.09.12","Wunderbar Studios,Wunderbar Films,Dhanush,Maari 2 Trailer,Maari 2,Maari 2 Teaser,Maari 2 First Look,Dhanush Movies,Balaji Mohan,Yuvan Shankar Raja,Tovino Thomas,Sai Pallavi,Varalakshmi Sarathkumar,Prabhu Deva Songs,Maari 2 Official Trailer,Maari 2 Tamil Trailer,Maari 2 Dhanush,Maari 2 Sai Pallavi,Maari 2 Tovino Thomas,maari,sai pallavi maari 2,rowdy baby maari 2 song,rowdy baby yuvan song,robo shankar,rowdy baby dhanush song,divo,யுவன் ஷங்கர் ராஜா","15309324","501519","27693","24791","https://i.ytimg.com/vi/ORZltL9glEA/default.jpg","False","False","Here we go, Official Trailer of #Maari2. Maari 2 stars Dhanush, Sai Pallavi, Krishna, Varalakshmi Sarathkumar, Tovino Thomas in lead roles; Music Composed by Yuvan Shankar Raja & Directed by Balaji Mohan.The Naughtiest DON of our times is Back | Worldwide release on Dec 21st 2018*Press Captions to turn on Subtitles*Wunderbar Films Private LimitedDhanushMAARI 2Written & Directed by Balaji Mohana Yuvan Shankar Raja musicalCast: Dhanush, Sai Pallavi, Krishna, Varalakshmi Sarathkumar & Tovino Thomas, Robo Shankar, Kalloori Vino, Kaali Venkat & OthersProducer: DhanushExecutive Producer: S Vinod KumarDOP: Om PrakashProduction Design: Amaran AEdit: GK PrasannaCostumes: Vasuki BhaskarChoreography: Baba Bhaskar, JaniStunts: SilvaLyrics: Poetu Dhanush, Yuvan Shankar RajaDesigns : Sivakumar S (SivaDigitalArt)PRO : Riaz K AhmedBanner: Wunderbar FilmsProduction Controller: S P Chokkalingam Sound design: Sync CinemaSounf mixing: Raja Krishnan Production Executive: Martin Rex Make up: Raja B, A Saravanakumar Costumes: Nagu DI: B2HVFX: Digital BricksStills: AmirListen to the Music of #Maari2 on your favorite Streaming Platformshttp://divo.in/Maari2iTunes - http://bit.ly/RowdyBabyMaari2Google Play - http://bit.ly/2E3Y0mIGaana - https://bit.ly/2P67L4QSaavn - https://bit.ly/2AvI34RHungama - https://bit.ly/2E27OOfRaaga - https://bit.ly/2BDhXhZWynk Music - https://bit.ly/2FN69OdJio Music - https://bit.ly/2zvkWaSIdea Music - https://bit.ly/2PXP0WXMusic on Wunderbar StudiosDigital Partner: Divo#MaariIsBack #Maari2 on FB  https://www.facebook.com/Maari2Offl/Subscribe to our channel bit.ly/WunderbarStudiosWunderbar Films Official FB Page: http://bit.ly/WunderbarFilmsfbWunderbar Films Official Twitter: https://twitter.com/WunderbarFilmsFollow us on Instagram - https://www.instagram.com/wunderbarfilms/In Association with Divohttp://www.facebook.com/divomovieshttps://twitter.com/divomovies"
"yvyCexakIqM","Azhagu - Tamil Serial | அழகு | Episode 322 | Sun TV Serials | 08 Dec 2018 | Revathy | Vision Time","2018-12-08T14:31:51.000Z","UCOpUWgNJq1kUlB3Z5KM7X-A","Vision Time Tamil","24","18.09.12","Azhagu,அழகு,Azhagu Tamil Serial,Full Episode 322,Sun TV Serials,8 December 2018,Thalaivasal Vijay,Vision Time,azhagu serial,azhagu serial today episode,azhagu serial yesterday episode,azhagu tamil serial,azhagu tamil serial today episode,azhagu tv serial,azhagu yesterday tamil serial,azhagu latest sun tv,azhagu latest serial,Revathy tamil serial,Revathy latest serial,Revathy sun tv serial,latest sun tv serial,azhagu latest episodes","622902","4120","832","1139","https://i.ytimg.com/vi/yvyCexakIqM/default.jpg","False","False","Azhagu Tamil Serial latest Full Episode 322 Telecasted on 8 December 2018 in Sun TV. Azhagu Serial ft. Revathy, Thalaivasal Vijay, Shruthi Raj and Aishwarya in the lead roles. Azhagu serail Produced by Vision Time, Directed by ON Rathnam, Dialogues by Jagan. Azhagu serial deals with the nuances of love between a husband (Thalaivasal Vijay) and wife (Revathi), even though they have been married for decades, and have successful and very strong individual personas.Click here to watch : Azhagu Full Episode 321 https://youtu.be/OEEiXgDEFJAAzhagu Full Episode 320 - https://youtu.be/D_OtqqZ3DXgAzhagu Full Episode 319 https://youtu.be/olNKEmHZpaoAzhagu Full Episode 318 - https://youtu.be/RL5T3rBgLv8Azhagu Full Episode 317 https://youtu.be/79EfydoP6p8Azhagu Full Episode 316 https://youtu.be/gI7wrzdgruYAzhagu Full Episode 315 - https://youtu.be/QpxKlxB-IpIAzhagu Full Episode 314 https://youtu.be/eHva0bDszNcAzhagu Full Episode 313 https://youtu.be/eeoJY4h_iIkAzhagu Full Episode 312 https://youtu.be/Gmr9i6HACEIAzhagu Full Episode 311 https://youtu.be/g9O_bAvrTRcSubscribe for latest Azhagu Episodes - http://bit.ly/SubscribeVTLike us on - https://www.facebook.com/visiontimeindia"
"xHn0Bvz7RuM","Naayagi Episode 248, 08/12/18","2018-12-08T15:00:05.000Z","UC-lJ-F5mlPP6SYPkkq6gjwA","VikatanTV","43","18.09.12","naayagi today episode,Naayagi 08/12/18,Naayagi 08/12/2018,Naayagi Episode 247,vikatan,vikatantv,Naayagi latest episode,Naayagi episode today","715707","4140","946","638","https://i.ytimg.com/vi/xHn0Bvz7RuM/default.jpg","False","False","USee Shop appAndroid   http://bit.ly/2S8QniRApple   https://apple.co/2EzxseeNaayagi Episode 248Subscribe: https://goo.gl/eSvMiG  Vikatan App - http://bit.ly/2QvUBTD Prev Episode: http://bit.ly/2KWR5N7  Best of Naayagi: http://bit.ly/2LzLHlLPromos: https://goo.gl/iptj14 Facebook: https://goo.gl/Ze4PrFNaayagi (Nayagi or Nayaki) is a 2018 Tamil language family soap opera, a serial with daily episode, starring Vidya Pradeep, Papri Ghosh, Ambika, Dhilip Rayan, Vetri Velan, Meera Krishnan and Suresh Krishnamurthi. It is the story of Anandhi, heir apparent to a business empire but separated at birth from her parents who were killed treacherously by their aide Kalivardhan. The show replaced Deivamagal and is produced by Vikatan Televistas Pvt Ltd. This Tamil daily serial airs on SUN TV, every Monday to Saturday at 8:00 pm.Here is today’s episode. Yesterday episode link above."
"UvQ9y4w8unE","Ullaallaa Lyric Video – Petta | Superstar Rajinikanth | Sun Pictures | Karthik Subbaraj | Anirudh","2018-12-07T12:29:39.000Z","UCBnxEdpoZwstJqC1yZpOjRA","Sun TV","24","18.09.12","SunTV,SuperStar,SuperStarRajiniKanth,Rajinikanth,SunPictures,KarthikSubbaraj,Anirudh,AnirudhRavichander,Vivek,LyricistVivek,Petta,MaranaMass,SouthMovie,TamilMovie,PettaPongal,PettaPongalParak,PettaParak,2nd single,ThalaivarBaila,Ullaallaa,PettaSecondSingle,AzizNakash,innogenga,Karthik Subbaraj,Simran,Vijay Sethupathi,Trisha,Nawazuddin,Sasikumar,Megha Akash,Tami lMovie,Audio Launch,Petta Teaser Petta Trailer,Sun TV,Petta SunTV,Thillu Mullu,Rajini Movie,Kaali,Singaar Singh","3485330","158220","14812","9111","https://i.ytimg.com/vi/UvQ9y4w8unE/default.jpg","False","False","Sun Pictures presents the Official Lyric Video of #ULLAALLAA – The Second Single from #Petta Song : UllaallaaMovie : PettaProducer: Sun TV Network LTD Director: Karthik SubbarajComposed by Anirudh RavichanderLyrics - VivekVocals - Nakash Aziz, Inno GengaGuitars - Keba Jeremiah Bass - Naveen NapierTrumpet - MaxwellRhythm & Percussions - Krishna KishorPianica - AnirudhBacking Vocals - Arjun ChandyKeyboards, Synth and Rhythm Programming - Anirudh RavichanderAdditional Rhythm Programming - ShashankMusic Advisor - Ananthakrrishnan Recorded @ Albuquerque Records, Chennai by Srinivasan & AnanthakrrishnanTapas Studios, Chennai by ManiratnamKnack Studios, Chennai by Srinidhi & VigneshMixed by Vinay Sridhar & Srinivasan at Albuquerque Records, ChennaiMastered by Shadab Rayeen at New Edge Studios, MumbaiLyric Video Created & Edited by Ranjit Kumar (SFTS MEDIA)"
