video_id,title,publishedAt,channelId,channelTitle,categoryId,trending_date,tags,view_count,likes,dislikes,comment_count,thumbnail_link,comments_disabled,ratings_disabled,description
"tJJrklUkSVQ","Payless Vs. Designer Shoes (GAME)","2018-11-27T11:00:07.000Z","UC4PooiX37Pld1T8J5SYT-SQ","Good Mythical Morning","24","18.04.12","gmm,good mythical morning,rhettandlink,rhett and link,mythical morning,mythical,rhett,link,season 14,payless,shoes,designer,designer shoes,gmm game,gmm shoes,rhett and link shoes,knock off shoes,cheap shoes,shoes haul,shoe review,sneakers,sneakerhead,high heels,heels,shoe modeling,payless shoes,designer haul","1352679","29664","493","2649","https://i.ytimg.com/vi/tJJrklUkSVQ/default.jpg","False","False","Can we tell whether a pair of shoes was a designer's dream or plucked from the bargain bin?  GMM #1431Mythical Beasts— We’re blown away by how quickly you’ve all come together to bring us So close to our initial goal of $200k! Since the season of giving has only just begun, we’d like to challenge you to meet a new goal of $300k by year’s end, so that together, we can make the largest possible impact for the kids at St. Jude. Watch today's GMMore: https://youtu.be/Uq8AAbwc5oUWant more GMM? Watch this season from the start: http://bit.ly/GMM_S14Pick up official GMM and Mythical merch at https://mythical.storeand https://www.amazon.com/mythicalDon’t miss our weekly podcast, Ear Biscuits: https://applepodcasts.com/earbiscuitsFollow Rhett & Link: Instagram: https://instagram.com/rhettandlinkFacebook: https://facebook.com/rhettandlinkTwitter: https://twitter.com/rhettandlinkWebsite: https://mythical.com/Check Out Our Other Mythical Channels:Good Mythical MORE: https://youtube.com/goodmythicalmoreRhett & Link: https://youtube.com/rhettandlinkMythical: https://youtube.com/thisismythicalWant to send us something? https://mythical.com/contactSubmit your Wheel of Mythicality intro video here: https://bit.ly/GMMWheelIntroIntro Animation by Digital Twigs: https://www.digitaltwigs.comIntro & Outro Music by Jeff Zeigler & Sarah Schimeneck https://www.jeffzeigler.comSupplemental Music from Extreme Production Music: https://www.extrememusic.com/Mic: ‘The Mouse’ by Blue Microphones https://www.bluemic.com/mouse/"
"i2vkviU2Qw4","EVERY BLACK FRIDAY EVER","2018-11-26T17:00:07.000Z","UCY30JRSgfhYXA6i6xX1erWg","Smosh","23","18.04.12","smosh,every blank ever,every,blank,ever,every thanksgiving ever,black,friday,cyber,monday,black friday,cyber monday,deals,walmart,target,best buy,comedy,funny,sketch,ian hecox,shayne topp,olivia sui,noah grossman,keith leak jr,courtney miller,smosh pit,every ever,fight","1829197","56839","1852","4532","https://i.ytimg.com/vi/i2vkviU2Qw4/default.jpg","False","False","Yeah yeah yeah we know Black Friday has already passed, but we already shot this video and this was the earliest we could post it. Happy Cyber Monday? Or some other sort of day of the week you're reading this? EVERY BLACK FRIDAY EVERCASTIan HecoxCourtney MillerKeith Leak JrOlivia SuiNoah GrossmanShayne ToppBrian SandstromCREWDirected & Produced by Ryan ToddWritten by  Sean Hyatt & Ryan FinnertySmosh Co-Founded by Ian Hecox & Anthony PadillaSmosh Creative Director: Luke BaratsDirector of Photography: Mitch AndersonEditor: Nick AgichProducer: Kristina NikolicProduction Manager: Jon-Michael BurgessFirst Assistant Director: David GutelProduction Designer: Tayler NicholsonArt Assistant: Jake SperlingCamera: Brennan IketaniGaffer: Trent TurnerSound Mixer: Greg JonesMakeup Artist: Rachel JenkinsCostume Supervisor: Lindsay HamiltonScript Supervisor: Merina SeidelAssistant Editor: Matthew DuranPost-Production Supervisor: Reed BriceSenior Design: Ness Cardano"
"LU-pqb7WpDs","American Authors - Say Amen ft. Billy Raffoul","2018-11-16T05:00:04.000Z","UC67f6whPY0ZzudUZaY2AymA","AmericanAuthorsVEVO","10","18.04.12","American,Authors,Say,Amen,Island,Records,Alternative","4332920","53839","2711","1429","https://i.ytimg.com/vi/LU-pqb7WpDs/default.jpg","False","False","Music video by American Authors performing Say Amen. © 2018 Island Records, a division of UMG Recordings, Inc.http://vevo.ly/MhOE12"
"NY8VGNft-Zc","MINO(송민호) - ‘아낙네 (FIANCÉ)’ M/V","2018-11-26T09:00:17.000Z","UCayQxFAoFCvGariuQCtHRGQ","WINNER","10","18.04.12","YG Entertainment,YG,와이지,WINNER,위너,MINO,Song Minho,송민호,미노,민호,랩,힙합,Rap,Hip hop,Rapper,XX,아낙네,MV,뮤직비디오,뮤비,피앙세,MINO 아낙네,FIANCÉ","18280929","454437","10756","42508","https://i.ytimg.com/vi/NY8VGNft-Zc/default.jpg","False","False","MINO(송민호) - ‘아낙네 (FIANCÉ)’ M/VAll :  smarturl.it/MINO_XXiTunes : http://smarturl.it/MINO_XX/itunesApple Music : http://smarturl.it/MINO_XX/applemusicSpotify : http://smarturl.it/MINO_XX/spotifyMore about WINNER @http://www.yg-winner.com/http://www.facebook.com/OfficialYGWINNERhttp://www.youtube.com/OfficialYGWINNERhttp://sptfy.com/OfficialYGWINNERhttp://weibo.com/winnerasiahttp://twitter.com/ygent_officialAlbums Available @YG SELECT : http://www.ygselect.com/YG SELECT China : http://cn.ygselect.com/YG SELECT Amazon(JP) : http://bit.ly/yg-amzn-jpYG SELECT Amazon(US) : http://bit.ly/yg-amzn-usYG SELECT Amazon(UK) : http://bit.ly/yg-amzn-ukYG SELECT Qoo10(SG) : https://www.qoo10.sg/shop/ygselect#MINO #미노 #송민호 #WINNER #위너 #FIRSTSOLOALBUM #XX_mino #아낙네 #FIANCÉ #MV #20181126_6PM #OUTNOW #YG"
"hfIog7RIgFE","Kymberli Joye Performs Break Every Chain - The Voice 2018 Live Top 11 Performances","2018-11-27T02:31:53.000Z","UCpdK1NLHxEUGXc1gq2NxkTw","The Voice","24","18.04.12","the voice,watch the voice,the voice top 11 performances,the voice top 11,the voice 2018,adam levine,kelly clarkson,jennifer hudson,blake shelton,kymberli joye,break every chain,tasha cobbs leonard,the voice nbc,the voice season 15,the voice new season,The Voice 2018,The Voice USA,The Voice Season 15,The voice winners,Jennifer Hudson,Kelly Clarkson,carson daly,the voice auditions,NBC,tv,television,music","1165665","36877","359","3525","https://i.ytimg.com/vi/hfIog7RIgFE/default.jpg","False","False","Team Kelly's Kymberli Joye performs Break Every Chain during The Voice Live Top 11 Performances.» Get The Voice Official App: http://bit.ly/TheVoiceOfficialApp» Subscribe for More: http://bit.ly/TheVoiceSub» Watch The Voice Mondays & Tuesdays 8/7c on NBC!» Get Kymberli's Performance on Apple Music: https://apple.co/2r6j043» Stream Anytime: http://bit.ly/TheVoiceFullEpisodesTHE VOICE ON SOCIAL:Like The Voice: http://Facebook.com/NBCTheVoiceFollow The Voice: https://Twitter.com/NBCTheVoiceThe Voice Tumblr: http://nbcTheVoice.Tumblr.com/Follow The Voice on Instagram: https://instagram.com/nbcthevoice/#TheVoice #VoicePlayoffs #KymberliJoye #TheVoice2018 #TheVoiceUSA #NBC #BreakEveryChain #Cover #TeamKelly #Music #AdamLevine #BlakeShelton #JenniferHudson #KellyClarksonNBC’s The Voice follows the strongest vocalists from across the country and invites them to compete in this season's blockbuster vocal competition.Find The Voice trailers, full episode highlights, previews, promos, clips, and digital exclusives here.NBC ON SOCIAL:NBC YouTube: http://www.youtube.com/nbcLike NBC: http://Facebook.com/NBCFollow NBC: http://Twitter.com/NBCNBC Tumblr: http://nbctv.tumblr.com/NBC Google+: https://plus.google.com/+NBC/postsNBC Instagram: http://instagram.com/nbcABOUT THE VOICEThe Voice 2018 USA YouTube channel features exclusive content with The Voice coaches, highlights from The Voice auditions, interviews with The Voice winners, as well as The Voice recaps and results. Learn more about The Voice contestants, The Voice tour, the eliminations, and follow your favorite performers all the way to the finale. In season 15, returning coaches Adam Levine, Blake Shelton, Kelly Clarkson and welcomes back Jennifer Hudson as celebrity musician coaches, while Carson Daly continues to serve as host. The show’s innovative format features five stages of competition: the first begins with the blind auditions, followed by the battle rounds, the knockouts, the live playoffs and finally, the live performance shows.Kymberli Joye Performs Break Every Chain - The Voice 2018 Live Top 11 Performanceshttps://youtu.be/hfIog7RIgFEThe Voicehttp://www.youtube.com/user/nbcthevoice"
"bGD_YF64Nwk","Mission Control Live: NASA InSight Mars Landing","2018-11-26T20:41:03.000Z","UCryGec9PdUCLjpJW2mgCuLw","NASA Jet Propulsion Laboratory","28","18.04.12","NASA,Jet Propulsion Laboratory,JPL,space,exploration,planets,mars,marslanding,landing,mission control,live,news,insight,nasainsight,nasajpl","3840926","32285","1671","2981","https://i.ytimg.com/vi/bGD_YF64Nwk/default.jpg","False","False","Original air date: November 26, 2018 11 a.m. PT (2 p.m. ET)See inside mission control at NASA’s Jet Propulsion Laboratory as signals return from the InSight mission as it lands on Mars. Landing commentary includes interviews with team members. https://mars.nasa.gov/insight"
"HARP7YxJnOA","Bradley Walsh DESTROYED 😱 by Michael's nightmare text - Send To All","2018-11-24T21:15:00.000Z","UCCj956IF62FbT7Gouszaj9w","BBC","24","18.04.12","BBC iPlayer,Michael McIntyre,Michael mcintyres big show,big show,comedy,comedian,stand up,funny,hilarious,best,laugh,laughter,joke,jokes,cheeky,series 4,series four,bbc comedy,gag,trick,spoof,antic,fun,humour,live comedy,comedy roadshow,Michael McIntyre send to all,send to all,celebrities read mean tweets,phone,texting,prank,prank calls,prank call,prank show,pranking,bradley walsh,jodie whittaker,doctor who,new doctor who,chaser,the chase","1521231","16062","639","840","https://i.ytimg.com/vi/HARP7YxJnOA/default.jpg","False","False","SUBSCRIBE for more BBC highlights: https://bit.ly/2IXqEInWATCH full programmes on BBC iPlayer https://bbc.in/2J18jYJSKIP to the text: 08:00Michael McIntyre causes mischief with Doctor Who star, Bradley Walsh's phone as he rifles through his photos and sends an embarrasing text to his contacts. Bradley gets his own back & he pranks Michael.Michael McIntyre’s Big Show returns for the biggest series to date.Filmed in front of a live audience at the Theatre Royal, Drury Lane, the show is packed with celebrity guests, musical performances, stand-up comedy and surprises.Michael McIntyre's Big Show | Series 4 Episode 2 | BBC#MichaelMcIntyresBigShow #MichaelMcIntyre #SendToAll"
"PT-EzzJxySI","Roksana Węgiel - Anyone I Want To Be - Poland 🇵🇱 - WINNER - LIVE - Junior Eurovision 2018","2018-11-25T16:45:43.000Z","UC-lkYjunAyfultKGuRJz6HQ","Junior Eurovision Song Contest","24","18.04.12","Junior Eurovision Song Contest,2018,Minsk,JESC2018,LightUp,Roksana Węgiel,Anyone I Want To Be,Live,Performance,Polska,Poland,Roxy","5445255","105618","5480","13024","https://i.ytimg.com/vi/PT-EzzJxySI/default.jpg","False","False","Roksana Węgiel from Poland won the 2018 Junior Eurovision Song Contest in Minsk with the song Anyone I Want To Be. Read more about Roksana here: https://junioreurovision.tv/participant/roksana-wegiel"
"FbUcwTu2R6U","Weird Coffee Hacks (Taste Test)","2018-11-26T11:00:01.000Z","UCzpCc5n9hqiVC7HhPwcIKEg","Good Mythical MORE","24","18.04.12","gmm,good mythical morning,rhettandlink,rhett and link,mythical morning,mythical,rhett,link,season 14,gmmore,good mythical more,coffee,dunkin,dunkin donuts,starbucks,coffee bean and tea leaf,gmmore coffee,coffee hacks,hacks,drink hacks,caffeine,gmm coffee,good mythical more coffee,gmmore hacks,good mythical more hacks","992932","18548","2006","2497","https://i.ytimg.com/vi/FbUcwTu2R6U/default.jpg","False","False","We asked for your weird coffee hacks and we are equal parts amused and concerned. GMMore #1430Watch today's GMM: https://youtu.be/WPgkV6lTS_MWant more GMM? Watch this season from the start: http://bit.ly/GMM_S14Pick up official GMM and Mythical merch at https://mythical.storeand https://www.amazon.com/mythicalDon’t miss our weekly podcast, Ear Biscuits: https://applepodcasts.com/earbiscuitsFollow Rhett & Link: Instagram: https://instagram.com/rhettandlinkFacebook: https://facebook.com/rhettandlinkTwitter: https://twitter.com/rhettandlinkWebsite: https://mythical.com/Check Out Our Other Mythical Channels:Good Mythical Morning: https://youtube.com/goodmythicalmorningRhett & Link: https://youtube.com/rhettandlinkMythical: https://youtube.com/thisismythicalWant to send us something? https://mythical.com/contactSubmit your Wheel of Mythicality intro video here: https://bit.ly/GMMWheelIntroIntro Animation by Digital Twigs: https://www.digitaltwigs.comIntro & Outro Music by Jeff Zeigler & Sarah Schimeneck https://www.jeffzeigler.comSupplemental Music from Extreme Production Music: https://www.extrememusic.com/Mic: ‘The Mouse’ by Blue Microphones https://www.bluemic.com/mouse/"
"LruaD7XhQ50","What is Federal Land?","2018-11-26T13:27:21.000Z","UC2C_jShtL725hvbm1arSV9w","CGP Grey","27","18.04.12","cgpgrey,education,hello internet,united states,nevada,alaska,land,real eastate,government","1711727","88320","1071","6915","https://i.ytimg.com/vi/LruaD7XhQ50/default.jpg","False","False","Like what does it mean?  (For real though?)***Federal Girls Wallpaper***: https://www.patreon.com/posts/federal-land-now-23029763Discuss this video: https://old.reddit.com/r/CGPGrey/comments/a0jf4j/what_is_federal_land/Thank you to my supporters on Patreon:Thomas J Miller Jr MD, James Bissonette, Bob Kunz, John Buchan, Nevin Spoljaric, Chris Chapin, Richard Jenkins, Tony DiLascio, Donal Botkin, Phil Gardner, Christian Cooper, Michael Little, Martin, Steven Grimm, Ø³Ù„ÙŠÙ…Ø§Ù† Ø§Ù„Ø¹Ù‚Ù„, Saki Comandao, Jason Lewandowski, Michael Mrozek, Kozo Ota, Faust Fairbrook, Colin Millions, Cas EliÃ«ns, Ian, rictic, Guillermo, JoJo Chehebar, Derek Bonner, Derek Jackson, Mikko, Orbit_Junkie, Ron Bowes, TÃ³mas Ãrni JÃ³nasson, Christopher Anthony, Richard Comish, Oliver Steele, Andrea Di Biagio, David F Watson, Michael Cao, Andrew Proue, Bear, chrysilis, Dag Viggo LokÃ¸en, David Palomares, Edward Adams, Emil, Erik Parasiuk, Esteban Santana Santana, Freddi HÃ¸rlyck, Jacob Ostling, John Rogers, ken mcfarlane, Kevin Anderson, Leon, Maarten van der Blij, Paul Tomblin, Peter Lomax, Rescla, Rhys Parry, ShiroiYami, Tijmen van Dien, Tristan Watts-Willis, Veronica Peshterianu, Ernesto Jimenez, John Lee, Maxime Zielony, Osric Lord-Williams, Ben Schwab, Roman Pinchuk, and Elizabeth Keathley.https://www.patreon.com/cgpgreyMusic by: http://www.davidreesmusic.com"
"QYzWEb4Ho6I","Wembley Cup LIVE FINAL 2018","2018-11-25T18:33:43.000Z","UCWkr08nsQ9GuFvHgQYafi_w","Spencer FC","17","18.04.12","wembley cup,wembley cup final,wembley cup highlights,wembley cup goals,hashtag united,f2 fc,rebel fc,xo fc,xo","1480368","26468","2470","0","https://i.ytimg.com/vi/QYzWEb4Ho6I/default.jpg","True","False","► Subscribe: http://bit.ly/subSPENI hope you’re sitting comfortably because this year’s EE Wembley Cup final promises to be unlike anything you’ve ever seen before. Four teams, three thirty minute matches, Sin Bin for yellow card offences and Man Down time to settle draws. All this plus footballing legends hand-picked by our captains in our Wembley Cup Draft. So can my boys HashTag Utd hold on to the trophy or will F2 FC, Rebel FC or XO FC take it off us? There’s only one way to find out.   About the show:The EE Wembley Cup 2018 is a seven-part football series building up to one massive live final at Wembley Stadium on Sunday 25th November. EE have teamed up with Next Level to rip up the football rulebook. We’re hosting a tournament with four of YouTube’s most talked about teams, a group stage, EE Wembley Cup Draft and plenty of big twists on old rules. More about the BT Sport offer:Watching sport got a whole lot easier for EE customers. EE are bringing you the best live action with the BT Sport app – and letting you watch it on your TV as well as your phone. No more dodgy links, expensive pub trips or contracts to manage; simply cast the game from your phone to your telly using Apple TV of Google Chromecast and get stuck in. And best of all EE customers get the first three months of access to the BT Sport app for free.Get the BT Sport app here: https://ee.co.uk/why-ee/bt-sport► Follow me on Twitter! - http://twitter.com/SpencerOwen► Follow me on Instagram! - http://bit.ly/spengram► Hashtag United channel - http://youtube.com/hashtagunited► Buy Hashtag United merch! http://hashtagutd.com"
"If1sbtliqQk","ZERO: Mere Naam Tu Song | Shah Rukh Khan, Anushka Sharma, Katrina Kaif | T-Series","2018-11-23T06:34:14.000Z","UCq-Fj5jknLsUf-MWSy4_brA","T-Series","10","18.04.12","latest hindi songs,bollywood songs,songs,hindi songs,songs2018,zero song,zero movie song,Zero,Mere Naamtu,mere,mere naam tu zero,zero mera naam tu,zero mere naam tu song,mera naam tu video,latest bollywood songs,hindi songs 2018,Shah Rukh Khan,Anushka Sharma,Katrina Kaif,zero songs,zero all song,zero songs 2018,shahrukh khan songs 2018,zero movie songs,anushka sharma songs,tseries,t series songs 2018","32392292","639807","51838","82329","https://i.ytimg.com/vi/If1sbtliqQk/default.jpg","False","False","Presenting the first video song Mere Naam Tu from the most awaited bollywood movie Zero. The film is starring Shah Rukh Khan, Anushka Sharma and Katrina Kaif and directed by Aanand L Rai. Movie Releases in cinemas On► 21st December, 2018. ♪ Available on ♪iTunes : http://bit.ly/Mere-Naam-Tu-Zero-iTunesHungama : http://bit.ly/Mere-Naam-Tu-Zero-HungamaSaavn : http://bit.ly/Mere-Naam-Tu-Zero-SaavnGaana : http://bit.ly/Mere-Naam-Tu-Zero-GaanaApple Music : http://bit.ly/Mere-Naam-Tu-Zero-Apple-MusicGoogle Play : http://bit.ly/Mere-Naam-Tu-Zero-Google-PlayWynk : http://bit.ly/Mere-Naam-Tu-Zero-WynkJioMusic : http://bit.ly/Mere-Naam-Tu-Zero-JioMusicIdea Music : http://bit.ly/Mere-Naam-Tu-Zero-Idea-MusicProducer: Gauri KhanDirector : Aanand L RaiWriter: Himanshu SharmaCo-producer: Karuna Badwal_______________________________________For Caller Tunes :Mere Naam Tu https://bit.ly/2DQHdUpMere Naam Tu - Wo Rang Bhi https://bit.ly/2PM1u3LMere Naam Tu - Uljhan Bhi https://bit.ly/2BsAJIAMere Naam Tu - Mere Hi Ghere Me https://bit.ly/2zqvibRSet as Caller Tune:Set Mere Naam Tu as your caller tune - sms ZERO1 To 54646Set Mere Naam Tu - Wo Rang Bhi as your caller tune - sms ZERO2 To 54646Set Mere Naam Tu - Uljhan Bhi as your caller tune - sms ZERO3 To 54646Set Mere Naam Tu - Mere Hi Ghere Me as your caller tune - sms ZERO4 To 54646________________________________________♫Song Credits♫Song : Mere Naam TuSinger : Abhay JodhpurkarMusic : Ajay-AtulLyrics : Irshad KamilMusic Label: T-Series::::::::::Additional credits :::::::::::::::Recorded  by : Vijay Dayal  (YRF studios) & (soundideaz studio) Mixed: Vijay Dayal (YRF studios) Assisted by : ChinmayMestryMusic and Rhythm conducted by : Ajay-AtulMastered by : Donal Whelan at Hafod Mastering (Wales)Indian flute  :VaradKathapurkarNylon guitar :PawanRasayli________________________________________Operator Codes: 1.Mere Naam TuVodafone Subscribers Dial 53710800606Airtel Subscribers Dial 5432116669999Idea Subscribers Dial 5678910800606Tata DoCoMo Subscribers dial 54321110800606BSNL (South / East) Subscribers sms BT 10800606 To 56700BSNL (North / West) Subscribers sms BT 7195631 To 56700Virgin Subscribers sms TT 10800606 To 58475MTNL Subscribers sms PT 10800606 To 567892. Wo Rang BhiVodafone Subscribers Dial 53710800582Airtel Subscribers Dial 5432116669960Idea Subscribers Dial 5678910800582Tata DoCoMo Subscribers dial 54321110800582BSNL (South / East) Subscribers sms BT 10800582 To 56700BSNL (North / West) Subscribers sms BT 7195633 To 56700Virgin Subscribers sms TT 10800582 To 58475MTNL Subscribers sms PT 10800582 To 567893.Uljhan BhiVodafone Subscribers Dial 53710800575Airtel Subscribers Dial 5432116669939Idea Subscribers Dial 5678910800575Tata DoCoMo Subscribers dial 54321110800575BSNL (South / East) Subscribers sms BT 10800575 To 56700BSNL (North / West) Subscribers sms BT 7195634 To 56700Virgin Subscribers sms TT 10800575 To 58475MTNL Subscribers sms PT 10800575 To 567894. Mere Hi Ghere MeVodafone Subscribers Dial 53710800602Airtel Subscribers Dial 5432116669561Idea Subscribers Dial 5678910800602Tata DoCoMo Subscribers dial 54321110800602BSNL (South / East) Subscribers sms BT 10800602 To 56700BSNL (North / West) Subscribers sms BT 7195632 To 56700Virgin Subscribers sms TT 10800602 To 58475MTNL Subscribers sms PT 10800602 To 56789___Enjoy & stay connected with us!► Subscribe to T-Series: http://bit.ly/TSeriesYouTube► Like us on Facebook: https://www.facebook.com/tseriesmusic► Follow us on Twitter: https://twitter.com/tseries► Follow us on Instagram: http://bit.ly/InstagramTseries"
"phqhW8DgZtw","Kitchen Gadget Testing #36","2018-11-22T16:00:41.000Z","UCAzyupPG4vdo8jd9nJ13LAw","My Virgin Kitchen","28","18.04.12","Kitchen Gadget Testing 35 - Wish.com special,testing kitchen gadgets,Kitchen gadget testing,kitchen gadgets,barry lewis kitchen gadgets,my virgin kitchen gadgets,myvirginkitchen,testing food gadgets,virgin kitchen,barry lewis,food gadget testing,gadget,inventions,weird cooking gadgets,food hacks,you need,food gadgets,review,novelty,weird,wish app,ice cream sandwich maker,dishwasher brush,garject,bacon rack,sushi penguin,clever egg cracker clever scrambler","255866","5633","274","829","https://i.ytimg.com/vi/phqhW8DgZtw/default.jpg","False","False","Kitchen gadget testing 36! Testing out another batch of novelty kitchen items and gadgets including a garlic ejector, cheese grating hedgehog and a sushi penguin! What's your favourite kitchen gadget? Subscribe for videos each week & press the bell button so you are notified of all new ones http://goo.gl/CbsOCc Have a Barrathon, watch the kitchen gadget testing playlist https://www.youtube.com/watch?v=hECAxPxsdmo&list=PLfItiEY3o1mua5cnCEz2ssWLQbS6ZiSIqGet the gadgets here: ice cream sandwich maker https://amzn.to/2QWWYMqDishwasher brush https://amzn.to/2DNt0r9Clever egg cracker https://amzn.to/2Kh0D4RGarject https://amzn.to/2QQqR0xOxo corn stripper https://amzn.to/2OSKymSBacon rack https://amzn.to/2A5pJiJSushi penguin https://amzn.to/2OSuLnQHedgehog cheese grater https://amzn.to/2ORFC1FSupport me on Patreon https://www.patreon.com/myvirginkitchenmerchandise! - https://teespring.com/stores/myvirginkitchen ***************************************************TWITTER - https://twitter.com/myvirginkitchenFACEBOOK - http://www.facebook.com/myvirginkitchenINSTAGRAM - https://www.instagram.com/myvirginkitchenWEBSITE - http://www.myvirginkitchen.com/PODCAST - https://soundcloud.com/myvirginkitchenSNAPCHAT - @myvirginkitchen***************************************************If you would like to help me translate any of my videos to a different language click here http://www.youtube.com/timedtext_cs_panel?c=UCAzyupPG4vdo8jd9nJ13LAw&tab=2***************************************************Our kitchen is from http://www.larkandlarks.co.uk/#barrylewis #kitchengadgets #gadgets"
"lkVMEMXKAbc","The Motans - Maraton | Videoclip Oficial","2018-11-22T11:33:26.000Z","UCVH4CfUtEZ6A0q2fJkOuCjw","THE MOTANS Official","10","18.04.12","the motans,maraton,videoclip,oficial,piesa,muzica,romaneasca,pop,trupa,proiect,denis roabes,nota de plata,inainte sa ne fi nascut,muzica 2018,versus,muzica download,muzica youtube,the motans official,canal oficial,weekend,august,the motans delia,the motans inna,the motans jackpot,top radio hits romania 2018,romanian top hits 2018","2152969","38237","1298","1444","https://i.ytimg.com/vi/lkVMEMXKAbc/default.jpg","False","False","Videoclip oficial cu The Motans interpretand single-ul Maraton. (C) & (P) 2018 Global RecordsMaraton Download / Streaming:iTunes: https://geo.itunes.apple.com/us/album/id1443550819Spotify: http://open.spotify.com/album/7rFtGlOPocHgpVPTJf6NBpBooking & Licensing:booking@globalrecords.com | +40.0757.104.166https://globalbooking.ro/the-motans/licensing: licensing@globalrecords.com#themotans #maraton #videoclipoficialMuzică: Denis Roabeș, Vlad LucanText: Denis RoabeșProducție: Vlad LucanMix & Master: Sergiu Musteață Producție viori: Turcan AlexeiInterpretare viori: Muse QuartetRegie: Bogdan PăunD.O.P. : Alexandru MureșanScenariu: Ali Said, Bogdan Păun, Alexandru Mureșan, Denis RoabeșProductie video: Loops ProductionThe Motans Online:Facebook: https://www.facebook.com/themotansInstagram: https://www.instagram.com/themotansYoutube: http://www.youtube.com/c/THEMOTANSOfficialGlobal Records Online: Facebook: https://www.facebook.com/GlobalRecordsComInstagram: https://www.instagram.com/GlobalRecordsOfficial Website: http://globalrecords.comTwitter: https://twitter.com/GlobalRecordsROToate drepturile sunt rezervate. Orice upload neautorizat al acestui videoclip este ilegal si poate fi raportat oricand la Youtube. All rights reserved. Unauthorized reproduction is a violation of applicable laws. In order to avoid copyright infringement, please do not upload this video on your channel."
