video_id,title,publishedAt,channelId,channelTitle,categoryId,trending_date,tags,view_count,likes,dislikes,comment_count,thumbnail_link,comments_disabled,ratings_disabled,description
"pCvP2lm9Iko","Ab Dekh Khuda Kia Karta Hai - Episode 20 | HAR PAL GEO","2018-12-04T16:15:01.000Z","UCe9JSDmyqNgA_l2BzGHq1Ug","HAR PAL GEO","24","18.05.12","Ab Dekh Khuda Kia Karta Hai,HAR PAL GEO,Episode 20","926562","9270","708","2959","https://i.ytimg.com/vi/pCvP2lm9Iko/default.jpg","False","False","Ab Dekh Khuda Kia Karta Hai - Episode 20 | HAR PAL GEOAb Dekh Khuda Kiya Karta Hai, is based on the life of a fraudulent businessman Jan-e-Alam who manipulates young innocent girls who are chronically jobless, by giving them a job and subjecting them to improper advances. Many women working under Jan-e-Alam are constantly harassed, subjected to assaults, and slandered when they refuse the advances of their boss. Maryam, the female protagonist, also gets victimized by him. When she refuses to comply with his inappropriate demands, he traps her in a business scam and gets her jailed. Maryam manages to get herself out but unfortunately she keeps finding herself under the threat of her malicious ex employer who doesn’t seem to stop making her life miserable.  In a society, where it is so easy for a young girl to lose her dignity and to stain her reputation because of uncontrollable circumstances, will Maryam ever get riddance from sick minded Jan-e-Alam?Written by: Syed Ameer Ali Shah Hussaini Directed by: Syed Ali Raza UsamaProduced by: Babar JavedCast with respective character names: Danish Taimoor (Jaan-e-Alam), Sanam Chaudhry (Maryam), Humayoun Ashraf (Shaan-e-Alam), Qavi Khan (Naseer), Sajida Syed (Firdous), Rashid Farooqui (Malik), Parveen Akbar (Shaista), Yashma Gill (Noor Saba), Maryam Noor (Erum), Ali Rizvi (Hammad), Salah Uddin Tunio (Minister), Talat Iqbal (Ashfaq), Farzana Thaeem (Salma).For More Videos Subscribe YouTube - https://www.youtube.com/harpalgeo#ADKKKH#harpalgeo#GEO"
"EpB3cp42nEA","बायको पळून गेली l निवृत्ती महाराज इंदोरीकर यांचे कॉमेडी किर्तन l Indorikar Maharaj Comedy Kirtan","2018-12-02T09:00:01.000Z","UCkcExu2Mbm1pIB6tTSJBLzg","Aaichya Gavat","24","18.05.12","Aaichya Gavat,aaychya gawat,bayko,बायको,indurikar kirtan,indurikar kirtan comedy,indurikar kirtan mp3,indurikar kirtan latest,indurikar kirtan video,indurikar kirtan marathi,indurikar kirtan new,kirtan,indurikar maharaj comedy kirtan,maharaj kirtan,indorikar,nivarutti,new kirtan,man mandira,gajar bhakticha,इंदुरीकर महाराज कीर्तन नवीन 2019,निवृत्ती महाराज देशमुख इंदोरीकर नवीन कीर्तन,निवृत्ती महाराज,मन मंदिरा,गजर भक्तीचा,इंदुरीकर महाराज कॉमेडी किर्तन","823181","3548","704","165","https://i.ytimg.com/vi/EpB3cp42nEA/default.jpg","False","False","बायको पळून गेली, ह.भ.प.इंदूरीकर महाराज हे महाराष्ट्रातील लोकप्रिय कीर्तनकार आहेत, इंदुरीकर महाराज हे त्यांच्या कीर्तनाच्या मजेदार शैली साठी ओळखले जातात, त्यांचे कीर्तन हे सर्वच वयोगटातील व्यक्तींना आवडते हे विशेष,हे कीर्तन संपूर्ण ऐका, पोट धरून हसाल, निर्वूत्ती महाराज इंदुरीकर यांचे कीर्तन हे कडू पण सत्य असे आहे, कीर्तनाच्या माध्यमातून प्रबोधनाचे कार्य महाराज करत असतात, त्यांचे विचार आवडल्यास व्हिडीओ Like व Share करा, तसेच या कीर्तनाविषयी आपल्या प्रतिक्रिया Comment मध्ये जरूर कळ्वा. धन्यवाद !!Ⓒ Aaichya Gavat 2018 [Copyright]Please Subscribe : आईच्या गावात Write us : aaichyagavatteam@gmail.comधन्यवाद !!Copyright Disclaimer Under Section 107 of the Copyright Act 1976, Audio added in video comes under fair use policy of you tube."
"3hfPdpOwXlk","How to use hot water for weight loss Tamil / உடல் எடை குறைய சுடு தண்ணீர் போதும்","2018-12-04T08:02:18.000Z","UCPKqvApwtTXrUnrDXqsKPKw","Kavitha Uthamasamy","22","18.05.12","weight loss tamil,weight reduction video,udal edai kuraipathu,7 natkalil udal edai kuraiya,hot water therapy,udal ilaika,no diet weight loss,weight loss no exercise","213666","2143","168","161","https://i.ytimg.com/vi/3hfPdpOwXlk/default.jpg","False","False","How to use hot water for weight loss in just 10 days, udal edai kuraipathu eppadi,  Tamil weight reduction video. No diet, no exercise,  hot water weight loss therapy has given may positive reviews. There are many benefits of drinking hot water, improves, digestion, constipation medicine, stress reliever, removes toxins etc."
"ZlfWmm-E6Nc","Dipika Kakar Major EMOTIONAL Breakdown | Bigg Boss 12 Full Episode Update","2018-12-04T07:27:06.000Z","UCycyxZMoPwg9cuRDMyQE7PQ","TellyMasala","24","18.05.12","tellymasala,telly masala,tellymasala latest news,bigg boss 12,bigg boss season 12,bigg boss 12 episode update,dipika kakar,dipika kakar bigg boss,dipika kakar crying bigg boss 12,dipika kakar emotional bigg boss 12,surbhi and rana insults dipika kakar,surbhi rana bigg boss 12,deepak bigg boss,deepak bigg boss 12,dipika crying in bigg boss house,dipika kakar latest bigg boss 12","352790","5427","530","4877","https://i.ytimg.com/vi/ZlfWmm-E6Nc/default.jpg","False","False","Watch the video for episodic update on Bigg Boss 12 as Dipika breaks down in front of Megha. Dipika leaves her task incomplete due to Deepak and Surbhi.  Reporter:  Neha Antani  Editor:  Omkar Ingale#tellymasala #biggboss12  #DipikaKakarSubscribe Now http://bit.ly/SubscribeToTellyMasalaLike Us on Facebook https://www.facebook.com/TellyMasalaFollow Us on Twitter https://twitter.com/TellyMasalaFollow Us for more updates on Dailymotion http://www.dailymotion.com/user/TellyMasala/1 Follow Us on Google+ https://plus.google.com/u/0/113985400750240490690/posts"
"i8LZDw7C1OU","Bigg Boss S12 – Day 78 – Watch Unseen Undekha Clip Exclusively on Voot","2018-12-04T09:02:58.000Z","UCFHhFwEdsLs2wuvh1YdChHw","Voot","24","18.05.12","Sreesanth,Jasleen Matharu,Bigg Boss,Season 12,Unseen Undekha,Cutless,Megha Dhade,Streaming online,Voot App,Colors TV,Reality Show,Full episodes,Watch Online,Salman Khan,Dipika Kakar","176975","1977","78","181","https://i.ytimg.com/vi/i8LZDw7C1OU/default.jpg","False","False","Sree Santh is up for some mischief & his mission is to interfere with Jasleen Matharu's nap time. Catch him in action in this hilarious unseen clip on Voot.Watch Now: https://bit.ly/2Nrb4rFDownload app link: https://bit.ly/2OmDTAR"
"-e--X738s-U","ക്ലാസ്സിൽ വരാത്ത കാരണം ചോദിച്ച ടീച്ചറോട് കുട്ടി പറഞ്ഞ കാരണം കേട്ട്  തള്ളി ടീച്ചർ | Funny Video","2018-12-04T14:30:01.000Z","UCKEES_6ykHFizIjlh3tz1Fg","First Show","24","18.05.12","film news,movie news,movie gossips,mollywood,bollywood,tollywood,mohanlal,mammootty,prithviraj,dileep,nivin pauly,dulquer,Kerala Funny Video","47453","358","38","26","https://i.ytimg.com/vi/-e--X738s-U/default.jpg","False","False","ക്ലാസ്സിൽ വരാത്ത കാരണം ചോദിച്ച ടീച്ചറോട് കുട്ടി പറഞ്ഞ കാരണം കേട്ട്  തള്ളി ടീച്ചർ - Kerala Funny Video"
"J0FUdEoBxCk","The Best Day of My Life | Meet & Greet | MostlySane","2018-12-04T15:26:10.000Z","UCvCyIiKSCA1fHKSCOKJyjXA","MostlySane","23","18.05.12","prajakta koli,mostly sane,mostlysane,latest funny videos,comedy videos,comedy funny videos,top 5,top funny videos,top comedy videos,top 5 videos,comedy videos 2018,funny videos 2018,funny videos by prajakta,prajakta new video","175772","28070","194","3441","https://i.ytimg.com/vi/J0FUdEoBxCk/default.jpg","False","False","Click here to Subscribe :- http://bit.ly/PrajaktaKoliThis has got to be the best day of my life, thank you so much for showering me with so much love. I truly feel blessed! One Digital Entertainment NinjasConcept - Ruchi Patel, Yash Pania, Anushka VaidyaDirection - Anushka Vaidya, Ruchi Patel Camera - Aritra Sen, Amey Dhuri, Aditya Vaidya, Venu Iyer Editor - Yash Pania Link To My Blog - https://mostlysane.inLike me on Facebook @ https://www.facebook.com/MostlySaneOfficialFollow me on Twitter @ https://twitter.com/iamMostlySane Follow me on Instagram @ https://instagram.com/MostlySane Email me at :- iammostlysane@gmail.com Digitally Powered by One Digital Entertainment [https://www.facebook.com/onedigitalentertainment][http://www.onedigitalentertainment.com]You can write to me and send me letters here - 407-411 Standford Plaza, Off Lokhandwala Link Road, Next to Orritel Hotel, Andheri West, Mumbai, Maharashtra 400053"
"F6hwZsGQgE0","EMIWAY - TRIBUTE TO EMINEM (OFFICIAL)","2018-12-01T12:30:00.000Z","UCHmk8iNJHvf5mGN6_pkPc7g","Emiway Bantai","10","18.05.12","emiway,eminem,emiway bantai,rap,universe,universal,tribute to eminem,indian hip hop,underground music,rap god,legend,rap music,rapper,indian music,indian underground music,underground,underground hiphop\,emiway rapper,emiway songs,emiway new song,jay pol,lose yourself,aur bantai","4664884","379614","33161","44235","https://i.ytimg.com/vi/F6hwZsGQgE0/default.jpg","False","False","(LYRICS GIVEN BELOW)ARTIST - EMIWAY BANTAISHOT/EDITED - HAPPYCar shot - RohanPRODUCTION ASST - Minta,Sumit Singh,Rohan Dubey,Mohan Shetty,Arvind Arul.POSTER BY MRIGANK PATANKARINSTAGRAM - emiway_bantaiFacebook - Emiway37Twitter - Emiway3Management - imailemiway@gmail.comLyrics - Emiway Tribute to EminemPehle phat ti thi chadne mujhe stage peItna sa tha fancy show mein Shaktiman ke bhes mein liya tha mic hath mein teacher khadi thi sath mein. main rone laga teacher boli roo mat beta pakdi hu na hath main.fir baad mein, dasvi mein jab padta tha jay pol ne bataya mujhe Eminem ke bare mein.nahi pata tha kya hota hai rap kya hip hop lekin gyan diya mujhe mere Eminem ke gaane ne.college mein jata tha lekin pura samay gana sunke main bitata, practical ka book khali rehta peche se bhar jata. Teacher class se bhagata book fadke. lekin tera bhai jhanda gaadke baith chuka tha karunga rap padunga rap banunga rapper lekin main kahan par kho chuka tha mujhko khudko nahi khabar.MBBS karne nikla barvi mein tha ye dar.tapak na jau,latak na jau,bhatak na jau waich hua.khud hi khudse maine khudke liye khoda tha kua.lekin mere kue se nikla paani.rap karne laga sabko batane laga kahani,gaana likhke abba ne bola gaane tere fikke angreji mei karega rap nahi chalenge sikke fir thikhai abba ki baat sun li maine. 'Aur Bantai' gaane ke aaj bhi kitne fan hai(Hook)Bolo aur bantai kya bolte tumNasta paani karke peeye chai mein cheeni kamKoi maare dum toh koi chillum sab pukare ek hi naam Bhole bum bum.I'm back I'm back bhai tera dera hai comeback jahan pe hum khad jare sab jare hai beta back back snapback mere sar pe, public ka horela bagpack badla lene pe aate toh kar daalte seedha hijack.pyaar se rehte toh swabhav pura shaant yede chali kardega toh seedha Rajnikanth yennada rascala ek ko la ya fir jaake das ko la baat mere full vastav...boht hard 50 tolakho diya khudko main khudke hu raho pe baton pe nai bharosa hai kitabon pe jo maine likha hai padke sunadu aaj sabko bata du yeh daastan chehre mere ghere pade kafi sare dard se ghere pade chehre mere bohtsaare dar se gharse nikalna mushkil hai batoon se buzdil hai fokat ke fokat yeh logbandook ki goli ki tarah yeh chote haichoti baatein aur yeh choti yeh soch tera bhai tooph bummmbbbb phat ta main zor se, karta main shor kam kyuki logo ko kam samajh aata sab karte waade par koi nahi nibhata aadhi zindagi mei bata pe kata Nike adidas se mera ab hua naata Aur bantai kya bolte tumNasta paani karke peeye chai mein cheeni kamKoi maare dum toh koi chillum sab pukare ek hi naam Bhole bum bum.*DISCLAIMER: This Audio/Video is Strictly meant for Promotional Purpose. We Do Not Wish to make any Commercial Use of this & Intended to Showcase the Creativity and Inspiration Of the Artist Involved.**The original Copyright(s) is (are) Solely owned by the Companies/Original-Artist(s)/Record-label(s).All the contents are intended to Showcase the creativity of the artist involved and is strictly done for a creative/promotional purpose.**DISCLAIMER: As per 3rd Section of Fair use guidelines Borrowing small bits of material from an original work is more likely to be considered fair use. Copyright Disclaimer Under Section 107 of the Copyright Act 1976, allowance is made for fair use."
"SpP58VBfO60","Kabhi Aar Kabhi Paar - Raghav | Dance Choreography | LiveToDance with Sonali","2018-12-04T10:30:00.000Z","UCrCrHVA0_WTH1vmn_13eGeg","LiveToDance with Sonali","27","18.05.12","live to dance with sonali,sonali bhadauria,kabhi aar kabhi paar,kabhi aar kabhi paar dance,raghav,kabhi aar kabhi paar musically,kabhi aar kabhi paar remake,kabhi aar kabhi paar new version,raghav songs hindi,kabhi aar kabhi paar song,kabhi aar kabhi paar remix,dance,kabhi aar kabhi paar laga teer e najar,kabhi aar kabhi paar song dance,dance choreography kabhi aar kabhi paar,dance on kabhi aar kabhi paar,dance covers,raghav cant get enough,sonali latest dance","143417","10323","316","709","https://i.ytimg.com/vi/SpP58VBfO60/default.jpg","False","False","Check out my latest Dance choreography on the track Kabhi Aar Kabhi Paar by Raghav, Was fun to do this video with the talented Rutuja Bhagat. Hope you guys enjoy the videoHope you guys enjoy the video & do not forget to LIKE SHARE & COMMENT!!!Shot & Edited by: Joe JoshiInstagram: https://www.instagram.com/ohmygosh_joe/Subscribe to LiveToDance with Sonali:https://www.youtube.com/channel/UCrCrHVA0_WTH1vmn_13eGeg?sub_confirmation=1Follow Sonali  on:Facebook: https://www.facebook.com/sonali.bhada...Instagram: https://www.instagram.com/sonali.bhad...Facebook Page: https://www.facebook.com/livetodanceltd/Follow Rutuja: https://www.instagram.com/rutuja_bhagat/Keep dancing!Cheers!#kabhiaarkabhipaar #raghav #dancechoreography"
"LWQydi_Sgfw","നടി മഞ്ജിമയുടെ ഫോട്ടോഷൂട്ട് പുറത്തെത്തി വല്ലാത്ത സൗന്ദര്യം തന്നെ | Manjima mohan photoshoot","2018-12-03T09:23:00.000Z","UCh2WTjOj_FUtGoXwZGLFSqA","FILM COURT","24","18.05.12","Film news,malayalam news,film gossip,movie news,movie gossip,molywood,hot news,news,popular news,star news,location news,location,film location,film,movie,cinema,cinema news,film court,film review,review,new movies,new movie news,hot,dance,song,tamil,mohanlal,mammootty,nivin,pauly,dulquar,salman,nayanthara","221499","471","296","63","https://i.ytimg.com/vi/LWQydi_Sgfw/default.jpg","False","False","Watch നടി മഞ്ജിമയുടെ ഫോട്ടോഷൂട്ട് പുറത്തെത്തി വല്ലാത്ത സൗന്ദര്യം തന്നെ Manjima mohan photoshootBlog  : http://filmcourt1.blogspot.in/"
"WZQh6gZiIKs","#राधाकृष्ण | कृष्ण वाणी 40","2018-12-03T15:42:48.000Z","UCCy2rLnGdwoJcSAtixNdsPQ","STAR भारत","22","18.05.12","radha krishn,radha,krishn,love story,love,राधाकृष्ण,राधा,कृष्ण,प्रेम,स्टार भारत,प्रेमगाथा","367158","16516","149","838","https://i.ytimg.com/vi/WZQh6gZiIKs/default.jpg","False","False","कृष्ण वाणी 40अपने वो हैं, जो विपत्ति में काम आएँ.अपनों के साथ समय का पता नहीं चलता, पर समय के साथ अपनों का पता चल जाता है...#कृष्णवाणी | #KrishnVaani#राधाकृष्ण | #RadhaKrishn"
"eAMQpzZ3Jb4","છોકરી કેમ પટાવી || dhaval domadiya","2018-12-03T05:30:00.000Z","UCTEfw4GhRUFoeUD6DQZ4RWA","Dhaval Domadiya","24","18.05.12","dhaval domadiya,comedy video,gujarati video,dhaval domadiya comedy","427185","8559","433","551","https://i.ytimg.com/vi/eAMQpzZ3Jb4/default.jpg","False","False","This video is all about chokari kem patavi follow me on ...insta - https://www.instagram.com/dhaval_domadiya/facebook - https://www.facebook.com/dhaval.domadiya.7"
"JySkZaTLzfU","Revanth wife Shocking Counter To KCR | #RevanthReddyArrest | TRS Vs Congress | Mango News","2018-12-04T08:18:56.000Z","UCv98nH5lII-twQqyvFVRe8Q","Mango News","25","18.05.12","Revanth Reddy,Revanth Reddy Wife,Revanth Reddy Wife fires on Police,Revanth Reddy Wife fires on Police over Revanth arrest,Revanth Reddy wife with media,Revanth Reddy wife interview,revanth reddy wife on revanth arrest,revanth reddy arrest,revanth reddy latest news,about revanth reddy arrest,revanth reddy arrest video,revanth reddy arrest scene,trs vs congress,reavnath reddy wife questions,mango news,mango news live,mango news youtube,mango news latest","119128","1039","159","133","https://i.ytimg.com/vi/JySkZaTLzfU/default.jpg","False","False","Revanth wife shocking counter to KCR. She slammed that they are wantedly doing all these things to make elections one-sided. She said that the election campaign should conduct with peace without any protests. She questioned over TRS meeting while 144 section is issued. She demanded to give permission to go for the TRS public meeting.#MangoNews#TelanganaElections2018Updates : https://bit.ly/2KidpQB#PoliticalNewsUpdates :  https://bit.ly/2FvsvDNFor all top and best news stories happening all around you For all top and best news stories happening all around you SUBSCRIBE: https://bit.ly/2Tse2eQFor all the news and latest updates, like us @ https://www.facebook.com/MangoNewsFollow us on Twitter: http://www.twitter.com/Mango_NewsCheck us out on Google +: https://plus.google.com/+mangonewsVisit us @ http://themangonews.co"
"38ek_w7uwEg","పావనికి ఇత్తడైపోయినట్టుంది ఇవాళ!!!  #KathaloRajakumari Today at 9 PM on Star Maa","2018-12-04T13:20:25.000Z","UCJF4y2nyCCrDKTgA7dxz1Qw","Star Maa","24","18.05.12","Star Maa,Starmaa,Starmaa serials,Telugu TV,Telugu Serials,Maatv Serials,Maa tv. drama,comedy action,entertainment,Telugu,tollywood,maatv,star telugumaa,maatelugu,#StarMaaSerials","66239","396","32","57","https://i.ytimg.com/vi/38ek_w7uwEg/default.jpg","False","False","#StarMaaSerials"
"KKukaI1Fg14","Girls Hostel | Official Trailer || Girliyapa Originals","2018-12-01T07:55:15.000Z","UCdxbhKxr8pyWTx1ExCSmJRw","Girliyapa","24","18.05.12","Girls Hostel | Official Trailer || Girliyapa Originals,girls hostel,official,trailer,girliyapa,originals,girls,hostel,hostel life,hostel funny,girls funny,girls funny videos 2018,girliyapa videos,ahsaas channa,whisper,parul gulati,simran natekar,shreya mehta,srishti srivastava,Gaggan Arora,girls hostel life,tvf,tvfplay,college,college life,friends,bff,best friends,girlfriends,love,romance,warden,campus,all girls,girls college,no mercy,web series,web show","1082194","29461","1349","1712","https://i.ytimg.com/vi/KKukaI1Fg14/default.jpg","False","False","Imagine a night in with 4 girls. Now imagine doing that for 4 years. In a building full of girls that is a Girl’s Hostel. Live the Dushmani, the Dosti, the Pyaar, the Bhasad. Watch Girliyapa Originals’ Whisper Presents GIRLS HOSTEL OFFICIAL TRAILER now!#Girliyapa #GirliyapaOriginalsFollow Girliyapa on: Instagram: https://www.instagram.com/girliyapa/ Facebook: https://www.facebook.com/Girliyapa/ Twitter: https://twitter.com/GirliyapaWant more awesome original videos?Head to https://tvfplay.com/Download TVFPlay now:Android: http://bit.ly/tvfplayandroid iOS: http://bit.ly/tvfplayiosCredits:Written by: Shreyasi SharmaDirected by: Chaitanya KumbhakonumCast: Ahsaas Channa, Srishti Srivastava, Parul Gulati, Simran Natekar, Shreya Mehta, Gagan Arora"
"YsDCluiGfaY","2.0 - Back To Back Promos | Rajinikanth | Akshay Kumar | A R Rahman | Shankar | Subaskaran","2018-12-01T15:14:30.000Z","UCA7gwgLgmCZ8DSmdf2bhb8g","Lyca Productions","1","18.05.12","Lyca Productions,2.0,2point0,robot 2,robo 2.0 teaser,akshay kumar,2.0 making,enthiran making,2.0 teaser,shankar,2.0 movie,amy jackson,a r rahman,robot 2.0,enthiran movie,rajinkanth,director shankar,rajinikanth,Making of 2.0,making of 2.0 reaction,2.0 trailer,enthiran 2,robot 2.0 trailer,shankar 2.0,2 point 0 teaser,2.0 Release,rajini,rajnikanth,2.0 trailer official,2.0 back to back promos","6075058","79696","3514","4187","https://i.ytimg.com/vi/YsDCluiGfaY/default.jpg","False","False","2.0 Back To Back Promos | Rajinikanth | Akshay Kumar | A R Rahman | Shankar | Subaskaran#2point0Lyca Productions - Subaskaran presents you the Back to Back promos. 2.0 is a Science Fiction film featuring Superstar Rajinikanth & Akshay Kumar, being directed by Shankar and music by A. R. Rahman. -Team 2.0- Cast : 'Superstar' Rajinikanth, Akshay Kumar, Amy Jackson & Others Directed by S. Shankar Written by S. Shankar, B. Jeyamohan Music by A. R. Rahman Cinematography Nirav Shah Edited by Anthony Produced by : Lyca Productions LIKE us in Facebook - https://www.facebook.com/LycaProductionsFollow us in Twitter - https://twitter.com/LycaProductions"
"QaBbU1UWdbk","SCHOOL LIFE VS COLLEGE LIFE | So Effin Cray","2018-12-01T10:55:39.000Z","UCOquMs0QXyjbw2YMigivRAw","So Effin Cray","24","18.05.12","so effin cray,so effin cray latest,school life,girls vs boys in school life,college life,school life vs college life,college ka pehla pyaar,school love,college love,when a girl falls in love with sakht launda,sakht launda,maari,gully boy vs rich guy,whatsapp videos,school love story,whatsapp funny,cheater girlfriend,sakht launda shares a flat with a hot girl,school ke wo din","1750722","58143","2462","3590","https://i.ytimg.com/vi/QaBbU1UWdbk/default.jpg","False","False","Buy Mach3Turbo - http://spr.ly/GilletteMach3Special Thanks To Pramod Sawant SirWritten,Directed and Produced By Vatsl SethCo-Producer and Co-Writer- Shaeina SethDoP- Omkar KolekarCast-Vartika Chauhan | Sandy D. Mokal | Shalini Chauhan | Guneet | Ruchika | Sudhanshu | Urzan | Sandeep | Aakash | OmkarFirst AD- Rohit SinghAD- VimalDo Like and Follow us on-https://www.facebook.com/soeffincrayhttps://www.instagram.com/soeffincray/https://twitter.com/soeffincraySpecial Thanks To 3 Million+ Amazing People Who Subscribed :)So Effin CrayCreated By Vatsl Seth"
"bfHpJ579-cY","Tata Harrier - In the Flesh I First Look I Autocar India","2018-12-04T02:30:02.000Z","UCjWs7BxyjO5SLqevxSmp4vQ","Autocar India","2","18.05.12","Autocar,India,Autocar India,Car Reviews,Video Reviews,Test Drives,tata,Tata HArrier,Harrier,new cars,suv,new suv,new Tata Suv,tata harrier,tata harrier price,tata harrier interior,tata harrier review,harrier,2019 tata harrier,tata harrier suv,tata harrier 2019,tata harrier h5x,tata harrier 2018,tata harrier launch,tata harrier features,tata harrier launch date,tata motors,new tata harrier,tata harrier video,tata harrier india,tata harrier engine","452468","11486","828","2220","https://i.ytimg.com/vi/bfHpJ579-cY/default.jpg","False","False","No more teaser videos, no more expo shots. This is a first look at the Tata Harrier that will launch in Jan 2019. Hormazd Sorabjee walks you through the Harrier and it’s features. Opinions are embargoed at this time but watch out for the full review on the Dec 7th. SUBSCRIBE to Autocar India for hottest automotive news and the most comprehensive reviews ► http://bit.ly/AutocarIndAutocar India is your one stop source for test drive reviews & comparison test of every new car released in India. We also offer a great mix of other automotive content including podcasts, motor show reports, travelogues and other special features.Click this link for latest car reviews ►http://bit.ly/ACI-NewCarReviewsClick this link for comparison tests of latest cars & bikes ►http://bit.ly/ACI-ComparisonClick this link for latest bike reviews ►http://bit.ly/ACI-BikeReviewsClick this link for Autocar India exclusive features ►http://bit.ly/ACI-FeaturesVisit http://www.autocarindia.com for the latest news & happenings from the auto world.Facebook: http://www.facebook.com/autocarindiamagInstagram: https://www.instagram.com/autocar_india/Twitter: http://www.twitter.com/autocarindiamagG+: https://plus.google.com/+autocarindia1"
