video_id,title,publishedAt,channelId,channelTitle,categoryId,trending_date,tags,view_count,likes,dislikes,comment_count,thumbnail_link,comments_disabled,ratings_disabled,description
"sJUGAIf1Px0","Shawn Mendes  - Youth ft. Khalid","2018-11-05T23:37:56.000Z","UCAvCL8hyXjSUHKEGuUPr1BA","Shawn Mendes","10","18.04.12","Shawn Mendes,Khalid,Youth,You Cant Take Our Youth Away,Our Vote Is Our Voice,vote,march for our lives,apple,applemusic","10950436","871049","7873","42098","https://i.ytimg.com/vi/sJUGAIf1Px0/default.jpg","False","False","Shawn Mendes on Apple Music:apple.co/YouthOnAppleMusic Co-written by Marjory Stoneman Douglas students Emma Gonzalez and David Hogg, director Anthony Mandler, Larry Jackson, Shawn & Khalid, this video creates a literal stage to celebrate and honor the young, diverse and talented amongst us. Starring both Mendes and Khalid as well as over 30 different inspiring young people ranging from activists, painters, dancers, gun violence survivors, musical prodigies and many more splashed against a stunning New York City backdrop (A full list can be found below)  It also features a sculpture by New York-based contemporary artist Daniel Arsham.  THE COMPLETE LIST OF INCREDIBLE “YOUTHS” STARRING ALONGSIDE SHAWN MENDES AND KHALID IN ORDER OF APPEARANCE: Autumn de Forest, 17, Painter Yetunde Washinton, Nia Mandisa Parker & Lourdes Honor Taylor, 18, 20 & 19, Hiplet Dancers Lizzy Howell, 17, Ballerina  Xiuhtezcatl Martinez, 18, Environmental Activist Hasaan Hawthorne, 20, Wrestling State Champion (Double Amputee Wrestler) Clawdeena, 18, Drag Performer Zuriel Oduwole, 16, Filmmaker / Activist Ahmed Mohamed, 17, Arrested for bringing a homemade clock to school  Kojo Odu Roney, 13, Prodigal Drummer Giuliana Siraguso, 12, Hearing Impaired Dancer Donielle Hansley, 14, Dancer Sonita Alizadeh, 21, Rapper / Activist  Morgan Hurd, 17, World Champion Gymnast D’Angelo McDade, 18, Survivor of Gun Violence Jahne Benthall & Lynn Yeboah, 18, 18, Northstar Academy Policy Debater  Kadan Bart Rockett & Brooklyn 13 & 11, Kid Magicians David Doktorman & Isaac Segal, 18, 18, National Policy Debate Champions Phoenix Hunter, 8, Wrestling State Champion Rayna Vallandingham, 15, Martial Arts Champion Elias & Zion Phoenix, 12, Music Prodigies  Mars, 18, Gender Fluid Artist Nassir Little, 18, All-American Basketball Player Parker Clark, 14, Fire Performer Austin Perine, 4, Superhero who feeds the homeless Charlotte Reidy & Gabriel Ratner, 12, 11, Shakespearean Actor Jack Andraka, 21, Inventor, Scientist, Cancer ResearcherEthan Fineshriber - martial arts championDirector: Anthony MandlerCreative Director: Larry Jackson Exec Producer: Larry Jackson, Nathalie Besharat, Scott Seviour Written by: Larry Jackson, David Hogg, Emma Gonzalez and Anthony Mandler, Shawn Mendes & KhalidProducer: BlackHandCinema, John WinterPost Producer: Karl Reid Production Company: BlackhandCinema"
"CxnJf0tWu48","BTS (防弾少年団) 'Airplane pt.2 -Japanese ver.-' Official MV","2018-11-06T15:00:01.000Z","UCl2aT0nRejTCQO_LHZAftBw","UNIVERSAL MUSIC JAPAN","10","18.04.12","BTS,防弾少年団,バンタン,EXO,SHINee,Wanna One,TWICE,iKON,WINNER,DNA,FAKE LOVE,Don't Leave Me,Not Today,LIVE TRILOGY,THE WINGS TOUR","26924395","2198141","29249","124912","https://i.ytimg.com/vi/CxnJf0tWu48/default.jpg","False","False","BTS、日本9thシングル11月7日発売!韓国で2018年5月に発売された「LOVE YOURSELF 轉 ‘Tear'」では、韓国人アーティストとして史上初の快挙となる‘ビルボード200'で1位を記録。更に韓国で8月に発売されたアルバム「LOVE YOURSELF 結 ‘Answer'」が‘ビルボード200'で再び1位を獲得。今作のニューシングルは「LOVE YOURSELF 轉 ‘Tear'」からの大ヒット楽曲「FAKE LOVE」、「Airplane pt.2」のJapanese ver.を表題とする超強力なシングル！【商品概要】BTS (防弾少年団) 「FAKE LOVE/Airplane pt.2」2018/11/7 Releasehttps://umj.lnk.to/bts_flap2YD【関連サイト】■BTS (防弾少年団)　公式ホームページ https://bts-official.jp/ ■BTS (防弾少年団)　ユニバーサルミュージック公式ページ　http://www.universal-music.co.jp/bts/"
"wMxKbkWrvDc","Binging with Babish: Bear Stew from Red Dead Redemption 2","2018-11-06T14:00:08.000Z","UCJHA_jMfCvEnv-3kRjTCQXw","Binging with Babish","24","18.04.12","red,dead,redemption,rockstar,arthur,morgan,cowboy,stew,bear,meat,food from red dead redemption 2,rdr2,red dead redemption,red dead redemption 2,food in red dead redemption,food in red dead redemption 2,bear stew,game stew,RDR2,rdr 2,bear stew recipe,game stew recipe,how to make game stew,rabbit stew,rabbit stew recipe,venison stew,venison stew recipe,binging with babish,babbish,cooking with babish","2134770","96008","1600","7177","https://i.ytimg.com/vi/wMxKbkWrvDc/default.jpg","False","False","Food in video games has seen a renaissance in the past few years, with vittles playing a pivotal role in your mere survival as a character.  Rockstar games inches ever-closer to real life in video game form with Red Dead Redemption 2, where you can buy, hunt, cook, steal, and eat your nutritional requirements every day.  You never seem to need to go to the bathroom though...Special thanks to Justin Bailey, a wilderness expert without whom this episode would not have been possible!  Go check out his Instagram:https://www.instagram.com/theoutdoorethos/Check out my playlist of preferred cooking tunes, Bangers with Babish: https://open.spotify.com/user/easybakeandy/playlist/04Gp926I7HFqBLVDI2eRJIBinging With Babish Website: http://bit.ly/BingingBabishWebsiteBasics With Babish Website: http://bit.ly/BasicsWithBabishWebsitePatreon: http://bit.ly/BingingPatreonInstagram: http://bit.ly/BabishInstagramFacebook: http://bit.ly/BabishFacebookTwitter: http://bit.ly/BabishTwitterhttps://www.bingingwithbabish.com/podcast/Apple Podcasts: https://itunes.apple.com/us/podcast/bedtime-with-babish/id1327655367?mt=2Soundcloud: https://soundcloud.com/bedtimewithbabishStitcher: https://www.stitcher.com/podcast/bedtime-with-babish?refid=stpr"
"atNGFSCjwuc","Bubalu - Anuel AA x Prince Royce x Becky G x Mambo Kingz x Dj Luian","2018-11-06T05:05:31.000Z","UCz2SUbUr2k0T3nEmutgsPjg","Hear This Music","10","18.04.12","bubalu,anuel,prince royce,becky g,mambo kingz,dj luian,bubaloo,boobaloo","97282164","1070894","49370","37422","https://i.ytimg.com/vi/atNGFSCjwuc/default.jpg","False","False","Hear This Music presenta:Bubalu - Anuel x Prince Royce x Becky G x Mambo Kingz x Dj LuianInstagrams:http://www.instagram.com/mambokingzhttp://www.Instagram.com/djluian"
"mAKsZ26SabQ","TWICE YES or YES M/V","2018-11-05T08:59:49.000Z","UCaO6TYtlC8U5ttz62hTrZgg","jypentertainment","10","18.04.12","TWICE YES or YES,TWICE YESorYES,TWICE YES YES,TWICE 예스오어예스,TWICE YES,TWICE 예스,TWICE 예스 오어 예스,트와이스 YES or YES,트와이스 YESorYES,트와이스 YES YES,트와이스 예스오어예스,트와이스 YES,트와이스 예스,트와이스 예스 오어 예스,TWICE YoY,트와이스 YoY,YES or YES,YESorYES,YES,예스오어예스,예스 오어 예스,예스,YoY,YES or YES M/V,YES or YES MV,YES or YES Music Video,YES or YES 뮤비,YES or YES 뮤직비디오,예스오어예스 MV,예스오어예스 뮤비,예스오어예스 뮤직비디오,TWICE M/V,TWICE MV,TWICE Music Video,트와이스 MV,트와이스 뮤직비디오,트와이스 뮤비,TWICE,트와이스","90489416","1768122","143237","338498","https://i.ytimg.com/vi/mAKsZ26SabQ/default.jpg","False","False","TWICE(트와이스) YES or YES M/V iTunes & Apple Music  https://goo.gl/fc5tPPSpotify https://goo.gl/p4dWydGoogle Play Music https://goo.gl/i54Y56TWICE Official YouTube: http://www.youtube.com/c/TWICEonAirTWICE Official Facebook: http://www.facebook.com/JYPETWICETWICE Official Twitter: http://www.twitter.com/JYPETWICETWICE Official Instagram: http://www.instagram.com/TWICETAGRAMTWICE Official Homepage: http://TWICE.jype.comTWICE Official Fan's: http://fans.jype.com/TWICEⓒ 2018 JYP Entertainment. All Rights Reserved"
"tkCflMyvRbM","Delia - Acadele | Videoclip Oficial","2018-11-05T07:49:14.000Z","UCnwuVNhrwtxnGEbwkxuK6Sw","Delia","10","18.04.12","delia,acadele,videoclip,oficial,piesa,single,muzica,romaneasca,muzica 2018,muzica youtube,muzica petrecere,download muzica,muzica noua,muzica noua 2018,pe aripi de vant,du-te ma baby,despablito,cine m-a facut om mare,inimi desenate,delia official,delia canal oficial,1 2 3 4,unde dragoste nu e,cum ne noi,delia weekend,delia the motans,delia carla's dreams","3810729","79555","9833","5218","https://i.ytimg.com/vi/tkCflMyvRbM/default.jpg","False","False","Videoclip oficial cu Delia interpretand single-ul Acadele. (C) & (P) 2018 Global RecordsAcadele Download / Streaming:iTunes: https://geo.itunes.apple.com/us/album/id1441289348Spotify: http://open.spotify.com/album/70RlsoMhqAzQi16jrR3K1VBooking & Licensing:booking@globalrecords.com | +40.0757.104.166http://www.globalbooking.ro/delia-matache/licensing@globalrecords.comFollow Delia:Facebook: http://www.facebook.com/OfficialDeliaTwitter: https://twitter.com/delia_officialOfficial Website: http://deliaofficial.ro#delia #acadele #videoclipMuzica si Text: Delia Matache, Alex CotoiProductie muzicala: Alex CotoiRegie/ D.O.P : Alex CeausuVideo Production: Luca-s art film / Radu Selaru. Global Records Online: Facebook: https://www.facebook.com/GlobalRecordsComInstagram: https://www.instagram.com/GlobalRecordsOfficial Website: http://globalrecords.comTwitter: https://twitter.com/GlobalRecordsROToate drepturile sunt rezervate. Orice upload neautorizat al acestui videoclip este ilegal si poate fi raportat oricand la Youtube. All rights reserved. Unauthorized reproduction is a violation of applicable laws. In order to avoid copyright infringement, please do not upload this video on your channel."
"LykS0TRSHLY","New iPad Pro review: can it replace your laptop?","2018-11-05T11:00:03.000Z","UCddiUEpeqJcYeBxX1IVBKvQ","The Verge","28","18.04.12","ipad pro 2018,ipad pro,ipad,2018 ipad pro,new ipad pro,ipad 2018,apple,apple ipad,apple event,new ipad,new ipad 2018,2018 ipad,apple keynote,2018 ipad review,2018,what to expect,keynote,tim cook,apple products,steve jobs,apple 2018,event,new iphones,rumors,apple ny,apple media event,apple official,technology,top 10,gadgets,tech,first look,hands on,latest updates,iphone,review,verge,the verge","1710371","37802","2211","5813","https://i.ytimg.com/vi/LykS0TRSHLY/default.jpg","False","False","Apple’s new iPad Pro is a beast of a tablet, and Nilay Patel reviews it -- everything from its new design and screen to plugging in several devices to the new USB-C port. Dami Lee and William Joel, professional creatives at The Verge, also give their insight into the new iPad and Apple Pencil. Subscribe: http://goo.gl/G5RXGsLike The Verge on Facebook: https://goo.gl/2P1aGcFollow on Twitter: https://goo.gl/XTWX61Follow on Instagram: https://goo.gl/7ZeLvXRead More: http://www.theverge.comCommunity guidelines: http://bit.ly/2D0hlAvSubscribe to Verge Science on YouTube, a new home base for our explorations into the future of science: http://bit.ly/2FqJZMl"
"n9ckBa7WWAo","Found Diamond Wedding Ring Metal Detecting Underwater! $5,000+ (Returned to Owner)","2018-11-05T00:28:36.000Z","UCI4fHQkguBNW3SwTqmehzjw","DALLMYD","17","18.04.12","river treasure,river treasure finds,scuba diving,dallmyd,underwater metal detecting,found wedding ring,found gold ring,found diamond ring,metal detecting underwater,metal detecting,metal detecting videos,river treasure hunting,found jewelry in river,found lost jewelry,found ring in river,metal detecting finds,found jewelry underwater in river,found money in river,found in river,returned to owner,found underwater,swimming,scuba,fish,fishing","1006910","32566","871","3519","https://i.ytimg.com/vi/n9ckBa7WWAo/default.jpg","False","False","In this video I search for a lost wedding ring underwater in the river!New? Subscribe and help me reach 10 million subscribers on YouTube!! https://goo.gl/aS999eIf you want to see more videos like this make sure to click the like button! Let's aim for 10,000 likes! Searching Bottom of Lake for Lost Valuables! (Over $1,000 Worth of Finds) https://youtu.be/xE8zbCWhPZUFound Sunken Car Underwater in the River While Scuba Diving! (City Awards Me) https://youtu.be/xLFNySwsvIIFound iPhone Underwater While Scuba Diving a Boat Ramp! (What's Under the Boat Ramp?) https://youtu.be/g8V1uzNhptsFound Sunken Truck Underwater in the River at Boat Ramp! (Recovered Truck for Owner) https://youtu.be/CDP3OgX974oI Found an iPhone Underwater in the River While Swimming! (River Treasure) https://youtu.be/HTh3tKSL8-8I Found a Police Stun Gun Underwater in the River! (Things Found Underwater) https://youtu.be/HTh3tKSL8-8Found GoPro While Exploring Underwater in the River! (Lost Footage Found) https://youtu.be/0keSO2xC-aII Found Money While Cleaning a Trash Pile Underwater in River! (Scuba Diving) https://youtu.be/gExbIfncEPoI Found a Lost Apple Watch with Help From an Underwater Drone! (Returned to Owner) https://youtu.be/-pvCz9LKwaoFound Gun Underwater in River While Scuba Diving! (WRBL News Interview) https://youtu.be/828_kJiAVTQSaving the Lives of 3 children, 2 dogs and a Father at the River! (Police Called)Found Possible Murder Weapon Underwater in River While Scuba Diving! (Police Called) https://youtu.be/UZbRxWmE3HMI Found an iPhone Underwater While Searching for Lost Valuables! (Underwater Finds) https://www.youtube.com/watch?v=ROIaN34LZ1sI BOUGHT MY BEST FRIEND HIS DREAM JET SKI! (2018 Yamaha GP1800) **Emotional** https://youtu.be/TpvxYvMKlqoI Found a JUUL Underwater in the River While Searching for Lost Valuables! (Underwater Finds) https://youtu.be/yh6HyC9v8_UFound Crashed DJI Phantom 4 Drone Underwater at Wakeboard Park! (Unbelievable https://youtu.be/I6xbGitR2uYHelping Search & Rescue Teams Locate Two Drowned People in River (Bodies Recovered) https://youtu.be/oroQD6ioEW4Found Drone Underwater in River Lost 4 Years Ago! (Scuba Diving) https://youtu.be/_DCn6Y0YwM0Found Assault Rifle Underwater in River While Scuba Diving! (Police Called) https://youtu.be/ZGAS4zuwJNgHelping the Police Find a Gun Underwater to Solve a Criminal Case! (Metal Detecting Underwater) https://www.youtube.com/watch?v=6_-b3U9QDKgFound Jewelry Underwater in River While Scuba Diving for Lost Valuables! (Unbelievable) https://youtu.be/-jSirHVQAOkSearching for Possible Murder Weapons in a Shallow Urban Canal! (WLTZ News Interview) https://youtu.be/psihUrXPhO0Found Possible Murder Weapon Underwater in a Shallow Urban Canal! (Police Called) https://youtu.be/-4Gx1KrH7R4Scuba Diving the Devil's Den for Lost Valuables! (Found 2 Prehistoric Bones) | DALLMYD https://youtu.be/GxS73Fuha24CHECK OUT MY TOP 10 MOST POPULAR VIDEOS ↓ Playlist: https://goo.gl/o7xFC4Found 3 GoPros, iPhone, Gun and Knives Underwater in River! - Best River Treasure Finds of 2016 https://youtu.be/UZHDwemAZ-kFound Lost iPhone 7 in River While Scuba Diving! (w/ Girlfriend) | DALLMYD https://youtu.be/Y3JE4_c_-PIFound Possible Murder Weapon Underwater in River! (Police Called) https://youtu.be/eAmn4pxIclcFound Human Remains Underwater in River! (Police Called) https://youtu.be/cQ8ia7PejfYFound Jewelry Underwater in River While Scuba Diving for Lost Valuables! (Unbelievable) https://youtu.be/-jSirHVQAOkFound Lost iPhone, Fishing Pole and Swimbaits Underwater in River! (Scuba Diving) https://youtu.be/dPTglkp4LpwFound a Working iPhone X Underwater in the River! (Returned Lost iPhone to Owner) https://youtu.be/VfrsFd5NcCsFound Possible Murder Weapon Underwater in a Shallow Urban Canal! (Police Called) https://youtu.be/-4Gx1KrH7R4Found GoPro Camera Lost 1 Year Ago! (Reviewing the Footage) https://youtu.be/OIFWMboJIrsFound Knife, Razor Blade and $50 Swimbait Underwater in River! (Freediving) | DALLMYD https://youtu.be/aJHas5fUo88About DALLMYD:Hello! My name is Jake. I'm a Treasure Hunter, Scuba Diver, Freediver, Spearfsherman, Angler & YouTuber w/ 6,000,000+ Subscribers! I enjoy traveling to new destinations in hunt of urban treasure!FOLLOW ME ON TWITTER & INSTAGRAM ↓Twitter (Daily Updates): https://twitter.com/DALLMYDInstagram (Daily Pictures): https://www.instagram.com/DALLMYDMy PO BoxDALLMYDP.O. Box 211Phenix City, Alabama 36868-0211Have any questions? Feel free to email me anytime! I'm open to discussing about collaborations, sponsorships, product reviews and more! Email: mgordon@fullscreen.comJustin: Camera Man/ Friend: https://goo.gl/kFya6WMusic Provided by the FollowingNomyn - Daydreamer Link: https://goo.gl/yefKkHFlarve - Bounce Link: https://goo.gl/Um1gXw"
"UOxkGD8qRB4","K/DA - POP/STARS (ft Madison Beer, (G)I-DLE, Jaira Burns) | Official Music Video - League of Legends","2018-11-03T07:30:00.000Z","UC2t5bjwHdUX4vM2g8TRDq5g","League of Legends","20","18.04.12","Riot Games,Riot,League of Legends,League,LoL,MOBA,worlds pop song,worlds popstar,worlds music video,K/DA,Ahri,Kai’Sa,Evelynn,Eve,Akali,K/DA Ahri,K/DA Kai’Sa,K/DA kaisa,K/DA Evelynn,K/DA Eve,K/DA Akali,KDA Ahri,KDA Kai’Sa,KDA kaisa,KDA Evelynn,KDA Eve,KDA Akali,ahri kda,kaisa kda,eve kda,akali kda,evelynn kda,kai’sa kda,lol KDA","100924569","2317897","43898","147596","https://i.ytimg.com/vi/UOxkGD8qRB4/default.jpg","False","False","K/DA Ahri, K/DA Evelynn, K/DA Kai’Sa, and K/DA Akali take the world stage with their debut single. Keep the show going on the Rift with these new Epic skins.MEET THE BAND:https://universe.leagueoflegends.com/en_US/kdaLISTEN NOW:Spotify: http://smarturl.it/kdapopstars/spotifyApple Music: http://smarturl.it/kdapopstars/applemusiciTunes: http://smarturl.it/kdapopstars/itunesGoogle Play: http://smarturl.it/kdapopstars/googleplayDeezer: http://smarturl.it/kdapopstars/deezerPRODUCTION CREDITS:K/DA - POP/STARSFeatured artists: Madison Beer, (G)I-DLE, Jaira Burns Written by: Riot Music Team and HarloeKorean translation by: Lydia Paek and Minji Kim  Produced by: Riot Music TeamMixed by: Riot Music Team Mastered by: Riot Music TeamVocals performed by: Madison Beer, Miyeon of (G)I-DLE, Soyeon of (G)I-DLE, Jaira BurnsAdditional vocals by: Harloe Vocal production by: Riot Music TeamExecutive Producers: Riot Games & Justin Tranterhttp://madisonbeer.com/http://www.cubeent.co.kr/gidlehttp://www.jairaburns.com/ANIMATION: Fortiche ProdLYRICS:You know who it isComing 'round againYou want a dose of thisRight nowIt’s K/DA uh!I'm a goddess with a blade소리쳐봐 내 이름잊지 못하게Loud loud loud loudI could take it to the top절대 멈추지 못해내가 끝내주는Bad gal gal galAnd when I start to talk like that (like that)Oh you won’t know how to reactI’m a picture perfect faceWith that wild in my veinsYou can hear it in myGrowl, growl, growl, growlSo keep your eyes on me now무엇을 보든 좋아할 거야닿을 수 없는 level나와 대결 원한 널 확신해We got it all in our hands nowSo can you handle what we’re all aboutWe’re so toughNot scared to show you upCan you feel the rush now?Ain’t nobody bringing us down down down down down downThey could try but we’re gonna wear the crownYou could go another round round round round round round roundWish you luck but you’re not bringing us downWe go hardTill we get it get itWe go hardWe so in it in itWe POP/STARSOnly winning winning nowAin’t nobody bringing us down down down downHey!You ready for this? (Let's go!)See 언제든지 내 모습 magic단 한 번에 내가 잡어절대 기죽지 않지 uh!Pow pow 네가 뭘 알아견딜 수 없어, 원해도.원하는 게 얼굴에 보여I’m trouble and you’re wanting itI’m so coldWhen I move that wayYou gonna be so blownI’m the realest in the game uh!Say I’m on fire with a bladeYou’re about to hear my nameRinging in your head like ohSo keep your eyes on me now무엇을 보든 좋아할 거야We’re so toughNot scared to show you upCan you feel the rush now?Ain’t nobody bringing us down down down down down downThey could try but we’re gonna wear the crownYou could go another round round round round round round roundWish you luck but you’re not bringing us downWe go hardTill we get it get itWe go hardWe so in it in itWe POP/STARSOnly winning winning nowAin’t nobody bringing us down down down downOh... 난 멈추지 않아Oh oh we go hardOh oh we POP/STARS (stars), stars (stars)Ain’t nobody bringing usAin’t nobody bringing us down down down down down downThey could try but we’re gonna wear the crownYou could go another round round round round round round roundWish you luck but you’re not bringing us downWe go hardTill we get it get itWe go hardWe so in it in itWe POP/STARSOnly winning winning nowAin’t nobody bringing us down down down downMORE RIOT GAMES MUSIC:https://www.youtube.com/user/RiotGamesInc/playlists?sort=dd&view=50&shelf_id=23PLAY LEAGUE OF LEGENDS:http://riot.com/signup#KDA #POPSTARS #LEAGUEOFLEGENDS"
"UjX10jO-p3c","Shakira - Nada (Official Video)","2018-11-04T01:30:01.000Z","UCGnjeahCJW1AF34HBmQTJ-Q","shakiraVEVO","10","18.04.12","official video,video oficial,music,musica,nothing,shak,el dorado,shakira lovers,latin music,musica latina,musica en español,latin pop,pop latino,sony music,Latin Pop,Nada,Shakira,Sony Music Latin","11611041","331655","10104","26718","https://i.ytimg.com/vi/UjX10jO-p3c/default.jpg","False","False","Shakira - Nada (Official Video) Music: iTunes: http://smarturl.it/ElDoradoiApple Music: http://smarturl.it/ElDoradoApSpotify: http://smarturl.it/ElDoradoSAmazon: http://smarturl.it/ElDoradoAGoogle Play: http://smarturl.it/ElDoradoGD2C: http://smarturl.it/ElDoradoPSocials: Facebook: http://www.facebook.com/shakiraTwitter: http://www.twitter.com/shakiraInstagram: http://www.instagram.com/shakiraOfficial Music Video by Shakira performing Nada (Official Video).(C) 2018 Ace Entertainment S.ar.l., under exclusive license to Sony Music Entertainment US Latin LLC#Shakira #Nada #ElDorado"
"hlznpxNGFGQ","Clean Bandit - Baby (feat. Marina & Luis Fonsi) [Official Video]","2018-11-02T10:15:39.000Z","UCvhQPdeTHzIRneScV8MIocg","Clean Bandit","10","18.04.12","clean bandit,baby,Marina,Luis Fonsi,What Is Love,Solo,Demi Lovato,Symphony,I'm someone else's baby,Rockabye,Anne-Marie,Sean Paul,Zara LArsson,Rather Be,Jess Glynne,Tears,Louisa Johnson,I Miss You,Julia Michaels,Real Love,Extraordinary,Stronger,Come Over,Stylo G,Dust Clears,Mozart's House,Love Ssega,Disconnect,New Eyes,Strictly,It Takes Two,BBC Radio 2,Scott Mills,official,video,BBC Radio 1,Billboard,marina and the diamonds,pop song,uk pop","31694489","505612","18222","28809","https://i.ytimg.com/vi/hlznpxNGFGQ/default.jpg","False","False","Download or stream now: http://atlanti.cr/BabyTaken from our new album What Is Love? - out now: http://atlanti.cr/WhatIsLoveClick here to subscribe: http://bit.ly/SubscribeToCleanBanditFollow us:Website: http://cleanbandit.co.uk/Facebook: http://www.facebook.com/cleanbandit Twitter: http://www.twitter.com/cleanbandit Instagram: http://instagram.com/cleanbanditSoundcloud: http://www.soundcloud.com/cleanbanditSpotify: http://www.atlre.co.uk/CleanBanditSpotify"
"yNXDxUQ4c9U","benny blanco & Calvin Harris - I Found You (Official Music Video)","2018-11-02T16:00:07.000Z","UCqrBKQHQVEvD2Q9FP0DCP2g","benny blanco","10","18.04.12","benny blanco,benny,blanco,calvin harris,calvin,i found you,found you,halsey,tory,tory lanez,francis,francis and the lights,francis & the lights,lil dicky,dicky,dancing,edm","19723676","108711","5624","2512","https://i.ytimg.com/vi/yNXDxUQ4c9U/default.jpg","False","False","“I Found You” out now: http://smarturl.it/IFoundYouBBDirected by: Jake Schreier Video featuring: benny blanco, Tory Lanez, Francis and the Lights, Lil’ Dicky, benny's Mom, Halsey, and Cashmere Cat. Executive Producers: Jackie Kelman Bisbee, Alex FischLine Producer: Cody RyderDP: Christopher SoosColor: Michael Rossiter, The Mill NY Follow benny blanco:http://www.instagram.com/itsbennyblancohttp://www.facebook.com/itsbennyblancohttp://www.twitter.com/itsbennyblanco #bennyblanco #CalvinHarris #IFoundYou"
"jpJ8CbrWX_Y","Panic! At The Disco - The Greatest Show [from The Greatest Showman: Reimagined]","2018-11-02T04:11:52.000Z","UColJTBTSGqaaZr5NOk5r3Pg","Panic! At The Disco","10","18.04.12","panic! at the disco,panic at the disco,the greatest showman,the greatest show,the greatest showman: reimagined,brendon urie,urie,beebo,fueled by ramen,fbr,dcd2,dcd2 records,patd","8851331","400866","2981","27830","https://i.ytimg.com/vi/jpJ8CbrWX_Y/default.jpg","False","False","Don't fight it, it's coming for you 🎩 hopped in the studio to remake The Greatest Show from The Greatest Showman: Reimagined 🙌 Pre-order the album + get the song now https://Atlantic.lnk.to/TGS_ReimaginedPAUpcoming tour dates: http://panicatthedisco.com/tour Pray For The Wicked Winter Tour 2019 w/ Two Feet + Betty Who on sale nowSite: http://panicatthedisco.comFacebook: http://facebook.com/panicatthediscoTwitter: http://twitter.com/panicatthediscoInstagram: http://instagram.com/panicatthediscoSpotify: http://spoti.fi/1CsbsdCStore: https://store.panicatthedisco.com#PanicAtTheDisco #TheGreatestShow #TGSReimagined"
