video_id,title,publishedAt,channelId,channelTitle,categoryId,trending_date,tags,view_count,likes,dislikes,comment_count,thumbnail_link,comments_disabled,ratings_disabled,description
"ZwMot0Ld64I","SIT | THE FAMILY VACATION| S1E6 | THE FINALE","2018-12-06T09:00:09.000Z","UCqnW0v3DXxt0Svv0H64TVZQ","Shitty Ideas Trending","24","18.09.12","SIT,Shitty Ideas Trending,SIT Videos,tvf qtiyapa,Buzzfeed,web series,family,drama,comedy,viral,the viral fever,permanent roommates,filtercopy,short films,BYN,Ashish Chanchalani,BeYouNick,The Better Half,Chhavi Mittal,Karan V Grover,Funny Video,Rishi Rohini,Husband Wife Comedy,The Family Vacation,TFV,Father,Mother,Family,In Laws,Ayub Khan,Dice Media,What The Folks,Tinder,In-Laws,Parents,Meet The Folks,Cocaine,Coke,Drugs,Finale","756161","22417","641","1361","https://i.ytimg.com/vi/ZwMot0Ld64I/default.jpg","False","False","#WebSeriesMr. Chopra catches Rishi red-handed in the act of doing drugs! He goes all out and shows all his cards in front of the whole family. For him it’s do or die now. Will Rishi prove his innocence? Watch the drama reach never-before heights in the season finale of THE FAMILY VACATION!SIT presents S1E6- THE FAMILY VACATION - The Finale_______________________________________________________Do SHARE the video if you LIKE it, and leave us a COMMENT! Don't forget to SUBSCRIBE to Shitty Ideas Trending for a fun video every Thursday!Also participate in the contest to win FREE SIT MERCHANDISE!________________________________________________________CREDITS:Created By: MOHIT HUSSEINProduced By: WORKSHOP INCConcept & Directed By: MOHIT HUSSEINWritten By: MOHIT HUSSEIN, CHHAVI MITTALCreative Director: CHHAVI MITTALCast: AYUB KHAN, DEEPIKA AMIN, CHHAVI MITTAL, KARAN V GROVER, GUNJAN UTREJA, PREETIKA CHAWLA, PRACHEEN CHAUHAN, MASTER KAVYAAN KHOSLASupporting Cast: RAKESH BAZAD (Shady guy), DEVENDRA SINGH (Taxi Driver), ANIL JENA (Pandit), VINOD PRADHAN (Waiter), VIKAS SINGH (Delivery Boy)DOP: KAMAL CHAURASIAEditor: ASHISH JHASound Engineer: ANIL JENAAssistant DOP: GULSHAN RAMANIExecutive Producer: EHTESHAM HUSSEINLine Producer: FRESHWATER FILMS & TELEVISION Digital Intermediate: FULL FRAME FILMSColorist: SUNNY DHANJALOST “Papa Ji” credits: Music, LyricsRap: MALIK SAHABProgramming, Mixing, Mastering: SAURABH JAYProduction Controller: DILIP KANOJIAFirst Assistant: DEVENDRA SINGHSecond Assistants: TUSHAR RANJAN, VIDIT KANOJIALocal Co-ordinator: RAKESH BAZADAssociate Editor: JAYANTA BANERJEEGaffer: WASIM ANSARI Equipment Partner: PANASONIC LUMIX GH5Panasonic HOD: HITESH VIGPanasonic Attendants: NISHANT THAKUR, VIKAS SINGH, SUNIL GAWAIAdditional Equipment: VIDEO PLUSCamera Attendant: KRISHNANAND SINGHAssistant Sound Recordist: RAMESH JAISWALLocations: TATA MYST, KASAULI, WORKSHOP INC STUDIOS, IGI AIRPORT, NEW DELHITata Myst Team - Estate Manager: AJAY KUMARTech Exec: SAAHI DOHRUAR Hospitality: ANIL RAWATChefs: MUKESH PANDEY, RAJ KUMARRestaurant Incharge: VINOD PRADHANWaiters: Pradeep, BittySocial Media Manager: PRIYANKA PEREIRADrone Operator: RAKESH BAZADLight Equipment: IN INDIA FILMSLight Incharge: AVADESHLightmen: M.K, VIKESH, PANKAJ, RADHE, S.K, RAJUAccommodation: SAKET GUEST HOUSEDressman: SATISH YADAVProduction Boys: BAJRANGI THAKUR, DILIP SHARMA, RAJENDRA SHARMACostume Stylist: SHRUTI KOTHARIMake-Up: SANDESH GADEKARMake-up Assistant: AMIT SHAHHair Stylist: NASEEM ANSARIPost Production: WORKSHOP INC POST FACILITYBehind The Scenes Team: CHHAVI MITTAL, TUSHAR RANJAN, SUSHIL SHARMA, JAYANTA BANERJEEFood Supplier: TATA MYST, KASAULITravel Agent: ASHWINI TOURS & TRAVELSTransport: IN INDIA FILMSDrivers: GURDEEP SINGH, PRADEEPProperty Supplier: NATIONAL NOVELTYLocal Vendor: KANTA STORES (Kasauli)________________________________________This series was not possible without the support of:TATA HOUSING – MYST, Kasaulihttps://www.tatahousing.in/mystSPICEJET AIRLINEShttps://www.spicejet.com/AMITY UNIVERSITY ONLINEhttps://www.amityonline.com/amityonline/GROWW APPhttps://groww.in/THE  MOMS COhttps://themomsco.com/PANASONIC LUMIX GH5Follow SIT:Facebook: https://www.facebook.com/SITofficial/Twitter: https://twitter.com/TeamShittyIdeasInstagram: https://www.instagram.com/shittyideastrending/FOR BUSINESS INQUIRIES: info@shittyideastrending.comVisit us on www.shittyideastrending.com____________________________________________________CHHAVI MITTAL:https://www.facebook.com/chhavimittalofficial/?ref=br_rshttps://www.instagram.com/chhavihussein/https://twitter.com/chhavihussein_______________________________________________________MOHIT HUSSSEIN:https://www.facebook.com/mohithusseinsithttps://www.instagram.com/mohithussein/_______________________________________________________DISCLAIMER:THIS VIDEO WAS CREATED PURELY FOR ENTERTAINMENT PURPOSES ONLY. THE CHARACTERS, DIALOGUES, SITUATIONS & OTHER THINGS ARE PURELY FICTIONAL. ANY RESEMBLANCE TO A PERSON LIVING OR DEAD IS PURELY COINCIDENTAL. THIS CHANNEL DOES NOT CLAIM TO BE FACTUAL OR POLITICALLY CORRECT AT ALL TIMES. THE CONTENT IS FICTIONAL AND MEANT ONLY FOR ENTERTAINMENT. ANY OFFENCE CAUSED IS SUBJECTIVE AND DEEPLY REGRETTED.  CONSUMPTION OF ALCOHOL/SMOKING/DRUGS IS INJURIOUS TO HEALTH. NONE OF THE CREATORS OR ACTORS PROMOTES THE USE OF IT"
"VMUDetCb9d8","Analyzer | Exam Analysis Of IBPS CLERK PRE 2018 SHIFT- 2 (Review & Cut Off) 8th DECEMBER 2018","2018-12-08T07:43:49.000Z","UC1L2JoMpcY6MRLhFd3gg5Xg","Adda247 : Government Job in Your Pocket","27","18.09.12","ibps clerk prelims,ibps clerk 2018,ibps clerk prelims 2018,ibps clerk prelims 2018 exam analysis,ibps clerk exam analysis,ibps clerk prelims exam review,ibps clerk question paper,ibps 2018,ibps clerk prelims 8 december analysis,ibps clerk prelims shift 1,bank clerk exam analysis,ibps clerk prelims question paper,ibps clerk prelims expected cutoff,ibps clerk prelims questions,clerk prelims analysis,ibps clerk,clerk prelims 2018 paper,ibps","69791","1653","73","196","https://i.ytimg.com/vi/VMUDetCb9d8/default.jpg","False","False","To Know More about IBPS PO 2018 exam, pattern, syllabus & exam date, visit:  http://www.bankersadda.com/p/ibps-po.htmlTo Know More about Ssc cgl exam pattern syllabus and exam date visit  http://www.sscadda.com/p/ssc-cgl.htmlTo Know More about Teaching Job exam pattern syllabus and exam date , visit ::;https://www.teachersadda.co.in/Aspirants, Adda247 is Now In Telegram, Join Our Telegram Group -@Adda247youtube  https://t.me/adda247youtube For All the Updates and Notifications. Hurry!!Join Now Official Telegram Channel of Bankersadda - https://t.me/bankersadda_OfficialJoin Now Official Telegram Channel of SSC Adda - https://t.me/sscadda_officialPLAYLIST FOR BANK AND SSC EXAMS - https://www.youtube.com/channel/UC1L2JoMpcY6MRLhFd3gg5Xg/playlistsAdda247 Youtube channel is India's most popular channel for Online Coaching for IBPS Bank PO Exams and Online Coaching for SSC CGL. 1.To buy Banking & SSC Latest Pattern Video Courses of Adda247 - at Online Streaming, SD Card or Tablet click here - https://store.adda247.com/#!/videos/list To Buy Adda247 Test Series Click Here - https://store.adda247.com/#!/testseries/listTo Buy Adda247 Books Click Here -https://store.adda247.com/#!/books/list2. Download Adda247 App (India's No.1 App for Bank & SSC Exams) - http://bit.ly/adda247 3. To get all latest videos in your mailbox, subscribe to our youtube channel - https://www.youtube.com/adda247live 4. Get all updates on facebook, like us our facebook page - https://www.facebook.com/adda247live 5. Join us at twitter - https://twitter.com/adda247live"
"xA29cTi9K50","Sembarathi - செம்பருத்தி | Preview | Episode - 341 | 07/12/18 | Zee Tamil","2018-12-07T08:10:22.000Z","UC_wIGmvdyAQLtl-U2nHV9rg","Zee Tamil","24","18.09.12","Sembarathi,Sembarathi zee tamil,Sembarathi full episodes,Sembarathi best scenes,Sembarathi webisodes,sembaruthi today promo,sambarathi latest scnene today,sembarathi today videos,tamil best serial 2018,#tamil serials,zee tamil,zee tamil serials,zee tamil shows,tamil tv serials,tamil tv shows,zee tamil live,watch online free,#drama,Zee tamil entertainment,#Story,zee5","401353","1921","173","106","https://i.ytimg.com/vi/xA29cTi9K50/default.jpg","False","False","ZEE5 Now Available in 190+ Countries, Click Here: http://bit.ly/WatchNowOnZEE5To watch FULL episode of Sembarathi, CLICK here - https://www.zee5.com/tvshows/details/sembarathi/0-6-675Watch Latest Zee Tamil Serials & Shows Full Episodes Online on ZEE5 App. Please Click below to DOWNLOAD the ZEE5 app: - Playstore: https://play.google.com/store/apps/details?id=com.graymatrix.did- iTunes: https://itunes.apple.com/in/app/ozee-tv-shows-movies-more/id743691886Visit our website - https://www.zee5.com For more  Latest Updates Connect with us on Social Media: - Facebook - https://www.facebook.com/ZEE5/ - Instagram - https://www.instagram.com/zee5 - Twitter - https://twitter.com/ZEE5IndiaSembarathi is a Tamil romantic family television series starring Priya Raman, Shabanaa and Karthik in the lead. This is a story of a poor girl Parvathi, whose father works as a driver to Akhilandeshwari, who is rich and arrogant woman. The journey of hardships that Parvathi goes through, after she is married to Adithya, son of Akhilandeshwari, is something you can’t give a miss.#tamil #zeetamil #zeetamilserials #tamilserials #tamiltvserials #tamizhserials #zeeserials #ztamil #tamiltvshow #tamilnadagam #tamilentertainment #tamilcomedy"
"anINyt3zBo8","प्राइम टाइम इंट्रो : अलग-अलग एग्ज़िट पोल से क्या नतीजे निकलते हैं?","2018-12-07T15:47:11.000Z","UC9CYT9gSNLevX5ey2_6CK0Q","NDTV India","25","18.09.12","Prime time,intro,ravish kumar,exit polls,poll of polls,ndtv india,Exit Poll,Poll of exit polls,Exit Poll 2018,Election Exit Poll,Opinion Poll,Election 2018 Exit Poll,Exit Polls,Exit Polls 2018,Exit poll Madhya Pradesh,Exit poll Chhattisgarh,Exit poll Rajasthan,Exit poll results,Exit poll result,Ravish Kumar","875558","30424","1906","4414","https://i.ytimg.com/vi/anINyt3zBo8/default.jpg","False","False","हर चुनाव में एग्ज़िट पोल की कुछ कंपनियां गायब हो जाती हैं और कुछ नई आ जाती हैं. अच्छा एक और बात. एक बदवाल आया है. रिपब्लिक टीवी ने तो दो अलग अलग एजेंसियों से एग्ज़िट पोल कराया है. एक का नाम है सी-वोटर और एक का नाम है जन की बात. उम्मीद है रिपब्लिक टीवी में दोनों एजेंसियों के लोगों को एक कमरे में नहीं बिठाया गया होगा. तो अब आते हैं मध्य प्रदेश के एग्ज़िट पोल के नतीजों पर. मध्यप्रदेश में 230 सीटों के लिए चुनाव हुए हैं. सरकार बनाने के लिए 116 सीटें चाहिए. पिछली विधानसभा में बीजेपी के पास 165 सीटें थीं और कांग्रेस के पास 58.NDTV is one of the leaders in the production and broadcasting of un-biased and comprehensive news and entertainment programmes in India and abroad. NDTV delivers reliable information across all platforms: TV, Internet and Mobile.Subscribe for more videos: https://www.youtube.com/user/ndtv?sub_confirmation=1Like us on Facebook: https://www.facebook.com/ndtvFollow us on Twitter: https://twitter.com/ndtvDownload the NDTV Apps: http://www.ndtv.com/page/appsWatch more videos: https://khabar.ndtv.com/videos?yt"
"xfIITm_Nquo","Jodi Fun Unlimited | 8th & 9th December 2018 - Promo 2","2018-12-06T08:14:10.000Z","UCvrhwpnp2DHYQ1CbXby9ypQ","Vijay Television","24","18.09.12","Star,Star Vijay TV,Vijay TV,Vijay,Redefining Entertainment,தமிழ்,விஜய்,டிவி,தொலைக்காட்சி,Tamil TV,Tamil Shows,Jodi,ஜோடி","678830","10717","471","510","https://i.ytimg.com/vi/xfIITm_Nquo/default.jpg","False","False","#Jodi #FunUnlimited #VijayTV #VijayTelevision #StarVijayTV #StarVijay #TamilTV  Jodi Fun Unlimited - சனி மற்றும் ஞாயிறு இரவு 8:30 மணிக்கு உங்கள் விஜயில்.. Click here https://www.hotstar.com/tv/jodi-fun-unlimited/s-135 to watch the show on hotstar."
"zlBeMz0_K-Q","Neelakkuyil || General Promo || Mon to Sat at 7:30 PM || Asianet","2018-12-08T09:21:59.000Z","UCp_r6Z-Oh0YTf-ym71z5Nqg","Asianet","24","18.09.12","asianet,malayalam channel,tv show,malayalam serial,entertainment,Neelakkuyil || General Promo || Mon to Sat at 7:30 PM || Asianet","102566","202","59","47","https://i.ytimg.com/vi/zlBeMz0_K-Q/default.jpg","False","False","Neelakkuyil || General Promo || Mon to Sat at 7:30 PM || AsianetWatch All Shows: http://www.hotstar.com/asianetFollow Us On Facebook - https://www.facebook.com/Asianet                        Instagram - https://www.instagram.com/asianet                        Twitter - https://twitter.com/asianet"
"WL2KA6cIIOw","இரண்டு புதுவித டிபன் | 2 min instant breakfast recipes | quick and easy breakfast recipes | Indian","2018-12-07T05:48:43.000Z","UC9oPCWZ6Wh5WG68YcEmCXNA","Papa's Kitchen","2","18.09.12","instant breakfast recipes | quick and easy breakfast recipes | healthy breakfast recipes,breakfast recipes,instant breakfast recipes indian,instant dosa recipes south indian,instant dosa recipes indian,healthy breakfast ideas,2 min recipes,Papa's Kitchen,Madras samayal Breakfast Recipes,dosa,pizza,dosa pizza,sandwich,how,to,Make,cook,prepare,Snacks,famous street food,youtube","175236","1655","220","196","https://i.ytimg.com/vi/WL2KA6cIIOw/default.jpg","False","False","instant breakfast recipes | quick and easy breakfast recipes | healthy breakfast recipes | Breakfast Recipes Indian , #EasyBreakfast #HealthyBreakfast #YouTubeBreakFast#InstantBreakFastRecipes #PapasKitchen💥 Bread Pizza 👇  https://youtu.be/quM3-QzXqNA💥Normal pizza without oven 👇 https://youtu.be/EgseOcFlhJQ😍 Don't Miss it ❣️"
"G_zp63DdHik","Tula Pahata Song Video - Mumbai Pune Mumbai 3 | New Marathi Song 2018 | Swapnil Joshi, Mukta Barve","2018-12-06T11:13:20.000Z","UCe7UKRSJM6ITMfXX-CbET0w","Everest Marathi","10","18.09.12","marathi,marathi movies,new marathi movies,new marathi songs,marathi songs 2018,marathi songs,marathi movie,new marathi songs 2018,marathi movie 2018,मराठी,marathi movies 2018,new marathi movies 2018,mumbai pune mumbai 3,mumbai pune mumbai,Swapnil Joshi,Mukta Barve,mumbai pune mumbai 3 trailer,mumbai pune mumbai 3 teaser,marathi song,marathi song मराठी गाणी,Tula Pahata,mumbai pune mumbai 3 songs,hrishikesh ranade songs,Avinash Vishwajeet","488153","9094","234","244","https://i.ytimg.com/vi/G_zp63DdHik/default.jpg","False","False","This Season, Celebrate Life..!! Presenting New Marathi Song 2018 Tula Pahata from most awaited Marathi Movie Mumbai Pune Mumbai 3 मुंबई पुणे मुंबई ३ staring Swapnil Joshi, Mukta Barve, Prashant Damle.Song beautifully sung by Hrishikesh Ranade. Song Composed by Avinash Vishwajeet and Lyrics are penned by Vishwajeet Joshi & Jay Atre. Sure you will love it.Subscribe/सबस्क्राईब on below link for Mumbai Pune Mumbai 3 Movie Video Updates.http://bit.ly/EverestMarathiPopular Videos► Mumbai Pune Mumbai 3 Trailer - https://youtu.be/7U70c9_Ed8k► Kuni Yenar Ga Song - https://youtu.be/vUUDfkBT4zs► Ka Kalena Song - https://youtu.be/FupW3gNXowI► Kadhi Tu Song - https://youtu.be/VYdWSp8pIjg► Saath De Tu Mala Song - https://youtu.be/i0Cj7FwEDnY► Band Baja Song - https://youtu.be/Ofm-iIAFsSITo Set 'Tula Pahata' as your Mobile CallerTune SMS MUPUMU3 to 56060Set 'Tula Pahata' song as your Mobile Callertune (India Only)Vodafone Subscribers Dial 53710842917Idea Subscribers Dial 5678910842917BSNL (South / East) Subscribers sms BT 10842917 To 56700BSNL (North / West) Subscribers sms BT 7199943 To 56700Song Credits:Singer: Hrishikesh RanadeMusic: Avinash Vishwajeet Lyrisist: Vishwajeet Joshi & Jay AtreProgramming & Arrangements: Avinash Vishwajeet Harmonium: Avinash Chandrachud,Guitar: Somu SealTabla: Prasad PadhyeMovie Credits:Cast: Swapnil Joshi, Mukta Barve, Prashant Damle, Mangal Kenkre, Vijay Kenkre, Savita PrabhuneDirector: Satish RajwadeProducer: Sanjay ChhabriaAssociate Producer: Amit BhanushaliStory: Pallavi RajwadeScreenplay: Ashwini Shende, Pallavi Rajwade, Satish RajwadeDialogues: Ashwini Shende, Pallavi RajwadeMusic Director: Avinash Vishwajeet, Nilesh MoharirSong Lyrics:तुला पाहता आजही , हासते या मनी चांदणेबहरुन प्रीत ये अशीगाली पडे खळी जशी साथ तुझी मला हवी जीवनीओंजळीतूनी भरूनी जो आणतो, सुख नवे,पाऊस तो पहिला,ओळखीतल्या वाटती बरसत्या सरी नव्या,स्पर्श तुझा होता,जरा जरा लाजरे,तुझ्या सवे साजरे,ॠतूंचे खरे सोहळे,ॠतूंचे खरे सोहळे,बहरून प्रीत ये अशी,गाली पडे खळी जशी,साथ तुझी मला हवी जीवनी...सावली तुझी भासते मी जिथे तू तिथे,बंध हे जन्मांचे,पापणीवरी गुंफते माळते रात ही,रंग हे स्वप्नांचेहळू हळू जोडले,हळू हळू जोडलेमनाने मनाशी दुवे,बहरून प्रीत ये अशी,गाली पडे खळी जशी,साथ तुझी मला हवी जीवनी...Enjoy & Stay connected with us!YouTube: http://bit.ly/EverestMarathiFacebook: https://facebook.com/EverestEntertainmentTwitter: https://twitter.com/everestmarathiInstagram: https://instagram.com/everestentertainmentWebsite: https://www.everestent.in#MumbaiPuneMumbai3 #MarathiSongs"
"DS9-zGmlQco","Priyanka Chopra In First Interview After Wedding Talks About Her Tech Investment Bumble","2018-12-05T14:04:35.000Z","UCZFMm1mMw0F81Z37aaEzTUA","NDTV","24","18.09.12","Priyanka Chopra,Priyanka Chopra's interview,Priyanka Chopra's wedding,Priyanka Chopra's marriage,Nick Jonas,ndtv 24x7,bollywood,priyanka chopra husband,First Interview,Exclusive Interview,Piggy,Piggy Chopra,Priyanka and Nick,nickyanka wedding,priyanka chopra speaksafter wedding,BUMBLE,PRIYANKA NEW BUSINESS BUMBLE,Nick Jonas Wife,Nick wife","988371","9168","1149","1440","https://i.ytimg.com/vi/DS9-zGmlQco/default.jpg","False","False","In her first interview since her wedding with American singer Nick Jonas, Priyanka Chopra spoke about her investment in dating app Bumble. Calling herself a tech fan and someone who loves doing things out of the box, Priyanka said that she thought that the app would be an incredible platform for women.NDTV is one of the leaders in the production and broadcasting of un-biased and comprehensive news and entertainment programmes in India and abroad. NDTV delivers reliable information across all platforms: TV, Internet and Mobile.Subscribe for more videos: https://www.youtube.com/user/ndtv?sub_confirmation=1Like us on Facebook: https://www.facebook.com/ndtvFollow us on Twitter: https://twitter.com/ndtvDownload the NDTV Apps: http://www.ndtv.com/page/appsWatch more videos: http://www.ndtv.com/video?yt"
"7N-D4hDscEw","Toronto : Jass Manak | Priya (Official Song) Gangland In Motherland | Latest Punjabi Song | Geet MP3","2018-12-04T13:01:58.000Z","UClZF7OsrECe3t_ADrjZEh_Q","Geet MP3","10","18.09.12","deep jandu,deep jandu music,deep jandu new song,gangland in motherland,gangland,new punjabi song,new punjabi song 2018,latest punjabi songs,latest punjabi song 2018,gangland web series,gangland punjabi web series,geetmp3,gk digital,toronto jass manak,jass manak toronto,toronto song,toronto song 2018,toronto,jass manak new song,jass manak,jass manak song,priya,priya verma,punjabi songs,punjabi latest songs,web series,punjabi web series,jass,guri","9871471","300265","13724","16484","https://i.ytimg.com/vi/7N-D4hDscEw/default.jpg","False","False","GeetMp3 & The Theater Army Films 🎥 Subscribe To Our New Channel For New Songs  : http://bit.ly/SubscribeGEETMP3Audio Available On Gaana : http://bit.ly/2Edc7WTThe Gangland in Motherland Punjabi Webseries 1st Episode 19 December 6PM Song : TorontoSinger : Jass Manak & Priya Lyrics : Jass ManakComposer : Jass Manak Music : Deep Jandu Gangland In Motherland Casting Dirctor/Story : Gabbar Sangrur Screenplay : Gabbar & Baljit NoorProducer : Kv Dhillon Starring : Nishawn Bhullar, Mehtab Virk, Vadda Grewal, Yaad Grewal, Japji Kharia, Victor Jhon, Navdeep Kaler Editor : Sarabjeet SohalCinematography : Shoeb SiddiquiSingers : Nishawn Bhullar, Guri, Jass Manak, Vadda Grewal, Mehtab Virk Music : Deep Jandu, Sharry Nexus, Game Changerz Background : Mix Singh Online Promotion : Gk.DigitalMusic Label : Geet MP3Music Consultant & Digital Partner : Gk.DigitalInstagram : https://www.instagram.com/GK.DIGITALEnjoy and stay connected with us 📲https://www.youtube.com/channel/UClZF7OsrECe3t_ADrjZEh_Q/joinWebsite : http://GeetMP3.comYouTube : https://www.youtube.com/c/GeetMP3 Facebook : https://www.facebook.com/GEETMP3OFFICIALInstagram : https://www.instagram.com/GEETMP3Twitter : https://twitter.com/GEETMP3SnapChat : https://www.snapchat.com/add/GEETMP3"
"Q04xy7sMBoE","Aai, Me & Dating | #BhaDiPa","2018-12-06T14:30:04.000Z","UCUw8vQF-X7CJqdVpxBYcavQ","Bharatiya Digital Party","23","18.09.12","bhartiya digital party,bhadipa latest,marathi web series,dating,tinder,sex,relationship,veg kanya,alok rajwade,sarang sathaye,parna pethe,mrinmayee godbole,marathi celebrity,narcos,pubg,boyfriend,girlfriend,single,aai ani me,mi,mum,mother,tinder bio,mingle,swipe right,love,dirty tinder,pick up lines,tinder gold,superlike","329175","18082","350","861","https://i.ytimg.com/vi/Q04xy7sMBoE/default.jpg","False","False","When Aai gets too involved in your dating life! (How Ani met Babdu)Tinder is the world's best app to meet new peopleDownload Tinder here - https://bit.ly/2RAzc94Subscribe to BhaDiPa to get alerts on our new videos! शास्त्र असते ते ! #BhaDiPa Stickers, Mugs, T-Shirts and more here: https://www.thesouledstore.com/artists/bhadipaFollow us on :https://www.facebook.com/BhaDiPahttps://www.twitter.com/BhaDiPahttps://www.instagram.com/BhaDiPaCastAai: Renuka Daftardar Ani: Alok RajwadeJui: Mrinmayee GodboleBabdu : Parna PetheBabbu: Sarang SathayeCrewSponsors: TinderWriter: Savani Vaze, Varun NarvekarDirector: Abhay Raut, Omkar JadhavCreative Producer: Anusha NandakumarAssistant Director: Vinay PanditCamera: Aditya DivekarLocation Sound: Sourabh Morgaonkar and Prasad MoreEdit & Sound: Abhay RautProduction: Tejas Limaye, Vaishnavi GokhaleLocation Courtesy: Rohan ShedbalkarMusic:Strange Precident: Silent PartnerDog and Pony Show - Silent Partner https://youtu.be/Dw20ZkMwI10"
"6rT41CFJEjo","राधाकृष्ण | राधा को कृष्ण के मोह ने साधा","2018-12-08T16:30:00.000Z","UCCy2rLnGdwoJcSAtixNdsPQ","STAR भारत","22","18.09.12","promo,radha krishn,radha,krishn,love story,love,प्रोमो,राधाकृष्ण,राधा,कृष्ण,प्रेम,स्टार भारत,प्रेमगाथा","136518","4060","41","255","https://i.ytimg.com/vi/6rT41CFJEjo/default.jpg","False","False","क्या राधा को हो रहा है कृष्ण से मोह?देखना न भूलें राधाकृष्ण, सोम-शनि, रात 9 बजे, सिर्फ़ STAR भारत पर!#राधाकृष्ण | #RadhaKrishn"
"RyUMdmlJIyc","Powder illama naan illa FUN FILLED Tamilisai HANDBAG Secrets | What's Inside the HANDBAG","2018-12-07T15:30:36.000Z","UCSbUX_gKMur5FPcTbH2L5mA","Galatta Tamil | கலாட்டா தமிழ்","24","18.09.12","galatta tamil handbag,Tamilisai Handbag,galatta tamil handbag secrets,tamilisai soundararajan,galatta handbag,tamilisai soundararajan comedy,tamilisai trolls,tamilisai memes,tamilisai soundararajan interview,vj ashiq handbag,tamilisai,tamilisai troll,bjp,what is inside your handbag,handbag,தமிழிசை,Tamilisai Soundararajan HANDBAG Secrets,Tamilisai handbag secrets,pm modi,what's in my bag,tamilisai interview","246518","5339","975","1373","https://i.ytimg.com/vi/RyUMdmlJIyc/default.jpg","False","False","Powder illama naan illa FUN FILLED Tamilisai HANDBAG Secrets | What's Inside the HANDBAGStay tuned to Galatta Tamil for latest updates on Cinema and Politics. Like and Share your favourite videos and Comment your views too. Subscribe to GALATTA TAMIL : http://goo.gl/J4TyOo#Tamilisai #HANDBAG #WhatsInsidetheHANDBAGAlso, Like and Follow us on:Facebook: https://www.facebook.com/GalattaMediaTwitter: https://twitter.com/galattadotcomWebsite: http://www.galatta.comInstagram: https://www.instagram.com/stories/galattadotcom/"
