video_id,title,publishedAt,channelId,channelTitle,categoryId,trending_date,tags,view_count,likes,dislikes,comment_count,thumbnail_link,comments_disabled,ratings_disabled,description
"0LHxvxdRnYc","Marvel Studios' Captain Marvel - Trailer 2","2018-12-04T02:43:35.000Z","UCvC4D8onUfXzvjTOM-dBfEA","Marvel Entertainment","24","18.04.12","marvel,comics","7751436","415948","17543","56405","https://i.ytimg.com/vi/0LHxvxdRnYc/default.jpg","False","False","Learn More at https://www.marvel.com/movies/captain-marvel► Subscribe to Marvel: http://bit.ly/WeO3YJFollow Marvel on Twitter: ‪https://twitter.com/marvelLike Marvel on FaceBook: ‪https://www.facebook.com/MarvelFor even more news, stay tuned to:Tumblr: ‪http://marvelentertainment.tumblr.com/Instagram: https://www.instagram.com/marvelGoogle+: ‪https://plus.google.com/+marvelPinterest: ‪http://pinterest.com/marvelofficial"
"i25i6vyjIpg","World Record Exercise Ball Surfing | Overtime 6 | Dude Perfect","2018-12-03T22:54:24.000Z","UCRijo3ddMTht_IHyNSNXpNQ","Dude Perfect","17","18.04.12","dude perfect,dude perfect stereotypes,dude perfect water bottle flip,bottle flip,water bottle flip,dude perfect bottle flip,dude perfect basketball,dp,dude perfect world record,edition,nerf,trick shots,trick shot,family,ping pong,bowling,clean,family friendly,bubble wrap,soccer,football,spinner,spinners,fidget spinners,dude,overtime,cool not cool,absurd,recurds,taste,test,betcha,bet,ya,swimming,swim,mile,long,olympics,coffee,paintings,thermal","6003486","220954","5790","16308","https://i.ytimg.com/vi/i25i6vyjIpg/default.jpg","False","False","From rolling on exercise balls to a freezing cold mile-long swim, this episode of Overtime has it all!► Click HERE to subscribe to Dude Perfect! http://bit.ly/SubDudePerfect► Click HERE to watch our most recent videos! http://bit.ly/NewestDudePerfectVideoshttp://bit.ly/NewestDPVideos► SHOP our NEW Merchandise! - http://bit.ly/DPStore►Click HERE to join the exclusive Dude Perfect T-Shirt Club! http://bit.ly/DPTShirtClubPlay our NEW iPhone game!► PLAY Endless Ducker on iPhone -- http://smarturl.it/EndlessDucker► PLAY Endless Ducker on Android -- http://smarturl.it/EndlessDucker► VISIT our NEW STORE - http://bit.ly/DPStore► JOIN our NEWSLETTER - http://bit.ly/DPNewsletterEndCard► WATCH our STEREOTYPES - http://bit.ly/StereotypesPlaylistIn between videos we hang out with you guys on Instagram, Snapchat, Twitter, and Facebook so pick your favorite one and hang with us there too!http://Instagram.com/DudePerfecthttp://bit.ly/DudePerfectSnapchathttp://Twitter.com/DudePerfecthttp://Facebook.com/DudePerfectDo you have a GO BIG mindset? See for yourself in our book Go Big. ►http://amzn.to/OYdZ2sA special thanks to those of you who play our iPhone Games and read our book. You guys are amazing and all the great things you tell us about the game and the book make those projects so worthwhile for us! Dude Perfect GAME - http://smarturl.it/DPGameiPhoneDude Perfect BOOK - Go Big - http://amzn.to/OYdZ2sClick here if you want to learn more about Dude Perfect:http://www.dudeperfect.com/blog-2/Bonus points if you're still reading this! Comment: “I like how Ty always has a different signature entrance haha”As always...Go Big and God Bless!- Your friends at Dude PerfectBusiness or Media, please contact us at: Dude@DudePerfect.com------------5 Best Friends and a Panda.If you like Sports + Comedy, come join the Dude Perfect team!Best known for trick shots, stereotypes, battles, bottle flips, ping pong shots and all around competitive fun, Dude Perfect prides ourselves in making the absolute best family-friendly entertainment possible! Welcome to the crew! Pound it. Noggin. - Dude Perfect"
"FzfKn-hlZwo","The 1975 - It's Not Living (If It's Not With You) Official Video","2018-12-03T16:58:34.000Z","UCH_YpPVrF7Kzjew8rB2cdjg","The1975VEVO","10","18.04.12","The,1975,It's,Not,Living,(If,With,You),Polydor,Records,Alternative","567067","73502","482","4749","https://i.ytimg.com/vi/FzfKn-hlZwo/default.jpg","False","False","The 1975 - It's Not Living (If It's Not With You) Official VideoA Brief Inquiry Into Online Relationships Out Now: https://The1975.lnk.to/ABIIORVDDirected by Warren Fu"
"aLcJZ6OhxAw","Dalton and James Arthur duet on X Factor Final | Final | The X Factor UK 2018","2018-12-02T20:36:51.000Z","UCEY1ejsweY4DgMwOVJeEaBA","The X Factor UK","24","18.04.12","the x factor,x factor,X factor UK,x factor 2018,simon cowell,robbie williams,auditions judges season 15,series 15,X Factor UK 2018,X Factor 2018 audition,The x factor 2018,XFactor 2018,louis Tomlinson,Ayda Field,DALTON HARRIS,JAMES ARTHUR,JAMES ARTHUR X FACTOR,DALTON X FACTOR,THE POWER OF LOVE,X FACTOR FINAL","994493","30624","649","0","https://i.ytimg.com/vi/aLcJZ6OhxAw/default.jpg","True","False","Visit the official site: http://itv.com/xfactorTwo contrasting styles, one superb performance, Dalton Harris and James Arthur perform The Power Of Love at the X Factor Final. SUBSCRIBE: http://bit.ly/TXFSubFacebook: http://bit.ly/TXFFBTwitter: http://bit.ly/TXFTwiDownload The X Factor mobile app: http://bit.ly/TXFappWatch full episodes on ITV Hub (UK ONLY): http://www.itv.com/hub/the-x-factor"
"gl1aHhXnN1k","Ariana Grande - thank u, next","2018-11-30T19:58:22.000Z","UC0VOyT2OCBKdQhF3BAbZ-1g","ArianaGrandeVevo","10","18.04.12","Ariana,Grande,thank,next,Republic,Records,Pop","104047158","6190196","210429","532658","https://i.ytimg.com/vi/gl1aHhXnN1k/default.jpg","False","False","thank u, next (Official Video)Song available here: https://arianagrande.lnk.to/thankunextYDDirected by Hannah Lux DavisProduced by Brandon Bonfiglio Edited by Hannah Lux Davis & Taylor Tracy WalshProduction Company: London AlleyExecutive Producers: Brandon Bonfiglio, Luga Podesta, Andrew LeriosColorist: Bryan SmallerFeaturing (in alphabetical order)Colleen BallingerJonathan BennettMatt BennettCourtney ChipoloneJennifer CoolidgeGabi DeMartinoStefanie DrummondElizabeth GilliesToulouse GrandeKris JennerAlexa LuriaDaniella MonetVictoria MonetScott NicholsonTayla ParxTroye SivanMusic video by Ariana Grande performing thank u, next. © 2018 Republic Records, a Division of UMG Recordings, Inc.http://vevo.ly/dFKirk"
"6OLpwr4AN-g","Tyson Fury was the superior boxer vs. Deontay Wilder- Stephen A. | First Take","2018-12-03T18:39:13.000Z","UCiWLfSweyRNmLpgEHekhoAg","ESPN","17","18.04.12","wilder fury,deontay wilder,tyson fury,deontay wilder tyson fury,wilder vs fury,boxing,anthony joshua,deontay wilder vs tyson fury,wilder fury face-off,tyson fury vs deontay wilder,fury,fury vs wilder,wilder knockout,fury wilder,showtime boxing,boxing espn,showtime,heavyweight,deontay wilder fight,wilder vs. fury,stephen a smith on deontay wilder,first take wilder fury,stephen a on fury,max kellerman on wilder,kellerman on wilder fury,espn,espn live","1001155","12193","762","6430","https://i.ytimg.com/vi/6OLpwr4AN-g/default.jpg","False","False","Stephen A. Smith and Max Kellerman break down Deontay Wilder and Tyson Fury's heavyweight bout which concluded in a draw and discuss why Wilder had the superior punching power but wasn't as skilled of a boxer as Fury.✔ Subscribe to ESPN on YouTube: http://es.pn/SUBSCRIBEtoYOUTUBE✔ Subscribe to ESPN FC on YouTube: http://bit.ly/SUBSCRIBEtoESPNFC✔ Subscribe to NBA on ESPN on YouTube: http://bit.ly/SUBSCRIBEtoNBAonESPN✔ Watch ESPN on YouTube TV: http://es.pn/YouTubeTVESPN on Social Media:► Follow on Twitter: http://www.twitter.com/espn► Like on Facebook: http://www.facebook.com/espn► Follow on Instagram: http://www.instagram.com/espnVisit ESPN on YouTube to get up-to-the-minute sports news coverage, scores, highlights and commentary for NFL, NHL, MLB, NBA, College Football, NCAA Basketball, soccer and more. More on ESPN.com: http://www.espn.com"
"2RQH5Ycj1C8","Being the Best/Worst Ever","2018-12-02T19:03:16.000Z","UCGwu0nbY2wSkW8N-cghnLpA","Jaiden Animations","1","18.04.12","jaiden,animations,jaidenanimation,jaidenanimations,self improvement,self improvement jaiden animation","2257492","203065","2647","44009","https://i.ytimg.com/vi/2RQH5Ycj1C8/default.jpg","False","False","life, amirite?♥ The Team ♥Atrox: https://twitter.com/AtroxChobatsuDenny: https://www.instagram.com/90percentknuckles/DavidBaronArt: http://davidbaronart.tumblr.com/Pivots: https://www.youtube.com/user/ThePivotsXXDMorganToast: https://www.youtube.com/channel/UCHimPYk1csmmOSGKF4pKelgDuckdee: https://www.youtube.com/channel/UCvS5en9GP_XSYwgzNReHNTQDevon: https://www.instagram.com/devonkong/GinjaNinja: https://www.youtube.com/user/GinjaNinjaOwOJaystarz: https://www.youtube.com/xjaystarzx------------------------------------------------------------------------------------SUBSCRIBE for more animations!https://www.youtube.com/c/jaidenanimationsMERCH:https://jaidenanimations.com/TWITTER:https://twitter.com/JaidenAnimationINSTAGRAM:https://instagram.com/jaiden_animations/DEVIANTART:http://jaidenanimations.deviantart.com/Behind the Scenes:https://www.patreon.com/jaidenanimations?ty=hIf you're an animator, artist, gamer, or entertainer, then join us at Channel Frederator Network: https://frdr.us/JaidenWanna Send Fanart?You can send it to me through Twitter or DeviantArt (links above)------------------------------------------------------------------------------------Music: Assembly Line Frustration by ionicsBaseball montage: https://www.youtube.com/watch?v=BnmglWHoVrk&list=PLMFmJLFhkDPG6le5JoCJbWK8pQM6tU_TBPiano montage by www.bensound.com------------------------------------------------------------------------------------And this tells me you read the description, which means you respect what I have to say! Thank you :D ...come here often?"
"ecH2gANpUtU","RALPH BREAKS THE INTERNET | Meet Eboy, Voiced by DanTDM! | Official Disney UK","2018-12-02T08:30:00.000Z","UCQphRgAhj5UxktrQNP3WF5g","Disney UK","1","18.04.12","DanTDM,dantdm fortnite,make a wish,ebay,ralph breaks the internet,charity,dantdm videos,vanellope,disney,disney uk,ku yensiD,ralph,ralph 2,wreck it ralph 2,wreck it ralph fortnite,make a wish foundation,wreck it ralph,vanellope von schweetz,ralph wrecks the internet,trailer 2018,Disney Magic UK,Movie,Movies,Disney Movies,Disney Official,Walt Disney,Walt Disney Studios,watch,cinema,new,john c reilly,2018","982943","20344","755","4383","https://i.ytimg.com/vi/ecH2gANpUtU/default.jpg","False","False","Meet Eboy from Ralph Breaks the Internet, voiced by DanTDM! Watch Ralph and Vanellope's latest adventure now in UK cinemas! To celebrate the UK release of Ralph Breaks The Internet, Disney UK are joining forces with Ebay UK and DanTDM to raise awareness and donations for Make A Wish UK who grant life-changing wishes. Together, we can create more moments that matter for seriously ill children and their families when they need it the most. eBay UK https://www.ebay.co.uk/rpp/ralphbreakstheinternet Make A Wish UK https://www.make-a-wish.org.uk/RalphBreaksTheInternet DanTDM https://www.youtube.com/user/TheDiamondMinecart Subscribe to Disney UK for new Disney videos! ► http://dis.ne/subscribe-to-disney  Follow @Disney_UK on Twitter ► https://twitter.com/Disney_UK Like our official Facebook page ► https://www.facebook.com/DisneyUK Follow @DisneyUK on Instagram ► https://www.instagram.com/disneyuk The Disney UK YouTube channel brings you a wealth of official video content from all the Disney movies and characters you know and love. Do you want to learn more about your favourite Disney and Pixar movies? Subscribe to our channel to watch the latest trailers and clips, you'll be the first to see features for current and upcoming Walt Disney Studios Films and even get to watch exclusive interviews with the stars. Dig into our back catalogue for great Disney videos from classic animations through to modern day Disney & Pixar classics such as Frozen and Inside Out."
"u7YsYX8-AaQ","'WILDER GOT EXPOSED - TYSON FURY WON THAT!!' - LENNOX LEWIS REACTS TO WILDER v FURY DRAW","2018-12-02T08:29:53.000Z","UCdl_gZZR6BtKi45eHFGAduw","iFL TV","17","18.04.12","'WILDER GOT EXPOSED - TYSON FURY WON THAT!!' - LENNOX LEWIS REACTS TO WILDER v FURY DRAW","664050","8164","466","3642","https://i.ytimg.com/vi/u7YsYX8-AaQ/default.jpg","False","False","'WILDER GOT EXPOSED - TYSON FURY WON THAT!!' - LENNOX LEWIS REACTS TO WILDER v FURY DRAWBY KUGAN CASSIUSDon’t miss the action – tune into BoxNation, Sky Sports and BT Sports and watch the fights live. Not signed up? You’ll find the best offers for new and existing UK customers here:Sky CustomersNEW - http://tidd.ly/e11e34aaEXISTING - http://tidd.ly/d23d458fBT CustomersNEW - http://tidd.ly/90e75d54  TalkTalk  NEW - http://tidd.ly/2d34a477"
"aZTbtTmGsws","Charlie's Grandparents - SNL","2018-12-02T07:06:28.000Z","UCqFzWxSCi39LnW1JKFR3efg","Saturday Night Live","24","18.04.12","nbc,snl,saturday night live,snl host,snl 44,snl season 44,season 44,claire foy,aidy bryant,kyle mooney,heidi gardner,kate mckinnon,movie parody,willy wonka and the chocolate,s44,s44e7,episode 7,live,new york,comedy,sketch,funny,hilarious,late night,host,music,laugh,impersonation,musician,Claire Foy,The Crown,Unsane,First Man,The Girl in the Spider’s Web,Lisbeth Salander","787600","12784","796","610","https://i.ytimg.com/vi/aZTbtTmGsws/default.jpg","False","False","Charlie Bucket (Claire Foy) gets out of work a little too early and interrupts his grandparents' good nights in their shared bed in a scene from Willy Wonka & the Chocolate Factory.#SNL #ClaireFoy #AndersonPaak #SNL44Subscribe to SNL: https://goo.gl/tUsXwMGet more SNL: http://www.nbc.com/saturday-night-liveFull Episodes: http://www.nbc.com/saturday-night-liv...Like SNL: https://www.facebook.com/snlFollow SNL: https://twitter.com/nbcsnlSNL Tumblr: http://nbcsnl.tumblr.com/SNL Instagram: http://instagram.com/nbcsnlSNL Pinterest: http://www.pinterest.com/nbcsnl/"
"1yB0LWhfglQ","Chills! Tyson Fury reacts to Wilder result in his first interview after the fight","2018-12-02T09:35:36.000Z","UC4i_9WvfPRTuRWEaWyfKuFw","BT Sport","17","18.04.12","deontay wilder,deontay wilder tyson fury,tyson fury,wilder fury,wilder press conference,wilder push fury,wilder fury press conference,tyson fury interview,deontay wilder interview,bt sport tyson fury,wilder knockouts,wilder knockout,fury knockouts,fury knockout,wilder fury face-off,wilder fury promo,wilder fury tickets,wilder fury date,wilder fury highlights,fury singing","1044977","20305","363","4612","https://i.ytimg.com/vi/1yB0LWhfglQ/default.jpg","False","False","We caught up with Tyson Fury immediately after his incredible fight with Deontay Wilder which ended in a split decision draw. Fury also had a special message for those who suffer and have suffered from mental health issues."
"WOdJVjT8tIY","Joe & Dianne Salsa to Joseph Megamix from 'Joseph & The Amazing Technicolor Dreamcoat' - Strictly","2018-12-01T20:47:18.000Z","UC0-p7mK8hRVvV86yREq342A","BBC Strictly Come Dancing","24","18.04.12","Strictly Come Dancing,Dancing With the Stars UK,BBC,Strictly,Come,Dancing,musicals,musicals week,week 11,strictly come dancing 2018,joe sugg,dianne buswell,josephy megamix,joseph and the amazing technicolour dreamcoat,andrew lloyd webber,thatcherjoe,thatcher joe,zoella","452531","14756","198","1134","https://i.ytimg.com/vi/WOdJVjT8tIY/default.jpg","False","False","SUBSCRIBE to BBC Strictly Come Dancing: https://bit.ly/2kzjjATJoe Sugg & Dianne Buswell take to the floor in a bid to impress the judges. It's Musicals Week, and Tess Daly and Claudia Winkleman host as the six remaining couples take to the dance floor with routines inspired by musicals.Watch Strictly Come Dancing on the BBC: https://bbc.in/2xMhHKgStrictly Come Dancing | Series 16 | BBCSUBSCRIBE to BBC for more entertainment highlights: https://bit.ly/2IXqEIn#strictly #bbcstrictly #strictlycomedancing"
"CodtdeXZhJA","Street Food in Peshawar - AMAZING PAYA + CHARSI TIKKA | Pakistani Food Tour!","2018-12-02T13:00:02.000Z","UCyEd6QBSgat5kkC6svyjudA","Mark Wiens","19","18.04.12","Peshawar,Pakistan,Pakistani food,Pakistani street food,street food,Peshawar street food,Mark Wiens,curry,tikka,charsi tikka,siri paye,paya,Peshawari paye,peshawari food,Pakistani street food tour,pulao,kabuli pulao,saag,lassi,travel,pakistan travel,travel vlog,food vlog,food videos,street food videos,travel videos","1045068","35301","1405","8801","https://i.ytimg.com/vi/CodtdeXZhJA/default.jpg","False","False","SUBSCRIBE http://bit.ly/MarkWiensSubscribe for 2 new videos every weekT-shirts and caps: https://goo.gl/6WdK1lThank you to Waqas for taking us around: https://goo.gl/ipRiqeThank you to Ali (Pakistan Travel Market): https://goo.gl/VY6NjHPESHAWAR is the capital of Khyber Pakhtunkhwa, Pakistan, and it’s a must-visit city in the world for food lovers.  Of all the cities I visited in Pakistan, Peshawar was one of the most special, a city of immense history, culture, and some of the most incredible meat dishes of anywhere in the world. People have huge hearts, and a great taste of delicious food. Thank you Waqas and Peshawar for an amazing street food tour!Halwa puri - We started off this Peshawar street food tour with first breakfast, halwa puri, something that is loved throughout Pakistan. Their version was one of the best, fried in pure desi ghee, and what I loved most was the chana, chickpeas stew.Nika Seri Pai - Breakfast number two was one of the best dishes I ate in all of Pakistan - Peshawari seri paye, this version made with stewed cows feet. The stew was so rich and incredibly thick - like one of the most rich things you could possibly eat. What I loved so much about Peshawari paye is that it had an incredible garlic flavor. The meat was fall apart tender melting as well.Price - 500 PKR ($3.73) per bowlSir Cunningham Clock Tower - After breakfast we headed to walk around and explore Peshawar, which has some ancient history, and is a fascinating city to explore. Masjid Mahabat Khan is one of the oldest and landmark mosques in Peshawar that’s well worth a visit.Brains masala - 90 PKR ($0.67) - After having some amazing Peshawari tea, we then continued on to eat brains masala, which he literally whipped up in minutes, and we had a fresh plate of cow brains masala. It was delicious especially with the added chutney.Pomegranate juice 200 PKR ($1.49) per cup - This is a cup of juice I could hardly even believe. It was the best, freshest, and perfectly sweet and tart cup of pomegranate juice I’ve ever had.Peshawari pulao - 185 PKR ($1.38) per plate - Next on this Pakistani street food tour of Peshawar, we had Peshawari pulao, which is quite similar to Kabuli pulao. The rice was lightly seasoned, cooked with meat and chickpeas. It was awesome.Saag and lassi - 50 PKR ($0.37) - Another highlight from this amazing street food tour of Peshawar was the saag and lassi sold by an extremely friendly man right outside the pulao restaurant. The saag was so healthy and fresh, and the lassi was freshly whipped up.Kaptaan Chappal - One of the best things I brought back with me from Pakistan are Kaptaan Chappals, the locals sandals made in Pakistan. We went to the same shop that Mr. Imran Khan, Prime Minister of Pakistan, is famous for buying his sandals that he wears almost everyday.Nisar Khan Charsi Tikka Shish Mahel - Finally, a food trip to Peshawar wouldn’t be complete without eating at Nisar Khan Charsi Tikka, the most famous restaurant in Peshawar for meat, specifically lamb. Everything was incredibly good, and I especially loved the lamb chops.Total price - 2,600 PKR ($19.38)An amazing day in Peshawar, it was one of those days where everything is fascinating, everywhere you look and everything you taste.Thank you again to Waqas for taking us around: https://goo.gl/ipRiqeAli: https://goo.gl/VY6NjHJoel: https://goo.gl/5AkWm6MUSIC: https://us.audionetwork.com/Logo: https://goo.gl/VhaLp5CAMERA GEAR I used to make this video (these are affiliate links):Main camera: http://amzn.to/2sV0XQOMain lens: http://amzn.to/2szLZNf2nd lens: http://amzn.to/2EjBeEgMicrophone: http://amzn.to/2rBKD3zDrone: http://amzn.to/2CrtAHzFOLLOW:Instagram: https://instagram.com/migrationologyFacebook: https://www.facebook.com/migrationologyThank you for watching!"
"UTJ7c2saCc4","Priyanka Chopra & Nick Jonas Play the Newlywed Game | Vogue","2018-12-01T14:45:48.000Z","UCRXiA3h1no_PFkb1JCP0yMA","Vogue","24","18.04.12","nick jonas,priyanka chopra,wedding,newlyweds game,priyanka chopra wedding,priyanka chopra newlywed,priyanka chopra newlywed game,priyanka chopra and nick jonas,priyanka chopra nick jonas,priyanka chopra nick jonas together,priyanka chopra interview,nick jonas interview,nick jonas newlywed game,priyanka chopra vs nick jonas,priyanka chopra relationship,priyanka chopra hair,priyanka chopra funny,priyanka chopra funny moments,priyanka,vogue","4074581","114988","3080","7248","https://i.ytimg.com/vi/UTJ7c2saCc4/default.jpg","False","False","Watch Priyanka Chopra and Nick Jonas play the Newlywed Game, in which they answer questions about their relationship.As part of our partnership with Google, this video was captured on Pixel3.Still haven’t subscribed to Vogue on YouTube? ►► http://bit.ly/vogueyoutubesub ABOUT VOGUEVogue is the authority on fashion news, culture trends, beauty coverage, videos, celebrity style, and fashion week updates. Priyanka Chopra & Nick Jonas Play the Newlywed Game | Vogue"
"rdgCTRSbOj4","I'm usually NOT hit on... but something happened","2018-12-01T18:19:50.000Z","UCsDmESjqNPukDmVnuneLrqw","It's Alex Clark","1","18.04.12","its alex clark,itsalexclark,alex clark,itsalexclark youtube,youtube itsalexclark,itsalexclark channel,animation,animation channel,animated,animated videos,alex clark youtube,youtube alex clark,alex clark channel,alex clark vlogs,clark cartoons,shirtless man,hit on,check out,I'm usually not use to this,shirtless comedian,shirtless men","1458456","37718","3898","7054","https://i.ytimg.com/vi/rdgCTRSbOj4/default.jpg","False","False","I'm usually not used to this.... To check out final space visit our sponsor http://www.vrv.co/alexMerch/Tour Info http://www.itsalexclark.comIn the video:Http://www.YouTube.com/pamonsunset https://www.youtube.com/channel/UCIADdhCzvfbnQCX0f9TdrXgAnimation Team:Chris: http://bit.ly/tanimaytoPenny: https://www.instagram.com/pennylanemorales/Jeff: https://jeff-fam.tumblr.comSupport our animations: https://Patreon.com/itsalexclarkWe draw all our videos with products from Huion: https://www.huiontablet.com/all-products/Follow ItsAlexClark!Facebook: https://facebook.com/itsalexclark/Instagram: https://instagram.com/itsalexclark/Twitter: https://twitter.com/itsalexclarkOfficial Website: http://itsalexclark.com/What I make these videos with:Final Cut Pro X: http://go.magik.ly/ml/7cvu/Get these Cheap lights: https://goo.gl/74tza7 And attach them to this: https://goo.gl/Qp8aefToon Boom Harmony: https://store.toonboom.com/studentsMost of our music comes from Epidemic (30-Day Free Trial): http://bit.ly/itsalexmusicWritten by:Alex ClarkMail me packages and stuff: Alex ClarkP.O. Box 192022LA, CA 90019Email: sayhello (at) itsalexclark (dot) comSpecial Thanks to our Inner Circle of Friendship and Family Tier PatronsStephan ReedErich leeMariam GegechkoriArjun BlairTrey SimmonsJon McmasterAmy M MayfieldTony SullivanAriana BransfordJack souchMolly Dowling"
