video_id,title,publishedAt,channelId,channelTitle,categoryId,trending_date,tags,view_count,likes,dislikes,comment_count,thumbnail_link,comments_disabled,ratings_disabled,description
"FL_luOnB67Q","All the details from Priyanka Chopra and Nick Jonas' wedding","2018-12-03T14:41:29.000Z","UCH1oRy1dINbMVp3UFWrKP0w","Good Morning America","24","18.05.12","Priyanka,Chopra,nick,jonas,wedding,marriage,vow,indian,christian,ceremony,couple,celebrity,GMA,Nick Jonas wife,2018,Nick jonas and priyanka,People,TV,video,wedding video,married,get married,Jonas Brothers,nick jonas wedding pictures,age,good morning america,priyanka chopra wedding,priyanka chopra wedding dress,movies,instagram,veil","295819","3726","105","322","https://i.ytimg.com/vi/FL_luOnB67Q/default.jpg","False","False","The celebrity couple exchanged vows twice this weekend with an Indian and a Christian ceremony."
"zNjO6arjuAc","Loaded Questions with Margot Robbie","2018-12-04T05:02:23.000Z","UC8-Th83bH_thdKZDJCrn88g","The Tonight Show Starring Jimmy Fallon","23","18.05.12","The Tonight Show,Jimmy Fallon,Loaded Questions,Margot Robbie,TSJF Games,NBC,NBC TV,Television,Funny,Talk Show,comedic,humor,snl,tonight,show,jokes,funny video,interview,variety,comedy sketches,talent,celebrities,video,clip,highlight,games with guests,Margot Robbie on Fallon,Margot Robbie game,Suicide Squad,Harley Quinn,The Wolf of Wall Street,The Big Short,I Tonya,Tonya Harding","616417","13603","297","866","https://i.ytimg.com/vi/zNjO6arjuAc/default.jpg","False","False","Margot Robbie and Jimmy take turns giving answers to personal questions that only they know, forcing each other to take a mystery shot if they refuse to reveal the question.Subscribe NOW to The Tonight Show Starring Jimmy Fallon: http://bit.ly/1nwT1aNWatch The Tonight Show Starring Jimmy Fallon Weeknights 11:35/10:35cGet more Jimmy Fallon: Follow Jimmy: http://Twitter.com/JimmyFallonLike Jimmy: https://Facebook.com/JimmyFallonGet more The Tonight Show Starring Jimmy Fallon: Follow The Tonight Show: http://Twitter.com/FallonTonightLike The Tonight Show: https://Facebook.com/FallonTonightThe Tonight Show Tumblr: http://fallontonight.tumblr.com/Get more NBC: NBC YouTube: http://bit.ly/1dM1qBHLike NBC: http://Facebook.com/NBCFollow NBC: http://Twitter.com/NBCNBC Tumblr: http://nbctv.tumblr.com/NBC Google+: https://plus.google.com/+NBC/postsThe Tonight Show Starring Jimmy Fallon features hilarious highlights from the show including: comedy sketches, music parodies, celebrity interviews, ridiculous games, and, of course, Jimmy's Thank You Notes and hashtags! You'll also find behind the scenes videos and other great web exclusives.Loaded Questions with Margot Robbiehttp://www.youtube.com/fallontonight#FallonTonight#MargotRobbie#JimmyFallon"
"Dy4z4pfCu-Y","ಶಿವನ ಕೃಪೆಯಿಂದ 2019 ವರ್ಷದಲ್ಲಿ ಈ 4 ರಾಶಿಯವರ ಅದೃಷ್ಟ ಬದಲಾಗಲಿದೆ: Lord Shiva Blessings to 4 Zodiac Signs","2018-12-03T05:50:05.000Z","UCuHTvJgH8FfEmXECaehN0-A","Kannada Bhakthi Channel","22","18.05.12","horoscope 2019,daily horoscope,horoscope matching,zodiac signs,aries horoscope today,virgo horoscope today,horoscope,leo horoscope today,astrology today,horoscope today,astrology,astrology in kannada,dina bhavishya,rashi bhavishya in kannada,kundali matching,nithya bhavishya,weekly horoscope,capricorn,aquarius,nitya bhavishya,rashi bhavishya,rashifal,lord shiva,mantra,shiva pooja,shiva blessings,lucky zodiac,Luckiest sign","58684","0","0","44","https://i.ytimg.com/vi/Dy4z4pfCu-Y/default.jpg","False","True","These 4 Zodiac Signs are Most Likely to Get Dhana Yoga in the year 2019 with the Blessings of Lord Shiva. ಶಿವನ ಕೃಪೆಯಿಂದ 2019 ವರ್ಷದಲ್ಲಿ ಈ 4 ರಾಶಿಯವರ ಅದೃಷ್ಟ ಬದಲಾಗಲಿದೆ. ಇವರ ನಿರೀಕ್ಷೆಯಂತೆ ಅಂದುಕೊಂಡದ್ದು ನೆರವೇರುವುದು ಖಚಿತ. Find out Lucky Rashis of 2019 and 2019 Yearly Horoscope in Kannada."
"BIUv_6WU0Zw","बडी खबर - देखिये पवन सिंह के घर हुआ लड़का - Pawan Singh's nephew, Pawan Singh became uncle","2018-12-04T15:23:37.000Z","UCY9uVy6tWthAqPCemgyVBkw","Bhojpuri FansClub","24","18.05.12","pawan singh,pawan siang nephew,pawan singh family,pawan singh wife,pawan singh ka pariwar,pawan singh film,pawan singh songs,Pawan Singh became uncle,bhojpuri news 2018,bhojpuri fansclub","69137","1102","121","93","https://i.ytimg.com/vi/BIUv_6WU0Zw/default.jpg","False","False","Credit & Thanks : - Pawan Singh.#pawansingh#pawansingh_news------------------------------------------------------------------------------------------------------------इ लिंक पर क्लिक करके चैनल के सब्सक्राइब कर सकतानी : https://www.youtube.com/channel/UCY9uVy6tWthAqPCemgyVBkwLike Facebook Page : https://www.facebook.com/FansClubBhojpuri/----------------------------------------------------------------------------------------------------------ध्यान दे : - इस वीडियो का मकसद लोगों को ख़बर और जानकारी देना है न की किसी को ठेस पहुँचाना, अगर किसी तरह का कोई शिकायत है तो कृपया पहले आप हमसे संपर्क करे.email ID : fansclubbhojpuri@gmail.com----------------------------------------------------------------------------------------------------------Disclaimer : - I have used the poster, image or scene in this video just for the News & Information purpose .Copyright Disclaimer Under Section 107 of the Copyright Act 1976, allowance is made for fair use for purposes such as criticism, comment, news reporting, teaching, scholarship, and research. Fair use is a use permitted by copyright statute that might otherwise be infringing. Non-profit, educational or personal use tips the balance in favor of fair use."
"4CPzBQiz_Yk","KSI - Ares (Quadeca Diss Track) Official Video","2018-12-04T19:01:25.000Z","UCVtFOytbRpEvzLjvqGG5gxQ","KSI","10","18.05.12","ksi","3735428","384938","58943","122328","https://i.ytimg.com/vi/4CPzBQiz_Yk/default.jpg","False","False","Directed by @RVBBERDUCKProduced by http://afterparty.studioInstrumental produced by http://instagram.com/z_azadTwitter: https://twitter.com/KSIOlajidebtInstagram: https://www.instagram.com/ksiFacebook: https://www.facebook.com/KSIOlajidebt/Footasylum: https://www.footasylum.com/Snapchat: therealksiClothing: https://www.sidemenclothing.com/Myprotein - https://bit.ly/2w9KGa0KSI: Can't Lose available worldwide - https://www.cantlosefilm.com"
"c-jfT--4QKM","Ammai Cute Abbai Naatu | Mounamga Dooramga | Web Episode 114 | ETV Plus","2018-12-03T17:12:09.000Z","UCi1m4TnmmXGUIY4roVtvjDA","ETV Plus India","23","18.05.12","etv Plus,etv comedy show,3 Idiots,anchor ravi,Chinnadana Neekosam,express raja,hungama,Kick,Nandini Vs Nandini,Pataas,jabardasth,extra jabardasth,naga babu,roja,anchor anasuya,pove pora,comedy short films,yadamma raju,chalaki chanti,sudigali sudeer,anchor suma,comedy show,anchor sreemukhi,comedy skits in telugu,telugu comedy tracks,racha ravi,allare allari,sardaga kasepu,ejunction,anchor pradeep,pataas punches,anchor vishnupriya,getup srinu","72922","2396","59","802","https://i.ytimg.com/vi/c-jfT--4QKM/default.jpg","False","False",""
"CodtdeXZhJA","Street Food in Peshawar - AMAZING PAYA + CHARSI TIKKA | Pakistani Food Tour!","2018-12-02T13:00:02.000Z","UCyEd6QBSgat5kkC6svyjudA","Mark Wiens","19","18.05.12","Peshawar,Pakistan,Pakistani food,Pakistani street food,street food,Peshawar street food,Mark Wiens,curry,tikka,charsi tikka,siri paye,paya,Peshawari paye,peshawari food,Pakistani street food tour,pulao,kabuli pulao,saag,lassi,travel,pakistan travel,travel vlog,food vlog,food videos,street food videos,travel videos","1148786","36959","1501","9154","https://i.ytimg.com/vi/CodtdeXZhJA/default.jpg","False","False","SUBSCRIBE http://bit.ly/MarkWiensSubscribe for 2 new videos every weekT-shirts and caps: https://goo.gl/6WdK1lThank you to Waqas for taking us around: https://goo.gl/ipRiqeThank you to Ali (Pakistan Travel Market): https://goo.gl/VY6NjHPESHAWAR is the capital of Khyber Pakhtunkhwa, Pakistan, and it’s a must-visit city in the world for food lovers.  Of all the cities I visited in Pakistan, Peshawar was one of the most special, a city of immense history, culture, and some of the most incredible meat dishes of anywhere in the world. People have huge hearts, and a great taste of delicious food. Thank you Waqas and Peshawar for an amazing street food tour!Halwa puri - We started off this Peshawar street food tour with first breakfast, halwa puri, something that is loved throughout Pakistan. Their version was one of the best, fried in pure desi ghee, and what I loved most was the chana, chickpeas stew.Nika Seri Pai - Breakfast number two was one of the best dishes I ate in all of Pakistan - Peshawari seri paye, this version made with stewed cows feet. The stew was so rich and incredibly thick - like one of the most rich things you could possibly eat. What I loved so much about Peshawari paye is that it had an incredible garlic flavor. The meat was fall apart tender melting as well.Price - 500 PKR ($3.73) per bowlSir Cunningham Clock Tower - After breakfast we headed to walk around and explore Peshawar, which has some ancient history, and is a fascinating city to explore. Masjid Mahabat Khan is one of the oldest and landmark mosques in Peshawar that’s well worth a visit.Brains masala - 90 PKR ($0.67) - After having some amazing Peshawari tea, we then continued on to eat brains masala, which he literally whipped up in minutes, and we had a fresh plate of cow brains masala. It was delicious especially with the added chutney.Pomegranate juice 200 PKR ($1.49) per cup - This is a cup of juice I could hardly even believe. It was the best, freshest, and perfectly sweet and tart cup of pomegranate juice I’ve ever had.Peshawari pulao - 185 PKR ($1.38) per plate - Next on this Pakistani street food tour of Peshawar, we had Peshawari pulao, which is quite similar to Kabuli pulao. The rice was lightly seasoned, cooked with meat and chickpeas. It was awesome.Saag and lassi - 50 PKR ($0.37) - Another highlight from this amazing street food tour of Peshawar was the saag and lassi sold by an extremely friendly man right outside the pulao restaurant. The saag was so healthy and fresh, and the lassi was freshly whipped up.Kaptaan Chappal - One of the best things I brought back with me from Pakistan are Kaptaan Chappals, the locals sandals made in Pakistan. We went to the same shop that Mr. Imran Khan, Prime Minister of Pakistan, is famous for buying his sandals that he wears almost everyday.Nisar Khan Charsi Tikka Shish Mahel - Finally, a food trip to Peshawar wouldn’t be complete without eating at Nisar Khan Charsi Tikka, the most famous restaurant in Peshawar for meat, specifically lamb. Everything was incredibly good, and I especially loved the lamb chops.Total price - 2,600 PKR ($19.38)An amazing day in Peshawar, it was one of those days where everything is fascinating, everywhere you look and everything you taste.Thank you again to Waqas for taking us around: https://goo.gl/ipRiqeAli: https://goo.gl/VY6NjHJoel: https://goo.gl/5AkWm6MUSIC: https://us.audionetwork.com/Logo: https://goo.gl/VhaLp5CAMERA GEAR I used to make this video (these are affiliate links):Main camera: http://amzn.to/2sV0XQOMain lens: http://amzn.to/2szLZNf2nd lens: http://amzn.to/2EjBeEgMicrophone: http://amzn.to/2rBKD3zDrone: http://amzn.to/2CrtAHzFOLLOW:Instagram: https://instagram.com/migrationologyFacebook: https://www.facebook.com/migrationologyThank you for watching!"
"q_X36L136_8","#KoffeeWithKaran: Diljit and Badshah","2018-12-02T16:30:02.000Z","UCa0ZcLPHL2QY1p1xqBCYedQ","Star World","24","18.05.12","[none]","388182","5677","179","932","https://i.ytimg.com/vi/q_X36L136_8/default.jpg","False","False",""
"MtEjX6gUl3Q","LIVE Raj Thackeray Speech in North Indians Event","2018-12-02T14:52:31.000Z","UCrcpw88HvKJ0skdsHniCJtQ","News18 Lokmat","25","18.05.12","marathi news,news,latest marathi news,latest news,breaking news,rajshri marathi,news18lokmat,news18 lokmat,Raj Thackeray LIVE,LIVE Raj Thackeray","204185","3532","385","843","https://i.ytimg.com/vi/MtEjX6gUl3Q/default.jpg","False","False","Follow us: https://lokmat.news18.com/https://twitter.com/news18lokmat?lang=enNews18 India’s leading News Network, and the Lokmat Group, Maharashtra’s leading Newspaper group, present News18Lokmat (formerly- IBN-Lokmat ) - a 24-hour Marathi News and Current Affairs Channel. The legacy of these two renowned media powerhouses will give News18Lokmat a sense of immense credibility as well as access to a vast audience base. Going on air from April 6, News18Lokmat will be a world-class credible News channel for the highly aware and conscious ‘Progressive Marathi’.Through its content, programming, state-of-the-art broadcast centre, extensive infrastructure and international production quality, news18Lokmat will embark on the principle of delivering news with the spirit of ‘Dhyas Janmansancha’. As credible journalism empowers people it gives them the inner confidence to take control of their surroundings and bring about change. News18Lokmat seeks to do just that and more. With reporters in every district of Maharashtra, and access"
"OWHkbPQ32Us","4th DECEMBER 2018 | The Hindu | The Editorial Today | Editorial Discussion &  Analysis","2018-12-04T04:33:18.000Z","UC1L2JoMpcY6MRLhFd3gg5Xg","Adda247 : Government Job in Your Pocket","27","18.05.12","adda247,bankersadda,ssc,sbi,SSC,SBI,BANK,EXAMSBANKING,GOVT.JOB,EXAM,Tutorials,Lectures,Questions,Quiz,IBPS,PO,RRB,IBPSCLERK2018,IBPSCLERK2018DATE,IBPSCLERK2018SYLLABUS,GS,GK,The Hindu,The Editorial Today,Editorial Discussion & Analysis,Editorial,NEWSTODAY,DAILYNEWS,HINDUNEWS","17057","2324","36","148","https://i.ytimg.com/vi/OWHkbPQ32Us/default.jpg","False","False","To Know More about IBPS PO 2018 exam, pattern, syllabus & exam date, visit:  http://www.bankersadda.com/p/ibps-po.htmlTo Know More about Ssc cgl exam pattern syllabus and exam date visit  http://www.sscadda.com/p/ssc-cgl.htmlTo Know More about Teaching Job exam pattern syllabus and exam date , visit ::;https://www.teachersadda.co.in/Aspirants, Adda247 is Now In Telegram, Join Our Telegram Group -@Adda247youtube  https://t.me/adda247youtube For All the Updates and Notifications. Hurry!!Join Now Official Telegram Channel of Bankersadda - https://t.me/bankersadda_OfficialJoin Now Official Telegram Channel of SSC Adda - https://t.me/sscadda_officialPLAYLIST FOR BANK AND SSC EXAMS - https://www.youtube.com/channel/UC1L2JoMpcY6MRLhFd3gg5Xg/playlistsAdda247 Youtube channel is India's most popular channel for Online Coaching for IBPS Bank PO Exams and Online Coaching for SSC CGL. 1.To buy Banking & SSC Latest Pattern Video Courses of Adda247 - at Online Streaming, SD Card or Tablet click here - https://store.adda247.com/#!/videos/list To Buy Adda247 Test Series Click Here - https://store.adda247.com/#!/testseries/listTo Buy Adda247 Books Click Here -https://store.adda247.com/#!/books/list2. Download Adda247 App (India's No.1 App for Bank & SSC Exams) - http://bit.ly/adda247 3. To get all latest videos in your mailbox, subscribe to our youtube channel - https://www.youtube.com/adda247live 4. Get all updates on facebook, like us our facebook page - https://www.facebook.com/adda247live 5. Join us at twitter - https://twitter.com/adda247live#ADDA247 #EDITORIAL #THEHINDU"
"jIjyioCwwYM","Silsila Badalte Rishton Ka - 5th December 2018 | Colors Tv Silsila Serial News 2018","2018-12-02T16:00:04.000Z","UC2tRhjkebu5aSo0IYcTtX2Q","pressnews tv","24","18.05.12","Silsila Badalte Rishton Ka,Silsila Badalte Rishton Ka 5th December 2018,Silsila Badalte Rishton Ka 5th December 2018 Full Episode,Silsila Badalte Rishton Ka Full Episode,Colors Tv,5th December 2018,Full Episode,Promo,Full,Latest,Last,Today,Upcoming,Colors Promo,Rishto,Rishton,2018,Episodes,Serial,Show,News,Episoe,Colors Serials,Shakti Arora,Drashti Dhami,Aditi Sharma,watch,online","86630","285","69","20","https://i.ytimg.com/vi/jIjyioCwwYM/default.jpg","False","False","Silsila Badalte Rishton Ka - 5th December 2018 | Colors Tv Silsila Serial News 2018 Colors Tv Silsila Badalte Rishton Ka #SilsilaBadalteRishtoKa #DrashtiDhami #ColorsTv  #ShaktiArora #AditiSharma  pressnewstv: first hand account of video news on Hindi Serial News 2018 Updates, Bollywood News 2018, Hot Video, National News India 2018, Live News Today, Entertainment, Politics - Stay Updated!  ►Subscribe us on YouTube @ http://bit.do/pressnewstv►Follow us On Twitter  @ https://twitter.com/pressnewstv►Like us on Facebook @ https://www.facebook.com/pressnewstv"
"g8emcExNQP4","The untold stories of Subhash Chandra Bose | Unknown Facts about Netaji | Vikram Aditya | #EP154","2018-12-02T02:30:16.000Z","UCqR14yApZM2ZAOTY0qrKIGw","Vikram Aditya","24","18.05.12","The untold stories of Subhash Chandra Bose,Unknown Facts about Netaji,Vikram Aditya,#EP154,subhash chandra bose,netaji subhash chandra bose,vikram aditya channel,vikram aditya videos,vikram aditya latest videos,vikram aditya new videos,freedom fighters,india independence,reason for independence,subash sena,father of indian army,Who is Subhash Chandra Bose?,Fascinating Facts About Netaji","329818","21746","388","3145","https://i.ytimg.com/vi/g8emcExNQP4/default.jpg","False","False","The untold stories of Subhash Chandra Bose, Few unknown facts about Netaji in Telugu by Vikram Aditya in today's episode #EP154. For more Latest Shocking Facts & Informative Videos stay tuned to #VikramAditya Channel- https://bit.ly/2ziGWnY #VikramAditya #Netaji #MysteryofNetaji #SubashChandraBose #NetajiSubashChandraBose #NetajiAYURSHA SHAMPOO: https://amzn.to/2P6G641Join me for Parahitha, A Journey Towards Humanity Through PATREON: https://www.patreon.com/VikramAditya ▶ Order my Telugu book in AMAZON: Vikram Aditya's జీవించడం ఒక కళ: https://amzn.to/2KoH35x. Or call: -  7032875554 , 9052783437 Click here to Watch:▶ Previous Episodes of Mahabharatam Series - https://youtu.be/5LjpMWuhJw0▶MAHABHARATAM- 20 | Pandavas Exile | Aranyavasam In Telugu | Vikram Aditya Latest Video | #EP148- https://youtu.be/a5UB9PPKY4k▶ For DEDICATIONS / BUSINESS / BRAND PROMOTIONS :Whatsapp To 7659061119 or Mail me to:  vikramadityavlog@gmail.com▶ CALL AYURSHA: 8096787555 .  AYURSHA IN AMAZON: HAIR OIL & HAIR PACK: https://amzn.to/2HsStV1AYURSHA PIMPLE KIT: https://amzn.to/2qZaGCnFACE PACK & FACE MASSAGE OIL: https://amzn.to/2Hq8qLAFor more interesting videos : Subscribe : http://bit.ly/1l1RaR4Like : https://www.facebook.com/VikramAdityaofficial/Follow: https://www.instagram.com/vikramadityaofficial"
"Sb4dP7wtc2Q","Drew McIntyre ambushes Finn Bálor: Raw, Dec. 3, 2018","2018-12-04T05:01:02.000Z","UCJ5v_MCY6GNUBTO8-D3XoAg","WWE","17","18.05.12","wwe,world wrestling entertainment,wrestling,wrestler,wrestle,superstars,कुश्ती,पहलवान,डब्लू डब्लू ई,मैच,सुपरस्टार,व्यावसायिक कुश्ती,مصارعه,Raw,Drew McIntyre,Finn Bálor,wwe raw,raw highlights,wwe raw full show,wwe raw 2018,wwe raw highlights this week,wwe raw top 10","449051","7397","670","620","https://i.ytimg.com/vi/Sb4dP7wtc2Q/default.jpg","False","False","The Scottish Psychopath seeks vengeance against The Extraordinary Man.#RawGET YOUR 1st MONTH of WWE NETWORK for FREE: http://wwenetwork.com---------------------------------------------------------------------Follow WWE on YouTube for more exciting action!---------------------------------------------------------------------Subscribe to WWE on YouTube: http://bit.ly/1i64OdTCheck out WWE.com for news and updates: http://goo.gl/akf0J4Find the latest Superstar gear at WWEShop: http://shop.wwe.com---------------------------------------------Check out our other channels!---------------------------------------------The Bella Twins: https://www.youtube.com/thebellatwinsUpUpDownDown: https://www.youtube.com/upupdowndownWWEMusic: https://www.youtube.com/wwemusicTotal Divas: https://www.youtube.com/wwetotaldivas------------------------------------WWE on Social Media------------------------------------Twitter: https://twitter.com/wweFacebook: https://www.facebook.com/wweInstagram: https://www.instagram.com/wwe/Reddit: https://www.reddit.com/user/RealWWEGiphy: https://giphy.com/wwe"
"UlnS1eBL2tg","Honeymoon Couples Scenario | Husband Vs Wife | Samsaram Athu Minsaram | Mini Series - #8","2018-12-01T12:29:49.000Z","UC6IJFR0fWCBGhQnMKZQ-01g","Chennai Memes","23","18.05.12","honeymoon,honeymoon couples,divorced couples,samsaram adhu minsaram,pregnancy test,episode 8,illegal affairs news,husband vs wife,honeymoon couples scenario,husband vs wife prank,husband vs","269426","12501","497","1294","https://i.ytimg.com/vi/UlnS1eBL2tg/default.jpg","False","False","#SamsaramAthuMinsaram #MiniSeries #ChennaiMemesBook your favourite stay at Kodaikanal here @ http://ecorganicstays.com/destinations/Book your self drive car in Chennai @ https://www.zoomcar.com/chennai/CASTFabiean / Insta: fabbyftfwAarthi Subash / Insta: vj_aarthisubashDhilip Theodore / Insta: dhiliptheodoreCAMERAFrancis ShajanEDITKiruba ShankarPRODUCERGautham GovindaramanCheck us out on Facebook at: https://www.facebook.com/memeschennaiOn twitter as well at:https://twitter.com/MemesChennaioh wait.. Even on Instagram at:https://www.instagram.com/chennaimemes"
"pDO2KPXgKfw","5 ஜி சோதனையால் கொத்துக் கொத்தாக செத்து விழுந்த பறவைகள்","2018-12-02T08:35:51.000Z","UCat88i6_rELqI_prwvjspRA","News 18 Tamilnadu","25","18.05.12","நியூஸ்18 தமிழ்நாடு,news 18,news 18 tamil nadu,tamil news 18 live,tamil news 18 channel,news 18 tamilnadu news,news 18 tamilnadu live,news 18 tamilnadu today,tamil news 18 live online,news 18 tamilnadu news live,tamil news 18 live streaming,news18 tamil live,news18 tamilnadu live,2.o,rajinikanth new movie,5g network,5 G test,Netherlands,The bird died cellphone radiation,The birds have been killed and the articles have been published,5 ஜி சோதனையால்","393731","10410","411","996","https://i.ytimg.com/vi/pDO2KPXgKfw/default.jpg","False","False","ரஜினிகாந்த்தின் 2.o படத்தில் வருவது போன்று செல்போன் கதிர்களால் பறவை உயிரிழந்த புகார் ஒன்று நெதர்லாந்து நாட்டில் சர்ச்சை ஏற்பட்டுள்ளது. 5ஜி சோதனையால் பறவைகள் கொத்துக் கொத்தாக உயிரிழந்து விழுந்ததாக வலைத்தளங்களில் கட்டுரைகள் வெளியாகியுள்ளது. இதனால் 5 ஜி சோதனைதான் காரணம் என இயற்கை ஆர்வலர்கள் நம்புகின்றனர்.Subscribe to the News18 Tamil Nadu Videos : http://bit.ly/News18TamilNaduVideosConnect with Website: http://www.news18tamil.com/Like us @ https://www.facebook.com/News18TamilNaduFollow us @ https://twitter.com/News18TamilNaduOn Google plus @ https://plus.google.com/+News18TamilnaduAbout Channel:யாருக்கும் சார்பில்லாமல், எதற்கும் தயக்கமில்லாமல், நடுநிலையாக மக்களின் மனசாட்சியாக இருந்து உண்மையை எதிரொலிக்கும் தமிழ்நாட்டின் முன்னணி தொலைக்காட்சி ‘நியூஸ் 18 தமிழ்நாடு’ News18 Tamil Nadu brings unbiased News & information to the Tamil viewers. Network 18 Group is presently the largest Television Network in India."
"gooygVwZMwU","Jitu E Patai Chokri | New Comedy Video 2018 | Greva Kansara | #JTSA","2018-12-03T12:00:57.000Z","UCTiD4Pot0vTdXBAGrzacIgQ","Jokes Tamara Style Aamari","24","18.05.12","jitu,mangu,greva kansara,jokes tamara style aamari,comedy video,funny video,jokes,comedy jokes,latest jokes,latest comedy video","363166","4437","410","599","https://i.ytimg.com/vi/gooygVwZMwU/default.jpg","False","False","#gujaratijokes2018 #Jitupandya #mangu #JTSA Presenting : New Jokes/Comedy Video   Jokes Tamara Style Aamari  Artist :Jitu Pandya, Greva Kansara Camerman : SHREYANK JOSHI (DAKOR)Editor :Bharat Patel Location Dharti farm Director/Story/Concept :Dhiren RandhejaProducer :Dhiren Randheja,Kishan SabnaniLabel :DK Digital"
