video_id,title,publishedAt,channelId,channelTitle,categoryId,trending_date,tags,view_count,likes,dislikes,comment_count,thumbnail_link,comments_disabled,ratings_disabled,description
"Ru4lEmhHTF4","Zero | Official Trailer | Shah Rukh Khan | Aanand L Rai | Anushka | Katrina | 21 Dec 2018","2018-11-02T11:15:43.000Z","UCjJKg01HAP01xCLVhDmnLhw","Red Chillies Entertainment","24","18.04.11","Zero Trailer,Zero official trailer,Zero2018,Zero teaser,Zero new film,Zero Red Chillies Entertainment,SRK birthday,Zero,Zero Movie,SRK,shah rukh khan,katrina kaif,anushka sharma,anand l rai,tanu weds manu,colour yellow,bollywood new,new release,Zero trailer HD,salman khan,bauua,baua,2zero18,eid trailer,zero full movie HD,r madhavan,Zero 21 December,zero the movie,zero the film","65230999","1501256","110881","166418","https://i.ytimg.com/vi/Ru4lEmhHTF4/default.jpg","False","False","Here’s presenting the official trailer of Zero starring Shah Rukh Khan, Anushka Sharma and Katrina Kaif and directed by Aanand L Rai. The film releases in cinemas on 21st December, 2018. #ZeroTrailer #ShahRukhKhan #SRKBirthdayRed Chillies Entertainment and Colour Yellow Production come together to bring the film, produced by Gauri Khan, ZERO is all set to release worldwide.Actors: Anushka Sharma, Katrina Kaif, Shah Rukh Khan, Producer: Gauri KhanDirector : Aanand L RaiWriter: Himanshu SharmaCo-producer: Karuna BadwalMusic: Ajay-AtulDOP: Manu AnandVFX Supervisor: Harry HingoraniProduction Designer: Wasiq KhanEditor: Hemal KothariBorn to a wealthy family and raised in an environment of affluence and indulgence, Bauua was never failed by Meerut or its people. But when he meets two women (Katrina Kaif, Anushka Sharma), his experiences with these women take him on a journey to complete his ‘incompleteness' and broaden his horizons to find a purpose he never knew he had.For more updates on Zero, click on the links below: http://www.twitter.com/RedChilliesEnthttp://www.facebook.com/RedChilliesEnthttp://www.instagram.com/RedChilliesEnthttp://www.dailymotion.com/RedChilliesEnt"
"_qOl_7qfPOM","2.0 - Official Trailer [Hindi] | Rajinikanth | Akshay Kumar | A R Rahman | Shankar | Subaskaran","2018-11-03T07:22:20.000Z","UCKQKIY2YlI4L5QVg7hhfjrQ","Dharma Productions","1","18.04.11","Lyca Productions,2.0,2point0,2.0 teaser,2.0 trailer,2.0 official trailer,2.0 movie,2.0 making,2.0 official teaser,robot 2.0 official trailer,robot 2,robo 2.0 teaser,robot 2.0,robot 2 teaser,robot 2.0 trailer,2.o,two point zero,akshay kumar,shankar 2.0,rajinikanth,director shankar,amy jackson,shankar,a r rahman,2.0 trailer official,rajinkanth,2 point 0 teaser,2.o official trailer,karan johar,dharma productions","10236900","365229","45682","53500","https://i.ytimg.com/vi/_qOl_7qfPOM/default.jpg","False","False","Unleashing the official trailer of our magnum opus 2.0 Starring Rajinikanth, Akshay Kumar, Amy Jackson in leadMusic Composed by A R RahmanDirected by Shankar#2Point0 #2Point0Teaser #LycaProductions #Rajinikanth #AkshayKumar #ARRahman #ShankarLyca Productions presents 2.0 Trailer-Team 2.0-Cast : 'Superstar' Rajinikanth, Akshay Kumar, Amy Jackson & OthersWritten & Directed by S. ShankarProduced by SubaskaranMusic: A. R. RahmanCinematographer: Nirav ShahEditor: AnthonyArt: T MuthurajJeya Mohan | V Srinivas Mohan | Rif Dagher | Resul Pookutty | Mary E Vogt | Kenny Bates | Nick Powell | Steve Griffin | Silva | Legacy Effects | Double Negative | Quantum FX | Bosco | Na Muthukumar | Madhan Karky | RockyMusic on Lyca MusicHitting silver screens on November 29th 2018.Subscribe for Regular Updateshttp://goo.gl/tBtxttLike us on http://www.facebook.com/DharmaMoviesFollow us onhttp://www.twitter.com/DharmaMovieshttps://www.instagram.com/dharmamoviesCircle us on Google+https://plus.google.com/+DharmaMovies"
"ZFdn9qSaF8E","Chhota Bheem - Happy Diwali | Diwali Special Video","2018-11-01T10:08:39.000Z","UCiBigY9XM-HaOxUc269ympg","Green Gold","24","18.04.11","[none]","3628234","14996","4807","1472","https://i.ytimg.com/vi/ZFdn9qSaF8E/default.jpg","False","False","Green Gold Animation Presents Chhota Bheem - Happy DiwaliNow you can bring home the fun... Own your favorite toons merchandise. Shop Online at www.greengoldstore.comBuy all the cool Movie Merchandise (T-Shirts, Mugs, Water Bottles, Sippers, Stationery, Cushions and lot more) at http://www.greengoldstore.com/movie-merchandise.htmlGet Attractive Combo Deals on your favorite Super Hero's Merchandise use this link:http://www.greengoldstore.com/chhota-bheem-deals.html"
"HayVuHxh1Lw","Beautiful Rangoli Design बनाने का तरीका | Rangoli Easy and Beautiful Designs for Diwali","2018-11-03T07:06:53.000Z","UCKjJXmZxk1SiTUQUB28KHpw","TsMadaan","26","18.04.11","rangoli,rangoli designs,easy rangoli,RANGOLI DESIGNS,Rangoli Designs,rangoli design,latest rangoli designs,unique rangoli designs,rangoli designs easy,beautiful rangoli designs,kolam,easy rangoli designs,diwali,rangoli designs beautiful,rangoli easy,rangoli easy designs,रंगोली,rangoli ke design,rangoli unique designs,simple design,simple designs,simple rangoli,rangoli designs with dots,innovative rangoli designs,colourful rangoli designs","443070","7404","434","442","https://i.ytimg.com/vi/HayVuHxh1Lw/default.jpg","False","False","रंगोली बनाने का आसान तरीका कि आप भी बना सकते हैं | Beautiful Rangoli Designs Easy and Attractive for Diwali.This Diwali, decorate your home or office with very easy rangoli designs using kitchen items. You will find our rangoli designs easy and simple rangoli designs, yet these are unique rangoli designs.Learn Rangoli tricks and techniques on how to make Rangoli for Diwali 2018. In our best rangoli videos, you will find beautiful rangoli designs, simple kolam with dots, which are rangoli easy designs for beginners to make quick rangoli designs step by step using basic colours.Easy Rangoli - https://www.youtube.com/watch?v=8DTQLSOtiFoSimple Rangoli - https://www.youtube.com/watch?v=-viuZXATeKkBeautiful Rangoli - https://www.youtube.com/watch?v=0eFyZPOOpSgColourful Rangoli Designs - https://www.youtube.com/watch?v=NRPndNPJbtoRangoli Designs with Dots - https://www.youtube.com/watch?v=LsWcO0Ax1WIFor more innovative rangoli designs, subscribe us.https://www.youtube.com/TSMadaan is a Free Hindi Life Changing Videos Channel to raise your Success and Happiness level on various subjects."
"cJ_y5wwCGKI","The Trip 2 | Castaways | Episode 5","2018-11-02T13:28:31.000Z","UCzo5sreD2cVGu2T2mNu__1Q","bindass","24","18.04.11","bindass tv shows,bindass tv,The Trip 2,The Trip,Trip2,trip episodes,Mallika Dua,Shweta Tripathi,Sapna Pabbi,Amyra Dastur,Lisa Haydon,Shivam Bhargava,Harman Singh Sangha,Pranay Pachauri,Bindass,Bindass channel shows,Bindass channel serial,Bindass TV shows,Bindass TV programs,BindassTV,new web series,Bindass web series,new TV shows 2018,Bindass full episode,Up Up and Away,The trip 2 episode 5,trip episode 5","1059850","18703","1687","1062","https://i.ytimg.com/vi/cJ_y5wwCGKI/default.jpg","False","False","DeJa Vu: Beach edition, anyone? Well, it couldn't be truer for the girls as they find themselves stranded on a beach, yet again! 🤦‍♀ They must find a way out before they kill each other! 😥Watch these castaways find middle ground on EP 5 of #TheTrip 2, presented by Lakme!About The Trip 2: The Trip series is back with a new season! The second season explores the journeys of four friends played by Sapna Pabbi, Shweta Tripathi, Mallika Dua and Amyra Dastur as they explore South India's beauty through an exhilarating road trip yet again!What was meant to be FOMO causing Vacay Goals, turns into yet another dramatic desi wedding with a twist, some more drama and a lot of self-discovery for the girls!Presented by #BindassOriginals►Download the BINDASS APP → http://bindass.com/download.html ►SUBSCRIBE To bindass: http://bit.ly/1bfqpUbFor More Videos & Downloads visit bindass: http://www.bindass.com►Follow Bindass:Facebook: https://www.facebook.com/bindass Twitter: https://twitter.com/bindasstv Google+: https://plus.google.com/+bindass Instagram: http://instagram.com/bindasstvWatch more popular shows on bindass:►Girl in the City - http://bit.ly/2DF8Zml► Girl in the City - Chapter 2: http://bit.ly/2F5N0lB ► The Trip - http://bit.ly/2GaUiWj ► Dil Buffering - http://bit.ly/2BnDWpz ►Yeh Hai Aashiqui - http://bit.ly/1yNiecX    Best of Yeh Hai Aashiqui: http://bit.ly/1J5nVWQ"
"rxdXLCHtRjs","Manzoor-e-Khuda Song Teaser | Thugs Of Hindostan | Aamir, Katrina, Fatima, Ajay-Atul, A Bhattacharya","2018-10-31T06:38:01.000Z","UCbTLwN10NoCU4WDzLf1JMOA","YRF","10","18.04.11","Aamir Khan,Amitabh Bachchan,Katrina Kaif,Fatima Sana Shaikh,Thugs of Hindostan Song,Thugs of Hindustan Song,Manzoor-e-Khuda Song,Ajay Atul Song,Best of Ajay Atul Song,Shreya Ghoshal Song,Sunidhi Chauhan Song,Sukhwinder Singh Song,Thugs of Hindustan New Song,Aamir Khan Song,YRF,Thugs of Hindustan Full Song,Tugs of Hindustan Songs,Best of 2018 Song,Katrina Kaif New Song,Amitabh Bachchan Song,Manzoor-e-Khuda Tamil,Manzoor-e-Khuda Telugu,Manjoor Khuda Song","10457141","114675","17437","8661","https://i.ytimg.com/vi/rxdXLCHtRjs/default.jpg","False","False","The biggest adventure is about to begin. Yeh Diwali Hogi Thug waali!Book your tickets for #ThugsOfHindostan NOW - http://bit.ly/TOHBookTicket_PayTm | http://bit.ly/TOHBookTicket_BMSSubscribe Now: https://goo.gl/xs3mrY 🔔 Stay updated!This Diwali, get ready for an explosion of action & adventure!  Watch #ManzooreKhuda SONG TEASER NOW.Listen to the full song on SAAVN: https://goo.gl/5FtZbT🎧 Song Credits:Song: Manzoor-e-Khuda  Singers: Shreya Ghoshal, Sunidhi Chauhan, Sukhwinder Singh, Additional Vocals - Ajay Gogavale  Music Composed, Arranged & Produced by: Ajay-AtulLyrics: Amitabh BhattacharyaRecording Studio: YRF Studios (Vijay Dayal, Shantanu Hudlikar, Chinmay Mestry, Abhishek Khandelwal, Manasi Tare)Mixed By: Vijay Dayal (YRF Studios)Mastered By: Donal Whelan (Mastering World Wales - UK) Additional Music Credits:Music & Rhythm Conducted by: Ajay-AtulIndian Percussions: Raju Kulkarni, Pratap Rath, Dipesh Verma, Satyajit Jamsandekar, Arun Solanki, Keyur Barve, Rahul Rupawate Musician Coordinator: Ramanand Shetty Choreography: Chinni Prakash - Rekha Prakash Stay in the filmy loop:► Like us on Facebook: https://facebook.com/yrf  ► Follow us on Twitter: https://twitter.com/yrf  ► Follow us on Instagram: http://instagram.com/yrf  © Yash Raj Films Pvt. Ltd. 🎬 Movie Credits: Starring: Amitabh Bachchan, Aamir Khan, Katrina Kaif, Fatima Sana ShaikhWriter-Director: Vijay Krishna AcharyaProducer: Aditya ChopraMusic: Ajay-AtulLyrics: Amitabh BhattacharyaDirector of Photography: Manush NandanRelease Date: 8 November 2018Synopsis:  Vijay Krishna Acharya (Victor), the writer-director of the all-time YRF blockbuster DHOOM:3, teams up once again with Aamir Khan in THUGS OF HINDOSTAN along with Amitabh Bachchan to give the audience a never seen before experience of larger than life filmmaking!This YRF film holds a double bonanza by bringing together Amitabh Bachchan and Aamir Khan together for the first time ever. That in itself, is film lore in making!The film is set to treat audiences across age groups with the biggest jaw-dropping action sequences seen by audiences on screen to date. With its edge-of-the-seat thrills and an epic adventure and war on the seas, the film is set to light up this Diwali.Watch out for more details in this space and keep counting the time till its release date of 08 November 2018.#ThugsOfHindostan #YRFnewreleases #yrf #MakingofThugsOfHindostan #VijayKrishnaAcharya #KatrinaKaif #amitabhbachchan #AamirKhan #FatimaSanaShaikh |#ChinniPrakash #RekhaPrakash"
"QtxMO7RZGkM","Just Sister Things | The Timeliners","2018-11-03T06:03:55.000Z","UCTlnaHHQ75zlDg_fLr7tGEg","The Timeliners","24","18.04.11","sister,sister things,just sister things,timeliners new video,shreya singh,siblings,sister love,sister bond,sibling love,family,sisters before misters,sunakshi grover,flames,filtercopy,the timeliners,girliyapa,screenpatti,Just Sister Things | The Timeliners,sisters fighting,comedy video,relatable videos,sibling rivalry,sister sister,funny videos,sibling day,girls,funny hindi video,sisterhood,sisterly love,sister fighting,anusha flames,Girlpower,diwali","602074","28999","1263","773","https://i.ytimg.com/vi/QtxMO7RZGkM/default.jpg","False","False","The only person you can hate & love at the same time is your sister!Watch Runi & Anu doing Just Sister Things.Please subscribe to our channel by clicking the following link to make sure you get the notifications for our videos:https://goo.gl/TVeum4Like Us On Facebook: https://www.facebook.com/TheTimelinersFollow us on Twitter: https://twitter.com/the_timelinersFollow us on Instagram: https://www.instagram.com/thetimelinersChannel Head: Akansh Gaur Creative Head: Apoorv Singh KarkiWritten by: Prakriti KargetiDirected by: Sanjeev JoshiDOP: Arjun Kukreti Edited by: Tushar ManochaStock music: Universal Music: Tusshar Mallek  Production Design: Beeva Mahajan Creative Producer: Ambrish VermaLine Producer: Puneet WaddanChief Assistant Director: Swati SinghColour Correction: Arjun KukretiAssistant Directors: Manasvi Sharma and Tushar SahiGraphics: Chandan Bhatnagar Animation: CitrusMotion Graphics: Dhananjaya PathakAssistant Art Director: Shweta YadavPost Production Supervisor: Tushar ManochaProduction Manager: Irshad Ali Production Executives: Haneet Singh SawhneyProduction Intern: Ravi KumarMarketing: Vineet Kanabar, Bhavya Prabhakar & Himakshi Batra Cast: Sunakshi Grover, Shreya Singh & Madhu Sachdeva"
"KHAFlCgo0mM","RRR Launch Date - NTR, Ram Charan | SS Rajamouli | #RRRLaunch","2018-11-02T13:28:41.000Z","UCumU_6FNxfHXTmeeFCYz6Yw","DVV Entertainment","24","18.04.11","RRR Launch Date,NTR,Ram Charan,SS Rajamouli,#RRRLaunchOnNov11,RRR Launch Date - NTR,Ram Charan | SS Rajamouli | #RRRLaunchOnNov11,RRR Muhurtham,RRR Announcement,RRR Begins,RRR Shoot,RRR Opening,RRR Launch Day,RRR NTR,RRR Telugu","1407977","50682","1699","3578","https://i.ytimg.com/vi/KHAFlCgo0mM/default.jpg","False","False","RRR Launch Date #RRRLaunchThe Opening Ceremony of our MASSIVE MULTISTARRER is on ... 🤘🏻🤘🏻#RRRStarring NTR, Ram Charan. An SS Rajamouli Film. A DVV Entertainment Production."
"Kppy-nNTJjc","Kamli (Official Song) - Mankirt Aulakh Ft. Roopi Gill | Sukh Sanghera | Latest Punjabi Songs 2018","2018-10-31T12:29:21.000Z","UCuFwzKrS0wE43CSkyaHBGiQ","SagaHits","10","18.04.11","Mankirt Aulakh,Roopi Gill,Mankirt Aulakh New Song,Mankirt Aulakh Kamli,Kamli Mankirt Aulakh,Punjabi Songs,New Punjabi Songs 2018,Punjabi Songs 2018,Kamli New Punjabi Songs 2018,Latest Punjabi Song 2018,Mankirt Aulakh New Punjabi Songs 2018,Punjabi Bhangra Songs,Bhangra Songs,Mankirt aulakh Bhangra Songs,Mankirt Aulakh Kadar,Kadar Mankirt,Kamli Mankirt,mankirat new song,Sukh Sanghera,Roopi Gill New Punjabi Songs 2018","11956593","279383","9547","13184","https://i.ytimg.com/vi/Kppy-nNTJjc/default.jpg","False","False","The biggest song of the year Kamli by Mankirt Aulakh featuring Roopi Gill. Video directed by Sukh Sanghera.Get ready with your Bhangra steps to perform on this most awaited Punjabi song of #MankirtAulakh Ft. #RoopiGill directed by #SukhSanghera where the powerful music is given by Ikwinder Singh & beautiful lyrics penned down by Veet Baljit & Kammy Grewal.Ohne Dil Mangya Te Saatho Naa Ho GayiKudi Patlo Jhi sang ke para ho gayiJatti hik naal laa laake paundi boliyan oh jatt de rumal nuUtto gabru jatta da munda tich jaanda kamli de haal nu➤Subscribe SagaHits: http://goo.gl/aFFNeC➤Watch best of Punjabi songs here in one playlist: https://www.youtube.com/playlist?list=PLdtRMZzEIrjuvSPHs9EiMHlUug-Bv4XC5☛ Hear it on:►Gaana: https://gaana.com/album/kamli-punjabi-1►Saavn: https://www.saavn.com/s/album/punjabi/kamli-2018/wku0v8kzEqg_►Wynk: http://wynk.in/u/EQ28VJnja►Listen on Apple Music: https://geo.itunes.apple.com/in/album/kamli-single/1440717925?mt=1&app=music►Buy from iTunes: https://geo.itunes.apple.com/us/album/kamli-single/1440717925?app=itunes►Reliance Jio: http://share.media.jio.com/MTQ4NV8xNDg0Njk2XzFec29uZ15hR2x0WVc1emFIVmphR0Z1WkdWc1lTMHdPUT09►GooglePlay Music: https://play.google.com/store/music/album/Ikwinder_Singh_Kamli?id=Bd3vet3ylz3lcct6yaxocvlnjwu--------------------------------------------------------------------------------------------------➧Follow SagaHits on:Facebook: https://www.facebook.com/sagahitsInstagram: https://www.instagram.com/sagamusicofficialTwitter: https://twitter.com/Saga_HitsSnapchat: Saga Music Official (@sagamusichits)➧Follow Mankirt Aulakh on:Facebook: https://www.facebook.com/MankirtAulakh/Instagram: https://www.instagram.com/mankirtaulakh/Snapchat: Mankirtaulakh--------------------------------------------------------------------------------------------------Bhangra Teams:VanCity Bhangra (https://www.instagram.com/vancitybhangra)Royal BhangraSong Credits:Title: KamliAlbum: KamliSinger: Mankirt AulakhStarring: Mankirt Aulakh, Roopi GillMusic: Ikwinder SinghDirector: Sukh SangheraLyricist: Veet Baljit & Kammy GrewalProducer: Sumeet SinghMix & Master by: Sameer CharegaonkarLabel: Saga MusicDigitally Managed By: Unisys InfosolutionsOnline Artist Promotions: G.K. Digital"
"6NTADXlO5LA","Pove Pora | 2nd November  2018 | Full Episode 68 | ETV Plus","2018-11-02T17:06:57.000Z","UCi1m4TnmmXGUIY4roVtvjDA","ETV Plus India","23","18.04.11","etv Plus,etv comedy show,3 Idiots,anchor ravi,Chinnadana Neekosam,express raja,hungama,Kick,Nandini Vs Nandini,Pataas,jabardasth,extra jabardasth,naga babu,roja,anchor anasuya,pove pora,comedy short films,yadamma raju,chalaki chanti,sudigali sudeer,anchor suma,comedy show,anchor sreemukhi,comedy skits in telugu,telugu comedy tracks,racha ravi,allare allari,sardaga kasepu,ejunction,anchor pradeep,pataas punches,anchor vishnupriya,getup srinu","619004","4785","441","797","https://i.ytimg.com/vi/6NTADXlO5LA/default.jpg","False","False",""
"a2OXNuGPDcE","Sarkar Promo - 5 | Sun TV","2018-11-02T04:27:07.000Z","UCBnxEdpoZwstJqC1yZpOjRA","Sun TV","24","18.04.11","SunTV,SunTvTamizh,Tamil Channel,sarkar,sarkar movie,sarkar vijay,vijay,actor vijay,tamil sarkar,vijay sarkar,SarkarTrackList,Vijay,ActorVijay,Thalapathy,KeerthySuresh,Varalakshmi,YogiBabu,ARMurugadoss,ARRahman,Vivek,SarkarDeepavali,ARR,NewTamilMovie,SarkarTeaser,SarkarTrailer,VijaySarkar,ThalapathySarkar,SunTVContest,AudioLaunch,Chennai,TamilMovie2018,Simtaangaran,Sun TV Network LTD,Bamba Bakiya,Vipin Aneja,Aparna Narayanan,LyricistVivek","2523651","111665","3809","2423","https://i.ytimg.com/vi/a2OXNuGPDcE/default.jpg","False","False","Sun Pictures presents “Sarkar” Starring Thalapathy Vijay, Keerthy Suresh, Varalaxmi Sarathkumar, Radha Ravi, Yogi Babu, Pazha Karuppiah, Livingston.  Directed by A.R MurugadossMusic By A.R Rahman Produced by: Sun TV Network LTDEditor: Sreekar PrasadDOP: Girish GangadharanArt: T. SanthanamStunts: Ram-LaxmanExecutive Producer: SundarrajAudio Label: Sony Music #Sunpictures #ThalapathyVijay #Sarkar #ARMurugadoss #ARRahman #SunTV"
"F1t6zmvAnp0","ALADDIN | Round2hell | R2h","2018-11-03T14:09:09.000Z","UCt4atlExw8aj3Bm79nv1fig","Round2hell","23","18.04.11","Roumd2hell,R2h,Aladdin,Aladdin R2h,Round2hell new video,R2h new video,Round2hell funny,Round2hell funny video,muradabadi boys,moradabad boys","1845923","246480","4663","37016","https://i.ytimg.com/vi/F1t6zmvAnp0/default.jpg","False","False","1. Get the app here: http://bit.ly/R2HDiwali and Win upto ₹85000 cash in Diwali Contest ! 2.Participate in the contest here: http://bit.ly/ContestDiwali .A young orphan named Aladin, who is often bullied by his peers. Chances upon a life-altering object, a magic lamp. He sets off on a series of adventures and uses the lamp to defeat a bully. Watch yourself to find out what happned in the end.Contact for Email ::- round2hell@gmail.comFollow us on :-→ instagram page : http://instagram.com/round2hellFollow our artists :-→ nazim : http://www.facebook.com/nzm0211→ zayn : http://www.facebook.com/zayn.saifi.50 → wasim : http://www.facebook.com/wasimahmadr2hSubscribe Here ⇨ https://www.youtube.com/c/round2hellSong Credit :-Bazanji - Fed UpLink : https://youtu.be/9-zK_5gn4_sThank You For Watching !"
"NNj8k22pkcc","Baarish ( Full Video ) Neha Kakkar  | Bilal Saeed  | Desi Music Factory","2018-11-01T06:30:23.000Z","UCLtNvbkqea8wN_kGtfgx_Mw","Desi Music Factory","10","18.04.11","tony kakkar,neha kakkar,sonu kakkar,music,song,desi music factory,baarish by neha kakkar,neha kakkar new song,neha kakkar all songs,neha kakkar baarish,bilal saeed,baarish song neha kakkar,love songs,loves songs hindi,new love song,2018 new song,suroor,zindagi mil jayegi","8709389","229950","12224","12659","https://i.ytimg.com/vi/NNj8k22pkcc/default.jpg","False","False","Desi Music Factory Presents‘Baarish’ by Neha KakkarWhen the lips go silent but the heart is screaming. Subscribe to DMF - http://bit.ly/DMF-Subscribe   Song - BaarishSinger - Neha KakkarMusic Produced by Aditya DevComposer & Lyrics - Bilal SaeedProduction house - Beyond Entertainment Director - Prakhar Khemka DoP - Anuj Samtani 1st AD - Vansh Goswami2nd AD - Alice Ekka Focus Puller - ChoteLine Producer - Hiten Jha Gaffer - Mangesh Dutt Special Effects - Anurag Enterprise Colorist - Dilshad Nanji (Coolab)Edit - Post Master ProductionsDigital Marketing - Prateek JainDistribution - Piyush ChandakFollow Desi Music Factory Facebook - https://facebook.com/desimusicfactoryTwitter - https://twitter.com/DesiMFactoryInstagram - https://www.instagram.com/desimusicfa...Tiktok - http://vm.tiktok.com/wmhEe/Snapchat - DMFRecordsFollow Neha Kakkar Facebook - https://www.facebook.com/NehaKakkarOfficial/ Twitter - https://twitter.com/iAmNehaKakkarInstagram - https://www.instagram.com/nehakakkar/ #Baarish #NehaKakkar #NehaKakkarSongs"
"NCD6pkeWjqs","Azhagu - Tamil Serial | அழகு | Episode 293 | Sun TV Serials | 03 Nov 2018 | Revathy | Vision Time","2018-11-03T14:13:30.000Z","UCOpUWgNJq1kUlB3Z5KM7X-A","Vision Time Tamil","24","18.04.11","Azhagu,அழகு,Azhagu Tamil Serial,Full Episode 293,Sun TV Serials,03 November 2018,Thalaivasal Vijay,Vision Time,azhagu serial,azhagu serial today episode,azhagu serial yesterday episode,azhagu tamil serial,azhagu tamil serial today episode,azhagu tv serial,azhagu yesterday tamil serial,azhagu latest sun tv,azhagu latest serial,Revathy tamil serial,Revathy latest serial,Revathy sun tv serial,latest sun tv serial,azhagu latest episodes","609522","2893","629","909","https://i.ytimg.com/vi/NCD6pkeWjqs/default.jpg","False","False","Azhagu Tamil Serial latest Full Episode 293 Telecasted on 03 November 2018 in Sun TV. Azhagu Serial ft. Revathy, Thalaivasal Vijay, Shruthi Raj and Aishwarya in the lead roles. Azhagu serail Produced by Vision Time, Directed by ON Rathnam, Dialogues by Jagan. Azhagu serial deals with the nuances of love between a husband (Thalaivasal Vijay) and wife (Revathi), even though they have been married for decades, and have successful and very strong individual personas.Click here to watch : Azhagu Full Episode 292 https://youtu.be/lKxYS7j_8pkAzhagu Full Episode 291 https://youtu.be/iqySf4wd4i0Azhagu Full Episode 290 https://youtu.be/VPzzSV8ekSgAzhagu Full Episode 289 https://youtu.be/I_7K6TmEJiAAzhagu Full Episode 288 https://youtu.be/1PJAePU0H9oAzhagu Full Episode 287  https://youtu.be/iDF9jlxgXekAzhagu Full Episode 286 - https://youtu.be/JaScjdZ7JPMAzhagu Full Episode 285 https://youtu.be/2B423gq10YAAzhagu Full Episode 284 https://youtu.be/xpOk1eu5lMIAzhagu Full Episode 283 https://youtu.be/z3zkPqAcV7wAzhagu Full Episode 281 https://youtu.be/1t-Paiwlu_kAzhagu Full Episode 280 https://youtu.be/8AqqqFF1A4MAzhagu Full Episode 279 https://youtu.be/7957iF1ifnEAzhagu Full Episode 277 : https://youtu.be/nDgBSjEW6yoSubscribe for latest Azhagu Episodes - http://bit.ly/SubscribeVTLike us on - https://www.facebook.com/visiontimeindia"
"hqo8GZRNkYk","शनिवार Special भजन: बजरंग बाण,शनि अमृतवाणी,Bajrang Baan, Shani Amritwani,HARIHARAN,ANURADHA PAUDWAL","2018-11-03T00:30:38.000Z","UCaayLD9i5x4MmIoVZxXSv_g","T-Series Bhakti Sagar","10","18.04.11","t-series,bhakti,sagar,tseries bhakti,tseries music,top devotional songs,video,bhakti songs,bhakti bhajans,mantra,stuti,vandana,शनि आरती,shani bhajan,hanuman bhajan,हनुमान चालीसा,हनुमान भजन,मंगलवार स्पेशल भजन,शनिवार स्पेशल भजन,शनि भजन,शनिवार भजन,मंगलमूर्ति,मारुति नंदन,जय बजरंगबली,हरिहरन,top hanuman bhajan,morning time bhajan,morning hanuman bhajan,morning shani bhajan,religious,hanuman chalisa,हनुमानजी,शनिदेव song,पवनपुत्र,रामदूत,mahavir","1498580","7140","1462","1348","https://i.ytimg.com/vi/hqo8GZRNkYk/default.jpg","False","False","Subscribe to T-Series: https://www.youtube.com/user/tseriesCLICK ON DURATION TO PLAY ANY SONGBAJRANG BAAN  00:00SHANI AMRITWANI  07:45#TSeriesHanuman Bhajan: BajrangbaanSinger: HariharanMusic Director: Lalit Sen ChanderLyrics: TraditionalAlbum: Shree Hanuman ChalisaMusic Label: T-SeriesShani Bhajan: Shani AmritwaniSinger: Anuradha PaudwalMusic Director: Surinder KohliLyricist: Balbir NirdoshAlbum: Shanidev AmritwaniIf You like the video don't forget to share with others & also share your views.Stay connected with us!!!► Subscribe: http://www.youtube.com/tseriesbhakti► Like us on Facebook: http://www.facebook.com/tseriesbhaktisagar► Follow us on Twitter: https://twitter.com/tseriesbhaktiFor Spiritual Voice Alerts, Airtel subscribers Dial 589991 (toll free) To set popular Bhakti Dhun as your HelloTune, Airtel subscribers Dial 57878881"
