video_id,title,publishedAt,channelId,channelTitle,categoryId,trending_date,tags,view_count,likes,dislikes,comment_count,thumbnail_link,comments_disabled,ratings_disabled,description
"5mHy2bM2Sjg","चमचमीत गावरान चिकन सुक्के | Village Style Chicken Sukka | MadhurasRecipe Ep - 483","2018-12-07T05:30:01.000Z","UCmbua9iiakRr6nuCXxxsKSQ","MadhurasRecipe Marathi","26","18.09.12","Madhurasrecipe,Marathi Recipe,Maharashtrian Padarth,Chicken Sukka Recipe in Marathi,Gavran Chicken Sukka,Gavran Chicken Sukk,गावरान चिकन सुकं,Chicken Sukk,Maharashtrian style,गावरान चिकन,Maharashtrian style authentic chicken,गावराणी कोंबडीचा चिकन रस्सा,Maharashtrian Style Dry Chicken Recipe in Marathi,Village style chicken curry,कोल्हापुरी झणझणीत चिकन,village cooking,Gavrani Kombdi Rassa,village style cooking,village style chicken,chicken sukka","71016","2217","120","742","https://i.ytimg.com/vi/5mHy2bM2Sjg/default.jpg","False","False","Please take a moment to like and subscribe ✿◕ ‿ ◕✿http://www.youtube.com/c/MadhurasRecipeMarathi?sub_confirmation=1मधुराजरेसिपी चे मसाले ऑर्डर करण्यासाठी इथे क्लीक करा - https://amzn.to/2Cq0jz4#MadhurasRecipeMasale / #MRM मधुराजरेसिपी चे पुस्तक ऑर्डर करण्यासाठी इथे क्लीक करा https://amzn.to/2SuyATBhttp://amzn.in/d/jl7MY8lमधुरजरेसीपी पुस्तक घरपोहच मिळण्याकरता, तुमचे नाव आणि पत्ता ९८८११८६६६३ नंबरवर व्हाट्सअँप करा. हा नंबर मधुराच्या नसून हा माय मिरर पुब्लिकेशनचा नंबर आहे. मधुराज रेसिपी बुक किंवा मसाले ऑर्डर कसे करायचे यासाठी हा विडिओ पहाhttps://youtu.be/9Db_owqWJe4---------------------------------------------------------------------------------------------Click for detail Recipe - http://www.madhurasrecipe.com/regional-recipe/marathi-video-recipesVisit Facebook page - https://business.facebook.com/madhurasrecipeFor Business inquiries please email us on madhurasrecipe@gmail.com Madhurasrecipe facebook group link - https://www.facebook.com/groups/madhurasrecipe/After making mutton sukka there were lot many requests chicken sukka recipe. So here is the chicken sukka recipe. As you all know chicken sukka is semi dry gravy. It tastes just awesome. Do try this yummy and easy recipe and drop a comment for me. Do not forget to like, share and subscribe.Ingredients:For Masala:• 1 tbsp Oil• 1 tsp Cumin seeds• 1 cup sliced Onion• 4~5 Garlic cloves• 1/2” chopped Ginger• 2~3 tsp dry grated Coconut• Coriander leavesFor Chicken Sukka• 3~4 tsp Oil• 1 tsp Kanda lasun masala• 1~2 tsp Red chili powder• 250 gm Chicken• Salt to tasteMethod:For Masala• Heat up oil in a pan. • Add cumin seeds, onion, garlic, ginger and fry everything on   medium heat until onion gets light golden color. • When onion gets light golden color, add dry coconut and fry about   3-4 minutes more. • Turn off the gas and let the mixture cool down completely. • Transfer the mixture into a blender jar, add coriander leaves and   blend into smooth paste. • Do not add water while blending or if at all required use minimum   amount water. • Masala is already.For Chicken Sukka• Heat up oil in a pan. Add blended masala and fry for just about 2   minutes. • Add kanda lasun masala, red chili powder and mix well. • Fry everything well for another 2 minutes. • When masala begins to release a little oil add chicken and mix   well. • Add salt and mix well. • Fry everything for about 2 minutes. • Add about a tsp water so that chicken won’t stick to the bottom   of the pan. • Cover and cook on medium heat for about 8-10 minutes. • Remove the lid, mix well and cook covered again. • If you feel the chicken is too dry or sticking to the bottom of the   pan then add just a tsp water and cook again. • Cook until the chicken cooks nice and soft or for about 20-25   minutes. • Keep on mixing at the intervals. • Chicken sukka is already. • You can have it with bhakari, fulka, chapatti, roti, naan or rice too.Subscribe to my other channelsMadharasrecipehttp://www.youtube.com/c/madhurasrecipe?sub_confirmation=1Hindi channelhttps://www.youtube.com/channel/UCIdtPLjTb111r4iubQ9Mq5A?sub_confirmation=1For more Such Recipesतांबडा रस्सा, सुकं मटण | Kolhapuri Style Spicy Mutton Curry | Kolhapuri Sukha Mutton Recipehttps://www.youtube.com/watch?v=6E31PI85Yuw&t=1sमटण करी | Mutton Curry | madhurasrecipe | Dhaba style Mutton Curry | Mutton Rassahttps://www.youtube.com/watch?v=ZFw9Kwcw3g4&t=2sखीमा रेसिपी | How to make Mutton Kheema | Easy Kheema Recipe | Madhurasrecipehttps://www.youtube.com/watch?v=-gp9Y3FOCuEचिकन दम बिर्याणी | Hyderabadi Chicken Dum Biryani | Step by Step-Chicken Biryani | Restaurant Stylehttps://www.youtube.com/watch?v=NeMLex6b6-4&t=4sढाबा स्टाईल चिकन मसाला | How to make Chicken Masala | Chicken Masala | MadhurasRecipe Ep - 404https://www.youtube.com/watch?v=u73fbTpDGvc&t=1sतर्रीबाज चिकन हंडी | Chicken Handi Recipe | How to make Handi Chicken | MadhurasRecipe | Ep - 349https://www.youtube.com/watch?v=EoGx3rzHXe8&t=3sकुरकुरीत नी चमचमीत सुरमई फ्राय | How to make Surmai Rava Fry | MadhurasRecipe | Ep - 326https://www.youtube.com/watch?v=PzoqlY12JWQ&t=3sभरलेले पापलेट | Stuffed Pomfret | Bharala paplet Marathi | MadhurasRecipe | Ep - 319https://www.youtube.com/watch?v=EZsBJcu3dDYकुरकुरीत बोंबील फ्राय | Crispy Bombil Fry | Crispy Bombay Duck Fry | MadhurasRecipe | Ep - 415https://www.youtube.com/watch?v=p0HsvrWRODg&t=9sझणझणीत कोळंबी भात | Kolambi bhaat | Prawn Rice | Spicy Shrimp Rice | MadhurasRecipe | Ep - 322https://www.youtube.com/watch?v=siBkdZs-B_s"
"f5Fy1pgl7kw","Ellen Wants to Throw an On-Air 50th Birthday Party for Jennifer Aniston","2018-12-08T15:00:02.000Z","UCp0hYYBW6IMayGgR-WeoCvQ","TheEllenShow","24","18.09.12","ellen,ellen degeneres,degeneres,the ellen show,ellen fans,ellen tickets,ellentube,ellen audience,new,jennifer aniston,jennifer,aniston,birthday party,50th birthday,interview,season 16,50,jennifer aniston 50,dumplin,dumplin movie,netflix,netflix is a joke,dumplin netflix,dolly parton,dolly,parton,beauty pageant,rachel green,friends,reese witherspoon,steve carell,new show,new movie,jennifer aniston movie,boxing lessons,boxing,facetime","410718","8625","183","664","https://i.ytimg.com/vi/f5Fy1pgl7kw/default.jpg","False","False","With Jennifer Aniston turning 50 next year, Ellen offered to host her birthday party on her show! Plus, the actress talked about FaceTiming with Ellen to stay in touch, and taking boxing lessons to stay in shape.#JenniferAniston#TheEllenShow#Dumplin"
"I9fvxGG5GQU","Jamui DM Dharmendra Kumar और Sharddha का क्या है Connection जो Vatsala को देखना पड़ा ये दिन |","2018-12-08T14:36:41.000Z","UCGwWE0AEHEkHTUzKrzDjZSQ","Live Cities Media Private Limited","25","18.09.12","jamui dm Dharmendra kumar,Dharmendra kumar DM Jamui,Dharmendra kumar jamui dm,vatsala singh,vatsala singh jamui,jamui dm wife,wife jamui dm,Jamui,Jamui News,Jamui DM,जमुई डीएम,Bihar News,Bihar,latest bihar news,जमुई धर्मेंद्र कुमार,डीएम जमुई,DM’s Wife,DM divorce case,Dharmendra’s wife Vatsala,Dharmendra Vatsala Divorce case,Patna,SDM Shraddha Shandaliyayan,धर्मेंद्र कुमार आईएएस,धर्मेंद्र कुमार वीडियो,धर्मेंद्र कुमार जमुई डीएम,धर्मेंद्र कुमार जमुई","63249","833","210","273","https://i.ytimg.com/vi/I9fvxGG5GQU/default.jpg","False","False","Jamui DM Dharmendra Kumar और Sharddha का क्या है Connection जो Vatsala को देखना पड़ा ये दिन | Live Cities ExClusivePart 1 : Jamui DM Dharmendra Kumar के Vatsala Singh से Divorce का है तीसरा एंगल | LiveCities ExClusive https://youtu.be/Q4mPeKTfQs8Part 2 : Jamui DM Dharmendra Kumar - Vatsala Singh Divorce case में सबसे बड़ा खुलासा | Live Cities ExClusivehttps://youtu.be/52ZlTr1r5XMPart 3 : Jamui DM Dharmendra Kumar - Vatsala Singh Divorce case में पति, पत्नी और वो वाली कहानी | Live Cities ExClusivehttps://youtu.be/czKvF-jZXEMPart 4 : Jamui DM Dharmendra Kumar - Vatsala Singh Divorce Case  में कौन है Sharddha | Live Cities ExClusivehttps://youtu.be/LHuS6QEb3PkPart 5 : Jamui DM Dharmendra Kumar और Sharddha का क्या है Connection जो Vatsala को देखना पड़ा ये दिन | Live Cities ExClusivehttps://youtu.be/I9fvxGG5GQUPart 6 : Jamui DM Dharmendra Kumar और Sharddha के Mobile Number, Call Details से खुला राज | Live Citieshttps://youtu.be/aP-9lrA3KoIPart 7 : Jamui DM Dharmendra Kumar अब क्या जवाब दे पाएंगे Vatsala Singh को | Live Cities ExClusivehttps://youtu.be/m9u5Ge77UIkPart 8 : Jamui DM Dharmendra Kumar- Vatsala Singh Divorce case क्या Sharddha की वजह से Planned था | Live Cites ExClusivehttps://youtu.be/8Vttc7-5a5c#Jamui #JamuiDM #DharmendraKumar #VatsalaSingh #Sharddha#जमुई #जमुई #जमुईजिलाधिकारी #जिलाधिकारीजमुईStay Connected with Us  :Subscribe Us for Latest News & Updates ►  https://goo.gl/mjiPnpFacebook ► https://goo.gl/5RLYLFTwitter ► @Live_Cities"
"vpWUwmOAafM","Annoying Strangers || Mahathalli","2018-12-05T13:05:14.000Z","UCFnLGH9BGpJLJMMlRMr-f5Q","Mahathalli","24","18.09.12","telugu comedy videos,telugu funny videos,telugu comedy webseries,comedy videos telugu,telugu comedy shortfilms,comedy shortfilms,telugu,comedy,mahathalli,mahathalli amma,Annoying Strangers Mahathalli,Mahathalli Latest Video","588895","15447","630","1660","https://i.ytimg.com/vi/vpWUwmOAafM/default.jpg","False","False","DOP : Seshi KiranEditing : Yuva KiranScript: Sai SomayajuluPublicity Designer : PradeepHope to entertain you all..!!!Thank you for Subscribing…. XOXOLive the Moment.  Cheers..!!!#TamadaMedia #Wirally #MahathalliPowered By Tamada MediaFollow me onhttps://www.facebook.com/Mahathalli/https://twitter.com/mahathallihttps://www.instagram.com/mahathalli/"
"-1ewWf7teZ0","Silsila Badalte Rishton Ka - 6th December 2018 - सिलसिला बदलते रिश्तों का","2018-12-07T04:11:06.000Z","UC55IWqFLDH1Xp7iu1_xknRA","Colors TV","24","18.09.12","Colors TV,colorstv,hindi shows,VOOT,new promo,clips,3 minute clip,Silsila voot clip,Silsila,drama,extra marital affair,sislsila,badalte rishton ka,Silsila full show,childhood friend,Silsila Badalte Rishton Ka,Drashti Dhami,Nandini,Shakti Arora,Kunal,Aditi Sharma,Dr Mauli,Rajdeep,Abhinav Shukla,love story,husband,wife,cheating,harassment,#silsila","231091","782","148","60","https://i.ytimg.com/vi/-1ewWf7teZ0/default.jpg","False","False","To watch the full episode of 'Silsila Badalte Rishton Ka' anytime, Download the Voot app now or Visithttps://www.voot.com/shows/silsila/1/606786/kunal-mauli-ready-to-reconcile/679967 Two best friends, one broken marriage, and a dangerously addictive affair! Follow the dramatic twists and turns in the lives of Mauli, her husband Kunal, and her best friend Nandini. What happens when the unhappily married Nandini realises that the mutual admiration between her and Kunal has turned into fatal attraction? Will friendship be forsaken for love? Will one woman's happiness becomes another woman's heartbreak? Find out in Silsila Badalte Rishton Ka."
"jsOme6a6aqQ","Dhruva Sarja Engagement Diamond Ring Rate ||  Dhruva Sarja and Prerana","2018-12-08T09:40:00.000Z","UC8hVoXNFmuLgz4wXRAxAbXg","Top Kannada TV","24","18.09.12","Top kannada TV,sandalwood news,kannada film news,sandalwood trailers,Dhruva Sarja Engagement Diamond Ring Rate,Dhruva Sarja and Prerana,dhruva sarja and prerana photos,dhruva sarja and prerna engagement,dhruva sarja and prerana love story,Dhruva Sarja Engagement Diamond Ring,Dhruva Sarja Engagement ring,Dhruva Sarja Engagement rings","32154","281","54","30","https://i.ytimg.com/vi/jsOme6a6aqQ/default.jpg","False","False","Watch Dhruva Sarja Engagement Diamond Ring Rate ||  Dhruva Sarja and PreranaKannada Short films, Darshan, Sudeep, Yash, Shivarajkumar, Puneethrajkumar Sandalwood updates,news,gossips and interviewsFacebook : https://www.facebook.com/TopkannadaTV"
"dUiRtHr1HO8","PAKKA (2018) | New Released Full Hindi Dubbed Movie | Vikram Prabhu,Nikki Galrani |South Movies 2018","2018-12-08T16:30:01.000Z","UCt7_pnSRPKU3bu2GqmgH8gQ","WAMIndiaMovies","1","18.09.12","PAKKA,pakka full movie in hindi dubbed,pakka new released movie 2018,vikram prabhu new movies 2018,nikki galrani new movies 2018,hindi dubbed movies,south movies 2018 new,sauth hindi dubbed movies,2018 released bollywood movies,south movie 2018,hindi movie 2018,new south movie 2018,south indian movies dubbed in hindi full movie 2018 new,new sauth movie 2018 hindi dubbed,hindi movies 2018 full movie,south indian action movies in hindi dubbed","395142","6475","449","266","https://i.ytimg.com/vi/dUiRtHr1HO8/default.jpg","False","False","PAKKA is a South Indian Blockbuster Full Movie in Hindi Dubbed Starring Vikram Prabhu,Nikki Galrani. It's a Hindi Dubbed Movies 2018 Full Movie, Action Movie, 2018 New Released Full Hindi Dubbed Movie.Click to Susbscribe Us: http://goo.gl/Bscph8Pakkaa starts with ‘Dhoni’ Kumar (Vikram Prabhu) trying to save a heart-broken Nadhiya (Bindu Madhavi) from committing suicide. Nadhiya narrates her poignant tale to Kumar, who actually resembles Paandi (Vikram Prabhu in another role), her lover. After listening to the partly-convincing love story between them, Kumar assures to help her find Paandi. Meanwhile, Nadhiya finds that Kumar, too, is a heart-broken person. Upon her compulsion, Kumar, a self-confessed fan of Mahendra Singh Dhoni, opens up his love story with Radha (Nikki Galrani), who is a huge fan of Rajinikanth. Will Nadhiya, who has been abandoned by her family for falling in love with Paandi, be able to find him? Will Kumar be able to live his life happily thereafter?_____________________________PAKKA,pakka full movie in hindi dubbed,pakka new released movie 2018,vikram prabhu new movies 2018,nikki galrani new movies 2018,hindi dubbed movies,south movies 2018 new,sauth hindi dubbed movies,2018 released bollywood movies,south movie 2018,hindi movie 2018,new south movie 2018,south indian movies dubbed in hindi full movie 2018 new,new sauth movie 2018 hindi dubbed,hindi movies 2018 full movie,south indian action movies in hindi dubbed"
"TXIHTqLXvp0","5 राज्यों के लिए Exit Poll जारी, राजस्थान में कांग्रेस आगे, मध्य प्रदेश में कांटे की टक्कर","2018-12-07T13:12:05.000Z","UC1tnj_v8Sn-hWERFvqSjBWQ","inKhabar","25","18.09.12","Rajasthan Exit Poll Result 2018,Exit Poll 2018 Madhya Pradesh,Madhya Pradesh 2018 Exit poll result,Chhattisgarh 2018 Exit poll result,Mizoram 2018 Exit poll result,Exit poll result Rajasthan 2018,Exit Poll 2018 LIVE Updates,Telangana,Madhya Pradesh,Chhattisgarh,Mizoram,Chhattisgarh assembly election 2018,BJP in Exit Poll result","258146","1236","352","188","https://i.ytimg.com/vi/TXIHTqLXvp0/default.jpg","False","False","While BJP and Congress have emerged as the two main opponents, regional parties also seem to be having a sway in the states of Rajasthan, Telangana, Madhya Pradesh, Chhattisgarh and Mizoram. Assembly election is over now for these five stats and all are waiting for Vidhan Sabha election 2018 results, expected on 11 December 2018. In Chhattisgarh, BSP has joined hands with Ajit Jogi-led Janta Congress Chhattisgarh and will be looking to create a dent in the vote-base of both the traditional parties in the state. Meanwhile, in Telangana, the incumbent TRS under K Chandrashekhar Rao will be looking to coming back to power. In Madhya Pradesh, the BJP will be looking to continue in power after running the government for three successive terms under chief minister Shivraj Singh Chouhan, while in Mizoram the fight is between the MNF and the BJP.#FiveStatesExitPollResult2018 #ExitPollResult2018 #BJPvsCongressFor More Information visit us: http://www.inkhabar.com/Connect with us on Social platform at https://www.facebook.com/InkhabarConnect with us on Social platform athttps://twitter.com/InkhabarSubscribe to our YouTube channel: https://www.youtube.com/user/itvnewsindiaRajasthan Exit Poll Result 2018Exit Poll 2018 Madhya PradeshMadhya Pradesh 2018 Exit poll resultChhattisgarh 2018 Exit poll resultMizoram 2018 Exit poll resultExit poll result Rajasthan 2018Rajasthan exit pollExit Poll 2018 LIVE UpdatesExit Poll 2018 UpdatesTelangana, Madhya Pradesh, Chhattisgarh, MizoramChhattisgarh assembly election 2018BJP in Exit Poll result"
"hssq_GKtHyA","WAQT KA KHEL | BakLol Video |","2018-12-04T10:30:06.000Z","UCQfE97UMDGgKCFb7iGM8Btg","BakLol Video","24","18.09.12","funny video,viral video,motivational video,baklol video,baklol video new,prince verma,yogesh kathuria,sanjhalika shokeen,viral vines,entertainment,hindi funny video,baklol","1243776","31745","2920","3303","https://i.ytimg.com/vi/hssq_GKtHyA/default.jpg","False","False","To find the people that you've crossed paths with, download Happn app: http://gethap.pn/zfFGAfThis video is a true love story of a boy includes fun, love, motivation.follow us on Instagram- https://www.instagram.com/baklolvideo/Cast-Pankaj SharmaSanjhalika ShokeenYogesh KathuriaNikitaPrince VermaAadi NagarRahul KanojiaHimanshu DaroliaMusic fromCsy Music- https://www.youtube.com/watch?v=rg8182OBdqY&feature=youtu.beBeatbyShahedhttps://youtube.com/c/djshahmoneybeatzhttps://soundcloud.com/djshahmoneybeatzhttps://instagram.com/imshahedKofi Beatzhttps://soundcloud.com/01kofibeatzhttps://www.facebook.com/kofi.product...https://www.instagram.com/01kofiDOP- Mandy CSCManaged by: Sociopool India private limited (https://www.sociopoolindia.com/)"
"UOMlxvDsIBE","Honor 8C Unboxing & First Look - World's First Snapdragon 632 and More🔥🔥🔥","2018-12-08T08:04:00.000Z","UCOhHO2ICt0ti9KAh-QHvttQ","Technical Guruji","28","18.09.12","Honor 8C,honor 8c review,honor 8c unboxing hindi,honor 8c camera,Honor 8C India,Honor 8C Price,Honor 8C Features,Honor 8C Smartphone,Honor,Honor India,honor,honor 8c first look,honor 8c india,honor 8c hands on,honor 8c features,honor 8c launch date,honor 8c hindi,honor 8c specifications,honor 8c 2018,honor 8c launch,honor 8x,honor 8c specification,Technicalguruji,Technical guruji,Gaurav Chaudhary","443255","32503","1296","5699","https://i.ytimg.com/vi/UOMlxvDsIBE/default.jpg","False","False","Namaskaar Dosto, is video mein maine aapse Honor 8C Smartphone ke baare mein baat ki hai aur share ki hai iski Unboxing aur Overview. Honor 8C mein 6.26 HD+ Screen hai 19.5:9 aspect ratio ke saath mein aur isme hai Qualcomm Snapdragon 632 Octa Core processor saath mein hai 4GB aur 32GB/64GB ki Internal Storage. Honor 8C mein Dual Rear camera setup 13MP + 2MP aur saath mein 8MP front facing camera. Honor 8C mein 4000mAh ki battery hai aur saath mein aapko AR lens ka option bhi milta hai front aur rear camera mein. Iske alawa isme Fingerprint Scanner aur Face Unlock ka option bhi hai. India mein Honor 8C ki price hai 11,999INR 4GB/32GB varient ke liye aur 12,999INR 4GB/64GB ke option ke liye. Mujhe umeed hai ki aapko Honor 8C ki yeh video pasand aayegi. Share, Support, Subscribe!!!Subscribe: http://bit.ly/1Wfsvt4Android App: https://technicalguruji.in/appYoutube: http://www.youtube.com/c/TechnicalGuruji Twitter:  http://www.twitter.com/technicalgurujiFacebook: http://www.facebook.com/technicalgurujiFacebook Myself: https://goo.gl/zUfbUUInstagram: http://instagram.com/technicalgurujiGoogle Plus: https://plus.google.com/+TechnicalGurujiWebsite: https://technicalguruji.in/Merchandise: http://shop.technicalguruji.in/About : Technical Guruji is a YouTube Channel, where you will find technological videos in Hindi, New Video is Posted Everyday :)"
"4azUvsw4CcI","Dilli Ki Shaadi | Stand up Comedy by Nishant Tanwar","2018-12-07T05:30:00.000Z","UCUK8HXeI3WqXczgMkT5XUWQ","Nishant Tanwar","23","18.09.12","dilli ki shaadi,nishant tanwar,nishant comedy,mahacool,nishant tanwar comedy,nishant dilli ki shaadi","471331","20298","1321","457","https://i.ytimg.com/vi/4azUvsw4CcI/default.jpg","False","False","Stand up comedian Nishant Tanwar explains what is so different about the weddings in Delhi. for show queries: contact@nishanttanwar.com or call 8454865007 / ‭ 9762187945‬ ‬ / ‭9167473633‬"
"mphFOAoShNo","Poll of Polls: MP में 15 साल बाद कांग्रेस की वापसी का, क्या कहते हैं महा एग्जिट पोल के आंकड़ें ?","2018-12-08T02:55:03.000Z","UCmphdqZNmqL72WJ2uyiNw5w","ABP NEWS HINDI","22","18.09.12","#RajasthanAssemblyelection 2018,#RajasthanElections,RajasthanElections2018,Rajasthan Assembly Election 2018,rajasthan election 2018 opinion poll latest,rajasthan election 2018 live news,abp news,abp news hindi,abp news live,abp hindi,aaj tak live,abp news hindi live,telangana elections,vidhan sabha chunav latest news,up,rajasthan chunav exit poll,election exit poll rajasthan,bjp vs congress,exit poll rajasthan,vote news,breaking news,mp exit poll,mp news","155486","944","158","166","https://i.ytimg.com/vi/mphFOAoShNo/default.jpg","False","False","पांच राज्यों में हुए विधानसभा चुनाव के नतीजे 11 दिसंबर को आएंगे. इससे पहले एबीपी न्यूज़-लोकनीति(CSDS) का एग्जिट पोल के आंकड़े आ गए हैं. राजस्थान में बीजेपी की सरकार को हटाकर कांग्रेस सत्ता पलटती नज़र आ रही है तो वहीं मध्य प्रदेश में भी बीजेपी को कड़ा झटका लगा है.Subscribe Our Channel: https://www.youtube.com/channel/UCmphdqZNmqL72WJ2uyiNw5w?sub_confirmation=1About Channel:ABP News एक समाचार चैनल है जो नवीनतम शीर्ष समाचारों, खेल, व्यवसाय, मनोरंजन, राजनीति और कई और अन्य कवरेज प्रदान करता है। यह चैनल मुख्य रूप से भारत के विभिन्न हिस्सों से नवीनतम समाचारों का विस्तृत विवरण प्रदान करता है।ABP News is a news hub which provides you with the comprehensive up-to-date news coverage from all over India and World. Get the latest top stories, current affairs, sports, business, entertainment, politics, astrology, spirituality, and many more here only on ABP News.ABP News is a popular Hindi News Channel made its debut as STAR News in March 2004 and was rebranded to ABP News from 1st June 2012.The vision of the channel is 'Aapko Rakhe Aagey' -the promise of keeping each individual ahead and informed. ABP News is best defined as a responsible channel with a fair and balanced approach that combines prompt reporting with insightful analysis of news and current affairs.ABP News maintains the repute of being a people's channel. Its cutting-edge formats, state-of-the-art newsrooms commands the attention of 48 million Indians weekly.Watch Live on http://abpnews.abplive.in/live-tvABP Hindi: http://abpnews.abplive.in/ABP English: http://www.abplive.in/Download ABP App for Apple: https://itunes.apple.com/in/app/abp-live-abp-news-abp-ananda/id811114904?mt=8Download ABP App for Android: https://play.google.com/store/apps/details?id=com.winit.starnews.hin&hl=enSocial Media Handles:Instagram: https://www.instagram.com/abpnewstv/Facebook: https://www.facebook.com/abpnews/Twitter: https://twitter.com/abpnewstvGoogle+: https://plus.google.com/+abpnews"
