video_id,title,publishedAt,channelId,channelTitle,categoryId,trending_date,tags,view_count,likes,dislikes,comment_count,thumbnail_link,comments_disabled,ratings_disabled,description
"PtFY3WHztZc","Simmba | Official Trailer | Ranveer Singh, Sara Ali Khan, Sonu Sood | Rohit Shetty | December 28","2018-12-03T07:15:26.000Z","UCqZR7KVVsZRSfezZKJllxVQ","Reliance Entertainment","24","18.05.12","Simmba,ranveer singh,Simmba Movie Teaser,Ranveer Singh,Simmba Teaser,ranveer singh simmba trailer,ranveer singh simmba,simmba official trailer,simmba teaser,simmba first look,simmba action t,marathi,golmaal again,ashutosh rana,sonu sood,chennai express,golmaal,rohit,tseries,dharma productions,deepika padukone,ranveer,latest hindi trailer,action movie,simmba trailer,action,action movies,karan johar,ajay devgan,sara ali khan,singham,siddharth jadhav","32447827","540710","87140","85604","https://i.ytimg.com/vi/PtFY3WHztZc/default.jpg","False","False","Simmba is an orphan from Shivgadh from where our beloved Singham was born and raised. Contrary to the philosophies of Singham, Simmba believes that a Corrupt Officer’s life is an ideal life which inspires him to become one. While Simmba enjoys all the perks of being an immoral and unethical Police Officer, a twist in the tale transforms him and forces him to choose the righteous path.Reliance Entertainment presentsRohit Shetty PicturezIn association with Dharma Productions“Simmba”Produced by : Hiroo Johar, Rohit Shetty, Apoorva Mehta & Karan JoharDirected by: Rohit ShettyStar Cast : Ranveer Singh, Sara Ali Khan, Sonu Soodalong withSiddharth Jadhav, Ashutosh RanaReleasing Worldwide on December 28, 2018 in cinemas near you!For more information log on:Facebook: https://www.facebook.com/RelianceEnt/ Twitter: https://twitter.com/RelianceEnt Instagram: https://www.instagram.com/reliance.entertainment/#Simmba"
"eTls6-julhU","Zero: ISSAQBAAZI Video Song | Shah Rukh Khan, Salman Khan, Anushka Sharma, Katrina Kaif | T-Series","2018-12-04T07:13:00.000Z","UCq-Fj5jknLsUf-MWSy4_brA","T-Series","10","18.05.12","zero song,zero video song,issabaazi song,issaqbaazi video song 2018,video song zero issaqbaazi,zero movie video songs,video songs zero 2018,best song of zero,Issaqbaazi,ISSAQBAAZI,Zero,Shah Rukh Khan,Salman Khan,Anushka Sharma,Katrina Kaif,t series songs 2018,salman khan,tseries,zero mera naam tu,zero songs,shahrukh khan songs 2018,zero all song,anushka sharma songs","15920246","407326","28391","42535","https://i.ytimg.com/vi/eTls6-julhU/default.jpg","False","False","Presenting the full song Issaqbaazi from the most awaited Bollywood movie Zero. The film is starring Shah Rukh Khan, Anushka Sharma and Katrina Kaif and directed by Aanand L Rai. Movie Releases in cinemas On ► 21st December, 2018. #Issaqbaazi #ShahRukhKhan #SalmanKhan #Zero-------------------------------------------------------------------------------------------------------♪ Available on ♪iTunes : http://bit.ly/Issaqbaazi-Zero-iTunesHungama : http://bit.ly/Issaqbaazi-Zero-HungamaSaavn : http://bit.ly/Issaqbaazi-Zero-SaavnGaana : http://bit.ly/Issaqbaazi-Zero-GaanaApple Music : http://bit.ly/Issaqbaazi-Zero-Apple-MusicAmazon Prime Music : http://bit.ly/Issaqbaazi-Zero-Amazon-Prime-MusicGoogle Play : http://bit.ly/Issaqbaazi-Zero-Google-PlayWynk : http://bit.ly/Issaqbaazi-Zero-Wynk♫ Song Credits ♫♪ Film : Zero ♪ Song : Issaqbaazi♪ Music : Ajay-Atul ♪ Lyrics : Irshad Kamil ♪ Singer : Sukhwinder Singh, Divya Kumar ♪ Recorded & mixed by : Vijay Dayal @ YRF studios   ♪ Assisted by Chinmay Mestry ♪ Music composed, arranged and produced by: Ajay- Atul ♪ Music and Rhythm conducted by: Ajay-Atul ♪ Mastered By: Donal Whelan at Hafod Mastering (Wales) ♪ Musician coordinator: Ramanand shetty♪ Music Label: T-Series ___Enjoy & stay connected with us!► Subscribe to T-Series: http://bit.ly/TSeriesYouTube► Like us on Facebook: https://www.facebook.com/tseriesmusic► Follow us on Twitter: https://twitter.com/tseries► Follow us on Instagram: http://bit.ly/InstagramTseries"
"blwXR3Mp1BE","23 SMART LIFE HACKS FOR EVERY OCCASION","2018-12-02T00:30:02.000Z","UC295-Dw_tDNtZXFeAPAW6Aw","5-Minute Crafts","26","18.05.12","5-Minute Crafts,DIY,Do it yourself,crafts,trucos,5 minutes craft,life hacks,5 minute craft,trucos de belliza,proyectos faciles,useful things,lifehacks,tricks,tips,DIY projects,DIY activities,Handcraft,Tutorial,howto,sexual harassment,how to defend yourself,rapist attack,fight harassment,fight attack,how to,escape,take off handcuffs,pain spots,hits,groin area,save your life,earthquake,bandages,extreme survival,emergency situation,cuts,bruises","62588587","535955","117432","34186","https://i.ytimg.com/vi/blwXR3Mp1BE/default.jpg","False","False","BEST HACKS FOR EXTREME SITUATIONSSurvival hacks and skills are essential for anyone who lives in the city or in wildness. It doesn't matter what the situation is there are always at least one or two survival hack and skills you need to now.  Using what you have, to get what you need is the key to successful survival scenario. Of course, sometimes you need to improvise, but still, you need to know the main surviving tips.So, what are the most useful safety hacks and skills that you need to know? We have a collection of uncommon solutions to common and uncommon problems. If you're a woman, you've probably experienced a nervous feeling when walking alone at night. You need to watch our video as it has a great compilation of self-defense techniques. It’s better to be prepared for every situation because it could save your life. So, if you are attacked you should punch the attacker in the groin as it will literally paralyze the attacker and you will have just enough time to escape. The main spots you should beat are eyes, nose, throat, chest, knees, and groin because they are the most vulnerable. Watch our video carefully as we collected the most effective moves to escape from the attack.Pay your attention to medical lifehacks that are helping to ease the pain, get rid of bruises more quickly, cure minor burns and cuts.Also, in our video, we have a lot of lifehacks for extreme situations and tons of survival tips such as how to remove a splinter, how to bear with a migraine without using medicine, how to use ear candle to cure clogged ear.As a bonus, we prepared a list of useful relaxing acupuncture exercises. Acupuncture is a specific type of massage that relies primarily on using the fingers to apply pressure to various points on the body. We share with you best acupressure points to treat body pains and aches.Acupressure can provide relief for a number of different pains and ailments, nourishes blood and promotes relaxation.TIMESTAMPS:01:08 Forget about bruises01:50 Self-defense techniques03:25 Clogged ear?05:21 Keep mosquitos away09:17 Best acupressure points----------------------------------------------------------------------------------------Our Social Media:Facebook: https://www.facebook.com/5min.crafts/Instagram: https://www.instagram.com/5.min.crafts/Twitter: https://twitter.com/5m_craftsSubscribe to 5-Minute MAGIC: http://bit.ly/2ldditZSubscribe to 5-Minute Crafts GIRLY: https://goo.gl/fWbJqzSubscribe 5-Minute Crafts KIDS: https://goo.gl/PEuLVtThe Bright Side of Youtube: https://goo.gl/rQTJZz----------------------------------------------------------------------------------------For more videos and articles visit:http://www.brightside.meMusic by Epidemic Sound: https://www.epidemicsound.com/"
"L1V3w9rb3x4","FilterCopy | When Your Partner Is Annoying But Cute | Ft. Ayush Mehra and Aisha Ahmed","2018-12-04T06:59:14.000Z","UC7IMq6lLHbptAnSucW1pClA","FilterCopy","23","18.05.12","filtercopy,ayush mehra,aisha ahmed,cute,couple,relationship,girlfriend,boyfriend,amit bhadana,ashish chanchlani,mostly sane,prajakta koli,beyounick,elvish yadav,love,annoying,partner,mithila,dhruv,little things,what the folks,adulting,jordindian,bhuvam bam,bb,emiway,raftaar,relatable","1694880","95695","1382","3220","https://i.ytimg.com/vi/L1V3w9rb3x4/default.jpg","False","False","Can't live with you. Can't live without you.WRITERNAYANA SHYAM DIRECTORNAYANA SHYAM DOPISHANI ROY ASSISTANT DIRECTORRAJAT TANJEJAPRANAV SINGHPRODUCERHITESH PARDESHI CREATIVE PRODUCERNISHAAD JAVERI EXECUTIVE PRODUCERKARAN DEV CAST (in alphabetical order)AISHA AHMEDAYUSH MEHRAYASHASWINI DAYAMA EDITORJAICY MATHEW COLOR GRADINGISHANI ROY SOUND DESIGNSUDHANSHU GAUR GRAPHICSMANOJ OMRESHREYA SETHIGAURAV JHAMB  MAKEUP AND HAIR JANAK THAPA ZOYA WARDROBEMAHENDRA R PRASAD  VIDEO OPERATIONSRAUNAK RAMTEKE SUBTITLINGNAYANA SHYAM CAMERA ATTENDANTAADESH D SIDDHU SOUND RECORDISTSONAL ACHAREKAR SPOTCHANDAN KUMAR"
"HHk-Fk7wTfo","Marana Mass Lyric Video– Petta | Superstar Rajinikanth | Sun Pictures | Karthik Subbaraj |Anirudh","2018-12-03T12:29:24.000Z","UCBnxEdpoZwstJqC1yZpOjRA","Sun TV","24","18.05.12","SuperStar,SuperStarRajiniKanth,Rajinikanth,SunPictures,KarthikSubbaraj,Anirudh,AnirudhRavichander,Vivek,LyricistVivek,SPB,SPBalasubramanyam,Petta,MaranaMass,SouthMovie,TamilMovie,PettaPongal,PettaParak,PettaPongalParak","6184076","313902","29502","20604","https://i.ytimg.com/vi/HHk-Fk7wTfo/default.jpg","False","False","Sun Pictures presents the Official Lyric Video of #MaranaMass – The First Single from #Petta Song : Marana MassMovie: PettaProducer: Sun TV Network LTD Director: Karthik SubbarajComposed by: Anirudh RavichanderLyrics: VivekVocals: S P Balasubrahmanyam and Anirudh Ravichander Lyric video: Ranjit Kumar (SFTS MEDIA)Bass - Naveen NapierTrumpet - Thomas, Ben, Maxwell, BabuTrombone - Maxwell, BabuFrench Horn - ThomasFlugel Horn - BenRhythm & Percussions - Maa Dhakinakali Singha Baja, OrissaRibash Naik, Dillu Naik, Bikash Naik, Ashok Naik, Guddu Naik, Ajaya Naik & Subash NaikRhythm Conducted by MT Aditya & AnanthakrishnanRhythm Editor - Rajesh Kannan, Ishaan ChhabraMaa Dhakinakali Singha Baja, Orissa Rhythm Co-ordinated by Srivijay, JagadishBacking Vocals - KaKa Balachander, Ananthakrrishnan & Shashank Keyboards, Synth and Rhythm Programming - Anirudh RavichanderAdditional Rhythm Programming - Nagi, Sidhharth & ShashankOrchestral Programming - Ishaan ChhabraMusic Advisor - Ananthakrrishnan Recorded atAlbuquerque Records, ChennaiRecording Engineers - Srinivasan, AnanthakrrishnanAM Studios, ChennaiChief Engineer - S SivakumarRecording Engineers - Pradeep Menon, Manoj Raman, Aravind M S, Aditya Ganesh Kodandapani Audio Labs, ChennaiRecording Engineer - Kannu KumaranKnack Studios, ChennaiRecording Engineers - Rajesh Kannan, VigneshMixed by Vinay Sridhar & Srinivasan at Albuquerque Records, ChennaiMastered by Shadab Rayeen at New Edge Studios, MumbaiMastered for iTunes by Shadab RayeenMusic Co-Ordinator: Velavan"
"5w1ZR4q3QVI","Every SIBLINGS Relation Ever - Types of BHAI-BEHAN | #Fun #Sketch #Roleplay #ShrutiArjunAnand","2018-12-04T13:00:01.000Z","UCIsotCCdTjStPCLyD9iBCCQ","Shruti Arjun Anand","26","18.05.12","shruti,shruti anand,shruti arjun anand,shrutiarjunanand,expectation,reality,comedy,vlogger,blogger,expectations,funniest,mymissanand,vlogs,funny,vloggers,family,miss anand,blogging,roleplay,types of moms,laugh,how to vlog,kids,family vlog,skit,fun,sketch,family vlogs,real life,rich vs poor,rich,poor,normal,hot girl,funny girl,role play,rinky,my miss anand,desi,desi girl,proposals,types of people,bhai,behan,types of bhai behan,types of siblings","526066","54591","1309","2968","https://i.ytimg.com/vi/5w1ZR4q3QVI/default.jpg","False","False","Follow on Instagram: https://tinyurl.com/ShrutiArjunAnandBhai-Behen (Siblings) relations is full of love, hate, teasing, caring, sharing, small fights and lots of entertainment so this video is all about that sweetest and most weird relation we all share with our brothers & sisters. If you have enjoyed this then target hai 1,50,000 LIKES & I am sure you'll relate to this video and if you do then do SHARE it with your brothers & sisters. COMMENT below your most favourite sequence?CHECKOUT All My AWESOME Channels: SUBSCRIBE To ShrutiArjunAnand - https://goo.gl/1gmCTASUBSCRIBE To ShrutiVlogs - https://goo.gl/00seNeSUBSCRIBE To Anaysa - https://goo.gl/5A2h93SUBSCRIBE To MyMissAnand - https://goo.gl/mnBhXgSUBSCRIBE To CookWithNisha - https://goo.gl/Kep2iSSUBSCRIBE To LafanGAY - https://goo.gl/XRHDrqCAMERA CREDITS:https://instagram.com/extremepictureimagecreation~ XoXo~ Shruti NEW UPLOADS Tuesday & Friday!▷ CONNECT with us!!♥ ♥ YOUTUBE ♥ ♥ https://www.youtube.com/user/shrutiarjunanand♥ ♥ WEB ♥ ♥ http://www.shrutiarjunanand.com/♥ ♥ INSTAGRAM ♥ ♥ https://www.instagram.com/shrutiarjunanand/♥ ♥ FACEBOOK ♥ ♥ https://www.facebook.com/shrutiarjunanand/♥ ♥ TWITTER ♥ ♥ https://twitter.com/shruti_ilim♥ ♥ SNAPCHAT ♥ ♥ @Shruti_ILIM♥ ♥ BUSINESS INQUIRY ♥ ♥ contactus@shrutiarjunanand.comAUDIO DISCLAIMER/CREDITS –Music from Epidemic Sound (http://www.epidemicsound.com)DISCLAIMER: All products used in my videos, regardless of whether the video is sponsored or not, are the products that I love using unless otherwise stated in case of first impression reviews. The information provided on this channel is for general purposes only and should NOT be considered as professional advice. We are not a licensed professional or a medical practitioner so always make sure you consult a professional in case of need. We always try to keep our channel and its content updated but we cannot guarantee it. All opinions expressed here are our own and we are not compensated by any brand, advertiser, PR representative or affiliate for the same unless explicitly stated in our videos and/or description box. We never try to push products on anyone but we do make recommendations based on our personal experience. All the content published on this channel is our own creative work and is protected under copyright law and in case you need to use our content for any purpose please write to us - contactus@shrutiarjunanand.com *  blogger comedy funniest family channel good vs  hilarious vlogging a day in my life miss anand funy vlogger vloggers new year good vs blogging anantya roleplay how to vlog indian youtuber hindi vlog in real life sketch women's health monthly rinky"
"BqsW179XMTo","KCR Sensational Comments at Kodankal Ashirvada Sabha | TRS Latest Videos | Political Qube","2018-12-04T11:13:16.000Z","UC6-2LI8dZ9o4uq4AAnPaKcA","Political Qube","24","18.05.12","newsqube,newsqubepublictalk,newsqube Talk,NewsQube public talk,movie public talk,telugu movies public talk,KCR Sensational Comments at Kodankal Ashirvada Sabha,Kodankal Ashirvada Sabha,TRS Latest Videos","770570","0","0","0","https://i.ytimg.com/vi/BqsW179XMTo/default.jpg","True","True","KCR Sensational Comments at Kodankal Ashirvada Sabha | TRS Latest Videos#KodangalAshirvadaSabhaHello Guys This is Our EXCLUSIVE Channel Only For Public Talks . Here You can Watch Movie Public Talk and Social Issues Public Talk and Anything Related to Public. Please Give Us Support Like NewsQube and do Subscribe For this Channel Also.NewsQube It is a one stop solution for all Entertainment needs.Opportunity for New Creators : If you are passionate to give technical reviews & information's on latest apps, mobiles, electronic gadgets. Come join with us we are ready to make videos with you. send us your sample videos.info@newsqube.inNote: If you have any type of Creative Short Films or Funny Skits and Sketches We have the Expertise to Promote your Content, Reach out to us and we will help you reach out to Millions.Mail to This i'd info@newsqube.in  For any Sponsoring and Advertising Your Products .Follow us :Website : http://newsqube.inFb Page : https://www.facebook.com/Newsqube.in/Twitter   : https://twitter.com/NewsQube"
"iIyCeOUI-WE","बुधवार Special भजन I गणेश जी, कृष्ण जी के भजन I Ganesh Bhajan I Krishna Bhajan","2018-12-05T00:30:00.000Z","UCaayLD9i5x4MmIoVZxXSv_g","T-Series Bhakti Sagar","10","18.05.12","T-Series Bhakti Sagar,krishna bhajan,ganesh bhajan,krishna dhun,anuradha paudwal,sadhana sargam,kanha,budhwar special bhajan,janmashtami,ganesh chaturthi,jai ganesh deva,aartiyan,aarti kunj bihari ki,कुञ्ज,कुंज बिहारी की,आरती कुंज बिहारी की,morning ganesh bhajans,morning krishna bhajans,बुधवार स्पेशल भजन गणेश जी के,बुधवार स्पेशल भजन,जय गणेश देवा,श्री कृष्णा गोविन्द हरे मुरारी,हरे,रामा,कृष्णा,धुनि,हरिहरन,गुलशन कुमार,गुलशन कुमार भजन,गणपति,आरती","1021752","5887","1038","1319","https://i.ytimg.com/vi/iIyCeOUI-WE/default.jpg","False","False","► Subscribe: http://www.youtube.com/tseriesbhakti    अपने दिन शुरुआत कीजिये श्री गणेश एवं श्री कृष्ण के भजनों  के साथ!!!! ॐ गण गणपतये नमो नमः (गणेश मंत्र) सुरेश वाडकर द्वारा, मैं तो वृन्दावन को जाऊं सखी मेरे नैना लगे बिहारी से देवी चित्रलेखा द्वारा, शेंदूर लाल चढ़ायो गणेश जी की आरती रविंद्र साठे द्वारा, कानूड़ो रे थारा घूँघर वाला बाल अनुराधा पौडवाल द्वारा, नमोस्तुते सिद्धिविनायक रविंद्र बिजुर, शिल्पा पई द्वारा, श्री राधे गोपाल भजमन श्री राधे धुन देवी चित्रलेखा द्वारा !!!!Click on duration to play any songOm Gan Ganpatye Namo Namah (Ganesh Mantra)   00:00Main To Vrindavan Ko Jaaun   05:37Shendur Laal Chadhayo (Aarti)  12:00Kanuda Re Thara Ghoonghar Wala Baal  15:11Namostute Siddhivinayak  20:14Shree Radhe Gopal Bhajman Shree Radhe Dhun   25:06Music Label: T-SeriesGanesh Bhajan: Om Gan Ganpatye Namo Namah (Ganesh Mantra) Singer: Suresh Wadkar Music Director: Rajesh Gupta Lyrics: Traditional Album: Ganesh MantraKrishna Bhajan: Main To Vrindavan Ko Jaaun Singer: Devi Chitralekha Music Director: Bijender Chauhan Lyrics: Traditional Album: Radhe Radhe BolBhajan: Shendur Laal Chadhayo (Aarti) Singer: Ravindra Sathe Music Director: Jatin-Lalit Lyricist: Sameer Album: Vaastav: The RealityKrishna Bhajan: Kanuda Re Thara Ghoonghar Wala Baal Singer: Anuradha Paudwal Music Director: Surinder Kohli Lyricist: Guru Ji Ram Lal Sharma, Saral Kavi, Das Mahendra Album: Chhappan BhogGanesh Bhajan: Namostute Siddhivinayak Singer: Ravindar Bijoor, Shilpa Paee Music Director: Anil Mohile  Album: Vighnaharta Shree SiddhivinayakKrishna Bhajan: Shree Radhe Gopal Bhajman Shree Radhe DhunSinger: Devi Chitralekha Music Director: Bijender Chauhan Lyrics: TraditionalAlbum: Radhe Radhe BolIf You like the video don't forget to share with others & also share your views.Stay connected with us!!!► Subscribe: http://www.youtube.com/tseriesbhakti► Like us on Facebook: http://www.facebook.com/tseriesbhaktisagar► Follow us on Twitter: https://twitter.com/tseriesbhaktiFor Spiritual Voice Alerts, Airtel subscribers Dial 589991 (toll free) To set popular Bhakti Dhun as your HelloTune, Airtel subscribers Dial 57878881"
"L5eVKe4qOpg","Salaam Rocky Bhai Song with Lyrics | KGF Kannada Movie | Yash | Prashanth Neel | Hombale Films","2018-12-04T12:58:30.000Z","UCnSqxrSfo1sK4WZ7nBpYW1Q","Lahari Music | T-Series","10","18.05.12","kgf songs,kannada songs,salaam rocky bhai,salaam rocky bhai song,kgf kannada movie songs,kgf movie songs,kgf movie songs kannada,kgf latest videos,#kgf,kgf,kannada new songs,kannada new songs 2018,salaam rocky bhai kgf song,salaam rocky bhai song with lyrics,kannada hd songs,kgf chapter 1,kgf chapter 1 songs,yash kgf movie,yash kgf,kgf film songs,kgf kannada songs,kgf mp3 songs,yash kgf kannada movie,Prashanth Neel,Ravi Basrur,kannada super hits","1304831","90327","5625","11248","https://i.ytimg.com/vi/L5eVKe4qOpg/default.jpg","False","False","Watch Salaam Rocky Bhai Song with Lyrics From #KGF Chapter 1 Kannada Movie.KGF Songs, Salaam Rocky Bhai Song#Yash #SalaamRockyBhai #KGFSongs #KGFKannadaMovie #KGFKannadaTrailer #KGFKannadaTeaser #KGFMovieSongs #KGFKannadaMovieSongs #SalaamRockyBhaiKGF #SrinidhiShetty #PrashanthNeel #VijayKiragandur #KannadaSongs #KannadaNewSongsWritten & Directed by: Prashanth NeelStarring: Yash, Srinidhi Shetty, Ayyapa, B Suresh, Srinivas Murthy, Archana Jois, Roopa Rayappa, Master Anmol, Ananth Nag, Malavika, Achut Kumar, Naga Bharana, Dinesh Mangalur, Harish roi, Ninasam Ashwath, introducing Avinash, Ram, Lucky, Vinay, Puneeth RudranagSubscribe to our Youtube Channel : http://bit.ly/1hE4KpSProduced by: Vijay Kiragandur Music by: Ravi BasrurSinger's: Vijay Prakash, Santhosh Venki, Sachin Basrur, Puneeth Rudranag, Mohan, H. Shreenivas Moorthi, Vijay AursLyrics by: V. Nagendra PrasadProgrammed by: Ravi Basrur, Sachin Basrur, V.M. BharathMixing by: Kishore Kumar  S (Hyd), B.R Naveen Kumar (D f Tech) Mastered byKishore Kumar  S (Hyd)Recording and mastering StudioRBM (Ravi Basrur Music)Produced by Vijay KiragandurWritten & Directed byPrashanth NeelBanner: Hombale Films--------------SHORT LINKS♪ Available on ♪Hungama - http://www.hungama.com/song/salaam-rocky-bhai/42917266/Jiosaavn - https://www.jiosaavn.com/album/salaam-rocky-bhai-from-kgf-chapter-1/JMJ-20e2yHE_Gaana - https://gaana.com/album/kgf-chapter-1-kannadaWynk - https://wynk.in/music/album/kgf-chapter-1/hu_42917262Saavn - https://www.saavn.com/p/album/kannada/salaam-rocky-bhai-from-kgf-chapter-1-2018/JMJ-20e2yHE_?------------Enjoy & stay connected with us!!Subscribe to our Youtube Channel : http://bit.ly/1hE4KpSLike us on FB: https://goo.gl/hbfPfL Circle Us on G+ :  http://goo.gl/STQX0gFollow Us on Twitter : http://bit.ly/1sZimzM"
"p8L-LjWHpjw","This is getting out of control...","2018-12-03T17:44:48.000Z","UC-lHJZR3Gqxm24_Vd_AJ5Yw","PewDiePie","24","18.05.12","SATIRE,india,charity,livestream","7324998","927794","43934","137948","https://i.ytimg.com/vi/p8L-LjWHpjw/default.jpg","False","False","Please D O N A T E:https://bit.ly/2PdY7NSCheck out and learn more about cry: https://www.cry.org/This link crashed for donations, but Im leaving it here anyway.https://fundly.com/pewdiepie-s-fundraiser-for-kids-in-indiaIll accumulate both sites when campaign ends.12 HOURS LEFT N E W  M E R C H  : https://represent.com/pewdiepie 🔥 (◡‿◡✿)LIVESTREAM TOMORROW 4th of December at 4pm-7pm UKhttp://lmgtfy.com/?q=What+time+is+4pm+in+UKSubmit M E M E S: https://www.reddit.com/r/PewdiepieSubmissions/ ༼♥ل͜♥༽ __AD| Shop my headphones: http://rzr.to/edgar__TSUKI: https://tsuki-co-uk.myshopify.com__:::::::My Setup:::::::: (Affiliate links)Chair:: ONLY 399 !USA & Asia: https://usa.clutchchairz.com/product/pewdiepie-edition-throttle-series/Europe: https://europe.clutchchairz.com/en/product/throttle-series-pewdiepie-edition/Canada: https://canada.clutchchairz.com/product/throttle-series-pewdiepie-edition/Elgato green screen: http://e.lga.to/PewDiePie (Affiliate)__:::::::Check out: ::::::::http://store.steampowered.com/app/703840/Animal_Super_Squad/(A game I helped make and affiliated with)__Outro:Animation: https://www.youtube.com/user/jae55555Song: https://www.youtube.com/channel/UC3e8EMTOn4g6ZSKggHTnNng"
"JA2v3qKKxi0","BYN : How Social Media Ruined My Life","2018-12-03T06:24:20.000Z","UC7sRFTKIbH4NNpFXmpUAWuA","Be YouNick","23","18.05.12","Social Media,Youtube,Facebook,Twitter,Instagram,Watsapp,Snapchat,Facebook Messenger,BYN,byn,be,you,nick,beyounick latest,Nikunj Lotia,Tushar Khair,Funny videos,comedy,trending video,social,technology","1659655","133988","4302","5350","https://i.ytimg.com/vi/JA2v3qKKxi0/default.jpg","False","False","Follow The Team :Nick - https://www.instagram.com/beyounick/Tushar - https://www.instagram.com/tusharkhairbyn/Murali -  https://www.instagram.com/woh_lambe_baal_wala_ladka/Vivek -  https://www.instagram.com/i_am_vivekmenon_byn/Sushant-  https://www.instagram.com/cut_appa_sushant/Anant - https://www.instagram.com/ananttss/Omkar -  https://www.instagram.com/one_moody_foodie/Directed By  - Vivek Menon, NickWritten By - Omkar ShindeCo-Writers - Vivek Menon , Nick Editor - Sushant ChopdekarDOP - Vivek MenonOn Set Sound - Murali ThevarProduced By - Nick Production Manager - Anant T , Murali ThevarProduction Assistant - Nikhil Tari Cast - Nick           Kritika AvastiVenue Courtesy - CoWrks"
