video_id,title,publishedAt,channelId,channelTitle,categoryId,trending_date,tags,view_count,likes,dislikes,comment_count,thumbnail_link,comments_disabled,ratings_disabled,description
"6sbPGzrXbts","Statue of Unity: The Harsh Reality | Analysis by Dhruv Rathee","2018-11-01T11:55:34.000Z","UC-CSyyi47VX1lD9zyeABW3w","Dhruv Rathee","25","18.04.11","Dhruv Rathee,Dhruv,Rathee,Dhruv Rathee latest video,india news live,Statue of Unity,Sardar Patel,sardar vallabhbhai patel,Sardar Patel Statue of unity,Statue of liberty,Eiffel tower,Narendra Modi,Statue of unity height,the statue of unity,statue of sardar patel,India tourist attractions,top india tourist places,worlds biggest statue,world's largest statue,BJP,Gujarat,Shivaji Statue,Tourism in India,Taj Mahal,monuments of India,Iron man of India","1330672","90731","30087","38961","https://i.ytimg.com/vi/6sbPGzrXbts/default.jpg","False","False","The grand tribute to the Iron Man of India, Sardar Vallabhbhai Patel - the Statue of Unity was recently inaugurated by PM Narendra Modi. In this video, I analyse the statue from all possible aspects. Economical, Cultural, Social, Political, Touristic viewpoints. 0:50 How Economically viable is the statue?2:15 Will the statue of unity be profitable?4:38 Potential for an attractive tourism hotspot7:09 History and Culture Preservation7:52 Social and Environmental Impact of the Statue9:00 Politics and Pride for Sardar Patel ji10:38 Sardar Patel on RSSSupport my work: https://www.patreon.com/dhruvratheeRead More about the Sardar Patel Statue: https://theprint.in/opinion/even-if-statue-of-unity-becomes-as-famous-as-taj-mahal-we-need-120-years-to-break-even/142596/---------------------------------------------------- For more informative videos and discussion on important Indian and world issues- Telegram channel to receive instant video updates: https://t.me/dhruvratheechannel Support on Patreon: https://www.patreon.com/dhruvrathee Subscribe: http://www.youtube.com/dhruvrathee Facebook: http://www.facebook.com/DhruvRatheePage Twitter: http://www.twitter.com/dhruv_rathee Instagram: http://www.instagram.com/dhruvrathee More Interviews by Dhruv Rathee: https://www.youtube.com/playlist?list... All episodes of The Dhruv Rathee Show: Ep 9 Black Money: https://youtu.be/UdNe4Bv8ARYEp 8 RTI Activists: https://youtu.be/zE_tnXDXlaI Ep 7 Ache Din in UP: https://youtu.be/dPvM2n2AFAw Ep 6 Lairs Modi, Ivanka: https://youtu.be/jt14K39g7TwEp 5 Padmavati: https://youtu.be/1M9XXdpuiaw Ep 4 Rajasthan: https://youtu.be/y26_c2jNPUw Ep 3 Jay Shah growth: https://youtu.be/FfTpWUPsdsc Ep 2 Indian economy: https://youtu.be/1ZIFEASmno0 Ep 1 Currency Notes: https://youtu.be/sAH9YyR3O4c More videos: Rahul Gandhi vs Modi: https://youtu.be/Lem7KgAb9SYPayTM reality: https://youtu.be/cseroHjs__E Air Pollution: https://youtu.be/Yo_mO0L8uE4 BJP IT Cell part 2: https://youtu.be/BslKjxaP4Ik Maun Modi: https://youtu.be/KOudMPiJFBI Indian Education: https://youtu.be/ABmXRhizz4I PNB Scam: https://youtu.be/5dL4AtHYd1w Bitcoin: https://youtu.be/Kesk8WK1uWM Aadhaar Card: https://youtu.be/S_bvQO6K5fY Best State in India: https://youtu.be/XPwVq56l1rk Petrol Prices reality: https://youtu.be/OSQXo3DpFAg Budget 2018: https://youtu.be/Ncjcg97P1TgSave Our Forests: https://youtu.be/jHmXSpTVjZA ----------------------------------------------------"
"1jKZJCxlMYs","Buildup Babai || Ravi Ganjam","2018-11-03T11:33:37.000Z","UC3st0eH7gCWwg2wqaYa1GDg","Ravi Ganjam","23","18.04.11","Ravi Ganjam,Ravi Ganjam Comedy Videos,Telugu Bigg Boss Comedy,Ravi Ganjam Latest Videos,Ravi Ganjam Short FIlms,avinash varanasi short films,Wirally,Tamada media,Petrol Kastalu,Ravi Ganjam La,EAMCET Exam,Maa Abbai B.Tech,mogudu pellam,smart phone kashtalu,smart phone,atu class itu mass","177332","6772","536","482","https://i.ytimg.com/vi/1jKZJCxlMYs/default.jpg","False","False","#TamadaMedia #Wirally #RaviGanjam #Comedyvideos #LaughingtimeCast- Gowthami Chitra, Avinash Varanasi, Deek Sunny, Saahith Bunnye & Ravi GanjamDOP - Surya TejEditing- Ravi Ganjam , Kumba shivakumarWritten-Direction-Ravi GanjamAtu class Itu Mass web series trailerhttps://www.youtube.com/watch?v=OxyXamGM854Publicity Design- Durga SaiPowered By - Tamada Media"
"96YDxvH2q3I","#राधाकृष्ण","2018-11-02T13:23:48.000Z","UCCy2rLnGdwoJcSAtixNdsPQ","STAR भारत","22","18.04.11","[none]","326948","7749","112","367","https://i.ytimg.com/vi/96YDxvH2q3I/default.jpg","False","False","कृष्ण उन्हीं की सहायता कर सकते हैं, जो अपने प्रेम के लिए खड़े रहने का साहस रखते हैं!#राधाकृष्ण | #RadhaKrishn"
"XhpcX9iWPww","Dance+ 4 | Dance Battle","2018-11-02T08:58:59.000Z","UC-LPIU24bQXVljUXivKEeRQ","StarPlus","24","18.04.11","Dance plus,danceplus 4,Dance+,Remo Dsouza,Dance Plus Mumbai Auditions,Sapne Sirf Apne Nahin Hote Hai,Dance Plus 4 auditions in Delhi,11th August,Group Dance,Punit Pathak,Raghav Juyal,Shakti Mohan,Dharmesh,DancePlus on StarPlus","853830","9864","260","193","https://i.ytimg.com/vi/XhpcX9iWPww/default.jpg","False","False","The Royal family is left spellbound after watching #DanceDhamaka on Dance+ 4. Don't miss it Tomorrow at 8pm"
"-1k5h9BPGVA","RRB ALP & Technician CBT-1 Result & Cut Off Out | CBT-2 Exam Date Confirmed","2018-11-02T14:55:59.000Z","UCuWuAvEnKWez5BUr29VpwqA","wifistudy","27","18.04.11","rrb alp result,rrb alp cut off,rrb alp,rrb,alp,technician,rrb alp cbt 2 exam date,rrb alp cbt 1 result,rrb cbt 2,rrb cbt 1 result,rrb cbt 1 cut off,rrb cbt 1 ka result,alp cbt 1 result,alp cbt 1 result 2018,alp cbt 1 ka result,alp results 2018,alp result,alp cut off,rrb alp cut off 2018,cbt 2 exam date,cbt 2,alp and technician result,alp and technician result 2018,alp and technician cut off,alp result 2018 date,alp cbt 2 exam date,wifistudy,railway","299283","10912","634","8044","https://i.ytimg.com/vi/-1k5h9BPGVA/default.jpg","False","False","wifistudy is a part of the Unacademy Group. Follow us on Unacademy: https://unacademy.com/user/wifistudySubscribe wifistudy vlogs here: https://www.youtube.com/wifistudyvlogsअब पढ़ाई के लिए हो जाओ तैयार क्योंकि wifistudy ने कर दी है Live Classes की बौछारLive Classes New Schedule (Mon-Fri) Effective from 1st Nov, 2018: -Morning Shows:5:00 AM - Current Affairs Quiz Show by Bhunesh Sir8:00 AM - Current Affairs Show by Bhunesh Sir8:45 AM - Vocabulary Show by Bhunesh SirRailway ALP CBT-2:6:00 AM - Electrician and Electronics by Ramveer Sir7:00 AM - Engineering Drawing by Ramveer Sir9:00 AM - Basic Science and Engineering by Neeraj Sir3:00 PM - Physics by Neeraj Sir4:00 PM - Maths by Naman SirRRB Group D Crash Course:10:00 AM - Reasoning by Hitesh Sir11:00 AM - Maths by Sahil Sir12:00 PM - General Science by Shipra Ma'amIBPS Clerk Crash Course:1:00 PM - Reasoning by Deepak Sir2:00 PM - Maths by Sahil Sir3:00 PM - English by Sanjeev SirLab Assistant:2:00 PM - General Science by Shipra Ma'amसमस्त शिक्षक भर्ती परीक्षा हेतु:4:00 PM - Psycology & Pedagogy by Rajendra SirHSSC Group D Crash Course:5:00 PM - Hindi by Ganesh Sir5:30 PM - General Science by Shipra Ma'am6:00 PM - Maths by Naman Sir6:30 PM - English by Sanjeev Sir7:00 PM - GK by Sandeep Sir7:30 PM - Reasoning by Hitesh SirDefence Special (CDS Crash Course):7:00 PM - English by Harsh SirSSC GD 2018:8:00 PM - GK by Bhunesh Sir8:30 PM - Hindi by Ganesh Sir9:00 PM - Reasoning by Hitesh Sir9:30 PM - Maths by Naman SirBihar Police Crash Course:10:00 PM - English by Sanjeev Sir10:30 PM - Hindi by Ganesh Sir11:00 PM - Bihar GK by Sandeep SirUPSSSC VDO Special:10:00 PM - UP Current Affairs by Sandeep SirTechnical Classes (SSC JE/GATE) Sat / Sun:12:00 PM - Mech by Neeraj Sir3:00 PM - Civil by Nikhil Sir6:00 PM - EE/EC by Ashish Sir⇒⇒⇒⇒⇒ Follow us: -♥ Facebook: - https://www.fb.com/wifistudy♥ Google+: - https://plus.google.com/+wifistudy♥ Twitter: - https://twitter.com/wifistudy♥ Linkedin: - https://www.linkedin.com/company/wifistudy♥ Telegram: - https://t.me/wifistudy♥ Pinterest: - https://in.pinterest.com/wifistudyLearn/♥ Instagram: - https://www.instagram.com/wifistudylearn/♥ Website: - https://www.wifistudy.com♥ YouTube: - https://www.youtube.com/wifistudy"
"E6lqCQ5lPc0","BIJILI 2.0 UPGRADED | Ft.Madurai 360 | Fun Panrom | Black Sheep","2018-11-03T12:34:25.000Z","UCzh5hQc_O3r3xjh9sXrM7-A","Black Sheep","24","18.04.11","black sheep,fun panrom,vj siddhu,bijili,bijili ramesh,bijili 2.0,2.0,endhiran 2.0,tamil pranks,madurai 360,360,madurai pranks,diwali,deepavali,udictionary,endhiran 2.0 trailer,sarkar,thala","419180","27498","673","2583","https://i.ytimg.com/vi/E6lqCQ5lPc0/default.jpg","False","False","Here we are again with Bijili 2.0 Prank. Watch and share.U-Dictionary Download Link:https://dn66q.app.goo.gl/blacksheepUDContest Link - https://goo.gl/forms/GKitz4jvSMTrl7RS2Black Sheep is an infotainment channel which aims to engage an audience of all categories. Black Sheep wil be an upgraded version of Smile Mixture, this time aiming for more fun and entertainment. Watch, Share and Subscribe ...."
"R8OFOURSZZA","Addiction To Education (पढ़ाई की लत) By Sandeep Maheshwari","2018-10-31T10:19:17.000Z","UCBqFKDipsnzvJdt6UT0lMIg","Sandeep Maheshwari","22","18.04.11","Inspirational,Inspiring,Videos,Motivational,Motivation,Motivating,Success,India,Indian,Speaker,Speaking,Workshop,Ideas,Hindi,Greatest,Speech,Talk,Positive,Thinking,Attitude,Powerful,Leadership,Aasaan,session,thoughts,great,most,best,lecture,last,Ever,india tour,power of focus,focus,students,concentration power,studies,best of sandeep,career,choice,10+2,student,latest 2018,entrepreneurship,business,confusion,education system,india","1846523","88801","1766","5884","https://i.ytimg.com/vi/R8OFOURSZZA/default.jpg","False","False","Sandeep Maheshwari is a name among millions who struggled, failed and surged ahead in search of success, happiness and contentment. Just like any middle class guy, he too had a bunch of unclear dreams and a blurred vision of his goals in life. All he had was an undying learning attitude to hold on to. Rowing through ups and downs, it was time that taught him the true meaning of his life.To know more, log on to www.sandeepmaheshwari.comConnect with him at Facebook.com/SandeepMaheshwariPageWatch his inspirational videos at Youtube.com/SandeepSeminarsMusic: Youtube Music Library"
"DqdesR59r5c","Bepannah - 2nd November 2018 - बेपनाह","2018-11-03T05:47:32.000Z","UC55IWqFLDH1Xp7iu1_xknRA","Colors TV","24","18.04.11","Colors TV,colorstv,hindi shows,VOOT,new promo,clips,3 minute clip,Bepannah voot clip,Bepannah full episode online,watch Bepannah online,Aditya,Zoya,love,partners,worlds,collide,shocking,twist,brutal,accident,unbearable loss,unanswered questions,affair,marriages,sham,story,betrayal,Jennifer Winget,Bepanaah,#Bepannah,bepanah,bepanah serial,bepanah song,bepanah full episode,bepanah promo,bepanah episode,bepanah bepanah,#bepanah,#bepanaah","124488","553","65","34","https://i.ytimg.com/vi/DqdesR59r5c/default.jpg","False","False","To watch the full episode of 'Bepannah' anytime, Download the Voot app now or Visithttps://www.voot.com/shows/bepannah/1/572880/aditya-and-zoya-celebrate-karva-chauth/648717Aditya and Zoya are madly in love with their respective partners, until one day their worlds collide in the most shocking twist. Their spouses are found together, after losing their lives in a brutal accident! Dealing with the unbearable loss, Aditya and Zoya are hounded by many unanswered questions - why were their partners together? Were they having an affair? Were their marriages nothing but just a sham? Watch this complicated story of love and betrayal unfold now on Colors."
"lSwIFb4pz_4","EXPERIMENT: CAR VS EGGS","2018-11-02T10:45:00.000Z","UCatfiM69M9ZnNhOzy0jZ41A","Power Vision","28","18.04.11","Experiment,Car Vs,Eggs,Redd Bull,Egg,Gas Torch,Car Vs Eggs,Waffle maker,Gummy Bears,Liquid Nitrogen,Experiment with Eggs,Coca-Cola,Experiment with Coke,Gas Torch Vs Coca-Cola,Glowing 1000 degree METAL BALL,Experiment with Car,Experiements,Life hacks,Test,Tricks,Auto Vs,Power Vision","468680","1772","1403","323","https://i.ytimg.com/vi/lSwIFb4pz_4/default.jpg","False","False","What will happen if you put the eggs under the car?Hi guys.Today I will show you what will happen if you put the eggs under the car. I will also show some interesting experiments with liquid nitrogen and a gas burner.Did you know what will happen with jelly bears if you put them in a waffle iron?Watch and enjoy.Music:Jim Yosef - Link [NCS Release]https://youtu.be/9iHM6X6uUH8[Jim Yosef]• http://soundcloud.com/jim-yosef• http://facebook.com/jimyosefmusic• http://twitter.com/jimyosefElectro-Light - Symbolism [NCS Release]https://youtu.be/__CRWE-L45kElectro-Light➞ Facebook https://www.facebook.com/ElectroLightOfficial➞ SoundCloud https://soundcloud.com/maskedacoustic➞ Twitter https://twitter.com/ElectroLightEDM➞ YouTube https://www.youtube.com/user/ElectroLightOfficialAlan Walker - Fade [NCS Release]https://youtu.be/bM7SZ5SBzyYAlan Walker➞ Facebook https://www.facebook.com/alanwalkermusic/➞ SoundCloud https://soundcloud.com/alanwalker➞ Twitter https://twitter.com/IAmAlanWalker➞ YouTube https://www.youtube.com/user/DjWalkzz ➞ Instagram https://www.instagram.com/alanwalkermusic/"
"oj-3y0G_bUM","Dice Media | What The Folks (WTF) | Web Series | S02E03 - Spilling the Beans","2018-10-31T09:21:03.000Z","UCC89oVFqenaffhBoyqxd6qw","Dice Media","24","18.04.11","Dice Media,Dice,Filter Copy,Films,bindaas,little things,all india bakchod,tvf qtiyapa,buzzfeed,webseries,web series,family,drama,comedy,viral,the viral fever,pitchers,permanent roommates,tvf tripling,filtercopy,short films,scoopwhoop,SIT,TVF originals,amazon prime,netflix,inside edge,y films,what the folks,WTF,HBO,Ashish Chanchalani,veer rajwant singh,eisha chopra,renuka shahane,shishir sharma,kriti vij,trending video,amit bhadana","2014810","40817","1413","2903","https://i.ytimg.com/vi/oj-3y0G_bUM/default.jpg","False","False","In the first season of What The Folks!, we saw the Sharma family warm up to their son-in-law, Nikhil Solanki and form an everlasting bond.This time around, Dice Media takes you to Nikhil's side of the family - the affable Solankis - as Anita now tries to be a part of this crazy family! Episode 3: Anita's awkwardness is laid to rest by mum-in-law, who tells her 'she can never have it all...no one can'. Meanwhile, the family plans to go to a relative's 80th birthday out of the city. Upon Anita's insistence, Nikhil vocalizes his inhibitions with his sister, Shreya, who reveals to the family about her personal life.Dice Media and Epigamia present What The Folks! Season 2, powered by Pepperfry, in partnership with Google.AN ORIGINAL SERIES BYDICEA POCKET ACES CHANNELLOCATION COURTESYAJMERA GROUPPRODUCED BYASHWIN SURESHANIRUDH PANDITAADITI SHRIVASTAVADIRECTORSUMIT ARORASERIES DIRECTORRUCHIR ARUNSTORYSIDHANTA MATHURANAND BHARDWAJAYESHA NAIRWRITERSANAND BHARDWAJAYESHA NAIRCREATIVE PRODUCTION & DEVELOPMENTBHARAT MISRASIDHANTA MATHURSTARRING (In Alphabetical order)EISHA CHOPRA KRITI VIJRENUKA SHAHANESHISHIR SHARMAVEER RAJWANT SINGHEXECUTIVE PRODUCERSABHISHEK KUMARLALIT RAJ ARORADIRECTOR OF PHOTOGRAPHYANIRUDDHA PATANKARPRODUCTION DESIGNERSNIMISH KOTWALRIYAZ SHAIKHEDITORCHARU TAKKARORIGINAL MUSIC & BACKGROUND SCORENEEL ADHIKARISYNC SOUNDSANDRO SADHUKHANSOUND DESIGN & MIXSANDRO SADHUKHANBAIJAYANTA ROYDI COLORISTTAPASVI ASIJA (Arts for Production)COSTUME DESIGNERANINDITA SINGHVIHAIR & MAKE-UPSNEHA J RATHILINE PRODUCERNIPUN MALHOTRACASTING BYCASTING BAYCAST (In Alphabetical Order)ALLWYN ARVIND BESRABANWARI LAL JHOLDEEPIKA DESHPANDE AMINDHRUV SEHGALRAMNIK CHANDRACHIEF ASSISTANT DIRECTORVARUN KUMAR2ND ASSISTANT DIRECTORSANTARA ANANDKANAK RAJUKUMAR SANJUSCRIPT AND CONTINUITY SUPERVISORROHIT CHAUHAN2ND UNIT DOPPRATIK PARMARFOCUS PULLERSAJINKYA PANDITJAIRAJ SHETTYADDITIONAL 2ND UNIT DOPAMEYA KALEART DIRECTORSHRADDHA HEREKARASSISTANT ART DIRECTORSABHISHEK JADHAVANAYA JOSHIMAMATA POKALESHREYAS SHELARSETTING BOYSLAXMAN BATTALWADRAVINDRA SALVERAVINDRA TEHAREUDAY PRAKASH JADHAVSUBTITLESANTARA ANANDVISUAL DESIGN TEAMSIDHANT GANDHIMANOJ OMRESHREYA SETHIGAURAV JHAMBASSISTANT EDITORSASHISH BHAGATNISHANT DHARMAKE-UP ASSISTANTSHENOYA FERNANDESCOSTUME ASSISTANTSHRUTI PILLAIWARDROBE COURTESYMANGOTATA CLiQFBBKOOVSSTALKBUYLOVELIFESTYLEHIDESIGNDRESSMANMAHENDRA PRASADSURYA KUMAR YADAVYOGENDRA KUMARCASTING ASSISTANTSSHRUTI DUTTIPSHITA DEYEXTRAS CASTINGRAVINDRA SURI AND CO.EQUIPMENT SUPPLIERSACCORD EQUIPS PVT. LTD.VEENA ENTERPRISEADDITIONAL SYNC SOUNDNILESH JATWABOOM OPERATORDHARMENDRA SINGH RAJPUTADDITIONAL BOOM OPERATORCHANDPASHA JIYAUDDIN SHAIKHDITSUJIT KAVANKARCAMERA ATTENDANTSAADESH SIDDHUAKHILESH YADAVANIRBAN MAHATOMUKESH KUMAR DASSANKET CHOUDHARYLIGHT MENEZAZ AHMEDISMAIL KHANAFTAB ALAMRAMA SHANKARTRACK AND TROLLEYRAJJAK KHANSANJAYRIG ATTENDANTSDAYASHANKAR TIWARIHITESH RATHODJAYESH RATHODRAM SHARMAMUSICGUITAR, UKULELENEEL ADHIKARIPIANO & MUSIC PRODUCTIONSANJAY DASSONGSJUST DON'T FIT (Title Track)WRITTEN AND COMPOSED BYNEEL & THE LIGHTBULBSVOCALS AND GUITARNEEL ADHIKARISYNTHESIZERS, PIANOSANJAY DASTITLE SEQUENCE & PHOTOSHOOTDOPsISHANI ROYOMKAR DEONALLISOUND STUDIOAURALMAYHEMEDIT STUDIOSAFTERPLAY FILM STUDIOICASTX TECHNOLOGIESCONTENT OPERATIONSSANGEETHA RAOBUSINESS DEVELOPMENTSHREYA AGARWALANUBHAV RAORAGINI ROYSHIVI SINGHVISHWANATH SHETTYVIDUSHI GAURFINANCEKUNAL LAKHARASHAILESH KINJALERUCHA MOKASHILICENSING & SYNDICATIONAKSHADA BHALERAOMARKETINGBALRAM VISHWAKARMAHITESH PARDESHIMADHU GUDIMEDINI MANGALARAUNAK RAMTEKEVIRAJ GHELANIDICE MEDIA TEAMDHRUV SEHGALKARTIK KRISHNANAAKASH BHOJWANIISHA KAZINATASHA MALPANIOFFICE MANAGERSBHARAT ANGREYOGESH BAJRANGSPOT BOYSAMARNATH SINGHRAJESH KUMAR SAROJRAVI SANJANPICTURE & PRODUCTION VEHICLESJUNED KHANLOCATION MANAGERSHEMENDRA JAINSANDIP PATILSUMIT SINGHTRANSPORTLATA TOURS AND TRAVELSJUNED KHANSUPPLIERSKALPESH ENTERPRISESOM NOVELTYPRINTONICVANITY & GENERATOR RENTALSDREAMS ZONEAAYAN SOUNDCATERERSBLUE CHILLI FOOD HOSPITALITYLEGALDOYEL SENGUPTA MATTOO (AMICUS IP)LOCATION COURTESYAJMERA I-LAND, WADALA, MUMBAIMOONSHINE CAFE & BARCOPYRIGHT (C) 2018POCKET ACES PICTURES PVT. LTD."
"YEuAtBzJ7po","Avalum Naanum | 2nd to 3rd November 2018 - Promo","2018-11-02T07:26:44.000Z","UCvrhwpnp2DHYQ1CbXby9ypQ","Vijay Television","24","18.04.11","Vijay Matinee,VijayTV,VijayTelevision,StarVijayTV,StarVijay,TamilTV,Redefining Entertainment,Avalum Naanum,Thiya,Nila,Diya,அவளும் நானும்","628986","2675","160","186","https://i.ytimg.com/vi/YEuAtBzJ7po/default.jpg","False","False","#அவளும்_நானும் | திங்கள் முதல் சனிக்கிழமை வரை மதியம் 1:30 மணிக்கு உங்கள் விஜயில்.. Click here http://www.hotstar.com/tv/avalum-naanum/16760 to watch the show hotstar. #VijayTV #VijayTelevision #StarVijayTV #StarVijay #TamilTV #AvalumNaanum #Thiya #Diya #Nila"
"1BlDdzT2aGE","Sur Nava Dhyas Nava Chote Surveer | Episode Update","2018-11-03T13:00:01.000Z","UCo17p1v3vJ1Nk-ln7NwMogw","Rajshri Marathi ShowBuz","24","18.04.11","Sur Nava Dhyas Nava,Little Champ,Sur nava Dhyas nava Chote Surveer,Music,Little Champs,Colors Marathi,Avdhut Gupte,Mahesh kale,Shalmali,Kolghade,Spruha Joshi,Music Avadhut Gupte,Colors Marathi Serials,Singing Show,Music Show.,Sur nava Dhyas navachhote survir episode update of 25 september 2018,Sur nava Dhyas nava chhote survir episode update of 26 september 2018,upcoming promo of Sur Nava DHyas nava chhote surveer","142717","1787","40","61","https://i.ytimg.com/vi/1BlDdzT2aGE/default.jpg","False","False","सूर नवा ध्यास नवा छोटे सुरवीरच्या मंचावर लाल्या आला आहे. अभिनेता सुयोध भावे आणि लाल्याने एक कडक डायलॉगही सादर केला. मंचावरची ही धमाल पाहण्यासाठी बघा हा विडिओ.  Reporter - Darshana TamboliVideo Editor - Rupesh Shinde Subscribe to Rajshri Marathi ShowBuz: https://www.youtube.com/MarathiShowBuz"
"kGoagts5lrI","काजू कतली खास क्रंची स्वाद वाली - दीपावली के लिए ।  Kaju Katli Recipe with Wonderfulls Chunkies","2018-11-03T05:20:26.000Z","UCgoxyzvouZM-tCgsYzrYtyg","Nisha Madhulika","26","18.04.11","kaju burfi,kaju barfi,Cashew Burfi,crunchy kaju kalti recipe,Kaju Barfi Recipe in Hindi,How to make Kaju Katli at Home,Instant Kaju Katli Recipe,kaju katli recipe in hindi,kaju katli recipe in hindi video,kaju katli recipe youtube,rakshabandhan special recipe,burfi without mawa,how to make kaju katli,cashew nut burfi,indian sweets recipes,काजू की बर्फी,kaju burfi easy recipe,instant kaju katli recipe","59035","1681","117","668","https://i.ytimg.com/vi/kGoagts5lrI/default.jpg","False","False","काजू कतली रेसिपी, Kaju ki Barfi Recipe, Cashew Nut Katli, Britannia Dessert Carnival Recipe, #BritanniaDessertCarnival #kajukatliRecipeIngredients:Sugar - 250 gms Cashew Nuts - 250 gmsMilk - 200 mlGhee  Good Day Wonderfulls Chunkies - 1 packetHow to make Britania Kaju Katli1- Blend Cashews, Sugar and milk for the paste.2- Pour in a pan and cook while continuously stirring it until its consistency is thick.3- Crush 1 packet of Good Days Wonderfull and add in the paste.4- Stir and cook them for a while.5- Keep it aside to cool down and in the meantime, grease the sheet with Ghee.6- Apply some Ghee on your palms and roll the paste over it using a rolling pin.7- Roll it into a square with a thickness of ¼ cm.8- Cut the straight strips using a pizza cutter then, cut it vertically to give it a diamond shape. 9- Kaju Katlis are ready to be served. Subscribe for more recipes - http://www.youtube.com/subscription_center?add_user=nishamadhulikaFor the Best recipes on YouTube, log onto - http://www.youtube.com/nishamadhulikaFind us on Facebook at - https://www.facebook.com/nishamadhulikaVisit my Hindi Websitehttp://nishamadhulika.com"
"VjDf7Pa2ur4","நடுரோட்டில் தலை இல்லாமல் திரியும் சிறுமி | Tamil News","2018-11-01T14:30:01.000Z","UC-ssqellSXFl-BBIf57eQQA","Full Meals","24","18.04.11","full meals,fullmeals,latest news,tamil news,viral news,tamil seithigal,Tamil,indian,scary,girls,kids,child,philliphines,headless costume,hallowen,viral video,trending video","407617","1430","1686","0","https://i.ytimg.com/vi/VjDf7Pa2ur4/default.jpg","True","False","See this video if you have dareநடுரோட்டில் தலை இல்லாமல் திரியும் சிறுமி தைரியம் இருந்தால் பாருங்கRecently one video of 2 years old child scary video went viral on social media. Here we are going to see about it.--------------------------------------------------------------------------------------For more Tamil cinema news and Kollywood videos, subscribe to our FullMeals channel. We hope our channel will surely help you. --------------------------------------------------------------------------------------Subscribe : https://goo.gl/VAVi5y Follow us on FB : https://goo.gl/SAH0W4 --------------------------------------------------------------------------------------Music Credit:Tobu & Itro - Sunburst [NCS Release]https://www.youtube.com/watch?v=4lXBHD5C8do"
"f_LfBTLbp8Q","ஈரோட்டில் மாமியார் இறந்தற்கு மருமகள்கள் போட்ட குத்தாட்டம்!","2018-11-03T04:12:46.000Z","UCaP9XQSj4KMAWWZteAh7BFg","Kurumbu Poonai","24","18.04.11","Tamil News,Tamil latest news,Kurumbu ponnai","194160","1076","317","178","https://i.ytimg.com/vi/f_LfBTLbp8Q/default.jpg","False","False","ஈரோட்டில் #மாமியார் இறந்தற்கு மருமகள்கள் போட்ட #குத்தாட்டம்!  | #KurumbuPoonai"
