video_id,title,publishedAt,channelId,channelTitle,categoryId,trending_date,tags,view_count,likes,dislikes,comment_count,thumbnail_link,comments_disabled,ratings_disabled,description
"0samRmOIcLc","Wengie 'Ugly Christmas Sweater' MV (Official Music Video)","2018-11-17T18:00:02.000Z","UCuBuvOo0l7S9Yf-RbrGScBQ","Wengie Music","10","18.04.12","ugly christmas sweater,wengie ugly christmas sweater,christmas sweater,ugly sweater,wengie new music 2018,wengie,wengie cake,official music video,wengie deja vu,wengie oh i do,christmas,christmas music,댄스,bts reaction,christmas songs 2018,reacticorns,dance challenge,family is love,john lewis,abs-cbn,YES or YES,twice yes or yes live,twice 예스오어예스,abs-cbn philippines,엠넷,트와이스,jennie solo,exile tribe overdrive,rewrite the stars,gma christmas,dodo","5406252","115175","14673","29599","https://i.ytimg.com/vi/0samRmOIcLc/default.jpg","False","False","Official Music Video for Ugly Christmas Sweater by Wengie! 🎄🎄🎄 Spotify: http://bit.ly/spotifywengieucs🎄 iTunes: http://bit.ly/ituneswengieucsUgle Christmas Sweater - WengieLyrics:(Ooh ooh, shoobedoo, ooh) [2×] Go rap the presents, put 'em under the treePour me some eggnog and I'll bake the cookiesSittin' by the fire, keep the cold outside, oh yeah(Ooh, ooh, shoobedoo, ooh)Go hang the mistletoe, and then we can kissI told you Christmas don't get better than thisYou know what I wantPut your ugIy Christmas sweater on(Ooh, ooh, shoobedoo, ooh)Oooh, it's been waitin' in a box in the atticYou told me that you weren't sure you still had itBaby, don't you know?That the time has comeTo rock the polyester with the bells on the front(Ooh ooh, shoobedoo, ooh) [2×] No matter what holidayNaughty or Nice?With singing carols and to twinkle the lightsBaby, you and me got a little bit of everything(Ooh, ooh, shoobedoo, ooh)Go make an angel layin' out in the snowYou know it keeps you warm where ever you go You waited all year long to put your ugIy Christmas sweater on(Ooh, ooh, shoobedoo, ooh)Oooh, it's been waitin' in a box in the atticYou told me that you weren't sure you still had itBaby, don't you know?That the time has comeTo rock the polyester with the bells on the frontSo put it on, put it on, yeahHaving fun, having fun, yeahEveryone say they want thatOooooh~You know the cam with the battery pack?You can feel the water running straight down your backEverybody gonna ask you where you got it atEven Santa can't top that(Oooh, oooh, oooh, ugIy Christmas sweater) [2×]Go rap the presents, put 'em under the treePour me some eggnog and I'll bake the cookiesSittin' by the fire, keep the cold outside, oh yeahOoooh, oh yeahGo hang the mistletoe, and then we can kissI told you Christmas don't get better than thisYou waited all year longYou know what I want Come on put it onPut your ugIy Christmas sweater on Get your limited edition Christmas Merch! ➜ http://bit.ly/wengiemerch'Thanksgiving Sale' $30% Off Select Youth Products (Starts: Nov 17th / Ends: Nov 26th after cyber Monday)Subscribe! http://bit.ly/WengieMusicFamFollow me on Spotify: http://bit.ly/WengieSpotifyInstagram: http://www.instagram.com/wengie#ChristmasSongs #wengie #christmas #uglysweater"
"gsd_tbZNKbM","Guests FIRE BACK at Jimmy’s Insults!! | 8 Out of 10 Cats Does Countdown | Best of Guests Pt.1","2018-11-17T10:00:05.000Z","UCz1hQ68G3XPVYEBoFDgSjcQ","Channel 4","24","18.04.12","roisin conaty best bits,8 out of 10 cats does countdown,watch 8 out of 10 cats,8 out of 10 cats,watch 8 out of 10 cats episode,watch 8 out of 10 cats online,Channel 4,8 out of 10 cats does countdown joe wilkinson,jimmy carr,best moments,full episode,jon richardson,funniest moments,sean lock,jimmy carr insults,jimmy insults,cats does countdown guests,best insults,danny dyer,jason manford,rhod gilbert,susie dent,rachel riley,guests,david odoherty","1034208","9718","287","393","https://i.ytimg.com/vi/gsd_tbZNKbM/default.jpg","False","False","Subscribe to Channel 4 for more: https://bit.ly/2v2I6SYA lot of you have asked for it! Here's some of the best moments of guests firing back at Jimmy Carr's insults, part 1!Watch full episodes on All 4: https://goo.gl/dNM8NJ#CatsDoesCountdown #JimmyCarr #GuestsFireBack #FunniestMoments #JimmyCarrInsults #Channel4 #All4"
"DcQDlVzD9MY","This was life changing...","2018-11-17T23:00:13.000Z","UCC3OGYxHwV8pB5yLobw9KdA","Dobre Brothers","22","18.04.12","Dobre Brothers,The Dobre Brothers,Lucas and Marcus,Dobre Twins,Marcus and Lucas,Cyrus Dobre,Darius Dobre,Dobre Brothers YouTube,Lucas and Marcus pranks,Dobre brothers gymnastics,Dobre brothers pranks,Pranks,Gymnastics,Dance,Challenges,Music,Rap,Grocery Store,Cars,Reactions,Makeup,Make-up,Games,Food,Family,Collabs,Hello Lab,ATT Hello Lab,AT&T Hello Lab,The Bright Fight,Nabela Noor,Scotty Sire","1298539","44617","843","16293","https://i.ytimg.com/vi/DcQDlVzD9MY/default.jpg","False","False","We can all do our part to end online hate by spreading more love. Watch how just a small action like spreading some online or IRL love can change someone’s life! Nobody deserves hate, so make sure to spread the love and say later to the haters with our new gifs. Check them out at https://giphy.com/dobrebrightfight. Send them to your friends and let us know what your favorite Dobre Gif is in the comments below.And if you liked this video, give it a thumbs up, share it, and use #BrightFight. And make sure to watch the rest of the videos in the playlist! Check out more Bright Fight videos:https://www.youtube.com/playlist?list=PLGI3B8GyDF9qm73IJPYYAocFHny_xJt-NMore about AT&T Hello Lab and The Bright Fight:http://www.att-hellolab.com/bright-fight/http://www.instagram.com/atthellolabhttp://www.twitter.com/atthellolabhttps://www.youtube.com/channel/UCLQkJRvtdweZ-WkPxY0hGtQNEW MERCH! ➡ http://bit.ly/COPDobreMerchWE’RE GOING ON A 20 CITY TOUR! ➡ https://bitly.com/DobreTourTURN ON OUR POST NOTIFICATIONS!SUBSCRIBE!! https://www.youtube.com/channel/UCC3OGYxHwV8pB5yLobw9KdAFOLLOW US! Dobre BrothersInstagram - http://instagram.com/dobrebrothersCyrusInstagram - @CyrusdobreTwitter - @CyrusdobreMusical.ly - @CyrusdobreDariusInstagram - @DariusdobreTwitter - @DariusdobreMusical.ly - @DariusdobreLucas Instagram - @lucas_dobreTwitter - @DobrelucasMusical.ly @dobretwinsMarcusInstagram - @MarcusdobreTwitter - @DobremarcusMusical.ly - @dobretwinsBIZ - dobrebrothersmgmt@gmail.comTHANKS FOR WATCHING! :)This was life changing...https://www.youtube.com/channel/UCC3OGYxHwV8pB5yLobw9KdA"
"DlsD_cifOsk","Little Mix - Strip (Official Video) ft. Sharaya J","2018-11-16T19:30:01.000Z","UCssD3_aDYhaG44mwP53CO0w","littlemixVEVO","10","18.04.12","Sharaya,Sharaya J,The Four,Rapper,Mixers,Missy Elliott,LM5,Woman Like Me,Nicki Minaj,Glory Days,Mix,Shout Out To My Ex,Black Magic,Little Mix feat. Sharaya J,Pop,Strip,Syco Music","14816641","634075","20821","26031","https://i.ytimg.com/vi/DlsD_cifOsk/default.jpg","False","False","Little Mix - Strip ft. Sharaya J (Official Music Video)Little Mix's fifth studio album LM5 is OUT NOW! Get your copy here Official Music Store: http://smarturl.it/LMMusicStoreYTD LM5 Standard: http://smarturl.it/LM5_YTD LM5 Deluxe: http://smarturl.it/LM5Deluxe_YTD LM5 Super Deluxe: http://smarturl.it/LM5SuperDeluxe_YTDFollow Little Mix:Facebook https://www.facebook.com/LittleMixOfficialTwitter https://twitter.com/LittleMix  Instagram https://www.instagram.com/littlemix/  Spotify http://smarturl.it/LittleMixSpotifyMore great videos here http://smarturl.it/littlemixVEVO  Subscribe to Little Mix on YouTube: http://smarturl.it/littlemixYTStrip (Lyrics)Take off all my make up Cos I love what’s under it Rub off all your words Don’t give a uh I’m over it Jiggle all this weight yeah You know I love all of this Finally love me naked Sexiest when I’m confident You say I ain’t prettyWell I say I’m beautiful it’s my committee Say we too provocative Still look at me, look at me, look at me uh!Come for my girls you blocked Be Daily Mail ratin’ manana a la noche I don’t owe you nothing Nah I don’t give a no not anymore If you got lil boobs love it If you got a big ass grab it If you got none, babe rock it It’s your life, go get it if you want itUp in the mirror like ah yeah Lovin’ my figure like ah yeah When I’m slim or I’m thick I’m like ah yeah Swear I’m a kill em like ah ChorusStrip Take off all my makeup Cos I love what’s under it Rub off all your wordsDon’t give a uh I’m over it(Strip)Jiggle all this weight yeahYou know I love all of thisFinally love me nakedSexiest when I’m confidentI ain’t scared anymoreMy body outta controlBaby I know that you love dis, dis, dis, disI know ima hotGotta do what you wantIf they love it or they don’t I know you ain’t ready for dis, dis, dis, disBaby take it offStripDa da da, da da da da da Da da da, da da da da strip Love who you wanna Don’t give a damn issa man or a woman Wanna talk about colour It’s the skin that I’m in yeah I get from my mama I’m a woman don’t test meBaby I’m growin’, my stretch marks are sexy I don’t owe you nothing Nah I don’t give a no not anymore If you got lil boobs love it If you got a big ass grab it If you got none, babe rock it It’s your life, go get it if you want Chorus Strip Take off all my makeup Cos I love what’s under it Rub off all your words Don’t give a uh I’m over it (Strip) Jiggle all this weight yeah You know I love all of this Finally love me nakedSexiest when I’m confident Take off all my makeupCos I love what’s under itRub off all your wordsDon’t give a uh I’m over it(Strip)Jiggle all this weight yeahYou know I love all of thisFinally love me nakedSexiest when I strip"
"tLNOce4Y4uc","XXXTENTACION & Lil Pump ft. Maluma & Swae Lee  - Arms Around You (Official Music Video)","2018-11-16T15:00:04.000Z","UC6pjHMC4QXMi4llCCjtDXWg","Lil pump","10","18.04.12","xxxtentacion,lilpump,pump,maluma,swaelee,armsaroundyou,armaroundyou,xxx,lil pump,arms around you tribute,xxxtentacion tribute,sway lee,arms around you,arms around you song,rap music,pop music,hip hop music,xxx tentacion","47401224","1829077","43483","163893","https://i.ytimg.com/vi/tLNOce4Y4uc/default.jpg","False","False","Download/Stream Arms Around You here:  https://ad.gt/armsaroundyouLil Pump's Clothing Brand ► https://unhappy.com► Instagram: https://www.instagram.com/unhappystoreFollow Lil Pump:Twitter: https://twitter.com/lilpumpInstagram: https://www.instagram.com/lilpumpFacebook: https://www.facebook.com/lilpumpofficialSoundcloud: https://soundcloud.com/lilpumpXXXTENTACION:Twitter: https://twitter.com/xxxtentacionInstagram: https://www.instagram.com/xxxtentacionMaluma:Twitter: https://twitter.com/malumaInstagram: https://www.instagram.com/malumaSwae Lee:Twitter: https://twitter.com/goswaeleeInstagram: https://www.instagram.com/swaelee"
"6DHDIDgn2oA","J. Balvin - Reggaeton","2018-11-17T04:58:16.000Z","UCrHL_BF5lHyK43BxLU8-vBQ","jbalvinVEVO","10","18.04.12","J.,Balvin,Reggaeton,UMLE,Latino,Latin,Urban","35790243","508424","29847","20834","https://i.ytimg.com/vi/6DHDIDgn2oA/default.jpg","False","False","Escucha REGGAETON en todas las plataformas digitales ▶ https://UMLE.lnk.to/REGGAETONFpSUBSCRIBETE AQUI ▶ https://www.youtube.com/user/jbalvinVEVOSIGUEME EN:Facebook | https://www.facebook.com/JBalvinOficial/Instagram | https://www.instagram.com/jbalvin/ Twitter | https://twitter.com/JBALVINLyrics – J Balvin “Reggaeton” Estamos rompiendo O no estamos rompiendo, muchachos Y si el pueblo pide J Balvin man Y si el pueblo pide Leggo leggo Y si el pueblo pide (reggaetón reggaetón) No se lo voy a negar (reggaetón reggaetón) Si las mujeres piden (reggaetón reggaetón) Pues yo les voy a dar (reggaetón reggaetón) Y si el pueblo pide (reggaetón reggaetón) No se lo voy a negar (reggaetón reggaetón) Si las mujeres piden (reggaetón reggaetón) Pues yo les voy a dar (reggaetón reggaetón) DJ suénalo Baja y aceléralo Todo el mundo hasta abajo Y sin miedo ese booty pégalo No me mates la vibra a esta hora y gózatelo Metele sazón mami como dice Tego Ya tú sabes quienes son Me resalto del montón Dios bendiga el Reggaetón AménHasta abajo así soy yo Yankee pa esta me inspiró Bajo fuerte como ron Falda con mi pantalón bailando reggaetón (reggaetón) No se lo voy a negar (reggaetón reggaetón) Si las mujeres piden (reggaetón reggaetón) Pues yo les voy a dar (reggaetón reggaetón) Y si el pueblo pide (reggaetón reggaetón) No se lo voy a negar (reggaetón reggaetón) Si las mujeres piden (reggaetón reggaetón) Pues yo les voy a dar (reggaetón reggaetón) El reggaetón las pone freaky Se pega como Kiki Como yaviah con el wiki wiki La vida loca como Ricky No te la des de piky Que yo te visto fumando cripy Ya tú sabes quienes son Me resalto del montón Dios bendiga el Reggaetón Amén (Amén) Hasta abajo así soy yoYankee pa esta me inspiró Bajo fuerte como ron ron ron Y si el pueblo pide (reggaetón reggaetón) No se lo voy a negar (reggaetón reggaetón) Si las mujeres piden (reggaetón reggaetón) Pues yo les voy a dar (reggaetón reggaetón) Y si el pueblo pide (reggaetón reggaetón) No se lo voy a negar (reggaetón reggaetón) Si las mujeres piden (reggaetón reggaetón) Pues yo les voy a dar (reggaetón reggaetón) El Negocio socio J Balvin men (J Balvin men) Sky rompiendo (Sky) Tainy (Tainy) Viste Viste Reggaeton ton ton ton ton Reggaeton ton ton ton ton (x8)#JBalvin #Reggaeton #AmenChallengeMusic video by J. Balvin performing Reggaeton. © 2018 UMG Recordings, Inc.http://vevo.ly/J0SPhV"
"XG4rnKlgCN8","The Haunted Town Of Tombstone","2018-11-16T23:00:01.000Z","UCKijjvu6bN1c-ZHVwR7-5WA","BuzzFeed Unsolved Network","22","18.04.12","Buzzfeed unsolved,BuzzFeed,unsolved,mystery,unsolved mystery,unexplained,investigation,investigate,investigative,true crime,crime,criminal,theory,theories,case,cold case,cold-case,detective,detectives,scary,spooky,creepy,eerie,weird,strange,haunted,ghost,monster,demon,creepypasta,supernatural,paranormal,Tombstone,O.K. Corral,cowboy,cowboys,Old West,Arizona,shootout,gun fight,The Swamper,gift shop,Doc Holliday,Wyatt Earp,Virgil Earp,Clanton,McLaury","2275275","63774","2808","9925","https://i.ytimg.com/vi/XG4rnKlgCN8/default.jpg","False","False","We travel to the O.K. Corral in search of gunslinging ghouls.Unsolved has merch! Check it out here: http://bzfd.it/shopunsolvedWatch on Amazon Instant Video: http://amzn.to/2nxA2q6Watch on Hulu: https://hulu.tv/2FHqdMT Check out our BuzzFeed Original Series channel on Roku: http://bit.ly/2DUnOlECredits: https://www.buzzfeed.com/bfmp/videos/68733Welcome to the BuzzFeed Unsolved Network! This channel is your one-stop destination for all things mystery, conspiracy, supernatural, true crime, and everything in between. Subscribe here: http://bit.ly/2zuaR06.MUSICLicensed via Audio NetworkSTILLSBig Nose Kate's Saloon on E Allen St in historic Tombstone, Arizonacsfotoimages/Getty ImagesVillage near the OljatoâMonument Valley in Arizona.  Ranch house. Aerial view, from above, drone shootingAlenaMozhjer/Getty Imageslump of silver or platinum on a stone floorOat_Phawat/Getty ImagesClose-Up Of Beer Glass Against White BackgroundClassen Rafael / EyeEm/Getty ImagesAntique photograph of people from the World: Jay Gouldilbusca/Getty ImagesOuzina desertManuel Breva Colmeiro/Getty ImagesVector wooden TextureJulia_Khimich/Getty ImagesFull Frame Texture, old concrete wallIvan/Getty Images3D Image of classic old deserted western townrichard eppedio/Getty ImagesSilhouette of Cowboy couple riding horses at sunset, vectorkanyakits/Getty ImagesSet of blood splashes isolated on white background. Vector design elementioanmasay/Getty ImagesU.S. Army Taking over Western Territories Engraving, 1887bauhaus1000/Getty ImagesAntique photo of paintings: Manilbusca/Getty ImagesScenic View Of Mountains Against Clear SkyArthur Simoes / EyeEm/Getty ImagesEDITORIAL USE: Graves of OK Corral gunfight participants, Boothill Graveyard, Tombstone, ArizonaElizabeth Beard/Getty ImagesMan with handlebar mustache and chin puffHolly Harris/Getty ImagesCowboy in various action4x6/Getty ImagesOK Corral, TombstoneMirrorpix/Getty ImagesBarman stood behind the bar of his pubJGalione/Getty ImagesGlass and bottle of beer on tableLumina Images/Getty ImagesMen Killed by Wyatt EarpJohn van Hasselt - Corbis/Getty ImagesDoc HollidayJohn van Hasselt - Corbis/Getty ImagesTHE WESTERN CITY OF TOMBSTONE IN ARIZONAJohn van Hasselt - Corbis/Getty ImagesTombstone ArizonaArt Wager/Getty Images1900s PORTRAIT WOMAN...H. Armstrong Roberts/ClassicStock/Getty ImagesShotgun icon vectorMrsWilkins/Getty ImagesModern condo apartmentStuart Dee/Getty ImagesWyatt EarpBettmann/Getty ImagesEvil School Janitorinhauscreative/Getty ImagesSilbermine, Westerndorf 'Tombstone Village', Arizona, Nordamerika, Amerika, USA, ReiPeter Bischoff/Getty Imagesgravestone setkoya79/Getty ImagesCourt of the Queen's Benchduncan1890/Getty ImagesVictorian PeopleMan_Half-tube/Getty ImagesYoung Black Server or Waiter Holding a Trayinnovatedcaptures/Getty ImagesRidin' down the canyonEastview Photography/Getty ImagesTrailer Trashvandervelden/Getty ImagesA Stagecoach In TombstoneUnderwood Archives/Getty ImagesWestern style silhouette buildings.Klibbor/Getty ImagesEmpty pubSpaces Images/Getty ImagesWestern Cowboy Gunslingers - Gun Fight, OutlawsKeithBishop/Getty ImagesA black and white portrait of a cowboy in Paradise Valley, NV.Rachid Dahnoun/Getty ImagesA black and white portrait of a cowboy in Wells, NV.Rachid Dahnoun/Getty ImagesEquestrian Sports: WesternGaucho/Getty Imagescowboy deputytreasurephoto/Getty ImagesGrunge background in black and white with a brick patternAngel_1978/Getty ImagesCourthouse.Witold Skrypczak/Getty ImagesView from Massai Point at Chiricahua National Monument with Sulphur Spring Valley Dragoon Mountains in far distance.Witold Skrypczak/Getty ImagesYoung cowboy at table in saloonMordolff/Getty ImagesTombstone county courthouseTashka/Getty ImagesOK Corral Gunfight Site, Tombstone, Arizona, USAWalter Bibikow/Getty ImagesOK Corral Gunfight sign, Tombstone, Arizona, USADanita Delimont/Getty ImagesNorth America, United States, 1855, Map Of The United States Exhibiting The Several Collection Districts. Senate Ex. Doc. No. Drawn By David H. Burr Draftsman U.s, Senate. Ackerman Lith. Broadway N.y., Map Of The United States Exhibiting The Several CollHistoric Map Works LLC and Osher Map Library/Getty ImagesTables in restaurantTetra Images/Getty ImagesPortrait of a cowboyAdam Burn/Getty Imagesbartender shaking cocktail mixer in bar.RK Studio / Monashee Frantz/Getty ImagesTHB0008248Thinkstock/Getty ImagesTHC0020462Thinkstock/Getty ImagesColt Peacemaker and a handful of bulletsGeoff Brightling/Getty ImagesVIDEO(Slow Motion) Horse Running- Hoof Close UpRocheleau/Getty Images"
"sZ7Jlq9mQrY","Lamborghini Aventador vs Tesla Model X - DRAG & ROLLING RACE - Can an EV SUV beat a supercar?","2018-11-17T09:00:08.000Z","UCUhFaUpnq31m6TNX2VKVSVA","carwow","2","18.04.12","carwow,mat watson,4k review,lambo,lamborghini aventador,aventador,aventador s,tesla,tesla model x,model x,model x p100d,p100d,electric car,super car,drag race","3419776","51415","2846","6462","https://i.ytimg.com/vi/sZ7Jlq9mQrY/default.jpg","False","False","It’s petrol vs electric for our latest drag race! The Model X P100D has left all other competitors in its wake when it’s taken part in previous drag races, but how will it fare when it goes up against a 740hp Aventador S? There’s only one way to find out… Let’s race! Follow Yiannimize - http://youtube.com/YiannimizeInstagram – http://www.instagram.com/carwowcarsFacebook – http://www.facebook.com/carwowuk/Twitter – http://www.twitter.com/carwowukRefer A Friend – https://www.carwow.co.uk/shareAwkward haggling is a thing of the past with carwow. Choose your perfect car with our configurator tool and let the country’s best dealers compete over you. Compare the five best offers by price, location and dealer ratings and choose the one that’s right for you – no hassle, no haggling, just a great deal. Visit our site to save money on your new car – http://bit.ly/carwow-UK Oder auch in Deutschland Geld beim Autokauf sparen – http://bit.ly/carwow-DE"
"VI4DLrx4Rgw","MAX & Ty Dolla $ign - The Other Side (Official Lyric Video)","2018-11-16T05:00:02.000Z","UCe4LM_eKc9ywRmVuBm5pjQg","Atlantic Records","10","18.04.12","The Greatest Showman,Greatest Showman,Atlantic Records,Atlantic,Rewrite The Stars,This Is Me,A Million Dreams,P!nk A Million Dreams,A Million Dreams P!nk,Pink A Million Dreams,A Million Dreams Pink,Lyric Video,Greatest Showman Lyrics,Greatest Showman Soundtrack,V1weVGUmNTA,Official Lyric Video,The Greatest Showman Lyrics,MAX,ty dolla sign,the other side lyrics the greatest showman,the other side lyrics,max the other side,ty dolla sign the other side","1172560","34766","421","1313","https://i.ytimg.com/vi/VI4DLrx4Rgw/default.jpg","False","False","The official lyric video of The Other Side by MAX and Ty Dolla $ign from the album 'The Greatest Showman: Reimagined'.The Greatest Showman: Reimagined available now: https://Atlantic.lnk.to/TGS_ReimaginedID Subscribe for more official content from Atlantic Records:https://Atlantic.lnk.to/subscribeFollow The Greatest Showmanhttps://twitter.com/GreatestShowmanhttps://facebook.com/GreatestShowmanhttps://instagram.com/greatestshowmanFollow Atlantic Recordshttps://facebook.com/atlanticrecordshttps://instagram.com/atlanticrecordshttps://twitter.com/AtlanticRecordshttp://atlanticrecords.com The official Atlantic Records YouTube Channel is home to the hottest in hip-hop, rock, pop, R&B, indie, musicals and soundtracks. With over 70 years of global recorded music history, Atlantic Records’ legacy and passion for artistry continues with Top 40 hitmakers like Wiz Khalifa, Sean Paul, Trey Songz, Bruno Mars, Charlie Puth, Janelle Monáe, and B.o.B. Atlantic Records prides itself for working on Motion Picture Soundtracks, such as “The Greatest Showman”, “Suicide Squad” and “The Fate of the Furious.” As well as Musical Soundtracks including “Dear Evan Hansen,” and Grammy and Tony Award Winning “Hamilton”. It is home to world-renowned record labels representing music from every genre, including Asylum, Big Beat, Canvasback, Elektra, Fueled By Ramen, Rhino, Roadrunner, and Sire. Subscribe for the latest official music videos, official audio videos, performances, bts and more from our artists and projects.https://Atlantic.lnk.to/subscribe#TheGreatestShowman #MAX #TyDollaSign #TheOtherSide #LyricVideo #AtlanticRecords #Atlantic #TGSReimagined"
"oljw-gQY3D8","3 True Scary Horror Stories","2018-11-16T23:49:19.000Z","UCnM02drQP-dF7WMgtJHR4Xw","Mr. Nightmare","24","18.04.12","true scary stories,true stories,scary stories,true scary,creepy stories,mr. nightmare,mrnightmare,mr nightmare,nightmare,shocking,disturbing,creepy,horror,horror stories,true horror stories,real creepy stories,real scary stories,scary real horror stories,scary real stories,true horror","1197846","45177","739","8501","https://i.ytimg.com/vi/oljw-gQY3D8/default.jpg","False","False","Here are 3 random horror stories with no theme, all sent by subscribers.Story 1 : Nicole ElardoStory 2 : S. MartinaStory 3 : AnonymousInsta: https://www.instagram.com/realmrnightmare/Twitter: https://twitter.com/mista_nightmare?l...If you want to send a personal TRUE story of yours, please send it through email: mrnightmareinbox@gmail.comAnything with poorly structured sentences and grammar will not be read, so please just make them neat and understandable. Please also state how you https://www.youtube.com/upload?redirect_to_classic=truewould like your name to be credited in a video."
