video_id,title,publishedAt,channelId,channelTitle,categoryId,trending_date,tags,view_count,likes,dislikes,comment_count,thumbnail_link,comments_disabled,ratings_disabled,description
"DVHMaVIOttg","വീട്ടിൽ അടിച്ച് വാരുന്നവർ വരുത്തി വയ്ക്കുന്ന വലിയ നഷ്ടം","2018-12-07T05:42:59.000Z","UCDLvpnZxo_egdbR2BN1BB_A","Peace Of Islam - Malayalam Channel","27","18.09.12","peace of islam,peace of islam malayalam,peace of islam malayalam chennel","57699","521","102","104","https://i.ytimg.com/vi/DVHMaVIOttg/default.jpg","False","False","ഏറ്റവും പുതിയ പ്രഭാഷണങ്ങൾ കേൾക്കുവാൻ ഈ ചാനൽ ഇപ്പോൾ തന്നെ സബ്സ്ക്രൈബ് ചെയ്യുകhttps://www.youtube.com/peaceofislammalayalamchannelകൂടുതൽ മനോഹരമായ അറിവുകൾ നിറഞ്ഞ ഇസ്ലാമിക പ്രഭാഷണങ്ങൾക്കായി ഈ ലിങ്കിൽ ക്ലിക്ക് ചെയ്യുക https://www.youtube.com/channel/UCDLvpnZxo_egdbR2BN1BB_A/videos?disable_polymer=1&spfreload=10﻿ ☽ Peace Of Islam - Malayalam Channel ☾★ Suggested For You ★    -------------------------------🔴𝐏𝐨𝐩𝐮𝐥𝐚𝐫 𝐒𝐩𝐞𝐞𝐜𝐡𝐞𝐬▶ ഈ സൂറത്ത് 11 തവണ ഓതിയാൽ നിങ്ങളുടെ ഏത് ആഗ്രഹങ്ങളും സാധിക്കും https://youtu.be/Vnv4KxurlBc▶ സ്വർഗം ഉറപ്പാണ് ഈ ദിക്ർ ചെല്ലുന്ന ദിവസം നീ മരണപ്പെട്ടാൽ https://youtu.be/y2X6EShSpoY▶ ആർത്തവ ശുദ്ധി സ്ത്രീകൾ ശ്രദ്ധിക്കാതെ പോകുന്ന കാര്യം https://youtu.be/z9uOq_Z-EY8▶പാമ്പിന് സ്ത്രീകളോട് പ്രണയം തോന്നുമെന്നോ? | LATEST ISLAMIC SPEECH MALAYALAM https://youtu.be/GCJhcKkUfH4▶ വ്യഭിചാരത്തേക്കാൾ വലിയ തെറ്റ് ചെയ്യുന്ന ഭർത്താവ് | ISLAMIC SPEECH MALAYALAM  https://www.youtube.com/watch?v=EZrq6Aurzlo&t=4s▶ ഈ ദിക്ർ മുടങ്ങാതെ 15 ദിവസം ചെല്ലുന്നവരെ അള്ളാഹു കൈവിടുകയില്ല https://youtu.be/QtbvEWsoKNMകേരളത്തിലെപ്രഭാഷണകലയുടെ സുൽത്താന്മാരുടെ കേരളത്തിലെ അനുഗ്രഹീതമായ മജ് ലിസിന്റെ വേദികളിലൂടെ പകർന്നു നല്കുന്ന അറിവുകൾ ഈ ചാന്നലിലൂടെ നിങ്ങൾക്ക് ലഭിക്കും❤ സിംസാറുൽ ഹഖ് ഹുദവി പ്രഭാഷണങ്ങൾ ❤ കുമ്മനം നിസാമുദ്ധീൻ പ്രഭാഷണങ്ങൾ❤ ഖലീൽ ഹുദവി പ്രഭാഷണങ്ങൾ❤ ഉസ്താദ് ഫാറൂഖ് നഈമി പ്രഭാഷണങ്ങൾ ❤ പേരോട് ഉസ്താദ് പ്രഭാഷണങ്ങൾ ❤ അബുറയ്യാൻ ഉസ്താദ് പ്രഭാഷണങ്ങൾ❤ മറന്നുപോകാതെ കമന്റ്&ഷെയർ  (COMMENT&SHARE) ചെയ്യുക❤ ഈ പ്രഭാഷണം ഇഷ്ട്ടമായാൽ ലൈക് (LIKE) ചെയ്യുക"
"WWUuVLKdJXU","పవన్ అనుకున్నలక్ష్యం Nagababu Speech on Pawan | face to face | Nagababu Vote | T- Elections | 99 TV","2018-12-07T10:49:08.000Z","UCl5YgCiwSRVOiC2Nd1P9v1A","99TV Telugu","25","18.09.12","Nagababu Speech on Pawan,Nagababu face to face over his vote,Nagababu face to face,Nagababu speech on pawan,nagababu reaction on janasena,nagababu comments on,nagabau voting,nagababu vote in telangana,latest maga brothers updates,today nagababu press meet,nagababu response on jagan comments,Telangana Elections 2018,Vote,telangana polls,polling,ts polls,polls,ts elections,elections,elections in telangana,99 tv,mega brother nagabau talks on pawan","199810","8625","997","1739","https://i.ytimg.com/vi/WWUuVLKdJXU/default.jpg","False","False","పవన్అనుకున్నలక్ష్యం #Nagababu #Speech on #Pawan | #facetoface | Nagababu Vote | T- Elections  | 99 TV. The news of 99TV Telugu is daring, straightforward and biased only towards people.Using its unparalleled infrastructure, 99TV Telugu has brought shows that were unprecedented in its genre. As a pioneer in infotainment, it has launched a series of game shows and interactive content. Its hard-hitting news, frank questioning and result oriented analysis driven by its in-depth journalism have made it the agenda setter for the Telugu people. ►Subscribe to 99tv Telugu: https://www.youtube.com/99tvtelugu?sub_confirmation=1►Like us on Facebook: https://www.facebook.com/99tvtelugu► Follow us on Twitter:  https://twitter.com/99tvtelugu► https://www.instagram.com/99tvtelugu/► https://plus.google.com/u/0/+99TVTelugu"
"9n02ZpJMDak","यहां वोट डालने नहीं पहुंचा कोई मतदाता, इंतज़ार में रही पोलिंग पार्टी, जानिए ये है वजह!","2018-12-07T06:16:09.000Z","UCqYygyG8XVeQwSPy48NPqYg","The Sadaknama","22","18.09.12","[none]","177118","1875","121","185","https://i.ytimg.com/vi/9n02ZpJMDak/default.jpg","False","False","राजस्थान विधानसभा चुनाव को लेकर वोटिंग आज, 200 सीटों पर मतदान, शांतिपूर्ण मतदान की रिपोर्ट, देखिये हनुमानगढ़ जिले के नोहर विधानसभा क्षेत्र के गांव जसाना में वोट डालने नहीं गया कोई मतदाता, करीब ढाई घंटे तक एक भी वोट नहीं डला, जानिए ये है खास वजह, पूरा गांव एकत्रित लेकिन वोट नहीं डालेगा कोई, करीब 14 महीने पहले हुआ था पवन व्यास का मर्डर, गांव के लोग बोले: आरोपी नहीं तो वोट नहीं, देखिये द सड़कनामा की टीम पहुंची इस गांव में, देखिये ये रिपोर्ट प्रमोद कुमार के साथ वीडियो जर्नलिस्ट सुरेंदर दत्त।"
"51e5xPjtNqk","Back to School - Lunch Period - Mini Web Series - Season 01 -  EP 02 #Nakkalites","2018-12-04T10:28:21.000Z","UCiPmhfdCL06cSVTXKabF0Zg","Nakkalites","23","18.09.12","Back to school,web series,nakkalites mini series,nakkalites web series,english period nakkalites,nakkalites,nakkalites alaparaigal,tamil creators,nakkalites new video,social satire,tamil web series,tamil web series 2018,tamil new web series,indian web series,tamil tv series,tamil comedy web series,web series in tamil,web series tamil comedy,web series tamil,web series comedy,best tamil web series,top tamil web series,tamil original web series","913012","40790","959","2855","https://i.ytimg.com/vi/51e5xPjtNqk/default.jpg","False","False","When you think of your Lunch Period, What strikes to your mind first ??A Guy who brings huge Lunch box ??or the one who always brings different kinds of food ??or the fight that you had for a hand full of Rice ??Here we have Compiled a few..Watch and Share your Comments..!Thanks toDivoThai Thamizh Hr Sec School., Singanur.Ezhil SubramanianTiruppathi MGowri Shankar ( Diary Machines )CastNandhiniShrinithiSindhuVaideeswariNivedhithaArun KumarSassi KumarKavi JSRajesh RJAniruthAneessh SivashanmugamPrasanth VarmanSivan MoorthiTiruppathi MKannan BaluAsst. CinematographyVigneshJayachandranAsst. DirectionBoopalanSarathDubbingVikramanMusic & Sound DesignVivek SaroEditing & Field RecordistKannan BaluCinematographySujith SScriptNijanthanDirectionRajeshwar KProduction ManagersMithun VigneshProduced By Erumbugal NetworkSUBSCRIBE US at : https://www.youtube.com/?gl=INLIKE US at : https://www.facebook.com/Nakkalites/Follow Us at: https://twitter.com/NakkalitesIn Association with Divohttp://www.facebook.com/divomovieshttps://twitter.com/divomovies"
"NgluYiaYJks","గుడ్డలు విప్పుకుని తిరిగే వాళ్ళు సెలెబ్రిటీలా.. | Dr Garikapati Narasimha Rao | TeluguOne","2018-12-08T09:00:42.000Z","UCXjhJbviBl0M4JAC3cxDXqA","TeluguOne","22","18.09.12","garikapati,garikipati narasimha rao,garikapati narasimha rao,garikapati narasimha rao latest,garikapati speeches,orator,TeluguOne,poems,poet,motivational speeches,garikapati funny speeches,garikapati funny comments,BhakitiOne,best speeches,telugu pravachanalu,telugu speeches,hasyam,old age people,old people,human values,human,Garikapati Samethalu,celebrities dressing comedy,celebrities,dressing issues","27149","525","34","78","https://i.ytimg.com/vi/NgluYiaYJks/default.jpg","False","False","Garikapati Narasimha Rao is a very famous orator and a spiritual speaker. To know the poem’s significance watch the video. #GarikapatiNarasimharao #TeluguOne #FunnyVideosఇల్లు ఇరకాటం ఆలు మర్కాటం - సామెతలు విని కాసేపు నవ్వుకోండి - https://youtu.be/8ZSppOv5bLQమన సైనికుల గురించి ఎంత గొప్పగా చెప్పారో చూడండి - https://youtu.be/7cqXga-tAuAఅలాంటోడి కన్నా గడ్డి పరక మేలు - https://youtu.be/2q1R9P30rrAకొంపలు అంటించే వాళ్ళు కొంతమంది ఉంటారు - https://youtu.be/dHKplZrNc-0ఏమిటీ స్త్రీ శరీరమంతా పద్మాలేనా..? - గరికిపాటి గారి చమత్కారం - https://youtu.be/5vFH6ayEckUమంచి ఉంటే మైక్ లో చెప్పాలి చెడు ఉంటే చెవిలో చెప్పాలి - https://youtu.be/MWD7mx8OXMIస్వదేశీ కొడుకులు విదేశీ కుక్కలు - https://youtu.be/jmH_UKSjB_Iపాతికేళ్ళు వచ్చాక కాల్వ గట్టున అమ్మాయిని చూసాను అంటే కుదరదు - https://youtu.be/BbzyQMXGt44"
"pCTYQE20XC4","Manas Paavam Kidaiyathu - Subiksha | Manas Love Story","2018-12-08T02:30:00.000Z","UCjF5ecCYXFDvR0UY9GcfnoA","Cinema Vikatan","24","18.09.12","alya manasa hot,alya manasa dance,alya manasa lover,alya manasa and manas,alya manasa sanjeev,alya manasa breakup,alya manasa gift,alya manasa ad","29709","442","585","130","https://i.ytimg.com/vi/pCTYQE20XC4/default.jpg","False","False","In this Interview, Manas & Subhiksha talk about their love story, passion for dance, family, marriage , audience reception, expectation & much more.CREDITSReporter- Ayyanar Rajan  , Host - Selva ,Camera - Hariharan & Venkataraj,Edit - Rajasekar  Vikatan App - http://bit.ly/2reO1mdSubscribe Cinema Vikatan : https://goo.gl/zmuXi6 Subscribe: https://goo.gl/zmuXi6  Audio launch: https://goo.gl/K0vCt2  Interviews and features: https://goo.gl/Kn0XEZ  Satellite chips: https://goo.gl/nePcRI   Popcorn Reel: https://goo.gl/Zem8tm  Latest cinema news: https://goo.gl/f7ca67  Latest trending videos: https://goo.gl/io1n8Ohttps://twitter.com/#!/Vikatanhttps://www.facebook.com/Vikatanwebhttps://soundcloud.com/vikatanhttp://www.vikatan.com"
"g25StPrw624","My Next Smartphone May Surprise You...","2018-12-08T17:29:35.000Z","UCsTcErHg8oDvUnTzoqsYeNw","Unbox Therapy","28","18.09.12","smartphone,switch,switching,best smartphone,best smartphone 2018,best,2018,iphone,iphone xs,max,apple,samsung,galaxy note 9,galaxy note,note 9,samsung galaxy note 9,google pixel 3,google pixel 3 xl,3 xl,pixel,pixel 3,pixel 3 xl,google,samsung galaxy,galaxy,new,unboxtherapy,unbox therapy,vs,iphone vs,iphone xs vs,iphone xr,xr,xs,xs max,oneplus,oneplus 6t,oppo,huawei,vivo,mate 20 pro,3xl,unboxing,review,note,galaxy s9,galaxy s9+,android,ios","828440","31785","1634","3505","https://i.ytimg.com/vi/g25StPrw624/default.jpg","False","False","It's that time again... time for a new daily smartphone. Which do you think is the best smartphone of 2018?WATCH SOME MORE VIDEOS...Wait... This Headset Does WHAT?https://youtu.be/PCATqsHc7oEThe Truth About The iPad Pro...https://youtu.be/JXqou3SVbMwYou’ve Never Seen A Smartphone Like This…https://youtu.be/zpuy3vjdVNQThe Mind Bending 77-inch Wallpaper TVhttps://youtu.be/tjedpFHFKhYThe Craziest Smartphone Yet...https://youtu.be/tZsiEfnOp30Can The Google Pixel Slate Beat The iPad Pro?https://youtu.be/lccvHF4ODNYIs The Huawei Mate 20 Pro As Good As They Say?https://youtu.be/peYgzUIOUp8Is Nokia Back?https://youtu.be/mXjZMleiJZsI’m quitting computershttps://youtu.be/w3oRJeReP8gIs The Surface Laptop 2 The Perfect Laptop?https://youtu.be/Ht2L6wSEjHQThe Enormous Microsoft Surface Studio 2https://youtu.be/YZ489u3w7i0The Addictive Sliding Smartphone...https://www.youtube.com/watch?v=6vKQxTV366c&index=2&list=PL7u4lWXQ3wfI_7PgX0C-VTiwLeu0S4v34&t=8sThe Incredible Dual Screen Smartphone…https://youtu.be/hcDrGYyemDw?list=PL7...Is The iPad Pro Worth Laptop Money?https://youtu.be/FGJWE_qcOAM?list=PL7...Is This The Best Laptop For Most People?https://youtu.be/8eMdpKwEvRw?list=PL7...The Project Tesla Solar Powered Smartphonehttps://youtu.be/NVO5XgJlL9Y?list=PL7...3 Unusual Gadgets With Secret Features...https://youtu.be/zNxR4gPm82I?list=PL7...The Red Hydrogen One Holographic Smartphonehttps://youtu.be/3zdAhMPdJbI?list=PL7...OnePlus 6T - Is This My Next Smartphone?https://youtu.be/KI6ZJTSja4s?list=PL7...The Most Insane Gaming Laptophttps://youtu.be/Iy4G2_nTkRU?list=PL7...Unboxing Every iPhone XRhttps://youtu.be/u_MmxV2vNs8?list=PL7...Unboxing a $1300 Professional Fighting Robothttps://youtu.be/X7MpHzdscUk?list=PL7...Is The Pixel 3 A Scratch Magnet?https://youtu.be/VX0sA_-h0-o?list=PL7...This Smartphone Will Change Everything...https://youtu.be/a1OUaxl2iiI?list=PL7...Is This The Most Underrated Smartphone Right Now?https://youtu.be/xXdEn9ZiRDk?list=PL7...Razer Phone 2 Unboxing - Can It Compete?https://youtu.be/khxLE4EBoTc?list=PL7...I'm Switching To The Google Pixel 3 XL...https://youtu.be/EeFqcmaw6iA?list=PL7...The iPhone XS Max Is Great. Don't Buy It.https://youtu.be/2ccjWGaZe3k?list=PL7...Dear Google...https://youtu.be/XjZJHsYIj2w?list=PL7...Unboxing Every Google Pixel 3 XL + Pixel 3https://youtu.be/BJrsmM6aEYE?list=PL7...This Smartphone Has 5 Cameras… But Why?https://youtu.be/LNa93qmP868?list=PL7...The Levitating Turntable - What Magic Is This?https://youtu.be/JUlPN2A_r-g?list=PL7...The iPhone XS Has A Serious Problem...https://youtu.be/J_lRJuQtBmc?list=PL7...Realme 2 Pro Unboxing - The $200 Real Dealhttps://youtu.be/pNzhLB6vSGQ?list=PL7...My iPhone XS Max Is Doing Something Weird...https://youtu.be/Q3GGdtn9poo?list=PL7...I'm Switching To The iPhone XS Max...https://youtu.be/SeZsW1o-jaA?list=PL7...Unboxing Every iPhone XS + XS Maxhttps://youtu.be/XFckmtISfJk?list=PL7...iPhone XS + XR Actual Battery Capacity Revealedhttps://youtu.be/M-0hj4tmHNA?list=PL7...A Galaxy Note 9 Has Allegedly Exploded...https://youtu.be/tYpX-AeDfAA?list=PL7...The iPhone XR Is Depressing...https://youtu.be/rpeFbaf6XkM?list=PL7...Pocophone F1 Review - Is It Really That Good?https://youtu.be/xzZgO1xCJ7Q?list=PL7...Is This The Ultimate Gaming Smartphone?https://youtu.be/ejrjuZ5PDEc?list=PL7...This iPhone XS Max Was Not Made By Apple…https://youtu.be/8_gObXfLw28?list=PL7...Is This The Best Smartphone Notch Yet?https://youtu.be/NNh6qjHZED8?list=PL7...iPhone XS, XS Max, XR - Did Apple Do Enough?https://youtu.be/RQIG7XYqkK8?list=PL7...The Samsung Foldable Smartphone is Real...https://youtu.be/DULpT-mpUC4?list=PL7...Switching to the Pocophone F1...https://youtu.be/c7nC7G_urPY?list=PL7...The Truth About The Huawei P20 Pro...https://youtu.be/D--RtduxDMs?list=PL7...The Xiaomi Mi A2 is a crazy good deal... https://youtu.be/IMCQ0AyHG2w?list=PL7...Pocophone F1 - How Is This Smartphone Possible?https://youtu.be/ssw9H08ddlw?list=PL7...This is the Google Pixel 3 XLhttps://youtu.be/FBJUzImcGzc?list=PL7...The Best Smartphone For YouTubehttps://youtu.be/bIbfDxpzs7Y?list=PL7...FOLLOW ME IN THESE PLACES FOR UPDATESTwitter - http://twitter.com/unboxtherapyFacebook - http://facebook.com/lewis.hilsentegerInstagram - http://instagram.com/unboxtherapyGoogle Plus - http://bit.ly/1auEeak"
"B7vZ9R8B_Gw","Huawei Mate 20 Pro & Sennheiser PXC550 Unboxing ll in Telugu ll","2018-12-08T13:07:53.000Z","UCb-xXZ7ltTvrh9C6DgB9H-Q","Prasadtechintelugu","28","18.09.12","prasadtechintelugu,prasad,techtelugu,technews,prasad tech in telugu,huawei,huawei mate 20 pro unboxing,huawei mate 20 pro camera,huawei mate 20 pro unboxing in telugu,huawei mate 20 pro,huawei mate 20 pro review","53201","4560","62","550","https://i.ytimg.com/vi/B7vZ9R8B_Gw/default.jpg","False","False","Huawei Mate20 Pro : https://amzn.to/2E2o9meSupport me :) (Everytime you buy using the below links I get a small commission which will help me make more Product Reviews for you)download flipkart app : http://fkrt.it/yhZv3!NNNNFlipkart : http://fkrt.it/y2g5K!NNNNAmazon : http://amzn.to/2jILUGjfollow me in social mediahttps://twitter.com/iamprasadtechhttps://www.facebook.com/prasadtechintelugu/https://www.instagram.com/prasadyoutuber/https://plus.google.com/u/0/+prasad923923My GearLG 32 inch IPS Monitor : http://amzn.to/2nIFVDnNikon d5200 : http://amzn.to/2mw1G5kNikon 50mm f1.8 prime lens : http://amzn.to/2mcEkQxCanon 80D : http://amzn.to/2BW7TP6Vanguard Tripod : http://amzn.to/2B4KCwOLogitech k480 keyboard : http://amzn.to/2BZyElELogitech MX Master Mouse : http://amzn.to/2BXXOBnDivoom Aurabox : http://amzn.to/2B2HYYxBlue yeti microphone : http://amzn.to/2nNBkPGBoom Arm Stand : http://amzn.to/2B0EYfpZoom H1 Audio Recorder : http://amzn.to/2nIUqHBRode Smart LAV + Mic : http://amzn.to/2B2vakPRode SC3 Adapter : http://amzn.to/2kfyZsKBluedio Headset : http://amzn.to/2uZ0Fs8Harison Softbox Studio Lights : http://amzn.to/2B4XLpQAcoustic Foam Background : http://amzn.to/2B0xOYtUSB RGB LED Strip : http://amzn.to/2nLecSAMobile Stand : http://amzn.to/2yQGQVTPower Extension Board : http://amzn.to/2B5YabHAndroid Toy : http://amzn.to/2yR9zK8Unboxing Knife : http://amzn.to/2B1aoSBintromusic creditssong name :DEAF KEV - Invincible [NCS Release]https://www.youtube.com/watch?v=J2X5mJ3HDYEartist credits:▽ Follow DEAF KEVSoundCloud https://soundcloud.com/atm-dubstepFacebook https://www.facebook.com/ATMDubstepYouTube https://www.youtube.com/user/ATMDubstep"
"CYEmaee5GkQ","Gentleman 2 (2018) NEW RELEASED Full Hindi Dubbed Movie | Vishnu | South Dubbed 2018 Movie","2018-12-07T16:30:00.000Z","UCFTtrxmEhd1pu-_ShK8XeIg","Premium Digiplex Movies","1","18.09.12","gentleman2 2018 new movie goldmine,gentleman 2 full movie in hindi dubbed,gentleman 2 hindi dubbed movie,vishnu movies in hindi dubbed,action movies,hindi dubbed movies 2018 full movie,goldmine telefilms 2018 new releases,goldmine movies,south indian movies dubbed in hindi full movie 2018 new,hindi movies 2018 full movie,bollywood movies 2018,new released full hindi dubbed movies 2018,2018 New Hindi Dubbed Heroine Movies,south dubbed hindi movies 2018 full movie","748106","4883","476","0","https://i.ytimg.com/vi/CYEmaee5GkQ/default.jpg","True","False","Here is the Exclusive South Indian Blockbuster Movie 'Gentleman 2018' Starring Vishnu (Its a South Action Movie in Hindi Dubbed 2018, sauth movies in hindi dubbed, sauth indian movie in hindi dubbed full 2018 new hd)Sree Vishnu plays a youngster whose doting parents and loving sister give him fulfillment in life.  His new neighbour Chitra Shukla is beautiful and he predictably falls in love with her.When his parents and sister are snuffed out by a bomb blast, he becomes an orphan overnight.Seething with rage, like a typical avenging hero in a mass action entertainer, he takes it upon himself to trace the whereabouts of those behind the gory blast.  In his efforts to nab the terrorist network behind the blast, he has none to fall back on, except his own IQ, intuition and guts.Subscribe 'Gold Digiplex Movies' - https://goo.gl/23Hwh4"
"aiv12DLgyIM","Kitaben Bahut Si - JHANKAR BEATS | HD VIDEO | Baazigar | Shah Rukh Khan | 90's Best Romantic Songs","2018-12-07T07:30:00.000Z","UCWi_65E_L8tQZ34C6wVAlpQ","Venus","10","18.09.12","Kitaben Bahut Si,kitaben bahut si hd video song,hd video,hd video song,kitaben bahut si jhankar,kitaben bahut si full song,kitaben bahut si baazigar,baazigar,shahrukh khan,shilpa shetty,baazigar song,90's romantic songs,baazigar movie songs hd,shahrukh khan baazigar songs,90s songs,shahrukh khan songs old,jhankar beats,jhankar song,shilpa shetty baazigar song,hindi love songs,baazigar kitaben bahut si,bollywood 90's evergreen songs,90's hit songs,venus","336589","2006","343","152","https://i.ytimg.com/vi/aiv12DLgyIM/default.jpg","False","False","Kitaben Bahut Si - JHANKAR BEATS | HD VIDEO | Baazigar | Shah Rukh Khan & Shilpa Shetty | 90's Best Romantic SongsFor Bollywood HD Video Songs Jukeboxes : http://bit.ly/2oXKqHkEnjoy Bollywood Superhit Latest Songs Collection : http://bit.ly/2oaSGq7For Bollywood 90's Romantic Songs : http://bit.ly/2cdIFlABollywood Non Stop Superhit Music : http://bit.ly/2bFfwyjSong : Kitaben Bahut Si - Jhankar BeatsSinger : Asha Bhosle & Vinod RathodLyrics : Zafar GorakhpuriMusic : Anu MalikMovie : BaazigarFor More Updates, Subscribe to;For Hit & Latest Music:https://www.youtube.com/user/venus For Blockbuster Movieshttps://www.youtube.com/user/VenusMovies For Movies & Music in Regional Languages: https://www.youtube.com/user/venusregional For Heavenly & Peaceful Devotional Music: https://www.youtube.com/user/venusdevotionalFor Bhojpuri Superhit Movies & Music :https://www.youtube.com/c/VenusBhojpuriFor Gujarati Latest Music & Movies: https://www.youtube.com/c/VenusGujaratiFor Punjabi & Haryanvi Superhit Music:https://www.youtube.com/c/VenusPunjabiHaryanviFor Devotional & Islamic Qawwalis https://www.youtube.com/user/venusislamicFor Best Nursery Rhymes:https://www.youtube.com/user/venuskidsworldAlso You Can:'LIKE' us on Facebook: https://www.facebook.com/venusentertainmenthttps://www.facebook.com/venusentertainment2 'FOLLOW' us on Twitter: https://twitter.com/venusmovies 'CIRCLE' us on Google+:https://plus.google.com/+VenusMoviesFOLLOW' us on Instagram: https://www.instagram.com/venusmovies/"
"i9JeePZWnss","MY FIRST WORK SPACE TOUR | NEW STUDIO | Myhappinesz","2018-12-07T14:30:01.000Z","UCc9Po66Ghg5-RChE8VLaE-Q","MyHappinesz","26","18.09.12","my first work space tour,studio tour,office tour,myhappinesz,komalvlogz,workspace tour,work space,work space tour,lifestyle vlogs,studio vlog,interior design,come see my office,lifestyle videos,office decor,peppy studio ideas,best studio,studio 2018,my first studio tour,studio,tour,home studio tour,diy,behind the scenes,setup,best home studio,recording studio tour,organization,youtube studio tour,trending,trending on youtube,fan mails","43772","3883","97","529","https://i.ytimg.com/vi/i9JeePZWnss/default.jpg","False","False","Very Emotional video for me as I share with you all my First Office Tour. Hope you enjoyed watching the video, make sure to like, share and subscribe!! My Mum's Instagram Handle: https://www.instagram.com/lifespaces_interior/?hl=en ----------------------------------------­­­­­­­----------------------------------­-­-­-­-My Links:VLOG CHANNEL : https://www.youtube.com/channel/UCAz8...INSTAGRAM : https://www.instagram.com/myhappineszTWITTER : https://twitter.com/myhappineszFACEBOOK : https://www.facebook.com/MyHappineszSNAPCHAT : komalucky----------------------------------------­­­­­­­----------------------------------­-­-­-­-• My Equipment •Vloggiing Camera: http://amzn.to/2uBZ8ZoMain Camera: http://amzn.to/2u9Fx1XStock lens: http://amzn.to/2visg5QLens used for videos: http://amzn.to/2vBnekbProduct shoot lens: http://amzn.to/2vBG4rgMic: http://amzn.to/2tpQUo0Better quality mic: http://amzn.to/2u9FJyrTripod 1: http://amzn.to/2u9PD34Tripod 2: http://amzn.to/2visNEIBall head for Tripod 2: http://amzn.to/2vif3dlGoPro: http://amzn.to/2tpJXmI----------------------------------------­­­­­­­----------------------------------­-­-­-­-• Contact • Myhappinesz@gmail.comWish to send me letters or things53/3 D.B Gupta RoadKarol BaghNew Delhi110005----------------------------------------­­­­­­­----------------------------------­-­-­-­-Thanks for watching!Komal"
