video_id,title,publishedAt,channelId,channelTitle,categoryId,trending_date,tags,view_count,likes,dislikes,comment_count,thumbnail_link,comments_disabled,ratings_disabled,description
"RvQDcs5Ig_M","Ennu Swantham Jani | 1th Nov 2018 | Surya TV","2018-11-02T07:05:27.000Z","UCHyU1e7YmhHgUnVwpP5hpYA","Surya Television","24","18.04.11","Surya TV,Soorya TV,Malayalam Programs,Malayalam Entertainment,Malayalam Serials,Surya TV Serials,SuryaTV","61846","104","32","10","https://i.ytimg.com/vi/RvQDcs5Ig_M/default.jpg","False","False","Steps to avail 20% Discount on Sun NXT subscription:  1 Logon to http://bit.ly/YT20OFFER or Download Sun NXT android app from Playstore. 2 Click on any video content & Sign up or Sign in. 3 Enter the Coupon YT20 in the Coupon Code option in Subscription Pop-Up. 4 Complete your payment on discounted price.￼      Offer applicable only for Quarterly & Yearly packs. 5 iPhone customers can avail the discount from your browser onlyT&C Apply.Enjoy Sun NXT. T&C:·         This discount offer is not applicable for users from US.·         The discount if applicable only of new purchases and not for renewals·         The renewals for the discounted purchase will be on the actual cost·         Offer applicable only for Quarterly & Annual Packs·         Offer not applicable for users paying via iTunesWatch Ennu Swantham Jani - 1th Nov, 2018, Full Episode on Sun NXT : http://bit.ly/YtMalEnnuJani is an orphaned six-year-old, she has people who takes care of her at the same time who wants to kill her. The serial showcases her struggles in life losing her mother and later on her father too. Thamara, Abayan, Jeevan, are the ones who lives to ensure Jani’s safety. Mortuary Mani a goon, has vowen to destroy Jani as she gave witness to the murder he committed. How Jani struggles to live in this world, ensuring not just her’s but her loved ones safety forms the story of this heart touching serial.To Watch all SURYA TV Programs on Sun NXT Click http://bit.ly/SuryaTVLIVEWatch 4000+ Movies, 40+ Live TV Channels, TV Shows, Music Videos, Comedy and exclusives on Sun NXT anytime anywhere.Download Sun NXT Now to Enjoy Unlimited entertainment,Android: http://bit.ly/SunNxtAdroidiOS: India - http://bit.ly/sunNXTiOS Rest of the World - http://bit.ly/ussunnxtor Visit https://www.sunnxt.comFollow Us On Our Social Media LinksFacebook     : https://www.facebook.com/SuryaTVTwitter          : https://twitter.com/SuryaTVInstagram    : https://www.instagram.com/suryatelevision/Watch all SuryaTV Programs on Sun NXT AppSunNXT: https://www.sunnxt.com/"
"6VibxllZzSg","Nasreen Horror Show | Rahim Pardesi","2018-11-01T14:31:05.000Z","UC-awjwg4N6lWu1TSK1ostjQ","Rahim Pardesi","24","18.04.11","nasreen horror show,nasreen scary movie,rahim pardesi,nasreen scary video,nasreen monster,nasreen halloween,new nasreen video,rahim pardesi horror,rahim pardesi scary video,nasreen funny,scary spoof,funny scary video,nasreen halloween 2018","805497","28872","2307","4676","https://i.ytimg.com/vi/6VibxllZzSg/default.jpg","False","False","SUBSCRIBE FOR NEW VIDEOS EVERY WEEK!Snapchat rahimpardesiFacebook https://www.facebook.com/rahimpardesii/Instagram https://www.instagram.com/rahimpardesi/"
"fJo8CqLzJRY","Onteru Pratap Reddy Says Harish Rao Going to Join in Congress Party | YOYO TV Channel","2018-11-03T16:16:38.000Z","UCJ97pLhPp-CU9Tj4-dp9B6g","YOYO TV Channel","25","18.04.11","talangan news,harish rao,pratap reddy,kcr,cm kcr,trs,party,congress party,pratap reddy gajwel,onteru pratap reddy,telangana news,latest news,onteru pratap reddy on harish rao,onteru pratap reddy comments on kcr,onteru pratap reddy trs party,onteru pratap reddy rally,onteru pratap reddy latest,onteru pratap reddy comments,onteru pratap reddy about harish rao,onteru pratap reddy news,onteru pratap reddy video,yoyo tv,yoyo channel,yoyo news channel","20299","250","117","68","https://i.ytimg.com/vi/fJo8CqLzJRY/default.jpg","False","False","onteru pratap reddy Says Harish Rao Going to Join in Congress Party Top Ten Telugu Trending Videos from Our Channel 1.   జగన్ పై దాడి ని ముందే చెప్పిన శివాజీ ...👉🏻 https://www.youtube.com/watch?v=yY-KdZxOQuE2 .  Anchor Shyamala And Narasimha Exclusive Interview 👉🏻 https://www.youtube.com/watch?v=elWCrKCI9983.  Is Telangana Congress MLA Candidates List For Telangana Assembly Elections 2018 Confirmed?👉🏻 https://www.youtube.com/watch?v=CsqzpCe7eac4. Rahul Gandhi Speech at Kamareddy @Telangana Congress Public Meeting👉🏻 https://www.youtube.com/watch?v=WsF-r9lnQjY5. 2050 లో ఊహించని విధంగా మనిషి జీవితం👉🏻 https://www.youtube.com/watch?v=_O1lzKPaKVA6.  Mangli Songs | Mangli Excellent Performance at ATC 2018👉🏻 https://www.youtube.com/watch?v=xMqS0N7CUfA7. Folk Singer Sai Chand Songs on Revanth Reddy at TRS Meeting - Kodangal👉🏻 https://www.youtube.com/watch?v=sjJJeZTCZmA9. Madhu Priya Song Performance & Anchor Udaya Bhanu Dance at World Telangana Convention👉🏻 https://www.youtube.com/watch?v=LI0ztYhDHPY10. Interesting Facts About Teenmar Mangli👉🏻 https://www.youtube.com/watch?v=CamXlnOQF7EDownload YOYOTV App NowAndroid: https://play.google.com/store/apps/details?id=com.yoyiptv.yoyomobileiOS: https://itunes.apple.com/us/app/yoyotv/id1392981692?mt=8Watch 24/7 News Videos, Breaking News updates, special political analysis, current issues, celebrity latest updates, movie reviews and exclusive Interviews anytime anywhere.Follow Us on: Facebook: http://bit.ly/2hkcu66 https://plus.google.com/+YOYOTVChannelTwitter: https://twitter.com/YOYOTVChannel Website: http://yoyoiptv.com/Subscribe Us https://www.youtube.com/channel/UCJ97pLhPp-CU9Tj4-dp9B6g?sub_confirmation=1"
"3zawDzZJ8xk","Left Hand's Revenge | ft. Naga Chaitanya | Savyasachi | ChaiBisket","2018-11-01T14:46:49.000Z","UCswaOEJ1UiLSiXR3s0Dw7vg","Chai Bisket","24","18.04.11","Chai Bisket,Girl Formula,Krazy Khanna,Vijay Devarakonda,The Athidi,If Subjects Were People,telugu,Chai with Charan,*her,What If...,Nenu Mee Kalyan,savyasachi,savyasachi songs,mm keeravani,naga chaitanya,savyasachi review,chandoo mondeti,interview,left hand,revenge,songs,madhavan,savyasachi public talk,alien hand syndrome,vanishing twin syndrome","177042","4199","145","230","https://i.ytimg.com/vi/3zawDzZJ8xk/default.jpg","False","False","What If Our Left hand starts taking revenge on us.Dear Fans, Click the bell icon 🔔 near the Subscribe button on your Mobile app & Desktop to get instant notification for all the upcoming episodes and music videos of Chai Bisket! :)Follow us on Facebook : http://bit.ly/fbpagecbTwitter : http://bit.ly/TweetCBInstagram : http://bit.ly/cbinstacbYou tube : http://bit.ly/1TTIAmpWebsite : http://chaibisket.com/"
"poMY4Eqka3Q","RANGER (2018) | New Released Full Hindi Dubbed Movie | Action Movie 2018 | South Movie","2018-11-03T16:30:01.000Z","UCt7_pnSRPKU3bu2GqmgH8gQ","WAMIndiaMovies","1","18.04.11","RANGER,ranger full movie in hindi dubbed,2018 released hindi movie,hindi dubbed movies 2018 full movie,hindi movies new 2018,hindi movies 2018 full movie,hindi dubbed movie,latest bollywood movies 2018,2018 released south indian movies,new south indian movies dubbed in hindi 2018 full,2018 New Hindi Dubbed Movies,hindi action movies,south dubbed hindi movies 2018 full movie,upcoming movies 2018 official trailers bollywood","363730","3241","298","118","https://i.ytimg.com/vi/poMY4Eqka3Q/default.jpg","False","False","Here is a Latest South Indian Blockbuster Movie 'RANGER' is a south indian movies dubbed in hindi full movie 2018 new. 'RANGER' is a 2018 New Released Full Hindi Dubbed Movie. Watch full Movie for More.Click to Susbscribe Us: http://goo.gl/Bscph8Shiva ('Ganesh Venkataraman') is an IT graduate, who is in love with Archana (Kalpana Pandit), a medical student. Shiva lands up with a big job in USA. However Archana's father throws a challenge before Shiva leaves to USA. He agrees to get her daughter married to him on one condition that he should not call up or try to meet his daughter for the next one year. After a couple years, one can see a total change in Shiva. He romances his colleague Maya ('Shibana Shankar') and forgets Archana. But one evening, he is suddenly drawn to his past. Thoughts about Archana come up. He rushes to the doctor only to find out that a truth about him, which he didn't know so far.___________________________________RANGER,ranger full movie in hindi dubbed,2018 released hindi movie,hindi dubbed movies 2018 full movie,hindi movies new 2018,hindi movies 2018 full movie,hindi dubbed movie,latest bollywood movies 2018,2018 released south indian movies,new south indian movies dubbed in hindi 2018 full,2018 New Hindi Dubbed Movies,hindi action movies,south dubbed hindi movies 2018 full movie,upcoming movies 2018 official trailers bollywood"
"h9t2rMRJpUY","Chicha v/s Friends : The Diwali War (A short comedy film) | Hyderabadi Comedy | The Baigan Vines","2018-11-01T10:39:12.000Z","UCsHhB0DI59ru6T4fp5lb4Jw","The Baigan Vines Official","24","18.04.11","ashish,chanchlani,hyderabadi,jokes,bb,ki,vines,comedy,balajimovies,tollywood,movies,latest,india,videos,whatsapp,diwali,funny diwali videos,tbv,tbv 2018,baigan vines,baigan vines new video,baigan vines diwali,snaptube,types of people on diwali,friends vs chicha,diwali war,baigan vines chicha,baigan vines musically,latest diwali video,how to burn crackers,lighting firecrackers,lighting 1000 fireworks","368122","9797","265","951","https://i.ytimg.com/vi/h9t2rMRJpUY/default.jpg","False","False","1. Download Special Version of Snaptube : http://bit.ly/TBVDiwali and WIN upto Rs.85,000 cash in Snaptube Diwali Contest!2. Participate in the contest and post SCREENSHOThere : http://bit.ly/ContestDiwaliRules of the Diwali ContestA) Download the special version of AppB)Use App to download Diwali special Video Of The Baigan Vines Diwali Video.C)Share to friend via whatsapp from Snaptube App itself & make screenshot.D)Comment On 2nd link given of diwali contest post with the screenshot, mention the name of Our Channel  The Baigan Vines to get a special Diwali wish.E)1 lucky winner will get 31000 Rupees cash, 5 lucky ones will get 11000 Rupees each. All the winners can get special Diwali wish from The Baigan VinesCheck out the funny Diwali war that starts after a fight between a Chicha and 2 Friends!To Promote your Brand/Product, mail us for details on : - Thebaiganvines@gmail.com- Contact@thebaiganvines.comOur 2nd Channel : https://www.youtube.com/ThebaiganvinesExtrasFACEBOOK: https://www.facebook.com/thebaiganvinesINSTAGRAM: https://www.instagram.com/the_baigan_vinesThe Baigan Vines bringing You The Best Hyderabadi Comedy/Funny Clips, Skits, Vines, Social experiments, Pranks and Much More !!!indian comedy funny,indian comedy funny video,indian comedy funny movies,indian comedy funny clips,indian comedy funny videos 2016,dehati indian comedy funny video,funny indian comedy,dehati india funny comedy,funny stand up comedy india,india vs pakistan funny comedy,indianfunny boy full comedy,indian best funny comedy,funny indian baby comedy,funny british indian comedy,indian bangla funny comedy,indian funny comedy video clips,indianfunny show comedy circus,funny indian comedycompilation,indian funny comedy channel,funny indian child comedy,indian dehati funny comedy,indian funny comedy dance,full funny comedy indian dehati,funny indian stand up comedy english,funny indian english comedy,funny friend indian comedy,indian funny comedy film,indian funny guy comedy,indian hot funny comedy videos,funny stand up comedy indian hindi,indian hindi funny comedy,hindi comedy funny,hindi comedy funny video,hindi comedy funny movie,hindi comedy funny jokes,hindi comedy funny scene,new hindi comedy funny video,new hindi comedy funny,hindi comedy videos funny 2017,funny stand up comedy hindi,funny comedy videos hindi movie,funny indian movie scene comedy scene,most funny indian comedy,funny comedy movies 2017 indian,indian comedy pranks funny videos,funny stand up comedy indian,indian funny show comedy,funny indian comedy scenes,south indian funny comedy,indian whatsapp comedy videos funny unlimited,whatsapp video funny comedy indian,indian comedy videos funny 2017 bollywood scenes best,bollywood scenes comedy,bollywood scenes action,bollywood scenes funny,bollywood funny scenes action,bollywood comedy scenes all the best,bollywood best scenes action,bollywood movies best scenes,behind the scenes bollywood movies funny,bollywood movies comedy scenes,funny comedy scenes bollywood,bollywood drama romantic scenes,bollywood movies dance scenes,best bollywood scenes ever,funniest bollywood scenes ever,funny bollywood scenes eng sub,funny bollywood scenes ever,bollywood emotional scenes"
"YaZplz_GdJs","Ghadge & Suun - 2nd November 2018 - घाडगे & सून","2018-11-03T06:02:56.000Z","UCiYWSa2j-dIdZMgZKyrV1ig","Colors Marathi","24","18.04.11","Colors Marathi,ETV Marathi,colorsmarathi,VOOT,new promo,clips,3 minute clip,Ghadge & Suun voot clip,Ghadge & Suun full episode online,watch Ghadge & Suun online,Ghadge & Suun,ghadge,beautiful,daughter-in-law,Amruta,modern,ideologies,clash,Mai Ghadge,traditional,amruta,8:00pm,8pm,mon-sat","20609","45","11","2","https://i.ytimg.com/vi/YaZplz_GdJs/default.jpg","False","False","To watch the full episode of 'Ghadge & Suun' anytime, Download the Voot app now or Visithttps://www.voot.com/shows/ghadge-&-suun/1/523875/amruta-vasudha-have-a-rift/648630The Ghadge household is all set to welcome their beautiful daughter-in-law, Amruta. But what happens when Amruta's modern ideologies clash with those of Mai Ghadge, the traditional matriarch of the family? Can Amruta win over Mai and still live her life on her terms? Watch Ghadge & Suun now."
"7xKW8Y_xVx4","Fun Bucket | 157th Episode | Funny Videos | Telugu Comedy Web Series | By Sai Teja - TeluguOne","2018-11-01T13:46:13.000Z","UCXjhJbviBl0M4JAC3cxDXqA","TeluguOne","23","18.04.11","fun bucket,TeluguOne,fun bucket series,fun bucket juniors,wife and husband jokes,telugu comedy web series,fun bucket comedy videos,latest fun bucket copy,#meetoo,paparayudu comedy,#meetoojoke,wife and husband joke,lovers joke telugu,drinker comedy,trishool baba,friends jokes,brother and sister joke,fun bucket trishool,teluguone web series,fun bucket jokes,trishool comedy,telugu funny jokes,fun bucket dubsmash,teluguone comedy,comedy web series","172410","2784","268","507","https://i.ytimg.com/vi/7xKW8Y_xVx4/default.jpg","False","False","Fun Bucket 157th Copy. Checkout Awesome Funbucket Telugu Comedy Videos / Funny Videos. TeluguOne Comedy Web Series 2018. #FunBucket #TeluguComedyWebSeries #FunBucketJokesFun Bucket | 156th Episode - https://youtu.be/Ve4lCPJr9C4Fun Bucket | 155th Episode - https://youtu.be/6jF-vXUHD2QFun Bucket | 154th Episode  - https://youtu.be/x2c8cGF31X4Fun Bucket 153rd Episode - https://youtu.be/HY2Uukd3eGQFun Bucket 152nd Episode - https://youtu.be/YVg-x4JohvgFun Bucket 151st Episode - https://youtu.be/H8g9O5Y0MQsFun Bucket 150th Episode - https://youtu.be/gmZpEHvEvzIFun Bucket 149th Episode - https://youtu.be/giX1rpGzgVgProducer : Ravi Shankar KantamneniEditing : ShyamD.O.P : Mahesh BejjankiDirection : Sai TejaFollow and Like us on Our facebook page :- https://goo.gl/gdu2i6Send your videos to this mail ID :  funbucketseniorsupdates@gmail.com "
"gaozqQKc8NI","Tata Tiago JTP and Tigor JTP | First Drive Review | Autocar India","2018-11-03T05:30:23.000Z","UCjWs7BxyjO5SLqevxSmp4vQ","Autocar India","2","18.04.11","autocar india,autocar,Tata tiago JTP,tiago jtp price,tigor jtp launch date,tata car review in english,tata tiago 2018,tata tiago jtp launch,tata tigor jtp,tata tigor sport,tata tigor jtp mileage,tata tiago jtp review,tata tiago jtp features,tigor sport review,tata tiago performance,tata tiago / tigor jtp features,tata tiago jtp interiors,upcoming cars in india,latest tata car,upcoming tata cars,tata tiago jtp test drive,tata tigor jtp review 2018","80662","1562","65","250","https://i.ytimg.com/vi/gaozqQKc8NI/default.jpg","False","False","For just about a lakh more than the standard cars, you could have one of these - the hotted up JTP versions of the Tata Tiago and Tigor. But what are they like to drive? All show and no go? Nikhil Bhatia drives them to find out. #TiagoJTP #TiagoJTP #TeamAutocarSUBSCRIBE to Autocar India for hottest automotive news and the most comprehensive reviews ► http://bit.ly/AutocarIndAutocar India is your one stop source for test drive reviews & comparison test of every new car released in India. We also offer a great mix of other automotive content including podcasts, motor show reports, travelogues and other special features.Click this link for latest car reviews ►http://bit.ly/ACI-NewCarReviewsClick this link for comparison tests of latest cars & bikes ►http://bit.ly/ACI-ComparisonClick this link for latest bike reviews ►http://bit.ly/ACI-BikeReviewsClick this link for Autocar India exclusive features ►http://bit.ly/ACI-FeaturesVisit http://www.autocarindia.com for the latest news & happenings from the auto world.Facebook: http://www.facebook.com/autocarindiamagInstagram: https://www.instagram.com/autocar_india/Twitter: http://www.twitter.com/autocarindiamagG+: https://plus.google.com/+autocarindia1"
"fm93mLeb4uE","MAMA JAFRY did my Makeup! **SCARY**","2018-11-03T14:30:01.000Z","UChIrj5Qb5V-TZIRrk0Df-Uw","Shahveer Jafry","24","18.04.11","shahveer jafry vlogs,shahveer jafry,shahveer vlogs,vlawgs,shavengers,halloween,prank,makeup,mua","96918","8296","87","1509","https://i.ytimg.com/vi/fm93mLeb4uE/default.jpg","False","False","Shahveer Jafry – MAMA JAFRY did my Makeup! **SCARY**Subscribe: http://bit.ly/subJafry | Follow my IG: https://instagram.com/shahveerjayWatch the LATEST from Shahveer Jafry: https://youtube.com/playlist?list=PLPQW3yJZGl1Jasc3OdYlFAv6hdWO6gSTsFollow Shahveer Jafry:Facebook: https://facebook.com/shahveerjayInstagram: https://instagram.com/shahveerjayTwitter: https://twitter.com/shahveerjaaySnapChat: https://snapchat.com/add/shahveerjWatch More Shahveer Jafry:Vlogs: https://youtube.com/playlist?list=PLPQW3yJZGl1JlZrSsI6fWHHb4wGnD-3EuSkits: https://youtube.com/playlist?list=PLPQW3yJZGl1IXAZbaVo451I2GPkvgBq92Romeo & Chintu: https://youtube.com/playlist?list=PLPQW3yJZGl1KTk_hPtdIk84NzVJhz_76APranks: https://youtube.com/playlist?list=PLPQW3yJZGl1K6wpWQRhkNHi776aEKbt4VLatest Uploads: https://youtube.com/playlist?list=PLPQW3yJZGl1Jasc3OdYlFAv6hdWO6gSTsPopular Uploads: https://youtube.com/playlist?list=PLPQW3yJZGl1KAHlZ3rVvBbGFJTgJQdHawThe Hunter by Audionautix is licensed under a Creative Commons Attribution license (https://creativecommons.org/licenses/...)Artist: http://audionautix.com/Razihel - Love U [NCS Release]https://www.youtube.com/watch?v=OJBxN...Razihel• https://soundcloud.com/razihel• https://www.facebook.com/RazihelOffic...• https://www.youtube.com/user/RazihelO...• https://www.instagram.com/razihel/"
"omd7ORCZGYA","October Favourites 🍒💋🎟","2018-11-02T14:14:07.000Z","UCNrfs-wsE7yadASGhw6iKWg","Scherezade Shroff","26","18.04.11","october,favorites,favourites,fashion,beauty,Scherezade shroff,Sherry,Sherry shroff,how to,DIY,makeup,Tutorial,Style,Hairstyle,indian youtuber,indian beautyguru","31145","1137","56","265","https://i.ytimg.com/vi/omd7ORCZGYA/default.jpg","False","False","Its that time of the month again! Tell me your October Favourites in the comments :)NEW UPLOAD EVERY MONDAY & FRIDAY!!!!OCTOBER FAVOURITESLIPSTICK- NUDESTIX IN MYSTIChttps://goo.gl/jVpSVPMOVIESVENOMhttps://www.youtube.com/watch?v=u9Mv98Gr5pYCRAZY RICH ASIANShttps://www.youtube.com/watch?v=ZQ-YX-5bAs0APPLE WATCH SERIES 4https://goo.gl/R5CvhmIPHONE XS MAXhttps://goo.gl/JK1VgaMOMENT - RED HAIRHair Colour Details- Magenta red on the tips and 5.20 on the roots. my hair wasn’t bleached before and its not ammonia free colour.KERASTASE REFLECTION SHAMPOOhttps://www.kerastase.in/kerastase-productsSHOESGOLD ONITSUKA TIGERhttps://www.onitsukatiger.com/sg/en-sgDAMAGE FREE GEL NAILShttps://www.youtube.com/watch?v=nzRo31UBb0I&t=1sCHERRY-COLA TIC-TAChttps://goo.gl/4kmKswGREENKURE OILhttps://goo.gl/7Ej8mDSHOWSSHARP OBJECTSTHIS IS USwww.hotstar.comTRAVELS WITH MY FATHERDYNASTYWONDERLUSTwww.netflix.inFollow me Twitter- @sherryshroffInstagram- @sherryshroffSnapchat- sherryshroffFacebook-  https://www.facebook.com/scherezadeshroff?ref=hlGoogle + - https://plus.google.com/u/0/+ScherezadeShroffPinterest- http://www.pinterest.com/sherryshroff/SEND ME A LETTER!!!P.O. BOX NO 227G.P.O. MUMBAIMUMBAI-400001Check Out My Other Channels!!!Coupling!https://www.youtube.com/channel/UCNi_vge0Wij6vJISgRuYvwgGottaDoIndiahttps://www.youtube.com/user/GottaDoIndia"
"2ie2pPW3oMU","O Jaana | Ishqbaaz Serial Title Song | Romantic Love Story 2018 | LoveSHEET","2018-11-02T03:56:34.000Z","UCMMfNEPCze48r4G8k7Eg0yA","LoveSHEET","10","18.04.11","o jaana ishqbaaz,ishqbaaz title song,o jaana full song,ishqbaaz title song full video,o jaana full video,o jaana full hd video,o jaana ishqbaaz full song,serial song,serial love song,o jaana full version,o jaana female version,new songs 2018,LoveSHEET,new,cute love story,manojit,ankit,subho puja love story,korean mix,heart touching love story,bewafa song,bewafa hai tu","262078","9291","242","917","https://i.ytimg.com/vi/2ie2pPW3oMU/default.jpg","False","False","O Jaana | Ishqbaaz Serial Title Song | Romantic Love Story 2018 | LoveSHEET#ojaana #ishqbaaz  #lovesheetO jaana full song - Ishqbaaz title song These are the lyrics from O jaana song from Ishqbaaz TV serial:O jaana...Khoya Khoya rehta haiDil Tadap ke kehta haiTu hai mere jeene ki wajah...O jaana...For full lyrics go here:  https://forum32.com/2016/08/o-jaana-i...Music: Sanjeev SrivastavaLyrics: Shaheen IqbalSinger: Bhaven Dhanak--------------------------------------------LoveSHEETYouTube page-https://www.youtube.com/lovesheetfacebook page-https://www.facebook.com/Lovesheet365ourTwitter page-https://twitter.com/LoveSHEET365instagram page-https://www.instagram.com/lovesheet365/For Business EnquiriesContact - +91-7001833869True love storyBest wishes toLoveSHEET PLEASE WATCH THIS VIDEOLIKE * SHARE * COMMENTS & SUBSCRIBE"
"rMXW8bC5EVk","GULLY BOY VS RICH GUY | So Effin Cray","2018-10-30T15:24:25.000Z","UCOquMs0QXyjbw2YMigivRAw","So Effin Cray","24","18.04.11","so effin cray,so effin cray latest,gully boy,gully boy vs rich guy,school boy,girls vs boy in school life,pyaar vs yaar,divine,whatsapp funny,whatsapp videos,college ka pehla pyaar,school love story,sakht launda,when a girl falls in love with a sakht launda,whatsapp status,best friend vs girlfriend,bro code,men will be men,cheater girlfriend,when youre a sakht launda,whatsapp funny videos","1960385","75643","3551","3918","https://i.ytimg.com/vi/rMXW8bC5EVk/default.jpg","False","False","Buy Mach3Turbo.  http://spr.ly/GilletteMach3Written,Directed and Produced By Vatsl SethCo-Produced and Co-Writer - Shaeina SethCast- Vartika Chauhan | Sandy Mokal |Sarsun Malhotra |  Sandeep Gaud | Guneet | Sidhanshu | AakashDoP- Omkar KolekarChief AD- Sandeep GaudFirst AD- Rohit Singh"
"63Fuz5k_c3c","लालू के घर में घमासान: तेज लेंगे ऐश्वर्या से तलाक, 2019 पड़ेगा भारी Tej Files for Divorce from Wife","2018-11-02T15:17:54.000Z","UC1tnj_v8Sn-hWERFvqSjBWQ","inKhabar","25","18.04.11","Tej Pratap Yadav,Tej Pratap Yadav wife,Tej Pratap Yadav marriage,Tej Pratap Yadav divorce,Tej Pratap Yadav has filed for divorce,Tej Pratap Yadav divorce Aishwarya,Aishwarya Rai,Tej Pratap Yadav wife Aishwarya Rai,Lalu Yadav son Tej Pratap Yadav,Daroga Rai,Aishwarya Rai Daroga Rai,Aishwarya Rai family,Aishwarya Rai education","63007","301","53","60","https://i.ytimg.com/vi/63Fuz5k_c3c/default.jpg","False","False","Lalu Yadav's elder son Tej Pratap Yadav has filed for divorce from his wife Aishwarya Rai. He married Aishwarya on May 12 this year.Aishwarya also comes from a political family. Her grandfather Daroga Rai was a former chief minister of Bihar while her father Chandrika Rai is a former minister and a Rashtriya Janata Dal (RJD) leader.#TejPratapYadav #TejPratapYadavWife #TejPratapYadavDivorce For More Information visit us: http://www.inkhabar.com/Connect with us on Social platform at https://www.facebook.com/InkhabarConnect with us on Social platform athttps://twitter.com/InkhabarSubscribe to our YouTube channel: https://www.youtube.com/user/itvnewsindiaTej Pratap YadavTej Pratap Yadav wifeTej Pratap Yadav marriageTej Pratap Yadav divorceTej Pratap Yadav has filed for divorceTej Pratap Yadav divorce AishwaryaAishwarya RaiTej Pratap Yadav wife Aishwarya RaiLalu Yadav son Tej Pratap YadavDaroga Rai Aishwarya Rai Daroga Rai Aishwarya Rai family Aishwarya Rai education"
