video_id,title,publishedAt,channelId,channelTitle,categoryId,trending_date,tags,view_count,likes,dislikes,comment_count,thumbnail_link,comments_disabled,ratings_disabled,description
"sCIsuG6mO3k","Desi Shinchan | If Shinchan was Punjabi | SahibNoor Singh","2018-11-03T14:31:33.000Z","UCyQ_pkccmIIE6pEAWIC7dcw","SahibNoor Singh","24","18.04.11","Desi Shinchan,Shinchan,Sahibnoor singh,hungama,funny videos,doremon,funny shinchan videos,cartoon,shinchan sardar,shinchan punjabi,Viral videos,trending videos,sahibnoor new video,indian viner,gym,girls","122855","15931","879","1979","https://i.ytimg.com/vi/sCIsuG6mO3k/default.jpg","False","False","This video is about SHINCHAN if he must have been a Desi or Punjabi.CAST : SahibNoor Singh, Teena Chhetri , Raman Hora , Tushar Sawhney , Avleen DhanjalCinematographer : Sahib AnandFollow us on instagram :SahibNoor Singh : https://www.instagram.com/sahibnoorsinghTeena Chettri : https://www.instagram.com/teenachhetri/Raman hora : https://instagram.com/the.ramanhoraSCRIPT BY : PAVNEET JAG ( INFINITYY MONKEY )"
"lPOsGd8G0MM","Tech Talks #650 - OnePlus Guinness World Record,#HappyDiwali Emoji, OnePlus 6T Thunder Purple, S10","2018-11-02T17:26:29.000Z","UCOhHO2ICt0ti9KAh-QHvttQ","Technical Guruji","28","18.04.11","OnePlus Guinness World Record,#HappyDiwali Emoji,OnePlus 6T Thunder Purple,S10,Tech Talks #649,PUBG beta,Phone Unlock,Jio Offer 2018,technical guruji,technicalguruji,Tech news,tech talks,latest tech news,technology,india,hindi,latest,Latest,latest updates,trick,online,Daily News,Hindi News,Airtel,Jio Latest News,India,Gaurav Chaudhary,Flipkart,Bitcoin,Facebook,Jio New Plans,iPhone,5G India,News,Guruji","297248","29695","639","4918","https://i.ytimg.com/vi/lPOsGd8G0MM/default.jpg","False","False","TG Deals@ https://tg.deals/   New Channel: https://goo.gl/Jz6p5KNamaskaar Dosto, Tech Talks ke is Episode mein maine aapse kuch interesting Tech News Share ki hai jaise OnePlus 6T Guiness World Record, Samsung Galaxy S10, Apple in India, Huawei Mate 20 Series Benchmarks, Amazon Great Indian Sale, Twitter Diwali Emoji, Facebook Data Breach Update aur bahut kuch. Mujhe umeed hai ki yeh video aapko pasand aayega. Share, Support, Subscribe!!!Subscribe: http://bit.ly/1Wfsvt4Android App: https://technicalguruji.in/appYoutube: http://www.youtube.com/c/TechnicalGuruji Twitter:  http://www.twitter.com/technicalgurujiFacebook: http://www.facebook.com/technicalgurujiFacebook Myself: https://goo.gl/zUfbUUInstagram: http://instagram.com/technicalgurujiGoogle Plus: https://plus.google.com/+TechnicalGurujiWebsite: https://technicalguruji.in/Merchandise: http://shop.technicalguruji.in/About : Technical Guruji is a YouTube Channel, where you will find technological videos in Hindi, New Video is Posted Everyday :)"
"8ZwgoVmILQU","ISN'T IT ROMANTIC - Official Trailer","2018-10-31T19:00:11.000Z","UCjmJDM5pRKbUlVIzDYYWb6g","Warner Bros. Pictures","24","18.04.11","Rebel Wilson,Liam Hemsworth,Adam Devine,Priyanka Chopra,Todd Strauss-Schulson,Erin Cardillo,Dana Fox,Katie Silberman,Todd Garner,Gina Matthews,Grant Scharbo,Marty Ewing,Simon Duggan,Andrew Marcus,Leah Katznelson,New Line,Warner Bros,WB","4518180","41265","1115","1721","https://i.ytimg.com/vi/8ZwgoVmILQU/default.jpg","False","False","Trapped in a rom-com like…😱 Watch the new trailer for #IsntItRomantic, only in theaters Valentine’s Day! http://www.facebook.com/IsntItRomantic/ http://twitter.com/IsntItRomantichttp://www.instagram.com/isntitromantic/-- From New Line Cinema comes the romantic comedy “Isn’t It Romantic,” starring Rebel Wilson (“How to Be Single,” the “Pitch Perfect” films), Liam Hemsworth (the “Hunger Games” films), Adam Devine (“The Intern,” the “Pitch Perfect” films) and Priyanka Chopra (“Quantico,” “Baywatch”), under the direction of Todd Strauss-Schulson (“A Very Harold & Kumar 3D Christmas,” “The Final Girls”). New York City architect Natalie works hard to get noticed at her job but is more likely to be asked to deliver coffee and bagels than to design the city’s next skyscraper.  And if things weren’t bad enough, Natalie, a lifelong cynic when it comes to love, has an encounter with a mugger that renders her unconscious, waking to discover that her life has suddenly become her worst nightmare—a romantic comedy—and she is the leading lady. Wilson stars as Natalie, alongside Liam Hemsworth as Blake, a handsome client; Adam Devine as her earnest best friend, Josh; and Priyanka Chopra as yoga ambassador Isabella.Strauss-Schulson directs from a screenplay by Erin Cardillo and Dana Fox & Katie Silberman.  Todd Garner (“Paul Blart: Mall Cop,” “Tag”), Gina Matthews and Grant Scharbo (“13 Going on 30,” “What Women Want”) are producing, with Marty Ewing (“IT,” “The Accountant”) and Rebel Wilson executive producing. Collaborating with Strauss-Schulson behind the scenes are director of photography Simon Duggan (“The Great Gatsby,” “Hacksaw Ridge”), production designer Sharon Seymour (“Argo,” “The Town”), editor Andrew Marcus (“Begin Again,” “Sing Street”), and costume designer Leah Katznelson (“How to Be Single,” “Sleeping with Other People”). New Line Cinema presents, in association with Bron Creative, a Broken Road/Little Engine Production, “Isn’t It Romantic.”  Slated for release on February 14, 2019, and will be distributed worldwide by Warner Bros. Pictures, a Warner Bros. Entertainment Company. The film has been rated PG-13."
"0gkqWpHGTbE","सीट बंटवारे के बाद नीतीश कुमार का पहला EXCLUSIVE इंटरव्यू | News Tak","2018-11-03T14:43:28.000Z","UCAUNFgpgVisKPL3yq_-Nj-Q","News Tak","25","18.04.11","hindi news,news video,latest news,“newstak,news”,channel”,“news”,“,newstak”,news tak,news tak channel,newstak channel,news videos,news videos in hindi,news tak newstak,news tak india,news tak live,newstak live,newstak india,newstak exclusive,news tak exclusive,news tak videos,newstak videos,exclusive news tak videos,exclusive newstak videos,news tak today,news tak official,newstak official,newstak aajtak,news tak aaj tak","253517","4591","1003","1868","https://i.ytimg.com/vi/0gkqWpHGTbE/default.jpg","False","False","इंडिया टुडे कॉन्क्लेव में बिहार के सीएम नीतीश कुमार आए और बिहार में चलती सरकार के काम काज के बारे में जब एंकर अंजना ओम कश्यप ने पूछा तो हर सवाल का जबाव दिया सीएम ने, सुनिए महागठबंधन पर क्या कहा नीतीश कुमार ने...Bihar's CM Nitish kumar spoke on  'Mahagathbandhan' in india today state conclave, Anchor anjana om kashyap asks straight questions to CM nitish. Listen to what CM nitish has to say on anchor anjana om kashyap's questions.About News Tak (न्यूज़ तक):न्यूज़ तक (news tak) आपको देता है ख़बरों का बिल्कुल नया अंदाज । 40 सेकंड के छोटे गरमा-गरम वीडियो तो हैं ही साथ में न्यूज़ तक (news tak) के यू ट्यूब प्लेटफॉर्म पर आपको मिलेंगे दिलचस्प और EXCLUSIVE इंटरव्यू, वो भी अनकट..यहां आपको मिलेगा न्यूज़तक (news tak) स्पेशल, न्यूज़ तक (news tak) LIVE और भी बहुत कुछ। राजनीति, बॉलीवुड, देश-विदेश हर तरह की ख़बरों से जुड़े मनोरंजक वीडियो के लिए देखिए सिर्फ न्यूज़ तक (news tak)। क्या है वायरल होने वाले वीडियो की सच्चाई? ख़बर में ऐसा क्या था खास जो आप नहीं देख पाए? कोई भी ख़बर वायरल होने से पहले आप तक पहुंचाएगा न्यूज़ तक (news tak) । हर रोज दिलचस्प और गरमा-गरम वीडियो के लिए सब्सक्राइब कीजिए न्यूज़ तक (news tak)। ये है न्यूज़तक (news tak) का Official Channel.News Tak is the most revolutionary and credible news channel on YouTube. News Tak brings news to you in an innovative VOD style that is set to capture and satiate your thirst for NEWS. This is the most credible source of Live videos that bring to you PC done by all political parties. From exclusive interviews to politics, bolly & Viral videos, anything and everything that is happening around the world is on News Tak. We ensure that the truth behind viral videos reaches you.We save you from rumours. This is the most reliable source of news that you can rely on. Subscribe to the official channel of News Tak here.You can follow News Tak on:News Tak Youtube: https://www.youtube.com/newstakNews Tak Facebook: https://www.facebook.com/newstakofficialNews Tak Twitter: https://twitter.com/newstakofficialNews Tak Instagram: https://www.instagram.com/newstakofficial/"
"0MCXhCRcYrE","The Real Kadaikutty Singam Family - Mirchi Shiva's Family | Full Comedy","2018-11-02T05:53:26.000Z","UCjF5ecCYXFDvR0UY9GcfnoA","Cinema Vikatan","24","18.04.11","mirchi shiva,mirchi shiva songs,mirchi shiva dance,mirchi shiva movies,mirchi shiva comedy,mirchi shiva interview,mirchi shiva speech,mirchi shiva radio,mirchi shiva angry,mirchi shiva anchor","136423","4744","64","351","https://i.ytimg.com/vi/0MCXhCRcYrE/default.jpg","False","False","Mirchi Shiva's Exclusive Family InterviewCatch the video to know where Mirchi Shiva's Comic Timing sense comes from & his huge family in this Diwali Special.CREDITSReporter- Ma Pandiarajan , Host - Avudaippan  ,Camera - Muthukumar & Ramesh Kannan ,Edit - ArunSubscribe Cinema Vikatan : https://goo.gl/zmuXi6 Subscribe: https://goo.gl/zmuXi6  Audio launch: https://goo.gl/K0vCt2  Interviews and features: https://goo.gl/Kn0XEZ  Satellite chips: https://goo.gl/nePcRI   Popcorn Reel: https://goo.gl/Zem8tm  Latest cinema news: https://goo.gl/f7ca67  Latest trending videos: https://goo.gl/io1n8Ohttps://twitter.com/#!/Vikatanhttps://www.facebook.com/Vikatanwebhttps://soundcloud.com/vikatanhttp://www.vikatan.com"
"hs1HoLs4SD0","Introducing the new MacBook Air — Apple","2018-10-30T14:21:50.000Z","UCE_M8A5yxnLfW0KghEeajjw","Apple","28","18.04.11","Apple,MacBook Air,Retina display,Touch ID,dual core processors,butterfly keyboard,thin,light,T2 Security Chip,recycled aluminum,sustainable,green,eco-friendly,environment","4185235","99745","13577","0","https://i.ytimg.com/vi/hs1HoLs4SD0/default.jpg","True","False","The new MacBook Air brings many of our most advanced technologies to this iconic design for the first time — including a brilliant Retina display, Touch ID, a powerful eighth-generation Intel Core i5 processor, the latest-generation butterfly keyboard, and the Apple T2 Security Chip. And with an enclosure made with 100% recycled aluminum, it’s the greenest Mac ever.Learn more at https://apple.co/2OhVx9f"
"9TgYmP67lXo","ഇപ്പളാ കിട്ട്യേ ... ഇപ്പളാ അയച്ചേ..! | Shane Nigam , Nimisha Sajayan - Eeda Romantic Scene","2018-11-01T07:23:50.000Z","UCeM3IXubMXTH3LdsMQ3VAhw","Saina Movies","24","18.04.11","eeda,eeda malayalam movie,eeda full movie,eeda climax,eeda song,eeda actor,eeda best scenes,eega background song,eeda dvd release,malayalam movie eeda download,eeda full,eeda full movie 2018,eeda film songs,eeda full movie climax,eeda online watch,malayalam comedy movies 2018,latest action movies,mallu movies 2018,malayalam evergreen movies 2018,malayalam latest release movie 2018,new malayalam movies 2018","282787","839","138","44","https://i.ytimg.com/vi/9TgYmP67lXo/default.jpg","False","False","♦Subscribe Us: https://goo.gl/6mfvL8♦Like Us: https://goo.gl/SYUax3♦Follow Us: https://bit.ly/2z0UhleEeda is a 2018 Indian Malayalam-language romance film written, edited and directed by B. Ajithkumar.The film is a modern take on William Shakespeare's Romeo and Juliet, set in the backdrops of political violence in Kannur, north Malabar. Shane Nigam and Nimisha Sajayan plays the lead roles. Eeda was produced by Sharmila Rajaa through Delta Studio, in collaboration with Collective Phase One[5]. The executive producers were TRS Muthukumaar, K.J. Ayyappan, and Sukumar Thekkepatt."
"F5GE0Oy6yAA","अगर एक बार बना ली तो बार बार बनाने का मन करेगा ऐसी है ये Tasty मिठाई  Sweet Recipes - Diwali Sweet","2018-11-01T07:32:22.000Z","UClfidxoNRvDO361TM5rw64Q","Cook With Parul","26","18.04.11","tasty mithai,easy sweet recipes,indian recipes,indian sweet,sweet recipes indian,sweet recipes video,sweet recipes in hindi,sweet recipes for kids,sweet recipes with milk,indian sweet dish reciipe,sweet recipe using milk,barfi dessert recipe,milk sweet recipe in hindi,milk sweet easy recipe,no cooking sweets recipe,instant peda recipe,instant sweet,instant sweet recipe,quick sweet recipe,sweet recipes","311234","5768","392","795","https://i.ytimg.com/vi/F5GE0Oy6yAA/default.jpg","False","False","Sweet Recipes . Aaj mai aapko batane ja rahi hoon easy Burfi recipes. Tasty Mithai is a Indian sweet Sweet Recipes Pahli baar dekhiye 3 minute mai Easy Sweet Recipes sweet recipes aisi swadhist sweet recipes Tasty Pencil Mithai jo bina Ghee bina mawa ke bana sakte hai.Quick Sweet Recipes Jab samay ho kam aur mitha khaane ka man jhatpat banaye ye mithai. Sweet Recipes. milk sweet recipes, sweet milk cake recipe, easy milk sweet recipes at home, maida milk sweet recipe, sweet recipe from milk, sweet recipe using milk, sweet recipe of milk, milk kova sweet recipe, milk sweet easy recipe, milk sweet recipe in hindi, milk sweet recipe in tamil, milk sweet recipe tamil, barfi dessert recipe, burfi recipe with milk powder, barfi recipe khoya, barfi recipe hindi, Ingredients: Poha/chidwa/flatten rice - 1 cupRava - 1/2 cupGhee - 1 tbspBoiled Milk - 1 cupSugar - 6 tbspDesiccated coconut - 2 tbspRose Essence - 1/2 tspRed Food Colour - 2-3 dropshank you so much for your sweet comment and watching VideoDiwali Sweets: https://goo.gl/s1CsFT मिठाई स्वीट्स रसगुल्ला जलेबी लडडू  Indian Sweets-Sweets- #cookwithparul  http://cookwithparul.comकिचन के  समान जो मै यूज़ करती हूँ उसका लिंक ये है.आप इस लिंक से खरीद सकते है Wow Confetti™ Confeito Rainbow Balls, 75g  https://amzn.to/2JbdJjmDryfruit Mart Silver Balls Sprinkle, 100g  https://amzn.to/2JaELYihttps://amzn.to/2uutFa3  Philips Food Processor HL1660 700Whttps://amzn.to/2L7wTan Morphy Richards Icon Superb 1000-Watt Food Processorhttps://amzn.to/2m6chUW Circulon Origins Hard Anodized Non-stick Open Frypan, 2.08 Litershttps://amzn.to/2ulHMOz Circulon Momentum (Stainless Steel+Non-Stick) open Frypanhttps://amzn.to/2zuNkfG Circulon Hard Anodized Non-Stick Frypan and Tawa 2 Piecehttps://amzn.to/2L3mUmn Philips Daily Collection HR7629/90 650-Watthttps://amzn.to/2FYZawj Pigeon Wondercast DOSA Flat Tawa https://amzn.to/2rqt3Ay  eKitchen Fully Seasoned Cast Iron https://amzn.to/2jIvLhp  Iron Thava 14 IN -NatureLoC Iron Tawa Dosa kallu Big Dosa Tawa https://amzn.to/2IhxAvZ Philips Daily Collection HR1459 300-Watt Hand Mixerhttps://amzn.to/2uI2R9E Prestige PHB 6.0 200 Watt Hand Blender with Blending Jar, https://amzn.to/2GpI4wT  Morphy Richards HBCP 400-Watt Hand Blendehttps://amzn.to/2DQBauy  Prestige Omega Deluxe Granite 3 Pcs And 1 Lid Sethttps://amzn.to/2IVehK5  Knestar Videocon 25-Litre Convection Microwave Ovenhttps://amzn.to/2I6KdtA  IFB 23 L Convection Microwave Oven (23BC4, Black+Floral Design)https://amzn.to/2GuOVUV IFB 25 L Convection Microwave Oven (25SC3, Metallic Silver) https://amzn.to/2G8R19H  Omega Deluxe Metallica Luminous red BYKhttps://amzn.to/2DUvm3e  Philips Daily Collection HR1459 300-Watt Hand Mixer https://amzn.to/2pAUGXt  Prestige Deluxe Alpha Outer Lid Stainless Steel Pressure Cooker, 3 Litreshttps://amzn.to/2G9V0mw  Prestige Deluxe Alpha Stainless Steel Junior Handi, 4.4 Litres, Silverhttps://amzn.to/2I2XJi1  Prestige Clip On Stainless Steel Pressure Cooker with Glass Lid, 3 Litres, Silverhttps://amzn.to/2pATALv  Prestige Marvel 4 Burner Glass Gas Stove GTM 04 Mhttps://amzn.to/2GoByWa Gilma Nero 4 Burner Gas Stovehttps://amzn.to/2G7RgBZ  Rustik Craft Cast Iron Dosa Tawahttps://amzn.to/2G5IiVF Philips Daily Collection HR1363 600-Watt Hand Blenderhttps://amzn.to/2G7bcVw  edworld Iron DosaTawa FRY PAN Original Loha Ironhttps://amzn.to/2pEHgcU  Measurement Measuring Cups And Spoons Set Of 10 Pieceshttps://amzn.to/2pDsGBL Measurement Measuring Cups 5 Pieces & Spoons 5 Pieces Set Of Each Big & Smallhttps://amzn.to/2qPMwKB  Kitchenif Ice Cream, Sorbet, Slush & Frozen Yoghurt Maker Capacity 1.5 Liters (White)https://amzn.to/2HiP7DY  Kitchenif Digital Ice Cream, Sorbet, Slush & Frozen Yoghurt Maker Capacity 1.5 Liters (White)https://amzn.to/2F5dtPw  Ossoro French Vanilla Flavour, 30 mlhttps://amzn.to/2vy8t6r Konvex Ice Cream Scoop , Smooth & Sturdy#cookwithparul   #parulslifestyle  #cookstepbystep   #eastsomethngnew  #eastsomethingtasty CONNECT WITH ME:  Subscribe- LIKE- Comment-WatchYoutube: https://goo.gl/n9nvav   Subscribe the YouTube Channel- Its Free Instagram: https://www.instagram.com/cookwithparul/Sweet Recipes. milk sweet recipes, sweet milk cake recipe, easy milk sweet recipes at home, maida milk sweet recipe, sweet recipe from milk, sweet recipe using milk, sweet recipe of milk, milk kova sweet recipe, milk sweet easy recipe, milk sweet recipe in hindi, milk sweet recipe in tamil, milk sweet recipe tamil, barfi dessert recipe, burfi recipe with milk powder, barfi recipe khoya, barfi recipe hindi,"
"LdvJGQEG0cY","Top 5 Under Rs. 500 | Affordable Beauty Products In India | Diwalog Day 16 | Shreya Jain","2018-11-03T17:36:56.000Z","UCcjwEAaBGu1yc89QE3DC1Tw","Shreya Jain","26","18.04.11","sjlovesjewelry,shreya jain,indian beauty guru,indian makeup guru,indian vlogger,Top 5 Under Rs. 500 | Affordable Beauty Products In India | Diwalog Day 16 | Shreya Jain","28729","2059","60","269","https://i.ytimg.com/vi/LdvJGQEG0cY/default.jpg","False","False","Subscribe Now for more such videos :)▶http://goo.gl/1avtfTNew video Monday-Wednesday-Friday!Hey everyone! :)Today I am going to share top 5 products under Rs. 500 in my Diwalog 2018 series!Products Mentioned:The Face Shop Fresh Lotus gel (Rs. 490)Body Shop Born Lippie Lip Balm (Rs. 250)PAC Long Lasting Kohl Pencils (Rs. 395)Purpelle Liquid Lipsticks (Rs. 399)Wet n Wild Natural Finish Setting Spray (Rs. 499)What Am I Wearing:Lipstick: Huda Beauty Spice GirlThis is NOT a Sponsored Video.You can connect with me on: My blog: http://beautyinthethirdworld.blogspot.in/Twitter: https://twitter.com/SjlovesjewelryFacebook page: https://www.facebook.com/pages/Sjlovesjewelry/185128851560958Instagram: Shreyajain26Snapchat: Shreyajain26Email id: sjlovesjewelryyoutube@yahoo.inSend me letters or things!Shreya Jain5633 Qutub Road, New DelhiDelhi110055IndiaPlease follow me :)Till next time,take careLoveXOXOShreya"
"LAVZ5RTPvGM","Balraj: Ishqbazian (Full Video Song) G Guri | Singh Jeet | Latest Punjabi Songs 2018","2018-11-01T04:36:02.000Z","UCcvNYxWXR_5TjVK7cSCdW-g","T-Series Apna Punjab","10","18.04.11","latest punjabi songs,new punjabi songs,new punjabi videos,latest punjabi videos,ishq bazian balraj,ishq baziyan,ishqbazian,balraj,balraj new song,latest punjabi songs 2018,punjabi songs,g guri,singh jeet,balraj new songs,new songs 2018,latest this week,sad romantic punjabi songs,romantic punjabi songs,romantic songs 2018,balraj sad song,new video songs 2018","1730915","45084","1542","2749","https://i.ytimg.com/vi/LAVZ5RTPvGM/default.jpg","False","False","Presenting latest punjabi song Ishqbazian sung by Balraj. The music of new punjabi song is given by G Guri while lyrics are penned by Singh Jeet. The video of new song is directed by Raweye Film. Enjoy and stay connected with us !!♪ Available on ♪iTunes : http://bit.ly/Ishqbazian-Balraj-iTunesHungama : http://bit.ly/Ishqbazian-Balraj-HungamaSaavn : http://bit.ly/Ishqbazian-Balraj-SaavnGaana : http://bit.ly/Ishqbazian-Balraj-GaanaApple Music : http://bit.ly/Ishqbazian-Balraj-Apple-MusicAmazon Prime Music : http://bit.ly/Ishqbazian-Balraj-Amazon-Prime-MusicGoogle Play : http://bit.ly/Ishqbazian-Balraj-Google-PlayWynk : http://bit.ly/Ishqbazian-Balraj-WynkSong: IshqbazianSinger: BalrajMusic: G GuriLyrics: Singh JeetVideo: Raweye FilmProject: Naresh KakaEditor: Pawan Kumar (Ediframez)Mix & Master: Sameer CharegaonkarOnline Promotion: Being DigitalMusic Label: T-Series---------------------------------------------------------------Connect with T-SERIES APNAPUNJAB----------------------------------------------------------------For Latest Punjabi video's and songs stay connected with us!! SUBSCRIBE - http://www.youtube.com/tseriesapnapunjabLIKE US - http://www.facebook.com/tseriesapnapunjabInstagram - https://www.instagram.com/tseries.official------------------------------------------------------------Set Ishqbazian song as your caller tune sms ISQBZ1 To 54646Set Ishqbazian - Chhitiyan Saver song as your caller tune sms ISQBZ2 To 54646Set Ishqbazian - Taare Ginane song as your caller tune sms ISQBZ3 To 54646-----------------------------------------------------------Operator Codes:1. IshqbazianVodafone Subscribers Dial 53710707489Airtel Subscribers Dial 5432116622675Idea Subscribers Dial 5678910707489Tata DoCoMo Subscribers dial 54321110707489BSNL (South / East) Subscribers sms BT 10707489 To 56700Virgin Subscribers sms TT 10707489 To 58475MTNL Subscribers sms PT 10707489 To 567892. Ishqbazian - Chhitiyan SaverVodafone Subscribers Dial 53710707490Airtel Subscribers Dial 5432116618258Idea Subscribers Dial 5678910707490Tata DoCoMo Subscribers dial 54321110707490BSNL (South / East) Subscribers sms BT 10707490 To 56700Virgin Subscribers sms TT 10707490 To 58475MTNL Subscribers sms PT 10707490 To 567893. Ishqbazian - Taare GinaneVodafone Subscribers Dial 53710707517Airtel Subscribers Dial 5432116618199Idea Subscribers Dial 5678910707517Tata DoCoMo Subscribers dial 54321110707517BSNL (South / East) Subscribers sms BT 10707517 To 56700Virgin Subscribers sms TT 10707517 To 58475MTNL Subscribers sms PT 10707517 To 56789"
"t5QWLbi8KFg","A Father And Son Were Selling Diyas On Diwali 😢","2018-10-30T11:13:25.000Z","UC5GMWJmrR0LDUQ8MojJyXEQ","ActorVarunPruthi","24","18.04.11","varun pruthi,actor varun pruthi,she dumped him,actor varun,social experiment","1888051","131598","2586","11694","https://i.ytimg.com/vi/t5QWLbi8KFg/default.jpg","False","False","Haath jod ke request hai aap sabse ki is video ko har jagah share kar dena taaki sirf paise wale hi nahi sab Diwali bana sake! 😢, A Father and Son were selling Diyas On Diwali. Instagram pe bhi apna pyaar aur support dena https://instagram.com/varun_pruthiFacebook: https://Facebook.com/ActorVarunTwitter: https://Twitter.com/ActorVarun#SubscribeKarkeSupportDena"
"ZjE-tdcIeHc","Roja serial team fun Dance Priyanka Nalkari Akila Shamili Venkat","2018-11-02T02:50:29.000Z","UChZqgyvE7-yLoK2nTLqf7uA","Tamil Dubsmash","24","18.04.11","[none]","77121","774","45","44","https://i.ytimg.com/vi/ZjE-tdcIeHc/default.jpg","False","False","Roja serial team fun Dance Priyanka Nalkari Akila Shamili Venkat. Sun TV Roja serial actor and actress fun from shooting spot#tamildubsmash #priyankanalkari #rojaபிடித்திருந்தால் லைக், கமெண்ட், ஷேர் பண்ணுங்க. Please don't forget to subscribe. பார்த்ததற்கு மிக்க நன்றி. Press the 🔔 for notifications"
"pWaXkursfo4","For Law Exam | How to Study Law and How to Write Answers In Exams","2018-11-02T12:28:26.000Z","UCt22CG7b9crZ0HDk1eTiJjA","Neeraj Arora","27","18.04.11","neeraj arora latest,neeraj arora classes,neeraj arora motivational,ca neeraj arora","48011","2509","46","293","https://i.ytimg.com/vi/pWaXkursfo4/default.jpg","False","False","#cainter #law #novmber2018This video is all about CA IPCC and CA Inter Law Exam November 2018. This is applicable for old as well as the new course. This video will help you in starting your law preparation and writing your law exam. All the bestEnglish version of this video is available at our English Channel - http://bit.ly/2JwKY0XTo Buy Pen Drive Lectures, Video Classes, Books, Test Series etc.Video Classes - http://bit.ly/nacn18Here is the link of our second channel Seekhtey Rahey -https://goo.gl/3EmtHKFor Any Information Video classes & Face To Face Batches Call 9810113555, 9266816886 support@neerajaroraclasses.com(We Prefer emails rather than calls)Call timings Monday to Friday - Morning 10 to Evening 5JOIN OUR TELEGRAM GROUP - https://t.me/neerajaroraclassesFIND ME & Mishti on InstagramINSTAGRAM- https://www.instagram.com/neerajaroraofficialSUBSCRIBE- Click on the link to Subscribe my YouTube Channel- https://goo.gl/1z9BSd Follow me on TWITTER- https://twitter.com/canacofficial"
