video_id,title,publishedAt,channelId,channelTitle,categoryId,trending_date,tags,view_count,likes,dislikes,comment_count,thumbnail_link,comments_disabled,ratings_disabled,description
"o_pZh8lZ9jY","Suvarna Girls with Yash P4- ಯಶ್ ಮೊದಲ ಕ್ರಷ್ ಯಾರು ಗೊತ್ತಾ ..?","2018-11-11T09:27:26.000Z","UCjElJyiXmQXnWmceQ1JyKrA","Suvarna News | ಸುವರ್ಣ ನ್ಯೂಸ್","25","18.13.11","Kannada News,Kannada News Channel,Kannada Live TV,Karnataka News,Sports News,Karnataka Local News,Karnataka Business News,Karnataka Politics,Sandalwood News,Kannada Celebrity News,Kannada Live Streaming,Suvarna Girls,Program KGF,KGF Secret P4,Roking Star Yash","374187","4317","344","260","https://i.ytimg.com/vi/o_pZh8lZ9jY/default.jpg","False","False","Suvarna Girls with Yash P4- ಯಶ್ ಮೊದಲ ಕ್ರಷ್ ಯಾರು ಗೊತ್ತಾ ..?Visit Us at: ►Facebook: https://www.facebook.com/SuvarnaNews ►Twitter: https://twitter.com/SuvarnaNewstv ►Website: http://www.suvarnanews.comCheck out the latest news from Karnataka, India and across the world. Latest Trending news on Sandalwood, Politics, Business, Cricket, Technology, Automobile, Lifestyle & Health and Travel. More on suvarnanews.com► SUBSCRIBE OUR CHANNEL : https://goo.gl/8eNAWQ"
"VnVVKYT1jK0","Kunwari Bohu | 12 Nov 18 | Promo | Odia Serial - TarangTV","2018-11-12T05:33:26.000Z","UCnm5DH0oJndtA-6J10_jIEw","Tarang TV","24","18.13.11","tarang,tarang tv,tarang tv online,tarang tv serial,odia tarang tv serial,tarang tv show,taranga channel,tarang tv channel,odia tarang channel,odia serial,odia serial video,odia channel,odia tv channel,odia tv show,odia tv,odia serial Kunwari Bohu,tarang tv Kunaari Bohu,Kunwari Bohu tarang,tarang tv Kunwari Bohu","81245","366","12","13","https://i.ytimg.com/vi/VnVVKYT1jK0/default.jpg","False","False","Kunwari Bohu: Monday-Saturday at 7.30 p.m. only on Tarang TV.SUBSCRIBE to TarangTV channel for more Odia Serial and movie videoshttps://goo.gl/QgkQLbLike us on Facebookhttps://www.facebook.com/tarangtv Circle on G+  https://goo.gl/ArUUGwFollow us on Twitterhttps://twitter.com/tarangtvodishaFollow us on Instagramhttps://www.instagram.com/tarangtv/Visit our website for further details: www.tarangtv.in #KunwariBohu #TarangPromo #TarangSerial"
"uCjy6-AMZ-g","Australia v South Africa, third ODI","2018-11-11T12:23:19.000Z","UCkBY0aHJP9BwjZLDYxAQrKg","cricket.com.au","17","18.13.11","cricket,cricket australia,cricket highlights,Australia,South Africa,third ODI,Hobart,Shaun Marsh,Faf du Plessis,David Miller","1199731","11350","555","831","https://i.ytimg.com/vi/uCjy6-AMZ-g/default.jpg","False","False","A mammoth 252-run stand - the most ever against Australia - between century-makers David Miller and Faf du Plessis ensured the tourists would leave Australian shores as series winners"
"5vuohqHx3uU","जब  मैंने पहली बार PAD छोड़कर इस्तेमाल किया Menstrual Cup का जो हुआ उसे जानकर रह जायेंगे हैरान","2018-11-08T08:28:23.000Z","UCPMqs8vxEwbie26nFA3ykAw","Health Time","26","18.13.11","[none]","1258876","12563","2499","1587","https://i.ytimg.com/vi/5vuohqHx3uU/default.jpg","False","False","आप इसे खरीद कर जरूर देखिये इसे इस्तेमाल करना बहुत ही आसान है। इसे खरीदने के लिए.... everteen menstrual cup is available at www. everteen.co.in and all popular market places as below:Amazon- https://amzn.to/2B2jZI9Flipkart:https://www.flipkart.com/everteen-large-reusable-menstrual-cup/p/itmf2ndsr2spyzjqSnapdeal-https://www.snapdeal.com/product/everteen-1-reusable-menstrual-cup/678102191849ＬＩＫＥ | ＣＯＭＭＥＮＴ | ＳＨＡＲＥ | ＳＵＢＳＣＲＩＢＥ & Must Click on notification bell. http://www.youtube.com/healthtime?sub_confirmation=1Please Like our facebook Page. https://www.facebook.com/healthtime1"
"Qw6DWz02MCA","आजकाल ची जीन्स पैंट घातलेली आई l इंदुरीकर महाराज यांचे कॉमेडी किर्तन l Indurikar Maharaj Kirtan","2018-11-10T10:30:00.000Z","UCkcExu2Mbm1pIB6tTSJBLzg","Aaichya Gavat","24","18.13.11","Aaichya Gavat,aaychya gawat,आईच्या गावात,आयच्या गावात,indurikar maharaj comedy kirtan,maharaj kirtan,indorikar,nivarutti,new kirtan,man mandira,gajar bhakticha,इंदुरीकर महाराज कीर्तन नवीन 2019,निवृत्ती महाराज देशमुख इंदोरीकर नवीन कीर्तन,निवृत्ती महाराज,मन मंदिरा,गजर भक्तीचा,इंदुरीकर महाराज कॉमेडी किर्तन,जीन्स पैंट घातलेली आई,aai,आई माझी मायेचा सागर,आई मला खेळायला जायच,जाऊ दे ना व,comedy kirtan,marathi kirtan","542526","2292","728","350","https://i.ytimg.com/vi/Qw6DWz02MCA/default.jpg","False","False","आजकाल ची जीन्स पैंट घातलेली आई, ह.भ.प.इंदूरीकर महाराज हे महाराष्ट्रातील लोकप्रिय कीर्तनकार आहेत, इंदुरीकर महाराज हे त्यांच्या कीर्तनाच्या मजेदार शैली साठी ओळखले जातात, त्यांचे कीर्तन हे सर्वच वयोगटातील व्यक्तींना आवडते हे विशेष,हे कीर्तन संपूर्ण ऐका, पोट धरून हसाल, निर्वूत्ती महाराज इंदुरीकर यांचे कीर्तन हे कडू पण सत्य असे आहे, कीर्तनाच्या माध्यमातून प्रबोधनाचे कार्य महाराज करत असतात, त्यांचे विचार आवडल्यास व्हिडीओ Like व Share करा, तसेच या कीर्तनाविषयी आपल्या प्रतिक्रिया Comment मध्ये जरूर कळ्वा. धन्यवाद !!Ⓒ Aaichya Gavat 2018Please Subscribe : आईच्या गावात Write us : aaichyagavatteam@gmail.comधन्यवाद !!Copyright Disclaimer Under Section 107 of the Copyright Act 1976, Audio added in video comes under fair use policy of you tube."
"SaJKnfA3qJw","🌷💛Status💜🌷💚 Video For 🌷💚🌷Whatsapp 🌺💖🌺Meri Jaan Le Lete Ho💕(by Aaliya)","2018-11-11T03:58:59.000Z","UC_qXlnj3LcTg_qScXJcEL2w","MD Saddaf","24","18.13.11","Status,Whatsapp status,New whatsapp status,Md saddaf,Top whatsapp status channel,No 1 whatsapp status channel","509476","2568","596","360","https://i.ytimg.com/vi/SaJKnfA3qJw/default.jpg","False","False","Download vidStatushttps://goo.gl/dCvC8iDownload #Md_Saddaf App and enjoy all types status videos in your gallery Download link:- https://play.google.com/store/apps/details?id=com.appiclogics.ytvideos Follow me on Social mediaFacebook:- https://www.facebook.com/mdsaddaf786/Instagram:- https://www.instagram.com/md_saddaf/TikTok (musical.ly):-http://vm.tiktok.com/upJ8JfMy/ You can also contact us at mdsaddafyt@gmail.com❤️All Types Videos Here❤️🌹Love💜Romantic🌷,,🌹,,Heart💔 touching,,,❤️💛 Sad,,Whatsapp,,💖💚 Status,💖,Videos,,..💕💕#Status #Whatsapp_status ___________________________________________________________________________________________________ IMPORTANT NOTICE:- All Rights Reserve to me."
"WgEQJy_Cw9M","டிபன், ஸ்னாக்ஸ் எப்படி கொடுத்தாலும் காலி ஆகிரும் 😋 | instant snacks | Easy  breakfast | Rava adai","2018-11-10T11:29:36.000Z","UC9oPCWZ6Wh5WG68YcEmCXNA","Papa's Kitchen","2","18.13.11","YouTube,Recipe,Tamil,instant snacks,healthy breakfast,Papa's Kitchen,Samayal,Lunchbox,Popular food,Street food,Food,Adai Dosai Recipe in Tamil,How to make adai,How to make Adai Dosa,How To Make Adai Dosa,அடை,how to makedosa in tamil,How to Cook Tasty Adai,easy,2 min recipe,suji,rava,ரவா,ரவை,செய்வது எப்படி","276824","2538","226","231","https://i.ytimg.com/vi/WgEQJy_Cw9M/default.jpg","False","False","#Breakfast  #YouTubeRecipe #Snacks  #ஸ்னாக்ஸ்  #டிபன்  #PapaskitchenEasy Breakfast, healthy breakfast, instant snacks, Breakfast Recipe | papa's Kitchen,டிபன், ஸ்னாக்ஸ் எப்படி கொடுத்தாலும் காலி ஆகிரும் 😋 | instant snacks | Easy  breakfast | Rava adai"
"sWt0SdnqtqU","Whatsapp status tamil - Super Love Duet...","2018-11-11T11:15:45.000Z","UCUPsaRAXAcSoyHiCQJ_ZgFQ","Anbu Selvan AR","22","18.13.11","whatsapp status tamil,whatsapp status,tamil whatsapp status,tamil whatsapp status love,whatsapp status Comedy,tamil whatsapp status latest,whatsapp status new song,whatsapp status video tamil songs,whatsapp status new,Anbu Selvan AR","90568","1406","68","82","https://i.ytimg.com/vi/sWt0SdnqtqU/default.jpg","False","False",""
"1jdC3Fghm2o","2019 ಹೊಸ ವರ್ಷದಲ್ಲಿ ಕಾಲಿಟ್ಟ ತಕ್ಷಣ ಈ 3 ರಾಶಿಯವರ ಕಷ್ಟಗಳೆಲ್ಲ ದೂರ ಆಗಿ ಅದೃಷ್ಟವಂತರು ಆಗುತ್ತಾರೆ","2018-11-12T06:41:17.000Z","UCuHTvJgH8FfEmXECaehN0-A","Kannada Bhakthi Channel","22","18.13.11","2019 horoscope,horoscope 2019,Luckiest Zodiac Signs of 2019,astrology 2019,horoscope,horoscope matching,zodiac signs,today's horoscope,horoscope today,daily horoscope,astrology,rashi bhavishya,rashi bhavishya in kannada,astrology in kannada,kundali matching,rashifal,kundali app,star signs,numerology,astrology app,today bhavishya,dina bhavishya,bhavishya in kannada,rashi bhavishya 2019 kannada,rashi bhavishya 2019,kannada videos,karnataka,kannada news","45564","0","0","52","https://i.ytimg.com/vi/1jdC3Fghm2o/default.jpg","False","True","2019 is going to be Most Lucky Year for these 3 Zodiac Signs. Find out and Explore the 3 Luckiest Zodiac Signs of 2019 in Kannada Language from Karnataka's Most Accurate Horoscope Analyst on Youtube. 2019 ಹೊಸ ವರ್ಷದಲ್ಲಿ ಕಾಲಿಟ್ಟ ತಕ್ಷಣ ಈ 3 ರಾಶಿಯವರ ಕಷ್ಟಗಳೆಲ್ಲ ದೂರ ಆಗಿ ಅದೃಷ್ಟವಂತರು ಆಗುತ್ತಾರೆ."
"BUWD_BF9dyg","Tapu's Warning | Tapu Sena Special | Taarak Mehta Ka Ooltah Chashmah","2018-11-10T12:07:33.000Z","UC6-F5tO8uklgE9Zy8IvbdFw","SAB TV","24","18.13.11","sab tv channel,sab tv serials,all episodes,tapu sena videos,comedy channel india,comedy channel hindi,comedy videos,tapu sena special,tapu special clips,taarak mehta clips,tapu sena fun,Taarak Mehta Ka Oolta Chashmah,tapu sena comedy,sab tv show,tapu and friends,special clips of Tapu,taarak mehta best videos,taarak mehta tapu sena,tmkoc tapu sena special,tapu sena,kutch tarak mehta,tapu loves kheer,Tapu's Warning","606599","2234","439","239","https://i.ytimg.com/vi/BUWD_BF9dyg/default.jpg","False","False","Click here to Subscribe to SAB TV Channel : https://www.youtube.com/user/sabtv?sub_confirmation=1Click to watch all the clips of Tapu Sena from Taarak Mehta Ka Oolta Chashmah:https://www.youtube.com/playlist?list=PL6Rtnh6YJK7Z4igDkRboaZFl9zKFFzClOWe bring you all the special videos of Taarak Mehta Ka Ooltah Chashmah. Sit back, watch and enjoy all the special clips of Tapu Sena, specially picked out for you!About Taarak Mehta Ka Ooltah Chashmah:--------------------------------------------------------------------The show is inspired from the famous humorous column 'Duniya Ne Undha Chasma' written by the eminent Gujarati writer Mr. Tarak Mehta. This story evolves around happenings in Gokuldham Co-operative Society and covers topical issues which are socially relevant.The show predominantly - Promoolves around 'Jethalaal' (Dilip Joshi) who is an uneducated Gujarati businessman. Your 'Taarak Mehta' (Sailesh Lodha), is his neighbour. 'Jethalaal' finds a friend and philosopher in 'Taarak Mehta' and often goes to him for advice whenever he is in trouble. Jethalaal's family includes his simpleton wife 'Daya Ben' (Disha Wakani) and a mischievous son 'Tapu' (Bhavya Gandhi). Tapu is a menace and a constant source of trouble to all the members of Gokuldham. They have often warned 'Jethalaal' to reform 'Tapu' or else be prepared to leave the premises. Lost hopes of being heard by his son pushes Jethalaal' to call his father 'Champaklal' (Amit Bhatt) from the village. This was his great idea of leashing some control over the mischievous Tapu. The opposite happens and the grandfather joins hands with the grandson to make life a roller coaster troublesome ride for Jethalaal.More Useful Links :------------------------------ * Visit us at : http://www.sonyliv.com * Like us on Facebook : http://www.facebook.com/SonyLIV * Follow us on Twitter : http://www.twitter.com/SonyLIVAlso get Sony LIV app on your mobile * Google Play - https://play.google.com/store/apps/details?id=com.msmpl.livsportsphone * ITunes - https://itunes.apple.com/us/app/liv-sports/id879341352?ls=1&mt=8"
"BJjobTn941g","Sitara: Coming Soon","2018-11-12T05:16:24.000Z","UCLNItyVW0epTrMVA3DxQglg","ColorsTV Promos","24","18.13.11","colors tv,colorstv,hindi serials","206355","3656","90","543","https://i.ytimg.com/vi/BJjobTn941g/default.jpg","False","False",""
"0O9McWbI6gU","Ind Vs WI 3rd T20: आखिरी 6 गेंदों का रोमांच देखिए Ball By Ball, जरुर देखें | Headlines Sports","2018-11-11T17:37:08.000Z","UCPACfH7u4cAD2APtM_7TJZQ","Headlines Sports","17","18.13.11","Team India Won T20 Series,Ind Vs WI 3rd T20,India Vs Westindies Last T20,India Vs Westindies,Last 6 Balls,Team India Win Last Ball,Manish Pandey,Shikhar Dhawan,Rishabh Pant,Headlines Sports News,Headlines Sports","516246","2683","1251","161","https://i.ytimg.com/vi/0O9McWbI6gU/default.jpg","False","False","#IndVsWI3rdT20 #Last6Balls #HeadlinesSports #TeamIndia Ind Vs WI 3rd T20: आखिरी 6 गेंदों का रोमांच देखिए Ball By Ball, जरुर देखें Watch This Video 🔊 LIKE ➡ SHARE ➡ SUBSCRIBEPlease subscribe the channel and you will get new video notification next time. Here is the subscription link:https://www.youtube.com/channel/UCPACfH7u4cAD2APtM_7TJZQShare This Video : Follow Us With FacebookFacebook:- https://www.facebook.com/Headlinessports/"
"QJ9w_2fWO00","Indians And Phones Part 2 | The Timeliners","2018-11-09T13:14:06.000Z","UCTlnaHHQ75zlDg_fLr7tGEg","The Timeliners","24","18.13.11","Phones,Indians and phones,mobile phone,phone addiction,cell phones,i phone,technical guruji,Digital detox,Iphone X unboxing,Shreya Mehta,Ambrish Verma,The Timeliners,Girliyapa,Indians,indians and momos,technology video,selfie,shreya singh,screen patti,tvf,the viral fever,phone sex,butt dialing,filtercopy,comedy video,funny hindi video,relatable video,Indians And Phones Part 2 | The Timeliners,Mobile Reviews,Technology,smartphone","1701114","50045","3300","2331","https://i.ytimg.com/vi/QJ9w_2fWO00/default.jpg","False","False","I forgot my Phone is enough to get us a mini heart attack. If you are addicted to your phone like everyone else, watch Indians & Phones Part 2.Check out part 1 here: http://bit.ly/IndiansAndPhonesPlease subscribe to our channel by clicking the following link to make sure you get the notifications for our videos:https://goo.gl/TVeum4Like Us On Facebook: https://www.facebook.com/TheTimelinersFollow us on Twitter: https://twitter.com/the_timelinersFollow us on Instagram: https://www.instagram.com/thetimelinersChannel Head: Akansh Gaur Creative Head: Apoorv Singh Karki Written by: Anubhav ParsheeraDirected by: Himali ShahDOP: Georgy John PanickerEdited by: Rishab Malhotra & Tushar ManochaMusic: Tusshar Mallek  Stock music: Universal MusicProduction Design: Beeva Mahajan Creative Producer: Ambrish VermaLine Producer: Puneet WaddanChief Assistant Director: Prashant SoniColour Correction: Georgy John PanickerAssistant Directors: Abhinav Joshi, Tushar SahiGraphics: Chandan Bhatnagar Animation: CitrusMotion Graphic: Ashish DograAssistant DOP: Himansh AhujaAssistant Art Director: Vikrant ShahiAssistant Editor: Ashish DograPost Production Supervisor: Tushar ManochaProduction Manager: Irshad Ali Production Executives: Prabhjot Singh & Ahana Menon Marketing: Vineet Kanabar, Bhavya Prabhakar & Himakshi Batra  Cast:  Sahil Verma, Abhishek Srivastava, Apoorv Singh Karki, Ambrish Verma, Shreya Singh, Shreya Mehta, Tushar Sahi, Akshit Grover, Simar Singh, Ravi Kumar, Bhavya Singal, Shweta Yadav"
"Xsnjs2Dvtd0","ஹோட்டல் வெள்ளை தேங்காய் சட்னி ரகசியம் இந்த இரண்டு பொருட்களில் தான் உள்ளது/Hotel Style CoconutChutney","2018-11-10T07:21:51.000Z","UC49KpNwxY28o_t3-J4ZipOg","Buds 2 Bloom","2","18.13.11","[none]","297991","0","0","188","https://i.ytimg.com/vi/Xsnjs2Dvtd0/default.jpg","False","True",""
"ceMRcvTqM8Y","Romeo Weds Heer - Episode 4 | HAR PAL GEO","2018-11-11T16:15:00.000Z","UCe9JSDmyqNgA_l2BzGHq1Ug","HAR PAL GEO","24","18.13.11","Romeo Weds Heer,Feroz Khan,Sana Javed,HAR PAL GEO,Drama,Episode 4","1268868","12998","989","2812","https://i.ytimg.com/vi/ceMRcvTqM8Y/default.jpg","False","False","Romeo Weds Heer - Episode 4 | HAR PAL GEOAfter giving us the blockbuster drama serial Khaani, ace producers Abdullah Kadwani and Asad Qureshi are bringing the favorite couple Feroz Khan and Sana Javed back, in the 7th Sky Entertainment’s mega project, Romeo Weds Heer. Directed by the renowned director Anjum Shehzad who is known for his commendable work in Khaani and written by legendary writer Muhammad Younis Butt who has penned the famous satirical show Hum Sab Umeed Se Hain, Romeo Weds Heer is a romantic comedy that is for the masses.7th Sky Entertainment presents Feroz Khan and Sana Javed in a complete new avatar. The first look of the serial unveiled by Geo Entertainment features the title track of Romeo Weds Heer, sung by the renowned singers Aima Baig and Sahir Ali Bhagga, and the colorful music video for the track has been choreographed by Wahab Shah.  The track is full of fun and entertainment and the screen chemistry of Feroz &amp; Sana in the dance number is amazing. The dance number of Romeo Weds Heer has made the audience glued to the screen. Romeo Weds Heer is scheduled to go on air in October 2018 on Geo TV.A love story for generations to come in a serial redefining love, where east meets west. In our society marriage is not just between two individuals but between two families and when these families are poles apart this will bring twist and turns in Romeo and Heer’s life.So fasten your seatbelts belts &amp; get ready for the fun &amp; excitement in a signature Rom-com to celebrate the true colors of love &amp; happiness in the one &amp; only love story of the year.Written by: Dr. Muhammad Younis ButtDirected by: Anjum ShahzadProduced by: Abdullah Kadwani &amp; Asad QureshiProduction House: 7th Sky EntertainmentFor More Videos Subscribe - https://www.youtube.com/harpalgeoFor More Videos Subscribe - https://www.youtube.com/harpalgeo#RomeoWedsHeer#HARPALGEO#GEO#FerozKhan#Sanajaved"
"cVfJGzluRWg","Muddha Mandaram - ముద్ద మందారం | Episode - 1231 - Best Scene | Zee Telugu Serial","2018-11-11T00:30:00.000Z","UC3PYGKK29qJ0zu-eEthHK4g","Zee Telugu","24","18.13.11","Muddha Mandaram,muddha mandaram telugu serial latest episode,muddha mandaram today episode live,muddha mandaram today episode,muddha mandaram latest episode today,zee telugu mudda mandaram,zee telugu mudda mandaram serial,zee telugu mudda mandaram full episode,zee telugu,#telugu,zee tv serial,zee tv shows,zee5,#drama,family drama,zee telugu live,zee telugu serials,telugu tv serials in zee telugu,latest episode,watch online","187608","451","78","31","https://i.ytimg.com/vi/cVfJGzluRWg/default.jpg","False","False","Subscribe to your favourite Channel 👉 http://bit.ly/ZeeTelugu_SubscribeGet notified about our Latest update by Clicking the Bell Icon 🔔To watch FULL episode of #MuddhaMandaram, CLICK here - https://www.zee5.com/tvshows/details/muddha-mandaram/0-6-93The show will explore mindset and class conflict of two different personalities 'Akhilandeshwari' and 'Parvathi'.Kalavari Kodalu fame #Haritha is playing the role of Akhilandeshwari and as #ZeeTelugu is famous for bringing new faces on small screen, is repeating it by launching a new girl Tanuja as the leading protagonist 'Parvathi' in Mudda Mandaram. Also #Tollywood Star Hero King #Nagarjuna promoted this show by accepting Muddha Mandaram plant from Parvathi which she bought from her village and he further gifted it to his better half 'Amala' and expected this chain to continue by inviting people to gift a mandaram plant to their beloved ones.To Feel ZEE5 in Your Language (Apni Bhasha Mein Feel Hai) | To DOWNLOAD the app click below links  Now enjoy ZEE5 Globally. Available in over 190 countries* - Playstore: http://bit.ly/2K8zBw9- iTunes: http://bit.ly/2JpqI0hVisit our website - https://www.zee5.com Connect with us on Social Media: - Facebook - https://www.facebook.com/ZEE5/ - Instagram - https://www.instagram.com/zee5 - Twitter - https://twitter.com/ZEE5India#telugu #zeetelugu #teluguserials #zeeserials #telugudrama #entertainment #zeetelugushow #zee5"
"4laE-Odt-MM","VJ Archana's Handbag Secrets Revealed | What's Inside the HANDBAG","2018-11-10T03:30:00.000Z","UCSbUX_gKMur5FPcTbH2L5mA","Galatta Tamil | கலாட்டா தமிழ்","24","18.13.11","zee tamil archana,vj archana handbag,archana zee tamil,whats indside the handbag,behindwoods ashiq,ashiq behindwoods,thalaivar meeting archana,archana interview with rajini,rajini and archana,archana rajini interview zee tamil,vj archana interview,rajini interview zee tamil,akshay kumar,2.0 rajinikanth mass speech,2.0 rajini interview,zee tamil 2.0 interview,zee tamil archana comedy,zee tamil anchor archana,archana anchor,vj archana zee tamil","262822","6620","177","537","https://i.ytimg.com/vi/4laE-Odt-MM/default.jpg","False","False","ZEE Tamil VJ Archana's Handbag Secrets Revealed | What's Inside The Handbag | Stay tuned to Galatta Tamil for latest updates on Cinema and Politics. Like and Share your favourite videos and Comment your views too. Subscribe to GALATTA TAMIL : http://goo.gl/J4TyOo#VJArchana #zeetamil #HandbagSecretAlso, Like and Follow us on:Facebook: https://www.facebook.com/GalattaMediaTwitter: https://twitter.com/galattadotcomWebsite: http://www.galatta.comInstagram: https://www.instagram.com/stories/galattadotcom/"
"MjKsrm91dGM","Abhishekam | 12th November 2018 | Full Episode No 3065 | ETV Telugu","2018-11-12T10:00:00.000Z","UCSs9H1cyB3OHdy8wkit8ZKg","etvteluguindia","24","18.13.11","etv,etv telugu,telugu etv serial,telugu etv serials,sorna,etv fiction,comedy,jabardasth,extra jabardasth,eenadu television,aadukalam,daily serials,animation,amrutha,dasari narayana rao,etv noon time serials,abhishekam,abhishekamserial,sanjay,shirisha,rekha","209189","575","170","99","https://i.ytimg.com/vi/MjKsrm91dGM/default.jpg","False","False","Vinay overcomes many hurdles in his life. Though he is a family man, he ties the knot with Rekha to fulfill her last wishes. However, Rekha recovers miraculously and enters Vinay's life."
"rDUNVKdHSmE","EXPERIMENT: CAR VS TOOTHPASTE","2018-11-08T10:30:03.000Z","UCatfiM69M9ZnNhOzy0jZ41A","Power Vision","28","18.13.11","Experiment,Car,Car Vs,Watermelon,Balloon,Orbeez,Coca-Cola,CAR VS Toothpaste,Eggs,Soccer Ball,Lemons,Tests,Auto Vs,Power Vision","4832851","11460","10872","2236","https://i.ytimg.com/vi/rDUNVKdHSmE/default.jpg","False","False","What will happen if you put a toothpaste under the car?Hi guys.Today I will show you what will happen if you put toothpaste under the car.In this video, I collected the best episodes with the car.This is a super compilation.Watch and enjoy.Music:Jim Yosef - Link [NCS Release]https://youtu.be/9iHM6X6uUH8[Jim Yosef]• http://soundcloud.com/jim-yosef• http://facebook.com/jimyosefmusic• http://twitter.com/jimyosefElectro-Light - Symbolism [NCS Release]https://youtu.be/__CRWE-L45kElectro-Light➞ Facebook https://www.facebook.com/ElectroLightOfficial➞ SoundCloud https://soundcloud.com/maskedacoustic➞ Twitter https://twitter.com/ElectroLightEDM➞ YouTube https://www.youtube.com/user/ElectroLightOfficial"
