video_id,title,publishedAt,channelId,channelTitle,categoryId,trending_date,tags,view_count,likes,dislikes,comment_count,thumbnail_link,comments_disabled,ratings_disabled,description
"2ErjMY8rTbU","HUGE Collective Winter Haul | Sejal Kumar","2018-12-10T15:09:42.000Z","UCK-l8DE1lyZnguaRQr7_Y-Q","Sejal Kumar","26","18.11.12","huge haul,huge winter haul,haul 2018,winter haul 2018,sale haul,huge sale haul,haul videos,haul videos india,try on haul,haul,haul videos sejal kumar,sejal kumar,haul indian 2018","80008","5446","198","597","https://i.ytimg.com/vi/2ErjMY8rTbU/default.jpg","False","False","Hey Guys! My favourite item from the haul was the harry potter skirt and the chopsticks, what was yours?Most of the clothes in this video were from my clothing line SejalxSBl. Shop SejalxSBL: https://bit.ly/2DW2qMoDo tag me on Instagram and use the hashtag SejalxSBL if you shop!Rest of the items: 1. Black Corduroy shorts: Shein.com 2. Pleated midi skirt (Japan): Around Rs 30003. Black Denim skirt (Zara): Rs 27904. Tan Hat (Zara): Rs 15905. Blue headband (Japan): Around Rs 5006. Bow Rubber Bands (Japan): Around Rs 2007. Gold embellished Rubber Bands (Japan): Around Rs 1508. Gold teardrop hoops (Japan): Around Rs 7009. Chopsticks (Japan): Around Rs 150010. Black tights (Japan): Around Rs 500Fashion Videos: https://bit.ly/2uELrKKMusic Covers: https://bit.ly/2JfxJBwVlogs: https://bit.ly/2uDJChpSkits: https://bit.ly/2GsQ40hProduction: Kaushi BhartiWriter: Satvika JainTalk to me! Instagram: instagram.com/sejalkumar1195/Twitter: https://twitter.com/sejalkumar1195Facebook : www.facebook.com/TheClothingEditCamera used: Sony Alpha range"
"wl2-iBY57-0","வாணி ராணி - VAANI RANI -  Episode 1743 - 08-12-2018 END","2018-12-08T16:37:19.000Z","UCxhPXCaIGhyt2HOrJkoVuGA","RadaanMedia","24","18.11.12","Vaani rani,rani,Radhika in funny character,venu aravind,SunTV,VaniRani,vani,vaani,Radhika's dual role serial,Ranimma veetu kuripu,Radhika as lawyer in serial,radikaa,rathika,Radhika's new","911417","8970","1016","2146","https://i.ytimg.com/vi/wl2-iBY57-0/default.jpg","False","False","Subscribers Us for All Episode:https://www.youtube.com/show/vanirani/UCxhPXCaIGhyt2HOrJkoVuGA?sub_confirmation=1aa Connect with Radaan Media online: https://www.youtube.com/user/RadaanMediaVisit our WEBSITE: www.radaan.tvLike us on FACEBOOK: https://www.facebook.com/RadaanMediaWorksIndiaLtd?ref=hlFollow us on TWITTER:  https://twitter.com/RadaanTVTamil"
"XmtXQwsbkns","Exclusive: Gambhir’s Sensational Interview, Says He Was Hurt When Dumped By Dhoni | Vikrant Gupta","2018-12-08T16:21:52.000Z","UCVXCo0W9pk2dDkEBNLhTt7A","Sports Tak","17","18.11.12","sports tak,“sportstak”,“sports”,sports events,“cricket”,“sports,videos”,interviews”,Gautam Gambhir,gautam gambhir,gambhir batting,gambhir retirement video,gambhir,gautam gambhir fight,gautam gambhir life,gambhir retirement,gautam gambhir retire,gautam gambhir retires,gautam gambhir cricket,gautam gambhir records,gautam gambhir best innings,MS Dhoni,Sandeep Patil,Dhoni-Gambhir,World Cup 2015,World Cup 2011,ICC World T20 2007,Ind vs NZ 2008-09,Napier","1878998","66957","1785","12057","https://i.ytimg.com/vi/XmtXQwsbkns/default.jpg","False","False","After retirement Gautam Gambhir talked exclusively with sports tak. In this Interview he talked about Relation With Dhoni and How He was Dropped despite scoring runs. ----------About Sports Tak: स्पोर्ट्स तक (Sports Tak) खेल की दुनिया की हर छोटी-बड़ी खबर आपके लिए लाता है। स्पोर्ट्स You Tube पर आपको मिलेगी हर ब्रेकिंग न्यूज, विश्लेशण और बड़े-बड़े खिलाड़ियों के Exclusive इंटरव्यू। साथ ही सुनील गावस्कर, हरभजन सिंह, मोहम्मद अजहरूद्दीन, मदनलाल, आकाश चोपड़ा और निखिल चोपड़ा जैसे क्रिकेट दिग्गज आपके लिए खेल पर चर्चा करेंगे और आपके सवालों के जवाब भी देंगे। खेल जगत की हर खबर से रूबरू होने के लिए सब्सक्राइब/Subscribe कीजिए स्पोर्ट्स तक (Sports Tak)।  You can follow स्पोर्ट्स तक (Sports Tak) on: Sports Tak Youtube: https://www.youtube.com/sportstakSports Tak Facebook: https://www.facebook.com/sportstak/Sports Tak Twitter: https://twitter.com/sports_takSportsTak Instagram: https://www.instagram.com/sportstakofficial/Sports Tak, as the name suggests, is all about sports. You can find all the latest sports news from around the world here. Not just that, we bring to you exclusive interviews, live chats with players - past and present - and also the top journalists from sports journalism. It is an exclusive platform for sports news updates for the fans, not just from the sub-continent but the world over"
"UxrQhNOzSoI","Seetha Kalyanam || General Promo || Mon to Sat 9 PM || Asianet","2018-12-09T18:30:01.000Z","UCp_r6Z-Oh0YTf-ym71z5Nqg","Asianet","24","18.11.12","asianet,malayalam channel,tv show,malayalam serial,entertainment,Seetha Kalyanam || General Promo || Mon to Sat 9 PM || Asianet,Seethakalyanam,Seetha kalyanam,Seethakalyanam serial,Seethakalyanam asianet,Seethakalyanam Hotstar,Seethakalyanam Serial Online,watch Seethakalyanam Episode,Seethakalyanam online,Seetha,kalyan,Swathy,Seethakalyanam latest episode,Seethakalyanam Full Episode,Watch Seethakalyanam serial,Seetha Kalyanam Promo,Seetha Kalyanam Serial Promo","259729","628","58","80","https://i.ytimg.com/vi/UxrQhNOzSoI/default.jpg","False","False","Seetha Kalyanam || General Promo || Mon to Sat 9 PM || AsianetWatch All Shows: http://www.hotstar.com/asianetFollow Us On Facebook - https://www.facebook.com/Asianet                        Instagram - https://www.instagram.com/asianet                        Twitter - https://twitter.com/asianet"
"M7n-TIKjX4E","#SixthSense2 with Bellamkonda Sreenivas Kajal, Mehreen & Chota k Naidu   Tonight at 9 PM","2018-12-09T04:00:01.000Z","UCJF4y2nyCCrDKTgA7dxz1Qw","Star Maa","24","18.11.12","Star Maa,Starmaa,Starmaa serials,Telugu TV,Telugu Serials,Maatv Serials,Maa tv. drama,comedy action,entertainment,Telugu,tollywood,maatv,star telugumaa,maatelugu","597728","5753","304","265","https://i.ytimg.com/vi/M7n-TIKjX4E/default.jpg","False","False","#SixthSense2 with #Kavacham Team"
"4f-gODMMY_g","RBI Governor Urjit Patel Resigns उर्जित पटेल ने इस्तीफा दिया Analysis Current Affairs 2018","2018-12-10T14:03:42.000Z","UCrC8mOqJQpoB7NuIMKIS6rQ","Study IQ education","27","18.11.12","urjit patel,rbi urjit patel,urjit patel speech,rbi governor urjit patel,urjit patel resigns as rbi governor,urjit patel resigns,urjit patel rbi governor,urjit patel rbi,urjit patel live,urjit patel interview,urjit patel press conference,rbi governor urjit patel resigns,rbi governor urjit patel to resign,rbi governor urjit patel resignation,urgit patel,urjit patel latest,urjit patel salary","222517","14666","193","2238","https://i.ytimg.com/vi/4f-gODMMY_g/default.jpg","False","False","Get FLAT 60% discount on Pendrive Courses https://goo.gl/aTFK6Q. Offer Valid till 12th December '18.Videos PDFs - https://goo.gl/X8UMwF || Join #StudyIQ on Telegram - https://goo.gl/xBR3g8 || #Pendrive_Courses for Various Govt. Exams. Click here to know more - https://goo.gl/aTFK6Q or #Call_9580048004 or Live Chat Support - https://goo.gl/s68PZ1UPSC/CSE 2019 - https://goo.gl/UrCD46SSC & Bank - https://goo.gl/9LQ4AiUPSC Optionals - https://goo.gl/rtmXRUState PSCs - https://goo.gl/FDB32qDefence Exams - https://goo.gl/UEmtRzSSC JE Exams - https://goo.gl/2WyU1ZRBI Grade B - https://goo.gl/PY32m6NABARD Grade A - https://goo.gl/C6CzALDMRC Exams - https://goo.gl/yDnvyfInsurance Exams - https://goo.gl/iLEFxfCLAT 2019 - https://goo.gl/BurjtjRailway Jobs - https://goo.gl/5KaL7hTeaching Jobs - https://goo.gl/q117TXUPSC Prelim 2019Test Series -https://goo.gl/zkCG51Free PDFs - https://goo.gl/cJufZc || Free Quiz - https://goo.gl/wCxZsy || Free Video Courses - https://goo.gl/jtMKP9Follow us on Facebook - https://goo.gl/iAhPDJTelegram - https://t.me/StudyiqeducationThe Hindu Editorial Analysis - https://goo.gl/vmvHjGCurrent Affairs by Dr Gaurav Garg - https://goo.gl/bqfkXeUPSC/IAS Burning Issues analysis- https://goo.gl/2NG7vPWorld History for UPSC - https://goo.gl/J7DLXvIndian History  - https://goo.gl/kVwB79Follow us on Facebook - https://goo.gl/iAhPDJFollow Dr Gaurav Garg on Facebook - https://goo.gl/xqLaQmUPSC/IAS past papers questions - https://goo.gl/F5gyWHSSC CGL + IBPS Quantitative tricks - https://goo.gl/C6d9n8English Vocabulary - https://goo.gl/G9e04HReasoning tricks for Bank PO + SSC CGL- https://goo.gl/a68WRNError spotting / Sentence correction  https://goo.gl/6RbdjCStatic GK complete- https://goo.gl/kB0uAoComplete GK + Current Affairs for all exams- https://goo.gl/MKEoLyWorld History - UPSC / IAS - https://goo.gl/kwU9jCLearn English for SSC CGL, Bank PO https://goo.gl/MoL2itScience and Technology for UPSC/IAS - https://goo.gl/Jm4h8jPhilosophy for UPSC/IAS - https://goo.gl/FH9p3nYojana Magazine analysis -https://goo.gl/8oK1gyHistory for SSC CGL + Railways NTPC - https://goo.gl/7939eV"
"ojKe0PDyCP8","Durga | Full Ep 1249 | 8th Dec 2018 | Odia Serial - TarangTV","2018-12-09T05:30:00.000Z","UCnm5DH0oJndtA-6J10_jIEw","Tarang TV","24","18.11.12","tarang,tarang tv,tarang tv online,tarang tv serial,odia tarang tv serial,tarang tv show,taranga channel,tarang tv channel,odia tarang channel,odia serial,odia serial video,odia channel,odia tv channel,odia tv show,odia tv","262012","896","155","135","https://i.ytimg.com/vi/ojKe0PDyCP8/default.jpg","False","False","After Lisa return, Lisa tries to destroy Dev Mansion  by using Rudra and Shiv as weapon..But stuti saves her family from Rudra’s attack always..Durga & Stuti tries to save their family from Rudra’s –ve power and make Rudra +ve out of the evil powers..Will they be able to know about Lisa’s plan & succeed in their mission?Monday-Saturday at 8.30 p.m. only on Tarang TV.SUBSCRIBE to TarangTV channel for more Odia Serial and movie videoshttps://goo.gl/QgkQLbLike us on Facebookhttps://www.facebook.com/tarangtv Circle on G+ https://goo.gl/ArUUGwFollow us on Twitterhttps://twitter.com/tarangtvodisha Follow us on Instagramhttps://www.instagram.com/tarangtv/ Visit our website for further details: www.tarangtv.in#Durga #TarangSerial #OdiaSerial"
"CZ0DT7jW4Ws","Jethalal Leaves The Society | Tapu Sena Special | Taarak Mehta Ka Ooltah Chashmah","2018-12-10T12:18:35.000Z","UC6-F5tO8uklgE9Zy8IvbdFw","SAB TV","24","18.11.12","sab tv channel,sab tv serials,all episodes,tapu sena videos,comedy channel india,comedy channel hindi,comedy videos,tapu sena special,tapu special clips,taarak mehta clips,tapu sena fun,Taarak Mehta Ka Oolta Chashmah,tapu sena comedy,sab tv show,tapu and friends,special clips of Tapu,taarak mehta best videos,taarak mehta tapu sena,tmkoc tapu sena special,tapu sena,kutch tarak mehta,Jethalal Leaves The Society","163871","877","167","81","https://i.ytimg.com/vi/CZ0DT7jW4Ws/default.jpg","False","False","Click here to Subscribe to SAB TV Channel : https://www.youtube.com/user/sabtv?sub_confirmation=1Click to watch all the clips of Tapu Sena from Taarak Mehta Ka Oolta Chashmah:https://www.youtube.com/playlist?list=PL6Rtnh6YJK7Z4igDkRboaZFl9zKFFzClOWe bring you all the special videos of Taarak Mehta Ka Ooltah Chashmah. Sit back, watch and enjoy all the special clips of Tapu Sena, specially picked out for you!About Taarak Mehta Ka Ooltah Chashmah:--------------------------------------------------------------------The show is inspired from the famous humorous column 'Duniya Ne Undha Chasma' written by the eminent Gujarati writer Mr. Tarak Mehta. This story evolves around happenings in Gokuldham Co-operative Society and covers topical issues which are socially relevant.The show predominantly - Promoolves around 'Jethalaal' (Dilip Joshi) who is an uneducated Gujarati businessman. Your 'Taarak Mehta' (Sailesh Lodha), is his neighbour. 'Jethalaal' finds a friend and philosopher in 'Taarak Mehta' and often goes to him for advice whenever he is in trouble. Jethalaal's family includes his simpleton wife 'Daya Ben' (Disha Wakani) and a mischievous son 'Tapu' (Bhavya Gandhi). Tapu is a menace and a constant source of trouble to all the members of Gokuldham. They have often warned 'Jethalaal' to reform 'Tapu' or else be prepared to leave the premises. Lost hopes of being heard by his son pushes Jethalaal' to call his father 'Champaklal' (Amit Bhatt) from the village. This was his great idea of leashing some control over the mischievous Tapu. The opposite happens and the grandfather joins hands with the grandson to make life a roller coaster troublesome ride for Jethalaal.More Useful Links :------------------------------ * Visit us at : http://www.sonyliv.com * Like us on Facebook : http://www.facebook.com/SonyLIV * Follow us on Twitter : http://www.twitter.com/SonyLIVAlso get Sony LIV app on your mobile * Google Play - https://play.google.com/store/apps/details?id=com.msmpl.livsportsphone * ITunes - https://itunes.apple.com/us/app/liv-sports/id879341352?ls=1&mt=8"
"Cgnd18MZzoY","Yash-Radhika Pandit First Press Meet With Their Newborn Daughter","2018-12-09T05:57:17.000Z","UCl-OodciBGZ0k8K8rBZGe4w","Public TV | ಪಬ್ಲಿಕ್ ಟಿವಿ","25","18.11.12","Public TV,Public TV Live,Kannada Live News,Kannada latest news,trending news,Online Kannada news,Kannada online news,Karnataka Latest News,Karnataka Politics,Karnataka Political Developments,HR Ranganath,Sandalwood News,radhika pandit baby,radhika pandit,yash radhika pandit,yash radhika pandit baby,yash,radhika yash baby,yash radhika pandit baby video,yash & radhika pandit's baby,yash radhika,rocking star yash","337726","3054","253","235","https://i.ytimg.com/vi/Cgnd18MZzoY/default.jpg","False","False","Rocking Star Yash & Radhika Pandit addressed the press for the with their newborn daughter on the ocassion of their 2nd wedding anniversary today. ಇಂದು ರಾಕಿಂಗ್ ಸ್ಟಾರ್ ಯಶ್ ಮತ್ತು ರಾಧಿಕಾ ಪಂಡಿತ್ ಅವರ ಎರಡನೇ ಮದುವೆ ವಾರ್ಷಿಕೋತ್ಸವವಾಗಿದೆ. ಆದರೆ ಇಂದೇ ತಮ್ಮ ಮುದ್ದಿನ ಮಗಳನ್ನು ಮನೆಗೆ ಕರೆದುಕೊಂಡು ಹೋಗುತ್ತಿದ್ದಾರೆ.ಸುದ್ದಿಗೋಷ್ಠಿಯಲ್ಲಿ ಮಾತನಾಡಿದ ಯಶ್, ಅಂದಿನ ದಿನ ನಾನು ಬೇರೆ ಕೆಲಸದಲ್ಲಿದ್ದೆ. ಆದ್ದರಿಂದ ನಾನು ಬಂದು ಯಾರನ್ನು ಮಾತನಾಡಿಸಲು ಸಾಧ್ಯವಾಗಿಲ್ಲ. ಆದರೆ ನೀವು ನಮ್ಮ ಮಾತಿಗೆ ಗೌರವ ಕೊಟ್ಟಿದ್ದೀರಿ. ಆದ್ದರಿಂದ ಮೊದಲೇಯದಾಗಿ ಎಲ್ಲರಿಗೂ ಧನ್ಯವಾದಗಳು ಎಂದು ಮಾಧ್ಯಮದವರಿಗೆ ತಿಳಿಸಿದರು.Keep Watching Us On Youtube At: https://www.youtube.com/user/publictvnewskannadaWatch More From This Playlist Here: https://www.youtube.com/user/publictvnewskannada/playlistsRead detailed news at www.publictv.inSubscribe on YouTube: https://www.youtube.com/user/publictvnewskannada?sub_confirmation=1Follow us on Google+ @  https://plus.google.com/+publictvLike us @ https://www.facebook.com/publictvFollow us on twitter @ https://twitter.com/PublicTVnews--------------------------------------------------------------------------------------------------------Public TV brings to you the latest updates from all walks of life, be it politics or entertainment, religion or sports, crime or any other thing. Keep watching..."
"mW1LZNuXPY4","Sabarimala Swamigal - the current scenario","2018-12-07T12:28:29.000Z","UCpPOf9BQPwa4K11Zjxu1ZPw","Jump Cuts","23","18.11.12","Jump cuts,Jumpcuts,Tamil comedy,Tamil Comedy Videos,jumpcuts new video,jumpcuts haribaskae,jumpcuts naresh,haribaskar videos,jumpcuts sabarimalai,jumpcuts swami comedy,jumpcuts boys vs girls,jumpcuts proposing girls,jumpcuts local loganathan,kanaga jumpcuts comedy","961997","60941","2687","3147","https://i.ytimg.com/vi/mW1LZNuXPY4/default.jpg","False","False","Jump Cuts is a Tamil Entertainment channel by Hari and Naresh. We love telling our stories that we have came across in our life, friends, neighbourhood and bring it to you in our own way through the jump cut editing ✂️.We are here to entertain and if you like us, do share, like and subscribeFollow us on Facebook : https://www.facebook.com/jumpcutz/Follow us on Instagram : jump_cutsFollow us on Twitter : @jumpcuts7Thank you keep supportingJ U M P C U T S"
"6rT41CFJEjo","राधाकृष्ण | राधा को कृष्ण के मोह ने साधा","2018-12-08T16:30:00.000Z","UCCy2rLnGdwoJcSAtixNdsPQ","STAR भारत","22","18.11.12","promo,radha krishn,radha,krishn,love story,love,प्रोमो,राधाकृष्ण,राधा,कृष्ण,प्रेम,स्टार भारत,प्रेमगाथा","467146","6856","155","370","https://i.ytimg.com/vi/6rT41CFJEjo/default.jpg","False","False","क्या राधा को हो रहा है कृष्ण से मोह?देखना न भूलें राधाकृष्ण, सोम-शनि, रात 9 बजे, सिर्फ़ STAR भारत पर!#राधाकृष्ण | #RadhaKrishn"
"e6-prxPwGJg","Malaikottai Prank | Fun Panrom Reloaded | Black Sheep","2018-12-10T15:56:01.000Z","UCzh5hQc_O3r3xjh9sXrM7-A","Black Sheep","24","18.11.12","black sheep,fun panrom,fun panrom latest,vj siddhu,ram nishanth,settai sheriff,tamil pranks,top tamil pranks,trichy,pranksters,tamil pranksters","287071","21800","374","2917","https://i.ytimg.com/vi/e6-prxPwGJg/default.jpg","False","False","Here we are again with Malaikottai Prank part-1. Watch and share.Black Sheep is an infotainment channel which aims to engage an audience of all categories. Black Sheep wil be an upgraded version of Smile Mixture, this time aiming for more fun and entertainment. Watch, Share and Subscribe ...."
"chfeiqpis4I","प्राइम टाइम इंट्रो : रिज़र्व बैंक गवर्नर पद से उर्जित पटेल का इस्तीफ़ा","2018-12-10T15:54:32.000Z","UC9CYT9gSNLevX5ey2_6CK0Q","NDTV India","25","18.11.12","RBI,rbi governor,ndtv india,prime time,ravish kumar,Urjit Patel,Urjit Patel resigns,Narendra Modi,Arun Jaitley,Reserve Bank of India (RBI),आरबीआई,उर्जित पटेल,उर्जित पटेल का इस्‍तीफा,नरेंद्र मोदी,अरुण जेटली,भारतीय रिजर्व बैंक,प्राइम टाइम,रवीश कुमार","234718","9757","388","1232","https://i.ytimg.com/vi/chfeiqpis4I/default.jpg","False","False","2018 का साल 12 जनवरी के चार जजों के प्रेस कांफ्रेंस से जिन सवालों को लेकर शुरू हुआ था, वह 10 दिसंबर के रिज़र्व बैंक के गवर्नर के इस्तीफे से और बड़ा हो गया है. इस बीच सीबीआई का हाल आप देख चुके हैं. पंचपरमेश्वर की एक पंक्ति है. क्या बिगाड़ के डर से ईमान की बात न कहोगे. लगता है कि भारत की सर्वोच्च संस्थाओं पर बैठे कुछ लोगों के ईमान पर कोई दस्तक दे रहा है. 12 जनवरी से यह साल शुरू हुआ, 10 दिसंबर को एक मोड़ पर पहुंचा है. 12 जनवरी को सुप्रीम कोर्ट के चार सीनियर जज बाहर आए और देश की जनता को बताया कि न्यायपालिका की आज़ादी ख़तरे में है. 10 दिसंबर को भारतीय रिज़र्व बैंक के गवर्नर उर्जित पटेल ने इस्तीफा देकर उन चर्चाओं को साबित कर दिया कि अपने रहते अब और इस संस्थान की गरिमा दांव पर नहीं लगा सकते हैं.NDTV is one of the leaders in the production and broadcasting of un-biased and comprehensive news and entertainment programmes in India and abroad. NDTV delivers reliable information across all platforms: TV, Internet and Mobile.Subscribe for more videos: https://www.youtube.com/user/ndtv?sub_confirmation=1Like us on Facebook: https://www.facebook.com/ndtvFollow us on Twitter: https://twitter.com/ndtvDownload the NDTV Apps: http://www.ndtv.com/page/appsWatch more videos: https://khabar.ndtv.com/videos?yt"
"qXg002k95uE","Seetha | Flowers | Ep# 496","2018-12-08T11:30:01.000Z","UCSrS91iCgFCv_3KwjWWHzSg","Flowers TV","24","18.11.12","flowers serials,actress,malayalam serials,flowers tv malayalam,flowers tv,Seetha,Latest Serial,Seetha serial","576284","1587","8848","0","https://i.ytimg.com/vi/qXg002k95uE/default.jpg","True","False","Mon- fri, 06.30 PM Only On Flowers.================================Don't miss even a single episode of Seetha =================================Flowers Comedy  -http://j.mp/flowerscomedyFlowers On Air      -http://j.mp/flowersonairOur Social Media Facebook- https://www.facebook.com/flowersonair Twitter     https://www.twitter.com/flowersonairGoogle Plus -https://plus.google.com/+FlowerstvIndia"
"L6eDM1G2DFM","Call Taxi Alaparaigal - Nakkalites","2018-12-09T11:28:33.000Z","UCiPmhfdCL06cSVTXKabF0Zg","Nakkalites","23","18.11.12","Nakkalites,Roommates Alaparaigal,Roommates Nakkalites,Roommates,Nakkalites new video,Nakkalites bloopers,Arun nakkalites,Sassi nakkalites,Amma alaparaigal,Girl roommates,Nakkalites whatsapp status,Call Taxi Alaparaigal,call taxi nakkalites,nakkalites amma,uber alaparaigal,ola alaparaigal,tamil creators,nakkalites channel,trending video,tamil comedy,political satire","320279","15587","770","768","https://i.ytimg.com/vi/L6eDM1G2DFM/default.jpg","False","False","A comedy sketch about call taxi driver.Play Games and get to win cash!Win upto 1 lakh Rupees daily - Download MPL App now -https://www.mpl.liveThanks toDivoCastSavithiri Manoj BeadzSassi Kumar ChellaManikamPrasanna BalachandranArun KumarkaviAneessh sivashanmugamKannanProduction ManagerKaviAsst. CinematographyKannanAsst. DirectionSarathLive SoundSivan MoorthySound DesignVivek SaroEditingVigneshCinematography & Colour GradingSanthoshScriptNijanthanDirectionVishnu PriyanProduced ByErumbugal Network In Association With DivoSUBSCRIBE US at : https://www.youtube.com/?gl=INLIKE US at : https://www.facebook.com/Nakkalites/Follow Us at: https://twitter.com/NakkalitesIn Association with Divohttp://www.facebook.com/divomovieshttps://twitter.com/divomovies"
