video_id,title,publishedAt,channelId,channelTitle,categoryId,trending_date,tags,view_count,likes,dislikes,comment_count,thumbnail_link,comments_disabled,ratings_disabled,description
"mNbSgMEZ_Tw","John Lewis & Partners Christmas Ad 2018  - #EltonJohnLewis 🎹","2018-11-15T07:42:54.000Z","UCa1yUHQmV6Z0PpAUtfgNd9g","John Lewis & Partners","1","18.17.11","john lewis,john lewis & partners,christmas advert,elton john,sir elton john,christmas,advert,waitrose","6269234","69462","7245","8555","https://i.ytimg.com/vi/mNbSgMEZ_Tw/default.jpg","False","False","Watch the new John Lewis & Partners Christmas TV advert, The Boy and The Piano.This year’s story is about the power of a gift. And how that gift inspired, changed and influenced the course of a little boy’s life. That little boy just happens to be Elton John. The film begins in present day and works backwards chronologically through Elton’s life right until the moment on Christmas morning when he received the special gift that changed his life.Subscribe to this channel for regular video updates https://jland.partners/2OQbQuc If you want to hear more from John Lewis & Partners:Like John Lewis & Partners  on Facebook http://www.facebook.com/johnlewisandpartnersFollow John Lewis & Partners on Twitter http://twitter.com/jlandpartnersFollow John Lewis & Partners on Instagram http://instagram.com/johnlewisandpartners"
"qEqwI_oo31U","Wayne Rooney's final England game! | England 3-0 USA | International Friendly Highlights","2018-11-15T22:49:17.000Z","UCNAf1k0yIjyGu3k9BwAg3lg","Sky Sports Football","17","18.17.11","sky sports,premier league,Football League,La Liga,football,thierry henry,gary neville,jamie carragher,soccer saturday,sunday supplement,soccer,Premiership,Sky Sports live,Sky,Sports,stream,the debate,the debate sky sports,sky sports football,England,USA,Highlights,Friendly,england usa,england vs usa,england vs usa highlights,england highlights,wayne rooney last england game,wayne rooney,england v usa highlights","606045","8252","202","1297","https://i.ytimg.com/vi/qEqwI_oo31U/default.jpg","False","False","SUBSCRIBE ► http://bit.ly/SSFootballSubCallum Wilson scored on his debut and Wayne Rooney earned his 120th and final cap as England beat the United States 3-0 at Wembley.Watch Premier League LIVE on Sky Sports here ► http://bit.ly/WatchSkyPL►TWITTER: https://twitter.com/skysportsfootball►FACEBOOK: http://www.facebook.com/skysports►WEBSITE: http://www.skysports.com/football►SOCCER AM: http://bit.ly/SoccerAMSub►SKY SPORTS BOXING: http://bit.ly/SSBoxingSub"
"7NiYVoqBt-8","Dumbo Official Trailer","2018-11-15T01:47:07.000Z","UCuaFvcY4MhZY3U43mMt1dYQ","Walt Disney Studios","1","18.17.11","walt disney,disney,movies,trailer,official,hd,dumbo,elephant,1080p,new","5467124","132206","6461","15840","https://i.ytimg.com/vi/7NiYVoqBt-8/default.jpg","False","False","Watch the new trailer for Dumbo, and see the film when it soars to theatres March 29, 2019!From Disney and visionary director Tim Burton, “Dumbo” expands on the beloved classic story where differences are celebrated, family is cherished and dreams take flight. A new trailer, images and poster are now available. The trailer features Colin Farrell, Michael Keaton, Danny DeVito, Eva Green, Finley Hobbins and Nico Parker.Circus owner Max Medici (Danny DeVito) enlists former star Holt Farrier (Colin Farrell) and his children Milly (Nico Parker) and Joe (Finley Hobbins) to care for a newborn elephant whose oversized ears make him a laughingstock in an already struggling circus. But when they discover that Dumbo can fly, the circus makes an incredible comeback, attracting persuasive entrepreneur V.A. Vandevere (Michael Keaton), who recruits the peculiar pachyderm for his newest, larger-than-life entertainment venture, Dreamland. Dumbo soars to new heights alongside a charming and spectacular aerial artist, Colette Marchant (Eva Green), until Holt learns that beneath its shiny veneer, Dreamland is full of dark secrets.Website: https://disney.com/dumboYouTube: https://www.youtube.com/disneymovietrailersFacebook: https://www.facebook.com/DisneyDumbo/Twitter: https://twitter.com/dumboInstagram: https://www.instagram.com/dumbo/U.S. Release Date:  March 29, 2019Cast:  Colin Farrell, Michael Keaton, Danny DeVito, Eva Green, Alan Arkin, Finley Hobbins, Nico Parker.Director:  Tim BurtonProducers:  Justin Springer, Ehren Kruger, Katterli Frauenfelder, Derek FreyScreenplay by: Ehren KrugerExecutive Producer: Nigel Gostelow"
"MKWzKzZrzts","Ellen & Michelle Obama Go to Costco","2018-11-15T14:00:06.000Z","UCp0hYYBW6IMayGgR-WeoCvQ","TheEllenShow","24","18.17.11","michelle obama,first lady,new book,becoming michelle,memoir,book signing,costco,ellen degeneres,ellen,degeneres,the ellen degeneres show,ellentube,who is on ellen today,season 16,season 16 episode 52,hilarious,funny,spoof,michelle obama meets fans,michelle obama book signing,snl,parody,skit,comedy,costco book signing,michelle obama cvs,cvs,ellen cvs,ellen and michelle obama costco,fans,barack obama,barack,piano,michelle obama playing piano","4075574","144823","4407","0","https://i.ytimg.com/vi/MKWzKzZrzts/default.jpg","True","False","Michelle Obama is on a book tour for her new memoir, Becoming, so Ellen thought the best place to set up an impromptu book signing was one of America's favorite wholesale stores, Costco. Watch as they sign books for unsuspecting fans, do some shopping, and Ellen provides a musical interlude just for the former First Lady.#TheEllenShow#MichelleObama#Becoming"
"lzQyH-nX0u0","James Joins Mark Wahlberg's 4am Workout Club","2018-11-15T07:44:42.000Z","UCJ0uqCI0Vqr2Rrt1HseGirg","The Late Late Show with James Corden","24","18.17.11","The Late Late Show,Late Late Show,James Corden,Corden,late night,late night show,comedy,comedian,celebrity,celeb,celebrities,CBS,joke,jokes,funny,funny videos,funny video,humor,hollywood,famous","3091352","56911","825","2571","https://i.ytimg.com/vi/lzQyH-nX0u0/default.jpg","False","False","After seeing Mark Wahlberg's ridiculous daily schedule, beginning with a 2:30am wake-up call and a 4am workout, James Corden decides to adopt his schedule for the day and heads to Mark's house for a taste of the 4am workout club.More Late Late Show:Subscribe: http://bit.ly/CordenYouTubeWatch Full Episodes: http://bit.ly/1ENyPw4Facebook: http://on.fb.me/19PIHLCTwitter: http://bit.ly/1Iv0q6kInstagram: http://bit.ly/latelategramWatch The Late Late Show with James Corden weeknights at 12:35 AM ET/11:35 PM CT. Only on CBS.Get new episodes of shows you love across devices the next day, stream live TV, and watch full seasons of CBS fan favorites anytime, anywhere with CBS All Access. Try it free! http://bit.ly/1OQA29B---Each week night, THE LATE LATE SHOW with JAMES CORDEN throws the ultimate late night after party with a mix of celebrity guests, edgy musical acts, games and sketches. Corden differentiates his show by offering viewers a peek behind-the-scenes into the green room, bringing all of his guests out at once and lending his musical and acting talents to various sketches. Additionally, bandleader Reggie Watts and the house band provide original, improvised music throughout the show. Since Corden took the reigns as host in March 2015, he has quickly become known for generating buzzworthy viral videos, such as Carpool Karaoke."
"u1cdJA6jxtA","DUMPLIN' Official Trailer (2018) Jennifer Aniston, Netflix Movie HD","2018-11-14T15:10:06.000Z","UCzcRQ3vRNr6fJ1A9rqFn7QA","ONE Media","1","18.17.11","Cinema,Trailer,Official,Movie,Film,Dumplin',Dumplin,Jennifer Aniston,Netflix,2018","1038414","21086","708","843","https://i.ytimg.com/vi/u1cdJA6jxtA/default.jpg","False","False","DUMPLIN Official Trailer (2018) Jennifer Aniston, Netflix Movie HD© 2018 - NetflixComedy, Kids, Family and Animated Film, Blockbuster,  Action Cinema, Blockbuster, Scifi Movie or Fantasy film, Drama...   We keep you in the know! Subscribe now to catch the best movie trailers 2017 and the latest official movie trailer, film clip, scene, review, interview."
"WL21pwS05g4","Gordon Ramsay Appalled By 'English Style Fish & Chips | Kitchen Nightmares","2018-11-14T17:00:03.000Z","UCUZzyuAlhHNP3oiuMjn7RfQ","Kitchen Nightmares","24","18.17.11","Gordon Ramsay kitchen nightmares,Gordon Ramsay best insults,kitchen nightmares full episodes,kitchen nightmares online,kitchen nightmares watch online,kitchen nightmares HD,kitchen nightmares best moments,Gordon Ramsay,Kitchen Nightmares,gordon ramsay kitchen nightmares full episodes,gordon ramsay kitchen nightmares best moments,gordon ramsay fish and chips,kitchen nightmares fish and chips,kitchen nightmares cafe hon full episode","1407732","15454","297","2114","https://i.ytimg.com/vi/WL21pwS05g4/default.jpg","False","False","Bawlmer? Bawlmer. Bawlmer? Bawlmer. Bawlmer? Bawlmer.If you liked this clip check out the rest of Gordon's channels:http://www.youtube.com/gordonramsayhttp://www.youtube.com/thefwordhttp://www.youtube.com/kitchennightmaresMore Gordon Ramsay:Website: http://www.gordonramsay.comFacebook: http://www.facebook.com/GordonRamsay01Twitter: http://www.twitter.com/GordonRamsay"
"R4LJAVNpVFI","My Life With Tourette Syndrome","2018-11-14T18:00:02.000Z","UCGDV4-Gr3gyc-eGCgRtXknw","ACTUALLY HAPPENED","1","18.17.11","Tourette,kid,storybooth,story booth,problem,doctor,syndrome,school,student,lonely,teacher,depression,tics,The Voice,support,animated channel,actually happened,pain","755820","21582","799","5380","https://i.ytimg.com/vi/R4LJAVNpVFI/default.jpg","False","False","★ Subscribe ACTUALLY HAPPENED: https://bit.ly/2J5HP7jThis is Pete. He has a problem that maybe you’ve heard about or seen, and which you’ll probably find funny, annoying or creepy. He has Tourette’s syndrome. He’s not ashamed of it – he’s got used to it. Pete wants to tell you how he found a way to turn his condition to his advantage rather than accept it was a problem.He was an absolutely normal kid until one morning when he woke up and felt the urge to twitch his head for no reason. And then do it one more time. And again. He was standing in the center of his bedroom doing strange movements, and he couldn’t control it. Okay, he thought, maybe it’s some muscular spasm and it will pass. It didn’t pass even after several days. What was even worse was that he had a couple of other symptoms. Like raising his hands and winking. And the worst thing was that he wanted to squeak like a pig, like this *squeak*, from time to time, and he didn’t understand why. Of course, all this became pretty noticeable, and he went to see his parents feeling pretty stressed. They took him to the doctor at once, and that’s where he was diagnosed with Tourette’s syndrome.Pete had never heard of it before, and he was certain that if he had seen someone else with these symptoms he would have laughed or been disgusted. And now he had to go to school and explain that this was how he would behave for the time being. He was only ten at the time. He still remembers what it felt like standing among his classmates and saying he had a condition, how embarrassing it felt to constantly move, and his classmates laughing at his every single tic. Sure, it certainly looked like he was having fun, but really, it’s not pleasant or entertaining at all! When he tried to explain that no one actually understood his problem, everyone just thought that it was Pete’s weird way of expressing himself.And that’s how he became isolated from everyone. No one wanted to be around him anymore; and the teachers didn’t even try to give him any support. Even worse, Pete remembers how once his teacher became irritated by his winking – she thought he was just making faces, and put him at the back of the room away from everyone else. There he remained, isolated both physically and psychologically. Pete got to know some other guys with Tourette’s. He thought that he wouldn’t feel so lonely if he got to know other people with the same problem. Unfortunately, Tourette’s is tricky, because when you see other people’s tics, your own tics become worse. And even if a situation like this looks comical in a way, all these tics can be very tiring and debilitating. So Pete came away from these meetings feeling really exhausted, and tried to avoid other Tourette’s sufferers from then on. In the meantime, the situation with his tics was getting worse – more movements appeared, as did more sounds, even abusive language, and in the end he reached his mid-teens looking like a foul-mouthed perpetual motion machine in deep depression.At that time, Pete was browsing a lot on the web, because online no one was disturbed by his tics. One day, he came across a video of a Tourette’s guy who was singing on “The Voice”, and Pete was amazed to see that he performed flawlessly and beautifully, without a single twitch. It was then that he had the idea that maybe he could give it a try himself, and he even knew what he could do. Pete he’d always been quick-witted and had a good sense of humor, so he thought that he could maybe try a couple of times to do stand-up comedy pieces for a small audience, just to get him out of his house a bit.Pete immediately sat himself down to write punchlines, and the ones he came up with made even him laugh. It was so exciting that he completely forgot his depressed state – he was just so drawn into the process. The thing was that his Tourette’s tics could be pretty amusing if he looked at them from an outsider’s perspective, and combined with his comic monologue, the effect was hilarious. And what he wanted to tell people was that having his condition was not a stigma; he wasn’t an idiot or anything, he was just a regular guy.Pete performed his first show surrounded by Tourette’s patients. The effect was even better than he had expected. He got a standing ovation, which was a bit undeserved in his view, but still pleasant. What’s more, Pete learned that he really could control his tics better when he was on stage. He went to the local open mic comic club and performed in front of the locals, who first were taken aback by his strange behavior but by the end of the performance were laughing their heads off. And the most important part was that they were laughing not at him, but with him.He’s now taken his comedy outside the club, and everywhere his audiences like him a lot, while Pete himself feels a lot better – more in control and not so lonely anymore.Music by Epidemic Sound: https://www.epidemicsound.com"
"ajN57m_OSpY","Ellie Goulding, Diplo, Swae Lee - Close To Me (Official Video)","2018-11-14T15:00:01.000Z","UCvu362oukLMN1miydXcLxGg","EllieGouldingVEVO","10","18.17.11","Ellie,Goulding,Diplo,Swae,Lee,Close,To,Me,Polydor,Records,Pop","2023002","91989","1887","3754","https://i.ytimg.com/vi/ajN57m_OSpY/default.jpg","False","False","LISTEN: https://ellie.lnk.to/CloseToMeID Location: Budapest, HungaryMore Ellie:http://www.elliegoulding.comhttp://www.instagram.com/elliegouldinghttp://www.facebook.com/elliegouldinghttp://www.twitter.com/elliegouldingSign up to the official Ellie Goulding mailing list: https://ellie.lnk.to/signup"
"2Sl_9VMeAWg","Pastry Chef Attempts to Make Gourmet Sno Balls | Gourmet Makes | Bon Appétit","2018-11-14T17:00:59.000Z","UCbpMy0Fg74eXXkvxJrtEn3w","Bon Appétit","26","18.17.11","claire saffitz,pastry chef,gourmet makes,claire,claire makes,sno ball,sno balls,claire makes snow balls,claire makes sno balls,gourmet sno balls,sno balls hostess,hostess sno balls,snoball,gourmet sno ball,gourmet snoball,claire makes gourmet sno balls,make sno balls,making sno balls,make gourmet sno balls,claire bon appetit,claire sno balls,how to make sno balls,how to make gourmet sno balls,claire gourmet sno balls,gourmet snacks,food,bon appetit","1887401","78659","1291","8372","https://i.ytimg.com/vi/2Sl_9VMeAWg/default.jpg","False","False","Sno Balls. Baby boomers will remember this post-World War II junk food favorite. Claire Saffitz returns to the Test Kitchen to try her hand at making gourmet Sno Balls.Check out Claire's Instagram: https://www.instagram.com/csaffitz/Still haven’t subscribed to Bon Appetit on YouTube? ►► http://bit.ly/1TLeyPnABOUT BON APPÉTITCook with confidence using Bon Appetit’s kitchen tips, recipes, videos, and restaurant guides. Stay current on the latest food trends, dining destinations, and hosting ideas. Pastry Chef Attempts to Make Gourmet Sno Balls | Gourmet Makes | Bon Appétit"
"OSye8OO5TkM","Hozier - Movement (Official Video)","2018-11-14T16:58:26.000Z","UCdOcBpu5O2V0JhFFs9k-Ouw","HozierVEVO","10","18.17.11","Hozier,Movement,Universal-Island,Records,Ltd.,Alternative","1004515","55148","698","2498","https://i.ytimg.com/vi/OSye8OO5TkM/default.jpg","False","False","Listen to 'Movement' here: https://Hozier.lnk.to/MovementIN Follow Hozier  :  https://Hozier.lnk.to/FollowID  Hozier Store : https://Hozier.lnk.to/StoreIDMusic: HozierStarring: Sergei PoluninDirectors: UsProduction Comp: Academy FilmsProducer: Tabetha Glass-JackmanExecutive Producer: Leah JoyceExecutive Producer: Sheira Rees-DaviesDOP: Sebastian Wintero Choreographer: Sergei Polunin Edit House: TrimEditor: Vid PricePost Production: The MillVFX Supervisor: James Mac2D artist: Amit KambliColourist: James BamfordWith thanks to PanavisionMusic video by Hozier performing Movement. © 2018 Rubyworks Limited, under assignment to Universal Music Operations Limitedhttp://vevo.ly/5FWxxS"
"BXVpAoyM5oI","Watch Theresa May's Brexit statement in full","2018-11-14T21:34:24.000Z","UCoMdktPbSTixAyNGwb-UYkQ","Sky News","25","18.17.11","theresa may,breaking news,brexit,eu,michel barnier,exit,divorce,agreement,text,statement,downing street,number 10,prime minister,politics,uk,uk news,cabinet,boris johnson,sky news,jacob rees-mogg,remain,leave,ministers,mps,government","139377","634","1819","1370","https://i.ytimg.com/vi/BXVpAoyM5oI/default.jpg","False","False","Theresa May and her top team were locked in talks for more than four hours as they considered a draft divorce agreement.The Prime Minister said the Cabinet had backed her agreement and called it a decisive step. She said the decision was in the best interest of the entire UK. The 585-page divorce agreement has now been published in full, including details of a 'single customs territory'. Sky sources have said the cabinet is 'split', with up to 10 ministers opposed. SUBSCRIBE to our YouTube channel for more videos: http://www.youtube.com/skynews Follow us on Twitter: https://twitter.com/skynews and https://twitter.com/skynewsbreak Like us on Facebook: https://www.facebook.com/skynews Follow us on Instagram: https://www.instagram.com/skynews For more content go to http://news.sky.com and download our apps:  Apple https://itunes.apple.com/gb/app/sky-news/id316391924?mt=8 Android https://play.google.com/store/apps/details?id=com.bskyb.skynews.android&hl=en_GB"
"U77ZdnYi6Kw","Theresa May: Cabinet has backed draft Brexit plan - BBC News","2018-11-14T19:53:43.000Z","UC16niRr50-MSBwiO3YDb3RA","BBC News","25","18.17.11","bbc,bbc news,news,Full Statement Theresa May,May,Theresa,pm,prime minister,british prime ministers,may plan,brexit,brexit plan,brexit cabinet,theresa may,statement,theresa may statement,cabinet meeting,brexit news,brexit updates,brexit deal,brexit negotiations,breaking news,top news,uk news,breaking,latest,bbc brexit news","214435","1311","4182","3180","https://i.ytimg.com/vi/U77ZdnYi6Kw/default.jpg","False","False","Theresa May Full Statement: In a statement outside 10 Downing Street after a five-hour Cabinet meeting, Prime Minister Theresa May said that Cabinet has agreed the draft Brexit withdrawal agreement.Please subscribe HERE http://bit.ly/1rbfUogMrs May said she believed the draft agreement was the best that could be negotiated.#FullStatement #May #Brexit #BREXIT #BBC #NEWS"
"ru_8NLzxLj4","Waterloo Road - Finn Gets Kyle Kicked Out Of The School Show | Season 6 Episode 20","2018-11-14T17:18:48.000Z","UCQ38BO3MSPCzmWESXuUyXyw","Waterloo Road","43","18.17.11","Waterloo Road,Waterloo Road Drama,Official Waterloo Road,Waterloo Road Soap,School tv show,high school drama,old BBC show,UK shows,uk soap,Waterloo Road TV,waterloo road full episode,waterloo road full episodes,British tv,waterloo road streaming,watch tv online,waterloo road full season,waterloo road season 6,waterloo road series 6,waterloo road series 6 episode 20 full episode,waterloo road season 6 episode 20 watch online,waterloo road series 6 finale","132523","1709","50","559","https://i.ytimg.com/vi/ru_8NLzxLj4/default.jpg","False","False","Finn gets Kyle kicked out of the school pantomime causing drama on and off the stage. ▶ SUBSCRIBE FOR MORE: http://bit.ly/WaterlooRoadWaterloo Road is now on YouTube! Experience the emotion, the fights, the passion- right here with new videos every week!We’ve got all the best bits from every TV show just for you. Please subscribe to show us some love and find out every time we upload a new video. And remember to leave your comments in the box beneath each video – we’d love to hear your reactions to the all the drama!Want to own Waterloo Road?▶BUY: http://bit.ly/BuyWaterlooRoadTwitter: @WaterlooRoadFacebook: @officialwaterlooroad"
