video_id,title,publishedAt,channelId,channelTitle,categoryId,trending_date,tags,view_count,likes,dislikes,comment_count,thumbnail_link,comments_disabled,ratings_disabled,description
"x1pC76gulhE","Khesari Lal Yadav का #New छठ पूजा VIDEO SONG | A Khesari Ahire Ho | Superhit Bhojpuri Chhath Geet","2018-11-10T08:30:01.000Z","UCW91g3oy4NPPkhvptikjsbg","Venus Bhojpuri","10","18.12.11","Khesari lal yadav,a khesari ahire ho,a khesari ahire ho video song,a khesari ahire ho khesari lal,khesari lal chhath geet video,khesari lal chhath video song,khesari lal new chhath geet 2018,latest bhojpuri chhath songs 2018,chhath puja songs,chhath geet 2018,new bhojpuri chhath songs,भोजपुरी छठ गीत 2018,karab chhath ke,ka kami rahe khesariya ahir me,new,hit,geet,2018,khesari,khesari lal chhath geet,khesari lal chhath song,bhojpuri video 2018,venus bhojpuri","1926314","14560","1750","2378","https://i.ytimg.com/vi/x1pC76gulhE/default.jpg","False","False","Khesari Lal Yadav का #New छठ पूजा VIDEO SONG | A Khesari Ahire Ho | Superhit Bhojpuri Chhath GeetFor Bhojpuri Superhit App: http://bit.ly/2yU9upHFor Bhojpuri Romantic Songs : http://bit.ly/2eaBGN0Enjoy The Breathtaking Bhojpuri Video Songs : http://bit.ly/2e8ZJtcFor Best Bhojpuri Songs Jukeboxes : http://bit.ly/2ejzpNrEnjoy The Sensuous Bhojpuri Songs : http://bit.ly/2e3E4l7Blockbuster Bhojpuri Movies Collection : http://bit.ly/2ejEKolSong : A Khesari Ahire HoSinger : Khesari Lal Yadav Music : Ashish VermaLyrics : Pyarelal (Kavi Ji) & Azad Singh Conceptualize : Sonu Kumar PandeyVideo Director : Kishor Kumar*Set it as your CRBTAirtel Subscribers Direct Dial to Set as Hello tune 5432116644801Airtel Hellotune link https://www.airtelhellotunes.in/single/index/vcode/009166400004801Vodafone Subscribers for Caller Tune Direct Dial 53710757675Idea Subscribers for Dialer Tone Direct Dial 5678910757675BSNL (N & W) Subscribers Direct Dial 567007175831 to set BSNL TuneBSNL (E & S) Subscribers Direct Dial 5670010757675 to set BSNL TuneWynk : https://bit.ly/2D6YpU6Idea Music : https://playideamusic.mjamsmusic.com/songs/105576466For More Updates, Subscribe to;For Bhojpuri Superhit Movies & Music :https://www.youtube.com/c/VenusBhojpuriFor Hit & Latest Music:https://www.youtube.com/user/venus For Blockbuster Movieshttps://www.youtube.com/user/VenusMovies For Movies & Music in Regional Languages: https://www.youtube.com/user/venusregional For Heavenly & Peaceful Devotional Music: https://www.youtube.com/user/venusdevotionalFor Gujarati Latest Music & Movies: https://www.youtube.com/c/VenusGujaratiFor Punjabi & Haryanvi Superhit Music:https://www.youtube.com/c/VenusPunjabiHaryanviFor Devotional & Islamic Qawwalis https://www.youtube.com/user/venusislamicFor Best Nursery Rhymes:https://www.youtube.com/user/venuskidsworldAlso You Can:'LIKE' us on Facebook: https://www.facebook.com/venusentertainmenthttps://www.facebook.com/venusentertainment2 'FOLLOW' us on Twitter: https://twitter.com/venusmovies 'CIRCLE' us on Google+:https://plus.google.com/+VenusMoviesFOLLOW' us on Instagram: https://www.instagram.com/venusmovies/"
"KUd2KqT4oZY","Sembaruthi Breaking News |","2018-11-11T06:28:41.000Z","UCu37EYTCokmDZhxFAQ5prGA","Apple TV","22","18.12.11","zee Tamil,full episode,zee tv,zee tamil tv serials,zee tamil tv shows,zeetamil,zeetv zeetv,zee tamil serials best scenes,sembaruthi serial,sembaruthi,sembaruthi serial zee tamil,sembaruthi serial full episode,sembaruthi serial today,sembaruthi serial promo,sembaruthi promo,zee tv serial,sembaruthi serial zee tamil last episode zee Tamil,sembaruthi today full episode 218,sembaruthi today episode,sembaruthi serial today episode","94347","670","154","412","https://i.ytimg.com/vi/KUd2KqT4oZY/default.jpg","False","False","#sembaruthi#sembaruthipromo#zeetamilCredits - zeeSembaruthi Breaking News FAIR-USE COPYRIGHT DISCLAIM* Copyright Disclaimer Under Section 107 of the Copyright Act 1976, allowance is made for fair use for purposes such as review, criticism, commenting, news reporting, teaching, scholarship, and research. -This video has no negative impact on the original works (It would actually be positive for them)-This video is also for entertaining purposes.-It is not transformative in nature.-I only used bits and pieces of fair use image to get the point across where necessary.We make these videos with the intention of entertaining others. #tamilnadu#sembaruthitoday#sembaruthiepisode#zee5------------------------------------------------------------------------------------------------------------THANK YOU ALL"
"14I1zNDYglI","Crazy Car Video Song || Taxiwaala Video Songs || Vijay Deverakonda, Priyanka","2018-11-11T15:11:18.000Z","UCNApqoVYJbYSrni4YsbXzyQ","Aditya Music","10","18.12.11","Crazy Car Video Song,Taxiwaala Movie,Crazy Car,Maate Vinadhuga,Maate Vinadhuga Song,Taxiwaala,Taxiwaala Songs,Taxiwaala Telugu Movie,Taxiwaala Full Songs,Taxiwala Songs,Taxivala Movie Songs,Sid Sriram Songs,New Telugu Songs,Sid Sriram New Songs,Maate Vinadhuga Video Song,Taxiwaala Video Songs,Taxiwaala Promo Songs","191248","3748","148","86","https://i.ytimg.com/vi/14I1zNDYglI/default.jpg","False","False","Watch & Enjoy #CrazyCar Video Song From  #Taxiwala Telugu Movie. Starring #VijayDeverakonda, #PriyankaJawalkar and #MalavikaNair. Produced by SKN, Music Composed by Jakes Bejoy. Directed by Rahul Sankrityan. Under the Banner of  UV Creations and GA2 Pictures.Click here to share on Facebook- https://goo.gl/Yb85jsListen on Apple Music- https://goo.gl/DEPZCuAudio also available on:Saavn- https://goo.gl/J4g9AcWynk- https://goo.gl/eSuizHJioMusic- https://goo.gl/wDrZyeIdea Music- https://goo.gl/LPWNG9Spotify- https://goo.gl/intJVTBookMyShow- https://goo.gl/umMUXjSong: Crazy CarMovie: TaxiwaalaBanners : UV Creations and GA2 PicturesProducer : SKNDirector: Rahul SankrityanMusic: Jakes BejoyLyrics: Krishna Kanth Singer: Revanth KumarScreenPlay-Dialogues: Saikumar ReddyCast: Vijay Deverakonda, Priyanka Jawalkar and Malavika NairCinematographer: Sujith SarangEditor-Di Colorist: Sreejith SarangMusic Label: Aditya Music.    ------------------------------------------------------------------------------------------Enjoy and stay connected with us!!►Subscribe us on Youtube: http://bit.ly/adityamusic►Like us on Facebbok: http://www.facebook.com/adityamusic►Follow us on Twitter: http://www.twitter.com/adityamusic►Follow us on Instagram: https://www.instagram.com/adityamusicindia►Follow us on LinkedIn: http://bit.ly/2Pp6ze3►Circle us: https://plus.google.com/+adityamusicSUBSCRIBE Aditya Music Channels for unlimited entertainment:►For New Movies in HD: http://www.youtube.com/Adityamovies►For Songs with Lyrics: https://www.youtube.com/AdityaMusicNM...►For Devotional Songs: http://www.youtube.com/AdityaDevotional►For Kids Educational: http://www.youtube.com/AdityaKids→మా పాట మీ నోట Telugu Lyrical Songs - http://bit.ly/1B2EcJG→Latest Tollywood Lyric Video Songs - http://bit.ly/1Km97mg→Ever Green Classics - https://goo.gl/1fZEDy→Popular Jukeboxes - https://goo.gl/LNvAIo→Telugu Songs with Lyrics - https://goo.gl/7ZmgWT© 2018 Aditya Music India Pvt. Ltd."
"VByp0mx7vYE","இலவசம் தேவையா? மக்கள் கருத்து என்ன?  | Sarkar | Vijay","2018-11-09T12:37:42.000Z","UCjF5ecCYXFDvR0UY9GcfnoA","Cinema Vikatan","24","18.12.11","Sarkar,Vijay,sarkar scenes","486464","13024","551","1124","https://i.ytimg.com/vi/VByp0mx7vYE/default.jpg","False","False","In this Public Opinion, Chennai People talk in detail about the need for freebies from government , the impact , Sarkar Controversy & much more.CREDITS Host -  Krishna ,Camera - Karthick ,Edit - Sundar MathiSubscribe Cinema Vikatan : https://goo.gl/zmuXi6 Subscribe: https://goo.gl/zmuXi6  Audio launch: https://goo.gl/K0vCt2  Interviews and features: https://goo.gl/Kn0XEZ  Satellite chips: https://goo.gl/nePcRI   Popcorn Reel: https://goo.gl/Zem8tm  Latest cinema news: https://goo.gl/f7ca67  Latest trending videos: https://goo.gl/io1n8Ohttps://twitter.com/#!/Vikatanhttps://www.facebook.com/Vikatanwebhttps://soundcloud.com/vikatanhttp://www.vikatan.com"
"oTcV9k0bgRs","Live: IND Vs WI 3rd T-20 | Live Scores and Commentary | 2018 Series","2018-11-11T17:35:11.000Z","UCJrpiw6dS09Zx2Z8d9AFWDA","CricTalks","17","18.12.11","india score,india match,cricket score,live score,india cricket,highlights,virat kohli,match score,live stream,cricket news,live cricket,live commentary,odi,crictalks,crictalks2,india,cricket,indian team,match result,presentation,india win,ind,india cricket match,india match score,rohit sharma,2018,century,live cricket match today,ind vs wi,india vs windies,windies cricket,windies,Bumrah,T20 series,rishabh pant,3rd T20,Chennai,dhawan","758357","3999","739","12","https://i.ytimg.com/vi/oTcV9k0bgRs/default.jpg","False","False","Live: IND Vs WI 3rd T-20 | Live Scores and Commentary | 2018 SeriesFor Ad Spots and general inquiries: anatomizedtube@gmail.comCHENNAI: India will be aiming to complete a clean sweep when they take on a battered West Indies in the third T20 International on Sunday even while looking to test the bench strength.For the cricket loving fans in Chennai, they will certainly miss their 'favourite son' Mahendra Singh Dhoni, who is not a part of the T20 squad.Having sealed the series with a comprehensive win in the second T20I at Lucknow riding on skipper Rohit Sharma's brilliant ton, the home team would look to give reserve bench players like Shreyas Iyer, MS Washington Sundar and the uncapped Shahbaz Nadeem an opportunity before it embarks on the tour of Australia.The selectors decided to rest pacemen Jasprit Bumrah, Umesh Yadav and wrist spinner Kuldeep Yadav for Sunday's game, allow them to be in the best physical condition ahead of the tour to Australia. Medium-pacer Siddarth Kaul has been added to the squad.The pitch at Chepauk has been on the slower side in recent games but the square prepared for Sunday's game is expected to favour the batsmen.Skipper Rohit was at his best during the Lucknow T20I following up his exploits in the preceding ODI series but the other batsmen haven't made sizeable contributions despite facing an inconsistent West Indies attack.On Diwali eve, when Rohit Sharma’s firecracker century at Lucknow gave India an unassailable 2-0 lead in the three-match T20 international series, West Indies had been left with virtually nothing to play for in Chennai. Also, the Chepauk game is coming after a five-day gap due to the Diwali festivities — a seemingly painstaking wait for the visitors. In a full series comprising two Tests, five ODIs and three T20Is West Indies so far have managed to win just one game; the third ODI in Pune. They must have liked an early sign-off.And yet, from the players’ point of view the final T20I at Chepauk on Sunday is not an inconsequential fixture. No T20I in India can be inconsequential, especially with the next IPL only a few months away.The captain's opening partner Shikhar Dhawan, K L Rahul and Rishabh Pant among others would like to have a few more runs under the belt before the Australia tour.Local star Dinesh Karthik, whose heroics in the Nidahas Trophy finale in Sri Lanka are still fresh in memory, shone as India chased down a modest target in the first match after a mid-innings wobble and will be eager to shine in front of the home crowd.With Bumrah and Kuldeep, who have posed a challenge to the visiting batsmen being rested, Bhuvneshwar Kumar and the young Khaleel Ahmed will be expected to form the pace attack and provide early wickets.The spin department may see the return of Yuzvendra Chahal in the absence of Kuldeep while Krunal Pandya will expect to build on an impressive start to his international career.It remains to be seen if the team management chooses to give Chennai man Washington Sundar a go alongside Shreyas Iyer.The visitors, on the other hand have been at sixes and sevens in the T20s after posing an unexpected challenge to the Indians in the ODIs, especially against the skills of Bumrah and Kuldeep.The absence of regular openers (Chris Gayle and Evin Lewis) and the decision to tinker with the combination at the top hasn't helped their cause either. Skipper Carlos Brathwaite admitted they had to make do with the resources available and the team will aim to end the series with a consolation win.Established names like Kieron Pollard, Darren Bravo and Denesh Ramdin haven't fired and the impressive Shimron Hetmyer pushed up the order hasn't found the going easy to add to the Windies' woes.Among the bowlers, Oshane Thomas has impressed the most with his pace and ability to take wickets but has lacked support from the others.Brathwaite, who rose to fame after smashing Ben Stokes for four sixes in the final over of the 2016 ICC World T20 final in Kolkata, will be eager to showcase his abilities and thereby inspire his men, low on morale, to raise their game against a dominant Indian side in the concluding match of the tour to secure a consolation win.Squads:India: Rohit Sharma (captain), Shikhar Dhawan, KL Rahul, Dinesh Karthik (wicket-keeper), Manish Pandey, Shreyas Iyer, Rishabh Pant (wicket-keeper), Krunal Pandya, Washington Sundar, Yuzvendra Chahal, Bhuvneshwar Kumar, Khaleel Ahmed, Shahbaz Nadeem, Siddarth Kaul.West Indies:  Carlos Brathwaite (Capt), Darren Bravo, Shimron Hetmyer, Shai Hope, Obede McCoy, Keemo Paul, Khary Pierre, Kieron Pollard, Nicholas Pooran, Rovman Powell, Denesh Ramdin, Sherfane Rutherford, Oshane Thomas."
"3EIewRizgLA","வாணி ராணி - VAANI RANI - Episode 1719 - 10-11-2018","2018-11-10T16:30:00.000Z","UCxhPXCaIGhyt2HOrJkoVuGA","RadaanMedia","24","18.12.11","Vaani rani,rani,Radhika in funny character,venu aravind,SunTV,VaniRani,vani,vaani,Radhika's dual role serial,Ranimma veetu kuripu,Radhika as lawyer in serial,radikaa,rathika,Radhika's new","404416","2410","410","201","https://i.ytimg.com/vi/3EIewRizgLA/default.jpg","False","False","Subscribers Us for All Episode:https://www.youtube.com/show/vanirani/UCxhPXCaIGhyt2HOrJkoVuGA?sub_confirmation=1aa Connect with Radaan Media online: https://www.youtube.com/user/RadaanMediaVisit our WEBSITE: www.radaan.tvLike us on FACEBOOK: https://www.facebook.com/RadaanMediaWorksIndiaLtd?ref=hlFollow us on TWITTER:  https://twitter.com/RadaanTVTamil"
"KO4KgxT92iw","Working Husband Vs Caring Wife | Husband Vs Wife | Samsaram Athu Minsaram | Mini Series - #5","2018-11-10T11:44:09.000Z","UC6IJFR0fWCBGhQnMKZQ-01g","Chennai Memes","23","18.12.11","working husband vs wife,husband vs wife prank,husband vs wife fight,thala diwali vs years later,wife with lie detector,samsaram adhu minsaram full movie tamil,mini series,pregnancy,pregnant,pregnant wife expectation vs reality tamil,entertainment,episode 5,husband wife comedy,trending videos,sarkar controversy scene,sarkar controversy news,husband wife love status,funny videos,newly married vs years later,chennai memes,jump cuts,paridhabangal madras,nettv4u","220192","12319","147","730","https://i.ytimg.com/vi/KO4KgxT92iw/default.jpg","False","False","#SamsaramAthuMinsaram #MiniSeries #ChennaiMemesWorking Husband Vs Wife | Husband Vs Wife | Samsaram Athu Minsaram | Mini Series - #5CASTFabieanArthi SubashHemaSCRIPT & DIRECTIONDhilip TheodoreCAMERAFrancis ShajanEDITKiruba Shankar PRODUCERGautham GovindaramanCheck us out on Facebook at: https://www.facebook.com/memeschennaiOn twitter as well at:https://twitter.com/MemesChennaioh wait.. Even on Instagram at:https://www.instagram.com/chennaimemes"
"OULHz-DDpMA","Silsila Badalte Rishton Ka - 9th November 2018 - सिलसिला बदलते रिश्तों का","2018-11-10T06:31:14.000Z","UC55IWqFLDH1Xp7iu1_xknRA","Colors TV","24","18.12.11","Colors TV,colorstv,hindi shows,VOOT,new promo,clips,3 minute clip,Silsila voot clip,Silsila,drama,extra marital affair,sislsila,badalte rishton ka,Silsila full show,childhood friend,Silsila Badalte Rishton Ka,Drashti Dhami,Nandini,Shakti Arora,Kunal,Aditi Sharma,Dr Mauli,Rajdeep,Abhinav Shukla,love story,husband,wife,cheating,harassment,#silsila","295577","904","166","93","https://i.ytimg.com/vi/OULHz-DDpMA/default.jpg","False","False","To watch the full episode of 'Silsila Badalte Rishton Ka' anytime, Download the Voot app now or Visithttps://www.voot.com/shows/silsila/1/606786/mishti-is-electrocuted/650719Two best friends, one broken marriage, and a dangerously addictive affair! Follow the dramatic twists and turns in the lives of Mauli, her husband Kunal, and her best friend Nandini. What happens when the unhappily married Nandini realises that the mutual admiration between her and Kunal has turned into fatal attraction? Will friendship be forsaken for love? Will one woman's happiness becomes another woman's heartbreak? Find out in Silsila Badalte Rishton Ka."
"pPN8iFQPLsY","Avandu Gaadi Doddadirabahudu Aadre Nindu Adey Doddadu | Sharan | Chikkanna | Ashika | Raambo 2","2018-11-10T14:25:40.000Z","UCzR_54cXZM6JoUPz4jfZUPg","Anand Audio Kannada Comedy","23","18.12.11","rambo 2,rambo 2 full movie kannada,rambo 2 kannada song,rambo 2 dj song,rambo 2 comedy,rambo 2 climax,rambo 2 chikkanna comedy,rambo 2 kuri prathap comedy,rambo 2 sharan comedy,rambo 2 comedy videos,rambo 2 hd,rambo 2 hd movie,rambo 2 hd video songs,rambo 2 hd kannada movie arjun janya all songs,ashika comedy,sharan comedy,sadhu kokila comedy scenes,sadhu kokila rambo 2 comedy scenes,sadhu kokila rambo 2 entry scene","386621","1841","134","41","https://i.ytimg.com/vi/pPN8iFQPLsY/default.jpg","False","False","Watch Full HD Avandu Gaadi Doddadirabahudu Aadre Nindu Adey Doddadu Comedy Scene from the movie Raambo - 2. Starring: Sharan, Ashika Ranganath, Ravishankar, Chikkanna, Sadhu Kokila & Others Exclusive Only On Anand Audio COMEDY Channel..!!! ----------------------------------------­--------------------------------------------------------You can also Download Anand Audio App https://play.google.com/store/apps/details?id=com.anandaudio.app----------------------------------------­--------------------------------------------------------*YouTube: http://goo.gl/JtObUW                  **Twitter: https://twitter.com/aanandaaudio            **Google+: https://plus.google.com/+AnandAudio         **Facebook: https://www.facebook.com/aanandaaudio *----------------------------------------­--------------------------------------------------------You can also download this album fromiTunes :  https://apple.co/2vUrQ7CSaavn :  https://bit.ly/2qriufVHungama :  https://bit.ly/2EzJJtYWynk :  https://bit.ly/2IU0qqeidea :  https://bit.ly/2qFLAcuListen & Download in HD on JioMusic :  http://bit.ly/2CQJiP6Google Music: https://play.google.com/store/music/album?id=Buim7in6hk7q6n32r3hmfyskuceGaana Music: https://bit.ly/2GS5Sc1Jukebox Link: https://youtu.be/Rp5UekgWf_4 ----------------------------------------­--------------------------------------------------------Film: RAAMBO-2 Music:  ARJUN JANYAStarcast: SHARAN, AASHIKA Director: ANIL KUMARCreative Head: THARUN KISHORE SUDHIRProducer: SHARAN.G.K, ATLANTA NAGENDRABanner: LADOO CINEMA HOUSE / DE ARTE STUDIOSRecord Label: AANANDA AUDIO VIDEO----------------------------------------­--------------------------------------------------------01:Song: Dum Maro Dum/Singer: Aditi Sagar02:Song: Yavva Yavva/ Singer: Vijay Prakash03:Song: Chuttu ChuttuSinger: Ravindra Soragavi, Shamitha Malnad04:Song: Bit Hogbeda/Singer: Mehboob Saab 05:Song: Elli Kaan Ellikaaneno/Singer: Puneeth Rajkumar06:Song: Bellege Bellege/Singer: Chikkanna---------------------------------------­--------------------------------------------------------Operator Codes1)To Set Dum Maro Dum as Your Caller Tune!!!AirTel Users Dial 5432116459087Vodafone Users Dial 53710089620Idea Users Dial 5678910089620Docomo Users Dial 54321110089620BSNL Users SMS BT 10089620 to 56700 Operator Codes2) To Set Yavva Yavva as Your Caller Tune!!!AirTel Users Dial 5432116484833Vodafone Users Dial 53710247822Idea Users Dial 5678910247822Docomo Users Dial 54321110247822BSNL Users SMS BT 10247822 to 56700 Operator Codes3) To Set Chuttu Chuttu as Your Caller Tune!!!AirTel Users Dial 5432116505244Vodafone Users Dial 53710378196Idea Users Dial 5678910378196Docomo Users Dial 54321110378196BSNL Users SMS BT 10378196 to 56700 Operator Codes4) To Set Bit Hogbeda as Your Caller Tune!!!AirTel Users Dial 5432116512834Vodafone Users Dial 53710401577Idea Users Dial 5678910401577Docomo Users Dial 54321110401577BSNL Users SMS BT 10401577 to 56700 Operator Codes5) To Set Elli Kaan Ellikaaneno as Your Caller Tune!!!AirTel Users Dial 5432116517719Vodafone Users Dial 53710424395Idea Users Dial 5678910424395Docomo Users Dial 54321110424395BSNL Users SMS BT 10424395 to 56700 Operator Codes6) To Set Bellege Bellege as Your Caller Tune!!!AirTel Users Dial Coming SoonVodafone Users Dial Coming SoonIdea Users Dial Coming SoonDocomo Users Dial Coming SoonBSNL Users SMS BT Coming Soon to 56700 ----------------------------------------­--------------------------------------------------------Anand Audio is a largest music company in Kannada has released audio of super hit movies like Yejamana, Snehaloka, Chandra Chakori, Tavarige Baa Thangi, Mungaru Male, Milana, Jackie, Maanikya, Kotigobba 2, Chowka, Chakravarthy & others. We have worked with almost big stars like Sudeep, Puneeth Rajkumar, Yash, Dharshan, Radhika Pandith, Sharan, Sadhu Kokila, Shivrajkumar, Upendra & others.----------------------------------------­--------------------------------------------------------VISIT OUR OTHER CHANNELS:-Anand Audio Devotional: https://goo.gl/73RHJRAnand Audio NaaduNudi: https://goo.gl/UCLZLjAnand Audio Evergreen: https://goo.gl/dLSjmKAnand Audio Tulu: https://goo.gl/v4cgYqAnand Audio Entertainment: https://goo.gl/G2yx6XAnand Audio Kannada Comedy: https://goo.gl/UFXUhq"
"a3LTNs5IzQU","നീതുവിന്റെ രഹസ്യ കാമുകനെ കയ്യോടെ പിടികൂടി കാവ്യയും ശ്രീകുട്ടിയും.","2018-11-10T05:35:23.000Z","UCp_r6Z-Oh0YTf-ym71z5Nqg","Asianet","24","18.12.11","asianet,malayalam channel,tv show,malayalam serial,entertainment,Kasthooriman || Serial || Today at 8:30 PM || Asianet,Kasthooriman,Kasthooriman asianet,Kasthooriman serial,Watch Kasthooriman Serial,Kasthooriman Latest Episode,Kasthooriman Full Episode,Kasthooriman malayalam serial,Kasthooriman online,watch Kasthooriman serial online,Kasthooriman Serial Online,Kasthooriman latest episode hotstar,Kasthooriman promo,kasthooriman serial promo","253752","616","76","212","https://i.ytimg.com/vi/a3LTNs5IzQU/default.jpg","False","False","Kasthooriman || Serial || Today at 8:30 PM || Asianet Watch All Shows: http://www.hotstar.com/asianetFollow Us On Facebook - https://www.facebook.com/Asianet                        Instagram - https://www.instagram.com/asianet                        Twitter - https://twitter.com/asianet"
