video_id,title,publishedAt,channelId,channelTitle,categoryId,trending_date,tags,view_count,likes,dislikes,comment_count,thumbnail_link,comments_disabled,ratings_disabled,description
"v_1aEcNLTVs","SODA VS WATER FILTER!! (WHAT WILL HAPPEN?)","2018-11-01T21:38:05.000Z","UCtNBFUsxj2YVbEc5HquzFqg","Carter Sharer","24","18.17.11","filter soda,carter,sharer,can you filter soda,soda,brita filter,water filter,carter sharer,coca cola,coke,carl and jinger,lizzy sharer,fanta,mountain due,lizzy,brita filter test,taste test,soda vs,soda vs filter,sharer fam,share the love","1157891","10714","7048","5240","https://i.ytimg.com/vi/v_1aEcNLTVs/default.jpg","False","False","WHAT HAPPENS WHEN YOU FILTER COKE THROUGH A WATER FILTER??Today Carter Sharer and Lizzy Sharer tried to filter water through a Brita filter. This water filter is meant to filter water. But with the help of Carl and Jinger they are going to try to filter Coca Cola through a water filter. Carter has coke soda, Fanta soda, and mountain due soda. He will try and filter all of these soda drinks through the water filter to see what will happen. Comment #Soda if you think the coca-cola will filter to water.❇️OTHER EPIC VLOGS ❇️🍭CANDY DATE CHALLENGE WITH MY CRUSH!! (BLINDFOLDED) https://youtu.be/9V2dq-u0-Is🎃Try Not To Sink the World's Biggest First Swimming Pool Pumpkin Patch Boat! https://youtu.be/O4pzI3GqSuo⛵️RC BOAT VS ORBEEZ SWIMMING POOL!! https://youtu.be/o5VO9cU2uJ4🍔We tried to EAT food UNDERWATER!!https://youtu.be/1IJ6RzqFof8----------------------------------------------------------------------------------------------------------WANT A PERSONALIZED SHOUTOUT?!Carter https://www.bookcameo.com/cartersharer Liz https://www.bookcameo.com/lizzysharer-----------------------------------------------------------------------------------------------------------Follow Us For a Chance to WIN Some Epic Stuff!📷INSTAGRAM → @CarterSharer https://goo.gl/DkjB5J📘FACEBOOK → CARTER SHARER OFFICIAL https://goo.gl/WM7mBu📷INSTAGRAM → @LizzySharer https://goo.gl/jALBqj📘FACEBOOK → LIZZY SHARER https://goo.gl/AX1d4t📷INSTAGRAM → @OtterSharer https://goo.gl/PX9J43📘FACEBOOK → OTTER SHARER https://goo.gl/Z8vyatJoin the Dream Team and Subscribe to my channel! https://goo.gl/XjjCA8-----------------------------------------------------------------------------------------------------------Business Inquiries: Cartersharerbiz@gmail.comWARNING: This video is only for entertainment purposes. Do not attempt to recreate any of the acts in this video, as they may be dangerous if not done correctly, and could result in serious injury. If you rely on the information portrayed in this video, you assume the responsibility for the results. Have fun, but always think ahead, and remember that every project you try is at YOUR OWN RISK.This footage is property of Dream Team Studios LLC and is not allowed to be repurposed without written consent from Dream Team Studios LLC. For any requests from media contact us at Cartersharerbiz@gmail.com"
"U0ih3FriG1k","Carly Rae Jepsen - Party For One","2018-11-01T13:00:07.000Z","UCtKuVNj4wVrZvTfxPxAUHcQ","CarlyRaeJepsenVEVO","10","18.17.11","Carly,Rae,Jepsen,Party,For,One,Silent,Records,IGA,Pop","6103361","109860","10161","8877","https://i.ytimg.com/vi/U0ih3FriG1k/default.jpg","False","False","Carly Rae Jepsen’s “Party For One” is available now!http://smarturl.it/CRJPartyForOneDirected by: Bardia Zeinali Follow Carly Rae Jepsenhttps://www.instagram.com/carlyraejepsen/https://twitter.com/carlyraejepsenhttps://www.facebook.com/Carlyraejepsen/#CarlyRaeJepsen #PartyForOneMusic video by Carly Rae Jepsen performing Party For One. © 2015 School Boy/Interscope Records © 2015 604 Records for Canada onlyhttp://vevo.ly/jSxbOD"
"0w3XwPVxcsw","Anuel AA - Ella Quiere Beber (Remix) ft. Romeo Santos","2018-11-01T16:00:00.000Z","UC05eluGxsI8_xf5uRC-J26Q","AnuelVEVO","10","18.17.11","anuel,anuel aa,ella quiere beber,quiere beber,real hasta la muerte,los iluminati,free anuel,sale,de,la,carcel,music,music video,vydia,Quiere Beber (Video Oficial),Anuel AA,Latino,Single,2018,Real Hasta La Muerte,LLC,Nuno Gomes,Emmanuel Gazmey,vevo,remix,romeo santos,romeo,santos,ella quiere beber remix","62842305","885491","37481","30837","https://i.ytimg.com/vi/0w3XwPVxcsw/default.jpg","False","False","Anuel AA - Ella Quiere Beber (Remix) ft. Romeo Santos |  © 2018 Real Hasta La Muerte."
"p_mlSq7ufvc","BROTHER vs. BROTHER GYMNASTICS BATTLE!","2018-11-01T21:26:03.000Z","UCwD4x63A9KC7Si2RuSfg-SA","Lucas and Marcus","24","18.17.11","Lucas and Marcus,Dobre Twins,Dobre Brothers,Marcus and Lucas,Gymnastics,Dance,Challenges,Music,Rap,Pranks,Grocery Store,Cars,Reactions,Makeup,Make-up,Games,Food,Family,Collabs,Animals,New,backflip,brother battle,gymnastics battle,twins battle,twin vs twin","1487591","34230","10284","14410","https://i.ytimg.com/vi/p_mlSq7ufvc/default.jpg","False","False","THIS WAS SO INTENSE!WE’RE GOING ON A 20 CITY TOUR! ➡ https://bitly.com/DobreTourNEW MERCH! ➡ http://bit.ly/COPDobreMerchWE POST TUESDAY,THURSDAY, & SUNDAY!TURN OUR POST NOTIFICATIONS ON FOR A SHOUTOUT!SUBSCRIBE TO THE DOBRE VLOG CHANNEL! https://www.youtube.com/channel/UCC3OGYxHwV8pB5yLobw9KdASUBSCRIBE TO THE LUCAS AND MARCUS CHANNEL!https://www.youtube.com/user/TwiNboTzVids Lucas's Social Media  Instagram: https://www.instagram.com/lucas_dobre/Twitter: https://twitter.com/dobrelucasFacebook: https://www.facebook.com/dobrelucas/Snapchat: lucas_dobreMusical.ly: DobreTwins Marcus's Social Media  Instagram: https://www.instagram.com/marcusdobreTwitter: https://twitter.com/dobremarcusFacebook: https://www.facebook.com/marcusdobre/Snapchat: marcusdobre1Musical.ly: DobretwinsFollow the Dobre Brothers: Instagram: https://www.instagram.com/dobrebrothers/BIZ - dobrebrothersmgmt@gmail.com THANKS FOR WATCHING!BROTHER vs. BROTHER TWIN GYMNASTICS BATTLE!https://www.youtube.com/user/TwiNboTzVids"
"zMCVp6INpnw","Lil Peep - Runaway (Official Video)","2018-11-01T13:30:04.000Z","UC0gOw4iy-6HwO01q-gA1B0Q","Lil Peep","10","18.17.11","Lil Peep,COWYS2","7744944","488775","5824","38721","https://i.ytimg.com/vi/zMCVp6INpnw/default.jpg","False","False","'Come Over When You're Sober, Pt. 2' Out November 9:http://smarturl.it/COWYS2Runaway off 'Come Over When You're Sober, Pt. 2' out now:http://smarturl.it/LilPeepRunawayLIZA'S DIRECTOR'S NOTES:I'm so proud to have been given the opportunity to collaborate with Steven Mertens on the video for Runaway. It has allowed me to make something beautiful for my son -- in his honor.  Early in the process, many of us agreed that Runaway would be a great song to release as a single for COWYS 2.  It is a powerful song that tells the story of how Gus--aka Lil Peep--had decided to leave his apartment in LA, but he didn't want to come home to live in Long Beach, either.  So, he had gone to stay in London.  That was a productive and happy time for him--working with friends like Smokeasac and ILoveMakonnen.This video tells that part of Gus's story.  The story is told using many of Gus's drawings, from different periods of his life.  After transforming into the wonderful flaming-haired character that Gus drew, himself, he flies away from LAX to London--to make music with some of his best friends.I know you will enjoy watching it.  You will see different things each time you watch.  His drawings.  His tattoos.  His friends.  The house where he really lived.  And his dog, Taz, the legend./////Directed by Liza Womack & Steven Mertens (@stevenstmertens)Special Thanks to Smokeasac and ILoveMakonnenAdditional Footage provided by Richard Stilwell/////http://www.lilpeep.party/http://twitter.com/lilpeephttp://instagram.com/lilpeephttp://soundcloud.com/lil_peephttp://facebook.com/lilpeepmusic"
"U68MJz9DrI4","Gucci Mane, Bruno Mars, Kodak Black - Wake Up in The Sky [Official Music Video]","2018-10-31T14:17:10.000Z","UCSugZEYrWbzqIWGD195V-YA","OfficialGucciMane","10","18.17.11","officialguccimane,gucci mane,gucci,mane,atlantic records,atlantic,guwop,radric davis,hip hop,rap,i get the bag,both,curve,met gala,solitaire,real rich,el gato,mr. davis,droptopwop,atlanta,DN6WWu_KEQs,UdvpUjCmLC4,Wake Up In The Sky,Bruno Mars,Kodak Black,Music Video,Official Music Video,mjaayCARwro,zcWqllTtns4,gucci mane bruno mars kodak black,smoke til I'm high,drink til I'm drunk,You cant tell me I aint fly,I know Im super fly,wuits,gucci bruno kodak","28066394","757115","24307","39220","https://i.ytimg.com/vi/U68MJz9DrI4/default.jpg","False","False","The official music video for Gucci Mane, Bruno Mars, and Kodak Black’s “Wake Up In The Sky” – available now!Stream/Download - https://guccimane.lnk.to/WakeUpInTheSkyAYDirector: Bruno Mars & Florent DechardProduced By Jeremy SullivanColored by: olio creativeSubscribe for more official content from Gucci Mane:https://Atlantic.lnk.to/GMsubscribeFollow Gucci Manehttp://GucciManeOnline.comhttp://Twitter.com/Gucci1017http://Facebook.com/GucciManehttp://Instagram.com/LaFlare1017Follow Bruno Marshttp://www.brunomars.comhttp://www.instagram.com/brunomarshttp://www.twitter.com/brunomarshttp://www.facebook.com/brunomarsFollow Kodak Blackhttps://officialkodakblack.com/https://twitter.com/KodakBlack1khttps://facebook.com/TheRealKodakBlackhttps://instagram.com/kodakblackhttps://soundcloud.com/kodak-blackThe official YouTube channel of Atlantic Records artist Gucci Mane. Subscribe for the latest music videos, performances, and more.#gucci #kodak #bruno #guccimane #brunomars #kodakblack #WakeUpInTheSky #WUITS #MusicVideo #AtlanticRecords #atlantic"
"C5YeOc0N6Ao","SPIES IN DISGUISE | OFFICIAL HD TRAILER #1 | 2019","2018-11-01T13:00:03.000Z","UCzBay5naMlbKZicNqYmAQdQ","20th Century Fox UK","22","18.17.11","Animation,Spies,Secret Agent,Will Smith,Tom Holland,Rashida Jones,Karen Gillan,DJ Khaled,Goldie Hawn,Ice Age,Rio,Ferdinand","2233456","39450","3119","6115","https://i.ytimg.com/vi/C5YeOc0N6Ao/default.jpg","False","False","IN CINEMAS 2019 Super spy Lance Sterling (Will Smith) and scientist Walter Beckett (Tom Holland) are almost exact opposites. Lance is smooth, suave and debonair. Walter is… not. But what Walter lacks in social skills he makes up for in smarts and invention, creating the awesome gadgets Lance uses on his epic missions. But when events take an unexpected turn, Walter and Lance suddenly have to rely on each other in a whole new way. And if this odd couple can’t learn to work as a team, the whole world is in peril. SPIES IN DISGUISE is an animated comedy set in the high-octane globe-trotting world of international espionage.Follow us on Twitter: https://twitter.com/20CenturyFoxUK Like us on Facebook: - https://facebook.com/20thCenturyFoxUK - https://www.facebook.com/SpiesInDisguiseUK/Follow us on Instagram: https://www.instagram.com/20centuryfoxuk"
"lSmEVq5YMMo","Fears","2018-10-31T22:43:19.000Z","UCn1XB-jvmd9fXMzhiA6IR0w","Domics","23","18.17.11","domics,animation,halloween,fears,scared,horror,boo","3254000","166645","1631","25058","https://i.ytimg.com/vi/lSmEVq5YMMo/default.jpg","False","False","If you're an animator, artist, gamer, or entertainer, then join us at Channel Frederator Network: https://frdr.us/Dom   Additional Animators:Alaylay: https://twitter.com/alaylays | https://instagram.com/alaylaysJakeuro: https://twitter.com/jak_euro | https://www.youtube.com/jakeuroJomm: https://twitter.com/FlashJomm | https://www.instagram.com/jommish/Ehlboy: https://www.youtube.com/ehlboyOriginal Music by Christopher CarloneYT: https://www.youtube.com/carlonecWebsite: http://www.christophercarlone.com/PO BOX:Domics11-4040 Creditview Rd.Suite #317Mississauga ON L5C 3Y8CanadaFollow me!TUMBLR: http://www.domics.meFACEBOOK: http://www.facebook.com/domics.meINSTAGRAM: https://www.instagram.com/omnomdomz/"
"whlfOVtJlZ8","Introducing the new iPad Pro — Apple","2018-10-30T15:14:57.000Z","UCfJcxY7o1UjUQE4oObwritw","Apple United Kingdom","28","18.17.11","Apple,Apple United Kingdom,iPad,Pro,computer,iOS,Pencil,tablet,Face ID,wireless charging,powerful,power,Photoshop,A12X Bionic chip,Smart Keyboard Folio","255842","4779","1446","0","https://i.ytimg.com/vi/whlfOVtJlZ8/default.jpg","True","False","iPad Pro is all new, all screen and all powerful. Now with an edge-to-edge Liquid Retina display, Face ID and an A12X Bionic chip, and introducing the new Apple Pencil and Smart Keyboard Folio. It’s like a computer, unlike any computer.Learn more at https://apple.co/2JsJlRS"
"b9HpOAYjY9I","Martin Garrix feat. Mike Yung - Dreamer (Official Video)","2018-11-01T10:58:24.000Z","UC5H_KXkPbEsGs0tFt8R35mA","Martin Garrix","10","18.17.11","martin garrix dreamer,dreamer,martin garrix,martin garrix mike yung,mike yung,martin garrix mike yung dreamer,dreamer official video,dreamer martin garrix,music video,waiting for tomorrow,animals,new york,subway singer,america got talent,stmpd rcrds,stmpd,rcrds,david guetta,calvin harris,like i do,khalid,ocean,high on life,shawn mendes,maroon 5,burn out","5862327","161162","2902","8018","https://i.ytimg.com/vi/b9HpOAYjY9I/default.jpg","False","False","Martin Garrix feat. Mike Yung - Dreamer (Official Video)♫ Dreamer feat. Mike Yung is out now: http://stmpd.co/MGMDRIDMy new track Dreamer with Mike Yung is out now! Hope you like this one as much as I do!Turn on/off subtitles for lyrics!Follow Martin Garrix: Facebook: http://facebook.com/MartinGarrixTwitter: http://twitter.com/MartinGarrixInstagram: http://instagram.com/MartinGarrixYouTube: http://youtube.com/MartinGarrixFollow Mike YungFacebook: https://www.facebook.com/mikeyungofficial/Twitter: https://twitter.com/mikeyungInstagram: https://www.instagram.com/mikeyung/YouTube: https://www.youtube.com/channel/UCOJS8--a_csEJLXXjqhTIPgDirected by Damian KarszniaCinematographer Julian Lomaga Cam Op Amsterdam: Mees Roozen #Garrix #MikeYung #Dreamer #MartinGarrix #Martin #Mike #Yung #Official #Video #ImADreamer #SomethingToBelieveIn #STMPDRCRDS"
"tA10XayhSOM","HAZBIN HOTEL- LET'S MISBEHAVE -(CLIP)-","2018-11-01T06:57:20.000Z","UCzfyYtgvkx5mLy8nlLlayYg","Vivziepop","1","18.17.11","Vivziepop,Zoophobia","2480858","161840","1361","19292","https://i.ytimg.com/vi/tA10XayhSOM/default.jpg","False","False","SUPPORT HAZBIN ON PATREON: https://www.patreon.com/VivienneMedranoBUY MERCH: https://sharkrobot.com/collections/hazbin-hotel. DOWNLOAD THE SONG: ITUNES: https://goo.gl/KQckSA AMAZON: https://goo.gl/3UPrnf SPOTIFY: https://goo.gl/Ezqtrr The infamous Radio Demon shows up at the Hotel, for what purpose? Wait and see.HAZBIN HOTEL ON TWITTER: https://twitter.com/HazbinHotel"
"wLoYIBEZEfw","Slipknot - All Out Life [OFFICIAL MUSIC VIDEO]","2018-10-31T16:13:14.000Z","UCOJZ1tna8yj8mAEITPkHNCQ","Slipknot","10","18.17.11","Slipknot (Musical Group),metal,Corey Taylor (Musical Artist),Jim Root (Guitarist),Mick Thompson (Guitarist),Roadrunner Records (Record Label),official video,lyrics,aol,all out life,new song,2018,new video,rock,hard rock","12917419","586419","17214","55641","https://i.ytimg.com/vi/wLoYIBEZEfw/default.jpg","False","False","Directed by M. Shawn CrahanGet All Out Life : https://slipknot1.lnk.to/alloutlifeSite: http://slipknot1.comiTunes: http://itunes.com/slipknotFacebook: http://facebook.com/slipknotTwitter: http://twitter.com/slipknotInstagram: http://instagram.com/slipknotTumblr: http://slipknot.tumblr.com Lyrics:What a world/the horizon’s coming like a hell bent killing machineCan’t afford to be the goddamn wreckage- burn it all again at a million degreesCalling all the adamant upper-level undefeated counterfeit cunts w/ a reason to fearThrow away all the meaningless shit that’s clinging/the Enemy is hereI said stop… give it to 3- I’m going to show you how to do it if you know what I meanOne By One Against- Give Me The NameAll You Shiny Pretty Never-Wills Ruined The GameWe Hold All The Keys So The Chains Shouldn’t Hold YouI Know You Heard Me- I Fucking Told YouOLD DOES NOT MEAN DEAD-NEW DOES NOT MEAN BESTNO HARD FEELINGS-I’M TIRED OF BEING RIGHT ABOUT EVERYTHING I’VESAIDYOURS DOES NOT MEAN MINE-KILL DOES NOT MEAN DIEWE ARE NOT YOUR KIND-NO EXCUSESI CHALLENGE YOU TO ALL-OUT-LIFEDrop that shit and put it on a pedestal-children are afraid of the GodsRaise your hands and show me what’s impossibleThat makes us even-never tell me the oddsWhat a Bore/I’m getting stuck in a metaphor/I don’t want to go to sleepI need a breakdown quick in negotiations-get it all together and remember to seetheStop… give it to 3- I’m going to show you how to do it if you know what I meanDrive By Violence-More Of The SameI Can See Where You’re Going And I’m Really AshamedDo You Think When You Act Or Just Act Like You’re Thinking?I Got To Know Now- You Better Tell MeOLD DOES NOT MEAN DEAD-NEW DOES NOT MEAN BESTNO HARD FEELINGS-I’M TIRED OF BEING RIGHT ABOUT EVERYTHING I’VESAIDYOURS DOES NOT MEAN MINE-KILL DOES NOT MEAN DIEWE ARE NOT YOUR KIND-I CHALLENGE YOU TO ALL-OUT-LIFEWe are gathered here today to get it right… repeat after meI WILL NOT CELEBRATE MEDIOCRITY- I WILL NOT WORSHIP EMPTYSHELLSI WILL NOT LISTEN TO WORTHLESS NOISESI WILL NOT SUBJECT MYSELF TO SELECTED PREDICTABLE CHOICESMY TIME-MY ATTENTION-MY QUALITY SHOULD NOT BE BOUGHT ANDSOLDFOR CONVENIENCE’S SAKE… EVERWE ARE NOT YOUR KINDOLD DOES NOT MEAN DEAD-NEW DOES NOT MEAN BESTNO HARD FEELINGS-I’M TIRED OF BEING RIGHT ABOUT EVERYTHING I’VESAIDYOURS DOES NOT MEAN MINE-KILL DOES NOT MEAN DIEPAY ATTENTION-IT’S GOING TO BE AWHILE TIL I REALLY FEEL ALRIGHTOLD DOES NOT MEAN DEAD-NEW DOES NOT MEAN BESTNO HARD FEELINGS-I’M TIRED OF BEING RIGHT ABOUT EVERYTHING I’VESAIDYOURS DOES NOT MEAN MINE-KILL DOES NOT MEAN DIEWE ARE NOT YOUR KIND-NO EXCUSESI CHALLENGE YOU TO ALL OUT FUCKING LIFE"
"csdpfoCZWQM","GLOOM TRIES CUPPING FOR THE FIRST TIME","2018-10-30T19:02:56.000Z","UC6IijBsVf2PlWo_uq6P9wQw","Gloom","24","18.17.11","i tried cupping,cupping,what is cupping,chinese medicine,chinese traditional medicine,cupping massage,cupping therapy,fire cupping,gloom,gloomgames,kassie,2018,gloom tries cupping for the first time,cupping session,health,therapy,funny","3009759","44984","2869","7062","https://i.ytimg.com/vi/csdpfoCZWQM/default.jpg","False","False","I've been experimenting with Traditional Chinese Medicine lately and really wanted to try fire cupping for my poor stiff back. 10/10 would silently freak out again, hbu?SUBSCRIBE HERE: https://www.youtube.com/channel/UC6IijBsVf2PlWo_uq6P9wQw?sub_confirmation=1My INSTAGRAM: http://www.instagram.com/gloomykassieMy TWITTER: http://www.twitter.com/gloomykassieWatch Videos with ITSFUNNEH: https://www.youtube.com/watch?v=AkmU167NilM&list=PLwbhb6Gu7AnWV6Qo5CmMr-VNVywWV93JNWatch some of my favourite videos here: https://www.youtube.com/playlist?list=PLwbhb6Gu7AnXZPY5Yl1gNgxWVpL12SJhUThe Best of Chinese Medicine in Toronto: https://bestofchinesemedicine.com---------------------------------------------------------------------------I'm Kassie, also known as Gloom! I'm a variety gamer who does gameplay commentary on indie games and some bigger titles too. I also do silly sketches, challenges, Q&As, and whatever makes my Nimble Wimble's smile. Let's explore virtual worlds and have some laughs!I do my best to upload at a few times a week (unless my life is a mess). ---------------------------------------------------------------------------"
"mUBMPaj0L3o","ROSALÍA - DI MI NOMBRE (Cap.8: Éxtasis)","2018-10-30T16:00:09.000Z","UCy2bCk5KnIfjmWYFHMZcd5w","RosaliaVEVO","10","18.17.11","rosalia,rosalia di mi nombre,video rosalia,di mi nombre video oficial,pop,flamenco,DI MI NOMBRE,Pop,ROSALÍA,Sony Music Entertainment","7958840","127856","8813","6568","https://i.ytimg.com/vi/mUBMPaj0L3o/default.jpg","False","False","ROSALÍA - Di mi nombre (Official Video)Download & stream “Di mi nombre”: Spotify: https://ROSALIA.lnk.to/DiMiNombreAY/spotifyiTunes: https://ROSALIA.lnk.to/DiMiNombreAY/itunesApple Music: https://ROSALIA.lnk.to/DiMiNombreAY/applemusicDeezer: https://ROSALIA.lnk.to/DiMiNombreAY/deezerFollow ROSALÍA: Instagram: https://www.instagram.com/rosalia.vt/ Twitter: https://twitter.com/rosaliavt Facebook: https://www.facebook.com/musicarosaliabarcelona/Spotify: https://open.spotify.com/artist/7ltDVBr6mKbRvohxheJ9h1?si=LJI253ChSdms6o-GulnEpwOfficial site: https://rosalia.com/Directed by Henry ScholfieldChoreography by Charm La DonnaProduced by Caviar"
"Ppy8qbOW5R0","Musical Shopping | Rudy Mancuso","2018-10-30T20:30:12.000Z","UC5jkXpfnBhlDjqh0ir5FsIQ","Rudy Mancuso","10","18.17.11","Musical Shopping | Rudy Mancuso,rudymancuso,musical,shopping,musical shopping,anwar,lelepons,hannahstocking,anitta,brazil,alesso,celoso,iphone xs by pineapple,superhero therapy,lento","2767495","100902","3351","5729","https://i.ytimg.com/vi/Ppy8qbOW5R0/default.jpg","False","False","Thank you @target for sponsoring this video. #TargetMyWay #Tarzhay #adPlease donate to Corentin, a beloved Shots Studios Family member ▶ https://www.gofundme.com/z67hg-250000WATCH YOU'RE MY BEST FRIEND MUSIC VIDEO ▶ https://youtu.be/UNRRcA1l-2EWATCH MORE ▶ https://youtu.be/aP0bKcsSNuASUBSCRIBE ► https://www.youtube.com/channel/UC5jkXpfnBhlDjqh0ir5FsIQ?sub_confirmation=1THANKS FOR WATCHING! LIKE & SUBSCRIBE FOR MORE VIDEOS!-----------------------------------------------------------FIND ME ON: Instagram | http://instagram.com/rudymancusoTwitter | http://twitter.com/rudymancusoFacebook | http://facebook.com/rudymancusoCAST: Rudy Mancuso | http://youtube.com/c/rudymancusoFOLLOW THE SHOTS FAMILY ▶ http://instagram.com/theshotsfamilyShots Studios Channels:Alesso | http://youtube.com/c/alessoAnitta | http://youtube.com/c/anittaAnwar Jibawi | http://youtube.com/c/anwarAwkward Puppets | http://youtube.com/c/awkwardpuppetsDelaney Glazer | http://youtube.com/c/deeglazerHannah Stocking | http://youtube.com/c/hannahstockingLele Pons | http://youtube.com/c/leleponsMarlon Wayans | http://youtube.com/c/marlonwayansRudy Mancuso | http://youtube.com/c/rudymancusoShots Studios | http://youtube.com/c/shotsThe Shots Family [Vertical] | http://youtube.com/c/theshotsfamily#Rudy#RudyMancuso"
"gap2WssoxWc","Keira Knightley & Mackenzie Foy Answer the Web's Most Searched Questions | WIRED","2018-10-30T16:01:09.000Z","UCftwRNsjfRo08xYE31tkiyw","WIRED","24","18.17.11","keira knightley,mackenzie foy,wired autocomplete interview,keira knightley interview,keira knightley autocomplete,autocomplete interview,keira knightley wired autocomplete,mackenzie foy interview,mackenzie foy autocomplete,mackenzie foy autocomplete interview,mackenzie foy twilight,keira knightley funny,keira knightley funny moments,keira knightley interview 2018,keira knightley the nutcracker,wired","1120159","28324","390","1888","https://i.ytimg.com/vi/gap2WssoxWc/default.jpg","False","False","The Nutcracker and the Four Realms stars Keira Knightley and Mackenzie Foy take the WIRED Autocomplete Interview and answer the internet's most searched questions about themselves. Does Keira Knightley have a baby? Is Mackenzie Foy related to Claire Foy? Where did Keira Knightley grow up? Still haven’t subscribed to WIRED on YouTube? ►► http://wrd.cm/15fP7B7 Also, check out the free WIRED channel on Roku, Apple TV, Amazon Fire TV, and Android TV. Here you can find your favorite WIRED shows and new episodes of our latest hit series Masterminds.ABOUT WIREDWIRED is where tomorrow is realized. Through thought-provoking stories and videos, WIRED explores the future of business, innovation, and culture.Keira Knightley & Mackenzie Foy Answer the Web's Most Searched Questions | WIRED"
"hs1HoLs4SD0","Introducing the new MacBook Air — Apple","2018-10-30T14:21:50.000Z","UCE_M8A5yxnLfW0KghEeajjw","Apple","28","18.17.11","Apple,MacBook Air,Retina display,Touch ID,dual core processors,butterfly keyboard,thin,light,T2 Security Chip,recycled aluminum,sustainable,green,eco-friendly,environment","4885542","109217","14591","0","https://i.ytimg.com/vi/hs1HoLs4SD0/default.jpg","True","False","The new MacBook Air brings many of our most advanced technologies to this iconic design for the first time — including a brilliant Retina display, Touch ID, a powerful eighth-generation Intel Core i5 processor, the latest-generation butterfly keyboard, and the Apple T2 Security Chip. And with an enclosure made with 100% recycled aluminum, it’s the greenest Mac ever.Learn more at https://apple.co/2OhVx9f"
"Fd7BrGUSxqQ","2019 iPad Pro Impressions: Incredibly Thin!","2018-10-30T21:35:21.000Z","UCBJycsmduvYEL83R_U4JriQ","Marques Brownlee","28","18.17.11","iPad Pro,new iPad Pro,Apple iPad Pro.,iPad Pro impressions,iPad Pro hands on,iPad Pro review,2019 iPad Pro,MKBHD,iPad Pro 12.9,iPad Pro 11,Retina iPad,iPad Pro new,iPad,the new iPad,new iPad Pro 12.9,ProMotion","4259815","107782","3192","13901","https://i.ytimg.com/vi/Fd7BrGUSxqQ/default.jpg","False","False","The new iPad Pro widens the gap between itself and every other tablet.3rd generation iPad Pro: https://apple.com/ipad-pro/MKBHD Merch: http://shop.MKBHD.comVideo Gear I use: http://kit.com/MKBHD/video-gear#recommendation17959Tech I'm using right now: https://www.amazon.com/shop/MKBHDIntro Track: Filet Mignon by The Cutlery~http://twitter.com/MKBHDhttp://snapchat.com/add/MKBHDhttp://google.com/+MarquesBrownleehttp://instagram.com/MKBHDhttp://facebook.com/MKBHD"
