video_id,title,publishedAt,channelId,channelTitle,categoryId,trending_date,tags,view_count,likes,dislikes,comment_count,thumbnail_link,comments_disabled,ratings_disabled,description
"65UMrVHN12k","Jason Momoa Spills His Life Secrets!","2018-12-12T17:00:01.000Z","UCYzPXprvl5Y-Sf0g4vX-m6g","jacksepticeye","24","18.16.12","jacksepticeye,jason momoa,jason momoa interview,aquaman,jason momoa jacksepticeye,jacksepticeye jason momoa interview,jason momoa aquaman,aquaman movie,jacksepticeye aquaman,aquaman review,aquaman film","1028062","64766","1680","7971","https://i.ytimg.com/vi/65UMrVHN12k/default.jpg","False","False","I got to interview Jason Momoa for Aquaman!Playing Deadpool With Ryan Reynolds ►https://www.youtube.com/watch?v=oMCijY1XGlQ Become a Sponsor: https://youtube.com/jacksepticeye/join►Twitter : https://twitter.com/Jack_Septic_Eye►Instagram: http://instagram.com/jacksepticeye►Merchandise: http://jacksepticeye.com/Edited by Pixlpit: https://www.youtube.com/channel/UCHsjBlPYou_k7FgMKLCo5JAOutro animation created by Pixlpit:https://www.youtube.com/user/pixlpitOutro Song created by Teknoaxe. It's called I'm everywhere and you can listen to it herehttp://www.youtube.com/watch?v=JPtNBwMIQ9Q#jacksepticeye #Aquaman"
"rFMw3AO_uJ0","Gordon Ramsay's Pork Chop Looks Like A Map Of The USA | Kitchen Nightmares","2018-12-12T17:00:07.000Z","UCUZzyuAlhHNP3oiuMjn7RfQ","Kitchen Nightmares","24","18.16.12","Gordon Ramsay kitchen nightmares,Gordon Ramsay best insults,kitchen nightmares full episodes,kitchen nightmares online,kitchen nightmares watch online,kitchen nightmares HD,kitchen nightmares best moments,Gordon Ramsay,Kitchen Nightmares,kitchen nightmares food tasting,kitchen nightmares food tasting compilation,kitchen nightmares food compilation,kitchen nightmares ms jean,kitchen nightmares ms jean's southern","2317277","28703","716","5757","https://i.ytimg.com/vi/rFMw3AO_uJ0/default.jpg","False","False","Seeing an exercise bike in a restaurant is never a good sign.If you liked this clip check out the rest of Gordon's channels:http://www.youtube.com/gordonramsayhttp://www.youtube.com/thefwordhttp://www.youtube.com/kitchennightmaresMore Gordon Ramsay:Website: http://www.gordonramsay.comFacebook: http://www.facebook.com/GordonRamsay01Twitter: http://www.twitter.com/GordonRamsay"
"3JgcbtxURA4","Why You Don't Own Your Tech","2018-12-12T16:00:00.000Z","UCPDXXXJj9nax0fr0Wfc048g","CollegeHumor","23","18.16.12","Collegehumor,CH originals,comedy,sketch comedy,internet,humor,funny,sketch","902635","23971","2508","4262","https://i.ytimg.com/vi/3JgcbtxURA4/default.jpg","False","False","Watch an all-new Adam Ruins Everything on truTV every Tuesday 10/9C! #AdamRuinsFOLLOW THE CAST:ALLY: http://www.twitter.com/lilbeardsleyGRANT: http://www.twitter.com/grantobKATIE: http://www.twitter.com/katiemarovitchTRAPP: http://www.twitter.com/mikewtrappRAPH: http://www.twitter.com/chestangraphaelREKHA: http://www.twitter.com/rekhalshankarBRENNAN: https://twitter.com/brennanlmSAM: http://www.twitter.com/samreichSee more http://www.collegehumor.comLIKE us on: http://www.facebook.com/collegehumorFOLLOW us on: http://www.twitter.com/collegehumorFOLLOW us on: http://www.collegehumor.tumblr.comSIGN UP for our emails: http://bit.ly/2E6svor"
"UfE93izZcPk","Freddie Goes Through Devin's Search History • Ladylike","2018-12-12T23:00:01.000Z","UCcOeS5aEIadAhKtJ9_VKAIw","Ladylike","22","18.16.12","buzzfeed,buzzfeed ladylike,ladylike,freddie,buzzfeed freddie,buzzfeed devin,devin lyte,freddie ransome,search history,women try","580429","15396","620","742","https://i.ytimg.com/vi/UfE93izZcPk/default.jpg","False","False","LadylikeSubscribe for your weekly dose of Freddie, Chantel, Devin, Kristin and Jen and all the antics that they get up to. Expect new videos three times a week. We are so excited to have you here!LadyLike on Instagram: https://www.instagram.com/buzzfeedladylike/?hl=enLadyLike on Facebook: https://www.facebook.com/buzzfeedladylike/ For business inquiries email ladylikebusiness@buzzfeed.comCredits: https://www.buzzfeed.com/bfmp/videos/71405Check out more awesome videos on Ladylike!https://bit.ly/2nbQuy4GET MORE BUZZFEED:https://www.buzzfeed.comhttps://www.buzzfeed.com/videoshttps://www.youtube.com/buzzfeedvideohttps://www.youtube.com/asishttps://www.youtube.com/buzzfeedmultiplayerhttps://www.youtube.com/buzzfeedviolethttps://www.youtube.com/perolikehttps://www.youtube.com/ladylike"
"f-VJvFbkFHU","Will Smith grunt","2018-12-12T01:07:01.000Z","UCPcFg7aBbaVzXoIKSNqwaww","jacksfilms","23","18.16.12","Jacksfilms,Jack Douglass,YGS,YGS 100,YGS 50,The Best of Your Grammar Sucks,Your Grammar Sucks,YIAY,Yesterday I Asked You,Fidget Spinners,Emoji Movie,Kermit Sings,JackAsk,Jack Ask,Dubstep Solves Everything,Frozen 2,iPhone Parody,Apple Parody","1822200","214111","3674","16403","https://i.ytimg.com/vi/f-VJvFbkFHU/default.jpg","False","False","https://www.youtube.com/watch?v=CZ0B22z22pI"
"zThm7SRp-wc","Champions League Recap: Real Madrid 0-3 CSKA Moscow Highlights, Goals and Best Moments","2018-12-12T20:03:48.000Z","UClvow1RFSyeh5CRwRB_m5sA","B/R Football","17","18.16.12","br football,bleacher report,soccer,football,goal,champions,champions league,epl,world cup,ronaldo,messi,sp:ty=high,sp:dt=2018-12-12T16:55:00+00:00,sp:vl=en-US,sp:st=soccer,sp:li=chlg,sp:ti:home=RMAD,sp:ti:away=CSKA,Real Madrid Highlights,Real Madrid,Real Madrid 0-3 CSKA","278291","2497","133","1326","https://i.ytimg.com/vi/zThm7SRp-wc/default.jpg","False","False","Full highlights of the action from the Bernabeu as Real Madrid were stunned by CSKA Moscow.Despite the win, CSKA Moscow finished fourth in the group, and Real Madrid remained top."
"UU3HMi4jYSA","Unboxing Top Toys Of 2018","2018-12-12T11:00:09.000Z","UCzpCc5n9hqiVC7HhPwcIKEg","Good Mythical MORE","24","18.16.12","gmm,good mythical morning,rhettandlink,rhett and link,mythical morning,mythical,rhett,link,season 14,gmmore,good mythical more,top toys of 2018,top,toys,2018,unboxing,unboxing toys,ryan's toy review,toy review,kids toy review,Unboxing Top Toys Of 2018,toy unboxing,scruff a luv","492056","10633","401","1515","https://i.ytimg.com/vi/UU3HMi4jYSA/default.jpg","False","False","We got our hands on the top toys of 2018, so it's time to get this unboxing underway to see which one wins this holiday season!  GMMore #1442Watch today's GMM: https://youtu.be/6iEtjaYI-oUWant more GMM? Watch this season from the start: http://bit.ly/GMM_S14Pick up official GMM and Mythical merch at https://mythical.storeand https://www.amazon.com/mythicalDon’t miss our weekly podcast, Ear Biscuits: https://applepodcasts.com/earbiscuitsFollow Rhett & Link: Instagram: https://instagram.com/rhettandlinkFacebook: https://facebook.com/rhettandlinkTwitter: https://twitter.com/rhettandlinkWebsite: https://mythical.com/Check Out Our Other Mythical Channels:Good Mythical Morning: https://youtube.com/goodmythicalmorningRhett & Link: https://youtube.com/rhettandlinkMythical: https://youtube.com/thisismythicalWant to send us something? https://mythical.com/contactSubmit your Wheel of Mythicality intro video here: https://bit.ly/GMMWheelIntroIntro Animation by Digital Twigs: https://www.digitaltwigs.comIntro & Outro Music by Jeff Zeigler & Sarah Schimeneck https://www.jeffzeigler.comSupplemental Music from Extreme Production Music: https://www.extrememusic.com/Mic: ‘The Mouse’ by Blue Microphones https://www.bluemic.com/mouse/"
"DANa4ABfkR4","Ya Burnt: Sledding, Bethlehem Innkeepers","2018-12-12T05:35:56.000Z","UCVTyTA7-g9nopHeHbeuvpRA","Late Night with Seth Meyers","23","18.16.12","Late Night,Seth Meyers,Ya Burnt,Sledding,Bethlehem Innkeepers,NBC,NBC TV,television,funny,talk show,comedy,humor,stand-up,parody,snl seth meyers,host,promo,seth,meyers,weekend update,news satire,satire,chestnuts,hockey,office holiday parties,Home Alone,parents,Elf on the Shelf","405951","4609","668","386","https://i.ytimg.com/vi/DANa4ABfkR4/default.jpg","False","False","Seth sizzles through a list of topics and fires sick burns at some deserving subjects, like the song 12 Days of Christmas.» Subscribe to Late Night: http://bit.ly/LateNightSeth» Get more Late Night with Seth Meyers: http://www.nbc.com/late-night-with-seth-meyers/» Watch Late Night with Seth Meyers Weeknights 12:35/11:35c on NBC.LATE NIGHT ON SOCIALFollow Late Night on Twitter: https://twitter.com/LateNightSethLike Late Night on Facebook: https://www.facebook.com/LateNightSethFind Late Night on Tumblr: http://latenightseth.tumblr.com/Connect with Late Night on Google+: https://plus.google.com/+LateNightSeth/videosLate Night with Seth Meyers on YouTube features A-list celebrity guests, memorable comedy, and topical monologue jokes.NBC ON SOCIAL Like NBC: http://Facebook.com/NBCFollow NBC: http://Twitter.com/NBCNBC Tumblr: http://NBCtv.tumblr.com/NBC Pinterest: http://Pinterest.com/NBCtv/NBC Google+: https://plus.google.com/+NBCYouTube: http://www.youtube.com/nbcNBC Instagram: http://instagram.com/nbctvYa Burnt: Sledding, Bethlehem Innkeepers- Late Night with Seth Meyershttps://youtu.be/DANa4ABfkR4Late Night with Seth Meyershttp://www.youtube.com/user/latenightseth"
"GZIml51UaR4","My Friends Were With Me For My Money","2018-12-11T18:00:00.000Z","UCGDV4-Gr3gyc-eGCgRtXknw","ACTUALLY HAPPENED","1","18.16.12","money,rich,girl,dad,family,friends,betray,school,classmates,teen,study,gold diggers,friendship,sad,poor,animation channel,actually happened,pain","2141676","56137","2368","10711","https://i.ytimg.com/vi/GZIml51UaR4/default.jpg","False","False","★ Subscribe ACTUALLY HAPPENED https://bit.ly/2J5HP7jThis is Britney. She’s a lucky person – she comes from a very wealthy family. But she’s not here to boast. Unfortunately, everyone has their problems, and hers are no less significant than anyone else’s. Her biggest problem is finding friends, and this is the reason why.Britney doesn’t think that she’s arrogant, or a snob, or whatever it is that people think about kids from rich families. Her dad is a very simple person, a self-made-man, and he wants his children to work their own way through life too. That doesn’t mean that they have strict limitations on using money – his belief is that they need to invest their time and effort in studying, and should work like everyone else who is not as lucky as they are. That’s why they have always lived a pretty simple life – not in some mansion, but in an ordinary house. Their dad also insisted that they go to an ordinary school, not some fancy private one.When Britney was a child, she didn’t even notice the difference between herself and other children. They all shared the same studies and hobbies. She’s a very sociable person, so she didn’t have problems finding friends. But when she became a teenager and went to high school, she noticed that things had changed. Everyone was divided into groups and ranks – it was not just one big group of children anymore. She didn’t like the idea of classifying people, but you have to adapt in order to enjoy life.Since she is quite easy-going, she ended up in the “celeb” group. This wasn’t her goal, of course, but she was at a new school and she just wanted to make friends. They came to her and proposed that she hang out with them – why would she say no? They seemed like really nice people. They chatted a lot about designer clothes and gadgets, and all the other things that are trendy nowadays. This was when she found out that they had somehow already learned about who she was and what family she was from – and Britney began to have doubts. She’s not a fool, and she understands that sometimes people can be guided by self-interest when choosing friends.She started watching her new friends attentively. Her dad had taught her that you should always check people out before trusting them, even if she had never been in a situation where she’d been right to mistrust people before. But everything seemed okay. It was quite a large group of people – there were eight of them – and they all had different backgrounds. They were regular people with different personalities – that’s ok then, she thought. They spent a lot of time together, and met outside school as well, and as time passed she didn’t notice any particular interest in her family’s wealth.When things started changing, she didn’t even notice at first. From time to time when they went out, one or two of her friends asked her to pay for their movie tickets or a coffee, and promised to give back the money. They never gave it back, and she thought it was a bit petty to remind them. Then...their ‘appetites’ started growing. Sometimes they asked her to pay for a round of bowling or a coffee for everyone. She didn’t think it was fair, but they were her friends and she thought it was shameful to quarrel over money. Britney became irritated by the situation, and started thinking: “What if they made friends with me only because of my money? What if they don’t even really like me?”At some point, thinking these kinds of thoughts over again and again leads you to paranoia.  She wanted to check if they really liked just her money or her. She already had trust issues, and thought that it would be better to be alone than with friends like that. So one day she met up with them and pretended to be all sad, saying that they had financial problems at home – that her dad had lost his business and that he had cut her pocket money drastically. She saw them exchange glances but they didn’t say anything. Everything continued as normal and she had already begun to calm down, but when they decided to go to the cinema, she asked someone to pay for her. “I’m broke”, she said, “sorry guys, I’ll give it back as soon as I can”. They exchanged glances again. Then one of her supposed friends said: “Look, we’re not as rich as you are and we can’t sponsor you, sorry. Maybe it’d be better if you go another time”.That was it. Now she knew! How could she even think that someone could be disinterested in her family’s money! She was staring at their backs as they were walking away feeling so disappointed, and she didn’t notice that Lea was still standing by her side. She asked if Britney needed help. “Do you need to talk? I understand it can be hard”. She offered to pay for her as they went to get a coffee. She thanked Lea from the bottom of her heart, because she had restored her faith in people. They’ve been best friends ever since, and she never went back to the ‘celeb’ group."
"M_ROduqXkpE","I Am Afraid After The Synagogue Shooting in Pittsburgh","2018-12-11T20:03:31.000Z","UCWENB1OaGA9402PKzEVl0ow","storybooth","1","18.16.12","synagogue,girl,storybooth,boy,story booth,pain,storybooth animated,mom,panic,dad,relationships,storytime,story time,animation,tree of life synagogue,shooting,massacre,mother,sister,family,friends,jewish,judaism,antisemetic,antisemitic,anti semitic,anti semitism,hate,intolerance,intolerant,bigotry,coexist,love,gun violence,murderer,religious,synagogue shooting,worship,hate crime,community,tragedy,story,pittsburgh shooting","1592954","56169","3309","13680","https://i.ytimg.com/vi/M_ROduqXkpE/default.jpg","False","False","By Bella  |  Subscribe: http://bit.ly/sub2storybooth | Record your story @ https://storybooth.com or our iPhone app for a chance to get animated. Comment, like, share this story.Bella lives in a neighborhood called Squirrel Hill in Pittsburgh. She's grown up there, lived there her whole life, has her friends and her synagogue there, right near the Tree of Life synagogue, and it had always been a peaceful neighborhood - diverse and accepting - a really nice place to live. There were a lot of Jewish families who lived there and she could hardly remember any anti semitism ever happening around them.But, on Saturday, October 27th, she slept in late and only woke up when her mom called to her from the other room at around eleven o'clock. She ran in to her Mom's room and her younger sister was there and they looked awful, pale, afraid and scared. Bella didn't know what was going on, and her mom would only whisper because she didn't want Bella's youngest sister to wake up. But something really, really bad was going on - you could tell from the terrified looks on her Mom and sister.Her mom asked is she'd looked at her phone yet, if she'd seen or heard any of what was on the news. She'd heard lots of sirens in her half sleep, but they didn't wake her - what was going on? Her mom sat her down and told her that there had been a mass shooting at a temple - the Tree of Life synagogue right there in squirrel hill. Bella gasped and sat down hard. She was so scared, afraid, shaking and crying. She was just in shock that something like this had happened, in their neighborhood, at a synagogue that was practically right next to the one she attended. Also, the fact that it was all because of their religion, all because they were Jewish, and this scared Bella too - the ant-semitism, and all these shootings taking place everywhere.What made the tragedy even worse was the fact that it was Shabbat, the holiest day of the week for the Jewish people -- all they were doing was praying -- and that morning the Tree of Life synagogue was having a baby naming for a new baby just born into their community, a special and festive and happy occasion. And an evil man full of hate and anti semitism came into their place of worship and shot and killed 11 people, including police and security guards.When Bella and her friends returned to their religious school, hebrew school, so many of them were on edge, scared, and couldn't quite put into words how awful and vulnerable it made them feel. Why was there anti semitism, or hate of any kind? Why couldn't people coexist without hatred and gun violence?After they had started their school day they had a special morning prayer service and they invited the congregation from the Tree of Life synagogue to join them. There were so many people there, mourning and praying, holding hands and supporting each other - praying for peace, and love, and for the souls of the those who passed to ascend. And they chanted and sang words of power, that they were strong and that they would not be afraid.The Pittsburgh synagogue shooting has effected jews all over the United States and the world, and all people who enjoy feeling safe and free to worship how they choose under any religion they choose. Hopefully the families affected by this tragedy will be able to feel one day that those they lost did not die in vain and that they re-awakened the need for peace, and love, and light across the entire world._____What's your story?  storybooth wants to hear it!  actually happenedLINKS:Website: http://www.storybooth.comInstagram: @thestorybooth twitter @thestorybooth https://www.instagram.com/thestoryboothG+: https://plus.google.com/+StoryboothFacebook: https://www.facebook.com/thestorybooth/Tumblr: https://storybooth.tumblr.com/If you liked this storybooth animation and love storytime / story time story booth kid videos, watch our themed playlist collections:Being Yourself: https://goo.gl/89enENLove and Heartbreak: https://goo.gl/mfaoKwEmbarrassing and Funny: https://goo.gl/5GjxrWBullies and Mean People:https://goo.gl/THS3LBOvercoming Challenges: https://goo.gl/pbxRa9"
"exOcVBQfXxs","Kids Try Avocado Toast | Kids Try | HiHo Kids","2018-12-11T13:00:05.000Z","UCqa2MPu8bLY1PwVFUpSyVhQ","HiHo Kids","22","18.16.12","PL2etPlnTb9sVxgqJsqelbBfixN-mwrA3d,PL2etPlnTb9sWYqZ40D6G36Exbkz--5ENd,Kids Try,Food,Kids,American kids try,Hiho Kids,HiHoKids,Hiho,kids videos,children,kids describe,unboxing,kid friendly,family,family friendly,Maddox,Maddox weddle,kid activities,games,experiment,kids play,fun,toys,friends,kids make friends,try new things,kids guess,what’s in the box,kids fun,Ernie,Desmond,Crystal,Justin,GG,Austin,Jayque,Steven,Carolina,Fancy Toast,Avocado Toast","591116","11222","520","1596","https://i.ytimg.com/vi/exOcVBQfXxs/default.jpg","False","False","Sponsor this video: http://bit.ly/2zNbqjwCome play with us!Sign up at http://bitly.com/hihofans to get updates on HiHo, special offers, and exclusive behind-the-scenes content with your favorite kids.SUBSCRIBE to HiHo Kids: http://bit.ly/HiHoYouTubeWatch More Kids Try: https://www.youtube.com/playlist?list=PLJic7bfGlo3pjYhhc7c2xAhMOMIhhTlfTAbout Kids Try: Adventurous and adorable kids give us an entree into the world’s array of foods and snacks.Don't forget to subscribe and follow us!Facebook- http://www.facebook.com/hihokidsYouTube- http://www.youtube.com/hihokidsGet HiHo swag here: http://bit.ly/BuyCutAbout HiHo Kids:Every kid – including the one inside each of us – needs imagination and curiosity about the world. Hiho promotes empathy through play.Send HiHo Kids things to unbox: PO Box 19604, Seattle WA 98109Stay updated by signing up to our email list @ bit.ly/ytJoinTheFamily For licensing inquiries: http://cut.com/licensingWant to work with us? http://cut.com/hiringWant to be in a video? http://cut.com/castingWant to sponsor a video? http://cut.com/sponsorshipsLove HiHo? Fill out this form for exclusive updates: http://cut.com/fanformKids Try Avocado Toast | Kids Try | HiHo Kidshttps://youtu.be/exOcVBQfXxs#HiHoKids #KidsTry #KidsHiHo Kidshttps://www.youtube.com/hihokids"
"eFsGA0GXB-8","ZAYN - There You Are (Lyric Video)","2018-12-11T17:00:05.000Z","UCy5FUarBYUHFpPtYVuvzgcA","ZaynVEVO","10","18.16.12","Pop,RCA Records Label,There You Are,ZAYN","2612013","195821","1912","15323","https://i.ytimg.com/vi/eFsGA0GXB-8/default.jpg","False","False","Pre-Order / Pre-Save Zayn's New Album Icarus Falls - http://smarturl.it/IcarusFallsZZ Get Zayn’s new song “There You Are” - http://smarturl.it/ZTh3r3Y0uAreMore Zayn: “Good Years” - http://smarturl.it/ZG00dY3ar5“Rainberry” - http://smarturl.it/ZRainb3rryZNo Candle No Light feat. Nicki Minaj - http://smarturl.it/zNCxNLzFingers - http://smarturl.it/Zfing3rZ“Too Much” feat. Timbaland - http://smarturl.it/Zt00muchZt“Sour Diesel”: http://smarturl.it/zS0urzDi3s3l“Entertainer” - http://smarturl.it/Z3ntrt4inerZLet Me - http://smarturl.it/ZlZmZFollow Zayn: Instagram - http://instagram.com/ZAYN Twitter - https://twitter.com/zaynmalik Facebook - http://facebook.com/ZAYN Tumblr - http://zayn.tumblr.com Spotify - http://smarturl.it/ZAYNSpotify http://www.inZAYN.com “There You Are” Official Lyrics:Only you know me the way you know meOnly you forgive me when I’m sorryVERSE 1Need you when I'm broken When I'm fixedNeed you when I'm well And when I'm sick Friends that I rely onDon't come throughThey run like the river But not you PRE CHORUS Can't see when I'm falling Losing myself But then I here you calling. CHORUSThere you are There you are You're there with open arms. There you are There you are And I run VERSE2Whispers in the background Behind closed doors Got myself in a mess and with out you I'm in more.Oh I'm little drunk nowThat's why I went to war Oh yeah you are my sober When I'm on the floor.PRE CHORUS CHORUSPOST CHORUSOnly you know me the way you know meOnly you forgive me when I'm sorry Even when I mess it up There you areBRIDGENeed when I'm hot When I'm coldNeed you when I'm young When I'm old. You won't be far CHORUSPOST CHORUSADLIB BREAK When you're caught in the crowdsWhen you're up in the clouds X2There you are"
"Kb4dd_aWmok","Hi I'm Poppy Oh","2018-12-11T01:18:31.000Z","UC8JE00xTMBOqKs7o0grFTfQ","Poppy","24","18.16.12","poppy,music,blonde,titanic sinclair","1295655","25198","22552","12352","https://i.ytimg.com/vi/Kb4dd_aWmok/default.jpg","False","False","New merch available now at http://shop.impoppy.com/Stream/Download: http://maddecent.fm/amiagirlOrder Am I A Girl? Merch: http://maddecent.fm/amiagirlshopFOLLOW POPPYFacebook: https://www.facebook.com/Poppy Twitter: https://twitter.com/poppy SoundCloud: https://soundcloud.com/poppy Instagram: https://www.instagram.com/impoppy Web: https://poppy.wun.io/store YouTube: https://www.youtube.com/PoppyTOUR DATES: 01/31/19 Washington, DC02/01/19 Philadelphia, PA02/02/19 New York, New York02/04/19 Boston, Massachusetts02/06/19 Toronto, Ontario02/07/19 Detroit, Michigan02/08/19 Chicago, Illinois 02/09/19 Pittsburgh, PA02/11/19 Nashville, Tennessee02/12/19 Atlanta, Georgia02/13/19 Tampa, Florida02/15/19 Dallas, Texas02/16/19 Austin, Texas02/18/19 Aspen, Colorado02/19/19 Englewood, Colorado02/21/19 Seattle, Washington02/22/19 Portland, Oregon02/23/19 Chico, California02/24/19 San Francisco, California02/27/19 San Diego, CaliforniaDirected by: Titanic Sinclair"
