video_id,title,publishedAt,channelId,channelTitle,categoryId,trending_date,tags,view_count,likes,dislikes,comment_count,thumbnail_link,comments_disabled,ratings_disabled,description
"Mcep-uch_hM","Guess My Disability (Bjork) | Lineup | Cut","2018-12-08T13:00:03.000Z","UCbaGn5VkOVlcRgIWAHcrJKA","Cut","24","18.16.12","PLJic7bfGlo3qJcIXUJteaUm_3-3tgQSXw,PLJic7bfGlo3rM20M7N8rLXAkz6dU2-7FX,lineup,line up,People Guess,guessing games,Cut,Watch Cut,people,people videos,storytelling,relationships,Dating,Interviews,Firsts,couples,exes,love,Kids Try,games,challenges,Ethnic groups,People Interviews,Dares,Truth or Dare,100 ways,blind dates,100 people,experiments,#tbt,Maddox,Truth or Drink,kids,kids videos,100 YOB,100 Years of Beauty,Fear Pong,Guess My Disability,Bjork","1144506","15478","4849","3332","https://i.ytimg.com/vi/Mcep-uch_hM/default.jpg","False","False","Sponsor this video: http://bit.ly/2zMPhl9Fear Pong is now a game! Get it here: http://www.fearponggame.comSUBSCRIBE: http://bit.ly/CutSubscribeWatch More Lineup: https://www.youtube.com/playlist?list=PLJic7bfGlo3qJcIXUJteaUm_3-3tgQSXwAbout Lineup:A who’s who of awkward assumptions and judgments.Don't forget to subscribe and follow us!Official Site: https://www.cut.com/Facebook: http://cut.com/facebook Twitter: https://twitter.com/CutInstagram: http://cut.com/instagramSnapchat: @watchcut Cut Swag: http://cut.com/shopAbout Cut: Small questions have powerful effects when they go viral. Cut spreads stories for fun, for serious, and for real– bringing the internet together one awkward moment at a time.Produced, directed, and edited by https://cut.com Want to work with us? http://cut.com/hiring Want to be in a video? http://cut.com/casting Want to sponsor a video? http://cut.com/sponsorships For licensing inquiries: http://cut.com/licensingGuess My Disability (Bjork) | Lineup | Cuthttps://youtu.be/Mcep-uch_hM#Cut #Lineup #ChallengeCuthttps://www.youtube.com/watchcut"
"b7QxOnr4t5I","College Kids React To Try Not To Sing Along Challenge (Disney Edition)","2018-12-08T22:00:01.000Z","UC0v-tlzsn0QZwJnkiaUSJVQ","FBE","24","18.16.12","Disney sing along,Disney,try not to sing,College Kids Try Not To Sing Along Challenge (Disney Edition),college kids react,react,reaction,thefinebros,fine brothers,fine brothers entertainment,finebros,fine bros,FBE,watch,review,for the first time,reviews,responds,respond,youtubers react,elders react,teens react,kids react,adults react,parents react,teenagers react,the little mermaid,camp rock,the lion king,mulan,Aladdin,whole new world,Toy Story,OGCK1845","1190202","33700","967","5942","https://i.ytimg.com/vi/b7QxOnr4t5I/default.jpg","False","False","Try Not To Sing Along Challenge (Disney Edition) played by the College Kids. Original links below.SUBSCRIBE & HIT THE 🔔. New Videos 2pm PT on FBE: http://fbereact.com/SubscribeFBEWhat should we react to next?? https://fbereact.com/submitWatch More from FBE: http://fbereact.com/FBEallreactepisodesWatch More from React: http://fbereact.com/REACTallepisodesJoin us LIVE on React every Tuesday, Friday, and Sunday at 3pm PST.Sign Up for Our Newsletter: http://fbereact.com/infoCollege Kids take on the Try Not to Sing Along Challenge (Disney Edition). Watch to see their Reactions.To watch more from Disney, check out their channels below:Disneyhttps://www.youtube.com/channel/UC_5niPa-d35gg88HaS7RrIwDisneyMuiscVevohttps://www.youtube.com/channel/UCgwv23FVv3lqh567yagXfNgDisneyChannelhttps://www.youtube.com/user/disneychannel/featuredFBE’s goal is to credit the original links to the content featured in its shows. If you see incorrect or missing attribution please reach out to credits@fbeteam.comReactors Featured:Brandonhttps://www.youtube.com/c/brandocommandoyaboiChelseahttps://www.instagram.com/whoischelsea/Diontehttps://www.instagram.com/dapper_macon2.0/Elisehttps://www.instagram.com/elise.kom/Genevahttps://instagram.com/pie.poli/Luishttps://www.instagram.com/luiegee_/Matthewhttps://www.instagram.com/matthewlagahit._/Michellehttps://www.instagram.com/thewickedlady/Sheilahttps://www.youtube.com/sheilacurielTomhttps://www.youtube.com/user/ImBostonTomMERCH 👕 https://www.shopfbe.comFollow FBE:FBE WEBSITE: https://fbeteam.com/FBE: http://www.youtube.com/FBEREACT: http://www.youtube.com/REACTFBE2: https://www.youtube.com/FBE2FBELive: https://www.youtube.com/fbeliveFACEBOOK: http://www.facebook.com/FBEFACEBOOK: http://www.facebook.com/FBEShowsTWITTER: http://www.twitter.com/fbeINSTAGRAM: http://www.instagram.com/fbeSNAPCHAT: https://fbereact.com/snapchatDISCORD: https://fbereact.com/FBEdiscordTWITCH: https://www.twitch.tv/fbeliveAMAZON: https://www.amazon.com/v/FBEROKU: http://fbereact.com/FBERokuXUMO: https://fbereact.com/xumoSEND US STUFF:FBEP.O. BOX 4324Valley Village, CA 91617-4324Creators & Executive Producers - Benny Fine & Rafi FineHead of Production - Nick BergtholdCreative Director & Senior Producer - Derek BaynhamDirector of Post Production - Adam SpeasSupervising Producer - Kyle SegalProducer - Ethan WeiserJr. Producer - Vartuhi Oganesyan, JC ChavezProduction Coordinator - Alberto AguirreAssistant Production Coordinator - Kristy KieferPost Supervisor - Emily McGuinessEditor -  Zach ButlerAssistant Editor - Nicole WorthingtonJr. Studio Technician -  Oscar Ramos, Stephen Miller, Jayden RomeroProduction Assistant -  Lauren Hutchinson, Kyllis Jahn, Micah Kearny,Stefan Fior, Laura LareauStudio Technician - Sam KimSet design - Melissa JudsonMusic - Cyrus Ghahremani© FBE, IncCollege Kids Try Not To Sing Along Challenge (Disney Edition)"
"hA6hldpSTF8","Marvel Studios' Avengers - Official Trailer","2018-12-07T13:01:21.000Z","UCvC4D8onUfXzvjTOM-dBfEA","Marvel Entertainment","24","18.16.12","marvel,comics,avengers,avengers 4,trailer,official,a4,mcu,endgame","71226173","3077456","45575","313247","https://i.ytimg.com/vi/hA6hldpSTF8/default.jpg","False","False","Part of the journey is the end.► Subscribe to Marvel: http://bit.ly/WeO3YJLearn more: https://bit.ly/2QD3Z85---Follow Marvel on Twitter: ‪https://twitter.com/marvelLike Marvel on FaceBook: ‪https://www.facebook.com/MarvelFor even more news, stay tuned to:Tumblr: ‪http://marvelentertainment.tumblr.com/Instagram: https://www.instagram.com/marvelGoogle+: ‪https://plus.google.com/+marvelPinterest: ‪http://pinterest.com/marvelofficial"
"9knRj34ya2Q","Highlights RCD Espanyol vs FC Barcelona (0-4)","2018-12-08T22:42:19.000Z","UCTv-XvfzLX3i4IGWAm4sbmA","LaLiga Santander","17","18.16.12","española,oficial,soccer,football,spanish league,laliga,resumen,highlight,RCD Espanyol vs FC Barcelona,sp:st=soccer,sp:vl=en,sp:dt=2018-12-08T19:45:00Z,sp:ti:home=esp,sp:ti:away=fcb,sp:ty=high,sp:or=2,sp:li=liga,hl,highlights,great goal,amazing goal,free kick goal,leo messi,dembele,luis suarez,derby,RCD Espanyol 0-4 FC Barcelona,Espanyol vs Barcelona 0-4,Resumen Espanyol vs Barcelona,RCD Espanyol vs FC Barcelona 2018","1444381","12221","745","978","https://i.ytimg.com/vi/9knRj34ya2Q/default.jpg","False","False","FC Barcelona beat RCD Espanyol 0-4 in the derby. Messi (twice), Dembele and Luis Suarez scored the goals of the victory. LaLiga Santander 2018/2019Suscríbete al canal oficial de LaLiga Santander en HD | 2018-12-08 00.00h | J15 | ESP | BARLaLiga Santander on YouTube: http://goo.gl/Cp0tCLaCopa on YouTube: http://bit.ly/1P4ZriPLaLiga 1|2|3 on YouTube: http://bit.ly/1OvSXbiFacebook: https://www.facebook.com/LaLigaTwitter: https://twitter.com/LaLigaInstagram: https://instagram.com/laligaGoogle+: http://goo.gl/46Py9"
"WYZ3n5duaX0","Chelsea v. Man City | PREMIER LEAGUE EXTENDED HIGHLIGHTS | 12/8/18 | NBC Sports","2018-12-08T21:09:23.000Z","UCqZQlzSHbVJrwrn5XvzrzcA","NBC Sports","17","18.16.12","premier league,premier league highlights,arsenal,machester city,man city,man united,man utd,chelsea,epl highlights,nbc sports,nbc,NBCSN,chelsea vs man city,chelsea vs man city 2018,chelsea vs man city highlights,manchester city vs chelsea,chelsea vs man city highlights 2018,premier league highlights today,chelsea vs manchester city,epl highlights this week","279340","2230","81","537","https://i.ytimg.com/vi/WYZ3n5duaX0/default.jpg","False","False","Chelsea earned an impressive 2-0 win over Man City to end City's unbeaten season. #NBCSports #PremierLeague #Chelsea #ManCity» Subscribe to NBC Sports: https://www.youtube.com/nbcsports» Watch Live Sports on NBCSports.com: http://www.nbcsports.com/live» Get more Premier League news on NBC Sports: https://www.nbcsports.com/soccerNBC Sports Group serves sports fans 24/7 with premier live events, insightful studio shows, and compelling original programming. NBC Sports is an established leader in the sports media landscape with an unparalleled collection of sports properties that include the Olympics, NFL, Premier League, NHL, NASCAR, PGA TOUR, the Kentucky Derby, Tour de France, French Open, IndyCar and many more. Subscribe to our channel for the latest sporting news and highlights!The Premier League across NBC Sports Group launched in 2013 with their biggest and broadest programming commitment to-date in the United States. With live multi-platform coverage of all 380 games, analysis from best-in-class talent and extensive surrounding coverage all week long, NBC Sports Group has become the ultimate destination for new and existing Premier League fans.The Premier League maintains strong and consistent reach across NBC, NBCSN, CNBC, and NBC Sports Group’s live streaming products, led by the biggest stars and most prestigious teams in the world.Visit NBC Sports: https://www.nbcsports.comFind NBC Sports on Facebook: https://www.facebook.com/NBCSportsFollow NBC Sports on Twitter: https://twitter.com/nbcsportsFollow NBC Sports on Instagram: https://www.instagram.com/nbcsports/Chelsea v. Man City | PREMIER LEAGUE EXTENDED HIGHLIGHTS | 12/8/18 | NBC Sportshttps://www.youtube.com/nbcsports"
"TNRQT9ODqDI","Trailer 🎥 | Kim Possible | Disney Channel Original Movie","2018-12-07T16:00:04.000Z","UCw7SNYrYei7F5ttQO3o-rpA","Disney Channel","24","18.16.12","trailer,kim possible,live action,disney channel,disney,dcom,full movie,naked mole rat,sadie stanley","2812227","29513","136024","30161","https://i.ytimg.com/vi/TNRQT9ODqDI/default.jpg","False","False","Find out what the sitch is, premiering in the U.S. on February 15, 2019!!Everyday teen hero Kim Possible (Sadie Stanley) and her best friend Ron Stoppable (Sean Giambrone) embark on their freshman year of high school, all while saving the world from evil villains. While Kim and Ron have always been one step ahead of their opponents, navigating the social hierarchy of high school is more challenging than the action-heroes ever imagined. With Drakken (Todd Stashwick) and Shego (Taylor Ortega) lurking in the wings, Kim must rely on her family and friends on Team Possible—Ron, tech-genius Wade (Issac Ryan Brown), new friend Athena (Ciara Wilson), and Rufus, a Naked mole-rat—to stop these super villains!#kimpossible #dcom #disneychannel"
"Dd4nKt0RT7c","Man Says Woman is Too Sneaky (Full Episode) | Paternity Court","2018-12-07T23:00:01.000Z","UC5w5rFxcZ4UL_IJSOFWo9OQ","Paternity Court","24","18.16.12","maury,paternity court,full episode,couples court,divorce court,you are not the father,you are the father,dna testing,paternity test,biological father,father's day,baby,dna test,ancestry,23 and me,season 5,mgm studios,judge faith,judge rinder,judge judy,court show,paternity court full episode,season 5 full episodes,maury show,steve wilkos,wendy williams,season 4,season 4 full episodes","521412","7104","500","2603","https://i.ytimg.com/vi/Dd4nKt0RT7c/default.jpg","False","False","Sousis v. Payne: An emotion 19 year old claims that her ex's meddling mother has caused her son to doubt fathering her 10 month old baby.Subscribe: https://bit.ly/PaternityCourtYT Follow Paternity Court on Social Media:Facebook: https://www.facebook.com/PaternityCourt/Twitter: https://twitter.com/PaternityCourtInstagram: @PaternityCourtTVFollow MGM Television on Social Media:Facebook: https://www.facebook.com/MGMTelevisionTwitter: https://twitter.com/MGMTelevision Instagram: @MGM_TelevisionMan Says Woman is Too Sneaky (Full Episode) | Paternity Courthttps://www.youtube.com/watch?v=Dd4nKt0RT7cSeason 4, Episode 99#PaternityCourt #LaurenLake"
"a2GVxYfKSxA","Elon Musk vs Mark Zuckerberg - Epic Rap Battles of History.","2018-12-07T19:00:06.000Z","UCMu5gPmKp5av0QCAajKTMhw","ERB","24","18.16.12","elon musk,elon musk vs mark zuckerberg,elon musk rap battle,mark zuckerberg rap battle,epic rap battles of history,erb,rap battle,rap battles,battle rap,mark zuckerberg,erbofhistory,mark zuckerberg vs elon musk,mark zuckerberg vs elon musk rap battle,musk vs zuck,zuck vs musk,facebook vs tesla,tesla vs facebook,celebrity rap battles,epic rap battles of history season 6","6911745","428817","9840","75289","https://i.ytimg.com/vi/a2GVxYfKSxA/default.jpg","False","False","Download this song here ► http://hyperurl.co/MuskVsZuckSong ◄Elon Musk and Mark Zuckerberg face off in this bonus episode of Epic Rap Battles of History. Who won? Who’s next? You decide!NEW ERB Season 5 Signed CD's - https://erbmerch.comWatch the Behind The Scenes here: http://bit.ly/2PwdscDOfficial ERB Website: https://erbofhistory.comCheck out our new Teespring Merch Store: https://bit.ly/2E8lCGWAnd don't forget to subscribe to our channel: https://bit.ly/2zBQU53Thank you!np & eL#epicrapbattles #elonmusk #markzuckerbergCAST==========Elon Musk: EpicLLOYDhttp://www.youtube.com/EpicLLOYDIG/Twitter: @theepiclloydMark Zuckerberg: Nice Peterhttp://www.youtube.com/NicePeterIG/Twitter: @nicepeterSenator Dianne Feinstein: EpicLLOYDCaptain Jean-Luc Picard: EpicLLOYDCREW==========Producer: Atul SinghWritten by EpicLLOYD, Nice Peter, Zach Sherwin & Dante CimadamoreBeat Produced by Hollywood Legend Productions: http://bit.ly/HollywoodLegendProductionsMusic Mixed and Mastered by Nice PeterDirected by: Nice PeterDirector of Photography: Jon NaGaffer: Trent TurnerDepartment  Make Up Head: Ashlyn McIntyreDIT: Josh BestPlayback Supervisor: Dante CimadamoreSenior PA: Morgan ChristensenSpecial thanks to Jay MendozaVideo Editors: Daniel Flesher, Josh Best, Nice PeterProduced by Atul SinghVFX: Andrew Sherman, Javi Sánchez BlancoShot on the Arri Alexa Mini"
"YbJOTdZBX1g","YouTube Rewind 2018: Everyone Controls Rewind | #YouTubeRewind","2018-12-06T17:58:29.000Z","UCBR8-60-B28hp2BmDPdntcQ","YouTube Spotlight","24","18.16.12","Rewind,Rewind 2018,youtube rewind 2018,#YouTubeRewind,Rewind 2017,Lilly Singh,Markiplier,Swoozie,Liza Koshy,Dolan Twins,Lele Pons,Rudy Mancuso,Casey Neistat,LaurDIY,Merrell Twins,Collins Key,Safiya Nygaard,Luisito Comunica,BB Ki Vines,Bie The Ska,Authentic Games,Manual do Mundo,Fortnite,Kiki Challenge,Mukbang,Ninja,BTS,Idol,Marshmello,Cardi B,Year in Review,In my feelings challenge","137379552","2301237","13140329","2205577","https://i.ytimg.com/vi/YbJOTdZBX1g/default.jpg","False","False","YouTube Rewind 2018. Celebrating the videos, people, music and moments that defined 2018. #YouTubeRewindIt wouldn’t be Rewind without the creators: https://rewind.youtube/creatorsExplore the videos, music and trends that defined YouTube in 2018: https://rewind.youtubeWatch the Behind the Scenes video: https://youtu.be/8qTQbk2A02M  See all the Easter Eggs: https://goo.gl/xr3uUn  Music by The Hood InternetYouTube Rewind 2018 produced by Portal A Starring:10OcupadosAdam RipponAfros e Afins por Nátaly NeriAlisha MarieAmi Rodriguez Anwar JibawiAsapSCIENCEAuthenticGamesBB Ki VinesBearhugBie The SkaBilingirl ChikaBokyem TVCajuTVCasey NeistatCasparCherrygummsCollins KeyDagi BeeDesimpedidosDiva DepressãoDolan TwinsDomicsDotty TVElle Millsemma chamberlainEnes BaturEnjoyPhoenixEroldStoryFAP TVFavijTVFischer'sFurious JumperGabbie HannaGamingWithKevGEN HALILINTARGongdaesanggymvirtualHannah StockingHikakinTVHow RidiculousillymationItsFunnehJaidenAnimations James CharlesJohn OliverJordindian Jubilee MediaJukiLopjulioprofeKatya ZamolodchikovaKaykai Salaider Kelly MissesVlogKrystal Yam & familyLA LATALachlanLaurDIYLele PonsLife NogginLilly SinghLiza KoshyLosPolinesiosLucas the SpiderLuisito Comunica (Rey Palomo)LuzuLynaManual do MundoMarkiplier Marques BrownleeMarshmelloMason RamseyMe Poupe!Merrell TwinsMichael Dapaah MissRemiAshtenmmoshayaMolly BurkeMs YeahMuro PequenoNick Eh 30NikkieTutorials NinjaNoor Stars PautipsPinkfong Baby SharkPozziPrimitive TechnologyRobleisIUTURosanna PansinoRudy MancusoSafiya NygaardSam TsuiSamHarveyUKSHALOM BLACSimone Giertzskinnyindonesian24Sofia Castro @StrayRogue and @DitzyFlama (Bongo Cat)sWooZieTabbesTechnical Guruji The Try GuysTheKateClappTheOdd1sOutTiền Zombie v4 Trevor NoahTrixie MattelWengieWhinderssonNunesWill SmithYammy Yes TheoryAll comments featured in Rewind inspired by real comments from the YouTube community."
"ZdbI5cM_w0s","The Creepiest Urban Legends To Keep You Up At Night","2018-12-08T16:00:05.000Z","UCKijjvu6bN1c-ZHVwR7-5WA","BuzzFeed Unsolved Network","22","18.16.12","buzzfeed unsolved,unsolved,urban legends,buzzfeed urban legends,creepy stories,scary stories,buzzfeed scary,buzzfeed mysteries,buzzfeed mystery,buzzfeed true stories,unsolved network,buzzfeed unsolved network","367274","8646","1526","1144","https://i.ytimg.com/vi/ZdbI5cM_w0s/default.jpg","False","False","Credits: https://www.buzzfeed.com/bfmp/videos/60392Welcome to the BuzzFeed Unsolved Network! This channel is your one-stop destination for all things mystery, conspiracy, supernatural, true crime, and everything in between. Subscribe here: http://bit.ly/2zuaR06.MUSICSFX Provided By AudioBlocks(https://www.audioblocks.com)Drone Town_undrscr.aifLicensed via Warner Chappell Production Music Inc.Shadow Dance Part II_fullmix.aifLicensed via Warner Chappell Production Music Inc.CE The Dungeon Pad_fullmix.aifLicensed via Warner Chappell Production Music Inc.CE Sexual Differences_fullmix.aifLicensed via Warner Chappell Production Music Inc.Trapped In A Gap_fullmix.aifLicensed via Warner Chappell Production Music Inc.STILLSStatue of an Angel in the cemetery holding flowersmzajac/Getty ImagesDirty white car with fingerprintsMac99/Getty ImagesVIDEOFootage provided by VideoBlocks(http://vblocks.com/x/BuzzFeedYouTube)Chapel and cemetery in Agios Fokas LaconiaVoyagerix/Getty ImagesA view of a typical Spanish apartment house.Kuan7777/Getty ImagesDriver playing car radio, stations shiftingAndrii Bicher/Getty Images4k Absract light backgroundayagiz/Getty ImagesWhite snowdrop flowers in an old cemeteryopal2/Getty ImagesFlying down the Potomac River with D.C. in the distance.viafilms/Getty ImagesAntique Gravestones on Old Jewish Cemetery at Sunrise Steadicammaradek/Getty ImagesElectric Voltage Meter.Electrician using voltmeter for checking office equipmentIIhor/Getty ImagesCamera slides over autumn lawn to reveal ranch suburban home at nightJoseph  Kelly/Getty Imagesnight movement of trains on a railway junctionalex57111/Getty Imagesgirl sitting on chair and playing with a doll.Елена Новикова/Getty ImagesPanoramic view of coniferous trees in a misty forestLPinchuk/Getty ImagesEstablishing shot of old historical building on busy street in small american townJoseph  Kelly/Getty ImagesFedaia Mountain Pass, Dolomites, ItalyLady-Photo/Getty ImagesDriving through Fedaia Mountain Pass. Dolomites, ItalyLisa-Blue/Getty ImagesHeadlights of car approaching on a dark roadStusya/Getty ImagesEaster adorable white bunny outdoor on green background running away. Slow motionKristina Kokhanova/Getty ImagesExterior crime scene tape outside daytime Police Line Do Not Cross dolly shotJaimeByrd/Getty ImagesClose-up backlit view of centre pivot irrigatiing vegetablesMartinHarvey/Getty ImagesCave Paintings Of Animals By FirelightRockfordMedia/Getty Imagesyoung woman hitch-hiking on a road at the fields. Young girl hippy hitchhiking on the road. Among the mountains in nature. Going on the road.Sibfilm/Getty Imagesdefocused dance floorbennymarty/Getty ImagesCLOSE UP Derelict decaying home next to beautiful semi-detached house in Detroithelivideo/Getty ImagesCLOSE UP: Two semi-detached abandoned decaying houses in Detroithelivideo/Getty ImagesAerial of Waterfront City Park with Piers and Downtown City Skyscraper Buildings in BackgroundOpenRangeStock/Getty ImagesFire In Wooden HouseAeroshotpro/Getty ImagesMorning fog on a calm river, sepia toned3sbworld/Getty ImagesCherry blossom in the windpkujiahe/Getty Images4K Horror Shot Of Woman Trying to Breath in Plastic BagMarioProduction/Getty Images4K Crime Scene Evidences and Dead Body Finger MovingMarioProduction/Getty ImagesHiker walking away from the cameraSpencer_Whalen/Getty ImagesSpooky Old Metal Gate Under A Lightning StormNissim Farin/Getty ImagesCemetery at night with colorful candles for All Saints Day. All Saints' Day is a solemnity celebrated on 1 November by the Catholic Church. Static shotramiai/Getty ImagesBeautiful old ruined house.Kolidzei/Getty ImagesHanging Rope in Windtavi_repede/Getty Images4k Halloween Shot of a Horror Woman Screaming with Blackout EyesMarioProduction/Getty ImagesManhattan Bridge at sunset establishing shotErikvanIngen/Getty ImagesManhattan Bridge at sunset establishing shotErikvanIngen/Getty ImagesCrash  at night roadiv-serg/Getty ImagesCouple is dancing together at clubiD-Stock/Getty ImagesFlythrough shot of energetic party people dancing in clubwundervisuals/Getty ImagesNoose and the abandoned farmhouse.Blooms-Studio/Getty ImagesMoon over the lake at night.Blooms-Studio/Getty Imagesfire in wooden housezgr_pro/Getty ImagesFence Traffic Timelapserevelpix/Getty ImagesSolitary tree on green meadow, timelapse clouds at sunsetcircotasu/Getty ImagesWhite female wild sheepTwitchyFilms/Getty Imagesfire in wooden housezgr_pro/Getty ImagesHanging noose with the moon in the background.Blooms-Studio/Getty ImagesBaby Doll in the Cornerrevelpix/Getty ImagesEaster bunny waiting for laundryviafilms/Getty ImagesDOLLY: Little girl goes to schoolbenjikat/Getty ImagesGroup of family photos, dolly movementviafilms/Getty Images"
"0ZClCVajB-s","How I Met My Cute Wife","2018-12-07T21:11:13.000Z","UCsDmESjqNPukDmVnuneLrqw","It's Alex Clark","1","18.16.12","its alex clark,itsalexclark,alex clark,itsalexclark youtube,youtube itsalexclark,itsalexclark channel,animation,animation channel,animated,animated videos,alex clark youtube,youtube alex clark,alex clark channel,alex clark vlogs,clark cartoons,cute wife,hot babysitter,how i met your mother,how I met my wife,how I met my fiance,fiance story,hit on,wife you up,marriage proposal,marriage story,who is alex clark's girlfriend,wedding story animation","2483128","104405","3939","7906","https://i.ytimg.com/vi/0ZClCVajB-s/default.jpg","False","False","First name wife. Last name cutie.  Grab tickets to my tour: http://www.itsalexclark.comPam's Channel: http://www.youtube.com/pamonsunsetHuion Contest: https://www.youtube.com/watch?v=ZfAmVmEm8vwSecret Video: https://bit.ly/2HOx0WSAnimation Team:Chris: http://bit.ly/tanimaytoJeff: https://jeff-fam.tumblr.comSupport our animations: https://Patreon.com/itsalexclarkWe draw all our videos with products from Huion: http://bit.ly/huionclarkFollow ItsAlexClark!Facebook: https://facebook.com/itsalexclark/Instagram: https://instagram.com/itsalexclark/Twitter: https://twitter.com/itsalexclarkOfficial Website: http://itsalexclark.com/What I make these videos with:Final Cut Pro X: http://go.magik.ly/ml/7cvu/Get these Cheap lights: https://goo.gl/74tza7 And attach them to this: https://goo.gl/Qp8aefToon Boom Harmony: https://store.toonboom.com/studentsMost of our music comes from Epidemic (30-Day Free Trial): http://bit.ly/itsalexmusicWritten by:Alex ClarkMail me packages and stuff: Alex ClarkP.O. Box 192022LA, CA 90019Email: sayhello (at) itsalexclark (dot) comSpecial Thanks to our Inner Circle of Friendship and Family Tier PatronsStephan ReedErich leeMariam GegechkoriArjun BlairTrey SimmonsJon McmasterAmy M MayfieldTony SullivanAriana BransfordJack souchMolly Dowling"
