video_id,title,publishedAt,channelId,channelTitle,categoryId,trending_date,tags,view_count,likes,dislikes,comment_count,thumbnail_link,comments_disabled,ratings_disabled,description
"RSvj0-kNZ2g","twenty one pilots: arizona","2018-11-11T23:52:56.000Z","UCBQZwaNPFfJ1gZ1fLZpAEGw","twenty one pilots","10","18.19.11","twenty one pilots,bandito tour,tøp bandito tour,twenty one pilots arizona,twenty one pilots behind the scenes,josh dun,tyler joseph,twenty one pilots tour,twenty one pilots 2013,tøp first arizona show,tøp arizona,official recap,bandito tour arizona,tøp talking stick arena,bandito tour talking stick,tøp history,official tøp,twenty one pilots official,bandito tour phoenix,twenty one pilots phoenix","465885","52272","334","4342","https://i.ytimg.com/vi/RSvj0-kNZ2g/default.jpg","False","False","twenty one pilots played a show in arizona for the first time back in 2013.the album TRENCH, available now on Fueled By Ramen.  http://top.lnk.to/trenchBanditø TourSee all 2018-2019 dates + get tickets at http://twentyonepilots.com/banditotourDEC 7 Perth, AU @ Perth ArenaDEC 10 Adelaide, AU @ Adelaide Entertainment CentreDEC 13 Melbourne, AU @ Rod Laver ArenaDEC 16 Sydney, AU @ Qudos Bank ArenaDEC 18 Brisbane, AU @ Brisbane Entertainment CentreDEC 21 Auckland, NZ @ Spark ArenaJAN 30 Kiev, UA @ Palace of SportsFEB 2 Moscow, RU @ VTB Arena - SOLD OUTFEB 4 St. Petersburg, RU @ Ice PalaceFEB 6 Helsinki, FI @ Ice HallFEB 8 Stockholm, SE @ Ericsson Globe ArenaFEB 9 Oslo, NO @ Telenor ArenaFEB 11 Copenhagen, DK @ Royal ArenaFEB 12 Hamburg, DE @ Barclaycard ArenaFEB 14 Berlin, DE @ Mercedes-Benz ArenaFEB 15 Lodz, PL @ Atlas Arena - SOLD OUTFEB 16 Prague, CZ @ The O2 Arena - SOLD OUTFEB 17 Vienna, AT @ Wiener Stadthalle - SOLD OUTFEB 21 Bologna, IT @ Unipol Arena - SOLD OUTFEB 23 Zurich, CH @ Hallenstadion ZurichFEB 24 Stuttgart, DE @ Hanns-Martin-SchleyerhalleFEB 25 Cologne, DE @ Lanxess ArenaFEB 27 Birmingham, UK @ Genting Arena - SOLD OUTMAR 1 Dublin, IE @ 3Arena - SOLD OUTMAR 2 Belfast, UK @ SSE Arena BelfastMAR 4 Glasgow, UK @ The SSE Hydro ArenaMAR 5 Manchester, UK @ Manchester Arena - SOLD OUTMAR 7 London, UK @ The SSE Arena Wembley - SOLD OUTMAR 8 London, UK @ The SSE Arena Wembley - SOLD OUTMAR 9 London, UK @ The SSE Arena WembleyMAR 11 Paris, FR @ Accorhotels Arena - SOLD OUTMAR 12 Amsterdam, NL @ Ziggo Dome - SOLD OUTMAR 13 Brussels, BE @ Palais 12 - SOLD OUTMAR 15 Bilbao, ES @ Bizkaia Arena (BEC!)MAR 16 Madrid, ES @ WiZink Center - SOLD OUTMAR 17 Lisbon, PT @ Altice ArenaMAY 1 Monterrey, MX @ Arena MonterreyMAY 3 Mexico City, MX @ Sports PalaceMAY 4 Mexico City, MX @ Sports PalaceMAY 6 Guadalajara, MX @ ARENA VFGMAY 12 Vancouver, BC @ Pepsi Live at Rogers ArenaMAY 14 Calgary, AB @ Scotiabank SaddledomeMAY 15 Edmonton, AB @ Rogers PlaceMAY 17 Winnipeg, MB @ Bell MTS PlaceMAY 20 London, ON @ Budweiser GardensMAY 21 Ottawa, ON @ Richcraft Live at Canadian Tire CentreMAY 22 Montreal, QC @ Bell CentreMAY 28 Toronto, ON @ Scotiabank ArenaMAY 29 Toronto, ON @ Scotiabank ArenaMAY 31 Grand Rapids, MI @ Van Andel Arena - SOLD OUTJUN 1 Buffalo, NY @ KeyBank CenterJUN 4 Brooklyn, NY @ Barclays CenterJUN 5 Newark, NJ @ Prudential CenterJUN 7 Pittsburgh, PA @ PPG Paints ArenaJUN 8 Atlantic City, NJ @ Boardwalk HallJUN 9 Charlottesville, VA @ John Paul Jones ArenaJUN 11 Raleigh, NC @ PNC ArenaJUN 12 Charlotte, NC @ Spectrum CenterJUN 14 Jacksonville, FL @ Jacksonville Veterans Memorial ArenaJUN 15 Miami, FL @ AmericanAirlines ArenaJUN 16 Orlando, FL @ Amway CenterJUN 18 Birmingham, AL @ Legacy Arena at the BJCCJUN 19 New Orleans, LA @ Smoothie King CenterJUN 21 Houston, TX @ Toyota CenterJUN 22 San Antonio, TX @ AT&T CenterJUN 23 Austin, TX @ Frank Erwin CenterJUN 25 Oklahoma City, OK @ Chesapeake Energy ArenaJUN 26 Memphis, TN @ FedExForumJUN 28 Indianapolis, IN @ Bankers Life FieldhouseJUN 29 Columbus, OH @ Nationwide Arena - SOLD OUTJUN 30 Columbus, OH @ Nationwide Arena - SOLD OUTShot and edited by Reel Bear Media#TwentyOnePilots #BanditoTour #TRENCH"
"1X7iNzX3xvk","23-Year-Old Completes Trip Across Country on Rollerblades","2018-11-11T11:36:52.000Z","UC9k-yiEpRHMNVOnOi_aQK8w","Inside Edition","25","18.19.11","across country,cat-news,country,florida,hong kong,ie newsdesk,inside edition,inside_edition,news,rollerblade,skate,united states,us,woman,woman rollerblades across country","1047524","28682","1135","4769","https://i.ytimg.com/vi/1X7iNzX3xvk/default.jpg","False","False","The young woman who traveled coast to coast on Rollerblades has completed her nearly 4,000-mile journey. At times, 23-year-old Yanise Ho battled severe heat, heavy rains and fierce winds, but nothing could stop her. She kicked off her adventure in Miami, documenting the seven-month trip with a makeshift selfie stick. Most impressively, she traveled with no money, relying instead on the kindness of others to give her a place to sleep and eat."
"9qlG8afEKXg","DEEP DISH PIZZA 🍕VS DEEP DISH PIZZA 🍕","2018-11-11T16:11:01.000Z","UCY1Yc3xA1aY0lqnKUTDTi7A","HellthyJunkFood","24","18.19.11","Lenovo,Lenovo Smart Display,Smart Display,Smart,Display,Google Assistant,Assistant Google,#Lenovo,#Google,Made by Google,tech,technology,best new tech,new tech,smart speaker,smartspeaker,touch screen,touch,screen,smart home,hellthyjunkfood,healthyjunkfood,healthy junk food,healthy junkfood,hellthy junkfood,deep dish pizza,deep dish,pizza,pizza challenge,cooking,cooking challenge,best deep dish pizza,homemade,homemade pizza,homemade deep dish pizza","489111","10278","795","1257","https://i.ytimg.com/vi/9qlG8afEKXg/default.jpg","False","False","Inspired by our trip to Chicago, we decided to have a deep dish pizza cooking challenge. Who will make the better pizza? 🍕Thanks to Lenovo for this paid partnership! #Ad #LenovoSmartDisplayTo purchase the Lenovo Smart Display visit http://www.lenovo.com/hellthyjunkfood(Save 50%! on an 8” Lenovo Smart Display between Nov 22 and Nov 26!) Check out other awesome creators’ Lenovo Smart Display videos at http://bit.ly/LenovoSmartDisplayVideosSUBSCRIBE HERE ➡️ https://goo.gl/CitGia2ND CHANNEL ➡️ https://goo.gl/4HUP8JONLINE STORE:http://bit.ly/HJFShopTHINGS YOU’LL NEED:Kitchen Aid: https://amzn.to/2L3imw0Deep Dish Pizza Pan: https://amzn.to/2QWqRg4HJF Cutting Board: http://bit.ly/2Eyhr3RHJF Apron: http://bit.ly/2Ez9Cz0FULL RECIPE DETAILS:http://www.hellthyjunkfood.com/deep-dish/🍔Social Media Links🍔  @HellthyJunkFoodhttp://www.facebook.com/hellthyjunkfoodhttp://www.instagram.com/hellthyjunkfoodhttp://www.twitter.com/hellthyjunkfoodhttp://www.patreon.com/hellthyjunkfoodhttp://www.twitch.com/hellthyjunkfoodSnapchat - HellthyJunkFoodMusic - Epidemic Sound"
"TyOpNGXMX0o","Lucas The Spider - New Friend","2018-11-10T20:08:11.000Z","UCNqRS1gSJFMNPVwye1gyI_g","Lucas the Spider","1","18.19.11","LucastheSpider,Animation,3D Animation,Cute,YtKids,Cartoon,Funny,Funny Animals,Family Entertainment,Cute Animal,Spider,Animal,Pre-School,Animal Video,Pets,youtube kids,Kids","2382233","148471","1342","8626","https://i.ytimg.com/vi/TyOpNGXMX0o/default.jpg","False","False","Just as Lucas the Spider had started to lose all hope for a new friend, his bell started ringing! Who could it be?! Follow Lucas's exciting new adventure to find out!Do you love Lucas the Spider? Check out our online store for cute animal merchandise! https://teespring.com/stores/lucas-the-spider© 2018 Fresh Interactive Inc. All Rights Reserved."
"yCaFfWBybvY","We Reveal Our Texting Habits • Ladylike","2018-11-11T16:00:05.000Z","UCcOeS5aEIadAhKtJ9_VKAIw","Ladylike","22","18.19.11","buzzfeed,buzzfeed ladylike,Kristin Chirico,Chantel Houston,texting,emoji,debate,dating,needy,bad texter,ghosted,texting habits,text,ladylike","594999","15037","1047","1400","https://i.ytimg.com/vi/yCaFfWBybvY/default.jpg","False","False","Texting your crush is like playing tennis for people who don't know how to play tennis.LadylikeSubscribe for your weekly dose of Freddie, Chantel, Devin, Kristin and Jen and all the antics that they get up to. Expect new videos every Wednesday, Saturday, and Sunday. We are so excited to have you here!LadyLike on Instagram: https://www.instagram.com/buzzfeedladylike/?hl=enLadyLike on Facebook: https://www.facebook.com/buzzfeedladylike/ For business inquiries email ladylikebusiness@buzzfeed.comCredits: https://www.buzzfeed.com/bfmp/videos/69534Check out more awesome videos on Ladylike!https://bit.ly/2nbQuy4GET MORE BUZZFEED:https://www.buzzfeed.comhttps://www.buzzfeed.com/videoshttps://www.youtube.com/buzzfeedvideohttps://www.youtube.com/asishttps://www.youtube.com/buzzfeedmultiplayerhttps://www.youtube.com/buzzfeedviolethttps://www.youtube.com/perolikehttps://www.youtube.com/ladylikeMUSICLicensed via Audio NetworkSFX Provided By AudioBlocks(https://www.audioblocks.com)"
"SqAVbvHRMZ8","YouTubers React To Try Not To Sing Along Challenge (Internet Songs)","2018-11-10T22:00:02.000Z","UC0v-tlzsn0QZwJnkiaUSJVQ","FBE","24","18.19.11","Try not to sing,internet songs,BED INTRUDER SONG,YouTubers React To Try Not To Sing Along Challenge (Internet Songs),reacts,reaction,reactions,youtubers react,thefinebros,fine brothers,fine brothers entertainment,FBE,watch,review,for the first time,reviews,responds,respond,elders react,teens react,kids react,adults react,parents react,college kids react,Elle Mills,Jessie Paege,Jordyn Jones,Veronica Merrell,Vanessa Merrell,Noah Grossman,smosh,TheOdd1sOut","1420190","41434","1451","7819","https://i.ytimg.com/vi/SqAVbvHRMZ8/default.jpg","False","False","Click to subscribe to the YouTubers in this episode: http://bit.ly/2OBcM5nSUBSCRIBE THEN HIT THE 🔔. New Videos 2pm PT on FBE https://fbereact.com/SubscribeFBEWatch latest videos from FBE: http://fbereact.com/LatestFromFBEYouTubers try not ot sing along to classic internet songsl. Watch to see their Reactions.Content featured in this episode:BED INTRUDER SONG!!!http://bit.ly/2Dty2clRebecca Black - Fridayhttp://bit.ly/2z2gOyBShoes the Full Versionhttp://bit.ly/2RLJ2EJBadgers : animated music video : MrWeeblhttp://bit.ly/2FnbsE2It's Peanut Butter Jelly Time!!!http://bit.ly/2OCYFfUWhat does the fox sayhttps://goo.gl/MIjuagFBE’s goal is to credit the original links to the content featured in its shows. If you see incorrect or missing attribution please reach out to credits@fbeteam.comThis episode features the following YouTubers:Elle Millshttp://www.youtube.com/ElleOfTheMillsJessie Paegehttps://www.youtube.com/jessiepaegeJordyn Joneshttps://www.youtube.com/JordynJonesVeronica & Vanessa Merrellhttps://www.youtube.com/c/merrelltwinsNoah Grossmanhttps://www.youtube.com/smoshCib & James DeAngelishttp://www.youtube.com/SugarPine7TheOdd1sOuthttps://www.youtube.com/TheOdd1sOutcomicTimothy DeLaGhettohttps://www.youtube.com/TIMOTHYMERCH 👕 https://www.shopfbe.comFollow Fine Brothers Entertainment:FBE WEBSITE: http://www.finebrosent.comFBE CHANNEL: http://www.youtube.com/FBEREACT CHANNEL: http://www.youtube.com/REACTBONUS CHANNEL: https://www.youtube.com/FBE2FACEBOOK: http://www.facebook.com/FBEFACEBOOK: http://www.facebook.com/FBEShowsTWITTER: http://www.twitter.com/fbeINSTAGRAM: http://www.instagram.com/fbeSNAPCHAT: https://www.snapchat.com/add/finebrosSOUNDCLOUD: https://soundcloud.com/fbepodcastiTUNES (Podcast): https://goo.gl/DSdGFTGOOGLE PLAY (Podcast): https://goo.gl/UhL6bkMUSICAL.LY: @fbeTWITCH: https://www.twitch.tv/fbeliveAMAZON: https://www.amazon.com/v/FBEROKU: http://bit.ly/FBERokuSEND US STUFF:FBEP.O. BOX 4324Valley Village, CA 91617-4324Creators & Executive Producers - Benny Fine & Rafi FineHead of Production - Nick BergtholdCreative Director & Senior Producer - Derek BaynhamDirector of Post Production - Adam SpeasSupervising Producer - Kyle SegalProducer - Ethan WeiserJr. Producer - Vartuhi Oganesyan, JC ChavezProduction Coordinator - Alberto AguirreAssistant Production Coordinator - Kristy KieferPost Supervisor - Emily McGuinessEditor - Cara BomarAssistant Editor - Lizzy SiskindJr. Studio Technician - Oscar Ramos, Stephen Miller, Jayden RomeroProduction Assistant -  Lauren Hutchinson, Kyllis Jahn, Micah Kearny,Stefan Fior, Laura LareauStudio Technician - Sam KimSet Design - Melissa JudsonMusic - Cormac Bluestone http://www.youtube.com/cormacbluestone© Fine Brothers Entertainment.YouTubers React #200 - YouTubers React To Try Not To Sing Along Challenge (Internet Songs)"
"p4ZDcjR3Ypc","Step up your cookie game with these delicious cookie recipes! I Dessert ideas by So Yummy","2018-11-11T12:00:03.000Z","UCH8NnRkxQg1zX7mHFRPq73g","So Yummy","26","18.19.11","so yummy,home cooking,recipes,best recipes,food recipes,easy recipes,easy recipe,easy food to make at home,food ideas,how to cook,recipe,cooking show,food tutorial,how to,cookie,cookies,dessert,dessert ideas,dessert ideas so yummy,dessert recipes,diy,best recipes video,easy dessert recipes,cake,how to make,cake videos,satisfying,cake decorating,satisfying cake decorating,cake decorating ideas,cake tutorial,amazing cakes,yummy cake,cakes","1356808","20871","778","979","https://i.ytimg.com/vi/p4ZDcjR3Ypc/default.jpg","False","False","Step up your cookie game with these amazing dessert ideas! Try making our hot cocoa cookies at home by following this recipe http://bit.ly/hotcocoacookiesbysoyummy Let us know how it turned out in the comments below :) About So YummySo Yummy brings you fun food ideas and recipes for your cooking and baking adventures. We believe that home cooking should always be fun, interesting, and easy to do! Enjoy our collection of fun and easy food tutorials! With recipes ranging from healthy dinners, to sugary sweet delights, there's a plethora of creative options to spice up your home cooking. Our easy-to-follow, wonderfully edited videos show you how to cook and bake these recipes with ease. Thanks for watching, and subscribe today by clicking the link below!https://www.youtube.com/channel/UCH8NnRkxQg1zX7mHFRPq73g?sub_confirmation=1"
"a5t1bBN9fRQ","Veterans Voices | Listening is Honoring","2018-11-11T03:08:32.000Z","UCK8sQmJBp8GCxrOtXWBpyEA","Google","28","18.19.11","[none]","7712033","20098","1376","2067","https://i.ytimg.com/vi/a5t1bBN9fRQ/default.jpg","False","False","Andy Fancher is a 19-year-old on a mission to preserve history. For the past three years, he’s been documenting the stories of World War II veterans on his YouTube channel. This Veterans Day, he’s using the StoryCorps app to record an oral history with an important veteran in his life, and archive it in the Library of Congress. Visit http://storycor.ps/veterans to record an oral history with a veteran in your life. In honor of the brave individuals who have served our country, StoryCorps, Google and YouTube are working together to highlight the stories of past and present service members from all branches of the military with a Veterans Day Google Doodle that features the voices of five veterans.-------------To learn more about the Veterans Day Google Doodle, visit: g.co/veteransvoicesTo learn more about Andy Fancher’s films, visit his YouTube Channel: https://www.youtube.com/channel/UCBUkAyb841r533idYMAVj2Q"
"ZhBxQCAbML0","FASHION PHOTO RUVIEW: All Stars 4 Cast w/ Kameron Michaels & Asia O'Hara!","2018-11-10T16:38:10.000Z","UCUUUpaMp8DV6KUOfQwoIiLg","WOWPresents","24","18.19.11","world of wonder,world of wonder productions,wow report,toot and boot,rupaul's drag race all stars,kameron michaels,asia o'hara,all stars","647990","16515","2620","5074","https://i.ytimg.com/vi/ZhBxQCAbML0/default.jpg","False","False","Find out if All Stars 4 will be available in your territory on WOW Presents Plus!https://help.wow-presents.comWatch New and Uncensored Episodes on WOW Presents Plus:https://worldofwonder.vhx.tvSubscribe: http://youtube.com/subscription_center?add_user=wowpresentsRead More at: http://worldofwonder.net/RuPaul's DragCon LA, May 24, 25, 26!From World of Wonder, the producers of The Eyes of Tammy Faye, Party Monster, The Strange History of Don't Ask, Don't Tell, The Last Beekeeper, RuPaul's Drag Race, Life With La Toya, and Million Dollar Listing."
"oicXRb50H_I","CATCHING EXERCISE BALLS from 165m Dam!","2018-11-09T21:58:24.000Z","UC5f5IV0Bf79YLp_p9nfInRA","How Ridiculous","17","18.19.11","how ridiculous,magnus effect,oobleck,rc cars,how ridiculous rc car,bowling ball vs trampoline,bowling ball,giant dart,trampoline,bowling ball vs oobleck,anvil vs car,how ridiculous giant dart,basketball,how ridiculous darts,basketball connect 4,bowling,anvil vs fridge,44 club,anvil,anvil vs,catching,soccer ball,tennis ball","5904292","107435","8411","16836","https://i.ytimg.com/vi/oicXRb50H_I/default.jpg","False","False","Catching exercise balls at Luzzone Dam, Ticino, Switzerland.SUBSCRIBE ➤ http://bit.ly/SubHowRidiculousBUY NEW MERCH ➤ http://tidd.ly/8b33c00bSOCIALSInstagram ➤ (@HowRidiculous): http://bit.ly/FollowHRonInstaFacebook ➤ http://bit.ly/HRFaceyTwitter     ➤ (@howridiculous): http://bit.ly/HRTweetyA huge thank you to Ticino Tourism for helping to make this happen! We had an epic time visiting this incredible part of the world and filmed heaps of new videos that are coming soon. Do yourself a favour and go experience Ticino for yourself, it's amazing! For more info check out https://www.ticino.ch/en/What's the 44 Club you may ask? Well it all started in the outro of this video https://www.youtube.com/watch?v=AyLPMhp7qbs where we wondered if anyone was still watching the video at that point, and to comment 44 (Scott's fave number) if they were. Brett then said 44 Club get on board and the rest is history. The 44Club is the official How Ridiculous fan club made up of people who love our videos and watch them right to the very end. We've even got 44 Club merch now! So yeh, that's the story. Pretty random but good fun at the same time.We are passionate about seeing children released from poverty and we would love you to consider sponsoring a child with Compassion. We visited our sponsor children in the Philippines and were blown away by the difference that child sponsorship can make. To find out more about sponsoring a child right now, check out: http://cmpsn.co/howridiculousMusic by Chillhop: https://chillhop.lnk.to/listenCSBrock Berrigan - Hotwire (https://soundcloud.com/brockberrigan)Globuldub - Foreign Exchange (https://soundcloud.com/globuldub)Iamalex - If Only For A Day (https://soundcloud.com/iamalexcph)For fan mail or other items please send to: How Ridiculous PO Box 7045 Karawara WA 6152 AustraliaFor Business or Media Inquiries: management@howridiculous.orgFor Licensing Inquiries: licenses@howridiculous.orgFor online use, you may embed this YouTube video - for usage in other players please contact us for permission.© Copyright 2018 How Ridiculous"
"9Jkj-_4T5eM","IRONMAN Stop Motion Action Video Part 7","2018-11-10T13:30:00.000Z","UC59jm6JUT_PNciq8XNHDCbA","lozaus1","1","18.19.11","Spiderman,spider-man,ironman,ironman vs thanos,avengers,infinity stone,spiderman stop motion,ironman stop motion,thanos,marvel,infinity war,marvel animation,spiderman animation,rhino,super heroes,lozaus1,spiderman cartoon,captain america,dr strange,antman,ironspider,ironspiderman upgrade,time stone,ironman stop motion action video","2522297","31001","1486","1943","https://i.ytimg.com/vi/9Jkj-_4T5eM/default.jpg","False","False","Starring IronMan, Spider-Man (Iron Spider) Thanos, Rhino, Hulk, Captain America, Dr Strange and Ant Man Thanos has disintegrated half the population of the house. Stefan has also been disintegrated!IronMan, now with his new suit has decided to deal with Thanos alone…Thanks to Big Bad Toy Storehttp://www.bigbadtoystore.com/?utm_source=youtube&utm_campaign=lozaus1Disintegration effects thanks to RED GIANThttps://www.redgiant.com/ https://www.redgiant.com/products/trapcode-particular/#compatibilityAlso thanks to..Egg Attack figures are made by Beast kingdom. Check them out here :Beast Kingdom website    https://www.beast-kingdom.com.twHelp support this channel by becoming a LOZAUS patron  https://www.patreon.com/user?u=2432040For other stop motion videos, Check out...IN CHRONOLOGICAL ORDERhttps://www.youtube.com/playlist?list=PLclsZGg7FL721QXg6VTRE7B7n8HTqfojMSPIDERMAN STOP MOTION ACTION FIGURE SERIEShttps://www.youtube.com/playlist?list=PLclsZGg7FL721QXg6VTRE7B7n8HTqfojMthe new Spider-Man STOP MOTION ACTION SERIEShttps://www.youtube.com/playlist?list=PLclsZGg7FL73VsMYcbToSVpuDUrziR6kHIRONMAN STOP MOTION SERIEShttps://www.youtube.com/playlist?list=PLclsZGg7FL72Yspuk0zTJHgCgXhk4bWf-BABY SPIDEY STOP MOTION SERIEShttps://www.youtube.com/playlist?list=PLclsZGg7FL71dUj0lofxrwbYyi7ri5mSmSCARBU STOP MOTION SERIEShttps://www.youtube.com/playlist?list=PLclsZGg7FL71cglnKIO5bA_UG4pzrZqzh                                                                      Music by                                    epidemicsound.com                                        jewelbeat.com                                &  videocopilot.comMost sounds were made by us, purchased from videocopilot.com and some need to be credited to the following members/users of freesound.org. Those members and sounds are as followsfreemaster2__thunderstorm-loudwolffvisuals__wiping-windowswosh.aif by manCinematic Bass Boom by CosmicEmbersThud-dry.wav by juskiddink punch.wav by ekokubza123omar-alvarado__impact-hitBrutal Slaps by Project_TridentCrash02.wav by FreqMan"
"0EhPuWbblh4","Making PERFECT Cotton Candy!","2018-11-10T20:09:50.000Z","UCjwmbv6NE4mOh8Z8VhPUx1Q","Rosanna Pansino","26","18.19.11","cotton candy,candy,fair,fair food,faire,recipe,jellybeans,from scratch,simple,easy,step by step,guide,tutorial,food,tasty,delicious,yummy,talking tom,my talking tom,my talking tom 2,app,app game,game,lets play,gameplay,unlock,impossible,perfect,guest,collab,cat,animal,pet,rosanna pansino,perfection,have to try,tips,tricks,hacks,fail,epic fail,win,nailed it,chef,how to make,how to cook,how to bake,decorate,kitchen,challenge,sweet,treat,idea,gift,party","955826","24421","974","3205","https://i.ytimg.com/vi/0EhPuWbblh4/default.jpg","False","False","This video is sponsored by My Talking Tom 2 (Outfit 7 Limited) #adDownload My Talking Tom 2 (FREE): https://go.onelink.me/sc3f/23618127Today I figure out the PERFECT pink cotton candy recipe! SUBSCRIBE ► https://www.youtube.com/subscription_center?add_user=rosannapansinoWATCH MY LAST VIDEO ► https://www.youtube.com/watch?v=Jkdx1Xtec8w-------------------------------------------------------------------------- *BUY MY NEW COOKBOOK: http://www.BakingAllYearRound.comBaking Line: https://www.amazon.com/shop/rosannapansinoNerdy Nummies Cookbook: http://rosannapansino.com/the-nerdy-nummies-cookbook/--------------------------------------------------------------------------ADD ME ON:Facebook: http://www.facebook.com/rosannapansinoTwitter: http://www.twitter.com/RosannaPansinoInstagram: http://instagram.com/rosannapansinoSnapchat: rosannapansinoWebsite: http://www.RosannaPansino.com--------------------------------------------------------------------------I hope you enjoy today' #Tutorial video!  We tried many different ways to make the cotton candy from #MyTalkingTom2 to find the perfect way to make pink cotton candy! Some worked great, some not so much! It was so much fun!xoxo Ro"
"qdXZA2bdR_k","D&D Story: “Whoops! Guess EVERYONE has to die now.”","2018-11-10T15:49:53.000Z","UCUpkp-6fXuG9dqfoJ99XTmw","Puffin Forest","23","18.19.11","Puffin,Forest,RPG,Dungeons and Dragons,D&D,Animated,Cartoon,Roleplaying,Story","779074","31794","540","2825","https://i.ytimg.com/vi/qdXZA2bdR_k/default.jpg","False","False","This animated Dungeons and Dragons story comes from when I ran a mission for the first time in Adventurer's League. I accidentally misread the adventure and turned out I made some crucial mistakes when running it. End song: Bluebird from the Youtube Audio Library"
"mPYl_uI5ipA","The Art of Betrayal  - The Office US","2018-11-10T17:00:05.000Z","UCa90xqK2odw1KV5wHU9WRhg","The Office US","24","18.19.11","the office,the office full episodes,rainn wilson,john krasinski,steve carell,michael scott,the office fire drill,jim and dwight pranks,dwight schrute,jim halpert,jenna fischer,the office thug life,the office funniest moments,the office bloopers season 1,the office cpr,the office parkour,Best The Office Moments,Michael and dwight,nbc,snl,anchorman","512416","10480","135","911","https://i.ytimg.com/vi/mPYl_uI5ipA/default.jpg","False","False","JUDASWatch The Office US on Google Play: http://bit.ly/2xYQkLD & iTunes http://apple.co/2eW0rcKSubscribe: http://bit.ly/2y5VK8NThis is the official YouTube channel for The Office US. Home to all of the official clips from the series, the funniest moments, pranks and fails. Think we should feature your favourite episode? Let us know in the comments! FB : https://www.facebook.com/theofficenbcTwitter : https://twitter.com/theofficenbcWebsite : http://www.nbc.com/the-office#NBC #TheOfficeUS #Comedy"
