video_id,title,publishedAt,channelId,channelTitle,categoryId,trending_date,tags,view_count,likes,dislikes,comment_count,thumbnail_link,comments_disabled,ratings_disabled,description
"XUL551rqpUU","रविवार Special भजन: Arghya Chadhaao Prani,Hare Rama Hare Krishna Dhun, ANURADHA PAUDWAL, KUMAR VISHU","2018-12-09T00:30:49.000Z","UCaayLD9i5x4MmIoVZxXSv_g","T-Series Bhakti Sagar","10","18.11.12","aisi laagi lagan,meera ho gaimagan,bhajan sandhya,T-Series Bhakti Sagar,krishna bhajans,hari bhajan,shri,top devotional songs,bhakti songs,bhakti bhajan,bhakti albums,gopal,krishan,kunj bihari,anuradha paudwal top bhajans,top bhakti songs,jag,भजन संध्या,कृष्ण भजन,राम भजन,morning bhajan,morning bhakti bhajan,morning bhakti songs,top Devotional,Surya Upasana bhajan,lord surya,bhaskar,ravi,hare,rama,krishna,janmashtami special bhajan,bhajan","602579","3195","513","591","https://i.ytimg.com/vi/XUL551rqpUU/default.jpg","False","False","Subscribe: http://www.youtube.com/tseriesbhaktiTIME CODE: Arghya Chadhaao Prani   00:00Hare Rama Hare Krishna Dhun   06:23Lod Surya Bhajan: ARGHYA CHADHAAO PRANI Singer: ANURADHA PAUDWAL Music: ARUN PAUDWALLyrics:  KIRTI ANURAG, BHARAT ACHARYA, PANDIT KIRAN MISHRA Album: Surya UpasanaMusic Label: T-SeriesKrishna Dhuni: Hare Krishna Hare Rama DhunSinger: Kumar VishuMusic Director: Anil Sharma  Lyrics: TraditionalAlbum: Govind Bolo Hari Gopal BoloMusic Label: T-SeriesIf You like the video don't forget to share with others & also share your views.Stay connected with us!!!► Subscribe: http://www.youtube.com/tseriesbhakti► Like us on Facebook: http://www.facebook.com/tseriesbhaktisagar► Follow us on Twitter: https://twitter.com/tseriesbhaktiFor Spiritual Voice Alerts, Airtel subscribers Dial 589991 (toll free) To set popular Bhakti Dhun as your HelloTune, Airtel subscribers Dial 57878881"
"BW9wY7qPofk","7 variety lunchbox Recipes | Easy LunchBox Recipe in Tamil | லஞ்ச் பாக்ஸ் ரெசிபி | Papa's Kitchen","2018-12-09T07:41:55.000Z","UC9oPCWZ6Wh5WG68YcEmCXNA","Papa's Kitchen","2","18.11.12","lunchbox Recipe,Kitchen,variety rice,in tamil,ஏழு நாள் ஏழு வகை சாதம்,puthina,mint,puthina rice,mint rice,ghee rice,Thengai satham,carrot rice,Tomato briyani,tomato rice,Coconut milk rice,mango rice,biriyani,easy,healthy,rice,kids,idea,Papa's Kitchen,லஞ்ச் பாக்ஸ் ரெசிபி,செய்வது எப்படி,YouTube recipe,Madras Samayal Lunchbox recipes","73574","850","81","172","https://i.ytimg.com/vi/BW9wY7qPofk/default.jpg","False","False","YouTube Lunchbox recipe, variety rice, 7 variety lunchbox Recipes |  இனி குழப்பம் இல்லாம சட்டுனு லஞ்ச்பாக்ஸ் ரெசிபி செய்யலாம் | Easy Lunch Box's recipe, #lunchboxeRecipes #7VarietyRice#Youtubelunchbox #easylunchbox #Papa's Kitchen #healthyRecipe"
"UpgCN-mAwY8","शेजारच्या बाईपासून सावधान l इंदोरीकर महाराज यांचे कॉमेडी किर्तन l Indurikar Maharaj Comedy Kirtan","2018-12-07T11:30:01.000Z","UCTW7-0x11i8y0vJKWcMr2vQ","Marathi Tadka","24","18.11.12","Marathi Tadka,मराठी तड़का,nivrutti maharaj indurikar kirtan,nivrutti maharaj indurikar kirtan full comedy,nivrutti maharaj latest kirtan 2018,indurikar maharaj comedy kirtan,indurikar maharaj kirtan,indurikar maharaj kirtan latest 2018,indurikar kirtan,इंदुरीकर महाराज कीर्तन 2018,इंदुरीकर महाराज कीर्तन नवीन 2018,निवृत्ती महाराज देशमुख इंदोरीकर नवीन कीर्तन,निवृत्ती महाराज कीर्तन 2018,निवृत्ती महाराज देशमुख(इंदोरीकर),marathi medium vs english medium,bhajan,भजन","1112322","8130","976","437","https://i.ytimg.com/vi/UpgCN-mAwY8/default.jpg","False","False","शेजारच्या बाईपासून सावधान, ह.भ.प. इंदूरीकर महाराज कीर्तन, कडू पण सत्य, त्यांचे विचार जर मनाला पटले असतील तर जरूर Like करा share करा आणि subscribe करायला विसरू नका. व्हिडिओ बद्दलची प्रतिक्रिया comment मध्ये जरूर कळवा । धन्यवाद।Ⓒ Marathi Tadka 2018 Please Like, Share and Subscribe - Marathi Tadka☛ You tube  :  https://www.youtube.com/c/MarathiTadkaOfficial☛ Facebook :  https://www.facebook.com/marathitadkaOfficial☛ Instagram :  https://www.instagram.com/marathitadkaa☛ Twitter :  https://twitter.com/marathitadkaa☛ Website : http://marathitadka.com/☛ Write us   :  marathitadkateam@gmail.com☛ Whatsapp  :  8100007744Thank You!!"
"Y5mqhAbgF_0","Dhruva Sarja And Prerana Shankar First Reaction After Engagement | ಧ್ರುವ ಸರ್ಜಾ ಪ್ರೇರಣಾ ಮಾತು...?","2018-12-09T11:52:22.000Z","UC8hVoXNFmuLgz4wXRAxAbXg","Top Kannada TV","24","18.11.12","Top kannada TV,sandalwood news,kannada film news,sandalwood trailers,dhruva sarja,prerana,dhuva sarja reaction,prerana dhruva sarja,dhruva sarja engagement,dhruva sarja engagement news,latest kannada movie,karnataka politics,latest kannada songs,sandalwood,kannada fim actor,dhruva sarja latest videos,dhruva sarja press meet,dhruva sarja latest video","101330","876","55","54","https://i.ytimg.com/vi/Y5mqhAbgF_0/default.jpg","False","False","Dhruva Sarja And Prerana First Reaction After Engagement | ಧ್ರುವ ಸರ್ಜಾ ಪ್ರೇರಣಾ ಮಾತು...? #Dhruvasarja #Prerana #DhruvaKannada Short films, Darshan, Sudeep, Yash, Shivarajkumar, Puneethrajkumar Sandalwood updates,news,gossips and interviewsFacebook : https://www.facebook.com/TopkannadaTV"
"KGVG7V73xH8","Exit Poll ने उड़ाई BJP की नींद !","2018-12-10T05:52:49.000Z","UCt4t-jeY85JegMlZ-E5UWtA","Aaj Tak","25","18.11.12","aajtak,aaj tak,aaj tak videos,hindi news,news video,latest news,aajtak tv,aajtak channel news,आज तक,madhya pradesh,madhya pradesh news,madhya pradesh exit poll,madhya pradesh elections 2018,madhya pradesh election,madhya pradesh election 2018,madhya pradesh assembly election 2018,madhya pradesh elections,madhya pradesh election result,madhya pradesh assembly election","169249","951","149","126","https://i.ytimg.com/vi/KGVG7V73xH8/default.jpg","False","False","पांच राज्यों के चुनाव संपन्न हो चुके हैं, चुनावी नतीजे तो 11 दिसंबर को आएंगे लेकिन एक्जिट पोल के नतीजे सामने हैं. और अगर एक्जिट पोल के संकेत सही हैं तो बीजेपी के लिए खबर अच्छी नहीं है. लेकिन कांग्रेस जोरदार ढंग से ये बात कहने की स्थिति में आ सकती है कि केंद्र की सत्ता के लिए उसकी संभावनाएं अभी जिंदा हैं.-------------------------------------------------------------------------------------------------------------AajTak Live TV Watch the latest Hindi news Live on the World's Most Subscribed News Channel on YouTube. Aaj Tak News Channel: आज तक भारत का सर्वश्रेष्ठ हिंदी न्‍यूज चैनल है । आज तक न्‍यूज चैनल राजनीति, मनोरंजन, बॉलीवुड, व्यापार और खेल में नवीनतम समाचारों को शामिल करता है। आज तक न्‍यूज चैनल की लाइव खबरें एवं ब्रेकिंग न्यूज के लिए बने रहें । Aaj Tak is India's best Hindi News Channel. Aaj Tak news channel covers latest news in politics, entertainment, Bollywood, business and sports. Stay tuned for all the breaking news in Hindi ! Download India’s No. 1 Hindi News Mobile App : https://aajtak.app.link/QFAp3ZaHmQSubscribe To Our Channel: http://bit.ly/2xTASBc Official website: https://aajtak.intoday.in/ Like us on Facebook http://www.facebook.com/aajtak Follow us on Twitter http://twitter.com/aajtak Subscribe to our other network channels: The Lallantop https://www.youtube.com/c/thelallantop India Today: http://www.youtube.com/channel/UCYPvA... SoSorry: https://www.youtube.com/user/sosorryp... Tez: http://www.youtube.com/user/teztvnews Dilli Aajtak: http://www.youtube.com/user/DilliAajtak"
"2fHePzlxEx8","Khesari Lal Yadav का मसालेदार कॉमेडी Video - Damru - Superhit Bhojpuri Movie - Best Comedy Scene","2018-12-10T07:45:01.000Z","UCW91g3oy4NPPkhvptikjsbg","Venus Bhojpuri","23","18.11.12","khesari lal yadav,khesari lal yadav new comedy,khesari lal yadav damru,damru bhojpuri movie,khesari lal yadav comedy,khesari lal comedy scene,bhojpuri comedy khesari lal,superhit comedy video,मसालेदार कॉमेडी Video,damru,anand mohan bhojpuri comedy,new video bhojpuri,new comedy khesari lal 2018,bhojpuri comedy,desi comedy,khesari lal desi comedy,bhojpuri latest comedy,new bhojpuri comedy video,कॉमेडी धमाका VIDEO,Khesarilalyadavbestcomedy,khesri,venus bhojpuri","245826","1043","186","67","https://i.ytimg.com/vi/2fHePzlxEx8/default.jpg","False","False","Khesari Lal Yadav का मसालेदार कॉमेडी Video - Damru - Superhit Bhojpuri Movie - Best Comedy SceneFor Bhojpuri Superhit App: http://bit.ly/2yU9upHFor Bhojpuri Romantic Songs : http://bit.ly/2eaBGN0Enjoy The Breathtaking Bhojpuri Video Songs : http://bit.ly/2e8ZJtcFor Best Bhojpuri Songs Jukeboxes : http://bit.ly/2ejzpNrArtist : Khesari Lal Yadav & Anand MohanComedy Part : 4Movie : Damru#KhesarilalyadavbestcomedyFor More Updates, Subscribe to;For Bhojpuri Superhit Movies & Music :https://www.youtube.com/c/VenusBhojpuriFor Hit & Latest Music:https://www.youtube.com/user/venus For Blockbuster Movieshttps://www.youtube.com/user/VenusMovies For Movies & Music in Regional Languages: https://www.youtube.com/user/venusregional For Heavenly & Peaceful Devotional Music: https://www.youtube.com/user/venusdevotionalFor Gujarati Latest Music & Movies: https://www.youtube.com/c/VenusGujaratiFor Punjabi & Haryanvi Superhit Music:https://www.youtube.com/c/VenusPunjabiHaryanviFor Devotional & Islamic Qawwalis https://www.youtube.com/user/venusislamicFor Best Nursery Rhymes:https://www.youtube.com/user/venuskidsworldAlso You Can:'LIKE' us on Facebook: https://www.facebook.com/venusentertainmenthttps://www.facebook.com/venusentertainment2 'FOLLOW' us on Twitter: https://twitter.com/venusmovies 'CIRCLE' us on Google+:https://plus.google.com/+VenusMoviesFOLLOW' us on Instagram: https://www.instagram.com/venusmovies/"
"fe0lgccihDM","How I Met Sudhir! | #SawaalSaturday | MostlySane","2018-12-08T16:50:54.000Z","UCvCyIiKSCA1fHKSCOKJyjXA","MostlySane","23","18.11.12","prajakta koli,mostly sane,mostlysane,latest funny videos,comedy videos,comedy funny videos,top 5,top funny videos,top comedy videos,top 5 videos,comedy videos 2018,funny videos 2018,funny videos by prajakta,prajakta new video","353915","17375","530","2404","https://i.ytimg.com/vi/fe0lgccihDM/default.jpg","False","False","Click here to Subscribe :- http://bit.ly/PrajaktaKoliLink To My Blog - https://mostlysane.inLike me on Facebook @ https://www.facebook.com/MostlySaneOfficialFollow me on Twitter @ https://twitter.com/iamMostlySane Follow me on Instagram @ https://instagram.com/MostlySane Email me at :- iammostlysane@gmail.com Digitally Powered by One Digital Entertainment [https://www.facebook.com/onedigitalentertainment][http://www.onedigitalentertainment.com]You can write to me and send me letters here - 407-411 Standford Plaza, Off Lokhandwala Link Road, Next to Orritel Hotel, Andheri West, Mumbai, Maharashtra 400053"
"jqzFSmOhgmk","चांदी की पायल बर्तन मूर्ति सब चमकाए चुटकियों में बिना हाथ लगाए बिना रगड़े चुटकियों में जबरदस्त ट्रिक","2018-12-10T08:30:01.000Z","UCVfaSe1Mv2y_Xn-ZGYv5Yqw","Ghar Grihasti","26","18.11.12","chandi saaf karne ka tarika,ghar par chandi ki payal kaise saaf kare,ghar par chandi kaise saaf kare,how to clean silver at home,how to clean silver pooja items at home,how to clean silver chain,chandi kaise saaf kare,chandi ke bartan ki safai,chandi ke bartan kaise chamkaye,chandi ke jevar saaf karne ka tarika,tips \\u0026 tricks,tips for cleaning silver items,silver items cleaning,silver saaf karne ka tarika,chandi chamkane ka tarika,chandi ki payal saaf","18446","592","49","55","https://i.ytimg.com/vi/jqzFSmOhgmk/default.jpg","False","False","Chandi saaf karne ka tarika,ghar par chandi ki payal kaise saaf kare,ghar par chandi kaise saaf kare,how to clean silver at home,how to clean silver pooja items at home,how to clean silver chain,chandi kaise saaf kare,chandi ke bartan ki safai ,chandi ke bartan kaise chamkaye,chandi ke jevar saaf karne ka tarika,tips and tricks,tips \\u0026 tricks,tips for cleaning silver items,silver items cleaning,silver saaf karne ka tarika,chandi chamkane ka tarika,chandi chamkane ke gharelu upay #silvercleaningathome  #chandichamkanekatarika#tipsandtricksSubscribe to my Channels - Recipe Channel Cook With Smarti- https://goo.gl/uNWyWq1 Minute Videos Channel - https://goo.gl/6ejBQKChannel Samadhaan -  https://goo.gl/nLuzDzChannel Ghar Grihasti - https://goo.gl/iQpjj4Follow me on FaceBook - https://goo.gl/DgPptXFollow me on Instagram - https://goo.gl/Rzj3igFollow me on Twitter - https://goo.gl/yNEz19Follow us on: Google + https://goo.gl/jMvF2vमेरे चॅनेल को सबस्क्राइब करने के लिए इस लिंक पर क्लिक करे - https://goo.gl/8c8Mtito JOIN - https://goo.gl/xQvFXW रेसिपी, घरेलू नुस्खे, प्रॉडक्ट रिव्यू, पूजा पाठ, किचन टिप्स, ब्यूटी टिप्स व घर गृहस्ती से जुड़ी हर जानकारी के लिए हमारी वेबसाइट देखे.http://ghargrihasti.comTips & Tricks Videos Playlist -https://goo.gl/F8C5KHDISCLAIMER: The information provided on this channel and its videos is for general purposes only and should NOT be considered as professional advice. We are NOT a licensed or a medical practitioner so always consult professional help. We always try to keep our channel & its content updated but cannot guarantee it. The content published on this channel is our own creative work and it's our personal experiences. All contents are protected under copyright law."
"V5V1aQreIes","Bloopers Sothanaigal | Micset","2018-12-07T11:28:23.000Z","UC5EQWvy59VeHPJz8mDALPxg","Mic Set","23","18.11.12","micset,bloopers,bloopers sothanaigal,micset rewind,sriram,sriram prince,tamil channel,comedy video,entertainment,sothanaigal,micset channel,tamil youtube,funny video,mic set bloopers,mic set,micset sriram,mic set comedy,micset sothanaigal,mic set new video,mic set status,mic set tamil,mic set school days,divo,mic set channel tamil,bloopers micset,petta,marana mass,thalaivar,thalaivar baila","1063945","60787","1317","2830","https://i.ytimg.com/vi/V5V1aQreIes/default.jpg","False","False","Hi everyone here comes the Bloopers Sothanaigal. Check out our memorable mistakes what exactly happened in the shooting spot with funny things. If you like it please don't forget to subscribe our channelIdea & Edit : SRI RAM  ( INSTA ID - https://www.instagram.com/sriram_prince_ )                      ( FB ID- https://www.fb.com/sri.ram.3511041 ) Team Manager  :   P.SheshathriTeam Coordinator :  velmuruganTeam Admin            :  N.ChandruDigital Partner : DIVO For Promotions, Branding, Digital Marketing Contact : +91 8248991430Email :  officialmicset@gmail.comFacebook page : https://www.facebook.com/micsetchannel/instagram          :  https://instagram.com/micset_micset/twitter                 :  https://twitter.com/micset_official/In Association with Divohttp://www.facebook.com/divomovieshttps://twitter.com/divomovieshttps://www.instagram.com/divomovies/"
"wcM7s8kLfH0","Mumbai Pune Mumbai 3 | Movie Review | Swwapnil Joshi, Mukta Barve | Marathi Movie 2018","2018-12-10T05:20:11.000Z","UCXv0AGtxxRzxJ7lP1M2l4jA","Ultra Marathi","24","18.11.12","Mumbai Pune Mumbai 3,Swapnil Joshi,Mumbai Pune Mumbai 3 puplic movie review,Mukta Barve,Mumbai Pune Mumbai 3 marathi movie review,Mumbai Pune Mumbai 3 review,Swapnil Joshi Mukta Barve friendship,Mumbai Pune Mumbai 3 Trailer,Mumbai Pune Mumbai 3 Full Movie,Mumbai Pune Mumbai 2 Songs,Swapnil Joshi Movies,Swapnil Joshi Songs,Mukta Barve Songs,Swapnil Joshi Serial,Mumbai Pune Mumbai 3 Latest News,Mumbai Pune Mumbai 3 Release Date,Mumbai Pune Mumbai 3 movie review","28658","179","35","19","https://i.ytimg.com/vi/wcM7s8kLfH0/default.jpg","False","False","#MPM3 #MovieReview #SwwapnilJoshiMumbai Pune Mumbai 3 | Movie Review | Swwapnil Joshi, Mukta Barve | Marathi Movie 2018Senior Journalist - Dilip ThakurVideo Editor  - Sushant VarsolkarSubscribe to this channel and stay tuned:http://www.youtube.com/user/ultramarathi► Like us on Facebook: https://www.facebook.com/UltraMarathi► Follow us on Twitter: https://twitter.com/UltraMarathi► Circle us on G+: https://plus.google.com/+UltraMarathi"
"mH227HILqII","Street Food in Gilgit + PAKISTANI VILLAGE FOOD | Ultra Happiness in Gilgit-Baltistan, Pakistan!","2018-12-09T13:00:15.000Z","UCyEd6QBSgat5kkC6svyjudA","Mark Wiens","19","18.11.12","Pakistan,Pakistani food,street food,Pakistani street food,Gilgit,Gilgit-Baltistan,street food gilgit,Mark Wiens,Pakistani food tour,food tour,street food tour,food in Asia,Asian food,Pakistan cuisine","950263","41222","954","8816","https://i.ytimg.com/vi/mH227HILqII/default.jpg","False","False","SUBSCRIBE http://bit.ly/MarkWiensSubscribe for 2 new videos every weekT-shirts and caps: https://goo.gl/6WdK1lThank you to Ali (Pakistan Travel Market): https://goo.gl/VY6NjHThank you to Gilgit Serena Hotel (https://www.serenahotels.com/serenagilgit/en/default.html) for sponsoring our stay.This video includes Day 9 and 10 of our Pakistani food tour trip (you can watch the entire video series here: https://youtu.be/Xdya8eym9nM). I combined the two days because things didn’t work out as planned on Day 9, and so didn’t end up being able to film much. But that’s the way things go sometimes!So firstly, on Day 9, the plan was to drive from Shigar to to Deosai National Park, and drive all the way through the park to the other side, en-route to Gilgit. Unfortunately it started snowing along the way, and by the time we arrived to the entrance of the park, it was snowing too hard, and it was too risky to proceed. So we turned around and took the long way to Gilgit.Gilgit, Gilgit-Baltistan, Pakistan - Ok, so now back to today (Day 10) we started the morning with a street food tour of Gilgit. Gilgit is an amazing small town, sort of the gateway of Gilgit Baltistan, and a commerce hub for the region on the Karakoram highway. The town is extremely friendly, and everywhere we went to eat on this small market and street food tour, we were greeted with such friendliness and hospitality.Kabuli pulao - 140 PKR ($1.04)Grilled meat - 120 PKR ($0.89)Curry - 120 PKR ($0.89)After about an hour eating street food and walking around the market, we continued on to Nizam’s house, which was about a 15 minute drive from the center of Gilgit. Nizam is an employee of Ali, and he graciously invited us to his amazing home in the countryside. The view from the backyard was breathtaking.We first went to the river valley to pick vegetables where we met Nizam’s father in law, who again may be the happiest man on earth - he was amazing pounding the chilies. We picked vegetables, and just stood in amazement at the natural wonder beauty of Pakistan. Lunch was incredibly delicious, all the fresh vegetables we picked, plus both mutton and beef curry, with rice and roti. The curries were some of the best I ate in Pakistan, but the fresh mountain vegetables, sauteed down with dried tomato, were the highlight. An incredible meal, really one of the most memorable I had in my entire trip to Pakistan.Thank you Nizam and family for the amazing meal!Watch the entire Pakistani video series: https://youtu.be/Xdya8eym9nMAli: https://goo.gl/VY6NjHJoel: https://goo.gl/5AkWm6MUSIC: https://us.audionetwork.com/Logo: https://goo.gl/VhaLp5CAMERA GEAR I used to make this video (these are affiliate links):Main camera: http://amzn.to/2sV0XQOMain lens: http://amzn.to/2szLZNf2nd lens: http://amzn.to/2EjBeEgMicrophone: http://amzn.to/2rBKD3zDrone: http://amzn.to/2CrtAHzFOLLOW:Instagram: @migrationologyFacebook: https://www.facebook.com/migrationologyThank you for watching!"
"v8xx3NHiyRM","धक्काबुक्की प्रकरणानंतर बंद पुकारणाऱ्या कार्यकर्त्यांना रामदास आठवलेंडून शांततेचं आवाहन | एबीपी माझा","2018-12-09T10:02:00.000Z","UCH7nv1A9xIrAifZJNvt7cgA","ABP Majha","25","18.11.12","abp majha news,marathi news,Bandra,Mumbai | Ramdas Athavle reacting on RPI activist protest and pushing incident,Mumbai,Ramdas Athavle,RPI activist protest,Athavle pushing incident","189959","619","374","398","https://i.ytimg.com/vi/v8xx3NHiyRM/default.jpg","False","False","केंद्रीय सामाजिक न्याय राज्यमंत्री रामदास आठवले यांच्यावर झालेल्या हल्ल्यानंतर त्यांनी आपली प्रतिक्रिया दिली आहे. माझी प्रगती काही जणांना पाहवत नाही, असा आरोप रामदास आठवलेंनी अंबरनाथमधल्या धक्काबुक्कीवर केला आहे. माझ्यावर झालेल्या धक्काबुक्की मागे कोणतंही षडयंत्र असल्याचं मला वाटत नाही. कारण विविध पक्षातील नेते माझे चांगले मित्र आहे. मात्र माझ्यावर करणाऱ्या प्रवीण गोसावीमागे कुणाचे हात आहेत. त्याने माझ्यावर हल्ला नेमका का केला? याची सखोल चौकशी व्हावी, अशी मागणीही आठवलेंनी केली.For latest breaking news, other top stories log on to: https://abpmajha.abplive.in/ & https://www.youtube.com/c/ABPMajhaTV &https://www.facebook.com/abpmajha/"
"vbk6cWYdSH0","Dhruva Sarja Engagement Video | Full HD | Dhruva Sarja Prerana Engagement | Druva Sarja Engagement","2018-12-09T11:25:46.000Z","UCU1GDiVN1bCa-gVy9jJPqLA","Namma KFI","24","18.11.12","DHRUVA SARJA ENGAGEMENT,DHRUVA SARJA ENGAGEMENT VIDEO,DHRUVA SARJA,PRERANA,ARJUN SARJA,DHRUVA SARJA PRERANA ENGAGEMENT,DHRUVA SARJA AND PRERNA ENGAGEMENT,ACTOR DHRUVA SARJA,DHRUVA SARJA LOVER,DHRUVA SARJA MARRIAGE,ARJUN SARJA FAMILY,DRUVA SARJA,DRUVA SARJA ENGAGEMENT,DHRUVA SARJA GIRLFRIEND,DARSHAN,YASH,CHALLENGING STAR DARSHAN,KGF,KGF MOVIE,YASH KGF MOVIE,#DHRUVASARJA,AMBAREESH,REBEL STAR AMBAREESH,DBOSS,KFI,NAMMA KFI,POGARU,POGARU TEASER,YASH BABY","62947","465","44","44","https://i.ytimg.com/vi/vbk6cWYdSH0/default.jpg","False","False","Dhruva Sarja Engagement Video Dhruva Sarja Prerana Engagement  Druva Sarja Engagement #DhruvaSarja #DruvaSarja #DhruvaSarjaEngagement"
