video_id,title,publishedAt,channelId,channelTitle,categoryId,trending_date,tags,view_count,likes,dislikes,comment_count,thumbnail_link,comments_disabled,ratings_disabled,description
"HOeSwjhSGoM","Cardi B Carpool Karaoke","2018-12-18T06:45:36.000Z","UCJ0uqCI0Vqr2Rrt1HseGirg","The Late Late Show with James Corden","24","18.19.12","The Late Late Show,Late Late Show,James Corden,Corden,late night,late night show,comedy,comedian,celebrity,celeb,celebrities,CBS,joke,jokes,funny,funny videos,funny video,humor,hollywood,famous,carpool,karaoke,carpool karaoke,cardi b,cardi","9214843","496496","15221","32325","https://i.ytimg.com/vi/HOeSwjhSGoM/default.jpg","False","False","Cardi B hops in the car with James Corden for a Carpool Karaoke through Los Angeles singing her biggest songs, discussing growing up in the Bronx and the subtle art of ASMR. And James encourages Cardi to get behind the wheel and give driving a chance, which he learns she doesn't really do for good reason.More Late Late Show:Subscribe: http://bit.ly/CordenYouTubeWatch Full Episodes: http://bit.ly/1ENyPw4Facebook: http://on.fb.me/19PIHLCTwitter: http://bit.ly/1Iv0q6kInstagram: http://bit.ly/latelategramWatch The Late Late Show with James Corden weeknights at 12:35 AM ET/11:35 PM CT. Only on CBS.Get new episodes of shows you love across devices the next day, stream live TV, and watch full seasons of CBS fan favorites anytime, anywhere with CBS All Access. Try it free! http://bit.ly/1OQA29B---Each week night, THE LATE LATE SHOW with JAMES CORDEN throws the ultimate late night after party with a mix of celebrity guests, edgy musical acts, games and sketches. Corden differentiates his show by offering viewers a peek behind-the-scenes into the green room, bringing all of his guests out at once and lending his musical and acting talents to various sketches. Additionally, bandleader Reggie Watts and the house band provide original, improvised music throughout the show. Since Corden took the reigns as host in March 2015, he has quickly become known for generating buzzworthy viral videos, such as Carpool Karaoke."
"KXtPnfS0a9E","TRY NOT TO LAUGH CHALLENGE #15","2018-12-18T18:00:01.000Z","UCYJPby9DRCteedh5tfxVbrw","Smosh Pit","22","18.19.12","smosh pit,smosh,pit,try not to laugh challenge,try not to laugh,competition,try not to,react,jujimufu,bath boys,joe bereta,ian hecox,olivia sui,shayne topp,courtney,noah grossman,keith leak jr,funny,comedy,improv,whose line,try not to challenge,dont laugh,don't laugh challenge,dont laugh challenge","790390","38581","1210","2795","https://i.ytimg.com/vi/KXtPnfS0a9E/default.jpg","False","False","SUBSCRIBE ►► http://youtube.com/smoshpitWe're back BABY! Another Try Not to Laugh with 80% more butts! Check it out! CASTNoah GrossmanKeith Leak Jr.Courtney MillerOlivia SuiShayne ToppCREWProduced by Josh MattinglyCam Op: Daren GirdnerEditor: Michael GreenPost Supervisor: Brett NoborikawaProduction Assistant: Kristin Sanchez-------------------------------------SMOSH: http://youtube.com/smoshSmosh Games: http://youtube.com/smoshgamesShut Up! Cartoons: http://youtube.com/shutupcartoonsSMOSH en Français: http://youtube.com/thefrenchsmoshSMOSH en Español: http://youtube.com/elsmosh"
"xoxhDk-hwuo","Package Thief vs. Glitter Bomb Trap","2018-12-17T19:55:40.000Z","UCY1kMZp36IQSyNx_9h4mpCg","Mark Rober","28","18.19.12","glitter bomb compilation,glitter bomb package,glitter bomb prank,glitter bomb,package thief,package thief revenge,package thief caught","24502037","816667","9591","103138","https://i.ytimg.com/vi/xoxhDk-hwuo/default.jpg","False","False","This might be my Magnum Opus. Go to https://NordVPN.com/MarkRober and use code MARKROBER to get 75% off a 3 year plan and an extra month for free.My buddy Sean posted a video with more details of the build: https://youtu.be/IpMxOmUcfOIHigh Speed camera courtesy of https://www.aimed-research.com/.  They rent high speed cameras at killer prices.  Hit them up.***Music***0:00- Dance of the Sugar Plum Fairy - Kevin MacLeod https://incompetech.com/00:18- Cereal Killa - Blue Wednesday https://soundcloud.com/bluewednesday/00:59- Take a Chance - Kevin MacLeod https://incompetech.com/1:09- Q - Blue Wednesday https://soundcloud.com/bluewednesday/1:56- Arrow- Andrew Applepie http://andrewapplepie.com/3:40- Home Alone Sample3:55- Ambientis9:39- New Shoes - Blue Wednesday https://soundcloud.com/bluewednesday/Summary:  I got upset that my package was stolen so I made a glitter bomb revenge package.MERCH-They are soft- https://teespring.com/stores/markroberPLEASE CONSIDER SUBSCRIBING: http://tinyurl.com/MarkRober-Sub****************************************­I make videos like this once a month all year long while supplies last:CHECK OUT MY CHANNEL: http://tinyurl.com/MarkRober-YouTubeFACEBOOK: https://www.facebook.com/MarkRoberYouTubeTWITTER: https://twitter.com/#!/MarkRoberINSTAGRAM:  https://www.instagram.com/markrober/"
"2UjJGNA4BL0","Mark Ronson, Miley Cyrus - No Tears Left To Cry (Ariana Grande cover) in the Live Lounge","2018-12-18T13:00:48.000Z","UCKoafhJ9dkAWaEvlXCiBBwA","BBCRadio1VEVO","10","18.19.12","Mark Ronson,Miley Cyrus,Ariana Grande,No Tears Left To Cry,BBC,Radio 1,Live Lounge","1670647","131314","2320","8196","https://i.ytimg.com/vi/2UjJGNA4BL0/default.jpg","False","False","Mark Ronson & Miley Cyrus cover Ariana Grande's No Tears Left To Cry in the BBC Radio 1 Live Loungehttp://vevo.ly/30R0KN"
"V0PwuFJ9_AE","7 Egg Gadgets put to the Test - Part 4","2018-12-18T21:36:58.000Z","UCe_vXdMrHHseZ_esYUskSBw","CrazyRussianHacker","28","18.19.12","Egg Gadgets,Gadgets,7 Egg Gadgets put to the Test,kitchen gadgets,kitchen gadgets egg,6 Eggs Gadgets You Have to Try,as seen on tv,Gadget,egs","259332","9018","388","1299","https://i.ytimg.com/vi/V0PwuFJ9_AE/default.jpg","False","False","Blast Off Windshield De-Icer - https://youtu.be/Q0AhkmGai104 Snow Gadgets That'll Help You Dig Yourself - https://youtu.be/E13UM9StgpgSubscribe to: 2nd channel - https://www.youtube.com/user/origami768instagram https://instagram.com/crazyrussianhacker/facebook - https://www.facebook.com/CrazyRussianHackerDON'T TRY THIS AT HOME!Business email: crh.inquire@gmail.comFAN MAIL:  CRAZY RUSSIAN HACKERP.O. Box 49Waynesville, NC 28786#kitchen #gadgets"
"fw7dexoX4pQ","Christmas Elves vs. Fantasy Elves","2018-12-18T18:30:23.000Z","UCPDXXXJj9nax0fr0Wfc048g","CollegeHumor","23","18.19.12","Collegehumor,CH originals,comedy,sketch comedy,internet,humor,funny,sketch,mythical creatures,holidays,christmas,family,reunions,well that’s disappointing,this vs that,whip-its,santa claus,parents,fantasies,dancing,singing,magic,gifts,janie stolar,mike trapp,brennan lee mulligan,ch shorts,collegehumor elf parody,collegehumor elves parody,parody,lotr,lord of the rings,santa,workshop","261925","19293","212","1563","https://i.ytimg.com/vi/fw7dexoX4pQ/default.jpg","False","False","Some elves make Red Rider BB guns, some elves forge artillery for the gods. Sponsored by Xfinity.FOLLOW THE CAST:ALLY: http://www.twitter.com/lilbeardsleyGRANT: http://www.twitter.com/grantobKATIE: http://www.twitter.com/katiemarovitchTRAPP: http://www.twitter.com/mikewtrappRAPH: http://www.twitter.com/chestangraphaelREKHA: http://www.twitter.com/rekhalshankarBRENNAN: https://twitter.com/brennanlmSAM: http://www.twitter.com/samreichSee more http://www.collegehumor.comLIKE us on: http://www.facebook.com/collegehumorFOLLOW us on: http://www.twitter.com/collegehumorFOLLOW us on: http://www.collegehumor.tumblr.comSIGN UP for our emails: http://bit.ly/2E6svorCASTMike TrappJanie StolarBrennan Lee MulliganCREWDirector - Ryan Anthony MartinWriter - Mike TrappProducer - Shane CrownProduction Coordinator - Annie HumphrevilleDirector Of Photography - Cooper JamesMake Up Artist - Denise Renee ValentineProduction Designer - Chloe BadnerCostume Designer - Chloe BadnerSound Mixer - Danny Carpenter of BoTown SoundEditor - Nick Rood"
"8eydIBipTO8","H.E.R. - Carried Away | A COLORS SHOW","2018-12-18T14:00:00.000Z","UC2Qw1dzXDBAZPwS7zm37g8g","COLORS","10","18.19.12","colorsstudios,colorsberlin,All Colors Shows,A COLORS SHOW,colors,colorsxstudios,live session,live performance,colours,studios,Music Video,H.E.R.,Carried Away,Grammy,I Used To Know Her","221411","19307","199","926","https://i.ytimg.com/vi/8eydIBipTO8/default.jpg","False","False","H.E.R. delivers a soul-stirring performance of “Carried Away” (prod. T-Minus) which is taken from her I Used To Know Her: Part 2 project.Follow H.E.R.:▶ Stream: https://colors.lnk.to/CarriedAway▶ Facebook: https://www.facebook.com/officialHERmusic/▶ Instagram: https://www.instagram.com/hermusicofficial/—Follow COLORS:▶ On Socials: https://lnk.to/socials▶ On Spotify: https://colors.lnk.to/Spotify▶ On Apple Music: https://colors.lnk.to/applemusic"
"7y-hKLfeurY","Skiing Stereotypes | Dude Perfect","2018-12-17T22:56:00.000Z","UCRijo3ddMTht_IHyNSNXpNQ","Dude Perfect","17","18.19.12","dude perfect,dude perfect stereotypes,dude perfect water bottle flip,bottle flip,water bottle flip,dude perfect bottle flip,dude perfect basketball,dp,dude perfect world record,edition,nerf,trick shots,trick shot,family,ping pong,bowling,clean,family friendly,bubble wrap,soccer,football,spinners,fidget spinners,dude,skiing,snowboard,jump,snow,chairlift,jerry,stereotypes,funny,cold,christmas,presents,grocery store,snowball fight,colorado,ski trip","6777834","279172","5506","19427","https://i.ytimg.com/vi/7y-hKLfeurY/default.jpg","False","False","Skiing Stereotypes. Love em' or hate em', we all know em'► Click HERE to subscribe to Dude Perfect! http://bit.ly/SubDudePerfect► Click HERE to watch our most recent videos!http://bit.ly/NewestDPVideos►  Special thanks to Red Lodge Mountain Montana for the hospitality! http://www.redlodgemountain.com► SHOP our NEW Merchandise! - http://bit.ly/DPStore►Click HERE to join the exclusive Dude Perfect T-Shirt Club! http://bit.ly/DPTShirtClubPlay our NEW iPhone game!► PLAY Endless Ducker on iPhone -- http://smarturl.it/EndlessDucker► PLAY Endless Ducker on Android -- http://smarturl.it/EndlessDucker► VISIT our NEW STORE - http://bit.ly/DPStore► JOIN our NEWSLETTER - http://bit.ly/DPNewsletterEndCard► WATCH our STEREOTYPES - http://bit.ly/StereotypesPlaylistIn between videos we hang out with you guys on Instagram, Snapchat, Twitter, and Facebook so pick your favorite one and hang with us there too!http://Instagram.com/DudePerfecthttp://bit.ly/DudePerfectSnapchathttp://Twitter.com/DudePerfecthttp://Facebook.com/DudePerfectDo you have a GO BIG mindset? See for yourself in our book Go Big. ►http://amzn.to/OYdZ2sA special thanks to those of you who play our iPhone Games and read our book. You guys are amazing and all the great things you tell us about the game and the book make those projects so worthwhile for us! Dude Perfect GAME - http://smarturl.it/DPGameiPhoneDude Perfect BOOK - Go Big - http://amzn.to/OYdZ2sClick here if you want to learn more about Dude Perfect:http://www.dudeperfect.com/blog-2/Bonus points if you're still reading this! Comment: It's the bead guy! He's my favorite! As always...Go Big and God Bless!- Your friends at Dude PerfectBusiness or Media, please contact us at: Dude@DudePerfect.com------------5 Best Friends and a Panda.If you like Sports + Comedy, come join the Dude Perfect team!Best known for trick shots, stereotypes, battles, bottle flips, ping pong shots and all around competitive fun, Dude Perfect prides ourselves in making the absolute best family-friendly entertainment possible! Welcome to the crew! Pound it. Noggin. - Dude Perfect"
"hoj2JVhhouI","Winter Games (A Christmas Special) - Simon's Cat | SHORT #88","2018-12-18T13:15:00.000Z","UCH6vXjt-BA7QHl0KnfL-7RQ","Simon's Cat","1","18.19.12","simon's cat,simons cat,simons cats,simon's katze,саймон кот,simon the cat,кот саймона,“кот,саймон”,Simon,Tofield,simonscat,animated cats,animated animals,black and white,black and white cat,cat lovers,cat fails,cute cats,funny cat,funny cats,kids,Animated,Animation,cartoon,cartoons,Cat,cats,cute,fail,fun,Funny,Humour,kitten,kittens,kitty,pets,Toons,videos,саймон,кот саймона все серии,kot simona,for kids,winter games,snowball fight,christmas,special,mice","194893","11241","167","383","https://i.ytimg.com/vi/hoj2JVhhouI/default.jpg","False","False","Build your own website and support our channel by signing up to Wix today! - Visit https://www.wix.com/go/Simonscat - and check out Simon's new blog at http://www.mylifewith.simonscat.com SHARE - LIKE - COMMENT!A competitive cat tries his paw at some Winter Games in our latest Christmas Special. 'Winter Games' Credits:Director: Simon TofieldAnimator: Plamen AnanievAnimation Supervisor: Rachel ThornDesign & Rigging:Trevor Phillips Art Director: Liza NechaevaCompositor: Julia YoungMusic: ShrootyFoley: FonicProducer: Emma BurchAssociate Producer: Edwin EckfordExecutive Producer: Mike BellWant to see more of our Black & White films? Check out our FULL play list here: http://www.goo.gl/FkqgHwWant to know more about the history of Simon's Cat?Watch the Simon's Cat Story here - http://goo.gl/Vfx2JS FAQs:Q. What software do you use?A. Simon's Cat has been made using a variety of animation software over the years. Originally in Adobe Flash. Then TV Paint (and still on occasions) and most recently using CelAction.Q. Why does it take so long to make each Simon's Cat film?A. Animation is a slow process and Simon’s Cat films pay particular attention to observed, real life cat behaviour. Historically the films were traditionally animated frame by frame. More recently we use CelAction which has sped up the process but still requires a lot of care and attention. Each film takes approximately 6-9 weeks to make, depending on complexity, number of characters and special effects.#HappyHolidays #SnowballFight"
"kHDvp1zH04g","Jennifer Lopez & Leah Remini Answer the Web's Most Searched Questions | WIRED","2018-12-18T17:00:17.000Z","UCftwRNsjfRo08xYE31tkiyw","WIRED","24","18.19.12","google autocomplete,jennifer lopez,jlo,wired autocomplete,wired autocomplete interview,second act,jennifer lopez funny,jennifer lopez interview,jennifer lopez autocomplete,jennifer lopez autocomplete interview,jlo autocomplete,jlo interview,jennifer lopez and leah remini,leah remini interview,leah remini autocomplete,wired autocomplete leah remini,jlo google autocomplete,leah remini autocomplete interview,wired","135162","3627","1334","648","https://i.ytimg.com/vi/kHDvp1zH04g/default.jpg","False","False","Second Act stars Jennifer Lopez and Leah Remini take the WIRED Autocomplete Interview and answer the internet's most searched questions about themselves. Is Jennifer Lopez from the block? Is Leah Remini Mexican? How did Jennifer get the role of Selena? How do you pronounce Leah's last name? Jennifer and Leah answer all these questions and more!Still haven’t subscribed to WIRED on YouTube? ►► http://wrd.cm/15fP7B7 Also, check out the free WIRED channel on Roku, Apple TV, Amazon Fire TV, and Android TV. Here you can find your favorite WIRED shows and new episodes of our latest hit series Masterminds.ABOUT WIREDWIRED is where tomorrow is realized. Through thought-provoking stories and videos, WIRED explores the future of business, innovation, and culture.Jennifer Lopez & Leah Remini Answer the Web's Most Searched Questions | WIRED"
"ZN9ZSo8jHi8","Generations React To AND MEET James Charles","2018-12-17T22:00:02.000Z","UC0v-tlzsn0QZwJnkiaUSJVQ","FBE","24","18.19.12","james charles,fans meet james charles,unleash your inner artist,james charles palette,morphe,Generations React To AND MEET James Charles,generations react,kids react,teens react,adults react,college kids react,react,reaction,thefinebros,fine brothers,fine brothers entertainment,finebros,fine bros,fbe,watch,review,for the first time,reviews,responds,respond,youtubers react,parents react,teenagers react,sister,meet james charles,james charles fans,SPCL1858","1649205","106537","8145","19971","https://i.ytimg.com/vi/ZN9ZSo8jHi8/default.jpg","False","False","Subscribe to James Charles: https://www.youtube.com/channel/UCucot-Zp428OwkyRm2I7v2QFollow James Charles: IG & Twitter @jamescharles, Snapchat @jamescharlessSUBSCRIBE & HIT THE 🔔. New Videos 2pm PT on FBE: http://fbereact.com/SubscribeFBEWhat should we react to next?? https://fbereact.com/submitWatch More from FBE: http://fbereact.com/FBEallreactepisodesWatch More from React: http://fbereact.com/REACTallepisodesJoin us LIVE on React every Tuesday, Friday, and Sunday at 3pm PST.Sign Up for Our Newsletter: http://fbereact.com/infoGenerations MEET James Charles. Watch to see their Reactions.Reactors Featured:KIDSLucas, age 10https://www.instagram.com/lucasvazquez2008/Sydney, age 11https://www.instagram.com/sydneybergerson/TEENSJayka, age 16https://www.instagram.com/jayka.noelle/Jair, age 17https://www.instagram.com/debonairgirljair/Ulises, age 17http://instagram.com/ulisesgonzalezlaADULTSBrittanyhttps://www.instagram.com/brittcuadra/Sabrina D.https://www.instagram.com/sabrina.danielle/Tylerhttps://www.instagram.com/i.of.the.tyler/MERCH 👕 https://www.shopfbe.comFollow FBE:FBE WEBSITE: https://fbeteam.com/FBE: http://www.youtube.com/FBEREACT: http://www.youtube.com/REACTFBE2: https://www.youtube.com/FBE2FBELive: https://www.youtube.com/fbeliveFACEBOOK: http://www.facebook.com/FBEFACEBOOK: http://www.facebook.com/FBEShowsTWITTER: http://www.twitter.com/fbeINSTAGRAM: http://www.instagram.com/fbeSNAPCHAT: https://fbereact.com/snapchatDISCORD: https://fbereact.com/FBEdiscordTWITCH: https://www.twitch.tv/fbeliveAMAZON: https://www.amazon.com/v/FBEROKU: http://fbereact.com/FBERokuXUMO: https://fbereact.com/xumoSEND US STUFF:FBEP.O. BOX 4324Valley Village, CA 91617-4324Creators & Executive Producers - Benny Fine & Rafi FineHead of Production - Nick BergtholdCreative Director & Senior Producer - Derek BaynhamSupervising Producer - Kyle SegalProducer - Ethan WeiserJr. Producer - Vartuhi Oganesyan, JC ChavezAssociate Producer - Lauren HutchinsonProduction Coordinator - Alberto AguirreAssistant Production Coordinator - Kristy KieferPost Supervisor - Emily McGuinessEditor - Jordan TowlesAssistant Editor - Lucas GriffithJr. Studio Technician - Oscar Ramos, Stephen Miller, Jayden RomeroProduction Assistant - Kyllis Jahn, Micah Kearny, Stefan Fior, Laura LareauStudio Technician - Sam KimSet design - Melissa JudsonMusic - Cyrus GhahremaniMusic - Cormac Bluestone http://www.youtube.com/cormacbluestone]© FBE, IncGenerations React To AND MEET James Charles"
"AhTlHnFJN-U","River Plate v Al Ain FC - MATCH 5","2018-12-18T19:54:53.000Z","UCpcTrCXblq78GZrTUTLWeBw","FIFATV","17","18.19.12","sp:ty=high,sp:dt=2018-12-18T16:30:00Z,sp:st=soccer,sp:li=fifa_club,sp:ti:home=RIV,sp:ti:away=AIN,Football,match highlights,goals,UAE,United Arab Emirates,Futebol,Fussball,FIFA,official,Soccer,Futbol,Calcio,Voetbal,Club World Cup,Tournament,al Ain,Hussein Elshahat,Espérance S. De Tunis,Tunisia,Copa Libertadores,كرة فوتبول","556555","5079","439","2345","https://i.ytimg.com/vi/AhTlHnFJN-U/default.jpg","False","False","Hosts Al Ain secured a place in the final, defeating the South American champions on penalties. Follow all the action from UAE across the FIFA Platforms:👉 http://www.youtube.com/fifa👉 http://www.facebook.com/fifaclubworldcup👉 http://www.twitter.com/FIFAcom👉 http://www.instagram.com/fifaworldcup"
"hycxFvZirh8","Stephen A. ‘scared’ Anthony Davis is Lakers’ only option | First Take","2018-12-18T17:00:04.000Z","UCiWLfSweyRNmLpgEHekhoAg","ESPN","17","18.19.12","anthony davis,stephen a. smith,anthony davis new orleans,first take,anthony davis new agent,anthony davis trade,lakers,lebron,anthony davis to lakers,anthony davis clippers,clippers,kevin durant free agent,kemba walker free agency,first take today,kyrie irving free agency,2019 nba free agency,nba trades,nba rumors,nba free agency,lebron james,first take nba,nba on espn,magic johnson lakers,nba trade rumors,rob pelinka,lonzo ball,brandon ingram,nba","642345","5723","275","2354","https://i.ytimg.com/vi/hycxFvZirh8/default.jpg","False","False","Stephen A. Smith is “officially scared” that the Los Angeles Lakers may miss out on the chance to sign Kawhi Leonard, Kevin Durant,  Kyrie Irving or Kemba Walker in free agency, leaving Anthony Davis as the only option. ✔ Subscribe to ESPN on YouTube: http://es.pn/SUBSCRIBEtoYOUTUBE✔ Subscribe to ESPN FC on YouTube: http://bit.ly/SUBSCRIBEtoESPNFC✔ Subscribe to NBA on ESPN on YouTube: http://bit.ly/SUBSCRIBEtoNBAonESPN✔ Watch ESPN on YouTube TV: http://es.pn/YouTubeTVESPN on Social Media:► Follow on Twitter: http://www.twitter.com/espn► Like on Facebook: http://www.facebook.com/espn► Follow on Instagram: http://www.instagram.com/espnVisit ESPN on YouTube to get up-to-the-minute sports news coverage, scores, highlights and commentary for NFL, NHL, MLB, NBA, College Football, NCAA Basketball, soccer and more. More on ESPN.com: http://www.espn.com"
"iYaRZ4TNfus","Disney•Pixar Short Film Bao","2018-12-17T23:05:46.000Z","UC_IRYSp4auq7hKLvziWVH6w","Disney•Pixar","1","18.19.12","Pixar,Disney,Disney Pixar,Pixar Movie,Animation,Bao,short film,Pixar Short Film Collection","791208","34419","639","2958","https://i.ytimg.com/vi/iYaRZ4TNfus/default.jpg","False","False","In “Bao,” an aging Chinese mom suffering from empty nest syndrome gets another chance at motherhood when one of her dumplings springs to life as a lively, giggly dumpling boy. Mom excitedly welcomes this new bundle of joy into her life, but Dumpling starts growing up fast, and Mom must come to the bittersweet revelation that nothing stays cute and small forever. This short film from Pixar Animation Studios and director Domee Shi explores the ups and downs of the parent-child relationship through the colorful, rich, and tasty lens of the Chinese immigrant community in Canada. The Pixar Short Films Collection: Volume 3 is now on Digital, Movies Anywhere, and Blu-ray: http://di.sn/6003DL8n1 Bao is also available on Digital, Movies Anywhere, and Blu-ray with Disney•Pixar’s Incredibles 2”: http://di.sn/6008DIJx4Visit Disney Movies Anywhere for more! https://www.disneymoviesanywhere.com/ Facebook:https://www.facebook.com/Pixar Instagram: https://www.instagram.com/disneypixar/?hl=enhttps://www.instagram.com/pixar/  Twitter: https://twitter.com/DisneyPixar Copyright: (C) Disney•Pixar"
"eCz-q39mQBo","A Balancing Act (Ft. Elsie Fisher) - Ten Minute Power Hour","2018-12-17T20:00:02.000Z","UC9CuvdOVfMPvKCiwdGKL3cQ","GameGrumps","20","18.19.12","lets play,walkthrough,gameplay,egoraptor,danny,game grumps,gamegrumps,funny,arin,letsplay,ten minute power hour,10 minute power hour,tmph,game grumps power hour,power hour,grumps power hour,10mph,grumps live action,game grumps podcast,game grumps real life,game grumps live action,arin and dan,tucker prescott,suspend,jenga,elsie fisher,elsie,fisher","503265","34838","311","3884","https://i.ytimg.com/vi/eCz-q39mQBo/default.jpg","False","False","Elsie Fisher is here to help our sweaty boys play Jenga! Oh wait, it's not Jenga.What should we do next? Let us know!Click to Subscribe ► http://bit.ly/GrumpSubscribeDir/shot by Tucker ► http://www.tuckerprescott.com► http://www.instagram.com/tucker.prescottEdited by Ryan/Tucker ►https://twitter.com/elirymagee?lang=enWant updates on what's new and coming soon?Our email list! ► http://eepurl.com/cN7syXGame Grumps are:Egoraptor ► http://www.youtube.com/EgoraptorDanny ► http://www.youtube.com/NinjaSexPartyGame Grumps on social:Facebook ► https://www.facebook.com/GameGrumpsTwitter ► https://www.twitter.com/gamegrumpsMusic from Stevia Sphere ► http://www.steviasphere.bandcamp.comMystery Sax Kevin MacLeod (incompetech.com)Licensed under Creative Commons: By Attribution 3.0 Licensehttp://creativecommons.org/licenses/by/3.0/"
