video_id,title,publishedAt,channelId,channelTitle,categoryId,trending_date,tags,view_count,likes,dislikes,comment_count,thumbnail_link,comments_disabled,ratings_disabled,description
"Kb4dd_aWmok","Hi I'm Poppy Oh","2018-12-11T01:18:31.000Z","UC8JE00xTMBOqKs7o0grFTfQ","Poppy","24","18.19.12","poppy,music,blonde,titanic sinclair","1392109","26024","23782","12842","https://i.ytimg.com/vi/Kb4dd_aWmok/default.jpg","False","False","New merch available now at http://shop.impoppy.com/Stream/Download: http://maddecent.fm/amiagirlOrder Am I A Girl? Merch: http://maddecent.fm/amiagirlshopFOLLOW POPPYFacebook: https://www.facebook.com/Poppy Twitter: https://twitter.com/poppy SoundCloud: https://soundcloud.com/poppy Instagram: https://www.instagram.com/impoppy Web: https://poppy.wun.io/store YouTube: https://www.youtube.com/PoppyTOUR DATES: 01/31/19 Washington, DC02/01/19 Philadelphia, PA02/02/19 New York, New York02/04/19 Boston, Massachusetts02/06/19 Toronto, Ontario02/07/19 Detroit, Michigan02/08/19 Chicago, Illinois 02/09/19 Pittsburgh, PA02/11/19 Nashville, Tennessee02/12/19 Atlanta, Georgia02/13/19 Tampa, Florida02/15/19 Dallas, Texas02/16/19 Austin, Texas02/18/19 Aspen, Colorado02/19/19 Englewood, Colorado02/21/19 Seattle, Washington02/22/19 Portland, Oregon02/23/19 Chico, California02/24/19 San Francisco, California02/27/19 San Diego, CaliforniaDirected by: Titanic Sinclair"
"ayOZa2zINEM","Ellen DeGeneres Couldn't Get a Ticket if She Tried","2018-12-11T10:00:02.000Z","UCa6vGFO9ty8v5KZJXQxdhaw","Jimmy Kimmel Live","24","18.19.12","jimmy,kimmel,live,late,night,talk,show,funny,comedic,comedy,clip,comedian,ellen,degeneres,driving,cars,speeding,police,celebrity,ellen degeneres,speeding ticket,traffic violation","2459443","46798","809","1760","https://i.ytimg.com/vi/ayOZa2zINEM/default.jpg","False","False","Ellen talks about her love of driving and reveals what has happened on several different occasions when she has been pulled over for speeding.The Story of the Chanucorn! https://youtu.be/McaWZZEc5EE   SUBSCRIBE to get the latest #KIMMEL: http://bit.ly/JKLSubscribe Watch Mean Tweets: http://bit.ly/KimmelMT10 Connect with Jimmy Kimmel Live Online: Visit the Jimmy Kimmel Live WEBSITE: http://bit.ly/JKLWebsiteLike Jimmy Kimmel on FACEBOOK: http://bit.ly/KimmelFBLike Jimmy Kimmel Live on FACEBOOK: http://bit.ly/JKLFacebookFollow @JimmyKimmel on TWITTER: http://bit.ly/KimmelTWFollow Jimmy Kimmel Live on TWITTER: http://bit.ly/JKLTwitterFollow Jimmy Kimmel Live on INSTAGRAM: http://bit.ly/JKLInstagram About Jimmy Kimmel Live: Jimmy Kimmel serves as host and executive producer of Emmy-winning Jimmy Kimmel Live, ABC's late-night talk show.Jimmy Kimmel Live is well known for its huge viral video successes with 5.6 billion views on YouTube alone.Some of Kimmel's most popular comedy bits include - Mean Tweets, Lie Witness News, Jimmy's Twerk Fail Prank, Unnecessary Censorship, YouTube Challenge, The Baby Bachelor, Movie: The Movie, Handsome Men's Club, Jimmy Kimmel Lie Detective and music videos like I (Wanna) Channing All Over Your Tatum and a Blurred Lines parody with Robin Thicke, Pharrell, Jimmy and his security guard Guillermo.Now in its sixteenth season, Kimmel's guests have included: Johnny Depp, Meryl Streep, Tom Cruise, Halle Berry, Harrison Ford, Jennifer Aniston, Will Ferrell, Katy Perry, Tom Hanks, Scarlett Johansson, Channing Tatum, George Clooney, Larry David, Charlize Theron, Mark Wahlberg, Kobe Bryant, Steve Carell, Hugh Jackman, Kristen Wiig, Jeff Bridges, Jennifer Garner, Ryan Gosling, Bryan Cranston, Jamie Foxx, Amy Poehler, Ben Affleck, Robert Downey Jr., Jake Gyllenhaal, Oprah, and unfortunately Matt Damon.Ellen DeGeneres Couldn't Get a Ticket if She Triedhttps://youtu.be/ayOZa2zINEM"
"eAZ7azcr3cw","Overwatch Seasonal Event | Overwatch Winter Wonderland 2018","2018-12-11T19:03:02.000Z","UClOf1XXinvZsy4wKPAkro2A","PlayOverwatch","20","18.19.12","“Overwatch Seasonal Event” | Overwatch Winter Wonderland 2018,” Overwatch Winter Wonderland 2018,Krampus Junkrat,Sugar Plum Fairy Mercy,Figure Skater Symmetra,Winter Wonderland skin reveals,OW Winter Wonderland,Blizzard Entertainment,Blizzard,FPS,First-Person Shooter,Team-Based Shooter,Objective-Based Shooter,Shooter,Action Game,Team Game,Objective-Based Game,Multiplayer Game,Hero Shooter,Hero,Heroes,Hero Abilities,Future,Near-Future,Sci-Fi","511447","16050","1481","2969","https://i.ytimg.com/vi/eAZ7azcr3cw/default.jpg","False","False","Overwatch is getting into the holiday spirit for the next three weeks! Expand your collection and enjoy two winter brawls: Yeti Hunter and Mei’s Snowball Offensive. Visit Blizzard World to watch the snow fall, admire its twinkling nighttime lights, and savor the sight of confectionary-inspired décor. Of course, we have new presents for you to unwrap from our Winter Loot Boxes! Unlock new seasonal items—including legendary skins like Krampus Junkrat, Sugar Plum Fairy Mercy, Figure Skater Symmetra, and more. Learn more about Winter Wonderland here: https://blizz.ly/OWW2018.Begin your watch: http://buyoverwatch.comLike us on Facebook: http://www.facebook.com/playoverwatchFollow us on Twitter: http://www.twitter.com/playoverwatchJoin us on Instagram: https://www.instagram.com/playoverwatch"
"AmGti20smKo","Kodak Black - Testimony [Official Music Video]","2018-12-10T19:58:24.000Z","UChEYVadfkMCfrKUi6qr3I1Q","Kodak Black","10","18.19.12","kodak,black,kodak black,atlantic records,atlantic,roll in peace,codeine dreaming,tunnel vision,drowning,transportin,heart break kodak,project baby 2,kodak black testimony,kodak testimony,Dying To Live,Calling My Spirit,Zeze,EfHNIPXTxy0,ppSY98RGyBU,Florida,Florida Rap,Tunnel Vision","3233889","106016","7374","13306","https://i.ytimg.com/vi/AmGti20smKo/default.jpg","False","False","Kodak Black - Testimony [Official Music Video]Stream/Download - https://Kodak.lnk.to/testimonyIDDying To Live Out Now!Stream/Download - https://Kodak.lnk.to/DyingToLiveIDDirector: JD Films & Kodak BlackCommissioner: Kareem Johnson Subscribe for more official content from Kodak Black:https://Atlantic.lnk.to/KBsubscribeFollow Kodak Blackhttps://twitter.com/KodakBlack1khttps://facebook.com/TheRealKodakBlackhttps://instagram.com/kodakblackhttps://soundcloud.com/kodak-blackhttps://open.spotify.com/artist/46SHBwWsqBkxI7EeeBEQG7The official YouTube channel of Atlantic Records artist Kodak Black. Subscribe for the latest music videos, performances, and more."
"KDnKuFtdc7A","Godzilla: King of the Monsters - Official Trailer 2 - In Theaters May 31","2018-12-10T16:59:32.000Z","UCjmJDM5pRKbUlVIzDYYWb6g","Warner Bros. Pictures","24","18.19.12","Godzilla,Titans,Legendary,Millie Bobby Brown,Kyle Chandler,Toho,Mothra,Vera Farmiga,Warner Bros,O'Shea Jackson,Gidora","10970873","163626","5098","30295","https://i.ytimg.com/vi/KDnKuFtdc7A/default.jpg","False","False","Following the global success of “Godzilla” and “Kong: Skull Island” comes the next chapter in Warner Bros. Pictures’ and Legendary Pictures’ cinematic MonsterVerse, an epic action adventure that pits Godzilla against some of the most popular monsters in pop culture history.  The new story follows the heroic efforts of the crypto-zoological agency Monarch as its members face off against a battery of god-sized monsters, including the mighty Godzilla, who collides with Mothra, Rodan, and his ultimate nemesis, the three-headed King Ghidorah.  When these ancient super-species—thought to be mere myths—rise again, they all vie for supremacy, leaving humanity’s very existence hanging in the balance."
"CJB9GP5gyAw","Baby, Just GO Outside","2018-12-10T12:18:22.000Z","UCl2axinLKd00nMBW6RTASag","The Holderness Family","10","18.19.12","go outside,music video,how bow dah,the holderness family,holderness family,holderness family videos,holderness family fortnite,holderness family thanksgiving,holderness family algebra,holderness family greatest showman,holderness family songs,holderness family christmas jammies,holderness family parody,holderness family vlogs,baby it's cold outside lyrics,baby it's cold outside,baby it's cold outside elf,baby it's cold outside original","1273230","19364","2119","2203","https://i.ytimg.com/vi/CJB9GP5gyAw/default.jpg","False","False","We wanted to re-do the lyrics to the controversial Baby, It's Cold Outside. What do you think? Make sure to follow us on Instagram @TheHoldernessFamilyThank you for subscribing!Check out our vlog channel www.youtube.com/holdernessfamilyvlogsWe're in Facebook and Instagram @TheHoldernessFamilyAbout the Holderness FamilyThe Holderness Family creates original music, parodies, and Vlogs for YouTube to poke fun of themselves and celebrate the absurdity in circumstances most families face in their day to day life. They published Christmas Jammies in December 2013 and life hasn't been the same. Since then, their popular parodies, All About That Baste, Baby Got Class, and original music Snow Day have received national news coverage. Penn, the Dad, took a chance and left his job as a news anchor to join his wife Kim, the Mom, at their video production and digital marketing company, Greenroom Communications, LLC. Lola and Penn Charles are always happy, respectful and eat all of their vegetables (that last sentence is a lie). Penn, Kim, Lola, and Penn Charles publish Vlogs and other nonsense to this channel as often as they can while remaining sane. Our viewers have become our family and we try our best to respond to comments.#BabyGOOutside #BabyItsColdOutside #ChristmasSong"
"HCuddH2qRyY","Paris Hilton Explores ASMR | W Magazine","2018-12-10T17:00:21.000Z","UCB_TGajnJymiSmu6zWkjW2Q","W magazine","24","18.19.12","asmr,asmr interview,celebrity asmr,paris hilton,paris hilton interview,celebrity asmr interview,celeb asmr,autonomous sensory meridian response,asmr whispers,asmr therapy,asmr massage,asmr video,asmr candy,asmr ear candy,asmr mouth sounds,paris hilton voice,asmr talking,asmr soothing,paris hilton asmr video,paris hilton whisper asmr,celeb asmr whisper,paris hilton asmr sounds,paris hilton 2018,paris hilton asmr,asmr paris hilton,w magazine,wmag","992036","26331","3186","4678","https://i.ytimg.com/vi/HCuddH2qRyY/default.jpg","False","False","In this Celebrity #ASMR interview, Paris Hilton explores autonomous sensory meridian response with whispers and sounds from her life. The TV personality shares the story of her most famous catch phrase, shucks corn, takes some impressive paparazzi selfies, and introduces her latest fragrance. Paris Hilton can currently be seen in the social media documentary film “The American Meme” streaming on Netflix [December 7th / now]. Her 24th fragrance, Platinum Rush, is available exclusively at Perfumania stores nationwide. https://www.perfumania.com/content/root-paris-hilton-fragrances/content.htmlIn addition, she recently launched first full skincare line under the Paris Hilton brand called ProD.N.A., available at https://parishiltonskincare.com/.Paris recently collaborated with nail & bone, a socially-conscious, indie beauty brand to design a capsule nail polish collection called nail & bone by PARIS HILTON, in honor of her furry best friends. They support pet rescue & adoption organizations by donating 20% of proceeds from the product. https://nailandbone.com/Still haven’t subscribed to W on YouTube? ►► http://bit.ly/wyoutubesubABOUT WThe Who, What, Where, When, and Why in the world of fashion and style. W provides the ultimate insider experience with an original, provocative approach to art, culture, videos, travel, fashion, and beauty.Paris Hilton Explores ASMR | W Magazine"
"MEbdjASvx7g","EVERY AIRPLANE EVER","2018-12-10T18:00:02.000Z","UCY30JRSgfhYXA6i6xX1erWg","Smosh","23","18.19.12","smosh,smosh pit,pit,airplane,airport,mile high club,sketch,stewardess,fight video,freakout,delta,american airlines,caught on tape,raw,passenger,passenger freakout,fight,news,animal,emotional support animal,dog,parrot,cat,ian hecox,shayne topp,olivia sui,noah grossman,courtney miller,keith leak jr,funny,comedy,worst,kid","1766495","59942","1938","4251","https://i.ytimg.com/vi/MEbdjASvx7g/default.jpg","False","False","Whether it's waiting for the bathroom, being stuck in the middle seat, or wanting to strangle the kid that keeps kicking your seat, we've all been there (unless you haven't ever flown, then in that case, well heck, I hope you still enjoy). This is EVERY AIRPLANE EVER.CASTIan HecoxCourtney MillerKeith Leak JrOlivia SuiNoah GrossmanShayne ToppBrian SandstromCREWDirected & Produced by Ryan ToddWritten by  Ryan Todd, Ryan Finnerty, Ian Hecox & Monica VasandaniSmosh Co-Founded by Ian Hecox & Anthony PadillaSmosh Creative Director: Luke BaratsDirector of Photography: Mitch AndersonEditor: Ryan ToddProducer: Kristina NikolicProduction Manager: Jon-Michael BurgessFirst Assistant Director: Tanner RisnerProduction Designer: Tayler NicholsonArt Assistant: Jake SperlingCamera: Brennan IketaniGaffer: Trent TurnerGrip: Joseph PitruzzelloSound Mixer: Greg JonesMakeup Artist: Brooke Davis DarwinCostume Supervisor: Lindsay HamiltonScript Supervisor: Merina SeidelAssistant Editor: Matthew DuranPost-Production Supervisor: Reed BriceSenior Design: Ness Cardano"
"jynxDtFJt68","12 Days of Christmas (Millennial Edition) ft. Try Guys","2018-12-10T23:34:29.000Z","UCfm4y4rHF5HGrSr-qbvOwOg","IISuperwomanII","23","18.19.12","iisuperwomanii,superwoman,team super,comedy,skit,rant,lilly singh,youtube superwoman,manjeet,paramjeet,parents,types of people,superwoman youtube,12 Days of Christmas (Millennial Edition) ft. Try Guys,12 days of christmas,lilly try guys,iisuperwomanii try guys,millennial edition lilly singh,lilly singh try guys,12 days of christmas try,try guys edition,12 days lilly,iisuperwomanii millennial,milenial christmas,millenial christmas","1170359","94523","12621","7659","https://i.ytimg.com/vi/jynxDtFJt68/default.jpg","False","False","We all know the traditional carol of 12 Days of Christmas but we decided it needed a little update. With help from The Try Guys, I introduce to you the 12 Days of Christmas MILLENNIAL EDITION, complete with basic af gifts that for some reason mean the world to us. BEHIND THE SCENES: https://youtube.com/watch?v=JdB8qsV_lggSubscribe: http://bit.ly/SubLillySingh | MERCH: https://lillysingh.comWatch My Last Christmas Collab with Dr. Phil! https://youtube.com/watch?v=u75y8fDb0XA&index=1&list=PLuBXqtS2jaLOHcYCLGaRkFDynyeAWUEuhFollow Try Guys: Subscribe: https://youtube.com/channel/UCpi8TJfiA4lKGkaXs__YdBAIG: https://instagram.com/tryguys/?hl=enTwitter: https://twitter.com/tryguys?ref_src=twsrc%5Eappleosx%7Ctwcamp%5Esafari%7Ctwgr%5Eprofile If you want to add translations, click the gear icon and go to Subtitles/CC then to Add subtitles or CC! Follow Paramjeet:Instagram: https://instagram.com/iiparamjeetii/Twitter: https://twitter.com/iiparamjeetii/ Follow Manjeet:Instagram: https://instagram.com/iimanjeetii/Twitter: https://twitter.com/iimanjeetii/ Get HOW TO BE A BAWSE: https://lillysinghbook.com Follow Lilly Singh:Facebook: https://facebook.com/IISuperwomanII/Instagram: https://instagram.com/iisuperwomanii/Twitter: https://twitter.com/iisuperwomaniiLilly Singh Vlogs: https://youtube.com/user/SuperwomanVlogsOfficial Website: http://lillysingh.com/ Watch More Lilly Singh:Types Of People: https://youtube.com/watch?v=eR_nzGqYXNw&list=PLuBXqtS2jaLMu81JnF6AOnRHzG6Csbd6yMy Parents: https://youtube.com/watch?v=EPHMXbZml_s&list=PLuBXqtS2jaLOGQynSYvxaqUgvNl7Ovz8xSkits: https://youtube.com/watch?v=jyxi0rfEDnE&list=PLuBXqtS2jaLMhu9PU0tAaHbnqloWibwl0The Super Rants: https://youtube.com/watch?v=KYadw8gNOok&list=PLuBXqtS2jaLPopv899QwFphiirmD_XWdqLatest Uploads: https://youtube.com/user/IISuperwomanII/videos?view=0&sort=dd&shelf_id=2 Thanks for watching and don't forget to keep smiling. You're worth it! xoxo"
"dAqC07wsbOk","Our Cats :3","2018-12-09T18:41:54.000Z","UCo8bcnLyZH8tBIH9V1mLgqQ","TheOdd1sOut","23","18.19.12","Cats,shady,luna,pepper,peppermint,calico,spot,sailor moon,dog,georgie,pet,cat person,cartoon,animation,funny,comedy,pepsi,poppy,animals","10566166","537270","8563","144277","https://i.ytimg.com/vi/dAqC07wsbOk/default.jpg","False","False","How many cats do you need to have before you're known as the 'crazy cat lady?' Cat Puuuurrrson shirt: https://theodd1sout.com/collections/odd-1s-out-store/products/cat-puuuuursonAdditional artists: Rushlight Invader ➤ https://www.youtube.com/user/RushLightInvaderToonCee ➤https://www.youtube.com/channel/UC9L3VJUMynz7d_L7KXzukIgAntiDarkHeart ➤ https://twitter.com/AntiDarkHeartPantslessPajamas ➤ https://www.youtube.com/channel/UCR0O-1cvuPNxDosvSDLpWHghyojin ➤ https://twitter.com/squizxyAnnie Loomis ➤ https://twitter.com/annieloomisartHexrin ➤ https://twitter.com/hexriinMolly Flood➤ https://twitter.com/TehFlood/Twitter ➤ https://twitter.com/Theodd1soutInstagram ➤ https://www.instagram.com/theodd1sout/Second Channel ➤ https://www.youtube.com/channel/UC0GLNhtTu7yI8rl6ZZGeezwMerch ➤ https://theodd1sout.com/collections/odd-1s-out-store"
"R4aT8aF50A0","We Found the Auction Corvette's Previous Owner... The Story is INSANE!","2018-12-10T19:43:30.000Z","UCh8f8vssLddD2PbnU3Ag_Bw","Cleetus McFarland","1","18.19.12","leroy,1320video,drag racing,boosted,cleetus McFarland,cleetus,McFarland,Leroy,bald eagles,bald eagle machine,procharger,1320,modified,boost,turbo,twin turbo,precision turbo,precision turbo and engine,Texas speed,resleeved 427,Texas speed and performance,Fasterproms,tuning,tuned,burnout,stick shift,six speed,corvette,Leroy Vette,c5 corvette,Chevrolet,unicorn,c5,supercharging Leroy,turbocharging Leroy,ruby,c6,auction corvette","1538058","35329","815","6711","https://i.ytimg.com/vi/R4aT8aF50A0/default.jpg","False","False","Cleetus Merch! - https://goo.gl/DWHJa3What an INSANE story. We literally can't make this up! Check out the previous owner's channel, he posted some old videos of Ruby! - https://www.youtube.com/channel/UCL3lu9MxSloSxCSX3Gt7FuwCleetus and Cars 2019 dates:Feb 16th Houston April 13th BradentonOct 26th HoustonNov 23th BradentonHolley's new channel - https://www.youtube.com/channel/UCeQfJXzg0gnfuM4tgmagCCwSign up to be a sponsor of our channel! - https://www.youtube.com/channel/UCh8f...-Leroy's Injectors! - http://fuelinjectorclinic.com-Leroy's BILLET Intake! - https://frankensteined.net (15% off one if you use coupon code GODBLESSAMERICA)-Leroy's Clutch (LT1-RR Triple Disc) - monsterclutches.com-Leroy's ECU (Holley Dominator) - https://goo.gl/JjvakM-Precision Turbo (turbos, BOV, waste gates) - http://www.precisionturbo.net -Jeremy's Shop, Fasterproms (tuning) - (813) 476-7364-Texas Speed & Performance - (512) 863-0900-Motion Raceworks - (563) 345-7223-ProFab Performance Plus - (727) 849-9300-RPM Transmissions - www.rpmtransmissions.com-Billet T4 Flanges - www.streetcarrfabrication.com**MERCHANDISE: Leroy the Savage T-SHIRT - https://goo.gl/2FSYaS“DO IT FOR DALE” Cleetus/1320Video T-Shirt - https://goo.gl/2jvjJwCleetus Twin Turbskies T-Shirts - https://goo.gl/TYBLcVMotoloot Key Tags! - https://motoloot.com/collections/clee...**Social Media:Instagram - https://goo.gl/LZvy5eFacebook - https://goo.gl/gdwhh1**SEND ME FAN MAIL... (bald eagles welcome) Cleetus McFarland12961 44th St N. Ste BClearwater, FL 33762United States of America"
"PH3kBCSfL-4","Stranger Things: Season 3 | Title Tease [HD] | Netflix","2018-12-10T01:00:00.000Z","UCWOA1ZGywLbqmigxE4Qlvuw","Netflix","24","18.19.12","Netflix,Trailer,Netflix Original Series,Netflix Series,television,movies,streaming,movies online,television online,documentary,comedy,drama,08282016NtflxUSCAN,watch movies,Stranger Things,Stranger Things 3,Noah Schnapp,Millie Bobby Brown,Finn Wolfhard,Caleb Mclaughlin,Gaten Matarazzo,David Harbour,Sadie Sink,Winona Ryder,Duffer Brothers,PLvahqwMqN4M0tmnA1nyhx0JYnjTm7Zcjz,PLvahqwMqN4M0MGkARAHH7sCVVEepIBVYe,st3tltsr129","4853689","193464","6541","16644","https://i.ytimg.com/vi/PH3kBCSfL-4/default.jpg","False","False","In the summer of 1985, the adventure continues.Watch Strange Things on Netflix:https://www.netflix.com/in/title/80057281#Netflix #StrangerThings #Season3SUBSCRIBE: http://bit.ly/29qBUt7About Netflix:Netflix is the world's leading internet entertainment service with 130 million memberships in over 190 countries enjoying TV series, documentaries and feature films across a wide variety of genres and languages. Members can watch as much as they want, anytime, anywhere, on any internet-connected screen. Members can play, pause and resume watching, all without commercials or commitments.Connect with Netflix Online:Visit Netflix WEBSITE: http://nflx.it/29BcWb5Like Netflix Kids on FACEBOOK: http://bit.ly/NetflixFamilyLike Netflix on FACEBOOK: http://bit.ly/29kkAtNFollow Netflix on TWITTER: http://bit.ly/29gswqdFollow Netflix on INSTAGRAM: http://bit.ly/29oO4UPFollow Netflix on TUMBLR: http://bit.ly/29kkemTStranger Things: Season 3 | Title Tease [HD] | Netflixhttp://youtube.com/netflix"
"2VawSnaxtSI","KINGDOM HEARTS III – Opening Movie Trailer","2018-12-09T15:00:01.000Z","UCCyrXyelKeXFx5KDgldMmNw","Kingdom Hearts","20","18.19.12","KINGDOM HEARTS 3,KINGDOM HEARTS,KH,KH3,Disney,Square Enix,Magic,Mickey,Sora,Donald,Goofy,Friendship,Opening Movie,FINAL FANTASY,Skrillex,Utada Hikaru,Hikaru Utada","4149353","148928","5692","26663","https://i.ytimg.com/vi/2VawSnaxtSI/default.jpg","False","False","Find out more about KINGDOM HEARTS III https://sqex.link/kingd7bd1bHurry and Pre-Order your KINGDOM HEARTS III Deluxe Edition before they’re all sold out! Supplies are limited! PS4 – https://sqex.link/kingda69d7  XB1 – https://sqex.link/kingdfbf33                 Longtime Kingdom Hearts contributor Hikaru Utada has teamed up with longtime Kingdom Hearts superfan Skrillex to create the amazing theme “Face My Fears”.Watch the forces of light and darkness gather as the battle for KINGDOM HEARTS approaches! It is time for Sora and all the KINGDOM HEARTS characters to face their fears!   KINGDOM HEARTS III is coming to Sony PlayStation® 4 and Microsoft Xbox One on January 29, 2019. Pre-order the song Face My Fears from Hikaru Utada and Skrillex and get instant access to “Don’t Think Twice” available at 12am EST / 9pm PST! https://sonymasterworks.lnk.to/FaceMyFearsBe sure to follow us to keep up to date with everything Kingdom Hearts related: Twitter - https://twitter.com/KingdomHearts Instagram - https://www.instagram.com/KingdomHearts Facebook - https://www.facebook.com/KingdomHearts YouTube - https://www.youtube.com/KingdomHearts #KingdomHearts"
"HblwLcAR4r4","The Brooklyn Nine-Nine All Action Trailer","2018-12-09T15:00:07.000Z","UCtRa82x1BwQdnpHf0Es4gcQ","Brooklyn Nine-Nine","24","18.19.12","Brooklyn Nine-Nine,brooklyn 99,bk99,andre braugher,andy samberg,stephanie beatriz,terry crews,melissa fumero,jue lo truglio,captain holt,jake peralta,rosa diaz,terry jeffords,amy santiago,charles boyle,action movie,brooklyn nine-nine moves to nb,99,Andy Samberg,Jake Peralta,Stephanie Beatriz,Rosa Diaz,Terry Crews,Joe Lo Truglio,Detective Charles Boyle,Melissa Fumero,Detective Amy Santiago,Detective Jake Peralta,NBC","3371982","81091","1038","3225","https://i.ytimg.com/vi/HblwLcAR4r4/default.jpg","False","False","It's the Nine-Nine like you've never seen it before - in full action mode! Watch as Brooklyn Nine-Nine makes the leap to NBC, Thursday, January 10 at 9/8c on NBC.» Subscribe for More: http://bit.ly/NBCBrooklyn99» Brooklyn Nine-Nine Premieres Thursday, January 10 9/8c on NBC!» Get More Brooklyn Nine-Nine: https://www.nbc.com/brooklyn-nine-nineBROOKLYN NINE-NINE ON SOCIAL:Like Brooklyn Nine-Nine on Facebook: https://www.facebook.com/BrooklynNineNineFollow Brooklyn Nine-Nine on Twitter: https://twitter.com/NBCBrooklyn99Find Brooklyn Nine-Nine on Tumblr: http://nbcbrooklyn99.tumblr.com/Follow Brooklyn Nine-Nine on Instagram: https://www.instagram.com/nbcbrooklyn99The hilarious heroics of New York's funniest police precinct continue for a new season, with a brand-new home: NBC. Find Brooklyn Nine-Nine trailers, full episode highlights, previews, promos, clips, and digital exclusives here. NBC ON SOCIAL:NBC YouTube: http://www.youtube.com/nbcLike NBC: http://Facebook.com/NBCFollow NBC: http://Twitter.com/NBCNBC Tumblr: http://NBCtv.tumblr.com/NBC Pinterest: http://Pinterest.com/NBCtv/NBC Google+: https://plus.google.com/+NBCNBC Instagram: http://instagram.com/nbcABOUT BROOKLYN NINE-NINESNL alum Andy Samberg and Emmy winner Andre Braugher lead this diverse, critically acclaimed ensemble that solves crimes like only they can - with tons of humor and the heart to match. Winner of a Golden Globe Award for Best Comedy Series and from Executive Producers Michael Schur and Dan Goor, Brooklyn Nine-Nine has captured the hearts of millions, and NBC is proud to be a part of the story.The Brooklyn Nine-Nine All Action Trailerhttps://youtu.be/HblwLcAR4r4Brooklyn Nine-Ninehttps://www.youtube.com/NBCBrooklyn99"
