video_id,title,publishedAt,channelId,channelTitle,categoryId,trending_date,tags,view_count,likes,dislikes,comment_count,thumbnail_link,comments_disabled,ratings_disabled,description
"hA6hldpSTF8","Marvel Studios' Avengers - Official Trailer","2018-12-07T13:01:21.000Z","UCvC4D8onUfXzvjTOM-dBfEA","Marvel Entertainment","24","18.11.12","marvel,comics,avengers,avengers 4,trailer,official,a4,mcu,endgame","63180393","2961868","42043","301535","https://i.ytimg.com/vi/hA6hldpSTF8/default.jpg","False","False","Part of the journey is the end.► Subscribe to Marvel: http://bit.ly/WeO3YJLearn more: https://bit.ly/2QD3Z85---Follow Marvel on Twitter: ‪https://twitter.com/marvelLike Marvel on FaceBook: ‪https://www.facebook.com/MarvelFor even more news, stay tuned to:Tumblr: ‪http://marvelentertainment.tumblr.com/Instagram: https://www.instagram.com/marvelGoogle+: ‪https://plus.google.com/+marvelPinterest: ‪http://pinterest.com/marvelofficial"
"lXQgSJsqLyw","BB Ki Vines- | Ghar Ke Kaagaz |","2018-12-08T14:04:52.000Z","UCqwUrj10mAEsqezcItqvwEw","BB Ki Vines","24","18.11.12","BB Ki Vines,Bhuvan Bam,Titu mama,family,comedy,drunk,confession,humour,hilarious,bollywood,movies","8721293","839424","22542","62951","https://i.ytimg.com/vi/lXQgSJsqLyw/default.jpg","False","False","Titu mama comes home drunk to confess in front of Babloo and Janki. What happens next?Games Khelo aur Paise Jeeto!Jeetiye 1 lakh Rupaye harr roz -MPL App download kariye abhi aur shuru ho jaiye apne favourite games ke saath -https://www.mpl.liveMy favorite Mivi Wireless Earphones : https://mivi.shop/ed8eSpecial Coupon Code for BB Army: BBDECBuy BB Ki Vines Official Merchandise here:https://youthiapa.com/Facebook► https://www.facebook.com/BBkiVines/Instagram► bhuvan.bam22Snapchat► bbkv22Twitter►https://twitter.com/Bhuvan_Bam and https://twitter.com/BBkv22.This is an all original work of BB Ki Vines."
"pHlnKdHiZ2Y","ANGEL (2018) New Released Full Hindi Dubbed Movie | Naga Anvesh, Hebah Patel | South Movie 2018","2018-12-09T16:00:07.000Z","UCSx_w4q5PkAOg9i45uMFHmA","AD-WISE MEDIA ACTION MOVIEPLEX","24","18.11.12","south movie,south,south movie 2018,hindi movies,hindi movie 2018,new hindi movie,sauth movie in hindi 2018,action movies,hindi action movie,Hindi Movie,new hindi movies 2018,new south movie 2018,new south indian movies dubbed in hindi 2018 full,new movies 2018,south indian movies dubbed in hindi full movie 2018 new,new sauth movie 2018 hindi dubbed,hindi,bollywood,angel movie hindi,hebah patel movies in hindi dubbed,naga anvesh movies","7082055","69380","6046","3811","https://i.ytimg.com/vi/pHlnKdHiZ2Y/default.jpg","False","False","Presenting South (Sauth) Indian Movies Dubbed In Hindi Full Movie 2018 New (New Hindi Action Movies 2018, South Movie 2018, New Movies 2018) ANGEL starring Hebah Patel & Naga Anvesh. Exclusively on AD-WISE MEDIA ACTION MOVIEPLEX.Subscribe सब्सक्राइब Us For More South Indian Blockbusters in Hindi for FREE - http://bit.ly/ADMDMoviesList Of Our Superhit South Indian Movies Dubbed In Hindi:⦿ Razor : https://youtu.be/xrBQbQTiLjk⦿ Khalnayak 2 : https://youtu.be/YNsuF9wlmd4⦿ Junoon : https://youtu.be/ADNIDp7YvGw⦿ Tashan : https://youtu.be/w5AlaRjoZJg⦿ Chalo : https://youtu.be/IPo0mtsTydQ⦿ Vishnu Shastra : https://youtu.be/h9LF2JQH9QI⦿ Fire Man Surya : https://youtu.be/ZVcxz8A1l14⦿ The Great Story Of Sodabuddi : https://youtu.be/7fi2_xagIMw⦿ Rx Karthik : https://youtu.be/oJUFE90YM88⦿ Bhaagamathie : https://youtu.be/of51ugIPrhk⦿ Romeo Express : https://youtu.be/V_0LPSQUaO4⦿ Powerful Revenge : https://youtu.be/OW3B98ZJ8BE⦿ JUNGLE : https://youtu.be/HhwTvDbsebwCredits:Directed by PalaniProduced by Bhuvan SagarStarring: Hebah Patel, Naga AnveshMusic by Bheems CecireleoCinematography: GunasekaranProduction company: Saraswathy FilmsSynopsis:Nani (Nag Anvesh) is a small-time smuggler who comes across a holy angel called Nakshatra (Hebah Patel). As time passes by, Nani and Nakshatra fall deep in love and start spending quality time with each other. This is also the time when Nakshatra’s dad gets upset with her and sends a special person (Kabir Singh) to bring her back to their fantasy world. What will Nakshatra do now? Will she go back to the place where she came from? How will she convince everyone about her existence? That forms the rest of the story.For more such movies► Subscribe our channel : http://bit.ly/ADMDMovies► Visit our website: https://www.admdmovies.com► Follow us on Twitter: www.twitter.com/AdwiseMediaD► Like us on Facebook: www.facebook.com/adwisemediadigital#AngelMovie #HindiDubbedMovie #SouthMovie2018"
"2AQDaJTrjoI","adchithooku Song with Lyrics | Viswasam Songs | Ajith Kumar, Nayanthara | D.Imman | Siva","2018-12-10T13:30:00.000Z","UCnSqxrSfo1sK4WZ7nBpYW1Q","Lahari Music | T-Series","10","18.11.12","viswasam,viswasam songs,ajith songs,viswasam single track,Adchithooku Song,adchithooku,viswasam tamil movie songs,ajith kumar songs,viswasam teaser,thala ajith,viswasam movie songs,viswasam adchithooku song,viswasam first single adchithooku,viswasam adchithooku,viswasam first single,viswasam 1st single,viswasam trailer,viswasam single track song,viswasam song,sathya jyothi films,Nayanthara,D Imman,d imman songs,siva,#Viswasam,#Adchithooku","4305424","500301","73895","43068","https://i.ytimg.com/vi/2AQDaJTrjoI/default.jpg","False","False","Watch & Enjoy adchithooku Song with Lyrics From Viswasam Tamil Movie, Starring Ajith Kumar, Nayanthara.#Viswasam #adchithooku #ViswasamSongs #VishwasamListen to the Song adchithooku Exclusive on Gaana: Gaana: https://gaana.com/song/adchithookuSong: AdchithookuCast: Ajith Kumar, Nayanthara, Jagapathi Babu, Vivek, Thambi Ramiah, Yogi Babu, Robo Shankar & Kovai SaralaSingers: D.Imman, Aditya Gadhavi, NarayananLyricist: VivekaDirector: Siva Music Director: D ImmanProducer: Sendhil Thyagarajan, Arjun ThyagarajanBanner: Sathya Jyothi FilmsMusic production: Ranjan,Indian Percussions conducted by Kaviraj,Electric and Bass guitars- Keba Jeremiah,Harmony Vocals conducted by D.ImmanCopyright: MRT Studios------------Enjoy & stay connected with us!!Subscribe to our Youtube Channel : http://bit.ly/1hE4KpSLike us on FB: https://goo.gl/hbfPfL Circle Us on G+ :  http://goo.gl/STQX0gFollow Us on Twitter : http://bit.ly/1sZimzM"
"NrYtkb0a0uI","Vijay Sethupathi's Speech | PETTA Audio Launch","2018-12-10T09:27:11.000Z","UCBnxEdpoZwstJqC1yZpOjRA","Sun TV","24","18.11.12","SunTV,SuperStar,SuperStarRajiniKanth,Rajinikanth,SunPictures,KarthikSubbaraj,Anirudh,AnirudhRavichander,Vivek,LyricistVivek,SPB,SPBalasubramanyam,Petta,MaranaMass,SouthMovie,TamilMovie,PettaPongal,PettaPongalParak,PettaParak,2nd single,ThalaivarBaila,Ullaallaa,PettaSecondSingle,karthiksubbaraj,AzizNakash,innogenga,Karthik Subbaraj,Simran,Vijay Sethupathi,Trisha,Nawazuddin,Sasikumar,Megha Akash,Audio Launch,Petta Teaser Petta Trailer,Sun TV,Petta SunTV,Rajini Movie,Kaali,Jithu","1677658","59268","1411","2262","https://i.ytimg.com/vi/NrYtkb0a0uI/default.jpg","False","False","#PettaAudioLaunch"
"MTXXMDfIicA","Antariksham 9000 KMPH Theatrical Trailer | Varun Tej, Aditi Rao, Lavanya Tripathi | Sankalp Reddy","2018-12-09T05:28:19.000Z","UC-qG4kLJF_D0VNdYuKk-bkw","First Frame Entertainments","1","18.11.12","First Frame Entertainments,Antariksham,Antariksham 9000 kmph teaser,Antariksham trailer,Antariksham teaser,Antariksham 9000 movie teaser,Antariksham varun tej,Antariksham 9000 km h trailer,Antariksham videos,Antariksham movie,Varun Tej,Aditi Rao Hydari,Lavanya Tripathi,Sankalp Reddy,varun tej new movie,Antariksham movie teaser,Antariksham telugu movie trailer,Antariksham 9000KMPH,antariksham movie first look,antariksham theatrical trailer","4250266","137162","5964","11326","https://i.ytimg.com/vi/MTXXMDfIicA/default.jpg","False","False","Here is #Antariksham9000KMPHTheatricalTrailer.Starring: Varun Tej, Lavanya Tripathi, Aditi Rao Hydari, Satya Dev, Raja, Srinivas Avasarala, RahmanProducers: Rajeev Reddy Yeduguru, Radha Krishna Jagarlamudi (Krish) and Sai Babu JagarlamudiWriter & Director : Sankalp ReddyDOP: Gnana Sekhar V.S. (Baba)Editor: Karthika SrinivasProduction Designers: Ramakrishna Sabbani, Monika Nigotre SabbaniMusic: Prashanth R. VihariDialogues: Kittu VissaapragadaCostume Designer/Stylist: Ashwanth ByriStunts: Todor LazarovC.G.: Rajeev RajasekharanSFX: Maish Tyagi#Antariksham #FirstFrameEntertainmentsFor More Videos from First Frame EntertainmentsSubscribe us @ https://www.youtube.com/channel/UC-qG4kLJF_D0VNdYuKk-bkw?sub_confirmation=1"
"_KhQT-LGb-4","SIMMBA: Aankh Marey | Ranveer Singh, Sara Ali Khan | Tanishk Bagchi, Mika, Neha Kakkar,  Kumar Sanu","2018-12-06T05:30:01.000Z","UCq-Fj5jknLsUf-MWSy4_brA","T-Series","10","18.11.12","latest hindi songs,bollywood songs,songs,hindi songs,songs2018,Aankh Marey,aankh mare ladki aankh mare,hindi songs 2018,Simmba,simmba movie,simmba movie song,simmba 2018,sara ali khan,ranveer singh simmba,ranveer singh,simmba ranveer singh movie,simmba sara ali khan,simbaa,zero,deepika padukone,karan johar,bollywood,simba,sonu sood,aankh mare simba,simba movie songs,t series,t series songs,ankh marey arshad varsi,simmba songs","53804239","848704","106607","68359","https://i.ytimg.com/vi/_KhQT-LGb-4/default.jpg","False","False","Presenting the first video song Aankh Marey from the Bollywood Movie Simmba , The movie features Ranveer Singh, Sara Ali Khan, Sonu Sood along with Siddharth Jadhav, Ashutosh Rana in leading roles, produced by Hiroo Johar, Rohit Shetty, Apoorva Mehta & Karan Johar.Releasing Worldwide on ►December 28, 2018 Ankh Marey | Aankh Mare Ladki Aankh Mare Song | New Songs 2018 Hindi #AankhMarey #SimmbaSongs #Ranveersingh #SaraAliKhan Streaming On:♪ iTunes : http://bit.ly/Aankh-Marey-Simmba-iTunes-Store♪ Hungama : http://bit.ly/Aankh-Marey-Simmba-Hungama ♪ Saavn : http://bit.ly/Aankh-Marey-Simmba-Saavn♪ Gaana : http://bit.ly/Aankh-Marey-Simmba-Gaana♪ Apple Music : http://bit.ly/Aankh-Marey-Simmba-Apple-Music ♪ Amazon Prime Music : http://bit.ly/Aankh-Marey-Simmba-Amazon-Prime-Music♪ Google Play : http://bit.ly/Aankh-Marey-Simmba-Google-Play♪ Wynk : http://bit.ly/Aankh-Marey-Simmba-Wynk♪ Idea Music : http://bit.ly/Aankh-Marey-Simmba-Idea-Music------------------------------------------------------------------------------------------------------Produced by : Hiroo Johar, Rohit Shetty, Apoorva Mehta & Karan JoharDirected by: Rohit Shetty Star Cast : Ranveer Singh, Sara Ali Khan, Sonu Sood along with Siddharth Jadhav, Ashutosh Rana Song -Aankh MareySingers - Neha Kakkar, Mika Singh And Kumar Sanu.Music - Tanishk BagchiRe-Created And Programmed: Tanishk BagchiLyrics - Shabbir AhmedAdditional Percussions: Krishna Kishor And TeamMusic Supervisor - Azeem DayaniVoice over and special thanks -Rajnigandha ShekhawatSongs Mixed And Mastered By Eric Pillai@Future Sound Of BombayMix Assistant Engineers - Michael Edwin PillaiQuirks – Azeem Dayani♫ ORIGINAL SONG CREDITS ♫Song : Aankh Maare O Ladka Aankh MaareMovie : Tere Mere SapneSinger : Kumar Sanu, Kavita KrishnamurthyLyricist : Anand BakshiMusic Director : Viju ShahArtist : Arshad Warsi, Chandrachur Singh, Priya GillMusic Label : T-Series___Enjoy & stay connected with us!► Subscribe to T-Series: http://bit.ly/TSeriesYouTube► Like us on Facebook: https://www.facebook.com/tseriesmusic► Follow us on Twitter: https://twitter.com/tseries► Follow us on Instagram: http://bit.ly/InstagramTseries"
"iP2mL74yVB4","Girls Hostel | Episode 1 - The Bra Chor || Girliyapa Originals","2018-12-08T09:31:28.000Z","UCdxbhKxr8pyWTx1ExCSmJRw","Girliyapa","24","18.11.12","Girls Hostel | Episode 1 - The Bra Chor || Girliyapa Originals,Girls Hostel,girls,hostel,episode 1,episode,girls hostel serial,girls hostel girliyapa,girls hostel episode 1,the,bra,chor,Girliyapa Originals,girliyapa,originals,lost my bra,bra thieves,funny videos,girlfriends,girl friends,hostel friends,hostel life,whisper,girls hostel full episode,clothes,hostel funny,girliyapa girls hostel,girliyapa new,girliyapa new videos,hostel remix,web show,tvfplay","4548807","148361","5978","7685","https://i.ytimg.com/vi/iP2mL74yVB4/default.jpg","False","False","Richa wants to live life by her terms and she starts this journey in SVM’s Dental College Girls hostel. On her first day she meets sweet and innocent Milli but she doesn’t anticipate that she would meet Jo and Zahira, her seniors who rule over the hostel. Amidst all the drama, there has been a thief hiding in plain sight who steals clothes from all the girls in the hostel. Will Richa, Milli and Jo be able to find the thief? Will Richa be able to live her life by her own rules? Watch the first episode of Whisper presents Girls Hostel to find out!Written by: Shreyasi SharmaDirected by: Chaitanya KumbhakonumEdited by: Akash BundhooMusic by: Vaibhav BundhooCast: Ahsaas Channa, Srishti Shrivastava, Parul Gulati, Simran Natekar, Shreya Mehta, Gagan Arora Wardrobe Courtesy: Bewakoof, Mystere Paris, Vero Moda#Girliyapa #GirliyapaOriginalsFollow Girliyapa on: Instagram: https://www.instagram.com/girliyapa/ Facebook: https://www.facebook.com/Girliyapa/ Twitter: https://twitter.com/GirliyapaWant more awesome original videos?Head to https://tvfplay.com/Download TVFPlay now:Android: http://bit.ly/tvfplayandroid iOS: http://bit.ly/tvfplayios"
"Ci0WbaUH3no","She Move It Like - Official Video | Badshah | Warina Hussain | ONE Album | Arvindr Khaira","2018-12-10T09:28:29.000Z","UC56gTxNs4f9xZ7Pa2i5xNzg","Sony Music India","10","18.11.12","Sony Music India,Sony Music,Latest Hits,she move it like,badshah new song,she move it like badshah,badshah dance song,one album,warina hussain,badshah warina hussain,arvindr khaira,dance song 2018,party song 2018,Badshah New Song,Warina Hussain Hot,Heartless,Lets Nacho,Party Songs 2018,New Year Party Songs","6311622","213859","16298","10408","https://i.ytimg.com/vi/Ci0WbaUH3no/default.jpg","False","False","The No.1 Rap King of the Nation, BADSHAH,  created history with his first album O.N.E. Packed with 17 Super Hit chartbusting tracks!Be it DJ Waley Babu or Heartless, this Hit Machine has made sure he shows no MERCY. From being an underground Rapper to becoming a worldwide sensational phenomenon, BADSHAH, the trendsetter of Music is all set to showcase all that you’ve been waiting for. O.N.E- Original Never Ends features the divas of Pop Music- Sunidhi Chauhan, Aastha Gill and Lisa Mishra! Can it get any better? We Bet not!Presenting She Move It Like featuring Warina Hussain from the most anticipated album of the year ONE. The video has been directed by Arvindr Khaira.Hear It On Gaana : https://gaana.com/song/she-move-it-like#SheMoveItLike #Badshah #WarinaHussain #ONEAlbum Welcome your Callers with this groovy caller tune :Airtel subscribers Dial 5432116572186  Vodafone subscribers Dial 53710612760  Idea subscribers Dial 5678910612756 BSNL (South/East) subscribers sms BT 10612756 to 56700  BSNL (North/West) subscribers sms BT 7150382 to 56700  Jio users, download the Jio Music App to set this song as your Jio Tune  Singer : BadshahMusic & Lyrics : BadshahProgramming : Aditya DevMix & Master : Aditya DevCast : Badshah & Warina HussainStylist : Divya Bawa ( Warina Hussain)Hair & Make Up - Marcello Juan Pedrozo ( Warina Hussain)Manager : Disha Raval ( TOABH Talent Management for Warina Hussain)  Costumes  / Wardrobe (Badshah) : Team Badshah & Nought OneHair - Javed AlamMake Up - Swapnil Haldankar Story & Direction : Arvindr KhairaAsst. Directors : Harman Buttar , Satnam , GopiDOP : Sayed TanveerSteadicam : Amaninder SyanProduction : Bhatt production & Fateh ProductionEditor : AdeleVFX: ShudhanshuArt Director : Pinki , BlaccColorist : Nadeem AkhtarChoreographers : Sahaj & Shreoshi Still Photography : Hardik GambhirPublicity Creatives & Designs : Karanjit SinghMusic Label : Sony Music Indiacourtyard. Choleric, phlegmatic, melancholy, sanguineBharti Kher, at The Sculpture Park at Madhavendra Palace, on Loan from Nature Morte, Dehli and Bharti Kher's Studio, GurgaonArrested Image of a DreamThukral & Tagraat The Sculpture Park at Madhavendra Palace, on Loan from Nature Morte, Delhi and Thakrul and Tagra's Studio, GurgaonterraceThe Hundred Petal LotusVikram Goyal,at The Sculpture Park at Madhavendra Palace, on Loan from Viya Home, DelhiFor exclusive updates on Punjabi / Pop Music connect -Facebook- https://www.facebook.com/SonyMusicNorthTwitter - https://twitter.com/sonymusicnorthSubscribe: https://www.youtube.com/user/sonymusicindiaVEVOFollow us: Twitter - https://twitter.com/sonymusicindiaG+ https://plus.google.com/+SonyMusicIndiaAudio on Sony Music Entertainment India Pvt. Ltd (C) 2018 Sony Music Entertainment India Pvt. Ltd."
"YbJOTdZBX1g","YouTube Rewind 2018: Everyone Controls Rewind | #YouTubeRewind","2018-12-06T17:58:29.000Z","UCBR8-60-B28hp2BmDPdntcQ","YouTube Spotlight","24","18.11.12","Rewind,Rewind 2018,youtube rewind 2018,#YouTubeRewind,Rewind 2017,Lilly Singh,Markiplier,Swoozie,Liza Koshy,Dolan Twins,Lele Pons,Rudy Mancuso,Casey Neistat,LaurDIY,Merrell Twins,Collins Key,Safiya Nygaard,Luisito Comunica,BB Ki Vines,Bie The Ska,Authentic Games,Manual do Mundo,Fortnite,Kiki Challenge,Mukbang,Ninja,BTS,Idol,Marshmello,Cardi B,Year in Review,In my feelings challenge","106585602","2104339","8248226","1835660","https://i.ytimg.com/vi/YbJOTdZBX1g/default.jpg","False","False","YouTube Rewind 2018. Celebrating the videos, people, music and moments that defined 2018. #YouTubeRewindIt wouldn’t be Rewind without the creators: https://rewind.youtube/creatorsExplore the videos, music and trends that defined YouTube in 2018: https://rewind.youtubeWatch the Behind the Scenes video: https://youtu.be/8qTQbk2A02M  See all the Easter Eggs: https://goo.gl/xr3uUn  Music by The Hood InternetYouTube Rewind 2018 produced by Portal A Starring:10OcupadosAdam RipponAfros e Afins por Nátaly NeriAlisha MarieAmi Rodriguez Anwar JibawiAsapSCIENCEAuthenticGamesBB Ki VinesBearhugBie The SkaBilingirl ChikaBokyem TVCajuTVCasey NeistatCasparCherrygummsCollins KeyDagi BeeDesimpedidosDiva DepressãoDolan TwinsDomicsDotty TVElle Millsemma chamberlainEnes BaturEnjoyPhoenixEroldStoryFAP TVFavijTVFischer'sFurious JumperGabbie HannaGamingWithKevGEN HALILINTARGongdaesanggymvirtualHannah StockingHikakinTVHow RidiculousillymationItsFunnehJaidenAnimations James CharlesJohn OliverJordindian Jubilee MediaJukiLopjulioprofeKatya ZamolodchikovaKaykai Salaider Kelly MissesVlogKrystal Yam & familyLA LATALachlanLaurDIYLele PonsLife NogginLilly SinghLiza KoshyLosPolinesiosLucas the SpiderLuisito Comunica (Rey Palomo)LuzuLynaManual do MundoMarkiplier Marques BrownleeMarshmelloMason RamseyMe Poupe!Merrell TwinsMichael Dapaah MissRemiAshtenmmoshayaMolly BurkeMs YeahMuro PequenoNick Eh 30NikkieTutorials NinjaNoor Stars PautipsPinkfong Baby SharkPozziPrimitive TechnologyRobleisIUTURosanna PansinoRudy MancusoSafiya NygaardSam TsuiSamHarveyUKSHALOM BLACSimone Giertzskinnyindonesian24Sofia Castro @StrayRogue and @DitzyFlama (Bongo Cat)sWooZieTabbesTechnical Guruji The Try GuysTheKateClappTheOdd1sOutTiền Zombie v4 Trevor NoahTrixie MattelWengieWhinderssonNunesWill SmithYammy Yes TheoryAll comments featured in Rewind inspired by real comments from the YouTube community."
"felou_KGREM","Azhagu - Tamil Serial | அழகு | Episode 323 | Sun TV Serials | 10 Dec 2018 | Revathy | Vision Time","2018-12-10T14:15:08.000Z","UCOpUWgNJq1kUlB3Z5KM7X-A","Vision Time Tamil","24","18.11.12","Azhagu,அழகு,Azhagu Tamil Serial,Full Episode 323,Sun TV Serials,10 December 2018,Thalaivasal Vijay,Vision Time,azhagu serial,azhagu serial today episode,azhagu serial yesterday episode,azhagu tamil serial,azhagu tamil serial today episode,azhagu tv serial,azhagu yesterday tamil serial,azhagu latest sun tv,azhagu latest serial,Revathy tamil serial,Revathy latest serial,Revathy sun tv serial,latest sun tv serial,azhagu latest episodes","787888","4764","788","893","https://i.ytimg.com/vi/felou_KGREM/default.jpg","False","False","Azhagu Tamil Serial latest Full Episode 323 Telecasted on 10 December 2018 in Sun TV. Azhagu Serial ft. Revathy, Thalaivasal Vijay, Shruthi Raj and Aishwarya in the lead roles. Azhagu serail Produced by Vision Time, Directed by ON Rathnam, Dialogues by Jagan. Azhagu serial deals with the nuances of love between a husband (Thalaivasal Vijay) and wife (Revathi), even though they have been married for decades, and have successful and very strong individual personas.Click here to watch : Azhagu Full Episode 322 https://youtu.be/yvyCexakIqMAzhagu Full Episode 321 https://youtu.be/OEEiXgDEFJAAzhagu Full Episode 320 - https://youtu.be/D_OtqqZ3DXgAzhagu Full Episode 319 https://youtu.be/olNKEmHZpaoAzhagu Full Episode 318 - https://youtu.be/RL5T3rBgLv8Azhagu Full Episode 317 https://youtu.be/79EfydoP6p8Azhagu Full Episode 316 https://youtu.be/gI7wrzdgruYAzhagu Full Episode 315 - https://youtu.be/QpxKlxB-IpIAzhagu Full Episode 314 https://youtu.be/eHva0bDszNcAzhagu Full Episode 313 https://youtu.be/eeoJY4h_iIkAzhagu Full Episode 312 https://youtu.be/Gmr9i6HACEIAzhagu Full Episode 311 https://youtu.be/g9O_bAvrTRcSubscribe for latest Azhagu Episodes - http://bit.ly/SubscribeVTLike us on - https://www.facebook.com/visiontimeindia"
"Im1fyNtaW4o","Romil Choudhary's Wife Comments On Somi Khan | Bigg Boss 12","2018-12-10T12:56:37.000Z","UCjZfuDrU3FkjPJroH6s1-pA","Lehren Small Screen","24","18.11.12","Bigg boss contestant romil chaudhary,romil chaudhary,romil chaudhary wife entered bigg boss house,romil chaudhary wife said somi khan romil’s sister,somi khan sister saba khan entered bigg boss 12,somi khan crying in bigg boss house,romil emotional in bigg boss house,romil chaudhary angry,surbhi rana crying in bigg boss house,karanveer bohra crying in bigg boss house,dipika crying in bigg boss house,bigg boss house12,bigg boss live alert update,bigg boss gossip","228281","1220","208","443","https://i.ytimg.com/vi/Im1fyNtaW4o/default.jpg","False","False","Romil Choudhary’s wife and Somi Khan’s sister Saba Khan enters the Bigg Boss house. #RomilChoudhary,#BiggBoss12,##SabaKhan,Catch up on all the drama of your favourite TV shows, subscribe now: http://bit.ly/LehrenSmallScreenLog On To Our Official Website : http://www.lehren.comFacebook : https://bit.ly/LehrenFacebookTwitter: https://bit.ly/LehrenTwitter"
"vpGC1Yu94jY","BHEN VS BHAI - | Elvish Yadav |","2018-12-09T05:49:32.000Z","UCbmu9wfzxKls40WkCzvqtRA","Elvish yadav","23","18.11.12","bhen vs bhai elvish yadav,elvish yadav bhen bhai,elvish yadav video,elvish yadav new video,brother sister video,elvish yadav latest video,bhen bhai videos,bhen vs bhai,elvish yadav vines,elvis yadav,elvish yadav desi,elvish yadav school life',bhai vs bhen videos","2696068","244652","4773","15740","https://i.ytimg.com/vi/vpGC1Yu94jY/default.jpg","False","False","This video shows story of a brother and sister  Directed By  - Gaurav aggarwal, Elvish YadavWritten By - Elvish yadavCo Writer -  kirti mehraEditor - Elvish yadav Produced By - Elvish YadavCast - Elvish yadav, sibbu giri , gaurav aggarwalFOLLOW MY SOCIAL MEDIA HANDLESINSTAGRAM-    http://instagram.com/elvish_yadavFACEBOOK. -    http://facebook.com/theindianvinerTWITTER-         http://twitter.com/elvishyadavSNAPCHAT -   @elvishyadav"
"HXG9WcmySME","Maanam Thudukkanu | Odiyan Official Video Song HD | #Mohanlal #ManjuWarrier #ShreyaGhoshal | M J","2018-12-08T15:12:11.000Z","UCpJmCkjsJbqIBdvTRx2zt-w","satyamvideos","10","18.11.12","Odiyan Official Video Song HD,Maanam Thudukkanu,Shreya Ghoshal,M Jayachandran,New Film Song,K. Harikrishnan,Aashirvad Cinemas,V. A. Shrikumar Menon,Rafeeq Ahamed,Satyam Audios,Satyam Videos","2096532","86387","3897","5695","https://i.ytimg.com/vi/HXG9WcmySME/default.jpg","False","False","Singer : Shreya GhoshalLyrics : Rafeeq AhamedMusic: M JayachandranOdiyan is an upcoming Malayalam-language Indian fantasy thriller film directed by V. A. Shrikumar Menon in his feature film debut, written by K. Harikrishnan. It is based on the legend of Odiyan, who in Kerala folklore are men possessing shapeshifting abilities, who could assume animal form. Odiyans are said to have inhabited the Malabar region of Kerala before the era of electricity. The film stars Mohanlal in the lead role, with Prakash Raj and Manju Warrier; produced by Aashirvad Cinemas & Action choreographed by Peter Hein. The songs featured in the film is composed by M. Jayachandran while the lyrics are written by Rafeeq Ahamed and Lakshmi Shrikumar.Subscribe Now  Satyam Jukebox: https://www.youtube.com/user/satyamju...Satyam Videos: https://www.youtube.com/user/satyamvi... Satyam Audios: https://www.youtube.com/user/SatyamAudioFollow usSatyam Audios Facebook - https://www.facebook.com/SatyamAudiosSatyam Audios Twitter - https://twitter.com/satyamaudiosSatyam Audios Website -  http://satyamaudios.com/Satyam Audios Pinterest - https://www.pinterest.com/satyamaudios/#Mohanlal #ManjuWarrier #Odiyan #MJayachandran #ShreyaGhosal"
