video_id,title,publishedAt,channelId,channelTitle,categoryId,trending_date,tags,view_count,likes,dislikes,comment_count,thumbnail_link,comments_disabled,ratings_disabled,description
"_YA-XF1zzKM","Koffee With Karan: Saif Ali Khan and Sara Ali Khan","2018-11-11T16:30:00.000Z","UCa0ZcLPHL2QY1p1xqBCYedQ","Star World","24","18.13.11","[none]","3144587","27265","2008","1802","https://i.ytimg.com/vi/_YA-XF1zzKM/default.jpg","False","False","The dynamic father-daughter duo are here to brew up some fun! #KoffeeWithKaran #KoffeeWithSaif #KoffeeWithSara #SaifAliKhan #SaraAliKhan"
"1Av2Al-uoQ0","School Diaries | Harsh Beniwal","2018-11-12T14:13:05.000Z","UCVmEbEQUGXHVm-O9pqa3JWg","Harsh Beniwal","23","18.13.11","Harsh beniwal,harsh,beniwal,harsh beniwal school diaries,school,diaries,school diaries,harsh beniwal school video,harsh beniwal new video,harsh beniwal latest video,harsh beniwal school,top video,funny videos,harsh beniwal best video,popular video,harsh beniwal popular video,harsh beniwal comedy,bollywood,nazarbattu","1577060","234651","2153","34498","https://i.ytimg.com/vi/1Av2Al-uoQ0/default.jpg","False","False","This video is all about those School Memories which is close to my heart and I hope you guys will also relate to it.This video will take you to those days , those Precious Memories, which comes once for a lifetime. Cheers…    Cast - Kritika   KRITIKA NARULA Harshu   HARSH BENIWAL Mohit   MOHIT CHHIKARA Jaigo   JAIGO GILL Annie   TENA JAIIN Annie's friend AKRITI BAJPAI  Golu Bhaiya    TARED SACHDEVA         Friend 1      KSHITIJ TIWARI         Friend 2    PURAV JHA Dilwara   JITENDER KUMAR Choti Kritika  KANISHKA Chota Harshu AAYUSH YADAV Chota Mohit   VEDANSH RANA Chota Jaigo   TANVEER MALHOTRA Harsh’s Dad   ADVYA BAJPAIClass Students -Tushar KathuriaKapil YadavTushar YadavSukhman Malhotra Shristika RanaTanisha DhullMohit Das Riya Yadav  Rashi YadavMukul DaimSonalika Toshiba        Written byHarsh BeniwalScreenplay byMayank MishraDirected byAmeen KhanEdited bySarfaraz ZuberDOPPradeep GoswamiAssociate DirectorNeha SinghAssistant DirectorRajat VermaVishal KumarAssistant DOPVikas GiriArt DirectorMuzammil HayaatCostume StylistMohit RajMake upRajeshColor GradingSarfaraz ZuberThumbnail Muzammil HayaatBackground ScoreAmeen KhanLine ProducerHimanshu SharmaProduction ControllerSunny SharmaSpot BoyShravan YogeshMukeshLocation CourtesySwiss Cottage SchoolEnd Music Tere Jaisa yaar kahan - https://www.youtube.com/watch?v=IgM1lAXppwISubscribe: https://www.youtube.com/c/TheBrainHumourLike|Share|CommentShow us some love on these platform too.Facebook: https://www.facebook.com/harshbeniwalofficialInstagram: https://www.instagram.com/harshbeniwal/Snapchat: Harshbeniwal"
"wrVgaN1tSLM","Bigg Boss S12 – Day 55 – Watch Unseen Undekha Clip Exclusively on Voot","2018-11-11T06:31:25.000Z","UCFHhFwEdsLs2wuvh1YdChHw","Voot","24","18.13.11","colors tv,bigg boss house,latest updates,jasleen matharu,srishty rode,season 12,voot app,2018,Unseen Undekha,cutless,full episodes","783100","6190","2315","1108","https://i.ytimg.com/vi/wrVgaN1tSLM/default.jpg","False","False","Srishty and Jasleen discuss how they talk and behave with their loved ones and pets. Watch Now: https://bit.ly/2Nrb4rFDownload app link: https://bit.ly/2OmDTAR"
"9KN3dbZVRwQ","Taxiwaala Theatrical Trailer | Vijay Deverakonda, Priyanka Jawalkar, Rahul Sankrityan","2018-11-11T15:00:46.000Z","UCiJfiEg1FImWsVuEu0L8X6Q","Geetha Arts","24","18.13.11","Taxiwaala Trailer,Vijay Deverakonda,Taxiwaala,Taxiwaala Movie,Taxiwaala Songs,Taxiwaala Audio,Priyanka Jawalkar,Rahul,JAkes Bejoy,SKN,Taxiwaala Telugu Trailer,Taxiwaala Telugu Movie,Vijay Deverakonda Taxiwaala,Taxiwaala Teaser,Taxiwaala First Look,Taxiwaala Theatrical Trailer,Taxiwala Trailer,Taxiwala Theatrical Trailer","3041904","82762","3221","3603","https://i.ytimg.com/vi/9KN3dbZVRwQ/default.jpg","False","False","Watch & Enjoy #TaxiwaalaTrailer Taxiwala Movie Starring #VijayDeverakonda, #PriyankaJawalkar and #MalavikaNair. Music by Jakes Bejoy. Directed by Rahul Sankrityan. Produced by SKN Under the Banner of  UV Creations & GA2 Pictures.Sarrainodu Telugu Video Songs : http://bit.ly/29oZFCRMagadheera Telugu Video Songs : http://bit.ly/2e5EruASubscribe For More Telugu Full Movies: http://goo.gl/yk99z2Subscribe For More Telugu Video Songs: http://goo.gl/BJoFLTFollow us : www.twitter.com/GeethaArtsFollow us : plus.google.com/+GeethaArtsLike us On : www.facebook.com/GeethaArts"
"q28LX6BCX1Q","Movie Vs Reality Sothanaigal | Micset","2018-11-10T10:32:20.000Z","UC5EQWvy59VeHPJz8mDALPxg","Mic Set","23","18.13.11","micset,micset channel,sothanaigal,movie vs reality,movie,tamil movie,vs reality,funny video,sarkar,kollywood,tamil cinema,comedy,96,entertainment,micset sriram,49 p,vijay,2.0,deleted scene,sriram,sriram prince,trending video,trending,video,fun video","1569329","124809","2196","10012","https://i.ytimg.com/vi/q28LX6BCX1Q/default.jpg","False","False","Play Games and get to win cash!Win upto 1 lakh Rupees daily - Download MPL App now -https://www.mpl.liveHi everyone here comes the new video with exact scenario happens in movie and reality of ones life with funny sketch ! watch till the end and enjoy the video !!subscribe our channel for more videos !!!Cast & Crew:Sriram   ( INSTA ID - https://www.instagram.com/sriram_prince_ )                      ( FB ID- https://www.fb.com/sri.ram.3511041 ) Sivaranjini    ( FB ID- https://www.fb.com/Ranjani.anba )Punithan     ( INSTA ID - https://www.instagram.com/punithan_tayse )VKP    ( FB ID- https://www.fb.com/prakash.vk.89 ) Nandhini ( INSTA ID - https://www.instagram.com/a.c.h.u._5 )Chandru ( INSTA ID - https://www.instagram.com/chandru_kidboy )                     ( FB ID -  https://www.fb.com/chandrukidboy )Abinash - ( INSTA ID - https://www.instagram.com/abinash_killer )thilaksundarvenkatnandhavigneshniranashoskiyyanarFRAMES :    Thilak raj ( INSTA ID - https://www.instagram.com/thilakjamie )                                  Editing  - SFX: Sriram  ( INSTA ID - https://www.instagram.com/sriram_prince_ )                     ( FB ID- https://www.fb.com/sri.ram.3511041 ) VFX - Chandru ( INSTA ID - https://www.instagram.com/chandru_kidboy )Speacial Thanks :niranashoskpurusothamanrajimuruganTeam Manager  :   P.SheshathriTeam Coordinator :  velmuguganTeam Admin            :  N.ChandruScript & Direction: SRI RAM Digital Partner : DIVO For Promotions, Branding, Digital Marketing Contact : +91 8248991430Email :  officialmicset@gmail.com"
"W_RQVUBjO5I","Break Up Ya Patch Up | FilterCopy Talkies | S01E07 | Ft. Akash Deep Arora, Palvi and Zervaan","2018-11-11T07:35:02.000Z","UC7IMq6lLHbptAnSucW1pClA","FilterCopy","23","18.13.11","filtercopy,filter copy,dice,dice media,pocket aces,netflix,amazon prime,little things,what the folks,love,couple,relationship,breakup,pyaar,passion,crying,sadness,cute couple,couple fight,couple goals,girlfriend,boyfriend,amit bhadana,bb ki vines,harsh beniwal,ashish chanchlani,carryminati,beyounick,elvish yadav,makejokeof,mostlysane,buzzfeed,tvf,timeliners,screenpatti,mithila palkar,trending video,funny video","1456407","40098","1965","1816","https://i.ytimg.com/vi/W_RQVUBjO5I/default.jpg","False","False","Agar tum saath ho...WRITER & DIRECTOR RAJAT TANEJA DOP AJINKYA PANDIT ASSISTANT DIRECTOR ZISHAN ZAFFAR PRODUCER HITESH PARDESHI CREATIVE PRODUCER NISHAAD JAVERI EXECUTIVE PRODUCER AAKASH SHEWAKARAMANI CAST (in alphabetical order) AKASH DEEP ARORAPALVI JASWALZERVAAN J BUNSHAH EDITOR JAICY MATHEW COLOR GRADING AJINKYA PANDITISHANI ROY SOUND DESIGN NIPUN MADAN SOUND RECORDIST ZISHAN ZAFFAR GRAPHICS SHREYA SETHIMANOJ OMREGAURAV JHAMB  SUBTITLING PRANAV SINGHRAJAT TANJEJA LIGHT ATTENDANTJITENDRA PRATAP VIDEO OPERATIONS RAUNAK RAMTEKE"
"1roy4o4tqQM","POKÉMON Detective Pikachu - Official Trailer #1","2018-11-12T17:00:00.000Z","UCjmJDM5pRKbUlVIzDYYWb6g","Warner Bros. Pictures","24","18.13.11","POKÉMON Detective Pikachu,Pikachu,POKÉMON,Detective Pikachu,Rob Letterman,ryan reynolds,harry goodman,justice smith,kathryn newton,ken watanabe,TOHO,Legendary,Warner Bros.,Warner Bros. Pictures,WB","8976832","393680","17801","61464","https://i.ytimg.com/vi/1roy4o4tqQM/default.jpg","False","False","POKÉMON Detective Pikachu - In Theaters May 11, 2019http://www.detectivepikachumovie.com/https://www.facebook.com/detectivepikachumovie/https://twitter.com/DetPikachuMovie https://www.instagram.com/detectivepikachumovie/The world of Pokémon comes to life!The first-ever live-action Pokémon movie, “POKÉMON Detective Pikachu” stars Ryan Reynolds as the titular character in the first-ever live-action movie based on the iconic face of the global Pokémon brand—one of the world’s most popular, multi-generation entertainment properties and most successful media franchises of all time.Fans everywhere can now experience Pikachu on the big screen as never before, as a talking detective Pikachu, a Pokémon like no other. The film also showcases a wide array of beloved Pokémon characters, each with its own unique abilities and personality.The story begins when ace private eye Harry Goodman goes mysteriously missing, prompting his 21-year-old son Tim to find out what happened. Aiding in the investigation is Harry’s former Pokémon partner, Detective Pikachu: a hilariously wise-cracking, adorable super-sleuth who is a puzzlement even to himself. Finding that they are uniquely equipped to communicate with one another, Tim and Pikachu join forces on a thrilling adventure to unravel the tangled mystery. Chasing clues together through the neon-lit streets of Ryme City—a sprawling, modern metropolis where humans and Pokémon live side by side in a hyper-realistic live-action world—they encounter a diverse cast of Pokémon characters and uncover a shocking plot that could destroy this peaceful co-existence and threaten the whole Pokémon universe.“POKÉMON Detective Pikachu” also stars Justice Smith (“Jurassic World: Fallen Kingdom”) as Tim; Kathryn Newton (“Lady Bird,” TV’s “Big Little Lies”) as Lucy, a junior reporter following her first big story; and Oscar nominee Ken Watanabe (“Godzilla,” “The Last Samurai”) as Lt. Yoshida.Directed by Rob Letterman (“Goosebumps,” “Monsters Vs. Aliens”), the “POKÉMON Detective Pikachu” creative filmmaking team includes two-time Oscar nominated director of photography John Mathieson (“The Phantom of the Opera,” “Gladiator”), production designer Nigel Phelps (“Pirates of the Caribbean: Dead Men Tell No Lies”) and Oscar-winning editor Mark Sanger (“Gravity”). Visual effects are by Moving Picture Company (“Wonder Woman”) and Framestore (“Guardians of the Galaxy Vol. 2”).Launched in 1996 to overwhelming response, the Pokémon brand is a global sensation that now encompasses a robust video gaming fandom with over 300 million units sold worldwide; the Pokémon Trading Card Game available in 11 languages with more than 23.6 billion cards shipped; an animated television series in its 21st season that is available in more than 160 countries; and over 20 animated films; as well as books, manga comics, music, toys, merchandise, and apps, including the wildly popular Pokémon GO, that has been downloaded over 850 million times and is enjoyed across the globe by fans of all ages.“POKÉMON Detective Pikachu” is set for release on Friday, May 10, 2019.The film will be distributed outside of Japan and China by Warner Bros. Pictures, in Japan by Toho Company, Ltd. and by Legendary East in China."
"s3Q6AM4MDs4","Amar Akbar Anthony Theatrical Trailer | Ravi Teja | Ileana | Sreenu Vaitla | Thaman | Sreenu Vaitla","2018-11-11T03:30:22.000Z","UCKZSn5C-RzrLjuWJF8wWiDw","Mythri Movie Makers","24","18.13.11","Amar Akbar Anthony Theatrical Trailer,Ravi Teja,Ileana,Thaman,Sunil,#AAA,Amar Akbar Antony Trailer,Amar Akbar Anthony Telugu Movie,Ravi Teja Amar Akbar Anthony,Mythri Movie Makers,Amar Akbar Anthony Movie Trailer,Amar Akbar Anthony 2018 Telugu Movie,#AmarAkbarAnthony,Thaman S,Sreenu Vaitla,Amar Akbar Anthony,latest telugu movies 2018,AAA Trailer,Amar Akbar Antony Movie Songs,Amar Akbar Anthony Trailer,AAA Movie Trailer","4880949","97933","3594","5006","https://i.ytimg.com/vi/s3Q6AM4MDs4/default.jpg","False","False","Amar Akbar Anthony Theatrical Trailer on Mythri Movie Makers. #AmarAkbarAnthony Latest 2018 Telugu Movie ft. Ravi Teja, Ileana D'Cruz, Sunil, and Laya. Directed by Sreenu Vaitla. Music by Thaman S. Produced by Naveen Yerneni, Y. Ravi Shankar and Mohan (CVM) under Mythri Movie Makers banner. #AAATrailer #RaviTeja #IleanaDcruz #Ileana #Sunil #Laya #MythriMovieMakers #SreenuVaitla #ThamanS #AmarAkbarAnthonyTeaserAmar Akbar Anthony 2018 movie also ft. Srinivas Reddy, Raghu Babu, Jayaprakash Reddy, Tanikella Bharani, Satya, Vennala Kishore, Ravi Prakash, Tarun Arora, Aditya Menon, Abhimamyu Singh, Vikram jit, Rajveer Singh, Shiyaji Shinde, Subhalekha Sudhakar and others.AAA Movie is all set for a grand release on 16th November.#AAAMovie Details:Cast: Ravi Teja, Ileana D'Cruz, Sunil, LayaScreenplay, Dialogues, and Direction: Sreenu VaitlaProducers: Naveen Yerneni, Y. Ravi Shankar and Mohan Cherkuri (CVM)Co-producer: Praveen MarpuriStory: Sreenu Vaitla and Vamsi Rajesh KondaveetiBanner: Mythri Movie MakersCEO: CherryDOP: Venkat C DileepMusic: SS ThamanEditor: MR VarmaArt Director: AS PrakashLyrics: Ramajogayya ShastriPRO: Vamsi ShekarClick Here To Watch : Amar Akbar Anthony Teaser | Ravi Teja | Ileana:https://youtu.be/VYuI6USrGuEPivot of Amar Akbar Anthony:https://youtu.be/qVl3gAZ8ElMNaga Chaitanya Savyasachi Official Trailer:https://youtu.be/An9lC-F_HMgNaga Chaitanya Savyasachi Movie Making:https://youtu.be/CqWZb_e9_e8Naga Chaitanya Savyasachi Pre Release Event: https://youtu.be/DNIEoA3peP0Sai Dharam Tej Chitralahari Movie Launch :https://youtu.be/ji1WsSWLa7ARangasthalam 100 Days Celebrations:https://youtu.be/MQ6yWe7faBkJr NTR Janatha Garage Telugu Full Movie | Mohanlal | Samantha | Nithya Menen: https://youtu.be/_Nq2m5LRQ3gSrimanthudu Telugu Full Movie | Mahesh Babu | Shruti Haasan:https://youtu.be/LS6XiINMc2sDear Comrade Movie Launch | Vijay Deverakonda | Rashmika Mandanna:https://youtu.be/AVpZW4IOPtoRangasthalam Back 2 Back Full Video Songs 4K:https://youtu.be/MZyal8FU_KsSrimanthudu Back To Back Full Video Songs:https://youtu.be/ZPSN4RdhteUFor more updates about Amar Akbar Anthony and Mythri Movie Makers :Like - https://www.facebook.com/MythriMovieMakersSubscribe - https://goo.gl/eJiVktTwitter - https://twitter.com/MythriOfficialInstagram: https://instagram.com/MythriOfficial"
"R2ye1dlpFDU","RRR Launch Video - NTR, Ram Charan | SS Rajamouli","2018-11-11T14:14:48.000Z","UCumU_6FNxfHXTmeeFCYz6Yw","DVV Entertainment","24","18.13.11","RRR Launch,RRR Muhurtham,RRR Opening,RRR Massive Launch,RRR Rajamouli Movie,RRR Ram Charan,RRR NTR Movie,RRR Telugu Movie,RRR Indian Cinema,RRR New Movie,RRR Grand Opening,RRR Epic Movie,RRR Opening Ceremony,Ram Charan,NTR,SS Rajamouli,Chiranjeevi,Koratal Siva,#RRR,#RRRLaunch,#RRROpening","2801039","56557","1501","3863","https://i.ytimg.com/vi/R2ye1dlpFDU/default.jpg","False","False","Watch RRR Launch Video... Starring NTR, Ram Charan. Directed by SS Rajamouli#RRR, #RRRLaunch, #RRROpeningScreenplay & Direction: S.S. RajamouliPresented by: D. ParvathiProducer: DVV Danayya Story: V. Vijayendra Prasad DOP: K.K. Senthil KumarProduction Designer: Sabu CyrilMusic Composer: M.M. KeeravaaniVFX Supervision: V Srinivasa MohanEditor: Sreekar PrasadCostume Designer: Rama RajamouliDialogues: Sai Madhav Burra, Karky"
"Ot2ibpbZKuk","Pyaar Lafzon Mein Kahan Episode 108","2018-11-12T11:06:23.000Z","UCSZCTqWb3uP7ozMaZnYOA-A","Pyaar Lafzon Mein Kahan","1","18.13.11","filmazia,pyar lafzon mein kahan,pakistan,hayat and murat,Pyaar Lafzon Mein Kahan Drama,hayat murat,phar lafzon urdu language,aşk laftan anlamaz,show tv,new episode,pyar lafzon mein kahan latest episode,pakistan tv,turkish serials,urdu dubbed","737600","15024","468","2713","https://i.ytimg.com/vi/Ot2ibpbZKuk/default.jpg","False","False","Follow Facebook Page → https://www.facebook.com/pyaarlafzonmeinkahanSubscribe → http://bit.ly/PyaarLafzonMeinKahanTurkish Drama Ask Laftan Anlamaz starting in Pakistan as Pyaar Lafzon Mein Kahan#Hayat#Murat#Pyaar#pyaarlafzonmeinkahan#LoveSeries"
"XibA_ugEaSM","Allu Arjun Speech @Taxiwaala Pre Release Event","2018-11-11T16:59:29.000Z","UCHca09YXIXzK32mGjOuHjRg","Shreyas Media","24","18.13.11","Allu Arjun Speech,Shreyas Media,Taxiwaala Pre Release Event Live,#Taxiwala,Taxiwala Pre Release EVent,Allu Arjun As Special Guest,Vijay Deverakonda Taxiwala,Vijay Deverakonda,vijay devarakonda songs,Taxiwala Event Live,taxiwala song,Taxiwala Teaser,Taxiwala Trailer,taxiwala vijay devarakonda movie,Priyanka Jawalkar,taxiwala video songs,vijay deverakonda,vijay deverakonda speech","699576","10617","675","927","https://i.ytimg.com/vi/XibA_ugEaSM/default.jpg","False","False","Allu Arjun Speech @Taxiwaala Pre Release Event Taxiwala Movie Starring #VijayDeverakonda, #PriyankaJawalkar and #MalavikaNair. Music by Jakes Bejoy. Directed by Rahul Sankrityan. Produced by SKN Under the Banner of  UV Creations & GA2 Pictures.Shreyas Media was born as a Movie Promotion & Event Management. An idea, Unalloyed expertise, Micro solutions. These three words define our core competency. Right from our inception. Shreyas event has been catering to renowned global companies offering turnkey solutions for Movie Promotions, Outdoor Publicity, Electronic Media, Print Media, In-Film branding, etc. Time changes, values don't over time as we developed a multi-disciplinary service focused on delivering integrated experiential communications solutions geared towards realizing client's marketing. We believe & propose that marketing communication is most effective when it is experiential and accurately focused. We also believe that marketing communication needs to be a two-way process and this duality is eminently achieved using the medium of experiential communication. Ultimately we are the one-stop project solution providers for event projects. Our goal is to leave u free to participate as your event is in safe hands------------------------Stay connected with us!!►Subscribe to http://bit.ly/ShreyasGroup►Visit us @ http://www.film70mm.com►Like us @ https://fb.com/ShreyasGroup►Follow us @ https://twitter.com/ShreyasGroup►Circle us@ https://goo.gl/GsKrzQ"
"JCjLBrrjgXk","India v Pakistan - Women's World T20 2018 highlights","2018-11-11T18:46:00.000Z","UCt2JXOLNxqry7B_4rRZME3Q","ICC","17","18.13.11","Cricket,ICC,World T20,WorldT20,T20,WT20,2018,India,Pakistan,Watch This,mithali Raj,highlights","4456992","33337","2089","2841","https://i.ytimg.com/vi/JCjLBrrjgXk/default.jpg","False","False","India came out on top in a much-awaited match against Pakistan, as the experienced Mithali Raj calmly piloted the chase in Guyana"
"ZSFDKq_mIi4","The Trip 2 | Breathe | Episode 7","2018-11-09T13:30:01.000Z","UCzo5sreD2cVGu2T2mNu__1Q","bindass","24","18.13.11","bindass,bindass official,bindass channel shows,bindass channel serial,bindass tv shows,bindass tv programs,bindass tv,the trip,the trip 2,trip 2 episodes,trip episode 6,trip episode breathe,mallika dua,sapna pabbi,amyra dastur,shweta tripathi,pranay pachauri,harman singha,shivam bhargava","2000876","24058","2558","2024","https://i.ytimg.com/vi/ZSFDKq_mIi4/default.jpg","False","False","Hmm... an old flame is washed ashore, crashing right into the girl's trip! 🌊What to expect next? A lot of nerves, some raw tension, first kisses and did someone say SALSA!? Let's dive in? 💃💋Catch the girls on EPISODE 7 of The Trip 2 | Presented by I Love LakmeAbout The Trip 2: The Trip series is back with a new season! The second season explores the journeys of four friends played by Sapna Pabbi, Shweta Tripathi, Mallika Dua and Amyra Dastur as they explore South India's beauty through an exhilarating road trip yet again!What was meant to be FOMO causing Vacay Goals, turns into yet another dramatic desi wedding with a twist, some more drama and a lot of self-discovery for the girls!Presented by #BindassOriginals►Download the BINDASS APP → http://bindass.com/download.html ►SUBSCRIBE To bindass: http://bit.ly/1bfqpUbFor More Videos & Downloads visit bindass: http://www.bindass.com►Follow Bindass:Facebook: https://www.facebook.com/bindass Twitter: https://twitter.com/bindasstv Google+: https://plus.google.com/+bindass Instagram: http://instagram.com/bindasstvWatch more popular shows on bindass:►Girl in the City - http://bit.ly/2DF8Zml► Girl in the City - Chapter 2: http://bit.ly/2F5N0lB ► The Trip - http://bit.ly/2GaUiWj ► Dil Buffering - http://bit.ly/2BnDWpz ►Yeh Hai Aashiqui - http://bit.ly/1yNiecX    Best of Yeh Hai Aashiqui: http://bit.ly/1J5nVWQ"
"FCRI4Xw7Xwg","Dino James - Achi Maza Aayi [Official Video]","2018-11-09T11:21:39.000Z","UCtpDorOuxwQ1URGQ0WLIXmQ","Dino James","10","18.13.11","dino james,acchi maza aayi,empowerment for men,acchi maza aayi latest video,new video,full song,official video,dance,hip hop,rap,dino james song","3382182","274119","7718","29489","https://i.ytimg.com/vi/FCRI4Xw7Xwg/default.jpg","False","False","Aaj sabse jyada need hai for #EmpowermentForMenSong Credits:Mix & Mastered by Shadab RayeenAssisted by: Abhishek Sortey Music by Bluish Music (Nilesh Patel)Supervision: Girish NakodRecording Engineer: - SalmanVocals recorded at Rae n Raga StudioWritten & composed by Dino JamesVideo credits:Directed by Himanshu TyagiConcept by Dino James and Himanshu TyagiDirector of photography: Shlok HassanandaniAdditional cinematography: Nikunj SinghCreative supervisor: Kartik ParandeEdited by : Yash Pania & Himanshu TyagiDI Colourist: Harsh DandotiyaExecutive Producer: Sherish ShaikhGraphic designing and VFX: Mustafa ZaveriFirst Assistant Director: Sheepu SharmaSecond Assistant Directors: Vinayak Singh, Kapil KadamJunior artist coordinator: Sunil Cast:Anshul Trivedi Thanks to:  Sooraj Harry, Divya James, Jaspreet Singh Chhabra, Akbar Bhai, Prajakta Koli, Sudeep Lahiri (One Digital)"
"fnGW4iQzVLw","KGF Trailer Telugu | Yash | Srinidhi Shetty | Prashanth Neel | Vijay Kiragandur","2018-11-09T08:58:41.000Z","UCWKzBXU_5jgyXwmlj04H2dg","Vaaraahi Chalana Chitram","1","18.13.11","KGF Trailer,KGF Trailer Telugu,KGF Telugu Trailer,Latest Telugu Movies,Telugu Movie Trailers,KGF Official Trailer,Latest Trailers","4861049","140926","5194","11655","https://i.ytimg.com/vi/fnGW4iQzVLw/default.jpg","False","False","Here is the most awaited #KGF Trailer Telugu Presented by Kaikala Satyanarayana, AP / Telangana Distributed by Sai Korrapati - Vaaraahi Chalana Chitram Starring #Yash #SrinidhiShetty #PRashanthNeel #VijayKiragandur Written & Directed by: Prashanth Neel Starring: Yash, Srinidhi Shetty, Ayyapa, B Suresh, Srinivas Murthy, Archana Jois, Roopa Rayappa, Master Anmol, Ananth Nagu, Malavika, Achut Kumar, Naga Bharana, Dinesh Mangalur, Harish roi, Neenazam Ashwath, introducing Avinash, Ram, Lucky, Vinay Producer: Vijay Kiragandur DOP: Bhuvan Gowda #KGFTrailer in other languages: Telugu: Tamil: Hindi: Malayalam: For More #KGF Updates Subscribe: YouTube: https://www.youtube.com/HombaleNinnin... Facebook: https://www.facebook.com/hombalefilm Twitter: https://twitter.com/hombalefilms"
"yy2UOE4Ab2Q","BOHT HARD - EMIWAY X THORATT","2018-11-12T18:31:11.000Z","UCHmk8iNJHvf5mGN6_pkPc7g","Emiway Bantai","10","18.13.11","boht hard,bohot hard,emiway\,emiway,emiway bantai,bantai,rap,rapper,music,hip hop,underground,underground hip hop,indian hip hop,rap music","877341","134661","12407","24914","https://i.ytimg.com/vi/yy2UOE4Ab2Q/default.jpg","False","False","MUSIC BY TONY JAMESDIRECTOR - SAM MOHANBoht hard literally means very hard is used as an expression to commend something/someone ubercool. Here in this video,boht hard suggests people who do the impossible. The folks who are pioneers of alternative culture in India come from humble backgrounds and practice day in and day out to make the impossible possible.instagram - emiway_bantai and thoratttManagement mail id - imailemiway@gmail.com"
