video_id,title,publishedAt,channelId,channelTitle,categoryId,trending_date,tags,view_count,likes,dislikes,comment_count,thumbnail_link,comments_disabled,ratings_disabled,description
"kaVkk9vjZvo","Dhee Jodi | 5th December 2018 | Full Episode | ETV Telugu","2018-12-05T18:30:01.000Z","UCoY_p16GEbOQPgES1-wXpYg","ETV Dhee","24","18.11.12","etv shows,eenadu television,padutha theeyaga,super2,Dhee10,dhee Jodi,jabardasth,extra jabardsth,cash,genes,swarabhishekam,etv20,manasu mamatha,swathi chinukulu,naperu meenakshi,funny task,intro,bhargav,rishika,govind,husna,piyush,ankitha,Rahul,darshini,sai,malavika,saketh,priyanka,reality show,dance","4457917","22860","3456","2988","https://i.ytimg.com/vi/kaVkk9vjZvo/default.jpg","False","False","దక్షణ భారతదేశంలోనే అతిపెద్ద డాన్స్ రియాలిటీ షో... 10 సీజన్స్ ముగించుకుని ఇపుడు ఢీ-జోడి (ఢీ-11 సీజన్) గా మిమ్మల్ని అలరించడానికి, ఎంటర్ టైన్ మెంట్ ని టన్నుల టన్నుల కొద్ది మీకు అందిచదానికి సిద్దమైంది. యాంకర్ గా ప్రదీప్, టీమ్ లీడర్స్ గా రష్మి, సుడిగాలి సుధీర్, జడ్జిస్‌ గా హీరోయిన్ ప్రియమణి, శేఖర్ మాష్టర్ లు షోకి వ్యవహరిస్తారు."
"bJNAD9WCExk","Jasmine Sandlas Targetting Garry Sandhu  Says i am Single l Dainik Savera","2018-12-10T08:14:43.000Z","UCpO4dk13_6xE63mn7SI-7Mg","Savera Star Talks","24","18.11.12","jasmine sandlas,garry sandhu,jasmine,jasmine songs,garry sandhu lve,garry sandhu fans,jasmine sandlas controversy","44573","416","231","62","https://i.ytimg.com/vi/bJNAD9WCExk/default.jpg","False","False","Jasmine  ਨੇ ਦਿਤਾ Garry Sandhu  ਨੂੰ ਇਸ਼ਾਰਾ ਕਿਹਾ ਮੈਂ Single ਹਾਂ l Dainik Savera"
"Sg7kxjk0AHM","കറി ഇല്ലെങ്കിലും രുചിക്ക് NO കുറവ് || Tasty & Healthy Vegetarian Breakfast Paratha || Salu Kitchen","2018-12-10T05:58:20.000Z","UC6UaUhlqtbWmhd2FU5q7atg","Salu Kitchen","26","18.11.12","salu kitchen,quick,recipe,tasty,yummy,how to,easy,food,cooking,malayalam,sailu,sallu,salus,shalu,sulu,paratha,parantha,porotta,paratta,healthy,കറി ഇല്ലെങ്കിലും രുചിക്ക് NO കുറവ് || Tasty & Healthy Vegetarian Breakfast Paratha || Salu Kitchen,vegetarian,breakfast,meal","26302","0","0","144","https://i.ytimg.com/vi/Sg7kxjk0AHM/default.jpg","False","True","How to make curd at home: https://youtu.be/Iu-Syc28RRUTasty & Healthy Vegetarian breakfast that can be made easily from Salu Kitchen. Does not require much ingredients or time.കറി ഇല്ലെങ്കിലും രുചിക്ക് NO കുറവ് || Tasty & Healthy Vegetarian Breakfast Paratha || Salu Kitchen Accessorise you kitchen with Amazon: https://amzn.to/2kvnn54This is a simple yet delicious recipe that can be prepared even by beginners. Follow us at https://www.instagram.com/salu_kitchen/ for more updates and behind the scenes😇😇Share, Support, Subscribe!!!Subscribe here for weekly updates: https://goo.gl/yFFyBJDownload our Android App: http://bit.ly/saluAppMail me at: salukitchen@gmail.comAbout : Salu Kitchen is a YouTube Channel, where you will find cookery and related videos in Malayalam; Uploads are on Monday, Wednesday, Friday and Saturday. Happy Cooking.Do try out, and let us know your feedback. Like and share and help us grow.*The video is in Malayalam.*"
"PtFY3WHztZc","Simmba | Official Trailer | Ranveer Singh, Sara Ali Khan, Sonu Sood | Rohit Shetty | December 28","2018-12-03T07:15:26.000Z","UCqZR7KVVsZRSfezZKJllxVQ","Reliance Entertainment","24","18.11.12","Simmba,ranveer singh,Simmba Movie Teaser,Ranveer Singh,Simmba Teaser,ranveer singh simmba trailer,ranveer singh simmba,simmba official trailer,simmba teaser,simmba first look,simmba action t,marathi,golmaal again,ashutosh rana,sonu sood,chennai express,golmaal,rohit,tseries,dharma productions,deepika padukone,ranveer,latest hindi trailer,action movie,simmba trailer,action,action movies,karan johar,ajay devgan,sara ali khan,singham,siddharth jadhav","43650672","664365","108255","103008","https://i.ytimg.com/vi/PtFY3WHztZc/default.jpg","False","False","Simmba is an orphan from Shivgadh from where our beloved Singham was born and raised. Contrary to the philosophies of Singham, Simmba believes that a Corrupt Officer’s life is an ideal life which inspires him to become one. While Simmba enjoys all the perks of being an immoral and unethical Police Officer, a twist in the tale transforms him and forces him to choose the righteous path.Reliance Entertainment presentsRohit Shetty PicturezIn association with Dharma Productions“Simmba”Produced by : Hiroo Johar, Rohit Shetty, Apoorva Mehta & Karan JoharDirected by: Rohit ShettyStar Cast : Ranveer Singh, Sara Ali Khan, Sonu Soodalong withSiddharth Jadhav, Ashutosh RanaReleasing Worldwide on December 28, 2018 in cinemas near you!For more information log on:Facebook: https://www.facebook.com/RelianceEnt/ Twitter: https://twitter.com/RelianceEnt Instagram: https://www.instagram.com/reliance.entertainment/#Simmba"
"ZwMot0Ld64I","SIT | THE FAMILY VACATION| S1E6 | THE FINALE","2018-12-06T09:00:09.000Z","UCqnW0v3DXxt0Svv0H64TVZQ","Shitty Ideas Trending","24","18.11.12","SIT,Shitty Ideas Trending,SIT Videos,tvf qtiyapa,Buzzfeed,web series,family,drama,comedy,viral,the viral fever,permanent roommates,filtercopy,short films,BYN,Ashish Chanchalani,BeYouNick,The Better Half,Chhavi Mittal,Karan V Grover,Funny Video,Rishi Rohini,Husband Wife Comedy,The Family Vacation,TFV,Father,Mother,Family,In Laws,Ayub Khan,Dice Media,What The Folks,Tinder,In-Laws,Parents,Meet The Folks,Cocaine,Coke,Drugs,Finale","824668","23311","687","1408","https://i.ytimg.com/vi/ZwMot0Ld64I/default.jpg","False","False","#WebSeriesMr. Chopra catches Rishi red-handed in the act of doing drugs! He goes all out and shows all his cards in front of the whole family. For him it’s do or die now. Will Rishi prove his innocence? Watch the drama reach never-before heights in the season finale of THE FAMILY VACATION!SIT presents S1E6- THE FAMILY VACATION - The Finale_______________________________________________________Do SHARE the video if you LIKE it, and leave us a COMMENT! Don't forget to SUBSCRIBE to Shitty Ideas Trending for a fun video every Thursday!Also participate in the contest to win FREE SIT MERCHANDISE!________________________________________________________CREDITS:Created By: MOHIT HUSSEINProduced By: WORKSHOP INCConcept & Directed By: MOHIT HUSSEINWritten By: MOHIT HUSSEIN, CHHAVI MITTALCreative Director: CHHAVI MITTALCast: AYUB KHAN, DEEPIKA AMIN, CHHAVI MITTAL, KARAN V GROVER, GUNJAN UTREJA, PREETIKA CHAWLA, PRACHEEN CHAUHAN, MASTER KAVYAAN KHOSLASupporting Cast: RAKESH BAZAD (Shady guy), DEVENDRA SINGH (Taxi Driver), ANIL JENA (Pandit), VINOD PRADHAN (Waiter), VIKAS SINGH (Delivery Boy)DOP: KAMAL CHAURASIAEditor: ASHISH JHASound Engineer: ANIL JENAAssistant DOP: GULSHAN RAMANIExecutive Producer: EHTESHAM HUSSEINLine Producer: FRESHWATER FILMS & TELEVISION Digital Intermediate: FULL FRAME FILMSColorist: SUNNY DHANJALOST “Papa Ji” credits: Music, LyricsRap: MALIK SAHABProgramming, Mixing, Mastering: SAURABH JAYProduction Controller: DILIP KANOJIAFirst Assistant: DEVENDRA SINGHSecond Assistants: TUSHAR RANJAN, VIDIT KANOJIALocal Co-ordinator: RAKESH BAZADAssociate Editor: JAYANTA BANERJEEGaffer: WASIM ANSARI Equipment Partner: PANASONIC LUMIX GH5Panasonic HOD: HITESH VIGPanasonic Attendants: NISHANT THAKUR, VIKAS SINGH, SUNIL GAWAIAdditional Equipment: VIDEO PLUSCamera Attendant: KRISHNANAND SINGHAssistant Sound Recordist: RAMESH JAISWALLocations: TATA MYST, KASAULI, WORKSHOP INC STUDIOS, IGI AIRPORT, NEW DELHITata Myst Team - Estate Manager: AJAY KUMARTech Exec: SAAHI DOHRUAR Hospitality: ANIL RAWATChefs: MUKESH PANDEY, RAJ KUMARRestaurant Incharge: VINOD PRADHANWaiters: Pradeep, BittySocial Media Manager: PRIYANKA PEREIRADrone Operator: RAKESH BAZADLight Equipment: IN INDIA FILMSLight Incharge: AVADESHLightmen: M.K, VIKESH, PANKAJ, RADHE, S.K, RAJUAccommodation: SAKET GUEST HOUSEDressman: SATISH YADAVProduction Boys: BAJRANGI THAKUR, DILIP SHARMA, RAJENDRA SHARMACostume Stylist: SHRUTI KOTHARIMake-Up: SANDESH GADEKARMake-up Assistant: AMIT SHAHHair Stylist: NASEEM ANSARIPost Production: WORKSHOP INC POST FACILITYBehind The Scenes Team: CHHAVI MITTAL, TUSHAR RANJAN, SUSHIL SHARMA, JAYANTA BANERJEEFood Supplier: TATA MYST, KASAULITravel Agent: ASHWINI TOURS & TRAVELSTransport: IN INDIA FILMSDrivers: GURDEEP SINGH, PRADEEPProperty Supplier: NATIONAL NOVELTYLocal Vendor: KANTA STORES (Kasauli)________________________________________This series was not possible without the support of:TATA HOUSING – MYST, Kasaulihttps://www.tatahousing.in/mystSPICEJET AIRLINEShttps://www.spicejet.com/AMITY UNIVERSITY ONLINEhttps://www.amityonline.com/amityonline/GROWW APPhttps://groww.in/THE  MOMS COhttps://themomsco.com/PANASONIC LUMIX GH5Follow SIT:Facebook: https://www.facebook.com/SITofficial/Twitter: https://twitter.com/TeamShittyIdeasInstagram: https://www.instagram.com/shittyideastrending/FOR BUSINESS INQUIRIES: info@shittyideastrending.comVisit us on www.shittyideastrending.com____________________________________________________CHHAVI MITTAL:https://www.facebook.com/chhavimittalofficial/?ref=br_rshttps://www.instagram.com/chhavihussein/https://twitter.com/chhavihussein_______________________________________________________MOHIT HUSSSEIN:https://www.facebook.com/mohithusseinsithttps://www.instagram.com/mohithussein/_______________________________________________________DISCLAIMER:THIS VIDEO WAS CREATED PURELY FOR ENTERTAINMENT PURPOSES ONLY. THE CHARACTERS, DIALOGUES, SITUATIONS & OTHER THINGS ARE PURELY FICTIONAL. ANY RESEMBLANCE TO A PERSON LIVING OR DEAD IS PURELY COINCIDENTAL. THIS CHANNEL DOES NOT CLAIM TO BE FACTUAL OR POLITICALLY CORRECT AT ALL TIMES. THE CONTENT IS FICTIONAL AND MEANT ONLY FOR ENTERTAINMENT. ANY OFFENCE CAUSED IS SUBJECTIVE AND DEEPLY REGRETTED.  CONSUMPTION OF ALCOHOL/SMOKING/DRUGS IS INJURIOUS TO HEALTH. NONE OF THE CREATORS OR ACTORS PROMOTES THE USE OF IT"
"ogQ0xqWBWkk","India vs Australia 1st Test : Rishabh Pant 18 Runs In An Over, Fans Gone Crazy | Oneindia Telugu","2018-12-10T06:48:56.000Z","UCzMBnBZZ__khxsIjdlSnlQw","Oneindia Telugu","25","18.11.12","India vs Australia,India vs Australia 1st Test,Rishabh Pant,Nathan Lyon,virat kohli,rohit sharma,India vs Australia 2nd Test,IND VS AUS","40224","485","29","21","https://i.ytimg.com/vi/ogQ0xqWBWkk/default.jpg","False","False","After Nathan Lyon dismissed Cheteshwar Pujara and Rohit Sharma in quick succession on Day 4 of the opening Test between India and Australia, which is being played at the Adelaide Oval, Rishabh Pant smashed Lyon for 18 runs in the 96th over. #IndiavsAustralia#IndiavsAustralia1stTest#INDVSAUS#RishabhPant#NathanLyon#viratkohliఆస్ట్రేలియా గడ్డపై భారత యువ హిట్టర్ రిషబ్ పంత్ జోరుగా బ్యాటింగ్ చేశాడు. ఇటీవల ముగిసిన టీ20 సిరీస్‌లో మెరుపు ఇన్నింగ్స్‌లతో ఆకట్టుకున్న రిషబ్ పంత్.. మరోసారి అది టెస్టు ఫార్మాట్ అనే సంగతి మర్చిపోయి అడిలైడ్ వేదికగానూ బౌండరీల మోత మోగించాడు. క్రీజులో ఉన్నంతసేపు దూకుడుగా ఆడిన ఈ యువ వికెట్ కీపర్.. దూకుడు మీద ఆడి ఆ వెంటనే పెవిలియన్ చేరుకున్నాడు.Oneindia TeluguSubscribe to OneIndia Telugu News Channel for latest updates on politics, sports, current affairs in India & around the world.▬▬▬▬▬▬▬▬▬▬▬▬▬▬▬▬▬▬▬▬▬▬▬▬▬▬▬ Share, Support, Subscribe▬▬▬▬▬▬▬▬▬♥ subscribe : https://goo.gl/sp2m54♥ Facebook : https://www.facebook.com/oneindiatelugu/♥ YouTube : https://goo.gl/sp2m54 ♥ Website : http://telugu.oneindia.com♥ twitter:  https://twitter.com/thatsTelugu♥ GPlus:   https://plus.google.com/+OneindiaTelugu♥ For Viral Videos: http://telugu.oneindia.com/videos/viral-c34/▬▬▬▬▬▬▬▬▬▬▬▬▬▬▬▬▬▬▬▬▬▬▬▬▬▬"
"-DNl2EseHOE","Analyzer | Exam Analysis Of IBPS CLERK PRE 2018 SHIFT- 1 (Review & Cut Off) 9th DECEMBER 2018","2018-12-09T05:11:56.000Z","UC1L2JoMpcY6MRLhFd3gg5Xg","Adda247 : Government Job in Your Pocket","27","18.11.12","adda247,bankersadda,ssc,sbi,SSC,EXAMSBANKING,GOVT.JOB,EXAM,Quiz,IBPS,PO,RRB,ibps clerk prelims,ibps clerk 2018,ibps clerk prelims 2018,ibps clerk prelims 2018 exam analysis,ibps clerk exam analysis,ibps clerk prelims exam review,ibps clerk question paper,ibps 2018,ibps clerk prelims shift 1,bank clerk exam analysis,ibps clerk prelims question paper,ibps clerk prelims expected cutoff,ibps clerk prelims questions,ibps clerk,ibps","36104","722","51","95","https://i.ytimg.com/vi/-DNl2EseHOE/default.jpg","False","False","To Know More about IBPS PO 2018 exam, pattern, syllabus & exam date, visit:  http://www.bankersadda.com/p/ibps-po.htmlTo Know More about Ssc cgl exam pattern syllabus and exam date visit  http://www.sscadda.com/p/ssc-cgl.htmlTo Know More about Teaching Job exam pattern syllabus and exam date , visit ::;https://www.teachersadda.co.in/Aspirants, Adda247 is Now In Telegram, Join Our Telegram Group -@Adda247youtube  https://t.me/adda247youtube For All the Updates and Notifications. Hurry!!Join Now Official Telegram Channel of Bankersadda - https://t.me/bankersadda_OfficialJoin Now Official Telegram Channel of SSC Adda - https://t.me/sscadda_officialPLAYLIST FOR BANK AND SSC EXAMS - https://www.youtube.com/channel/UC1L2JoMpcY6MRLhFd3gg5Xg/playlistsAdda247 Youtube channel is India's most popular channel for Online Coaching for IBPS Bank PO Exams and Online Coaching for SSC CGL. 1.To buy Banking & SSC Latest Pattern Video Courses of Adda247 - at Online Streaming, SD Card or Tablet click here - https://store.adda247.com/#!/videos/list To Buy Adda247 Test Series Click Here - https://store.adda247.com/#!/testseries/listTo Buy Adda247 Books Click Here -https://store.adda247.com/#!/books/list2. Download Adda247 App (India's No.1 App for Bank & SSC Exams) - http://bit.ly/adda247 3. To get all latest videos in your mailbox, subscribe to our youtube channel - https://www.youtube.com/adda247live 4. Get all updates on facebook, like us our facebook page - https://www.facebook.com/adda247live 5. Join us at twitter - https://twitter.com/adda247live"
"oKW8awc_ns8","Biggest Boycott Pewdiepie Movement in India Started ! Support T-Series ! Social Message","2018-12-09T13:40:05.000Z","UCQmg6f48mtIOX4DoerGJYWw","My Smart Support","28","18.11.12","Pewdiepie vs T-Series,pewdiepie vs t-series memes","178105","20533","7087","10588","https://i.ytimg.com/vi/oKW8awc_ns8/default.jpg","False","False","Pewdiepie vs T-Series boycott Videopewdiepie vs t-series memespewdiepie vs t-series videopewdiepie vs t-series controversy"
"ZLxRsrjFWE8","PUBG || dhaval domadiya","2018-12-09T05:00:01.000Z","UCTEfw4GhRUFoeUD6DQZ4RWA","Dhaval Domadiya","24","18.11.12","dhaval domadiya,comedy video,funny video,gujarati comedy video,dhaval domadiya new video,dhaval domadiya comedy vide,pub g,pub g video","326873","16585","665","930","https://i.ytimg.com/vi/ZLxRsrjFWE8/default.jpg","False","False","this video is about pubg game title: pubg follow me on ...insta - https://www.instagram.com/dhaval_domadiya/facebook - https://www.facebook.com/dhaval.domadiya.7#pubg #dhavaldomadiya"
"OmvbawRbUw8","AdchiThooku | Viswasam Single Track Public Reaction | தூக்குதுரையின் ஆட்டம் ஆரம்பம்?!?","2018-12-10T15:18:20.000Z","UC0C3kipEr72V6BYM_fvabdg","Chennai Waalaa","24","18.11.12","Entertainment,news,viral,trending,Ajith Kumar,Nayanthara,AdchiThooku,viswasam","115537","3170","1683","865","https://i.ytimg.com/vi/OmvbawRbUw8/default.jpg","False","False","AdchiThooku Song Public Reaction.Subscribe Channel | Chennai Waalaa | https://www.youtube.com/channel/UC0C3kipEr72V6BYM_fvabdgFind us on Facebook | https://www.facebook.com/ChennaiWaalaaOfficial/Find us on Instagram |https://www.instagram.com/chennaiwaalaa/"
"Q04xy7sMBoE","Aai, Me & Dating | #BhaDiPa","2018-12-06T14:30:04.000Z","UCUw8vQF-X7CJqdVpxBYcavQ","Bharatiya Digital Party","23","18.11.12","bhartiya digital party,bhadipa latest,marathi web series,dating,tinder,sex,relationship,veg kanya,alok rajwade,sarang sathaye,parna pethe,mrinmayee godbole,marathi celebrity,narcos,pubg,boyfriend,girlfriend,single,aai ani me,mi,mum,mother,tinder bio,mingle,swipe right,love,dirty tinder,pick up lines,tinder gold,superlike","401809","19980","408","881","https://i.ytimg.com/vi/Q04xy7sMBoE/default.jpg","False","False","When Aai gets too involved in your dating life! (How Ani met Babdu)Tinder is the world's best app to meet new peopleDownload Tinder here - https://bit.ly/2RAzc94Subscribe to BhaDiPa to get alerts on our new videos! शास्त्र असते ते ! #BhaDiPa Stickers, Mugs, T-Shirts and more here: https://www.thesouledstore.com/artists/bhadipaFollow us on :https://www.facebook.com/BhaDiPahttps://www.twitter.com/BhaDiPahttps://www.instagram.com/BhaDiPaCastAai: Renuka Daftardar Ani: Alok RajwadeJui: Mrinmayee GodboleBabdu : Parna PetheBabbu: Sarang SathayeCrewSponsors: TinderWriter: Savani Vaze, Varun NarvekarDirector: Abhay Raut, Omkar JadhavCreative Producer: Anusha NandakumarAssistant Director: Vinay PanditCamera: Aditya DivekarLocation Sound: Sourabh Morgaonkar and Prasad MoreEdit & Sound: Abhay RautProduction: Tejas Limaye, Vaishnavi GokhaleLocation Courtesy: Rohan ShedbalkarMusic:Strange Precident: Silent PartnerDog and Pony Show - Silent Partner https://youtu.be/Dw20ZkMwI10"
"ahZvGbEggps","Seth VS Becky WINNER REVEALED ! Cena Heel Turn ! Finn Balor On Moving to Smackdown Live !","2018-12-10T08:47:45.000Z","UCetiwiWVoUBvIHIzYFaEiEw","Wrestle Chatter","24","18.11.12","seth rollins vs becky lynch,seth rollins is the man,why becky lynch called the man,becky vs seth,john cena heel turn,john cena speaks on his heel turn,finn balor moving to smackdown live,finn balor smackdown live,wwe raw 10 december 2018 highlights,wwe raw highlights today,wwe raw 12/10/18 highlights,john cena,seth rollins,finn balor,becky lynch","48954","4431","222","765","https://i.ytimg.com/vi/ahZvGbEggps/default.jpg","False","False","Topics Covered In Video-1)Seth Rollins Vs Becky Lynch Who is the man ?2)John Cena Speaks On His Heel Turn !3)Finn Balor Talks About Moving to Smackdown Live !4)John cena Heel Turn !5)Seth Rollins Vs Becky Lynch Twitter War !#JohnCena #SethRollins #FinnBalorSeth VS Becky WINNER ! Cena Heel Turn ! Finn Balor On Moving to Smackdown Live !My Second Channel For Masala Videos [ The RohiTreasure ] :- https://www.youtube.com/channel/UCJWATIXQplD0NUiFSqEpLngSocial Accounts:-Facebook:-  https://facebook.com/wrestlechatterInstagram:- https://instagram.com/wrestlechatterTwitter:-       https://twitter.com/wrestle_chatterMusic Credit-https://soundcloud.com/joakimkarud/lowriderPhoto Credit-https://www.wwe.com/  (WWE)"
"G3uS-wv5ckA","Sembaruthi Serial Tomorrow Episode 10.12.18 Promo Review | FULL EPISODE","2018-12-09T10:27:48.000Z","UCu37EYTCokmDZhxFAQ5prGA","Apple TV","22","18.11.12","zee Tamil,zee tamil tv serials,zee tamil tv shows,sembaruthi serial,sembaruthi,sembaruthi serial zee tamil,sembaruthi serial full episode,sembaruthi serial today,sembaruthi serial promo,sembaruthi promo,zee tv serial,sembaruthi serial zee tamil last episode zee Tamil,sembaruthi serial today episode,sembaruthi this week promo,sembaruthi tomorrow promo,sembaruthi serial latest episode,sembaruthi serial next episode,apple tv,sahana nachiyar,tamil speedy","58390","562","31","27","https://i.ytimg.com/vi/G3uS-wv5ckA/default.jpg","False","False","#sembaruthi#zeetamil#sembaruthipromoCredits - zee tamilSembaruthi Serial Tomorrow Episode 10.12.18 Promo Review | FULL EPISODE__செம்பருத்தி ஆதியை பற்றிய 10 சுவாரஸ்ய தகவல்கள் :https://youtu.be/DYoU-nMFVJwsubscribe and support : https://www.youtube.com/channel/UCu37EYTCokmDZhxFAQ5prGAFAIR-USE COPYRIGHT DISCLAIM* Copyright Disclaimer Under Section 107 of the Copyright Act 1976, allowance is made for fair use for purposes such as review, criticism, commenting, news reporting, teaching, scholarship, and research. -This video has no negative impact on the original works (It would actually be positive for them)-This video is also for entertaining purposes.-It is not transformative in nature.-I only used bits and pieces of fair use image to get the point across where necessary.We make these videos with the intention of entertaining others. #tamilnadu#tamilspeedy#sembaruthitoday#sembaruthitodayepisode#zeetamilsembaruthi#shabanasembaruthi#sembaruthiserialreview------------------------------------------------------------------------------------------------------------THANK YOU ALL"
"q0ENmy51t1g","ಅದೃಷ್ಟ ಕೂಡಿಬಂದು ಕೋಟ್ಯಾಧಿಪತಿ ಆಗುವ ಯೋಗವಿದೆ: Mesha Rashi Bhavishya 2019 Aries Horoscope in Kannada","2018-12-10T06:21:20.000Z","UCuHTvJgH8FfEmXECaehN0-A","Kannada Bhakthi Channel","22","18.11.12","horoscope,horoscope 2019,rashi bhavishya in kannada,dina bhavishya,astrology,zodiac signs,rashi bhavishya,yearly horoscope,mesha rashi,mesh rashi,mesha rasi,ಮೇಷ ರಾಶಿ 2019,ಮೇಷ,ವರ್ಷ ಭವಿಷ್ಯ,2019 horoscope,mesha rashi 2019 kannada,aries horoscope in kannada,mesha rashi bhavishya,mesha rashi in kannada,astrology in kannada,jyothishya,kannada videos,kannada news,numerology,rashi bhavishya 2019 in kannada,jataka,kundali,ರಾಶಿ ಭವಿಷ್ಯ,Aries Horoscope","18216","0","0","5","https://i.ytimg.com/vi/q0ENmy51t1g/default.jpg","False","True","ಮೇಷ ರಾಶಿ 2019 ವರ್ಷ ಭವಿಷ್ಯ : Mesha Rashi Astrology Predictions for 2019. Watch Rashi Bhavishya 2019 Yearly Predictions. Find your Future According to your Zodiac Sign - Aries. Don't Miss our other Zodiac Signs Videos Horoscope 2019. We provide only Most Credible and Trusted information."
"Y766uqS8RjU","My Top 5 Flagship Smartphones of 2018","2018-12-09T08:37:53.000Z","UCO2WJZKQoDW4Te6NHx4KfTg","Geekyranjit","28","18.11.12","top 5 smartphones india,top 5 flagship smartphone,top 5 premium smartphones 2018,top 5 smartphones 2018,top 5 smartphones,geekyranjit","246162","10073","640","2055","https://i.ytimg.com/vi/Y766uqS8RjU/default.jpg","False","False","These are my picks for the Top 5 Smartphones of 2018 and I also state the reason with their strengths and weakness so that you can pick your favourite based on your needs. Some Other Notable mentions are Asus Zenfone 5z & LG G7 ThinQ even the Galaxy S9+ is a nice option if you don't need the S-pen and if you are a hardcore gamer then the ASUS ROG is also a good option if budget is not a issue.My Review of OnePlus 6T https://www.youtube.com/watch?v=NS-XQ4fROnQMy Pixel 3 XL Review https://www.youtube.com/watch?v=ywF07gLVResHuawei Mate 20 Pro Review https://www.youtube.com/watch?v=Gf-uP60QbwwiPhone XS Max Review https://www.youtube.com/watch?v=h0gcnH9KpC8Samsung Galaxy Note 9 Review https://www.youtube.com/watch?v=Shy5MGHiBp4"
