video_id,title,publishedAt,channelId,channelTitle,categoryId,trending_date,tags,view_count,likes,dislikes,comment_count,thumbnail_link,comments_disabled,ratings_disabled,description
"clxOL-yIySQ","Full Song: Nain Na Jodeen | Badhaai Ho| Ayushmann Khurrana|Sanya Malhotra| Rochak Kohli| Neha Kakkar","2018-11-11T06:30:01.000Z","UCq-Fj5jknLsUf-MWSy4_brA","T-Series","10","18.13.11","latest hindi songs,bollywood songs,songs,hindi songs,songs2018,Nain Na Jodi Video Song,Nain Na Jodi,Nain Na Jodi badhaai ho song,badhaai ho movie songs,new movie songs,neha kakkar songs,new kakkar new song,Ayushmann Khurrana,Neha Kakkar,Rochak Kohli,Badhaai Ho,Sanya Malhotra,Neena Gupta,nain na jodi,sanya malhotra,badhaai ho,Nain Na Jodeen,Nain Na Jodeen video,Nain Na Jodeen badhaai ho song,nain na jodi badhaai ho song","597979","13836","4785","5108","https://i.ytimg.com/vi/clxOL-yIySQ/default.jpg","False","False","Presenting the full video song Nain Na Jodeen from the Bollywood movie Badhaai Ho,  The movie features  Ayushmann Khurrana, Sanya Malhotra, Gajraj Rao And Neena Gupta in leading roles. Badhaai Ho is a coming-of-age family entertainer that celebrates love, family and everything in between. The Song is composed by Rochak Kohli and is sung by  Ayushmann Khurrana, Neha Kakkar and Rochak Kohli♪ Available on ♪iTunes : http://bit.ly/Nain-Na-Jodeen-Badhaai-Ho-iTunesHungama : http://bit.ly/Nain-Na-Jodeen-Badhaai-Ho-HungamaSaavn : http://bit.ly/Nain-Na-Jodeen-Badhaai-Ho-SaavnGaana : http://bit.ly/Nain-Na-Jodeen-Badhaai-Ho-GaanaApple Music : http://bit.ly/Nain-Na-Jodeen-Badhaai-Ho-Apple-MusicAmazon Prime Music : http://bit.ly/Nain-Na-Jodeen-Badhaai-Ho-Amazon-MusicGoogle Play : http://bit.ly/Nain-Na-Jodeen-Badhaai-Ho-Google-PlayWynk : http://bit.ly/Nain-Na-Jodeen-Badhaai-Ho-Wynk_______________________________________For Caller Tunes :Nain Na Jodeen https://bit.ly/2pJTtgnNain Na Jodeen - Na Kisi Apne https://bit.ly/2RCZCaBNain Na Jodeen - Birha Ka Rang https://bit.ly/2RC5CR6Set as Caller Tune:Set Nain Na Jodeen  as your caller tune - ssms BAHO7 To 54646Set Nain Na Jodeen - Na Kisi Apne as your caller tune - sms BAHO8 To 54646Set Nain Na Jodeen - Birha Ka Rang as your caller tune - sms BAHO9 To 54646_______________________________________Song Credits: Nain Na JodeenSingers: Ayushmann Khurrana, Neha Kakkar and Rochak KohliMusic: Rochak KohliLyrics: KumaarMusic Label: T-SeriesProgrammed and Arranged by: Aditya DevMixed and mastered by: Shadaab Rayeen @New EdgeOud, Rabab, Bouzouki by: Tapas RoySarangi by: Dilshad KhanPiano by: Aditya DevGuitars by: Rochak KohliMusic Team: Raj Chanana, Shivam Chanana, Sonal Chawla, Vivin Sachdeva @T-SeriesMusic Director’s Management: Vikas Nopany @KWANMix Assistants: Abhishek Sortey and Dhananjay Khapekar________________________________________Operator Codes: 1.Nain Na JodeenVodafone Subscribers Dial 53710688754Airtel Subscribers Dial 5432116607075Idea Subscribers Dial 5678910688754Tata DoCoMo Subscribers dial 54321110688754BSNL (South / East) Subscribers sms BT 10688754 To 56700BSNL (North / West) Subscribers sms BT 7167453 To 56700Virgin Subscribers sms TT 10688754 To 58475MTNL Subscribers sms PT 10688754 To 567892.Nain Na Jodeen - Na Kisi ApneVodafone Subscribers Dial 53710688692Airtel Subscribers Dial 5432116607061Idea Subscribers Dial 5678910688692Tata DoCoMo Subscribers dial 54321110688692BSNL (South / East) Subscribers sms BT 10688692 To 56700BSNL (North / West) Subscribers sms BT 7167455 To 56700Virgin Subscribers sms TT 10688692 To 58475MTNL Subscribers sms PT 10688692 To 567893.Nain Na Jodeen - Birha Ka RangVodafone Subscribers Dial 53710688795Airtel Subscribers Dial 5432116607076Idea Subscribers Dial 5678910688795Tata DoCoMo Subscribers dial 54321110688795BSNL (South / East) Subscribers sms BT 10688795 To 56700BSNL (North / West) Subscribers sms BT 7167454 To 56700Virgin Subscribers sms TT 10688795 To 58475MTNL Subscribers sms PT 10688795 To 56789___________________________________________Enjoy & stay connected with us!► Subscribe to T-Series: http://bit.ly/TSeriesYouTube► Like us on Facebook: https://www.facebook.com/tseriesmusic► Follow us on Twitter: https://twitter.com/tseries► Follow us on Instagram: http://bit.ly/InstagramTseries"
"oTcV9k0bgRs","Live: IND Vs WI 3rd T-20 | Live Scores and Commentary | 2018 Series","2018-11-11T17:35:11.000Z","UCJrpiw6dS09Zx2Z8d9AFWDA","CricTalks","17","18.13.11","india score,india match,cricket score,live score,india cricket,highlights,virat kohli,match score,live stream,cricket news,live cricket,live commentary,odi,crictalks,crictalks2,india,cricket,indian team,match result,presentation,india win,ind,india cricket match,india match score,rohit sharma,2018,century,live cricket match today,ind vs wi,india vs windies,windies cricket,windies,Bumrah,T20 series,rishabh pant,3rd T20,Chennai,dhawan","804395","4091","822","22","https://i.ytimg.com/vi/oTcV9k0bgRs/default.jpg","False","False","Live: IND Vs WI 3rd T-20 | Live Scores and Commentary | 2018 SeriesFor Ad Spots and general inquiries: anatomizedtube@gmail.comCHENNAI: India will be aiming to complete a clean sweep when they take on a battered West Indies in the third T20 International on Sunday even while looking to test the bench strength.For the cricket loving fans in Chennai, they will certainly miss their 'favourite son' Mahendra Singh Dhoni, who is not a part of the T20 squad.Having sealed the series with a comprehensive win in the second T20I at Lucknow riding on skipper Rohit Sharma's brilliant ton, the home team would look to give reserve bench players like Shreyas Iyer, MS Washington Sundar and the uncapped Shahbaz Nadeem an opportunity before it embarks on the tour of Australia.The selectors decided to rest pacemen Jasprit Bumrah, Umesh Yadav and wrist spinner Kuldeep Yadav for Sunday's game, allow them to be in the best physical condition ahead of the tour to Australia. Medium-pacer Siddarth Kaul has been added to the squad.The pitch at Chepauk has been on the slower side in recent games but the square prepared for Sunday's game is expected to favour the batsmen.Skipper Rohit was at his best during the Lucknow T20I following up his exploits in the preceding ODI series but the other batsmen haven't made sizeable contributions despite facing an inconsistent West Indies attack.On Diwali eve, when Rohit Sharma’s firecracker century at Lucknow gave India an unassailable 2-0 lead in the three-match T20 international series, West Indies had been left with virtually nothing to play for in Chennai. Also, the Chepauk game is coming after a five-day gap due to the Diwali festivities — a seemingly painstaking wait for the visitors. In a full series comprising two Tests, five ODIs and three T20Is West Indies so far have managed to win just one game; the third ODI in Pune. They must have liked an early sign-off.And yet, from the players’ point of view the final T20I at Chepauk on Sunday is not an inconsequential fixture. No T20I in India can be inconsequential, especially with the next IPL only a few months away.The captain's opening partner Shikhar Dhawan, K L Rahul and Rishabh Pant among others would like to have a few more runs under the belt before the Australia tour.Local star Dinesh Karthik, whose heroics in the Nidahas Trophy finale in Sri Lanka are still fresh in memory, shone as India chased down a modest target in the first match after a mid-innings wobble and will be eager to shine in front of the home crowd.With Bumrah and Kuldeep, who have posed a challenge to the visiting batsmen being rested, Bhuvneshwar Kumar and the young Khaleel Ahmed will be expected to form the pace attack and provide early wickets.The spin department may see the return of Yuzvendra Chahal in the absence of Kuldeep while Krunal Pandya will expect to build on an impressive start to his international career.It remains to be seen if the team management chooses to give Chennai man Washington Sundar a go alongside Shreyas Iyer.The visitors, on the other hand have been at sixes and sevens in the T20s after posing an unexpected challenge to the Indians in the ODIs, especially against the skills of Bumrah and Kuldeep.The absence of regular openers (Chris Gayle and Evin Lewis) and the decision to tinker with the combination at the top hasn't helped their cause either. Skipper Carlos Brathwaite admitted they had to make do with the resources available and the team will aim to end the series with a consolation win.Established names like Kieron Pollard, Darren Bravo and Denesh Ramdin haven't fired and the impressive Shimron Hetmyer pushed up the order hasn't found the going easy to add to the Windies' woes.Among the bowlers, Oshane Thomas has impressed the most with his pace and ability to take wickets but has lacked support from the others.Brathwaite, who rose to fame after smashing Ben Stokes for four sixes in the final over of the 2016 ICC World T20 final in Kolkata, will be eager to showcase his abilities and thereby inspire his men, low on morale, to raise their game against a dominant Indian side in the concluding match of the tour to secure a consolation win.Squads:India: Rohit Sharma (captain), Shikhar Dhawan, KL Rahul, Dinesh Karthik (wicket-keeper), Manish Pandey, Shreyas Iyer, Rishabh Pant (wicket-keeper), Krunal Pandya, Washington Sundar, Yuzvendra Chahal, Bhuvneshwar Kumar, Khaleel Ahmed, Shahbaz Nadeem, Siddarth Kaul.West Indies:  Carlos Brathwaite (Capt), Darren Bravo, Shimron Hetmyer, Shai Hope, Obede McCoy, Keemo Paul, Khary Pierre, Kieron Pollard, Nicholas Pooran, Rovman Powell, Denesh Ramdin, Sherfane Rutherford, Oshane Thomas."
"tzT9tQNK_TY","Thugs of Hindostan | Sorabh Reviews Anything | #NoRules | Aamir Khan | Amitabh Bachchan","2018-11-11T06:02:18.000Z","UCG-DtDzk64PaJHM0Wanj8NA","Sorabh Pant","23","18.13.11","thugs of hindostan,amir khan,vijay krishna acharya,vashmalle,rajeev masand,rajeev masand review,film review,yrf,tried&refused,filmifever,ajay-atul,krk,sorabh pant,william lawsons","441649","21320","1253","1980","https://i.ytimg.com/vi/tzT9tQNK_TY/default.jpg","False","False","Hugs to Hindustan for enduring Thugs of Hindustan.#SorabhReviewsAnything#NoRules#WilliamLawsonsSubscribe to this channel. See me do LIVE standup: sorabhpant.com/ticketsOn Twitter: https://twitter.com/hankypantyOn Facebook: https://www.facebook.com/SorabhPant/On Snapchat: @hankypanty.On Instagram: https://www.instagram.com/sorabhpant/"
"wbPalIb1LJY","Tula Pahate Re - ईशा पाहणार पाडव्याचे स्वप्न | 12th November 2018 | Marathi Serial Update News","2018-11-12T04:03:12.000Z","UCPsUV8VaZX43Jgi-5SPvl8w","Manoranjan Marathi","24","18.13.11","tula pahate re zee marathi,tula pahate re zee marathi serial promo,Tula Pahate Re Marathi Serial,Upcoming Marathi Serial,Tula Pahate Re Marathi Tv Show,गायत्री दातार,तुला पाहते रे,Story,Tula Pahate Re,Marathi Tv Show,सुबोध भावे,Watch Online,zee marathi,Zee5,Marathi Serial,Zee,tula pahate re zee marathi serial cast,tula pahate re zee marathi serial time,love story,tula pahate re marathi serial,tula pahate re,Vikrant love isha,12th November 2018","47501","203","24","135","https://i.ytimg.com/vi/wbPalIb1LJY/default.jpg","False","False","Click to Download Zee5 Official App From PlaystorePlaystore - http://bit.ly/2LCPUSRI tunes - https://apple.co/2L6I6reTo watch full episode click here :- https://www.zee5.com/tvshows/details/tula-pahate-re/0-6-tvshow_312127630/tula-pahate-re-episode-79-november-10-2018-full-episode/0-1-150031In Zee Marathi's, Tula Pahte Re's, Isha will dream of Padva celebrate with Vikrant.  Isha  missing to Vikrant since she will call the video.Watch, Like, share and Subscribe Manoranjan MarathiSUBSCRIBE here: https://www.youtube.com/channel/UCPsUV8VaZX43Jgi-5SPvl8w?sub_confirmation=1"
"QVlOI8C-Jjk","Cash Latest Promo - 17th November 2018 - Getup Srinu,Madhavi Latha,Venu,Dhan Raj - Mallemalatv","2018-11-10T17:30:00.000Z","UCULLmfWqhMOeiWEV6hkMSCg","mallemalatv","24","18.13.11","All Time Hit Comedy Shows,cash promo,cash program in etv,cash program,cash latest promo,cash promo 2018,suma kanakala,latest cash program,last cash promo,Suma kanakala latest Program,Cash Latest Promo,Suma Cash Show,Suma Punches,Jabardasth Comedy,Getup Srinu,Madhavi Latha,Venu,Dhan Raj,Jabardasth Srinu Comedy,Jabardasth Srinu Punches,Dhanraj Comedy,Venu Wonders Comedy,Madhavi Latha Comedy","681399","6721","364","512","https://i.ytimg.com/vi/QVlOI8C-Jjk/default.jpg","False","False","Watch Cash Latest Promo - 17th November 2018. Cash Show host by Suma Kanakala. #GetupSrinu #MadhaviLatha #Venu #DhanRaj is the Participants.Enjoy and stay connected with us!! ►Subscribe us on Youtube: http://bit.ly/Mallemalatv►Like us: http://www.facebook.com/mallemalatv►Follow us: http://www.twitter.com/mallemalatv►Circle us: https://plus.google.com/+mallemalatv►Visit For More Film Updates: http://www.123telugu.com►Subscribe For Telugu Cooking Videos:  http://bit.ly/TeluguRuchi"
"a3LTNs5IzQU","നീതുവിന്റെ രഹസ്യ കാമുകനെ കയ്യോടെ പിടികൂടി കാവ്യയും ശ്രീകുട്ടിയും.","2018-11-10T05:35:23.000Z","UCp_r6Z-Oh0YTf-ym71z5Nqg","Asianet","24","18.13.11","asianet,malayalam channel,tv show,malayalam serial,entertainment,Kasthooriman || Serial || Today at 8:30 PM || Asianet,Kasthooriman,Kasthooriman asianet,Kasthooriman serial,Watch Kasthooriman Serial,Kasthooriman Latest Episode,Kasthooriman Full Episode,Kasthooriman malayalam serial,Kasthooriman online,watch Kasthooriman serial online,Kasthooriman Serial Online,Kasthooriman latest episode hotstar,Kasthooriman promo,kasthooriman serial promo","282646","657","94","213","https://i.ytimg.com/vi/a3LTNs5IzQU/default.jpg","False","False","Kasthooriman || Serial || Today at 8:30 PM || Asianet Watch All Shows: http://www.hotstar.com/asianetFollow Us On Facebook - https://www.facebook.com/Asianet                        Instagram - https://www.instagram.com/asianet                        Twitter - https://twitter.com/asianet"
"kI9sDkGCw1k","Ram Charan and Mahesh Babu fans fight on Vinaya Vidheya Rama teaser - TV9","2018-11-10T18:40:16.000Z","UCSCMq5lBO2siZ8eA9gF-LMw","TV9 Entertainment","24","18.13.11","TV9 Entertainment,Tollywood gossips,Latest movies,Telugu film trailers,Latest movie teasers,Telugu songs,Tollywood movies,Telugu movie reviews,Tollywood updates,Theatrical Trailer,Ram Charan and Mahesh Babu fans fight on Vinaya Vidheya Rama teaser - TV9,Ram Charan,Mahesh Babu,Ram Charan and Mahesh Babu fans,Vinaya Vidheya Rama teaser","656521","10799","1817","2121","https://i.ytimg.com/vi/kI9sDkGCw1k/default.jpg","False","False","Ram Charan and Mahesh Babu fans fight on Vinaya Vidheya Rama teaser - TV9► Download Tv9 Android App: http://goo.gl/T1ZHNJ► For More: https://goo.gl/5i4dsT► Circle us on G+: https://plus.google.com/+Tv9Entertainment► Like us on FB: https://www.facebook.com/TV9Entertainment► Follow us on Twitter: https://twitter.com/TV9ET► Pin us on Pinterest: https://www.pinterest.com/Tv9telugu"
"Yo99xW6td5E","கடைசி நேரத்தில் ஆப்ரேஷனைதடுத்து நிறுத்திய ஆனந்தி காரணம் என்ன தெரியுமா | Nayaki Serial Review |Nayaki","2018-11-11T10:43:00.000Z","UCGkOEOGTHGrW4P_-AcAa7LA","Daily Tamil Serial Review","22","18.13.11","[none]","134323","520","76","20","https://i.ytimg.com/vi/Yo99xW6td5E/default.jpg","False","False",""
"OULHz-DDpMA","Silsila Badalte Rishton Ka - 9th November 2018 - सिलसिला बदलते रिश्तों का","2018-11-10T06:31:14.000Z","UC55IWqFLDH1Xp7iu1_xknRA","Colors TV","24","18.13.11","Colors TV,colorstv,hindi shows,VOOT,new promo,clips,3 minute clip,Silsila voot clip,Silsila,drama,extra marital affair,sislsila,badalte rishton ka,Silsila full show,childhood friend,Silsila Badalte Rishton Ka,Drashti Dhami,Nandini,Shakti Arora,Kunal,Aditi Sharma,Dr Mauli,Rajdeep,Abhinav Shukla,love story,husband,wife,cheating,harassment,#silsila","348574","1003","181","111","https://i.ytimg.com/vi/OULHz-DDpMA/default.jpg","False","False","To watch the full episode of 'Silsila Badalte Rishton Ka' anytime, Download the Voot app now or Visithttps://www.voot.com/shows/silsila/1/606786/mishti-is-electrocuted/650719Two best friends, one broken marriage, and a dangerously addictive affair! Follow the dramatic twists and turns in the lives of Mauli, her husband Kunal, and her best friend Nandini. What happens when the unhappily married Nandini realises that the mutual admiration between her and Kunal has turned into fatal attraction? Will friendship be forsaken for love? Will one woman's happiness becomes another woman's heartbreak? Find out in Silsila Badalte Rishton Ka."
"BwE3osULMqA","விஜய்க்கு ஆதரவாக கொந்தளித்த பிரேமலதா விஜயகாந்த் | Premalatha Vijayakanth Speech","2018-11-09T16:18:42.000Z","UCrn698AOJJ69zWN9Z_kTAKQ","Thi Cinemas","25","18.13.11","Cinema,premalatha vijayakanth speech,premalatha vijayakanth,premalatha vijayakanth about sarkar,premalatha vijayakanth speech about sarkar,premalatha vijayakanth about vijay,premalatha vijayakanth speech about vijay,premalatha vijayakanth today speech,premalatha vijayakanth latest speech,premalatha vijayakanth on sarkar issue,premalatha vijayakanth dubsmash,premalatha vijayakanth biography,premalatha vijayakanth today,thi cinemas,premalatha vijayakanth latest","1002601","17759","587","794","https://i.ytimg.com/vi/BwE3osULMqA/default.jpg","False","False","விஜய்க்கு ஆதரவாக கொந்தளித்த பிரேமலதா விஜயகாந்த் | Premalatha Vijayakanth Speech#premalathavijayakanthspeechtoday#premalathavijayakanthaboutsarkar#premalathavijakanthaboutvijayFor More Political & Cinema News , Reviews , Press Meet , Gossips , Audio Launch , Movie Updates  Subscribe Thi Cinemas and click notification bell to get notifications for regular updatesStay tuned to #thicinemas for more updates about #cinema HIT like and Share your commentsWeb: http://www.thicinemas.com/ Facebook - https://www.facebook.com/thicinemasTwitter- https://twitter.com/thicinemas"
"6I-tH-OFkxw","Funny Friends | Hyderabadi Comedy | Warangal Diaries","2018-11-11T05:44:33.000Z","UCWSyWK6oS5VL3RrJZuWsdSA","Warangal Diaries","23","18.13.11","warangal diaries,latest,funny,comedy,Balajimovies,shalimar,vines,warangal diaries new video,warangal diaries latest video,nabeel afridi,types of friends,kindso f friends,funny friends,friends comedy,hyderabadi friends,hyderabadi funny friends,hyderabadi comedy video,hyderabadi funny video,warangal diaries comedy video,warangal diaries funny video,characters of friends,funny friend scenes,funny friend vines,funny friends video,funny friends comedy scenes","191231","11499","333","1840","https://i.ytimg.com/vi/6I-tH-OFkxw/default.jpg","False","False","(Earphone Use Is Recommended)!!Download The App here: http://bit.ly/2DdwlyKFunny Friends : Types And Kinds Of Funny Friends Whom You Have In Your Zone. You Must Watch - Humour , Amusing , Jokes It's All About Fun #EveryOneMustWatch Give a Big Thumpsup , Comment Below How The Videos Was ,  Share This Video , Subscribe To Our Channel , Click On The Link Below To Subscribe Now!! https://www.youtube.com/channel/UCWSyWK6oS5VL3RrJZuWsdSA?sub_confirmation=1Follow Us on Our Social Sites :- Facebook :- https://www.facebook.com/WarangalDiariesTwitter :- https://www.twitter.com/WarangalDiariesInstagram :- https://www.instagram.com/WarangalDiariesGoogle+ :- https://www.plus.google.com/+WarangaldiarieschannelYoutube :- https://www.youtube.com/WarangalDiariesChannelEdit & Screen play , Owner :- Nabeel Afridi Facebook :- https://www.facebook.com/IamNabeelAfridiInstagram :- https://www.instagram.com/IamNabeelAfridiTwitter :-  https://www.twitter.com/IamNabeelAfridiSnapchat :- IamNabeelAfridi(Every Sunday New Video)  #Hyderabadicomedy #Warangaldiaries #NabeelproductionsWarangal Diaries Bringing You Hilarious & Funny Short Comedy Skits , Public Videos , Pranks , Social Experiments , Inspirational & Motivational Videos And Much More!!"
"TzTnDk3fmFw","SIT | THE FAMILY VACATION| S1E2 | Chhavi Mittal | Karan V Grover | Ayub Khan","2018-11-08T09:00:03.000Z","UCqnW0v3DXxt0Svv0H64TVZQ","Shitty Ideas Trending","24","18.13.11","SIT,Shitty Ideas Trending,SIT Videos,tvf qtiyapa,buzzfeed,being indian,web series,family,drama,comedy,viral,the viral fever,pitchers,permanent roommates,filtercopy,short films,scoopwho","793904","13613","759","1040","https://i.ytimg.com/vi/TzTnDk3fmFw/default.jpg","False","False","#WebSeriesRohini’s dad’s dislike of Rishi leads to a series of confusions. He misunderstands a conversation between Rishi and Kunal assuming that Rishi is “struggling” in his work. On the other hand, Rohini’s mom gets a feeling that Rishi is unable to conceive! The pressure is building on Rishi. Will he be able to deal with it? Watch how Rishi finds himself completely trapped at the end!SIT presents S1E2-THE FAMILY VACATION!_______________________________________________________This video was done in association with AMITY UNIVERSITY ONLINE. Click the link to start registering for their programmes!http://bit.ly/LearnWithAmityOnlineDo SHARE the video if you LIKE it, and leave us a COMMENT! Don't forget to SUBSCRIBE to Shitty Ideas Trending for a fun video every Thursday!Also participate in the contest to win FREE SIT MERCHANDISE!________________________________________________________CREDITS:Created By: MOHIT HUSSEINProduced By: WORKSHOP INCConcept & Directed By: MOHIT HUSSEINWritten By: MOHIT HUSSEIN, CHHAVI MITTALCreative Director: CHHAVI MITTALCast: AYUB KHAN, DEEPIKA AMIN, CHHAVI MITTAL, KARAN V GROVER, GUNJAN UTREJA, PREETIKA CHAWLA, PRACHEEN CHAUHAN, MASTER KAVYAAN KHOSLASupporting Cast: RAKESH BAZAD (Shady guy), DEVENDRA SINGH (Taxi Driver), ANIL JENA (Pandit), VINOD PRADHAN (Waiter), VIKAS SINGH (Delivery Boy)DOP: KAMAL CHAURASIAEditor: ASHISH JHASound Engineer: ANIL JENAAssistant DOP: GULSHAN RAMANIExecutive Producer: EHTESHAM HUSSEINLine Producer: FRESHWATER FILMS & TELEVISION Digital Intermediate: FULL FRAME FILMSColorist: SUNNY DHANJALOST “Papa Ji” credits: Music, LyricsRap: MALIK SAHABProgramming, Mixing, Mastering: SAURABH JAYProduction Controller: DILIP KANOJIAFirst Assistant: DEVENDRA SINGHSecond Assistants: TUSHAR RANJAN, VIDIT KANOJIALocal Co-ordinator: RAKESH BAZADAssociate Editor: JAYANTA BANERJEEGaffer: WASIM ANSARI Equipment Partner: PANASONIC LUMIX GH5Panasonic HOD: HITESH VIGPanasonic Attendants: NISHANT THAKUR, VIKAS SINGH, SUNIL GAWAIAdditional Equipment: VIDEO PLUSCamera Attendant: KRISHNANAND SINGHAssistant Sound Recordist: RAMESH JAISWALLocations: TATA MYST, KASAULI, WORKSHOP INC STUDIOS, IGI AIRPORT, NEW DELHITata Myst Team - Estate Manager: AJAY KUMARTech Exec: SAAHI DOHRUAR Hospitality: ANIL RAWATChefs: MUKESH PANDEY, RAJ KUMARRestaurant Incharge: VINOD PRADHANWaiters: Pradeep, BittySocial Media Manager: PRIYANKA PEREIRADrone Operator: RAKESH BAZADLight Equipment: IN INDIA FILMSLight Incharge: AVADESHLightmen: M.K, VIKESH, PANKAJ, RADHE, S.K, RAJUAccommodation: SAKET GUEST HOUSEDressman: SATISH YADAVProduction Boys: BAJRANGI THAKUR, DILIP SHARMA, RAJENDRA SHARMACostume Stylist: SHRUTI KOTHARIMake-Up: SANDESH GADEKARMake-up Assistant: AMIT SHAHHair Stylist: NASEEM ANSARIPost Production: WORKSHOP INC POST FACILITYBehind The Scenes Team: CHHAVI MITTAL, TUSHAR RANJAN, SUSHIL SHARMA, JAYANTA BANERJEEFood Supplier: TATA MYST, KASAULITravel Agent: ASHWINI TOURS & TRAVELSTransport: IN INDIA FILMSDrivers: GURDEEP SINGH, PRADEEPProperty Supplier: NATIONAL NOVELTYLocal Vendor: KANTA STORES (Kasauli)________________________________________This series was not possible without the support of:TATA HOUSING – MYST, Kasaulihttps://www.tatahousing.in/mystSPICEJET AIRLINEShttps://www.spicejet.com/AMITY UNIVERSITY ONLINEhttps://www.amityonline.com/amityonline/GROWW APPhttps://groww.in/THE  MOMS COhttps://themomsco.com/PANASONIC LUMIX GH5Follow SIT:Facebook: https://www.facebook.com/SITofficial/Twitter: https://twitter.com/TeamShittyIdeasInstagram: https://www.instagram.com/shittyideastrending/FOR BUSINESS INQUIRIES: info@shittyideastrending.comVisit us on www.shittyideastrending.com____________________________________________________CHHAVI MITTAL:https://www.facebook.com/chhavimittalofficial/?ref=br_rshttps://www.instagram.com/chhavihussein/https://twitter.com/chhavihussein_______________________________________________________MOHIT HUSSSEIN:https://www.facebook.com/mohithusseinsithttps://www.instagram.com/mohithussein/_______________________________________________________DISCLAIMER:THIS VIDEO WAS CREATED PURELY FOR ENTERTAINMENT PURPOSES ONLY. THE CHARACTERS, DIALOGUES, SITUATIONS & OTHER THINGS ARE PURELY FICTIONAL. ANY RESEMBLANCE TO A PERSON LIVING OR DEAD IS PURELY COINCIDENTAL. THIS CHANNEL DOES NOT CLAIM TO BE FACTUAL OR POLITICALLY CORRECT AT ALL TIMES. THE CONTENT IS FICTIONAL AND MEANT ONLY FOR ENTERTAINMENT. ANY OFFENCE CAUSED IS SUBJECTIVE AND DEEPLY REGRETTED.  CONSUMPTION OF ALCOHOL/SMOKING/DRUGS IS INJURIOUS TO HEALTH. NONE OF THE CREATORS OR ACTORS PROMOTES THE USE OF IT"
