video_id,title,publishedAt,channelId,channelTitle,categoryId,trending_date,tags,view_count,likes,dislikes,comment_count,thumbnail_link,comments_disabled,ratings_disabled,description
"IWJUPY-2EIM","Red Velvet 레드벨벳 'RBB (Really Bad Boy)' MV","2018-11-30T09:00:04.000Z","UCEf_Bc-KVd7onSeifS3py9g","SMTOWN","10","18.16.12","Red Velvet,RBB,Really Bad Boy,Bad Boy,IRENE,SEULGI,WENDY,JOY,YERI,레드벨벳,알비비,배드보이,아이린,슬기,웬디,조이,예리","19211583","1200847","41076","120485","https://i.ytimg.com/vi/IWJUPY-2EIM/default.jpg","False","False","Red Velvet's the 5th mini album RBB is out!Listen and download on iTunes & Apple Music, Spotify, and Google Play Music http://smarturl.it/RBB[Tracklist]01 RBB (Really Bad Boy)02 Butterflies03 So Good04 멋있게 (Sassy Me)05 Taste06 RBB (Really Bad Boy) (English Ver.)Red Velvet Officialhttp://redvelvet.smtown.comhttp://www.youtube.com/redvelvet http://www.facebook.com/RedVelvethttps://www.instagram.com/redvelvet.smtownhttps://twitter.com/RVsmtown#RedVelvet #레드벨벳 #RBB #ReallyBadBoyRed Velvet 레드벨벳 'RBB (Really Bad Boy)' MV ℗ SM Entertainment"
"z-oxagtRO7A","Santa Baby - Lindsey Stirling","2018-11-30T04:59:57.000Z","UCyC_4jvPzLiSkJkLIkA7B8g","Lindsey Stirling","10","18.16.12","lindsey,lindsay,violin,dubstep,electronic,sterling,stirling,santa baby,santa,baby,lindsey stirling,christmas,edm,pop,chill,chill christmas,luna,latte,warmer in the winter,chimney,hurry down,xmas","2077588","78670","6388","6639","https://i.ytimg.com/vi/z-oxagtRO7A/default.jpg","False","False","Pick up a copy of the Deluxe Edition of Lindsey's Christmas Album Warmer in the Winter including 'Santa Baby' at the following places: Target: https://found.ee/LS_WITWDeluxeTarget Amazon: https://found.ee/LS_WITWDeluxeAMZ iTunes: https://found.ee/LS_WITWDeluxeiTunes Barnes & Noble https://found.ee/LS_WITWDeluxeBN Spotify: https://found.ee/LS_WITWDeluxeSpotify Apple Music: https://found.ee/LS_WITWDeluxeApple Director: Joshua Shultz & Lindsey Stirling Producer: Krizia VegaEditor: Lindsey StirlingHead here for tour dates, tickets, and VIP upgrades: http://www.lindseystirling.com/Sheet Music Here: https://lindseystirlingsheetmusic.comFollow me here:https://www.facebook.com/lindseystirlingmusichttps://twitter.com/LindseyStirlinghttp://www.instagram.com/LindseyStirlingSign up for my super-cool newsletter here:http://lindseystirling.fanbridge.com"
"05lfQfEc0Q8","Nacho, Manuel Turizo - Déjalo","2018-11-30T01:58:17.000Z","UCf9WY_e35w2UV3LDLKX2jQw","NachoVEVO","10","18.16.12","Nacho,Manuel,Turizo,Déjalo,UMLE,Latino,Latin,Urban,La Criatura,Nacho la Criatura,Los Mendoza,Manuel Turizo,Los Hermanos Turizo,Mosty,Julian Turizo,Ozuna,Piso 21,Colombia,Venezuela,Dejalo,Amor,Romance,Canciones de Amor,Te Amo,Por Eso Dejalo,La Criatura Y Los Hermanos Turizo,Rolo,Dayme Y El High","14586950","328081","5298","12882","https://i.ytimg.com/vi/05lfQfEc0Q8/default.jpg","False","False","Listen to “Dejalo” here: https://UMLE.lnk.to/TH35DFp Follow Nacho: https://www.instagram.com/nacho/ https://www.facebook.com/NachoOfficial/ https://twitter.com/nacholacriaturaFollow Manuel Turizo: https://www.facebook.com/ManuelTurizoMusic/ https://www.instagram.com/mturizomusic/?hl=en https://twitter.com/ManuelTurizoMTZ?lang=enLyrics – Nacho, Manuel Turizo “Déjalo”Ya te acostumbraste a que esa persona nunca ponga de su parte para comprenderte mucho menos para darte lo que necesitas tú siempre solita y él por ahí feliz con sus amantes Por eso te pido que te quedes conmigo yo te amo tanto y Dios está de testigo si te trato bien tan solo siendo tu amigo imagínate si yo estuviera contigo Por eso déjalo olvida ya a ese tonto y vámonos de ahora en adelante ignóralo no pierdas más el tiempo nena que algo mejor te espera Déjalo que ya llegó el momento de los dos de ahora en adelante ignóralo no pierdas más el tiempo nena que algo mejor te espera (Manuel Turizo) Entiende que yo soy diferente no creas lo que dice la gente no todos somos iguales quiero que me regales un rato que este hombre no te miente y atrévete lady ven conmigo escápate sabes que quiero tus besos déjame recibir para hacerte sentir que ya llegó nuestro momento Déjalo olvida ya a ese tonto y vámonos de ahora en adelante ignóralo no pierdas más el tiempo nena que algo mejor te espera Déjalo que ya llegó el momento de los dos de ahora en adelante ignóralo no pierdas más el tiempo nena que algo mejor te esperaDime cómo las heridas del pasado que ese tipo te ha causado no te han matado nena dime cómo has superado lo que te ha hecho ese degenerado un patán que nunca te ha amado yo que todo te he ofrecido y no te lo he dado porque tú no has querido quedarte a mi lado has podido, pero no has logrado separarte de ese tipo tan raro Por eso te pido que te quedes conmigo yo te amo tanto y Dios está de testigo si te trato bien tan solo siendo tu amigo imagínate si yo estuviera contigo Por eso déjalo olvida ya a ese tonto y vámonos de ahora en adelante ignóralo no pierdas más el tiempo nena que algo mejor te espera Déjalo que ya llegó el momento de los dos de ahora en adelante ignóralo no pierdas más el tiempo nena que algo mejor te espera La criatura y los hermanos Turizo Manuel Turizo Julian Turizo Nacho Venezuela y Colombia No mires pa otro lado Mosty Rolo Dayme y el High El corillo#Nacho #Dejalo #ManuelTurizo #NachoLacriatura #LosMendozaMusic video by Nacho, Manuel Turizo performing Déjalo. © 2018 UMG Recordings, Inc.http://vevo.ly/2ikKCl"
"6B0Mn5XZs2E","TOUR VLOG PART 2: RIDING A ROLLERCOASTER IN MADISON SQUARE GARDEN","2018-11-29T21:43:32.000Z","UCWkYXtnAuu7VTLPwUcRSB6A","Kylie Jenner","22","18.16.12","Kylie Jenner,Travis Scott,Astroworld","7099767","0","0","0","https://i.ytimg.com/vi/6B0Mn5XZs2E/default.jpg","True","True","Behind the scenes of life on Astroworld Tour."
"3E2stBZjzsU","뮤직뱅크 Music Bank - RBB(Really Bad Boy) - 레드벨벳(Red Velvet).20181130","2018-11-30T08:53:17.000Z","UCeLPm9yH_a_QH8n6445G-Ow","KBSKpop","10","18.16.12","Korean,Music,Show,K-pop,KBS","3404761","192620","5235","0","https://i.ytimg.com/vi/3E2stBZjzsU/default.jpg","True","False","뮤직뱅크 Music Bank - RBB(Really Bad Boy) - 레드벨벳(Red Velvet).20181130"
"OhSCYbaeejg","Film Theory: Can You Speak Groot? (Marvel Guardians of the Galaxy)","2018-11-29T21:05:10.000Z","UC3sznuotAs2ohg_U__Jzj_Q","The Film Theorists","1","18.16.12","groot,guardians of the galaxy,guargians of the galaxy 2,marvel,i am groot,i am groot infinity war,baby groot,avengers 4,avengers infinity war,groot dance,thor meets the guardians of the galaxy,avengers 4 trailer,guardians of the galaxy meets thor,captain marvel,guardians of the galaxy soundtrack,guardians of the galaxy trailer,guardians of the galaxy 2 soundtrack,star lord thor,guardians of the galaxy theme,film theory,film theorists,film theory marvel","2711846","86801","2679","13608","https://i.ytimg.com/vi/OhSCYbaeejg/default.jpg","False","False","Get your NEW Holiday Theory Wear! ► http://bit.ly/2B7pUMeDoctor Strange Magic DEBUNKED ►► https://bit.ly/2FbOvOL  Thanos CAN'T Snap! ► https://bit.ly/2uG4tyfSUBSCRIBE for More Film Theories! ► http://bit.ly/1dI8VBHGroot became a fan favorite right away despite, or perhaps because, he can only say the simple phrase I am Groot. Now, so far in the MCU we've seen only two people able to fully understand the little twig - Rocket and Thor. What I want to know is, can you or I learn to speak Groot? Could it be a REAL language? Let's find out!Don't forget to snuggle up in our new hood-tastic holiday Theory Wear! ► http://bit.ly/2B7pUMeNeed Royalty Free Music for your Content? Try Epidemic Sound.Get A 30 Day Free Trial Now! ► http://share.epidemicsound.com/FilmTh...#Groot #Marvel #GuradiansoftheGalaxy #InfinityWar #InfinityWar2 #Avengers #Avengers4 #FilmTheoryMORE FILM THEORIESThanos Was RIGHT! ► https://youtu.be/3eQP6JoxtKk Ant Man's GIANT Problem  ► https://bit.ly/2L2pxZaSpiderman is DEAD! ►► https://bit.ly/2HpyASIMarvel's Ant-Man Could KILL Us All! ►► https://bit.ly/2HtsDjLDid Deadpool WRITE Deadpool?!? ► https://bit.ly/2HtAq17Like the theme song and remix for this episode? Thanks to CARF! https://www.youtube.com/user/carfmobileSOCIAL MEDIA:Twitter: @MatPatGTFacebook: facebook.com/GameTheoristsInstagram:  instagram.com/matpatgt"
"v2M5uXu6l2c","I Got a Tattoo from One of Yelp's Worst-Rated Tattoo Parlors","2018-11-29T17:00:11.000Z","UCn8zNIfYAQNdrFRrr8oibKw","VICE","24","18.16.12","vice,comedy,Tattoos,review,The VICE Guide To Right Now,journalism,documentary,videos,culture,interview,film,movies,underground,vice videos,lifestyle,independent,vice guide,exclusive,vice mag,vice magazine,vice.com,world,documentaries,short films,docs,one star review,worst reviewed tattoo parlor,yelp,tattoo,worst tatoo,fails,bad tattoo,best tattoo,ink,surfer,wave","3018414","51164","11638","9537","https://i.ytimg.com/vi/v2M5uXu6l2c/default.jpg","False","False","Taji gets a tattoo from a tattoo artist who has a 1 star review average online.WATCH NEXT: Removing Gang Tattoos with Homeboy Industries -- https://www.youtube.com/watch?v=rT9jcDrFGxs&index=3&list=PLDbSvEZka6GEpioVNLfBoqqjRwVPrHjtnClick here to subscribe to VICE: http://bit.ly/Subscribe-to-VICECheck out our full video catalog: http://bit.ly/VICE-VideosVideos, daily editorial and more: http://vice.comMore videos from the VICE network: https://www.fb.com/vicevideoClick here to get the best of VICE daily: http://bit.ly/1SquZ6vLike VICE on Facebook: http://fb.com/viceFollow VICE on Twitter: http://twitter.com/viceFollow us on Instagram: http://instagram.com/viceDownload VICE on iOS: http://apple.co/28VgmqzDownload VICE on Android: http://bit.ly/28S8Et0"
"SLrqm8F7TgM","The 1975 - 102 (Acoustic)","2018-11-29T16:59:55.000Z","UC_LfW1R3B0of9qOw1uI-QNQ","The 1975","10","18.16.12","[none]","1438615","84744","586","4213","https://i.ytimg.com/vi/SLrqm8F7TgM/default.jpg","False","False","A Brief Inquiry Into Online Relationships - Out Nowhttps://the1975.lnk.to/ABIIORDirected by Giorgio Testi"
"H3vtCx5CBaI","Cutting Soap For My Dog While He Wears A Turtleneck","2018-11-29T08:54:17.000Z","UC9gFih9rw0zNCK3ZtoKQQyA","JennaMarbles","23","18.16.12","jenna,marbles,mourey,soap,for,my,dog,kermit,cermet,cermit,peach,asmr,sounds,knife,funny,funniest,best,table,kitchen,glasses,clothes,sitting,loves,bed,irish,spring,favorite,cute,amazing,rubbing,face,on ground,italian,greyhound,relaxing,relax,julien,solomita,boyfriend,scared,pushing,clothing,into,blankets,bury,burying,dog wearing,vlog,trying,to eat,trouble,soap cutting,crying,whining,nasty,boy","3744392","269432","5008","30453","https://i.ytimg.com/vi/H3vtCx5CBaI/default.jpg","False","False","Please subscribe to my channel and my vlog channel!  I make new videos here every Wednesday and make vlogs during my majestical daily life. http://www.youtube.com/JennaMarbleshttp://www.youtube.com/JennaMarblesVlogAlso our weekly podcast https://www.youtube.com/user/JennaJulienPodcastTwitchhttps://www.twitch.tv/jennajulienAnd past gaming from Twitch to Jenna Julien Gameshttps://www.youtube.com/channel/UC_Z0x662N1VUN9J7FYwCwkgSnapchat:JennaKermarblesFacebook: http://www.facebook.com/pages/Jenna-Mourey/311917224927Twitter:https://twitter.com/Jenna_Marbles@Jenna_Marbleshttps://twitter.com/jennajulien@jennajulienMerchandise:http://jennamarblesblog.com/shop Tumblr: http://jennamarbles.tumblr.com/Instagramhttp://instagram.com/JennaMarbles"
"giA1qS_xuuE","Chris Sails - Love Language (Official Music Video)","2018-11-28T21:15:28.000Z","UC9kvifn1C38ToEQFMwEx0Mg","Chris Sails","24","18.16.12","chris and queen,chrisand queen,chris sails,queen naija,baby cj,the sails family,pranks,challenges,vlogs","515794","23718","2709","3879","https://i.ytimg.com/vi/giA1qS_xuuE/default.jpg","False","False","Click this link to download song!!  https://itunes.apple.com/us/album/love-language-single/1443445692"
"0jMPXRDYpkQ","Alessia Cara - Not Today","2018-11-27T15:00:00.000Z","UC1EwyHfJHEKnA7kKfcGhlIw","AlessiaCaraVEVO","10","18.16.12","Alessia,Cara,Not,Today,Def,Jam,Recordings,Pop,Alessia Cara,The Pains of Growing,Pains of Growing,Not Today","3541724","107982","2502","5314","https://i.ytimg.com/vi/0jMPXRDYpkQ/default.jpg","False","False","my second album, The Pains of Growing, will be out november 30th. Pre-order is available now: https://alessiacara.lnk.to/ThePainsOfGrowingMore from Alessia Cara:http://www.alessiacara.com http://twitter.com/AlessiaCara http://instagram.com/alessiasmusic http://www.facebook.com/AlessiaCara Music video by Alessia Cara performing Not Today. © 2018 Def Jam Recordings, a division of UMG Recordings, Inc.http://vevo.ly/3dQub2"
"CeTOJa6-_U0","Woman spills coffee on customer's laptop | What Would You Do? | WWYD","2018-11-27T18:41:15.000Z","UCwdo8-3UrfZ9scHPl0m4Ysg","What Would You Do?","24","18.16.12","wwyd,what would you do,social experiment,wwyd videos,wwyd abc,what would you do videos,wwyd episodes,wwyd host,2018,John Quinones,wwyd scenarios,hidden camera,tv show,reactions,Arizona,coffee shop,laptop,computer,stranger,bystander,spills coffee,coffee cup,keyboard,cover up,woman spills coffee on computer,watch,ABC,wwyd actors,funny,drink,water spill on laptop,water spill on macbook,on keyboard","1328767","20718","709","3595","https://i.ytimg.com/vi/CeTOJa6-_U0/default.jpg","False","False","A customer trips and spills her coffee on a woman's laptop. WATCH FULL EPISODES OF WWYD:https://abc.go.com/shows/what-would-you-doWatch brand new WWYD episodes on Friday at 9PM on ABC! ►https://www.youtube.com/watch?v=SUlwc...Subscribe to WWYD ► http://bit.ly/WWYDSubsCheck out some of the Best WWYD? Episodes ► https://www.youtube.com/watch?v=Htytu...Follow What Would You Do? across the web!Facebook: https://www.facebook.com/wwyd Twitter: https://twitter.com/WWYDABC Instagram: https://instagram.com/wwydabc/ What would you do when you think no one is watching? What Would You Do? (WWYD?) explores the varying answers with the help of hidden cameras capturing individuals who have been placed within seemingly everyday situation that quickly go ary. The individuals on this hidden camera show are forced to make tough calls when directly faced with situations of racism, violence, hate crimes, and other hot button cultural issues. Catch John Quinones reporting on these individuals as they make split-second decisions to intervene or mind their own business. WWYD? airs Friday nights at 9|8c on ABC. What Would You Do? (WWYD) is a hidden camera show, hosted by ABC News correspondent John Quinones, in which unknowing bystanders are placed in uncomfortable, and often compromising real world scenarios in public. WWYD’s hidden cameras focus on the average person’s responses and reactions to these issues of social responsibility. Topics such as gay couples being affectionate in public, date rape, racism and racial profiling, interracial couples, abusive parents, drunk driving, and harassment of the homeless are touched upon in this series. What will you do? Would you choose to intervene in these situations? Watch and join the discussion."
"LwFtSxWY92g","YouTubers Get A REAL JOB For The First Time!","2018-11-27T21:00:04.000Z","UCITqR49EAUY8i1vZtXTwe-A","Dolan Twins","23","18.16.12","Dolan,Twins,Getting a real job,ethan,grayson,coffee,baristas","3782534","305152","3721","31607","https://i.ytimg.com/vi/LwFtSxWY92g/default.jpg","False","False","We started YouTubing when we were 15 so we never really had a real job before. In this video we find out what its like, and also find out that we should probably just stick to youtube lolol.SUBSCRIBE -  https://www.youtube.com/user/TheDolan...Last Week's Video - https://www.youtube.com/watch?v=lXqp1AQ_2rc&t=691sMerch - https://dolantwins.comEthan’s StuffINSTAGRAM - https://instagram.com/ethandolan/TWITTER - https://twitter.com/EthanDolanSNAPCHAT - EthanDolanGrayson’s ThingsINSTAGRAM - https://instagram.com/graysondolan/TWITTER - https://twitter.com/GraysonDolanSNAPCHAT - GraysonDolan"
"Mlc7TXsJLpQ","Honest Trailers - Elf","2018-11-27T18:00:03.000Z","UCOpcACMWblDls9Z6GERVi1A","Screen Junkies","1","18.16.12","screenjunkies,screen junkies,honest trailers,honest trailer,honest trailers elf,elf,elf movie,elf will ferrell,elf movie scene,honest trailers christmas,honest trailers will ferrell,will ferrell movies,elf trailer,elf reaction","1521063","34261","1015","4099","https://i.ytimg.com/vi/Mlc7TXsJLpQ/default.jpg","False","False","Some Christmas movies are sweet, others are funny, some are even super weird, but only ONE Christmas movie is all of those things - it's Honest Trailers for ElfWatch the Honest Trailers Commentary to see an inside look from the writer's perspective!https://www.youtube.com/watch?v=wZ7SkXH1ZfEVoiceover Narration by Jon BaileyTitle Design: Robert HoltbyWritten by Spencer Gilbert, Dan Murrell, Joe Starr, Lon HarrisProduced by Spencer Gilbert, Dan Murrell, Joe Starr & Max DionneEdited by Kevin Williamsen and TJ NordakerAssistant Editor: Emin BassavandHonest Trailers - Elf"
"MPQ5EIKtmrY","Kelly Price, Luke James & More Sing Verse For Verse In This Cypher | Soul Train Awards 2018","2018-11-27T00:34:17.000Z","UCcVqCJ_9owb1zM43vqswMNQ","BETNetworks","24","18.16.12","BET,BET Networks,BET Music,Black Entertainment Television,Soul Train Awards,Exclusives,Queen Naija,Erykah Badu,Robert Glasper,BJ The Chicago Kid,Luke James,Thundercat","1153153","32269","591","5101","https://i.ytimg.com/vi/MPQ5EIKtmrY/default.jpg","False","False","Erykah Badu, Kelly Price, BJ The Chicago Kid, Luke James, Queen Naija, Robert Glasper And Thundercat show out in the soul cypher!SUBSCRIBE to #BET NOW! ►► http://bit.ly/1U0v9xG#SoulTrainAwards #BETCypher #KellyPrice #LukeJames #QueenNaijaDownload the BET NOW app for full episodes of your favorite BET shows and exclusive content!Connect with BET Web: http://www.BET.comFacebook: http://www.facebook.com/BETTwitter: http://www.twitter.com/BETInstagram: http://www.instagram.com/BETGoogle+: http://www.bet.us/gplusBET"
"kFKm6x5gS80","Best Quinceañera Ever | Lele Pons","2018-11-27T17:00:09.000Z","UCi9cDo6239RAzPpBZO9y5SA","Lele Pons","23","18.16.12","best quinceaera ever,lele,pons,best,quinceaera,ever,how to avoid taking a test,crazy uber driver,aitana x lele pons telfono remix,How to Avoid Taking a Test | Lele Pons,lelepons,hannahstocking,rudymancuso,inanna,anwar,sarkis,shots,shotsstudios,alesso,anitta,brazil","5331654","137771","10262","9926","https://i.ytimg.com/vi/kFKm6x5gS80/default.jpg","False","False","This video was sponsored by Google. Want to see how to do me time with the Google Assistant? Check out this link: https://youtu.be/1YMzk2v--BIThe Google Assistant is available on Android and iOS phones, Google Home products, and for use with select smart devices.Sequences shortened and simulated. Google Assistant Routines are created by the user and do not immediately exist as presented in this video. Working internet and wifi required. WATCH MORE ▶ https://youtu.be/B6m2bm5MqkESUBSCRIBE HERE ▶ http://www.youtube.com/channel/UCi9cDo6239RAzPpBZO9y5SA?sub_confirmation=1THANKS FOR WATCHING! :) LIKE & SUBSCRIBE FOR MORE VIDEOS!-----------------------------------------------------------FIND ME ON:Instagram | http://instagram.com/leleponsTwitter | http://twitter.com/leleponsFacebook | http://facebook.com/lele CAST: Lele Pons | http://youtube.com/c/leleponsFOLLOW THE SHOTS FAMILY ▶ http://instagram.com/theshotsfamilyShots Studios Channels:Alesso | http://youtube.com/c/alessoAnitta | http://youtube.com/c/anittaAnwar Jibawi | http://youtube.com/c/anwarAwkward Puppets | http://youtube.com/c/awkwardpuppetsDelaney Glazer | http://youtube.com/c/deeglazerHannah Stocking | http://youtube.com/c/hannahstockingLele Pons | http://youtube.com/c/leleponsMarlon Wayans | http://youtube.com/c/marlonwayansRudy Mancuso | http://youtube.com/c/rudymancusoShots Studios | http://youtube.com/c/shotsThe Shots Family | http://youtube.com/c/theshotsfamily#Lele#LelePons"
"ts0Ir2hXXaw","BTS 'EPIPHANY' THE PIANO GUYS (Piano/Cello Cover)","2018-11-27T13:00:08.000Z","UCmKurapML4BF9Bjtj4RbvXw","ThePianoGuys","10","18.16.12","ThePianoGuys,The Piano Guys,Peponi Coldplay Christina Perri,A Thousand Years,One Direction,What makes you beautiful,David Guetta,Secrets,Bruno Mars,Star Wars,Cello Wars,Fight Song,Hello,Adele,Let it Go,Disney,k-pop videos,instrumental songs,classical music,kpop songs,cover song,official audio,new music,love yourself,epiphany bts,epiphany bts piano,epiphany piano,wedding songs,wedding video,wedding songs for walking down the aisle,wedding music","1876995","116432","557","8779","https://i.ytimg.com/vi/ts0Ir2hXXaw/default.jpg","False","False","► Listen to our new album LIMITLESS: http://ThePianoGuys.lnk.to/LimitlessAW►Get Limitless Autographed: http://bit.ly/Limitless_Album► Add this song to your Spotify playlists: https://open.spotify.com/album/4PPZ216h9xlTOsjXPUMlPw► Get all of our albums: https://smarturl.it/TPG_ALBUMS► WE'RE ON TOUR! https://smarturl.it/tpgtour________________________► SUBSCRIBE: https://smarturl.it/TPGsubscribe1► FACEBOOK: https://www.facebook.com/ThePianoGuys► INSTAGRAM: https://www.instagram.com/ThePianoGuys► TWITTER: https://www.twitter.com/ThePianoGuysEvery so often the inspiration for a music project is such that we know exactly what to do and things come together very quickly.  Such was the case with Epiphany. In a time when so many people are battling feelings of self-doubt and worthlessness as they navigate a social media world, the positive message of this BTS song is so important:: I’m the one I should love. Watch BTS (방탄소년단) LOVE YOURSELF 結 Answer 'Epiphany' Comeback Trailer here: https://youtu.be/fIkZOLsnoqYFilmed at https://thefifthfloorutah.comWho are The Piano Guys?Since formally introducing themselves in 2011 on YouTube, The Piano Guys – Steven Sharp Nelson (Cellist/Songwriter), Jon Schmidt (Pianist/Songwriter), Al Van der Beek (Music Producer/Songwriter) and Paul Anderson (Video Producer/Entrepreneur) – unassumingly arrived as a musical phenomenon. Over the course of five studio records, two Christmas releases, and a fan favorite live album, they have impressively tallied 2 billion-plus global streams, clocked upwards of 1.6 billion YouTube views, earned six No. 1 debuts on the Billboard Top Classical Albums Chart, sold out concerts in almost every corner of the world, averaged nearly 2 million monthly listeners on Spotify, and attracted a diehard audience. Not to mention, they’ve appeared in The New York Times, Fast Company, BuzzFeed, Mashable, and People, were featured on CBS Sunday Morning and performed on the TODAY Show, Good Morning America and The Tonight Show. Their latest album, Limitless catapulted to the top of the charts, holding the No. 1 spot on iTunes, Apple Music and Amazon classical charts.  With over 28 million digital streams worldwide, the newest release from The Piano Guys lives up to the name Limitless as the foursome once again leap past boundaries for the 13-track collection.  Limitless features the guys’ take on the latest pop hits – from Shawn Mendes to Ed Sheeran to Coldplay and The Chainsmokers, The Piano Guys continue to break new ground, even exploring the K-Pop world with two BTS covers.  Rounding out the collection are two tracks from the box office hit The Greatest Showman as well as four new original compositions, culminating in a diverse new album with massive multigenerational appeal.   Watch more TPG videos here:A Million Dreams: https://youtu.be/xeQnXe6DLtMJungle Book/Sarabande: https://youtu.be/O3cBZ5X-eGwRewrite The Stars: https://youtu.be/5cINJwaAn4YFight Song / Amazing Grace: https://youtu.be/mOO5qRjVFLwKung Fu Piano - Oogway Ascends: https://youtu.be/NCaH-qqTWpkHello/Lacrimosa: https://youtu.be/WZjFMj7OHTwA Thousand Years - Christina Perri: https://youtu.be/QgaTQ5-XfMMDisney's Let It Go / Vivaldi's Winter: https://youtu.be/6Dakd7EIgBEBeethoven's 5 Secrets - OneRepublic: https://youtu.be/mJ_fkw5j-t0Titanium / Pavane David Guetta / Faure: https://youtu.be/fz4MzJTeL0cWhat Makes You beautiful / One Direction: https://youtu.be/0VqTwnAuHwsPeponi - Coldplay - Paradise: https://youtu.be/Cgovv8jWETMCello Wars - Star Wars: https://youtu.be/BgAlQuqzl8oStory of My Life - One Direction: https://youtu.be/yET4p-r2TI8Arrangement produced & written by Jon SchmidtSteven Sharp Nelson and Al van der Beek.  Piano: Jon Schmidt Cellos: Steven Sharp Nelson vocal textures:Al van der Beek.  Recorded at Big Idea Studios, Draper, UT.  Engineered and mixed  by Jake Bowen. Mastered by Al van der Beek at TPG Studios, UtahFilmed & Produced by Paul Anderson & Shaye ScottEdited by Shaye ScottBehind the Scenes: Kyle Fisher"
"wXlBep9uFjI","Disney's Artemis Fowl - Teaser Trailer","2018-11-27T08:02:16.000Z","UCuaFvcY4MhZY3U43mMt1dYQ","Walt Disney Studios","1","18.16.12","Disney,Artemis Fowl,Book,Eoin Colfer,Ferdia Shaw,Lara McDonnell,Tamara Smart,Nonzo Anozie,Josh Gad,Judi Dench","4234932","56742","15414","15483","https://i.ytimg.com/vi/wXlBep9uFjI/default.jpg","False","False","Disney’s ARTEMIS FOWL releases in U.S. theaters on August 9, 2019!Directed by Kenneth Branagh and based on the beloved book by Eoin Colfer, ARTEMIS FOWL follows 12-year-old genius Artemis Fowl, a descendant of a long line of criminal masterminds, as he finds himself in a battle of strength and cunning against a powerful, hidden race of fairies who may be behind his father’s disappearance. The film stars Ferdia Shaw, Lara McDonnell, Tamara Smart, Nonzo Anozie, with Josh Gad, and Judi Dench. Judy Hofflund and Kenneth Branagh are producing with Angus More Gordon and Matthew Jenkins serving as executive  producers. The screenplay is by Conor McPherson.             Follow On Social: https://www.facebook.com/ArtemisFowlhttps://www.twitter.com/ArtemisFowl https://www.instagram.com/ArtemisFowl"
