video_id,title,publishedAt,channelId,channelTitle,categoryId,trending_date,tags,view_count,likes,dislikes,comment_count,thumbnail_link,comments_disabled,ratings_disabled,description
"MJnySSg9OVk","CRAZY SNOW DARES!","2018-11-17T01:54:14.000Z","UCC3OGYxHwV8pB5yLobw9KdA","Dobre Brothers","22","18.10.12","Dobre Brothers,The Dobre Brothers,Lucas and Marcus,Dobre Twins,Marcus and Lucas,Cyrus Dobre,Darius Dobre,Dobre Brothers YouTube,Lucas and Marcus pranks,Dobre brothers gymnastics,Dobre brothers pranks,Pranks,Gymnastics,Dance,Challenges,Music,Rap,Grocery Store,Cars,Reactions,Makeup,Make-up,Games,Food,Family,Collabs,dolan twins,the ace family,james charles","1915404","36389","2366","5382","https://i.ytimg.com/vi/MJnySSg9OVk/default.jpg","False","False","IT SNOWED 🙌🔥SUBSCRIBE TO CYRUS AND CHRISTINA'S CHANNEL! http://bit.ly/2Lf25EMWE’RE GOING ON A 20 CITY TOUR! ➡ https://bitly.com/DobreTourTURN ON OUR POST NOTIFICATIONS!SUBSCRIBE!! https://www.youtube.com/channel/UCC3OGYxHwV8pB5yLobw9KdAFOLLOW US! Dobre BrothersInstagram - http://instagram.com/dobrebrothersCyrusInstagram - @CyrusdobreTwitter - @CyrusdobreMusical.ly - @CyrusdobreDariusInstagram - @DariusdobreTwitter - @DariusdobreMusical.ly - @DariusdobreLucas Instagram - @lucas_dobreTwitter - @DobrelucasMusical.ly @dobretwinsMarcusInstagram - @MarcusdobreTwitter - @DobremarcusMusical.ly - @dobretwinsBIZ - dobrebrothersmgmt@gmail.comTHANKS FOR WATCHING! :)CRAZY SNOW DARES!https://www.youtube.com/channel/UCC3OGYxHwV8pB5yLobw9KdA"
"sZ7Jlq9mQrY","Lamborghini Aventador vs Tesla Model X - DRAG & ROLLING RACE - Can an EV SUV beat a supercar?","2018-11-17T09:00:08.000Z","UCUhFaUpnq31m6TNX2VKVSVA","carwow","2","18.10.12","carwow,mat watson,4k review,lambo,lamborghini aventador,aventador,aventador s,tesla,tesla model x,model x,model x p100d,p100d,electric car,super car,drag race","3717234","54777","3058","6607","https://i.ytimg.com/vi/sZ7Jlq9mQrY/default.jpg","False","False","It’s petrol vs electric for our latest drag race! The Model X P100D has left all other competitors in its wake when it’s taken part in previous drag races, but how will it fare when it goes up against a 740hp Aventador S? There’s only one way to find out… Let’s race! Follow Yiannimize - http://youtube.com/YiannimizeInstagram – http://www.instagram.com/carwowcarsFacebook – http://www.facebook.com/carwowuk/Twitter – http://www.twitter.com/carwowukRefer A Friend – https://www.carwow.co.uk/shareAwkward haggling is a thing of the past with carwow. Choose your perfect car with our configurator tool and let the country’s best dealers compete over you. Compare the five best offers by price, location and dealer ratings and choose the one that’s right for you – no hassle, no haggling, just a great deal. Visit our site to save money on your new car – http://bit.ly/carwow-UK Oder auch in Deutschland Geld beim Autokauf sparen – http://bit.ly/carwow-DE"
"VI4DLrx4Rgw","MAX & Ty Dolla $ign - The Other Side (Official Lyric Video)","2018-11-16T05:00:02.000Z","UCe4LM_eKc9ywRmVuBm5pjQg","Atlantic Records","10","18.10.12","The Greatest Showman,Greatest Showman,Atlantic Records,Atlantic,Rewrite The Stars,This Is Me,A Million Dreams,P!nk A Million Dreams,A Million Dreams P!nk,Pink A Million Dreams,A Million Dreams Pink,Lyric Video,Greatest Showman Lyrics,Greatest Showman Soundtrack,V1weVGUmNTA,Official Lyric Video,The Greatest Showman Lyrics,MAX,ty dolla sign,the other side lyrics the greatest showman,the other side lyrics,max the other side,ty dolla sign the other side","1335110","36256","460","1396","https://i.ytimg.com/vi/VI4DLrx4Rgw/default.jpg","False","False","The official lyric video of The Other Side by MAX and Ty Dolla $ign from the album 'The Greatest Showman: Reimagined'.The Greatest Showman: Reimagined available now: https://Atlantic.lnk.to/TGS_ReimaginedID Subscribe for more official content from Atlantic Records:https://Atlantic.lnk.to/subscribeFollow The Greatest Showmanhttps://twitter.com/GreatestShowmanhttps://facebook.com/GreatestShowmanhttps://instagram.com/greatestshowmanFollow Atlantic Recordshttps://facebook.com/atlanticrecordshttps://instagram.com/atlanticrecordshttps://twitter.com/AtlanticRecordshttp://atlanticrecords.com The official Atlantic Records YouTube Channel is home to the hottest in hip-hop, rock, pop, R&B, indie, musicals and soundtracks. With over 70 years of global recorded music history, Atlantic Records’ legacy and passion for artistry continues with Top 40 hitmakers like Wiz Khalifa, Sean Paul, Trey Songz, Bruno Mars, Charlie Puth, Janelle Monáe, and B.o.B. Atlantic Records prides itself for working on Motion Picture Soundtracks, such as “The Greatest Showman”, “Suicide Squad” and “The Fate of the Furious.” As well as Musical Soundtracks including “Dear Evan Hansen,” and Grammy and Tony Award Winning “Hamilton”. It is home to world-renowned record labels representing music from every genre, including Asylum, Big Beat, Canvasback, Elektra, Fueled By Ramen, Rhino, Roadrunner, and Sire. Subscribe for the latest official music videos, official audio videos, performances, bts and more from our artists and projects.https://Atlantic.lnk.to/subscribe#TheGreatestShowman #MAX #TyDollaSign #TheOtherSide #LyricVideo #AtlanticRecords #Atlantic #TGSReimagined"
"oljw-gQY3D8","3 True Scary Horror Stories","2018-11-16T23:49:19.000Z","UCnM02drQP-dF7WMgtJHR4Xw","Mr. Nightmare","24","18.10.12","true scary stories,true stories,scary stories,true scary,creepy stories,mr. nightmare,mrnightmare,mr nightmare,nightmare,shocking,disturbing,creepy,horror,horror stories,true horror stories,real creepy stories,real scary stories,scary real horror stories,scary real stories,true horror","1326606","47634","798","8952","https://i.ytimg.com/vi/oljw-gQY3D8/default.jpg","False","False","Here are 3 random horror stories with no theme, all sent by subscribers.Story 1 : Nicole ElardoStory 2 : S. MartinaStory 3 : AnonymousInsta: https://www.instagram.com/realmrnightmare/Twitter: https://twitter.com/mista_nightmare?l...If you want to send a personal TRUE story of yours, please send it through email: mrnightmareinbox@gmail.comAnything with poorly structured sentences and grammar will not be read, so please just make them neat and understandable. Please also state how you would like your name to be credited in a video."
"u0q2bIUX_kc","BOWLING BALL Vs. ONE MILE of CLING WRAP from 45m!","2018-11-16T21:58:28.000Z","UC5f5IV0Bf79YLp_p9nfInRA","How Ridiculous","17","18.10.12","how ridiculous,magnus effect,oobleck,rc cars,how ridiculous rc car,bowling ball vs trampoline,bowling ball,giant dart,trampoline,bowling ball vs oobleck,anvil vs car,how ridiculous giant dart,basketball,how ridiculous darts,basketball connect 4,bowling,anvil vs fridge,44 club,anvil,anvil vs,cling wrap,gladwrap,layers","2520359","130102","2181","11842","https://i.ytimg.com/vi/u0q2bIUX_kc/default.jpg","False","False","We got over a mile of cling wrap to find out if it can stop a bowling ball from the top of the tower!SUBSCRIBE ➤ http://bit.ly/SubHowRidiculousBUY NEW MERCH ➤ http://tidd.ly/8b33c00bSOCIALSInstagram ➤ (@HowRidiculous): http://bit.ly/FollowHRonInstaFacebook ➤ http://bit.ly/HRFaceyTwitter     ➤ (@howridiculous): http://bit.ly/HRTweetyWhat's the 44 Club you may ask? Well it all started in the outro of this video https://www.youtube.com/watch?v=AyLPMhp7qbs where we wondered if anyone was still watching the video at that point, and to comment 44 (Scott's fave number) if they were. Brett then said 44 Club get on board and the rest is history. The 44Club is the official How Ridiculous fan club made up of people who love our videos and watch them right to the very end. We've even got 44 Club merch now! So yeh, that's the story. Pretty random but good fun at the same time.We are passionate about seeing children released from poverty and we would love you to consider sponsoring a child with Compassion. We visited our sponsor children in the Philippines and were blown away by the difference that child sponsorship can make. To find out more about sponsoring a child right now, check out: http://cmpsn.co/howridiculousA big thanks to the awesome crew at the Gravity Discovery Centre in Gingin for letting us use their 45m leaning tower for our own experiments. If you wanna head out there and check it out, it's not far from Perth. Western Australia: https://gravitycentre.com.au/leaning-tower/Music by Chillhop: https://chillhop.lnk.to/listenCSBonus Points - Pizza and Video Games (https://soundcloud.com/bonuspoints)Jeff Kaale - Mai Tai (https://soundcloud.com/jeff-kaale)Joakim Karud - Canals (https://soundcloud.com/joakimkarud)For fan mail or other items please send to: How Ridiculous PO Box 7045Karawara WA 6152 AustraliaFor Business or Media Inquiries: management@howridiculous.orgFor Licensing Inquiries: licenses@howridiculous.orgFor online use, you may embed this YouTube video - for usage in other players please contact us for permission.© Copyright 2018 How Ridiculous"
"mNbSgMEZ_Tw","John Lewis & Partners Christmas Ad 2018  - #EltonJohnLewis 🎹","2018-11-15T07:42:54.000Z","UCa1yUHQmV6Z0PpAUtfgNd9g","John Lewis & Partners","1","18.10.12","john lewis,john lewis & partners,christmas advert,elton john,sir elton john,christmas,advert,waitrose","11895345","114227","10063","11540","https://i.ytimg.com/vi/mNbSgMEZ_Tw/default.jpg","False","False","Watch the new John Lewis & Partners Christmas TV advert, The Boy and The Piano.This year’s story is about the power of a gift. And how that gift inspired, changed and influenced the course of a little boy’s life. That little boy just happens to be Elton John. The film begins in present day and works backwards chronologically through Elton’s life right until the moment on Christmas morning when he received the special gift that changed his life.Subscribe to this channel for regular video updates https://jland.partners/2OQbQuc If you want to hear more from John Lewis & Partners:Like John Lewis & Partners  on Facebook http://www.facebook.com/johnlewisandpartnersFollow John Lewis & Partners on Twitter http://twitter.com/jlandpartnersFollow John Lewis & Partners on Instagram http://instagram.com/johnlewisandpartners"
"7w4Udbys4O4","Sabrina Carpenter - Sue Me","2018-11-16T17:28:33.000Z","UC4mYKePIas5YgGfYZ2J2OxQ","SabrinaCarpenterVEVO","10","18.10.12","sabrina carpenter,sabrina carpenter singular,singular act i,singular act 1,new sabrina carpenter,sue me,sabrina carpenter music","7826339","315177","6686","16816","https://i.ytimg.com/vi/7w4Udbys4O4/default.jpg","False","False","#SingularAct1 is available now! http://hollywoodrecs.co/SingularAct1Follow Sabrina Carpenter:Instagram: http://instagram.com/sabrinacarpenterTwitter: http://twitter.com/sabrinaannlynnFacebook: http://facebook.com/sabrinacarpenterSnapchat: @sabscarpenterMusic video by Sabrina Carpenter performing Sue Me. © 2018 Hollywood Records, Inc.http://vevo.ly/TN1bal"
"P_iNacbYTVM","ATV Basketball Game!!","2018-11-16T21:16:24.000Z","UCaRH3rDr3K3CEfhVqu5mgUQ","Team Edge","23","18.10.12","basketball challenge,team edge,team edge challenge,teamedge,challenges,competition,giant games,battle,ATV basketball game,diy games,basketball game,diy basketball,basketball,best basketball,razor electric atv,atv sports","1041560","18777","353","3158","https://i.ytimg.com/vi/P_iNacbYTVM/default.jpg","False","False","Team Edge Merchandise! ➡ https://teamedge.store/collections/best-sellersSUPER-Sized Punishment Cup Pong!! ➡ https://www.youtube.com/watch?v=-081BfYFOCcSubscribe to Team Edge Vlogs ➡ https://www.youtube.com/channel/UCaRgPWIc0uo_kHxtgE2rcgg🔽MORE LINKS BELOW 🔽Hey guys! What did you think of our idea to play basketball on ATVs? Who do you think was the best basketball player? Let us know down below! Go check out Funky Fresh Basketball Challenge!!: https://youtu.be/gWvyR4gZoSoSubscribe To Team Edge! ➡ https://www.youtube.com/channel/UCaRH3rDr3K3CEfhVqu5mgUQMore Team Edge Challenge Videos! Season 1 Challenges! ➡ https://www.youtube.com/playlist?list=PLdU_QLI5aP--e4DyT2Cler5W1PpKLWwQ_Season 2 Challenges! ➡ https://www.youtube.com/playlist?list=PLdU_QLI5aP--2XBT-sdKQtkQjyHT3TxgtThe Edge Games San Diego 2016 ➡ https://www.youtube.com/playlist?list=PLdU_QLI5aP--58zK687Fn4_3-MObiefJNMatthias ➡ https://www.youtube.com/user/matthiasiam?sub_confirmation=1J-Fred ➡ https://www.youtube.com/user/mrjollywhitegiantBryan ➡ https://www.youtube.com/playlist?list=PLZPssQhdLX_8JS7ohhNNrkrBpTdgJHB1B&disable_polymer=trueOn this channel, you'll see a bunch of family friendly, kid friendly fun challenges, board games, toys, bottle flipping, giant sports, gross food tasting, messy challenges, nerf challenges, and more!Mail Box:24307 Magic Mtn Pkwy #211Valencia, CA 91355Twitter ➡ https://goo.gl/rbKKmGInstagram  ➡ https://instagram.com/itsteamedge/Challenges ➡ Tuesday - Friday"
"ajN57m_OSpY","Ellie Goulding, Diplo, Swae Lee - Close To Me (Official Video)","2018-11-14T15:00:01.000Z","UCvu362oukLMN1miydXcLxGg","EllieGouldingVEVO","10","18.10.12","Ellie,Goulding,Diplo,Swae,Lee,Close,To,Me,Polydor,Records,Pop","26249167","279813","12883","7647","https://i.ytimg.com/vi/ajN57m_OSpY/default.jpg","False","False","LISTEN: https://ellie.lnk.to/CloseToMeID Location: Budapest, HungaryMore Ellie:http://www.elliegoulding.comhttp://www.instagram.com/elliegouldinghttp://www.facebook.com/elliegouldinghttp://www.twitter.com/elliegouldingSign up to the official Ellie Goulding mailing list: https://ellie.lnk.to/signup"
"OSye8OO5TkM","Hozier - Movement (Official Video)","2018-11-14T16:58:26.000Z","UCdOcBpu5O2V0JhFFs9k-Ouw","HozierVEVO","10","18.10.12","Hozier,Movement,Universal-Island,Records,Ltd.,Alternative","6181727","144496","2344","4429","https://i.ytimg.com/vi/OSye8OO5TkM/default.jpg","False","False","Listen to 'Movement' here: https://Hozier.lnk.to/MovementIN Follow Hozier  :  https://Hozier.lnk.to/FollowID  Hozier Store : https://Hozier.lnk.to/StoreIDMusic: HozierStarring: Sergei PoluninDirectors: UsProduction Comp: Academy FilmsProducer: Tabetha Glass-JackmanExecutive Producer: Leah JoyceExecutive Producer: Sheira Rees-DaviesDOP: Sebastian Wintero Choreographer: Sergei Polunin Edit House: TrimEditor: Vid PricePost Production: The MillVFX Supervisor: James Mac2D artist: Amit KambliColourist: James BamfordWith thanks to PanavisionMusic video by Hozier performing Movement. © 2018 Rubyworks Limited, under assignment to Universal Music Operations Limitedhttp://vevo.ly/5FWxxS"
"WL21pwS05g4","Gordon Ramsay Appalled By 'English Style Fish & Chips | Kitchen Nightmares","2018-11-14T17:00:03.000Z","UCUZzyuAlhHNP3oiuMjn7RfQ","Kitchen Nightmares","24","18.10.12","Gordon Ramsay kitchen nightmares,Gordon Ramsay best insults,kitchen nightmares full episodes,kitchen nightmares online,kitchen nightmares watch online,kitchen nightmares HD,kitchen nightmares best moments,Gordon Ramsay,Kitchen Nightmares,gordon ramsay kitchen nightmares full episodes,gordon ramsay kitchen nightmares best moments,gordon ramsay fish and chips,kitchen nightmares fish and chips,kitchen nightmares cafe hon full episode","3145313","25728","645","3415","https://i.ytimg.com/vi/WL21pwS05g4/default.jpg","False","False","Bawlmer? Bawlmer. Bawlmer? Bawlmer. Bawlmer? Bawlmer.If you liked this clip check out the rest of Gordon's channels:http://www.youtube.com/gordonramsayhttp://www.youtube.com/thefwordhttp://www.youtube.com/kitchennightmaresMore Gordon Ramsay:Website: http://www.gordonramsay.comFacebook: http://www.facebook.com/GordonRamsay01Twitter: http://www.twitter.com/GordonRamsay"
"u1cdJA6jxtA","DUMPLIN' Official Trailer (2018) Jennifer Aniston, Netflix Movie HD","2018-11-14T15:10:06.000Z","UCzcRQ3vRNr6fJ1A9rqFn7QA","ONE Media","1","18.10.12","Cinema,Trailer,Official,Movie,Film,Dumplin',Dumplin,Jennifer Aniston,Netflix,2018","2203565","30841","1197","1126","https://i.ytimg.com/vi/u1cdJA6jxtA/default.jpg","False","False","DUMPLIN Official Trailer (2018) Jennifer Aniston, Netflix Movie HD© 2018 - NetflixComedy, Kids, Family and Animated Film, Blockbuster,  Action Cinema, Blockbuster, Scifi Movie or Fantasy film, Drama...   We keep you in the know! Subscribe now to catch the best movie trailers 2017 and the latest official movie trailer, film clip, scene, review, interview."
"i4OJL69hld4","Michelle Obama says her brother is still their mother's favorite","2018-11-13T16:38:17.000Z","UCH1oRy1dINbMVp3UFWrKP0w","Good Morning America","24","18.10.12","GMA,Good Morning America,Michelle Obama,First Lady,Chicago,Becoming,Craig Robinson,Memoir,books,basketball,coach,New York Knicks,politics,gma,abc news,Michelle Obama brother,Michelle Obama book tour,2018,today,now,family,Michelle Obama mom,mother,Robin Roberts,ABC,Becoming Michelle","2494019","35512","3111","7472","https://i.ytimg.com/vi/i4OJL69hld4/default.jpg","False","False","Obama and her brother, Craig Robinson, reflect on growing up on Chicago's South Side, plus the former first lady shares how her daughters have gotten guidance from the Bush sisters."
"1roy4o4tqQM","POKÉMON Detective Pikachu - Official Trailer #1","2018-11-12T17:00:00.000Z","UCjmJDM5pRKbUlVIzDYYWb6g","Warner Bros. Pictures","24","18.10.12","POKÉMON Detective Pikachu,Pikachu,POKÉMON,Detective Pikachu,Rob Letterman,ryan reynolds,harry goodman,justice smith,kathryn newton,ken watanabe,TOHO,Legendary,Warner Bros.,Warner Bros. Pictures,WB","52015789","1377556","65605","176062","https://i.ytimg.com/vi/1roy4o4tqQM/default.jpg","False","False","POKÉMON Detective Pikachu - In Theaters May 10, 2019http://www.detectivepikachumovie.com/https://www.facebook.com/detectivepikachumovie/https://twitter.com/DetPikachuMovie https://www.instagram.com/detectivepikachumovie/The world of Pokémon comes to life!The first-ever live-action Pokémon movie, “POKÉMON Detective Pikachu” stars Ryan Reynolds as the titular character in the first-ever live-action movie based on the iconic face of the global Pokémon brand—one of the world’s most popular, multi-generation entertainment properties and most successful media franchises of all time.Fans everywhere can now experience Pikachu on the big screen as never before, as a talking detective Pikachu, a Pokémon like no other. The film also showcases a wide array of beloved Pokémon characters, each with its own unique abilities and personality.The story begins when ace private eye Harry Goodman goes mysteriously missing, prompting his 21-year-old son Tim to find out what happened. Aiding in the investigation is Harry’s former Pokémon partner, Detective Pikachu: a hilariously wise-cracking, adorable super-sleuth who is a puzzlement even to himself. Finding that they are uniquely equipped to communicate with one another, Tim and Pikachu join forces on a thrilling adventure to unravel the tangled mystery. Chasing clues together through the neon-lit streets of Ryme City—a sprawling, modern metropolis where humans and Pokémon live side by side in a hyper-realistic live-action world—they encounter a diverse cast of Pokémon characters and uncover a shocking plot that could destroy this peaceful co-existence and threaten the whole Pokémon universe.“POKÉMON Detective Pikachu” also stars Justice Smith (“Jurassic World: Fallen Kingdom”) as Tim; Kathryn Newton (“Lady Bird,” TV’s “Big Little Lies”) as Lucy, a junior reporter following her first big story; and Oscar nominee Ken Watanabe (“Godzilla,” “The Last Samurai”) as Lt. Yoshida.Directed by Rob Letterman (“Goosebumps,” “Monsters Vs. Aliens”), the “POKÉMON Detective Pikachu” creative filmmaking team includes two-time Oscar nominated director of photography John Mathieson (“The Phantom of the Opera,” “Gladiator”), production designer Nigel Phelps (“Pirates of the Caribbean: Dead Men Tell No Lies”) and Oscar-winning editor Mark Sanger (“Gravity”). Visual effects are by Moving Picture Company (“Wonder Woman”) and Framestore (“Guardians of the Galaxy Vol. 2”).Launched in 1996 to overwhelming response, the Pokémon brand is a global sensation that now encompasses a robust video gaming fandom with over 300 million units sold worldwide; the Pokémon Trading Card Game available in 11 languages with more than 23.6 billion cards shipped; an animated television series in its 21st season that is available in more than 160 countries; and over 20 animated films; as well as books, manga comics, music, toys, merchandise, and apps, including the wildly popular Pokémon GO, that has been downloaded over 850 million times and is enjoyed across the globe by fans of all ages.“POKÉMON Detective Pikachu” is set for release on Friday, May 10, 2019.The film will be distributed outside of Japan and China by Warner Bros. Pictures, in Japan by Toho Company, Ltd. and by Legendary East in China."
"kQDZO2vApC0","DUMBEST TEST ANSWERS","2018-11-13T20:00:04.000Z","UCv-GNHtqM97EaU_i7gN_Ikw","Chunkz","24","18.10.12","Chunkz Entertainment,comedy,family friendly,Funny Challenges Fun,facts,rebecca zamolo,10 funniest test answers,funniest kid test answers,top 10,funniest test answers from kids,hilarious test answers,try not to laugh or grin,funny kids,family,kid friendly,fact,learn,learning,funny,funniest,hilarious,entertainment,for kids,rebecca zamolo youtube,fun,dumb test answers,filly,chunkz filly","427932","36167","658","1965","https://i.ytimg.com/vi/kQDZO2vApC0/default.jpg","False","False","DUMBEST TEST ANSWERS! FUNNIEST KID TEST ANSWERS!Subscribe: https://bit.ly/2PGvXfx | 🔔Make sure to enable ALL push notifications!🔔Watch the NEWEST videos: bit.ly/2PzaVSYFilly -https://www.youtube.com/channel/UCq3xWfTdDRjgyd7_WOK94FgFollow Chunkz :Instagram: https://instagram.com/chunkz_en/Twitter: https://twitter.com/Chunkz_ENSnapChat: https://snapchat.com/add/SpiceggWatch more Chunkz :1V1 RAP BATTLE: bit.ly/2RY6Ar1COOKING WITH CHUNKZ: bit.ly/2pWEXlc2V2 RAP BATTLE: bit.;y/ 2RYtyOHLatest Videos: bit.ly/2PzaVSYPopular Videos: bit.ly/2yGdppi"
"BOC8sq5EAzk","Honest Trailers - The Meg","2018-11-13T18:00:00.000Z","UCOpcACMWblDls9Z6GERVi1A","Screen Junkies","1","18.10.12","screenjunkies,screen junkies,honest trailers,honest trailer,honest trailers the meg,the meg,shark movie,honet trailers for the meg,jason statham,jason statham movies,honets trailers the shark movie,shark movies,shark movies 2018,the meg movie,the meg review,the meg spoilers","1912351","38175","836","4431","https://i.ytimg.com/vi/BOC8sq5EAzk/default.jpg","False","False","The shark movie that tows the line between good good and bad good and just bad bad - it' Honest Trailers for The Meg!Watch the Honest Trailers Commentary to see an inside look from the writer's perspective!https://www.youtube.com/watch?v=joeU-41peAsVoiceover Narration by Jon BaileyTitle Design: Robert HoltbyWritten by Spencer Gilbert, Dan Murrell, Joe Starr, Lon HarrisProduced by Spencer Gilbert, Dan Murrell, Joe Starr & Max DionneEdited by Kevin Williamsen and TJ NordakerAssistant Editor: Emin BassavandHonest Trailers - The Meg"
"LDXYRzerjzU","Toy Story 4 | Official Teaser Trailer","2018-11-12T13:00:03.000Z","UC_IRYSp4auq7hKLvziWVH6w","Disney•Pixar","1","18.10.12","Pixar,Disney,Disney Pixar,Pixar Movie,Animation,Toy Story,Toy Story 4,Buzz,Woody,Sequel,Forky,Tony Hale,Animated,Funny,Clouds,Song,Trailer,Teaser,HD,Official","13999993","245135","11379","34821","https://i.ytimg.com/vi/LDXYRzerjzU/default.jpg","False","False","See Toy Story 4 in theatres Summer 2019!Woody has always been confident about his place in the world and that his priority is taking care of his kid, whether that’s Andy or Bonnie. But when Bonnie adds a reluctant new toy called “Forky” to her room, a road trip adventure alongside old and new friends will show Woody how big the world can be for a toy. Directed by Josh Cooley (“Riley’s First Date?”) and produced by Jonas Rivera (“Inside Out,” “Up”) and Mark Nielsen (associate producer “Inside Out”), Disney•Pixar’s “Toy Story 4” ventures to U.S. theaters on June 21, 2019. Facebook: https://www.facebook.com/PixarToyStory/Twitter: https://twitter.com/toystoryInstagram: https://www.instagram.com/ToyStory/ Copyright: (C) Disney•Pixar"
