video_id,title,publishedAt,channelId,channelTitle,categoryId,trending_date,tags,view_count,likes,dislikes,comment_count,thumbnail_link,comments_disabled,ratings_disabled,description
"3zjD5qtkObE","Hugh Jackman Remembers Stan Lee: 'A Creative Genius'","2018-11-13T08:35:00.000Z","UCMtFAi84ehTSYSE9XoHefig","The Late Show with Stephen Colbert","24","18.17.11","The Late Show,Late Show,Stephen Colbert,Steven Colbert,Colbert,celebrity,celeb,celebrities,late night,talk show,comedian,comedy,CBS,joke,jokes,funny,funny video,funny videos,humor,hollywood,famous","1756756","26865","665","2120","https://i.ytimg.com/vi/3zjD5qtkObE/default.jpg","False","False","'The Front Runner' star Hugh Jackman remembers thinking his portrayal of Wolverine would make him the center of attention on the red carpet at Comic Con. That was until the paparazzi abandoned him for Stan Lee.Subscribe To The Late Show Channel HERE: http://bit.ly/ColbertYouTubeFor more content from The Late Show with Stephen Colbert, click HERE: http://bit.ly/1AKISnRWatch full episodes of The Late Show HERE: http://bit.ly/1Puei40Like The Late Show on Facebook HERE: http://on.fb.me/1df139YFollow The Late Show on Twitter HERE: http://bit.ly/1dMzZzGFollow The Late Show on Google+ HERE: http://bit.ly/1JlGgzwFollow The Late Show on Instagram HERE: http://bit.ly/29wfREjFollow The Late Show on Tumblr HERE: http://bit.ly/29DVvtRWatch The Late Show with Stephen Colbert weeknights at 11:35 PM ET/10:35 PM CT. Only on CBS.Get the CBS app for iPhone & iPad! Click HERE: http://bit.ly/12rLxgeGet new episodes of shows you love across devices the next day, stream live TV, and watch full seasons of CBS fan favorites anytime, anywhere with CBS All Access. Try it free! http://bit.ly/1OQA29B---The Late Show with Stephen Colbert is the premier late night talk show on CBS, airing at 11:35pm EST, streaming online via CBS All Access, and delivered to the International Space Station on a USB drive taped to a weather balloon. Every night, viewers can expect: Comedy, humor, funny moments, witty interviews, celebrities, famous people, movie stars, bits, humorous celebrities doing bits, funny celebs, big group photos of every star from Hollywood, even the reclusive ones, plus also jokes."
"4DB3Ar6wFdc","Spying on GAME MASTER TOP SECRET Meeting! (Details of GM Network Underground Tunnel and Riddles)","2018-11-12T17:36:17.000Z","UCfw8x3VR-ElcaWW2Tg_jgSA","Rebecca Zamolo","24","18.17.11","reacting,top secret,meeting,cave,escaping,game master,spying,laboratory,safe,abandoned,chad wild clay,treasure map,stephen sharer,found,secret,mystery,details,project zorgo,rebecca zamolo,matt and rebecca,fun,family friendly,funny,entertainment,comedy,2018,for kids,kids,family fun,exploring,gm,underground,tunnel,network,game,hidden,pg,kid friendly,iphone","2424919","61948","2557","25906","https://i.ytimg.com/vi/4DB3Ar6wFdc/default.jpg","False","False","Watch - GAME MASTER Take Down PROJECT ZORGO DATE REVEAL! (Underground Tunnel and Secret Cave Control Room) - https://youtu.be/x7PhO7_pB6o▶ Help Rebecca Zamolo and Matt solve Game Master clues! https://bit.ly/2S207vo▶ ZamFam merch is here!  https://rebeccazamolo.comAfter Matt and Rebecca Zamolo Found GAME MASTER Top Secret LABORATORY! (Using Spy Gadgets to Recreate Lie Detector Potion)  and REACTING TO GAME MASTER VS PROJECT ZORGO VIDEO (GM NETWORK ACTIVATED) Rebecca and Matt explore the Master underground tunnel. She used spy gadgets and a hidden camera tracker device to sneak into the top secret laboratory. While inside they found mysterious clues about code 10 and the GM Network on his laptop. Rebecca Zamolo went home and reacted to the Game Master’s new video taking down Project Zorgo and tried to solve the mystery if they are working together. In today’s video Rebecca uses a treasure map inside the tunnel that leads her to an abandoned swimming pool where she finds a key hidden in the water. Matt and Rebecca hide behind a rock to spy on a secret meeting between the GameMaster and Pumpkin Patch along with two other mystery men ninjas. Using spy gadgets we heard mysterious code words then watched them each receive a final mystery note. Matt began secretly chasing Pumpkin Patch while I followed the Game Master into a new hidden cave. I believe if we can uncover PP’s disguise and do a face reveal he can help us solve this puzzle and keep us safe. Thanks so much for watching my pg family friendly videos in 2018!Watch My Awesome Friends and other fun YouTube Videos:Stephen Sharer | GAME MASTER Tells Grace Sharer Top Secret Mystery Clues & Escape Room Details https://youtu.be/Ks2mQgE7kNkChad Wild Clay | Spying on Project Zorgo Secret Meeting (ed Mysterious Evidence Exploring Secret Treasure) https://youtu.be/Et4gIU53ajUMatt and Rebecca | Found New Mysterious Safe above our House! (Clues & Game Master Plans into Underground Tunnel) https://youtu.be/sYGGmwhhkvUVy Qwaint | Stop Project Zorgo from Framing CWC and Stephen Sharer (Escape Room Challenge Mystery Riddles) https://youtu.be/rxsM7GGR4YMWATCH MY OTHER FUN VIDEOS!24 hour challenges: https://goo.gl/ADsrGtSummer Fun Videos: goo.gl/CJfmQ4Marriage Mondays: https://goo.gl/7WAZrcFollow Rebecca Zamolo:Instagram: https://instagram.com/rebeccazamolo/Twitter: https://twitter.com/rebeccazamoloMusical.ly/ Tik Tok: RebeccaZamoloSnapChat: rebeccazamoloFacebook: https://www.facebook.com/rebecca.zamoloSEND FAN MAIL TO REBECCA!12021 Wilshire Blvd number 714Los Angeles, Ca 90025#gamemaster #exploringabandoned"
"BOC8sq5EAzk","Honest Trailers - The Meg","2018-11-13T18:00:00.000Z","UCOpcACMWblDls9Z6GERVi1A","Screen Junkies","1","18.17.11","screenjunkies,screen junkies,honest trailers,honest trailer,honest trailers the meg,the meg,shark movie,honet trailers for the meg,jason statham,jason statham movies,honets trailers the shark movie,shark movies,shark movies 2018,the meg movie,the meg review,the meg spoilers","1596813","35201","712","3854","https://i.ytimg.com/vi/BOC8sq5EAzk/default.jpg","False","False","The shark movie that tows the line between good good and bad good and just bad bad - it' Honest Trailers for The Meg!Watch the Honest Trailers Commentary to see an inside look from the writer's perspective!https://www.youtube.com/watch?v=joeU-41peAsVoiceover Narration by Jon BaileyTitle Design: Robert HoltbyWritten by Spencer Gilbert, Dan Murrell, Joe Starr, Lon HarrisProduced by Spencer Gilbert, Dan Murrell, Joe Starr & Max DionneEdited by Kevin Williamsen and TJ NordakerAssistant Editor: Emin BassavandHonest Trailers - The Meg"
"hpxr1BVUWTU","Happy birthday grandpa! Charles is pictured with his dynasty to mark his 70th birthday","2018-11-14T01:44:41.000Z","UCoFqfg9kfKKi_mzjAhqDDZw","The Tig","25","18.17.11","Prince Charles,pictured,dynasty,birthday,Duchess of Sussex,Duchess of Cambridge,Prince George,Prince Louis,Princess Charlotte,Prince Harry,Prince William","134259","1000","193","462","https://i.ytimg.com/vi/hpxr1BVUWTU/default.jpg","False","False","Palace shared a brand new series of photos of the royal family — smiling and laughing in the garden of Clarence House, where Prince Charles and Camilla, Duchess of Cornwall, live.Photographed by Chris Jackson, the pics show the Prince of Wales and his wife sitting outside on a wooden bench next to their grandchildren, Prince George and Princess Charlotte. Behind them stands Prince Harry and Meghan Markle, as well as Prince William and Kate Middleton, who cradles their 6-month-old son, Prince Louis."
"itCItPwyyYE","Chord Overstreet - Hold On (Lyrics)","2018-11-13T15:42:41.000Z","UC0aXGG4J16PmxgZo10Nzk6A","Gold Coast Music","10","18.17.11","emotional songs,chord overstreet,hold on,lyrics,lyric video,chord overstreet lyrics,hold on lyrics,chord overstreet hold on,chord overstreet hold on lyrics,chord overstreet hold on lyric video,chord overstreet - hold on,chord overstreet - hold on lyrics,chord overstreet - hold on lyric video,indie pop,chill out,relaxing songs,bedroom pop,alternative,electronic pop,indie acoustic","459281","3775","69","121","https://i.ytimg.com/vi/itCItPwyyYE/default.jpg","False","False","Stream Chord Overstreet - Hold On (Lyrics)https://open.spotify.com/artist/1IrKUHz5tIrGTFXcjmj46xChord Overstreet • Social NetworksInstagram: http://instagram.com/chordoverstreetTwitter: http://twitter.com/chordoverstreetFacebook: https://facebook.com/chordoverstreetTags :#ChordOverstreet #Lyrics #LyricVideo #Pop #Indie #Alternate #ChillOut #IndieElectronic #RelaxingMusic #IndiePop #Audio Gold Coast Music • Social Networks ► https://open.spotify.com/user/ite89asz7if3eic9jbx6pqvhr► http://twitter.com/iamgoldcoast► https://instagram.com/goldcoastog► https://soundcloud.com/gold-coastmusic.........• Lyricsloving and fightingaccusing, denyingi can't imagine a world with you gonethe joy and the chaos, the demons we're made ofi'd be so lost if you left me aloneyou locked yourself in the bathroomlying on the floor when i break throughi pull you in to feel your heartbeatcan you hear me screaming, please don't leave me!hold on, i still want youcome back, i still need youlet me take your hand, i'll make it righti swear to love you all my lifehold on, i still need youlong endless highway, you're silent beside medriving a nightmare i can't escape fromhelplessly praying, the light isn't fadinghiding the shock and the chill in my bonesthey took you away on a tablei pace back and forth as you lay stillthey pull you in to feel your heartbeatcan you hear me screaming, please don't leave me!hold on, i still want youcome back, i still need youlet me take your hand, i'll make it righti swear to love you all my lifehold on, i still need youi don't wanna let goi know i'm not that strongi just wanna hear yousaying baby, let's go homelet's go homeyeah i just wanna take you homehold on, i still want youcome back, i still need you"
"D9vLQdb8Kcw","How Fantastic Beasts and Where To Find Them Should Have Ended","2018-11-13T17:00:32.000Z","UCHCph-_jLba_9atyCZJPLQQ","How It Should Have Ended","1","18.17.11","Fantastic Beasts,and where to find them,The Crimes of Grindelwald,HISHE,How Fantastic Beasts Should Have Ended,how it should have ended,comedy,animated,parody,cartoon,entertainment,wizard,harry potter,Johnny Depp,Eddie Redmayne,funny","1083318","47168","758","2036","https://i.ytimg.com/vi/D9vLQdb8Kcw/default.jpg","False","False","How Fantastic Beasts and Where to Find Them Should Have EndedWatch More HISHEs: https://bit.ly/HISHEPlaylistSubscribe to HISHE: https://bit.ly/HISHEsubscribeFOLLOW HISHE!Twitter @theHISHEdotcomhttp://bit.ly/HISHETwitterInstagram @HISHEgramhttps://instagram.com/hishegram/Facebook: http://bit.ly/HISHE-FBHISHE Swag:http://www.dftba.com/HISHE--------------Previous Episodes--------------------How Incredibles 2 Should Have Endedhttps://youtu.be/U92Cp37V-68Villain Pub - Trick or Treathttps://youtu.be/7kgOUz9KJAIHow Ant-Man and The Wasp Should Have Endedhttps://youtu.be/kFQ2NvlCc6MHISHE Horror Compilationhttps://youtu.be/K6FteqXWtYIHow Avengers Infinity War Should Have Endedhttps://youtu.be/NcEbZ_vexA8How Solo: A Star Wars Story Should Have Endedhttps://youtu.be/u3kBzyJJDakHow Jurassic World Fallen Kingdom Should Have Endedhttps://youtu.be/OiaXHny9KD0Predator HISHE Dubshttps://youtu.be/q68Oog85VQwHow The Venom Trailer Should Have Endedhttps://youtu.be/datvIBL-5tISuper Cafe - Teens and Titanshttps://youtu.be/zg46XxztfUsHow Deadpool 2 Should Have Endedhttps://youtu.be/XU3NWji4h7sInfinity War Alternate HISHEhttps://youtu.be/eKMTHW6qfSwThe Last Jedi Lego Summaryhttps://youtu.be/nbPvj-2Z9JgJurassic World Alternate HISHEhttps://youtu.be/nk2GT1Msa2UJurassic World - Comedy Recap (HISHE Dubs)https://youtu.be/CUouUdYWh6gOceans Over 40 Trailerhttps://youtu.be/3QeNuWWQe5IHow Black Panther Should Have Endedhttps://youtu.be/oV0zkMe1K8sVillain Pub - The Dead Poolhttps://youtu.be/3DGlk_JAm8UHow Justice League Should Have Endedhttps://youtu.be/zj_y8eAKpQUHow Star Wars The Last Jedi Should Have Endedhttps://youtu.be/rCB8DUGpYQQHow Thor Ragnarok Should Have Endedhttps://youtu.be/lPZRmkVLeOEHow Spider-Man Homecoming Should Have Endedhttps://youtu.be/hjuHNdEgN30Avengers Infinity War and Beyond (Toy Story Mashup)https://youtu.be/bvXxLp_G9w0How IT Should Have Endedhttps://youtu.be/gh0WvZtbATEBatman V Superman - Comedy Recaphttps://youtu.be/bNjhtHyihJ0How The Incredibles Should Have Endedhttps://youtu.be/C0VJaFN4bncVillain Pub - Penny For Your Fearshttps://youtu.be/ZLyulYMZbj8Blade Runner - Comedy Recaphttps://youtu.be/fVwe9xXBdHQRogue One LEGO HISHE - Chirrut VS Everythinghttps://youtu.be/T5jK4XnaAQQHow Wonder Woman Should Have Endedhttps://youtu.be/Lf6gl4-MPd0How Guardians of the Galaxy Vol.2 Should Have Endedhttps://youtu.be/GBxxjhnjH4YHow Jurassic World Should Have Ended:https://youtu.be/TXGCyjJh48IHulk Spoils Movieshttps://youtu.be/HAg3fuFczs0How Kong Skull Island Should Have Endedhttps://youtu.be/C3H0OWehlVI?list=PL3...How Rogue One Should Have Endedhttps://youtu.be/RjR71XpAu0I?list=PL3...How Moana Should Have Endedhttps://youtu.be/4aHGssCxMo4?list=PL3...How The LEGO Batman Movie Should Have Endedhttps://youtu.be/g7OH2OhIjJAHow Doctor Strange Should Have Endedhttps://youtu.be/9e5epVDd9h0?list=PL3...How Beauty and the Beast Should Have Endedhttps://youtu.be/8hm9ezomDhQHow Star Wars Should Have Ended (Special Edition)https://youtu.be/oXUJiHut7YE?list=PLi...More HISHE Reviewshttps://www.youtube.com/playlist?list...Villain Pub - The Boss Battlehttps://youtu.be/bt__1gwGZSA?list=PL3...LEGO Harry Potter in 90 Secondshttps://youtu.be/jnbBcAr7XGo?list=PL3...Suicide Squad HISHEhttps://youtu.be/Wje0SdFWrzUHow Guardians of the Galaxy Vol.1 Should Have Endedhttps://youtu.be/d0K436vUM4wStar Trek Beyond HISHEhttps://youtu.be/Fymz7yoELS4?list=PL3...Super Cafe: Batman GOhttps://youtu.be/KntOy6am7CM?list=PL3...Civil War HISHEhttps://youtu.be/fvLw021rVN0Villain Pub - The New Smilehttps://youtu.be/0oP8s4GK1BE?list=PLA...How Batman V Superman Should Have Endedhttps://youtu.be/pTuyfQ5CR4QTMNT: Out of the Shadows HISHEhttps://youtu.be/_ac8xKxeqzk?list=PL3...How Deadpool Should Have Endedhttps://youtu.be/5vbEcTIAdPs?list=PL3...Hero Swap - Gladiator Starring Iron Manhttps://youtu.be/P4mY4qmuJas?list=PL3...How X-Men: Days of Future Past Should Have Ended:https://youtu.be/uT6YOI6JcRsStar Wars - Revenge of the Sith HISHEhttps://youtu.be/K2ScVx4mRDEBAT BLOOD - A Batman V Superman AND Bad Blood Parody ft. Batman:https://youtu.be/maX-ObiJB3o"
"BHhiOta0BJE","Little Mix - The Cure (Audio)","2018-11-13T20:45:00.000Z","UCssD3_aDYhaG44mwP53CO0w","littlemixVEVO","10","18.17.11","Little Mix,Pop,Syco Music,The Cure","943013","88302","366","6583","https://i.ytimg.com/vi/BHhiOta0BJE/default.jpg","False","False","Music video by Little Mix performing The Cure (Audio). (C) 2018 Simco Limited under exclusive licence to Sony Music Entertainment UK Limitedhttp://vevo.ly/9bLB1M"
"b73BI9eUkjM","JENNIE - 'SOLO' M/V","2018-11-12T09:00:04.000Z","UCOmHUn--16B90oW2L6FRR3A","BLACKPINK","10","18.17.11","YG Entertainment,YG,와이지,BLACKPINK,블랙핑크,제니,JENNIE,제니 뮤비,제니 음원,SOLO,JENNIE SOLO,제니 솔로,젠득이,블핑,JENNIE MV,MV,181112,OUTNOW","51684425","2859498","106426","306188","https://i.ytimg.com/vi/b73BI9eUkjM/default.jpg","False","False","[JENNIE - 'SOLO' M/V]All : http://smarturl.it/SOLOJennieApple Music : http://smarturl.it/SOLOJennie/applemusic iTunes : http://smarturl.it/SOLOJennie/itunesSpotify : http://smarturl.it/SOLOJennie/spotify#BLACKPINK #블랙핑크 #JENNIE #제니 #SOLO #MV #20181112_6PM #OUTNOW #YG"
"YGKRraZXp_4","Rainbow Jelly Tennis - The Slow Mo Guys","2018-11-13T15:56:08.000Z","UCUK0HBIBWgM2c4vsPhkYY4w","The Slow Mo Guys","24","18.17.11","slomo,slow,mo,super,motion,Slow Motion,1000,1000fps,gav,dan,slowmoguys,phantom,guys,HD,flex,gavin,free,gavin free,high speed camera,the slow mo guys,2000,2000fps,5000,5000fps,jelly,tennis,rainbow,12500,12500fps","702269","36413","255","1622","https://i.ytimg.com/vi/YGKRraZXp_4/default.jpg","False","False","Rainbow Jelly Tennis! Gav and Dan take a revisit slower and colourful-er. Dan also got way more annoyed than he did the first time. Success all round. Follow us on Instagram!https://www.instagram.com/gavinfree/https://www.instagram.com/danielgruchy/Filmed at 12,500fps and 6000fps on the Phantom v2640Rainbow Jelly Tennis - The Slow Mo Guys"
"xU3BiUMUkc4","detective pikachu","2018-11-12T21:54:14.000Z","UC6MFZAOHXlKK1FI7V0XQVeA","ProZD","1","18.17.11","detective pikachu,parody,pokemon,film trailer,danny devito,detective,gritty,film noir,csi,ryan reynolds,voice acting,english,game,3ds,tangela","1266004","93825","665","2509","https://i.ytimg.com/vi/xU3BiUMUkc4/default.jpg","False","False","My Twitter: https://twitter.com/prozdkpMy Let's Play channel, Press Buttons n Talk:https://www.youtube.com/channel/UCSHsNH4FZXFeSQMJ56AdrBAMy Merch/T-Shirt Store: http://www.theyetee.com/prozdMy Tumblr: http://prozdvoices.tumblr.com/My Twitch: https://www.twitch.tv/prozdMy Instagram: https://instagram.com/prozdMy Patreon: http://www.patreon.com/prozdUse the link below and the coupon code PROZDSNACKS to get $3 off your first Japan Crate Premium or Original:http://japancrate.com/?tap_a=13976-19476b&tap_s=76467-12d24bUse the link below and the coupon code PROZDRAMEN to get $3 off your first Umai Crate:http://japancrate.com/umai?tap_a=18655-b8af8b&tap_s=76467-12d24bUse the link below to get a free 14-day trial of Funimation anime streaming:https://www.funimation.com/prozdUse the link below and coupon code PROZD10 to get $10 off any Classic Bokksu subscription:http://www.bokksu.com?rfsn=498614.9d328&utm_source=refersion&utm_medium=influencers&utm_campaign=498614.9d328Use the link below and the coupon code ProZDCrate to get 10% off any Loot Crate:https://lootcrate.com/ProZD"
"AykrvnBFZjM","Giant Quality Street - The Purple One","2018-11-12T16:01:14.000Z","UCAzyupPG4vdo8jd9nJ13LAw","My Virgin Kitchen","26","18.17.11","Giant Quality Street - The Purple One,giant purple quality street,nestle,giant quality street,the purple one,my virgin kitchen,virgin kitchen,myvirginkitchen,barry lewis,chocolate,chocolate truffle,giant,super size,worlds biggest,candy,truffle,DIY,chocolate ball,giant food diy,cooking show,food hacks,homemade,giant food,caramel,giant nut,giant rolo,giant purple one,quality street,chocolate caramel,quality street (brand),barry lewis giant food","172742","6056","186","1224","https://i.ytimg.com/vi/AykrvnBFZjM/default.jpg","False","False","I had so many requests to make this Giant quality street chocolate off the back of the Giant Lindor. The purple one has a giant nut and gooey caramel filling, well here we go!Subscribe for videos each week & press the bell button so you are notified of all new ones http://goo.gl/CbsOCc  More giant food here https://www.youtube.com/watch?v=rYGK6ICT72A&list=PLfItiEY3o1mv8IqALYKrvwfrNMobHMRXwSupport me on Patreon https://www.patreon.com/myvirginkitchenMVK merchandise! - https://teespring.com/stores/myvirginkitchen ***************************************************TWITTER - https://twitter.com/myvirginkitchenFACEBOOK - http://www.facebook.com/myvirginkitchenINSTAGRAM - https://www.instagram.com/myvirginkitchenWEBSITE - http://www.myvirginkitchen.com/PODCAST - https://soundcloud.com/myvirginkitchenSNAPCHAT - @myvirginkitchen***************************************************If you would like to help me translate any of my videos to a different language click here http://www.youtube.com/timedtext_cs_panel?c=UCAzyupPG4vdo8jd9nJ13LAw&tab=2***************************************************Our kitchen is from www.larkandlarks.co.uk/#giantfood #qualitystreet #barrylewis"
"tvXBbsRU83Q","The Big Night | Sainsbury's Ad | Christmas 2018","2018-11-11T23:51:18.000Z","UCgY-h0zGG5EOa3f_k22wMJg","Sainsbury's","24","18.17.11","Christmas 2018,new radicals,sainsburys christmas advert,the big night,christmas ads,christmas commercials,christmas tree advert,christmas tree,Sainsbury's ad,get what you give ad,10 Nov 2018","2087356","9851","2537","0","https://i.ytimg.com/vi/tvXBbsRU83Q/default.jpg","True","False","Presenting the new Sainsbury’s Christmas 2018 advert, ‘The Big Night’. Starring an eight year old star giving the performance of her life, all for her mum. Directed by Michael Gracey, the director of The Greatest Showman. The Show tells the story of the North Star overcoming her nerves to deliver a performance of a lifetime, to the amazement of mum. She is supported by a huge cast of 59 kids aged 6-11, all dressed as a variety of Christmas staples - including a turkey drummer and set of Christmas lights (plug included). The cast all dance and sing along as the stage transforms to reveal a 40ft Christmas tree and a 14ft glitter-filled gravy boat.The children’s real parents were featured in the crowd too, and were intentionally kept away from the castings and rehearsals until shoot day.We hope you enjoy seeing our whole cast give all they’ve got for the ones they love.Celebrate Christmas with Sainsbury's!Meet the kids behind the ad: https://youtu.be/F0XGgKStoVw 🎵: The North Star and Friends x Sainsbury’s - You Get What You GiveListen on Spotify: https://open.spotify.com/album/47EzNPreC2Dciijv8VglnzOriginal song by New Radicals.Shop online: https://www.sainsburys.co.uk/shop/gb/groceries/Christmas"
"nbegkEX2di8","Nicki Minaj Shoots Her Shot at Michael B. Jordan | E! People's Choice Awards","2018-11-12T04:06:07.000Z","UCD-1jAmL42qnEszozefaa1g","E! Red Carpet & Award Shows","24","18.17.11","Awards,people's choice awards,People's Choice,2018 People's Choice Awards,E! Live from the Red Carpet,Red Carpet,Celebrity Gossip,Celebrity News,E! News,E! Entertainment,E! Pop Culture,Live Interviews Awards,Award Show,Fashion,Beauty,Oscar,Grammys,Golden Globes,Emmys,Screen Actors Guild,People’s Choice Awards,PCAs,Red Carpet and Live Events,Live Events,Nicki Minaj,Michael B. Jordan,Chun-Li,Donatella Versace,Black Panther,Nicki,Minaj","3157284","45390","4004","9061","https://i.ytimg.com/vi/nbegkEX2di8/default.jpg","False","False","Nicki Minaj thanks Donatella Versace for creating her custom dress--and invites Michael B. Jordan to take it off later that night. Watch!SUBSCRIBE: http://eonli.ne/RedCarpetSubscribeAbout People’s Choice Awards: The E! People’s Choice Awards celebrates all forms of entertainment, chosen entirely by the fans.Connect with People’s Choice Awards: Visit the People’s Choice Awards on E! ONLINE: http://eonli.ne/peopleschoiceawardsFollow People’s Choice Awards on TWITTER: http://twitter.com/peopleschoiceFollow People’s Choice Awards on FACEBOOK: http://facebook.com/peopleschoiceCheck out People’s Choice Awards on INSTAGRAM: http://instagram.com/peopleschoiceAbout E! Red Carpet and Award Shows: E! is the ultimate destination for Red Carpet coverage. And for the first time ever we’re taking you from the E! People’s Choice Awards directly into the show as E! is the new home of the People’s Choice Awards. From the Academy Awards to the Emmys, we give you an insider's view of the arrivals, exclusive interviews and of course, cover every stitch of the fabulous fashion. Only Live From the Red Carpet hosts Ryan Seacrest and Giuliana Rancic, along with E!’s entire awards team of fashion and entertainment experts, have the most comprehensive LIVE coverage of the biggest premieres and events.    Connect with E! Red Carpet and Award Shows:Visit the E! News WEBSITE: http://eonli.ne/enewsFollow E! Live from the Red Carpet on TWITTER: http://eonli.ne/RedCarpetTwitterFollow E! News on TWITTER: http://eonli.ne/ENewsTWLike E! News on FACEBOOK: http://eonli.ne/ENewsFBCheck out E! News on INSTAGRAM: http://eonli.ne/ENewsIGNicki Minaj Shoots Her Shot at Michael B. Jordan | E! People's Choice Awardshttps://youtu.be/nbegkEX2di8https://www.youtube.com/ERedCarpetandAwardShows"
"Q8LQh6grnZo","Busted - Nineties (Official Video)","2018-11-12T11:58:41.000Z","UCueKqV4BVrjwZAqjPmGw72w","Busted","10","18.17.11","busted,meet you there,night driver,tour,charlie simpson,matt willis,james bourne,pigs can fly,on what you're on,nineties,90s,god i miss the 90s,school,year 3000,air hostess,crashed the wedding","168100","8338","222","960","https://i.ytimg.com/vi/Q8LQh6grnZo/default.jpg","False","False","Nineties, from the new album Half Way There, released Feb 8th. Pre-order to get Nineties instantly https://lnk.to/busted-halfwaythereVideo directed by RankinThe Half Way There 2019 Arena Tour is on sale now. Get tickets at https://myticket.co.uk/artists/bustedMARCH 2019Sat 23 - GLASGOW The SSE HydroTue 26 - CARDIFF Motorpoint ArenaThu 28 - MANCHESTER ArenaFri 29 - BIRMINGHAM Resorts World ArenaSat 30 - LONDON The SSE Arena, WembleyGet Half Way There exclusive bundles and vinyl on the official webstore https://busted.tmstor.eshttp://busted.comhttp://facebook.com/bustedInstagram: http://instagram.com/bustedSpotify: http://smarturl.it/BustedSpotifyTwitter: http://twitter.com/bustedSnapchat: BustedMusichttps://instagram.com/jamesfutureboybournehttps://instagram.com/mattjwillishttp://instagram.com/charliesimohttps://twitter.com/jamesbournehttps://twitter.com/mattjwillishttp://twitter.com/charliesimo"
