video_id,title,publishedAt,channelId,channelTitle,categoryId,trending_date,tags,view_count,likes,dislikes,comment_count,thumbnail_link,comments_disabled,ratings_disabled,description
"s3Q6AM4MDs4","Amar Akbar Anthony Theatrical Trailer | Ravi Teja | Ileana | Sreenu Vaitla | Thaman | Sreenu Vaitla","2018-11-11T03:30:22.000Z","UCKZSn5C-RzrLjuWJF8wWiDw","Mythri Movie Makers","24","18.12.11","Amar Akbar Anthony Theatrical Trailer,Ravi Teja,Ileana,Thaman,Sunil,#AAA,Amar Akbar Antony Trailer,Amar Akbar Anthony Telugu Movie,Ravi Teja Amar Akbar Anthony,Mythri Movie Makers,Amar Akbar Anthony Movie Trailer,Amar Akbar Anthony 2018 Telugu Movie,#AmarAkbarAnthony,Thaman S,Sreenu Vaitla,Amar Akbar Anthony,latest telugu movies 2018,AAA Trailer,Amar Akbar Antony Movie Songs,Amar Akbar Anthony Trailer,AAA Movie Trailer","3842379","87429","3070","4488","https://i.ytimg.com/vi/s3Q6AM4MDs4/default.jpg","False","False","Amar Akbar Anthony Theatrical Trailer on Mythri Movie Makers. #AmarAkbarAnthony Latest 2018 Telugu Movie ft. Ravi Teja, Ileana D'Cruz, Sunil, and Laya. Directed by Sreenu Vaitla. Music by Thaman S. Produced by Naveen Yerneni, Y. Ravi Shankar and Mohan (CVM) under Mythri Movie Makers banner. #AAATrailer #RaviTeja #IleanaDcruz #Ileana #Sunil #Laya #MythriMovieMakers #SreenuVaitla #ThamanS #AmarAkbarAnthonyTeaserAmar Akbar Anthony 2018 movie also ft. Srinivas Reddy, Raghu Babu, Jayaprakash Reddy, Tanikella Bharani, Satya, Vennala Kishore, Ravi Prakash, Tarun Arora, Aditya Menon, Abhimamyu Singh, Vikram jit, Rajveer Singh, Shiyaji Shinde, Subhalekha Sudhakar and others.AAA Movie is all set for a grand release on 16th November.#AAAMovie Details:Cast: Ravi Teja, Ileana D'Cruz, Sunil, LayaScreenplay, Dialogues, and Direction: Sreenu VaitlaProducers: Naveen Yerneni, Y. Ravi Shankar and Mohan Cherkuri (CVM)Co-producer: Praveen MarpuriStory: Sreenu Vaitla and Vamsi Rajesh KondaveetiBanner: Mythri Movie MakersCEO: CherryDOP: Venkat C DileepMusic: SS ThamanEditor: MR VarmaArt Director: AS PrakashLyrics: Ramajogayya ShastriPRO: Vamsi ShekarClick Here To Watch : Amar Akbar Anthony Teaser | Ravi Teja | Ileana:https://youtu.be/VYuI6USrGuEPivot of Amar Akbar Anthony:https://youtu.be/qVl3gAZ8ElMNaga Chaitanya Savyasachi Official Trailer:https://youtu.be/An9lC-F_HMgNaga Chaitanya Savyasachi Movie Making:https://youtu.be/CqWZb_e9_e8Naga Chaitanya Savyasachi Pre Release Event: https://youtu.be/DNIEoA3peP0Sai Dharam Tej Chitralahari Movie Launch :https://youtu.be/ji1WsSWLa7ARangasthalam 100 Days Celebrations:https://youtu.be/MQ6yWe7faBkJr NTR Janatha Garage Telugu Full Movie | Mohanlal | Samantha | Nithya Menen: https://youtu.be/_Nq2m5LRQ3gSrimanthudu Telugu Full Movie | Mahesh Babu | Shruti Haasan:https://youtu.be/LS6XiINMc2sDear Comrade Movie Launch | Vijay Deverakonda | Rashmika Mandanna:https://youtu.be/AVpZW4IOPtoRangasthalam Back 2 Back Full Video Songs 4K:https://youtu.be/MZyal8FU_KsSrimanthudu Back To Back Full Video Songs:https://youtu.be/ZPSN4RdhteUFor more updates about Amar Akbar Anthony and Mythri Movie Makers :Like - https://www.facebook.com/MythriMovieMakersSubscribe - https://goo.gl/eJiVktTwitter - https://twitter.com/MythriOfficialInstagram: https://instagram.com/MythriOfficial"
"q28LX6BCX1Q","Movie Vs Reality Sothanaigal | Micset","2018-11-10T10:32:20.000Z","UC5EQWvy59VeHPJz8mDALPxg","Mic Set","23","18.12.11","micset,micset channel,sothanaigal,movie vs reality,movie,tamil movie,vs reality,funny video,sarkar,kollywood,tamil cinema,comedy,96,entertainment,micset sriram,49 p,vijay,2.0,deleted scene,sriram,sriram prince,trending video,trending,video,fun video","1280155","110409","1811","9240","https://i.ytimg.com/vi/q28LX6BCX1Q/default.jpg","False","False","Play Games and get to win cash!Win upto 1 lakh Rupees daily - Download MPL App now -https://www.mpl.liveHi everyone here comes the new video with exact scenario happens in movie and reality of ones life with funny sketch ! watch till the end and enjoy the video !!subscribe our channel for more videos !!!Cast & Crew:Sriram   ( INSTA ID - https://www.instagram.com/sriram_prince_ )                      ( FB ID- https://www.fb.com/sri.ram.3511041 ) Sivaranjini    ( FB ID- https://www.fb.com/Ranjani.anba )Punithan     ( INSTA ID - https://www.instagram.com/punithan_tayse )VKP    ( FB ID- https://www.fb.com/prakash.vk.89 ) Nandhini ( INSTA ID - https://www.instagram.com/a.c.h.u._5 )Chandru ( INSTA ID - https://www.instagram.com/chandru_kidboy )                     ( FB ID -  https://www.fb.com/chandrukidboy )Abinash - ( INSTA ID - https://www.instagram.com/abinash_killer )thilaksundarvenkatnandhavigneshniranashoskiyyanarFRAMES :    Thilak raj ( INSTA ID - https://www.instagram.com/thilakjamie )                                  Editing  - SFX: Sriram  ( INSTA ID - https://www.instagram.com/sriram_prince_ )                     ( FB ID- https://www.fb.com/sri.ram.3511041 ) VFX - Chandru ( INSTA ID - https://www.instagram.com/chandru_kidboy )Speacial Thanks :niranashoskpurusothamanrajimuruganTeam Manager  :   P.SheshathriTeam Coordinator :  velmuguganTeam Admin            :  N.ChandruScript & Direction: SRI RAM Digital Partner : DIVO For Promotions, Branding, Digital Marketing Contact : +91 8248991430Email :  officialmicset@gmail.com"
"9KN3dbZVRwQ","Taxiwaala Theatrical Trailer | Vijay Deverakonda, Priyanka Jawalkar, Rahul Sankrityan","2018-11-11T15:00:46.000Z","UCiJfiEg1FImWsVuEu0L8X6Q","Geetha Arts","24","18.12.11","Taxiwaala Trailer,Vijay Deverakonda,Taxiwaala,Taxiwaala Movie,Taxiwaala Songs,Taxiwaala Audio,Priyanka Jawalkar,Rahul,JAkes Bejoy,SKN,Taxiwaala Telugu Trailer,Taxiwaala Telugu Movie,Vijay Deverakonda Taxiwaala,Taxiwaala Teaser,Taxiwaala First Look,Taxiwaala Theatrical Trailer,Taxiwala Trailer,Taxiwala Theatrical Trailer","1324928","50755","1741","2487","https://i.ytimg.com/vi/9KN3dbZVRwQ/default.jpg","False","False","Watch & Enjoy #TaxiwaalaTrailer Taxiwala Movie Starring #VijayDeverakonda, #PriyankaJawalkar and #MalavikaNair. Music by Jakes Bejoy. Directed by Rahul Sankrityan. Produced by SKN Under the Banner of  UV Creations & GA2 Pictures.Sarrainodu Telugu Video Songs : http://bit.ly/29oZFCRMagadheera Telugu Video Songs : http://bit.ly/2e5EruASubscribe For More Telugu Full Movies: http://goo.gl/yk99z2Subscribe For More Telugu Video Songs: http://goo.gl/BJoFLTFollow us : www.twitter.com/GeethaArtsFollow us : plus.google.com/+GeethaArtsLike us On : www.facebook.com/GeethaArts"
"wrVgaN1tSLM","Bigg Boss S12 – Day 55 – Watch Unseen Undekha Clip Exclusively on Voot","2018-11-11T06:31:25.000Z","UCFHhFwEdsLs2wuvh1YdChHw","Voot","24","18.12.11","colors tv,bigg boss house,latest updates,jasleen matharu,srishty rode,season 12,voot app,2018,Unseen Undekha,cutless,full episodes","308194","2813","870","428","https://i.ytimg.com/vi/wrVgaN1tSLM/default.jpg","False","False","Srishty and Jasleen discuss how they talk and behave with their loved ones and pets. Watch Now: https://bit.ly/2Nrb4rFDownload app link: https://bit.ly/2OmDTAR"
"W_RQVUBjO5I","Break Up Ya Patch Up | FilterCopy Talkies | S01E07 | Ft. Akash Deep Arora, Palvi and Zervaan","2018-11-11T07:35:02.000Z","UC7IMq6lLHbptAnSucW1pClA","FilterCopy","23","18.12.11","filtercopy,filter copy,dice,dice media,pocket aces,netflix,amazon prime,little things,what the folks,love,couple,relationship,breakup,pyaar,passion,crying,sadness,cute couple,couple fight,couple goals,girlfriend,boyfriend,amit bhadana,bb ki vines,harsh beniwal,ashish chanchlani,carryminati,beyounick,elvish yadav,makejokeof,mostlysane,buzzfeed,tvf,timeliners,screenpatti,mithila palkar,trending video,funny video","916179","31206","1256","1477","https://i.ytimg.com/vi/W_RQVUBjO5I/default.jpg","False","False","Agar tum saath ho...WRITER & DIRECTOR RAJAT TANEJA DOP AJINKYA PANDIT ASSISTANT DIRECTOR ZISHAN ZAFFAR PRODUCER HITESH PARDESHI CREATIVE PRODUCER NISHAAD JAVERI EXECUTIVE PRODUCER AAKASH SHEWAKARAMANI CAST (in alphabetical order) AKASH DEEP ARORAPALVI JASWALZERVAAN J BUNSHAH EDITOR JAICY MATHEW COLOR GRADING AJINKYA PANDITISHANI ROY SOUND DESIGN NIPUN MADAN SOUND RECORDIST ZISHAN ZAFFAR GRAPHICS SHREYA SETHIMANOJ OMREGAURAV JHAMB  SUBTITLING PRANAV SINGHRAJAT TANJEJA LIGHT ATTENDANTJITENDRA PRATAP VIDEO OPERATIONS RAUNAK RAMTEKE"
"fnGW4iQzVLw","KGF Trailer Telugu | Yash | Srinidhi Shetty | Prashanth Neel | Vijay Kiragandur","2018-11-09T08:58:41.000Z","UCWKzBXU_5jgyXwmlj04H2dg","Vaaraahi Chalana Chitram","1","18.12.11","KGF Trailer,KGF Trailer Telugu,KGF Telugu Trailer,Latest Telugu Movies,Telugu Movie Trailers,KGF Official Trailer,Latest Trailers","4535823","136669","5021","11003","https://i.ytimg.com/vi/fnGW4iQzVLw/default.jpg","False","False","Here is the most awaited #KGF Trailer Telugu Presented by Kaikala Satyanarayana, AP / Telangana Distributed by Sai Korrapati - Vaaraahi Chalana Chitram Starring #Yash #SrinidhiShetty #PRashanthNeel #VijayKiragandur Written & Directed by: Prashanth Neel Starring: Yash, Srinidhi Shetty, Ayyapa, B Suresh, Srinivas Murthy, Archana Jois, Roopa Rayappa, Master Anmol, Ananth Nagu, Malavika, Achut Kumar, Naga Bharana, Dinesh Mangalur, Harish roi, Neenazam Ashwath, introducing Avinash, Ram, Lucky, Vinay Producer: Vijay Kiragandur DOP: Bhuvan Gowda #KGFTrailer in other languages: Telugu: Tamil: Hindi: Malayalam: For More #KGF Updates Subscribe: YouTube: https://www.youtube.com/HombaleNinnin... Facebook: https://www.facebook.com/hombalefilm Twitter: https://twitter.com/hombalefilms"
"ZSFDKq_mIi4","The Trip 2 | Breathe | Episode 7","2018-11-09T13:30:01.000Z","UCzo5sreD2cVGu2T2mNu__1Q","bindass","24","18.12.11","bindass,bindass official,bindass channel shows,bindass channel serial,bindass tv shows,bindass tv programs,bindass tv,the trip,the trip 2,trip 2 episodes,trip episode 6,trip episode breathe,mallika dua,sapna pabbi,amyra dastur,shweta tripathi,pranay pachauri,harman singha,shivam bhargava","1766208","22690","2316","1884","https://i.ytimg.com/vi/ZSFDKq_mIi4/default.jpg","False","False","Hmm... an old flame is washed ashore, crashing right into the girl's trip! 🌊What to expect next? A lot of nerves, some raw tension, first kisses and did someone say SALSA!? Let's dive in? 💃💋Catch the girls on EPISODE 7 of The Trip 2 | Presented by I Love LakmeAbout The Trip 2: The Trip series is back with a new season! The second season explores the journeys of four friends played by Sapna Pabbi, Shweta Tripathi, Mallika Dua and Amyra Dastur as they explore South India's beauty through an exhilarating road trip yet again!What was meant to be FOMO causing Vacay Goals, turns into yet another dramatic desi wedding with a twist, some more drama and a lot of self-discovery for the girls!Presented by #BindassOriginals►Download the BINDASS APP → http://bindass.com/download.html ►SUBSCRIBE To bindass: http://bit.ly/1bfqpUbFor More Videos & Downloads visit bindass: http://www.bindass.com►Follow Bindass:Facebook: https://www.facebook.com/bindass Twitter: https://twitter.com/bindasstv Google+: https://plus.google.com/+bindass Instagram: http://instagram.com/bindasstvWatch more popular shows on bindass:►Girl in the City - http://bit.ly/2DF8Zml► Girl in the City - Chapter 2: http://bit.ly/2F5N0lB ► The Trip - http://bit.ly/2GaUiWj ► Dil Buffering - http://bit.ly/2BnDWpz ►Yeh Hai Aashiqui - http://bit.ly/1yNiecX    Best of Yeh Hai Aashiqui: http://bit.ly/1J5nVWQ"
"FCRI4Xw7Xwg","Dino James - Achi Maza Aayi [Official Video]","2018-11-09T11:21:39.000Z","UCtpDorOuxwQ1URGQ0WLIXmQ","Dino James","10","18.12.11","dino james,acchi maza aayi,empowerment for men,acchi maza aayi latest video,new video,full song,official video,dance,hip hop,rap,dino james song","2718960","247972","6554","27455","https://i.ytimg.com/vi/FCRI4Xw7Xwg/default.jpg","False","False","Aaj sabse jyada need hai for #EmpowermentForMenSong Credits:Mix & Mastered by Shadab RayeenAssisted by: Abhishek Sortey Music by Bluish Music (Nilesh Patel)Supervision: Girish NakodRecording Engineer: - SalmanVocals recorded at Rae n Raga StudioWritten & composed by Dino JamesVideo credits:Directed by Himanshu TyagiConcept by Dino James and Himanshu TyagiDirector of photography: Shlok HassanandaniAdditional cinematography: Nikunj SinghCreative supervisor: Kartik ParandeEdited by : Yash Pania & Himanshu TyagiDI Colourist: Harsh DandotiyaExecutive Producer: Sherish ShaikhGraphic designing and VFX: Mustafa ZaveriFirst Assistant Director: Sheepu SharmaSecond Assistant Directors: Vinayak Singh, Kapil KadamJunior artist coordinator: Sunil Cast:Anshul Trivedi Thanks to:  Sooraj Harry, Divya James, Jaspreet Singh Chhabra, Akbar Bhai, Prajakta Koli, Sudeep Lahiri (One Digital)"
"R2ye1dlpFDU","RRR Launch Video - NTR, Ram Charan | SS Rajamouli","2018-11-11T14:14:48.000Z","UCumU_6FNxfHXTmeeFCYz6Yw","DVV Entertainment","24","18.12.11","RRR Launch,RRR Muhurtham,RRR Opening,RRR Massive Launch,RRR Rajamouli Movie,RRR Ram Charan,RRR NTR Movie,RRR Telugu Movie,RRR Indian Cinema,RRR New Movie,RRR Grand Opening,RRR Epic Movie,RRR Opening Ceremony,Ram Charan,NTR,SS Rajamouli,Chiranjeevi,Koratal Siva,#RRR,#RRRLaunch,#RRROpening","1361291","42363","855","2941","https://i.ytimg.com/vi/R2ye1dlpFDU/default.jpg","False","False","Watch RRR Launch Video... Starring NTR, Ram Charan. Directed by SS Rajamouli#RRR, #RRRLaunch, #RRROpeningScreenplay & Direction: S.S. RajamouliPresented by: D. ParvathiProducer: DVV Danayya Story: V. Vijayendra Prasad DOP: K.K. Senthil KumarProduction Designer: Sabu CyrilMusic Composer: M.M. KeeravaaniVFX Supervision: V Srinivasa MohanEditor: Sreekar PrasadCostume Designer: Rama RajamouliDialogues: Sai Madhav Burra, Karky"
"XibA_ugEaSM","Allu Arjun Speech @Taxiwaala Pre Release Event","2018-11-11T16:59:29.000Z","UCHca09YXIXzK32mGjOuHjRg","Shreyas Media","24","18.12.11","Allu Arjun Speech,Shreyas Media,Taxiwaala Pre Release Event Live,#Taxiwala,Taxiwala Pre Release EVent,Allu Arjun As Special Guest,Vijay Deverakonda Taxiwala,Vijay Deverakonda,vijay devarakonda songs,Taxiwala Event Live,taxiwala song,Taxiwala Teaser,Taxiwala Trailer,taxiwala vijay devarakonda movie,Priyanka Jawalkar,taxiwala video songs,vijay deverakonda,vijay deverakonda speech","279883","5955","348","627","https://i.ytimg.com/vi/XibA_ugEaSM/default.jpg","False","False","Allu Arjun Speech @Taxiwaala Pre Release Event Taxiwala Movie Starring #VijayDeverakonda, #PriyankaJawalkar and #MalavikaNair. Music by Jakes Bejoy. Directed by Rahul Sankrityan. Produced by SKN Under the Banner of  UV Creations & GA2 Pictures.Shreyas Media was born as a Movie Promotion & Event Management. An idea, Unalloyed expertise, Micro solutions. These three words define our core competency. Right from our inception. Shreyas event has been catering to renowned global companies offering turnkey solutions for Movie Promotions, Outdoor Publicity, Electronic Media, Print Media, In-Film branding, etc. Time changes, values don't over time as we developed a multi-disciplinary service focused on delivering integrated experiential communications solutions geared towards realizing client's marketing. We believe & propose that marketing communication is most effective when it is experiential and accurately focused. We also believe that marketing communication needs to be a two-way process and this duality is eminently achieved using the medium of experiential communication. Ultimately we are the one-stop project solution providers for event projects. Our goal is to leave u free to participate as your event is in safe hands------------------------Stay connected with us!!►Subscribe to http://bit.ly/ShreyasGroup►Visit us @ http://www.film70mm.com►Like us @ https://fb.com/ShreyasGroup►Follow us @ https://twitter.com/ShreyasGroup►Circle us@ https://goo.gl/GsKrzQ"
"SdnvyVMUZxE","Sudigaali Sudheer Performance | Extra Jabardasth | 9th November 2018 | ETV Telugu","2018-11-09T18:48:29.000Z","UCnoqvTW4YZExfDeq7_Wmd-w","ETV Jabardasth","22","18.12.11","etv shows,eenadu television,padutha theeyaga,super2,dhee Jodi,jabardasth,extra jabardsth,etv20,etv comedy show,extra jabardasth,naga babu,roja,anchor anasuya,rashmi,dhanraj,chandra,venu,chanti,dhana dhan dhanraj,comedy short films,chamak chandra,chalaki chanti,raghava,rocket raghava,roller raghu,venu wonders,comedy skits in telugu,telugu comedy tracks,allari harish,yedukondalu","3690722","30024","2694","1735","https://i.ytimg.com/vi/SdnvyVMUZxE/default.jpg","False","False","A comedy show, in which comedians like Sudigaali Sudheer, Chammak Chandra and Hyper Aadi perform side|splitting comedy skits."
"UNCFy8iXQCY","Uppum Mulakum│Flowers│EP# 724","2018-11-10T14:00:03.000Z","UCmAPdImtXLGh5E-lTTH4Qmg","Flowers Comedy","24","18.12.11","flowers tv,uppum mulakum,uppum,biju sopanam,Balanchandran,Neelima,juhi rustagi,flower tv comedy,flower tv malayalam,balanchandran,entertainment,best comedy serial malayalam,s p sreekumar,college campus comedy,marimayam,sneha sreekumar,programme,moosa,m80 moosa,funny,flower tv comedy night,malayalam comedy,+uppum mulakum","1042120","10033","819","1779","https://i.ytimg.com/vi/UNCFy8iXQCY/default.jpg","False","False","Watch Full Episode Here :- Watch Flowers TV Live On Your Mobile For Free!!! Download HomeMazala -  https://goo.gl/iGVJw2Join us on Facebook- https://www.facebook.com/flowersonair Twitter     https://www.twitter.com/flowersonairGoogle Plus -https://plus.google.com/+FlowerstvIndia"
"dxe3k_fNmOY","നമുക്ക് രസം തോന്നുമെങ്കിലും ഒരു നേരത്തെ അന്നത്തിന് വേണ്ടി അദ്ധ്വാനിക്കുവാ | This Boy Amazing","2018-11-11T07:45:00.000Z","UCYKQrn-CZYIoFjF1SKSyyOQ","Media Blasters","22","18.12.11","latest film news,female gossip,star news,movie central,film court,vekkada vedi,malayalam creations,metro matinee,gossips,comedy,entertaiment,music 247,gossip bazaar,Mollywood Gossips,Mollwood Gossips,sony music,new films,new songs,cricket,mohanlal,mammootty,vijay,surya,salmaan khan,amir khan,bahubali,2.0,making video,asianet news live,manorama live,friday film house,Media One,Flowers,Colours","182253","5290","171","254","https://i.ytimg.com/vi/dxe3k_fNmOY/default.jpg","False","False","Watch എന്താ സ്പീഡ് എന്താ കഴിവ് നമുക്ക് രസം തോന്നുമെങ്കിലും ഒരു നേരത്തെ അന്നത്തിന് വേണ്ടി അദ്ധ്വാനിക്കുവാ ആ കുട്ടി This Boy Amazing"
"JznTUVongfk","Diwali Har Ghar Ki | Ashish Chanchlani","2018-11-06T13:30:42.000Z","UC7eHZXheF8nVOfwB2PEslMw","ashish chanchlani vines","23","18.12.11","ashish chanchlani ashish chanchlani vines ashish,ashish chanchalani,ashish chanchlani new,ashish chanchlani new video,chanchlani,aashish,ashish funny vine,ashish chanchlani diwali,ashish chanchlani diwali new video,ashish chanchlani vines diwali,ashish diwali video,diwali har ghar ki,funny diwali videos,diwali videos,science vs commerce,bijlee ka bill tera baap bharega,DIWALI ASHISH,ashish funny diwali,happy diwali,diwali video,diwali","14423061","961969","38317","75210","https://i.ytimg.com/vi/JznTUVongfk/default.jpg","False","False","This diwali video hai thodi hatkeHar ghar ki diwali ki yeh hai kahaniWatch the full video till the endComment below and let us know which was your favourite scene!!#AshishChanchlani #Diwali Games Khelo aur Paise Jeeto!Jeetiye 1 lakh Rupaye harr roz -MPL App download kariye abhi aur shuru ho jaiye apne favourite games ke saath -https://www.mpl.liveProduction team :Co stars : Akash Dodeja, Simran Dhanwani, Deepa Chanchlani, Aditya Chanchlani, Jashan SirwaniCinematography : Siddharth Kedare & Kunal Chhabhria On set Handling : Grishim Nawani Editing : Ashish Chanchlani, Divesh Nainani & Kunal ChhabhriaLighting : Jeetu Red PetalsSound Handling : Tanish SirwaniWritten and created by : Ashish Chanchlani"
"gYlm_zgSxvk","KAATRIN MOZHI - OFFICIAL TRAILER | RADHAMOHAN | JYOTIKA | VIDAARTH | LAKSHMI MANCHU | G.DHANANJAYAN","2018-11-08T11:30:00.000Z","UCnSqxrSfo1sK4WZ7nBpYW1Q","Lahari Music | T-Series","10","18.12.11","[none]","2930765","79710","2943","3374","https://i.ytimg.com/vi/gYlm_zgSxvk/default.jpg","False","False","Kaatrin Mozhi Official TrailerFilm Name: Kaatrin MozhiArtiste: Jyotika, Vidaarth, Lakshmi Manchu, Kumaravel, M.S. Bhaskar, Manobala, Mohan Raman, Uma Padmanabhan, Sindhu Shekaran, Seema Taneja, Master Tejas and many othersTrailer Cuts: T. ShivanandeeswaranMusic: A.H. KaashifLyricist: Madhan KarkyCostumes: Poornima RamasamyDoP: Mahesh MuthuswamiEditing: Praveen KLArt Direction: KadhirMusic: Lahari AudioStory: Suresh TriveniDialogues: Pon. ParthibanScreenplay-Direction: RadhamohanExecutive Producer: S. SaravananProducers: G. Dhananjayan, S. Vikram Kumar, Lalitha Dhananjayan of BOFTA Mediaworks India#KaatrinMozhi------------Enjoy & stay connected with us!!Subscribe to our Youtube Channel : http://bit.ly/1hE4KpSLike us on FB: https://goo.gl/hbfPfL Circle Us on G+ :  http://goo.gl/STQX0gFollow Us on Twitter : http://bit.ly/1sZimzM"
"Adr04ypiPlM","A day out with mother - | Lalit Shokeen Vlogs |","2018-11-10T08:53:12.000Z","UCsLOXfgwzeLAl9E-6Flu3Bg","LShokeen Films","24","18.12.11","lalit shokeen,lalit shokeen films,lshokeen films,lalit shokeen videos,lalit shokeen vlogs,lalit shokeen latest video,a day out with mother,mothers day,haryanvi comedy,desi comedy,thugs of hindostan,movie review,diwali,goverdhan pooja,desi desi na bolya kar,haryanvi songs,diwali aarti,indian festival,indian sweets,dhanteras,bhaidooj,trending,family vacation,funny vlogs,delhi,haryanvi mom,desi chora","759289","42582","1692","3953","https://i.ytimg.com/vi/Adr04ypiPlM/default.jpg","False","False","I spent the whole day with mother and it was the best feeling in the world :) Enjoy and Subscribe! #lalitshokeen #vlogs #motherContact for advertising and business enquiries:Email: lshokeenfilms@gmail.com            lalit.shokeen@gmail.comINSTAGRAM: https://www.instagram.com/lalitshokeen1515FACEBOOK: https://www.facebook.com/lshokeenfilmsYOUTUBE: http://www.youtube.com/c/LShokeenFilms86TWITTER: https://twitter.com/lalitshokeenSNAPCHAT: lalit.shokeen"
"s4lT280Q0zQ","Regional videos | Jump Cuts Tamil | Hari Baskar | Naresh Dillibabu","2018-11-11T13:40:59.000Z","UCpPOf9BQPwa4K11Zjxu1ZPw","Jump Cuts","23","18.12.11","Jump cuts,Jumpcuts,Tamil comedy,Tamil Comedy Videos,regional videos,jumpcuts new promo,jumcpcuts new video,jumpcuts tamil,hari baskar videos","196409","16895","308","3179","https://i.ytimg.com/vi/s4lT280Q0zQ/default.jpg","False","False","FOR ADVERTISEMENTS : EMAIL - jumpcuts16@gmail.comEditing : Sri ramquote : Pandi Jump Cuts is a Tamil Entertainment channel by Hari and Naresh. We love telling our stories that we have came across in our life, friends, neighbourhood and bring it to you in our own way through the jump cut editing ✂️.We are here to entertain and if you like us, do share, like and subscribeFollow us on Facebook : https://www.facebook.com/jumpcutz/Follow us on Instagram : jump_cutsFollow us on Twitter : @jumpcuts7Thank you keep supportingJ U M P C U T S"
"_YA-XF1zzKM","Koffee With Karan: Saif Ali Khan and Sara Ali Khan","2018-11-11T16:30:00.000Z","UCa0ZcLPHL2QY1p1xqBCYedQ","Star World","24","18.12.11","[none]","703376","8926","373","607","https://i.ytimg.com/vi/_YA-XF1zzKM/default.jpg","False","False","The dynamic father-daughter duo are here to brew up some fun! #KoffeeWithKaran #KoffeeWithSaif #KoffeeWithSara #SaifAliKhan #SaraAliKhan"
