video_id,title,publishedAt,channelId,channelTitle,categoryId,trending_date,tags,view_count,likes,dislikes,comment_count,thumbnail_link,comments_disabled,ratings_disabled,description
"a40XLhSUREo","Imagine Dragons - Bad Liar (Audio)","2018-11-06T17:30:00.000Z","UCpx_k19S2vUutWUUM9qmXEg","ImagineDragonsVEVO","10","18.17.11","Imagine,Dragons,Bad,Liar,(Audio),Kid,Ina,Korner,Interscope,Alternative","11063214","470089","5491","29475","https://i.ytimg.com/vi/a40XLhSUREo/default.jpg","False","False","Get Origins, ft. Natural, Zero, Machine and Bad Liar, out now: http://smarturl.it/OriginsIDShop Imagine Dragons: http://smarturl.it/ImagineDragonsShopSign up for email updates: http://smarturl.it/ID_EmailListen to Imagine Dragons on Spotify: http://smarturl.it/ID_DiscographyCatch Imagine Dragons on tour: http://imaginedragonsmusic.com/tourFollow Imagine Dragons:Facebook: https://www.facebook.com/ImagineDragonsTwitter: https://twitter.com/ImaginedragonsInstagram: https://www.instagram.com/imaginedragonsLYRICSOh hush my dear, it’s been a difficult yearAnd terrors don’t prey on innocent victimsTrust me darlin’, trust me darlin’It’s been a loveless yearI’m a man of three fearsIntegrity, faith and crocodile tearsTrust me darlin’, trust me darlin’So look me in the eyesTell me what you seePerfect paradiseTearing at the seamsI wish I could escape itI don’t want to fake itI wish I could erase itMake your heart believeBut I’m a bad liarBad liarNow you knowNow you knowI’m a bad liarBad liarNow you knowYou’re free to goDid all my dreams never mean one thingDoes happiness lie in a diamond ringOh I’ve been asking, forOh I’ve been asking, for problems, problems, problemsI wage my war, on the world insideI take my gun to the enemy's sideOh I’ve been asking for (trust me darlin’)Oh I’ve been asking (trust me darlin’), for problems, problems, problemsSo look me in the eyesTell me what you seePerfect paradiseTearing at the seamsI wish I could escape itI don’t want to fake itI wish I could erase itMake your heart believeBut I’m a bad liarBad liarNow you knowNow you knowI’m a bad liarBad liarNow you knowYou’re free to goI can’t breatheI can’t beI can’t be what you want me to beBelieve me this one time, believe meI’m a bad liarBad liarNow you knowNow you knowI’m a bad liarBad liarNow you knowYou’re free to goPlease believe mePlease believe meMusic video by Imagine Dragons performing Bad Liar (Audio). © 2018 KIDinaKORNER/Interscope Recordshttp://vevo.ly/KXMwa6"
"sJUGAIf1Px0","Shawn Mendes  - Youth ft. Khalid","2018-11-05T23:37:56.000Z","UCAvCL8hyXjSUHKEGuUPr1BA","Shawn Mendes","10","18.17.11","Shawn Mendes,Khalid,Youth,You Cant Take Our Youth Away,Our Vote Is Our Voice,vote,march for our lives,apple,applemusic","8930396","823423","6997","40843","https://i.ytimg.com/vi/sJUGAIf1Px0/default.jpg","False","False","Shawn Mendes on Apple Music:apple.co/YouthOnAppleMusic Co-written by Marjory Stoneman Douglas students Emma Gonzalez and David Hogg, director Anthony Mandler, Larry Jackson, Shawn & Khalid, this video creates a literal stage to celebrate and honor the young, diverse and talented amongst us. Starring both Mendes and Khalid as well as over 30 different inspiring young people ranging from activists, painters, dancers, gun violence survivors, musical prodigies and many more splashed against a stunning New York City backdrop (A full list can be found below)  It also features a sculpture by New York-based contemporary artist Daniel Arsham.  THE COMPLETE LIST OF INCREDIBLE “YOUTHS” STARRING ALONGSIDE SHAWN MENDES AND KHALID IN ORDER OF APPEARANCE: Autumn de Forest, 17, Painter Yetunde Washinton, Nia Mandisa Parker & Lourdes Honor Taylor, 18, 20 & 19, Hiplet Dancers Lizzie Howell, 17, Ballerina  Xiuhtezcatl Martinez, 18, Environmental Activist Hasaan Hawthorne, 20, Wrestling State Champion (Double Amputee Wrestler) Clawdeena, 18, Drag Performer Zuriel Oduwole, 16, Filmmaker / Activist Ahmed Mohamed, 17, Arrested for bringing a homemade clock to school  Kojo Odu Roney, 13, Prodigal Drummer Giuliana Siraguso, 12, Hearing Impaired Dancer Donielle Hansley, 14, Dancer Sonita Alizadeh, 21, Rapper / Activist  Morgan Hurd, 17, World Champion Gymnast D’Angelo McDade, 18, Survivor of Gun Violence Jahne Benthall & Lynn Yeobah, 18, 18, Northstar Academy Policy Debater  Kadan Bart Rockett & Brooklyn Nicole Rockett 13 & 11, Kid Magicians David Doktorman & Isaac Segal, 18, 18, National Policy Debate Champions Phoenix Hunter, 8, Wrestling State Champion Rayna Vallandingham, 15, Martial Arts Champion Elias & Zion Phoenix, 12, Music Prodigies  Mars, 18, Gender Fluid Artist Nassir Little, 18, All-American Basketball Player Parker Clark, 14, Fire Performer Austin Perine, 4, Superhero who feeds the homeless Charlotte Reidy & Gabriel Ratner, 12, 11, Shakespearean Actor Jack Andraka, 21, Inventor, Scientist, Cancer ResearcherDirector: Anthony MandlerCreative Director: Larry Jackson Exec Producer: Larry Jackson, Nathalie Besharat, Scott Seviour Written by: Larry Jackson, David Hogg, Emma Gonzalez and Anthony Mandler, Shawn Mendes & KhalidProducer: BlackHandCinema, John WinterPost Producer: Karl Reid Production Company: BlackhandCinema"
"5LZ_G8jRGHg","Dunk Tank FIFA | Dude Perfect","2018-11-05T22:57:29.000Z","UCRijo3ddMTht_IHyNSNXpNQ","Dude Perfect","17","18.17.11","dude perfect,dude perfect stereotypes,dude perfect water bottle flip,bottle flip,water bottle flip,dude perfect bottle flip,dude perfect basketball,dp,dude perfect world record,edition,nerf,trick shots,trick shot,family,ping pong,bowling,clean,family friendly,bubble wrap,soccer,football,spinner,spinners,fidget spinners,dude,FIFA,games,consequences,dunk,tank,sideline,reporter,frisco,rough riders,baseball,messi,manchester,barcelona","12275246","282973","9451","17100","https://i.ytimg.com/vi/5LZ_G8jRGHg/default.jpg","False","False","Time for our brand new series: Games With Consequences!Video games just got WAY more fun!► Click HERE to subscribe to Dude Perfect! http://bit.ly/SubDudePerfect► Click HERE to watch our most recent videos! http://bit.ly/NewestDudePerfectVideoshttp://bit.ly/NewestDPVideos► Thanks to the Frisco RoughRiders for having us out to your awesome stadium! - https://www.milb.com/frisco► SHOP our NEW Merchandise! - http://bit.ly/DPStore►Click HERE to join the exclusive Dude Perfect T-Shirt Club! http://bit.ly/DPTShirtClubPlay our NEW iPhone game!► PLAY Endless Ducker on iPhone -- http://smarturl.it/EndlessDucker► PLAY Endless Ducker on Android -- http://smarturl.it/EndlessDucker► VISIT our NEW STORE - http://bit.ly/DPStore► JOIN our NEWSLETTER - http://bit.ly/DPNewsletterEndCard► WATCH our STEREOTYPES - http://bit.ly/StereotypesPlaylistIn between videos we hang out with you guys on Instagram, Snapchat, Twitter, and Facebook so pick your favorite one and hang with us there too!http://Instagram.com/DudePerfecthttp://bit.ly/DudePerfectSnapchathttp://Twitter.com/DudePerfecthttp://Facebook.com/DudePerfectDo you have a GO BIG mindset? See for yourself in our book Go Big. ►http://amzn.to/OYdZ2sA special thanks to those of you who play our iPhone Games and read our book. You guys are amazing and all the great things you tell us about the game and the book make those projects so worthwhile for us! Dude Perfect GAME - http://smarturl.it/DPGameiPhoneDude Perfect BOOK - Go Big - http://amzn.to/OYdZ2sClick here if you want to learn more about Dude Perfect:http://www.dudeperfect.com/blog-2/Bonus points if you're still reading this! Comment: What video game should we play next?As always...Go Big and God Bless!- Your friends at Dude PerfectBusiness or Media, please contact us at: Dude@DudePerfect.com------------5 Best Friends and a Panda.If you like Sports + Comedy, come join the Dude Perfect team!Best known for trick shots, stereotypes, battles, bottle flips, ping pong shots and all around competitive fun, Dude Perfect prides ourselves in making the absolute best family-friendly entertainment possible! Welcome to the crew! Pound it. Noggin. - Dude Perfect"
"a3qncufulFQ","Teens GUESS THAT Song Challenge (My Chemical Romance, Selena Gomez)","2018-11-05T20:00:01.000Z","UCHEf6T_gVq4tlW5i91ESiWg","REACT","24","18.17.11","guess that song,lady gaga,my chemical romance,Teens Guess That Song Challenge #9 (React),mcr,gerard way,Guess that,staff react,fbe staff,react,reaction,fbe,employees,coworkers,co-workers,laugh challenge,try not to laugh,try to watch without laughing or grinning,react gaming,kids versus food,do they know it,lyric breakdown,selena gomez","1636334","37524","2154","6536","https://i.ytimg.com/vi/a3qncufulFQ/default.jpg","False","False","Guess That Song Challenge played by Teens.SUBSCRIBE THEN HIT THE 🔔. New Videos 12pm PT on REACT: https://goo.gl/7SnCnCWatch all RC videos from this week: https://goo.gl/th0yyt Watch latest FBE videos: https://goo.gl/aU5PSmTeens take on the Guess That Song Challenge. Watch to see their reactions.Teens featured:Aliciahttps://www.instagram.com/Ali_dizzy_lol/Anahitahttps://www.instagram.com/anahita_j_/Dylanhttps://www.youtube.com/user/DylanDjoen/Jaxonhttps://www.youtube.com/channel/UC94AzegDvV1HPG-xuqqRhUwMoiseshttps://www.instagram.com/philo_p_/Troyhttps://www.instagram.com/troyglass/Tyler F.https://www.instagram.com/tyler.fraser/Zariahttps://www.instagram.com/zariaramirez/MERCH 👕 https://www.shopfbe.comFollow Fine Brothers Entertainment:FBE WEBSITE: http://www.finebrosent.comFBE CHANNEL: http://www.youtube.com/FBEREACT CHANNEL: http://www.youtube.com/REACTBONUS CHANNEL: https://www.youtube.com/FBE2FACEBOOK: http://www.facebook.com/FBEFACEBOOK: http://www.facebook.com/FBEShowsTWITTER: http://www.twitter.com/fbeINSTAGRAM: http://www.instagram.com/fbeSNAPCHAT: https://www.snapchat.com/add/finebrosSOUNDCLOUD: https://soundcloud.com/fbepodcastiTUNES (Podcast): https://goo.gl/DSdGFTGOOGLE PLAY (Podcast): https://goo.gl/UhL6bkMUSICAL.LY: @fbeTWITCH: https://www.twitch.tv/fbeliveAMAZON: https://www.amazon.com/v/FBEROKU: http://bit.ly/FBERokuSEND US STUFF:FBEP.O. BOX 4324Valley Village, CA 91617-4324Executive Produced by Benny Fine & Rafi FineHead of Post Production - Nick BergtholdDirector of Production - Harris ShermanSupervising Producer - Vincent IeraciProducer - Katie HarperProduction Coordinator - Alberto AguirreAssistant Production Coordinator - Kristy KieferStudio Technician - Josh HiltonProduction Assistant - Stephen Miller & Kyllis Jahn & Micah KearnyEditor - Karen Rivas & Jordan TowlesAssistant Editor - Lucas GriffithCreative Director - Derek BaynhamDirector of Post - Adam SpeasPost Supervisor - David ValbuenaSet Design - Melissa JudsonGraphics & Animation - Will HylerTheme Music - Cyrus GhahremaniGood Starts by Jingle Punks© Fine Brothers Entertainment.Teens GUESS THAT Song Challenge (My Chemical Romance, Selena Gomez)"
"wMxKbkWrvDc","Binging with Babish: Bear Stew from Red Dead Redemption 2","2018-11-06T14:00:08.000Z","UCJHA_jMfCvEnv-3kRjTCQXw","Binging with Babish","24","18.17.11","red,dead,redemption,rockstar,arthur,morgan,cowboy,stew,bear,meat,food from red dead redemption 2,rdr2,red dead redemption,red dead redemption 2,food in red dead redemption,food in red dead redemption 2,bear stew,game stew,RDR2,rdr 2,bear stew recipe,game stew recipe,how to make game stew,rabbit stew,rabbit stew recipe,venison stew,venison stew recipe,binging with babish,babbish,cooking with babish","1935387","91744","1535","6936","https://i.ytimg.com/vi/wMxKbkWrvDc/default.jpg","False","False","Food in video games has seen a renaissance in the past few years, with vittles playing a pivotal role in your mere survival as a character.  Rockstar games inches ever-closer to real life in video game form with Red Dead Redemption 2, where you can buy, hunt, cook, steal, and eat your nutritional requirements every day.  You never seem to need to go to the bathroom though...Special thanks to Justin Bailey, a wilderness expert without whom this episode would not have been possible!  Go check out his Instagram:https://www.instagram.com/theoutdoorethos/Check out my playlist of preferred cooking tunes, Bangers with Babish: https://open.spotify.com/user/easybakeandy/playlist/04Gp926I7HFqBLVDI2eRJIBinging With Babish Website: http://bit.ly/BingingBabishWebsiteBasics With Babish Website: http://bit.ly/BasicsWithBabishWebsitePatreon: http://bit.ly/BingingPatreonInstagram: http://bit.ly/BabishInstagramFacebook: http://bit.ly/BabishFacebookTwitter: http://bit.ly/BabishTwitterhttps://www.bingingwithbabish.com/podcast/Apple Podcasts: https://itunes.apple.com/us/podcast/bedtime-with-babish/id1327655367?mt=2Soundcloud: https://soundcloud.com/bedtimewithbabishStitcher: https://www.stitcher.com/podcast/bedtime-with-babish?refid=stpr"
"CxnJf0tWu48","BTS (防弾少年団) 'Airplane pt.2 -Japanese ver.-' Official MV","2018-11-06T15:00:01.000Z","UCl2aT0nRejTCQO_LHZAftBw","UNIVERSAL MUSIC JAPAN","10","18.17.11","BTS,防弾少年団,バンタン,EXO,SHINee,Wanna One,TWICE,iKON,WINNER,DNA,FAKE LOVE,Don't Leave Me,Not Today,LIVE TRILOGY,THE WINGS TOUR","17400082","2024862","24453","112930","https://i.ytimg.com/vi/CxnJf0tWu48/default.jpg","False","False","BTS、日本9thシングル11月7日発売!韓国で2018年5月に発売された「LOVE YOURSELF 轉 ‘Tear'」では、韓国人アーティストとして史上初の快挙となる‘ビルボード200'で1位を記録。更に韓国で8月に発売されたアルバム「LOVE YOURSELF 結 ‘Answer'」が‘ビルボード200'で再び1位を獲得。今作のニューシングルは「LOVE YOURSELF 轉 ‘Tear'」からの大ヒット楽曲「FAKE LOVE」、「Airplane pt.2」のJapanese ver.を表題とする超強力なシングル！【商品概要】BTS (防弾少年団) 「FAKE LOVE/Airplane pt.2」2018/11/7 Releasehttps://umj.lnk.to/bts_flap2YD【関連サイト】■BTS (防弾少年団)　公式ホームページ https://bts-official.jp/ ■BTS (防弾少年団)　ユニバーサルミュージック公式ページ　http://www.universal-music.co.jp/bts/"
"atNGFSCjwuc","Bubalu - Anuel AA x Prince Royce x Becky G x Mambo Kingz x Dj Luian","2018-11-06T05:05:31.000Z","UCz2SUbUr2k0T3nEmutgsPjg","Hear This Music","10","18.17.11","bubalu,anuel,prince royce,becky g,mambo kingz,dj luian,bubaloo,boobaloo","46106651","792363","34188","29773","https://i.ytimg.com/vi/atNGFSCjwuc/default.jpg","False","False","Hear This Music presenta:Bubalu - Anuel x Prince Royce x Becky G x Mambo Kingz x Dj LuianInstagrams:http://www.instagram.com/mambokingzhttp://www.Instagram.com/djluian"
"u5VvqyoySaU","Chevel Shepherd's Pure Country on Cover of Travelin' Soldier - The Voice 2018 Knockouts","2018-11-06T05:42:57.000Z","UCpdK1NLHxEUGXc1gq2NxkTw","The Voice","24","18.17.11","the voice,the voice nbc,the voice season 15,the voice knockouts,the voice knockout,team adam,adam levine,team jennifer,jennifer hudson,team kelly,kelly clarkson,team blake,blake shelton,dixie chicks,travelin' soldier,chevel shepherd,the voice new season,The Voice 2018,The Voice USA,The Voice Season 15,The voice winners,Jennifer Hudson,Kelly Clarkson,carson daly","859948","14665","203","888","https://i.ytimg.com/vi/u5VvqyoySaU/default.jpg","False","False","Team Kelly's Chevel Shepherd performs Travelin' Soldier in The Voice Knockouts.» Get The Voice Official App: http://bit.ly/TheVoiceOfficialApp» Subscribe for More: http://bit.ly/TheVoiceSub» Watch The Voice Mondays & Tuesdays 8/7c on NBC!» Stream Anytime: http://bit.ly/TheVoiceFullEpisodesTHE VOICE ON SOCIAL:Like The Voice: http://Facebook.com/NBCTheVoiceFollow The Voice: https://Twitter.com/NBCTheVoiceThe Voice Tumblr: http://nbcTheVoice.Tumblr.com/Follow The Voice on Instagram: https://instagram.com/nbcthevoice/#TheVoice #VoiceKnockouts #ChevelShepherd #TheVoice2018 #TheVoiceUSA #NBC #TravelinSoldier #Cover #TeamKelly #Music #AdamLevine #BlakeShelton #JenniferHudson #KellyClarksonNBC’s The Voice follows the strongest vocalists from across the country and invites them to compete in this season's blockbuster vocal competition.Find The Voice trailers, full episode highlights, previews, promos, clips, and digital exclusives here.NBC ON SOCIAL:NBC YouTube: http://www.youtube.com/nbcLike NBC: http://Facebook.com/NBCFollow NBC: http://Twitter.com/NBCNBC Tumblr: http://nbctv.tumblr.com/NBC Google+: https://plus.google.com/+NBC/postsNBC Instagram: http://instagram.com/nbcABOUT THE VOICEThe Voice 2018 USA YouTube channel features exclusive content with The Voice coaches, highlights from The Voice auditions, interviews with The Voice winners, as well as The Voice recaps and results. Learn more about The Voice contestants, The Voice tour, the eliminations, and follow your favorite performers all the way to the finale. In season 15, returning coaches Adam Levine, Blake Shelton, Kelly Clarkson and welcomes back Jennifer Hudson as celebrity musician coaches, while Carson Daly continues to serve as host. The show’s innovative format features five stages of competition: the first begins with the blind auditions, followed by the battle rounds, the knockouts, the live playoffs and finally, the live performance shows.Chevel Shepherd's Pure Country on Cover of Travelin' Soldier - The Voice 2018 Knockoutshttps://youtu.be/u5VvqyoySaUThe Voicehttp://www.youtube.com/user/nbcthevoice"
"LXZVn_ewwD8","EVERY HIGH SCHOOL RELATIONSHIP EVER","2018-11-05T17:00:03.000Z","UCY30JRSgfhYXA6i6xX1erWg","Smosh","23","18.17.11","every high school ever,high school,every high school relationship ever,relationship,couples,couple,boyfriend and girlfriend,girlfriend and boyfriend,girlfriend,boyfriend,passing notes,smosh,every blank ever,smosh every blank ever,every blank ever smosh,every school ever,every school ever smosh,every,ever,high school crush,crush,every crush ever","1860450","58812","2345","5134","https://i.ytimg.com/vi/LXZVn_ewwD8/default.jpg","False","False","Ah, young love - whether it's kissing in the halls, passing notes during EVERY single class, or more, this is Every High School Relationship Ever!CASTIan HecoxCourtney MillerKeith Leak JrOlivia SuiNoah GrossmanJessie GillCREWDirected & Produced by Ryan ToddWritten by  Monica Vasandani & Ryan FinnertySmosh Co-Founded by Ian Hecox & Anthony PadillaSmosh Creative Director: Luke BaratsDirector of Photography: Mitch AndersonEditor: Nick AgichProducer: Kristina NikolicProduction Manager: Jon-Michael BurgessFirst Assistant Director: Tanner RisnerProduction Designer: Tayler NicholsonArt Assistant: Jake SperlingCamera: Brennan IketaniGaffer: Trent TurnerGrip: Joseph PitruzzelloSound Mixer: Greg JonesMakeup Artist: Rachel JenkinsCostume Supervisor: Lindsay HamiltonScript Supervisor: Merina SeidelAssistant Editor: Matthew DuranPost-Production Supervisor: Reed BriceSenior Design: Ness CardanoSenior Design: Ness Cardano"
"mAKsZ26SabQ","TWICE YES or YES M/V","2018-11-05T08:59:49.000Z","UCaO6TYtlC8U5ttz62hTrZgg","jypentertainment","10","18.17.11","TWICE YES or YES,TWICE YESorYES,TWICE YES YES,TWICE 예스오어예스,TWICE YES,TWICE 예스,TWICE 예스 오어 예스,트와이스 YES or YES,트와이스 YESorYES,트와이스 YES YES,트와이스 예스오어예스,트와이스 YES,트와이스 예스,트와이스 예스 오어 예스,TWICE YoY,트와이스 YoY,YES or YES,YESorYES,YES,예스오어예스,예스 오어 예스,예스,YoY,YES or YES M/V,YES or YES MV,YES or YES Music Video,YES or YES 뮤비,YES or YES 뮤직비디오,예스오어예스 MV,예스오어예스 뮤비,예스오어예스 뮤직비디오,TWICE M/V,TWICE MV,TWICE Music Video,트와이스 MV,트와이스 뮤직비디오,트와이스 뮤비,TWICE,트와이스","67704629","1610268","129670","289635","https://i.ytimg.com/vi/mAKsZ26SabQ/default.jpg","False","False","TWICE(트와이스) YES or YES M/V iTunes & Apple Music  https://goo.gl/fc5tPPSpotify https://goo.gl/p4dWydGoogle Play Music https://goo.gl/i54Y56TWICE Official YouTube: http://www.youtube.com/c/TWICEonAirTWICE Official Facebook: http://www.facebook.com/JYPETWICETWICE Official Twitter: http://www.twitter.com/JYPETWICETWICE Official Instagram: http://www.instagram.com/TWICETAGRAMTWICE Official Homepage: http://TWICE.jype.comTWICE Official Fan's: http://fans.jype.com/TWICEⓒ 2018 JYP Entertainment. All Rights Reserved"
"yOlX5ehJjoc","Raw Men's and Women's Survivor Series captains revealed: Raw, Nov. 5, 2018","2018-11-06T02:23:13.000Z","UCJ5v_MCY6GNUBTO8-D3XoAg","WWE","17","18.17.11","wwe,world wrestling entertainment,wrestling,wrestler,wrestle,superstars,कुश्ती,पहलवान,डब्लू डब्लू ई,मैच,सुपरस्टार,व्यावसायिक कुश्ती,مصارعه,Raw,Baron Corbin,Braun Strowman,Alexa Bliss,Kurt Angle,sp:ty=high,sp:st=wrestling,sp:scp=athlete_in_match,sp:dt=2018-11-05T20:00:00-04:00,sp:ev=wwe-raw,sp:ath=wwe-albl,survivor series,survivor series 2017,survivor series 2018,general manager","2432333","38588","1443","3267","https://i.ytimg.com/vi/yOlX5ehJjoc/default.jpg","False","False","Find out who will head up the Men's and Women's Survivor Series teams for Monday Night Raw and which position could change.#RawGET YOUR 1st MONTH of WWE NETWORK for FREE: http://wwenetwork.com---------------------------------------------------------------------Follow WWE on YouTube for more exciting action!---------------------------------------------------------------------Subscribe to WWE on YouTube: http://bit.ly/1i64OdTCheck out WWE.com for news and updates: http://goo.gl/akf0J4Find the latest Superstar gear at WWEShop: http://shop.wwe.com---------------------------------------------Check out our other channels!---------------------------------------------The Bella Twins: https://www.youtube.com/thebellatwinsUpUpDownDown: https://www.youtube.com/upupdowndownWWEMusic: https://www.youtube.com/wwemusicTotal Divas: https://www.youtube.com/wwetotaldivas------------------------------------WWE on Social Media------------------------------------Twitter: https://twitter.com/wweFacebook: https://www.facebook.com/wweInstagram: https://www.instagram.com/wwe/Reddit: https://www.reddit.com/user/RealWWEGiphy: https://giphy.com/wwe"
"tkCflMyvRbM","Delia - Acadele | Videoclip Oficial","2018-11-05T07:49:14.000Z","UCnwuVNhrwtxnGEbwkxuK6Sw","Delia","10","18.17.11","delia,acadele,videoclip,oficial,piesa,single,muzica,romaneasca,muzica 2018,muzica youtube,muzica petrecere,download muzica,muzica noua,muzica noua 2018,pe aripi de vant,du-te ma baby,despablito,cine m-a facut om mare,inimi desenate,delia official,delia canal oficial,1 2 3 4,unde dragoste nu e,cum ne noi,delia weekend,delia the motans,delia carla's dreams","2473400","67793","8625","4410","https://i.ytimg.com/vi/tkCflMyvRbM/default.jpg","False","False","Videoclip oficial cu Delia interpretand single-ul Acadele. (C) & (P) 2018 Global RecordsBooking & Licensing:booking@globalrecords.com | +40.0757.104.166http://www.globalbooking.ro/delia-matache/licensing@globalrecords.comFollow Delia:Facebook: http://www.facebook.com/OfficialDeliaTwitter: https://twitter.com/delia_officialOfficial Website: http://deliaofficial.ro#delia #acadele #videoclipMuzica si Text: Delia Matache, Alex CotoiProductie muzicala: Alex CotoiRegie/ D.O.P : Alex CeausuVideo Production: Luca-s art film / Radu Selaru. Global Records Online: Facebook: https://www.facebook.com/GlobalRecordsComInstagram: https://www.instagram.com/GlobalRecordsOfficial Website: http://globalrecords.comTwitter: https://twitter.com/GlobalRecordsROToate drepturile sunt rezervate. Orice upload neautorizat al acestui videoclip este ilegal si poate fi raportat oricand la Youtube. All rights reserved. Unauthorized reproduction is a violation of applicable laws. In order to avoid copyright infringement, please do not upload this video on your channel."
"xfpHrQTmqck","Are We Too Easily Offended? | Good Morning Britain","2018-11-05T12:01:32.000Z","UCq18eeL7D9Vd8DhjMcLh9QQ","Good Morning Britain","24","18.17.11","good morning britain,breakfast show,news,morning news,gmb,good morning britain interview,itv,piers morgan,susanna reid,Talk Shows - Topic,gmb debate,good morning britain debate,vegans,waitrose food magazine,william sitwell,sarah jane crawford,sarah jane crawford vegan,philip collins,the times,waitrose","384165","5074","1089","0","https://i.ytimg.com/vi/xfpHrQTmqck/default.jpg","True","False","Waitrose Food magazine editor William Sitwell quit following his comment about 'killing vegans' last week. TV presenter and vegan Sarah-Jane Crawford and Philip Collins debate whether or not we get too easily offended. Subscribe now for more! http://bit.ly/1NbomQaBroadcast on 05/11/2018Like, follow and subscribe to Good Morning Britain!The Good Morning Britain YouTube channel delivers you the news that you’re waking up to in the morning. From exclusive interviews with some of the biggest names in politics and showbiz to heartwarming human interest stories and unmissable watch again moments. Join Susanna Reid, Piers Morgan, Ben Shephard, Kate Garraway, Charlotte Hawkins and Sean Fletcher every weekday on ITV from 6am.Website: http://bit.ly/1GsZuhaYouTube: http://bit.ly/1Ecy0g1Facebook: http://on.fb.me/1HEDRMbTwitter: http://bit.ly/1xdLqU3http://www.itv.com"
