video_id,title,publishedAt,channelId,channelTitle,categoryId,trending_date,tags,view_count,likes,dislikes,comment_count,thumbnail_link,comments_disabled,ratings_disabled,description
"Wnzz-orPdcU","Mystery Wheel of Slime Challenge 2 w/ Funny Satisfying DIY How To Switch Up Game","2018-11-17T19:13:15.000Z","UC7TTtOQKMXTWWMtWQMIgVSA","Collins Key","24","18.19.11","mystery wheel of slime challenge,mystery,wheel,challenge,challenges,slime,funny,satisfying,diy,switch up,game,how to,how,to,store bought slime,floam bricks,balloon slime,slime with balloons,slime challenge,challenge video,oobleck,collins key,collins,key,diy slime,real,fun,comedy,entertainment,brother,twin,bro,brothers,mystery wheel,mystery slime,twin telepathy,bath","2998170","173654","6498","24059","https://i.ytimg.com/vi/Wnzz-orPdcU/default.jpg","False","False","Learn how to make the 5 best new DIY slimes from this funny switch up mystery wheel of slime challenge 2 game with oobleck slime dump. This video is sponsored by Honey Nut Cheerios. Collect Buzzcoin and Do Good! No purchase necessary. Ends April 15th.  See https://www.beegoodrewards.com for more details.NEW MERCH DROPS ON BLACK FRIDAY! CLICK HERE to Get Yours before its all SOLD OUT: http://bit.ly/collins-signupBrothers (not twins) the key bros compete in this do it yourself squishy twin telepathy slime making challenge where they use crazy tools and supplies like real too many ingredients like eggs and egg pancake art challenge breakfast, they mix glue, foam, and store bought slime glitter into the ultimate smoothie slime instead of using piping bag slime or balloon glove and gloves slime. Create satisfying shaving cream foam fluffy and crunchy slime at home with your friends and family from this funny, cool tutorial. Full of unicorns, glue slime, sta flo blender slime mixing, amazing hacks, shredding and fails, it is sure to make you laugh.  They’ll test and try to make easy, awesome and fun slime in this entertainment and science experiment / life hack prank comedy education compilation viral video series. Also, check out the slime dump in a mini bath pool at the end. #slime #challenge #howto #diyFOLLOW COLLINS KEY Instagram: https://www.instagram.com/collinskey/ Twitter: https://twitter.com/CollinsKey Snapchat: http://snapchat.com/add/collinskey DEVAN'S LINKS: Insta: http://bit.ly/1wMSMyu Twitter: https://twitter.com/DevanKey Snapchat: DevanKeyy Musical.ly: DevanKey2Watch other awesome diy mystery wheel and slime videos:Making Slime with Funny Balloons - Satisfying Slime video – Izabela Stress https://www.youtube.com/watch?v=5JJ_jqqpTMYDogs Pick our Mystery Slime Challenge! Learn How To Make the Best DIY Funny Switch Up Oobleck Gamehttps://www.youtube.com/watch?v=AlJOG...Mixing Store Bought Slime Into Clear Slime - Most Satisfying Slime Videos! - Tom Slime https://www.youtube.com/watch?v=fXWp4jn4OmoSlime Piping Bags - Making Crunchy Slime – Slime Man https://www.youtube.com/watch?v=KjAMFwS0mt4Mystery Wheel of Slime Challenge! Learn How To Make DIY Switch Up Oobleckhttps://www.youtube.com/watch?v=3JqI8PANCAKE ART CHALLENGE 3!!! Learn How To Make SpongeBob Star Wars Jedi & Wonder Woman DIY Pancake!https://www.youtube.com/watch?v=hpedw10,000 POUNDS OF OOBLECK IN BATH CHALLENGE!https://www.youtube.com/watch?v=M6T0s"
"VUA2Rfvra64","Real Doctor Reacts to GREY'S ANATOMY #2 | Into You Like A Train","2018-11-18T16:00:05.000Z","UC0QHWhjbe5fGJEPz3sVb6nw","Doctor Mike","27","18.19.11","doctor mike,dr mike,greys anatomy,grey's anatomy,real doctor watches greys,doctor reacts to greys,mcdreamy,is grey's anatomy accurate,medical drama review,hospital drama,medical tv show,real doctor watches greys anatomy,derek shepherd,tv medical drama,medical drama,meredith grey,medical drama tv,TV doctors,how accurate is grey's anatomy,doctor tv shows,doctor reviews medical tv show,best doctor tv shows,best medical tv shows,greys anatomy review","478824","29194","274","3706","https://i.ytimg.com/vi/VUA2Rfvra64/default.jpg","False","False","Back at with my second review of greys anatomy the hit medical tv show on ABC. Now you know my feelings on medical tv dramas-- I need less loving and more medicine haha! This was a crazy episode but it is a fan favorite so I decided to review it. Definitely not every day that you see a pole go through two humans!Anyway, I hope you enjoy this episode of Real Doctor Watches Grey's Anatomy  / Real Doctor Reacts to Grey's Anatomy. If you want me to continue making this doctor reaction video please give it a  like and leave me a comment on which tv drama or show you'd like for me to review next. Love you all! SUBSCRIBE for new videos every Sunday ▶  https://goo.gl/87kYq6 Let’s connect:IG https://goo.gl/41ZS7w - Doctor MikeTwitter https://goo.gl/kzmGs5 - Real Doctor MikeFacebook https://goo.gl/QH4nJS - Real Doctor MikeContact Email: DoctorMikeMedia@Gmail.com P.O. Box (send me stuff):340 W 42nd St # 2695NY, NY 10108Dr. Mikhail Varshavski D.O. ( dr mike )Music by:DJ Quadshttps://soundcloud.com/aka-dj-quadsLakey Inspiredhttps://soundcloud.com/lakeyinspired"
"qVWMtdCp3k0","Disney - SNL","2018-11-18T06:00:36.000Z","UCqFzWxSCi39LnW1JKFR3efg","Saturday Night Live","24","18.19.11","nbc,snl,saturday night live,snl host,snl 44,snl season 44,season 44,disney,steve carell,aidy bryant,pete davidson,mikey day,melissa villaseñor,dumb dad,family vacation,disney world,s44,s44e6,episode 6,live,new york,comedy,sketch,funny,hilarious,late night,host,music,guest,laugh,impersonation,actor,improv,musician,Steve Carell,the office,michael scott,beautiful boy,VICE,despicable me,welcome to marwen,Donald Rumsfeld,Ella Mai,Boo’d Up","1150674","20023","3400","1465","https://i.ytimg.com/vi/qVWMtdCp3k0/default.jpg","False","False","A dad (Steve Carell) wakes his kids (Aidy Bryant, Mikey Day, Pete Davidson, Melissa Villaseñor) for a surprise trip to Disney World.#SNL #SNL44 #SteveCarell #EllaMaiSubscribe to SNL: https://goo.gl/tUsXwMGet more SNL: http://www.nbc.com/saturday-night-liveFull Episodes: http://www.nbc.com/saturday-night-liv...Like SNL: https://www.facebook.com/snlFollow SNL: https://twitter.com/nbcsnlSNL Tumblr: http://nbcsnl.tumblr.com/SNL Instagram: http://instagram.com/nbcsnlSNL Pinterest: http://www.pinterest.com/nbcsnl/"
"OVb2iUxcYyM","13 Types of Students After Exams","2018-11-18T12:57:38.000Z","UCGwcH4qnJ2qM_ZJUSFcAMAA","JianHao Tan","23","18.19.11","jianhao tan,jian hao tan,jianhao,the jianhao tan,thejianhaotan,jian hao,jianhaotan,kim lee,singapore,singaporean,youtuber,youtubers,youtube,exam,before vs after exams,before,vs,after,bad students vs good students,school,exam hall,exams,test,quiz,exam tips,exam motivation,cheaters,preperation,singaporean school,students video,jianhao student,class T1T5,give up,cheating,examinations,exam results,types of students,after exams,types of students after an exam","680713","25123","955","5369","https://i.ytimg.com/vi/OVb2iUxcYyM/default.jpg","False","False","The hardest part about exams is not the actual exam itself but getting back the results! Who will pass and who will fail? Follow me on Instagram: http://www.instagram.com/thejianhaotanNaomi : https://www.instagram.com/naomineo_ Pei Shi : https://www.instagram.com/speishi Debbie: https://www.instagram.com/debbwie/Denise: https://www.instagram.com/denisesoongeelyn/Kiara: https://www.instagram.com/kiaraakitty/ Cheryl: https://www.instagram.com/cheryl.chin Kevin:  https://www.instagram.com/kaleidoscovinNicole: https://www.instagram.com/nicolekittykatx/Ridhwan: https://www.instagram.com/ridhwannabe/Trevmonki: https://www.instagram.com/trevtham/Vicky: https://www.instagram.com/yklvv/Special thanks to Singapore Polytechnic for the location: https://www.sp.edu.sg/Shop our merchandise on: http://www.shophaohao.comEMAIL: For business enquiries, contact business@thejianhaotan.com directlyTITAN DIGITAL MEDIAhttp://www.titandigitalmedia.com http://www.instagram.com/titandigitalmediaGAMING CHANNELhttp://www.youtube.com/notgoodgamersOFFICIAL PARTNERS:ShopHaoHao: http://www.shophaohao.com Cocomo: https://cocomo.sgPlay-E: https://play-e.com Zeal Salon: https://www.facebook.com/zealsalonSecretlab GAMING CHAIR - http://secretlab.sg/ use the promo code HAO and get $20 off"
"ZhiAhNz8wlE","Michelle Obama Tried to Escape the White House to Celebrate the Legalization of Gay Marriage","2018-11-18T15:00:03.000Z","UCp0hYYBW6IMayGgR-WeoCvQ","TheEllenShow","24","18.19.11","ellen,ellen degeneres,degeneres,the ellen show,ellen fans,ellen tickets,ellentube,ellen audience,new,michelle obama,michelle,obama,barack obama,barack,obamas,malia,hilarious,funny,story,becoming,michelle obama book,becoming book,first lady,flotus,escape the white house,supreme court,legalize gay marriage,gay marriage,2015,celebrate,trump,potus,white house,amazing,inspiring,michelle obama daughter","1074676","42393","2013","0","https://i.ytimg.com/vi/ZhiAhNz8wlE/default.jpg","True","False","Former First Lady Michelle Obama shared with Ellen how she and daughter Malia attempted to escape the White House the night the U.S. Supreme Court legalized gay marriage in 2015, so they could celebrate in the street with other citizens. #TheEllenShow#MichelleObama#Obamas"
"737r0mRf0hY","Turning Coal into Diamonds, using Peanut Butter","2018-11-17T22:00:00.000Z","UC1zZE_kJ8rQHgLTVfobLi_g","The King of Random","27","18.19.11","peanut butter coal crystals,peanut butter,charcoal,charcoal peanut butter crystal,crystal,charcoal crystal,turning coal into crystal with peanut butter,king of random,diamond,grant thompson king of random,ice,ice cubes charcoal,how to make a diamond,chemical experiments,making crystals with coal and peanut butter,coal,charcoal peanut butter,science projects,grant thompson,the king of random,life hacks,science fair projects,random happens,fake,exposed","2851002","52777","20199","13209","https://i.ytimg.com/vi/737r0mRf0hY/default.jpg","False","False","Today we're taking a look at a viral video and seeing if it is actually possible to turn a peanut butter covered coal into a crystal!Subscribe & “Ring the Bell”: https://goo.gl/618xWmGet TKOR Merch:https://goo.gl/i5ehRgSee What Else I’m Up To:Instagram: https://goo.gl/C0Q1YUFacebook: https://goo.gl/EWo7S7Pinterest: https://goo.gl/Gbffq4Business Inquiries: For sponsorship requests or business opportunities please contact me directly: https://goo.gl/Z2L6yMMusic by:Josef Falkensköld - Happy Keys 9 (Indie Pop Version) & Chillax 3 (Indie Pop Version)Eden Maze - Burst Into Flames (Instrumental Version)Eden Maze - Into The Wild Again (Instrumental Version)Royalty Free Music from Epidemic Sound: https://goo.gl/jlJWJOWARNING:This video is only for entertainment purposes. If you rely on the information portrayed in this video, you assume the responsibility for the results. Have fun, but always think ahead, and remember that every project you try is at YOUR OWN RISK.✌️👑  RANDOM NATION: TRANSLATE this video and you'll GET CREDIT! Click Here: https://goo.gl/qbaEQUWant credit TRANSLATING other videos? Click Here to see where else you can contribute: https://goo.gl/DmpwbqTHANK YOU!! ✌️👑"
"0samRmOIcLc","Wengie 'Ugly Christmas Sweater' MV (Official Music Video)","2018-11-17T18:00:02.000Z","UCuBuvOo0l7S9Yf-RbrGScBQ","Wengie Music","10","18.19.11","Wenjie,ugly christmas sweater,wengie,wengie new song,wengie ugly christmas sweater,wengie music,christmas sweater,ugly sweater,wengie new music 2018,official music video,wengie cake,wengie deja vu,kpop,wengie oh i do,jpop,christmas,christmas music,christmas 2018,daily vlog,댄스,bts reaction,christmas music 2018,christmas songs 2018,reacticorns,all i want for christmas,dance challenge,EllieAndTour,jingle bells,santa baby,little drummer boy,feliz navidad","1811900","63428","8922","18265","https://i.ytimg.com/vi/0samRmOIcLc/default.jpg","False","False","Official Music Video for Ugly Christmas Sweater by Wengie! 🎄🎄🎄 Spotify: http://bit.ly/spotifywengieucs🎄 iTunes: http://bit.ly/ituneswengieucsUgle Christmas Sweater - WengieLyrics:(Ooh ooh, shoobedoo, ooh) [2×] Go rap the presents, put 'em under the treePour me some eggnog and I'll bake the cookiesSittin' by the fire, keep the cold outside, oh yeah(Ooh, ooh, shoobedoo, ooh)Go hang the mistletoe, and then we can kissI told you Christmas don't get better than thisYou know what I wantPut your ugIy Christmas sweater on(Ooh, ooh, shoobedoo, ooh)Oooh, it's been waitin' in a box in the atticYou told me that you weren't sure you still had itBaby, don't you know?That the time has comeTo rock the polyester with the bells on the front(Ooh ooh, shoobedoo, ooh) [2×] No matter what holidayNaughty or Nice?With singing carols and to twinkle the lightsBaby, you and me got a little bit of everything(Ooh, ooh, shoobedoo, ooh)Go make an angel layin' out in the snowYou know it keeps you warm where ever you go You waited all year long to put your ugIy Christmas sweater on(Ooh, ooh, shoobedoo, ooh)Oooh, it's been waitin' in a box in the atticYou told me that you weren't sure you still had itBaby, don't you know?That the time has comeTo rock the polyester with the bells on the frontSo put it on, put it on, yeahHaving fun, having fun, yeahEveryone say they want thatOooooh~You know the cam with the battery pack?You can feel the water running straight down your backEverybody gonna ask you where you got it atEven Santa can't top that(Oooh, oooh, oooh, ugIy Christmas sweater) [2×]Go rap the presents, put 'em under the treePour me some eggnog and I'll bake the cookiesSittin' by the fire, keep the cold outside, oh yeahOoooh, oh yeahGo hang the mistletoe, and then we can kissI told you Christmas don't get better than thisYou waited all year longYou know what I want Come on put it onPut your ugIy Christmas sweater on Get your limited edition Christmas Merch! ➜ http://bit.ly/wengiemerch'Thanksgiving Sale' $30% Off Select Youth Products (Starts: Nov 17th / Ends: Nov 26th after cyber Monday)Subscribe! http://bit.ly/WengieMusicFamFollow me on Spotify: http://bit.ly/WengieSpotifyInstagram: http://www.instagram.com/wengie#ChristmasSongs #wengie #christmas #uglysweater"
"kIwF0z9W5pE","Can We Make A Dish Without Knowing The Ingredients?","2018-11-17T20:00:01.000Z","UCJFp8uSYCjXOMnkUyb3CQ3Q","Tasty","26","18.19.11","Tasty,Game,chicken piccata,recipe,cooking,team work,food challenge,cooking challenge,no recipe,cooking game,recipe game,BuzzFeed,BuzzFeed Tasty,game,challenge,how to,food,chef,recipes,cook,competition","1360512","39383","1402","1824","https://i.ytimg.com/vi/kIwF0z9W5pE/default.jpg","False","False","Alix and Rie team up to play a recipe game where a cook must figure out how to make a mystery dish using only verbal commands from an instructor, but there's one problem: important key words are off limits.Follow Rie on Instagram @thedessertsnobFollow Alix on Instagram @majortraegerGet the recipe: https://tasty.co/recipe/creamy-chicken-piccataCheck us out on Facebook! - facebook.com/buzzfeedtastyCredits: https://www.buzzfeed.com/bfmp/videos/67355MUSICSFX Provided By AudioBlocks(https://www.audioblocks.com)Licensed via Audio Network"
"hWVgPOKClCQ","Teaching My Dog To Box","2018-11-18T00:34:03.000Z","UCq6VFHwMzcMXbuKyG7SQYIg","penguinz0","20","18.19.11","Teaching My Dog To Box Funny Cr1TiKaL","408722","35991","395","3305","https://i.ytimg.com/vi/hWVgPOKClCQ/default.jpg","False","False","This is the greatest boxing training of All Time"
"bdrQ8hXTy90","Ramsay In Awe Over Owner Telling Head Chef How To Cook Asparagus | Kitchen Nightmares","2018-11-17T17:00:05.000Z","UCUZzyuAlhHNP3oiuMjn7RfQ","Kitchen Nightmares","24","18.19.11","Gordon Ramsay kitchen nightmares,Gordon Ramsay best insults,kitchen nightmares full episodes,kitchen nightmares online,kitchen nightmares watch online,kitchen nightmares HD,kitchen nightmares best moments,Gordon Ramsay,Kitchen Nightmares,cafe hon kitchen nightmares,cafe hon kitchen nightmares full episode,kitchen nightmares cafe hon full episode,kitchen nightmares cafe hon season 5 episode 15","709515","8957","261","1859","https://i.ytimg.com/vi/bdrQ8hXTy90/default.jpg","False","False","Customers can't complain if the owner 86's everything.If you liked this clip check out the rest of Gordon's channels:http://www.youtube.com/gordonramsayhttp://www.youtube.com/thefwordhttp://www.youtube.com/kitchennightmaresMore Gordon Ramsay:Website: http://www.gordonramsay.comFacebook: http://www.facebook.com/GordonRamsay01Twitter: http://www.twitter.com/GordonRamsay"
"1YEDaELESiI","REAL LAWYER DESTROYS JOVEN IN COURT","2018-11-17T18:58:31.000Z","UCJ2ZDzMRgSrxmwphstrm8Ww","Smosh Games","20","18.19.11","smosh and order,smosh games,smosh,smosh court,mock trial,mock court,smosh trial,smosh games court,mari takahashi,boze smosh,damien haas,lawyer,joven","433938","22709","615","2414","https://i.ytimg.com/vi/1YEDaELESiI/default.jpg","False","False","SUBSCRIBE ►► http://smo.sh/SubscribeSmoshGamesWes brings in a real Lawyer to argue against Joven and he shows us how it's done! A full improv scene with only 30 minutes to prepare- it's Smosh & Order! CASTJoshua Ovenshire Boze  Damien HaasMari TakahashiWes JohnsonMichael Real Lawyer LawyersonTim Baker Follow Smosh Games!Twitter ►► @SmoshGamesInstagram ►► @SmoshGamesLike us on Facebook where we live stream!  ►► https://facebook.com/SmoshGames"
"E_uB0j6xkQo","(UNCUT) REAL LIFE HAUNTED AMITYVILLE HOUSE","2018-11-17T13:47:13.000Z","UCq52Fv9Jn7js4neFjaju3Fg","OmarGoshTV","24","18.19.11","omargoshtv,family vlogs,family vloggers,exploring,ghost hunting,EXPLORING A FANS HAUNTED HOUSE,amityville house in real life,the haunted amityville house,inside of the amityville house,omargoshtv fake,omar gosh haunted house,haunted houses in america,GHOST HUNTING IN THE AMITYVILLE HOUSE,amityville eminem,ammityville","234769","15411","656","2951","https://i.ytimg.com/vi/E_uB0j6xkQo/default.jpg","False","False","Today a fan of ours gave us permission to explore and investigate a haunted house that is alot like the Amityville horror house but most people won't visit this real life Amityville haunted house or even live in it. They said we won't last 10 minutes. We''ll see.Book a personal shoutout https://www.cameo.com/omargoshtvCheck out James The Fam https://www.youtube.com/channel/UCUSCuCzQIFeYe6bs20-YUdwBecome a member of my youtube channel for exclusive content, free giveaways, cool badges by your name and more: https://bit.ly/2mh4xzANew videos every day!SUBSCRIBE to OmarGoshTV ⇩ http://bit.ly/Sub2OmarGoshTVGet your fresh OmarGoshTV Merch here https://teespring.com/stores/omargoshtv-merchFOLLOW my other channel ⇩http://youtube.com/c/theomargoshCONNECT WITH ME ON SOCIAL MEDIA ⇩http://Instagram.com/omargoshtvhttp://Twitter.com/omargoshtvSnapchat: @theomargoshSEND US SOME FAM MAIL ⇩P.O. Box 11098 Spring Hill, FL 34610Professional Inquiries: TheOmarGosh@gmail.comMORE INFO: About OmarGoshTV:My channel is all about having fun, exploring new adventures and of course being humble. My content is safe for kids with no cursing (curse words) but still enjoyable for the entire family.OmarGoshTVhttps://www.youtube.com/OmarGoshTV"
"TCGIUFnJwDo","Dalton Harris sings Listen | Live Shows Week 5 | X Factor UK 2018","2018-11-17T21:34:11.000Z","UCEY1ejsweY4DgMwOVJeEaBA","The X Factor UK","24","18.19.11","the x factor,x factor,X factor UK,x factor 2018,simon cowell,robbie williams,auditions judges season 15,series 15,X Factor UK 2018,X Factor 2018 audition,The x factor 2018,XFactor 2018,louis Tomlinson,Ayda Field,DALTON HARRIS,BEYONCE,LISTEN,LISTEN BEYONCE,DALTON X FACTOR,X FACTOR BIG BAND,X FACTOR LIVE SHOWS","535376","19003","378","0","https://i.ytimg.com/vi/TCGIUFnJwDo/default.jpg","True","False","Visit the official site: http://itv.com/xfactorHow does he hit those high notes?! Singing Listen by Beyonce, Dalton delivers another barnstorming performance for Big Band week. SUBSCRIBE: http://bit.ly/TXFSubFacebook: http://bit.ly/TXFFBTwitter: http://bit.ly/TXFTwiDownload The X Factor mobile app: http://bit.ly/TXFappWatch full episodes on ITV Hub (UK ONLY): http://www.itv.com/hub/the-x-factor"
"TLgRryt2ZtE","Was Windows Vista THAT bad?","2018-11-17T20:02:22.000Z","UCXuqSBlHAE6Xw-yeJA0Tunw","Linus Tech Tips","28","18.19.11","Windows Vista,vs,Windows,Xp,10,8.1,Me,operating system,best,best OS,worst,version,install,how to install,run,launch,worst version,windows longhorn","1315854","55430","891","11295","https://i.ytimg.com/vi/TLgRryt2ZtE/default.jpg","False","False","Get an unrestricted 30-day free trial of FreshBooks at https://www.freshbooks.com/techtipsCheck out the available positions at Memory Express at https://lmg.gg/8KVKdI mean, was it that bad?Discuss on the forum: https://linustechtips.com/main/topic/996075-was-windows-vista-that-bad/Our Affiliates, Referral Programs, and Sponsors: https://linustechtips.com/main/topic/75969-linus-tech-tips-affiliates-referral-programs-and-sponsorsGet Private Internet Access today at http://geni.us/7lLuafKLinus Tech Tips merchandise at http://www.designbyhumans.com/shop/LinusTechTips/Linus Tech Tips posters at http://crowdmade.com/linustechtipsOur Test Benches on Amazon: https://www.amazon.com/shop/linustechtips Our production gear: http://geni.us/cvOSTwitter - https://twitter.com/linustechFacebook - http://www.facebook.com/LinusTechInstagram - https://www.instagram.com/linustechTwitch - https://www.twitch.tv/linustech Intro Screen Music Credit:Title: Laszlo - SupernovaVideo Link: https://www.youtube.com/watch?v=PKfxmFU3lWYiTunes Download Link: https://itunes.apple.com/us/album/supernova/id936805712Artist Link: https://soundcloud.com/laszlomusicOutro Screen Music Credit: Approaching Nirvana - Sugar High http://www.youtube.com/approachingnirvanaSound effects provided by http://www.freesfx.co.uk/sfx/"
"A078f1hUS0c","Axolotland - The Cutest Creatures You've Ever Seen","2018-11-17T14:58:25.000Z","UCONd1SNf3_QqjzjCVsURNuA","AntsCanada","15","18.19.11","ants,antscanada,mikey bustos,myrmecology,antfarm,ant colony,ant nest,queen ant,formicarium,ant habitat,antworks,insects,science,pets,exotic,nature,4K,Ultra HD,axolotl,amphibians,salamanders,cute pets,aquarium,fantasy,story,Ambystoma mexicanum","521166","24811","628","5408","https://i.ytimg.com/vi/A078f1hUS0c/default.jpg","False","False","Welcome to Axolotland, a new mountainside village aquarium and habitat for two aquadragons, i.e. axolotls (Ambystoma mexicanum). These very unique and cute amphibians, which are closely related to tiger salamanders are pretty interesting creatures. In this video, we watch these two axolotls evolve from strangers to best friends. We also watch how they hunt, forage, relax, and feed. You'll be surprised how intelligent and endearing they are. Hope you like this week's non-ant related (for a change) episode. Enjoy!Click here to SUBSCRIBE: https://goo.gl/tlCQJZCheck out & subscribe to my NEW DAILY VLOGS: https://goo.gl/GCx1JqAnt love forever! This video was shot in 4K Ultra HD resolution.Special thanks to nature photographer and biologist Alex Wild for allowing his photos to be used in this video. Check out his amazing nature photography and order some prints: http://www.alexanderwild.comIf you're new to the channel, catch up on your AntsCanada Lore with this playlist of the complete history of the ants of this channel: https://goo.gl/hVFxc2Visit us at http://www.antscanada.com CLOSE CAPTIONING CC available for this video. Please feel free to contribute to translating/CCing this video into another language: http://www.youtube.com/timedtext_cs_panel?tab=2&c=UCONd1SNf3_QqjzjCVsURNuAA brand new video is uploaded on this channel every Saturday at 8AM EST (with frequent bonus videos) so be sure to SUBSCRIBE to the channel to catch every ant video we release! Thank you for the support.Get our new AC Hybrid Nest 2.0 ant farm or'All You Need' Hybrid 2.0 Gear Pack (complete kit): https://www.antscanada.com/product-category/hybrid-nest-series/▶▶▶We've got new Ant T-shirts! Check them out here: https://goo.gl/PjnB7t▶▶▶Got a question about ants or AntsCanada? Visit our website FAQ: https://goo.gl/mJPEqn▶▶▶Want an ant farm? Check out our ant shop. We ship worldwide: http://goo.gl/I4l7Ho ▶▶▶Need to buy an ant colony for your ant farm, or do you have ant colonies to sell/give away? Find out more about our GAN Project: http://goo.gl/jzo9LcJoin us at the new AntsCanada Ant Forum: http://forum.antscanada.com▶AntsCanada Official Website http://www.antscanada.com▶Like us on http://facebook.com/antscanada ▶Follow us on http://twitter.com/antscanada▶Follow us on http://www.instagram.com/antscanadaEmail us at info@antscanada.com for any questions or inquiries.About AntsCanada.com: We believe ants are the most amazing creatures on the planet, and every new discovery about their micro world gives us some profound insights into the world around us and ourselves. Bringing the ant farm and love of ant keeping to a whole new level, we are dedicated to show the world the joys of keeping big and healthy pet ant colonies. Shipping worldwide since 2009, we are innovators of ant keeping products for ant lovers and museums alike."
