video_id,title,publishedAt,channelId,channelTitle,categoryId,trending_date,tags,view_count,likes,dislikes,comment_count,thumbnail_link,comments_disabled,ratings_disabled,description
"hfIog7RIgFE","Kymberli Joye Performs Break Every Chain - The Voice 2018 Live Top 11 Performances","2018-11-27T02:31:53.000Z","UCpdK1NLHxEUGXc1gq2NxkTw","The Voice","24","18.10.12","the voice,watch the voice,the voice top 11 performances,the voice top 11,the voice 2018,adam levine,kelly clarkson,jennifer hudson,blake shelton,kymberli joye,break every chain,tasha cobbs leonard,the voice nbc,the voice season 15,the voice new season,The Voice 2018,The Voice USA,The Voice Season 15,The voice winners,Jennifer Hudson,Kelly Clarkson,carson daly,the voice auditions,NBC,tv,television,music","1455513","43579","414","3932","https://i.ytimg.com/vi/hfIog7RIgFE/default.jpg","False","False","Team Kelly's Kymberli Joye performs Break Every Chain during The Voice Live Top 11 Performances.» Get The Voice Official App: http://bit.ly/TheVoiceOfficialApp» Subscribe for More: http://bit.ly/TheVoiceSub» Watch The Voice Mondays & Tuesdays 8/7c on NBC!» Get Kymberli's Performance on Apple Music: https://apple.co/2r6j043» Stream Anytime: http://bit.ly/TheVoiceFullEpisodesTHE VOICE ON SOCIAL:Like The Voice: http://Facebook.com/NBCTheVoiceFollow The Voice: https://Twitter.com/NBCTheVoiceThe Voice Tumblr: http://nbcTheVoice.Tumblr.com/Follow The Voice on Instagram: https://instagram.com/nbcthevoice/#TheVoice #VoicePlayoffs #KymberliJoye #TheVoice2018 #TheVoiceUSA #NBC #BreakEveryChain #Cover #TeamKelly #Music #AdamLevine #BlakeShelton #JenniferHudson #KellyClarksonNBC’s The Voice follows the strongest vocalists from across the country and invites them to compete in this season's blockbuster vocal competition.Find The Voice trailers, full episode highlights, previews, promos, clips, and digital exclusives here.NBC ON SOCIAL:NBC YouTube: http://www.youtube.com/nbcLike NBC: http://Facebook.com/NBCFollow NBC: http://Twitter.com/NBCNBC Tumblr: http://nbctv.tumblr.com/NBC Google+: https://plus.google.com/+NBC/postsNBC Instagram: http://instagram.com/nbcABOUT THE VOICEThe Voice 2018 USA YouTube channel features exclusive content with The Voice coaches, highlights from The Voice auditions, interviews with The Voice winners, as well as The Voice recaps and results. Learn more about The Voice contestants, The Voice tour, the eliminations, and follow your favorite performers all the way to the finale. In season 15, returning coaches Adam Levine, Blake Shelton, Kelly Clarkson and welcomes back Jennifer Hudson as celebrity musician coaches, while Carson Daly continues to serve as host. The show’s innovative format features five stages of competition: the first begins with the blind auditions, followed by the battle rounds, the knockouts, the live playoffs and finally, the live performance shows.Kymberli Joye Performs Break Every Chain - The Voice 2018 Live Top 11 Performanceshttps://youtu.be/hfIog7RIgFEThe Voicehttp://www.youtube.com/user/nbcthevoice"
"HARP7YxJnOA","Bradley Walsh DESTROYED 😱 by Michael's nightmare text - Send To All","2018-11-24T21:15:00.000Z","UCCj956IF62FbT7Gouszaj9w","BBC","24","18.10.12","BBC iPlayer,Michael McIntyre,Michael mcintyres big show,big show,comedy,comedian,stand up,funny,hilarious,best,laugh,laughter,joke,jokes,cheeky,series 4,series four,bbc comedy,gag,trick,spoof,antic,fun,humour,live comedy,comedy roadshow,Michael McIntyre send to all,send to all,celebrities read mean tweets,phone,texting,prank,prank calls,prank call,prank show,pranking,bradley walsh,jodie whittaker,doctor who,new doctor who,chaser,the chase","1749660","17260","708","893","https://i.ytimg.com/vi/HARP7YxJnOA/default.jpg","False","False","SUBSCRIBE for more BBC highlights: https://bit.ly/2IXqEInWATCH full programmes on BBC iPlayer https://bbc.in/2J18jYJSKIP to the text: 08:00Michael McIntyre causes mischief with Doctor Who star, Bradley Walsh's phone as he rifles through his photos and sends an embarrasing text to his contacts. Bradley gets his own back & he pranks Michael.Michael McIntyre’s Big Show returns for the biggest series to date.Filmed in front of a live audience at the Theatre Royal, Drury Lane, the show is packed with celebrity guests, musical performances, stand-up comedy and surprises.Michael McIntyre's Big Show | Series 4 Episode 2 | BBC#MichaelMcIntyresBigShow #MichaelMcIntyre #SendToAll"
"FbUcwTu2R6U","Weird Coffee Hacks (Taste Test)","2018-11-26T11:00:01.000Z","UCzpCc5n9hqiVC7HhPwcIKEg","Good Mythical MORE","24","18.10.12","gmm,good mythical morning,rhettandlink,rhett and link,mythical morning,mythical,rhett,link,season 14,gmmore,good mythical more,coffee,dunkin,dunkin donuts,starbucks,coffee bean and tea leaf,gmmore coffee,coffee hacks,hacks,drink hacks,caffeine,gmm coffee,good mythical more coffee,gmmore hacks,good mythical more hacks","1016029","18848","2023","2528","https://i.ytimg.com/vi/FbUcwTu2R6U/default.jpg","False","False","We asked for your weird coffee hacks and we are equal parts amused and concerned. GMMore #1430Watch today's GMM: https://youtu.be/WPgkV6lTS_MWant more GMM? Watch this season from the start: http://bit.ly/GMM_S14Pick up official GMM and Mythical merch at https://mythical.storeand https://www.amazon.com/mythicalDon’t miss our weekly podcast, Ear Biscuits: https://applepodcasts.com/earbiscuitsFollow Rhett & Link: Instagram: https://instagram.com/rhettandlinkFacebook: https://facebook.com/rhettandlinkTwitter: https://twitter.com/rhettandlinkWebsite: https://mythical.com/Check Out Our Other Mythical Channels:Good Mythical Morning: https://youtube.com/goodmythicalmorningRhett & Link: https://youtube.com/rhettandlinkMythical: https://youtube.com/thisismythicalWant to send us something? https://mythical.com/contactSubmit your Wheel of Mythicality intro video here: https://bit.ly/GMMWheelIntroIntro Animation by Digital Twigs: https://www.digitaltwigs.comIntro & Outro Music by Jeff Zeigler & Sarah Schimeneck https://www.jeffzeigler.comSupplemental Music from Extreme Production Music: https://www.extrememusic.com/Mic: ‘The Mouse’ by Blue Microphones https://www.bluemic.com/mouse/"
"PT-EzzJxySI","Roksana Węgiel - Anyone I Want To Be - Poland 🇵🇱 - WINNER - LIVE - Junior Eurovision 2018","2018-11-25T16:45:43.000Z","UC-lkYjunAyfultKGuRJz6HQ","Junior Eurovision Song Contest","24","18.10.12","Junior Eurovision Song Contest,2018,Minsk,JESC2018,LightUp,Roksana Węgiel,Anyone I Want To Be,Live,Performance,Polska,Poland,Roxy","6721499","118588","6219","14640","https://i.ytimg.com/vi/PT-EzzJxySI/default.jpg","False","False","Roksana Węgiel from Poland won the 2018 Junior Eurovision Song Contest in Minsk with the song Anyone I Want To Be. Read more about Roksana here: https://junioreurovision.tv/participant/roksana-wegiel"
"LruaD7XhQ50","What is Federal Land?","2018-11-26T13:27:21.000Z","UC2C_jShtL725hvbm1arSV9w","CGP Grey","27","18.10.12","cgpgrey,education,hello internet,united states,nevada,alaska,land,real eastate,government","1777681","89553","1097","7056","https://i.ytimg.com/vi/LruaD7XhQ50/default.jpg","False","False","Like what does it mean?  (For real though?)***Federal Girls Wallpaper***: https://www.patreon.com/posts/federal-land-now-23029763Discuss this video: https://old.reddit.com/r/CGPGrey/comments/a0jf4j/what_is_federal_land/Thank you to my supporters on Patreon:Thomas J Miller Jr MD, James Bissonette, Bob Kunz, John Buchan, Nevin Spoljaric, Chris Chapin, Richard Jenkins, Tony DiLascio, Donal Botkin, Phil Gardner, Christian Cooper, Michael Little, Martin, Steven Grimm, Ø³Ù„ÙŠÙ…Ø§Ù† Ø§Ù„Ø¹Ù‚Ù„, Saki Comandao, Jason Lewandowski, Michael Mrozek, Kozo Ota, Faust Fairbrook, Colin Millions, Cas EliÃ«ns, Ian, rictic, Guillermo, JoJo Chehebar, Derek Bonner, Derek Jackson, Mikko, Orbit_Junkie, Ron Bowes, TÃ³mas Ãrni JÃ³nasson, Christopher Anthony, Richard Comish, Oliver Steele, Andrea Di Biagio, David F Watson, Michael Cao, Andrew Proue, Bear, chrysilis, Dag Viggo LokÃ¸en, David Palomares, Edward Adams, Emil, Erik Parasiuk, Esteban Santana Santana, Freddi HÃ¸rlyck, Jacob Ostling, John Rogers, ken mcfarlane, Kevin Anderson, Leon, Maarten van der Blij, Paul Tomblin, Peter Lomax, Rescla, Rhys Parry, ShiroiYami, Tijmen van Dien, Tristan Watts-Willis, Veronica Peshterianu, Ernesto Jimenez, John Lee, Maxime Zielony, Osric Lord-Williams, Ben Schwab, Roman Pinchuk, and Elizabeth Keathley.https://www.patreon.com/cgpgreyMusic by: http://www.davidreesmusic.com"
"QYzWEb4Ho6I","Wembley Cup LIVE FINAL 2018","2018-11-25T18:33:43.000Z","UCWkr08nsQ9GuFvHgQYafi_w","Spencer FC","17","18.10.12","wembley cup,wembley cup final,wembley cup highlights,wembley cup goals,hashtag united,f2 fc,rebel fc,xo fc,xo","1529277","26786","2538","0","https://i.ytimg.com/vi/QYzWEb4Ho6I/default.jpg","True","False","► Subscribe: http://bit.ly/subSPENI hope you’re sitting comfortably because this year’s EE Wembley Cup final promises to be unlike anything you’ve ever seen before. Four teams, three thirty minute matches, Sin Bin for yellow card offences and Man Down time to settle draws. All this plus footballing legends hand-picked by our captains in our Wembley Cup Draft. So can my boys HashTag Utd hold on to the trophy or will F2 FC, Rebel FC or XO FC take it off us? There’s only one way to find out.   About the show:The EE Wembley Cup 2018 is a seven-part football series building up to one massive live final at Wembley Stadium on Sunday 25th November. EE have teamed up with Next Level to rip up the football rulebook. We’re hosting a tournament with four of YouTube’s most talked about teams, a group stage, EE Wembley Cup Draft and plenty of big twists on old rules. More about the BT Sport offer:Watching sport got a whole lot easier for EE customers. EE are bringing you the best live action with the BT Sport app – and letting you watch it on your TV as well as your phone. No more dodgy links, expensive pub trips or contracts to manage; simply cast the game from your phone to your telly using Apple TV of Google Chromecast and get stuck in. And best of all EE customers get the first three months of access to the BT Sport app for free.Get the BT Sport app here: https://ee.co.uk/why-ee/bt-sport► Follow me on Twitter! - http://twitter.com/SpencerOwen► Follow me on Instagram! - http://bit.ly/spengram► Hashtag United channel - http://youtube.com/hashtagunited► Buy Hashtag United merch! http://hashtagutd.com"
"phqhW8DgZtw","Kitchen Gadget Testing #36","2018-11-22T16:00:41.000Z","UCAzyupPG4vdo8jd9nJ13LAw","My Virgin Kitchen","28","18.10.12","Kitchen Gadget Testing 35 - Wish.com special,testing kitchen gadgets,Kitchen gadget testing,kitchen gadgets,barry lewis kitchen gadgets,my virgin kitchen gadgets,myvirginkitchen,testing food gadgets,virgin kitchen,barry lewis,food gadget testing,gadget,inventions,weird cooking gadgets,food hacks,you need,food gadgets,review,novelty,weird,wish app,ice cream sandwich maker,dishwasher brush,garject,bacon rack,sushi penguin,clever egg cracker clever scrambler","270308","5834","283","853","https://i.ytimg.com/vi/phqhW8DgZtw/default.jpg","False","False","Kitchen gadget testing 36! Testing out another batch of novelty kitchen items and gadgets including a garlic ejector, cheese grating hedgehog and a sushi penguin! What's your favourite kitchen gadget? Subscribe for videos each week & press the bell button so you are notified of all new ones http://goo.gl/CbsOCc Have a Barrathon, watch the kitchen gadget testing playlist https://www.youtube.com/watch?v=hECAxPxsdmo&list=PLfItiEY3o1mua5cnCEz2ssWLQbS6ZiSIqGet the gadgets here: ice cream sandwich maker https://amzn.to/2QWWYMqDishwasher brush https://amzn.to/2DNt0r9Clever egg cracker https://amzn.to/2Kh0D4RGarject https://amzn.to/2QQqR0xOxo corn stripper https://amzn.to/2OSKymSBacon rack https://amzn.to/2A5pJiJSushi penguin https://amzn.to/2OSuLnQHedgehog cheese grater https://amzn.to/2ORFC1FSupport me on Patreon https://www.patreon.com/myvirginkitchenmerchandise! - https://teespring.com/stores/myvirginkitchen ***************************************************TWITTER - https://twitter.com/myvirginkitchenFACEBOOK - http://www.facebook.com/myvirginkitchenINSTAGRAM - https://www.instagram.com/myvirginkitchenWEBSITE - http://www.myvirginkitchen.com/PODCAST - https://soundcloud.com/myvirginkitchenSNAPCHAT - @myvirginkitchen***************************************************If you would like to help me translate any of my videos to a different language click here http://www.youtube.com/timedtext_cs_panel?c=UCAzyupPG4vdo8jd9nJ13LAw&tab=2***************************************************Our kitchen is from http://www.larkandlarks.co.uk/#barrylewis #kitchengadgets #gadgets"
"lkVMEMXKAbc","The Motans - Maraton | Videoclip Oficial","2018-11-22T11:33:26.000Z","UCVH4CfUtEZ6A0q2fJkOuCjw","THE MOTANS Official","10","18.10.12","the motans,maraton,videoclip,oficial,piesa,muzica,romaneasca,pop,trupa,proiect,denis roabes,nota de plata,inainte sa ne fi nascut,muzica 2018,versus,muzica download,muzica youtube,the motans official,canal oficial,weekend,august,the motans delia,the motans inna,the motans jackpot,top radio hits romania 2018,romanian top hits 2018","2673963","40117","1401","1478","https://i.ytimg.com/vi/lkVMEMXKAbc/default.jpg","False","False","Videoclip oficial cu The Motans interpretand single-ul Maraton. (C) & (P) 2018 Global RecordsMaraton Download / Streaming:iTunes: https://geo.itunes.apple.com/us/album/id1443550819Spotify: http://open.spotify.com/album/7rFtGlOPocHgpVPTJf6NBpBooking & Licensing:booking@globalrecords.com | +40.0757.104.166https://globalbooking.ro/the-motans/licensing: licensing@globalrecords.com#themotans #maraton #videoclipoficialMuzică: Denis Roabeș, Vlad LucanText: Denis RoabeșProducție: Vlad LucanMix & Master: Sergiu Musteață Producție viori: Turcan AlexeiInterpretare viori: Muse QuartetRegie: Bogdan PăunD.O.P. : Alexandru MureșanScenariu: Ali Said, Bogdan Păun, Alexandru Mureșan, Denis RoabeșProductie video: Loops ProductionThe Motans Online:Facebook: https://www.facebook.com/themotansInstagram: https://www.instagram.com/themotansYoutube: http://www.youtube.com/c/THEMOTANSOfficialGlobal Records Online: Facebook: https://www.facebook.com/GlobalRecordsComInstagram: https://www.instagram.com/GlobalRecordsOfficial Website: http://globalrecords.comTwitter: https://twitter.com/GlobalRecordsROToate drepturile sunt rezervate. Orice upload neautorizat al acestui videoclip este ilegal si poate fi raportat oricand la Youtube. All rights reserved. Unauthorized reproduction is a violation of applicable laws. In order to avoid copyright infringement, please do not upload this video on your channel."
"wYKz2uxzhd0","DC Young Fly Does His Best Wendy Williams 😂 | Wild 'N Out | #WNOTHROWBACK","2018-11-22T17:00:08.000Z","UCrkzfc2yf-7q6pd7EtzgNaQ","Wild 'N Out","24","18.10.12","WNO,Wild,Out,Nick,Cannon,Justina,Valentine,Timothy,Delaghetto,Darren,Brand,DC,Young,Fly,frat,alpha,sigma,Nick Cannon,Justina Valentine,DC Young Fly,Timothy DeLaGhetto,Conceited,Chico Bean,Corey Charron,Darren Brand,Charlie Clips,Hitman Holla,pick up and kill it,let me holla,bullspittin,talking spit,wild style,live performance,improv,battle,championship,talkin spit,justina,justina valentine","1374025","27293","429","562","https://i.ytimg.com/vi/wYKz2uxzhd0/default.jpg","False","False","It was award szn on Wild ‘N Out and the cast is giving thanks as a few popular celebrities. 😂#WildNOut #ThanksForNothing #WNOTHROWBACK #MTVSubscribe to stay updated on the newest content! http://goo.gl/YuLQAoMore from Wild 'N Out!Official Wild 'N Out Website: http://www.mtv.com/shows/nick-cannon-presents-wild-n-outWild 'N Out Twitter: https://twitter.com/wildnoutWild 'N Out Instagram: https://www.instagram.com/mtvwildnout/Wild 'N Out Facebook: https://www.facebook.com/nickcannonwildnout/Nick Cannon Presents: Wild 'N Out delivers lightning-fast improv and head-to-head battles, helmed by the master of ceremonies, Nick Cannon. The stakes are high as teams face off in a series of visceral, hip-hop-edged comedy showdowns, all culminating in a rap battle for the championship belt."
"c30s6OnCApw","Cooking Thanksgiving Food","2018-11-22T05:11:12.000Z","UC9gFih9rw0zNCK3ZtoKQQyA","JennaMarbles","23","18.10.12","jenna,marbles,mourey,kermit,mr marbles,thanksgiving,j&js kitchen,vegan thanksgiving,vegan recipe,boyfriend,julien,solomita,vlog,kitchen,prep,meal,vegan,gluten free,stuffing,dressing,bagel,fried,chicken,meatless,dairy free,apple,crisp,baking,ice cream,dessert,vegan sausage,beyond meat,cooking,cook,mash potatoes,mashed potatoes,easy,simple,at home,diy,cranberry,delicious,yummy,funny,aries,virgo","3660426","226288","3543","19600","https://i.ytimg.com/vi/c30s6OnCApw/default.jpg","False","False","Recipes:Apple Crisp: https://bit.ly/2BpVchyFried 'Chicken': https://bit.ly/2TyRxojPlease subscribe to my channel and my vlog channel!  I make new videos here every Wednesday and make vlogs during my majestical daily life. http://www.youtube.com/JennaMarbleshttp://www.youtube.com/JennaMarblesVlogAlso our weekly podcast https://www.youtube.com/user/JennaJulienPodcastTwitchhttps://www.twitch.tv/jennajulienAnd past gaming from Twitch to Jenna Julien Gameshttps://www.youtube.com/channel/UC_Z0x662N1VUN9J7FYwCwkgSnapchat:JennaKermarblesFacebook: http://www.facebook.com/pages/Jenna-Mourey/311917224927Twitter:https://twitter.com/Jenna_Marbles@Jenna_Marbleshttps://twitter.com/jennajulien@jennajulienMerchandise:http://jennamarblesblog.com/shop Tumblr: http://jennamarbles.tumblr.com/Instagramhttp://instagram.com/JennaMarblesBrandenburg Concerto No4-1 BWV1049 - Classical Whimsical by Kevin MacLeod is licensed under a Creative Commons Attribution license (https://creativecommons.org/licenses/by/4.0/)Source: http://incompetech.com/music/royalty-free/index.html?isrc=USUAN1100303Artist: http://incompetech.com/"
"41iUdhFi8Gs","Blake Griffin Gets Full-Court Pressed By Spicy Wings | Hot Ones","2018-11-22T16:00:01.000Z","UCPD_bxCRGpmmeQcbe2kpPaA","First We Feast","26","18.10.12","First we feast,fwf,firstwefeast,food,food porn,cook,cooking,chef,kitchen,recipe,cocktail,bartender,craft beer,complex,complex media,Cook (Profession)sean evans,hot ones,hot ones first we feast hot sauce,spicy wings,blake griffin,hot ones blake griffin,blake griffin spicy wings,blake griffin nba,blake griffin detroit pistons,hot ones hot sauces,hot ones hot sauce challenge,food challenge,hot ones season 7,sean evans,sean evans hot ones,athlete hot ones","2086884","49466","837","5259","https://i.ytimg.com/vi/41iUdhFi8Gs/default.jpg","False","False","Happy Turkey Day, spice lords, and welcome to the 3rd Annual Hot Ones Thanksgiving Special! Gracing the hot seat this holiday is Detroit Pistons power-forward Blake Griffin. He's a five-time NBA All-Star, former No. 1 overall draft pick, and Slam Dunk Champion. But how is he with spicy food? Find out as Griffin takes on the wings of death and talks about everything from his burgeoning stand-up comedy career, to that time he dunked over a Kia Optima. Will he posterize Da Bomb, or get rejected by the heat? Watch the episode to find out, then stay tuned for a very special Thanksgiving announcement at the end...BUY THE CLASSIC HOT ONES  HOT SAUCE NOW!: https://bit.ly/2Q1VfIhBRAND-NEW HOT ONES MERCH available now: https://bit.ly/2S4yReUBUY your bottle of Los Calientes from Heatonist: https://bit.ly/2LMDxqSSIGN UP for the Hot Ones Monthly Hot Sauce Subscription box: https://bit.ly/2veY50PSUBSCRIBE to the brand-new Hot Ones podcast for extended cuts of classic interviews: https://apple.co/2vAceoHSubscribe to First We Feast on YouTube: http://goo.gl/UxFzhKCheck out more of First We Feast here:http://firstwefeast.com/https://twitter.com/firstwefeasthttps://www.facebook.com/FirstWeFeasthttp://instagram.com/firstwefeastFirst We Feast videos offer an iconoclastic view into the culinary world, taking you behind-the-scenes with some of the country's best chefs and finding the unexpected places where food and pop culture intersect."
"h0Tb9VtVzVE","C. Tangana, Niño de Elche - Un Veneno (Video Oficial)","2018-11-21T23:05:01.000Z","UCPTQlbt5SZO_SpYvC4Ygl-A","CTanganaVEVO","10","18.10.12","C. Tangana,Niño de Elche,Latin Pop,Sony Music Entertainment,Un Veneno","5519296","121155","9806","5538","https://i.ytimg.com/vi/h0Tb9VtVzVE/default.jpg","False","False","Music video by C. Tangana & Niño de Elche performing Un Veneno. (C) 2018 Sony Music Entertainment España, S.L. https://ctangana.lnk.to/UnVenenoC. Tangana: WEB www.ctangana.comFB @ctanganaoficial TW @c_tangana IG @c.tanganaNiño de Elche: FB @ninodeelcheTW  @ninodeelcheIG @ninodeelche Lyrics:Esta ambición desmedidaPor las mujeres la pasta y los focosMe está quitando la vidaMuy poqito a poqito poco  Me pregunta la prensa Puchitoooo cuál es la maña? Sin cantar ni afinarPa q me escuche toa españa Es un veneno que llevo dentroEn la sangre metidoQue va hacer que me mateSin que me hayas siquiera querido Lo hice por tí Yo he nacido bohemioPero tu amor me ha cambiadoAhora quiero triunfar y ganarY salir en la tele y la radio Es un veneno cruel y violentoQue estais alimentandoQue va hacer que me mateMientras todos seguis ahi mirando Lo hice por tí Aun recuerdo al chaval hambrientoque no invitábais al baileAntes cuando era inocente antesPero antes yo no era nadieY ahora tol dia metido en farraEscapando palanteIntentando olvidarteToreando recuerdos q arden Es un veneno que llevo dentroEn la sangre  metidoQue va hacer que me mateSin que me hayas siquiera querido Lo hice por tí"
"hRi8jxRA77Q","Redskins vs. Cowboys Week 12 Highlights | NFL 2018","2018-11-23T01:10:34.000Z","UCDVYQ4Zhbm3S2dlz7P1GBDg","NFL","17","18.10.12","NFL,Football,offense,defense,afc,nfc,American Football,highlight,highlights,game,games,sport,sports,play,plays,season,2018,touchdown,td,game highlights,wk 12,week 12,best plays,top plays,redskins,cowboys,sp:ty=high,sp:dt=2018-11-22T21:30:00+00:00,sp:vl=en-US,sp:st=football,sp:li=nfl,sp:ti:home=Dal,sp:ti:away=Was,cowboys highlights,redskins highlights,zeke,elliott,prescott","1434224","10421","733","3603","https://i.ytimg.com/vi/hRi8jxRA77Q/default.jpg","False","False","The Washington Redskins take on the Dallas Cowboys during Week 12 of the 2018 NFL season.Subscribe to NFL: http://j.mp/1L0bVBuCheck out our other channels:NFL Vault http://www.youtube.com/nflvaultNFL Network http://www.youtube.com/nflnetworkNFL Films http://www.youtube.com/nflfilmsNFL Rush http://www.youtube.com/nflrush#NFL #Redskins #Cowboys"
"-r3KmwdOWVQ","The 1975 Sincerity Is Scary Official Lyrics & Meaning | Verified","2018-11-21T16:58:03.000Z","UCyFZMEnm1il5Wv3a6tPscbA","Genius","10","18.10.12","genius,rap genius,verified,official lyrics,lyrics,lyric video,Lyric videos,pop music,hip hop,rap,new pop music,the 1975,sincerity is scary,the 1975 sincerity is scary,Polydor,Alternative,Matthew Healy,George Daniel,the 1975 sincerity is scary live,the 1975 live,the 1975 interview,the 1975 verified,matthew healy,a brief inquiry into online relationships full album","454089","31202","287","941","https://i.ytimg.com/vi/-r3KmwdOWVQ/default.jpg","False","False","The 1975 make a case for earnestness with “Sincerity Is Scary,” the third single from the band’s album, 'A Brief Inquiry Into Online Relationships.' Produced by band members Matthew Healy and George Daniel, the song has accrued more than 10.5 million Spotify streams since its release on September 13.Read more on Genius: https://genius.com/a/the-1975-breaks-down-sincerity-is-scary-on-genius-series-verifiedRead all the lyrics to The 1975's “Sincerity Is Scary” on Genius: https://genius.com/The-1975-sincerity-is-scary-lyrics Subscribe to Genius: http://bit.ly/2cNV6nzGenius on Twitter: https://twitter.com/GeniusGenius on Instagram: http://instagram.com/geniusGenius on Facebook: https://facebook.com/Geniusdotcomhttp://genius.com"
