video_id,title,publishedAt,channelId,channelTitle,categoryId,trending_date,tags,view_count,likes,dislikes,comment_count,thumbnail_link,comments_disabled,ratings_disabled,description
"4U1XnEamKcw","Breaking Up","2018-12-15T21:03:22.000Z","UCn1XB-jvmd9fXMzhiA6IR0w","Domics","23","18.16.12","domics,animation,relationship,break up,dump,nordvpn,vpn,nord,vpn network,vpn secure,vpn client,date,boyfriend,girlfriend","1135782","92725","1132","11770","https://i.ytimg.com/vi/4U1XnEamKcw/default.jpg","False","False","Go to https://NordVPN.com/domics and or use code DOMICS to to get 75% off a 3 year plan.  Protect yourself online today!If you're an animator, artist, gamer, or entertainer, then join us at Channel Frederator Network: https://frdr.us/Dom   Additional Animators:Alaylay: https://twitter.com/alaylays | https://instagram.com/alaylaysEhlboy: https://www.youtube.com/ehlboyJakeuro: https://twitter.com/jak_euro | https://www.youtube.com/jakeuroJomm: https://twitter.com/FlashJomm | https://www.instagram.com/jommish/Original Music by Christopher CarloneYT: https://www.youtube.com/carlonecWebsite: http://www.christophercarlone.com/Follow me!TUMBLR: http://www.domics.meFACEBOOK: http://www.facebook.com/domics.meINSTAGRAM: https://www.instagram.com/omnomdomz/"
"Vc4QGVEpsww","FASHION PHOTO RUVIEW: All Stars Season 4 Ep 1 with Raja and Asia O'Hara!","2018-12-15T17:00:05.000Z","UCUUUpaMp8DV6KUOfQwoIiLg","WOWPresents","24","18.16.12","world of wonder,world of wonder productions,wow report,FASHION,photo,RuPaul's Drag Race,All Stars 4,raja,toot,boot,asia o'hara","193662","6940","629","1772","https://i.ytimg.com/vi/Vc4QGVEpsww/default.jpg","False","False","Sponsored by Segura Viudas Cava: http://seguraviudasusa.comSubscribe: http://youtube.com/subscription_center?add_user=wowpresentsRead More at: http://worldofwonder.net/RuPaul's DragCon LA, May 24, 25, 26!From World of Wonder, the producers of The Eyes of Tammy Faye, Party Monster, The Strange History of Don't Ask, Don't Tell, The Last Beekeeper, RuPaul's Drag Race, Life With La Toya, and Million Dollar Listing."
"iRuQ4-9WlJM","Beauty Battle ft. Kim Kardashian & MakeupByMario","2018-12-14T20:23:05.000Z","UCucot-Zp428OwkyRm2I7v2Q","James Charles","24","18.16.12","james,james charles,makeup artist,mua,covergirl,coverboy,cute,jeffree star,manny mua,easy makeup,how-to,reviews,tutorials,funny videos,beauty tips,hacks,beauty,beauty battle,kim kardashian,kkw beauty,mario dedivanovic,makeupbymario","6249690","390385","6887","84924","https://i.ytimg.com/vi/iRuQ4-9WlJM/default.jpg","False","False","HI SISTERS! For the first time ever, we're doing a Beauty Battle, but I'm not in the middle. I challenged Mario Dedivanovic, celebrity makeup artist, to a battle on Kim Kardashian's face. Can I compete against the artist that has done her face every day for the past 10 years? Enjoy and don't forget to thumbs up and SUBSCRIBE!MARIO DEDIVANOVIC » http://instagram.com/makeupbymarioKIM KARDASHIAN » http://instagram.com/KimKardashianCome to the Master Class in February with Kim, Mario, Anastasia Beverly Hills, and I! » http://themasterclass.com 🎥 PREVIOUS VIDEO » https://youtu.be/PGtEbkdWjnY👕 SISTER'S APPAREL » http://sisters-apparel.com🛎 Subscribe to my channel to join the sisterhood & hit the notification bell so you never miss an upload! » http://bit.ly/JamesCharles for new videos!__🎅🏻 HOLIDAY GIVEASLAY RULESHOW TO ENTER:1. Must be subscribed to me on my YouTube channelhttp://youtube.com/jamescharles2. Must be following on my other social media platforms including Instagram, Twitter, & Snapchat (@jamescharles)3. Thumbs up this video & leave a comment down below!!GiveASlays will be happening on all 8 videos uploaded to my channel during the month of December (Tuesdays & Fridays).  Prize Package remains the same for all videos, consisting of the Morphe x James Charles PR box, a Sisters Apparel Rainbow Hoodie, & a brand new Apple Macbook Air. All winners will be chosen completely at random the day prior to the next video being uploaded, and will all be contacted via Instagram DM. GOOD LUCK!See the following page for ALL giveaway rules and regulations. »  https://sisters-apparel.com/pages/holiday-giveaslay12/4 WINNER: @_ivorycherry12/7 WINNER: @orlyluvjemma12/11 WINNER: @cameme97__❤️ LET'S BE BFFSINSTAGRAM » http://instagram.com/jamescharlesTWITTER » http://twitter.com/jamescharlesSNAPCHAT » jamescharless__💸 COUPON CODES 💸MORPHE BRUSHES » http://morphebrushes.comUse code JAMES for 10% off all products online AND in store!UBER » Use code SISTERJAMES for $5 off your first 3 rides!LILLY LASHES » https://lillylashes.com/Use code JAMES for 15% off all lashesLAURAS BOUTIQUE » http://lauras-boutique.comUse code JAMES for 10% off all itemsSKINDINAVIA » http://skindinavia.comUse code JAMES for 25% off all products __♡ MY AMAZING TEAMEDITOR: Louis & Anthony Gargiulahttp://instagram.com/louisgargiulahttp://instagram.com/anthonygargiulaWRITER: Eros Gomezhttp://instagram.com/erosmuaGRAPHICS: Michael Rusakovhttp://instagram.com/michael.ny"
"9rYFGtmpEPg","AZZYLAND - MONEY (Official Music Video) feat. BIG NEM","2018-12-14T20:24:27.000Z","UCzeB_0FNcPIyUSjL_TL5lEw","AzzyLand","10","18.16.12","azzyland,azzy,official,music,video,money,satire,comedy,music video","1968486","106267","41907","65637","https://i.ytimg.com/vi/9rYFGtmpEPg/default.jpg","False","False","AZZYLAND - MONEY (Official Music Video) feat. BIG NEMSong available here: https://song.link/i/1445083808BIG NEM: https://www.youtube.com/watch?v=s2SFPTUfWsc&t=206sSPECIAL THANKS:Just B Salon - https://www.instagram.com/justbsalon/BSide Beauty - https://www.instagram.com/bside.beauty/Viktor MitichPlatinum Cars - https://instagram.com/platinumcars_caChris & TinaJanie StevensSam HeatherStarring:Lo Wolkowski - https://www.instagram.com/lifeoflo/?hl=en Aury Barnett - https://www.instagram.com/legendaury/?hl=enYasmin Karssing - https://instagram.com/yazzieroseThomas Cox  - https://www.instagram.com/thomascxxCo-Directors/Producers Nora Stankovic & Big Nem - https://www.instagram.com/norastankovic/https://www.instagram.com/bignem/DoP Jason Han - https://www.instagram.com/dpjasonhan/1st AC Andrew Gerhold - https://www.instagram.com/andrewgerhold/Gaffer Ryan Saltzb Grip Dylan YoungHMU Artist Alan Jiefan Law https://www.instagram.com/andrewgerhold/PA Sarah Barnes - https://www.instagram.com/saraahbarnes/PA  Muzna R.PA Aleksa Miloradovic BTS Photographer Nikola Miloradovic -https://www.instagram.com/niko_milo/BTS Videographers Rui Hu - https://www.instagram.com/ruihui_photo/BTS Videographer Kevin Park - https://www.instagram.com/kvnpark/Dancers:Edz Gyamfi, Chris Duarte, Saskia, Ashlyn"
"9aAb2H2IVbA","Teyana Taylor - Gonna Love Me (Remix) ft. Ghostface Killah, Method Man, Raekwon","2018-12-14T16:00:03.000Z","UCPJksCfXRGylsvx1AKsJeUg","TeyanaTaylorVEVO","10","18.16.12","Teyana,Taylor,Gonna,Love,Me,(Remix),Getting,Out,Our,Dreams,Inc./Def,Jam,Recordings","1336672","79728","1869","6986","https://i.ytimg.com/vi/9aAb2H2IVbA/default.jpg","False","False","In Loving Memory of Kim Porter.Download/Stream Gonna Love (Remix) here:https://teyanataylor.lnk.to/GonnaLove... #teyanataylor #gonnaloveme #ghostfacekilla #methodman #raekwon #wutangFollow Teyana Taylor:http://www.teyanataylor.com/https://www.facebook.com/teyanataylor/https://www.instagram.com/teyanataylor/https://twitter.com/TEYANATAYLORLYRICS:Damn, I don’t understand why we go through this over and over and over and over againWhats really goodSometimes we say things that we really don't meanWe do things in between the linesWe should do more than stand outI'm sorry if i made you feel less than who you areA little insecure, oh you’s a shining starI wanna spend my nights with youMy life with you, oh baby babePlease wait up for me, till whenever i get homeI know that you're all aloneThinking ‘bout what you’re gon’ doI hope that you see it throughAnd oh, you’re gonna love me (imma love you regardless)You’re gonna wanna hug me (you just gotta cut this shit out)And squeeze me(Ghostface)YeahYo we used to spin back “Lovin’ you”Minnie RippertonThe bose speakers had my walls and the plaques tremblingLalala playing my mind all dayYou come home, i let calgon and take you awayBubble baths aroseGucci open toesSunday nights we sitting watching Power in our robesAll of a sudden our lines got crossed over nothingA text and your attitude change, yo you bugginHit me in the face with a pillow, and threw somethingI just got up and walked in the room,you still cussingNo “I love you”s before we sleep“Goodnight”s is out the windows, it lasts for weeksIt's been awhile since i gave you my street vowsPromised to love you and hit two times a day never cheat nowOur chemistry is like a bowl of cherries,and I’m the chocolate i smother youNever to worryAnd are you gonna love meYou’re gonna wanna hug me and squeeze me(I’m gonna share half of the blame for this problem we are gonna through, you know i'm a taurus, the bull, i'm stubborn, so tell me what's on your mind) - GhostfaceSometimes I don't think we really say enoughWhy is it so hard to keep in touchWhen we’re laying right next to each other, babyWe shouldn't read into things so muchOverthinking, understandingDon't let a feeling change it upI wanna spend my nights with youMy life with you, oh baby babePlease wait up for me til whenever i get homeI know that I’m all aloneThinking ‘bout what i'm gon’ doI hope that i see it through, ooh, ooh, yeah(Method Man) I ain't got time for tricksThem broads aint loyalI get a spanish chick, i make arroz con polloKeep my woman freshSo she will never be spoiledAnd she can be my queen, but we will never be royalsI don't give you cream, yadamean? But i assure youI'm heavy with the d, i got nothing but love for youSex as a weapon i got nothing but slugs for youAin't no protection, i done shot up the club for youYeah if i adore you, mi amor youThese dudes cannot afford you, let the god couture youI like them loyal from the soilAnd rhetorical questions when we smash, adorableWho put the sex in sex appealShorty got a receipt but her ex gets the billLook I'm too grown for netflix and chillBut i g and post up, like a net flick for reallove meAre you gonna love me,And are you gonna wanna hold me and squeeze meAre you gonna love and squeeze me(Raekwon)Yeah manYou know what it is maAy yo chef aka the wedding crasherCame through in the CullaninColor of skim milk the wrathOnly us in the corner with the paid face, black cards and louis faceAfrican cousins with us, we niggasSmoking blunts, wine thats licatta I waited like 3 yearsNow we here getting licenseAnd i'm tired of the whole jack and jill shit, the real shitBoth of us comfortable now, so you ain't ever gotta feel shitFeed a nigga laugh for hoursCount by ones, playing old school shitWhile we fuck in the showerAnd now you know your guard is top tierRemember the message,Love with capital letters until they dead usAnd are you gonna love me, youre gonna wanna hold me and squeeze me (x2)Music video by Teyana Taylor performing Gonna Love Me (Remix). © 2018 Getting Out Our Dreams, Inc./Def Jam Recordings, a division of UMG Recordings, Inc.http://vevo.ly/uVJWUn"
"3LMu2ag0lUc","Do All Black People Think the Same?","2018-12-14T21:00:01.000Z","UCJjSDX-jUChzOEyok9XYRJQ","Jubilee","24","18.16.12","jubilee,jubilee media,jubilee project,live for something greater,blind devotion,love language,do all black people think the same,spectrum,black people,african american,dreads styles,dreads,black stereotypes,kanye west,kanye west drake,kanye,kanye cookout","712817","30011","2422","7803","https://i.ytimg.com/vi/3LMu2ag0lUc/default.jpg","False","False","We brought Black people together to see where they stand on issues related to being black. SUBSCRIBE for more! 👉http://bit.ly/SUBSCRIBEjubilee 👈Follow us on INSTAGRAM: https://www.instagram.com/jubileemedia/Check out our cast on Instagram:Muja: @Muja_1Christian: @iamtelesmar Aisha: @alittlelomaxSabrina: @SabrinaMichelle88  Efa: @aye_effieAdib: @EthioNupe  Are you a loyal Jubilee fan? Join our Facebook group: https://www.facebook.com/groups/407942859721012/Want to be in a Jubilee video? Fill out our casting form: https://goo.gl/forms/EYJEIGgtGTOrb8GC2| ABOUT |Jubilee exists to bridge people together and inspire love through compelling stories. We create shareable human-centric videos that create connection, challenge assumptions, and touch the soul.Ultimately, we aim to inspire people to LIVE GREATER.| SOCIAL |Jubilee Facebook: https://www.facebook.com/jubileemediaJubilee Instagram: https://www.instagram.com/jubileemedia/Jubilee Twitter: https://www.twitter.com/jubileemediaJubilee Website: https://www.jubileemedia.comJubilee MERCH: https://www.jubileegear.comHelp us caption & translate this video!https://amara.org/v/f5rE/For brands interested in partnering with Jubilee, email us:hello@jubileemedia.comHelp us caption & translate this video!https://amara.org/v/mif4/"
"92_9bDvBu18","Dwight K. Schrute: Business 101 - The Office US","2018-12-15T17:00:02.000Z","UCa90xqK2odw1KV5wHU9WRhg","The Office US","24","18.16.12","the office,the office full episodes,rainn wilson,john krasinski,steve carell,michael scott,the office fire drill,jim and dwight pranks,dwight schrute,jim halpert,jenna fischer,the office thug life,the office funniest moments,the office bloopers season 1,the office cpr,the office parkour,Best The Office Moments,christmas,dwight business,nbc,ricky gervais,the office bloopers","297608","6970","96","453","https://i.ytimg.com/vi/92_9bDvBu18/default.jpg","False","False","He is so much more than an Assistant TO THE Regional Manager...Watch The Office US on Google Play: http://bit.ly/2xYQkLD & iTunes http://apple.co/2eW0rcKSubscribe: http://bit.ly/2y5VK8NThis is the official YouTube channel for The Office US. Home to all of the official clips from the series, the funniest moments, pranks and fails. Think we should feature your favourite episode? Let us know in the comments! FB : https://www.facebook.com/theofficenbcTwitter : https://twitter.com/theofficenbcWebsite : http://www.nbc.com/the-office#TheOffice #Christmas #MichaelScott"
"v1dZLYVAU8Y","The Pit Stop: Morgan McMichaels on All Stars 4 | RuPaul’s Drag Race All Stars 4","2018-12-15T17:00:16.000Z","UCvn-HVrAGYEKsVx6gW3MeNQ","VH1","24","18.16.12","RuPaul's Drag Race Pit Stop,The Pit Stop,Season 4 Episode 1,ep. 1,s4,trixie mattel and morgan mcmichaels,rupaul recap,all stars 4 premiere,rupaul's drag race,rupaul supercut,Michelle Visage,Ross Mathews,Carson Kressley,trinity the tuck,valentina,naomi smalls,monique heart,monet x change,manila luzon,latrice royale,jasmine masters,gia gunn,farrah moan,zoe kravitz,rita ora,jason wu,kacey musgraves,VH1,reality tv,reality show","168090","7181","341","1053","https://i.ytimg.com/vi/v1dZLYVAU8Y/default.jpg","False","False","All Stars 3 alums Trixie Mattel and Morgan McMichaels recap the premiere of All Stars 4, from the work room entrances to the bottom two. Watch RuPaul’s Drag Race All Stars every Friday at 8/7c on VH1!#VH1 #RuPaul #RuPaulsDragRaceSubscribe to VH1:  http://on.vh1.com/subscribeMama Ru is back with RuPaul's Drag Race All Stars, which features some of the most sickening queens to ever take the Drag Race runway. With panels including veteran judges Michelle Visage, Santino Rice, Carson Kressley, Todrick Hall and Ross Mathews sitting alongside RuPaul, this series is tucked to the edges with more tea, more shade and more twist-filled challenges than ever before.More from VH1:Official VH1 Website: http://www.vh1.com/ Like MTV on Facebook: http://facebook.com/VH1Follow VH1 on Instagram : http://instagram.com/vh1 Follow VH1 on Twitter: http://twitter.com/VH1Find VH1 on Tumblr: http://vh1.tumblr.com Find VH1 on Google + : http://plus.google.com/+vh1  Follow VH1 on Pinterest : http://pinterest.com/vh1 The Pit Stop: Morgan McMichaels on All Stars 4 | RuPaul’s Drag Race All Stars 4 http://www.youtube.com/user/VH1"
"t5REhShQVt0","The Ultimate Gingerbread House And Cookie Guide","2018-12-15T16:00:06.000Z","UCJFp8uSYCjXOMnkUyb3CQ3Q","Tasty","26","18.16.12","BuzzFeed,Tasty,BuzzFeed Tasty,gingerbread,gingerbread house,gingerbread house decorating,baking,Christmas,gingerbread houses,holidays,holiday baking,cookie decorating,how to make gingerbread,how to,candy,holiday traditions,homemade gingerbread,family recipe,cookie dough,decorating,tips and tricks,gingerbread men,gingerbread cookies","198645","9398","88","456","https://i.ytimg.com/vi/t5REhShQVt0/default.jpg","False","False","Check out our step by step guide here: https://www.buzzfeed.com/hannahloewentheil/tips-for-making-gingerbread-houseCheck us out on Facebook! - facebook.com/buzzfeedtastyCredits: https://www.buzzfeed.com/bfmp/videos/69424"
"v8y5qgWllT8","Taking my cats on a picnic (FAIL)","2018-12-15T11:05:25.000Z","UCX3g2Y_w3Fp4QA7VuTa0YUA","Jun Yoshizuki","26","18.16.12","jun,yoshizuki,junskitchen,vlog,blog,cat,cats,picnic,fail,cook,cooking,yt:cc=on,japan,japanese,料理,ジュン,猫,ねこ","291026","17162","151","1396","https://i.ytimg.com/vi/v8y5qgWllT8/default.jpg","False","False","This is one of the attempts we made at filming the “Taking my cats for a walk” video that I uploaded to JunsKitchen. The idea was that I would make myself an onigiri and my cats matching onigiri out of cat-safe ingredients, but the picnic didn’t end up working... But my wife put together some of the clips we filmed anyway so you can see a bit of what we did that day! :)►Patreon: https://www.patreon.com/JunsKitchen►Main Cooking Channel: https://www.youtube.com/user/JunsKitchen►Music by Epidemic Sound (https://goo.gl/wiYvVq)"
"gNyRlOSnoOs","Kashima Antlers v CD Guadalajara - MATCH 3","2018-12-15T16:36:12.000Z","UCpcTrCXblq78GZrTUTLWeBw","FIFATV","17","18.16.12","sp:ty=high,sp:dt=2018-12-15T13:00:00Z,sp:st=soccer,sp:li=fifa_club,sp:ti:home=ANT,sp:ti:away=CHI,Football,match highlights,goals,UAE,United Arab Emirates,Futebol,Fussball,FIFA,official,Soccer,Futbol,Calcio,Voetbal,Club World Cup,Tournament,كرة فوتبول,chivas,mexico,kashima,afc,concacaf,zico","334477","3247","245","1662","https://i.ytimg.com/vi/gNyRlOSnoOs/default.jpg","False","False","Losing finalists at the 2016 edition of the FIFA Club World Cup, Kashima Antlers defeated Mexico's CD Guadalajara in their return to the tournament to set up a semi-final against the team that beat them in that 2016 final, Real Madrid.Follow all the action from UAE across the FIFA Platforms:👉 http://www.youtube.com/fifa👉 http://www.facebook.com/fifaclubworldcup👉 http://www.twitter.com/FIFAcom👉 http://www.instagram.com/fifaworldcup"
"xp6706wVdCI","Anuel AA ➕  Haze - Amanece 🌅 [Official Video]","2018-12-14T03:34:24.000Z","UCRI7hheejBbWS6etTNwMT0g","Anuel AA","10","18.16.12","Anuel AA,anuel,Free anuel,Vidaprimo,haze,anuel aa amanece,como karol g en mi cama,haze amanece,amanece,amanece anuel,aa anuel,anuel y haze,anuel y haze amanece,anuel haze amanece,amanece anuel aa letra,amanece anuel video oficial,anuel amanecer letra,amanece anuel letra,annuel,anuel 2018,anuel aa,amanecer,sola,quiero beber,bubalu,amanecer anuel,que seria,anuel amanece,asesina remix,anuel spiderman,culpables anuel,amanece anuel reaccion","11577421","493510","15005","27029","https://i.ytimg.com/vi/xp6706wVdCI/default.jpg","False","False","Anuel AA ➕ Haze - Amanece 🌅 [Official Video] Subscribanse a mi canal:http://bit.ly/AnuelAAyoutube#RealHastaLaMuerte🎵 Stream/Download 'Amanece' en todas las plataformas digitales de música:http://cinqreleas.es/amaneceEscucha la playlist oficial de 'Real Hasta La Muerte'➤http://bit.ly/2RXTxFIOtras Playlists de Anuel AA➤Official Videos:http://bit.ly/2rAPpjb➤Official Audios: http://bit.ly/2LeIEwE➤ Estrenos:http://bit.ly/2SLAXAyOtros Exitos de Anuel AA🍾Ella Quiere Beber (Remix): http://bit.ly/2zZKNI3❓Que Sería: http://bit.ly/2ErbYzz🃏Hipócrita:http://bit.ly/2BeBKCV👟Yeezy: http://bit.ly/2zXvzTT🥂Brindemos: http://bit.ly/2Qwn9NCSíganme en mis Redes SocialesFacebook-https://goo.gl/0rbZtV  Twitter-https://goo.gl/g4nPiLInstagram-https://goo.gl/PIuWK3 www.freeanuel.com#Amanece #AnuelAA #Haze"
"EL5AohXhX3o","FLORAL FOAM WATERMELON for LUNCH! | Kluna Tik Dinner | ASMR eating sounds no talk espuma floral","2018-12-14T15:34:36.000Z","UCw5hxC9BldHV8cU8PgbNY9g","Kluna Tik","24","18.16.12","ASMR,floral foam,espuma floral,oasis,glitter,colorful,glitters,watermelon,water,art,DIY,creative,relaxing,tingling,pouring,poured,soak,soaked,soaking,sprinkled,sprinkle,sprinkling,colors,finger,stick,satisfying,satisfied,hungry,eating,sounds,swallow,drinking,drink,sleep,crunching,crunch,squishing,sensation,relax,relaxation,klunatik,kluna,tik","2160976","17751","2885","1670","https://i.ytimg.com/vi/EL5AohXhX3o/default.jpg","False","False","➜ I made a melon out of floral foam and glitter and ATE it!➜ SUBSCRIBE: http://goo.gl/n63S8O  New video EVERY WEEK!➜ Hi, I'm Kluna and together with my venus flytrap we eat funny/absurd meals like: mermaids, soap, cement and much more!➜ WARNING: Eating is NOT real, DON'T try this at home!Playlists➜ Kluna Tik Dinner videos: https://www.youtube.com/playlist?list=PL4-ncx89QjT17Jyw0kepjn40BV3UyDZzS➜ Charlie the Venus Flytrap: https://www.youtube.com/playlist?list=PL4-ncx89QjT2aDp7tkK5B1pgN5_0xyapy➜ Kluna & Charlie (Luna tic) eating MINIATURE food: https://www.youtube.com/playlist?list=PL4-ncx89QjT3pucFqseXch5vRUP_IlSLH➜ Business enquiries: charlietheflytrap@gmail.comThese videos contain ASMR sounds like: drinking, swallowing, eating, chewing but no talking.WARNING: Eating is NOT real, DON'T try this at home!I bought some floral foam / oasis at art store with some green and red glitter (DIY store).I cut the floral foam for the relaxing and tingling ASMR sounds, when I filmed it I almost fell asleep.Then I ate the dry floral foam, it tasted weird en really dry (DON'T try this at home).I poured some water on top of the dry floral foam and it soaked all the water up.I sprinkled some colorful green glitter on the outside of the floral foam.Then I sprinkled the red glitters on the inside.For the seeds I stick my finger in the floral foam, it was really satisfying.After that the floral foam with glitters looked like a water melon so I got a little hungry.I grabbed the watermelon and ate it, the water was dripping out of the floral foam just like a real watermelon.Estos videos contienen sonidos ASMR como: beber, tragar, comer, masticar pero no hablar.ADVERTENCIA: comer NO es real, ¡NO lo intentes en casa!Compré un poco de espuma / oasis floral en la tienda de arte con un poco de brillo verde y rojo (tienda de bricolaje).Corté la espuma floral para los sonidos relajantes y estridentes de ASMR, cuando la filmé casi me quedé dormida.Luego comí la espuma floral seca, tenía un sabor extraño y muy seco (NO intentes esto en casa).Vertí un poco de agua sobre la espuma floral seca y empapó toda el agua.Rocié un poco de colorido brillo verde en el exterior de la espuma floral.Luego rocié los brillos rojos por dentro.Para las semillas metí mi dedo en la espuma floral, fue realmente satisfactorio.Después de eso, la espuma floral con brillos parecía un melón de agua, así que tuve un poco de hambre.Tomé la sandía y la comí, el agua goteaba de la espuma floral como una sandía real.ASMR ressemble à ceci: boire, avaler, manger, mâcher mais pas parler.AVERTISSEMENT: Manger n'est PAS réel, NE PAS l'essayer à la maison!J'ai acheté des mousses / oasis florales au magasin d'art avec des paillettes vertes et rouges (magasin de bricolage).J'ai coupé la mousse florale pour les sons relaxants et picotants de l’ASMR. Quand je l’ai filmée, je me suis presque endormie.Ensuite, j'ai mangé la mousse florale sèche, elle avait un goût bizarre et vraiment sec (NE PAS l'essayer à la maison).J'ai versé de l'eau sur la mousse florale sèche qui a tout absorbé.J'ai saupoudré de paillettes vertes colorées à l'extérieur de la mousse florale.Puis j'ai saupoudré les paillettes rouges à l'intérieur.Pour les graines je mets mon doigt dans la mousse florale, c'était vraiment satisfaisant.Après cela, la mousse florale avec des paillettes ressemblait à un melon d'eau, alors j'ai un peu faim.J'ai attrapé la pastèque et l'ai mangée, l'eau coulait de l'écume florale, comme une vraie pastèque.Diese Videos enthalten ASMR-Sounds wie: Trinken, Schlucken, Essen, Kauen, aber kein Sprechen.WARNUNG: Essen ist NICHT echt, probieren Sie es nicht zu Hause!Ich habe Blumenschaum / Oase im Art Store mit grünem und rotem Glitter gekauft (Baumarkt).Ich schnitt den Blumenschaum für die entspannenden und prickelnden ASMR-Klänge ab, als ich ihn filmte, schlief ich fast ein.Dann habe ich den trockenen Blumenschaum gegessen, er schmeckte seltsam und wirklich trocken (probieren Sie das nicht zu Hause).Ich schüttete etwas Wasser auf den trockenen Blumenschaum und er saugte alles Wasser auf.Ich streute etwas bunten grünen Glitzer auf die Außenseite des Blumenschaums.Dann streute ich die roten Glitzer innen.Für die Samen stecke ich meinen Finger in den Blumenschaum, es war wirklich befriedigend.Danach sah der Blumenschaum mit Glitzern aus wie eine Wassermelone, so dass ich etwas hungrig wurde.Ich schnappte mir die Wassermelone und aß sie, das Wasser tropfte wie eine echte Wassermelone aus dem Blütenschaum.Autonomous sensory meridian response (ASMR) is a euphoric experience characterized by a static-like or tingling sensation on the skin that typically begins on the scalp and moves down the back of the neck and upper spine, precipitating relaxation."
