video_id,title,publishedAt,channelId,channelTitle,categoryId,trending_date,tags,view_count,likes,dislikes,comment_count,thumbnail_link,comments_disabled,ratings_disabled,description
"qV3vJ7W3Wk4","भाई दूज पे बनाइये इतनी नरम रसेदार मिठाई जिसे खाते ही भाई आपकी करे बड़ाई | Moong Dal Pitha Sweets","2018-11-08T06:00:01.000Z","UCboINKelMTqbT6QS6gd-Q4A","PAN TO PLATE","26","18.12.11","भाई दूज पे बनाइये इतनी नरम रसेदार मिठाई,भाई दूज मिठाई,moong dal pitha sweets,bengali sweets,sweets recipe,bhai dooj mithai,rasedar mithai,moong dal pitha in hindi,sweets recipe in hindi,soft sweets,pan to plate,sweets by pan to plate,moong dal pitha,bhaubeej mithai,bhaubeej sweets,bangladeshi sweets in hindi,মিষ্টি,नरम रसेदार मिठाई,मिठाई,mithai recipe,moong pitha recipe,recipe of sweets with rice flour,recipe of sweets","602612","5461","561","421","https://i.ytimg.com/vi/qV3vJ7W3Wk4/default.jpg","False","False","sweets, bhaubeej mithai, bhai dooj mithai, mitha recipe, recipe of mithai, recipe of gulab jamun, recipe of rasgulla,sweets, indian sweets, moong dal pitha recipe, indian mithai,mithai,মিষ্টিEkdum naram aur juicy mithai moong dal se bani hui aap sab ke liye is bhaubeej ke tyohaar pe, jarur banaiye apne bhai ke liye aur bhai dooj ki khushiyan manaiye.This juicy new sweet recipe is made from moong dal and rice flour.Mujhe umeed hai aap ko ye recipe bohot pasand ayegi, agar aap ise try karte hain to jarur feedback kariye.#bhaidoojmithai  #Sweets  #bhaubeejmithaiRoshbara mithai: https://youtu.be/vsAgONEuoC0Share, Support, Subscribe!Youtube: https://www.youtube.com/channel/PANTOPLATETwitter: https://twitter.com/Pan_to_PlateFacebook: https://www.facebook.com/PAN2PLATEInstagram: https://www.instagram.com/pan_to_plateGoogle Plus: https://plus.google.com/u/0/109069158001852301680Thank you very much for watching my channel."
"mniZ3WZ-lJc","🔴 [Live] Bhandal Dona (Kapurthala) Kabaddi Cup 11 Nov 2018","2018-11-11T17:39:10.000Z","UCw3P0coE7lUv5v0HoQfRZhw","Kabaddi365.com","17","18.12.11","Kabaddi365.com,kabbadi tournament,kabaddi videos,kabaddi photos,365kabaddi,kabbadi,kabaddi live,livekabaddi,Live,Bhandal Dona,Kapurthala,Kabaddi,Tournament,11 Nov 2018,2018","200199","1981","126","11","https://i.ytimg.com/vi/mniZ3WZ-lJc/default.jpg","False","False","🔴 [Live] Bhandal Dona (Kapurthala) Kabaddi Cup 11 Nov 2018🖐🏿👉Don't Forget to Like, Comment, Share and Subscribe to Kabaddi365.com Youtube Channel👉ਤੁਸੀ ਆਪਣੇ Android ਤੇ iPhone ਫੋਨ ਲਈ Kabaddi365 ਦੀ ਐਪ ਇਨਸਟਾਲ ਕਰਨ ਲਈ ਥੱਲੇ ਦਿੱਤੇ ਲਿੰਕ ਤੇ ਕਲਿਕ ਕਰੋ ! http://www.kabaddi365.com/app👉ਬੈਸਟ ਕਬੱਡੀ ਮੈਚ ਦੇਖੋ : http://www.youtube.com/user/365kabaddi👉ਫੇਸਬੁੱਕ ਪੇਜ:- http://www.facebook.com/kabaddi365👉ਸਾਰਾ ਟੂਰਨਾਂਮੈਂਟ ਦੇਖਣ ਲਈ: http://www.youtube.com/user/kabaddi365f👉Best Video Channel:- http://www.youtube.com/user/365kabaddi👉Facebook Page:- http://www.facebook.com/kabaddi365👉Full Video Channel:- http://www.youtube.com/user/kabaddi365f"
"WrYkILbnhX8","Video Call Fail | RishhSome","2018-11-10T14:01:47.000Z","UCz6l7YPnfyxvbVD7LVuNEow","Rishhsome","23","18.12.11","rishhsome,vines,rishabh rana,rishabh,funny,laugh,delhi,india,popular indian,funny videos,desi vines,dumb,dumbest,cute,desi popular,video call,video call fail,video chat,snapchat,fac","272172","22615","712","1018","https://i.ytimg.com/vi/WrYkILbnhX8/default.jpg","False","False","Video call fail!! We all have such friends who don.t know how to talk to girls.I have created my store on Spoyl and have hand-picked my fave styles just for you. So, download the Spoyl app now    https://spoyl.onelink.me/894465516/rish   and shop my collection. Avail 15% Off on my collection - Use Code : RISH15🔥⚡️WATCH LIT GIRL: https://www.youtube.com/watch?v=H9fFdSAUzlU ⚡🔥Cast:Rishabh Ranahttps://www.instagram.com/rishhsome/Vikram Bhuihttps://www.instagram.com/vikramamar/Twarita Nagarhttps://www.instagram.com/twaritanagar/DOP:LuckyDirector:Vikram BhuiScript Writer:Rishabh & VikramEditor:Ankit MotghareFollow my social media handles:Facebookhttps://www.facebook.com/rishhsome/?fref=tsInstagramhttps://www.instagram.com/rishhsome/Twitterhttps://www.twitter.com/rishhsome/"
"DhON4J33gQc","Thank You India ...","2018-11-10T17:00:01.000Z","UC_hoQDD6zKcIqpIYLsFbBeA","Mo Vlogs","22","18.12.11","mo vlogs,dubai,india,delhi,show,first show,singing,performance,indian song,indian music,mo vlogs india","762021","34474","1894","4835","https://i.ytimg.com/vi/DhON4J33gQc/default.jpg","False","False","GET YOUR TICKETS: http://www.bit.ly/moandlanatourMy Instagram : mo_vlogs_https://www.instagram.com/mo_vlogs_/?hl=enMy Sisters Instagram : lanarose786 https://www.instagram.com/lanarose786/?hl=en My Snapchat: mohamedooMy Sisters Snapchat: lana.rose786Twitter: https://twitter.com/mo_vlogs_My sister's youtube channel: https://www.youtube.com/channel/UC6sa7vq4zBuS5DxTUCWCchQLana's Facebook : https://www.facebook.com/Lana-Rose-1680371262242746/My Facebook Page : https://www.facebook.com/Mo-Vlogs-1731417100437873/My Email: movlogsbusiness@gmail.comMy Sisters Email: Lana.rose.business@gmail.comfluffing a Duck by Kevin MacLeod is licensed under a Creative Commons Attribution license (https://creativecommons.org/licenses/by/4.0/)Source: http://incompetech.com/music/royalty-free/index.html?isrc=USUAN1100768Artist: http://incompetech.com/Dog Park - Silent Partner https://youtu.be/Zzm4A3xYUp8-Sneaky Snitch Kevin MacLeod (incompetech.com) Licensed under Creative Commons: By Attribution 3.0 http://creativecommons.org/licenses/b... Music promoted by Audio Library https://youtu.be/7-rXQALDv-4"
"YUTBO54Ru8w","10 Deleted Scenes in Sarkar Movie | #Sarkar #ARMurugadoss | #Thalapathy #Vijay #SarkarIssue","2018-11-09T07:01:41.000Z","UCnw6jUU0KaCjgAiRsbuiCgg","Cineulagam","24","18.12.11","Sarkar,ARMurugadoss,Vijay,Thalapathy,Ilayathalapathy,SarkarIssue,ThalapathyVijay,SarkarPolitics,SarkarPoliticalSecrets,SarkarAIADMKIssue,TamilCinemaNews,TamilNadu,TNPoliticians","338342","1331","448","130","https://i.ytimg.com/vi/YUTBO54Ru8w/default.jpg","False","False","#ThalapathyVijay #ARMurugadoss #SarkarPolitics #SarkarPoliticalSecrets #SarkarAIADMKIssue #TamilCinemaNews #TamilNadu #TNPoliticians #India #KeerthySuresh #VaralaxmiSarathkumar #YogiBabu #RadhaRavi #ARRahman #SarkarTamilMovie #SarkarStory #SarkarFullMovie #VijaySarkar Log-on to http://www.cineulagam.comSubscribe: http://www.youtube.com/subscription_center?add_user=cineulagamFacebook: http://www.facebook.com/cineulagam"
"fSZTeE3VPO0","Funny Hostel Life (HOSTEL KI ZINDAGI) | The Baigan Vines","2018-11-10T13:12:38.000Z","UCsHhB0DI59ru6T4fp5lb4Jw","The Baigan Vines Official","24","18.12.11","hyderabadi,funny video,hyderabadi jokes,hyderabadi films,hyderabadi comedy,baigan vines,tbv,baigan vines college,college funny videos,funny hostel life,hostel ki zindagi,hostel life,tbv college,exams,students,funny student videos,funny teacher,hostel wala room,hyderabad,comedy,college life,student life,soty,exam cheating,funny exams,school life,engineering life,commerce life","130942","13162","232","2872","https://i.ytimg.com/vi/fSZTeE3VPO0/default.jpg","False","False","Please Hit more than 5000 Comments and 10000 Likes on this VIDU Dictionary download Below :  https://dn66q.app.goo.gl/blacksheepUDContest link: https://goo.gl/forms/h2UO2pMiJLfXXq1H2Check out the funny yet memorable Hostel life most of us have gone through! To Promote your Brand/Product, mail us for details on : - Thebaiganvines@gmail.com- Contact@thebaiganvines.comOur 2nd CHANNEL : https://bit.ly/2DkejvvINSTAGRAM : https://bit.ly/2QeTYKYFACEBOOK : http://bit.do/ez58qThe Baigan Vines bringing You The Best Hyderabadi Comedy/Funny Clips, Skits, Vines, Social experiments, Pranks and Much More !!!#HostelLife #Share #Subscribe indian comedy funny,indian comedy funny video,indian comedy funny movies,indian comedy funny clips,indian comedy funny videos 2016,dehati indian comedy funny video,funny indian comedy,dehati india funny comedy,funny stand up comedy india,india vs pakistan funny comedy,indianfunny boy full comedy,indian best funny comedy,funny indian baby comedy,funny british indian comedy,indian bangla funny comedy,indian funny comedy video clips,indianfunny show comedy circus,funny indian comedycompilation,indian funny comedy channel,funny indian child comedy,indian dehati funny comedy,indian funny comedy dance,full funny comedy indian dehati,funny indian stand up comedy english,funny indian english comedy,funny friend indian comedy,indian funny comedy film,indian funny guy comedy,indian hot funny comedy videos,funny stand up comedy indian hindi,indian hindi funny comedy,hindi comedy funny,hindi comedy funny video,hindi comedy funny movie,hindi comedy funny jokes,hindi comedy funny scene,new hindi comedy funny video,new hindi comedy funny,hindi comedy videos funny 2017,funny stand up comedy hindi,funny comedy videos hindi movie,funny indian movie scene comedy scene,most funny indian comedy,funny comedy movies 2017 indian,indian comedy pranks funny videos,funny stand up comedy indian,indian funny show comedy,funny indian comedy scenes,south indian funny comedy,indian whatsapp comedy videos funny unlimited,whatsapp video funny comedy indian,indian comedy videos funny 2017 bollywood scenes best,bollywood scenes comedy,bollywood scenes action,bollywood scenes funny,bollywood funny scenes action,bollywood comedy scenes all the best,bollywood best scenes action,bollywood movies best scenes,behind the scenes bollywood movies funny,bollywood movies comedy scenes,funny comedy scenes bollywood,bollywood drama romantic scenes,bollywood movies dance scenes,best bollywood scenes ever,funniest bollywood scenes ever,funny bollywood scenes eng sub,funny bollywood scenes ever,bollywood emotional scenes"
"gRKyYq2Rhzo","Tate Bhala Paaibaku | Romantic Music Video | Raj Rajesh & Sradha | Lalit Krisnan | Sidharth TV","2018-11-10T13:03:42.000Z","UCbBWncD3X_dfXwxmj4KwJnA","Sidharth TV","24","18.12.11","odia hit song,sarthak,sarthak music,odia film,odia movie,odia hd,sarthak film,odia album,hd,hd 1080,new,latest,odia music,2019,2018,91.9 sarthak fm,jukebox,new odia song,odia non film song,oriya,odia video song,odia song,odia gita,odia gana,odia jatra,odia bhajan,sidharth,sidharth music,sidharth tv,sidharthmusic,sidharthtv,sitaram agrawal,namita agrawal,tate bhala paibaku","649111","8339","564","708","https://i.ytimg.com/vi/gRKyYq2Rhzo/default.jpg","False","False","ଧ୍ୟାନ ଦିଅନ୍ତୁ - ଏବେ ସାର୍ଥକର ନୂଆ ନାଁ ହେଉଚି ସିଦ୍ଧାର୍ଥ !Sidharth TV ଏବଂ Sidharth Music ପ୍ରସ୍ତୁତ ଏହି ଭିଡିଓଟି ଯଦି ଭଲଲାଗିଥାଏ ତେବେ ଆମ channel କୁ Like ଏବଂ Share କରନ୍ତୁ I ଆମ ସହ ଯୋଡିହୋଇ ରହିବା ପାଇଁ ଏବଂ ସବୁଦିନ ନୂଆ ନୂଆ video ର  Notification ପାଇବା ପାଇଁ  Sidharth TV ଏବଂ Sidharth Music ର YouTube Channelକୁ Subscribe କରନ୍ତୁ ଓ Bell 🔔 ର Button ନିଶ୍ଚୟ ପ୍ରେସ୍ କରନ୍ତୁ I ଧନ୍ୟବାଦ୍ ISong : Tate Bhala PaaibakuSinger : Lalit KrisnanCast : Raj Rajesh & SradhaLyrics : Arun MantriMusic : Baidyanath DashEditor : BalramDOP : D.ShrinuDI, Graphics & Publicity Design : Binay SutarDirector : Sangram NayakRecorded At: Sidharth Music Studio. Voice Dubbing & Mixing By: Swapnajit Sabat & Munna at Sidharth Music StudioMastering By: Sitaram Agrawal & Swapnajit Sabat at Sidharth Music StudioBanner : Sidharth TVProducer : Sitaram Agrawal & Namita AgrawalMusic Label : Sidharth MusicLike us on Facebookhttps://www.facebook.com/sidharthtvofficial/https://www.facebook.com/SarthakFM/https://www.facebook.com/odiaenews/#SidharthTV #SitaramAgrawal #NamitaAgrawal #SidharthMusic"
"xxT4hXkfX_8","sarkar issue - sarkar ban we will not be silent seeman on sarkar controversy, seeman latest speech","2018-11-08T12:30:04.000Z","UCe1Nb-N6XgLFHfGxZjIkF8A","Red Pix 24x7","25","18.12.11","redpix,red pix,red pix 24x7,news tamil,tamil,tamil live news,tamil news,tamil news today,tamil news live,latest tamil news,tamil nadu news,news in tamil,sun tv news,sun news,sun news live,news,chennai news,sarkar movie,sarkar tamil movie,sarkar issue,sarkar controversy,sarkar latest news,seeman speech,seeman latest,seeman latest speech,seeman tamil,sarkar review,seeman birthday,sarkar,seeman","1298954","35541","1386","3145","https://i.ytimg.com/vi/xxT4hXkfX_8/default.jpg","False","False","sarkar issue - ban on sarkar we will not be silent seeman on  sarkar controversy, seeman latest speech sarkar latest news,naam tamilar katchi leader seeman, who is celebrating his birthday today, told redpix that he and his party will not be silent if isarkar was banned in tamilnadu. two day after the release of actor Vijay's latest film Sarkar, Minister minister jayakumar warned action against the screening of the film that is currently running to packed screens across theatres in the state.Speaking at a press conference today, Minister jayakumar, People will not accept these political motivesWhile rightly conceding that there was no relationship between the state government and the Central Board of Film Certification, jayakumar, however, said, But still, it has come to our attention. We will also take this to the attention of the Chief Minister. If they(the makers) remove these scenes, then it is good. If not, we will think of the next course of action.in the meanwhile tamil nadu law minister had a urgent meeting to explore the legal option to ban sarkar movie. While reacting to this development seeman said that, sarkar movie reflects the current political situations and if the government issues a bann for the movie we will organise a massive protest. sarkar movie, sarkar tamil movie, sarkar issue, sarkar controversy, sarkar latest news,seeman speech, seeman latest, seeman latest speech, seeman tamil, tamil, sarkar review, seeman birthday, sarkar, More tamil news tamil news today latest tamil news kollywood news kollywood tamil news Please Subscribe to red pix 24x7 https://goo.gl/bzRyDm  #tamilnewslive sun tv news sun news live sun news"
"XpXgcySclAw","ஒரே மாதிரி இருக்கும் நடிகைகள் | Actress Look A Like In Tamil Cinema","2018-11-10T09:49:20.000Z","UC7wwTyPDetsxqT2ZUj_dVoA","AllCineGallery - Tamil","24","18.12.11","Tamil Cinema News,Tamil Movies,Tamil Cinema,Tamil Cinema News Latest,Allcinegallery Tamil,Tamil Cinema Gossips Latest,Tamil Cinema Seithigal,Kollywood News,Kollywood Latest News,Kollywood Gossips,Tamil Cinema News Today,Tamil Cinema New Updates,Actress Look A Like,Actress Look Alikes,Actress Look A Like In Tamil Cinema,Tamil Actress Look A Like","45903","246","75","96","https://i.ytimg.com/vi/XpXgcySclAw/default.jpg","False","False","ஒரே மாதிரி இருக்கும் நடிகைகள் | Actress Look A Like In Tamil Cinema.Subscribe for more videos: https://goo.gl/AWplFK"
"Bd6GV6uDyeI","KASROCK | Nte Changhai Nee Nthpaa Enghane | Directors Cut | Official Video","2018-11-09T12:30:22.000Z","UCsbrh297T27EZVf8qnLQTdQ","Millennium Videos","24","18.12.11","KASROCK,KASROCK Song,Song KASROCK,Nte Changhai Nee Nthpaa Enghane,Nte Changhai Nee Nthpaa Enghane Song,new album song,Nte Changhai Nee Nthpaa Enghane Album Song,latest album Song,kasrock unplugged,kasrock band team,ZAFAR,ZAFAR - Despacito Malayalam Mashup","179634","9340","442","538","https://i.ytimg.com/vi/Bd6GV6uDyeI/default.jpg","False","False","Watch KASROCK | Nte Changhai Nee Nthpaa Enghane | Directors Cut | Official VideoDirected by | sunaizMusic | zafarProducer | shamseer shan & lulu shamseerDop | aswin k rChief associate director | arun c KumarEditing and colouring | linoy varghese paridayilCo producers | Saleel lukku, Shabeer Kargil ,Venkitesh S V, Sachin shyam,Dileep Sushama Dinesh,Assistant director | afreed AhmedAssociate cameraman | Vishnu aFocus | amal , jinuCast | mahfooz Ahmed , Lulu shamseer , Abdul Khader Kallatra Kizhur,farzi, adil,shan mass , adil , shamseer shan, akshitha☟REACH US ONWeb : https://www.millenniumaudios.comFacebook :https://www.facebook.com/MillenniumAudiosOfficial/Twitter :https://twitter.com/millenniumaudioBlog : http://www.millenniumaudios.blogspot.in/"
"SRiZubSwqqU","HYDERABADI BACHE KA KIRRAK INTERVIEW 😆😂😆😂","2018-11-11T10:10:19.000Z","UCQ86kqo-kULs8EU8ZqQTE1A","Hyderabad Diaries","24","18.12.11","Hyderabad,Diaries,hyderabad diaries,adnan shahrukh khan,shahrukh k adnan,hyderabadi,abrar khan,kirrak,funny,comedy,angaar,cheeqmaar,interview,new","57484","5184","178","467","https://i.ytimg.com/vi/SRiZubSwqqU/default.jpg","False","False","SUBSCRIBE! New Videos Every week!For Business Inquiry : hyderabaddiaries@yahoo.com#hyderabadddiaries #interview #hyderabadi#hyderabadicomedy#hyderbadifunny"
"4ya68xGA7oY","ദെ..എന്‍റെ സ്വഭാവം മഹാ ചീത്തയാണ്‌ ട്ടോ | Mohanlal , Manju Warrier , Priya Raman - Aaraam Thampuran","2018-11-10T07:12:04.000Z","UCeM3IXubMXTH3LdsMQ3VAhw","Saina Movies","24","18.12.11","aaram thampuran,aaram thamburan full movie,aaram thampuran mohanlal,aaram thamburan scenes,aaram thamburan comedy,aaram thamburan dialogues,aaram thamburan malayalam full movie,aaram thamburan mohanlal intro,aaram thamburan fight,aaraam thampuran harimuraleeravam,aaraam thampuran paadi,aaram thamburan super scenes,aaram thamburan songs hd,aaram thamburan status,aaram thamburan super dialogue","328352","780","159","96","https://i.ytimg.com/vi/4ya68xGA7oY/default.jpg","False","False","♦Subscribe Us: https://goo.gl/6mfvL8♦Like Us: https://goo.gl/SYUax3♦Follow Us: https://bit.ly/2z0UhleAaraam Thampuran is a 1997 Indian Malayalam action-drama film written by Ranjith and directed by Shaji Kailas. It stars #Mohanlal , Narendra Prasad, and Manju Warrier. The film's songs were composed by Raveendran."
"OMBLbkLFeGY","Fatima Sana Shaikh : ‘Aamir Khan criticises a lot! ‘ #Part1 #ThugsofHindostan","2018-11-09T15:46:14.000Z","UCjS8OCmHuWdl5aWDUuU0M4g","Siddharth Kannan","24","18.12.11","Fatima Sana Shaikh,‘Aamir Khan,Thugs of Hindostan,Katrina Kaif,Amitabh Bachchan,behind the scence,sid,thugs of hindostan trailer,thugs of hindostan full movie,Movie Review,bollywood latest movie 2016,hindi movie,Siddharth Kannan,finest moments,bollywood stars,surprises,controversies,gossip,Kannan,Siddharth,siddarth kanan latest video,latest video,sid kannan inconversation with,movie review,rj sid kanan,radio jockey sid kanan,thug of hindostan songs","790115","7183","2247","1125","https://i.ytimg.com/vi/OMBLbkLFeGY/default.jpg","False","False","Click here to Subscribe :- https://bit.ly/SiddharthKannanFollow Me On - Facebook - https://www.facebook.com/sidk313Instagram - https://www.instagram.com/sid_kannanTwitter - https://twitter.com/sidkannanDigitally Powered by One Digital Entertainment [https://www.facebook.com/onedigitalentertainment] [http://www.onedigitalentertainment.com] #ThugsofHindostan #AamirKhan #SiddharthKannan"
"Yo99xW6td5E","கடைசி நேரத்தில் ஆப்ரேஷனைதடுத்து நிறுத்திய ஆனந்தி காரணம் என்ன தெரியுமா | Nayaki Serial Review |Nayaki","2018-11-11T10:43:00.000Z","UCGkOEOGTHGrW4P_-AcAa7LA","Daily Tamil Serial Review","22","18.12.11","[none]","71880","375","44","15","https://i.ytimg.com/vi/Yo99xW6td5E/default.jpg","False","False",""
"FFGViT9Dji8","Reacting to YouTubers Reacting to Pewdiepie vs 🅱Series","2018-11-09T20:04:34.000Z","UC-lHJZR3Gqxm24_Vd_AJ5Yw","PewDiePie","24","18.12.11","SATIRE,react,mr beast","5592392","477132","6482","53667","https://i.ytimg.com/vi/FFGViT9Dji8/default.jpg","False","False","YouTubers react video: https://www.youtube.com/channel/UCHEf6T_gVq4tlW5i91ESiWgBECOME SPONSOR: https://youtube.com/pewdiepie/join 🙇MERCH: https://represent.com/pewdiepie 🔥SUBMIT MEMES: https://www.reddit.com/r/PewdiepieSubmissions/ ʚ(•__AD| Shop my headphones: http://rzr.to/edgar__TSUKI: https://tsuki-co-uk.myshopify.com__:::::::My Setup:::::::: (Affiliate links)Chair:: ONLY 399 !USA & Asia: https://usa.clutchchairz.com/product/pewdiepie-edition-throttle-series/Europe: https://europe.clutchchairz.com/en/product/throttle-series-pewdiepie-edition/Canada: https://canada.clutchchairz.com/product/throttle-series-pewdiepie-edition/Elgato green screen: http://e.lga.to/PewDiePie (Affiliate)__:::::::Check out: ::::::::http://store.steampowered.com/app/703840/Animal_Super_Squad/(A game I helped make and affiliated with)__Outro:Animation: https://www.youtube.com/user/jae55555Song: https://www.youtube.com/channel/UC3e8EMTOn4g6ZSKggHTnNng"
"djfeJrrX2Hw","Exclusive: Interview with Superstar Rajinikanth | Robot 2.0 | Part 1 | Zee Tamil","2018-11-09T07:16:37.000Z","UC_wIGmvdyAQLtl-U2nHV9rg","Zee Tamil","24","18.12.11","zee Tamil,rajini interview zee tamil,rajini interview zee tamil 2018,zee tamil rajini interview,robot 2.0 interview,robot 2.0 interview zee tamil,actor rajinikanth latest interview,zee tamil rajinikanth interview,robot 2.0,director shankar zee tamil,actor akshay kumar in 2.0,akshay kumar robot 2.0,amy jackson robot 2.0,rajinikanth latest interview zee tamil","482923","14678","688","1102","https://i.ytimg.com/vi/djfeJrrX2Hw/default.jpg","False","False","Watch Latest Zee Tamil Serials & Shows Full Episodes Online on ZEE5 App. Please Click below to DOWNLOAD the ZEE5 app: - Playstore: https://play.google.com/store/apps/details?id=com.graymatrix.did- iTunes: https://itunes.apple.com/in/app/ozee-tv-shows-movies-more/id743691886Visit our website - https://www.zee5.com For more  Latest Updates Connect with us on Social Media: - Facebook - https://www.facebook.com/ZEE5/ - Instagram - https://www.instagram.com/zee5 - Twitter - https://twitter.com/ZEE5India"
