video_id,title,publishedAt,channelId,channelTitle,categoryId,trending_date,tags,view_count,likes,dislikes,comment_count,thumbnail_link,comments_disabled,ratings_disabled,description
"xAnZg92B90s","2018 CMA Awards  - Keith Urban - Entertainer of The Year","2018-11-15T07:22:53.000Z","UC_IpSl6O_-IRAA6fiNs05Gg","ABC","24","18.19.11","American Broadcasting Company,ABC,ABC Network,Television,TV,what to watch,trailer,tv show,Television Program,CMA Awards,CMA Awards Show,2018 CMA Awards,country music,keith urban,entertainer of the year,acceptance speech,emotional","371894","2500","167","386","https://i.ytimg.com/vi/xAnZg92B90s/default.jpg","False","False","The moment everyone will be talking about! Keith Urban's Entertainer of the Year acceptance speech at the 2018 CMA Awards is everything!!Subscribe: http://goo.gl/mo7HqT"
"ZozJQY3j-IM","Garth Brooks' Stronger Than Me Was a CMA Tear-Jerker","2018-11-15T04:14:33.000Z","UCNl9LUgT_E1hxd4JMinnwkw","Taste of Country","10","18.19.11","Garth Brooks,Stronger Than Me,New Garth Brooks song,cma song,cma performances,stronger than me garth brooks,garth brooks cmas,cmas,country music awards,garth brooks stronger than me,garth brooks song for trisha,garth brooks song for wife,garth brooks live,garth brooks songs,#STM","459812","1772","967","379","https://i.ytimg.com/vi/ZozJQY3j-IM/default.jpg","False","False","#GarthBrooks performed his brand new song #StrongerThanMe for his wife #TrishaYearwood at the 2018 #CMAAwards. It was a tear-jerker, just like he said it would be. If you're new, Subscribe! → http://bit.ly/subscribe-taste-of-country Download the app → http://tasteofcountry.com/app/ Go here → http://tasteofcountry.com/Like us → https://www.facebook.com/thetasteofcountryFollow us → https://twitter.com/tasteofcountryGet our newsletter → http://tasteofcountry.com/newsletter/#CountryMusic #Nashville"
"k86KDFh_q6E","Dumplin' | Official Trailer [HD] | Netflix","2018-11-14T15:00:10.000Z","UCWOA1ZGywLbqmigxE4Qlvuw","Netflix","24","18.19.11","Netflix,Trailer,Netflix Original Series,Netflix Series,television,movies,streaming,documentary,comedy,drama,08282016NtflxUSCAN,watch movies,Dumplin,Dolly Parton,Jennifer Aniston,Danielle Macdonald,Beauty Pageant,Julie Murphy,Movie,Netflix Film,Dove Cameron,Ginger Minj,Harold Perrineau,Anne Fletcher,Kristin Hahn,Odeya Rush,Luke Benward,Dumplin',DMPLmt1114!,PLvahqwMqN4M1VvGtFng3qLuz13DiSbOoy,PLvahqwMqN4M35d1XdbUEWZT_r36Z6tIz3,drag queens,drag,LGBTQ,plus size","1918528","42850","1972","2468","https://i.ytimg.com/vi/k86KDFh_q6E/default.jpg","False","False","Directed by Anne Fletcher, DUMPLIN’ follows an outspoken plus-sized teenage girl named Willowdean (Danielle Macdonald), who’s known as Will to her friends and Dumplin’ to her mother (Jennifer Aniston), a former beauty queen who now runs the local Miss Teen Blue Bonnet pageant. In her small Texas town, Will confidently ignores comments about her weight and listens to Dolly Parton songs obsessively. But when she decides to enter her mother’s pageant in protest, her bold move encourages other contestants to follow in her footsteps, redefining the town’s traditions in the process.Add Dumplin' to My List:https://www.netflix.com/title/80201490#Netflix #Dumplin' #WillowdeanDicksonSUBSCRIBE: http://bit.ly/29qBUt7About Netflix:Netflix is the world's leading internet entertainment service with 130 million memberships in over 190 countries enjoying TV series, documentaries and feature films across a wide variety of genres and languages. Members can watch as much as they want, anytime, anywhere, on any internet-connected screen. Members can play, pause and resume watching, all without commercials or commitments.Connect with Netflix Online:Visit Netflix WEBSITE: http://nflx.it/29BcWb5Like Netflix Kids on FACEBOOK: http://bit.ly/NetflixFamilyLike Netflix on FACEBOOK: http://bit.ly/29kkAtNFollow Netflix on TWITTER: http://bit.ly/29gswqdFollow Netflix on INSTAGRAM: http://bit.ly/29oO4UPFollow Netflix on TUMBLR: http://bit.ly/29kkemTDumplin' | Official Trailer [HD] | Netflixhttp://youtube.com/netflix"
"ajN57m_OSpY","Ellie Goulding, Diplo, Swae Lee - Close To Me (Official Video)","2018-11-14T15:00:01.000Z","UCvu362oukLMN1miydXcLxGg","EllieGouldingVEVO","10","18.19.11","Ellie,Goulding,Diplo,Swae,Lee,Close,To,Me,Polydor,Records,Pop","4580017","128671","3256","4532","https://i.ytimg.com/vi/ajN57m_OSpY/default.jpg","False","False","LISTEN: https://ellie.lnk.to/CloseToMeID Location: Budapest, HungaryMore Ellie:http://www.elliegoulding.comhttp://www.instagram.com/elliegouldinghttp://www.facebook.com/elliegouldinghttp://www.twitter.com/elliegouldingSign up to the official Ellie Goulding mailing list: https://ellie.lnk.to/signup"
"OSye8OO5TkM","Hozier - Movement (Official Video)","2018-11-14T16:58:26.000Z","UCdOcBpu5O2V0JhFFs9k-Ouw","HozierVEVO","10","18.19.11","Hozier,Movement,Universal-Island,Records,Ltd.,Alternative","1591629","77020","904","3079","https://i.ytimg.com/vi/OSye8OO5TkM/default.jpg","False","False","Listen to 'Movement' here: https://Hozier.lnk.to/MovementIN Follow Hozier  :  https://Hozier.lnk.to/FollowID  Hozier Store : https://Hozier.lnk.to/StoreIDMusic: HozierStarring: Sergei PoluninDirectors: UsProduction Comp: Academy FilmsProducer: Tabetha Glass-JackmanExecutive Producer: Leah JoyceExecutive Producer: Sheira Rees-DaviesDOP: Sebastian Wintero Choreographer: Sergei Polunin Edit House: TrimEditor: Vid PricePost Production: The MillVFX Supervisor: James Mac2D artist: Amit KambliColourist: James BamfordWith thanks to PanavisionMusic video by Hozier performing Movement. © 2018 Rubyworks Limited, under assignment to Universal Music Operations Limitedhttp://vevo.ly/5FWxxS"
"R4LJAVNpVFI","My Life With Tourette Syndrome","2018-11-14T18:00:02.000Z","UCGDV4-Gr3gyc-eGCgRtXknw","ACTUALLY HAPPENED","1","18.19.11","Tourette,kid,storybooth,story booth,problem,doctor,syndrome,school,student,lonely,teacher,depression,tics,The Voice,support,animated channel,actually happened,pain","925623","24810","970","6233","https://i.ytimg.com/vi/R4LJAVNpVFI/default.jpg","False","False","★ Subscribe ACTUALLY HAPPENED: https://bit.ly/2J5HP7jThis is Pete. He has a problem that maybe you’ve heard about or seen, and which you’ll probably find funny, annoying or creepy. He has Tourette’s syndrome. He’s not ashamed of it – he’s got used to it. Pete wants to tell you how he found a way to turn his condition to his advantage rather than accept it was a problem.He was an absolutely normal kid until one morning when he woke up and felt the urge to twitch his head for no reason. And then do it one more time. And again. He was standing in the center of his bedroom doing strange movements, and he couldn’t control it. Okay, he thought, maybe it’s some muscular spasm and it will pass. It didn’t pass even after several days. What was even worse was that he had a couple of other symptoms. Like raising his hands and winking. And the worst thing was that he wanted to squeak like a pig, like this *squeak*, from time to time, and he didn’t understand why. Of course, all this became pretty noticeable, and he went to see his parents feeling pretty stressed. They took him to the doctor at once, and that’s where he was diagnosed with Tourette’s syndrome.Pete had never heard of it before, and he was certain that if he had seen someone else with these symptoms he would have laughed or been disgusted. And now he had to go to school and explain that this was how he would behave for the time being. He was only ten at the time. He still remembers what it felt like standing among his classmates and saying he had a condition, how embarrassing it felt to constantly move, and his classmates laughing at his every single tic. Sure, it certainly looked like he was having fun, but really, it’s not pleasant or entertaining at all! When he tried to explain that no one actually understood his problem, everyone just thought that it was Pete’s weird way of expressing himself.And that’s how he became isolated from everyone. No one wanted to be around him anymore; and the teachers didn’t even try to give him any support. Even worse, Pete remembers how once his teacher became irritated by his winking – she thought he was just making faces, and put him at the back of the room away from everyone else. There he remained, isolated both physically and psychologically. Pete got to know some other guys with Tourette’s. He thought that he wouldn’t feel so lonely if he got to know other people with the same problem. Unfortunately, Tourette’s is tricky, because when you see other people’s tics, your own tics become worse. And even if a situation like this looks comical in a way, all these tics can be very tiring and debilitating. So Pete came away from these meetings feeling really exhausted, and tried to avoid other Tourette’s sufferers from then on. In the meantime, the situation with his tics was getting worse – more movements appeared, as did more sounds, even abusive language, and in the end he reached his mid-teens looking like a foul-mouthed perpetual motion machine in deep depression.At that time, Pete was browsing a lot on the web, because online no one was disturbed by his tics. One day, he came across a video of a Tourette’s guy who was singing on “The Voice”, and Pete was amazed to see that he performed flawlessly and beautifully, without a single twitch. It was then that he had the idea that maybe he could give it a try himself, and he even knew what he could do. Pete he’d always been quick-witted and had a good sense of humor, so he thought that he could maybe try a couple of times to do stand-up comedy pieces for a small audience, just to get him out of his house a bit.Pete immediately sat himself down to write punchlines, and the ones he came up with made even him laugh. It was so exciting that he completely forgot his depressed state – he was just so drawn into the process. The thing was that his Tourette’s tics could be pretty amusing if he looked at them from an outsider’s perspective, and combined with his comic monologue, the effect was hilarious. And what he wanted to tell people was that having his condition was not a stigma; he wasn’t an idiot or anything, he was just a regular guy.Pete performed his first show surrounded by Tourette’s patients. The effect was even better than he had expected. He got a standing ovation, which was a bit undeserved in his view, but still pleasant. What’s more, Pete learned that he really could control his tics better when he was on stage. He went to the local open mic comic club and performed in front of the locals, who first were taken aback by his strange behavior but by the end of the performance were laughing their heads off. And the most important part was that they were laughing not at him, but with him.He’s now taken his comedy outside the club, and everywhere his audiences like him a lot, while Pete himself feels a lot better – more in control and not so lonely anymore.Music by Epidemic Sound: https://www.epidemicsound.com"
"07vZD9XJiNQ","Michelle Obama and her mother on adjusting to life at White House","2018-11-14T14:10:30.000Z","UC-SJ6nODDmufqBzPBwCvYvQ","CBS This Morning","25","18.19.11","video,cbs,news,Michelle Obama,campaigning and politics,couples therapy,Marian Robinson,Obama’s mother","715532","10222","1283","2352","https://i.ytimg.com/vi/07vZD9XJiNQ/default.jpg","False","False","Michelle Obama says it was never easy being the wife of a driven politician. The demands of campaigning and politics strained their marriage, and they sought help in couples' therapy. In their first national TV interview together, Gayle King also spoke with Marian Robinson, Obama’s mother, about her eight years in the White House.Subscribe to the CBS This Morning Channel HERE: http://bit.ly/1Q0v2hEWatch CBS This Morning HERE: http://bit.ly/1T88yARWatch the latest installment of Note to Self, only on CBS This Morning, HERE: http://cbsn.ws/1Sh8XlBFollow CBS This Morning on Instagram HERE: http://bit.ly/1Q7NGnYLike CBS This Morning on Facebook HERE: http://on.fb.me/1LhtdvIFollow CBS This Morning on Twitter HERE: http://bit.ly/1Xj5W3pFollow CBS This Morning on Google+ HERE: http://bit.ly/1SIM4I8Get the latest news and best in original reporting from CBS News delivered to your inbox. Subscribe to newsletters HERE: http://cbsn.ws/1RqHw7TGet your news on the go! Download CBS News mobile apps HERE: http://cbsn.ws/1Xb1WC8Get new episodes of shows you love across devices the next day, stream local news live, and watch full seasons of CBS fan favorites anytime, anywhere with CBS All Access. Try it free! http://bit.ly/1OQA29BDelivered by Norah O’Donnell and Gayle King, CBS This Morning offers a thoughtful, substantive and insightful source of news and information to a daily audience of 3 million viewers. The Emmy Award-winning broadcast presents a mix of daily news, coverage of developing stories of national and global significance, and interviews with leading figures in politics, business and entertainment. Check local listings for CBS This Morning broadcast times."
"vc_oXo-ajGs","Sorry, I'm a Slow Eater","2018-11-14T18:30:00.000Z","UCPDXXXJj9nax0fr0Wfc048g","CollegeHumor","23","18.19.11","Collegehumor,CH originals,comedy,sketch comedy,internet,humor,funny,sketch,eating,food,slow motion,please stop,meats,sports,basketball,lebron james,aging,old people,screaming,raphael chestang,mike trapp,ally beardsley,katie marovitch,hardly working","771540","22504","3592","2176","https://i.ytimg.com/vi/vc_oXo-ajGs/default.jpg","False","False","Catch our uncensored, ad-free sketches 3 days early ONLY ON DROPOUT.TV . Sign up today: https://bit.ly/2Iont9ZNow available in Canada, Australia and New Zealand.Trapp, Katie, and Ally are ready to go see LEBRON JAMES, but Raph is too busy eating that normal meal that we all love, a large steak and three hardboiled eggs.FOLLOW THE CAST:ALLY: http://www.twitter.com/lilbeardsleyGRANT: http://www.twitter.com/grantobKATIE: http://www.twitter.com/katiemarovitchTRAPP: http://www.twitter.com/mikewtrappRAPH: http://www.twitter.com/chestangraphaelREKHA: http://www.twitter.com/rekhalshankarBRENNAN: https://twitter.com/brennanlmSAM: http://www.twitter.com/samreichSee more http://www.collegehumor.comLIKE us on: http://www.facebook.com/collegehumorFOLLOW us on: http://www.twitter.com/collegehumorFOLLOW us on: http://www.collegehumor.tumblr.comSIGN UP for our emails: http://bit.ly/2E6svorCASTRaphael ChestangMichael TrappAlly BeardsleyKatie MarovitchCREWDirector - Arthur EnrightWriter - Raphael CheatingProducer - Francesca McLaffertyProduction Coordinator - Jessica ClemonsDirector Of Photography - Cooper JamesHMU - Denise R. ValentineSound Mixer - Chris Bennett of BoTown SoundEditor - Nick Rood"
"EU-m6SyXmXc","Big Ben & Mike Tomlin Mic'd Up vs. Panthers Can I get a hug? | NFL Films","2018-11-15T00:00:01.000Z","UCY3NEq2LYrmdoGkevo9BH5A","NFL Films","17","18.19.11","NFL,Football,NFL Films,American Football,panthers vs steelers,week 10,pittsburgh steelers,big ben,ben roethlisberger,mike tomlin,micd up,sound fx,big ben micd up,mike tomlin micd up,big ben mike tomlin micd up,micd up 2018","528621","7540","167","833","https://i.ytimg.com/vi/EU-m6SyXmXc/default.jpg","False","False","Pittsburgh Steelers quarterback, Ben Roethlisberger, and head coach, Mike Tomlin, mic'd up vs. the Panthers in Week 10 of the 2018 NFL Season. to NFL Films: http://goo.gl/XJTggLCheck out our other channels:NFL Network http://www.youtube.com/nflnetworkNFL http://www.youtube.com/nflNFL Rush http://www.youtube.com/nflrush#NFL #NFLFilms #Football #AmericanFootball"
"JePnQ1gSagc","Marshmello - Together (Official Music Video)","2018-11-14T15:00:02.000Z","UCEdvpU2pFRCVqU6yIPyTpMQ","Marshmello","10","18.19.11","marshmello,together,together marshmello,marshmallow,you and me,dance,wolves selena gomez,tomorrowland,Marshmello friends,cooking with Marshmello,Gaming with Marshmello,gaming,cooking,marshmello together,together music video,trippie redd,chill trap,electronic dance music,edm,slushii,alan walker,martin garrix,joytime,edc,flashbacks,check this out,tell me,marshmello fly,thanksgiving,heritage,family","7923744","417529","6812","32279","https://i.ytimg.com/vi/JePnQ1gSagc/default.jpg","False","False","Together music video is live! This is a reminder that despite our different cultures and backgrounds, we're all the same ❤️NEW Mello™️ by Marshmello gear SHOP NOW ▶ http://mellogang.comClick Here To Watch The Happier Music Video ▶ https://youtu.be/m7Bc3pLyij0LISTEN TO JOYTIME II HERE ▶ http://smarturl.it/JOYTIMEIIWatch Gaming with Marshmello HERE ▶ http://youtube.com/playlist?list=PLcYK4PlHbZQvk3_Q6fbJy0xklOZ2aH7WPWatch Cooking with Marshmello HERE ▶ http://youtube.com/playlist?list=PLcYK4PlHbZQtXROf5fnrr4dO4ruWiv7tsSUBSCRIBE HERE ▶ http://youtube.com/marshmellomusic?sub_confirmation=1WATCH CHECK THIS OUT MUSIC VIDEO ▶ https://youtu.be/D8tA6KGgmJEWATCH BAYEN HABEIT LYRIC VIDEO ▶ https://youtu.be/jNJCdxMf0t8WATCH STARS MUSIC VIDEO ▶ https://youtu.be/A57B7B6w3kwWATCH FLASHBACKS MUSIC VIDEO ▶ https://youtu.be/Lj-_mD0w474WATCH YOU CAN CRY MUSIC VIDEO ▶ https://youtu.be/2SJ0hgdciNEWATCH EVERYDAY MUSIC VIDEO ▶ https://youtu.be/bEdcJY8Emm8WATCH FLY MUSIC VIDEO ▶ https://youtu.be/oRArmtMA9AIWATCH FRIENDS MUSIC VIDEO ▶ https://youtu.be/jzD_yyEcp0MWATCH SPOTLIGHT MUSIC VIDEO ▶ https://youtu.be/7R1N-8SoqcMWATCH LOVE U MUSIC VIDEO ▶ https://youtu.be/D-pKeb6Wf4UWATCH TAKE IT BACK MUSIC VIDEO ▶ https://youtu.be/P9Ijqa_2eu0WATCH SILENCE MUSIC VIDEO ▶ https://youtu.be/Tx1sqYc3qasWATCH BLOCKS MUSIC VIDEO ▶ https://youtu.be/5E4ZBSInqUUWATCH YOU & ME MUSIC VIDEO ▶ https://youtu.be/fiusxyygqGkWATCH FIND ME MUSIC VIDEO ▶ https://youtu.be/ymq1WdGUcw8WATCH MOVING ON MUSIC VIDEO ▶ https://youtu.be/yU0tnrEk8H4WATCH SUMMER MUSIC VIDEO ▶ https://youtu.be/2vMH8lITTCEWATCH ALONE MUSIC VIDEO ▶ https://youtu.be/ALZHF5UqnU4WATCH KEEP IT MELLO MUSIC VIDEO ▶ https://youtu.be/_J_VpmXAzqgMARSHMELLO:Merch | http://mellogang.com/Spotify | http://spoti.fi/MarshmelloApple Music | http://apple.co/2n8Evz6SoundCloud | http://soundcloud.com/marshmellomusicInstagram | http://instagram.com/marshmellomusicFacebook | http://facebook.com/marshmellomusicTwitter | http://twitter.com/marshmellomusicTwitch | http://twitch.tv/marshmellomusicCredits:Agency: MGX CreativeDirector: Toby WosskowCreative Directors: Daniel Malikyar, Karam GillExecutive Producer: Daniel MalikyarProducers: Andrew Chennisi, Yusef Chabayta, Phillip VernonDP: Nico Aguilar, Dave CortezProduction Designer: Kendra BradaniniArt Director: Lacey Berggren, Hunter GortonCasting Director: Jake van ZyllEditor: Phillip VernonColorist: Bryan SmallerCostume Designer: Maggie Clapis#Marshmello #Together #Joytime"
"PLt9fRYT92M","Why ramen is so valuable in prison","2018-11-14T13:00:03.000Z","UCLXo7UDZvByw2ixzpQCufnA","Vox","25","18.19.11","ramen,ramen noodle,prison ramen,prison,prison ramen noodle,prison ramen soup,ramen soup,prison cooking ramen,prison food,inmate,inmates,inmates in prison,trade,cash,economics,consumers,consumer demand,The Goods,Vox,economy,vox news,top ramen,instant ramen,cup of noodles,maruchan,instant ramen noodles,instant ramen cup,calories,instant ramen calories,prison economies,prison trade","2410514","49556","1707","5656","https://i.ytimg.com/vi/PLt9fRYT92M/default.jpg","False","False","Instant ramen noodles have become like cash among inmates in the US. Subscribe to our channel! http://goo.gl/0bsAjOCash is illegal in prisons. And that means everything from tuna to stamps to cigarettes have their own unique value in a trade and barter market. But ramen has quickly taken over as the most in demand products the prison system offers. Watch this video to see how ramen took over prison economies and why it’s the default item for trade among inmates.The Goods by Vox explains what we buy, why we buy it, and why it matters.Watch the rest of The Goods videos on YouTube: http://bit.ly/2PvjHCBVox.com is a news website that helps you cut through the noise and understand what's really driving the events in the headlines. Check out http://www.vox.com.Watch our full video catalog: http://goo.gl/IZONyEFollow Vox on Facebook: http://goo.gl/U2g06oOr Twitter: http://goo.gl/XFrZ5H"
"5qVIaa9Nr88","Jonah Hill Breaks Down His Most Iconic Characters | GQ","2018-11-14T15:00:38.000Z","UCsEukrAd64fqA7FjwkmZ_Dw","GQ","24","18.19.11","celebrity,iconic,jonah hill,jonah hill 2018,jonah hill interview,jonah hill gq,jonah hill characters,jonah hill funny,jonah hill iconic characters,jonah hill roles,jonah hill movie,jonah hill movies,iconic characters,jonah hill show,90s jonah hill,jonah hill netflix,jonah hill wolf of wall street,jonah hill breaks down,jonah hill explains,jonah hill superbad,jonah hill 21 jump street,jonah hill mid90s,jonah hill this is the end,gq,gq magazine","1444378","33297","562","1607","https://i.ytimg.com/vi/5qVIaa9Nr88/default.jpg","False","False","GQ cover star Jonah Hill breaks down his most iconic characters, including roles in The Wolf of Wall Street, Superbad, 21 Jump Street, Cyrus, This is the End, War Dogs and Mid90s.Still haven’t subscribed to GQ on YouTube? ►► http://bit.ly/2iij5wtABOUT GQFor more than 50 years, GQ has been the premier men’s magazine, providing definitive coverage of style, culture, politics and more. In that tradition, GQ’s video channel covers every part of a man’s life, from entertainment and sports to fashion and grooming advice. So join celebrities from 2 Chainz, Stephen Curry and Channing Tatum to Amy Schumer, Kendall Jenner and Kate Upton for a look at the best in pop culture. Welcome to the modern man’s guide to style advice, dating tips, celebrity videos, music, sports and more.https://www.youtube.com/user/GQVideosJonah Hill Breaks Down His Most Iconic Characters | GQ"
"Fn3AhUzSOPs","Chefs Review Kitchen Gadgets | Vol. 5","2018-11-14T15:59:53.000Z","UCfyehHM_eo4g5JUyWmms2LA","SORTEDfood","26","18.19.11","DJ dinner set,kids plate,dj plate,kids dinner set,fun plate,childrens plate,crumb pet,crumb hoover,table hoover,table vacuum,crumb vacuum,kitchen gadget,useful gadgets,useless gadgets,per hoover,sheep crumb hoover,mini vacuum,supoon,spoon,no spill spoon,spoon gadget,silicon spoon,spoon spatula,spatula,sortedfood gadgets,sorted gadgets,gadget review,reviewing gadgets,useless kitchen gadgets,kitchen gadgets,cool gadgets,chefs review","321508","9578","276","614","https://i.ytimg.com/vi/Fn3AhUzSOPs/default.jpg","False","False","Don't you just HATE those pesky little crumbs that seem to appear out of nowhere on your kitchen worktops? Well... there's a gadget for that!!Find the gadgets here...DJ Dinner Set: https://amzn.to/2PXU5xxCrumb Pet: https://amzn.to/2zcgqOdDreamFarm Supoon: https://amzn.to/2K6AqWUWANT TO SUPPORT SORTED?? Here's how to get involved...SUBSCRIBE to the channel and press the bell button to get notifications every time we post: https://goo.gl/pqaw14Join the Sorted club for EXCLUSIVE podcasts and video specials: https://goo.gl/otD6NFGrab a copy of our AWESOME cookbook Desserts In Duvets: https://goo.gl/dEPqooCreate and account and carry on the conversation with other foodies on our forum: https://goo.gl/P73eMrMASSIVE thank you to Jaded for our intro music, you can check them out here: http://bit.ly/JadedSpot"
"i4OJL69hld4","Michelle Obama says her brother is still their mother's favorite","2018-11-13T16:38:17.000Z","UCH1oRy1dINbMVp3UFWrKP0w","Good Morning America","24","18.19.11","GMA,Good Morning America,Michelle Obama,First Lady,Chicago,Becoming,Craig Robinson,Memoir,books,basketball,coach,New York Knicks,politics,gma,abc news,Michelle Obama brother,Michelle Obama book tour,2018,today,now,family,Michelle Obama mom,mother,Robin Roberts,ABC,Becoming Michelle","1633236","26251","2488","6262","https://i.ytimg.com/vi/i4OJL69hld4/default.jpg","False","False","Obama and her brother, Craig Robinson, reflect on growing up on Chicago's South Side, plus the former first lady shares how her daughters have gotten guidance from the Bush sisters."
