video_id,title,publishedAt,channelId,channelTitle,categoryId,trending_date,tags,view_count,likes,dislikes,comment_count,thumbnail_link,comments_disabled,ratings_disabled,description
"i25i6vyjIpg","World Record Exercise Ball Surfing | Overtime 6 | Dude Perfect","2018-12-03T22:54:24.000Z","UCRijo3ddMTht_IHyNSNXpNQ","Dude Perfect","17","18.10.12","dude perfect,dude perfect stereotypes,dude perfect water bottle flip,bottle flip,water bottle flip,dude perfect bottle flip,dude perfect basketball,dp,dude perfect world record,edition,nerf,trick shots,trick shot,family,ping pong,bowling,clean,family friendly,bubble wrap,soccer,football,spinner,spinners,fidget spinners,dude,overtime,cool not cool,absurd,recurds,taste,test,betcha,bet,ya,swimming,swim,mile,long,olympics,coffee,paintings,thermal","15924495","359748","15749","23809","https://i.ytimg.com/vi/i25i6vyjIpg/default.jpg","False","False","From rolling on exercise balls to a freezing cold mile-long swim, this episode of Overtime has it all!► Click HERE to subscribe to Dude Perfect! http://bit.ly/SubDudePerfect► Click HERE to watch our most recent videos! http://bit.ly/NewestDudePerfectVideoshttp://bit.ly/NewestDPVideos► SHOP our NEW Merchandise! - http://bit.ly/DPStore►Click HERE to join the exclusive Dude Perfect T-Shirt Club! http://bit.ly/DPTShirtClubPlay our NEW iPhone game!► PLAY Endless Ducker on iPhone -- http://smarturl.it/EndlessDucker► PLAY Endless Ducker on Android -- http://smarturl.it/EndlessDucker► VISIT our NEW STORE - http://bit.ly/DPStore► JOIN our NEWSLETTER - http://bit.ly/DPNewsletterEndCard► WATCH our STEREOTYPES - http://bit.ly/StereotypesPlaylistIn between videos we hang out with you guys on Instagram, Snapchat, Twitter, and Facebook so pick your favorite one and hang with us there too!http://Instagram.com/DudePerfecthttp://bit.ly/DudePerfectSnapchathttp://Twitter.com/DudePerfecthttp://Facebook.com/DudePerfectDo you have a GO BIG mindset? See for yourself in our book Go Big. ►http://amzn.to/OYdZ2sA special thanks to those of you who play our iPhone Games and read our book. You guys are amazing and all the great things you tell us about the game and the book make those projects so worthwhile for us! Dude Perfect GAME - http://smarturl.it/DPGameiPhoneDude Perfect BOOK - Go Big - http://amzn.to/OYdZ2sClick here if you want to learn more about Dude Perfect:http://www.dudeperfect.com/blog-2/Bonus points if you're still reading this! Comment: “I like how Ty always has a different signature entrance haha”As always...Go Big and God Bless!- Your friends at Dude PerfectBusiness or Media, please contact us at: Dude@DudePerfect.com------------5 Best Friends and a Panda.If you like Sports + Comedy, come join the Dude Perfect team!Best known for trick shots, stereotypes, battles, bottle flips, ping pong shots and all around competitive fun, Dude Perfect prides ourselves in making the absolute best family-friendly entertainment possible! Welcome to the crew! Pound it. Noggin. - Dude Perfect"
"0OxnM9Mpvg0","HAZBIN HOTEL -Morning Report -(CLIP)-","2018-12-04T20:57:53.000Z","UCzfyYtgvkx5mLy8nlLlayYg","Vivziepop","1","18.10.12","Vivziepop,Zoophobia","834659","82157","595","7332","https://i.ytimg.com/vi/0OxnM9Mpvg0/default.jpg","False","False","SUPPORT HAZBIN ON PATREON: https://www.patreon.com/VivienneMedranoMERCH SALE: https://sharkrobot.com/collections/ha.... Meet Katie and Tom; 666 News’ top anchors. Despite being the “go-to” station for all of Hell’s going-ons, they still can't seem to find an engineer who can use a green screen correctly. Or at least one who actually wants to make them look good.HAZBIN HOTEL ON TWITTER: https://twitter.com/HazbinHotel"
"x8QKWekkjgM","Tyson Fury brilliant for accusing Anthony Joshua of ducking Deontay Wilder - Stephen A. | First Take","2018-12-04T17:30:00.000Z","UCiWLfSweyRNmLpgEHekhoAg","ESPN","17","18.10.12","stephen a,stephen a smith,Deontay wilder,tyson fury,tyson fury vs wilder,tyson fury fight,anthony joshua,stephen a first take,first take,stephen a. smith,anthony joshua tyson fury,espn,boxing,max kellerman,espn boxing,max kellerman espn,first take espn,deontay wilder,fury vs wilder,wilder vs fury,espn first take,first take boxing,first take wilder fury,heavyweight boxing,stephen a smith first take,stephen a espn,stephen a smith espn","980161","8980","624","4441","https://i.ytimg.com/vi/x8QKWekkjgM/default.jpg","False","False","Stephen A. Smith and Max Kellerman discuss Tyson Fury's comments on Anthony Joshua avoiding Deontay Wilder. Stephen A. thinks it makes Fury much more marketable for his next fight. ✔ Subscribe to ESPN on YouTube: http://es.pn/SUBSCRIBEtoYOUTUBE✔ Subscribe to ESPN FC on YouTube: http://bit.ly/SUBSCRIBEtoESPNFC✔ Subscribe to NBA on ESPN on YouTube: http://bit.ly/SUBSCRIBEtoNBAonESPN✔ Watch ESPN on YouTube TV: http://es.pn/YouTubeTVESPN on Social Media:► Follow on Twitter: http://www.twitter.com/espn► Like on Facebook: http://www.facebook.com/espn► Follow on Instagram: http://www.instagram.com/espnVisit ESPN on YouTube to get up-to-the-minute sports news coverage, scores, highlights and commentary for NFL, NHL, MLB, NBA, College Football, NCAA Basketball, soccer and more. More on ESPN.com: http://www.espn.com"
"FzfKn-hlZwo","The 1975 - It's Not Living (If It's Not With You) Official Video","2018-12-03T16:58:34.000Z","UCH_YpPVrF7Kzjew8rB2cdjg","The1975VEVO","10","18.10.12","The,1975,It's,Not,Living,(If,With,You),Polydor,Records,Alternative","1318565","97552","1154","5613","https://i.ytimg.com/vi/FzfKn-hlZwo/default.jpg","False","False","A Brief Inquiry Into Online Relationships OUT NOW: https://The1975.lnk.to/ABIIORMCThe 1975 - It's Not Living (If It's Not With You) Official VideoDirected by Warren Fu"
"nliNI5E0Vmc","What Really Happens In The Fortnite Locker (SFM Animation)","2018-12-04T13:46:36.000Z","UCuqw2XCsKEuzOCktBE0_EuQ","Cannaestia","20","18.10.12","fortnite,fortnite sfm,sfm,sfm animation,animation fortnite,fortnite vs pubg,fortnite animation,fortnite cartoon,fortnite animated,funny sfm,what really happens in the fortnite locker,what really happens on the fortnite battle bus,fortnite battle royale,fortnite funny,battle royale,funny fortnite animation,battle royale animation,fortnite season 7,fortnite animated cartoon,battle royale animated,funny,fortnite new,battle royale cartoon,cannaestia,meme","1074950","24263","1048","10313","https://i.ytimg.com/vi/nliNI5E0Vmc/default.jpg","False","False","What Really Happens In The Fortnite Locker (SFM Animation)If you'd like to support the channel and keeping the dream alive you can do so by clicking on this link!  https://bit.ly/2M9FkT3Gaming Merchandise-Use the code Canna to get 20% off Computer accessories at https://aziocorp.com/Stay Connected:● Twitter: https://twitter.com/Cannaestia● Instagram : https://www.instagram.com/cannaestia/● Stream: https://www.twitch.tv/cannaestia_and_outfoxedOutro Song: Knox Hillhttps://open.spotify.com/artist/1RWk8RsDoNhQ5J3DPXz5AC?si=wiCIN_qpTky9L0OXFOeRkQhttps://www.youtube.com/knoxhillAnimation: HoovyTube - https://www.youtube.com/hoovytubeVoice Actors:Outfoxedgaming: https://www.youtube.com/outfoxedgamingDiggums: https://www.youtube.com/diggums_Brosie: https://www.youtube.com/BrosieKayo: http://www.youtube.com/c/KayoVAIsic: https://www.youtube.com/channel/UCHNH-n9C1l9P035odoOXcFQ#fortnite #fortnitesfm #fortnitefunny"
"KPwoEYDaP7s","OFFICIAL PUBG MOBILE ROYALE DANCE VIDEO","2018-12-03T22:14:33.000Z","UCpB959t8iPrxQWj7G6n0ctQ","SSSniperWolf","24","18.10.12","sssniperwolf,reacting,sniper wolf,reaction,funny,pubg,pubg mobile,official music video,music,pubg dance,pubg dance video,pubg finger dance,pubg royal pass dance,pubg royale dance","1275407","78895","16173","23859","https://i.ytimg.com/vi/KPwoEYDaP7s/default.jpg","False","False","Official PUBG mobile Royale Dance Music Video! Leave a Like if you enjoyed (or cringed)! Download PUBG MOBILE for free: http://bit.ly/SSSniperRoyaleDanceDownload the song & create your OWN video: Song Available December 4th! Subscribe to join the Wolf Pack and enable notifications!Follow PUBG MOBILE for updates and news!Facebook: https://www.facebook.com/PUBGMOBILEYouTube: https://www.youtube.com/PUBGMOBILETwitter: https://twitter.com/PUBGMOBILEDiscord: http://bit.ly/PUBGDiscordReddit: https://www.reddit.com/r/PUBGMOBILE/"
"tde3nYmKFlI","10 Things The 1975's Matty Healy Can't Live Without | GQ","2018-12-03T17:00:48.000Z","UCsEukrAd64fqA7FjwkmZ_Dw","GQ","24","18.10.12","10 essentials,matt healy favorite,matt healy favorites,favorite matt healy,matt healy 10 things,10 things,matt healy explains,matt healy breaks down,10 things matt healy,matt healy top 10,matt healy 2018,matt healy interview,matt healy gq,matt healy 1975,matt healy the 1975,the 1975,1975,the 1975 matt healy,1975 matt healy,1975 interview,the 1975 interview,healy,matt healy hair,matty healy,matty healy 2018,matty healy interview,gq,gq magazine","508387","29762","259","914","https://i.ytimg.com/vi/tde3nYmKFlI/default.jpg","False","False","The 1975's globetrotting frontman Matt Healy shows us his five—er, 10—essentials. From his AirPods to his Taco Bell iPhone case, Matt Healy shares the 10 things he absolutely cannot live without.The 1975's new album, 'A Brief Inquiry Into Online Relationships' is available to stream now across all platforms.Still haven’t subscribed to GQ on YouTube? ►► http://bit.ly/2iij5wtABOUT GQFor more than 50 years, GQ has been the premier men’s magazine, providing definitive coverage of style, culture, politics and more. In that tradition, GQ’s video channel covers every part of a man’s life, from entertainment and sports to fashion and grooming advice. So join celebrities from 2 Chainz, Stephen Curry and Channing Tatum to Amy Schumer, Kendall Jenner and Kate Upton for a look at the best in pop culture. Welcome to the modern man’s guide to style advice, dating tips, celebrity videos, music, sports and more.https://www.youtube.com/user/GQVideos10 Things The 1975's Matty Healy Can't Live Without | GQ"
"aLcJZ6OhxAw","Dalton and James Arthur duet on X Factor Final | Final | The X Factor UK 2018","2018-12-02T20:36:51.000Z","UCEY1ejsweY4DgMwOVJeEaBA","The X Factor UK","24","18.10.12","the x factor,x factor,X factor UK,x factor 2018,simon cowell,robbie williams,auditions judges season 15,series 15,X Factor UK 2018,X Factor 2018 audition,The x factor 2018,XFactor 2018,louis Tomlinson,Ayda Field,DALTON HARRIS,JAMES ARTHUR,JAMES ARTHUR X FACTOR,DALTON X FACTOR,THE POWER OF LOVE,X FACTOR FINAL","1840174","43088","976","0","https://i.ytimg.com/vi/aLcJZ6OhxAw/default.jpg","True","False","Visit the official site: http://itv.com/xfactorTwo contrasting styles, one superb performance, Dalton Harris and James Arthur perform The Power Of Love at the X Factor Final. SUBSCRIBE: http://bit.ly/TXFSubFacebook: http://bit.ly/TXFFBTwitter: http://bit.ly/TXFTwiDownload The X Factor mobile app: http://bit.ly/TXFappWatch full episodes on ITV Hub (UK ONLY): http://www.itv.com/hub/the-x-factor"
"F1R_IFveYkw","Eugene Volunteers At The Trevor Project","2018-12-03T16:00:01.000Z","UCpi8TJfiA4lKGkaXs__YdBA","The Try Guys","23","18.10.12","try guys,keith,ned,zach,eugene,habersberger,fulmer,kornfeld,yang,buzzfeedvideo,buzzfeed,ariel,ned & ariel,comedy,education,funny,try,learn,fail,experiment,test,tryceratops,trevor project,trevor,project,LGBTQ,gay,lesbian,bisexual,trans,transgender,queer,gay rights,rights,suicide,lifeline,nonprofit,charity,teenagers,children,youth,young people,Millennials,identity,interview,roleplay,community,volunteer,counselor,empathy","1642997","123369","6773","13188","https://i.ytimg.com/vi/F1R_IFveYkw/default.jpg","False","False","TREVOR MIGHT BE EXPERIENCING HIGH VOLUMES AND WAIT TIMES RIGHT NOW, if you are not in an immediate crisis but still looking to connect with someone more quickly, their online community, http://www.TrevorSpace.org, can help you connect with other young people between the ages of 13 and 24.Eugene volunteers at The Trevor Project, the world's largest suicide prevention organization for LGBTQ youth, and explores the training process it takes to become a lifeline counselor. Visit The Trevor Project at https://www.thetrevorproject.org/Support us! http://www.patreon.com/tryguys. Join our Patreon to get videos a day early, plus, livestreams, chatrooms, BTS footage, exclusive merchandise, and more! SUBSCRIBE TO AND FOLLOW THE TRY GUYS http://www.youtube.com/c/tryguyshttp://www.facebook.com/tryguys  http://www.twitter.com/tryguyshttps://www.instagram.com/tryguysFOLLOW THE GUYShttp://www.Instagram.com/keithhabshttp://www.Instagram.com/nedfulmerhttp://www.Instagram.com/korndiddyhttp://www.instagram.com/eugeneleeyang http://www.twitter.com/keithhabshttp://www.twitter.com/nedfulmer http://www.twitter.com/korndiddyhttp://www.twitter.com/eugeneleeyang FEATURINGJoie A. DeRitis, LMSW Calvin StowellKevin WongTHE TRY GUYSThe #TryGuys is the flagship channel of 2ND TRY, LLC.  Tune in twice a week for shows from Keith, Ned, Zach and Eugene, the creators and stars of The Try Guys.MUSICLicensed from AudioNetworkAdditional Music licensed from SoundstripeSFXLicensed from AudioblocksVIDEOLicensed from VideoblocksOfficial Try Guys Photos By Mandee Johnson Photography | @mandeephoto2nd Try, LLC STAFFExecutive Producer - Keith HabersbergerExecutive Producer - Ned FulmerExecutive Producer - Zach KornfeldExecutive Producer - Eugene Lee YangProducer - Rachel Ann ColeProduction Manager - Alexandria HerringProduction Coordinator - Emily CorsiniEditor - Devlin McCluskeyEditor - YB ChangAssistant Editor - Will WitwerProduction Assistant - Kasiemobi Udo-okoyeProduction Assistant - Miles Bonsignore"
"2RQH5Ycj1C8","Being the Best/Worst Ever","2018-12-02T19:03:16.000Z","UCGwu0nbY2wSkW8N-cghnLpA","Jaiden Animations","1","18.10.12","jaiden,animations,jaidenanimation,jaidenanimations,self improvement,self improvement jaiden animation","3233424","256539","3234","58548","https://i.ytimg.com/vi/2RQH5Ycj1C8/default.jpg","False","False","life, amirite?♥ The Team ♥Atrox: https://twitter.com/AtroxChobatsuDenny: https://www.instagram.com/90percentknuckles/DavidBaronArt: http://davidbaronart.tumblr.com/Pivots: https://www.youtube.com/user/ThePivotsXXDMorganToast: https://www.youtube.com/channel/UCHimPYk1csmmOSGKF4pKelgDuckdee: https://www.youtube.com/channel/UCvS5en9GP_XSYwgzNReHNTQDevon: https://www.instagram.com/devonkong/GinjaNinja: https://www.youtube.com/user/GinjaNinjaOwOJaystarz: https://www.youtube.com/xjaystarzx------------------------------------------------------------------------------------SUBSCRIBE for more animations!https://www.youtube.com/c/jaidenanimationsMERCH:https://jaidenanimations.com/TWITTER:https://twitter.com/JaidenAnimationINSTAGRAM:https://instagram.com/jaiden_animations/DEVIANTART:http://jaidenanimations.deviantart.com/Behind the Scenes:https://www.patreon.com/jaidenanimations?ty=hIf you're an animator, artist, gamer, or entertainer, then join us at Channel Frederator Network: https://frdr.us/JaidenWanna Send Fanart?You can send it to me through Twitter or DeviantArt (links above)------------------------------------------------------------------------------------Music: Assembly Line Frustration by ionicsBaseball montage: https://www.youtube.com/watch?v=BnmglWHoVrk&list=PLMFmJLFhkDPG6le5JoCJbWK8pQM6tU_TBPiano montage by www.bensound.com------------------------------------------------------------------------------------And this tells me you read the description, which means you respect what I have to say! Thank you :D ...come here often?"
"gl1aHhXnN1k","Ariana Grande - thank u, next","2018-11-30T19:58:22.000Z","UC0VOyT2OCBKdQhF3BAbZ-1g","ArianaGrandeVevo","10","18.10.12","Ariana,Grande,thank,next,Republic,Records,Pop","152837902","7189383","284099","594442","https://i.ytimg.com/vi/gl1aHhXnN1k/default.jpg","False","False","thank u, next (Official Video)Song available here: https://arianagrande.lnk.to/thankunextYDDirected by Hannah Lux DavisProduced by Brandon Bonfiglio Edited by Hannah Lux Davis & Taylor Tracy WalshProduction Company: London AlleyExecutive Producers: Brandon Bonfiglio, Luga Podesta, Andrew LeriosColorist: Bryan SmallerFeaturing (in alphabetical order)Colleen BallingerJonathan BennettMatt BennettCourtney ChipoloneJennifer CoolidgeGabi DeMartinoStefanie DrummondElizabeth GilliesToulouse GrandeKris JennerAlexa LuriaDaniella MonetVictoria MonetScott NicholsonTayla ParxTroye SivanMusic video by Ariana Grande performing thank u, next. © 2018 Republic Records, a Division of UMG Recordings, Inc.http://vevo.ly/dFKirk"
"ecH2gANpUtU","RALPH BREAKS THE INTERNET | Meet Eboy, Voiced by DanTDM! | Official Disney UK","2018-12-02T08:30:00.000Z","UCQphRgAhj5UxktrQNP3WF5g","Disney UK","1","18.10.12","DanTDM,dantdm fortnite,make a wish,ebay,ralph breaks the internet,charity,dantdm videos,vanellope,disney,disney uk,ku yensiD,ralph,ralph 2,wreck it ralph 2,wreck it ralph fortnite,make a wish foundation,wreck it ralph,vanellope von schweetz,ralph wrecks the internet,trailer 2018,Disney Magic UK,Movie,Movies,Disney Movies,Disney Official,Walt Disney,Walt Disney Studios,watch,cinema,new,john c reilly,2018","1768288","30751","1115","7112","https://i.ytimg.com/vi/ecH2gANpUtU/default.jpg","False","False","Meet Eboy from Ralph Breaks the Internet, voiced by DanTDM! Watch Ralph and Vanellope's latest adventure now in UK cinemas! To celebrate the UK release of Ralph Breaks The Internet, Disney UK are joining forces with Ebay UK and DanTDM to raise awareness and donations for Make A Wish UK who grant life-changing wishes. Together, we can create more moments that matter for seriously ill children and their families when they need it the most. eBay UK https://www.ebay.co.uk/rpp/ralphbreakstheinternet Make A Wish UK https://www.make-a-wish.org.uk/RalphBreaksTheInternet DanTDM https://www.youtube.com/user/TheDiamondMinecart Subscribe to Disney UK for new Disney videos! ► http://dis.ne/subscribe-to-disney  Follow @Disney_UK on Twitter ► https://twitter.com/Disney_UK Like our official Facebook page ► https://www.facebook.com/DisneyUK Follow @DisneyUK on Instagram ► https://www.instagram.com/disneyuk The Disney UK YouTube channel brings you a wealth of official video content from all the Disney movies and characters you know and love. Do you want to learn more about your favourite Disney and Pixar movies? Subscribe to our channel to watch the latest trailers and clips, you'll be the first to see features for current and upcoming Walt Disney Studios Films and even get to watch exclusive interviews with the stars. Dig into our back catalogue for great Disney videos from classic animations through to modern day Disney & Pixar classics such as Frozen and Inside Out."
"aZTbtTmGsws","Charlie's Grandparents - SNL","2018-12-02T07:06:28.000Z","UCqFzWxSCi39LnW1JKFR3efg","Saturday Night Live","24","18.10.12","nbc,snl,saturday night live,snl host,snl 44,snl season 44,season 44,claire foy,aidy bryant,kyle mooney,heidi gardner,kate mckinnon,movie parody,willy wonka and the chocolate,s44,s44e7,episode 7,live,new york,comedy,sketch,funny,hilarious,late night,host,music,laugh,impersonation,musician,Claire Foy,The Crown,Unsane,First Man,The Girl in the Spider’s Web,Lisbeth Salander","956395","14348","978","735","https://i.ytimg.com/vi/aZTbtTmGsws/default.jpg","False","False","Charlie Bucket (Claire Foy) gets out of work a little too early and interrupts his grandparents' good nights in their shared bed in a scene from Willy Wonka & the Chocolate Factory.#SNL #ClaireFoy #AndersonPaak #SNL44Subscribe to SNL: https://goo.gl/tUsXwMGet more SNL: http://www.nbc.com/saturday-night-liveFull Episodes: http://www.nbc.com/saturday-night-liv...Like SNL: https://www.facebook.com/snlFollow SNL: https://twitter.com/nbcsnlSNL Tumblr: http://nbcsnl.tumblr.com/SNL Instagram: http://instagram.com/nbcsnlSNL Pinterest: http://www.pinterest.com/nbcsnl/"
"1yB0LWhfglQ","Chills! Tyson Fury reacts to Wilder result in his first interview after the fight","2018-12-02T09:35:36.000Z","UC4i_9WvfPRTuRWEaWyfKuFw","BT Sport","17","18.10.12","deontay wilder,deontay wilder tyson fury,tyson fury,wilder fury,wilder press conference,wilder push fury,wilder fury press conference,tyson fury interview,deontay wilder interview,bt sport tyson fury,wilder knockouts,wilder knockout,fury knockouts,fury knockout,wilder fury face-off,wilder fury promo,wilder fury tickets,wilder fury date,wilder fury highlights,fury singing","1114595","21093","389","4741","https://i.ytimg.com/vi/1yB0LWhfglQ/default.jpg","False","False","We caught up with Tyson Fury immediately after his incredible fight with Deontay Wilder which ended in a split decision draw. Fury also had a special message for those who suffer and have suffered from mental health issues."
"u7YsYX8-AaQ","'WILDER GOT EXPOSED - TYSON FURY WON THAT!!' - LENNOX LEWIS REACTS TO WILDER v FURY DRAW","2018-12-02T08:29:53.000Z","UCdl_gZZR6BtKi45eHFGAduw","iFL TV","17","18.10.12","'WILDER GOT EXPOSED - TYSON FURY WON THAT!!' - LENNOX LEWIS REACTS TO WILDER v FURY DRAW","836030","9257","563","4203","https://i.ytimg.com/vi/u7YsYX8-AaQ/default.jpg","False","False","'WILDER GOT EXPOSED - TYSON FURY WON THAT!!' - LENNOX LEWIS REACTS TO WILDER v FURY DRAWBY KUGAN CASSIUSDon’t miss the action – tune into BoxNation, Sky Sports and BT Sports and watch the fights live. Not signed up? You’ll find the best offers for new and existing UK customers here:Sky CustomersNEW - http://tidd.ly/e11e34aaEXISTING - http://tidd.ly/d23d458fBT CustomersNEW - http://tidd.ly/90e75d54  TalkTalk  NEW - http://tidd.ly/2d34a477"
