video_id,title,publishedAt,channelId,channelTitle,categoryId,trending_date,tags,view_count,likes,dislikes,comment_count,thumbnail_link,comments_disabled,ratings_disabled,description
"pVMEXu-j6iY","Making The SMALLEST Slime In The World! How To Make DIY Miniature Food Slime","2018-12-08T18:38:42.000Z","UCD9PZYV5heAevh9vrsYmt1g","Wengie","26","18.10.12","wengie,wengie slime,making the smallest slime,smallest slime ever,smallest slime in the world,mini slimes,mini slime,adding too much slime,tiny slime,slime food,making slime,diy slime,slime diy,how to make slime,adding too much of everything in slime,slime recipe,slime video,diy,for kids,easy,funny,fun,learn,comedy,kid,family friendly,educational,how to make,how to,slime challenge,how to slime,colors","1681121","34871","4914","8123","https://i.ytimg.com/vi/pVMEXu-j6iY/default.jpg","False","False","🎄Listen to UgIy Christmas Sweater!!! ➜ http://bit.ly/wengiexmassweaterBUY MY MERCH HERE ➜ http://bit.ly/wengiemerchSUB TO MY MUSIC CHANNEL: http://bit.ly/wengiemusicJOIN MY SLIME CHANNEL ➜ http://bit.ly/howtoslimechannelWATCH MAX's GAMING CHANNEL ➜ http://bit.ly/maxmellooYou guys loved my previous video where I spent 24 hours in a bounce house so today I decided to spend 24 hours in a squishy pit!! I have never had this many squishies in my life before and it was actually so much fun and surprisingly comfortable! Let me know how you think I did and what other challenges you want me to try! Love, WengieJOIN THE FAMILY ➜ http://bit.ly/wengiefamJOIN THE REACTIFAM  ➜ http://bit.ly/reacticornsJOIN THE VLOGSQUAD ➜ http://bit.ly/wengievlogsquadMUSIC I USE IN MY VIDEOS ➜ http://bit.ly/ruderobotmusic- - - - - - - - - - - - - - - - - - - - - - - - - - - - - - - - - - - - - - - - - - - - - - - - -How to get a SHOUTOUT at the end of the video!!1. Turn on notifications to be in the #wengificationsquad and comment #wengificationsquad as soon as I upload! Early posts will have a chance of being #wengificationsquad of the week!2. Follow me on instagram @wengie and comment on my most recent pic! A random comment will be the #wengiecorn of the week!- - - - - - - - - - - - - - - - - - - - - - - - - - - - - - - - - - - - - - - - - - - - - - - - -❄ M U S I C A L L Y➜ @wengie❄ I N S T A G R A M➜ http://instagram.com/wengie❄ S N A P C H A T ➜ @wengie❄ T W I T T E R ➜ http://www.twitter.com/wengie- - - - - - - - - - - - - - - - - - - - - - - - - - - - - - - - - - - - - - - - - - - - - - - - -Please email my management at Rare Global for business enquiries only: wengie@rare.global- - - - - - - - - - - - - - - - - - - - - - - - - - - - - - - - - - - - - - - - - - - - - - - - -"
"YbJOTdZBX1g","YouTube Rewind 2018: Everyone Controls Rewind | #YouTubeRewind","2018-12-06T17:58:29.000Z","UCBR8-60-B28hp2BmDPdntcQ","YouTube Spotlight","24","18.10.12","Rewind,Rewind 2018,youtube rewind 2018,#YouTubeRewind,Rewind 2017,Lilly Singh,Markiplier,Swoozie,Liza Koshy,Dolan Twins,Lele Pons,Rudy Mancuso,Casey Neistat,LaurDIY,Merrell Twins,Collins Key,Safiya Nygaard,Luisito Comunica,BB Ki Vines,Bie The Ska,Authentic Games,Manual do Mundo,Fortnite,Kiki Challenge,Mukbang,Ninja,BTS,Idol,Marshmello,Cardi B,Year in Review,In my feelings challenge","88797711","1974772","6950981","1688280","https://i.ytimg.com/vi/YbJOTdZBX1g/default.jpg","False","False","YouTube Rewind 2018. Celebrating the videos, people, music and moments that defined 2018. #YouTubeRewindIt wouldn’t be Rewind without the creators: https://rewind.youtube/creatorsExplore the videos, music and trends that defined YouTube in 2018: https://rewind.youtubeWatch the Behind the Scenes video: https://youtu.be/8qTQbk2A02M  See all the Easter Eggs: https://goo.gl/xr3uUn  Music by The Hood InternetYouTube Rewind 2018 produced by Portal A Starring:10OcupadosAdam RipponAfros e Afins por Nátaly NeriAlisha MarieAmi Rodriguez Anwar JibawiAsapSCIENCEAuthenticGamesBB Ki VinesBearhugBie The SkaBilingirl ChikaBokyem TVCajuTVCasey NeistatCasparCherrygummsCollins KeyDagi BeeDesimpedidosDiva DepressãoDolan TwinsDomicsDotty TVElle Millsemma chamberlainEnes BaturEnjoyPhoenixEroldStoryFAP TVFavijTVFischer'sFurious JumperGabbie HannaGamingWithKevGEN HALILINTARGongdaesanggymvirtualHannah StockingHikakinTVHow RidiculousillymationItsFunnehJaidenAnimations James CharlesJohn OliverJordindian Jubilee MediaJukiLopjulioprofeKatya ZamolodchikovaKaykai Salaider Kelly MissesVlogKrystal Yam & familyLA LATALachlanLaurDIYLele PonsLife NogginLilly SinghLiza KoshyLosPolinesiosLucas the SpiderLuisito Comunica (Rey Palomo)LuzuLynaManual do MundoMarkiplier Marques BrownleeMarshmelloMason RamseyMe Poupe!Merrell TwinsMichael Dapaah MissRemiAshtenmmoshayaMolly BurkeMs YeahMuro PequenoNick Eh 30NikkieTutorials NinjaNoor Stars PautipsPinkfong Baby SharkPozziPrimitive TechnologyRobleisIUTURosanna PansinoRudy MancusoSafiya NygaardSam TsuiSamHarveyUKSHALOM BLACSimone Giertzskinnyindonesian24Sofia Castro @StrayRogue and @DitzyFlama (Bongo Cat)sWooZieTabbesTechnical Guruji The Try GuysTheKateClappTheOdd1sOutTiền Zombie v4 Trevor NoahTrixie MattelWengieWhinderssonNunesWill SmithYammy Yes TheoryAll comments featured in Rewind inspired by real comments from the YouTube community."
"9JJlm0L6Ndg","My Boyfriend Is A Control Freak And He's Way Out Of Line","2018-12-08T18:00:01.000Z","UCGDV4-Gr3gyc-eGCgRtXknw","ACTUALLY HAPPENED","1","18.10.12","love,boy,girl,clingy,teen,boyfriend,girlfriend,relationships,date,texting,panic,school,student,break up,animated channel,actually happened,pain","804405","22428","802","2868","https://i.ytimg.com/vi/9JJlm0L6Ndg/default.jpg","False","False","★ Subscribe ACTUALLY HAPPENED https://bit.ly/2J5HP7jThis is Gina. Do you think it’s possible for a person to love you TOO MUCH? Well, this is EXACTLY what happened to her!She first saw Brad at school, and he was such a handsome boy with the prettiest smile she had ever seen. Every day, she would sit there hoping he would notice her, and then finally, it happened! He came over to her and asked if she was free that evening, and it was the happiest moment of her life.They went to the movies, and then for a walk in a park, and it was super romantic. Not long afterwards, they started to date, and the first few weeks were perfect – they saw each other every day, and he always told her how beautiful she was, and when they weren’t together he texted her all the time, telling her how much he loved and missed her. It was so sweet.But sometimes Gina was busy with school or seeing her friends, and during that time he would text her non-stop. One day she was doing her homework, and when she finished, she looked at her phone, and there were HUNDREDS of texts and missed calls. The first ones were like, “I love you” “I miss you,” but then it turned into things like “are you alright?” “where are you?” “why don’t you answer me?”She called Brad and said, “I’m sorry for not answering, I was busy with my homework.” He said “okay, but call me next time because I was worried.” It was quite sweet the first time, but then it happened again, and again. Each time when she wasn’t able to answer him right away, even if it was during a lesson, he started to panic.One time he even knocked on a classroom door and asked the teacher if she could come out. It was sooo embarrassing!Brad always wanted to be with Gina – like, ALL the time. He was visibly upset if she decided to spend some time with her friends instead of him. Honestly, it was kind of a turn off at this point; it’s hard to like a boy who doesn't give you any space. She told her friends about it, and they thought she was selfish because he clearly just loved her so much.Of course, they didn’t. They only got worse. He would wait for Gina to come out of class after each lesson and insisted on them always being together. At this point, even her friends realized that something was wrong.When she told him that she wanted to spend some time apart from him, he got mad and said “you don’t love me anymore!” She had to prove him wrong, so the only time she could be without him was when she was at home, and even then he still texted her constantly.The last straw for Gina was when she was talking to a boy named Johnny, a classmate, about the project they were doing together for school, and Brad came up to them, looked Johnny right in the eyes and said to him, “stop talking to her, she’s mine!” She tried to explain to Brad that he should calm down, that Johnny was just a classmate, but he wouldn’t listen and was trying to act all manly and “protect” her. Johnny got up and left, muttering “weirdo.” Gina was so embarrassed, and she said to Brad, “this is not okay, you behave like a stalker, can you please just stop!?” But he just answered: “I do it because I love you!”She didn’t know why Brad acted the way he did, but she no longer saw him as this cool, confident boy she had thought she knew before – her feelings towards him had changed. So later that day she said that she didn’t want to date him anymore. He begged her to reconsider and said he was sorry like a hundred times, and when she said “no” he got angry and implied that she liked Johnny, and that was why she was dumping him. Ugh!He texted her every day for two weeks, saying how much he missed her, and she explained over and over to him that she didn’t want to date anymore. For a few days he was silent, and she thought he must have moved on, but then…He called her and said “can you please look out your window?” She did, and saw a bunch of lit candles spelling out “I love you”. It was so awkward! She went outside and tried to explain him that he was a great guy, but she didn’t like this insane level of control. He was so upset, like he was holding back tears, and she felt so sorry for him.He said that she was his first girlfriend and he felt scared of losing her, and that’s why he acted the way he did, and he didn’t see what was happening until his older brother pointed it out to him. He asked if they could start again and promised that it would be better this time.Gina wanted to say “yes”, but she couldn’t, so she politely declined. And she felt so bad about it, like she was a bad person for refusing, but something inside of her said that all of it would just happen again.Gina thinks that a person shouldn’t be in a relationship if he or she is not comfortable in it, even if you feel sorry for someone. Brad is not a bad person, but he should have dealt with his insecurities before starting a relationship.Music by Epidemic Sound: https://www.epidemicsound.com"
"hA6hldpSTF8","Marvel Studios' Avengers - Official Trailer","2018-12-07T13:01:21.000Z","UCvC4D8onUfXzvjTOM-dBfEA","Marvel Entertainment","24","18.10.12","marvel,comics,avengers,avengers 4,trailer,official,a4,mcu","57973781","2864310","38331","293738","https://i.ytimg.com/vi/hA6hldpSTF8/default.jpg","False","False","Part of the journey is the end.► Subscribe to Marvel: http://bit.ly/WeO3YJLearn more: https://bit.ly/2QD3Z85---Follow Marvel on Twitter: ‪https://twitter.com/marvelLike Marvel on FaceBook: ‪https://www.facebook.com/MarvelFor even more news, stay tuned to:Tumblr: ‪http://marvelentertainment.tumblr.com/Instagram: https://www.instagram.com/marvelGoogle+: ‪https://plus.google.com/+marvelPinterest: ‪http://pinterest.com/marvelofficial"
"NL9Wbd0Bzl4","YouTubers React to YouTube Rewind 2018 #YouTubeRewind","2018-12-08T02:39:01.000Z","UC0v-tlzsn0QZwJnkiaUSJVQ","FBE","24","18.10.12","youtube rewind,youtube rewind 2018,YouTubers React to YouTube Rewind 2018 #YouTubeRewind,reacts,reaction,reactions,youtubers react,thefinebros,fine brothers,fine brothers entertainment,FBE,watch,review,for the first time,reviews,responds,respond,elders react,teens react,kids react,adults react,college kids react,Craig Thompson,miniladd,Gabbie Hanna,Courtney Miller,Ian Hecox,smosh,try guys,DANGMATTSMITH,Timothy DeLaGhetto,OGYT1854","2263250","67195","43263","31482","https://i.ytimg.com/vi/NL9Wbd0Bzl4/default.jpg","False","False","YouTube Rewind 2018, reacted to by YouTubers. Original links below.Subscribe to the YouTubers in this episode: http://bit.ly/2UwEm8aSUBSCRIBE & HIT THE 🔔. New Videos 2pm PT on FBE: http://fbereact.com/SubscribeFBEWhat should we react to next?? https://fbereact.com/submitWatch More from FBE: http://fbereact.com/FBEallreactepisodesWatch More from React: http://fbereact.com/REACTallepisodesJoin us LIVE on React every Tuesday, Friday, and Sunday at 3pm PST.Sign Up for Our Newsletter: http://fbereact.com/infoYouTubers React to YouTube Rewind 2018. Watch to see their Reactions.Content Featured:YouTube Rewind 2018http://bit.ly/2zPAwOwFBE’s goal is to credit the original links to the content featured in its shows. If you see incorrect or missing attribution please reach out to credits@fbeteam.comYouTubers Featured:Craig Thompsonhttp://youtube.com/MiniLadddGabbie Hannahttp://youtube.com/TheGabbieShowGabriel and Jesshttp://youtube.com/jessandgabrielIan Hecox & Courtney Millerhttp://youtube.com/smoshhttps://www.youtube.com/SmoshCourtneyZach Kornfeld & Keith Habersbergerhttp://youtube.com/TryGuysDANGMATTSMITHhttp://youtube.com/DANGMATTSMITHTheOdd1sOuthttps://www.youtube.com/TheOdd1sOutcomicTimothy DeLaGhettohttp://youtube.com/TIMOTHYMERCH 👕 https://www.shopfbe.comFollow FBE:FBE WEBSITE: https://fbeteam.com/FBE: http://www.youtube.com/FBEREACT: http://www.youtube.com/REACTFBE2: https://www.youtube.com/FBE2FBELive: https://www.youtube.com/fbeliveFACEBOOK: http://www.facebook.com/FBEFACEBOOK: http://www.facebook.com/FBEShowsTWITTER: http://www.twitter.com/fbeINSTAGRAM: http://www.instagram.com/fbeSNAPCHAT: https://fbereact.com/snapchatDISCORD: https://fbereact.com/FBEdiscordTWITCH: https://www.twitch.tv/fbeliveAMAZON: https://www.amazon.com/v/FBEROKU: http://bit.ly/FBERokuXUMO: https://fbereact.com/xumoSEND US STUFF:FBEP.O. BOX 4324Valley Village, CA 91617-4324MERCH ￼ https://www.shopfbe.comCreators & Executive Producers - Benny Fine & Rafi FineHead of Production - Nick BergtholdCreative Director & Senior Producer - Derek BaynhamSupervising Producer - Kyle SegalProducer - Ethan WeiserJr. Producer - Vartuhi Oganesyan, JC ChavezAssociate Producer - Lauren HutchinsonProduction Coordinator - Alberto AguirreAssistant Production Coordinator - Kristy KieferPost Supervisor - Emily McGuinessEditor - Cara Bomar, Zach ButlerAssistant Editor - Nicole WorthingtonJr. Studio Technician - Oscar Ramos, Stephen Miller, Jayden RomeroProduction Assistant - Kyllis Jahn, Micah Kearny, Stefan Fior, Laura LareauStudio Technician - Sam KimSet Design - Melissa JudsonMusic - Cormac Bluestone http://www.youtube.com/cormacbluestone© FBE, IncYouTubers React #205 - YouTubers React to YouTube Rewind 2018 #YouTubeRewind #YouTubeRewind2018 #Rewind2018 #YouTubeRewind"
"Mcep-uch_hM","Guess My Disability (Bjork) | Lineup | Cut","2018-12-08T13:00:03.000Z","UCbaGn5VkOVlcRgIWAHcrJKA","Cut","24","18.10.12","PLJic7bfGlo3qJcIXUJteaUm_3-3tgQSXw,PLJic7bfGlo3rM20M7N8rLXAkz6dU2-7FX,lineup,line up,People Guess,guessing games,Cut,Watch Cut,people,people videos,storytelling,relationships,Dating,Interviews,Firsts,couples,exes,love,Kids Try,games,challenges,Ethnic groups,People Interviews,Dares,Truth or Dare,100 ways,blind dates,100 people,experiments,#tbt,Maddox,Truth or Drink,kids,kids videos,100 YOB,100 Years of Beauty,Fear Pong,Guess My Disability,Bjork","661804","10188","3339","2201","https://i.ytimg.com/vi/Mcep-uch_hM/default.jpg","False","False","Sponsor this video: http://bit.ly/2zMPhl9Fear Pong is now a game! Get it here: http://www.fearponggame.comSUBSCRIBE: http://bit.ly/CutSubscribeWatch More Lineup: https://www.youtube.com/playlist?list=PLJic7bfGlo3qJcIXUJteaUm_3-3tgQSXwAbout Lineup:A who’s who of awkward assumptions and judgments.Don't forget to subscribe and follow us!Official Site: https://www.cut.com/Facebook: http://cut.com/facebook Twitter: https://twitter.com/CutInstagram: http://cut.com/instagramSnapchat: @watchcut Cut Swag: http://cut.com/shopAbout Cut: Small questions have powerful effects when they go viral. Cut spreads stories for fun, for serious, and for real– bringing the internet together one awkward moment at a time.Produced, directed, and edited by https://cut.com Want to work with us? http://cut.com/hiring Want to be in a video? http://cut.com/casting Want to sponsor a video? http://cut.com/sponsorships For licensing inquiries: http://cut.com/licensingGuess My Disability (Bjork) | Lineup | Cuthttps://youtu.be/Mcep-uch_hM#Cut #Lineup #ChallengeCuthttps://www.youtube.com/watchcut"
"f5Fy1pgl7kw","Ellen Wants to Throw an On-Air 50th Birthday Party for Jennifer Aniston","2018-12-08T15:00:02.000Z","UCp0hYYBW6IMayGgR-WeoCvQ","TheEllenShow","24","18.10.12","ellen,ellen degeneres,degeneres,the ellen show,ellen fans,ellen tickets,ellentube,ellen audience,new,jennifer aniston,jennifer,aniston,birthday party,50th birthday,interview,season 16,50,jennifer aniston 50,dumplin,dumplin movie,netflix,netflix is a joke,dumplin netflix,dolly parton,dolly,parton,beauty pageant,rachel green,friends,reese witherspoon,steve carell,new show,new movie,jennifer aniston movie,boxing lessons,boxing,facetime","787558","12931","415","1050","https://i.ytimg.com/vi/f5Fy1pgl7kw/default.jpg","False","False","With Jennifer Aniston turning 50 next year, Ellen offered to host her birthday party on her show! Plus, the actress talked about FaceTiming with Ellen to stay in touch, and taking boxing lessons to stay in shape.#JenniferAniston#TheEllenShow#Dumplin"
"a2GVxYfKSxA","Elon Musk vs Mark Zuckerberg - Epic Rap Battles of History.","2018-12-07T19:00:06.000Z","UCMu5gPmKp5av0QCAajKTMhw","ERB","24","18.10.12","elon musk,elon musk vs mark zuckerberg,elon musk rap battle,mark zuckerberg rap battle,epic rap battles of history,erb,rap battle,rap battles,battle rap,mark zuckerberg,erbofhistory,mark zuckerberg vs elon musk,mark zuckerberg vs elon musk rap battle,musk vs zuck,zuck vs musk,facebook vs tesla,tesla vs facebook,celebrity rap battles,epic rap battles of history season 6","4558148","357125","7422","62836","https://i.ytimg.com/vi/a2GVxYfKSxA/default.jpg","False","False","Download this song here ► http://hyperurl.co/MuskVsZuckSong ◄Elon Musk and Mark Zuckerberg face off in this bonus episode of Epic Rap Battles of History. Who won? Who’s next? You decide!NEW ERB Season 5 Signed CD's - https://erbmerch.comWatch the Behind The Scenes here: Official ERB Website: https://erbofhistory.comCheck out our new Teespring Merch Store: https://bit.ly/2E8lCGWAnd don't forget to subscribe to our channel: https://bit.ly/2zBQU53Thank you!np & eL#epicrapbattles #elonmusk #markzuckerbergCAST==========Elon Musk: EpicLLOYDhttp://www.youtube.com/EpicLLOYDIG/Twitter: @theepiclloydMark Zuckerberg: Nice Peterhttp://www.youtube.com/NicePeterIG/Twitter: @nicepeterSenator Dianne Feinstein: EpicLLOYDCaptain Jean-Luc Picard: EpicLLOYDCREW==========Producer: Atul SinghWritten by EpicLLOYD, Nice Peter, Zach Sherwin & Dante CimadamoreBeat Produced by Hollywood Legend Productions: http://bit.ly/HollywoodLegendProductionsMusic Mixed and Mastered by Nice PeterDirected by: Nice PeterDirector of Photography: Jon NaGaffer: Trent TurnerDepartment  Make Up Head: Ashlyn McIntyreDIT: Josh BestPlayback Supervisor: Dante CimadamoreSenior PA: Morgan ChristensenSpecial thanks to Jay MendozaVideo Editors: Daniel Flesher, Josh Best, Nice PeterProduced by Atul SinghVFX: Andrew Sherman, Javi Sánchez BlancoShot on the Arri Alexa Mini"
"75eDItfd0RQ","David Dobrik Answers the Web's Most Searched Questions | WIRED","2018-12-06T17:00:15.000Z","UCftwRNsjfRo08xYE31tkiyw","WIRED","24","18.10.12","david dobrik,david dobrik interview,david dobrik liza koshy,david dobrik wired autocomplete,david dobrik autocomplete interview,david dobrik interview wired,david dobrik autocomplete,wired autocomplete interview,wired autocomplete,google autocomplete,david dobrik youtube,david dobrik vine,david dobrik youtuber,david dobrik liza,david dobrik vlog,david dobrik slovakia,david dobrik funny,david dobrik funny moments,david dobrik funny interview,wired","6219901","325472","5590","14618","https://i.ytimg.com/vi/75eDItfd0RQ/default.jpg","False","False","David Dobrik takes the WIRED Autocomplete Interview and answers the internet's most searched questions about himself. Is David Dobrik from Slovakia? Does David own a Tesla? Who is David's best friend? David answers all these questions and more!Can't get enough of David? Visit https://www.wired.com/story/david-dobrik-autocomplete-video/ Wondering how the sausage gets made, check out Liza Koshy, Markiplier, and Rhett & Link sharing their secrets to success on YouTube: https://www.wired.com/story/creator-support-youtube-stars/And check out David all over the internet!David Dobrik's YouTube channelhttps://www.youtube.com/channel/UCmh5gdwCx6lN7gEC20leNVADavid Dobrik's Second YouTube channelhttps://www.youtube.com/channel/UCef29bYGgUSoJjVkqhcAPkwInstagramhttps://www.instagram.com/daviddobrik/Twitterhttps://twitter.com/daviddobrikSnapchat: @DavidDobrikStill haven’t subscribed to WIRED on YouTube? ►► http://wrd.cm/15fP7B7 Also, check out the free WIRED channel on Roku, Apple TV, Amazon Fire TV, and Android TV. Here you can find your favorite WIRED shows and new episodes of our latest hit series Masterminds.ABOUT WIREDWIRED is where tomorrow is realized. Through thought-provoking stories and videos, WIRED explores the future of business, innovation, and culture.David Dobrik Answers the Web's Most Searched Questions | WIRED"
"NspqGM0DbbQ","Game of Thrones | Season 8 | Official Tease: Dragonstone (HBO)","2018-12-06T21:43:43.000Z","UCQzdMyuz0Lf4zo4uGcEujFw","GameofThrones","1","18.10.12","Game of Thrones,For The Throne,Season 8,Stark,Lannister,HBO,Final Season,GoT,Dragonstone,Tease","11663254","225319","8702","14605","https://i.ytimg.com/vi/NspqGM0DbbQ/default.jpg","False","False","Fire and ice. The final season of Game of Thrones begins this April. #GoTS8"
"LfxY1sg5_rw","NF - If You Want Love","2018-12-07T02:00:01.000Z","UCI3H1FsjbdqGcLq93ZilV5g","NFVEVO","10","18.10.12","NF,If You Want Love,If You Want Love Music Video,If You Want Love Song,NF If You Want Love,nfrealmusic,If You Want Love Video,Perception,hip hop,rap,nf fans,capitol,nf official,nf music,new nf,if you want love official video,nf official video,nf 2018,nf family,nf wedding,nf singing,if you want love you gon have to learn how to change,I just need some time,I wish somebody woulda told me","1560645","153147","869","11234","https://i.ytimg.com/vi/LfxY1sg5_rw/default.jpg","False","False","Official music video for “If You Want Love” by NF from the album Perception. Subscribe to NF on YouTube: http://nfmusic.me/youtubeListen on the NF Real Music playlist: https://nf.lnk.to/playlistStream ‘Perception’ Spotify: http://nfmusic.me/perception.sp?IQid=vevoApple: http://nfmusic.me/perception.ap?IQid=vevoSoundCloud: http://nfmusic.me/perception.sc?IQid=vevoDownload ‘Perception’ iTunes: http://nfmusic.me/perception.it?IQid=vevo Amazon: http://nfmusic.me/perception.az?IQid=vevo Get ‘Perception’ on CDAmazon: http://nfmusic.me/perception.azp?IQid=vevoFollow NF Instagram: https://instagram.com/nfrealmusic Facebook: http://facebook.com/nfrealmusic Twitter: http://twitter.com/nfrealmusic Spotify: http://smarturl.it/NFSpotify Website: http://nfrealmusic.comEmail: http://smarturl.it/nfemailProducer: Nathan Feuerstein & Patrick Tohill Director: Patrick Tohill & Nathan Feuerstein Music video by NF performing If You Want Love. © 2018 NF Real Music, LLChttp://vevo.ly/CrkIdw"
"EgIZuxavs3o","thank u, jeff -- Ariana Grande Parody","2018-12-06T06:30:01.000Z","UCJ0uqCI0Vqr2Rrt1HseGirg","The Late Late Show with James Corden","24","18.10.12","The Late Late Show,Late Late Show,James Corden,Corden,late night,late night show,comedy,comedian,celebrity,celeb,celebrities,CBS,joke,jokes,funny,funny videos,funny video,humor,hollywood,famous,thank u next parody,thank u,ariana grande,thank you next,jeff goldblum,jeff goldbloom,parody,jurassic park,ian malcolm","5187683","344964","2922","9032","https://i.ytimg.com/vi/EgIZuxavs3o/default.jpg","False","False","James Corden has had lots of guests on The Late Late Show, but only one has taught him love, patience and pain: Jeff Goldblum. James shows his appreciation for Jeff with a song and music video in the style of Ariana Grande's hit thank u, next.More Late Late Show:Subscribe: http://bit.ly/CordenYouTubeWatch Full Episodes: http://bit.ly/1ENyPw4Facebook: http://on.fb.me/19PIHLCTwitter: http://bit.ly/1Iv0q6kInstagram: http://bit.ly/latelategramWatch The Late Late Show with James Corden weeknights at 12:35 AM ET/11:35 PM CT. Only on CBS.Get new episodes of shows you love across devices the next day, stream live TV, and watch full seasons of CBS fan favorites anytime, anywhere with CBS All Access. Try it free! http://bit.ly/1OQA29B---Each week night, THE LATE LATE SHOW with JAMES CORDEN throws the ultimate late night after party with a mix of celebrity guests, edgy musical acts, games and sketches. Corden differentiates his show by offering viewers a peek behind-the-scenes into the green room, bringing all of his guests out at once and lending his musical and acting talents to various sketches. Additionally, bandleader Reggie Watts and the house band provide original, improvised music throughout the show. Since Corden took the reigns as host in March 2015, he has quickly become known for generating buzzworthy viral videos, such as Carpool Karaoke."
