video_id,title,publishedAt,channelId,channelTitle,categoryId,trending_date,tags,view_count,likes,dislikes,comment_count,thumbnail_link,comments_disabled,ratings_disabled,description
"CWhuXhkivO8","Priyamanaval Episode 1166 10/11/18 Reviewed by TSP சசியை பற்றி புரிந்துகொண்ட திலீபன்","2018-11-11T11:28:53.000Z","UC4YdUeodT2qcI0-65o4DZig","Tamil Serial Periyars","24","18.12.11","priyamanaval,priyamanaval today,priyamanaval episode,priyamanavale,priyamanaval today episode,priyamanaval 1087,priyamanaval 1134,priyamanaval 1131,priyamanaval latest episode,priyamanaval avanthika,priyamanaval bhoomika,priyamanaval bgm,priyamanaval bloopers,priyamanaval bandook,priyamanaval baby,priyamanaval bhoomika pregnant","55081","298","53","7","https://i.ytimg.com/vi/CWhuXhkivO8/default.jpg","False","False","#Priyamanavalepromo #Priyamanavale #Priyamanavaletodayepisode Image Courtesy : VikatanTVKrishnan's familyKrishnan Subalekha sudhakar Uma's husband, Natraj, Saravanan, Dileepan and Prabha's fatherUma Krishnan Praveena Krishnan's wife, Natraj, Saravanan, Dileepan and Prabha's mother. Protagonist.Natraj Krishnan Vijay Krishnan and Uma's oldest sonSaravanan Krishnan Dharish Jayaseelan Kirshnan and Uma's second sonDileepan Krishnan Vineeth Krishnan and Uma's third sonPrabhakaran Krishnan Karthik Vasu/ Mohamed Azeem Kirshnan and Uma's youngest sonAvantika Natraj Sivaranjini (Ranjani) Natraj's wife, Krishnan's oldest daughter-in-law, Rajaram and Malliga's older daughter.Bhoomika Saravanan Kiran Saravana's wife, Avantika's sister, Rajaram and Malliga's younger daughter.Kavitha Dileepan Unknown/ Niranjani Dileepan's wifeNandini Prabhakaran pritikumar Prabha's wife Rodramoothy's daughter vinayagamand ulaganayagi's nice and Ramkumar vaitheeshwaran and geetha's sister colspan=5 style=text-align: center; background-color: rgb(127, 255, 212); iyavvu's family Iyavvu K. Veera Krishnan's best friend, Eeswari's husband, Kannan and Sumathi's father.Eeswari Iyavvu Usha Elizabeth Iyavvu's wife, Kannan and Sumathi's mother, Main Antagonist.Kannan Iyavvu Adhitya Iyavvu and Eeswari's son, antagonist.Rathnam Gunalan ACP of chennai, Iyavvu's brother.Vinayagam's familyVinayagam Krishnan's relative, Vaithy and Geetha's dadRudramoorthy (Rudra) Ganesh Vinayagam's brother, Ram and Nandhini's father, Krishnan's relativeUlaganaayagi Vinayagam Vinayagam's wife, Vaithy and Geetha's mom, Krishnan's relativeVaitheeswaran Vinayagam (Vaity) Giri Vinayagam's son, Geetha's brother, Krishnan's relativeRamanathan Rudramoorthy (Ram) Rudra's son, Krishnan's relativSusila Vaitheeswaran Nilani Vaithy's wifeDhanush Vaitheesaran Vaithy and Susila's son.Muthukumar's familyMuthukumar Uma's brother, Isaipriya, Kathirkaaman and Isaikuyil's fatherYazhini Muthukumar Muthukumar's late wife, Isaipriya, Kathirkaaman and Isaikuyil's motherIsaipriya Muthukumar Haripriya Muthukumar's oldest daughter/ Prabha's ex love interestKathirkaaman Muthukumar Abishek Rathan Muthukumar's sonIsaikuyil Muthukumar Uttra Shree Muthukumar's daughter vignesh kumar vignesh kumar isaipriya's love interestRajaram's familyRajaram Balasubramani Avantika and Bhoomika's father, Malliga's husband.Malliga Rajaram Balambiga Avantika and Bhoomika's mother, Rajaram's wife.Giritharan's familyGiritharan Parthan DCP, Geetha's husband, Krishnan's cousin in lawGeetha Giritharan Krishnan's cousin, Vinayagam's daughter, Vaithy's sister, Priyamanaval Episode 699, Priyamanaval Episode Today, Sun News, Speed News, Vikatan Tv , Vijay Tv , Tamil Channel , Tamil Serial ,Comedy Video,Funny Video,Breaking News, Tamil News..etc"
"6MslIxE8xgg","Lakshmi Baramma - 10th November 2018 - ಲಕ್ಷ್ಮೀ ಬಾರಮ್ಮ","2018-11-11T03:02:06.000Z","UCGDwFBgtKO4M7AaTCY3jMLw","Colors Kannada","24","18.12.11","Colors Kannada,ETV Kannada,colorskannada,VOOT,new promo,clips,3 minute clip,Lakshmi Baramma voot clip,Lakshmi Baramma full episode online,watch Lakshmi Baramma online,Lakshmi Baramma,lakshmi baramma,drama,Laxmi,Chandan,Shruti,Lakshmi,7:30pm","35981","54","14","5","https://i.ytimg.com/vi/6MslIxE8xgg/default.jpg","False","False","To watch the full episode of 'Lakshmi Baramma' anytime, Download the Voot app now or Visithttps://www.voot.com/shows/lakshmi-baramma/1/367649/aayi-grows-suspicious-of-ranjith/651001Lakshmi Baramma is the story of the young and naive Lakshmi who gets married to Chandan, only to realize that she is stuck in a marriage of convenience. Chandan, is in fact in love with Shruti, but heeding to his mother's advice, he chooses an arranged marriage over love. Indebted to Chandan for marrying her, Lakshmi is now torn between her reality and her dreams. What will Lakshmi do?"
"3oXj8aoAJu8","Exclusive - Tanushree Dutta EXPOSES Rakhi Sawant's TRUTH! | #MeToo | #WeAreListening","2018-11-10T12:30:01.000Z","UCotI-SqRXnkAZX4bMqlRNjw","zoom","24","18.12.11","tanushree dutta,tanushree dutta nana patekar,tanushree dutta interview,tanushree dutta rakhi sawant,tanushree dutta rakhi sawant video,tanushree dutta rakhi sawant speech,tanushree dutta rakhi sawant interview,rakhi sawant,tanushree dutta controversy,tanushree dutta 2018,rakhi sawant controversy,#metoo controversy,#metoobollywood,Zoom,Zoom TV,ZoomDekho,2018 Bollywood News,Bollywood Celebs,Latest News,Gossips,#wearelistening,#wearelistening zoom","103839","922","127","188","https://i.ytimg.com/vi/3oXj8aoAJu8/default.jpg","False","False","SUBSCRIBE To zoom:-Click Here ► http://goo.gl/olJaiw& CLICK On The Bell Icon To Receive All The Latest Updates.Zoom is young India's newest entertainment station. Original Shows. Bollywood News. Gossip. Music. Countdowns. Superstar Interviews. Fan Requests. Youth Shows. Film Reviews. Celebrity Parties, Movies and more. On-Air and Online!For Latest Television News And Gossips:Subscribe To TellyTalk India ► http://goo.gl/Q2pq7uStay Connected With Us On :Facebook     - https://www.facebook.com/zoomtvTwitter          - http://www.twitter.com/zoomtvGoogle+        - http://www.google.com/+zoomtv  Instagram     -https://instagram.com/zoomtv/Pinterest       -http://www.pinterest.com/zoomtvTumblr:         - http://zoomtv.tumblr.comDailymotion  - http://www.dailymotion.com/zoomtvWebsite         - http://www.zoomtv.com"
"Rzz2mii37DI","John Cena OUT From Survivor Series ! Big Cass NEW LOOK ! Kurt On Shane Wins World Cup Best in World","2018-11-11T15:05:10.000Z","UCetiwiWVoUBvIHIzYFaEiEw","Wrestle Chatter","24","18.12.11","survivor series 2018,john cena survivor series 2018,john cena match survivor series 2018,john cena,big cass after leaving wwe,where is big cass now,big cass after wwe release,big cass after quitting wwe,big cass,shane mcmahon wins world cup,shane mcmahon best in the world,shane mcmahon,kurt angle on shane mcmahon","43242","3389","158","552","https://i.ytimg.com/vi/Rzz2mii37DI/default.jpg","False","False","Topics Covered In Video-1)John Cena  Survivor Series 2018 !2)John Cena Out From Survivor Series 2018 !3)Kurt Angle On Shane McMahon Winning World Cup Best in the World Crown Jewel !4)Big Cass After Leaving WWE 2018 !5)Big Cass After WWE Release !#JohnCena #SurvivorSeries #BigCass #KurtAngle #ShaneMcmahonJohn Cena Out From Survivor Series ! Big Cass NEW LOOK ! Kurt On Shane Wins World Cup Best in WorldMy Second Channel For Masala Videos [ The RohiTreasure ] :- https://www.youtube.com/channel/UCJWATIXQplD0NUiFSqEpLngSocial Accounts:-Facebook:-  https://facebook.com/wrestlechatterInstagram:- https://instagram.com/wrestlechatterTwitter:-       https://twitter.com/wrestle_chatterMusic Credit-https://soundcloud.com/joakimkarud/lowriderPhoto Credit-https://www.wwe.com/  (WWE)"
"dW1S4mCPCqU","Life & Facts of TIPU SULTAN (Hindi Urdu) | The Baigan Vines","2018-11-11T07:30:00.000Z","UClcyhW2x45yij-nR9DTEBVQ","The Baigan Vines Extras","24","18.12.11","hyderabadi,comedy,tipu,sultan,facts,interesting facts,life story,tbv,baigan vines,the baigan vines,baigan vines history,maulana tariq jameel,great warrior,great warriors of india,indian warrior,rocket technology,apj abdul kalam,pioneer of rocket,rocket man,mysore,tiger of mysore,sword of tipu sultan,hindi,urdu,hindi history,urdu history,hindi stories,seringapatam,battle,war,fort,karnataka,tipu sultan jayanti,shaheed,martyr,latest,2018,bangalore 2018","48294","7756","73","985","https://i.ytimg.com/vi/dW1S4mCPCqU/default.jpg","False","False","TBV Team present Life & Facts of the great Shaheed Tipu Sultan!To Promote your Brand/Business/Product, mail us for details on : - Thebaiganvines@gmail.com- Contact@thebaiganvines.comTHANK YOU for your love & support :)Please Like & Comment on our videos as it means a lot! :)#SHARE #SUBSCRIBE #TipuSultanOur 1st Channel : https://www.youtube.com/ThebaiganvinesofficialFACEBOOK: https://www.facebook.com/thebaiganvinesINSTAGRAM: https://www.instagram.com/the_baigan_vines"
"GKj4rOgSm2w","Sembarathi Tomorrow Promo || 12/11/18","2018-11-11T12:44:42.000Z","UCpSTDNHqWznV3l_uKce6oBA","Cine Heart TAMIL","24","18.12.11","Sembarathi serial today episode,Sembarathi serial today promo,Sembarathi serial tomorrow promo,Sembarathi promo zee tamil,Sembaruthi 12/11/18 episode,Sembaruthi 12th November promo,sembaruthi la","46791","247","24","126","https://i.ytimg.com/vi/GKj4rOgSm2w/default.jpg","False","False","Sembarathi Tomorrow Promo || 12/11/18#sembarathipromo #sembarathiserialpromo"
"j6VT-ppZ5pE","Delhi Grand Mushayra || Imran Pratapgarhi || 10 Nov 2018 || Amanatullah Khan MLA (AAP)","2018-11-11T10:22:10.000Z","UCrOCrPtXW2OzpP2O87-gF-g","Imran Pratapgarhi Official","24","18.12.11","Delhi Grand Mushayra,Delhi Grand Mushayra || Imran Pratapgarhi || 10 Nov 2018 || Amanatullah Khan MLA (AAP),delhi mushayra 2018 imran pratapgarhi,jamia mushayra 2018 imran pratapgarhi,amanat ullah khaan imran pratapgarhi,amanat mushayra delhi 2018,jamia mushayra imran pratapgarhi,latest mushayra imran pratapgarhi 2018,november mushayra imran pratapgarhi 2018","115475","0","0","871","https://i.ytimg.com/vi/j6VT-ppZ5pE/default.jpg","False","True","क ख़ूबसूरत स्कूल का उद्घाटन, जुनैद और अज़ीम के परिवारों को नौकरी का ज्वाइनिंग लेटर, दिल्ली के उप मुख्यमंत्री मनीष सिसोदिया जी की एक एक मिसरे पर वाह वाह की सदायें !रात अमानतउल्लाह खान साहब का मुशायरा अपने आप में कई बुनियादी कामों की इबारत समेटे था !शुक्रिया जुनून की हद तक मुझे प्यार करने वाली अवाम का !Love U दिल्लीThis is Official YouTube Channel of Shayar/Poet Imran Pratapgarhi (Copyright)Visit Official Website http://imranpratapgarhi.in/ to Explore More About Imran PratapgarhiFor Latest Videos And Updates You Can Subscribe This Channel Imran Pratapgarhi Awarded  By YASH BHARTI For The Contribution in Literature and Shayari by Uttar Pradesh Government In 2016Yash Bharti Award is the highest Award of Government of Uttar Pradesh, Instituted in 1994, it is awarded to those personalities whose contribution is remarkable in the field of literature, social work, medicine, film, science, journalism, handicrafts, culture, education, music, drama, sports, industry and astrologyYou Can follow Imran Pratapgarhi On These Social Media Networks...Facebook - https://www.facebook.com/ImranPratapgarhiOfficialTwitter - https://twitter.com/ShayarImranInstagram - https://www.instagram.com/imranpratapgarhi/Website - http://imranpratapgarhi.in/"
"ssZtF3TD_BI","Tech Talks #657 - S10 Exynos, Huawei Display Hole, Kirin 990, Facebook Lasso, Xiaomi Price Increase","2018-11-10T15:26:39.000Z","UCOhHO2ICt0ti9KAh-QHvttQ","Technical Guruji","28","18.12.11","S10 Exynos,Huawei Display Hole,Kirin 990,Facebook Lasso,Xiaomi Prise Increase,Tech Talks #657,PUBG beta,Phone Unlock,Jio Offer 2018,technical guruji,technicalguruji,Tech news,tech talks,latest tech news,technology,india,hindi,latest,Latest,latest updates,trick,online,Daily News,Hindi News,Airtel,Jio Latest News,India,Gaurav Chaudhary,Flipkart,Bitcoin,Facebook,Jio New Plans,iPhone,5G India,News,Guruji","293103","34031","737","5005","https://i.ytimg.com/vi/ssZtF3TD_BI/default.jpg","False","False","TG Deals@ https://tg.deals/   New Channel: https://goo.gl/Jz6p5KNamaskaar Dosto, Tech Talks ke is Episode mein maine aapse kuch interesting Tech News Share ki hai jaise Xiaomi Price rise in India, Huawei Kirin 990 Processor with 5G, Samsung Exynos 9820 Launch, Facebook Lasso, YouTube Dark Mode, Twitter Removing Locked Accounts aur bahut kuch. Mujhe umeed hai ki yeh video aapko pasand aayega. Share, Support, Subscribe!!!Subscribe: http://bit.ly/1Wfsvt4Android App: https://technicalguruji.in/appYoutube: http://www.youtube.com/c/TechnicalGuruji Twitter:  http://www.twitter.com/technicalgurujiFacebook: http://www.facebook.com/technicalgurujiFacebook Myself: https://goo.gl/zUfbUUInstagram: http://instagram.com/technicalgurujiGoogle Plus: https://plus.google.com/+TechnicalGurujiWebsite: https://technicalguruji.in/Merchandise: http://shop.technicalguruji.in/About : Technical Guruji is a YouTube Channel, where you will find technological videos in Hindi, New Video is Posted Everyday :)"
"iZfWLxv5lLM","Current Affairs in Gujarati With GK 11 November 2018 - EduSafar","2018-11-11T04:57:20.000Z","UCfDAM9P2RF_ynz8B_j5enCw","Edu Safar","27","18.12.11","edusafar,current affairs in gujarati,latest current affairs in gujarati,current affairs in gujarati liberty,current affairs gujarati,current affairs gpsc in gujarati,gpsc current affairs in gujarati,daily current affairs in gujarati,daily gpsc current affairs in gujarati,current affairs,current affairs in gujarati 2018,current affairs in gujarati may 2018,monthly current affairs in gujarati","30228","6300","135","1503","https://i.ytimg.com/vi/iZfWLxv5lLM/default.jpg","False","False","Current Affairs in Gujarati 11 November 2018 . Current Affairs 2018 Video by Nikunj Sir.Hello, Mitro, Ame roj Current Affairs Video Muki Rahya chhie. ane apno khub Saro Pratisad Mali Rhyo chhe. video Niyamit Jota rahesho. ane madd karta rahejo. #Current_Affairs_2018 #edusafar #Current_Affairs_in_GujaratiJOIN TELEGRAM EduSafar GROUP https://t.me/EduSafarEduSafar App https://play.google.com/store/apps/details?id=com.edusafarCurrent Affairs All Videohttps://www.youtube.com/playlist?list=PLtgWmBVVunsajeNhcZvQrBCHPTlf56ID9Constitution of Indiahttps://www.youtube.com/playlist?list=PLtgWmBVVunsZ3GsMOX9fU6hhgAcihqpWaEnglish Grammar in Gujaratihttps://www.youtube.com/playlist?list=PLtgWmBVVunsakwdgvfTlrQcpN2bfFxH1CGujarati Vyakaranhttps://www.youtube.com/playlist?list=PLtgWmBVVunsbsYpUQ9PyTyzLk9dJz5sVlIPC in Gujaratihttps://www.youtube.com/playlist?list=PLtgWmBVVunsa0QxCi7yyJF8rx0CTJMxbhReasoning in Gujaratihttps://www.youtube.com/playlist?list=PLtgWmBVVunsbjQjcSjxZJ94imt5NKETaPGK Videohttps://www.youtube.com/playlist?list=PLtgWmBVVunsZOlEMDlDhnKr3bDYjF5UcdMathshttps://www.youtube.com/playlist?list=PLtgWmBVVunsYsoXZofzNhOGH8QPFLE3JUPrepare for Competitive Examshttps://www.youtube.com/playlist?list=PLtgWmBVVunsYl_PXvQz3gFIGvk16BvBu5STD 10 Social Sciencehttps://www.youtube.com/playlist?list=PLtgWmBVVunsbSJPLUuEgSPdd7j-HuKR3pGK -Indian Historyhttps://www.youtube.com/playlist?list=PLtgWmBVVunsZiKvhqymSXHDDTzcjc9qunGujarat na Jillaohttps://www.youtube.com/playlist?list=PLtgWmBVVunsZ48ckMnFZUHqF5UmFMZPv5Vyakti Visheshhttps://www.youtube.com/playlist?list=PLtgWmBVVunsbY8gt5VM5X-KhAezZT0JQf"
"kAm14llt31g","व्यापार घाटा कम करने के लिए भारत ने खेला कूटनीतिक दांव फस गया चीन \India to export sugar to China","2018-11-10T17:39:35.000Z","UCWuhuCxZJJZ-LtaKp_ucEHw","Amazing World Facts","25","18.12.11","India to export sugar to China,ISMA and COFCO.,india china,india china sugar,export","63700","1858","60","50","https://i.ytimg.com/vi/kAm14llt31g/default.jpg","False","False","India to export sugar to ChinaIn a statement on Thursday, the Commerce Ministry said the first contract to export 50,000 tonnes of sugar had been entered into by the Indian #Sugar_Mills Association (ISMA) and Chinese public sector company COFCO.ISMA initially denied there was any contract to export sugar to #China, then reversed its position and said it is making all efforts to export maximum possible sugar to China, but still denied any direct contract between #ISMA and #COFCO.#exportSound SourceLightless Dawn by Kevin MacLeod is licensed under a Creative Commons Attribution license (https://creativecommons.org/licenses/by/4.0/)Source: http://incompetech.com/music/royalty-free/index.html?isrc=USUAN1100655Artist: http://incompetech.com/"
"3G-BN6zTByo","Neeya Naana | 11th November 2018 - Promo","2018-11-09T07:27:46.000Z","UCvrhwpnp2DHYQ1CbXby9ypQ","Vijay Television","24","18.12.11","Neeya Naana,NN,Gopinath,Talk Show,Chat Show,Public Debate,Gopi,Gobi,Vijay,Star,Vijay TV,Star Vijay,Star Vijay TV,விஜய்,டிவி,தொலைக்காட்சி,நீயா நானா,கோபிநாத்,Tamil TV,Tamil Shows,gopi","381293","6972","87","352","https://i.ytimg.com/vi/3G-BN6zTByo/default.jpg","False","False","#NeeyaNaana. #VijayTV #VijayTelevision #StarVijayTV #StarVijay #TamilTV #RedefiningEntertainment #Gopi #NeeyaNaana #Gopinath #NeeyaNaanaGopi #Gobinath #நீயாநானா  | ஞாயிறு மதியம் 12 மணிக்கு உங்கள் விஜயில்.. Click here http://www.hotstar.com/tv/neeya-naana/1584 to watch the show on hotstar."
"cnrAhTM2ivA","Live : India vs West Indies : भारत ने जीता चेन्नई टी-20 , 3-0 से किया वेस्टइंडीज़ का सफाया","2018-11-11T17:29:53.000Z","UCVXCo0W9pk2dDkEBNLhTt7A","Sports Tak","17","18.12.11","sports tak,“sportstak”,“sports”,sports events,“cricket”,“sports,videos”,interviews”,india,india vs west indies,team india,rohit sharma,manish pandey","57894","1216","81","306","https://i.ytimg.com/vi/cnrAhTM2ivA/default.jpg","False","False","----------About Sports Tak: स्पोर्ट्स तक (Sports Tak) खेल की दुनिया की हर छोटी-बड़ी खबर आपके लिए लाता है। स्पोर्ट्स You Tube पर आपको मिलेगी हर ब्रेकिंग न्यूज, विश्लेशण और बड़े-बड़े खिलाड़ियों के Exclusive इंटरव्यू। साथ ही सुनील गावस्कर, हरभजन सिंह, मोहम्मद अजहरूद्दीन, मदनलाल, आकाश चोपड़ा और निखिल चोपड़ा जैसे क्रिकेट दिग्गज आपके लिए खेल पर चर्चा करेंगे और आपके सवालों के जवाब भी देंगे। खेल जगत की हर खबर से रूबरू होने के लिए सब्सक्राइब/Subscribe कीजिए स्पोर्ट्स तक (Sports Tak)।  You can follow स्पोर्ट्स तक (Sports Tak) on: Sports Tak Youtube: https://www.youtube.com/sportstakSports Tak Facebook: https://www.facebook.com/sportstak/Sports Tak Twitter: https://twitter.com/sports_takSportsTak Instagram: https://www.instagram.com/sportstakofficial/Sports Tak, as the name suggests, is all about sports. You can find all the latest sports news from around the world here. Not just that, we bring to you exclusive interviews, live chats with players - past and present - and also the top journalists from sports journalism. It is an exclusive platform for sports news updates for the fans, not just from the sub-continent but the world over"
"YfrcuTo5JpY","Joyee - জয়ী | Bangla Serial - Best Scene | EP - 387 | 4th Nov, 2018 | #ZeeBangla","2018-11-10T19:15:01.000Z","UCeMsqI6jU9WE2ctsrbxbywQ","Zee Bangla","24","18.12.11","Joyee,zee bangla Joyee,Joyee serial,full episode Joyee,zee bangla Tv Show,latest episode Joyee,new zee bangla episode,Joyee bengali serial,bangla serial Joyee,today episode Joyee,bangla tv serial,bengali shows,zee bangla,Zee5,Joyee natok,#zeebangla,family show,tv serial,tv shows,entertainment,zee bangla comedy show,bengali tv serial,joy","76864","326","36","12","https://i.ytimg.com/vi/YfrcuTo5JpY/default.jpg","False","False","The feel of your language is in your entertainment too! Watch your favourite TV shows, movies, original shows, in 12 languages on #ZeeBangla , because every language has a super feel! Watch Full Episode on Zee5 : https://www.zee5.com/tvshows/details/joyee/0-6-669/latestNow enjoy ZEE5 Globally. Available in over 190 countries* To Feel ZEE5 in Your Language, DOWNLOAD the app now for #ZeeShows- Playstore: https://play.google.com/store/apps/details?id=com.graymatrix.did- iTunes: https://itunes.apple.com/in/app/ozee-tv-shows-movies-more/id743691886Visit our website - https://www.zee5.com Connect with us on Social Media: - Facebook - https://www.facebook.com/ZEE5/ - Instagram - https://www.instagram.com/zee5 - Twitter - https://twitter.com/ZEE5India Subscribe to ZEE Bangla channel  : https://bit.ly/2wheKUOJoyee is a Bengali television series starring Debadrita Basu in the lead. The story revolves around Joyee, an innocent orphan, village girl, who dreams to become a football player. However, she gets married in a conservative family who is against football. It would be interesting to find out whether Joyee pursues her passion for football or gets engrossed in the family life after her marriage.#bangla #zeebangla #zeebanglashow #banglatvserial #bengaliserial #comedyshow #realityshow #entertainment #zee5 #zeetvshow"
"6P_-m-SXFFI","Breaking News | 107 TRS MLA Candidates Received B-Forms From KCR | Telangana Bhavan | YOYO TV","2018-11-11T16:04:24.000Z","UCJ97pLhPp-CU9Tj4-dp9B6g","YOYO TV Channel","25","18.12.11","trs,107 trs mla candidates,trs mla candidates recived b forms from kcr,trs b forms,breaking news,telangana bhavan live,kcr live,kcr b forms,telangana news,telangana elections news,107 trs mla,trs mla candidates niminations,trs bhavan,harish rao,ktr,kcr,telangana politics,political news,telangana congress mla,cm kcr,kcr nomination,yoyo tv,telugu news,politics,kcr afraid,congress,revanth reddy,uttam kumar reddy,latest news,mahakutami,hydeabad","29549","163","68","55","https://i.ytimg.com/vi/6P_-m-SXFFI/default.jpg","False","False","Breaking News | 107 TRS MLA Candidates Received B-Forms From KCR | Telangana Bhavan | YOYO TVTop Ten Telugu Trending Videos from Our Channel 1.   జగన్ పై దాడి ని ముందే చెప్పిన శివాజీ ...👉🏻 https://www.youtube.com/watch?v=yY-KdZxOQuE2 .  Anchor Shyamala And Narasimha Exclusive Interview 👉🏻 https://www.youtube.com/watch?v=elWCrKCI9983.  Is Telangana Congress MLA Candidates List For Telangana Assembly Elections 2018 Confirmed?👉🏻 https://www.youtube.com/watch?v=CsqzpCe7eac4. Rahul Gandhi Speech at Kamareddy @Telangana Congress Public Meeting👉🏻 https://www.youtube.com/watch?v=WsF-r9lnQjY5. 2050 లో ఊహించని విధంగా మనిషి జీవితం👉🏻 https://www.youtube.com/watch?v=_O1lzKPaKVA6.  Mangli Songs | Mangli Excellent Performance at ATC 2018👉🏻 https://www.youtube.com/watch?v=xMqS0N7CUfA7. Folk Singer Sai Chand Songs on Revanth Reddy at TRS Meeting - Kodangal👉🏻 https://www.youtube.com/watch?v=sjJJeZTCZmA9. Madhu Priya Song Performance & Anchor Udaya Bhanu Dance at World Telangana Convention👉🏻 https://www.youtube.com/watch?v=LI0ztYhDHPY10. Interesting Facts About Teenmar Mangli👉🏻 https://www.youtube.com/watch?v=CamXlnOQF7EDownload YOYOTV App NowAndroid: https://play.google.com/store/apps/details?id=com.yoyiptv.yoyomobileiOS: https://itunes.apple.com/us/app/yoyotv/id1392981692?mt=8Watch 24/7 News Videos, Breaking News updates, special political analysis, current issues, celebrity latest updates, movie reviews and exclusive Interviews anytime anywhere.Follow Us on: Facebook: http://bit.ly/2hkcu66 https://plus.google.com/+YOYOTVChannelTwitter: https://twitter.com/YOYOTVChannel Website: http://yoyoiptv.com/Subscribe Us https://www.youtube.com/channel/UCJ97pLhPp-CU9Tj4-dp9B6g?sub_confirmation=1"
