video_id,title,publishedAt,channelId,channelTitle,categoryId,trending_date,tags,view_count,likes,dislikes,comment_count,thumbnail_link,comments_disabled,ratings_disabled,description
"k-1oqsEvTw8","November 2018 Current Affairs in Hindi 11 November 2018 - SSC CGL,CHSL,IBPS PO,RBI,State PCS,SBI","2018-11-10T17:04:26.000Z","UCrC8mOqJQpoB7NuIMKIS6rQ","Study IQ education","27","18.13.11","ddstha","106360","6945","77","894","https://i.ytimg.com/vi/k-1oqsEvTw8/default.jpg","False","False","Download All Videos PDFs - https://goo.gl/X8UMwF || Join #StudyIQ on Telegram - https://goo.gl/xBR3g8 || #Pendrive_Courses for Various Govt. Exams. Click here to know more - https://goo.gl/aTFK6Q or #Call_9580048004 or Live Chat Support - https://goo.gl/s68PZ1UPSC/CSE 2019 - https://goo.gl/UrCD46SSC & Bank - https://goo.gl/9LQ4AiUPSC Optionals - https://goo.gl/rtmXRUState PSCs - https://goo.gl/FDB32qDefence Exams - https://goo.gl/UEmtRzSSC JE Exams - https://goo.gl/2WyU1ZRBI Grade B - https://goo.gl/PY32m6NABARD Grade A - https://goo.gl/C6CzALDMRC Exams - https://goo.gl/yDnvyfInsurance Exams - https://goo.gl/iLEFxfCLAT 2019 - https://goo.gl/BurjtjRailway Jobs - https://goo.gl/5KaL7hTeaching Jobs - https://goo.gl/q117TXUPSC Prelim 2019Test Series -https://goo.gl/zkCG51Free PDFs - https://goo.gl/cJufZc || Free Quiz - https://goo.gl/wCxZsy || Free Video Courses - https://goo.gl/jtMKP9Follow us on Facebook - https://goo.gl/iAhPDJTelegram - https://t.me/StudyiqeducationThe Hindu Editorial Analysis - https://goo.gl/vmvHjGCurrent Affairs by Dr Gaurav Garg - https://goo.gl/bqfkXeUPSC/IAS Burning Issues analysis- https://goo.gl/2NG7vPWorld History for UPSC - https://goo.gl/J7DLXvIndian History  - https://goo.gl/kVwB79Follow us on Facebook - https://goo.gl/iAhPDJFollow Dr Gaurav Garg on Facebook - https://goo.gl/xqLaQmUPSC/IAS past papers questions - https://goo.gl/F5gyWHSSC CGL + IBPS Quantitative tricks - https://goo.gl/C6d9n8English Vocabulary - https://goo.gl/G9e04HReasoning tricks for Bank PO + SSC CGL- https://goo.gl/a68WRNError spotting / Sentence correction  https://goo.gl/6RbdjCStatic GK complete- https://goo.gl/kB0uAoComplete GK + Current Affairs for all exams- https://goo.gl/MKEoLyWorld History - UPSC / IAS - https://goo.gl/kwU9jCLearn English for SSC CGL, Bank PO https://goo.gl/MoL2itScience and Technology for UPSC/IAS - https://goo.gl/Jm4h8jPhilosophy for UPSC/IAS - https://goo.gl/FH9p3nYojana Magazine analysis -https://goo.gl/8oK1gyHistory for SSC CGL + Railways NTPC - https://goo.gl/7939eV"
"zR_htQjeA28","Jeff Bezos दुन्या के सबसे अमीर इंसान की CASE STUDY - 7 RULES | SeeKen","2018-11-11T06:43:00.000Z","UCfhbydY40P2Lli9HuBz8cdA","SeeKen","27","18.13.11","RULES OF SUCCESS,BUSINESS,AMAZON,BOOKS,EBOOKS,SUMMARY,HINDI,SEEKEN,seeken,jeff bezos,biography,everything store,book,richest man,in world,costomer obession,leadership,case study,CASE STUDY,HABITS","149051","10266","172","865","https://i.ytimg.com/vi/zR_htQjeA28/default.jpg","False","False","JEFF BEZOS TOP 7 QUALITIES - EVERYTHING STORE BOOK SUMMARY IN HINDI https://www.seeken.org/audible (affiliate)BUY THE BOOK FROM HERE: https://goo.gl/NuGJTm (affiliate)BOOK RECOMMENDATIONS PLAYLIST: https://www.youtube.com/playlist?list... CONNECT TO GET KNOWLEDGE FROM SOME OF THE BEST MENTORS, BOOKS SUBSCRIBE https://www.youtube.com/channel/UCfhb...TO KNOW MORE ABOUT SEEKEN LIKE THE FACEBOOK PAGE https://www.facebook.com/seekeners/FOLLOW ON TWITTER https://twitter.com/Seeken7CONNECT ON INSTAGRAM https://www.instagram.com/seeken101/VIDEO SOFTWARE I USE - http://www.sparkol.com?aid=1580825REASON OF MY CLEAR VOICE (MIC) - https://goo.gl/egnkeuJEFF BEZOS IS WORLDS RICHEST MAN IN THE WORLD TODAY WITH OVER 130 BILLION DOLLAR NET WORTH. SINCE IT'S WISE TO LEARN FROM PEOPLE WHO HAVE ALREADY ACHIEVED SUCCESS HENCE IN THIS VIDEO WE WILL DISCUSS HOW AND WHAT MADE JEFF ACHIEVE SUCH A BIG SUCCESS AND HOW WE CAN TOO BECOME SUCCESSFUL LIKE HIM. HERE ARE TOP 7 THINGS I FOUND INTERESTING ABOUT JEFF WHILE STUDYING HIS BIOGRAPHY BOOK AND FROM OTHER SOURCES1) CURIOUS CREATOR AND INNOVATOR 2) SELF AWARNESS3) FUTURE POTENTIAL 4) THINK LONG TERM 5) CORE PRINCIPLES FROM GIANTS 6) CUSTOMER BEFORE ANYTHING 7) MARKET OWNER"
"2k7Pz-YLqsM","90's Vs 2k kids - Nakkalites","2018-11-12T13:26:01.000Z","UCiPmhfdCL06cSVTXKabF0Zg","Nakkalites","23","18.13.11","nakkalies,amma alaparaigal,comedy videos,tamil comedy videos,90's videos,trending,tamil trending,alaparaigal,latest comedy videos,mother son video,amma videos,2k kids,90s kids,90s games,pubg alaparaigal,puratasi alaparaigal,nakkalites,erumbugal media,tamil comedy,mother son,90 vs 2k boys,nakkalites new video,nakkalites bloopers,alaparaigal bloopers","170563","14400","137","1045","https://i.ytimg.com/vi/2k7Pz-YLqsM/default.jpg","False","False","A video about 90's Kids and 2k Kids. As the video got deleted due to some unknown reason, we have re-uploaded the video again. Thank you!Thanks To DivoCast KrishnaveniVaideeswariLeniSarveshArun KumarSassi kumarJesnson DivakarMuthamizhKavi JSAneesh RubenAnirudhDirectionRajeshwar KScript Nijanthan Shan ShyleshCinematography Sujith SEditing Sundar SNDRSound design Vivek SaroLive Sound VikramanAsst.Director BoobalanProduction Manager Muthamizh"
"M7b5zy_Ky8s","Ananth Kumar's Contribution To BJP Cannot Be Described In Words: BS Yeddyurappa","2018-11-12T04:59:21.000Z","UCl-OodciBGZ0k8K8rBZGe4w","Public TV | ಪಬ್ಲಿಕ್ ಟಿವಿ","25","18.13.11","Public TV,public tv live,union minister ananth kumar health,ananth kumar cancer,ananth kumar passed away,ananth kumar dies,ananth kumar dead,ananth kumar death,union minister ananth kumar,union minister ananth kumar dies at 59.,ananth kumar,union minister ananth kumar pa,ananth kumar minister,union ministor ananth kumar died,ananth kumar passes away,breaking news,exclusive new,BS Yeddyurappa,Yeddyurappa condoles death of Union Minister #AnanthKumar","77183","237","32","30","https://i.ytimg.com/vi/M7b5zy_Ky8s/default.jpg","False","False","BS Yeddyurappa condoles death of Union Minister #AnanthKumar and said his contribution to the BJP party cannot be described in words.Keep Watching Us On Youtube At: https://www.youtube.com/user/publictvnewskannadaWatch More From This Playlist Here: https://www.youtube.com/user/publictvnewskannada/playlistsRead detailed news at www.publictv.inSubscribe on YouTube: https://www.youtube.com/user/publictvnewskannada?sub_confirmation=1Follow us on Google+ @  https://plus.google.com/+publictvLike us @ https://www.facebook.com/publictvFollow us on twitter @ https://twitter.com/PublicTVnews--------------------------------------------------------------------------------------------------------Public TV brings to you the latest updates from all walks of life, be it politics or entertainment, religion or sports, crime or any other thing. Keep watching..."
"59Eub3gMGPk","Naga Chaitanya's Confession | No 1 Yaari With Rana Season 2 Ep 4 | Viu India","2018-11-09T08:33:40.000Z","UCKKgnZJoDHChxAuWLTwvVpw","Viu India","24","18.13.11","Naga Chaitanya's Confession,No 1 Yaari With Rana,Season 2 Episode 4,McDowell's No.1 Yaari with Rana Season 2,Viu India,Rana Daggubati,Naga Chaitanya,Niddhi Agerwal,Chandoo Mondeti,No 1 Yaari Telugu,No 1 Yaari With Rana Promo,Telugu Talk Show,Telugu Chat Show,Latest Telugu Talk Show,Yaari Telugu,Rana Daggubati Telugu Show,Rana Daggubati Talk Show,Yaari Telugu Promo,Yaari Telugu Episodes,Tollywood Actors Interview","263480","2132","89","51","https://i.ytimg.com/vi/59Eub3gMGPk/default.jpg","False","False","Naga Chaitanya's Confession on the fourth episode of McDowell's No 1 Yaari With Rana Season 2. Episode 4 features Naga Chaitanya, Niddhi Agerwal and Chandoo Mondeti. Click here to download the Viu App to stay tuned for more - http://bit.ly/ViuApp-YT#McDowellsNo1YaariWithRana #Season2 #RanaDaggubatiNaga Chaitanya Akkineni debuted in the 2009 film Josh, directed by newcomer Vasu Varma. Prior to the release of his first film, he signed his second film with Indira Productions Ye Maaya Chesave co-starring Samantha Akkineni released in 2010. In 2016, he starred in two films, Premam, co-starring Shruti Haasan and Sahasam Swasaga Sagipo, which earned him critical acclaim. Subsequently, in 2017, he starred in Rarandoi Veduka Chudham, which became his career's highest grosser till date. In 2018, he starred in the films Shailaja Reddy Alludu and Savyasachi.Nidhhi Agerwal made her Bollywood debut in 2017 opposite Tiger Shroff. Agerwal made her Telugu Debut along side Naga Chaitanya in Savyasachi which was released in October 2018. Download the Viu App for a Happy Viuing experience: http://bit.ly/ViuGenericYTAbout Viu : Viu is an Over-the-Top (OTT) video-on-demand (VOD) service from Vuclip, a PCCW Media company, providing access to best of Bollywood movies, Tollywood movies, latest Korean shows and Original web shows to entertain the diverse Indian audience. Viu’s content offering includes popular #digitalseries like No 1 Yaari With Shivanna featuring Shivanna as a host Tollywood Squares, #No1Yaari with Swwapnil along with diversified originals like PillA, PelliGola, Social, Gehraiyaan and SpotlightFollow and Like us on Facebook: https://www.facebook.com/pg/ViuIndiaTwitter: https://twitter.com/Viu_INInstagram: https://www.instagram.com/viuindia/"
"NX0pIxLihn4","Family की Situation vs आपके Goals - By Sandeep Maheshwari","2018-11-08T06:03:19.000Z","UCBqFKDipsnzvJdt6UT0lMIg","Sandeep Maheshwari","22","18.13.11","Inspirational,Inspiring,Videos,Motivational,Motivation,Motivating,Success,India,Indian,Speaker,Speaking,Workshop,Ideas,Hindi,Greatest,Speech,Talk,Positive,Thinking,Attitude,Powerful,Leadership,Aasaan,session,thoughts,great,most,best,lecture,last,Ever,india tour,power of focus,focus,students,concentration power,studies,best of sandeep,career,choice,10+2,student,latest 2018,entrepreneurship,business,confusion,education system,india","1068278","60184","818","4429","https://i.ytimg.com/vi/NX0pIxLihn4/default.jpg","False","False","Sandeep Maheshwari is a name among millions who struggled, failed and surged ahead in search of success, happiness and contentment. Just like any middle class guy, he too had a bunch of unclear dreams and a blurred vision of his goals in life. All he had was an undying learning attitude to hold on to. Rowing through ups and downs, it was time that taught him the true meaning of his life.To know more, log on to www.sandeepmaheshwari.comConnect with him at Facebook.com/SandeepMaheshwariPageWatch his inspirational videos at Youtube.com/SandeepSeminarsMusic: Youtube Music Library"
"J6nY-_YCIqE","5 Easy Rangoli Designs जो आप भी बना लेंगे | Rangoli Beautiful and Easy Design for Diwali","2018-11-07T05:25:44.000Z","UCKjJXmZxk1SiTUQUB28KHpw","TsMadaan","26","18.13.11","rangoli,rangoli designs,easy rangoli,RANGOLI DESIGNS,Rangoli Designs,rangoli design,latest rangoli designs,unique rangoli designs,rangoli designs easy,beautiful rangoli designs,kolam,easy rangoli designs,diwali,rangoli designs beautiful,rangoli easy,rangoli easy designs,रंगोली,rangoli ke design,rangoli unique designs,simple design,simple designs,simple rangoli,rangoli designs with dots,innovative rangoli designs,colourful rangoli designs","1830534","10402","2848","768","https://i.ytimg.com/vi/J6nY-_YCIqE/default.jpg","False","False","5 आसान रंगोली डिज़ाइन जो आप भी बना लेंगे | Easy Rangoli Designs Simple and Beautiful for Diwali.This Diwali, decorate your home or office with very easy rangoli designs using kitchen items. You will find our rangoli designs easy and simple rangoli designs, yet these are best rangoli designs.Learn Rangoli tricks and techniques on how to make Rangoli for Diwali 2018. In our creative rangoli videos, you will find beautiful rangoli designs, simple kolam with dots, which are rangoli easy designs for beginners to make quick rangoli designs step by step using basic colours.Easy Rangoli - https://www.youtube.com/watch?v=8DTQLSOtiFoSimple Rangoli - https://www.youtube.com/watch?v=-viuZXATeKkBeautiful Rangoli - https://www.youtube.com/watch?v=0eFyZPOOpSgAttractive Rangoli Designs - https://www.youtube.com/watch?v=NRPndNPJbtoRangoli Designs with Dots - https://www.youtube.com/watch?v=LsWcO0Ax1WIColourful Rangoli - https://www.youtube.com/watch?v=HayVuHxh1LwFor more best rangoli designs, subscribe us.https://www.youtube.com/TSMadaan is a Free Hindi Life Changing Videos Channel to raise your Success and Happiness level on various subjects."
"j6VT-ppZ5pE","Delhi Grand Mushayra || Imran Pratapgarhi || 10 Nov 2018 || Amanatullah Khan MLA (AAP)","2018-11-11T10:22:10.000Z","UCrOCrPtXW2OzpP2O87-gF-g","Imran Pratapgarhi Official","24","18.13.11","Delhi Grand Mushayra,Delhi Grand Mushayra || Imran Pratapgarhi || 10 Nov 2018 || Amanatullah Khan MLA (AAP),delhi mushayra 2018 imran pratapgarhi,jamia mushayra 2018 imran pratapgarhi,amanat ullah khaan imran pratapgarhi,amanat mushayra delhi 2018,jamia mushayra imran pratapgarhi,latest mushayra imran pratapgarhi 2018,november mushayra imran pratapgarhi 2018","246448","0","0","1172","https://i.ytimg.com/vi/j6VT-ppZ5pE/default.jpg","False","True","क ख़ूबसूरत स्कूल का उद्घाटन, जुनैद और अज़ीम के परिवारों को नौकरी का ज्वाइनिंग लेटर, दिल्ली के उप मुख्यमंत्री मनीष सिसोदिया जी की एक एक मिसरे पर वाह वाह की सदायें !रात अमानतउल्लाह खान साहब का मुशायरा अपने आप में कई बुनियादी कामों की इबारत समेटे था !शुक्रिया जुनून की हद तक मुझे प्यार करने वाली अवाम का !Love U दिल्लीThis is Official YouTube Channel of Shayar/Poet Imran Pratapgarhi (Copyright)Visit Official Website http://imranpratapgarhi.in/ to Explore More About Imran PratapgarhiFor Latest Videos And Updates You Can Subscribe This Channel Imran Pratapgarhi Awarded  By YASH BHARTI For The Contribution in Literature and Shayari by Uttar Pradesh Government In 2016Yash Bharti Award is the highest Award of Government of Uttar Pradesh, Instituted in 1994, it is awarded to those personalities whose contribution is remarkable in the field of literature, social work, medicine, film, science, journalism, handicrafts, culture, education, music, drama, sports, industry and astrologyYou Can follow Imran Pratapgarhi On These Social Media Networks...Facebook - https://www.facebook.com/ImranPratapgarhiOfficialTwitter - https://twitter.com/ShayarImranInstagram - https://www.instagram.com/imranpratapgarhi/Website - http://imranpratapgarhi.in/"
"IlGUU1EHH30","Thugs of Hindostan || Review by KRK || Bollywood Movie Reviews || Latest Reviews","2018-11-08T14:41:59.000Z","UCfDxyxsxaKpyYXkrNRItLsg","Kamaal R Khan - KRK","24","18.13.11","Review,Movie Review By KRK,Bollywood Review,Reviews,Kamaal Khan (Film Actor),Khan,Kamaal Rashid Khan (Film Actor),Best of Kamaal Khan,Latest Bollywood Reviews 2014,Best Of KRK Reviews,KRK Reviews 2014,critic,krk critic,no 1 critic","1328091","27765","10990","8002","https://i.ytimg.com/vi/IlGUU1EHH30/default.jpg","False","False","Follow KRK OnYouTube @ http://bit.ly/KamaalRKhanYTFacebook @ https://www.facebook.com/KRK.KamaalkhanTwitter @ https://twitter.com/kamaalrkhan"
"MvolnrzxQ0o","News18  Rajasthan Live Stream","2018-11-10T18:43:17.000Z","UC7FlLbNo66YsCEAPuJITiNg","News18 Rajasthan","25","18.13.11","ETV Rajasthan,rajasthan news,Rajasthan,latest,news,rajasthani news,rajasthan top stories,top stories,regional news,hindi news rajasthan,breaking news,live news,live news in hindi,rajasthan live,rajasthan news live,live news rajasthan,news from rajasthan,live news india,news18 rajasthan,news18 rajasthan live stream,news18 rajasthan live,news18 india,rajasthan live news","100735","750","59","0","https://i.ytimg.com/vi/MvolnrzxQ0o/default_live.jpg","False","False","Watch the live stream of News18  Rajasthan for latest news on politics, health, education, bollywood and much more.News18  Rajasthan is an exclusive news channel on YouTube which streams news related to Rajasthan, Nation and World. Along with the news, the channel also debates on contemporary topics and shows special series which are interesting and informative.Here you can watch hindi news, breaking news, politics news, latest news, entertainment news, tech news, auto news, lifestyle news & more.News18  राजस्थान एक क्षेत्रीय न्यूज़ चैनल है जिसपर राजस्थान, देश एवं विदेश की खबरें प्रकाशित की जाती हैं | समाचारों क साथ-साथ इस चैनल पर समकालीन विषयों पर वाद-विवाद एवं विशेष सीरीज भी प्रकाशित होती हैं जो की काफी रोचक एवं सूचनापूर्ण हैं |Subscribe to our channel for latest news updates: https://goo.gl/Xo1o6n Follow Us: https://twitter.com/News18Rajasthan Like Us: https://www.facebook.com/RajasthanNews18/ Follow Us: https://goo.gl/xnrjkt Our Website: news18rajasthan.com"
"_NrpzOPuueo","पॉलिटिकल स्टॉक एक्सचेंज: राजस्थान में किसकी जीत? EXCLUSIVE| News Tak","2018-11-08T14:21:24.000Z","UCAUNFgpgVisKPL3yq_-Nj-Q","News Tak","25","18.13.11","hindi news,news video,latest news,“newstak,news”,channel”,“news”,“,newstak”,news tak,news tak channel,newstak channel,news videos,news videos in hindi,news tak newstak,news tak india,news tak live,newstak live,newstak india,newstak exclusive,news tak exclusive,news tak videos,newstak videos,exclusive news tak videos,exclusive newstak videos,news tak today,news tak official,newstak official,newstak aajtak,news tak aaj tak","4093156","18047","5208","5560","https://i.ytimg.com/vi/_NrpzOPuueo/default.jpg","False","False","Who will win in rajasthan election pse exclusive with anjana om kashyap..About News Tak (न्यूज़ तक):न्यूज़ तक (news tak) आपको देता है ख़बरों का बिल्कुल नया अंदाज । 40 सेकंड के छोटे गरमा-गरम वीडियो तो हैं ही साथ में न्यूज़ तक (news tak) के यू ट्यूब प्लेटफॉर्म पर आपको मिलेंगे दिलचस्प और EXCLUSIVE इंटरव्यू, वो भी अनकट..यहां आपको मिलेगा न्यूज़तक (news tak) स्पेशल, न्यूज़ तक (news tak) LIVE और भी बहुत कुछ। राजनीति, बॉलीवुड, देश-विदेश हर तरह की ख़बरों से जुड़े मनोरंजक वीडियो के लिए देखिए सिर्फ न्यूज़ तक (news tak)। क्या है वायरल होने वाले वीडियो की सच्चाई? ख़बर में ऐसा क्या था खास जो आप नहीं देख पाए? कोई भी ख़बर वायरल होने से पहले आप तक पहुंचाएगा न्यूज़ तक (news tak) । हर रोज दिलचस्प और गरमा-गरम वीडियो के लिए सब्सक्राइब कीजिए न्यूज़ तक (news tak)। ये है न्यूज़तक (news tak) का Official Channel.News Tak is the most revolutionary and credible news channel on YouTube. News Tak brings news to you in an innovative VOD style that is set to capture and satiate your thirst for NEWS. This is the most credible source of Live videos that bring to you PC done by all political parties. From exclusive interviews to politics, bolly & Viral videos, anything and everything that is happening around the world is on News Tak. We ensure that the truth behind viral videos reaches you.We save you from rumours. This is the most reliable source of news that you can rely on. Subscribe to the official channel of News Tak here.You can follow News Tak on:News Tak Youtube: https://www.youtube.com/newstakNews Tak Facebook: https://www.facebook.com/newstakofficialNews Tak Twitter: https://twitter.com/newstakofficialNews Tak Instagram: https://www.instagram.com/newstakofficial/"
"PynSVIbIpfc","Top 10 Unlucky Run Outs in Cricket History - Unluckiest Run Outs","2018-11-09T14:13:43.000Z","UCOOrMnFmeCLd_BMQ-b_ohQg","Sports Blast","17","18.13.11","unlucky run out,unlucky run outs in cricket,unlucky run outs,unlucky run outs in cricket history,funny run outs in cricket,bizarre run outs in cricket,most unlucky run outs","1454986","9219","1038","412","https://i.ytimg.com/vi/PynSVIbIpfc/default.jpg","False","False","I come with a new video in this video you can watch the top  10 most unluckiest run outs in cricket history.These funny and unluckiest run outs made you laugh.This video also include the unluckiest run outs of inzamam ul haq as he has many funny run outs in cricket.----------------------------------------------------For All Cricket Matches Live Streaming & Highlights :Visit : https://cricbin.com------------------------------------------------------Sports Blast :Sports Blast is a Media providing Cricket fans the best Cricket videos from around the World since Aug 3, 2016. And now we are family of 1.3 Millions.Thank,s my every fan for supporting me.-----------------------------------------------------For Brand Promotion :Email :  support@cricbin.com-----------------------------------------------------Our Social Media:Facebook : https://www.facebook.com/SportsBlast.Live/Google+ : https://plus.google.com/+SportsBlastTwitter : https://twitter.com/SportsBlast2/Website : https://cricbin.com/------------------------------------------------------PlayLists :Cricket Slide Show Videos : https://www.youtube.com/watch?v=N-FgFRN6h-A&list=PL4bCcZicILH6CAfygLO83ImeCpWkXueNO-----------------------------------------------------If You Like our Videos then Subscribe to our Channel & Press the Bell icon to Stay Connect visit our Community Tab.Subscribe: https://www.youtube.com/sportsblastofficialCommunity : https://www.youtube.com/sportsblastofficial/community -----------------------------------------------------Music Credit :NCS ( NoCopyrightMusic )-----------------------------------------------------"
"y2_Tw45pOkI","Couple Fights || Mahathalli","2018-11-07T13:09:12.000Z","UCFnLGH9BGpJLJMMlRMr-f5Q","Mahathalli","24","18.13.11","telugu comedy videos,telugu funny videos,telugu comedy webseries,comedy videos telugu,telugu comedy shortfilms,comedy shortfilms,telugu,comedy,2016,mahathalli,mahathalli amma,Couple Fights,Mahathalli Couple Fights video","814307","15429","1055","1797","https://i.ytimg.com/vi/y2_Tw45pOkI/default.jpg","False","False","Fighting with friends and family is one thing but fighting with your partner is a whole new scene.. Watch this episode of Couple fights and let us know if you relate! Cast : Jahnavi, Jones, Ravi, Pratyusha, Karthik, Gautami, Sai, NikhilDOP : Seshi KiranEditing : RaviTeja Nannimala,  Yuva Kiran DI :  Pradeep RoyPublicity Designer : Durga Sai Hope to entertain you all..!!!Thank you for Subscribing…. XOXOLive the Moment.  Cheers..!!!#TamadaMedia #Wirally #MahathalliPowered By Tamada MediaFollow me onhttps://www.facebook.com/Mahathalli/https://twitter.com/mahathallihttps://www.instagram.com/mahathalli/"
"IZMZMNFDI7Y","KGF | Yash | Srinidhi Shetty | Kannada | Trailer Reaction!","2018-11-10T09:07:30.000Z","UCwV_A5L1hhEVfld6Wbxn3jg","jaby koay","24","18.13.11","kgf,trailer,reaction,jaby koay,jaby,jabykoay,yash,srinidhi shetty,Prashanth Neel,Vijay Kiragandu,kannada,telugu,hindi,india,anthony alba,achara kirk,achara","299611","9532","252","1723","https://i.ytimg.com/vi/IZMZMNFDI7Y/default.jpg","False","False","Jamazing Patrons of November: JN Valente, Sachin Shenoy, Avijit Singh, Madhan, Bhavya Singh,  Harmandeep Singh, Riju Mahna and Daniel Prakash!Be a patron for Jaby and support more videos like this!http://www.patreon.com/jabykoay___Trailer Link:https://www.youtube.com/watch?v=qXgF-iJ_ezE___SOCIAL MEDIA:~ACHARA KIRK~Twitter & Instagram: @AcharaKirkhttp://youtube.com/Achara~JABY KOAY~YouTube, Twitter, Instagram: @jabykoayFacebook: http://www.facebook.com/followjaby~VEERENDRA CHOWDARY~Veerendra Chowdary created the opening animation.Twitter: @NameisVeeru~MOOSA RAZA~Moosa Raza created additional background animation.Instagram: @syedraza7Twitter: @MoosaRaza27___Jaby WEST:https://youtube.com/GETJabyJaby ASIA:https://youtube.com/JabyKoayJABY KOAY'S SHORT FILMS PLAYLIST:https://www.youtube.com/playlist?list=PL34B19BA788E18384Click here to subscribe and know when the next video drops:http://www.youtube.com/subscription_center?add_user=jabykoayThanks for watching!!!__Credit of my favorite movie reviews song:Highlight Reel Kevin MacLeod (incompetech.com)Licensed under Creative Commons: By Attribution 3.0 Licensehttp://creativecommons.org/licenses/by/3.0/"
