video_id,title,publishedAt,channelId,channelTitle,categoryId,trending_date,tags,view_count,likes,dislikes,comment_count,thumbnail_link,comments_disabled,ratings_disabled,description
"FzfKn-hlZwo","The 1975 - It's Not Living (If It's Not With You)","2018-12-03T16:58:34.000Z","UCH_YpPVrF7Kzjew8rB2cdjg","The1975VEVO","10","18.19.12","The,1975,It's,Not,Living,(If,With,You),Polydor,Records,Alternative","1672557","104579","1488","5849","https://i.ytimg.com/vi/FzfKn-hlZwo/default.jpg","False","False","A Brief Inquiry Into Online Relationships OUT NOW: https://The1975.lnk.to/ABIIORMCThe 1975 - It's Not Living (If It's Not With You) Official VideoDirected by Warren Fu"
"ZZHZLMO0xc0","Natti Natasha - Me Gusta [Official Video]","2018-12-02T23:14:43.000Z","UCu59H8LNti6mwvcGRMge5PA","Natti Natasha","10","18.19.12","natti natasha,natti,natasha,natti nat,me gusta,natti natasha me gusta,me gusta natti,me gusta natti natasha,me gusta video,natti natasha video oficial,natti natasha 2018,Natti Natasha - Me Gusta,natti natasha letra,thalia natti natasha,sin pijama,natti natasha sin pijama,natti natasha quien sabe,becky g natti natasha,becky g,criminal,bad bunny natti natasha,pina records,quien sabe,thalia,No Me acuerdo,Zum Zum,daddy yankee,natti me gusta,ozuna","30742497","342213","14644","14008","https://i.ytimg.com/vi/ZZHZLMO0xc0/default.jpg","False","False","Natti Natasha - Me Gusta [Official Video]Suscríbete : http://bit.ly/NattiNatashaYouTubeEscucha Me Gusta en tu plataforma digital favorita:Spotify: https://spoti.fi/2SvQWTpApple Music: https://apple.co/2EbTmDsDeezer: https://bit.ly/2K2rkgTGoogle Play: https://goo.gl/pfQhYFAmazon Music: https://amzn.to/2SpisBAiTunes: https://apple.co/2KSDq9OSígueme en mis redes sociales:Facebook: https://www.facebook.com/NattiNatashaOfficial/Instagram: https://www.instagram.com/nattinatasha/Twitter: https://twitter.com/NattiNatashaPlaylists By Natti Natasha➤Official Videos: https://bit.ly/2E3soOh➤ Lo Nuevo: https://bit.ly/2SlziBI➤Natti Natasha Live: https://bit.ly/2rcxwXVMira otros éxitos de Natti Natasha aquí 👇❓Quien Sabe: https://youtu.be/mG0b8IAJvts🐝 Zum Zum: https://youtu.be/PLLexxa2xQU🐻 👩🏻Criminal: https://youtu.be/VqEbCxg2bNI🐰👩🏻 Amantes De Una Noche: https://youtu.be/FVRPzwb1Vi4🌹Tonta: https://youtu.be/VTzD0jNdrmo🎀Otra Cosa: https://youtu.be/XKqSpbbM-UISuscríbete al canal de Pina Records el sello disquero más importante del género urbano: http://bit.ly/PinaRecordsYouTubeWebsite: www.pinarecords.net(787) 743-1100 / booking@pinarecords.netPress & Media: press@pinarecords.net"
"Qgd1016Sk0A","Conan Surprises Japanese Fans","2018-12-03T18:53:58.000Z","UCi7GJNg51C3jgmYTUwqoUXA","Team Coco","23","18.19.12","[none]","1509577","46586","367","2216","https://i.ytimg.com/vi/Qgd1016Sk0A/default.jpg","False","False","Last year, a couple invited Conan to their wedding in Japan. Conan couldn’t make it, but he's stopping by their house now with a special wedding gift in tow.More CONAN @ http://teamcoco.com/videoTeam Coco is the official YouTube channel of late night host Conan O'Brien, CONAN on TBS & TeamCoco.com. Subscribe now to be updated on the latest videos: http://bit.ly/W5wt5DFor Full Episodes of CONAN on TBS, visit http://teamcoco.com/videoGet Social With Team Coco:On Facebook: https://www.facebook.com/TeamCocoOn Google+: https://plus.google.com/+TeamCoco/On Twitter: http://twitter.com/TeamCocoOn Tumblr: http://teamcoco.tumblr.comOn YouTube: http://youtube.com/teamcocoFollow Conan O'Brien on Twitter: http://twitter.com/ConanOBrien"
"6DOydovw1VQ","REBECCA ZAMOLO Christmas SWEATER Official Music Video! (Game Master Challenge)","2018-12-02T18:06:30.000Z","UCfw8x3VR-ElcaWW2Tg_jgSA","Rebecca Zamolo","10","18.19.12","christmas,24 hours,official,music,song,new,found,game master,challenge,escape,wengie,sweater,rebecca zamolo,matt and rebecca,fun,family friendly,funny,kids,entertainment,kid friendly,pg,game,family,2018","3513568","62539","5048","18782","https://i.ytimg.com/vi/6DOydovw1VQ/default.jpg","False","False","Watch - Exploring Game Master Top Secret Escape Room House! (Mysterious Clues & Hidden Riddles Found inside) - https://youtu.be/KqV-PUKqDHYRebecca Zamolo Official Music Video and Lyrics for Game Master Spy 24 Hours Challenge!▶ ITunes! https://goo.gl/ziQmtE▶ Help Rebecca Zamolo and Matt solve Game Master clues! https://bit.ly/2S207vo▶ ZamFam merch is here!  https://rebeccazamolo.comMadilyn Bailey- Vocals https://www.youtube.com/user/MadilynBaileyKyle Hanagami- Choreography https://www.youtube.com/user/kylehanagamiDirector- Ryan Parma and Matt YoakumDancers:  Yuliana MaldonadoHayley FitzgeraldLonni olsonHaley JonaeWatch My Awesome Friends and other fun YouTube Videos:Wengie | Christmas Sweater” MV (Official Music Video) https://youtu.be/0samRmOIcLcVy Qwaint | Trapping Project Zorgo on Scavenger Hunt with Spy Gadgets & Treasure chest (mysterious clues found) https://youtu.be/V_qjZgFqT-UStephen Sharer | Game Master on Top Secret Hidden Camera! (Control Room Found in Stephen Sharer House) https://youtu.be/mmOh7TP2_i4Matt and Rebecca| This Trip was a mistake! (Found Game Master Spy Mysterious Clues on Hidden Ninja Gadget Camera) https://youtu.be/cSugkLWXWL4Follow Rebecca Zamolo:Instagram: https://instagram.com/rebeccazamolo/Twitter: https://twitter.com/rebeccazamoloMusical.ly/ Tik Tok: RebeccaZamoloSnapChat: rebeccazamoloFacebook: https://www.facebook.com/rebecca.zamoloSEND FAN MAIL TO REBECCA!12021 Wilshire Blvd number 714Los Angeles, Ca 90025"
"2RQH5Ycj1C8","Being the Best/Worst Ever","2018-12-02T19:03:16.000Z","UCGwu0nbY2wSkW8N-cghnLpA","Jaiden Animations","1","18.19.12","jaiden,animations,jaidenanimation,jaidenanimations,self improvement,self improvement jaiden animation","3961234","294509","3529","68098","https://i.ytimg.com/vi/2RQH5Ycj1C8/default.jpg","False","False","life, amirite?♥ The Team ♥Atrox: https://twitter.com/AtroxChobatsuDenny: https://www.instagram.com/90percentknuckles/DavidBaronArt: http://davidbaronart.tumblr.com/Pivots: https://www.youtube.com/user/ThePivotsXXDMorganToast: https://www.youtube.com/channel/UCHimPYk1csmmOSGKF4pKelgDuckdee: https://www.youtube.com/channel/UCvS5en9GP_XSYwgzNReHNTQDevon: https://www.instagram.com/devonkong/GinjaNinja: https://www.youtube.com/user/GinjaNinjaOwOJaystarz: https://www.youtube.com/xjaystarzx------------------------------------------------------------------------------------SUBSCRIBE for more animations!https://www.youtube.com/c/jaidenanimationsMERCH:https://jaidenanimations.com/TWITTER:https://twitter.com/JaidenAnimationINSTAGRAM:https://instagram.com/jaiden_animations/DEVIANTART:http://jaidenanimations.deviantart.com/Behind the Scenes:https://www.patreon.com/jaidenanimations?ty=hIf you're an animator, artist, gamer, or entertainer, then join us at Channel Frederator Network: https://frdr.us/JaidenWanna Send Fanart?You can send it to me through Twitter or DeviantArt (links above)------------------------------------------------------------------------------------Music: Assembly Line Frustration by ionicsBaseball montage: https://www.youtube.com/watch?v=BnmglWHoVrk&list=PLMFmJLFhkDPG6le5JoCJbWK8pQM6tU_TBPiano montage by www.bensound.com------------------------------------------------------------------------------------And this tells me you read the description, which means you respect what I have to say! Thank you :D ...come here often?"
"-7oX_qB2JQw","Musical Smoothie Bar | Rudy Mancuso","2018-12-02T17:58:17.000Z","UC5jkXpfnBhlDjqh0ir5FsIQ","Rudy Mancuso","10","18.19.12","musical smoothie bar,rudy,mancuso,musical,smoothie,bar,seor grinch vacation,one man band,queen youre my best friend rudy mancuso cover,Señor Grinch Vacation | Rudy Mancuso,Anwar Jibawi,Hannah Stocking & King Bach,lelepons,hannahstocking,rudymancuso,inanna,anwar,sarkis,shots,shotsstudios,alesso,anitta,brazil","1880138","56683","1768","2913","https://i.ytimg.com/vi/-7oX_qB2JQw/default.jpg","False","False","Thank you to Clif Bar for sponsoring this video! Try new CLIF Fruit Smoothie Filled energy bars, now available at stores nationwide or online at: https://goo.gl/izJ2CuWATCH MORE ▶ https://youtu.be/ATwpzZnspMYSUBSCRIBE ► https://www.youtube.com/channel/UC5jkXpfnBhlDjqh0ir5FsIQ?sub_confirmation=1THANKS FOR WATCHING! LIKE & SUBSCRIBE FOR MORE VIDEOS!-----------------------------------------------------------FIND ME ON: Instagram | http://instagram.com/rudymancusoTwitter | http://twitter.com/rudymancusoFacebook | http://facebook.com/rudymancusoCAST: Rudy Mancuso | http://youtube.com/c/rudymancusoFOLLOW THE SHOTS FAMILY ▶ http://instagram.com/theshotsfamilyShots Studios Channels:Alesso | http://youtube.com/c/alessoAnitta | http://youtube.com/c/anittaAnwar Jibawi | http://youtube.com/c/anwarAwkward Puppets | http://youtube.com/c/awkwardpuppetsDelaney Glazer | http://youtube.com/c/deeglazerHannah Stocking | http://youtube.com/c/hannahstockingLele Pons | http://youtube.com/c/leleponsMarlon Wayans | http://youtube.com/c/marlonwayansRudy Mancuso | http://youtube.com/c/rudymancusoShots Studios | http://youtube.com/c/shotsThe Shots Family [Vertical] | http://youtube.com/c/theshotsfamily#Rudy#RudyMancuso"
"Lg2uQ1uoBJU","Deontay Wilder Knocks Down Tyson Fury in Round 12 | SHOWTIME PPV","2018-12-02T23:07:27.000Z","UCFPoJNd0d4k1H9A6UOlikcg","SHOWTIME Sports","17","18.19.12","showtime,shosports,sports,knockout,england,usa,deontay wilder,punch,knock down,showtime ppv,wilder vs. fury,tyson fury,round 12,undertaker,Wilder vs. Fury,deontay wilder vs tyson fury,Round 12,main event,odds,analysis,live stream,media,highlights,staples center,arena,los angeles,LA","1409606","11982","568","9734","https://i.ytimg.com/vi/Lg2uQ1uoBJU/default.jpg","False","False","WBC Heavyweight World Champion Deontay Wilder lands a right hand and left hook combination that sent the 6-foot-9 Tyson Fury down for the second time in the fight, hitting his head on the canvas, but manages to miraculously get up.#WilderFury #DeontayWilder #TysonFurySubscribe to the SHOWTIME Sports YouTube channel: https://goo.gl/s8CWVTFollow SHOWTIME Sports:Facebook: https://www.facebook.com/ShoSports/Twitter: https://twitter.com/SHOsportsInstagram: https://instagram.com/shosportsSnapchat: https://www.snapchat.com/add/shosportsOfficial Site: https://www.sho.com/sportsFollow SHOWTIME Boxing:Facebook: https://www.facebook.com/ShoBoxingTwitter: https://twitter.com/ShowtimeBoxingInstagram: https://instagram.com/showtimeboxingTumblr: http://showtimeboxing.tumblr.com/ Follow INSIDE THE NFL:Facebook: https://www.facebook.com/insidetheNFLTwitter: https://twitter.com/insidetheNFLInstagram: https://www.instagram.com/insidetheNFL/Follow BELOW THE BELT with Brendan Schaub:Facebook: https://www.facebook.com/BelowTheBeltSHOTwitter: https://twitter.com/btbshowtimeInstagram: https://www.instagram.com/belowthebelt/Follow SHOWTIME:Facebook: https://www.facebook.com/showtimeTwitter: https://twitter.com/SHO_NetworkInstagram: https://instagram.com/showtime/Youtube: https://www.youtube.com/user/SHOWTIMEOfficial Site: https://www.sho.com/"
"VWHlPH23P-w","Are Walmart Gaming PCs actually THAT bad?","2018-12-02T20:01:40.000Z","UCXuqSBlHAE6Xw-yeJA0Tunw","Linus Tech Tips","28","18.19.12","walmart,gaming,gaming pc","3497059","84094","3765","14142","https://i.ytimg.com/vi/VWHlPH23P-w/default.jpg","False","False","Thanks to Skillshare for sponsoring this video! First 500 people will get a 2 month FREE trial here: https://skl.sh/2Bz6IabBuy the be quiet! Silent Base 801 on Newegg: https://lmg.gg/8KVK5The new OverPowered line of gaming PC's from Walmart got slammed by other reviewers. While they do not sell these in Canada, we went down to US and got one to see for ourselves.Discuss on the forum: https://linustechtips.com/main/topic/1003043-are-walmart-gaming-pcs-actually-that-bad/Our Affiliates, Referral Programs, and Sponsors: https://linustechtips.com/main/topic/75969-linus-tech-tips-affiliates-referral-programs-and-sponsorsGet Private Internet Access today at http://geni.us/7lLuafKLinus Tech Tips merchandise at http://www.designbyhumans.com/shop/LinusTechTips/Linus Tech Tips posters at http://crowdmade.com/linustechtipsOur Test Benches on Amazon: https://www.amazon.com/shop/linustechtips Our production gear: http://geni.us/cvOSTwitter - https://twitter.com/linustechFacebook - http://www.facebook.com/LinusTechInstagram - https://www.instagram.com/linustechTwitch - https://www.twitch.tv/linustech Intro Screen Music Credit:Title: Laszlo - SupernovaVideo Link: https://www.youtube.com/watch?v=PKfxmFU3lWYiTunes Download Link: https://itunes.apple.com/us/album/supernova/id936805712Artist Link: https://soundcloud.com/laszlomusicOutro Screen Music Credit: Approaching Nirvana - Sugar High http://www.youtube.com/approachingnirvanaSound effects provided by http://www.freesfx.co.uk/sfx/"
"gl1aHhXnN1k","Ariana Grande - thank u, next","2018-11-30T19:58:22.000Z","UC0VOyT2OCBKdQhF3BAbZ-1g","ArianaGrandeVevo","10","18.19.12","Ariana,Grande,thank,next,Republic,Records,Pop","187498621","7628370","322861","625040","https://i.ytimg.com/vi/gl1aHhXnN1k/default.jpg","False","False","thank u, next (Official Video)Song available here: https://arianagrande.lnk.to/thankunextYDDirected by Hannah Lux DavisProduced by Brandon Bonfiglio Edited by Hannah Lux Davis & Taylor Tracy WalshProduction Company: London AlleyExecutive Producers: Brandon Bonfiglio, Luga Podesta, Andrew LeriosColorist: Bryan SmallerFeaturing (in alphabetical order)Colleen BallingerJonathan BennettMatt BennettCourtney ChipoloneJennifer CoolidgeGabi DeMartinoStefanie DrummondElizabeth GilliesToulouse GrandeKris JennerAlexa LuriaDaniella MonetVictoria MonetScott NicholsonTayla ParxTroye SivanMusic video by Ariana Grande performing thank u, next. © 2018 Republic Records, a Division of UMG Recordings, Inc.http://vevo.ly/dFKirk"
"aLcJZ6OhxAw","Dalton and James Arthur duet on X Factor Final | Final | The X Factor UK 2018","2018-12-02T20:36:51.000Z","UCEY1ejsweY4DgMwOVJeEaBA","The X Factor UK","24","18.19.12","the x factor,x factor,X factor UK,x factor 2018,simon cowell,robbie williams,auditions judges season 15,series 15,X Factor UK 2018,X Factor 2018 audition,The x factor 2018,XFactor 2018,louis Tomlinson,Ayda Field,DALTON HARRIS,JAMES ARTHUR,JAMES ARTHUR X FACTOR,DALTON X FACTOR,THE POWER OF LOVE,X FACTOR FINAL","2354261","47106","1098","0","https://i.ytimg.com/vi/aLcJZ6OhxAw/default.jpg","True","False","Visit the official site: http://itv.com/xfactorTwo contrasting styles, one superb performance, Dalton Harris and James Arthur perform The Power Of Love at the X Factor Final. SUBSCRIBE: http://bit.ly/TXFSubFacebook: http://bit.ly/TXFFBTwitter: http://bit.ly/TXFTwiDownload The X Factor mobile app: http://bit.ly/TXFappWatch full episodes on ITV Hub (UK ONLY): http://www.itv.com/hub/the-x-factor"
"UHQSzC03RgM","WHEEL OF PIZZA FOOD CHALLENGE!","2018-12-02T16:30:01.000Z","UCwIWAbIeu0xI0ReKWOcw3eg","Unspeakable","22","18.19.12","unspeakable,vlog,vlogs,unspeakablegaming,prank,comedy,challenge,laugh,funny,moments,craziest,pranks,crazy,no cursing,no swearing,how to,parody,troll,video,react,family friendly,funniest,adventure,trolling,unspeakable vlogs,real life,life,unspeakable real life,unspeakableplays,car,cars,racing","374155","13906","363","2338","https://i.ytimg.com/vi/UHQSzC03RgM/default.jpg","False","False","WHEEL OF PIZZA FOOD CHALLENGE! w/ UnspeakableGaming👚 MERCHANDISE - 🡆 https://www.unspeakable.co/KAYLA'S CHANNEL (KAYCO)  - https://bit.ly/2R3Xifi🎮 MY OTHER CHANNELS! 🡆 MAIN CHANNEL - https://goo.gl/Fxt9GF🡆 UNSPEAKABLEPLAYS 🡆 https://goo.gl/bbfyv7🡆 ASWD 🡆 https://goo.gl/SKotLJ🡆 THE SQUAD 🡆 https://goo.gl/hVEy3L👍 FOLLOW ME! 🡆 Twitter - https://twitter.com/UnspeakableGame🡆 Instagram - http://instagram.com/unspeakable🡆 Snapchat - UnspeakableGMusic from Epidemic Soundshttp://www.epidemicsound.com/Thanks for watching! Likes are greatly appreciated! Subscribe to be notified when my next video is live!"
"hPttAFx49sU","FULL FACE USING ONLY DOLLAR TREE PRODUCTS!!","2018-12-02T18:00:01.000Z","UCzzOKT1SkE7qdycJvPCR3Gg","Mia Maples","26","18.19.12","mia maples,full face dollar store makeup,dollar tree makeup challenge,full face using only dollar tree products,dollar tree makeup,is dollar makeup any good,hits and misses of dollar makeup products,full face for $20","565740","21853","410","1770","https://i.ytimg.com/vi/hPttAFx49sU/default.jpg","False","False","Full face using only Dollar Tree products!!New videos Friday & Sunday! :DInstagram:  @miamaplesSnapchat:  @miamaplesTwitter: @miamapless"
"e9qO0TxbDHE","All The Easter Eggs And References In Ariana Grande's 'Thank U, Next' Music Video Explained","2018-12-01T15:33:20.000Z","UCHJuQZuzapBh-CuhRYxIZrg","INSIDER","24","18.19.12","INSIDER,Ariana Grande,Thank U Next,Mean Girls,Bring It On,Legally Blonde,13 Going On 30,Easter eggs,References,Hidden meanings,Music video breakdown,Kris Jenner,troye sivan,Miranda Sings,Victorious,pete davidson,Big Sean,mac miller,ariana grande thank you next,ariana grande pete davidson","3602619","104367","2785","5164","https://i.ytimg.com/vi/e9qO0TxbDHE/default.jpg","False","False","Ariana Grande released an epic music video for her break up and self-love anthem Thank U, Next. We look at all the hidden meanings, Easter eggs, and movie references that even the biggest Ariana fans might have missed. She references four romantic comedies from the 2000s: Mean Girls, 13 Going on 30, Legally Blonde, and Bring it On. Plus, the video features cameos from Kris Jenner to Ari's best friends and former castmates from the Nickelodeon show Victorious. But there's so much more, and we uncover it all.In the video, Grande embodies a main character from each film, played by Rachel McAdams, Reese Witherspoon, Jennifer Garner, and Kirsten Dunst.Grande even has her own Burn Book about her exes — Pete Davidson, Ricky Alvarez, Big Sean, and Mac Miller — though she only wrote positive comments.Famous faces include Jonathan Bennett, Colleen Ballinger, Stefanie Drummond, Troye Sivan, Gabi DeMartino, Elizabeth Gillies, Kris Jenner, Robbie Shapiro, Daniella Monet, Ari's dog Toulouse, and Jennifer Coolidge.Read more: https://www.thisisinsider.com/ariana-grande-thank-u-next-music-video-mean-girls-legally-blonde-13-going-on-30-bring-it-on-2018-11------------------------------------------------------INSIDER is great journalism about what passionate people actually want to know. That’s everything from news to food, celebrity to science, politics to sports and all the rest. It’s smart. It’s fearless. It’s fun. We push the boundaries of digital storytelling. Our mission is to inform and inspire. Subscribe to our channel and visit us at: https://insder.co/2NCg6SgINSIDER on Facebook: https://insder.co/2NyYczEINSIDER on Instagram: https://insder.co/2xN5qFBINSIDER on Twitter: https://insder.co/2xyN5wEINSIDER on Snapchat: https://insder.co/2KJLtVo"
"UTJ7c2saCc4","Priyanka Chopra & Nick Jonas Play the Newlywed Game | Vogue","2018-12-01T14:45:48.000Z","UCRXiA3h1no_PFkb1JCP0yMA","Vogue","24","18.19.12","nick jonas,priyanka chopra,wedding,newlyweds game,priyanka chopra wedding,priyanka chopra newlywed,priyanka chopra newlywed game,priyanka chopra and nick jonas,priyanka chopra nick jonas,priyanka chopra nick jonas together,priyanka chopra interview,nick jonas interview,nick jonas newlywed game,priyanka chopra vs nick jonas,priyanka chopra relationship,priyanka chopra hair,priyanka chopra funny,priyanka chopra funny moments,priyanka,vogue","11058260","246837","6728","12038","https://i.ytimg.com/vi/UTJ7c2saCc4/default.jpg","False","False","Watch Priyanka Chopra and Nick Jonas play the Newlywed Game, in which they answer questions about their relationship.As part of our partnership with Google, this video was captured on Pixel3.Still haven’t subscribed to Vogue on YouTube? ►► http://bit.ly/vogueyoutubesub ABOUT VOGUEVogue is the authority on fashion news, culture trends, beauty coverage, videos, celebrity style, and fashion week updates. Priyanka Chopra & Nick Jonas Play the Newlywed Game | Vogue"
"FX3ZngT3OGw","SEC Championship 2018: Jalen Hurts Leads Alabama to Comeback Win","2018-12-02T04:26:56.000Z","UCja8sZ2T4ylIqjggA1Zuukg","CBS Sports","17","18.19.12","sp:ty=high,sp:dt=2018-12-01T21:00:00+00:00,sp:vl=en-US,sp:st=football,sp:li=cfb,sp:ti:home=Ala,sp:ti:away=UGa,nick saban,tua tagovailoa,jalen hurts,jalen hurts highlights,tua tagovailoa highlights,tua tagovailoa injury,sec championship 2018,sec championship,sec championship highlights,2018 sec championship highlights,alabama vs georgia sec championship highlights 2018,alabama georgia,alabama crimson tide","480916","3021","306","1235","https://i.ytimg.com/vi/FX3ZngT3OGw/default.jpg","False","False","Down late to Georgia, with Tua Tagovailoa hurt, the Crimson Tide turned to Jalen Hurts, who stepped in and led two clutch touchdown drives en route to winning the SEC Championship.SUBSCRIBE TO OUR PAGE:https://www.youtube.com/user/CBSSportsFOLLOW US ON:Facebook - https://www.facebook.com/CBSSports/Instagram - https://www.instagram.com/cbssports/Twitter - https://twitter.com/CBSSports#SECchampionship #CrimsonTide #JalenHurts #TuaTagovailoa #Georgia #Alabama #SEC #Fromm #NickSaban"
"T3lKEb0Cs94","Meek Mill - Going Bad feat. Drake [Official Audio]","2018-11-30T05:00:03.000Z","UC9HlWVtENbiMQzVRmnbJxtw","Meek Mill","10","18.19.12","meek mill,hip hop,rap,atlantic,atlantic records,champions,championship rings,rings,Intro,trauma,uptwon vibes,on me,cardi b,whats free,Respect the game,splash warning,going bad,drake,almost slipped,tic tac toe,24/7,pay you back,21 savage,100 summers,wit the shits,stuck in my ways,cold hearted ii,meek mill music,meek new music,philly,philadelphia,eagles,sixers,championships,meek championships,warner music group,official audio,official video","10408602","144795","3893","7827","https://i.ytimg.com/vi/T3lKEb0Cs94/default.jpg","False","False","Download / stream CHAMPIONSHIPS https://MeekMill.lnk.to/CHAMPIONSHIPSAYSubscribe for more official content from Meek Mill https://MeekMill.lnk.to/subscribeFollow Meek Millhttp://meekMill.comhttp://twitter.com/MeekMillhttp://facebook.com/MeekMillhttp://instagram.com/MeekMillhttps://soundcloud.com/meek-mill-dcThe official YouTube channel of Atlantic Records artist Meek Mill. Subscribe for the latest music videos, performances, and more."
"A9hcJgtnm6Q","Mark Ronson - Nothing Breaks Like a Heart (Official Video) ft. Miley Cyrus","2018-11-29T23:58:17.000Z","UCmfFGTSsfJVu6CGvL8r75qg","MarkRonsonVEVO","10","18.19.12","mark ronson,mark ronson nothing breaks like a heart,mark ronson miley cyrus,mark ronson miley cyrus nothing breaks like a heart,mark ronson miley cyrus snl,mark ronson miley cyrus graham norton show,mark ronson miley cyrus live,mark ronson miley cyrus lyrics,nothing breaks like a heart live,nothing breaks like a heart lyrics,nothing breaks like a heart graham norton show,nothing breaks like a heart snl,snl,graham norton show,live","24121201","774234","35848","41906","https://i.ytimg.com/vi/A9hcJgtnm6Q/default.jpg","False","False","Mark Ronson feat. Miley Cyrus - Nothing Breaks Like a HeartListen/Download: http://smarturl.it/NBLAH?IQid=yt  Follow Mark Ronson:https://www.markronson.co.uk/Instagram - http://instagram.com/iammarkronsonTwitter - http://twitter.com/markronsonFacebook - http://facebook.com/markronson Follow Miley Cyrus:https://www.mileycyrus.comInstagram - http://instagram.com/mileycyrusTwitter - http://twitter.com/mileycyrusFacebook - http://facebook.com/mileycyrus Directed by We Are From LAProduced by IconoclastExecutive Producer: Romain GavrasProducer: Natan SchottenfelsLine Producer: Mélodie BuchrisDirector of Photography: Benoit Debie Editor: Simon ColinVFX: MathmaticKiev Production Service: Limelite"
"IWJUPY-2EIM","Red Velvet 레드벨벳 'RBB (Really Bad Boy)' MV","2018-11-30T09:00:04.000Z","UCEf_Bc-KVd7onSeifS3py9g","SMTOWN","10","18.19.12","Red Velvet,RBB,Really Bad Boy,Bad Boy,IRENE,SEULGI,WENDY,JOY,YERI,레드벨벳,알비비,배드보이,아이린,슬기,웬디,조이,예리","20220019","1210982","41592","121529","https://i.ytimg.com/vi/IWJUPY-2EIM/default.jpg","False","False","Red Velvet's the 5th mini album RBB is out!Listen and download on iTunes & Apple Music, Spotify, and Google Play Music http://smarturl.it/RBB[Tracklist]01 RBB (Really Bad Boy)02 Butterflies03 So Good04 멋있게 (Sassy Me)05 Taste06 RBB (Really Bad Boy) (English Ver.)Red Velvet Officialhttp://redvelvet.smtown.comhttp://www.youtube.com/redvelvet http://www.facebook.com/RedVelvethttps://www.instagram.com/redvelvet.smtownhttps://twitter.com/RVsmtown#RedVelvet #레드벨벳 #RBB #ReallyBadBoyRed Velvet 레드벨벳 'RBB (Really Bad Boy)' MV ℗ SM Entertainment"
