video_id,title,publishedAt,channelId,channelTitle,categoryId,trending_date,tags,view_count,likes,dislikes,comment_count,thumbnail_link,comments_disabled,ratings_disabled,description
"LykS0TRSHLY","New iPad Pro review: can it replace your laptop?","2018-11-05T11:00:03.000Z","UCddiUEpeqJcYeBxX1IVBKvQ","The Verge","28","18.19.11","ipad pro 2018,ipad pro,ipad,2018 ipad pro,new ipad pro,ipad 2018,apple,apple ipad,apple event,new ipad,new ipad 2018,2018 ipad,apple keynote,2018 ipad review,2018,what to expect,keynote,tim cook,apple products,steve jobs,apple 2018,event,new iphones,rumors,apple ny,apple media event,apple official,technology,top 10,gadgets,tech,first look,hands on,latest updates,iphone,review,verge,the verge","1613955","36945","2144","5691","https://i.ytimg.com/vi/LykS0TRSHLY/default.jpg","False","False","Apple’s new iPad Pro is a beast of a tablet, and Nilay Patel reviews it -- everything from its new design and screen to plugging in several devices to the new USB-C port. Dami Lee and William Joel, professional creatives at The Verge, also give their insight into the new iPad and Apple Pencil. Subscribe: http://goo.gl/G5RXGsLike The Verge on Facebook: https://goo.gl/2P1aGcFollow on Twitter: https://goo.gl/XTWX61Follow on Instagram: https://goo.gl/7ZeLvXRead More: http://www.theverge.comCommunity guidelines: http://bit.ly/2D0hlAvSubscribe to Verge Science on YouTube, a new home base for our explorations into the future of science: http://bit.ly/2FqJZMl"
"n9ckBa7WWAo","Found Diamond Wedding Ring Metal Detecting Underwater! $5,000+ (Returned to Owner)","2018-11-05T00:28:36.000Z","UCI4fHQkguBNW3SwTqmehzjw","DALLMYD","17","18.19.11","river treasure,river treasure finds,scuba diving,dallmyd,underwater metal detecting,found wedding ring,found gold ring,found diamond ring,metal detecting underwater,metal detecting,metal detecting videos,river treasure hunting,found jewelry in river,found lost jewelry,found ring in river,metal detecting finds,found jewelry underwater in river,found money in river,found in river,returned to owner,found underwater,swimming,scuba,fish,fishing","820420","28499","808","3055","https://i.ytimg.com/vi/n9ckBa7WWAo/default.jpg","False","False","In this video I search for a lost wedding ring underwater in the river!New? Subscribe and help me reach 10 million subscribers on YouTube!! https://goo.gl/aS999eIf you want to see more videos like this make sure to click the like button! Let's aim for 10,000 likes! Searching Bottom of Lake for Lost Valuables! (Over $1,000 Worth of Finds) https://youtu.be/xE8zbCWhPZUFound Sunken Car Underwater in the River While Scuba Diving! (City Awards Me) https://youtu.be/xLFNySwsvIIFound iPhone Underwater While Scuba Diving a Boat Ramp! (What's Under the Boat Ramp?) https://youtu.be/g8V1uzNhptsFound Sunken Truck Underwater in the River at Boat Ramp! (Recovered Truck for Owner) https://youtu.be/CDP3OgX974oI Found an iPhone Underwater in the River While Swimming! (River Treasure) https://youtu.be/HTh3tKSL8-8I Found a Police Stun Gun Underwater in the River! (Things Found Underwater) https://youtu.be/HTh3tKSL8-8Found GoPro While Exploring Underwater in the River! (Lost Footage Found) https://youtu.be/0keSO2xC-aII Found Money While Cleaning a Trash Pile Underwater in River! (Scuba Diving) https://youtu.be/gExbIfncEPoI Found a Lost Apple Watch with Help From an Underwater Drone! (Returned to Owner) https://youtu.be/-pvCz9LKwaoFound Gun Underwater in River While Scuba Diving! (WRBL News Interview) https://youtu.be/828_kJiAVTQSaving the Lives of 3 children, 2 dogs and a Father at the River! (Police Called)Found Possible Murder Weapon Underwater in River While Scuba Diving! (Police Called) https://youtu.be/UZbRxWmE3HMI Found an iPhone Underwater While Searching for Lost Valuables! (Underwater Finds) https://www.youtube.com/watch?v=ROIaN34LZ1sI BOUGHT MY BEST FRIEND HIS DREAM JET SKI! (2018 Yamaha GP1800) **Emotional** https://youtu.be/TpvxYvMKlqoI Found a JUUL Underwater in the River While Searching for Lost Valuables! (Underwater Finds) https://youtu.be/yh6HyC9v8_UFound Crashed DJI Phantom 4 Drone Underwater at Wakeboard Park! (Unbelievable https://youtu.be/I6xbGitR2uYHelping Search & Rescue Teams Locate Two Drowned People in River (Bodies Recovered) https://youtu.be/oroQD6ioEW4Found Drone Underwater in River Lost 4 Years Ago! (Scuba Diving) https://youtu.be/_DCn6Y0YwM0Found Assault Rifle Underwater in River While Scuba Diving! (Police Called) https://youtu.be/ZGAS4zuwJNgHelping the Police Find a Gun Underwater to Solve a Criminal Case! (Metal Detecting Underwater) https://www.youtube.com/watch?v=6_-b3U9QDKgFound Jewelry Underwater in River While Scuba Diving for Lost Valuables! (Unbelievable) https://youtu.be/-jSirHVQAOkSearching for Possible Murder Weapons in a Shallow Urban Canal! (WLTZ News Interview) https://youtu.be/psihUrXPhO0Found Possible Murder Weapon Underwater in a Shallow Urban Canal! (Police Called) https://youtu.be/-4Gx1KrH7R4Scuba Diving the Devil's Den for Lost Valuables! (Found 2 Prehistoric Bones) | DALLMYD https://youtu.be/GxS73Fuha24CHECK OUT MY TOP 10 MOST POPULAR VIDEOS ↓ Playlist: https://goo.gl/o7xFC4Found 3 GoPros, iPhone, Gun and Knives Underwater in River! - Best River Treasure Finds of 2016 https://youtu.be/UZHDwemAZ-kFound Lost iPhone 7 in River While Scuba Diving! (w/ Girlfriend) | DALLMYD https://youtu.be/Y3JE4_c_-PIFound Possible Murder Weapon Underwater in River! (Police Called) https://youtu.be/eAmn4pxIclcFound Human Remains Underwater in River! (Police Called) https://youtu.be/cQ8ia7PejfYFound Jewelry Underwater in River While Scuba Diving for Lost Valuables! (Unbelievable) https://youtu.be/-jSirHVQAOkFound Lost iPhone, Fishing Pole and Swimbaits Underwater in River! (Scuba Diving) https://youtu.be/dPTglkp4LpwFound a Working iPhone X Underwater in the River! (Returned Lost iPhone to Owner) https://youtu.be/VfrsFd5NcCsFound Possible Murder Weapon Underwater in a Shallow Urban Canal! (Police Called) https://youtu.be/-4Gx1KrH7R4Found GoPro Camera Lost 1 Year Ago! (Reviewing the Footage) https://youtu.be/OIFWMboJIrsFound Knife, Razor Blade and $50 Swimbait Underwater in River! (Freediving) | DALLMYD https://youtu.be/aJHas5fUo88About DALLMYD:Hello! My name is Jake. I'm a Treasure Hunter, Scuba Diver, Freediver, Spearfsherman, Angler & YouTuber w/ 6,000,000+ Subscribers! I enjoy traveling to new destinations in hunt of urban treasure!FOLLOW ME ON TWITTER & INSTAGRAM ↓Twitter (Daily Updates): https://twitter.com/DALLMYDInstagram (Daily Pictures): https://www.instagram.com/DALLMYDMy PO BoxDALLMYDP.O. Box 211Phenix City, Alabama 36868-0211Have any questions? Feel free to email me anytime! I'm open to discussing about collaborations, sponsorships, product reviews and more! Email: mgordon@fullscreen.comJustin: Camera Man/ Friend: https://goo.gl/kFya6WMusic Provided by the FollowingNomyn - Daydreamer Link: https://goo.gl/yefKkHFlarve - Bounce Link: https://goo.gl/Um1gXw"
"eISbZutaed8","Gordon Ramsay Gets A HUGE Surprise For His 50th Birthday","2018-11-04T17:00:07.000Z","UCIEv3lZ_tNXHzL3ox-_uUGQ","Gordon Ramsay","24","18.19.11","Gordon,Gordon Ramsay,Ramsay,Ramsey,Chef Ramsay,Recipe,Recipes,Food,Cooking,Cookery,matilda ramsay,matilda ramsay cooking show,matilda ramsay and the ramsay bunch,matilda ramsay 2018,matilda ramsay and gordon,gordon ramsay cooking,matilda and the ramsay bunch,matilda and the ramsay bunch full episodes,gordon ramsay birthday,gordon ramsay happy birthday,gordon ramsay 50th birthday","2381869","40097","1863","5640","https://i.ytimg.com/vi/eISbZutaed8/default.jpg","False","False","Gordon Ramsay's family surprise him for his 50th birthday.Gordon Ramsay’s Ultimate Fit Food – http://po.st/REpVfP Subscribe for weekly cooking videos. If you liked this clip check out the rest of Gordon's channels:http://www.youtube.com/gordonramsayhttp://www.youtube.com/kitchennightmareshttp://www.youtube.com/thefword"
"UOxkGD8qRB4","K/DA - POP/STARS (ft Madison Beer, (G)I-DLE, Jaira Burns) | Official Music Video - League of Legends","2018-11-03T07:30:00.000Z","UC2t5bjwHdUX4vM2g8TRDq5g","League of Legends","20","18.19.11","Riot Games,Riot,League of Legends,League,LoL,MOBA,worlds pop song,worlds popstar,worlds music video,K/DA,Ahri,Kai’Sa,Evelynn,Eve,Akali,K/DA Ahri,K/DA Kai’Sa,K/DA kaisa,K/DA Evelynn,K/DA Eve,K/DA Akali,KDA Ahri,KDA Kai’Sa,KDA kaisa,KDA Evelynn,KDA Eve,KDA Akali,ahri kda,kaisa kda,eve kda,akali kda,evelynn kda,kai’sa kda,lol KDA","70460152","1974433","35863","124513","https://i.ytimg.com/vi/UOxkGD8qRB4/default.jpg","False","False","K/DA Ahri, K/DA Evelynn, K/DA Kai’Sa, and K/DA Akali take the world stage with their debut single. Keep the show going on the Rift with these new Epic skins.MEET THE BAND:https://universe.leagueoflegends.com/en_US/kdaLISTEN NOW:Spotify: http://smarturl.it/kdapopstars/spotifyApple Music: http://smarturl.it/kdapopstars/applemusiciTunes: http://smarturl.it/kdapopstars/itunesGoogle Play: http://smarturl.it/kdapopstars/googleplayDeezer: http://smarturl.it/kdapopstars/deezerPRODUCTION CREDITS:K/DA - POP/STARSFeatured artists: Madison Beer, (G)I-DLE, Jaira Burns Written by: Riot Music Team and HarloeKorean translation by: Lydia Paek and Minji Kim  Produced by: Riot Music TeamMixed by: Riot Music Team Mastered by: Riot Music TeamVocals performed by: Madison Beer, Miyeon of (G)I-DLE, Soyeon of (G)I-DLE, Jaira BurnsAdditional vocals by: Harloe Vocal production by: Riot Music TeamExecutive Producers: Riot Games & Justin Tranterhttp://madisonbeer.com/http://www.cubeent.co.kr/gidlehttp://www.jairaburns.com/ANIMATION: Fortiche ProdLYRICS:You know who it isComing 'round againYou want a dose of thisRight nowIt’s K/DA uh!I'm a goddess with a blade소리쳐봐 내 이름잊지 못하게Loud loud loud loudI could take it to the top절대 멈추지 못해내가 끝내주는Bad gal gal galAnd when I start to talk like that (like that)Oh you won’t know how to reactI’m a picture perfect faceWith that wild in my veinsYou can hear it in myGrowl, growl, growl, growlSo keep your eyes on me now무엇을 보든 좋아할 거야닿을 수 없는 level나와 대결 원한 널 확신해We got it all in our hands nowSo can you handle what we’re all aboutWe’re so toughNot scared to show you upCan you feel the rush now?Ain’t nobody bringing us down down down down down downThey could try but we’re gonna wear the crownYou could go another round round round round round round roundWish you luck but you’re not bringing us downWe go hardTill we get it get itWe go hardWe so in it in itWe POP/STARSOnly winning winning nowAin’t nobody bringing us down down down downHey!You ready for this? (Let's go!)See 언제든지 내 모습 magic단 한 번에 내가 잡어절대 기죽지 않지 uh!Pow pow 네가 뭘 알아견딜 수 없어, 원해도.원하는 게 얼굴에 보여I’m trouble and you’re wanting itI’m so coldWhen I move that wayYou gonna be so blownI’m the realest in the game uh!Say I’m on fire with a bladeYou’re about to hear my nameRinging in your head like ohSo keep your eyes on me now무엇을 보든 좋아할 거야We’re so toughNot scared to show you upCan you feel the rush now?Ain’t nobody bringing us down down down down down downThey could try but we’re gonna wear the crownYou could go another round round round round round round roundWish you luck but you’re not bringing us downWe go hardTill we get it get itWe go hardWe so in it in itWe POP/STARSOnly winning winning nowAin’t nobody bringing us down down down downOh... 난 멈추지 않아Oh oh we go hardOh oh we POP/STARS (stars), stars (stars)Ain’t nobody bringing usAin’t nobody bringing us down down down down down downThey could try but we’re gonna wear the crownYou could go another round round round round round round roundWish you luck but you’re not bringing us downWe go hardTill we get it get itWe go hardWe so in it in itWe POP/STARSOnly winning winning nowAin’t nobody bringing us down down down downMORE RIOT RECORDS:Tracks and albums from the makers of League of Legends: https://www.youtube.com/channel/UCJEGvSZnQ1pkVfHO8s5G8hAPLAY LEAGUE OF LEGENDS:http://riot.com/signup"
"UEAha_un74Q","Markiplier Animated | PRETZELS","2018-11-03T18:00:01.000Z","UC7_YxT-KID8kRbqZo7MyscQ","Markiplier","1","18.19.11","markiplier animated,cartoon,animation,animated,markiplier,funny animation,funny cartoon,funny,funny moments,funniest,hilarious,pretzels","2073906","94690","3263","7083","https://i.ytimg.com/vi/UEAha_un74Q/default.jpg","False","False","ANIMATED BY HARICZ ► https://www.youtube.com/channel/UC7FetDSR8i3iRjGlTxy_oowASSISTED BY TOONCEE ► https://www.youtube.com/channel/UC9L3VJUMynz7d_L7KXzukIgAnimated From Pretzels ►  https://youtu.be/3xWnU089wwoThis might be one of the funniest animations anyone has ever made of me! PLEASE show Haricz and ToonCee all the love in the world!SUPPORT THE CHANNEL ► https://www.youtube.com/markiplier/joinMy Clothing Brand ► https://cloakbrand.com/Check Out My WEBSITE!! ► https://markiplier.com/Subscribe Today! ► http://bit.ly/MarkiplierAwesome Games Playlist ► https://www.youtube.com/playlist?list=PL3tRBEVW0hiDAf0LeFLFH8S83JWBjvtqEScary Games Playlist ► https://www.youtube.com/playlist?list=PL3tRBEVW0hiBSFOFhTC5wt75P2BES0rAoFollow my Instagram ► http://instagram.com/markiplierFollow me on Twitter ► https://twitter.com/markiplierLike me on Facebook ► https://www.facebook.com/markiplierJoin us on Reddit! ► https://www.reddit.com/r/Markiplier/Horror Outro ► https://soundcloud.com/shurkofficial/hauntedHappy Outro ► https://soundcloud.com/hielia/minimusicman-crazy-la-paint"
"4hYCmPBlmwc","H.E.R. - Could've Been (Official Video) ft. Bryson Tiller","2018-11-02T19:41:59.000Z","UCQT3bmChpmnR5ThhY_ewoOQ","HERMusicVEVO","10","18.19.11","Could've Been,H.E.R. feat. Bryson Tiller,R&B,RCA Records Label","2309567","118820","943","4042","https://i.ytimg.com/vi/4hYCmPBlmwc/default.jpg","False","False","“Could’ve Been” feat. Bryson Tiller (Official Video): http://smarturl.it/CouldveBeenVid Follow H.E.R. https://www.facebook.com/officialHERmusic/https://twitter.com/HERMusicxhttps://www.instagram.com/hermusicofficial/https://everythingrevealed.her-official.com/Follow Bryson Tiller: https://www.facebook.com/BrysonTillerMusic/https://twitter.com/brysontillerhttps://www.instagram.com/brysontiller/#HER #IUTKH #CouldveBeen"
"qau-Z0oomc4","El Alfa Ft. Cardi B - Mi Mami (Video Oficial)","2018-11-02T17:00:12.000Z","UCEU5ZK7DwN9ppqPFJiGah3A","ElAlfaElJefeTV","10","18.19.11","El Alfa El Jefe,El Jefe Records,Latino,Music,Dominican republic,Santo Domingo,Urban,Hip Hop,Rap,Trap,Cardi B,Nicki Minaj","10277779","271450","49576","26470","https://i.ytimg.com/vi/qau-Z0oomc4/default.jpg","False","False","Disponible en todas las tiendas digitales!https://ElJefe.lnk.to/ElHombre©℗ El Jefe Record Music, LLC. All Rights Reserved.INSTAGRAM - @ElAlfaElJefe @IamCardiB @dherrera175"
"GNJloHR7uQg","Erika Costell - Karma (Official Music Video)","2018-11-02T19:00:02.000Z","UCrCkLipGria4UloMpvNil5g","Erika Costell","22","18.19.11","erika costell,team 10,erika team 10,erika jake paul,jerika,jake paul vlog,erika costell vlog,jake paul girlfriend,tessa brooks,chance and anthony,martinez twins,tristan tales,nick crompton,kade speiser,uncle kade,chad tepper,costellars,erika costell jake paul news,team 10 house news,daily vlog,daily vlogs,daily vlogger,travel vlog,travel vlogs,travel vlogger,chitty bang,reality","4674595","84448","71203","20879","https://i.ytimg.com/vi/GNJloHR7uQg/default.jpg","False","False","The official music video for Karma! Listen now on Spotify ► https://open.spotify.com/track/0oXPT3mcphHZqJr8ySBl8m?si=P9SvL7I8TD2vhpZc-W2BbAListen now on Apple Music ► https://itunes.apple.com/us/album/karma-single/1440545626Directed by: Taylor ChienAssistant directed and edited by: Shannon Curry Styled by: Kara Wilson and Ali MolanHair by: Chris DylanMakeup by: Aaron PaulSong Produced by: Harvey Mason Jr.Song written by: Erika Costell and Brittany BurtonSpecial Thanks to the crew:Gonzalo DigenioNick SerabynBen SmithJacob SteagalMassimo LegittimoShoutout to DOPE for helping us make this happen. dope.com😃 SUBSCRIBE ► http://www.youtube.com/c/ErikaCostell  WATCH THE KARMA DOCUMENTARY ► https://www.youtube.com/watch?v=Bx-FOmQjchc&t=208sCHECKOUT MY NEW MERCH HERE ►https://fanjoy.co/costellTURN ON MY POST NOTIFICATIONS!*FOLLOW ME ON SOCIAL MEDIA! *MY INSTAGRAM (@ErikaCostell) ► https://www.instagram.com/ErikaCostellMY TWITTER (@ErikaCostell) ► http://twitter.com/ErikaCostellMY FACEBOOK ► https://www.facebook.com/ErikaCostell1MY SNAPCHAT ► ErikaCostell"
"hlznpxNGFGQ","Clean Bandit - Baby feat. Marina & Luis Fonsi [Official Video]","2018-11-02T10:15:39.000Z","UCvhQPdeTHzIRneScV8MIocg","Clean Bandit","10","18.19.11","clean bandit,baby,Marina,Luis Fonsi,What Is Love,Solo,Demi Lovato,Symphony,I'm someone else's baby,Rockabye,Anne-Marie,Sean Paul,Zara LArsson,Rather Be,Jess Glynne,Tears,Louisa Johnson,I Miss You,Julia Michaels,Real Love,Extraordinary,Stronger,Come Over,Stylo G,Dust Clears,Mozart's House,Love Ssega,Disconnect,New Eyes,Strictly,It Takes Two,BBC Radio 2,Scott Mills,official,video,BBC Radio 1,Billboard,marina and the diamonds,pop song,uk pop","19802261","422702","14278","25988","https://i.ytimg.com/vi/hlznpxNGFGQ/default.jpg","False","False","Download or stream now: http://atlanti.cr/BabyTaken from our new album What Is Love? - out 30.11.18. Pre-order now: http://atlanti.cr/WhatIsLoveClick here to subscribe: http://bit.ly/SubscribeToCleanBanditFollow us:Website: http://cleanbandit.co.uk/Facebook: http://www.facebook.com/cleanbandit Twitter: http://www.twitter.com/cleanbandit Instagram: http://instagram.com/cleanbanditSoundcloud: http://www.soundcloud.com/cleanbanditSpotify: http://www.atlre.co.uk/CleanBanditSpotify"
"yNXDxUQ4c9U","benny blanco & Calvin Harris - I Found You (Official Music Video)","2018-11-02T16:00:07.000Z","UCqrBKQHQVEvD2Q9FP0DCP2g","benny blanco","10","18.19.11","benny blanco,benny,blanco,calvin harris,calvin,i found you,found you,halsey,tory,tory lanez,francis,francis and the lights,francis & the lights,lil dicky,dicky,dancing,edm","9401338","70698","2583","2039","https://i.ytimg.com/vi/yNXDxUQ4c9U/default.jpg","False","False","“I Found You” out now: http://smarturl.it/IFoundYouBBDirected by: Jake Schreier Video featuring: benny blanco, Tory Lanez, Francis and the Lights, Lil’ Dicky, benny's Mom, Halsey, and Cashmere Cat. Executive Producers: Jackie Kelman Bisbee, Alex FischLine Producer: Cody RyderDP: Christopher SoosColor: Michael Rossiter, The Mill NY Follow benny blanco:http://www.instagram.com/itsbennyblancohttp://www.facebook.com/itsbennyblancohttp://www.twitter.com/itsbennyblanco #bennyblanco #CalvinHarris #IFoundYou"
"jpJ8CbrWX_Y","Panic! At The Disco - The Greatest Show [from The Greatest Showman: Reimagined]","2018-11-02T04:11:52.000Z","UColJTBTSGqaaZr5NOk5r3Pg","Panic! At The Disco","10","18.19.11","panic! at the disco,panic at the disco,the greatest showman,the greatest show,the greatest showman: reimagined,brendon urie,urie,beebo,fueled by ramen,fbr,dcd2,dcd2 records,patd","6570833","376449","2505","26560","https://i.ytimg.com/vi/jpJ8CbrWX_Y/default.jpg","False","False","Don't fight it, it's coming for you 🎩 hopped in the studio to remake The Greatest Show from The Greatest Showman: Reimagined 🙌 Pre-order the album + get the song now https://Atlantic.lnk.to/TGS_ReimaginedPAUpcoming tour dates: http://panicatthedisco.com/tour Pray For The Wicked Winter Tour 2019 w/ Two Feet + Betty Who on sale nowSite: http://panicatthedisco.comFacebook: http://facebook.com/panicatthediscoTwitter: http://twitter.com/panicatthediscoInstagram: http://instagram.com/panicatthediscoSpotify: http://spoti.fi/1CsbsdCStore: https://store.panicatthedisco.com#PanicAtTheDisco #TheGreatestShow #TGSReimagined"
"sDKnKzYyx5c","Karol G, Maluma - Créeme (Official Video)","2018-11-02T03:58:40.000Z","UCz9yS18zJGQObwUL_K-ICnw","KarolGVEVO","10","18.19.11","Karol G,Maluma,Pretty Boy,Bebesita,Mi Cama,Anuel AA,J Balvin,NIcky Jam,Pineapple,Amor,Desamor,Daddy Yankee,Ciroc,Nissan,Latin Grammy,Rosalia,Culpables,Cardi B,Urban Queen,Latin Urban Queen","50735406","973199","41593","35386","https://i.ytimg.com/vi/sDKnKzYyx5c/default.jpg","False","False","Escucha Créeme en todas las plataformas digitales ▶ https://UMLE.lnk.to/CREEFpSUBSCRIBETE AQUI ▶ https://www.youtube.com/user/Karolgmusic/featured SIGUEME EN: Instagram | https://www.instagram.com/karolg/ Facebook | https://www.facebook.com/KarolGOficial/ Twitter | https://twitter.com/KarolGmusic -Lyrics – Karol G, Maluma “Créeme” -Tu siempre has pensado que yo no sé las cosas Tranquila, vos siempre con tus películas, Karol, ya Es que vos Yo no soy ninguna boba, y yo sé lo que hiciste ¿Qué queres? ¿Me voy? ¿Dale, te vas? Me voy pa’ el caraYeay...ya Dice Como explicarle a la conciencia que esto fue mi culpa Como decirle al corazón que tú no volverás Hacer saber a mis ojos que no te verán nunca Como explicarle a mi boca que no la besaras Y no es que muera porque no tenga tus besos Pero es que vivir sin eso es como vivir sin razón Y si tú supieras como me duele el proceso De olvidarme de tu cuerpo me destroza el corazón Créeme un poco más, te lo suplico Que te me fuiste y no merezco este castigo Soy un loco más que no ha entendido Si yo solo te daba amor porque te has ido (porque te has ido)Es que se siente un frío terrible (frio terrible) Ya no se ni como decirte (como decirte) Contigo me sentía invencible Me llamas, pero de que me sirve Si aquí no estás en el mejor momento te vas Solo pido una oportunidad para demostrarte Que lo nuestro es amor de verdad Pero ya tú no estás en el mejor momento te vas Solo pido una oportunidad para demostrarte Que lo nuestro es amor de verdadCréeme un poco más, te lo suplico Que te me fuiste y no merezco este castigo Soy un loco más que no ha entendidoSi yo solo te daba amor porque te has ido Um yo yo yo no puedo olvidarte y no lo niego A pesar del tiempo que paso sin entendernos Yo si sabía que por la motonia de mi te irías, ay que ironía Es que ya tú no estás en el mejor momento te vas Solo pido una oportunidad para demostrarte Que lo nuestro es amor de verdad Pero no estás en el mejor momento te vas Solo pido una oportunidad para demostrarte Que lo nuestro es amor de verdadCréeme un poco más, te lo suplico Que te me fuiste y no merezco este castigo yeay Soy un loco mas que no ha entendido (que no ha entendido) Si yo solo te daba amor porque te has ido Créeme un poco más, te lo suplico Que te me fuiste y no merezco este castigo yeay Soy un loco más que no ha entendido Si yo solo te daba amor porque te has ido#Karol G #Créeme #Maluma Music video by Karol G, Maluma performing Créeme. © 2018 UMG Recordings, Inc.http://vevo.ly/F54jH7"
