video_id,title,publishedAt,channelId,channelTitle,categoryId,trending_date,tags,view_count,likes,dislikes,comment_count,thumbnail_link,comments_disabled,ratings_disabled,description
"1-Y7SDg3SZA","Bowlers dominate but India well on top | Third Domain Test","2018-12-28T07:36:02.000Z","UCkBY0aHJP9BwjZLDYxAQrKg","cricket.com.au","17","18.29.12","sp:ty=play,sp:dt=2018-12-25T23:30:00Z,sp:st=cricket,sp:li=icc,sp:ti:home=AUS,sp:ti:away=IND,Australia,India,third Test,day three,MCG,2018,highlights","10151650","74097","4587","4299","https://i.ytimg.com/vi/1-Y7SDg3SZA/default.jpg","False","False","Jasprit Bumrah's six-wicket haul and a stunning spell of four wickets in eight ball from Pat Cummins highlighted a stunning day three at the MCG but it was India that finished with a huge advantage"
"q6a7YHDK-ik","The Accidental Prime Minister | Official Trailer | Releasing January 11 2019","2018-12-27T08:59:54.000Z","UC3ar28GS6o1p0m_wabfk2zw","Pen Movies","1","18.29.12","The Accidental Prime Minister,Accidental Prime Minister,Manmohan Singh,Prime Minister,Congress,BJP,Anupam Kher,Akshay Khanna,Pen Movies,Bollywood,Latest Movies,Indian Politics","17392573","458722","37547","57000","https://i.ytimg.com/vi/q6a7YHDK-ik/default.jpg","False","False","Presenting official trailer of The Accidental Prime Minister. In cinemas, January 11th 2019.A film based on the book The Accidental Prime Minister by Mr. Sanjaya Baru.Rudra Productions (UK), Bohra Bros in association with Dr. Jayantilal Gada (pen)  present The Accidental Prime Minister. Produced by Sunil Bohra, Dhaval Jayantilal Gada & Bloom Arts Pte Ltd.Directed by - Vijay Ratnakar GutteStarring - Anupam Kher, Akshaye Khanna, Suzanne Bernert, Aahana Kumra, Arjun Mathur, Vipin Sharma and Divya Sethi.Written by - Mayank Tewari, Vijay Ratnakar Gutte, Karl Dunne (UK), Aditya SinhaCo Producer - Jatinder Kumar Bharadwaj, Ashoke PanditEditor - Praveen KNLDirector Of Photography - Sachin KrishnDI & VFX - After Studios (UK)Music Director - Sudip Roy (UK), Sadhu S TiwariBackground Music- Sumit Sethi & Abhijit VaghaniSound Designer- Mandar KulkarniLine production- Bombay Casting Talent Management Pvt ltd."
"aV5HMqRas5g","Vinaya Vidheya Rama Trailer - Ram Charan, Kiara Advani | Boyapati Sreenu | DVV Danayya | #VVRTrailer","2018-12-27T15:53:17.000Z","UCumU_6FNxfHXTmeeFCYz6Yw","DVV Entertainment","24","18.29.12","Vinaya Vidheya Rama,Vinaya Vidheya Rama Ram Charan,Vinaya Vidheya Rama Telugu Movie,Vinaya Vidheya Rama New Movie,Vinaya Vidheya Rama Latest 2018,VVR 2018,VVR Telugu Movie,Ram Charan VVR Movie,VVR Teaser,Ram Charan,Kiara Advani,Boyapati Srinu,Devi Sri Prasad,Telugu Mass Scenes,Telugu Fights,Vinaya Vidheya Rama Trailer,Vinaya Vidheya Rama Songs,Vinaya Vidheya Rama Official Trailer,Vinaya Vidheya Rama Trailer - Ram Charan","9087323","272016","32025","20756","https://i.ytimg.com/vi/aV5HMqRas5g/default.jpg","False","False","Watch Vinaya Vidheya Rama Trailer. Starring Ram Charan, Kiara Advani, Vivek Oberoi #VinayaVidheyaRama, #VinayaVidheyaRamaTrailer, #RamCharan, VVR TrailerStory - Screenplay - Direction : Boyapati SreenuProducer : DVV DanayyaMusic : Devi Sri PrasadDOP : Rishi Punjabi - Arthur A Wilson Editing : Kotagiri Venkateswara Rao, ThammirajuArt : A.S.Prakash Stunts : Kanal Kannan Executive Producer - V.Y. Praveen KumarLine Producer : Vijay JagarlamudiCo Producer : Kalyan DVVDigital Partners : Walls & TrendsPRO : Vamsi Kaka, NaniStills : JeevanPublicity : Dhani AelayChief Co Director : Bandi Ramesh - Ravi Nandipati"
"Qqpl_sAcQF8","Thackeray | Official Trailer | Nawazuddin Siddiqui, Amrita Rao | Releasing 25th January","2018-12-26T09:43:07.000Z","UCs56ffejFhWlCvlvRIdpb9Q","Viacom18 Motion Pictures","24","18.29.12","Movies,Bollywood,Thackeray,Balasaheb Thackeray's,tiger of mumbai,Nawazuddin Siddiqui,Amrita Rao,thackeray trailer,bio pic on balasaheb thackeray,marathi manus,balasaheb speech,viacom,viacom latest movie,hindi movie,latest movie 2018,balasaheb thackeray trailer,marathi latest movie 2018,latest trailer,teaser,thackeray nawazuddin,rights,hindu,muslims","13448183","432059","38968","31617","https://i.ytimg.com/vi/Qqpl_sAcQF8/default.jpg","False","False","Unfolding the real story of Balasaheb Thackeray's courage, wisdom & indomitable truth. The tiger who was known for fearing none!#ThackerayTrailer out NOW!VIACOM18 MOTION PICTURES, CARNIVAL MOTION PICTURES ANDSANJAY RAUT PRESENTTHACKERAYDIRECTED BY ABHIJIT PANSE PRODUCED BY VIACOM18 MOTION PICTURES, DR. SHRIKANT BHASI, MRS. VARSHA SANJAY RAUT, MS. PURVASHI SANJAY RAUT & MS. VIDHITA SANJAY RAUTTHACKERAY  RELEASING ON 25th JANUARY 2019. IN MARATHI & HINDI#BalasahebThackeray #Thackeray #Viacom18Viacom18 Motion Pictures Handles :-Facebook:- https://www.facebook.com/Viacom18MotionPicturesTwitter :- https://twitter.com/Viacom18MoviesInstagram:- https://www.instagram.com/viacom18motionpictures"
"EGIfhT0gyZc","Sudigaali Sudheer Performance | Extra Jabardasth | 28th  December 2018 | ETV Telugu","2018-12-28T18:31:24.000Z","UCnoqvTW4YZExfDeq7_Wmd-w","ETV Jabardasth","22","18.29.12","etv shows,eenadu television,padutha theeyaga,super2,dhee Jodi,jabardasth,extra jabardsth,etv20,etv comedy show,extra jabardasth,naga babu,roja,anchor anasuya,rashmi,dhanraj,chandra,venu,chanti,dhana dhan dhanraj,comedy short films,chamak chandra,chalaki chanti,raghava,rocket raghava,roller raghu,venu wonders,comedy skits in telugu,telugu comedy tracks,allari harish,yedukondalu,racha ravi,adhire abhi,fata fut fun,Rocking rakesh","1060071","21274","1382","1142","https://i.ytimg.com/vi/EGIfhT0gyZc/default.jpg","False","False","A comedy show, in which comedians like Sudigaali Sudheer, Chammak Chandra and Hyper Aadi perform side|splitting comedy skits."
"Nl-3OIq7N1c","ZERO: Tanha Hua Video | Shah Rukh Khan, Anushka Sharma  | Jyoti N, Rahat Fateh Ali Khan","2018-12-28T13:33:31.000Z","UCq-Fj5jknLsUf-MWSy4_brA","T-Series","10","18.29.12","latest hindi songs,bollywood songs,songs,hindi songs,Tanha Hua,Tanha Hua zero,Rahat Fateh Ali Khan,Nusrat Fateh Ali Khan,Tanishk Bagchi,rahat fateh ali khan songs,rahat fateh ali khan new song,rahat fateh ali khan songs 2018,songs2018,zero song,anushka sharma,zero songs 2018,t series songs 2018,shahrukh khan songs 2018,tseries,hindi songs 2018,video songs zero 2018,zero video song,zero movie song","1404596","62609","4502","5670","https://i.ytimg.com/vi/Nl-3OIq7N1c/default.jpg","False","False","Presenting the video song Tanha Hua from the Bollywood movie Zero. The song is sung by Jyoti Nooran, Rahat Fateh Ali Khan, music composed by Nusrat Fateh Ali Khan, Tanishk Bagchi and lyrics are penned by Khwaja Parvaiz, Irshad Kamil. The film is starring Shah Rukh Khan, Anushka Sharma and Katrina Kaif and directed by Aanand L Rai.  #ShahRukhKhan #KatrinaKaifItemSong  #ZeroVideoSong-------------------------------------------------------------------------------------------------------Film : Zero Song - Tanha HuaSingers - Jyoti Nooran and Rahat Fateh Ali Khan.Composer – Nusrat Fateh Ali Khan/Tanishk BagchiWritten by – Khwaja Parvaiz/Irshad KamilPublished by – WOMAD Music Ltd & Oriental Star Agencies/T-SeriesRe- Composed and Programmed: Tanishk Bagchi Additional Vocals: Altamash Faridi & Shadab FaridiAdditional Percussions: Krishna Kishor and TeamStrings programming: Ishan ChhabraViolin: Kerala Chamber OrchestraBass Player: Napier Peter NaveenGuitar - Mayuk Sarkar and Keba Jeremiah Mandolin & Tumbi: Tapas RoyHarmonium: Firoz ShahDholak & Tabla: Vajid Ali ChandwaniSarangi: Dilshad KhanDubbing engineer: Rahul M Sharma (Mumbai) Mani Ratnam (Chennai)Songs Mixed And Mastered By Eric Pillai@Future Sound Of BombayMix Assistant Engineers - Michael Edwin Pillai-------------------------------------------------------------------------------------------------------Enjoy & stay connected with us!► Subscribe to T-Series: http://bit.ly/TSeriesYouTube► Like us on Facebook: https://www.facebook.com/tseriesmusic► Follow us on Twitter: https://twitter.com/tseries► Follow us on Instagram: http://bit.ly/InstagramTseries"
"pKcamCgBvMo","Ek Ladki Ko Dekha Toh Aisa Laga | Official Trailer | Anil | Sonam | Rajkummar | Juhi | 1st Feb'19","2018-12-27T05:30:00.000Z","UCGqvJPRcv7aVFun-eTsatcA","FoxStarHindi","24","18.29.12","Ek Ladki Ko Dekha Toh Aisa Laga,Ek Ladki Ko Dekha Toh Aisa Laga teaser,Anil Kapoor,Sonam kapoor,Rajkummar rao,new bollywood movie teaser,new movie teaser,upcoming movie teaser,anil kapoor new movie,anil kapoor upcoming movie,Sonam kapoor upcoming movie,Sonam kapoor new movie,love story movie,Ek Ladki Ko Dekha Toh Aisa Laga Official Trailer,Ek Ladki Ko Dekha Toh Aisa Laga Trailer,Juhi Chawla,ek ladki ko dekha,ek ladki,ek ladki ko,official trailer 2018","11503084","162644","8880","10464","https://i.ytimg.com/vi/pKcamCgBvMo/default.jpg","False","False","Some love stories are not simple, Sweety’s is one such story. She has to contend with her over-enthusiastic family that wants to get her married, a young writer who is completely smitten by her, a secret that she harbors close to her heart and ultimately the truth that her true love might not find acceptance in her family and society. Resolving these issues proves hilarious, touching & life changing.Welcome to the most Unexpected Romance of the year!  #LetLoveBe Releasing in theatres near you on 1st Feb’2019 Starring: Anil Kapoor, Sonam Kapoor, Rajkummar Rao, Juhi Chawla, Abhishek Duhan, Seema Pahwa, Madhumalti, Brijendra KalaDirected by: Shelly Chopra DharProduced by: Vidhu Vinod Chopra Co-produced by: Fox Star StudiosStory & Screenplay: Gazal Dhaliwal & Shelly Chopra DharMusic: Rochak KohliLyrics: Gurpreet SainiEditor: Ashish SuryavanshiDirector of Photography: Himman DhamijaAdditional Cinematography: Rangarajan RamabadranProduction Design: Rajat PoddarProduction Design (Punjab Schedule): Teddy MauryaExecutive Producer: Lawrence D'SouzaLine Producer: Alok SinhaFirst Assistant Director: Paran BawaCostume Design: Sheetal Sharma Background Music: Sanjay Wandrekar & Atul RaningaSound Design: Parikshit Lalvani & Kunal MehtaRe-recording Mixer: Alok DeAlso Subscribe To FoxStarIndia: http://goo.gl/Y8HGhYFoxStarSouth : http://goo.gl/AO8IsZFox Star Hindi:Facebook: https://www.facebook.com/foxstarhindiTwitter: https://twitter.com/foxstarhindiInstagram: http://instagram.com/foxstarhindiPinterest: http://www.pinterest.com/foxstarhindi/Vidhu Vinod Chopra Films:Facebook: https://www.facebook.com/vinodchoprafilms/Twitter: https://twitter.com/VVCFilmsInstagram: https://www.instagram.com/vinodchoprafilms/?hl=en"
"F4QiWjS3aHM","BYN: Instant Laughter","2018-12-28T13:14:18.000Z","UC7sRFTKIbH4NNpFXmpUAWuA","Be YouNick","23","18.29.12","That one friend,Kanjoos friend,Kanjoos,Miser,Friends,Friendship,best friend,Beyounick,be,you,nick,Be younick,byn,beyounick latest,Nikunj Lotia,Tushar Khair,Funny,Comedy,Trending video,vine,vine comedy,vine compilation byn,december vines 2018,instagram,funny","955839","76421","2387","3261","https://i.ytimg.com/vi/F4QiWjS3aHM/default.jpg","False","False","Follow The Team :Nick - https://www.instagram.com/beyounick/Tushar - https://www.instagram.com/tusharkhairbyn/Murali -  https://www.instagram.com/woh_lambe_baal_wala_ladka/Vivek -  https://www.instagram.com/i_am_vivekmenon_byn/Sushant-  https://www.instagram.com/cut_appa_sushant/Anant - https://www.instagram.com/ananttss/Omkar -  https://www.instagram.com/one_moody_foodie/"
"In33XkMy6o4","लोकसभा में 3 तलाक बिल पर मोदी सरकार पर भड़के ओवैसी EXCLUSIVE... News Tak","2018-12-27T13:46:29.000Z","UCAUNFgpgVisKPL3yq_-Nj-Q","News Tak","25","18.29.12","hindi news,news video,latest news,“newstak,news”,channel”,“news”,“,newstak”,news tak,news tak channel,newstak channel,news videos,news videos in hindi,news tak newstak,news tak india,news tak live,news tak exclusive,news tak videos,exclusive news tak videos,exclusive newstak videos,news tak today,news tak official,newstak official,newstak aajtak,news tak aaj tak,owaisi,parliament,triple talaq,modi,modi government","1531964","43457","8318","12417","https://i.ytimg.com/vi/In33XkMy6o4/default.jpg","False","False","लोकसभा में तीन तलाक बिल का विरोध करते हुए AIMIM प्रमुख असदुद्दीन ओवैसी ने कहा कि ट्रिपल तलाक क्या हमारी कल्चर और मान्यता का उल्लंघन नहीं है? समलैंगिक रिश्तों को अपराध की श्रेणी से हटाया गया, लेकिन ट्रिपल तलाक को अपराध की श्रेणी में रखा गया। ओवैसी ने कहा मैं इस बिल की मुखालफत करता हूं... AIMIM Chief Asaduddin Owaisi rejected the Triple Talaq bill and said that if Sabarimala is about Hindu's faith then Triple Talaq is also about Muslim's faith. One man can be with any number of women now as the Supreme Court has scrapped IPC Section 497 but if a Muslim man gives Triple Talaq to his wife then he will be jailed for 3 years. Is this justified?About News Tak (न्यूज़ तक):न्यूज़ तक (news tak) आपको देता है ख़बरों का बिल्कुल नया अंदाज । 40 सेकंड के छोटे गरमा-गरम वीडियो तो हैं ही साथ में न्यूज़ तक (news tak) के यू ट्यूब प्लेटफॉर्म पर आपको मिलेंगे दिलचस्प और EXCLUSIVE इंटरव्यू, वो भी अनकट..यहां आपको मिलेगा न्यूज़तक (news tak) स्पेशल, न्यूज़ तक (news tak) LIVE और भी बहुत कुछ। राजनीति, बॉलीवुड, देश-विदेश हर तरह की ख़बरों से जुड़े मनोरंजक वीडियो के लिए देखिए सिर्फ न्यूज़ तक (news tak)। क्या है वायरल होने वाले वीडियो की सच्चाई? ख़बर में ऐसा क्या था खास जो आप नहीं देख पाए? कोई भी ख़बर वायरल होने से पहले आप तक पहुंचाएगा न्यूज़ तक (news tak) । हर रोज दिलचस्प और गरमा-गरम वीडियो के लिए सब्सक्राइब कीजिए न्यूज़ तक (news tak)। ये है न्यूज़तक (news tak) का Official Channel.News Tak is the most revolutionary and credible news channel on YouTube. News Tak brings news to you in an innovative VOD style that is set to capture and satiate your thirst for NEWS. This is the most credible source of Live videos that bring to you PC done by all political parties. From exclusive interviews to politics, bolly & Viral videos, anything and everything that is happening around the world is on News Tak. We ensure that the truth behind viral videos reaches you.We save you from rumours. This is the most reliable source of news that you can rely on. Subscribe to the official channel of News Tak here.You can follow News Tak on:News Tak Youtube: https://www.youtube.com/newstakNews Tak Facebook: https://www.facebook.com/newstakofficialNews Tak Twitter: https://twitter.com/newstakofficialNews Tak Instagram: https://www.instagram.com/newstakofficial/"
"hQL72y40iYw","The Kapil Sharma Show | Baccha Yadav Meets Ranveer Singh | Starts 29th Dec | Sat-Sun At 9:30 PM","2018-12-27T14:40:36.000Z","UCpEhnqL0y41EpW2TvWAHD7Q","SET India","24","18.29.12","the kapil sharma show,the kapil sharma show coming soon,relaunch kapil sharma,kapil sharma,new comedy show,The Kapil Sharma Show - Jald Hasayenge,kapil sharma coming soon,kapil sharma comedy,kapil sharma show new season,best comedy show,kapil comedy,kapil sharma wedding,kapil sharma show,kapil sharma show new promo,kapil sharma promo,kapil sharma show simmba,ranveer singh,sara ali khan,rohit shetty,ranveer and sara,simmba promotion,chandan ki shayari","5569875","148764","4648","6204","https://i.ytimg.com/vi/hQL72y40iYw/default.jpg","False","False","Click here to Subscribe to SETINDIA Channel : http://www.youtube.com/setindiaPoorey India ko hasaane phir ek baar aa raha hai #TheKapilSharmaShow! Starts 29th December, every Saturday and Sunday at 9:30 PM, exclusively on SET and SonyLIV.More Useful Links :Visit us at : http://www.sonyliv.com Like us on Facebook : http://www.facebook.com/SonyLIV Follow us on Twitter : http://www.twitter.com/SonyLIV Also get Sony LIV app on your mobile Google Play - https://play.google.com/store/apps/details?id=com.msmpl.livsportsphone ITunes - https://itunes.apple.com/us/app/liv-sports/id879341352?ls=1&mt=8"
"VO7Vu207-e8","NIRA ISHQ : GURI (Official Song) Satti Dhillon | GK.DIGITAL | Latest Songs | Geet MP3","2018-12-26T12:30:01.000Z","UClZF7OsrECe3t_ADrjZEh_Q","Geet MP3","10","18.29.12","nira ishq,nira ishq guri,guri nira ishq,guri new song,guri songs,nira ishq song,nira ishq by guri,nira ishq guri song,guri all songs,guri new song video,latest punjabi songs,new punjabi songs,latest songs,romantic songs,new songs 2019,love songs,love songs punjabi,punjabi songs,guri all song,nira ishq song guri,love story,romantic song,romantic,latest songs punjabi,new songs punjabi,trending videos,trending songs,gk digital,geet mp3,guri","6502402","300395","8586","20007","https://i.ytimg.com/vi/VO7Vu207-e8/default.jpg","False","False","Geet MP3 &  Gk.Digital Presents GURI's New Track NIRA ISHQ Make Sure You Will Like It And Spread it As Much As You Can. Subscribe To Our Channel For Upcoming Songs :  http://bit.ly/SubscribeGEETMP3Games Khelo Aur Paise Jeeto!Jeetiye 1 lakh Rupaye Harr Roz - MPL App Download Kariye Bbhi Aur Shuru Ho Jaiye Apne Favourite Games Ke Saath - https://www.mpl.live.  Brand Association - Sanchit@brandzup.mediaAlso Availabe On : Gaana : http://bit.ly/2TarqDuWynk : http://bit.ly/2EN9f2MTitle : Nira IshqSinger : GuriLyrics : GuriComposer : GuriStarring : Sara Khatri Music : Sharry NexusMix : Jeffery Thompson (Canada)Mastered By  : Ricardo SangioVideo Director : Satti DhillonDop : VikceeEditor : KamceeArt Director : BlaccMakeup : AntheaHair : Ali Khan  Casting By : Crew Star Fashion (Rammy Singh, Deepesh Rakheja) Steadycam : Amninder SinghProduction : Fateh Film ProductionChoreography : Sahaj Singh & Shreoshi Kumarsuits by : nazaqat by gur sandhuPublicity Design : The Town MediaArtist Management : Gurbaksh Singh DhillonProduced By : Kv DhillonOnline Promotions : Gk.DigitalMusic Label : Geet MP3Subscribe To Our New Channel For New Songs  : http://bit.ly/SubscribeGEETMP3Music Consultant & Digital Partner : Gk.DigitalInstagram : https://www.instagram.com/Gk.DigitalEnjoy and stay connected with us 📲Website : http://GeetMP3.comYouTube : https://www.youtube.com/c/GeetMP3 Facebook : https://www.facebook.com/GeetMP3OfficialInstagram : https://www.instagram.com/GeetMP3Twitter : https://twitter.com/GeetMP3SnapChat : https://www.snapchat.com/add/GeetMP3"
"C84NCQoxulw","Dhee Jodi | 26th  December 2018 | Full Episode | ETV Telugu","2018-12-26T18:05:27.000Z","UCoY_p16GEbOQPgES1-wXpYg","ETV Dhee","24","18.29.12","etv shows,eenadu television,padutha theeyaga,super2,Dhee10,dhee Jodi,jabardasth,extra jabardsth,cash,genes,swarabhishekam,etv20,manasu mamatha,swathi chinukulu,naperu meenakshi,funny task,intro,bhargav,rishika,govind,husna,piyush,ankitha,Rahul,darshini,sai,malavika,saketh,priyanka,reality show,dance","2915619","16532","2746","1405","https://i.ytimg.com/vi/C84NCQoxulw/default.jpg","False","False","దక్షణ భారతదేశంలోనే అతిపెద్ద డాన్స్ రియాలిటీ షో... 10 సీజన్స్ ముగించుకుని ఇపుడు ఢీ-జోడి (ఢీ-11 సీజన్) గా మిమ్మల్ని అలరించడానికి, ఎంటర్ టైన్ మెంట్ ని టన్నుల టన్నుల కొద్ది మీకు అందిచదానికి సిద్దమైంది. యాంకర్ గా ప్రదీప్, టీమ్ లీడర్స్ గా రష్మి, సుడిగాలి సుధీర్, జడ్జిస్‌ గా హీరోయిన్ ప్రియమణి, శేఖర్ మాష్టర్ లు షోకి వ్యవహరిస్తారు."
"k_6RQtA2is0","Ek Baar Video Song Promo - Vinaya Vidheya Rama Songs - Ram Charan, Esha Guptha","2018-12-27T15:24:21.000Z","UCnSqxrSfo1sK4WZ7nBpYW1Q","Lahari Music | T-Series","10","18.29.12","vinaya vidheya rama songs,Ek Bar,Ek Bar Ek Bar,ek baar video song,ek bar video song,vinaya vidheya rama video songs,VinayaVidheyaRamaRamCharan,Ek Baar Video Song Promo,ram charan video songs,ram charan songs,Vinaya Vidheya Rama Song Promo,Vinaya Vidheya Rama,Vinaya Vidheya Rama Song Trailer,Vinaya Vidheya Rama Item Song,vinaya vidheya rama telugu movie songs,vinaya vidheya rama telugu songs,devi sri prasad,boyapati srinu,kiaraadvani,ram charan","1971779","58012","4359","2121","https://i.ytimg.com/vi/k_6RQtA2is0/default.jpg","False","False","Watch #EkBaar Video Song Promo from New Telugu Movie Vinaya Vidheya Rama starring Ram Charan, Kiara Advani, Vivek Oberoi#VinayaVidheyaRama #LahariMusic--------------Listen to #VinayaVidheyaRama Songs now on :iTunes : http://bit.ly/Vinaya-Vidheya-Rama-iTunesHungama : http://bit.ly/Vinaya-Vidheya-Rama-HungamaSaavn : http://bit.ly/Vinaya-Vidheya-Rama-SaavnGaana : http://bit.ly/Vinaya-Vidheya-Rama-GaanaApple Music : http://bit.ly/Vinaya-Vidheya-Rama-Apple-MusicAmazon Prime Music : http://bit.ly/Vinaya-Vidheya-Rama-Amazon-Prime-MusicGoogle Play : http://bit.ly/Vinaya-Vidheya-Rama-Google-PlayWynk : http://bit.ly/Vinaya-Vidheya-Rama-Wynk----------------Song: Ek BaarAlbum/Movie: Vinaya Vidheya RamaArtist Name: Ram Charan, Kiara Advani, Vivek OberoiSinger: DSP, Ranina ReddyMusic Director: Devi Sri PrasadLyricist: ShreemaniMusic Label: Lahari Music---------------Enjoy & stay connected with us!!Subscribe to our Youtube Channel : http://bit.ly/1hE4KpSLike us on FB: https://goo.gl/hbfPfL Circle Us on G+ :  http://goo.gl/STQX0gFollow Us on Twitter : http://bit.ly/1sZimzM"
"LDL2ecXpdNc","Naayagi Episode 265, 28/12/18","2018-12-28T15:00:02.000Z","UC-lJ-F5mlPP6SYPkkq6gjwA","VikatanTV","43","18.29.12","naayagi today episode,Naayagi 28/12/18,Naayagi Episode 265,Naayagi 28/12/2018,vikatan,vikatantv,Naayagi latest episode,Naayagi episode today","746981","4221","1170","770","https://i.ytimg.com/vi/LDL2ecXpdNc/default.jpg","False","False","USee Shop appAndroid   http://bit.ly/2S8QniRApple   https://apple.co/2EzxseeNaayagi Episode 265Subscribe: https://goo.gl/eSvMiG  Vikatan App - http://bit.ly/2QvUBTD Prev Episode: http://bit.ly/2KWR5N7  Best of Naayagi: http://bit.ly/2LzLHlLPromos: https://goo.gl/iptj14 Facebook: https://goo.gl/Ze4PrFNaayagi (Nayagi or Nayaki) is a 2018 Tamil language family soap opera, a serial with daily episode, starring Vidya Pradeep, Papri Ghosh, Ambika, Dhilip Rayan, Vetri Velan, Meera Krishnan and Suresh Krishnamurthi. It is the story of Anandhi, heir apparent to a business empire but separated at birth from her parents who were killed treacherously by their aide Kalivardhan. The show replaced Deivamagal and is produced by Vikatan Televistas Pvt Ltd. This Tamil daily serial airs on SUN TV, every Monday to Saturday at 8:00 pm.Here is today’s episode. Yesterday episode link above."
