video_id,title,publishedAt,channelId,channelTitle,categoryId,trending_date,tags,view_count,likes,dislikes,comment_count,thumbnail_link,comments_disabled,ratings_disabled,description
"0i7g9MzRu3o","ಹತ್ತಿರ ಸಂಬಂಧಿಗಳು ಜಯನಗರದ ನಿವಾಸಕ್ಕೆ ಬಂದು ಸುಮಲತಾ, ಅಭಿಷೇಕ್​​​​​​​​​​​ ಅವ್ರಿಗೆ ಸಾಂತ್ವನ ಹೇಳಿ ಹೋಗ್ತಿದ್ದಾರೆ.","2018-11-27T09:24:23.000Z","UC55LzMuR6ZeSpJMNCAfzb8w","Btv Kannada Ɩ ಬಿಟಿವಿ ಕನ್ನಡ","25","18.28.11","#BtvNewsLive,#BtvKannada,ಹತ್ತಿರ ಸಂಬಂಧಿಗಳು ಜಯನಗರದ ನಿವಾಸಕ್ಕೆ ಬಂದು ಸುಮಲತಾ,ಅಭಿಷೇಕ್​​​​​​​​​​​ ಅವ್ರಿಗೆ ಸಾಂತ್ವನ ಹೇಳಿ ಹೋಗ್ತಿದ್ದಾರೆ.","254730","1496","103","75","https://i.ytimg.com/vi/0i7g9MzRu3o/default.jpg","False","False","ಹತ್ತಿರ ಸಂಬಂಧಿಗಳು ಜಯನಗರದ ನಿವಾಸಕ್ಕೆ ಬಂದು ಸುಮಲತಾ, ಅಭಿಷೇಕ್​​​​​​​​​​​ ಅವ್ರಿಗೆ ಸಾಂತ್ವನ ಹೇಳಿ ಹೋಗ್ತಿದ್ದಾರೆ.Subscribe / Follows on our official Channels:https://www.facebook.com/btvnewslive/https://www.youtube.com/channel/UC55LzMuR6ZeSpJMNCAfzb8whttps://twitter.com/btvnewslivehttp:btvnewslive.com"
"JHu9HOvoPS4","Srishty Rode EVICTION Interview | Talks About Rohit, Dipika & Much More | EXCLUSIVE Interview","2018-11-25T16:30:00.000Z","UCycyxZMoPwg9cuRDMyQE7PQ","TellyMasala","24","18.28.11","tellymasala,telly masala,tellymasala latest news,Srishty Rode,Srishty Rode evicted,Srishty Rode eviction interview,Srishty Rode bigg boss 12 eviction,Srishty Rode tellymasala,Srishty Rode with tellymasala,Srishty Rode exclusive bigg boss interview,Srishty Rode full eviction interview,Srishty Rode on her boyfriend,Srishty Rode on rohit suchanti,Srishty Rode on bigg boss 12,Srishty Rode first interview after eviction,Srishty Rode out of bigg boss house,bigg boss 12","1828442","20336","3400","6637","https://i.ytimg.com/vi/JHu9HOvoPS4/default.jpg","False","False","This week in the Bigg Boss season 12 #SrishtyRode has got evicted. Watch Her First Interview After EVICTION Where she talks about her relationship with Rohit, Her Boyfriend Manish Naggdevv And Much More Only On #TellyMasala.Reporter: Anuradha ThakurEditor: Kamlesh Kandpal#BiggBoss12Subscribe Now http://bit.ly/SubscribeToTellyMasalaLike Us on Facebook https://www.facebook.com/TellyMasalaFollow Us on Twitter https://twitter.com/TellyMasalaFollow Us for more updates on Dailymotion http://www.dailymotion.com/user/TellyMasala/1 Follow Us on Google+ https://plus.google.com/u/0/113985400750240490690/posts"
"f9Vz3yq_1vs","Vj Anjana's Mommies Handbag Secret Revealed | What's Inside the HANDBAG","2018-11-27T10:00:03.000Z","UCSbUX_gKMur5FPcTbH2L5mA","Galatta Tamil | கலாட்டா தமிழ்","24","18.28.11","vj anjana handbag,vj anjana baby shower,vj anjana interview,vj anjana baby photos,vj anjana marriage,vj anjana rangan interview,anjana rangan interview,vj anjana rangan,anjana about surya,surya anjana,behindwoods ashiq,ashiq behindwoods,vj ashiq whats inside your handbag,behindwoods ashiq interview,whats inside my handbag tamil,kayal chandran and vj anjana interview,vj anjana interview with vijay,vj anjana latest interview,aashiq handbag videos","157326","3567","168","373","https://i.ytimg.com/vi/f9Vz3yq_1vs/default.jpg","False","False","Vj Anjana's Mommies Handbag Secret Revealed | What's Inside the HANDBAGStay tuned to Galatta Tamil for latest updates on Cinema and Politics. Like and Share your favourite videos and Comment your views too. Subscribe to GALATTA TAMIL : http://goo.gl/J4TyOo#VjAnjana #WhatsInsidetheHANDBAG Also, Like and Follow us on:Facebook: https://www.facebook.com/GalattaMediaTwitter: https://twitter.com/galattadotcomWebsite: http://www.galatta.comInstagram: https://www.instagram.com/stories/galattadotcom/"
"6Z3Ez6J2v5g","I PASSED OUT IN THE MIDDLE OF THE ROAD","2018-11-27T09:30:00.000Z","UCNn6AaHharXIbkRleXGboiQ","Mumbiker Nikhil","22","18.28.11","blogs,vlog,mumbiker,nikhil,BMW,RAJASHTHAN,india,mumbai,travel,gopro,sony,friends","601046","77758","906","3962","https://i.ytimg.com/vi/6Z3Ez6J2v5g/default.jpg","False","False","My Merch : https://labelmn.com/MIVI : Coupon code : SQUADNOVWebsite links:Octave 16W Bluetooth Speaker:    https://mivi.shop/Octave_MNFESTMoonstone 10W Bluetooth Speaker:    https://mivi.shop/Moonstone_MNFESTRoam 5W Bluetooth Speaker:    https://mivi.shop/Roam_MNFESTCollar Wireless Earphones:    https://mivi.shop/Collar_MNFESTSaxo Wireless Headphones:    https://mivi.shop/Saxo_MNFESTConquer Wireless Earphones:    https://mivi.shop/Conquer_MNFESTThunderBeats Wireless Earphones:    https://mivi.shop/ThunderBeats_MNFEST"
"LUkASJkBTo4","வாணி ராணி - VAANI RANI -  Episode 1731 - 26-11-2018","2018-11-26T16:28:31.000Z","UCxhPXCaIGhyt2HOrJkoVuGA","RadaanMedia","24","18.28.11","Vaani rani,rani,Radhika in funny character,venu aravind,SunTV,VaniRani,vani,vaani,Radhika's dual role serial,Ranimma veetu kuripu,Radhika as lawyer in serial,radikaa,rathika,Radhika's new","469066","2240","538","242","https://i.ytimg.com/vi/LUkASJkBTo4/default.jpg","False","False","Subscribers Us for All Episode:https://www.youtube.com/show/vanirani/UCxhPXCaIGhyt2HOrJkoVuGA?sub_confirmation=1aa Connect with Radaan Media online: https://www.youtube.com/user/RadaanMediaVisit our WEBSITE: www.radaan.tvLike us on FACEBOOK: https://www.facebook.com/RadaanMediaWorksIndiaLtd?ref=hlFollow us on TWITTER:  https://twitter.com/RadaanTVTamil"
"SOYiFgh9pWs","Who to Vote in 2019 Lok Sabha Elections? | Analysis by Dhruv Rathee","2018-11-26T13:22:07.000Z","UC-CSyyi47VX1lD9zyeABW3w","Dhruv Rathee","25","18.28.11","Dhruv Rathee,Dhruv,Rathee,Dhruv Rathee latest video,india news live,Who to vote,2019 Elections,Narendra Modi,Rahul Gandhi,Arvind Kejriwal,BJP,Congress,Aaj tak,India TV,Lallantop,Prime Minister of India,Parliamentary Democracy,Presidential Democracy,Democracy of India,Indian elections,Rajasthan Elections,Madhya Pradesh Elections,Rajasthan election 2018,modi speech today,2019 elections india,Zee News,Lok sabha polls,Voting,PM Modi","702428","52732","6550","14774","https://i.ytimg.com/vi/SOYiFgh9pWs/default.jpg","False","False","Should you vote for BJP or Congress ? Should you vote for Narendra Modi or Rahul Gandhi or someone else? I will answer the biggest political question of the year. Who actually deserves your vote in the 2019 Lok Sabha Elections and the upcoming state elections. I will educate you on the various aspects of voting for the right candidate and tell you what tools you can utilise for it. I will also inform you about the importance of parliamentary democracy as compared to a presidential democracy. Hope it will help you finally know the answer. Link to NETA app: https://play.google.com/store/apps/details?id=in.netaapp&hl=enLink to MPLADs website: https://www.mplads.gov.in/Best State in India video: https://youtu.be/XPwVq56l1rk4 yrs of Modi: https://youtu.be/U8ISnVlHV7wSupport my work: https://www.patreon.com/dhruvrathee---------------------------------------------------- For more informative videos and discussion on important Indian and world issues- Telegram channel to receive instant video updates: https://t.me/dhruvratheechannel Support on Patreon: https://www.patreon.com/dhruvrathee Subscribe: http://www.youtube.com/dhruvrathee Facebook: http://www.facebook.com/DhruvRatheePage Twitter: http://www.twitter.com/dhruv_rathee Instagram: http://www.instagram.com/dhruvrathee More Interviews by Dhruv Rathee: https://www.youtube.com/playlist?list... All episodes of The Dhruv Rathee Show: Ep 9 Black Money: https://youtu.be/UdNe4Bv8ARYEp 8 RTI Activists: https://youtu.be/zE_tnXDXlaI Ep 7 Ache Din in UP: https://youtu.be/dPvM2n2AFAw Ep 6 Lairs Modi, Ivanka: https://youtu.be/jt14K39g7TwEp 5 Padmavati: https://youtu.be/1M9XXdpuiaw Ep 4 Rajasthan: https://youtu.be/y26_c2jNPUw Ep 3 Jay Shah growth: https://youtu.be/FfTpWUPsdsc Ep 2 Indian economy: https://youtu.be/1ZIFEASmno0 Ep 1 Currency Notes: https://youtu.be/sAH9YyR3O4c More videos: Rahul Gandhi vs Modi: https://youtu.be/Lem7KgAb9SYPayTM reality: https://youtu.be/cseroHjs__E Air Pollution: https://youtu.be/Yo_mO0L8uE4 BJP IT Cell part 2: https://youtu.be/BslKjxaP4Ik Maun Modi: https://youtu.be/KOudMPiJFBI Indian Education: https://youtu.be/ABmXRhizz4I PNB Scam: https://youtu.be/5dL4AtHYd1w Bitcoin: https://youtu.be/Kesk8WK1uWM Aadhaar Card: https://youtu.be/S_bvQO6K5fY Best State in India: https://youtu.be/XPwVq56l1rk Petrol Prices reality: https://youtu.be/OSQXo3DpFAg Budget 2018: https://youtu.be/Ncjcg97P1TgSave Our Forests: https://youtu.be/jHmXSpTVjZA ----------------------------------------------------"
"zvLEVN6mdtA","Chiranjeevi, Mohan Babu, Kiccha Sudeep and other celebrities pay tribute to Ambareesh - TV9","2018-11-25T12:20:43.000Z","UCPXTXMecYqnRKNdqdVOGSFg","TV9 Telugu Live","25","18.28.11","Rajinikanth,Chiranjeevi and other celebrities pay tribute to Ambareesh,Rebel Star Ambareesh Death,Arjun Sarja pays tribute to Ambareesh,Deve Gowda & Kumaraswamy pay tributes to Ambareesh,Megastar Chiranjeevi pays tribute to Ambareesh,Mohan Babu cries over Actor Ambareesh Death,Kichcha Sudeepa,Karnataka Kicchaa Sudeep,Shiva Rajkumar,tv9,tv9 live,tv9 news,live tv9,tv9 telugu,tv9 ap,telugu news,tv9 youtube,tv9 online","645471","0","0","198","https://i.ytimg.com/vi/zvLEVN6mdtA/default.jpg","False","True","Rajinikanth, Chiranjeevi, Mohan Babu, Kiccha Sudeep and Shiva Rajkumar other celebrities pay tribute to Ambareesh► Download Tv9 Android App: http://goo.gl/T1ZHNJ► Subscribe to Tv9 Telugu Live: https://goo.gl/lAjMru► Circle us on G+: https://plus.google.com/+tv9► Like us on Facebook: https://www.facebook.com/tv9telugu► Follow us on Instagram: https://www.instagram.com/tv9telugu► Follow us on Twitter: https://twitter.com/Tv9Telugu► Pin us on Pinterest: https://www.pinterest.com/Tv9telugu"
"ylkax703tsc","ಅಂಬರೀಶ್ ಸಾವಿಗೂ ಮುನ್ನ ಆ ದಿನ ರಾತ್ರಿ 8 ಗಂಟೆಗೆ ಆ ಕೊನೆಯ ಕ್ಷಣದಲ್ಲಿ ಏನಾಗಿತ್ತು ಗೊತ್ತಾ || #Ambareesh","2018-11-27T08:00:03.000Z","UC8hVoXNFmuLgz4wXRAxAbXg","Top Kannada TV","24","18.28.11","Top kannada TV,sandalwood news,ಅಂಬರೀಶ್ ಸಾವಿಗೂ ಮುನ್ನ ಆ ದಿನ ರಾತ್ರಿ 8 ಗಂಟೆಗೆ ಆ ಕೊನೆಯ ಕ್ಷಣದಲ್ಲಿ ಏನಾಗಿತ್ತು ಗೊತ್ತಾ,#Ambareesh,#Ambareesh live,kannada news,ive news,kananda videos,ambareesh demise,ambarish no more,rebel star ambarish,top kannada tv videos","66953","334","39","13","https://i.ytimg.com/vi/ylkax703tsc/default.jpg","False","False","ಅಂಬರೀಶ್ ಸಾವಿಗೂ ಮುನ್ನ ಆ ದಿನ ರಾತ್ರಿ 8 ಗಂಟೆಗೆ ಆ ಕೊನೆಯ ಕ್ಷಣದಲ್ಲಿ ಏನಾಗಿತ್ತು ಗೊತ್ತಾ || #Ambareesh#AmbareeshVideo #KannadaNewsKannada Short films, Darshan, Sudeep, Yash, Shivarajkumar, Puneethrajkumar Sandalwood updates,news,gossips and interviewsFacebook : https://www.facebook.com/TopkannadaTV"
"INozmewnIGE","Nandini | 26-November-2018 | Sun TV Serial","2018-11-27T11:19:18.000Z","UCBnxEdpoZwstJqC1yZpOjRA","Sun TV","24","18.28.11","SunTV,SunTvTamizh,Tamil Channel,Nandini,Nandini Serial,Nandini Tamil Serial,Nandhini Serial,Nandhini,Maya,Sundar C,Sun TV Nandini,Sun Serial","182246","1451","119","64","https://i.ytimg.com/vi/INozmewnIGE/default.jpg","False","False","Steps to avail 20% Discount on Sun NXT subscription: 1. Logon to http://bit.ly/YT20OFFER or Download Sun NXT android app from Play Store.2. Click on any video content & Sign up or Sign in.3. Enter the Coupon YT20 in the Coupon Code option in Subscription Pop-Up.4. Complete your payment on discounted price.          * Offer applicable only for Quarterly & Yearly packs.5. iPhone customers can avail the discount from your browser onlyT&C Apply.Enjoy Sun NXT. T&C:PFB updated TnC.  * This discount offer is not applicable for users from US.*  The discount is applicable only for new purchases and not for renewals.*  The renewals for the discounted purchase will be on the actual cost.*  Offer applicable only for Quarterly & Annual Packs.*  Offer not applicable for users paying via iTunes.Episode Details:Watch Nandini - 26-November-2018, Full Episode on Sun NXT from http://bit.ly/nandiniSunTVSynopsis:Nandini is a supernatural drama series. The story is about a rich influential family haunted by a snake's curse. While a good spirit helps the family from the snake by its supernatural powers."
"P064fsn_lgY","Phone Milawaan (Full Song) Sharry Mann | New Punjabi Song 2018 | White Hill Music","2018-11-26T12:31:42.000Z","UCopY0NAzASqmD6eVaRj2TFQ","White Hill Music","10","18.28.11","phone milawaan,sharry mann,sharry mann songs,new Punjabi songs 2018,new punjabi songs,latest punjabi songs,2018 punjabi songs,full punjabi songs HD,latest punjabi songs 2018,new punjabi songs 2018,white hill music,songs,new,full songs,full punjabi videos,punjabi songs,punjabi songs 2018,full punjabi songs hd,marriage palace movie","921203","28406","609","724","https://i.ytimg.com/vi/P064fsn_lgY/default.jpg","False","False","White Hill Music presents new song upcoming Punjabi song from movie Marriage palace by Sharry Mann. Don't forget to Like, share & comment. Click here to Subscribe White Hill Music channel for Latest Punjabi songs : http://bit.ly/SubscribeWhiteHillMusicCredits : Song : Phone MilawaanSinger : Sharry MannMusic : GiftrulersLyrics : Baljit Singh GharuanAlso Available on :- ►iTunes : https://geo.itunes.apple.com/us/album/id1444589338?at=1l3v9Tx&app=itunes►Apple Music : https://geo.itunes.apple.com/us/album/id1444589338►Saavn : https://www.saavn.com/song/phone-milawaan/Oz5YaDsAeEA►Gaana : ►Wynk : ►Jio : ►idea :►Amazon Prime Music : ►Hungama : ►Amazon : https://www.amazon.com/Phone-Milawaan-Sharry-Maan/dp/B07KW4FKP9/►Google Play : https://play.google.com/store/music/album/Sharry_Mann_Phone_Milawaan?id=Bczmrs53fy4kynsd2do53ymsojq►Spotify : http://open.spotify.com/album/4nVs5MpZARTqKXXkh4L5dV►Deezer : http://www.deezer.com/album/79966592Operator Codes : ● Airtel : ● Airtel Hellotune Link : ● Vodafone : ● Idea : ● BSNL (N & W) Direct Dial : ● BSNL (E & S) Direct Dial : Movie Credits : Film - Marriage PalaceStarring- Sharry Mann, Payal Rajput , Jaswinder Bhalla , B N Sharma, Herby Sangha ,Nisha Bano, Anita Devgan , Nirmal Rishi & othersDirected by - Sunil ThakurProduced by - Happy Goyal , Harsh Goyal & Sazal GoyalCo Producer - Shubham ChandrachurWritten By - Rakesh DhawanCreative Director - Shivani ThakurMusic - Gurmeet Singh , Gift Rulerz & CheetahAssociate Director - Bhanu Thakur & Gaurav KakkarLyrics - Happy Raikoti, Vinder Nathu Majra , baljit Gharuan Sound Design : Pradeep SuriFinal Mix : Joe RodriguesMix & Master : Sameer CharegaonkerBackground Music - Gurmeet Singh & Sandeep SaxenaEditor - Rohit DhimanCinematographer - Yuvraj IndoriaChoreographer - Sunil Thakur & Vijay SinghPost Production - Pixel Digital StudioArt Director - Liyakat Ali KhanLine Producer - Jarnail SinghProduction - Virasat FilmsProduction Designer - Kazi Rafik AliYoutube Promotions - Being DigitalMedia Partner - Gold MediaOnline promotions-PUNJABI FRONT Costume - Roma SharmaProject Designer & Ground Promotion - Shubham ChandrachurVisual Promotions - Hashtag StudiosPoster Design - Thirsty FishMusic Label : White Hill MusicSubscribe us on :-YouTube : http://bit.ly/WhiteHillProductionFacebook : -White Hill Music : https://www.facebook.com/whitehillmusicWhite Hill Production : https://www.facebook.com/whitehillproduction  Twitter : https://twitter.com/whitehillproducInstagram : https://www.instagram.com/whitehillmusic/Website : https://www.whitehillproduction.comPublished Year : 2018Copyright : White Hill Music & Entertainment Private LimitedF-545,1st Floor,Phase -8A Industrial Area,Mohali - 160059"
"kfIbtzpJYG8","2019 की रानी चटर्जी  की सबसे बड़ी फिल्म || HD 2019  || Bhojpuri Superhit Film 2019","2018-11-27T12:21:59.000Z","UCaP6L7U9mq8C3OehlBhwqgg","Wave Music - Bhojpuri Movies","1","18.28.11","bhojpuri hit song,Sej wala age bhail,Pawan singh latest hit song,Sej wala age pawan singh,Sej wala age Bhail 2018,Pawan singh song Sej wala age age 2018,Pawan singh and priyanka Singh song,Sej wala age Bhail new song,Pawan singh new gaana 2018,Pawan singh Sej wala song,रानी चटर्जी,rani chatarji,bhojpuri movie 2018,movie 2018,pawan singh 2019,pawan singh new movie,rakesh mishrA,RAKESH MISHRA,PAWAN NEW MOVIE 2018","381651","839","422","90","https://i.ytimg.com/vi/kfIbtzpJYG8/default.jpg","False","False","2019  रानी चटर्जी  की सबसे बड़ी फिल्म || HD 2019  || Bhojpuri Superhit Scene 2019 2019  रानी चटर्जी  की सबसे बड़ी फिल्म || HD 2019  || Bhojpuri Superhit Scene 2019 2019  रानी चटर्जी  की सबसे बड़ी फिल्म || HD 2019  || Bhojpuri Superhit Scene 2019 2019  रानी चटर्जी  की सबसे बड़ी फिल्म || HD 2019  || Bhojpuri Superhit Scene 2019 2019  रानी चटर्जी  की सबसे बड़ी फिल्म || HD 2019  || Bhojpuri Superhit Scene 2019 व् व् 2019  रानी चटर्जी  की सबसे बड़ी फिल्म || HD 2019  || Bhojpuri Superhit Scene 2019"
"K8G_1D56GrU","Friendzone ka Punchnama || Sushant Maggu","2018-11-26T15:34:16.000Z","UCDKztRoZqEciuBcBCQIXXvg","Sushant Maggu","24","18.28.11","sushant maggu,sushant maggu video,sushant maggu funny video,funny video,comedy video,friendzone video,pyaar ka punchnama,maggu comedy,maggu,sushant,desi videos,haryanvi comedy,punchnama,friendzone,friendzone ka punchnama,maggu comedy video,maggu video,sushant comedy,funny,funnny video,punjabi music,friendship,love,girlfriendboyfriend,viralvideo,trendingvideo,comedyvideo","290830","25748","409","1806","https://i.ytimg.com/vi/K8G_1D56GrU/default.jpg","False","False","This Video Shows how a girl friendzoned a guy and what boys do after get friendzoned.https://www.instagram.com/sushant_maggu1Instagram Handle :-Directed By :-Sushant Maggu ,Saurav, Gaurav DhingraWritten by :- Sushant MagguEdited By:- Vishal SharmaCinematograhpy by :- Ikrar, Ravi GuptaVfx By :- Aman BhatiaActors :- Sushant Maggu, Swagger Sharma, Swara, Saurav, Gaurav Dhingra,Aman ,Go Haddippa, Shubham Goyal.Go hadippa Channel Link :-https://youtu.be/OolLSsfnrHISwara Channel link :-https://youtu.be/zcDIu-YLMZ0Swagger Sharma's channel - https://www.youtube.com/watch?v=uV_uRoy49B0&t=12sPrevious Video Link :- https://youtu.be/eeou8JDgoug"
"bPSsQ2PXuWU","20 FABULOUS CHRISTMAS DIY CRAFTS","2018-11-26T08:30:00.000Z","UC295-Dw_tDNtZXFeAPAW6Aw","5-Minute Crafts","26","18.28.11","5-Minute Crafts,DIY,Do it yourself,crafts,trucos,5 minutes craft,life hacks,5 minute craft,trucos de belliza,proyectos faciles,tricks,tips,DIY projects,Handcraft,Tutorial,howto,Christmas decor,decorate,decoration,holidays,Christmas gifts,gift,gift ideas,present,presents,DIY gifts,Christmas crafts,easy crafts,hot glue,glue gun,snowman,Christmas tree,Christmas garland,Ninja Turtle,ornaments,Christmas dinner,holiday wreaths","2097117","25934","2045","1106","https://i.ytimg.com/vi/bPSsQ2PXuWU/default.jpg","False","False","UNIQUE AND CHEAP CHRISTMAS ORNAMENTSHolidays are coming and it’s time to think about house decorations. The holidays can be expensive, which is why we love to save money by creating homemade Christmas decorations. Here is a whole collection of magical Christmas projects that will make your room as festive as possible.You will find such homemade Christmas decorations as holiday wreaths, simple Christmas trees, table decoration and a lot more!The classical light bulb could be a very versatile item and might be converted into Christmas decoration. Cover the bulb with glue and with glitters. Voila!We have a super creative idea how to make Ninja Turtle Ornaments. Supplies you need to make cute Ornaments: green ornament balls, ribbon (blue, red, orange, & purple) and toy eyes. Just string glue around the middle of the ornament ball and add ribbon. When the glue is dry add eyes. Ready! Let’s give your traditional decorations an extra special look! You don’t need to buy new Christmas ornaments because you can make homemade ones. Create Christmas tree decorations made from empty toilet rolls and macrame, crayons, polymer clay and even from pasta!Hosting guests is something that we all do from time to time. Though it may be challenging, we always try to make a perfect dinner. The napkin-folding techniques are something fun and useful for special events Christmas dinner. Check out an idea of how to make your Christmas table special!Our craft projects won’t take a lot of time and require a minimum amount of supplies. Let’s start from DIY wreaths that are a great addition to your home décor and gives a special holiday feel. You can make a huge and awesome Christmas wreath using with a wire hanger. Watch our video for the full tutorial! TIMESTAMPS:00:33 Ninja Turtle Ornaments01:20 How to decorate Christmas table02:34 Holiday wreaths05:59 Polymer clay Santa06:45 Pasta Christmas garland----------------------------------------------------------------------------------------Our Social Media:Facebook: https://www.facebook.com/5min.crafts/Instagram: https://www.instagram.com/5.min.crafts/Twitter: https://twitter.com/5m_craftsSubscribe to 5-Minute MAGIC: http://bit.ly/2ldditZSubscribe to 5-Minute Crafts GIRLY: https://goo.gl/fWbJqzSubscribe 5-Minute Crafts KIDS: https://goo.gl/PEuLVtThe Bright Side of Youtube: https://goo.gl/rQTJZz----------------------------------------------------------------------------------------For more videos and articles visit:http://www.brightside.meMusic by Epidemic Sound: https://www.epidemicsound.com/"
