video_id,title,publishedAt,channelId,channelTitle,categoryId,trending_date,tags,view_count,likes,dislikes,comment_count,thumbnail_link,comments_disabled,ratings_disabled,description
"tE3gZzrBlIY","WHY WOMEN LIVE LONGER THAN MEN? | Aashqeen","2018-12-28T12:08:41.000Z","UCc3b8uaQNySMagDbHsm52Tg","Aashqeen","23","18.29.12","aashqeen,aashqeen funny,comedy,ashqin,ashqeen,women live longer than men,relationship humour,ek ladki ko dekha to aisa laga,ashish chanchlani,amit bhadana,shopping,women problems,girl problems,barkha","442057","79075","1836","3382","https://i.ytimg.com/vi/tE3gZzrBlIY/default.jpg","False","False","Have you ever wondered why women live longer than men?Watch the full video and know our viewpoint.Follow Me On Instagram @AashqeenLink : https://www.instagram.com/aashqeen/?h... #Aashqeen Go check out the Spoyl app and shop trendy hand-picked styles at upto 80% Off!  We have handpicked amazing styles for you all.Plus, just for our fans we have EXTRA 15% off. Use code: ASHQ15Download Now: https://spoyl.page.link/ashq  Also Hit LIKE and Do COMMENT.SHARE this video & SUBSCRIBE the channel for more videos.Cast :AashqeenDikshant Negi- https://www.instagram.com/dikshant_negi14/?hl=enBarkha Sethi- https://www.instagram.com/barkhasethi/JessicaPriya GabaAkritiShubhamGaganMayankAashitaPayalShreyasKaran MasoonEditing :Lakhan Verma - https://www.instagram.com/soni.lakhan/Come Connect with me on:Facebook: https://www.facebook.com/aashqeen1/ Twitter: https://twitter.com/aashqeen1"
"By_Cn5ixYLg","YouTube Rewind 2018 but it's actually good","2018-12-27T17:30:00.000Z","UC-lHJZR3Gqxm24_Vd_AJ5Yw","PewDiePie","24","18.29.12","rewind 2018,youtube rewind 2018","18135299","4681659","29593","484146","https://i.ytimg.com/vi/By_Cn5ixYLg/default.jpg","False","False","YouTube Rewind 2018. Celebrating the actual videos, people, music and moments that defined 2018. #YouTubeRewindSUBSCRIBE TO:FlyingKitty: https://www.youtube.com/channel/UCYQT13AtrJC0gsM1far_zJgGrandayy: https://www.youtube.com/channel/UCa6TeYZ2DlueFRne5DyAnygDolan Dark: https://www.youtube.com/user/BlackIceShredderPartyinbackyard: https://www.youtube.com/channel/UCIaIVpEocfuQ9fhBT1rsKrQ____________________________________________Extra credits:Ali A's intro: https://www.youtube.com/watch?v=u86pVtqn_kkHit or miss: https://www.youtube.com/watch?v=3w-C0-zVaW8Megalovania: https://tobyfox.bandcamp.com/album/undertale-soundtrackCrab rave: https://www.youtube.com/watch?v=LDU_Txk06tM"
"rl4_l4yEtQY","Durga | Full Ep 1265 | 27th Dec 2018 | Odia Serial - TarangTV","2018-12-28T05:30:02.000Z","UCnm5DH0oJndtA-6J10_jIEw","Tarang TV","24","18.29.12","tarang,tarang tv,tarang tv online,tarang tv serial,odia tarang tv serial,tarang tv show,taranga channel,tarang tv channel,odia tarang channel,odia serial,odia serial video,odia channel,odia tv channel,odia tv show,odia tv","185668","688","84","103","https://i.ytimg.com/vi/rl4_l4yEtQY/default.jpg","False","False","After Lisa return, Lisa tries to destroy Dev Mansion  by using Rudra and Shiv as weapon..But stuti saves her family from Rudra’s attack always..Durga & Stuti tries to save their family from Rudra’s –ve power and make Rudra +ve out of the evil powers..Will they be able to know about Lisa’s plan & succeed in their mission?Monday-Saturday at 8.30 p.m. only on Tarang TV.SUBSCRIBE to TarangTV channel for more Odia Serial and movie videoshttps://goo.gl/QgkQLbLike us on Facebookhttps://www.facebook.com/tarangtv Circle on G+ https://goo.gl/ArUUGwFollow us on Twitterhttps://twitter.com/tarangtvodisha Follow us on Instagramhttps://www.instagram.com/tarangtv/ Visit our website for further details: www.tarangtv.in#Durga #TarangSerial #OdiaSerial"
"pKguNINOFGM","Reddy Ikkada Soodu - Full Video | Aravindha Sametha | Jr. NTR, Pooja Hegde | Thaman S","2018-12-27T09:49:28.000Z","UCLsSLka8jODBozvi5VTQeaQ","Zee Music South","10","18.29.12","ntr jr songs,ntr jr movies,new telugu songs,latest telugu songs,aravinda sametha songs,pooja hegde songs,daler mehndi songs,thaman s songs,thaman songs,reddy,ikada,sodu,jr ntr music,Aravindha Sametha,zee music south,latest songs,new songs,ntr jr movie songs,ntr jr hit songs,telugu songs 2018,reddy ikkada soodu,reddy ikkada soodu song,reddy ikkada soodu lyrical video,reddy ikkada soodu video song,reddy ikkada soodu full song","1637046","40643","1419","1692","https://i.ytimg.com/vi/pKguNINOFGM/default.jpg","False","False","#AravindhaSamethaSongs #JrNTRSongs #NewSongsZMCTo stream & download full song:Gaana: https://bit.ly/2IKQnkISaavn: https://bit.ly/2QGfAQfWynk Music: https://bit.ly/2OaL6sCJioMusic: https://bit.ly/2yqaXlJiTunes: https://apple.co/2CxL73zGoogle Play Music: http://bit.ly/2xBH8yOAmazon Prime Music: https://amzn.to/2OP5kYtHungama: https://bit.ly/2RDwQa7Idea Music - https://bit.ly/2pZRO6fSingers - Daler Mehndi & Anjana Soumya Lyrics - Ramajogayya SastryProgrammed & Arranged by Thaman SLive drums - Thaman S Live Percussion - Sivamani.A Live Dhol - deepesh ( Sound of Bombay ) Mumbai Live Tapes - Lakshmi Kanth , Jagan Mohan , Sruthi Raj , Kavi Raj  ( Chennai )Chennai Live Strings  Conducted by - Ravi Ragav Electric Guitars - Allap Raju & Subhani Bass guitar - Allap Raju Electric violin - sandilyaElectric Sarangi - ManonmaniHarmony - Sahithi Chaganti , Satya YaminiChorus - vishnu priya , Sony , Arti , kamalaja , Aparna Vocal supervisor - Sri Krishna Songs Recorded at YRF ( Mumbai ), RFC ( Hyd ), Audio Garage ( Mumbai ) & V studios (Chennai ) Strings Recorded In Muzik Lounge Studio ( Chennai )  Songs Recorded by Osho Venkat , Shanthanu & Abhishek Mixed & mastered by Shadab Rayeen @ new edge ( Mumbai ) & new edge ( Newyork ) Music cordinator  ManikandanStudio assistant  Bhaskar, Seenu , BoseAravindha Sametha - Veera Raghava Cast & Crew Starring: Jr. NTR, Pooja Hegde, Jagapathi Babu, Naga Babu, Sunil, Eesha RebbaDirector: Trivikram SrinivasMusic: Thaman SDOP: P.S. VinodEditor: Naveen NooliProduction Designer: A.S. PrakashStunts: Ram - LakshmanExecutive Producer: PDV PrasadProducer: S. Radha Krishna(chinababu)Banner: Haarika & Hassine CreationsMusic on Zee Music CompanySet Reddy Ikkada Soodu as your caller tune - SMS ARVSM4 To 57575Airtel Subscribers Dial 5432116591515Vodafone Subscribers Dial 53710661656Idea Subscribers Dial 5678910661656BSNL (South / East) Subscribers SMS BT 10661656 to 56700BSNL (North / West) Subscribers SMS BT 7161153 to 56700Connect with us  - https://www.youtube.com/c/zeemusicsouthhttps://www.facebook.com/zeemusicsouthhttps://twitter.com/zeemusicsouth"
"nxYRlmyb8uU","Mr & Mrs. E09 | To Mooch Or Not To Mooch ft. Nidhi Bisht & Biswapati Sarkar || Girliyapa","2018-12-27T06:30:57.000Z","UCdxbhKxr8pyWTx1ExCSmJRw","Girliyapa","24","18.29.12","[none]","680244","27132","1186","912","https://i.ytimg.com/vi/nxYRlmyb8uU/default.jpg","False","False","Sanju has had enough of his cute, chocolate boy image and decides to grow a moustache to seem like more of a badass. The plan immediately backfires as Madhu takes one look at him and bursts out laughing. Sanju tries to defend his choice but Madhu just can't seem to take him seriously. Why does he suddenly need a moustache anyway? What's the real l reason behind it and will he be able to convince Madhu to let him keep it? Furniture courtesy (Associate Partner): Pepperfryhttp://bit.ly/GYxPepperfryMicrosite Follow Girliyapa on: Instagram: https://www.instagram.com/girliyapa/ Facebook: https://www.facebook.com/Girliyapa/ Twitter: https://twitter.com/GirliyapaWant more awesome original videos?Head to https://tvfplay.com/Download TVFPlay now:Android: http://bit.ly/tvfplayandroid iOS: http://bit.ly/tvfplayiosCredits:Creative Head: Nidhi BishtChannel Manager: Sarjita JainWritten by: Chirag Ratna SinghDirected by: Aakanksha DuaDOP: Kunal Hassanandani, Shlok HassanandaniEdited by: Arunava ChaudhuriStock Music by: Universal Production MusicProduction Design: Abhimanyu JaiSupervising Producer: Shivani SinhaLine Producer: Uteja SharmaChief Assistant Director: Saksham AroraCostume Stylist: Shroboshi SamantaAssistant Costume Stylist: Ruchika JalanAssistant Directors: Pranjali Upadhye, Ayush AnandAssistant Production Design: Idris BurhanpurwalaColor Graded By: Arunava ChaudhuriGraphics: Anshuman SinghPost Production Supervisor: Garvit JanshaliSync Sound: DPProduction Manager: Niharika RathodUnit Production Manager: Richard FernandesProduction Executive: VK Singh MomHead of Production: Arun KumarHead of Brand Partnerships: Vijay KoshyHead of Brand Solutions: Vyom CharayaHead of Account Management: Gauri JoshiBrand Sales and Solutions Team: Lipica Buttan, Nisha Mutneja, Pranav ThakkerHead of Marketing: Vineet KanabarMarketing Team: Medha Roy, Pritika Mathur, Ayusha Gawale, Srishti Millicent, Radhika Vijay, Shailendra PatilFinance: Manish Saini, Nikita JoshiOffice Admin: Avadhraj YadavLegal: Megha GuptaWardrobe Courtesy: Mystere ParisLocation: London House, MadhCast: Nidhi Bisht, Biswapati Sarkar"
"sSsF2vGHXp4","Live: क्या मेलबर्न के मौसम के चलते फॉलोऑन ना कराना इंडिया को महंगा तो नहीं पड़ेगा ? | Sports Tak","2018-12-28T15:23:53.000Z","UCVXCo0W9pk2dDkEBNLhTt7A","Sports Tak","17","18.29.12","sports tak,“sportstak”,“sports”,sports events,“cricket”,“sports,videos”,india vs australia,india,india tour of australia,australia,ind vs aus,melbourne,melbourne test","256165","6040","565","937","https://i.ytimg.com/vi/sSsF2vGHXp4/default.jpg","False","False","India bowled out Australia for 151 runs in their first innings on the final session of day three of the third Test. India took a massive 292 runs lead over Australia but decided against enforcing the follow on.----------About Sports Tak: स्पोर्ट्स तक (Sports Tak) खेल की दुनिया की हर छोटी-बड़ी खबर आपके लिए लाता है। स्पोर्ट्स You Tube पर आपको मिलेगी हर ब्रेकिंग न्यूज, विश्लेशण और बड़े-बड़े खिलाड़ियों के Exclusive इंटरव्यू। साथ ही सुनील गावस्कर, हरभजन सिंह, मोहम्मद अजहरूद्दीन, मदनलाल, आकाश चोपड़ा और निखिल चोपड़ा जैसे क्रिकेट दिग्गज आपके लिए खेल पर चर्चा करेंगे और आपके सवालों के जवाब भी देंगे। खेल जगत की हर खबर से रूबरू होने के लिए सब्सक्राइब/Subscribe कीजिए स्पोर्ट्स तक (Sports Tak)।  You can follow स्पोर्ट्स तक (Sports Tak) on: Sports Tak Youtube: https://www.youtube.com/sportstakSports Tak Facebook: https://www.facebook.com/sportstak/Sports Tak Twitter: https://twitter.com/sports_takSportsTak Instagram: https://www.instagram.com/sportstakofficial/Sports Tak, as the name suggests, is all about sports. You can find all the latest sports news from around the world here. Not just that, we bring to you exclusive interviews, live chats with players - past and present - and also the top journalists from sports journalism. It is an exclusive platform for sports news updates for the fans, not just from the sub-continent but the world over"
"mlZOkYQhLvA","తమ్ముడు చిన్న బ్రేక్ తీసుకొని స్విజ్జర్లాండ్ వెళ్లాడు | Chiranjeevi About Pawan Kalyan","2018-12-27T17:01:26.000Z","UCTcH-GOkexQHWKBWSfOjhPQ","Vanitha TV","24","18.29.12","Chiranjeevi About Pawan Kalyan,Chiranjeevi superb words About Pawan Kalyan,vinaya vidheya rama,vinaya vidheya rama live,vinaya vidheya rama pre release event,vinaya vidheya rama pre release event live,vinaya vidheya rama audio launch live,ram charan vinaya vidheya rama,vinaya vidheya rama jukebox,#RamCharan,kiara advani,vvr pre release event,vvr movie,vanitha tv,boyapati srinu,ram charan about Chiranjeevi,ram charan speech,Chiranjeevi Speech","589704","11105","803","854","https://i.ytimg.com/vi/mlZOkYQhLvA/default.jpg","False","False","తమ్ముడు చిన్న బ్రేక్ తీసుకొని స్విజ్జర్లాండ్ వెళ్లాడు | Chiranjeevi About Pawan Kalyanat Vinaya Vidheya Rama Pre Release Event#VinayaVidheyaRama Movie ft. Ram Charan and Kiara Advani, Vivek Oberoi, Sneha and Aryan Rajesh. Directed by Boyapati Srinu and Produced by DVV Danayya. Music Composed by Devi Sri Prasad.#VinayaVidheyaRamaPreReleaseEvent #VVRPreReleaseEvent #RamCharan #KiaraAdvani#VVR #BoyapatiSrinu #VinayaVidheyaRama #VivekOberoi #Sneha #AryanRajeshStory - Screenplay - Direction : Boyapati SreenuProducer : DVV DanayyaMusic : Devi Sri PrasadDOP : Rishi Punjabi - Arthur A Wilson Editing : Kotagiri Venkateswara Rao, ThammirajuArt : A.S.Prakash Stunts : Kanal Kannan Executive Producer - V.Y. Praveen KumarLine Producer : Vijay JagarlamudiCo Producer : Kalyan DVVDigital Partners : Walls & TrendsPRO : Vamsi Kaka, NaniStills : JeevanPublicity : Dhani AelayChief Co Director : Bandi Ramesh - Ravi Nandipati#KarthikaMasam Special #ShivaSongs:ఈ శివుడి పాట మీ ఇంటికి సిరిసంపదలను తెస్తుంది : https://goo.gl/upbx22Lord Shiva Most Popular Song | #KotiDeepotsavam Song : https://goo.gl/bbnhymWatch Vanitha TV, the First Women Centric Channel in India by Rachana Television. Tune in for programs on infotainment, health and welfare of women, women power and women's fashion.For More Latest Details ☟☞ Watch Vanitha TV Live : https://goo.gl/QmDp33☞ Subscribe to Vanitha TV : https://goo.gl/ASrUwh☞ Like us on Facebook : https://goo.gl/1pHFWv☞ Follow on Vanitha TV Website : https://goo.gl/279L8d"
"eNA_SLep1ao","Deepika Padukone REVEALS all about life with Ranveer Singh after marriage | Deepveer| Pinkvilla","2018-12-27T11:10:59.000Z","UCkJZQddO3XTCdcLjN019FjA","PINKVILLA","24","18.29.12","deepveer marriage,deepveer vm,deepveer after marriage,deepveer after wedding,deepika padukone,deepika interview after marriage,deepika padukone marriage,deepika ranveer,deepika wedding,deepika marriage,deepika and ranveer wedding,deepika and ranveer marriage,deepika and ranveer singh wedding video,deepika and ranveer reception,deepika amin,deepika and ranveer interview,deepika aur ranveer ki shadi","943082","19218","705","1062","https://i.ytimg.com/vi/eNA_SLep1ao/default.jpg","False","False","Magical, is the one word Deepika Padukone used to summarise her delightful 2018. Whether it be professionally with the mega-hit Padmaavat or personally with her dream wedding to the love of her life, Ranveer Singh.As we say goodbye to 2018 and hello to 2019, we sat down with Deepika for an exclusive chat on life after marriage with Ranveer, when she realized he was the one for her, baby plans and why 2018 was DeepVeer's year.#Deepveer #DeepikaRanveer #RanveerSinghLike us on Facebook: https://www.facebook.com/pinkvillamedia/Follow us on Twitter: https://twitter.com/pinkvillaFollow us on Instagram: https://www.instagram.com/pinkvilla/For Pinkvilla South visit: https://regional.pinkvilla.com/ For Pinkvilla Hindi visit: http://hindirush.com/"
"28w74zdlNnU","Petta Trailer review by Prashanth","2018-12-28T09:15:41.000Z","UCZVcQLqXTn1DN-UcDwrc1gQ","tamilcinemareview","1","18.29.12","tamil cinema review,tamil cinema review prashanth,tamil cinema review prashanth latest,itisprashanth review,petta,trailer,petta trailer,petta trailer review,rajinikanth,superstar,simran,nawazuddin siddiqui,vijay sethupathi,trisha,sasikumar,rajini,kanth,petta review","242545","11600","994","975","https://i.ytimg.com/vi/28w74zdlNnU/default.jpg","False","False","Berry 'n' Blossom - http://www.berrynblossom.com/locations and contact details :1 Nungamabakkam--------- 044 421822552.Vadapalani --------------- 044 421622553 Purasaiwakkam ---------- 044 486110114.Kolathur-------------------- 044 43556954facebook page : http://www.facebook.com/pages/Berry-n-Blossom/126918547366074Review about recently released petta trailer which has superstar Rajinikanth , Nawazuddin Siddiqui , Vijay sethupathi , Sasikumar , Simran , Trisha and many others playing lead roles and movie was directed by Karthick Subbaraj . Music composed by Anirudh Ravichander."
"KuD6PL5aqRw","Abhishekam | 28th  December 2018 | Full Episode No 3105 | ETV Telugu","2018-12-28T10:00:07.000Z","UCSs9H1cyB3OHdy8wkit8ZKg","etvteluguindia","24","18.29.12","etv,etv telugu,telugu etv serial,telugu etv serials,sorna,etv fiction,comedy,jabardasth,extra jabardasth,eenadu television,aadukalam,daily serials,animation,amrutha,dasari narayana rao,etv noon time serials,abhishekam,abhishekamserial,sanjay,shirisha,rekha","166844","483","205","80","https://i.ytimg.com/vi/KuD6PL5aqRw/default.jpg","False","False","Vinay overcomes many hurdles in his life. Though he is a family man, he ties the knot with Rekha to fulfill her last wishes. However, Rekha recovers miraculously and enters Vinay's life."
"Iwscv3elgH0","Kasoote Video Motion Poster | Gulzaar Chhaniwala | Latest Haryanvi Songs | Sonotek","2018-12-28T12:31:47.000Z","UCFQ9AY7oyEqRS7iVXJLNSmw","Sonotek Music","10","18.29.12","kasoote,kasoote song,kasoote video,kasoote haryanvi song,gulzaar chhaniwala new song,kasoote video song,gulzaar chhaniwala,gulzaar chhaniwala song,sonotek music,kasoote video hd,haryanvi songs,haryanvi song,haryanvi,songs,haryanavi,2018,new,latest,new haryanvi,latest haryanvi,new haryanvi songs,latest haryanvi songs,new haryanvi song,latest haryanvi song,haryanvi songs haryanavi,haryanvi songs haryanavi 2019,#haryanvi","87436","2414","196","111","https://i.ytimg.com/vi/Iwscv3elgH0/default.jpg","False","False","Kasoote Video Motion Poster | Gulzaar Chhaniwala | Latest Haryanvi Songs 2019 | SonotekVideo Credits :--------------------------------------------------------------------------Song : Kasoote Video Motion PosterArtist : Gulzaar ChhaniwalaSinger : Gulzaar ChhaniwalaLyrics : Gulzaar ChhaniwalaMusic : Gulzaar ChhaniwalaDop : Edit : Director : Dance Garup : Choreography:  Sonotek Onwer:- Hansraj Railhan, Leela Krishan Railhan , Rajesh Thukral Ankit VijOffice Number:- 011-23268079Music Label & Copyrights :- Sonotek CassettesMail Us :-sonotekaudio@gmail.comContact Company (Person) :- Leela Krishan Ji +91-9212183337Contact Company (Person) :- Ankit Vij ------------+91-9899429419---------------------------------------------------------------------------------------------------------Enjoy and stay connected with us!!Subscribe Sonotek Cassettes Haryanvi channel for unlimited entertainment :- https://www.youtube.com/SonotekVideoLike us on Facebook :-https://www.facebook.com/SonotekVideoCircle us on G+ :-https://plus.google.com/+sonotekFollow us on Instagram :-https://instagram.com/SonotekVideoFollow us on Twitter :-https://twitter.com/SonotekvideoFollow us on Dailymotion :-https://www.dailymotion.com/SonotekvideoFollow us on Pinterest :-https://in.pinterest.com/SonotekVideoFollow us on Tumblr :-http://www.sonotekvideo.tumblr.com/Click Here Website :-http://www.sonotekcassette.com"
"kAsl6jzj4uI","GEETA RABARI | Koni Pade Entry | ગીતા રબારી | કોની પડે એન્ટ્રી | Latest Gujarati Song 2019","2018-12-29T01:15:00.000Z","UCpZVXyR7lix525VPi3Vc5mg","Studio Saraswati Official","10","18.29.12","tahukar,jay mogal,maa mogal,geeta rabari,rdc Gujarati,studio saraswati,Rona Song,New Rona Song,Rona Latest Song,Koni Pade Entry,ગીતા રબારી,કોની પડે એન્ટ્રી,Rona Ni Pade Entry,saraswati studio,new song 2019,latest song 2019,new year song,latest gujarati song,geeta rabari latest song,geeta rabari new song","292455","17165","1212","1321","https://i.ytimg.com/vi/kAsl6jzj4uI/default.jpg","False","False","Produce & Present By STUDIO SARASWATI - Junagadh.Producer MANOJ N JOBANPUTRA.Singer & Acting : GEETA RABARI.Lyrics : VIJAYSINH GOL.Music : DHAVAL KAPADIYA.D.O.P. – Direction – Editing – Concept : CHANAKYA A THAKOR.Sp Thanks : PRRUTHVI RABARI & MAHESHBHAI RABARI.Thanks To RATAN GADHVI – BHAVESH GADHVI & All Suporting Members.To Set Your Mobile Caller Tune : Rona Ni Pade EntryAiret User Direct Dial - 5432116708718Idea User Direct Dial - 5678910860696Vodafone User Direct Dial - 53710860696Dil Na Re Dil Dar RonaAiret User Direct Dial - 5432116708738Idea User Direct Dial - 5678910860697Vodafone User Direct Dial - 53710860697Dosto KajeAiret User Direct Dial - 5432116708637Idea User Direct Dial - 5678910860698Vodafone User Direct Dial - 53710860698રોજ નવા અપડૅટ ની માહિતી માટે ૩ ચેનલ ને subcribe કરો.- STUDIO MAA MOGALwww.youtube.com/channel/UCXrYZPDM4U9M-Bk1L-Kcmpw?sub_confirmation=1- STUDIO SARASWATI OFFICIALwww.youtube.com/channel/UCpZVXyR7lix525VPi3Vc5mg?sub_confirmation=1- STUDIO SARASWATI  OFFICIAL CHANNEL"
"csap4GTtFco","DNA: Actor Anupam Kher on his new film 'The Accidental Prime Minister'","2018-12-28T17:27:10.000Z","UCIvaYmXn910QMdemBG3v1pQ","Zee News","25","18.29.12","Sudhir Chaudhary,DNA,Anupam Kher,Actor,Bollywood,The Accidental Prime Minister,Congress,Sonia Gandhi,Rahul Gandhi,Anupan,Bollywood actor,Censor board,Central Board of Film Certification,Manmohan Singh,Congress Party,trailer,Anupan Kher pressor,Controversy on film","134748","5982","586","1185","https://i.ytimg.com/vi/csap4GTtFco/default.jpg","False","False","Watch Bollywood actor Anupam Kher in conversation with Sudhir Chaudhary on his upcoming film 'The Accidental Prime Minister'. About Channel:Zee News is a Hindi news channel with 24 hour coverage. Zee News covers breaking news, latest news, politics, entertainment and sports from India & World.-------------------------------------------------------------------------------------------------------------Subscribe to our other network channels:Zee Business: https://goo.gl/fulFdiDr. Subhash Chandra Show: https://goo.gl/fCugXCDaily News and Analysis: https://goo.gl/B8eVsD-------------------------------------------------------------------------------------------------------------You can also visit us at:http://zeenews.india.com/ Like us on Facebook:https://www.facebook.com/ZeeNews Follow us on Twitter:https://twitter.com/ZeeNews Follow us on G+:https://plus.google.com/+Zeenews"
"WuC5FFdx4M8","Tech Talks #698 - Poco F2 Leaks, Folding iPhone, Jio Happy New Year offer, Vivo Nex 5G, Moto P40","2018-12-28T17:19:30.000Z","UCOhHO2ICt0ti9KAh-QHvttQ","Technical Guruji","28","18.29.12","Poco F2 Leaks,Folding iPhone,Jio Happy New Year offer,Vivo Nex 5G,Moto P40,Jio Offer 2018,technical guruji,technicalguruji,Tech news,tech talks,latest tech news,technology,india,hindi,latest,Latest,latest updates,trick,online,Daily News,Hindi News,Airtel,Jio Latest News,India,Gaurav Chaudhary,Flipkart,Bitcoin,Facebook,Jio New Plans,iPhone,5G India,News,Guruji,Whatsapp,Tech Talks #698","246337","35145","980","6053","https://i.ytimg.com/vi/WuC5FFdx4M8/default.jpg","False","False","TG Deals@ https://tg.deals/   New Channel: https://goo.gl/Jz6p5KNamaskaar Dosto, Tech Talks ke is Episode mein maine aapse kuch interesting Tech News Share ki hai jaise Sony TOF 3D Camera Sensor, Poco F2 Specs Leaks, Vivo Nex 5G with 855, Moto P40, Xiaomi Projector, Yi Home Camera, Jio Happy New Year Offer aur bahut kuch. Mujhe umeed hai ki yeh video aapko pasand aayega. Share, Support, Subscribe!!!Subscribe: http://bit.ly/1Wfsvt4Android App: https://technicalguruji.in/appYoutube: http://www.youtube.com/c/TechnicalGuruji Twitter:  http://www.twitter.com/technicalgurujiFacebook: http://www.facebook.com/technicalgurujiFacebook Myself: https://goo.gl/zUfbUUInstagram: http://instagram.com/technicalgurujiGoogle Plus: https://plus.google.com/+TechnicalGurujiWebsite: https://technicalguruji.in/Merchandise: http://shop.technicalguruji.in/About : Technical Guruji is a YouTube Channel, where you will find technological videos in Hindi, New Video is Posted Everyday :)"
"PXXFKpLvOpw","Mustafa Ali's ringside reunion with his daughter will melt your heart","2018-12-28T22:30:57.000Z","UCJ5v_MCY6GNUBTO8-D3XoAg","WWE","17","18.29.12","wwe,world wrestling entertainment,wrestling,wrestler,wrestle,superstars,कुश्ती,पहलवान,डब्लू डब्लू ई,मैच,सुपरस्टार,व्यावसायिक कुश्ती,مصارعه,Mustafa Ali,daughter,cute,WWE Family,WWE Families","207601","10948","293","929","https://i.ytimg.com/vi/PXXFKpLvOpw/default.jpg","False","False","Mustafa Ali shares a heartwarming ringside moment with his daughter during a memorable WWE Live Event in his hometown of Chicago.GET YOUR 1st MONTH of WWE NETWORK for FREE: http://wwenetwork.com---------------------------------------------------------------------Follow WWE on YouTube for more exciting action!---------------------------------------------------------------------Subscribe to WWE on YouTube: http://bit.ly/1i64OdTCheck out WWE.com for news and updates: http://goo.gl/akf0J4Find the latest Superstar gear at WWEShop: http://shop.wwe.com---------------------------------------------Check out our other channels!---------------------------------------------The Bella Twins: https://www.youtube.com/thebellatwinsUpUpDownDown: https://www.youtube.com/upupdowndownWWEMusic: https://www.youtube.com/wwemusicTotal Divas: https://www.youtube.com/wwetotaldivas------------------------------------WWE on Social Media------------------------------------Twitter: https://twitter.com/wweFacebook: https://www.facebook.com/wweInstagram: https://www.instagram.com/wwe/Reddit: https://www.reddit.com/user/RealWWEGiphy: https://giphy.com/wwe"
