video_id,title,publishedAt,channelId,channelTitle,categoryId,trending_date,tags,view_count,likes,dislikes,comment_count,thumbnail_link,comments_disabled,ratings_disabled,description
"GqMdbpYi5Yw","Viswasam - Official Motion Poster | Ajith Kumar, Nayanthara | Sathya Jyothi Films","2018-11-25T15:30:11.000Z","UCdbalkQDqCcOsYG5c4L8TAw","Sathya Jyothi Films","1","18.28.11","Viswasam Motion Poster,Viswsam Official Motion Poster,Ajith Motion Poster,Sathya Jyothi Films,Motion Poster,Ajith Kumar,Nayanthara,Siva,D Imman,viswasam,viswasam trailer,viswasam song,viswasam teaser,viswasam second look,viswasam tamil movie trailer,yogi babu,thambi ramaiah,thala,viswasam first look,ajith,thala ajith,thala latest,viswasam movie,tamil cinema,kollywood,ajith viswasam,viswasam official trailer,viswasam update,thala news","6465306","481430","56245","34908","https://i.ytimg.com/vi/GqMdbpYi5Yw/default.jpg","False","False","Presenting The Official Motion Poster of Viswasam Banner : Sathya Jyothi Films - T.G.Thyagarajan Presents. Cast: Ajith Kumar, Nayanthara, Jagapathi Babu, Vivek, Thambi Ramiah, Yogi Babu, Robo Shankar & Kovai Sarala.Director: Siva Music Director: D Imman Cinematography: Vetri Editor: Ruben Art : Milan Stunts : Dhilip Subrayan Choreography : Kalyan, Ashok Raja & BrindaLyrics : Thamarai, Viveka, Arun Bharathi & Yuga Bharathi Co Produced by : G Saravanan Costume Designer : Anu Vardhan & Dhatsha A PillaiExecutive Producer : Raahul Stills : Sittrarasu Co Writer : Adi Narayana Co Director : Raja Sekar Dialogues : Siva, Manikandan, Savari, Bakyaraj & ChandranPRO : Suresh Chandra, RekhaPublicity Designs : Anil & Bhanu Sound Design : Uday Kumar VFX : Harihara SuthanMake Up : Kuppusamy Producer : Sendhil Thyagarajan, Arjun Thyagarajan Follow us on Facebook - https://twitter.com/SathyaJyothiFilmsTwitter - https://twitter.com/SathyaJyothi_ Instagram - https://twitter.com/SathyaJyothiFilmsDigital Partner - Divo http://www.facebook.com/divomovies https://twitter.com/divomovies#ViswasamMotionPoster #Viswasam #AjithKumar"
"_sbkAFROsKc","96 Movie - Deleted Scene | Vijay Sethupathi, Trisha | Govind Vasantha | C. Prem Kumar","2018-11-27T12:28:26.000Z","UCLbdVvreihwZRL6kwuEUYsA","Think Music India","10","18.28.11","[none]","1521273","88791","1531","3588","https://i.ytimg.com/vi/_sbkAFROsKc/default.jpg","False","False","96 Movie | #DeletedScene96 | #VijaySethupathi, #Trisha | #GovindVasantha | C. Prem KumarMadras Enterprises presents 96 Tamil Movie#96 Ringback Tunes ► https://bit.ly/2woIXyuListen to #96 Songs now available:iTunes ► https://apple.co/2Nf3zQrSaavn ► https://bit.ly/2My4S0wGaana ► https://bit.ly/2MSuGny Wynk ► https://bit.ly/2o6bZOZHungama ► https://bit.ly/2MwHJvuRaaga ► https://bit.ly/2LnumIrJioMusic ► https://bit.ly/2woqr8LFor 96 Movie Ringback Tunes:#KaathalaeKaathalaeAirtel : DIAL 5432116564611Vodafone : DIAL 53710587459Idea : DIAL 5678910587459BSNL : SMS BT 10587459 To 56700#Konjam (Kaathalae Kaathalae)Airtel : DIAL 5432116564799Vodafone : DIAL 53710587458Idea : DIAL 5678910587458BSNL : SMS BT 10587458 To 56700#KaathalaeKaathalae Violin ThemeAirtel : DIAL 5432116564998Vodafone : DIAL 53710587455Idea : DIAL 5678910587455BSNL : SMS BT 10587455 To 5670096 is an Indian Tamil-language romance film written and directed by C. Prem Kumar who earlier handled the cinematography for Naduvula Konjam Pakkatha Kaanom, the film features #VijaySethupathi and #Trisha Krishnan in the lead role and the film is bankrolled by Nandagopal of Madras Enterprises. The music for the film is composed by Govind Vasantha, who is currently working in Balaji Tharaneetharan’s Oru Pakka Kathai and N. Shanmuga Sundaram is doing the cinematography.#96 Tamil Movie Crew:Starcast: Vijay Sethupathi, Trisha KrishnanBanner : Madras EnterprisesProducer : S. NanthagopalDirectior : C. Prem KumarMusic : Govind VasanthaDOP : Mahendiran Jayaraju, N. Shanmuga SundaramEditor : R. GovindarajAudio Label : Think Music© 2018 SPI Music Pvt. Ltd.For All Latest Updates:Subscribe to us on: http://www.youtube.com/thinkmusicindiaSubscribe to us on: http://www.dailymotion.com/thinkmusicindiaFollow us on: https://twitter.com/thinkmusicindiaLike us on: https://www.facebook.com/ThinkmusicofficialFollow us on: https://plus.google.com/+thinkmusicindiaFollow us on: https://www.instagram.com/thinkmusicofficial96 teaser, 96 movie teaser, 96 official teaser, 96 trailer, 96 official trailer, 96 movie trailer, 96 movie trailer, 96 movie trailer tamil, 96 tamil movie,tamil movie,tamil movies,96 tamil movie trailer,tamil full movie,96 movie,tamil,hit tamil movie,tamil comedy,movie,96 tamil movie teaser,96 tamil movie first look,tamil hd movies,tamil new movies,tamil songs,96 movie first look,tamil hd movie,tamil hit movie,new tamil movie,tamil cinema,latest tamil movie"
"oWG_BLt7vfU","Sukhe - I Need Ya | Feat Krystle D'Souza | Jaani | B Praak | Arvindr Khaira","2018-11-27T09:30:04.000Z","UC56gTxNs4f9xZ7Pa2i5xNzg","Sony Music India","10","18.28.11","Sony Music India,Sony Music,Latest Hits,I need ya,baby i need ya,sukhe i need ya,krystle dsouza i need ya,krystle dsouza song,sukhe new song,sukhe song 2018,sukhe krystle dsouza,jaani,b praak,arvindr khaira,latest song 2018,kya baat ay,harrdy sandhu,buzz,aastha gill","3030321","152914","7234","8103","https://i.ytimg.com/vi/oWG_BLt7vfU/default.jpg","False","False","Pop sensation and heartthrob of millions - Sukhe is back with his latest R&B hit I Need Ya  feat Krystle D'Souza - Indian TV's hottest actress. The video has been shot in exotic location of Dubai by Arvindr Khaira. The song has been penned down by Jaani & composed by B Praak. #INeedYa  #Sukhe #KrystleDsouzaListen To I Need Ya on Wynk : https://bit.ly/2zugF7tSong : I Need YaArtist : SukheStarring : Sukhe & Krystle D'SouzaLyrics : Jaani Music : B Praak Dubbing  & Mix : Saffron Studio , Punchkula (Akash & Guri)Video Director : Arvindr KhairaChief AD : Harman ButtarDOP : Al Ameel Editor : Zipsi  Production : Mirchi Entertainment DXB ( Dubai) / DJ SaadSytlist : Shreya Juneja (Krystle D'Souza)Casting : Shivam Gupta ( Krystle D' Souza)Stills : Ethasham SaeedPublicity Creatives / Designs : The Town MediaPresentation : Yogesh Dixit (YS Events)Label : Sony Music IndiaTo set I Need Ya as your caller tune : For exclusive updates on Punjabi latest songs connect -Facebook- https://www.facebook.com/SonyMusicNorthTwitter - https://twitter.com/sonymusicnorthInstagram - https://www.instagram.com/sonymusic_n...Audio on Sony Music Entertainment India Pvt. Ltd (C) 2018 Sony Music Entertainment India Pvt. Ltd."
"KCHbayx2O7I","FilterCopy | When You're The Only Single One In Your Group | Ft. Barkha Singh and Hira Ashar","2018-11-27T07:04:43.000Z","UC7IMq6lLHbptAnSucW1pClA","FilterCopy","23","18.28.11","filtercopy,filter copy,dice,dice media,pocket aces,netflix,prime video,single,couple,relationship,third wheel,pyaar,friends,friend circle,cupid,tinder,couple goals,forever alone,online dating,dating app,amit bhadana,ashish chanchlani,bb ki vines,harsh beniwal,elvish yadav,make joke of,buzzfeed,beyounick,mostlysane,trending video,funny video,tvf,tsp,girliyapa,timeliners,college romance,school romance","1424718","46374","2493","1741","https://i.ytimg.com/vi/KCHbayx2O7I/default.jpg","False","False","Woh ladka hai kaha?Match on Substance over Selfies! Download OkCupid here - http://bit.ly/2DF804WWRITER AAKASH SHEWAKARAMANI DIRECTOR KEENAN BURROUGHS DOP AJINKYA PANDIT ASSISTANT DIRECTOR PRANAV SINGHAAKASH SHEWAKRAMANI CREATIVE PRODUCER NISHAAD JAVERI PRODUCER HITESH PARDESHI  CAST (in alphabetical order) ARNAV BHASINAAKASH SHEWAKARAMANIBARKHA SINGHGUNIT COURHIRA ASHARROHAN VERMA EXECUTIVE PRODUCER LALIT VERMA  EDITOR UDIT CHANDRAUL COLOR GRADING AJINKYA PANDIT SOUND DESIGN SUDHANSHU GAUR GRAPHICS MANOJ OMRESHREYA SETHIGAURAV JHAMB  VIDEO OPERATIONS RAUNAK RAMTEKE  BRAND SOLUTIONS RAGINI ROYSHIVI SINGHSHREYA AGARWAL SPOT CHANDAN KUMAR MAKEUP AND HAIR  JANAK THAPAZOYA SHAIKH ART DIRECTORS ANAYA JOSHISHREYAS S. RAHEJASWAPNIL MURKUTE STYLIST RICHA MEHTA WARDROBE MAHENDRA R PRASAD WARDROBE COURTESY UNITED COLOURS OF BENETTONFOREVER 21FABALLEY CAMERA ATTENDANT AADESH SIDDHU LIGHT ATTENDANT AFTAB ALAMAFZAL KHANASIF SHAIKH SOUND RECORDIST SANDEEP PRAJAPATI"
"MWaGLOM29co","Pyaar Lafzon Mein Kahan Episode 110 (Final)","2018-11-26T14:13:20.000Z","UCSZCTqWb3uP7ozMaZnYOA-A","Pyaar Lafzon Mein Kahan","1","18.28.11","filmazia,pyar lafzon mein kahan,pakistan,hayat and murat,Pyaar Lafzon Mein Kahan Drama,hayat murat,phar lafzon urdu language,aşk laftan anlamaz,show tv,new episode,pyar lafzon mein kahan latest episode,pakistan tv,turkish serials,urdu dubbed,pyaar lafzon mein kahan final episode","1732703","32503","1555","12642","https://i.ytimg.com/vi/MWaGLOM29co/default.jpg","False","False","Follow Facebook Page → https://www.facebook.com/pyaarlafzonmeinkahanSubscribe → http://bit.ly/PyaarLafzonMeinKahanTurkish Drama Ask Laftan Anlamaz starting in Pakistan as Pyaar Lafzon Mein Kahan#Hayat#Murat#Pyaar#pyaarlafzonmeinkahan#LoveSeries"
"Kw_Mr221Sfs","Girly Girl 💄 VS. Tomboy 🧢 | Rickshawali","2018-11-27T03:30:00.000Z","UCRKaf2y19u6G4iwS5sskLvQ","Rickshawali","24","18.28.11","anisha,rickshawali,rikshawali,rikshawaali,funny,funny girl,indian youtuber,youtube india,desi youtuber,anishatalks,anisha dixit,girl vs tomboy,girly girl vs tomboy,tomboy,tomboy vs girly girl,rickhswali channel,rickshawali lifestyle,rickshawali videos,rickshawali hindi videos,funny indian videos,indian funny videos,indian funny videos 2018,normal girl vs tomboy,rickshawali girly girl vs tomboy,funny tomboy,funny girl videos,rickshawali best videos","507963","24639","2132","3223","https://i.ytimg.com/vi/Kw_Mr221Sfs/default.jpg","False","False","Get Your FOREO LUNA Mini 2 here: https://foreo.se/1wxckWhat type of Girl are you? Girly Girl or Tomboy?Hit the LIKE Button Ricksters and lets get this Video to 70k Likes!!!! And dont forget to Subscribe! ❤️👊🏽｡｡｡｡｡｡｡｡｡｡｡｡｡｡｡｡｡｡｡｡｡｡｡｡Cinematography: Leslie D'Souza →DID YOU LIKE THE VIDEO? GIVE IT A THUMBS UP 👍→SUBSCRIBE to my channel: http://bit.ly/Rickshawali→SHARE this Video if you liked it!I make Videos every Tuesdays & Fridays! →For Business Inquiries: anisha@rickshawali.com｡｡｡｡｡｡｡｡｡｡｡｡｡｡｡｡｡｡｡｡｡｡｡｡Chat with me on:→Instagram : http://bit.ly/Rickshagram→Facebook: http://bit.ly/rickshawali→Twitter: http://bit.ly/Rickshatweet→Snapchat ID: Rickshawali→Musically : @rickshawali→Google Plus: http://bit.ly/RickshaPLUSSEND ME STUFF:P.O. Box 19847Bandra West Post OfficeMumbai - 400050IndiaWATCH IT, LIKE IT & SHARE IT and spread Rickshawali's Happiness! :-)"
"erl2J31seHA","Seetha | Flowers | Ep# 487","2018-11-27T11:30:00.000Z","UCSrS91iCgFCv_3KwjWWHzSg","Flowers TV","24","18.28.11","flowers serials,actress,malayalam serials,flowers tv malayalam,flowers tv,Seetha,Latest Serial,Seetha serial","298326","1218","673","0","https://i.ytimg.com/vi/erl2J31seHA/default.jpg","True","False","Mon- fri, 06.30 PM Only On Flowers.================================Don't miss even a single episode of Seetha =================================Flowers Comedy  -http://j.mp/flowerscomedyFlowers On Air      -http://j.mp/flowersonairOur Social Media Facebook- https://www.facebook.com/flowersonair Twitter     https://www.twitter.com/flowersonairGoogle Plus -https://plus.google.com/+FlowerstvIndia"
"pwZypSxvSGI","Types of MARRIAGE Proposals .. | #Fun #Sketch #Roleplay #Anaysa #ShrutiArjunAnand","2018-11-27T13:00:13.000Z","UCIsotCCdTjStPCLyD9iBCCQ","Shruti Arjun Anand","26","18.28.11","shruti,shruti anand,shruti arjun anand,shrutiarjunanand,expectation,reality,comedy,vlogger,blogger,expectations,funniest,mymissanand,expectations vs reality,vlogs,funny,vloggers,family,miss anand,blogging,roleplay,types of moms,laugh,how to vlog,kids,family vlog,skit,fun,sketch,family vlogs,real life,rich vs poor,rich,poor,normal,hot girl,funny girl,role play,rinky,my miss anand,desi,desi girl,marriage,wedding,proposals,types of people","393967","34002","1160","2801","https://i.ytimg.com/vi/pwZypSxvSGI/default.jpg","False","False","Follow on Instagram: https://tinyurl.com/ShrutiArjunAnandIndian marriages are full of entertainment; Especially if we are talking about arrange marriage as in those cases the fun starts with the very first meeting when families meet each other to checkout the groom and bride. If you have enjoyed this & want me to do Part-II then target hai 1,50,000 LIKES & I am sure you'll relate to this video and if you do then do SHARE it with your friends & relatives. COMMENT below your most favourite sequence & also what was yours most FUNNY or WEIRD moment during that phase?CHECKOUT All My AWESOME Channels: SUBSCRIBE To ShrutiArjunAnand - https://goo.gl/1gmCTASUBSCRIBE To ShrutiVlogs - https://goo.gl/00seNeSUBSCRIBE To Anaysa - https://goo.gl/5A2h93SUBSCRIBE To MyMissAnand - https://goo.gl/mnBhXgSUBSCRIBE To CookWithNisha - https://goo.gl/Kep2iSSUBSCRIBE To LafanGAY - https://goo.gl/XRHDrqCAMERA CREDITS:https://instagram.com/extremepictureimagecreation~ XoXo~ Shruti NEW UPLOADS Tuesday & Friday!▷ CONNECT with us!!♥ ♥ YOUTUBE ♥ ♥ https://www.youtube.com/user/shrutiarjunanand♥ ♥ WEB ♥ ♥ http://www.shrutiarjunanand.com/♥ ♥ INSTAGRAM ♥ ♥ https://www.instagram.com/shrutiarjunanand/♥ ♥ FACEBOOK ♥ ♥ https://www.facebook.com/shrutiarjunanand/♥ ♥ TWITTER ♥ ♥ https://twitter.com/shruti_ilim♥ ♥ SNAPCHAT ♥ ♥ @Shruti_ILIM♥ ♥ BUSINESS INQUIRY ♥ ♥ contactus@shrutiarjunanand.comAUDIO DISCLAIMER/CREDITS –Music from Epidemic Sound (http://www.epidemicsound.com)DISCLAIMER: All products used in my videos, regardless of whether the video is sponsored or not, are the products that I love using unless otherwise stated in case of first impression reviews. The information provided on this channel is for general purposes only and should NOT be considered as professional advice. We are not a licensed professional or a medical practitioner so always make sure you consult a professional in case of need. We always try to keep our channel and its content updated but we cannot guarantee it. All opinions expressed here are our own and we are not compensated by any brand, advertiser, PR representative or affiliate for the same unless explicitly stated in our videos and/or description box. We never try to push products on anyone but we do make recommendations based on our personal experience. All the content published on this channel is our own creative work and is protected under copyright law and in case you need to use our content for any purpose please write to us - contactus@shrutiarjunanand.com *  blogger comedy funniest family channel good vs  hilarious vlogging a day in my life miss anand funy vlogger vloggers new year good vs blogging anantya roleplay how to vlog indian youtuber hindi vlog in real life sketch women's health monthly rinky"
"RcfFW8sxnKQ","Bharathi Vishnuvardhan Sends Lunch For Ambareesh's House","2018-11-27T11:39:40.000Z","UCjElJyiXmQXnWmceQ1JyKrA","Suvarna News | ಸುವರ್ಣ ನ್ಯೂಸ್","25","18.28.11","Kannada News,Kannada News Channel,Kannada Live TV,Karnataka News,Sports News,Karnataka Local News,Karnataka Business News,Karnataka Politics,Sandalwood News,Kannada Celebrity News,Kannada Live Streaming,Karnataka Live Channel,Bharathi Vishnuvardhan,Sends,Lunch,Ambareesh's House","256162","1124","93","40","https://i.ytimg.com/vi/RcfFW8sxnKQ/default.jpg","False","False","Bharathi Vishnuvardhan Sends Lunch For Ambareesh's HouseVisit Us at: ►Facebook: https://www.facebook.com/SuvarnaNews ►Twitter: https://twitter.com/SuvarnaNewstv ►Website: http://www.suvarnanews.comCheck out the latest news from Karnataka, India and across the world. Latest Trending news on Sandalwood, Politics, Business, Cricket, Technology, Automobile, Lifestyle & Health and Travel. More on suvarnanews.com► SUBSCRIBE OUR CHANNEL : https://goo.gl/8eNAWQ"
"yotCyfbVmRs","Ronny Bhaiya meets Kaleen Bhaiya | Amazon Prime Video","2018-11-26T18:51:44.000Z","UCkS7Vxu4PjM99w0Is6idjcg","Zakir Khan","23","18.28.11","stand up comedy,zakirkhan,zakir,khan,amazon prime video,amazon prime,Podcast,interview,pankaj tripati,mirzpur,kaksha gyarvi","1581458","72935","875","3060","https://i.ytimg.com/vi/yotCyfbVmRs/default.jpg","False","False","Bas ek din Zakir gaye milne Pankaj ji se, aur baaton baaton mein purani yaadien taaza hogayi. #KakshaGyarvi #Mirzapur #StreamNow #AmazonPrimeVideoMirzapur Stream Now: https://amzn.to/MirzapurOutNowKaksha Gyarvi Stream Now: https://amzn.to/2zoEgq7"
"o4PUW8OLcew","Jawani : Guri (Official Song) Deep Jandu | Gangland In Motherland | Latest Punjabi Songs | Geet MP3","2018-11-26T12:30:29.000Z","UClZF7OsrECe3t_ADrjZEh_Q","Geet MP3","10","18.28.11","jawani,jawani song,guri jawani,jawani guri,guri new song,guri,guri songs,deep jandu,deep jandu music,deep jandu new song,gangland in motherland,gangland","4222151","167770","6803","11097","https://i.ytimg.com/vi/o4PUW8OLcew/default.jpg","False","False","GeetMp3 & The Theater Army Films 🎥 Subscribe To Our New Channel For New Songs  : http://bit.ly/SubscribeGEETMP3Also Available On Gaana : http://bit.ly/2r5HFFIThe Gangland in Motherland 🔥 Punjabi Webseries 1st Episode 19 December Song :Jawani Singer : Guri Lyrics : Golla ManawanMusic : Deep Jandu Gangland In Motherland Casting Dirctor/Story :- Gabbar Sangrur Screenplay:- Gabbar & Baljit NoorProducer :- KV Dhillon Starring :- Nishawn Bhullar - Mehtab Virk - Vadda Grewal-  Yaad Grewal - Japji Kharia - Victor Jhon - Navdeep Kaler Editor : Sarabjeet Sohalcinematography : Shoeb SiddiquiSingers ;- Nishawn Bhullar - GURI- Jass Manak - Vadda Grewal- Mehtab Virk Music :- Deep Jandu - Sharry Nexus - Game Changerz Background:- Mix Singh Online Promotion:- GK DigitalMusic Label : Geet MP3Music Consultant & Digital Partner : Gk.DigitalInstagram : https://www.instagram.com/GK.DIGITALEnjoy and stay connected with us 📲https://www.youtube.com/channel/UClZF7OsrECe3t_ADrjZEh_Q/joinWebsite : http://GeetMP3.comYouTube : https://www.youtube.com/c/GeetMP3 Facebook : https://www.facebook.com/GEETMP3OFFICIALInstagram : https://www.instagram.com/GEETMP3Twitter : https://twitter.com/GEETMP3SnapChat : https://www.snapchat.com/add/GEETMP3"
"639XNYG7RIU","छावनी बन गई Ayodhya, चप्पे-चप्पे पर तैनात की गई पुलिस","2018-11-25T02:45:10.000Z","UCjFKMoAk3qhRkW4eOqNm6dw","Zee Hindustan","25","18.28.11","Zee Hindustan,Zee,Zee hindustan news,Zee Hindustan channel,latest news,breaking news,Indian News,political news,UP news,Hindi News,Z Hindustan,Z Hindustan News,Viral Videos,Exclusive,Vishva Hindu Parishad,Uttar Pradesh,shiv sena,security,Ram temple,Ayodhya,VHP,VHP Ram mandir,Ayodhya Ram temple,Ayodhya controversy,babri,VHP meeting,Dharm Sabha","3149073","17522","6055","5177","https://i.ytimg.com/vi/639XNYG7RIU/default.jpg","False","False","वीएचपी की अयोध्या में धर्मसभा को देखते हुए कड़ी सुरक्षा व्यवस्था की गयी है. अयोध्या रेड और येलो जोन में बांटा गया है. कई आला अधिकारियों को सुरक्षा व्यवस्था की जिम्मेदारी सौंपी गयी है. सुरक्षा का जिम्मा सीआरपीएफ और पीएसी को दिया गया है और अतिरिक्त सिविल पुलिस फोर्स की भी तैनाती की गयी है...--------------------------------------------------About ChannelZee Hindustan believes that states make the Nation। The channel will cover content from various states beyond the National capital or metropolitan cities। ZEE हिंदुस्तान will flash more than 1500 news throughout the day।--------------------------------------------Subscribe Zee Hindustan: https://bit.ly/2JOMjyGYou can also visit us at:http://zeehindustan.tv/Like us on Facebook:https://www.facebook.com/ZeeHindustanFollow us on Twitter:https://twitter.com/Zee_HindustanConnect with us at Instagram:https://www.instagram.com/zee_hindustan"
"3xsOg1hSeYU","Top Singer | Musical Reality Show | Flowers | Ep# 39","2018-11-27T11:30:00.000Z","UCmAPdImtXLGh5E-lTTH4Qmg","Flowers Comedy","24","18.28.11","flowers tv,flower tv malayalam,kerala,talent,malayalam,entertainment,malayalam cinema,flowers top singer,top singer flowers,top singers,reality television (tv genre),talent show","589912","8560","658","1036","https://i.ytimg.com/vi/3xsOg1hSeYU/default.jpg","False","False","Join us on Facebook- https://www.facebook.com/flowersonair Twitter     https://www.twitter.com/flowersonairGoogle Plus -https://plus.google.com/+FlowerstvIndia"
"i-m1Avnz7EQ","Hockey World Cup Opening Ceremony: Grand Entry of Superstar Shah Rukh Khan","2018-11-27T15:05:41.000Z","UC90RW5ZmBBqp4r2QIQxfACA","Kanak News","25","18.28.11","odisha news,odisha latest news,Odisha Latest,latest news,odisha politics,odia famous people,Orissa News,Orissa Latest News,Orissa Latest,bhubaneswar,kanak news,puri,cuttack,hockey world cup,shah rukh khan,shahrukh khan in bhubaneswar,shahrukh khan performance,shahrukh khan in bbsr","435323","8291","427","478","https://i.ytimg.com/vi/i-m1Avnz7EQ/default.jpg","False","False","For latest Odisha News Follow us:Visit: http://kanaknews.com/YouTube: https://www.youtube.com/user/kanaktvonlineTwitter: https://twitter.com/kanak_newsFacebook: https://www.facebook.com/KanakNewsPlaylists-Big Debate- https://www.youtube.com/watch?v=FThjqCRJXQE&list=PLAfchLMlcCeXro0DaMSfVSS4Q-Q_jhTBbOne to One-https://www.youtube.com/watch?v=OvDWzu1jCco&list=PLAfchLMlcCeUPb0xj4SZtmDbVvP0iF-14Wah Wah Re Camera:https://www.youtube.com/watch?v=Irb_JGSPoy4&list=PLAfchLMlcCeVIdigqHVRt_EWaoZsBj_J1Loka Nakali Katha Asali:https://www.youtube.com/watch?v=zuAo6OBmyfA&list=PLAfchLMlcCeXzGOLmXc4K87EMc3hiyiezManoranjan Mishra Live:https://www.youtube.com/watch?v=jofnsNMsPes&list=PLAfchLMlcCeWfFRDWkNmLVnc2LeGp3oQ8Olta Palta: https://www.youtube.com/watch?v=ugFvlXgx6Bk&t=25s&index=1&list=PLAfchLMlcCeWQAqH87Cqo944_01LQP6eC #KanakNews"
"2vEX0EYyGnU","Avalum Naanum | 26th November to 1st December 2018 - Promo","2018-11-26T06:15:19.000Z","UCvrhwpnp2DHYQ1CbXby9ypQ","Vijay Television","24","18.28.11","Vijay Matinee,VijayTV,VijayTelevision,StarVijayTV,StarVijay,TamilTV,Redefining Entertainment,Avalum Naanum,Thiya,Nila,Diya,அவளும் நானும்","712893","3113","201","118","https://i.ytimg.com/vi/2vEX0EYyGnU/default.jpg","False","False","#AvalumNaanum #Thiya #Diya #Nila  #VijayTV #VijayTelevision #StarVijayTV #StarVijay #TamilTV #அவளும்_நானும் | திங்கள் முதல் சனிக்கிழமை வரை மதியம் 1:30 மணிக்கு உங்கள் விஜயில்.. Click here http://www.hotstar.com/tv/avalum-naanum/16760 to watch the show hotstar."
"4RmpQ1fPKh4","Kohli, Krunal secure series-levelling win | Third Gillette T20","2018-11-25T13:13:15.000Z","UCkBY0aHJP9BwjZLDYxAQrKg","cricket.com.au","17","18.28.11","Australia,India,SCG,T20,third T20,highlights,Virat Kohli","8682508","89843","4532","6681","https://i.ytimg.com/vi/4RmpQ1fPKh4/default.jpg","False","False","Krunal Pandya took four wickets before Virat Kohli built on a fast start by India’s openers to steer the tourists home in front of a huge crowd at the SCG"
"4CbLXeGSDxg","The Lion King Official Teaser Trailer","2018-11-22T22:32:21.000Z","UCuaFvcY4MhZY3U43mMt1dYQ","Walt Disney Studios","1","18.28.11","disney,the lion king,lion king,lion,jon favreau,trailer,hd,1080p,donald glover,beyonce,beyonce knowles,beyoncé,beyonce knowles-carter,childish gambino,billy eichner,seth rogen,john oliver,james earl jones","46365422","1191195","36739","109505","https://i.ytimg.com/vi/4CbLXeGSDxg/default.jpg","False","False","Disney's The Lion King opens in theatres July 19, 2019. From Disney Live Action, director Jon Favreau’s all-new “The Lion King” journeys to the African savanna where a future king must overcome betrayal and tragedy to assume his rightful place on Pride Rock."
