video_id,title,publishedAt,channelId,channelTitle,categoryId,trending_date,tags,view_count,likes,dislikes,comment_count,thumbnail_link,comments_disabled,ratings_disabled,description
"mVTnElCYSTQ","New Year Special | Best Videos of 2018 | Motivational Compilation of Speeches by Him eesh Madaan","2018-12-28T14:30:00.000Z","UCZQDF0x18Xe6RZayvod99zA","Him-eesh Madaan","27","18.29.12","best of 2018,motivational compilation,best motivational speech,best motivation,compilation of best motivational speeches,winners mindset,in hindi,never give up,business motivation,student motivation,hindi motivation,success motivation,speeches,2019,new year motivation,compilation for success,compilation of motivational videos,compilation motivation,confidence motivation,success habits in hindi,power of mind,him eesh madaan,ideas,business,study","40513","5006","47","369","https://i.ytimg.com/vi/mVTnElCYSTQ/default.jpg","False","False","Watch this power packed motivational video which will give you inspiration to step in new year of 2019 with compilation of motivational speeches of 2018. This hindi motivation video has a compilation of best videos of 2018 for business, students and overall success in life. This year of 2018 was a year of motivation as you all gave great love to our videos of power of subconscious mind, business ideas, morning motivation etc. We look forward to 2019 with more action and determination to build strong habits and winners mindset. Wishing you all a very happy new year..!Curated by: Team Himeesh Madaan►Follow us on Instagram: https://www.instagram.com/himeeshmadaan/►Like Us On Facebook: https://www.facebook.com/himeeshmadaan/►Follow us on Twitter: https://twitter.com/himeeshmadaanYou can watch more related videos:► Earn Money Online: https://www.youtube.com/watch?v=f-ZaCG3nxZo► This Music Will Change Your Life: https://www.youtube.com/watch?v=gewWRVyGnIA#motivationalvideosinhindi #newyear2019 #himeeshmadaan"
"FUwm9faQuWc","Ab Dekh Khuda Kia Karta Hai - Episode 23 | HAR PAL GEO","2018-12-25T16:00:01.000Z","UCe9JSDmyqNgA_l2BzGHq1Ug","HAR PAL GEO","24","18.29.12","Ab Dekh Khuda Kia Karta Hai,HAR PAL GEO,Episode 23","2440252","17827","2123","5084","https://i.ytimg.com/vi/FUwm9faQuWc/default.jpg","False","False","Ab Dekh Khuda Kia Karta Hai - Episode 23 | HAR PAL GEOAb Dekh Khuda Kiya Karta Hai, is based on the life of a fraudulent businessman Jan-e-Alam who manipulates young innocent girls who are chronically jobless, by giving them a job and subjecting them to improper advances. Many women working under Jan-e-Alam are constantly harassed, subjected to assaults, and slandered when they refuse the advances of their boss. Maryam, the female protagonist, also gets victimized by him. When she refuses to comply with his inappropriate demands, he traps her in a business scam and gets her jailed. Maryam manages to get herself out but unfortunately she keeps finding herself under the threat of her malicious ex employer who doesn’t seem to stop making her life miserable.  In a society, where it is so easy for a young girl to lose her dignity and to stain her reputation because of uncontrollable circumstances, will Maryam ever get riddance from sick minded Jan-e-Alam?Written by: Syed Ameer Ali Shah Hussaini Directed by: Syed Ali Raza UsamaProduced by: Babar JavedCast with respective character names: Danish Taimoor (Jaan-e-Alam), Sanam Chaudhry (Maryam), Humayoun Ashraf (Shaan-e-Alam), Qavi Khan (Naseer), Sajida Syed (Firdous), Rashid Farooqui (Malik), Parveen Akbar (Shaista), Yashma Gill (Noor Saba), Maryam Noor (Erum), Ali Rizvi (Hammad), Salah Uddin Tunio (Minister), Talat Iqbal (Ashfaq), Farzana Thaeem (Salma).For More Videos Subscribe YouTube - https://www.youtube.com/harpalgeo#ADKKKH#harpalgeo#GEO"
"4tJJnC26_uw","2018, in 5 minutes","2018-12-28T13:00:00.000Z","UCLXo7UDZvByw2ixzpQCufnA","Vox","25","18.29.12","year in review,Vox.com,vox,explain,explainer,Vox 2018,2018 vox,2018 in 5 minutes,2018 rewind,2018 summary,2018 roundup,2018 review,2018 year in review,2018 year in review vox,2018 vox year in review,vox year in review 2018,2018 highlights,2018 politics,2018 culture,2018 memes,2018 new developments","688410","71217","4150","6795","https://i.ytimg.com/vi/4tJJnC26_uw/default.jpg","False","False","Another year, another end-of-year video.Become a member of the Vox Video Lab! https://www.vox.com/joinVox.com is a news website that helps you cut through the noise and understand what's really driving the events in the headlines. Check out http://www.vox.com.Watch our full video catalog: http://goo.gl/IZONyEFollow Vox on Facebook: http://goo.gl/U2g06oOr Twitter: http://goo.gl/XFrZ5H"
"e9GpPdiET3w","What Alpesh Kathiriya says after getting slapped by traffic cop? - Zee 24 Kalak","2018-12-28T07:48:04.000Z","UCkNL_TQio--h85-14lUVY3A","Zee 24 Kalak","25","18.29.12","Zee24KalakNews,Zee24Kalak,ZeeVideo,ZeeMedia,ZeeNews,ZeeGujarati,GujaratiNews,NewsinGujarat,Gujarat","16408","158","17","0","https://i.ytimg.com/vi/e9GpPdiET3w/default.jpg","True","False","What Alpesh Kathiriya says after getting slapped by traffic cop? Stay connected with us on social media platforms:Subscribe us on YouTubehttps://goo.gl/5v9imZLike us on Facebookhttps://www.facebook.com/zee24kalak.in/Follow us on Twitterhttps://twitter.com/Zee24KalakYou can also visit us at:http://zeenews.india.com/gujarati"
"sj_C8YaQrbY","Lakshmi Stores | 24-December-2018 | Sun TV Serial","2018-12-26T11:17:32.000Z","UCBnxEdpoZwstJqC1yZpOjRA","Sun TV","24","18.29.12","SunTV,SunTvTamizh,Tamil Channel,Lakshmki Stores,Lakshmi Stores Serial,Kushbu,Kushboo","313300","1622","277","153","https://i.ytimg.com/vi/sj_C8YaQrbY/default.jpg","False","False","Steps to avail 20% Discount on Sun NXT subscription: 1. Logon to http://bit.ly/YT20OFFER or Download Sun NXT android app from Play Store.2. Click on any video content & Sign up or Sign in.3. Enter the Coupon YT20 in the Coupon Code option in Subscription Pop-Up.4. Complete your payment on discounted price.          * Offer applicable only for Quarterly & Yearly packs.5. iPhone customers can avail the discount from your browser onlyT&C Apply.Enjoy Sun NXT. T&C:PFB updated TnC. * This discount offer is not applicable for users from US.*  The discount is applicable only for new purchases and not for renewals.*  The renewals for the discounted purchase will be on the actual cost.*  Offer applicable only for Quarterly & Annual Packs.*  Offer not applicable for users paying via iTunes.Episode Details:Watch Lakshmi Stores - 24-December-2018Synopsis:Lakshmi Stores is a family drama serial on SunTV.  Mahalingam is the family’s patriarch and founder of the traditional textiles showroom, Lakshmi Stores,  but guilt stricken with a past secret. His daughter-in-law, Mahalakshmi, nurtures the family and the close-knit staff with her selfless love. But she gets disowned by her husband, when she seeks justice for Bhakiyalakshmi, a kind-hearted young woman and earns the wrath of a vengeful MP Shakunthaladevi, as well. Now Mahalakshmi is faced with an uphill task to save Lakshmi stores and reunite with her family."
"63w7wFBhRiY","Vishal Warning to Sriya Reddy | Pogaru Telugu Movie Scenes | Reema Sen | Sri Balaji Video","2018-12-26T08:09:40.000Z","UCoy3dQzEdq1y2zMnT4pdj3Q","SriBalajiMovies","24","18.29.12","Vishal Warning to Sriya Reddy,Pogaru,Pogaru Movie Scenes,Vishal Krishna,Reema Sen,Sriya Reddy,Manoj K. Jayan,Vadivelu,Vinayakan TK,Telugu Movie Scenes,South Movie Scenes,Tarun Gopi Movies,Vishal Telugu Movies,Reema Sen Movies,Sri Balaji Video","220676","545","121","15","https://i.ytimg.com/vi/63w7wFBhRiY/default.jpg","False","False","Watch Pogaru Movie Scenes, Starring Vishal Krishna, Reema Sen, Sriya Reddy, Manoj K. Jayan, Vadivelu, Vinayakan TK, I.M. Vijayan & The Movie Directed Tarun Gopi.#Vishal  #SriyaReddy #ReemaSen ☛ Subscribe to YouTube Channel: http://goo.gl/tEjah☛ Like us on Facebook: https://www.facebook.com/sribalajivideo☛ Circle us on G+: https://plus.google.com/+SriBalajiMovies☛ Like us on Twitter: https://twitter.com/sribalajivideos☛ Visit Our Website: http://www.sribalajivideo.comFor more Entertainment Channels► Telugu Full Movies: http://tinyurl.com/pfymqun► Telugu Comedy Scenes: http://goo.gl/RPk9x► Telugu Video Songs: http://goo.gl/ReGCU► Telugu Action Scenes: http://goo.gl/xG9wD► Telugu Latest Promos: http://goo.gl/BMSQs"
"fsuRuq8eL8w","கேட்டது 15000 கோடி...கொடுத்தது 173 கோடி! | Gaja Cyclone | தி இம்பர்ஃபெக்ட் ஷோ‌ 28/12/2018","2018-12-28T13:30:01.000Z","UCEhsOgK2u8GDDoynMCj78Ng","Vikatan TV","25","18.29.12","Vikatan vikatantv vikadan tamilnadu politics vikatanwebtv,the imperfect show,vikatan imperfect show,imperfect show vikatan,imperfect show,gaja cylone funds,ops,eps,modi,mekadatu issue","57001","1752","92","508","https://i.ytimg.com/vi/fsuRuq8eL8w/default.jpg","False","False","எவன் பார்த்த வேலடா இது 10:20 இன்றைய கீச்சுகள் 11:07 இன்றைய விருது 11:35கஜா புயல் தமிழகத்துக்கு ₹173 கோடி ஒதுக்கீடு! குட்கா வழக்கு : 4 காவல் அதிகாரிகளிடம் 3வது நாளாக சிபிஐ விசாரணை! தேர்தல் பரப்புரைக்கு  விஜயகாந்த் வருவார் - விஜயபிரபாகரன்! ஆந்திரா சித்தூரில் 5 ம் வகுப்பு மாணவர்களை ஆடையின்றி நிற்க வைத்து தண்டனை!விகடன் யூட்யூப் சேனலில் சிபி, சரண் நகைச்சுவையாக தொகுத்து வழங்கும் நிகழ்ச்சி ” தி இம்பர்ஃபெக்ட் ஷோ”. சில முக்கிய அன்றாட அரசியல் மற்றும் பொது நிகழ்வுகளை அறியவும், வெளி வராத சில ரகசியங்களை தெரிந்துகொள்ளவும், அரசியல் தெளிவு பெறவும் இந்த நிகழ்ச்சி உதவும்! #TheImperfectShowVikatan App : http://bit.ly/2Sks6FGSubscribe Vikatan Tv : https://goo.gl/wVkvNpCREDITSHost -Saran & Sha  | Script - Vikatan Team | Camera - Suresh   | Edit -Dinsa| Producer - Karthick.K |Co - Producer - Vivek"
"T625yibJTds","Lagira Zhala Jee | Marathi Serial | EP 524 - Best Scene | Dec 21, 2018 | Zee Marathi","2018-12-28T01:30:02.000Z","UC82o9tQyo_cJhtyoFi-ROEw","Zee Marathi","24","18.29.12","Lagira Zhala Jee,Marathi Serial,Ajinkya Shinde,Ajya,Sheetal,Bhaiyyasaheb,Jamya,Jaydi,Vipin Borate,Vikya,Full Episode,Latest Epsidoe,All Episodes,Superhit Marathi Serial,Watch Online,HD,Zee Marathi,Lagira Zhala Jee Marathi Serial,Drama,Action,Romance,Popular Marathi Serials,Marathi Tv Serial,Zee 5,lagir zal ji today episode","39201","130","18","2","https://i.ytimg.com/vi/T625yibJTds/default.jpg","False","False","ZEE5 Now available in 190+ countries. Click Here http://bit.ly/WatchNowOnZEE5 To watch FULL episode of Lagira Zhala Jee, CLICK here - https://www.zee5.com/tvshows/details/lagira-zhala-jee/0-6-339The feel of your language is in your entertainment too! Watch your favourite TV shows, movies, original shows, in 12 languages, because every language has a super feel!To Feel ZEE5 in Your Language, DOWNLOAD the app now - Playstore: https://play.google.com/store/apps/details?id=com.graymatrix.did- iTunes: https://itunes.apple.com/in/app/ozee-tv-shows-movies-more/id743691886Visit our website - https://www.zee5.com Connect with us on Social Media: - Facebook - https://www.facebook.com/ZEE5/ - Instagram - https://www.instagram.com/zee5 - Twitter - https://twitter.com/ZEE5India#Lagira_Zhala_Jee is a #Marathi romantic drama starring Nitish Chavan, Shivani Baokar and Kiran Dhane. The story revolves around Ajinkya, a youngster from #Satara, who aspires to join the #Indian_Army. He falls in #love with Sheetal, a free-spirited girl, however, his #aspirations come in between their love. Will Ajinkya #sacrifice his dream for his love?"
"ac379F2ZRDk","కెసిఆర్ లెవెల్ ఏంటి చంద్రబాబు రేంజ్ ఏంటి తేల్చి పారేసిన అఖిలేష్ | Akhilesh Yadav Comments | Taja30","2018-12-28T01:07:16.000Z","UCk_LLcOS5hWWgcMHH87HCNA","Taja30","25","18.29.12","telugu news,telugu live news,taja30,kcr,chandrababu,cm chandrababu,cm kcr,కెసిఆర్ లెవెల్ ఏంటి చంద్రబాబు రేంజ్ ఏంటి తేల్చి పారేసిన అఖిలేష్,Akhilesh Yadav Comments,national parties,anti BJP parties,anti Modi","123648","6077","973","1186","https://i.ytimg.com/vi/ac379F2ZRDk/default.jpg","False","False","కెసిఆర్ లెవెల్ ఏంటి చంద్రబాబు రేంజ్ ఏంటి తేల్చి పారేసిన అఖిలేష్ | Akhilesh Yadav Comments | Taja30Taja30 channel is a product of www.taja30news.com. In the Ocean of Youtube, Taja30 brings you the quality video content. It mainly focus on Telugu News, Telangana Politics, AndhraPradesh Politics, Telangana Elections, Telugu live news, Telugu Live  of famous Politicians like CM ChandraBabu Naidu, Cm KCR, YS Jagan , Pawan kalyan, Narendra Modi. It covers various Political Party News of TDP Party, Janasena Party, YSRCP Party, BJP Party, TRS Party, Congress Party and most important happeings around the world. To get the updates subscribe to Taja30https://www.youtube.com/channel/UCk_LLcOS5hWWgcMHH87HCNA"
"QOY4FL3iWpA","PUBG | Prank | Real Life | Yeh Kar Ke Dikhao","2018-12-27T13:30:00.000Z","UCAOUvZhWsj2D9xw3ImHA1sw","Red FM India","24","18.29.12","ashish chanchlani exam vine,pubg,pubg movie,ashish pubg,ashish pubg video,pubg new video,ashish chanchlani pubg,pubg funny video,indian pubg video,pubg vine,pubg ek game katha,science vs commerce,pubg live,pubg pro,pubg pro tips,s.p gamer live,s.p gamer pubg,ace gameplay pubg,ace,pubg mobile,pubg india,pubg mobile india tournament,RANK PUSH TO CONQUEROR,PUSH,TO,CONQUEROR,ACE,CROWN,custom rooms in pubg mobile live,custom rooms pubg live","236032","16079","594","827","https://i.ytimg.com/vi/QOY4FL3iWpA/default.jpg","False","False","Now Enjoy your favorite show on the Red FM APP. Download NOW: https://goo.gl/2kJKsnFollow your favorite RJ's at: https://www.redfmindia.in/ Connect with us at our social media handles Facebook: https://www.facebook.com/redfmindiaTwitter: https://twitter.com/RedFMIndiaInstagram: https://www.instagram.com/redfmindiaYoutube: https://www.youtube.com/935RedTv"
"Zlng2c-i-y4","Prabhas, Anushka and Rajamouli Dance @ SS Rajamouli Son Marriage - Filmyfocus.com","2018-12-28T13:41:33.000Z","UCAQk_zAuaksl_3p6lDmaNUQ","Filmy Focus","24","18.29.12","Prabhas,Prabhas Dance,Prabhas dance at Rajamouli Son Marriage,Prabhas and rajamouli Dance at Rajamouli Son marriage,Prabhas and Anushka,Prabhas and Anushka Dance,Prabhas and Anushka dance performance,Prabhas and Anushka at Rajamouli Son Marriage,Prabhas and Anushka Dance @Rajamouli Son marriage,Rajamouli Dance,Rajamouli Funny Dance,Rajamouli Son marriage,Rajamouli Son Wedding,NTR,Anushka,Anushka at Rajamouli Son marriage,Pranushka,Saaho Teaser,Karthikeya marriage","81562","957","42","45","https://i.ytimg.com/vi/Zlng2c-i-y4/default.jpg","False","False","Prabhas, Anushka and Rajamouli Dance @ SS Rajamouli Son Marriage. #PrabhasDance #AnushkaDance #RajamouliDanceFilmy Focus is your one stop shop for #TeluguMovieNews. Come engage with the latest movie updates, videos, movie gossip and more. For more updates about Tollywood:☛ Visit our Official website: http://filmyfocus.com/☛ Visit our infotainment partner : http://Wirally.com☛ Subscribe to our Youtube Channel - http://goo.gl/z5qwPVEnjoy and stay connected with us!!☛ Like us: https://www.facebook.com/FilmyFocus☛Follow us : http://www.twitter.com/FilmyFocus☛ Follow us : https://www.instagram.com/filmyfocus☛ Circle us : http://goo.gl/IH0oCE"
"wPLZfvVF13Q","WWE LOW BLOWS are Real Or Fake ? Why Low Blows Used in WWE ? WWE Low Blow in 2018 in Hindi","2018-12-28T14:34:44.000Z","UCetiwiWVoUBvIHIzYFaEiEw","Wrestle Chatter","24","18.29.12","wwe low blow,wwe low blows,shinsuke nakamura low blows,shinsuke nakamura low blows aj,wwe low blows are real or fake,wwe real or fake in hindi,wwe low blows reaction,aj styles low blowed,wwe,low blow,low blows,wwe low blow hurt,wwe asli hai ya nakli,wwe fake moments,wwe low blows match","39230","5270","321","571","https://i.ytimg.com/vi/wPLZfvVF13Q/default.jpg","False","False","If You are Fan of WWE, You Should know About Low blow, Low Blow are real or fake in hindi And Why Heel Superstars Use this Cheap Move ?#LowBlow #WWE #WrestleChatterWWE LOW BLOW are Real Or Fake ? Why Low Blows Used in WWE ? WWE Low Blow in 2018 !My Second Channel For Masala Videos [ The RohiTreasure ] :- https://www.youtube.com/channel/UCJWATIXQplD0NUiFSqEpLngSocial Accounts:-Facebook:-  https://facebook.com/wrestlechatterInstagram:- https://instagram.com/wrestlechatterTwitter:-       https://twitter.com/wrestle_chatterMusic Credit-https://goo.gl/ZavNjAPhoto Credit-https://www.wwe.com/  (WWE)If you like our videos, PLEASE don't forget to like and share to your friends via Facebook, Whatsapp and other social platforms. Hit SUBSCRIBE & NOTIFICATION BELL icon button if you don't want to miss any video of our channel.About-Wrestle Chatter youtube channel runs by Rohit Pant. This channel provides content related to wrestling(WWE) and other interesting stuff that you must watch."
"I8jUVqFgmO4","Kichchu Chaini Aami | Shah Jahan Regency | Anirban Bhattacharya | Prasen | Dipangshu | Srijit | SVF","2018-12-26T12:28:16.000Z","UC2GXNqco-k7fwg2SMM6SAzQ","SVF","10","18.29.12","Kichhu chaini ami,kichchu chaini aami,indraadip dasgupta bengali songs,Shah Jahan Regency,shahjahan regency official trailer,srijit mukherji bengali movie,srijit next bengali movie,abir chatterjee bengali movie,svf,svf music,swastika mukherjee new film,anirban bhattacharya new movie,kichu chaini ami lyrics,shah jahan regency bengali movie,kichu chaini ami,rajkumarir gaan,rajkumarir gaan lyrics,shah jahan regency songs,shahjahan regency","359321","12694","383","529","https://i.ytimg.com/vi/I8jUVqFgmO4/default.jpg","False","False","Seek within your own self as you dig into this song from Shah Jahan Regency. Presenting the track Kichchu Chaini Aami sung by actor Anirban Bhattacharya, and composed by Prasen.#KichchuChainiAami #ShahJahanRegency  #SrijitMukherji #SVF   #SwastikaMukherjee #AnirbanBhattacharya #ParambrataChatterjee  #DipangshuAcharya ------------------------------------------------------------------------------Listen to the full song : Hungama: http://bit.ly/KichchuChainiAami_HungamaGaana: http://bit.ly/KichchuChainiAami_GaanaWynk: http://bit.ly/KichchuChainiAami_WynkAmazon: http://bit.ly/KichchuChainiAami_AmazonHoichoi: https://www.hoichoi.tv/songs------------------------------------------------------------------------------Song Credits : Song name: Kichchu Chaini AamiSinger: Anirban Bhattacharya Music Composer: PrasenLyricist: Dipangshu Acharya Arrangement: Indraadip Das Gupta Nylon Guitar: Subhomoy Chowdhury Violin: Rohan Roy Mixing and Mastering: Amit Chatterjee @IDP StudioMusic Label: SVF Music Movie Credits :Film: Shah Jahan RegencyScreenplay, Dialogues and Direction: Srijit MukherjiCast: Parambrata Chatterjee, Abir Chatterjee, Anjan Dutt, Mamata Shankar, Swastika Mukherjee, Anirban Bhattacharya, Rittika Sen, Rituparna Sengupta, Kanchan Mullick, Babul Supriyo, Rudranil Ghosh, Sujoy Prosad Chatterjee, Pallavi Chatterjee, Ushasie Chakraborty & othersCinematography: Gairik SarkarEditor: Pronoy DasguptaMusic Directors: Anupam Roy, PrasenBackground Score: Indraadip Das GuptaLyrics: Anupam Roy, Dipangshu Acharya, Ritam SenProduction Design: Shibaji Pal, Srijit MukherjiAssociate Director: Soumyabroto RakshitSound Design: Anindit RayCostume Design: Sabarni DasAssociate Producer: Abhishek Daga------------------------------------------------------------------------------Enjoy and stay connected with us!!► Subscribe to SVF YouTube channel : http://bit.ly/SVFsocial► Like us on Facebook : https://www.facebook.com/SVFsocial► Follow us on Twitter : https://www.twitter.com/SVFsocial► Follow us on Instagram : https://www.instagram.com/svfsocial► Circle us on Google Plus : https://plus.google.com/+SVFsocial"
"01zJBcPHOQg","Cow Getting Fever Buffalo Getting ಬರೆ.!? | Sharan | Chikkanna | Ashika Ranganatha | Raambo 2","2018-12-27T13:18:24.000Z","UCzR_54cXZM6JoUPz4jfZUPg","Anand Audio Kannada Comedy","23","18.29.12","rambo 2,rambo 2 full movie kannada,rambo 2 kannada song,rambo 2 dj song,rambo 2 comedy,rambo 2 climax,rambo 2 chikkanna comedy,rambo 2 kuri prathap comedy,rambo 2 sharan comedy,rambo 2 comedy videos,rambo 2 hd,rambo 2 hd movie,rambo 2 hd video songs,rambo 2 hd kannada movie arjun janya all songs,ashika comedy,sharan comedy,sadhu kokila comedy scenes,sadhu kokila rambo 2 comedy scenes,sadhu kokila rambo 2 entry scene","138052","854","56","33","https://i.ytimg.com/vi/01zJBcPHOQg/default.jpg","False","False","Watch Full HD Comedy Cow Getting Fever Buffalo Getting ಬರೆ.!?.!!?  from the movie Raambo-2 Starring: Sharan, Ashika Ranganath, Ravishankar, Chikkanna, Sadhu Kokila & Others Exclusive Only On Anand Audio COMEDY Channel..!!! ----------------------------------------­--------------------------------------------------------You can also Download Anand Audio App https://play.google.com/store/apps/details?id=com.anandaudio.app----------------------------------------­--------------------------------------------------------*YouTube: http://goo.gl/JtObUW                  **Twitter: https://twitter.com/aanandaaudio            **Google+: https://plus.google.com/+AnandAudio         **Facebook: https://www.facebook.com/aanandaaudio *----------------------------------------­--------------------------------------------------------You can also download this album fromiTunes :  https://apple.co/2vUrQ7CSaavn :  https://bit.ly/2qriufVHungama :  https://bit.ly/2EzJJtYWynk :  https://bit.ly/2IU0qqeidea :  https://bit.ly/2qFLAcuListen & Download in HD on JioMusic :  http://bit.ly/2CQJiP6Google Music: https://play.google.com/store/music/album?id=Buim7in6hk7q6n32r3hmfyskuceGaana Music: https://bit.ly/2GS5Sc1Jukebox Link: https://youtu.be/Rp5UekgWf_4 ----------------------------------------­--------------------------------------------------------Film: RAAMBO-2 Music:  ARJUN JANYAStarcast: SHARAN, AASHIKA Director: ANIL KUMARCreative Head: THARUN KISHORE SUDHIRProducer: SHARAN.G.K, ATLANTA NAGENDRABanner: LADOO CINEMA HOUSE / DE ARTE STUDIOSRecord Label: AANANDA AUDIO VIDEO----------------------------------------­--------------------------------------------------------01:Song: Dum Maro Dum/Singer: Aditi Sagar02:Song: Yavva Yavva/ Singer: Vijay Prakash03:Song: Chuttu ChuttuSinger: Ravindra Soragavi, Shamitha Malnad04:Song: Bit Hogbeda/Singer: Mehboob Saab 05:Song: Elli Kaan Ellikaaneno/Singer: Puneeth Rajkumar06:Song: Bellege Bellege/Singer: Chikkanna---------------------------------------­--------------------------------------------------------Operator Codes1)To Set Dum Maro Dum as Your Caller Tune!!!AirTel Users Dial 5432116459087Vodafone Users Dial 53710089620Idea Users Dial 5678910089620Docomo Users Dial 54321110089620BSNL Users SMS BT 10089620 to 56700 Operator Codes2) To Set Yavva Yavva as Your Caller Tune!!!AirTel Users Dial 5432116484833Vodafone Users Dial 53710247822Idea Users Dial 5678910247822Docomo Users Dial 54321110247822BSNL Users SMS BT 10247822 to 56700 Operator Codes3) To Set Chuttu Chuttu as Your Caller Tune!!!AirTel Users Dial 5432116505244Vodafone Users Dial 53710378196Idea Users Dial 5678910378196Docomo Users Dial 54321110378196BSNL Users SMS BT 10378196 to 56700 Operator Codes4) To Set Bit Hogbeda as Your Caller Tune!!!AirTel Users Dial 5432116512834Vodafone Users Dial 53710401577Idea Users Dial 5678910401577Docomo Users Dial 54321110401577BSNL Users SMS BT 10401577 to 56700 Operator Codes5) To Set Elli Kaan Ellikaaneno as Your Caller Tune!!!AirTel Users Dial 5432116517719Vodafone Users Dial 53710424395Idea Users Dial 5678910424395Docomo Users Dial 54321110424395BSNL Users SMS BT 10424395 to 56700 Operator Codes6) To Set Bellege Bellege as Your Caller Tune!!!AirTel Users Dial Coming SoonVodafone Users Dial Coming SoonIdea Users Dial Coming SoonDocomo Users Dial Coming SoonBSNL Users SMS BT Coming Soon to 56700 ----------------------------------------­--------------------------------------------------------Anand Audio is a largest music company in Kannada has released audio of super hit movies like Yejamana, Snehaloka, Chandra Chakori, Tavarige Baa Thangi, Mungaru Male, Milana, Jackie, Maanikya, Kotigobba 2, Chowka, Chakravarthy & others. We have worked with almost big stars like Sudeep, Puneeth Rajkumar, Yash, Dharshan, Radhika Pandith, Sharan, Sadhu Kokila, Shivrajkumar, Upendra & others.----------------------------------------­--------------------------------------------------------VISIT OUR OTHER CHANNELS:-Anand Audio Devotional: https://goo.gl/73RHJRAnand Audio NaaduNudi: https://goo.gl/UCLZLjAnand Audio Evergreen: https://goo.gl/dLSjmKAnand Audio Tulu: https://goo.gl/v4cgYqAnand Audio Entertainment: https://goo.gl/G2yx6XAnand Audio Kannada Comedy: https://goo.gl/UFXUhq"
