video_id,title,publishedAt,channelId,channelTitle,categoryId,trending_date,tags,view_count,likes,dislikes,comment_count,thumbnail_link,comments_disabled,ratings_disabled,description
"qxgzI7N03bM","Jane Kyon Log Mohabbat Kiya Karte Hai | Vicky Singh | Cover","2018-11-26T12:59:14.000Z","UCBzRNetz7eOSqcAdNXhPZPA","Pehchan Music","10","18.28.11","jane kyun log mohabbat kiya karte hain,jaane kyun log mohabbat,jaane kyun log mohabbat cover,anand bakshi,lata mangeshkar,leena chandavarkar,vicky singh,pehchan music,sad songs,cover,pehchan,lata mangeshkar songs,old hindi songs,old sad songs,jaane,kyun,log,pyar,karte,hai","174602","11828","183","845","https://i.ytimg.com/vi/qxgzI7N03bM/default.jpg","False","False","Listen to this sad unplugged cover of old classic Jane Kyon Log Mohabbat Kiya Karte Hai by Vicky Singh.Cover Song Credits:Vocals - Vicky SinghMusic Produced | Mix & Mastered - Vicky SinghOriginal Song Credits:Film: Mehboob Ki MehndiSong: Jane Kyon Log MohabbatArtist: Lata MangeshkarMusic Director: Laxmikant-PyarelalLyricist: Anand BakshiFilmstar: Rajesh Khanna, Leena Chandravarkar, Pradeep Kumar, Paro Devi, Mumtaz BegumDirector: H.S RawalLabel :: Saregama India Ltd.All Rights to Music Label Co. & No Copyright infringement intended.___For Featuring on our Platforms, Please Send us your Music Profile at:pehchanmusic@gmail.comDue to the volume of requests, in most cases we won't be able to send you a personal reply but if we liked your work our team will be surely get in touch with you shortly :)___For Booking of LIVE SHOWS & EVENTS of our great Line up of Various ARTIST contact us on:liveshows@pehchanmusic.com___Follow on our Social Handles for Regular Updates:Subscribe to Pehchan Music https://www.youtube.com/pehchanmusicLike us on Facebookhttps://www.facebook.com/pehchanmusicFollow us on Instagramhttps://www.instagram.com/pehchan.musicFollow us on Twitterhttps://twitter.com/pehchanmusic"
"VobtSpnJudY","Sapna Choudhary क्यों हैं बदनाम, क्या सच में करा देती हैं दंगे ? Exclusive (Full Interview)","2018-11-22T16:25:24.000Z","UCttspZesZIDEwwpVIgoZtWQ","IndiaTV","25","18.28.11","hindi news,India TV,india tv news,aap ki adalat,Aaj Ki Baat,india tv live,india tv news live,india tv hindi,india tv youtube,india tv hindi news,india tv channel live,sapna choudhary on salman khan,sapna choudhary,sapna chaudhary,sapna choudhary video,sapna choudhary dance video,sapna,sapna choudhary viral video,sapna choudhary song,sapna choudhary angry,sapna choudhary interview,sapna choudhary india tv,full interview,hakikat kya hai india tv","1426958","13007","2213","1996","https://i.ytimg.com/vi/VobtSpnJudY/default.jpg","False","False","Watch Sapna Choudhary's Exclusive Interview only on India Tv as she talks about her fans, dance and Salman Khan. #SapnaChoudhary #SapnaChoudharyIndiatvFor More Videos Visit: http://www.indiatvnews.com/videoFollow IndiaTV: Facebook: http://www.fb.com/indiatvnews | Twitter: http://twitter.com/indiatvnewsDownload IndiaTV News Apps: Android: https://goo.gl/30MHqS | iOS: https://goo.gl/7C5EprDownload IndiaTV Live TV Apps: Android: https://goo.gl/VqkMIa | iOS: https://goo.gl/4rzvVnदेश -विदेश की ताजा खबरें पढ़ने के लिए क्लिक करें हमारी हिन्‍दी वेबसाइट : http://www.khabarindiatv.com बिजनेस जगत की ताजा हलचल और स्‍पेशल रिपोर्ट जानने के लिए क्लिक करें : http://www.indiatvpaisa.comSUBSCRIBE to IndiaTV Here: http://bit.ly/indiatv_sub"
"wbfConpuzxo","അറസ്റ്റ്; പിന്നാലെ രഹന ഫാത്തിമയെ ബിഎസ്എന്‍എല്‍ സസ്പെന്‍ഡ് ചെയ്തു","2018-11-27T11:12:51.000Z","UCP0uG-mcMImgKnJz-VjJZmQ","Manorama News","25","18.28.11","Manorama News,News,Politics,Kerala News,Breaking News,Latest News,Kerala,youtube,rehna fathima","157034","1607","103","558","https://i.ytimg.com/vi/wbfConpuzxo/default.jpg","False","False","Subscribe to the Manorama News YouTube Channel: https://goo.gl/EQDKUBGet Latest news updates http://goo.gl/kCaUppVisit our website: http://goo.gl/wYfPKqFollow Manorama News on Twitter https://goo.gl/tqDyokWatch the latest #ManoramaNews News Video updates and special programmes: https://goo.gl/63IdXc  Watch the latest Episodes of #ManoramaNews #Nattupacha https://goo.gl/KQt2T8Watch the latest Episodes of #ManoramaNews #ParayatheVayya https://goo.gl/C50rurWatch the latest Episodes of #ManoramaNews #NiyanthranaRekha https://goo.gl/ltE10XWatch the latest Episodes of #ManoramaNews #GulfThisWeek https://goo.gl/xzysbLWatch the latest Episodes of #ManoramaNews #ThiruvaEthirva https://goo.gl/2HYnQCWatch the latest Episodes of #ManoramaNews #NereChowe https://goo.gl/QWdAg2Watch the latest Episodes of #ManoramaNews #Fasttrack https://goo.gl/SJJ6cfWatch the latest Episodes of #ManoramaNews #Selfie https://goo.gl/x0sojmWatch the latest Episodes of #ManoramaNews #Veedu https://goo.gl/enX1bVManorama NewsManorama News, Kerala’s No. 1 news and infotainment channel, is a unit of MM TV Ltd., Malayala Manorama’s television venture. Manorama News was launched on August 17, 2006. The channel inherited the innate strengths of the Malayala Manorama daily newspaper and its editorial values: accuracy, credibility and fairness. It raised the bar in Malayalam television news coverage and stands for unbiased reporting, intelligent commentary and innovative programs. MM TV has offices across the country and overseas, including in major cities in Kerala, Metros and in Dubai, UAE."
"uoLT5XHy_qo","Sameeram Full Movie | Latest Telugu Full Movies 2018 | Yashwanth, Amrita Acharya, Jabardasth Srinu","2018-11-24T09:36:22.000Z","UCoy3dQzEdq1y2zMnT4pdj3Q","SriBalajiMovies","24","18.28.11","Sameeram Full Movie,Latest Telugu Full Movies,Yashwanth,Amrita Acharya,full movies 2018 telugu,Jabardasth Srinu Comedy,Yajamanya Music,Latest South Movies 2018,Getup Srinu Comedy,Sameeram Movie Songs,Ravi Gundaboina,2018 Telugu full movies,Divya Nandini,Sri Balaji Video","729364","3204","481","268","https://i.ytimg.com/vi/uoLT5XHy_qo/default.jpg","False","False","Watch Sameeram Latest Telugu Movie, Starring Yashwanth, Amrita Acharya, Jabardasth Srinivas, Divya Nandini, Music By Yajamanya, Directed By Ravi Gundaboina, Produced By Anitha Devendar Reddy, Suresh Kesavan, SMT G. Rukmini Under The Banner of Anitha Creative Works.#Sameeram #JabardasthSrinivas #2018TeluguMovies #Yashwanth #AmritaAcharya #SriBalajiVideoSameera(Amrita Acharya) is an orphan who does not enjoy life and saves all her income for the future. As time passes by, she gets affected by a deadly disease and doctors say that she has only a few months left in her life. Upset with this, she decides to enjoy the rest of the time and leaves to Thailand. There, she meets Ram(Yaswant) and falls in love with him. But Yaswant loves someone else and this breaks Sameera’s heart. Rest of the story is as to how Sameera deals with all her problems and wins her love.☛ Subscribe to YouTube Channel: http://goo.gl/tEjah☛ Like us on Facebook: https://www.facebook.com/sribalajivideo☛ Circle us on G+: https://plus.google.com/+SriBalajiMovies☛ Like us on Twitter: https://twitter.com/sribalajivideos☛ Visit Our Website: http://www.sribalajivideo.com•▬▬▬••▬▬▬••▬▬▬•▬▬▬•▬▬▬••▬▬▬••▬▬▬••"
"facEF19mtnM","Realme U1 Price,Iphone X Scam,Detel Rs.3,999 LCD Tv,Samsung Flex,Pixel 3 Lite,Nokia 7.1 Plus-#696","2018-11-27T18:10:05.000Z","UC8vlDm5xvbxOrCvdu9UNOiA","Techno Ruhez","28","18.28.11","Realme U1 Price,Iphone X Scam,Detel Rs.3,999 LCD Tv,Samsung Flex,Pixel 3 Lite,Nokia 7.1 Plus,unboxing,india,hindi,tech news,technology,review,techno ruhez,daily tech updates,tech news daily,best tech news,top tech news,technews,latest tech news,latest,latest updates,trick,online,daily news,hindi news,jio latest news,5g india,news,whatsapp","47494","8053","148","764","https://i.ytimg.com/vi/facEF19mtnM/default.jpg","False","False","Hello Everyone Welcome To My Daily Tech News # 696My New Non-Tech Channel : https://goo.gl/vL0mh2News Covered :Realme U1 Price,Iphone X Scam,Detel Rs.3,999 LCD Tv,Samsung Flex,Pixel 3 Lite,Nokia 7.1 Plus India--------------------------------------------------------------------------------------------------Intro & Background Music : ‘Music by Epidemic Sound http://www.epidemicsound.com-----------------------------------------------------------------------------------------------Follow and Like my Page on Facebook: https://www.facebook.com/technoruhezFollow me on google plus: https://plus.google.com/+TechnoruhezFollow me on twitter: https://twitter.com/AmreliaRuhezFollow me on Instagram: https://www.instagram.com/technoruhez/Do Leave A Like And Subscribe For More Awesome Videos Like This DailyFor Business Enquiries: technoreviewww@gmail.com------------------------------------------------------------------------------------------------------My Gears Camera - Canon 700D : https://amzn.to/2H3c1mMMonitor - AOC : https://amzn.to/2IWI9ovLight - https://amzn.to/2ISWcLVMic - https://amzn.to/2vguiY3My Laptop : https://amzn.to/2ENLe7NTechno Ruhez Channel ki Madad Kijiye aur Niche diye gaye link se Purchase KijiyeFlipkart : http://fkrt.it/vOdVL2NNNNAmazon : https://amzn.to/2GYuqx2-----------------------------------------------------------------------------------------------------NOTE : All content used is copyright to Techno Ruhez, Use or commercial display or editing of the content without proper authorization is not allowed"
"Bt9g4oE9EA0","சென்டினல் தீவு : அமெரிக்கரின் உடலை மீட்க முடியவில்லை| Sentinel Island |","2018-11-25T13:41:39.000Z","UCYlh4lH762HvHt6mmiecyWQ","Sun News","25","18.28.11","''TamilNadu,News,Sun News,Sun News Live,Live News,News Updates,Latest News,Tamil News,Tamizh News,Top News,Speed News,North Sentinel Island","251570","2135","133","580","https://i.ytimg.com/vi/Bt9g4oE9EA0/default.jpg","False","False","சென்டினல் தீவு : அமெரிக்கரின் உடலை மீட்க முடியவில்லை| Sentinel Island | North Sentinel Island |"
"9cJxh1ueaKI","#744 Nokia 8.1 India, Realme u1 Price, Oppo R17 Pro, Galaxy A8s, Meizu 16S, Lifetime Validity Airtel","2018-11-27T16:23:55.000Z","UCdiHpeH9fr4DMK_3wbUZapA","Sharmaji Technical","28","18.28.11","sharmaji technical,technews,tech news,Nokia 8.1 India,Realme u1 Price,Oppo R17 Pro,Galaxy A8s,Meizu 16S,Lifetime Validity Airtel,No Free Incoming,Zenfone M2 India Launch","59110","5079","158","1059","https://i.ytimg.com/vi/9cJxh1ueaKI/default.jpg","False","False","#744 Nokia 8.1 India, Realme u1 Price, Oppo R17 Pro, Galaxy A8s, Meizu 16S, Lifetime Validity Airtel, No Free Incoming, Zenfone M2 India LaunchDeals of the day - 1. Prolific Black & White Training Shoes at Rs 699 - http://bit.ly/2QmBco62. Arrow Sports Trouser (Rs 2500) at Rs 500 only - http://bit.ly/2DLIP0F3. Solar Chargeable Emergency Lantern (Rs 699) at Rs 216 only - http://bit.ly/2DNFcqU4. Orpat 1200 W Iron at Rs 499 only on Amazon - http://bit.ly/2DKwJ85Help Sharmaji in Return, via buying your gadget from below linksFlipkart - http://fkrt.it/BbsqDnuuuNAmazon.in - https://amzn.to/2pEojXYPlease share your thoughts and comments about this review, do like this video and share if further.Subscribe to youtube - www.youtube.com/sharmajitechnicalFacebook – https://www.facebook.com/sharmajitechnicalTwitter – https://twitter.com/sharmajitechInstagram – https://www.Instagram.com/sharmajitechnicalWebsite - sharmajiinfinity.com"
"pJbzJq999b4","5 मजेदार पहेलियाँ  (Part 86) | Paheliyan in Hindi | RAPID MIND RIDDLES | Hindi Riddle | Rapid Mind","2018-11-25T13:00:10.000Z","UCqf7I-Sid_8XkEnJz22VglA","Rapid Mind","27","18.28.11","Hindi Riddle,Rapid Mind,riddles,hindi paheliyan,hindi paheli,COMMON SENSE HINDI,हिन्दी पहेलियाँ,पहेली,rapid mind reshma,hindi riddles,riddles in hindi,paheliyan,paheli in hindi,iq questions,puzzle in hindi,majedar paheliyan,RAPID MIND RIDDLES,rapid mind questions,paheliyan in hindi,मजेदार पहेलियाँ,paheliyan hindi,riddles with answers,जासूसी पहेलियाँ,hindi paheliyan with answer,paheliyan in hindi with answer,paheliyan with answer,riddle in hindi","226652","2430","1148","1021","https://i.ytimg.com/vi/pJbzJq999b4/default.jpg","False","False","Paheliyan in hindi : #rapidmind dosto aapko ye Brain booster Majedar #paheliyan ka #paheli video pasand to ayegahi agar aapne mereyah IQ Test Video nahi dekhe hain to jarur dekh ligiye 7 Logical Paheliyan | Test Your IQ | Jasoosi Paheliyan 👇👇👉👉 https://youtu.be/4cZpoVHtITwअकलमंद हो तो इन 5 सवालों का सही जवाब दीजिये  | 99% Failed  👇👇👉👉  https://youtu.be/Cbd3g3LUh9Yकिस देश मे रात सिर्फ 40 मिनट की होती हैं | Interesting GK Part 15  👇👇👉👉  https://youtu.be/HtXUj4DMCCc5 दिमागी पहेलियाँ (Part 7) | Brain Teaser | Riddles 👇👇👉👉  https://youtu.be/AeXzdGajsLoSubscribe to Rapid Mind : https://goo.gl/Gck5m1Mera Naam Hai Reshma Wanole aur aap mujhe FaceBook par bhi Follow kar sakte hai Facebook : https://www.facebook.com/RapidMindHindi/"
"gj9BCW7xGXQ","Mogalirekulu | 23rd Nov 2018 | Gemini TV","2018-11-26T07:09:58.000Z","UCN2KBcMDJyCWB57K7i_Z10g","Gemini TV","24","18.28.11","Gemini TV,Reality Show,Telugu Serials,Telugu Programs,Gemini TV Serials,Geminitv Special,Telugu Promos,Telugu Entertainment,Telugu Best Programmes","69399","422","32","7","https://i.ytimg.com/vi/gj9BCW7xGXQ/default.jpg","False","False","Steps to avail 20% Discount on Sun NXT subscription:  1 Logon to http://bit.ly/YT20OFFER or Download Sun NXT android app from 2 Click on any video content & Sign up or Sign in. 3 Enter the Coupon YT20 in the Coupon Code option in Subscription Pop-Up. 4 Complete your payment on discounted price. • Offer applicable only for Quarterly & Yearly packs. 5 iPhone customers can avail the discount from your browser onlyT&C Apply.Enjoy Sun NXT. T&C:   • This discount offer is not applicable for users from US. • The discount is applicable only for new purchases and not for renewals • The renewals for the discounted purchase will be on the actual cost • Offer applicable only for Quarterly & Annual Packs • Offer not applicable for users paying via iTunesWatch Mogalirekulu - 23rd Nov 2018, Full Episode FREE on Sun NXT from http://bit.ly/MogalirekuGeminiTVMogalirekulu is a family drama show. The story depicts the story of three brothers, Dharma, Satya and Daya and their little sister, Shanti. All four of them are the victims of a family feud.To Watch Gemini TV Programs Live on Sun NXT Click: http://bit.ly/GeminiTVLIVEWatch 4000+ Movies, 40+ Live TV Channels, TV Shows, Music Videos, Comedy and exclusives on Sun NXT anytime anywhere.Download Sun NXT Now to Enjoy Unlimited entertainmentAndroid: http://bit.ly/SunNxtAdroid iOS: India - http://bit.ly/sunNXT iOS Rest of the World - http://bit.ly/ussunnxt or Visit https://www.sunnxt.comFollow Us On Our Social Media Links Facebook : https://www.facebook.com/GeminiTV Twitter : https://twitter.com/GeminiTV"
"0t8SVScxda4","Suraj shukla | chadhta Suraj dheere dheere | Darpan shah | Rock Qawali by dillagi creation","2018-11-26T14:35:47.000Z","UCI0FXWtOeMmfLskeIIn-nEg","DILLAGI CREATION","24","18.28.11","suraj shukla,suraj shukla new video,dillagi cretion,pyar wala video,chadhta suraj,dheere dheere,chadhta suraj dheere dheere,darpan shah,best qawali,qawali song,best new qawali song 2019,pahchan music,rahul jain,dillagi creation new video,heart touching love story,sad love story,2.0 muvie,panjab love story,best love wala story,dhalta hain dhal jayega,aaj jawami par itranewale,rahat fateh ali khan,rahat fateh ali khan best qawali song","186266","9397","390","809","https://i.ytimg.com/vi/0t8SVScxda4/default.jpg","False","False","shiv malik haiDillagi creation presented by new cute love story follow on Instagram:- Suraj shukla https://www.instagram.com/suraj__shukla/https://www.facebook.com/Suraj-Shukla...Video Credits:- Cast- SURAJ SHUKLA & SHAKSHISub Cast:- junaid mirza, vishal yadav abhishekCinematographer- Muveen Shaikh (MS)cover song creditvocal : Darpan shah & vaibhav shahmusic : Gulzar shahAaj jawani par itranewale Kal pacthhtayegaAaj jawani par itranewale Kal pacthhtayegaChadhta suraj dheere dheereDhalta hain dhal jayegaChadhta suraj dheere dheereDhalta hain dhal jayegaDhal jayega dhal jayegaDhal jayega dhal jayegaToo yaha musafir hain, Yeh sarah pani hainChar roj ki mehman, Teri zindagani hainJan zameen jar jevar, Kuchh naa sath jayegaKhali hath aaya hain, Khali hath jayegaJan kar bhi anjana, Ban raha hain divaneApni umrefani par, Tan raha hain divaneIss kadar too khoya, Hain iss jahan ke meleToo khuda ko bhula hain phasKe iss jhamele meAaj tak yeh dekha hain, Panewala khota hainZindagi ko jo samjha, Zindagi pe rota hainMitne wali duniya kaa, Aitbar karta hainKya samajh ke too aakhir, Is se pyar karta hainApni apni fikro mai jo, Bhi hain woh uljha hainJo bhi hain woh uljha hain, Zindagi hakikat mai kyaHain kaun samjha hainKya hain kaun samjha hainAaj samajhle aaj samajhleAaj samajhle aaj samajhleKal yeh mauka hath ,Naa tere aayegaO gaflat ki nind mai Sone wale dhoka khayegaChadhta suraj dheere dheereDhalta hain dhal jayegaChadhta suraj dheere dheereDhalta hain dhal jayegaDhal jayega dhal jayegaDhal jayega dhal jayegaMaut ne jamane ko Yeh sama dikh dalaKaise kaise uss ghum Ko khak me mila dalaYaad rakh sikander ke Hausle toh aali theJab gaya tha duniya se Dono hath khali theApna woh halaku hain  Aur naa uske sathi hainJung ko chu woh porus hain Aur naa uske hathi hainKal jo tanke chalte they Apni shano shaukat parShamma tak nahi jalti Aaj unki purbat parApna ho ya ala ho Sabko laut jana hainAbko laut jana hain Ab ko laut jana hainMuflifoh tavundar kaa Kabra hi thikana hainKabra hi thikana hain Kabra hi thikana hainJaisi karni jaisi karni…Jaisi karni jaisiKarni waisi bharniAaj kiya kal payegaSir ko uthakar chalneWale ek din thokar payegaChadhta suraj dheere dheereDhalta hain dhal jayegaChadhta suraj dheere dheereDhalta hain dhal jayegaDhal jayega dhal jayegaDhal jayega dhal jayega#dillagi_creation #Suraj_shukla #best_Qawali_song#Beat_heart_touching_love_story"
"PxN9VGyjs-g","5 Beauty Secrets for Naturally Glowing & Stress-free Skin","2018-11-27T06:30:01.000Z","UCXyq6UjvT4dWjMOOiKuBncA","Glamrs","26","18.28.11","fiama,glamrs,glamrstv,glamrs.com,5 Beauty Secrets for Naturally Glowing & Stress-free Skin,glowing skin,de-stress routine,skin brightening face pack,gentle scrub,body oils,shower gel,yoga,relaxation rituals,fresh skin,at home skin care,beauty treatments,fiama body oil,fiama bath essentials,fiama bath essentials scrub-a-dub-dub,beauty secrets,skin rejuvenation,savasana,dull skin treatment,dry skin tips,skin care tips,foot massage,foot massage technique","32744","2072","64","64","https://i.ytimg.com/vi/PxN9VGyjs-g/default.jpg","False","False","Did you know your skin can feel exhausted too? With all that’s crammed into your day and hundreds of little things to do, a tough one can take a lot out of you. So here’s a perfect at home destress beauty routine that will pick you up when you’re down and out.Make sure you subscribe and never miss a video ► https://goo.gl/FOVoGPTo buy these Fiama Bath Products: http://bit.ly/BathProductEssentials- Love, Team GlamrsGlamrs is the first Indian makeup, beauty, style, fitness and lifestyle video platform for women. Tune in daily for the latest and trendy makeup tips, healthcare, fashion ideas, nail art, daily life hacks, interesting DIY videos and much more.Our team of beauty, style, fitness and health experts brings you the best advice, tips, tricks and home remedies so you are always in-the-know, through quick videos that you can easily watch on your phone.#Glamrs #bathessentials #glowingskin"
"JFL1Uw-Zm6I","Lehanga - Vijay Varma | Raju Punjabi, Andy Dahiya | Releasing Soon | Latest Haryanvi Song 2018","2018-11-27T10:49:11.000Z","UCbYXVxwDEWc9sIt6yZhweqQ","Nav Haryanvi","10","18.28.11","lehanga raju punjabi song,lehanga haryanvi song,nav haryanvi,lehanga vijay varma,andy dahiya new song,andy dahiya,lehanga song,raju punjabi,vijay varma,vijay verma new song lehanga,lehanga,sushila takhar,vr bros,lahanga,vijay verma new songs 2018,raju punjabi new song,haryanvi songs haryanavi,haryanvi songs 2018,haryanvi dj songs,new haryanvi songs 2018,byah di anpad hali k,popular haryanvi songs,kadhai aala suit,haryanvi 2018,sonika singh","123039","4808","260","1363","https://i.ytimg.com/vi/JFL1Uw-Zm6I/default.jpg","False","False","#Lehanga #VijayVarma #RajuPunjabi #AndyDahiya #HaryanviSong #NavHaryanviSubscribe Us Here : https://goo.gl/hWsYbaCompany Contact No. - +917042509060Song - LehangaStarring Vijay VarmaSinger - Raju Punjabi & Sushila TakharLyrics - Andy DahiyaMusic - VR BrosMix & Master - Vinod ChhimpaDirector & Concept - Vijay VarmaLabel - NAV HaryanviConnect with us on :Subscribe Our Channel on YouTube : https://goo.gl/hWsYbaLike Us on Facebook :- https://www.facebook.com/navharyanviFollow Us on Instagram :- https://www.instagram.com/navharyanviTweet Us On :-https://twitter.com/HaryanviNavLehanga - Vijay Varma | Andy Dahiya, Raju Punjabi | Releasing Soon | Latest Haryanvi Song 2018"
"fFKnARHp-ik","THE ADITI INTERVIEW | Jaby Interviews Aditi Rao Hydari","2018-11-27T10:30:51.000Z","UCwV_A5L1hhEVfld6Wbxn3jg","jaby koay","24","18.28.11","aditi rao hydari,jaby koay,jabykoay,jaby,Antariksham,Antariksham 9000kmph,psycho,Chekka Chivantha Vaanam,Pashmina,Enchantment","100529","5942","71","1374","https://i.ytimg.com/vi/fFKnARHp-ik/default.jpg","False","False","SOCIAL MEDIA:~ADITI RAO HYDARI~Instagram, Twitter: @AditiRaoHydari~JABY KOAY~YouTube, Twitter, Instagram: @jabykoayFacebook: http://www.facebook.com/followjaby~ACHARA KIRK~Twitter & Instagram: @AcharaKirkhttp://youtube.com/Achara~VEERENDRA CHOWDARY~Veerendra Chowdary created the opening animation.Twitter: @NameisVeeru___Jamazing Patrons of November: JN Valente, Sachin Shenoy, Avijit Singh, Madhan, Bhavya Singh,  Harmandeep Singh, Riju Mahna, Arush Dayal and Daniel Prakash!Be a patron for Jaby and support more videos like this!http://www.patreon.com/jabykoay__Jaby WEST:https://youtube.com/GETJabyJaby ASIA:https://youtube.com/JabyTVJABY KOAY'S SHORT FILMS PLAYLIST:https://www.youtube.com/playlist?list=PL34B19BA788E18384Click here to subscribe and know when the next video drops:http://www.youtube.com/subscription_center?add_user=jabykoayThanks for watching!!!__Credit of my favorite movie reviews song:Highlight Reel Kevin MacLeod (incompetech.com)Licensed under Creative Commons: By Attribution 3.0 Licensehttp://creativecommons.org/licenses/by/3.0/"
"ybkGkbMDUPg","Tula Pahate Re | Marathi Serial | EP 92 - Preview | Nov 26, 2018 | Zee Marathi","2018-11-27T07:58:53.000Z","UC82o9tQyo_cJhtyoFi-ROEw","Zee Marathi","24","18.28.11","Tula Pahate Re,Tula Pahate Re Marathi Serial,Tula Pahate Re Title Song,Tula Pahate Re Title Track,Tula Pahate Re Marathi Show,Subodh Bhave,Gayatri Datar,Aarya Ambekar,Aarya Ambekar Song,Latest Episode,Full Episode,All Episodes,Watch Online,HD,Zee,Zee5,Zee Marathi,Subodh Bhave's Serial,Webisode,Full Episdoe,Todays Episode,Best Scene,Preview,झी मराठी","19740","58","12","14","https://i.ytimg.com/vi/ybkGkbMDUPg/default.jpg","False","False","ZEE5 Now available in 190+ countries. Click Here http://bit.ly/WatchNowOnZEE5 To Feel ZEE5 in Your Language (Apni Bhasha Mein Feel Hai)|To DOWNLOAD the app click below links - Playstore: https://play.google.com/store/apps/details?id=com.graymatrix.did- iTunes: https://itunes.apple.com/in/app/ozee-tv-shows-movies-more/id743691886Visit our website - https://www.zee5.com Connect with us on Social Media: - Facebook - https://www.facebook.com/ZEE5/ - Instagram - https://www.instagram.com/zee5 - Twitter - https://twitter.com/ZEE5IndiaTula Pahate Re is a Marathi romantic drama television show starring Subodh Bhave and Gaytri Datar. They belong to different worlds, they are from different backgrounds and two different decades. This couple will prove that when two souls are meant for each other, they will find their way to meet, even if the two belong to two eras!"
"DtvW7lMPew0","PM Modi Beautiful Speech in Telugu || BJP Public Meeting in Nizamabad | Raj News","2018-11-27T07:14:12.000Z","UC44ludjTptL-x-5wPnKbGEQ","RAJ NEWS Telugu","25","18.28.11","modi,pm modi,narendra modi,nizamabad,bjp nizamabad,pm modi telugu speech,modi speech in telugu,modi public meeting nizamabad,bharatiya janata party,amit shah","40503","505","301","174","https://i.ytimg.com/vi/DtvW7lMPew0/default.jpg","False","False","PM Narendra Modi Beautiful Speech in Telugu.#PMModi #Nizamabad #BJPFor More Updates :Subscribe Us at Youtube  : https://goo.gl/EZvNcMLike Us at Facebook          :  https://www.facebook.com/RajnewsTelugu/Visit our Website                : http://www.rajnewstelugu.com/Follow Us on Twitter         : https://twitter.com/rajnewsofficialCircle US on G+                  : https://goo.gl/Razf3wAbout Us:RAJ NEWS Telugu, 24/7 LIVE news channel dedicated to live reports, exclusive interviews, breaking news, sports, weather, entertainment, business updates and current affairs. Exclusive Live coverage from Telangana and Andhra Pradesh. This Channel is Promoted by SUSHEE MEDIA PVT LTD. It's an Official Youtube Channel of RAJ NEWS Telugu."
