video_id,title,publishedAt,channelId,channelTitle,categoryId,trending_date,tags,view_count,likes,dislikes,comment_count,thumbnail_link,comments_disabled,ratings_disabled,description
"OUguapOsFoA","Bedhadak (28Dec 2018 ) अहमदनगरमध्ये भाजपची शिवसेनेला धोबीपछाड with Millind Bhagwat","2018-12-28T12:04:47.000Z","UCrcpw88HvKJ0skdsHniCJtQ","News18 Lokmat","25","18.29.12","marathi news,news,latest marathi news,latest news,breaking news,rajshri marathi,news18lokmat,news18 lokmat,Bedhadak,Millind Bhagwat,अहमदनगरमध्ये,भाजपची,शिवसेनेला,धोबीपछाड,Dr.Uday Nirgudkar,maharashtra,maharashtra news,maharastra news,maharashtra city news,maharashtra latest news,maharashtra current news,maharastra news live,maharastra news today,maharashtra political news,maharashtra cm devendra fadnavis,28 Dec 2018","59471","378","90","150","https://i.ytimg.com/vi/OUguapOsFoA/default.jpg","False","False","Bedhadak (28 Dec 2018 ) अहमदनगरमध्ये भाजपची शिवसेनेला धोबीपछाड with Millind BhagwatFollow us: https://lokmat.news18.com/https://twitter.com/news18lokmat?lang=enNews18 India’s leading News Network, and the Lokmat Group, Maharashtra’s leading Newspaper group, present News18Lokmat (formerly- IBN-Lokmat ) - a 24-hour Marathi News and Current Affairs Channel. The legacy of these two renowned media powerhouses will give News18Lokmat a sense of immense credibility as well as access to a vast audience base. Going on air from April 6, News18Lokmat will be a world-class credible News channel for the highly aware and conscious ‘Progressive Marathi’.Through its content, programming, state-of-the-art broadcast centre, extensive infrastructure and international production quality, news18Lokmat will embark on the principle of delivering news with the spirit of ‘Dhyas Janmansancha’. As credible journalism empowers people it gives them the inner confidence to take control of their surroundings and bring about change. News18Lokmat seeks to do just that and more. With reporters in every district of Maharashtra, and access"
"9G2maTLYhbU","Bithiri Sathi Dressed As Young Man, Funny Conversation With Savitri | Teenmaar News | V6 News","2018-12-27T16:14:32.000Z","UCDCMjD1XIAsCZsYHNMGVcog","V6 News Telugu","25","18.29.12","teenmaar news,teenmaar sathi,bithiri sathi new,bithiri sathi dialogues,bithiri sathi comedy,bithiri sathi latest video,teenmaar sathi funny,teenmaar news funny,teenmaar savitri,Youth style,Style,V6 News,V6 Live News,V6 Online News,V6 Telugu News,V6 Youtube,Breaking news,Telugu Live TV,V6news.tv,v6telugu live tv","424861","6379","308","473","https://i.ytimg.com/vi/9G2maTLYhbU/default.jpg","False","False","Bithiri Sathi Dressed As Young Man, Funny Conversation With Savitri | Teenmaar News | V6 News. Subscribe Youtube at http://goo.gl/t2pFrqFacebook : http://www.facebook.com/V6News.tvVisit our Website : http://V6news.tvTwitter : https://twitter.com/V6NewsV6 Velugu Telugu Daily News Paperhttp://epaper.v6velugu.com/V6 News Popular ProgramsWatch V6 #TeenmaarNewshttps://goo.gl/aMw2Q7Watch V6 #GoodMorningTelangana Special Debatehttps://goo.gl/5ft6Vp6PM Special Bulletin on Telanganahttps://goo.gl/xbm4ev10PM Special Bulletin on Hamara Hyderabadhttps://goo.gl/YYseoGV6News, Official YouTube V6 News Channel owned by #VILMedia #Pvt #Ltd.V6 News Telugu #LiveTV, a 24 Hour Telugu News #Broadcaster, dedicated to report News across Telangana and other parts of the #World through live #Reports,#BreakingNews, #Sports updates, #Weather Reports, #Entertainment, #Business Trends, Exclusive #Interviews,  and #CurrentAffairs.The channel Airs programs like #TeenmaarNews, #TelanganaTheertham, #CinemaTalkies, #BithiriSathi Satires etc'.#Movies,#Technology."
"izcChrn9AQI","Maari 2 - Maari Gethu (Promo) | Dhanush | Yuvan Shankar Raja | Balaji Mohan","2018-12-26T12:46:27.000Z","UCIx3RWYwikMlDiJeCEUbfEA","Wunderbar Studios","10","18.29.12","Wunderbar Studios,Wunderbar Films,Dhanush,Maari,Maari 2,Maari 2 Single,Dhanush Songs,Sai Pallavi Maari 2,Yuvan Shankar Raja Hits,Maari 2 Songs,maari 2 first look,yuvan shankar raja,balaji mohan,sai pallavi,Krishna,Varalakshmi Sarathkumar,Tovino Thomas Maari 2,Maari 2 Jukebox,divo,Maari Gethu,Maari Gethu Maari 2 Song,Maari 2 Maari Gethu Song,Maari Gethu Yuvan Song,Maari Gethu Dhanush Song,Yuvan Maari 2 Songs,maari 2 trailer,யுவன் ஷங்கர் ராஜா","464595","18174","825","361","https://i.ytimg.com/vi/izcChrn9AQI/default.jpg","False","False","Unleashing the Video Song Promo of #MaariGethu from #Maari2. Maari 2 stars Dhanush, Sai Pallavi, Krishna, Varalakshmi Sarathkumar & Tovino Thomas in lead roles; Music Composed by Yuvan Shankar Raja & Directed by Balaji Mohan.#Maari2 - Mass Film Celebrated by Families 😎Running Successfully in Theaters Nearby You 🕶️Track CreditsTrack: Maari GethuSingers: Yuvan Shankar Raja, Dhanush, Chinnaponnu & V.M. MahalingamLyrics: Yuvan Shankar RajaMusic: Yuvan Shankar Rajahttp://divo.in/Maari2iTunes - http://bit.ly/RowdyBabyMaari2Google Play - http://bit.ly/2E3Y0mIGaana - https://bit.ly/2P67L4QSaavn - https://bit.ly/2AvI34RHungama - https://bit.ly/2E27OOfRaaga - https://bit.ly/2BDhXhZWynk Music - https://bit.ly/2FN69OdJio Music - https://bit.ly/2zvkWaSIdea Music - https://bit.ly/2PXP0WXComposed & Arranged by Yuvan Shankar Raja Kids Chorus: Sri Vishnu, Rakthaksh, Riyaz, Bhuvanashri – PSBB School, K.K.Nagar. Male Chorus: Deepak, Bamba Bakya, Guru, Pavan, Balasubramani, Sam, Belly Raj Brass Section: Babu Electric Guitar: Joshua Mark Raj Rhythm Section: V.Kumar, Lakshminarayana, Raju, Vedachalam, Lakshmikanth, Jagan Mohan Rhythm Section Recorded at Cirkul Entertainment by Ramji Voice Conduction: Vasudevan, Senthildass Program Co-ordination: V.Subbiah, Ahamad Recorded @ U1 RecordsRecorded by M. Kumaraguruparan D.F.Tech (U1 Records)Mixed by M. Kumaraguruparan D.F.TechMastered by RamjiWunderbar Films Private LimitedDhanushMAARI 2Written & Directed by Balaji Mohana Yuvan Shankar Raja musicalCast: Dhanush, Sai Pallavi, Krishna, Varalakshmi Sarathkumar & Tovino Thomas, Robo Shankar, Kalloori Vino & OthersProducer: DhanushExecutive Producer: S Vinod KumarDOP: Om PrakashProduction Design: Amaran AEdit: GK PrasannaCostumes: Vasuki BhaskarChoreography: Baba Bhaskar, JaniStunts: SilvaLyrics: Poetu Dhanush, Yuvan Shankar RajaDesigns : Sivakumar S (SivaDigitalArt)PRO : Riaz K AhmedBanner: Wunderbar FilmsJani | S P Chokkalingam | Sync Cinema | Raja Krishnan | Martin Rex | Raja B | A Saravanakumar | Nagu | Digital Bricks | AmirMusic on Wunderbar StudiosDigital Partner: Divo#MaariIsBack #Maari2 on FB  https://www.facebook.com/Maari2Offl/Subscribe to our channel bit.ly/WunderbarStudiosWunderbar Films Official FB Page: http://bit.ly/WunderbarFilmsfbWunderbar Films Official Twitter: https://twitter.com/WunderbarFilmsFollow us on Instagram - https://www.instagram.com/wunderbarfilms/In Association with Divohttp://www.facebook.com/divomovieshttps://twitter.com/divomovies"
"83dCzLsSfeg","EK LADKI KO DEKHA TOH AISA LAGA | Trailer Reaction!","2018-12-28T11:30:00.000Z","UCwV_A5L1hhEVfld6Wbxn3jg","jaby koay","24","18.29.12","ek ladki ko dekha to aisa laga,trailer,reaction,jaby koay,jaby,jabykoay,anil kapoor,rajkummar rao,rajkumar rao,sonam kapoor,Juhi Chawla,Shelly Chopra Dhar,anthony alba,achara kirk,achara","107479","3461","101","945","https://i.ytimg.com/vi/83dCzLsSfeg/default.jpg","False","False","Jamazing Patrons of December: JN Valente, Sachin Shenoy, Avijit Singh, Madhan, Bhavya Singh,  Harmandeep Singh, Riju Mahna, Arush Dayal and Daniel Prakash!Be a patron for Jaby and support more videos like this!http://www.patreon.com/jabykoay___Trailer Link:https://www.youtube.com/watch?v=pKcamCgBvMo___SOCIAL MEDIA:~ACHARA KIRK~Twitter & Instagram: @AcharaKirkhttp://youtube.com/Achara~JABY KOAY~YouTube, Twitter, Instagram: @jabykoayFacebook: http://www.facebook.com/followjaby~VEERENDRA CHOWDARY~Veerendra Chowdary created the opening animation.Twitter: @NameisVeeru~MOOSA RAZA~Moosa Raza created additional background animation.Instagram: @syedraza7Twitter: @MoosaRaza27___Jaby WEST:https://youtube.com/GETJabyJaby ASIA:https://youtube.com/JabyTVJABY KOAY'S SHORT FILMS PLAYLIST:https://www.youtube.com/playlist?list=PL34B19BA788E18384Click here to subscribe and know when the next video drops:http://www.youtube.com/subscription_center?add_user=jabykoayThanks for watching!!!__Credit of my favorite movie reviews song:Highlight Reel Kevin MacLeod (incompetech.com)Licensed under Creative Commons: By Attribution 3.0 Licensehttp://creativecommons.org/licenses/by/3.0/"
"K38s8WANrno","December 2018 Current Affairs in Hindi 29 December 2018 - SSC CGL,CHSL,IBPS PO,RBI,State PCS,SBI","2018-12-28T16:44:16.000Z","UCrC8mOqJQpoB7NuIMKIS6rQ","Study IQ education","27","18.29.12","ddstha","41468","4265","44","764","https://i.ytimg.com/vi/K38s8WANrno/default.jpg","False","False","हमारा नया चैनलअभी तुरंत SUBSCRIBE करो , लेकिन सिर्फ बैंकिंग के अभ्यार्थियों के लिए हैं अपने दोस्तों को भी हमारे नए चैनल के बारे मैं बताओ SUBSCRIBE to this new channel by Study IQ, Exclusive videos for Banking Exams https://www.youtube.com/channel/UCGXsku75ELWndSG7kEihspg"
"cmdqPcxmrgU","9 PM | ETV Telugu News | 28th December 2018","2018-12-28T16:44:00.000Z","UCJi8M0hRKjz8SLPvJKEVTOg","ETV Andhra Pradesh","25","18.29.12","ETV,ETV Telugu,ETV NewsVideo,National News Video,ETV World,ETV Andhravani,AndhravaniVideo,ETV Talkies,Etv2,Etv Andhra News,Andhravani,Etv2 Ghantaravam,Etv2 India,Telugu News,Etv AP,AP News,AP,Etv Telugu,Etv News Live Video,Etv Sakhi,Etv Sukhibhava,Health Magazine,Health Show,Etv Margadarsi,ETV Aaha,etv2india,Latest News Videos,Mundhadugu,Lakshyam,ETV Telangana,Telangana News,Telangana Latest News,Telangana Updates,ETV Live,Live TV","183351","1503","236","306","https://i.ytimg.com/vi/cmdqPcxmrgU/default.jpg","False","False","News Headlines for States & Regional News Headlines"
"avzN9JZobL0","Technews 407 Jio Happy New Year Offer,Moto P40,Voto Mobiles,Samsung Sound on Display etc","2018-12-28T14:59:24.000Z","UCb-xXZ7ltTvrh9C6DgB9H-Q","Prasadtechintelugu","28","18.29.12","prasadtechintelugu,prasad,techtelugu,technews,prasad tech in telugu,voto,voto mobiles,sony mobile,sony mobile 2018,jio,jio cinema,disney,disney jio,jio new year offer,motorola,moto g7,moto g7 play,moto g7 power,prasad tech news","63563","6900","81","563","https://i.ytimg.com/vi/avzN9JZobL0/default.jpg","False","False","Support me :) (Everytime you buy using the below links I get a small commission which will help me make more Product Reviews for you)download flipkart app : http://fkrt.it/yhZv3!NNNNFlipkart : http://fkrt.it/y2g5K!NNNNAmazon : http://amzn.to/2jILUGjfollow me in social mediahttps://twitter.com/iamprasadtechhttps://www.facebook.com/prasadtechintelugu/https://www.instagram.com/prasadyoutuber/https://plus.google.com/u/0/+prasad923923My GearLG 32 inch IPS Monitor : http://amzn.to/2nIFVDnNikon d5200 : http://amzn.to/2mw1G5kNikon 50mm f1.8 prime lens : http://amzn.to/2mcEkQxCanon 80D : http://amzn.to/2BW7TP6Vanguard Tripod : http://amzn.to/2B4KCwOLogitech k480 keyboard : http://amzn.to/2BZyElELogitech MX Master Mouse : http://amzn.to/2BXXOBnDivoom Aurabox : http://amzn.to/2B2HYYxBlue yeti microphone : http://amzn.to/2nNBkPGBoom Arm Stand : http://amzn.to/2B0EYfpZoom H1 Audio Recorder : http://amzn.to/2nIUqHBRode Smart LAV + Mic : http://amzn.to/2B2vakPRode SC3 Adapter : http://amzn.to/2kfyZsKBluedio Headset : http://amzn.to/2uZ0Fs8Harison Softbox Studio Lights : http://amzn.to/2B4XLpQAcoustic Foam Background : http://amzn.to/2B0xOYtUSB RGB LED Strip : http://amzn.to/2nLecSAMobile Stand : http://amzn.to/2yQGQVTPower Extension Board : http://amzn.to/2B5YabHAndroid Toy : http://amzn.to/2yR9zK8Unboxing Knife : http://amzn.to/2B1aoSBintromusic creditssong name :DEAF KEV - Invincible [NCS Release]https://www.youtube.com/watch?v=J2X5mJ3HDYEartist credits:▽ Follow DEAF KEVSoundCloud https://soundcloud.com/atm-dubstepFacebook https://www.facebook.com/ATMDubstepYouTube https://www.youtube.com/user/ATMDubstep"
"n5kwpYIFLFA","निवडणूक २०१९ स्पेशल किर्तन l निवृत्ती महाराज इंदोरीकर l Nivrutti Maharaj Indorikar New Kirtan 2019","2018-12-28T11:30:00.000Z","UCTW7-0x11i8y0vJKWcMr2vQ","Marathi Tadka","24","18.29.12","Marathi Tadka,मराठी तड़का,Marathi Tadka Videos,election 2019,maharashtra election 2019,निवडणूक २०१९,महाराष्ट्र निवडणूक २०१९,२०१९,nivrutti maharaj indurikar kirtan,nivrutti maharaj latest kirtan 2018,nivrutti maharaj kirtan 2018,indurikar maharaj kirtan,indurikar maharaj kirtan latest 2018,indurikar kirtan,इंदुरीकर महाराज कीर्तन 2018,इंदुरीकर महाराज कीर्तन नवीन 2018,निवृत्ती महाराज इंदुरीकर विनोदी कीर्तन 2018,निवृत्ती महाराज कीर्तन 2018","112419","1963","114","61","https://i.ytimg.com/vi/n5kwpYIFLFA/default.jpg","False","False","निवडणूक २०१९ स्पेशल किर्तन,  ह.भ.प. इंदूरीकर महाराज कीर्तन, कडू पण सत्य, त्यांचे विचार जर मनाला पटले असतील तर जरूर Like करा share करा आणि subscribe करायला विसरू नका. व्हिडिओ बद्दलची प्रतिक्रिया comment मध्ये जरूर कळवा । धन्यवाद।Ⓒ Marathi Tadka 2018 Please Like, Share and Subscribe - Marathi Tadka☛ You tube  :  https://www.youtube.com/c/MarathiTadkaOfficial☛ Facebook :  https://www.facebook.com/marathitadkaOfficial☛ Instagram :  https://www.instagram.com/marathitadkaa☛ Twitter :  https://twitter.com/marathitadkaa☛ Website : http://marathitadka.com/☛ Write us   :  marathitadkateam@gmail.com☛ Whatsapp  :  8100007744Thank You!!"
"SQ2a6LtIwe4","GAVDEVI KHARDI CHASHAK 2018","2018-12-28T03:01:17.000Z","UCnfbpBrEGLhumIE8mJgChYQ","Global Tennis Cricket","17","18.29.12","[none]","120340","570","47","1","https://i.ytimg.com/vi/SQ2a6LtIwe4/default_live.jpg","False","False",""
"J7c9jLPC_0M","Kasthooriman || Serial || Today at 8:30 PM || Asianet","2018-12-28T05:35:14.000Z","UCp_r6Z-Oh0YTf-ym71z5Nqg","Asianet","24","18.29.12","asianet,malayalam channel,tv show,malayalam serial,entertainment,Kasthooriman || Serial || Today at 8:30 PM || Asianet,Kasthooriman,Kasthooriman asianet,Kasthooriman serial,Popular serial Kasthooriman,Watch Kasthooriman Serial,Kasthooriman Latest Episode,Kasthooriman Full Episode,Kasthooriman malayalam serial,Kasthooriman online,watch Kasthooriman serial online,Kasthooriman Serial Online,Kasthooriman latest episode hotstar,Kasthooriman promo","111518","582","79","314","https://i.ytimg.com/vi/J7c9jLPC_0M/default.jpg","False","False","Kasthooriman || Serial || Today at 8:30 PM || Asianet Watch All Shows: http://www.hotstar.com/asianetFollow Us On Facebook - https://www.facebook.com/Asianet                        Instagram - https://www.instagram.com/asianet                        Twitter - https://twitter.com/asianet"
"W41ORehGX_w","Bigg Boss S12 – Day 99– Watch Unseen Undekha Clip Exclusively on Voot","2018-12-27T06:10:00.000Z","UCFHhFwEdsLs2wuvh1YdChHw","Voot","24","18.29.12","Dipika Kakar Ibrahim,Sree Santh,Deepak Thakur,Bigg Boss,Season 12,BB House,full episodes,uncut videos,behind the scenes,unseen undekha,bigg buzz,Extra Dose,Salman Khan,Colors TV","293783","3761","179","269","https://i.ytimg.com/vi/W41ORehGX_w/default.jpg","False","False","Sree Santh and Dipika Kakar Ibrahim turn into the goofiest duo. Want an example? Watch them pull each other's hair in this hilarious unseen clip on Voot.Watch Now: https://bit.ly/2Nrb4rFDownload app link: https://bit.ly/2OmDTAR"
"zde-m2PzNes","Riders Music Festival ‘18 | #ShirleySetiaLive | Delhi","2018-12-28T12:34:32.000Z","UC_c7EFVXxmQMjj5E2CchGXg","Shirley Setia","10","18.29.12","riders music festival,shirley setia,shirley setia live,shirley setia concerts,shirley setia delhi,riders music festival 2018,red fm festival,nucleya,lucky ali,divine,raja kumari,bhuvan bam,shirley setia live show,rmf,rmf2018","54593","4705","123","424","https://i.ytimg.com/vi/zde-m2PzNes/default.jpg","False","False","Hey everyone! I recently had the great opportunity to play at the Riders Music Festival in Delhi and it was absolutely all kinds of amazing! The entire audience ( I was later told that there were 10-12k people present there) were singing and jumping along with us. Would like to thank Red Fm, Nisha and Rajat for having me there! Hope y’all like this little clip we put together! Lots of love,ShirleyVideo by: Rituraj DharwadkarBand creditsBass Guitar: Wilson Kenneth (Kenny)Lead Guitar: Daniel Rego Kenneth (Danny)Keyboard: Kushal ChhedaDrums: Vaibhav WavikarSound Engineer: JeetendraThanks Mourjo for making this happen!"
"7UslTkBHTtw","Challa (Main Lad Jaana) - URI | Vicky Kaushal , Yami Gautam | Shashwat S | Romy | Vivek Hariharan","2018-12-24T10:38:53.000Z","UCFFbwnve3yF62-tVXkTyHqg","Zee Music Company","10","18.29.12","Challa,Challa Uri Song,Main Lad Jaana,Challa Main Lad Jaana,Vicky Kaushal Song,Yami Gautam Songs,Shashwat Sachdev,Shashwat Sachdev Songs,Romy,Vivek Hariharn Songs,Yami Gautam,New Bollywood Songs,uri the surgical strike,Surgical strike movies,new songs2019,zee music company,chala songs,chala uri song","3566748","138726","3160","8472","https://i.ytimg.com/vi/7UslTkBHTtw/default.jpg","False","False","To stream & download Full Song -Gaana -  http://bit.ly/2QL8mihSaavn -  http://bit.ly/2PZX8RzWynk -  http://bit.ly/2rTzZXriTunes -  https://apple.co/2EM7raTAmazon Prime Music - https://amzn.to/2SjOVd5Hungama Music - http://bit.ly/2rTApNvReleasing in cinemas on 11th Jan 2019. Singer(s): Romy, Vivek Hariharan & Shashwat SachdevMusic: Shashwat SachdevLyrics: KumaarExecutive Music Producer: Vivek HariharanBacking Vocal(s): Yamy Singh, Arun Ingle, Mandar Apte, Nitin Tupe & Mayuresh MadgavkarMusic Produced & Performed By Shashwat SachdevPlucked Instrument(s): Tapas RoyBass: Mohini DeyTumbi: RomyDhol: Manoj Kumar Hela, Asfak Khavra, Kadir Khavra, Husen Langha, Iqbal Shiekh, Kadir Shiekh Sound Engineers             Yash Raj Studios, Mumbai: Shantanu HudlikarAssistant to Shantanu Hudlikar  Abhishek, ManasiKuhn Labs, Mumbai: Shashwat SachdevAsia Music Vision, Mumbai Rahul SharmaMixed & Mastered By Shadab Rayeen@NewEdgeAssistant to Shadab Rayeen Abhishek SorteyCast: Vicky Kaushal, Paresh Rawal, Yami GautamWritten & Directed By Aditya DharProducer: Ronnie ScrewvalaAssociate Producer: Sonia KanwarDirector of Photography: Mitesh MirchandaniLyrics:Main Lad Jaana Main Lad JaanaHai Lahoo Mein Ek ChingaariZidd Se Junoon Tak Hai JaanaHar Katra Bol RahaMain Lad Jaana x 3 (Twice)Main Lad Jaana Main Lad JaanaHai Lahoo Mein Ek ChingaariZidd Se Junoon Tak Hai JaanaHar Katra Bol RahaMain Lad Jaana x 3 (Twice)Challa Sirte Banke Kafan Jad Tureya Tanke Maut Nu Wajahn MaareVe Thar Thar Kambde Saare (x2)Main Lad Jaana x 3 (Twice)Yeh Dil Ki MashaaleinJosh Se Jala KeJalti lapton Ko Humne Haathon Mein Hai Thaam LiyaHai Woh Kar JaanaKe Saara ZamanaaPhir Dega Misaala YaroonSabko Apne Naam DiyaanMain Lad Jaana Main Lad JaanaHai Lahoo Mein Ek ChingaariZidd Se Junoon Tak Hai JaanaHar Katra Bol RahaChalla Sirte Banke Kafan Jad Tureya Tanke Maut Nu Wajahn MaareVe Thar Thar Kambde Saare (x2)#ZeeMusicOriginalsSet Challa Main Lad Jaana as your caller tune - SMS URI1 To 57575Airtel Subscribers Dial 5432116723411Vodafone Subscribers Dial 53710886378Idea Subscribers Dial 5678910886378BSNL (South / East) Subscribers SMS BT 10886378 to 56700BSNL (North / West) Subscribers SMS BT 7214602 to 56700Music on Zee Music CompanyConnect with us on :Twitter - https://www.twitter.com/ZeeMusicCompanyFacebook - https://www.facebook.com/zeemusiccompanyYouTube - http://bit.ly/TYZMC"
"61od5vYXB3M","Poco F2 Specs,Kirin 990 5G,Foldable Iphone,Xiaomi Washing Machine,Fake Alexa,Pixel 3XL Lite#723","2018-12-28T12:48:42.000Z","UC8vlDm5xvbxOrCvdu9UNOiA","Techno Ruhez","28","18.29.12","Poco F2 Specs,Kirin 990,Kirin 990 5G,Foldable Iphone,poco f2,xaiomi mijia waching machine,techno ruhez,huawei p30,hauwei p30 pro,samsung galaxy m1,pixel 3 lite,pixel 3xl lite,unboxing,india,hindi,tech news,technology,review,daily tech updates,tech news daily,best tech news,top tech news,technews,latest tech news,latest,latest updates,trick,online,daily news,hindi news,jio latest news","58797","8082","155","576","https://i.ytimg.com/vi/61od5vYXB3M/default.jpg","False","False","Adidas Shoes at Afforable Prices :1. Men's Adidas Nayo Running Shoes (Rs 4599) at Rs 1840 - http://bit.ly/2GRLM2K2. Men's Adidas Toril Running Shoes (Rs 4599) at Rs 1840 - http://bit.ly/2GGL8Fj3. Men's Adidas Adispree Running Shoes at Rs 1899 - http://bit.ly/2Rehnjp4. Adidas Shoes | Starting Rs 1600 only - http://bit.ly/2GGMf7X-------------------------------------------------------------------------------------------------------Hello Everyone Welcome To My Daily Tech News # 723My New Non-Tech Channel : https://goo.gl/vL0mh2News Covered :Poco F2 Specs,Kirin 990 5G,Foldable Iphone,,Xiaomi Washing Machine,Fake Alexa,Netflix Censored--------------------------------------------------------------------------------------------------Intro & Background Music : ‘Music by Epidemic Sound http://www.epidemicsound.com-----------------------------------------------------------------------------------------------Follow and Like my Page on Facebook: https://www.facebook.com/technoruhezFollow me on google plus: https://plus.google.com/+TechnoruhezFollow me on twitter: https://twitter.com/AmreliaRuhezFollow me on Instagram: https://www.instagram.com/technoruhez/Do Leave A Like And Subscribe For More Awesome Videos Like This DailyFor Business Enquiries: technoreviewww@gmail.com------------------------------------------------------------------------------------------------------My Gears Camera - Canon 200D : https://amzn.to/2BH97hSMonitor - AOC : https://amzn.to/2IWI9ovLight - https://amzn.to/2ISWcLVMic - https://amzn.to/2vguiY3My Laptop : http://fkrt.it/AlnD4LuuuNTechno Ruhez Channel ki Madad Kijiye aur Niche diye gaye link se Purchase KijiyeFlipkart : http://fkrt.it/vOdVL2NNNNAmazon : https://amzn.to/2GYuqx2-----------------------------------------------------------------------------------------------------NOTE : All content used is copyright to Techno Ruhez, Use or commercial display or editing of the content without proper authorization is not allowed"
"8rFqTRmtyuk","FIGHTING FOR YOUR GIRLFRIEND || Hyderabad Diaries","2018-12-28T10:44:13.000Z","UCQ86kqo-kULs8EU8ZqQTE1A","Hyderabad Diaries","24","18.29.12","Hyderabad,Diaries,hyderabad diaries,shahrukh k adnan,adnan shahrukh khan,abrar khan,zainab,new,video,kirrak,comedy,funny,girlfriend,boyfriend,hugmeimfamous,abrarkhanproductions,gulludada,adnansajidkhan,hyderabadi,hyderabadi comedy,she team,HD","114161","9203","868","582","https://i.ytimg.com/vi/8rFqTRmtyuk/default.jpg","False","False","SUBSCRIBE! New Videos Every week!For Business Inquiry : hyderabaddiaries@yahoo.comSecond Channel:Hyderabad Diaries Vlogs: www.youtube.com/hyderabaddiariesvlogs"
"BbuXKZ9t6LM","Tej Pratap Yadav ने Nitish Kumar को लिखा पत्र, बोले - नहीं मानी मांग तो घेरेंगे CM आवास | LiveCities","2018-12-27T15:27:24.000Z","UCGwWE0AEHEkHTUzKrzDjZSQ","Live Cities Media Private Limited","25","18.29.12","Tej pratap yadav,Tej pratap yadav News,तेज प्रताप यादव,तेज प्रताप यादव न्यूज़,tej pratap,तेज प्रताप,tejpartab yadav,tejpratab yadav,Tej pratap yadav speech,Tej pratap yadav video,RJD,राजद,RJD News,राजद न्यूज़,Tej Pratap Yadav Latest News,Patna News,Bihar News,हिंदी बिहार न्यूज़,बिहार खबर,पटना न्यूज़,bihar latest news,latest bihar news,Bihar Samachar,Nitish Kumar News,नीतीश कुमार न्यूज़,patna police news,patna police latest news,patna latest news","137666","1187","134","181","https://i.ytimg.com/vi/BbuXKZ9t6LM/default.jpg","False","False","Tej Pratap Yadav ने Nitish Kumar को लिखा पत्र, बोले - नहीं मानी मांग तो घेरेंगे CM आवास | LiveCities#TejPratapYadav #NitishKumar #RJD #JDU #Bihar #BiharNewsStay Connected with Us  :Subscribe Us for Latest News & Updates ►  https://goo.gl/mjiPnpFacebook ► https://goo.gl/5RLYLFTwitter ► @Live_Cities"
"NgJQUNMx6lo","ആൺകുട്ടികളെ തേച്ചൊട്ടിച്ചൊരു പെൺകുട്ടിടെ വീഡിയോ വൈറലാകുന്നു - Malayalam Video","2018-12-27T14:30:00.000Z","UCKEES_6ykHFizIjlh3tz1Fg","First Show","24","18.29.12","film news,movie news,movie gossips,mollywood,bollywood,tollywood,mohanlal,mammootty,prithviraj,dileep,nivin pauly,dulquer,Malayalam Video","60085","0","0","367","https://i.ytimg.com/vi/NgJQUNMx6lo/default.jpg","False","True","ആൺകുട്ടികളെ തേച്ചൊട്ടിച്ചൊരു പെൺകുട്ടിടെ വീഡിയോ വൈറലാകുന്നു !!!!!!"
