video_id,title,publishedAt,channelId,channelTitle,categoryId,trending_date,tags,view_count,likes,dislikes,comment_count,thumbnail_link,comments_disabled,ratings_disabled,description
"TmlruvEgVTg","Amloki - আমলকী| Bangla Serial - Preview | EP - 215 | 26th Nov,  2018 |#ZeeBangla","2018-11-27T07:27:34.000Z","UCeMsqI6jU9WE2ctsrbxbywQ","Zee Bangla","24","18.28.11","amloki,amloki serial,full episode amloki,zee bangla amloki,latest episode amloki,new zee bangla episode,amloki bengali serial,bangla serial amloki,today episode amloki,bangla tv serial,zee bangla Tv Show,zee bangla,Zee5,amloki natok,#zeebangla,family show,tv serial,tv shows,entertainmen,bengali tv serial,bengali shows","49597","320","17","6","https://i.ytimg.com/vi/TmlruvEgVTg/default.jpg","False","False","ZEE5 Now available in 190+ countries. Click Here http://bit.ly/WatchNowOnZEE5The feel of your language is in your entertainment too! Watch your favourite TV shows, movies, original shows, in 12 languages on #ZeeBangla , because every language has a super feel! Watch Full Episode on Zee5 : https://www.zee5.com/tvshows/details/amloki/0-6-tvshow_647916067Now enjoy ZEE5 Globally. Available in over 190 countries* To Feel ZEE5 in Your Language, DOWNLOAD the app now for #ZeeShows- Playstore: https://play.google.com/store/apps/details?id=com.graymatrix.did- iTunes: https://itunes.apple.com/in/app/ozee-tv-shows-movies-more/id743691886Visit our website - https://www.zee5.com Connect with us on Social Media: - Facebook - https://www.facebook.com/ZEE5/ - Instagram - https://www.instagram.com/zee5 - Twitter - https://twitter.com/ZEE5India Subscribe to ZEE Bangla channel  : https://bit.ly/2wheKUOAmloki is a Bengali drama television series starring Aishwarya Roy and Antara in the lead. The story is about life and journey of Amloki, a 6-year old girl, who is born deaf and dumb. A unique bond shared by a mother-daughter pair, is the central theme of this series. Join her journey as she explores her talent to make a living and also nurtures values that she has learnt from her mother.#bangla #zeebangla #zeebanglashow #banglatvserial #bengaliserial #comedyshow #realityshow #entertainment #zee5 #zeetvshow"
"jlm6ZwMoUNQ","Bepannah - 26th November 2018 - बेपनाह","2018-11-27T04:45:12.000Z","UC55IWqFLDH1Xp7iu1_xknRA","Colors TV","24","18.28.11","Colors TV,colorstv,hindi shows,VOOT,new promo,clips,3 minute clip,Bepannah voot clip,Bepannah full episode online,watch Bepannah online,Aditya,Zoya,love,partners,worlds,collide,shocking,twist,brutal,accident,unbearable loss,unanswered questions,affair,marriages,sham,story,betrayal,Jennifer Winget,Bepanaah,#Bepannah,bepanah,bepanah serial,bepanah song,bepanah full episode,bepanah promo,bepanah episode,bepanah bepanah,#bepanah,#bepanaah","102891","463","35","63","https://i.ytimg.com/vi/jlm6ZwMoUNQ/default.jpg","False","False","To watch the full episode of 'Bepannah' anytime, Download the Voot app now or Visithttps://www.voot.com/shows/bepannah/1/572880/shocker-who-saved-anjana/676302Aditya and Zoya are madly in love with their respective partners, until one day their worlds collide in the most shocking twist. Their spouses are found together, after losing their lives in a brutal accident! Dealing with the unbearable loss, Aditya and Zoya are hounded by many unanswered questions - why were their partners together? Were they having an affair? Were their marriages nothing but just a sham? Watch this complicated story of love and betrayal unfold now on Colors."
"XlFiQSJRoEQ","आज मंगलवार है महावीर का वार है | Most Popular Hanuman ji song | Bajrangbli Song | @Sonotek Bhakti","2018-11-26T23:00:02.000Z","UC3oQ1986eLZ4MhyPBiu54PA","Sonotek Bhakti","10","18.28.11","आज मंगलवार है,महावीर का वार है,aaj mangalwar hai,mahaveer ka war,sunita panchal,bhajan bhakti,ras,kirtan,sonotek bhakti,hanuman bhajan,hanuman song,balaji bhajan,bhakti,bhajan,morning chant,chant,ram,song,bhakti song,bhakti bhajan,satsang,shyam,krishan,shiv,mata rani,mata,sherawali,devi maa,maa,devotional song","118632","741","138","159","https://i.ytimg.com/vi/XlFiQSJRoEQ/default.jpg","False","False","Hanuman Bhajan, Hanuman Song, Balaji Bhajan, bhakti, bhajan, morning chant, chant, ram, song, bhakti song, bhakti bhajan, satsang, shyam, krishan, shiv, mata rani, mata, sherawali, devi maa, maa, devotional songभक्ति पूर्ण गानों के लिए क्लिक करें | http://goo.gl/Jz3ffrSinger - Sunita PanchalAlbum - Aaj Mangalwar Hai Mahaveer Ka War HaiLyrics - Brahampal NagarEdit - Mirtunjay Baba ( Sonotek Video Studio )Music - Master HansrajLabel - Chanda CassettesContact Person - Ankit Vij 09899429419, Leela Krishan Ji (09212183337 )Mail Us - sonotekaudio@gmail.comFacebook subscribe  : http://goo.gl/mLL48zLike us:  http://goo.gl/Xz1hcHfollow us :  http://goo.gl/JBLsrgShree, Sri, Shri, Lord, God, Bhagwan, Jai, Jay, Karma, Peace, Value, Sanskar, Hindu, Religion, Sect, Bhajan, Aarti, Song, Chalisa, Praise, Mantra, Meditation, Mind, Enlightenment, Devotional, Guru, Guide, Divine, Force, Temple, Yoga, Dance, Pooja, Archana, Hare, Healing, Master, Teaching, Sanskrit, India, Culture, Daily, Life, Prayer, Ram, Sita, Shiva, Shankar, Ganesh, Ganpati, Krishna, Laxmi, Saraswati, Hanuman, Sai Baba, Kali, Durga, Ambe, Shreenathji, Maa, Hindi, MP3, Download, Stotra, Vishnu, Mahalaxmi, Ramayan, Gayatri, Free, Album, Sangraha"
"vrTtSE8jB9w","Back to School - Mini Series Promo - Nakkalites","2018-11-26T14:21:22.000Z","UCiPmhfdCL06cSVTXKabF0Zg","Nakkalites","23","18.28.11","Nakkalites,Amma alaparaigal,Nakkaites new video,Morattu single,Singles nakkalites,Morattu single nakkalites,Nakkalites new video,Tamil youtubers,Nakkalites arun,Nakkalites sassi,Nakkalites bloopers,Morattu single alaparaigal,Divo,Divo creators,back to school nakkalites,mini series nakkalites,mini series promo,new mini series nakkalites","189988","7998","126","718","https://i.ytimg.com/vi/vrTtSE8jB9w/default.jpg","False","False","Back to School - Mini Series Promo - Nakkalites"
"_xLRfDuRbck","The Trip - The Trip 2 | Vows | Episode 9","2018-11-23T13:30:01.000Z","UCzo5sreD2cVGu2T2mNu__1Q","bindass","43","18.28.11","bindass,bindass official,bindass channel shows,bindass channel serial,bindass tv shows,bindass tv programs,bindass tv,the trip 2,bindass trip 2,trip 2 episode 9,trip 2 finale,trip finale,mallika dua,sapna pabbi,amyra dastur,shweta tripathi,harman singha,pranay pachauri,shivam bhargava","1933397","34157","2121","2168","https://i.ytimg.com/vi/_xLRfDuRbck/default.jpg","False","False","All's well that ends well - and the girls definitely took a long trip to reach that conclusion! But will they finally get their fairytale ending? Watch the 9th Episode of #TheTrip2 for that ultimate closure! | Presented by Lakme!  About The Trip 2: The Trip series is back with a new season! The second season explores the journeys of four friends played by Sapna Pabbi, Shweta Tripathi, Mallika Dua and Amyra Dastur as they explore South India's beauty through an exhilarating road trip yet again!What was meant to be FOMO causing Vacay Goals, turns into yet another dramatic desi wedding with a twist, some more drama and a lot of self-discovery for the girls!Presented by #BindassOriginals►Download the BINDASS APP → http://bindass.com/download.html ►SUBSCRIBE To bindass: http://bit.ly/1bfqpUbFor More Videos & Downloads visit bindass: http://www.bindass.com►Follow Bindass:Facebook: https://www.facebook.com/bindass Twitter: https://twitter.com/bindasstv Google+: https://plus.google.com/+bindass Instagram: http://instagram.com/bindasstvWatch more popular shows on bindass:►Girl in the City - http://bit.ly/2DF8Zml► Girl in the City - Chapter 2: http://bit.ly/2F5N0lB ► The Trip - http://bit.ly/2GaUiWj ► Dil Buffering - http://bit.ly/2BnDWpz ►Yeh Hai Aashiqui - http://bit.ly/1yNiecX    Best of Yeh Hai Aashiqui: http://bit.ly/1J5nVWQ"
"PG372qy_TtQ","തമന്നയുടെ വസ്ത്രം അഴിഞ്ഞുപോയി പിന്നീട് സംഭവിച്ചത് കണ്ടോ | Malayalam News","2018-11-27T15:00:29.000Z","UCKEES_6ykHFizIjlh3tz1Fg","First Show","24","18.28.11","film news,movie news,movie gossips,mollywood,bollywood,tollywood,mohanlal,mammootty,prithviraj,dileep,nivin pauly,dulquer,Malayalam News,തമന്ന","65105","0","0","20","https://i.ytimg.com/vi/PG372qy_TtQ/default.jpg","False","True","തമന്നയുടെ വസ്ത്രം അഴിഞ്ഞുപോയി പിന്നീട് സംഭവിച്ചത് കണ്ടോ !!!!!!"
"7y56JjueBUk","కన్నబిడ్డలైనా దీప, కార్తీక్ లను ఒక్కటి చేస్తారా?   #KarthikaDeepam Today at 7:30 PM","2018-11-27T12:29:39.000Z","UCJF4y2nyCCrDKTgA7dxz1Qw","Star Maa","24","18.28.11","Star Maa,Starmaa,Starmaa serials,Telugu TV,Telugu Serials,Maatv Serials,Maa tv. drama,comedy action,entertainment,Telugu,tollywood,maatv,star telugumaa,maatelugu","29719","88","13","7","https://i.ytimg.com/vi/7y56JjueBUk/default.jpg","False","False","#StarMaaSerials"
"uvZixVJYHhg","🔴 [Live] Bhadaur (Barnala) Kabaddi Tournament 26 Nov 2018","2018-11-26T20:59:26.000Z","UCw3P0coE7lUv5v0HoQfRZhw","Kabaddi365.com","17","18.28.11","Kabaddi365.com,kabbadi tournament,kabaddi videos,kabaddi photos,365kabaddi,kabbadi,kabaddi live,livekabaddi,Live,Bhadaur,Barnala,Kabaddi,Tournament,26 Nov 2018,Live Kabaddi365,Kabaddi365 Live,Live Today,Live Tournament","359424","4343","266","20","https://i.ytimg.com/vi/uvZixVJYHhg/default.jpg","False","False","🔴 [Live] Bhadaur (Barnala) Kabaddi Tournament 26 Nov 2018🖐🏿👉Don't Forget to Like, Comment, Share and Subscribe to Kabaddi365.com Youtube Channel👉ਤੁਸੀ ਆਪਣੇ Android ਤੇ iPhone ਫੋਨ ਲਈ Kabaddi365 ਦੀ ਐਪ ਇਨਸਟਾਲ ਕਰਨ ਲਈ ਥੱਲੇ ਦਿੱਤੇ ਲਿੰਕ ਤੇ ਕਲਿਕ ਕਰੋ ! http://www.kabaddi365.com/app👉ਬੈਸਟ ਕਬੱਡੀ ਮੈਚ ਦੇਖੋ : http://www.youtube.com/user/365kabaddi👉ਫੇਸਬੁੱਕ ਪੇਜ:- http://www.facebook.com/kabaddi365👉ਸਾਰਾ ਟੂਰਨਾਂਮੈਂਟ ਦੇਖਣ ਲਈ: http://www.youtube.com/user/kabaddi365f👉Best Video Channel:- http://www.youtube.com/user/365kabaddi👉Facebook Page:- http://www.facebook.com/kabaddi365👉Full Video Channel:- http://www.youtube.com/user/kabaddi365f"
"c8RfGXWfx1E","Singer Baby in Mirrors Luxury Salon | Jubilee Hills, Telangana | TV5 News","2018-11-24T08:58:21.000Z","UCAR3h_9fLV82N2FH4cE4RKw","TV5 News","25","18.28.11","Singer Baby in Mirrors Luxury Salons | Jubilee HIlls | TV5 News,tv5,tv5 news,tv5 latest news,latest telugu news,telugu news,latest news,tv5 latest telugu news,tv5 live,tv5 youtube,tv5 live telugu,tv5 telugu live,Singer Baby,singer baby,singer baby song,singer baby interview,mirrors luxury salons hyderabad telangana,mirrors luxury salons,mirrors luxury salon hyderabad","835166","12254","558","964","https://i.ytimg.com/vi/c8RfGXWfx1E/default.jpg","False","False","Singer Baby in Mirrors Luxury Salon #JubileeHIlls #TV5News is 'Telugu Live news' which gives 24 Hours 'Live News' covering 'politics news', 'sports news', 'entertainment news'. 'TV5 News Live' is 'Telugu live Streaming' on YouTube giving 'hourly news' updates. This is our 'Telugu Live TV' 'Live Streaming' on YouTube which can be accessed from anywhere across the Globe. 'News Update', 'Telangana News', 'Andhra News' along with 'popular celebrities' 'live' with 'Chit Chat' on their 'latest film reviews' and 'Latest movie updates'.Here you can find 'Telugu Live Breaking News' 'Telugu YouTube Live News'. We are one of the leading 'Telugu Live News Channel'. You can watch 'Telugu Live News Updates' 'Telugu Live News TV5'. We have 'Telugu Live News Website' http://www.tv5news.in. You can watch #TV5Live Streaming' from our website. On YouTube Watch 'TV5 Telugu News Online HD'.For More Updates► TV5 News Live : https://goo.gl/UPacax► Subscribe to TV5 News Channel: http://goo.gl/NHJD9►  Download TV5 Android App: http://goo.gl/8mMEOX►Our Website : http://www.tv5news.in► Like us on Facebook: http://www.facebook.com/tv5newschannel► Follow us on Twitter: https://twitter.com/tv5newsnow► Circle us on TV5 News Channel G+: https://plus.google.com/+tv5newschannel► Follow us on Pinterest: https://www.pinterest.com/tv5newschannel"
"rT1f07ofnqw","Whatsapp status tamil - Surya Cut Song...","2018-11-27T11:59:33.000Z","UCUPsaRAXAcSoyHiCQJ_ZgFQ","Anbu Selvan AR","22","18.28.11","whatsapp status tamil,whatsapp status,tamil whatsapp status,tamil whatsapp status love,whatsapp status Comedy,tamil whatsapp status latest,whatsapp status new song,whatsapp status video tamil songs,whatsapp status new,Anbu Selvan AR","39232","627","18","12","https://i.ytimg.com/vi/rT1f07ofnqw/default.jpg","False","False",""
"kb5PHimLUYI","Exit Poll # सट्टा मार्केट # मप्र - छग व राजस्थान चुनावों पर सट्टा मार्केट का नया सर्वे आया सामने ।","2018-11-27T09:53:26.000Z","UCaJ1Ups6wh3HLJRAiXuxXKg","Opinion Poll NEWS","25","18.28.11","भाजपा,कांग्रेस,आज तक,ओपिनियन पोल,एैग्ज़िट पोल,सर्वे,सचिन पायलट,अशोक गहलोत,शिवराज सिंह,कमलनाथ,ज्योतिरादित्य सिंधिया,वसुंधरा राजै,नरेंद्र मोदी,टीएस सिंह देव,BJP,Congress,Opinion Poll,Latest News,Exit Poll,Rahul Gandhi,Narendra Modi,Elections 2018,चुनाव 2018","421047","2971","670","501","https://i.ytimg.com/vi/kb5PHimLUYI/default.jpg","False","False","जनतापोल - सबसे सटीक राजनैतिक विश्लेषण, हर राज्य पर पैनी नज़र ।"
"GYT00yRLXbA","K A Paul Satire on TDP MLA Nandamuri Balakrishna | 99 TV Telugu","2018-11-27T08:22:57.000Z","UCl5YgCiwSRVOiC2Nd1P9v1A","99TV Telugu","25","18.28.11","KA Paul,k a paul,KA Paul Satire on TDP MLA Nandamuri Balakrishna,KA Paul Satire on Nandamuri Balakrishna,ka paul comments on chandrababu,ka paul comments nbk,ka paul comments on ap politics,ap news,K A Paul Satires,ka paul punch on balakrishna,k a paul interview,99 live,99 tv telugu,99tv,99tv live,k a paul sensational comments,99tv telugu","239031","4588","564","1350","https://i.ytimg.com/vi/GYT00yRLXbA/default.jpg","False","False","Praja Santhi Party Chief KA Paul Satire on TDP MLA Nandamuri BalakrishnaThe news of 99TV Telugu is daring, straightforward and biased only towards people.Using its unparalleled infrastructure, 99TV Telugu has brought shows that were unprecedented in its genre. As a pioneer in infotainment, it has launched a series of game shows and interactive content. Its hard-hitting news, frank questioning and result oriented analysis driven by its in-depth journalism have made it the agenda setter for the Telugu people. ►Subscribe to 99tv Telugu: https://www.youtube.com/99tvtelugu?sub_confirmation=1►Like us on Facebook: https://www.facebook.com/99tvtelugu► Follow us on Twitter:  https://twitter.com/99tvtelugu► https://www.instagram.com/99tvtelugu/► https://plus.google.com/u/0/+99TVTelugu"
"rCwZMNwwEgs","गावाकडच्या गोष्टी|भाग#४१|Gavakadchya Goshti|EP#41|Marathi Web Series","2018-11-26T02:28:40.000Z","UChJBjEipru2hvTq1pgi24Pg","Kori Pati Productions","23","18.28.11","how to,kori pati,hit,marathi,comedy,web series,gav,village,award winning,satya surki,bapu,gavakadchya goshti,new,satara,maharashtra,mumbai","288917","10105","439","1204","https://i.ytimg.com/vi/rCwZMNwwEgs/default.jpg","False","False","बापू निघाला व्यसनमुक्ती केंद्रात पुढे काय झालं..? नक्क्की बघा"
"wlSmLL9mkfQ","6 DIY Giant Candy vs Miniature Candy / Funny Pranks!","2018-11-26T20:00:03.000Z","UCWwqHwqLSrdWMgp5DZG5Dzg","Troom Troom","26","18.28.11","Funny Pranks,DIY Giant Candy,Giant Candy,DIY Miniature Candy,Miniature Candy,Giant vs Miniature,Giant Candy vs Miniature,yummy,delicious,Sweet-tooth,funny video,prank ideas,how to prank,Joke,funny,Edible Experiments,Funny Experiments,Tricks With Food,Funny Candies,Funny Sweets,Troom Troom","428174","7570","469","638","https://i.ytimg.com/vi/wlSmLL9mkfQ/default.jpg","False","False","Subscribe Here: https://goo.gl/KM3AxwGiant Squishy Food vs Real Food Challenge!: https://youtu.be/tNnVW3DbpHw?list=PLy0LaulZe0vRyRDcwVaqbvnbSqhSQNtS-Do you like huge candies? Or you prefer miniature sweets? Maybe your choice depends on your today’s mood? Whatever it was, our new video has sweets for any situation!Supplies and tools:• Lunchbox • Mentos• Food coloring• Parchment paper• Cornstarch• Printed Altoids label• White fondant• Foil• Printed Mentos label• Cardboard box• Hot glue gun• Scissors• Acrylic paints• Sponge brush• Styrofoam ball• Light clay• Foam rubber sheet• Red cardboard• Corn bars• Big PEZ label• Short crust cookies• Butter• Apples• Sugar• Phyllo dough• Eggs• Milk• Flour• Topping• Frozen berries• StrawMusic:  Music: Tobu - Dreamshttp://youtube.com/tobuofficialItalian Afternoon by Twin Musicom is licensed under a Creative Commons Attribution (https://creativecommons.org/licenses/by/4.0/). Artist: http://www.twinmusicom.org/ Jumpin Boogie Woogie by Audionautix is licensed under a Creative Commons 4.0 Unported License.Source: http://audionautix.comMountain Sun by Audionautix is licensed under a Creative Commons Attribution (https://creativecommons.org/licenses/by/4.0/). Artist: http://audionautix.com/Watch More Troom Troom: Popular Videos:14 Weird Ways To Sneak Food Into Class / Back To School Pranks:  https://youtu.be/W5p2ndS34vA18 Funny Pranks! Prank Wars! https://youtu.be/yWazGzCNtJ411 DIY Edible Makeup Ideas/11 Funny Pranks:  https://youtu.be/kewz3hF63Xo17 Weird Ways To Sneak Makeup Into Class:  https://youtu.be/bvhBIsmzhwEGummy Food vs Real Food Challenge!  https://youtu.be/jBIG6GsQcq8Popular Playlists:Funny Pranks: https://goo.gl/hi5TWwBack to School: https://goo.gl/J5fhDtLife Hacks: https://goo.gl/Bcd7KWBeauty And Makeup Hacks: https://goo.gl/RqpxqgHome Décor: https://goo.gl/Rh88ELFollow Troom Troom:Subscribe: https://goo.gl/KM3AxwInstagram: https://www.instagram.com/troomtroom/Facebook: https://www.facebook.com/troomhandsPinterest: https://pinterest.com/troomtroom/Troom Troom Español: Subscribe: https://goo.gl/RL3cF2Troom Troom Française:Subscribe: https://goo.gl/1LHrhXTroom Troom Russian: Subscribe: https://goo.gl/kLx8qKTroom Troom Deutsch:Subscribe:  https://goo.gl/qoFyJ4Troom Troom Chinese:Subscribe:  https://goo.gl/T9B6oFTroom Troom Português:Subscribe:  https://goo.gl/Z6vdNCTroom Troom Japanese:Subscribe: https://goo.gl/x3V8HHAbout Troom Troom: Easy DIY how to video tutorials. DIY Accessories, Scrapbooking Cards, Home Décor, Make Up Tutorials, Life Hacks, and MUCH more! Make it easy! For any business enquires please contact me at: troomtroomdiy@gmail.comQuestion of the Day: what sweet idea did you like the most? Comment Below!Don’t forget to turn on notifications, like, & subscribe!"
"SW85mbEy4OU","Ennu Swantham Jani | 26th Nov 2018 | Surya TV","2018-11-27T10:29:39.000Z","UCHyU1e7YmhHgUnVwpP5hpYA","Surya Television","24","18.28.11","Surya TV,Soorya TV,Malayalam Programs,Malayalam Entertainment,Malayalam Serials,Surya TV Serials,SuryaTV","59021","104","37","25","https://i.ytimg.com/vi/SW85mbEy4OU/default.jpg","False","False","Steps to avail 20% Discount on Sun NXT subscription:  1 Logon to http://bit.ly/YT20OFFER or Download Sun NXT android app from Playstore. 2 Click on any video content & Sign up or Sign in. 3 Enter the Coupon YT20 in the Coupon Code option in Subscription Pop-Up. 4 Complete your payment on discounted price.￼      Offer applicable only for Quarterly & Yearly packs. 5 iPhone customers can avail the discount from your browser onlyT&C Apply.Enjoy Sun NXT. T&C:·         This discount offer is not applicable for users from US.·         The discount if applicable only of new purchases and not for renewals·         The renewals for the discounted purchase will be on the actual cost·         Offer applicable only for Quarterly & Annual Packs·         Offer not applicable for users paying via iTunesWatch Ennu Swantham Jani - 26th Nov, 2018, Full Episode on Sun NXT : http://bit.ly/YtMalEnnuJani is an orphaned six-year-old, she has people who takes care of her at the same time who wants to kill her. The serial showcases her struggles in life losing her mother and later on her father too. Thamara, Abayan, Jeevan, are the ones who lives to ensure Jani’s safety. Mortuary Mani a goon, has vowen to destroy Jani as she gave witness to the murder he committed. How Jani struggles to live in this world, ensuring not just her’s but her loved ones safety forms the story of this heart touching serial.To Watch all SURYA TV Programs on Sun NXT Click http://bit.ly/SuryaTVLIVEWatch 4000+ Movies, 40+ Live TV Channels, TV Shows, Music Videos, Comedy and exclusives on Sun NXT anytime anywhere.Download Sun NXT Now to Enjoy Unlimited entertainment,Android: http://bit.ly/SunNxtAdroidiOS: India - http://bit.ly/sunNXTiOS Rest of the World - http://bit.ly/ussunnxtor Visit https://www.sunnxt.comFollow Us On Our Social Media LinksFacebook     : https://www.facebook.com/SuryaTVTwitter          : https://twitter.com/SuryaTVInstagram    : https://www.instagram.com/suryatelevision/Watch all SuryaTV Programs on Sun NXT AppSunNXT: https://www.sunnxt.com/"
"dkGIdIVAkYw","सिंघाड़े की मसालेदार सब्जी ।  Singada ki sabji | Paniphal ki Curry Recipe","2018-11-26T05:43:40.000Z","UCgoxyzvouZM-tCgsYzrYtyg","Nisha Madhulika","26","18.28.11","singhada curry recipe,Singhare ki Sabji,Singhara Masala,shingada recipe,Singhare ki Sabji Recipe,Water Caltrop Recipe,How to make Singhare,How to make Paniphal Masaledar,singhare ki sabji kaise banti hai,water chestnut curry,singhare ki sabji kaise banaye,paniphal benefits,singhara flour recipes,how to boil singhara","130017","2480","176","1009","https://i.ytimg.com/vi/dkGIdIVAkYw/default.jpg","False","False","Singhare ki Sabji Recipe , water chestnut curry,  Paniphar ki sabziIngredients:Water Chestnut - 400 gmsTomatoes - 2 (100 gms)Ginger - ½ inch BatonGreen chilli - 2Mustard Oil - 2 tbspGreen Coriander - 2 to 3 tbsp (finely chopped)Asafoetida - ½ pinch Cumin Seeds - ½ tspTurmeric Powder - ½ tspCoriander Powder - 1 TspRed chilli powder - ½ tspGaram Masala - less than ¼ tspSalt - ¾ tspChickpea Flour - 1 tbspHow to make Singhara Curry (Water Chestnut)For boiling Singhara1- Take 400 gms of Singhara after washing and drying them. 2- For the boiling process, add them in the pressure cooker along with 1 cup of water. 3- Turn on the flame, close lid of the cooker and boil until the first whistle arrive.4- Turn the flame to low after the first whistle and leave them to cook for more 2 minutes. 5- Switch off the flame after 3 minutes and wait until its pressure releases. 6- Drain the boiled Singharas out of the cooker and let them cool down.7- After cooling, peel the boiled Singharas using a knife. For the Curry 1- Preheat 2 tbsp of Mustard Oil, add ½ tsp of Cumin Seeds on the low flame and roast it.2- Add ½ pinch of Asafoetida, ½ tsp of Turmeric Powder, 1 tsp of Coriander Powder and saute the spices.3- Prepare a paste of Tomatoes, Green Chillies and Ginger. 4- Add the paste in the sauteed spices along with ½ tsp of Red chilli powder and cook while stirring it on the medium flame. 5- Roast the spices until Oil separates from it.6- Take a tempering pan and add 1-2 tbsp of Oil in it, add 1 tbsp of chickpea flour in it and roast while continuously stirring it until its colour changes. 7- Add the roasted chickpea flour in the masala mixture.8- Add the Boiled Singharas in the masala mixture along with ½ tsp of Salt, less than ¼ tsp of Garam Masala, 2 to 3 tbsp of finely chopped Green coriander and roast while continuously stirring them for 2 minutes. 9- Add ½ / 1 cup of water in it and cook while covering it for 5 minutes on the low flame. 10- The Singhara curry is ready to be served11- Garnish it with finely chopped Green Coriander.Serving:1- You can serve it with Chappati, Paratha, Naan or Rice.2- This amount of the curry is enough for the 3-4 members of a family.    Subscribe for more recipes - http://www.youtube.com/subscription_center?add_user=nishamadhulikaFor the Best recipes on YouTube, log onto - http://www.youtube.com/nishamadhulikaFind us on Facebook at - https://www.facebook.com/nishamadhulikaVisit my Hindi Websitehttp://nishamadhulika.com"
