video_id,title,publishedAt,channelId,channelTitle,categoryId,trending_date,tags,view_count,likes,dislikes,comment_count,thumbnail_link,comments_disabled,ratings_disabled,description
"EbLEDSY6UiI","simbu spoiled my life manmadhan director slams #simbu tamil news live","2018-12-30T11:30:01.000Z","UCe1Nb-N6XgLFHfGxZjIkF8A","Red Pix 24x7","25","19.01.01","redpix,red pix,red pix 24x7,news tamil,tamil,tamil live news,tamil news,tamil news today,tamil news live,latest tamil news,tamil nadu news,news in tamil,sun tv news,sun news,sun news live,news,chennai news,simbu,simbu simbu,#simbu,manmadhan,manmadhan director","194372","3639","695","884","https://i.ytimg.com/vi/EbLEDSY6UiI/default.jpg","False","False","simbu spoiled my life manmadhan director slams #simbu tamil news live   While t rajendar fight a legal battle to sell manmadhan movie hindi rights, the director of the movie aj murugan claims that it was his story that t rajendar is selling to hindi market. In an interview to red pix felix gerald, aj murugan told that #simbu has spoiled his career, he also said that simbu promised for next movie call sheet and a lump sum of money for the movie manmadhan but he never kept his promise    simbu,simbu simbu, tamil, #simbu, manmadhan, manmadhan director,More tamil news tamil news today latest tamil news kollywood news kollywood tamil news Please Subscribe to red pix 24x7 https://goo.gl/bzRyDm #interview  sun tv news sun news live sun news"
"Lci7GrFI24Y","Panchayat Elections: ਜਦੋਂ GUrdas Badal ਦੇ ਪੈਰੀ ਪਿਆ Badal ਜੋੜਾ","2018-12-30T07:58:18.000Z","UCCdck7pTS5H4SR2VZw_O96A","Jagbani","25","19.01.01","punjabi news,punjab tv,punjab news,Punjab Video News,jagbani,Panchayat Election,Punjab Panchayat Election,Election Result,Gurdas Singh Badal,Sukhbir Singh Badal,Harsimrat Kaur Badal,Sukhbir Meet Gurdas Badal,Gurdas Badal","202029","950","276","170","https://i.ytimg.com/vi/Lci7GrFI24Y/default.jpg","False","False","#PanchayatElection #GurdasSinghBadal #SukhbirMeetGurdasBadal"
"ARKEIs-DTEs","Bokul Kotha - বকুল কথা | Eshar Biye | Bangla Serial | Mon - Sat 9:00 PM | Weekly Promo | #ZeeBangla","2018-12-31T08:44:25.000Z","UCeMsqI6jU9WE2ctsrbxbywQ","Zee Bangla","24","19.01.01","bokul kotha,bokul,bokul kotha serial,full episode bokul kotha,zee bangla bokul kotha,latest episode bokul kotha,bokul kotha bengali serial,bangla serial bokul kotha,today episode bokul kotha,bangla tv serial,zee bangla Tv Show,zee bangla,Zee5,#zeebangla,family show,tv serial,tv shows,entertainment,bangla drama,bengali tv serial,bengali shows,comedy serial,Bangla Comedy serial,bengali comedy serial,Eshar Biye,promo","207591","1520","87","30","https://i.ytimg.com/vi/ARKEIs-DTEs/default.jpg","False","False","ZEE5 Now available in 190+ countries. Click Here http://bit.ly/WatchNowOnZEE5The feel of your language is in your entertainment too! Watch your favourite TV shows, movies, original shows, in 12 languages on #ZeeBangla , because every language has a super feel! Watch Full Episode on Zee5 : https://www.zee5.com/tvshows/details/bokul-kotha/0-6-1166Now enjoy ZEE5 Globally. Available in over 190 countries* To Feel ZEE5 in Your Language, DOWNLOAD the app now for #ZeeShows- Playstore: https://play.google.com/store/apps/details?id=com.graymatrix.did- iTunes: https://itunes.apple.com/in/app/ozee-tv-shows-movies-more/id743691886Visit our website - https://www.zee5.com Connect with us on Social Media: - Facebook - https://www.facebook.com/ZEE5/ - Instagram - https://www.instagram.com/zee5 - Twitter - https://twitter.com/ZEE5India Subscribe to ZEE Bangla channel  : https://bit.ly/2wheKUOBokul Kotha is a Bengali television series starring Ushasi Ray and Honey Bafna in the lead. This is a story of Bokul, a tomboyish girl, who looks after all the responsibilities of a head of the family. After a lot of drama and confusion, she is married off to Rishi, who has already rejected 40 women for marriage.#bangla #zeebangla #zeebanglashow #banglatvserial #bengaliserial #comedyshow #realityshow #entertainment #zee5 #zeetvshow"
"KluzAAHa16I","Rs 3,20,90,500 - My 2018 Income Report","2018-12-31T08:58:49.000Z","UCFzyeVLrv5xzn2iTjnjaNTw","Amit Bhawani (PhoneRadar)","28","19.01.01","PhoneRadar,Youtube,Youtube Income,Youtube Revenue,Youtube Money,Make Money,Make Money 2019,Make Money 2018,How to make money,make money online,youtube money,youtube easy money,QnA,Amit Bhawani,Ask Amit Bhawani","50523","4944","230","734","https://i.ytimg.com/vi/KluzAAHa16I/default.jpg","False","False","Read about Mini Websites http://www.amitbhawani.com/make-money-mini-site/In this Video, #AmitBhawani answers your questions that you asked about #MakeMoney and #Youtube. Like this Video to Appreciate our Efforts, Subscribe to   https://youtube.com/PhoneRadar for Daily Tech Videos. Also, Tap on the Bell for Daily Notifications.Follow http://phoneradar.com on Social Media Belowhttp://twitter.com/phoneradarbloghttp://twitter.com/amitbhawanihttp://instagram.com/phoneradar on InstagramAll content used is copyright to PhoneRadar, Use or commercial display or editing of the content without proper authorization is not allowed."
"WqOi1JENS30","Padi Padi Leche Manasu | Emai Poyave Cover Song | Shanmukh Jaswanth","2018-12-28T15:01:01.000Z","UCjbBFvK04b-O3foSNabdrOA","Shanmukh Jaswanth","24","19.01.01","Shanmukh Jaswanth Dance covers Telugu Dance covers Telugu dance covers 2016,Telugu dance covers 2017,PadiPadiLecheManasu,Kallolam,Sharwanand,shannu,Shanmukh short films,cover song,sid sriram","735861","28049","2483","2479","https://i.ytimg.com/vi/WqOi1JENS30/default.jpg","False","False","A video song from movie Padi Padi leche manasu.Direction, Story, D.O.P, Screenplay and Editing : Vinay shanmukhCast : Shanmukh, Soniya, Rohit, Satish saripalli and RakeshProduced by infinitummediaDailogues : Shrija ReddyAssistant Cameraman : Ram NathAssistant Director : Sai kumar and TejaPoster Design : mks_manojSound Engineer : kalaka Srinivas Rao."
"eP5UrTfm6pg","नया साल नए आप | Change your Life in 2019 | Happy New Year","2018-12-30T13:30:01.000Z","UCZQDF0x18Xe6RZayvod99zA","Him-eesh Madaan","26","19.01.01","Happy new year 2019,happy new year video 2019,2019 wish video,whatsapp video,new year wishes,2019,new year,motivational,him eesh,new years motivation,in hindi,2019 video,change your life,inspirational","101363","11820","135","1039","https://i.ytimg.com/vi/eP5UrTfm6pg/default.jpg","False","False","In this Video, Himeesh Madaan, India’s leading motivational speaker and trainer, talks about an important topic for all of us. This video sheds light on an a very common practice in our lives which doesn't let us succeed in life. So this new year 2019 follow this advice so that you can achieve all the success and happiness in life that you want. This Hindi motivational video has been presented to you by Himeesh Madaan, who is the leading motivational speaker of India. We hope this video will help you to get inspired and motivated to follow your dreams. You can also visit our channel for more such motivational and inspirational videos in Hindi. Let’s keep marching on the path of our life’s growth.Curated by: Team Himeesh Madaan►Follow us on Instagram: https://www.instagram.com/himeeshmadaan/►Like Us On Facebook: https://www.facebook.com/himeeshmadaan/►Follow us on Twitter: https://twitter.com/himeeshmadaanYou can watch more related videos:► Never say Never: https://www.youtube.com/watch?v=fKKXQnCacrM► Jeena issi ka naam hai: https://www.youtube.com/watch?v=sdFASsnwISM#happynewyear2019 #himeeshmadaan  #2019"
"t6Kw3n9CNrc","How to Stay Motivated all the time? By Sandeep Maheshwari","2018-12-27T13:22:23.000Z","UCBqFKDipsnzvJdt6UT0lMIg","Sandeep Maheshwari","22","19.01.01","Inspirational,Inspiring,Videos,Motivational,Motivation,Motivating,Success,Ideas,Hindi,Greatest,Speech,Positive,Thinking,Leadership,Aasaan,session,thoughts,great,most,best,lecture,last,Ever,india tour,power of focus,focus,students,studies,best of sandeep,career,choice,student,business,india,latest 2019,2019,motivational video,motivational speech,videos,for students","956364","65627","874","4896","https://i.ytimg.com/vi/t6Kw3n9CNrc/default.jpg","False","False","Understanding yourself deeply is the ONLY permanent solution to all your problems.Sandeep Maheshwari is a name among millions who struggled, failed and surged ahead in search of success, happiness and contentment. Just like any middle class guy, he too had a bunch of unclear dreams and a blurred vision of his goals in life. All he had was an undying learning attitude to hold on to. Rowing through ups and downs, it was time that taught him the true meaning of his life.To know more, log on to www.sandeepmaheshwari.comConnect with him at Facebook.com/SandeepMaheshwariPageWatch his inspirational videos at Youtube.com/SandeepSeminarsMusic: Youtube Music Library#LatestVideo"
"SbJxt35KS6w","Simmba | Review by KRK | Bollywood Movie Reviews | Latest Reviews","2018-12-28T13:08:08.000Z","UCfDxyxsxaKpyYXkrNRItLsg","Kamaal R Khan - KRK","24","19.01.01","Review,Movie Review By KRK,Bollywood Review,Reviews,Kamaal Khan (Film Actor),Khan,Kamaal Rashid Khan (Film Actor),Best of Kamaal Khan,Latest Bollywood Reviews 2014,Best Of KRK Reviews,KRK Reviews 2014,critic,krk critic,no 1 critic","728310","13365","13335","4930","https://i.ytimg.com/vi/SbJxt35KS6w/default.jpg","False","False","#krk #krkreview #simmba #simmbareviewSimmba Review by KRK Star Cast - Ranveer Singh, Sara Ali Khan, Sonu SoodFollow KRK OnYouTube @ http://bit.ly/KamaalRKhanYTFacebook @ https://www.facebook.com/KRK.KamaalkhanTwitter @ https://twitter.com/kamaalrkhan"
"Hgq7bXIctdU","Romeo Weds Heer - Episode 13 | HAR PAL GEO","2018-12-30T16:00:02.000Z","UCe9JSDmyqNgA_l2BzGHq1Ug","HAR PAL GEO","24","19.01.01","Romeo Weds Heer,Feroz Khan,Sana Javed,HAR PAL GEO,Drama,Episode 13","1212329","12511","945","2461","https://i.ytimg.com/vi/Hgq7bXIctdU/default.jpg","False","False","Romeo Weds Heer - Episode 13 | HAR PAL GEOAfter giving us the blockbuster drama serial Khaani, ace producers Abdullah Kadwani and Asad Qureshi are bringing the favorite couple Feroz Khan and Sana Javed back, in the 7th Sky Entertainment’s mega project, Romeo Weds Heer. Directed by the renowned director Anjum Shehzad who is known for his commendable work in Khaani and written by legendary writer Muhammad Younis Butt who has penned the famous satirical show Hum Sab Umeed Se Hain, Romeo Weds Heer is a romantic comedy that is for the masses.7th Sky Entertainment presents Feroz Khan and Sana Javed in a complete new avatar. The first look of the serial unveiled by Geo Entertainment features the title track of Romeo Weds Heer, sung by the renowned singers Aima Baig and Sahir Ali Bhagga, and the colorful music video for the track has been choreographed by Wahab Shah.  The track is full of fun and entertainment and the screen chemistry of Feroz &amp; Sana in the dance number is amazing. The dance number of Romeo Weds Heer has made the audience glued to the screen. Romeo Weds Heer is scheduled to go on air in October 2018 on Geo TV.A love story for generations to come in a serial redefining love, where east meets west. In our society marriage is not just between two individuals but between two families and when these families are poles apart this will bring twist and turns in Romeo and Heer’s life.So fasten your seatbelts belts &amp; get ready for the fun &amp; excitement in a signature Rom-com to celebrate the true colors of love &amp; happiness in the one &amp; only love story of the year.Written by: Dr. Muhammad Younis ButtDirected by: Anjum ShahzadProduced by: Abdullah Kadwani &amp; Asad QureshiProduction House: 7th Sky EntertainmentFor More Videos Subscribe - https://www.youtube.com/harpalgeoFor More Videos Subscribe - https://www.youtube.com/harpalgeo#RomeoWedsHeer#HARPALGEO#GEO#FerozKhan#Sanajaved"
"Ebd68P_-yho","चिकन विथ बियर, हैप्पी न्यू ईयर l इंदोरीकर महाराज कॉमेडी किर्तन l Indorikar Maharaj on Happy New year","2018-12-30T11:30:00.000Z","UCkcExu2Mbm1pIB6tTSJBLzg","Aaichya Gavat","24","19.01.01","आईच्या गावात,आयच्या गावात,चिकन विथ बियर,हैप्पी न्यू ईयर,Happy New year,happy new year 2019,happy new year marathi,मराठी नव वर्ष,मराठी नवीन वर्ष,indurikar kirtan,indurikar kirtan comedy,indurikar kirtan latest,indurikar kirtan video,indurikar kirtan marathi,kirtan,indurikar maharaj comedy kirtan,maharaj kirtan,nivarutti,new kirtan,इंदुरीकर महाराज कीर्तन नवीन 2019,निवृत्ती महाराज देशमुख इंदोरीकर नवीन कीर्तन,इंदुरीकर महाराज कॉमेडी किर्तन","95277","759","87","42","https://i.ytimg.com/vi/Ebd68P_-yho/default.jpg","False","False","चिकन विथ बियर, हैप्पी न्यू ईयर, ह.भ.प.इंदूरीकर महाराज हे महाराष्ट्रातील लोकप्रिय कीर्तनकार आहेत, इंदुरीकर महाराज हे त्यांच्या कीर्तनाच्या मजेदार शैली साठी ओळखले जातात, त्यांचे कीर्तन हे सर्वच वयोगटातील व्यक्तींना आवडते हे विशेष,हे कीर्तन संपूर्ण ऐका, पोट धरून हसाल, निर्वूत्ती महाराज इंदुरीकर यांचे कीर्तन हे कडू पण सत्य असे आहे, कीर्तनाच्या माध्यमातून प्रबोधनाचे कार्य महाराज करत असतात, त्यांचे विचार आवडल्यास व्हिडीओ Like व Share करा, तसेच या कीर्तनाविषयी आपल्या प्रतिक्रिया Comment मध्ये जरूर कळ्वा. धन्यवाद !!Ⓒ Aaichya Gavat 2018Ⓒ Aaichya Gavat 2018 [Copyright]Please Subscribe : आईच्या गावात Write us : aaichyagavatteam@gmail.comधन्यवाद !!Copyright Disclaimer Under Section 107 of the Copyright Act 1976, Audio added in video comes under fair use policy of you tube."
"OBDu_TGcOzc","ऑगस्टा वेस्ट लैंड मामले में फंसे मोदी जी ब्लैक लिस्टेड कंपनी पर किया सौगातों की बौछार बेनक़ाब","2018-12-30T14:28:17.000Z","UC02ff0MLGEw2eHXDwBMcqjQ","News Bharti","25","19.01.01","Augusta Westland Scam,Augusta Scam,AICC PRESS CONFERENCE BY RANDEEP SURJEWALA,Congress party,Modi sarkar,UPA GOVERNMENT,Augusta Westland ghotala,Helicopter ghotala,Pm modi,Michael,Randeep Surjewala,Sonia Gandhi","57638","1519","117","235","https://i.ytimg.com/vi/OBDu_TGcOzc/default.jpg","False","False","ऑगस्टा वेस्ट लैंड मामले में फंसे मोदी जी ब्लैक लिस्टेड कंपनी पर किया सौगातों की बौछार बेनक़ाब  News Bharti #NewsBharti #ModiGiftAugusta #ModiDaamdar Credit : Indian National Congress Party Website : www.inc.in Youtube : www.youtube.com/IndianNationalCongressParty"
"lLvUMWe9cWM","Bigg Boss 12 winner Dipika Kakar gets grand welcome with flowers and dancing","2018-12-31T10:31:30.000Z","UCm7lHFkt2yB_WzL67aruVBQ","Hindustan Times","24","19.01.01","hindustan times,ht media,ht news,Bigg Boss 12,Dipika Kakar,Winnder Bigg Boss 12,Entertainment,Bollywood,TV News,Salman Khan Bigg Boss","21465","164","23","25","https://i.ytimg.com/vi/lLvUMWe9cWM/default.jpg","False","False","It is celebration time for TV actor Dipika Kakar, who emerged the Bigg Boss 12 winner who beat S Sreesanth and Deepak Thakur to lift the trophy. After her victory on the Salman Khan show, she said that sticking to doing what was right helped her win.Pictures and video clips from the Bigg Boss 12 finale are all over the internet now. One such video is from the finale in which Dipika is being carried by her husband Shoaib Ibrahim from the dais.Hindustan Times, owned by HT Media Ltd, is one of India’s largest publications that provides unbiased news, analysis and features on politics, sports, entertainment, lifestyle and more. Hindustan Times delivers the news across all social media platforms, on the web, and at your doorstep. Subscribe to our channel: http://read.ht/fLZFollow us on Twitter: https://twitter.com/htTweetsLike us on Facebook: https://www.facebook.com/hindustantimesiOS:- http://m.onelink.me/bcae8b2dAndroid:- http://m.onelink.me/986f584aWatch more videos at: http://www.hindustantimes.com/videohindustantimes.com © 2016"
"CksNlwYArf4","Couple's New Year Resolution |Husband Vs Wife | Samsaram Athu Minsaram | Mini Series - #12","2018-12-30T05:32:12.000Z","UC6IJFR0fWCBGhQnMKZQ-01g","Chennai Memes","23","19.01.01","types of wives,samsaram adhu minsaram,husband vs wife,husband vs wife prank,husband vs wife comedy,husband vs wife status,husband vs wife love story,mini series,episode 12,types of husbands,types of couples in fight,newly married vs years later,wife with lie detector,thala diwali vs years later,pregnant wife expecation vs reality,trending videos,new year couples,new year resolutions,couples resolution,couples in new year,new year party,honeymoon scenes","168068","8962","362","1498","https://i.ytimg.com/vi/CksNlwYArf4/default.jpg","False","False","#SamsaramAthuMinsaram #MiniSeries #ChennaiMemesNew Year Couples | Husband Vs Wife | Samsaram Athu Minsaram | Mini Series - #12 | Chennai MemesCASTFabiean / Insta: fabbyftfwAarthi Subash / Insta: vj_aarthisubashCAMERAFrancis ShajanEDITKiruba ShankarWRITTEN & DIRECTIONDhilip TheodorePRODUCERGautham GovindaramanCheck us out on Facebook at: https://www.facebook.com/memeschennaiOn twitter as well at:https://twitter.com/MemesChennaioh wait.. Even on Instagram at:https://www.instagram.com/chennaimemes"
"bYWBktfTY5E","நாலு பொருளில் சாக்லேட் இவளோ ஈஸியா 😍 | Homemade Chocolate Recipe in tamil | NewYear Special 2019","2018-12-31T10:23:55.000Z","UC9oPCWZ6Wh5WG68YcEmCXNA","Papa's Kitchen","2","19.01.01","chocolate recipe,chocolate recipe at home,chocolate recipe in Tamil,chocolate recipe with cocoa powder HOMEMADE dark CHOCOLATE,How to Make the Most Amazing dark Chocolate chocolate recipe without oven,how to make chocolate at home how to make chocolate at home in tamil,How to Make Home made Chocolate,Nutty Dark Chocolate Recipe,How to make dark chocolate,How To Make dark Chocolate At Home,Molded dark Chocolate,Nutty Dark Chocolate,chocolate in 10 minutes","33260","1098","39","306","https://i.ytimg.com/vi/bYWBktfTY5E/default.jpg","False","False","YouTubeHOME MADE CHOCOLATE RECIPE WITH ONLY 4 INGREDIENTS I HOW TO MAKE CHOCOLATE without Oven  | easy  chocolate, papa's kitchenHOME MADE CHOCOLATE"
"R2lilX6WpWY","Viswasam Official Trailer Break Down | 5 Things You Missed  | Thala | Ajith | D.imman","2018-12-30T13:08:16.000Z","UCKtcc8SgtIQ3WyhIga0Fzuw","Wetalkiess","24","19.01.01","viswasam trailer,viswasam trailer break down,ajith viswasam,thala ajith,viswasam,viswasam trailer record,viswasam trailer reactions,ajith mass in viswasam,ajithkumar,viswasam latest news,Viswasam nayanathara,viswasam wetalkiess","82067","4192","298","148","https://i.ytimg.com/vi/R2lilX6WpWY/default.jpg","False","False","Viswasam Official Trailer Break Down | Unoticed Things | Thala | Ajith | D.imman#viswasamtrailer #thala #ajith Click the below link & subscribe to our Channel for more updates on Tamil Cinema. https://goo.gl/KBxy8ESubscribe to : https://www.youtube.com/c/WetalkiessLike us on: https://www.facebook.com/WeTalkiess/Follow us on: https://twitter.com/WeTalkiessFollow us on: https://in.pinterest.com/WeTalkiess/"
"2DiNlx6XoVk","Sameer refuses engagement with Naina","2018-12-31T11:44:41.000Z","UCCaJ-4eia53A8FcZD-KwaeA","Saas Bahu aur Saazish","24","19.01.01","Yeh Un Dinon Ki Baat Hai,saas bahu aur saazish","93570","1932","42","141","https://i.ytimg.com/vi/2DiNlx6XoVk/default.jpg","False","False","Yeh Un Dinon Ki Baat Hai is an Indian Hindi-language coming of age romantic drama television series produced by Shashi Sumeet Productions which premiered on Sony TV on September 5, 2017. Ashi Singh and Randeep Rai play the roles of Naina and Sameer respectively. The show is based on the youngsters' love story and is set in the 1990s. It is inspired from the real life love story of the producers Shashi and Sumeet Mittal. Watch Saas Bahu aur Saazish (SBS) on ABP News daily at 2:30 PM to know what's happening in Indian television and bollywood industry with Aditi Rao Sawant. Presenting you the latest updates and daily dose of entertainment in the form of star cast interviews, gossips, updates of reality shows, behind the scenes, twist in serials. Join the non stop entertainment with Saas Bahu aur Saazish for all the juicy news.टेलीविजन और बॉलीवुड इंडस्ट्री के बारे में जानने के लिए एबीपी न्यूज़ पर देखिये सास बहु और साज़िश (एसबीएस) अदिति रॉव सावंत के साथ  रोज़ाना 2:30 बजे। एसबीएस पेश करता है स्टार कास्ट के इंटरव्यू, रियलिटी शो के अपडेट, सीरियल्स के नए मोड़, परदे के पीछे की कुछ गपशप और भी बहुत कुछ। नॉन स्टॉप मनोरंजन के लिए शामिल हों सास बहू और साज़िश के साथ। For your daily dose of Entertainment, you can subscribe to our channel on YouTube: https://www.youtube.com/user/sbsabpnewsABP Hindi: http://abpnews.abplive.in/ABP English: http://www.abplive.in/Download ABP App for Apple: https://itunes.apple.com/in/app/abp-live-abp-news-abp-ananda/id811114904?mt=8Download ABP App for Android: https://play.google.com/store/apps/details?id=com.winit.starnews.hin&hl=enSocial Media Handles:Twitter : https://twitter.com/SBSABPNewsFacebook : https://www.facebook.com/saasbahuaursaazishGoogle+ : https://plus.google.com/u/2/+sbsabpnewsInstagram : https://www.instagram.com/sbsabpnews/"
