video_id,title,publishedAt,channelId,channelTitle,categoryId,trending_date,tags,view_count,likes,dislikes,comment_count,thumbnail_link,comments_disabled,ratings_disabled,description
"acp1b0dh884","Taarak Mehta Ka Ooltah Chashmah - तारक मेहता - Ep 2633 - 28th December, 2018","2018-12-28T18:06:36.000Z","UC6-F5tO8uklgE9Zy8IvbdFw","SAB TV","24","19.01.01","sab tv channel,sab tv serials,comedy channel india,comedy channel hindi,taarak mehta ka ooltah chashmah,hindi comedy show,sab tv funny show,sony sab serials,Taarak Mehta,Babita and Jethalal funny,taarak mehta comedy,taarak mehta comedy scenes,hindi tv serials online,comedy scenes,jethalal babita funny,taarak mehta 10 years,gada electronics comedy,baga and nattu kaka comedy,gada electronics sale,ranveer singh taarak mehta,simbaa,jethalal comedy video","874355","5142","653","284","https://i.ytimg.com/vi/acp1b0dh884/default.jpg","False","False","Click here to watch the full episode of Taarak Mehta Ka Ooltah: https://www.sonyliv.com/details/episodes/5984191747001/28-December-2018---Taarak-Mehta-Ka-Ooltah-Chashmah---New-Year-Surprise?utm_source=YOUTUBE&utm_medium=slate&utm_campaign=YT_trafficClick here to subscribe to SonyLIV: http://www.sonyliv.com/signinClick here to watch all the episodes of Taarak Mehta Ka Ooltah Chashmah:  https://www.youtube.com/playlist?list=PL6Rtnh6YJK7ZzKESURdZe82ZWGXEwIrl-Episode 2633: New Year Surprise--------------------------------------------------------------------------------Everyone is set and ready to enjoy the new year celebrations in Gokuldham society with their college look theme but before the celebrations begin it is interrupted by Inspector Pandey who alleges that there's stolen gold in the society. Who is responsible for this? Stay tuned to find out!More Useful Links : * Visit us at : http://www.sonyliv.com * Like us on Facebook : http://www.facebook.com/SonyLIV * Follow us on Twitter : http://www.twitter.com/SonyLIVAlso get Sony LIV app on your mobile * Google Play - https://play.google.com/store/apps/details?id=com.msmpl.livsportsphone * ITunes - https://itunes.apple.com/us/app/liv-sports/id879341352?ls=1&mt=8About Taarak Mehta Ka Ooltah Chashmah:----------------------------------------------------------------------The show is inspired from the famous humorous column 'Duniya Ne Undha Chasma' written by the eminent Gujarati writer Mr. Tarak Mehta. This story evolves around happenings in Gokuldham Co-operative Society and covers topical issues which are socially relevant. The show predominantly - Promoolves around 'Jethalaal' (Dilip Joshi) who is an uneducated Gujarati businessman. Your 'Taarak Mehta' (Sailesh Lodha), is his neighbor. 'Jethalaal' finds a friend and philosopher in 'Taarak Mehta' and often goes to him for advice whenever he is in trouble. Jethalaal's family includes his simpleton wife 'Daya Ben' (Disha Wakani) and a mischievous son 'Tapu' (Bhavya Gandhi). Tapu is a menace and a constant source of trouble to all the members of Gokuldham. They have often warned 'Jethalaal' to reform 'Tapu' or else be prepared to leave the premises. Lost hopes of being heard by his son push Jethalaal' to call his father 'Champaklal' (Amit Bhatt) from the village. This was his great idea of leashing some control over the mischievous Tapu. The opposite happens and the grandfather joins hands with the grandson to make life a roller coaster troublesome ride for Jethalaal.Cast:---------Dilip Joshi as Jethalal Champaklal GadaDisha Vakani as Daya Jethalal GadaRaj Anadkat as Tipendra Jethalal Gada (Tapu) Amit Bhatt as Champaklal Jayantilal GadaShailesh Lodha as Taarak MehtaNeha Mehta as Anjali Taarak MehtaTanuj Mahashabde as Krishnan Subramaniam IyerMunmun Dutta as Babita Krishnan IyerMandar Chandwadkar as Aatmaram Tukaram BhideSonalika Joshi as Madhvi Aatmaram BhideNidhi Bhanushali as Sonalika Aatmaram Bhide (Sonu) Gurucharan Singh as Roshan Singh Harjeet Singh SodhiJennifer Mistry Bansiwal as Roshan Kaur Roshan Singh SodhiAzad Kavi as Dr. Hansraj Hathi Ambika Ranjankar as Komal Hansraj HathiKush Shah as Gulabkumar Hansraj Hathi (Goli)Shyam Pathak as Popatlal PandeySharad Sankla as AbdulAzhar Shaikh as Pinku Produced By: Neela Asit Modi, Asit Kumarr Modi Special Thanks: Mahesh Vakil, Indu Tarak MehtaSet Design: Jayant DeshmukhCreative Consultant: Dayashankar PandeyOn-Air Promotion  ( SAB): SAB OAPCostume Designer: Alka MehtaCostume Stylist: Ekta BrahmbhattSound Recordist: Shakeel Mansuri Cameraman: Aamir ViraniProduction Head: Arvind MarchandeProduction Controler: Vinod ShishupalBackground Music: Sunil PatniOnline Editors: Vishal Tambe, Sandeep Singh Executive Producer: Jatin Yogesh BajajEditor: Dinesh GosaviCreative Supervision ( Post Production): Krunal KhakhkharProgramming Team: Vinod Rao, Leanne DemeloProject Head: Sohil RamaniWritten By: Ashok ParmarDirectors: Harshad Joshi, Malav Suresh RajdaTelevision Adaptation and Designed By: Asit Kumarr Modi"
"8PhV9u9ilps","9 PM | ETV Telugu News | 31st December 2018","2018-12-31T16:39:46.000Z","UCJi8M0hRKjz8SLPvJKEVTOg","ETV Andhra Pradesh","25","19.01.01","ETV,ETV Telugu,ETV NewsVideo,National News Video,ETV World,ETV Andhravani,AndhravaniVideo,ETV Talkies,Etv2,Etv Andhra News,Andhravani,Etv2 Ghantaravam,Etv2 India,Telugu News,Etv AP,AP News,AP,Etv Telugu,Etv News Live Video,Etv Sakhi,Etv Sukhibhava,Health Magazine,Health Show,Etv Margadarsi,ETV Aaha,etv2india,Latest News Videos,Mundhadugu,Lakshyam,ETV Telangana,Telangana News,Telangana Latest News,Telangana Updates,ETV Live,Live TV","182155","1410","180","130","https://i.ytimg.com/vi/8PhV9u9ilps/default.jpg","False","False","News Headlines for states & regional News bulletin"
"ZXBZ2I1VIzU","Sembaruthi - செம்பருத்தி | Preview | Episode - 361 | 31/12/18 | Zee Tamil","2018-12-31T11:33:08.000Z","UC_wIGmvdyAQLtl-U2nHV9rg","Zee Tamil","24","19.01.01","Sembarathi,Sembarathi zee tamil,Sembarathi full episodes,Sembarathi best scenes,Sembarathi webisodes,sembaruthi today promo,sambarathi latest scnene today,sembarathi today videos,tamil best serial 2018,#tamil serials,zee tamil,zee tamil serials,zee tamil shows,tamil tv serials,tamil tv shows,zee tamil live,watch online free,#drama,Zee tamil entertainment,#Story,zee5","192129","1267","99","38","https://i.ytimg.com/vi/ZXBZ2I1VIzU/default.jpg","False","False","Subscribe & Watch all episodes BEFORE TV: http://bit.ly/2EzC6HuZEE5 Now Available in 190+ Countries, Click Here: http://bit.ly/WatchNowOnZEE5To watch FULL episode of Sembarathi, CLICK here - https://www.zee5.com/tvshows/details/sembarathi/0-6-675Watch Latest Zee Tamil Serials & Shows Full Episodes Online on ZEE5 App. Please Click below to DOWNLOAD the ZEE5 app: - Playstore: https://play.google.com/store/apps/details?id=com.graymatrix.did- iTunes: https://itunes.apple.com/in/app/ozee-tv-shows-movies-more/id743691886Visit our website - https://www.zee5.com For more  Latest Updates Connect with us on Social Media: - Facebook - https://www.facebook.com/ZEE5/ - Instagram - https://www.instagram.com/zee5 - Twitter - https://twitter.com/ZEE5IndiaSembarathi is a Tamil romantic family television series starring Priya Raman, Shabanaa and Karthik in the lead. This is a story of a poor girl Parvathi, whose father works as a driver to Akhilandeshwari, who is rich and arrogant woman. The journey of hardships that Parvathi goes through, after she is married to Adithya, son of Akhilandeshwari, is something you can’t give a miss.#tamil #zeetamil #zeetamilserials #tamilserials #tamiltvserials #tamizhserials #zeeserials #ztamil #tamiltvshow #tamilnadagam #tamilentertainment #tamilcomedy"
"e0YZ7ny0WYI","Best Motivational Video | How To Achieve Success? | Inspirational Video 2019 | Vikram Aditya","2018-12-31T12:52:57.000Z","UCqR14yApZM2ZAOTY0qrKIGw","Vikram Aditya","24","19.01.01","Best Motivational Video,How To Achieve Success?,Inspirational Video 2019,Vikram Aditya,motivational video,motivational speech,be inspired,how to stay motivated,vikram aditya latest videos,vikram aditya videos,vikram aditya new videos,new year resolutions,resolutions,inspirational speeches,key to success,inspirational video in telugu,motivational videos for students,best motivational video,best inspirational videos,motivational videos for success in life","95518","9522","159","1642","https://i.ytimg.com/vi/e0YZ7ny0WYI/default.jpg","False","False","Best Motivational Video To Start a New Journey in 2019 and Know How To Achieve Success, revealed by Vikram Aditya. Know few Inspirational Tips to stay Focused and Motivated by #VikramAditya in Telugu in Today's Episode EP 157. For more Latest Vikram Aditya Videos, Shocking Facts & Informative Videos stay tuned to #VikramAditya Channel- https://bit.ly/2ziGWnY #Motivation #HappyNewYear2019 #Success #Inspiration #Life #Career ▶ CALL AYURSHA: 7997019019, 7997617979, 7997616969.  AYURSHA IN AMAZON: HAIR OIL & HAIR PACK: https://amzn.to/2HsStV1AYURSHA PIMPLE KIT: https://amzn.to/2qZaGCnFACE PACK & FACE MASSAGE OIL: https://amzn.to/2Hq8qLA▶ AYURSHA SHAMPOO: https://amzn.to/2P6G641Click here to Watch:▶ Previous Episodes of Mahabharatam Series - https://youtu.be/5LjpMWuhJw0▶ Thu Ni Bathuku- 3 | Caste Reservations & Inter-Caste Marriages In India | Vikram Aditya | EP#144 - https://youtu.be/HWAOvcaHuVw▶ MAHABHARATAM- 19 | Draupadi Vastrapaharanam In Telugu | Vikram Aditya | EP#146-  https://youtu.be/XOjFX7M3Oyg▶ AYURSHA SHAMPOO: https://amzn.to/2P6G641▶ Join me for Parahitha, A Journey Towards Humanity Through PATREON: https://www.patreon.com/VikramAditya ▶ Order my Telugu book in AMAZON: Vikram Aditya's జీవించడం ఒక కళ: https://amzn.to/2KoH35x. Or call: -  7032875554 , 9052783437 ▶ For DEDICATIONS / BUSINESS / BRAND PROMOTIONS :Whatsapp To 7659061119 or Mail me to:  vikramadityavlog@gmail.comFor more interesting & amazing videos : Subscribe: http://bit.ly/1l1RaR4Like: https://www.facebook.com/VikramAdityaofficial/Follow: https://www.instagram.com/vikramadityaofficial"
"gngyrUPwNjE","Beer Biryani Lyric Video Song | STR | Oviya | 90 ML | Mirchi Vijay | Maria | Anita Udeep | MIG","2018-12-31T13:30:03.000Z","UCexdhDWHzDocaeW0MhusrKQ","MIG Series","10","19.01.01","Beer biryani lyric video song,str,oviya,90ml,mirchi vijay,maria,anita udeep,mig,beer briyani song,beer biryani,beer biryani video song,90 ml movie,90ml movie,90ml movie songs,str song,str music,str new song,str latest song,str new year song,str 90ml,str 90 ml songs,mirchi vijay songs,maria songs,marana matta,marana matta song,new year song,new year songs,tamil new songs,tamil party songs","450812","22959","2990","1095","https://i.ytimg.com/vi/gngyrUPwNjE/default.jpg","False","False","Beer Biryani Lyric Video Song Sung by Maria for the 90 ML movie on Mig Series.Oviya featuring in lead role along with others, Music composed by STR, Directed by Anita Udeep. Beer & Biryani song Lyrics written by Mirchi Vijay, Music by STR, & Sung by Maria. #BeerBiryani Song Details:-Film: 90 MLMusic: STRSinger: MariaLyricist: Mirchi VijayDirector: Anita UdeepMusic Label:  MIG Series#BeerBiryaniSong #STR #Oviya #BeerBiryani #90ML #MirchiVijay #Maria #AnitaUdeep ##BeerBiryaniLyricVideo #BeerFor more updates about from MIG Series :Subscribe: http://bit.ly/MIGSeriesLike Us: https://www.facebook.com/MIG-Series-844768495705510/Follow Us: https://twitter.com/MIGseries"
"_RNiEtPVIZU","TORTURE Challenge - BADLA (Revenge) | #Gameplay #Roleplay #Fun #Sketch #Anaysa #ShrutiArjunAnand","2018-12-28T13:00:10.000Z","UCIsotCCdTjStPCLyD9iBCCQ","Shruti Arjun Anand","26","19.01.01","mymissanand,miss anand,challenge,challenge videos,hindi,vlog,vlogger,vloggers,golgappa challenge,shruti,shruti anand,shrutiarjunanand,shruti arjun anand,kids,fun,sketch,roleplay,blogger,chit chat,comedy,2018,cute,expectation,funny girl,vlogs,reality,funy,funniest,funny videos 2018,gol gappa,fashion,torture challege,torture,horror challenge,hindi blog,gameplay,desi,badla,revenge,part 2,funny,skit,letsplay,bad girls,good girl,hot girl,desi girl","1106766","100245","3384","6967","https://i.ytimg.com/vi/_RNiEtPVIZU/default.jpg","False","False","Follow me on INSTA: https://tinyurl.com/ShrutiArjunAnand Hahahaha so finally I'll bring for you guys Torture Challenge - THE BADLA & this time I'm gonna take revenge from the two lovely ladies Anishka & Anku from my team Anaysa. Sounds good ,It's gonna be fun ;-)Is baar ka Target hai 1,00,000 LIKES (ab itne torture jhelne ke liye LIKE to banta hai yaar)If you want us to make more Challenge videos then do SHARE this with your friends and COMMENT below your most favourite part of the video :-)CHECKOUT All My AWESOME Channels: SUBSCRIBE To ShrutiArjunAnand - https://goo.gl/1gmCTASUBSCRIBE To ShrutiVlogs - https://goo.gl/00seNeSUBSCRIBE To Anaysa - https://goo.gl/5A2h93SUBSCRIBE To MyMissAnand - https://goo.gl/mnBhXgSUBSCRIBE To CookWithNisha - https://goo.gl/Kep2iSSUBSCRIBE To LafanGAY - https://goo.gl/XRHDrq~ XoXo~ Shruti NEW UPLOADS Tuesday & Friday!▷ CONNECT with us!!♥ ♥ YOUTUBE ♥ ♥ https://www.youtube.com/user/shrutiar...♥ ♥ WEB ♥ ♥ http://www.shrutiarjunanand.com/♥ ♥ INSTAGRAM ♥ ♥ https://www.instagram.com/shrutiarjun...♥ ♥ FACEBOOK ♥ ♥ https://www.facebook.com/shrutiarjuna...♥ ♥ TWITTER ♥ ♥ https://twitter.com/shruti_ilim♥ ♥ SNAPCHAT ♥ ♥ @Shruti_ILIM♥ ♥ BUSINESS INQUIRY ♥ ♥ contactus@shrutiarjunanand.comAUDIO DISCLAIMER/CREDITS –Music from Epidemic Sound (http://www.epidemicsound.com)DISCLAIMER: All products used in my videos, regardless of whether the video is sponsored or not, are the products that I love using unless otherwise stated in case of first impression reviews. The information provided on this channel is for general purposes only and should NOT be considered as professional advice. We are not a licensed professional or a medical practitioner so always make sure you consult a professional in case of need. We always try to keep our channel and its content updated but we cannot guarantee it. All opinions expressed here are our own and we are not compensated by any brand, advertiser, PR representative or affiliate for the same unless explicitly stated in our videos and/or description box. We never try to push products on anyone but we do make recommendations based on our personal experience. All the content published on this channel is our own creative work and is protected under copyright law and in case you need to use our content for any purpose please write to us - contactus@shrutiarjunanand.com *  blogger comedy funniest family channel good vs  hilarious vlogging a day in my life miss anand funy vlogger vloggers new year good vs blogging anantya roleplay how to vlog indian youtuber hindi vlog in real life sketch women's health monthly ylyl chit chat cute letsplay gameplayCategoryHowto & Style"
"BcI_ss-CFFk","Pove Pora | 28th December  2018  | Full Episode 76 | ETV Plus","2018-12-28T17:30:39.000Z","UCi1m4TnmmXGUIY4roVtvjDA","ETV Plus India","23","19.01.01","etv Plus,etv comedy show,3 Idiots,anchor ravi,Chinnadana Neekosam,express raja,hungama,Kick,Nandini Vs Nandini,Pataas,jabardasth,extra jabardasth,naga babu,roja,anchor anasuya,pove pora,comedy short films,yadamma raju,chalaki chanti,sudigali sudeer,anchor suma,comedy show,anchor sreemukhi,comedy skits in telugu,telugu comedy tracks,racha ravi,allare allari,sardaga kasepu,ejunction,anchor pradeep,pataas punches,anchor vishnupriya,getup srinu","763552","7550","586","876","https://i.ytimg.com/vi/BcI_ss-CFFk/default.jpg","False","False",""
"njUoRDSC7ag","New Year Resolutions | 2019 | 1 Kg Biriyani","2018-12-31T17:48:50.000Z","UC0x7BynaZB91oDBp8UT7sXw","1 Kg Biriyani","23","19.01.01","2019,NEW,YEAR,new,year,resolutions,resolution,boys,vs,girls,boys vs girls,1 kg biriyani,viral,video,latest,tamil,comedy,whatsapp,status,1 KG BIRIYANI,viral videos","75523","5938","300","626","https://i.ytimg.com/vi/njUoRDSC7ag/default.jpg","False","False","1. Download the app here: http://bit.ly/2R2hxuG.2. Participate in the contest http://bit.ly/2CAhGN4  and win big prize!This video is a funny take on how people take Resolutions for The New Year, What made them take it and How the resolution becomes over over the upcoming year. Failing resolutions simple as to learn driving to to learn cooking or Avoid mobile phone usage; different people come up with different resolutions: To cook, To learn driving, To be calm & composed, To not use mobile phones, To not drink, To not use curse words, To eat healthy and To hit the Gym... Enjoy all the resolutions the people take and their results... Team:Abbishek Rabi : @the_biriyanimanCibi Agnel : @cibi_agnelAldo Xavier : @though_aldo_eventhoughSharan Appu : @sharan_appuAbishek Kennedy : @abishekkennedyAnusha Prabhu : @@annnuv_prabhuSwarna Surya : @theswarnasuryaSuchithra : @suchithra_ramSashmitha1 Kg Briyani is a Tamil Entertainment Channel by Abbishek Rabi, Cibi Agnel and Aldo Xavier. We make comedy sketches for the fun of it.  We love to entertain people through videos inspired from the situations we faced in our lives. Like and Subscribe to our Page and Channel for your weekly dose of entertainment.Abbishek Rabi : https://www.facebook.com/abbishek.rabi.1395Cibi Agnel : https://www.facebook.com/vijay.agnel.7Aldo Xavier : https://www.facebook.com/aldo.xavier.14Official Page : https://www.facebook.com/1kgbiriyaniInstagram : https://www.instagram.com/1kgbiriyaniTwitter : https://www.twitter.com/1kgbiriyaniIn Association with Divohttp://www.facebook.com/divomovieshttps://twitter.com/divomovies"
"q4wC6rg53ro","#राधाकृष्ण I प्रेम का महा-सप्ताह","2018-12-31T10:30:40.000Z","UCCy2rLnGdwoJcSAtixNdsPQ","STAR भारत","22","19.01.01","Star,Star Bharat,Radha Krishn,Prem ki Pariksha,Sumedh,Mallika,राधाकृष्ण,प्रेम का महा-सप्ताह,प्रोमो,शो प्रोमो","176620","4711","70","337","https://i.ytimg.com/vi/q4wC6rg53ro/default.jpg","False","False","देखिए राधाकृष्ण के प्रेम का महा-सप्ताह,इस हफ़्ते, सोम-शनि, रात 9 बजे, सिर्फ़ STAR भारत पर!राधा-कृष्ण के एपिसोड्ज़ देखने के लिए, क्लिक कीजिए इस लिंक पर: http://bit.ly/RadhaKrishnHotstar    #राधाकृष्ण | #RadhaKrishn"
"ILMRDa8Ng00","Monsta Mashup 2018 by DJ Notorious & Lijo George | Best Dance Songs 2018","2018-12-31T11:01:51.000Z","UCFFbwnve3yF62-tVXkTyHqg","Zee Music Company","10","19.01.01","Monsta Mashup 2018,Monsta Mashup 2018 DJ Notorious,Monsta Mashup 2018 Lijo George,dj notorious 2018,dj notorious 2018 new song,dj notorious mashup 2018,dj notorious songs,lijo george songs,new year song 2019,new year song 2018,new year mashup 2019,new year mashup 2018,happy new year song,mashup song,party songs,new year party songs,new year party,remix song dj,dj remix 2019,dj party songs,party songs dj,party songs playlist,zee music songs","146462","3736","237","128","https://i.ytimg.com/vi/ILMRDa8Ng00/default.jpg","False","False","Ring in the New Year with our Monsta Mashup of 2018’s Biggest Hits by DJ Notorious & Lijo George featuring songs from Veere Di Wedding, Dhadak , Kedarnath, Andhadhun & More.▸ Song list -♫ Sweetheart - Kedarnath♫ Veere - Veere Di Wedding♫ Pallo Latke - Shaadi Mein Zaroor Aana♫ Balma - Pataakha♫ Zingaat - Dhadak♫ Padman - Padman♫ Naina Da Kasoor - Andhadhun♫ Mantoiyat - Manto♫ Sayaani - Padman♫ Laila Laila - Andhadhun♫ Jogi - Shaadi Mein Zaroor Aana♫ Lae Dooba - Aiyaary♫ Dilbaro - Raazi♫ Tareefan - Veere Di Wedding♫ Chad Gayi - Gold♫ Laila Main Laila - RaeesVideo edit by Abhishek PawarMusic on Zee Music CompanySUBSCRIBE and stay updated with the Latest & Superhit Bollywood Songs & Foot Tapping Dance Numbers#ZeeMusicOriginalsConnect with us on :Twitter - https://www.twitter.com/ZeeMusicCompanyFacebook - https://www.facebook.com/zeemusiccompanyYouTube - http://bit.ly/TYZMC"
"40ZlwyFY9lg","Ahmednagar | भाजपला पाठिंबा का दिला हे पक्षापुढे मांडणार : संग्राम जगताप | एबीपी माझा","2018-12-30T11:30:40.000Z","UCH7nv1A9xIrAifZJNvt7cgA","ABP Majha","25","19.01.01","abp majha news,marathi news,MLA,Sangram Jagtap,NCP,Sharad Pawar,BJP,Ahmednagar,Election","143340","760","141","147","https://i.ytimg.com/vi/40ZlwyFY9lg/default.jpg","False","False","#ABPMajhaNews भाजपाला कोणत्याही परिस्थिती पाठिंबा द्यायचा नाही, हे मी आधीच स्पष्टपणे सांगितले होते. मात्र, त्यानंतरही भाजपाला पाठिंबा देण्यात आला. प्रदेशाध्यक्षांचा आदेश नाकारणाऱ्यांना नोटीस पाठवली असून येत्या 5 दिवसांत संबंधितांवर कारवाई केली जाईल, अशी ग्वाही राष्ट्रवादी काँग्रेसचे राष्ट्रीय अध्यक्ष शरद पवार यांनी आज अहमदनगर येथे बोलताना दिली. त्यानंतर राष्ट्रवादीचे आमदार संग्राम जगताप यांनी पक्षापुढे बाजू मांडल्यावर पक्षाला आमची भुमिका पटेल असा दावा केला आहे.  पक्षाचा आदेश धुडकावून लावण्याइतके आम्ही मोठे नाही. अहमदनगरच्या महापौर निवडीवेळी आम्ही घेतलेला निर्णय पक्षश्रेष्ठींना मान्य नसेल तर त्यांनी नोटीस बजावणे साहजिक आहे. याबाबत आम्ही जे उत्तर देऊ त्याने नक्कीच त्यांचे समाधान होईल अशी अपेक्षा आमदार संग्राम जगताप यांनी व्यक्त केली. For latest breaking news, other top stories log on to: https://abpmajha.abplive.in/ & https://www.youtube.com/c/ABPMajhaTV &https://www.facebook.com/abpmajha/"
"sClsHbXUPS4","Fake Real (Full Video) Elly Mangat I Raja Game Changerz | Latest Punjabi song 2019","2018-12-31T11:22:41.000Z","UCx8-RWM_jQVdM0j9A9oNllw","Game Killerz Records","10","19.01.01","[none]","205433","11981","1496","1528","https://i.ytimg.com/vi/sClsHbXUPS4/default.jpg","False","False","Singer: Elly Mangat Music/Lyrics: Raja Game Changerz Edit: Garry Khatrao MediaVideo: Team Rupan BalSpecial thanks : tej Truck loan Promotions: Gold Media"
"Urp6hxk4sPs","Zero | VFX - Behind The Scenes | Shah Rukh Khan | Aanand L Rai","2018-12-27T13:21:25.000Z","UCjJKg01HAP01xCLVhDmnLhw","Red Chillies Entertainment","24","19.01.01","zero official trailer,zero teaser,zero new film,zero red chillies entertainment,SRK birthday,shah rukh khan,Katrina kaif,anushka sharma,anand l rai,tanu weds manu,colour yellow,Bollywood new,new release,zero trailer HD,salman khan,bauua,bauaa,2zero18,eid trailer,zero full movie HD,r madhavan,zero 21 December,zero the movie,zero the film,simmba,kedarnath,2.0,sara ali khan,ranveer singh,vfx,making,behind the scenes","3977898","117120","5042","9479","https://i.ytimg.com/vi/Urp6hxk4sPs/default.jpg","False","False","Bauua has a magical charm that can make everyone fall in love with him! But it took many magicians to create this charming personality of Bauua that we see on-screen! Here's presenting the Behind The Scenes of the VFX process and the team efforts that went into the creation of Bauua.The Aanand L Rai movie starring Shah Rukh Khan, Anushka Sharma and Katrina Kaif is now in theatres! Book your tickets here: https://www.redchillies.com/BookZeroTickets/Actors: Anushka Sharma, Katrina Kaif, Shah Rukh Khan, Producer: Gauri Khan Director : Aanand L Rai Writer: Himanshu Sharma Co-producer: Karuna Badwal Music: Ajay-Atul DOP: Manu Anand VFX Supervisor: Harry Hingorani Production Designer: Wasiq Khan Editor: Hemal Kothari For more updates on Zero, click on the links below:http://www.twitter.com/RedChilliesEnthttp://www.facebook.com/RedChilliesEnthttp://www.instagram.com/RedChilliesEnthttp://www.dailymotion.com/RedChilliesEnt#Zero #VFX #Making #ShahRukhKhan #AnushkaSharma #KatrinaKaif"
