video_id,title,publishedAt,channelId,channelTitle,categoryId,trending_date,tags,view_count,likes,dislikes,comment_count,thumbnail_link,comments_disabled,ratings_disabled,description
"TiDyv53adt0","Viswasam - Official Trailer | Ajith Kumar, Nayanthara | Sathya Jyothi Films","2018-12-30T08:00:40.000Z","UCdbalkQDqCcOsYG5c4L8TAw","Sathya Jyothi Films","1","19.01.01","Sathya Jyothi Films,Motion Poster,Ajith Kumar,Nayanthara,Siva,D Imman,viswasam,viswasam trailer,viswasam song,viswasam teaser,viswasam second look,viswasam tamil movie trailer,yogi babu,thambi ramaiah,viswasam first look,ajith,thala latest,viswasam movie,ajith viswasam,viswasam official trailer,viswasam update,thala news,Viswasam Official Trailer,Viswasam Tamil Trailer,Ajith Viswasam Trailer,Ajith Movie Trailer","16491497","1289107","225197","101520","https://i.ytimg.com/vi/TiDyv53adt0/default.jpg","False","False","Presenting The Official Trailer of Viswasam #Viswasam - Pongal 2019Banner : Sathya Jyothi Films - T.G.Thyagarajan Presents. Cast: Ajith Kumar, Nayanthara, Jagapathi Babu, Vivek, Thambi Ramiah, Yogi Babu, Robo Shankar & Kovai Sarala.Director: Siva Music Director: D Imman Cinematography: Vetri Editor: Ruben Art : Milan Stunts : Dhilip Subrayan Choreography : Kalyan, Ashok Raja & BrindaLyrics : Thamarai, Viveka, Arun Bharathi & Yuga Bharathi Co Produced by : G Saravanan Costume Designer : Anu Vardhan & Dhatsha A PillaiExecutive Producer : Raahul Stills : Sittrarasu Co Writer : Adi Narayana Co Director : Raja Sekar Dialogues : Siva, Manikandan, Savari, Bakyaraj & ChandranPRO : Suresh Chandra, RekhaPublicity Designs : Anil & Bhanu Sound Design : Uday Kumar VFX : Harihara SuthanMake Up : Kuppusamy Producer : Sendhil Thyagarajan, Arjun Thyagarajan Follow us on Facebook - https://twitter.com/SathyaJyothiFilmsTwitter - https://twitter.com/SathyaJyothi_ Instagram - https://twitter.com/SathyaJyothiFilmsAudio on 'Lahari Music'Digital Partner - Divo http://www.facebook.com/divomovies https://twitter.com/divomovies#ViswasamTrailer #AjithKumar"
"L6kV8BpbR8g","India retain Border-Gavaskar trophy | Third Domain Test","2018-12-30T03:05:16.000Z","UCkBY0aHJP9BwjZLDYxAQrKg","cricket.com.au","17","19.01.01","sp:ty=high,sp:dt=2018-12-25T23:30:00Z,sp:st=cricket,sp:li=icc,sp:ti:home=AUS,sp:ti:away=IND,Australia,India,third Test,day five,MCG,2018,highlights","11515558","116382","6480","6321","https://i.ytimg.com/vi/L6kV8BpbR8g/default.jpg","False","False","The rain delayed the inevitable but once play started in Melbourne it didn't take long for India to wrap up the final two Aussie wickets and win the MCG Test by 137 runs to retain the Border-Gavaskar Trophy"
"d72vXhJDE6M","Tuition Classes aur Bache | Ashish Chanchlani","2018-12-29T13:34:35.000Z","UC7eHZXheF8nVOfwB2PEslMw","ashish chanchlani vines","23","19.01.01","ashish chanchlani ashish chanchlani vines ashish,ashish chanchalani,ashish chanchlani new,ashish chanchlani new video,chanchlani,aashish,doraemon dub,ashish chanchlani exam vine,ashish chanchlani tuition,ashish tution,ashish chanchlani tution,tuition classes aur bache,ashish chanchlani tuition classes and bache,ashish chanchlani classroom video,ashish classes video,ashish tuition class video","10732048","1017679","38147","67061","https://i.ytimg.com/vi/d72vXhJDE6M/default.jpg","False","False","Here it is the last video of 2018 from usTUITION, CLASSES AUR BACHErelive your amazing tuition masti with this funny relatable videoand do not forget to comment down your favourite scene and dialogue now!also please do not forget download the AZAR APP : https://bit.ly/2PLEamHProduction Starring : Kunal Chhabhria, Akash Dodeja, Simran Dhanwani, Anmol Sachar, Vivek Menon, Jashan Sirwani, Tanish Sirwani, Rohit Sadhwani, Divesh Nainani, Aseem Sidhwani,Pranav Punjabi, Akash Jagtap, Raaj Raisinghani, Yogesh Makhija, Lovepreet Arora, Vijay Phulwadhwa, Ritesh Sidhwani,Prashant Jeswani, Kunal Hemnani, Dhiraj Makhijani, Nitesh Wadhwara, Sahil Talreja, Piyush Sadhwani, Om Jeswani, Sanju Gera, Grishim Navani, Chirag Bhojwani, Kunal Ahuja, Sagar Thakur, Mukesh Wadhwa, Rahul Sachani, Chetan Sachdev, Bhavesh Talreja, Sahil Taleja, Avinash Kukreja, Jai Wadhwara, Ritesh Udasi, Dipika Sharma.Cinematography : Siddharth KedareEdited by : Kunal Chhabhria, Divesh Nainani & Ashish ChanchlaniWritten & Created by : Ashish ChanchlaniLocation Courtesy : M.B BHATIA CLASSES, ULHASNAGARBrand Association : Goviral Media"
"XMs2wkBqp_0","Evadi Gola Vaadidi | ETV New Year Special Event | 31st  December 2018 | Full Episode | ETV Telugu","2018-12-31T21:24:27.000Z","UCSs9H1cyB3OHdy8wkit8ZKg","etvteluguindia","24","19.01.01","etv shows,eenadu television,padutha theeyaga,super2,dhee Jodi,jabardasth,extra jabardsth,etv20,etv comedy show,extra jabardasth,naga babu,roja,anchor anasuya,rashmi,dhanraj,chandra,chanti,comedy short films,raghava,rocket raghava,roller raghu,venu wonders","1586004","20838","1995","2170","https://i.ytimg.com/vi/XMs2wkBqp_0/default.jpg","False","False","The Jabardasth Katharnak Comedy Show is a popular Telugu TV comedy show, rated excellent among Telugu, broadcast on ETV channel, in Telugu States, India. The show was first telecast on ETV on 7 February 2014, featuring popular Telugu film industry actor and producer Nagendra Babu and Telugu film actress and politician Roja."
"FCB0ZfQ9Rzs","Petta - Official Trailer [Tamil] | Superstar Rajinikanth | Sun Pictures | Karthik Subbaraj | Anirudh","2018-12-28T04:54:25.000Z","UCBnxEdpoZwstJqC1yZpOjRA","Sun TV","24","19.01.01","SunTV,Tamil Channel,SuperStar,Rajinikanth,SunPictures,KarthikSubbaraj,Anirudh,AnirudhRavichander,Vivek,LyricistVivek,SPB,SPBalasubramanyam,Petta,MaranaMass,SouthMovie,TamilMovie,PettaPongal,PettaPongalParak,PettaParak,ThalaivarBaila,Ullaallaa,karthiksubbaraj,AzizNakash,innogenga,Karthik Subbaraj,Simran,Vijay Sethupathi,Trisha,Nawazuddin,Sasikumar,Megha Akash,Tami lMovie,Petta Teaser Petta Trailer,Petta SunTV,Rajini Movie,Jithu,Singaar Singh,PettaTrailer,GetRajinified,Trending","16569309","664236","69408","35526","https://i.ytimg.com/vi/FCB0ZfQ9Rzs/default.jpg","False","False","Sun Pictures presents the Official Trailer of “Petta” Starring: Superstar Rajinikanth, Vijay Sethupathi, Trisha, Simran, Nawazuddin Siddiqui, Sasi Kumar, Bobby Simha Director : KARTHIK SUBBARAJProducer : SUN TV NETWORK LIMITEDDOP : S THIRUNAVUKKARASUMusic : ANIRUDH RAVICHANDEREditor : VIVEK HARSHANProduction Designer : SURESH SELVARAJANAction Director : PETER HEINSound Designer : KUNAL RAJANExecutive Producer : KAARTHEKEYEN SANTHANAMMakeup & Hair : BANU | VINOTHCostume Designer : NIHARIKA BHASIN KHAN & PRAVEEN RAJACostumer : SUBIERLyricist : VIVEK,KU.KARTHIK & 'POETU' DHANUSHChoreography : SHERIFF | BABA BHASKARPro : RIAZ K AHMEDPublicity Design : 24AM | TUNEY JOHNStills : CH. BALU | TARUN KHIWALProduction Executive Team: D. RAMESH KUCHIRAYAR | R.S SURESH MANIYAN | SETHU | ASHOK  Direction Team:BALA | PURUSHOTH | SRINI | BHARATH | CHARUKESH | DHAKSHI | KARTHIK| SHYLAM | VIGNESH | JAGADEESH | GOWTHAM | MAHENDRAN GOWTHAM  #Sunpictures #SuperStar #RajiniKanth #PettaTrailer #KarthikSubbaraj #AnirudhRavichander #PettaPongal #Petta #GetRajinified #Trending"
"Hs4qYI6SDos","The Kapil Sharma Show Season 2 | Ep 1 | The Madness Returns | 29th December, 2018","2018-12-29T17:50:49.000Z","UCpEhnqL0y41EpW2TvWAHD7Q","SET India","24","19.01.01","bharti singh,bollywood,bollywood celebrity,chandan prabhakar,comedian,comedy acts,comedy gags,comedy videos,exclusive interviews,funny videos,hd videos,hilarious,kapil is back,kapil sharma,kiku sharda,krishna abhishek,movie promotions,promotion,season 2,set,set india,sony entertainment india,sony entertainment television,sonyliv,sonyliv app,sonyliv digital,stand up,sumona singh,the kapil sharma show,kapil sharma show,simbaa kapil sharma show","2796815","53766","3506","3502","https://i.ytimg.com/vi/Hs4qYI6SDos/default.jpg","False","False","Click on the link below to watch the full episodes of The Kapil Sharma Show Season 2 only on SonyLIV: https://www.sonyliv.com/details/episodes/5984418370001/Ep.-1---The-Madness-Returns---The-Kapil-Sharma-Show-Season-2---29-December-2018?utm_source=YOUTUBE&utm_medium=slate&utm_campaign=YT_trafficClick here to Subscribe to SonyLIV: http://www.sonyliv.com/signinClick here to watch The Kapil Sharma Show Season 2:https://www.youtube.com/playlist?list=PLzufeTFnhupwf9XxkXpD-xDdoHxtWhYeFEpisode 1: The Madness Returns-----------------------------------------------------The greatest comedy show is back on air. Everyone's beloved Kapil Sharma is back for another season of his super hit show. Tonight on this grand stage of laughter, we proudly welcome the cast of Simba, directed by Rohit Shetty. Ranveer Singh and Sara Ali Khan are here to join Kapil on his mission to make us laugh out loud. So sit back, relax and begin this journey of laughter, comedy and humorous jokes. Watch the full episode now!About The Kapil Sharma Show Season 2 : ---------------------------------------------------Kapil Sharma is back with a new 'Salah Center' (Consultancy Business) in a Mohollah with absurd characters. The wealthy milkman Bachcha Yadav (Kiku Sharda) with his wife Titli Yadav (Bharti Singh) and sister-in-law Bhoori (Sumona Singh) is the one who has rented out houses within the Mohollah and is Kapil Sharma's business partner. The neighbors in the Mohollah are also full of quirks and don't shy away from the antics. With celebrities gracing every episode, The Kapil Sharma Show promises fun-filled entertaining weekends.More Useful Links : * Visit us at : http://www.sonyliv.com * Like us on Facebook : http://www.facebook.com/SonyLIV * Follow us on Twitter : http://www.twitter.com/SonyLIVAlso get Sony LIV app on your mobile * Google Play - https://play.google.com/store/apps/details?id=com.msmpl.livsportsphone * ITunes - https://itunes.apple.com/us/app/liv-sports/id879341352?ls=1&mt=8"
"Hj867PrTLHw","Love Failure Sothanaigal | Micset","2018-12-31T11:28:13.000Z","UC5EQWvy59VeHPJz8mDALPxg","Mic Set","23","19.01.01","love failure,breakup,micset,love failure sothanaigal,mikeset,sriram,entertainment,tamil,siram prince,sothanaigal,petta,visuvasam,new year,micset video,micset channel,funny video,comedy,micset sriram love failure,micset love failure sothanaigal,micset sothanaigal,mic set bloopers,sriram prince,mic set,funny videos,mic set videos,mic set channel tamil,bloopers micset,love failure comedy videos","939381","100089","1513","5360","https://i.ytimg.com/vi/Hj867PrTLHw/default.jpg","False","False","1. Download the app here: http://bit.ly/2Spn6A1.2. Participate in the contest http://bit.ly/2CAhGN4  and win big prize!         1 winner will win 31111         5 winner will win 11111 Every Break up is an opportunity to make it right the next time....Guys here we are with the love failure sothanaigal..Watch till the end and enjoy the video.For More Videos Please Subscribe Our Channel.Cast & Crew:Sriram   ( INSTA ID - https://www.instagram.com/sriram_prince_ )                      ( FB ID- https://www.fb.com/sri.ram.3511041 ) Sivaranjini    ( FB ID- https://www.fb.com/Ranjani.anba )Punithan     ( INSTA ID - https://www.instagram.com/punithan_tayse )Nandhini ( INSTA ID - https://www.instagram.com/a.c.h.u._5 )Abinash - ( INSTA ID - https://www.instagram.com/abinash_killer )FRAMES :    Thilak raj ( INSTA ID - https://www.instagram.com/thilakjamie )                                  Editing  - SFX: Sriram  ( INSTA ID - https://www.instagram.com/sriram_prince_ )                     ( FB ID- https://www.fb.com/sri.ram.3511041 ) VFX - Chandru ( INSTA ID - https://www.instagram.com/chandru_kidboy )                      ( FB ID -  https://www.fb.com/chandrukidboy )Subtitles :Rj SophieTeam Manager  :   P.SheshathriTeam Coordinator :  VelmuruganTeam Admin            :  N.ChandruScript & Direction: SRI RAM Digital Partner : DIVO For Promotions, Branding, Digital Marketing Contact : +91 8248991430Email :  officialmicset@gmail.com"
"peUY8q3GzlM","BB Ki Vines- | From the heart- 2018 Rewind |","2018-12-30T15:34:29.000Z","UCqwUrj10mAEsqezcItqvwEw","BB Ki Vines","24","19.01.01","[none]","1726621","153218","4039","10052","https://i.ytimg.com/vi/peUY8q3GzlM/default.jpg","False","False","OFFICIAL BB KI VINES MERCHANDISEhttps://youthiapa.com/MIVI's YEAR END SALE !!Use coupon code BB2019 for a massive discount!https://www.mivi.in/bb2019RAHGUZAR- MUSIC VIDEOhttps://www.youtube.com/watch?v=rhhWr8R88IYSANG HOON TERE- MUSIC VIDEOhttps://www.youtube.com/watch?v=2RPuAW7E-YQSAFAR- MUSIC VIDEOhttps://www.youtube.com/watch?v=Zqv5CBWt9yAPLUS MINUS- SHORT FILMhttps://www.youtube.com/watch?v=jKyXUJceZ6k&t=27sTITU TALKS EPISODE 1 ft. SHAH RUKH KHANhttps://www.youtube.com/watch?v=zsjK04TqQq0&t=43sINTERVIEW WITH ANUPAMA CHOPRAhttps://www.youtube.com/watch?v=iM4h5jhy1Us&t=1221s GIRL CHILD EDUCATION- YOUTUBE IMPACT LABS:https://www.youtube.com/watch?v=MGeC6aZkz74YOUTUBE REWIND 2018https://www.youtube.com/watch?v=YbJOTdZBX1g&t=260sBB DUBSVirat- Anushka: https://www.instagram.com/p/BdUU6u7D0Cq/Royal Wedding: https://www.instagram.com/p/Bi_n0_eDCcd/Deepika- Ranveer: https://www.instagram.com/p/Bqe8uuNnixk/"
"DlnTzxPZuqA","Naayagi Episode 267, 31/12/18","2018-12-31T15:00:05.000Z","UC-lJ-F5mlPP6SYPkkq6gjwA","VikatanTV","24","19.01.01","SunTv,VikatanTV,Tamil Serial,Tamil Programme,Tamil TV Programme,Daily Serial,SunTV Serial,naayagi today episode,Naayagi 31/12/18,Naayagi Episode 267,Naayagi 31/12/2018,vikatan,vikatantv,Naayagi latest episode,Naayagi episode today","712697","3619","1112","654","https://i.ytimg.com/vi/DlnTzxPZuqA/default.jpg","False","False","USee Shop appAndroid   http://bit.ly/2S8QniRApple   https://apple.co/2EzxseeNaayagi Episode 267Subscribe: https://goo.gl/eSvMiG  Vikatan App - http://bit.ly/2QvUBTD Prev Episode: http://bit.ly/2KWR5N7  Best of Naayagi: http://bit.ly/2LzLHlLPromos: https://goo.gl/iptj14 Facebook: https://goo.gl/Ze4PrFNaayagi (Nayagi or Nayaki) is a 2018 Tamil language family soap opera, a serial with daily episode, starring Vidya Pradeep, Papri Ghosh, Ambika, Dhilip Rayan, Vetri Velan, Meera Krishnan and Suresh Krishnamurthi. It is the story of Anandhi, heir apparent to a business empire but separated at birth from her parents who were killed treacherously by their aide Kalivardhan. The show replaced Deivamagal and is produced by Vikatan Televistas Pvt Ltd. This Tamil daily serial airs on SUN TV, every Monday to Saturday at 8:00 pm.Here is today’s episode. Yesterday episode link above."
"q6a7YHDK-ik","The Accidental Prime Minister | Official Trailer | Releasing January 11 2019","2018-12-27T08:59:54.000Z","UC3ar28GS6o1p0m_wabfk2zw","Pen Movies","1","19.01.01","The Accidental Prime Minister,Accidental Prime Minister,Manmohan Singh,Prime Minister,Congress,BJP,Anupam Kher,Akshay Khanna,Pen Movies,Bollywood,Latest Movies,Indian Politics","37330032","584766","52313","70711","https://i.ytimg.com/vi/q6a7YHDK-ik/default.jpg","False","False","Presenting official trailer of The Accidental Prime Minister. In cinemas, January 11th 2019.A film based on the book The Accidental Prime Minister by Mr. Sanjaya Baru.Rudra Productions (UK), Bohra Bros in association with Dr. Jayantilal Gada (pen)  present The Accidental Prime Minister. Produced by Sunil Bohra, Dhaval Jayantilal Gada & Bloom Arts Pte Ltd.Directed by - Vijay Ratnakar GutteStarring - Anupam Kher, Akshaye Khanna, Suzanne Bernert, Aahana Kumra, Arjun Mathur, Vipin Sharma and Divya Sethi.Written by - Mayank Tewari, Vijay Ratnakar Gutte, Karl Dunne (UK), Aditya SinhaCo Producer - Jatinder Kumar Bharadwaj, Ashoke PanditEditor - Praveen KNLDirector Of Photography - Sachin KrishnDI & VFX - After Studios (UK)Music Director - Sudip Roy (UK), Sadhu S TiwariBackground Music- Sumit Sethi & Abhijit VaghaniSound Designer- Mandar KulkarniLine production- Bombay Casting Talent Management Pvt ltd."
"x-kqEhvvAYc","NA NA NA (Full Video) I Karan Aujla | Deep Jandu | Rupan Bal | Latest Punjabi Songs 2019","2018-12-31T12:30:59.000Z","UCm9SZAl03Rev9sFwloCdz1g","Rehaan Records","10","19.01.01","[none]","1029048","62223","1667","4485","https://i.ytimg.com/vi/x-kqEhvvAYc/default.jpg","False","False","Singer/Lyrics : Karan AujlaMusic: Deep JanduVideo: Rupan BalProject by: Deep Rehaan & Sukh BajwaProduced by: Sandeep RehaanLabel : Rehaan RecordsOnline promotions : gk digitalWebsite: WWW.RehaanRecords.COMFB: https://m.facebook.com/RehaanRecords/INSTA: Instagram/rehaanrecords"
"3RrKHPUb2sw","Deepak Thakur | Media Interaction | BiggBoss 12 | Eviction | Bigg Boss 12 Grand Finale | Cinespeaks","2018-12-30T18:41:06.000Z","UCUu-b0XePktygWpwPKVc3Bg","Cine Speaks","24","19.01.01","Deepak Thakur,Grand Finale,Media Interaction,BiggBoss 12,Evection","793420","18032","855","2783","https://i.ytimg.com/vi/3RrKHPUb2sw/default.jpg","False","False","#DeepakThakur out in the #BiggBossFinale and interact with Media #cinespeaks #WeekendKaVaarSubscribe to Cinespeaks: https://www.youtube.com/channel/UCUu-b0XePktygWpwPKVc3BgVisit our website for your daily dose of Bollywood and Hindi television: http://cinespeaks.comStay tuned on our social media pages for all your updatesFacebook: https://facebook.com/cinespeaks/Twitter: https://twitter.com/cinespeaks/"
"iunwd4_ydh4","JUMP AND GO ANYWHERE !!!","2018-12-31T04:00:02.000Z","UCNn6AaHharXIbkRleXGboiQ","Mumbiker Nikhil","22","19.01.01","blogs,vlog,mumbiker,nikhil,emirates,new year,garden,global village,money,kaerik,uat,youtube malll,youtube india,mumbai to dubai,shopping,dubai mall,man made,fans","695720","51796","1762","3821","https://i.ytimg.com/vi/iunwd4_ydh4/default.jpg","False","False","My Merch : https://labelmn.com/MIVI : Coupon code : MNDECWebsite links:Octave 16W Bluetooth Speaker:    https://mivi.shop/Octave_MNFESTMoonstone 10W Bluetooth Speaker:    https://mivi.shop/Moonstone_MNFESTRoam 5W Bluetooth Speaker:    https://mivi.shop/Roam_MNFESTCollar Wireless Earphones:    https://mivi.shop/Collar_MNFESTSaxo Wireless Headphones:    https://mivi.shop/Saxo_MNFESTConquer Wireless Earphones:    https://mivi.shop/Conquer_MNFESTThunderBeats Wireless Earphones:    https://mivi.shop/ThunderBeats_MNFESCategoryPeople & Blogs"
"C6fXqXQVzFI","Azhagu - Tamil Serial | அழகு | Episode 341 | Sun TV Serials | 31 Dec 2018 | Revathy | Vision Time","2018-12-31T14:12:44.000Z","UCOpUWgNJq1kUlB3Z5KM7X-A","Vision Time Tamil","24","19.01.01","Azhagu,அழகு,Azhagu Tamil Serial,Full Episode 341,Sun TV Serials,31 December 2018,Thalaivasal Vijay,Vision Time,azhagu serial,azhagu serial today episode,azhagu serial yesterday episode,azhagu tamil serial,azhagu tamil serial today episode,azhagu tv serial,azhagu yesterday tamil serial,azhagu latest sun tv,azhagu latest serial,Revathy tamil serial,Revathy latest serial,Revathy sun tv serial,latest sun tv serial,azhagu latest episodes","687805","4023","746","795","https://i.ytimg.com/vi/C6fXqXQVzFI/default.jpg","False","False","Azhagu Tamil Serial latest Full Episode 341 Telecasted on 31 December 2018 in Sun TV. Azhagu Serial ft. Revathy, Thalaivasal Vijay, Shruthi Raj and Aishwarya in the lead roles. Azhagu serail Produced by Vision Time, Directed by ON Rathnam, Dialogues by Jagan. Azhagu serial deals with the nuances of love between a husband (Thalaivasal Vijay) and wife (Revathi), even though they have been married for decades, and have successful and very strong individual personas.Click here to watch : Azhagu Full Episode 341 https://youtu.be/xdm_s-ug2zwAzhagu Full Episode 340 https://youtu.be/DRhq043dBloAzhagu Full Episode 339 https://youtu.be/rb0Q3GhKEy0Azhagu Full Episode 337 https://youtu.be/IrLfD3H2koYAzhagu Full Episode 336 - https://youtu.be/LdvdDCthE0AAzhagu Full Episode 335 - https://youtu.be/qSPpWo4lDj4Azhagu Full Episode 334 - https://youtu.be/55doKIflMVkAzhagu Full Episode 333 - https://youtu.be/rQzX6alcGiYAzhagu Full Episode 332 - https://youtu.be/gQpVYbBhBnoAzhagu Full Episode 331 https://youtu.be/ijaUGtBx88sAzhagu Full Episode 330 https://youtu.be/Uip2I1i_sVcAzhagu Full Episode 329 https://youtu.be/XHsKbvJODlgAzhagu Full Episode 328 https://youtu.be/K4zb5icuXqwSubscribe for latest Azhagu Episodes - http://bit.ly/SubscribeVTLike us on - https://www.facebook.com/visiontimeindia"
"K_EMU7pW24k","DONT BARK If You Can't Bite - Sippy Gill - New Punjabi Songs 2018 - Full HD- Punjabi Song 2018","2018-12-30T10:54:01.000Z","UCGgeKl-nC7ChF-b0J6ekPNg","Folk Rakaat","10","19.01.01","Sippy gill,Folk Rakaat,Dont Bark if you cant bite,new punjabi songs 2018 Sippy gill,Latest punjabi song 2018 sippy gill,Punjabi new songs 2018,punjabi latest song 2018,new punjabi songs latest this week,sippy gill new punjabi songs,sippy gill latest punjabi songs,punjabi songs 2018 sippy gill,punjabi song sippy gill,new songs 2018 sippy gill,latest song 2018 sippy gill,punjabi music videos,trending on youtube india,songs 2018","2299267","70036","3633","2650","https://i.ytimg.com/vi/K_EMU7pW24k/default.jpg","False","False","DONT BARK If You Can't Bite - Sippy Gill - New Punjabi Songs 2018 - Full HD- Punjabi Song 2018Folk Rakaat Presenting New Punjabi Song 2018 Dont Bark If You Cant Bite By Sippy GillClick Here To Subscribe For New Songs : http://bit.ly/SubscribeFolkRakaatAlso Available On :Apple:https://itunes.apple.com/in/album/dont-bark-if-you-cant-bite-single/1448041100Spotify:http://open.spotify.com/album/40HGe1vs3wz0hD5a4iChtPAmazon:https://www.amazon.com/Dont-Bark-You-Cant-Bite/dp/B07MKRVJKB/ref=mp_s_a_1_1Google Play:https://play.google.com/store/music/album/Sippy_Gill_Don_t_Bark_If_You_Can_t_Bite?id=Bpw6aebp6bgvnifujfgow6vditySong - DONT BARK If You Can't BiteSinger - SIPPY GILLhttps://www.facebook.com/SippyGillLyrics - SULAKHAN CHEEMAMusic -WESTERN PENDU Digital Partner and Online Promotions By :Kixtix Mediahttps://www.kixtix.inD.O.P - REGAN DADUEditor - JAGJEET SINGH DHANOAProducer - KULWINDER SINGHLabel - FOLK RAKAATEnjoy And Stay Connected With Us || FOLK RAKAATClick to Subscribe - http://bit.ly/SubscribeFolkRakaatFacebook - https://www.facebook.com/Folk-Rakaat-144666986071607Instagram - https://instagram.com/FolkRakaat"
"EGIfhT0gyZc","Sudigaali Sudheer Performance | Extra Jabardasth | 28th  December 2018 | ETV Telugu","2018-12-28T18:31:24.000Z","UCnoqvTW4YZExfDeq7_Wmd-w","ETV Jabardasth","22","19.01.01","etv shows,eenadu television,padutha theeyaga,super2,dhee Jodi,jabardasth,extra jabardsth,etv20,etv comedy show,extra jabardasth,naga babu,roja,anchor anasuya,rashmi,dhanraj,chandra,venu,chanti,dhana dhan dhanraj,comedy short films,chamak chandra,chalaki chanti,raghava,rocket raghava,roller raghu,venu wonders,comedy skits in telugu,telugu comedy tracks,allari harish,yedukondalu,racha ravi,adhire abhi,fata fut fun,Rocking rakesh","3722273","46348","3749","2450","https://i.ytimg.com/vi/EGIfhT0gyZc/default.jpg","False","False","A comedy show, in which comedians like Sudigaali Sudheer, Chammak Chandra and Hyper Aadi perform side|splitting comedy skits."
"aV5HMqRas5g","Vinaya Vidheya Rama Trailer - Ram Charan, Kiara Advani | Boyapati Sreenu | DVV Danayya | #VVRTrailer","2018-12-27T15:53:17.000Z","UCumU_6FNxfHXTmeeFCYz6Yw","DVV Entertainment","24","19.01.01","Vinaya Vidheya Rama,Vinaya Vidheya Rama Ram Charan,Vinaya Vidheya Rama Telugu Movie,Vinaya Vidheya Rama New Movie,Vinaya Vidheya Rama Latest 2018,VVR 2018,VVR Telugu Movie,Ram Charan VVR Movie,VVR Teaser,Ram Charan,Kiara Advani,Boyapati Srinu,Devi Sri Prasad,Telugu Mass Scenes,Telugu Fights,Vinaya Vidheya Rama Trailer,Vinaya Vidheya Rama Songs,Vinaya Vidheya Rama Official Trailer,Vinaya Vidheya Rama Trailer - Ram Charan","13680817","325531","37330","24008","https://i.ytimg.com/vi/aV5HMqRas5g/default.jpg","False","False","Watch Vinaya Vidheya Rama Trailer. Starring Ram Charan, Kiara Advani, Vivek Oberoi #VinayaVidheyaRama, #VinayaVidheyaRamaTrailer, #RamCharan, VVR TrailerStory - Screenplay - Direction : Boyapati SreenuProducer : DVV DanayyaMusic : Devi Sri PrasadDOP : Rishi Punjabi - Arthur A Wilson Editing : Kotagiri Venkateswara Rao, ThammirajuArt : A.S.Prakash Stunts : Kanal Kannan Executive Producer - V.Y. Praveen KumarLine Producer : Vijay JagarlamudiCo Producer : Kalyan DVVDigital Partners : Walls & TrendsPRO : Vamsi Kaka, NaniStills : JeevanPublicity : Dhani AelayChief Co Director : Bandi Ramesh - Ravi Nandipati"
"mMjOHAriaQg","#SachMein Hardik Pandya, Mahendra Singh Dhoni? #StarValuePack","2018-12-29T16:02:38.000Z","UC-LPIU24bQXVljUXivKEeRQ","StarPlus","24","19.01.01","Star Plus,Star Value Pack,sach mein campaign,Mahendra Singh Dhoni,Hardik Pandya,VIVO IPL,Star TV network,TRAI promo,only rs 49,Cricket,DTH","4873794","215979","2816","7384","https://i.ytimg.com/vi/mMjOHAriaQg/default.jpg","False","False","Vishwas nahin hoga yaar… #SachMein?Hardik Pandya | Mahendra Singh Dhoni | Star TV Network | #StarValuePack"
