video_id,title,publishedAt,channelId,channelTitle,categoryId,trending_date,tags,view_count,likes,dislikes,comment_count,thumbnail_link,comments_disabled,ratings_disabled,description
"RwaO_nOMGUE","तीन तलाक: विपक्ष के हंगामे की वजह से राज्य सभा में पेश नहीं हो सका बिल, सदन की कार्यवाही स्थगित","2018-12-31T09:55:32.000Z","UCmphdqZNmqL72WJ2uyiNw5w","ABP NEWS HINDI","25","19.01.01","triple talaq,triple talaq bill,triple talaq debate,triple talaq latest news india,triple talaq bill passed in parliament,triple talaq study iq,triple talaq bill in lok sabha,triple talaq bill in rajya sabha,triple talaq owaisi,triple talaq zakir naik,triple talaq parliament,congress on triple talaq,talaq e biddat,abp news,abp news live,aaj tak live,abp hindi,abp live,india news today,live news,live tv aaj tak,live news india,hindi news live","168320","1447","213","475","https://i.ytimg.com/vi/RwaO_nOMGUE/default.jpg","False","False","तीन तलाक विधेयक सहित विभिन्न मुद्दे पर अलग अलग दलों के हंगामे के कारण राज्यसभा की बैठक दो बार के स्थगन के बाद दोपहर दो बजकर करीब पच्चीस मिनट पर पूरे दिन के लिए स्थगित |Subscribe Our Channel: https://www.youtube.com/channel/UCmphdqZNmqL72WJ2uyiNw5w?sub_confirmation=1About Channel:ABP News एक समाचार चैनल है जो नवीनतम शीर्ष समाचारों, खेल, व्यवसाय, मनोरंजन, राजनीति और कई और अन्य कवरेज प्रदान करता है। यह चैनल मुख्य रूप से भारत के विभिन्न हिस्सों से नवीनतम समाचारों का विस्तृत विवरण प्रदान करता है।ABP News is a news hub which provides you with the comprehensive up-to-date news coverage from all over India and World. Get the latest top stories, current affairs, sports, business, entertainment, politics, astrology, spirituality, and many more here only on ABP News.ABP News is a popular Hindi News Channel made its debut as STAR News in March 2004 and was rebranded to ABP News from 1st June 2012.The vision of the channel is 'Aapko Rakhe Aagey' -the promise of keeping each individual ahead and informed. ABP News is best defined as a responsible channel with a fair and balanced approach that combines prompt reporting with insightful analysis of news and current affairs.ABP News maintains the repute of being a people's channel. Its cutting-edge formats, state-of-the-art newsrooms commands the attention of 48 million Indians weekly.Watch Live on http://abpnews.abplive.in/live-tvABP Hindi: http://abpnews.abplive.in/ABP English: http://www.abplive.in/Download ABP App for Apple: https://itunes.apple.com/in/app/abp-live-abp-news-abp-ananda/id811114904?mt=8Download ABP App for Android: https://play.google.com/store/apps/details?id=com.winit.starnews.hin&hl=enSocial Media Handles:Instagram: https://www.instagram.com/abpnewstv/Facebook: https://www.facebook.com/abpnews/Twitter: https://twitter.com/abpnewstvGoogle+: https://plus.google.com/+abpnews"
"HwtC-ZttW6c","Types Of New Year's Eve | People At A Party | Hasley India","2018-12-31T12:53:50.000Z","UCgM1AQcoM5TRlzsm1e66vrQ","Hasley India","23","19.01.01","hasley,india,harsh,beniwal,rishhsome,rishabh,rana,new years eve,nye,new years,party,house party,parties in india,boys vs girls,naya saal,welcome 2019,suspense,hasley india videos,hasley india desi videos,desi,students,comedy videos,funny videos,people at a party,short comedy videos,types of people","240415","15911","1429","391","https://i.ytimg.com/vi/HwtC-ZttW6c/default.jpg","False","False","Making plans for new year's eve Is always a task and partying in India.This video is about the NYE party's Expectation Vs Reality. Let's find out.Genre: Comedy VideoWatch our videos :-Office Romancehttps://www.youtube.com/watch?v=nHJaS...Indians And Police https://www.youtube.com/watch?v=AyVgR...Types of People At A House Partyhttps://www.youtube.com/watch?v=Zwuxc...For Business & Collaborations: hasleyindia@famegame.in Channel HeadAnkit MadaanDirected byShubham GaurCASTRishabh RanaAnkit MotghareMayank BhardwajShiva SharmaShubham GaurLavee KhanAarav YadavTwarita NagarAnushka SharmaSrishti VaidWriter Shubham GaurLucky SharmaLine Producer : Mayank MishraDOP : Priyanshu VatsArt : Vijay KumarPost Production Head: Ankit MotghareAssistant Editor: Aarav YadavGraphics: Vijay Kumar BholaEditor: Ankit MotghareHasley India Social Media Aman MadaanMayank MishraDarshan BhandariLightmen Kamal & YogeshSUBSCRIBE ► THANKS FOR WATCHING! LIKE & SUBSCRIBE FOR MORE VIDEOS!"
"up6NiB50y_M","Ram's wish Fulfilled by Jaanu - 96 Romantic Scene Re-created!","2018-12-29T10:00:08.000Z","UC8md0UEGj7UbjcZtMjBVrgQ","BehindwoodsTV","24","19.01.01","tamil cinema,96 trailer,96 song,vijay sethupathi young photos,96 interview,vijay sethupathi interview,trisha interview,96 movie whatsapp status,96 video song hd,96 vijay sethupathi,96 vijay sethupathi interview,96 vijay sethupathi trisha,jaanu Behindwoods awards,news,tamil cinema updates,ram and jaanu,yamunai aatrile,kadhale kadhale,adithya baskar and gouri,96 full movie,chinmayi singing,96 video songs,ram jaanu,trisha 96 scene","1894013","48117","1004","1007","https://i.ytimg.com/vi/up6NiB50y_M/default.jpg","False","False","Reach 4 crore people at Behindwoods. Click here to advertise:https://goo.gl/a3MgeBFor more such videos subscribe to the link http://goo.gl/AUJGvP We will work harder to generate better content. Thank you for your support.#BehindwoodsGoldMedals #RamJaanu #96Film.The 6th Iconic Edition of Behindwoods Gold Medals conducted on December 16th 2018 at Chennai Trade Centre. Best Debut Actors - AADHITYA BAASKAR & GOURI G KISHAN. Ram's wish fulfilled by Jaanu on Stage. Ram and Jaanu re-creating 96 romantic scene. To know more, watch the full video.  For more videos, interviews, reviews & news, go to: http://www.behindwoods.com/Subscribe here - http://goo.gl/AUJGvP"
"ZqITDHEWG1k","REWIND 2018 - TG Edition 🔥🔥🔥","2018-12-31T09:52:33.000Z","UCOhHO2ICt0ti9KAh-QHvttQ","Technical Guruji","28","19.01.01","TG Rewind,Rewind 2018,Technical guruji,Technicalguruji,Gaurav Chaudhary,Rewind,I/O 2018,CES,MWC 2018,Creator Summit,YouTube Rewind,New Year,2018,2019,Last video,Year End,TG,Top Tech Channel,Tech,Technology","287418","35741","1454","4385","https://i.ytimg.com/vi/ZqITDHEWG1k/default.jpg","False","False","Namaskaar Dosto, yeh ek bahut hi khaas video hai jaha maine share kiya hai ek Rewind 2018 ka Technical Guruji channel ke liye. Yeh saal bahut hi kamaal raha jaha humne bahut acchi journey share ki hai is saal mein saath milke. Chahe woh MWC2018 ka trip ho ya fir Google I/O 2018, baad mein Creator Summit 2018 ho aur fir channel ke 3 saal complete karna ho aur fir finally 10 Million Subscribers complete karna :) Yeh sab aapke support ke saath hi poora hua. Mujhe umeed hai ki aapko 2018 Rewind ka yeh video pasand aayegi. Thumbnail Sketch: https://youtu.be/yz0PrwKFIPYShare, Support, Subscribe!!!Subscribe: http://bit.ly/1Wfsvt4Android App: https://technicalguruji.in/appYoutube: http://www.youtube.com/c/TechnicalGuruji Twitter:  http://www.twitter.com/technicalgurujiFacebook: http://www.facebook.com/technicalgurujiFacebook Myself: https://goo.gl/zUfbUUInstagram: http://instagram.com/technicalgurujiGoogle Plus: https://plus.google.com/+TechnicalGurujiWebsite: https://technicalguruji.in/Merchandise: http://shop.technicalguruji.in/About : Technical Guruji is a YouTube Channel, where you will find technological videos in Hindi, New Video is Posted Everyday :)"
"KEW_0EIt4fg","आज सुबह की ताज़ा खबरें | News 100 Nonstop | December 31, 2018","2018-12-31T04:52:29.000Z","UCt4t-jeY85JegMlZ-E5UWtA","Aaj Tak","25","19.01.01","aajtak,aaj tak,aaj tak videos,hindi news,news video,latest news,aajtak tv,aajtak channel news,आज तक,hindi news live,breaking news,hindi news bulletin,hindi news today,hindi news video,hindi news aaj tak,news,news hindi,news in hindi,hindi latest news aaj tak,hindi samachar aaj tak,national news in hindi,breaking news aaj tak,national news in hindi today aaj tak,today speed news in hindi","245213","2264","288","152","https://i.ytimg.com/vi/KEW_0EIt4fg/default.jpg","False","False","Watch hundred top trending hot news topics of the hour in News 100 Nonstop!#SuperfastNews #LatestNews #TrendingNews #BreakingNewsAajTak Live TV Watch the latest Hindi news Live on the World's Most Subscribed News Channel on YouTube. Aaj Tak News Channel: आज तक भारत का सर्वश्रेष्ठ हिंदी न्‍यूज चैनल है । आज तक न्‍यूज चैनल राजनीति, मनोरंजन, बॉलीवुड, व्यापार और खेल में नवीनतम समाचारों को शामिल करता है। आज तक न्‍यूज चैनल की लाइव खबरें एवं ब्रेकिंग न्यूज के लिए बने रहें । Aaj Tak is India's best Hindi News Channel. Aaj Tak news channel covers latest news in politics, entertainment, Bollywood, business and sports. Stay tuned for all the breaking news in Hindi ! Download India’s No. 1 Hindi News Mobile App : https://aajtak.app.link/QFAp3ZaHmQSubscribe To Our Channel: http://bit.ly/2xTASBc Official website: https://aajtak.intoday.in/ Like us on Facebook http://www.facebook.com/aajtak Follow us on Twitter http://twitter.com/aajtak Subscribe to our other network channels: The Lallantop https://www.youtube.com/c/thelallantop India Today: http://www.youtube.com/channel/UCYPvA... SoSorry: https://www.youtube.com/user/sosorryp... Tez: http://www.youtube.com/user/teztvnews Dilli Aajtak: http://www.youtube.com/user/DilliAajtak"
"kAsl6jzj4uI","GEETA RABARI | Koni Pade Entry | ગીતા રબારી | કોની પડે એન્ટ્રી | Latest Gujarati Song 2019","2018-12-29T01:15:00.000Z","UCpZVXyR7lix525VPi3Vc5mg","Studio Saraswati Official","10","19.01.01","tahukar,jay mogal,maa mogal,geeta rabari,rdc Gujarati,studio saraswati,Rona Song,New Rona Song,Rona Latest Song,Koni Pade Entry,ગીતા રબારી,કોની પડે એન્ટ્રી,Rona Ni Pade Entry,saraswati studio,new song 2019,latest song 2019,new year song,latest gujarati song,geeta rabari latest song,geeta rabari new song","1962346","50037","4715","3050","https://i.ytimg.com/vi/kAsl6jzj4uI/default.jpg","False","False","Produce & Present By STUDIO SARASWATI - Junagadh.Producer MANOJ N JOBANPUTRA.Singer & Acting : GEETA RABARI.Lyrics & Compose : VIJAYSINH GOL.Music : DHAVAL KAPADIYA.D.O.P. – Direction – Editing – Concept : CHANAKYA A THAKOR.Sp Thanks : PRRUTHVI RABARI & MAHESHBHAI RABARI.Thanks To RATAN GADHVI – BHAVESH GADHVI & All Suporting Members.To Set Your Mobile Caller Tune : Rona Ni Pade EntryAiret User Direct Dial - 5432116708718Idea User Direct Dial - 5678910860696Vodafone User Direct Dial - 53710860696Dil Na Re Dil Dar RonaAiret User Direct Dial - 5432116708738Idea User Direct Dial - 5678910860697Vodafone User Direct Dial - 53710860697Dosto KajeAiret User Direct Dial - 5432116708637Idea User Direct Dial - 5678910860698Vodafone User Direct Dial - 53710860698રોજ નવા અપડૅટ ની માહિતી માટે ૩ ચેનલ ને subcribe કરો.- STUDIO MAA MOGALwww.youtube.com/channel/UCXrYZPDM4U9M-Bk1L-Kcmpw?sub_confirmation=1- STUDIO SARASWATI OFFICIALwww.youtube.com/channel/UCpZVXyR7lix525VPi3Vc5mg?sub_confirmation=1- STUDIO SARASWATI  OFFICIAL CHANNEL"
"YgWfxlQqqd8","31 dawath bandh | robo 2.0 spoof kodi raja | My village show comedy","2018-12-30T11:41:34.000Z","UCnprfRlJB7WE6zAEaOAfVYA","My Village Show","23","19.01.01","Dawath,31 new year party,My village show,Gangavva,MVS,Village show,Telugu,Village comedy,Telangana,Kollu,Dawath party,Daawath,Happy new year,Dethadi gangavva,Anji mama,Robo 2.0 spoof,Robo film parody,Village spoof,Rajini kanth,Bulliguva,Pakshiraja,Kodi raja","489255","21928","1366","3374","https://i.ytimg.com/vi/YgWfxlQqqd8/default.jpg","False","False","BECOME SPONSOR : https://www.youtube.com/channel/UCnprfRlJB7WE6zAEaOAfVYA/joinKEEP SUPPORTINGfollow us on social media :my village show Facebook page : https://www.facebook.com/myvillageshow/my village show instagram : https://www.instagram.com/myvillageshow/my village show twitter : https://twitter.com/myvillageshowwe do parodies, fun short films, songs, we show our culture, festivals ,development and regular activities videos. once check out all of my village show videos you people really enjoy lot.Our village location :village : Lambadipallymandal : Mallialdistrict : Jagityalstate : Telangana Email : sriram.srikanth05@gmail.comwebsite : www.myvillageshow.inif you want to give any suggestions for next videos please mention in the comment section.we will try to make it.subscribe : my village show"
"UsonLRP6wTU","Babbu Maan - Chandigarh | Aah Chak 2019 | New Year Party Songs | Punjabi Bhangra Songs","2018-12-31T18:00:01.000Z","UCiFUsV59Da7olI-fGIaBvUQ","Saga Music","10","19.01.01","Aah Chak 2019,Aah Chak Babbu Maan,Punjabi Songs,New Punjabi Songs 2018,Punjabi Bhangra Songs,New Year Party Songs,New Punjabi Songs 2019,Latest Punjabi Songs,New Year Punjabi Songs,Punjabi Party Songs,Party Songs Punjabi,Babbu Maan,Chandigarh,Babbu Maan Aah Chak 2019,Chandigarh Babbu Maan","533183","31712","1291","3004","https://i.ytimg.com/vi/UsonLRP6wTU/default.jpg","False","False","Celebrate New Year 2019 with Aah Chak 2019, the best performances on Punjabi Bhangra songs by the talented singersEnjoy Punjabi Song Chandigarh by Babbu Maan music directed by Babbu Maan & written by Babbu MaanWatch all stage performances by famous Punjabi singers BABBU MAAN, DARSHAN LAKHEWALA, DEEPAK DHILLON, GURJAZZ, PINKY SANDHU MOGEWALI, PARMINDER SIDHU, SARB AMAN, AMAN DHILLON, 22 GOLU, RUHI BEHAL, MANPREET DHAMI, SAHILAUJLA, BALLI VIRK, ASHISH SARDANA, DUBS BILLA, NAVI, AMAN HANJRA, SABI SINGH, GURWINDER JHANDER, MITHAPURIAAah Chak 2019 All Songs: https://www.youtube.com/playlist?list=PLlLvrlYwk_W-f5nAuIkp1bAkBhySG8X3DSubscribe SagaMusic: https://goo.gl/Q8KqsoSubscribe SagaHits : http://goo.gl/aFFNeCFollow us on:Facebook : https://www.facebook.com/sagahitsInstagram : https://www.instagram.com/sagamusicofficialTwitter : https://twitter.com/Saga_HitsSnapchat : sagamusicofficialSong CreditsTitle: ChandigarhSinger: Babbu MaanMusic: Babbu MaanLyrics: Babbu MaanAlbum Credits: Album: Aah Chak 2019Video: Yaarian FilmsDirector: Ajit DhaliwalEditor: Harmeet S KalraProducer: Munish Sharma & Sumeet SinghPost Production: Raja FilmsBanner: Swag Music, Hey Yolo & Saga MusicMusic Label: Saga MusicDigital Partner: Unisys"
"Imjkxq3AbyY","Tinku Teenager - | The Making and Bloopers | Lalit Shokeen Films","2018-12-30T07:20:06.000Z","UCsLOXfgwzeLAl9E-6Flu3Bg","LShokeen Films","24","19.01.01","lalit shokeen,lalit shokeen films,lshokeen films,lalit shokeen latest video,lalit shokeen videos,lalit shokeen comedy,tinku teenager,the making,happy new year,haryanvi comedy,web series,desi comedy,bloopers,deleted scenes,haryanvi songs,desi prem kahani,trending,viral videos,hilarious bloopers,school days,desi boyfriend","508250","20612","796","1311","https://i.ytimg.com/vi/Imjkxq3AbyY/default.jpg","False","False","Enjoy the hilarious Making and Bloopers of all three episodes of Tinku Teenager Web Series #lalitshokeen #tinkuteenager #lshokeenfilmsContact for advertising and business enquiries:Email: lshokeenfilms@gmail.com            lalit.shokeen@gmail.comFollow us on INSTAGRAM @lalitshokeen1515"
"pKcamCgBvMo","Ek Ladki Ko Dekha Toh Aisa Laga | Official Trailer | Anil | Sonam | Rajkummar | Juhi | 1st Feb'19","2018-12-27T05:30:00.000Z","UCGqvJPRcv7aVFun-eTsatcA","FoxStarHindi","24","19.01.01","Ek Ladki Ko Dekha Toh Aisa Laga,Ek Ladki Ko Dekha Toh Aisa Laga teaser,Anil Kapoor,Sonam kapoor,Rajkummar rao,new bollywood movie teaser,new movie teaser,upcoming movie teaser,anil kapoor new movie,anil kapoor upcoming movie,Sonam kapoor upcoming movie,Sonam kapoor new movie,love story movie,Ek Ladki Ko Dekha Toh Aisa Laga Official Trailer,Ek Ladki Ko Dekha Toh Aisa Laga Trailer,Juhi Chawla,ek ladki ko dekha,ek ladki,ek ladki ko,official trailer 2018","15384983","200741","11339","12558","https://i.ytimg.com/vi/pKcamCgBvMo/default.jpg","False","False","Some love stories are not simple, Sweety’s is one such story. She has to contend with her over-enthusiastic family that wants to get her married, a young writer who is completely smitten by her, a secret that she harbors close to her heart and ultimately the truth that her true love might not find acceptance in her family and society. Resolving these issues proves hilarious, touching & life changing.Welcome to the most Unexpected Romance of the year!  #LetLoveBe Releasing in theatres near you on 1st Feb’2019 Starring: Anil Kapoor, Sonam Kapoor, Rajkummar Rao, Juhi Chawla, Abhishek Duhan, Seema Pahwa, Madhumalti, Brijendra KalaDirected by: Shelly Chopra DharProduced by: Vidhu Vinod Chopra Co-produced by: Fox Star StudiosStory & Screenplay: Gazal Dhaliwal & Shelly Chopra DharMusic: Rochak KohliLyrics: Gurpreet SainiEditor: Ashish SuryavanshiDirector of Photography: Himman DhamijaAdditional Cinematography: Rangarajan RamabadranProduction Design: Rajat PoddarProduction Design (Punjab Schedule): Teddy MauryaExecutive Producer: Lawrence D'SouzaLine Producer: Alok SinhaFirst Assistant Director: Paran BawaCostume Design: Sheetal Sharma Background Music: Sanjay Wandrekar & Atul RaningaSound Design: Parikshit Lalvani & Kunal MehtaRe-recording Mixer: Alok DeAlso Subscribe To FoxStarIndia: http://goo.gl/Y8HGhYFoxStarSouth : http://goo.gl/AO8IsZFox Star Hindi:Facebook: https://www.facebook.com/foxstarhindiTwitter: https://twitter.com/foxstarhindiInstagram: http://instagram.com/foxstarhindiPinterest: http://www.pinterest.com/foxstarhindi/Vidhu Vinod Chopra Films:Facebook: https://www.facebook.com/vinodchoprafilms/Twitter: https://twitter.com/VVCFilmsInstagram: https://www.instagram.com/vinodchoprafilms/?hl=en"
"ASLrgxUCk0I","New Year 2019 Rangoli Art with Dots Latest | Easy Muggulu Designs with Kolam by Sunitha #1017","2018-12-30T09:00:01.000Z","UCZSybGbQDDJTVgYNWzFpY-w","Rangoli by Suneetha","26","19.01.01","easy rangoli designs,sunitha,muggulu,muggulu designs,muggulu with dots,chukkala muggulu,rangoli art,rangoli art designs,easy rangoli,kolam,kolam designs,kolam with dots,kolam designs with dots,simple kolam,sikku kolam,padi kolam,rangoli,rangoli designs,rangoli with dots,rangoli designs with dots,muggulu designs with dots,Rangoli Art","481231","0","0","65","https://i.ytimg.com/vi/ASLrgxUCk0I/default.jpg","False","True","1 Million Views Crossed Rangoli/Kolam/Muggulu Designs:https://www.youtube.com/watch?v=C5zSow2pPgM&list=PLiP5oL9-o5FZcQPvIJdfxJq_v4TxbPO3i_Special Happy New Year Rangoli 2019https://www.youtube.com/playlist?list=PLiP5oL9-o5FawjmlAU6PYJngOD_7PJlZyBest Rangoli/Kolam/Muggulu Designs: Beautiful Rangoli design with Dotshttps://youtu.be/Sv2c-kXCfQ4Simple Kolam Design with Dotshttps://youtu.be/0FHK6PYMEasy Kolam Design with Dotshttps://youtu.be/CulWUSUQBRIEasy Rangoli Design with Dotshttps://youtu.be/0LYK_mROFmIEasy Kolam Design with Dotshttps://youtu.be/AGQq5xoNlzYEasy Rangoli Design with Dotshttps://youtu.be/oUsaFHOCYXERain Drop Rangoli Design with Dotshttps://youtu.be/x65ZuSnLETAHappy New Year 2018 Rangolihttps://youtu.be/qCsbB_N5bjwEasy Rangoli Design with Dotshttps://youtu.be/x65ZuSnLETAEasy Rangoli Design with Dotshttps://youtu.be/KZiSQUX2Lg0Simple Rangoli Design with Dotshttps://youtu.be/SpvzpOQFDmUEasy Rangoli Design with Dotshttps://youtu.be/L9Xx5JGLJsIEasy Kolam Design with Dotshttps://youtu.be/vU3k4L-pUqQSimple Rangoli Design with Dotshttps://youtu.be/SXt-XE3dVFIVery Very Easy Rangoli Design with Dotshttps://youtu.be/Bbh79pfIiWsEasy Color Rangoli Design with Dots https://youtu.be/i_HthOzKsisVery Easy Kolam Design Dotshttps://youtu.be/46cREwZYZPMEasy Rangoli Design with Dotshttps://youtu.be/05Yby32rCMAEasy Kolam Design with Dotshttps://youtu.be/xNj9PmZfOcQVery Easy Rangoli Design with Dotshttps://youtu.be/TVbqqbf94cwVery Easy Rangoli Design with Dotshttps://youtu.be/PoDG0ytq7pwSimple Rangoli Design with Dotshttps://youtu.be/01z5WGw8m1UEasy Rangoli Design with Dotshttps://youtu.be/1AmWEpLIudQsimple rangoli design with dots https://youtu.be/ca6vtcgJuW4Very Very Simple Kambi/Chikku Kolam Designshttps://youtu.be/euNqaIeobEsBeautiful Rangoli Design with Dotshttps://youtu.be/tx4Z9rZJ9e4Very Very Simple Rangoli Designshttps://youtu.be/IZzZupyipNABeautiful Rangoli Design with Dotshttps://youtu.be/UhLSpA0HYTwVery Simple Rangoli Design with Dotshttps://youtu.be/qt_UOf8l9f8Very Simple Kambi/Chikku Kolam Designhttps://youtu.be/voX-7wWljaUvery very simple rangoli designs with dots https://youtu.be/6wmY90tkzuISimple Kolam Designs with dotshttps://youtu.be/v78R7PueHOcvery simple kolam designs with dots https://youtu.be/dV08fS3noiIlatest kolam designs with dotshttps://youtu.be/lZryDRz5Cawlatest easy & simple rangoli designs with dotshttps://youtu.be/OfWQg8d17VQcreative rangoli designs with dotshttps://youtu.be/grMhys_eT2slatest kolam design https://youtu.be/6Z5FHNa6JpAsimple kolam designshttps://youtu.be/JoRwl4m3--Abeginners kolam designs with dotshttps://youtu.be/IjtBYblAZA0Beginners kolam designs with dotshttps://youtu.be/NdMu6NgKFPMlatest kolam design with dotshttps://youtu.be/AmRpXXlKRdgBeginners kolam designs with dotshttps://youtu.be/_hMZkIhZqxsBeginners kolam designs with dotshttps://youtu.be/22CVjwEXBZQbeautiful rangoli design with dotshttps://youtu.be/Jrh6EZx61vUeasy kolam designs with dotshttps://youtu.be/KBqkLiOpi0EVery Very Simple Rangoli Designs https://youtu.be/BKI9ggMuzzMlatest rangoli design with dotshttps://youtu.be/iC_OMeY0WYwEasy Rangoli Design with Dotshttps://youtu.be/WrKgfINmE-kEasy Kolam Designs | Simple Rangoli Designshttps://youtu.be/dvB8FCUlMqoEasy Kolam Design with Dotshttps://youtu.be/-dxc3zsh6_MEasy rangoli with dotshttps://youtu.be/_Rjk2YtGi4QEasy Rangoli Design with Dotshttps://youtu.be/UaKtGGmSp3Qvery very easy rangoli design with dotshttps://youtu.be/EmbGSoAA-0glatest rangoli design with dotshttps://youtu.be/417d7VnoOEcEasy Rangoli Designs with Dotshttps://youtu.be/j63OrdRCXsISimple Rangoli Designs with Dotshttps://youtu.be/HJ2bvrvtRJUVery Very Easy Rangoli Design with Dotshttps://youtu.be/2uyAJ4qzbNYvery very easy kolam designshttps://youtu.be/ImAt7YkFT9AEasy Rangoli Designs with Dotshttps://youtu.be/EIZNTRhAK4EEasy Rangoli Design with Dotshttps://youtu.be/N6wGXSZrwe0Easy Rangoli Design with Dotshttps://youtu.be/BCa1OvziRHsSimple Rangoli Design with Dotshttps://youtu.be/VzhoIsGdv30Easy Rangoli Design with Dotshttps://youtu.be/fUjUAy79V44Easy Kolam Designs with Dotshttps://youtu.be/KjvWFJxOfr8Easy Rangoli with https://youtu.be/K8yUQW3XPlAEasy Rangoli Design with https://youtu.be/ruMJvNui0_oEasy Kolam Design with https://youtu.be/dzpr5rXcL0MSimple Rangoli Design with https://youtu.be/dOEMJc-qU6o#rangoli #rangolidesigns #kolamdesigns #muggulu #rangoliwithdots #rangolidesignswithdots #easyrangolidesigns #rangoliart #rangoliartdesigns #kolam #mugguludesigns #easyrangoli"
"ZGXTDht1sPw","My Friends HyperCar Collection !!!","2018-12-31T17:00:05.000Z","UC_hoQDD6zKcIqpIYLsFbBeA","Mo Vlogs","22","19.01.01","mo vlogs,dubai,cars,hypercars,supercars,pagani zonda,mclaren senna","305928","18202","1258","2413","https://i.ytimg.com/vi/ZGXTDht1sPw/default.jpg","False","False","If you like cars like this video  :)Thank you to @amcc.aeMy Instagram : mo_vlogs_https://www.instagram.com/mo_vlogs_/?hl=enMy Sisters Instagram : lanarose786 https://www.instagram.com/lanarose786/?hl=en My Snapchat: mohamedooMy Sisters Snapchat: lana.rose786Twitter: https://twitter.com/mo_vlogs_My sister's youtube channel: https://www.youtube.com/channel/UC6sa7vq4zBuS5DxTUCWCchQLana's Facebook : https://www.facebook.com/Lana-Rose-1680371262242746/My Facebook Page : https://www.facebook.com/Mo-Vlogs-1731417100437873/My Email: movlogsbusiness@gmail.comMusic:--Sneaky Snitch Kevin MacLeod (incompetech.com) Licensed under Creative Commons: By Attribution 3.0 http://creativecommons.org/licenses/b... Music promoted by Audio Library https://youtu.be/7-rXQALDv-4"
"UcC1ovgJS4s","விஸ்வாசம்... பேட்ட! - வம்பிழுத்தது யார்? | #488 | Valai Pechu","2018-12-31T15:07:21.000Z","UCRTmSft-1I9f0yzTnz32oMg","Valai Pechu","24","19.01.01","Viswasam Trailer,Viswasam Trailer Review,Viswasam,Ajith,Thala Ajith,Thala,Ajithkumar,Petta,Petta Trailer,Rajini,Rajinikanth,Simbu,STR,Vijay Antony,Suresh Kamatchi,Maanaadu,Vantha Rajavathaan Varuven,Mani Ratnam,Vijay Sethupathi,Jayam Ravi,Vikram,Amitabh Bachchan,Aishwarya Rai,K S Ravikumar,Suresh Krishna,Valai Pechu,Valai Pechu Videos","114165","2908","507","912","https://i.ytimg.com/vi/UcC1ovgJS4s/default.jpg","False","False","விஸ்வாசம்... பேட்ட! - வம்பிழுத்தது யார்? | #488 | Valai PechuFollow Our Social Media Networks :https://twitter.com/valaipechuhttps://www.facebook.com/valaipechuofficialhttps://www.instagram.com/valaipechu#ViswasamTrailer #Petta #ValaiPechu"
