video_id,title,publishedAt,channelId,channelTitle,categoryId,trending_date,tags,view_count,likes,dislikes,comment_count,thumbnail_link,comments_disabled,ratings_disabled,description
"hyJwdGVnb9k","Why I Stopped Shaving My Legs • Ladylike","2019-01-06T16:00:03.000Z","UCcOeS5aEIadAhKtJ9_VKAIw","Ladylike","22","19.17.01","buzzfeed,buzzfeed ladylike,ladylike chantel,i stopped shaving,i stopped shaving my legs,shaving,ladylike,buzzfeed chantel,chantel houston","1629695","47363","8115","10529","https://i.ytimg.com/vi/hyJwdGVnb9k/default.jpg","False","False","I'M NOT A WOMAN, MOM!Subscribe to Ladylike!https://bzfd.it/2Pg6etdAbout LadyLike:Subscribe for your weekly dose of Freddie, Chantel, Devin, Kristin and Jen and all the antics that they get up to. Expect new videos three times a week. We are so excited to have you here!Connect with LadyLike:Like us on Facebook: https://www.facebook.com/buzzfeedladylike/Follow us on Instagram: https://www.instagram.com/buzzfeedladylike/Buy our merch: https://goo.gl/2ny7stFor business inquiries, email ladylikebusiness@buzzfeed.comCredits: https://www.buzzfeed.com/bfmp/videos/73178MUSICLicensed via Audio NetworkSFX Provided By AudioBlocks(https://www.audioblocks.com)STILLS/BuzzMojiLoofah and volcanic stoneSteve Gorton/Getty ImagesMaking sure my legs are smooth to the touchDelmaine Donson/Getty ImagesRat Poisonwabeno/Getty ImagesWoman shaving hairy legs with plastic razorphanasitti/Getty ImagesPhotodynamic Therapy (PDT) treating skin cancer on legRapidEye/Getty ImagesClose up of mature woman using razorWestend61/Getty ImagesCharles Robert DarwinImagno/Getty ImagesMan dispensing shaving cream into handTetra Images/Getty ImagesSkull and crossbones sign on yellow triangle.Dorling Kindersley/Getty ImagesVIDEOWoman shaving hairy legs with plastic razorphanasitti/Getty Images1950 black and white close up man's hands holding ticking stopwatchPrelinger/Getty ImagesB/W 1800s/1900s montage of close up of frightened men + womenArchive Films/Getty Imagesabstract real fire flames burn movement on chroma key green screen, with alpha channel background loopdonfiore/Getty ImagesPAN Victorians dressed up in gowns with hats and parasols / United StatesWPA Film Library/Getty Imageshttps://www.youtube.com/c/Ladylike"
"oJNhCO8IrMs","DRIVING WITH ABBY LEE!!!","2019-01-05T20:36:31.000Z","UCeV2O_6QmFaaKBZHY3bJgsA","Its JoJo Siwa","24","19.17.01","JoJo,vlogs,dance,moms,nick,halo,boomerang,youtube,siwa,siwanators,bow,fun,funny,creative,vlogging,vlogger","5209831","135976","23232","26707","https://i.ytimg.com/vi/oJNhCO8IrMs/default.jpg","False","False","Lol! Drivers ED with Abby was fun! COME SEE ME ON TOUR! - WWW.JOJODREAMTOUR.COM 🐸✰SUBSCRIBE✰ ► https://www.youtube.com/channel/UCeV2O_6QmFaaKBZHY3bJgsA?view_as=subscriberSUBSCRIBE TO ABBY! - https://www.youtube.com/user/therealabbyleemiller/videosABBY INSTAGRAM @THEREALABBYLEE✰GO WATCH MY NEW MUSIC VIDEO!! ► https://www.youtube.com/watch?v=hbb8Kpuu-sc✰SUBSCRIBE AND TURN ON MY POST NOTIFICATIONS TO BE IN THE NEXT VIDEOS SHOUTOUTS✰✰ MORE VIDEOS ON MY VLOG CHANNEL!✰ ► https://www.youtube.com/user/1jessalynn✰ FOLLOW ME ON SOCIAL MEDIA!✰✔︎INSTAGRAM (@ItsJoJoSiwa) ► https://www.instagram.com/ItsJoJoSiwa✔︎TWITTER (@ItsJoJoSiwa) ► http://twitter.com/ItsJoJoSiwa✔︎FACEBOOK ► https://www.facebook.com/itsjojosiwa/✔︎SNAPCHAT ► SiwanatorzSnaps✔︎MUSICAL.LY ► @ItsJoJo Siwa✔︎VLOG CHANNEL ► https://www.youtube.com/user/1jessalynn✰ MY FRIENDS WHO ARE IN MY VIDEOS!!✰Jayden Siwa - https://www.youtube.com/channel/UC6MfDQjtoJj1qTJZuoINo1AColleen Ballinger - https://www.youtube.com/user/PsychoSopranoRachel Ballinger - https://www.youtube.com/user/NOVAQUAMini Jake Paul - https://www.youtube.com/channel/UCfFsZu7Ed20xKDOmzdpF3EQTaytum and Oakley - https://www.youtube.com/channel/UCJTyunmsBLj20wyguh6uMig✰SEE YOU SOON!!!✰"
"y6fThXQPT6I","Chris Brown - Undecided (Official Video)","2019-01-04T17:00:08.000Z","UCm1dsgJNnhaLkY3uAdqN4mA","ChrisBrownVEVO","10","19.17.01","RandB,RCA Records,Chris Brown Vevo,Chris Brown music,Undecided video chris brown,undecided official,chrisbrownvevo,indigo,indigoseason,indigo season,Chris Brown,Chris Brown Entertainment/RCA Records,R&B,Undecided","18669841","570791","27708","63776","https://i.ytimg.com/vi/y6fThXQPT6I/default.jpg","False","False","“Undecided” out now! http://smarturl.it/cbUndecidedApple Music: http://smarturl.it/cbUndecided/applemusiciTunes: http://smarturl.it/cbUndecided/itunes Spotify: http://smarturl.it/cbUndecided/spotifyAmazon Music: http://smarturl.it/cbUndecided/azGoogle Play: http://smarturl.it/cbUndecided/googleplayDeezer: http://smarturl.it/cbUndecided/deezeriHeartRadio: http://smarturl.it/cbUndecided/iheartradioSoundCloud: http://smarturl.it/cbUndecided/soundcloudTIDAL: http://smarturl.it/cbUndecided/tidalPandora: http://smarturl.it/cbUndecided/pandora Follow Chris Brown:http://www.chrisbrownworld.com/https://www.facebook.com/chrisbrownhttps://twitter.com/chrisbrownhttp://instagram.com/chrisbrownofficialhttp://smarturl.it/CBSpotify?IQid=yt#ChrisBrown #Undecided #RandB #indigoseason"
"MlQeSVcfjqs","Last To Leave Centre Circle Wins $10,000 (ft. W2S) - Challenge","2019-01-04T21:52:07.000Z","UCQ-YJstgVdAiCT52TiBWDbg","ChrisMD","24","19.17.01","last,to,leave,circle,mrbeast,w2s,wroetoshaw,sidemen,challenge,$10000,ten thousand","2240485","64872","4339","4124","https://i.ytimg.com/vi/MlQeSVcfjqs/default.jpg","False","False","Thanks to MrBeast for allowing me to put a roof over my family's head: https://www.youtube.com/user/MrBeast6000HARRY: https://www.youtube.com/user/wroetoshawWhoever remains in the centre circle the longest wins TEN THOUSAND DOLLARS. And with each new day coming with a copyright claim, even Harry couldn’t resist the chance to win that kind of money.My book: http://amzn.to/2hvWgIU► Follow my Instagram: http://instagram.com/chrismd10► Follow me on Twitter: https://twitter.com/chrismd10► Add me on Snapchat: christophmdHow I record my gameplay!: https://www.elgato.com/gaming/?utm_source=chrismd&utm_medium=youtube&utm_campaign=GameCaptureHDMusic:0:08 | Phoenix Music – Guardians of the Earth0:32, 6:47 | MoonBeat x OpenWater - Time1:24, 5:06 | Haterade – Warmonger   https://www.instagram.com/hateradeofficial/1:42 | Position Music – Verge Of Total Chaos1:51 | Aero Chord – Resistance1:57, 5:18 | Julius Dreisig – Barakah https://www.youtube.com/watch?v=-YCAfhRcQl4 Buy here: http://smarturl.it/m9lf9p2:18 | Jo Blankenburg – Lycan2:25 | Haterade – Flyin   https://www.instagram.com/hateradeofficial/2:37, 4:58 | Elport – Void https://youtu.be/LS3sCqlPLW02:44 | Stahl – Pushed Down (feat. Caroline) https://www.youtube.com/watch?v=EcyW_V3yCY03:04, 10:12 | Marc Madness – Mean https://www.youtube.com/watch?v=NGgNlXdqG90 3:35 | Jim Yosef Anna Yvette – Linked https://www.youtube.com/watch?v=yHLtE1wFeRQ4:30, 5:56, 10:40 | Tom Player – Speed4:47 | Jack Trammell – Maniacal Mind5:33 | Lemon Fight - Stronger (feat. Jessica Reynoso) [Champion Remix]  NCS Release https://www.youtube.com/watch?v=yZfyQ0MAMmo6:14 | TFLM – Wave From Me https://www.youtube.com/watch?v=K0VHbALqQ0g8:16 | Kings and Creatures – Resurrect8:36, 9:40 | Danny Cocke – The Quickening9:00 | Jo Blankenburg – Nephilim9:16 | Kings and Creatures – As The Empire Falls11:04 | Razihel, Aero Chord – Titans https://www.youtube.com/watch?v=dcyYFKeOT0o11:28 | Daniel Clem – The Catalyst11:52 | Kings and Creatures – Into The Dark12:24 | TFLM x Nadro x Anikdote - Take My Hand (feat. Timmy Commerford) https://www.youtube.com/watch?v=Dzu5Hmt3nUM13:38 | Jim Yosef Anna Yvette – Linked https://www.youtube.com/watch?v=yHLtE1wFeRQ"
"ER3TYzGVmug","JOE WELLER VS JEREMY LYNCH - WINNER GETS $25,000 (Boxing Match) BEHIND THE SCENES!","2019-01-05T19:48:25.000Z","UCKvn9VBLAiLiYL4FFJHri6g","F2Freestylers - Ultimate Soccer Skills Channel","17","19.17.01","f2,the f2,f2 freestylers,skills,tekkers,tricks,football,soccer,billy wingrove,jeremy lynch,football freestyle,freestylers,football duo,football freestylers,soccer am,messi,neymar,ronaldo,freekickerz,skilltwins,bin shots,trickshots,football trickshots,soccer tricks,soccer skills,Joe,Weller,Jeremy,Lynch,Behind,The,Scenes,Boxing,Match,Highlights,Undercard,Logan,Paul,VS,KSI,Mr,Beast,MrBeast,Last,To,Leave,Circle,Challenge,Wins","573904","15488","763","1205","https://i.ytimg.com/vi/ER3TYzGVmug/default.jpg","False","False","This is the Behind The Scenes from Joe Weller's MrBeast inspired video!SUBSCRIBE TO JOE: https://bit.ly/1Brod4k► Don't forget to SUBSCRIBE: http://bit.ly/SubscribeF2► CHECK OUT OUR CLOTHING RANGE! http://bit.ly/RascalClothing► SUBSCRIBE TO F2FC! http://bit.ly/SubF2FC► GET THE FIRST EVER F2 BOOK! http://bit.ly/F2Book1► GET OUR #1 BEST SELLING BOOK! http://bit.ly/F2Book2► GET OUR FIRST EVER GRAPHIC NOVEL! http://bit.ly/F2GN1► GET F2 WORLD CLASS! http://bit.ly/F2Book3DOWNLOAD OUR BOOK APP FOR FREE ► The F2 App on Apple/iOS - http://bit.ly/F2AppiOS► The F2 App on Android - http://bit.ly/F2AndroidTo keep up to date with us at any time in any place then follow us on;Twitter - http://bit.ly/F2TwitterInstagram - http://bit.ly/F2InstagramFacebook - http://bit.ly/F2FacebookSnapchat - http://bit.ly/F2SnapchatStay tuned by subscribing to our channel to see all of the amazing videos coming up in the near future! Love, peace & tekkers! Billy & Jezza"
"VEPOOMwpu4g","Dedicate - Day 5 - Flow  |  Yoga With Adriene","2019-01-06T06:00:01.000Z","UCFKE7WVJfvaHW5q283SxchA","Yoga With Adriene","26","19.17.01","yoga challenge,30 day yoga,30 day yoga challenge,fitness,yoga with adriene 30 days of yoga,30 days of yoga,yoga revolution,yoga for weight loss,new year new you,yoga for beginners,beginners yoga,yoga,yoga at home,free yoga,yoga with adrienne,adriene mishler,online yoga,free yoga videos,vinyasa yoga,yoga flow,yoga flow for strength,sun salutation,yogi,yoga life,yoga with adriene,wellness,yoga workout,health,meditation,yoga for mental health","353766","8563","81","1951","https://i.ytimg.com/vi/VEPOOMwpu4g/default.jpg","False","False","Welcome to your Day 5 Dedicate practice! This 28 min practice focuses on the marriage of movement and breath to help guide you to a balanced flow state. The journey continues. Enjoy the pace of these early days, gather everything you need to move with intention and go with the flow! Trust the practice, trust the process and remember to enjoy! I will see you tomorrow! Let us know how you are feeling in the comment section down below! Namaste! #YWAdedicate #30daysofyoga- - - - - - - - - - *** DEDICATE - Downloadable Collection *** Get the full series - for keeps! Great for those who wish to practice without streaming via internet connection!Just pay what feels good...   http://bit.ly/dedicate30*** Join the DEDICATE community *** https://www.fwfgkula.com/groups/827574*** Get the free DEDICATE calendar*** http://bit.ly/dedicate-calendar- - - - - - - - - - Become a FWFG YOGA member! https://yogawithadriene.vhx.tv/Free 7-Day trial featuring over 25 hours of exclusive videos + all my digital courses. - - - - - - - - - - Get your FREE Yoga Calendar: http://yogawithadriene.com/calendar/- - - - - - - - - - More at www.yogawithadriene.comInstagram: @adrienelouiseTwitter: @yogawithadrieneFacebook: Yoga With AdrieneShop: www.fwfg.com"
"JbwtHpq7WqQ","India take stranglehold on SCG contest | Fourth Domain Test","2019-01-05T06:53:06.000Z","UCkBY0aHJP9BwjZLDYxAQrKg","cricket.com.au","17","19.17.01","sp:ty=play,sp:dt=2019-01-02T23:30:00Z,sp:st=cricket,sp:li=icc,sp:ti:home=IND,sp:ti:away=AUS,Australia,India,fourth Test,day three,highlights,SCG,2019","11272417","66609","5462","3481","https://i.ytimg.com/vi/JbwtHpq7WqQ/default.jpg","False","False","In pristine batting conditions Australia started brightly despite the early loss of Usman Khawaja. But it was a different story after lunch as the home side lost 3-24 in nine overs, with Kuldeep and Jadeja causing havoc before rain ended play early"
"TF0w153xAr8","GIANT DART Vs. GOLD PLAY BUTTON from 45m!","2019-01-04T22:00:03.000Z","UC5f5IV0Bf79YLp_p9nfInRA","How Ridiculous","17","19.17.01","how ridiculous,magnus effect,oobleck,rc cars,how ridiculous rc car,bowling ball vs trampoline,bowling ball,giant dart,trampoline,bowling ball vs oobleck,anvil vs car,how ridiculous giant dart,basketball,how ridiculous darts,basketball connect 4,bowling,anvil vs fridge,44 club,anvil,anvil vs,gold play,gold play button,giant dart gold play button,gold play button trampoline,how ridiculous gold play button","2109999","110139","3594","23537","https://i.ytimg.com/vi/TF0w153xAr8/default.jpg","False","False","To celebrate a ripper 2018 our Gold Play Button gets the full How Ridiculous experience.SUBSCRIBE ➤ http://bit.ly/SubHowRidiculousBUY NEW MERCH ➤ http://tidd.ly/8b33c00bBECOME A MEMBER ➤ http://bit.ly/HRmemberships(iOS users must use Safari)SOCIALSInstagram ➤ (@HowRidiculous): http://bit.ly/FollowHRonInstaFacebook ➤ http://bit.ly/HRFaceyTwitter     ➤ (@howridiculous): http://bit.ly/HRTweetyWhat's the 44 Club you may ask? Well it all started in the outro of this video https://www.youtube.com/watch?v=AyLPMhp7qbs where we wondered if anyone was still watching the video at that point, and to comment 44 (Scott's fave number) if they were. Brett then said 44 Club get on board and the rest is history. The 44Club is the official How Ridiculous fan club made up of people who love our videos and watch them right to the very end. We've even got 44 Club merch now! So yeh, that's the story. Pretty random but good fun at the same time.We are passionate about seeing children released from poverty and we would love you to consider sponsoring a child with Compassion. We visited our sponsor children in the Philippines and were blown away by the difference that child sponsorship can make. To find out more about sponsoring a child right now, check out: http://cmpsn.co/howridiculousA big thanks to the awesome crew at the Gravity Discovery Centre in Gingin for letting us use their 45m leaning tower for our own experiments. If you wanna head out there and check it out, it's not far from Perth. Western Australia: https://gravitycentre.com.au/leaning-tower/Music by Chillhop: https://chillhop.lnk.to/listenCSBonus Points - Long Exposure (https://soundcloud.com/bonuspoints)Bonus Points - Pizza and Video Games (https://soundcloud.com/bonuspoints)Brock Berrigan - Why The Funk Not (https://soundcloud.com/brockberrigan)For fan mail or other items please send to: How Ridiculous PO Box 7045 Karawara WA 6152 AustraliaAll 44Club/fan email: 44club@howridiculous.orgPINYA Submissions: pinya@howridiculous.orgMerchandise: merch@howridiculous.orgLicensing/Media Inquiries: licenses@howridiculous.orgBusiness Inquiries ONLY: management@howridiculous.orgFor online use, you may embed this YouTube video - for usage in other players please contact us for permission.© Copyright 2018 How Ridiculous"
"wr-nyTE0A3g","Lottery winners: 'We want to do a lot of things for a lot of people'","2019-01-04T12:50:59.000Z","UCoMdktPbSTixAyNGwb-UYkQ","Sky News","25","19.17.01","lottery winners,euromillions,fortune,uk,money,charity,northern ireland,sky news,Co Armagh,Patrick Connolly,Frances Connolly,lottery,115 million,prize,exclusive","742625","6887","721","4489","https://i.ytimg.com/vi/wr-nyTE0A3g/default.jpg","False","False","In an exclusive interview with Sky News, Frances and Patrick Connolly share their plans on how they wish to spend their 'incredible amount of money'.The couple from Northern Ireland won just over £114 million in the New Year's Day EuroMillions jackpot and are the fourth biggest UK lottery winners in history.The couple would like to share some of their fortune with '50' special people, as well as personally treating themselves to a holiday and a new car.SUBSCRIBE to our YouTube channel for more videos: http://www.youtube.com/skynews Follow us on Twitter: https://twitter.com/skynews and https://twitter.com/skynewsbreak Like us on Facebook: https://www.facebook.com/skynews Follow us on Instagram: https://www.instagram.com/skynews For more content go to http://news.sky.com and download our apps:  Apple https://itunes.apple.com/gb/app/sky-news/id316391924?mt=8 Android https://play.google.com/store/apps/details?id=com.bskyb.skynews.android&hl=en_GB"
"nE4ad_t35yw","Ariana Grande - thank u, next (bloopers + deleted scene)","2019-01-04T05:00:01.000Z","UC9CoOnJkIBMdeijd9qYoT_g","Ariana Grande`","10","19.17.01","ariana grande,thank u next,bloopers,deleted scene","3470685","239245","3544","11720","https://i.ytimg.com/vi/nE4ad_t35yw/default.jpg","False","False","https://arianagrande.lnk.to/thankunextYD"
"t3dxPnIjarE","FIRST JOB!  *Good Employee vs Bad Employee*","2019-01-03T21:40:00.000Z","UCJVkkxqSzMZDcLFhULXAIIQ","Dan and Riya","23","19.17.01","danandriya,dan and riya,riya and dan,dan riya,couples skits,types of,dan and riya vlogs,tootsie,50 types of,dan and riya types of,dan & riya,dan and riya react,dan and riya parents,funny,comedy channel,best friends,first jobs,bad vs good employee,bad vs good,first job and fired,first day of work,bad vs good kid,bad employee,good employee,first job high school,types of workers,types of people at work,funny employee","2323668","23990","1559","2996","https://i.ytimg.com/vi/t3dxPnIjarE/default.jpg","False","False","First job in high school. You can be a good employee or a bad employee. Good employee's always go above and beyond while bad employee's try to sneak by without doing anything and cause a lot of trouble. Subscribe: http://bit.ly/SubscribeToDanAndRiya |Previous video: https://www.youtube.com/watch?v=xb5XQLjBiaY&t=194s♦ WATCH MORE:Beverly Valley High:  goo.gl/JqpRCSThe Skits!:  goo.gl/TUP8AYTypes of: goo.gl/mE21YMMost Popular: goo.gl/ZAMtLB♦ SOCIAL MEDIA DAN’S TIKTOK: @DanKipnisRIYA’S TIKTOK: @ItsRiyaMalikDAN'S INSTAGRAM: http://instagram.com/dankipnisRIYA'S INSTAGRAM: http://instagram.com/itsriyamalikBEVERLY VALLEY HIGH INSTA: https://www.instagram.com/beverlyvalleyhigh/DAN'S TWITTER: https://twitter.com/dankipnisRIYA'S TWITTER: https://twitter.com/itsriyamalikAbout Dan & Riya:Welcome to the Dan and Riya channel! Our names are Dan Kipnis and Riya Malik. We are best friends for over 15 years who decided to start making YouTube videos. We think we are the funniest people out there, so our job is to make you laugh for hours as you binge watch all our videos every single day on our YouTube channel!. Our channel is made up of comedic skits. Most of them take place in the world of Beverly Valley High where you have Dan, Riya, Tootsie, Cinnamon, Raja, Chad, Miss P, Riya's Dad and Riya's Mom. Our skits are for every age and are about everything including; relationships, boys, girls,, love, how to survive school, families, and friendship!Step into our world and become part of the DanAndRiyaFam!"
"z34A-mILN24","Asli Hip Hop - Trailer Announcement - Gully Boy | Ranveer Singh | Alia Bhatt | 14th February","2019-01-04T05:00:14.000Z","UCn9BuiRZGR_tPM2GGT4jN-w","Excel Movies","1","19.17.01","Bollywood,Bollywood Film,Ranveer Singh,Alia Bhatt,Excel Entertainment,Rap,Gully,Gully Boy,14th Feb,New Year,2019,Simmba,DeepVeer,Valentines Day","19890339","437457","19293","25244","https://i.ytimg.com/vi/z34A-mILN24/default.jpg","False","False","Asli Hip Hop se milaye Hindustan ko. Gully Boy Trailer AnnouncementCredits: Song Name: Asli Hip Hop Composer: SpitfireLyrics: SpitfireSinger: Ranveer SinghFeatured Singers: D’EVIL,Nexus,Rahul Raahi,Emiway Bantai,D-cypher,BeatRAW,And Big Sid.Beatboxers: D-Cypher, BeatRAW.Music Supervisor: Ankur Tewari Recorded at: Purple Haze Studios, MumbaiFollow Us On :- Click to Subscribe :: http://bit.ly/ExcelMoviesYTFacebook :: https://www.facebook.com/excelentertainment/Instagram :: https://www.instagram.com/excelmovies/Twitter :: https://twitter.com/excelmovies"
"1RjBH9psCPI","The trouble with WOKE comedy","2019-01-03T14:18:41.000Z","UCO79NsDE5FpMowUH1YcBFcA","Jonathan Pie","25","19.17.01","jonathan Pie,satire,comedy,louis CK,humour,free speech,news","568662","37776","1023","4999","https://i.ytimg.com/vi/1RjBH9psCPI/default.jpg","False","False","This is getting beyond a joke. For tickets to see Jonathan Pie's new (WOKE free) live show go to jonathanpie.com"
"IdZb402Nsac","'EMBARRASSING' -CHRIS EUBANK JR RAW ON DeGALE, RETIREMENT COMMENT, GROVES LOSS, SAUNDERS, TYSON FURY","2019-01-03T15:06:27.000Z","UCdl_gZZR6BtKi45eHFGAduw","iFL TV","17","19.17.01","'EMBARRASSING' - CHRIS EUBANK JR RAW ON DeGALE,RETIREMENT COMMENT,GROVES LOSS,SAUNDERS,TYSON FURY,chris eubank jr","223981","1269","283","2007","https://i.ytimg.com/vi/IdZb402Nsac/default.jpg","False","False","INTERVIEW BY KUGAN CASSIUS 'EMBARRASSING' - CHRIS EUBANK JR RAW ON DeGALE, RETIREMENT COMMENT, GROVES LOSS, SAUNDERS, TYSON FURY▶ FOLLOW IFL TV FOR DAILY EXCLUSIVE CONTENT:▶ FACEBOOK - http://facebook.com/ifltv▶ TWITTER - http://twitter.com/ifltv▶ INSTAGRAM - http://instagram.com/ifltvboxingDon’t miss the action – tune into BoxNation, Sky Sports and BT Sports and watch the fights live. Not signed up? You’ll find the best offers for new and existing UK customers here:Sky CustomersNEW - http://tidd.ly/9dff70aaEXISTING - http://tidd.ly/a155d633BT CustomersNEW - http://tidd.ly/90e75d54"
"zaH-xVq9A8Q","EO - Cold World [Freestyle]","2019-01-02T18:00:06.000Z","UCxPAsoU04XeuZhi1LfPQCDg","eocrossover","10","19.17.01","EO - Cold World freestyle,EO,Cold World,freestyle","976548","41492","619","3099","https://i.ytimg.com/vi/zaH-xVq9A8Q/default.jpg","False","False","Cold World [Freestyle] is available to stream on Spotify, Apple Music and iTunes on 11th January 2019!Produced by: T Piper x BGFollow EO:https://www.instagram.com/eocrossoverhttps://twitter.com/eocrossoverSnapchat - @eocrossover"
"Zpnykv3zbwg","Foreign Boys | Rudy Mancuso, Anwar Jibawi & Wuz Good","2019-01-03T17:00:03.000Z","UC5jkXpfnBhlDjqh0ir5FsIQ","Rudy Mancuso","24","19.17.01","foreign boys,rudy,mancuso,anwar,jibawi,foreign,boys,terrible elves,seor grinch vacation,musical smoothie bar,Foreign Boys | Rudy Mancuso & Anwar Jibawi,lelepons,hannahstocking,rudymancuso,shots,shotsstudios,alesso,anitta,brazil,wuz good,wuz,good","2923827","136991","6108","13341","https://i.ytimg.com/vi/Zpnykv3zbwg/default.jpg","False","False","WATCH MORE ▶ https://youtu.be/137zycWOEnYSUBSCRIBE HERE ► https://www.youtube.com/channel/UC5jkXpfnBhlDjqh0ir5FsIQ?sub_confirmation=1THANKS FOR WATCHING! LIKE & SUBSCRIBE FOR MORE VIDEOS!-----------------------------------------------------------FIND ME ON: Instagram | http://instagram.com/rudymancusoTwitter | http://twitter.com/rudymancusoFacebook | http://facebook.com/rudymancusoCAST: Rudy Mancuso | http://youtube.com/c/rudymancusoAnwar Jibawi | http://youtube.com/c/anwarWes Wuz Good Armstrong | https://instagram.com/wuzgoodMikaela Hoover | https://instagram.com/mikaelaJosh Gudwin | https://instagram.com/joshgudwinMusic by Rudy MancusoProduced by Jamie RiseRockstar by Post Malone, performed by Foreign Boys.FOLLOW THE SHOTS FAMILY ▶ http://instagram.com/theshotsfamilyShots Studios Channels:Alesso | http://youtube.com/c/alessoAnitta | http://youtube.com/c/anittaAnwar Jibawi | http://youtube.com/c/anwarAwkward Puppets | http://youtube.com/c/awkwardpuppetsDelaney Glazer | http://youtube.com/c/deeglazerHannah Stocking | http://youtube.com/c/hannahstockingLele Pons | http://youtube.com/c/leleponsRudy Mancuso | http://youtube.com/c/rudymancusoShots Studios | http://youtube.com/c/shotsThe Shots Family [Vertical] | http://youtube.com/c/theshotsfamily#Rudy#RudyMancuso"
"2XXPKxZEKUU","World's Healthiest Smoothie (challenge)","2019-01-03T01:04:00.000Z","UCd1fLoVFooPeWqCEYVUJZqg","Matt Stonie","24","19.17.01","Matt Stonie,Megatoad,Competitive Eating,Food Challenge,Speed Eating,Eating Challenge,Healthy,Healthy Challenge,Healthy Food Challenge,New Years,New Years Resolutions,New Years Goal,Superfood,Fruit,Vegetables,Kale,Pineapple,Smoothie,Lifesum,Healthy Living","2530336","109334","2247","10615","https://i.ytimg.com/vi/2XXPKxZEKUU/default.jpg","False","False","Start the year off healthy!! Download the Lifesum app for FREE today! -- https://bit.ly/2C4evgzVideo Sponsored by: LifesumHappy New Years!! Pretty much every single Healthy, Nutritious, Superfood status Food I could find into one blender. Feel free to try this at home, results might vary.Good Video? Like/Fav & Share!!ENJOY!!!Follow me on Social!FACEBOOK - https://www.facebook.com/megatoadTWITTER - https://www.twitter.com/mattstonieINSTAGRAM - https://www.instagram.com/matt_stonieTWITCH - https://www.twitch.tv/mattstonieMERCH - http://mattstonie.bigcartel.com/Mailing Address:P.O. Box 22210San Jose, CA 95151Credits:Royalty Free Music by http://audiomicro.com/royalty-free-musicAudio by Video CoPilot's Proscores"
"cVdvbjghScY","Official Hollyoaks Trailer: New Year 2019","2019-01-02T20:30:00.000Z","UCTBcWhmMiQlh2a07YTI15uw","Hollyoaks","24","19.17.01","Hollyoaks,TV,Soap Opera,Exclusive,Channel 4,E4,Domino's,Drama,Clip,Soap,TV Programme,UK","117626","1753","80","350","https://i.ytimg.com/vi/cVdvbjghScY/default.jpg","False","False","New year, new beginnings... but is 2019 already over for someone? See what's coming this new year on Hollyoaks...Subscribe so you never miss a new Hollyoaks trailer - http://www.youtube.com/user/Hollyoaks...Come and say hi!Twitter: @HollyoaksSnapchat: Add 'hellohollyoaks'Facebook: http://www.facebook.com/HollyoaksInstagram: search 'HollyoaksOfficial'Hollyoaks website: http://www.channel4.com/hollyoaks"
