video_id,title,publishedAt,channelId,channelTitle,categoryId,trending_date,tags,view_count,likes,dislikes,comment_count,thumbnail_link,comments_disabled,ratings_disabled,description
"NDeTFbI_fkM","The 2019 BMW 8 Series Is BMW's New Flagship Model","2018-12-26T17:56:03.000Z","UCsqjHFMB_JYTaEnf_vmTNqg","Doug DeMuro","2","19.17.01","bmw 8 series,bmw 8 series review,2019 bmw 8 series,2019 bmw 8 series review,bmw m850i review,bmw m850i,2019 8 series,2019 8 series review,m850i,m850i review,8 series,8 series review,new 8 series,new bmw 8 series,doug demuro,demuro","2188694","35436","1911","9804","https://i.ytimg.com/vi/NDeTFbI_fkM/default.jpg","False","False","GO READ MY COLUMN! http://autotradr.co/OversteerTHANKS TO CREVIER BMW! https://www.crevierbmw.com/https://www.instagram.com/crevierbmw/The 2019 BMW 8 Series is BMW's new flagship model. Today I'm reviewing a 2019 BMW M850i to see why the new 8 Series is BMW's new flagship car -- and I'm showing you all the quirks and features of the new M850i.FOLLOW ME!Facebook - http://www.facebook.com/ddemuroTwitter - http://www.twitter.com/dougdemuroInstagram - http://www.instagram.com/dougdemuroDOUGSCORE CHART: https://docs.google.com/spreadsheets/d/1KTArYwDWrn52fnc7B12KvjRb6nmcEaU6gXYehWfsZSo"
"1IWAtvzE9rs","Doctor FAILS Idiot Test | Wednesday Checkup","2018-12-27T01:00:01.000Z","UC0QHWhjbe5fGJEPz3sVb6nw","Doctor Mike","27","19.17.01","wednesday checkup,doctor mike,dr mike,dr. mike,doctor reacts,doctor fails,doctor humor,idiot test,moron test,trick questions,brain teasers","1299355","48792","981","5033","https://i.ytimg.com/vi/1IWAtvzE9rs/default.jpg","False","False","Doctors aren't mental maestros on every topic!  In this video, watch me dabble with random idiot tests that I find around the interwebs :)  - Doctor Mike VarshavskiPlease SUBSCRIBE for new videos every Sunday 11am EST ▶  https://goo.gl/87kYq6 Let’s connect:IG https://goo.gl/41ZS7w - Doctor MikeTwitter https://goo.gl/kzmGs5 - Real Doctor MikeFacebook https://goo.gl/QH4nJS - Real Doctor MikeContact Email: DoctorMikeMedia@Gmail.comP.O. Box (send me stuffs):340 W 42nd St # 2695NY, NY 10108"
"8-Ml2F8wO00","36 MUST-KNOW HACKS WITH EVERYDAY ITEMS","2018-12-26T13:30:00.000Z","UC295-Dw_tDNtZXFeAPAW6Aw","5-Minute Crafts","26","19.17.01","5-Minute Crafts,DIY,Do it yourself,crafts,trucos,5 minutes craft,life hacks,5 minute craft,trucos de belliza,proyectos faciles,useful things,lifehacks,tricks,tips,DIY projects,DIY activities,Handcraft,Tutorial,howto,IKEA,products,ORGANIZE,bobby pins,accessory,sandpaper,hacks,pet owners,wooden,chopping board,sharpen,a knife,lash curler,unexpected,uses,Magazine files,shelf,cleaning supplies,silica gel","10305395","77563","12723","5059","https://i.ytimg.com/vi/8-Ml2F8wO00/default.jpg","False","False","SIMPLE ORGANIZATIONAL IDEAS Today we have a surprise for you! We have an incredible selection of unexpected uses for IKEA products! These awesome ideas will help you to reorganize your home and reuse IKEA products you wanted to throw away. ORDNING (utensil holder) also could be used to store blow dryer and flat iron in the bathroom. FLORT (remote control pocket) you can turn it into a car organizer for kids. You can store art supplies, tissues, toys, books in it!SPONTAN (newspaper rack) is a space efficient way to store shoes.FRAKTA (shopping bag) could be turned into raincoat! Grab your scissors and watch our tutorial!Here are some hacks that you need to learn by heart:-    Use a flat iron to cook popcorn-    Bobby pins could be used to line your eyes-    Create a cute manicure design using bobby pins-    You can use bobby pins to create a super stylish necklace just for 5 minutes, and it will be a fabulous accessory for a party!-    Use tic tac box to organize tiny things like bobby pins-    Cat owners know that nails should be trimmed to save the furniture, smooth the edges out with some fine-grained sandpaper!-    Use sandpaper to remove rough skin from your feet-    The wooden chopping board is damaged over time and there are a lot of cuts, use sandpaper to clean it once or twice a year to prevent the appearance of microbes.-    Use sandpaper and drill to sharpen a knife-    Make several cuts through some fine grain sandpaper to sharpen scissors-    Use lash curler to apply mascara and to line eyes. Moreover, you can contour your nose using it. Watch our video for a full tutorial.Magazine files are very multifunctional items that could be used in unexpected ways! Here are some brilliant ideas: you can organize your kitchen cleaning supplies and toilet paper or use of a decorative magazine holder as a shelf. TIMESTAMPS:01:02 Quick way to cut strawberries02:22 Clever way to sharpen a knife04:12 Unexpected uses of bobby pins04:52 Polka dot manicure idea06:27 Sandpaper hacks11:00 IKEA hacks----------------------------------------------------------------------------------------Our Social Media:Facebook: https://www.facebook.com/5min.crafts/Instagram: https://www.instagram.com/5.min.crafts/Twitter: https://twitter.com/5m_craftsSubscribe to 5-Minute Crafts GIRLY: https://goo.gl/fWbJqzSubscribe to 5-Minute Crafts KIDS: https://goo.gl/PEuLVtSubscribe to 5-Minute Crafts MEN: http://bit.ly/2S69VUGThe Bright Side of Youtube: https://goo.gl/rQTJZz----------------------------------------------------------------------------------------For more videos and articles visit:http://www.brightside.meMusic by Epidemic Sound: https://www.epidemicsound.com/"
"kJdqZz58NMc","Erika Costell - Dynamite (Official Lyric Video)","2018-12-26T22:00:05.000Z","UCrCkLipGria4UloMpvNil5g","Erika Costell","22","19.17.01","erika costell,team 10,jerika,jake paul vlog,erika costell vlog,jake paul girlfriend,daily vlogger,reality,victoria secret,maybelline,model,tutorial,funny videos,erica costell,karma,karma erika costell,i'm erika costell,girls night,there for you,chitty bang,chitty chitty bang bang,music,erika costell song,dinomite,music video","1118371","40811","11389","14173","https://i.ytimg.com/vi/kJdqZz58NMc/default.jpg","False","False","I wrote and recorded this song months ago…Although the situation is very different now, and this part of my life is over…writing this song was one of most powerful things I’ve ever done because it came straight from my heart & I’m still very proud of it. Thank y’all SO much for all your support through the start of my music in 2018. I LOVE YOU!Stream it on Spotify & Apple Music or buy it on iTunes: https://ffm.to/dynamite Song Produced by: Harvey Mason Jr.Song written by: Erika Costell and Brittany Burton😃 SUBSCRIBE ► http://www.youtube.com/c/ErikaCostell  WATCH MY LAST VLOG ► https://www.youtube.com/watch?v=FsCZUKVnf7ECHECKOUT MY NEW MERCH HERE ►https://fanjoy.co/costellTURN ON MY POST NOTIFICATIONS!*FOLLOW ME ON SOCIAL MEDIA! *MY INSTAGRAM (@ErikaCostell) ► https://www.instagram.com/ErikaCostellMY TWITTER (@ErikaCostell) ► http://twitter.com/ErikaCostellMY FACEBOOK ► https://www.facebook.com/ErikaCostell1MY SNAPCHAT ► ErikaCostell"
"-aBoLCwq4YE","I Surprised My Girlfriend with a Rare Mercedes SLK55 AMG for Christmas","2018-12-26T16:35:45.000Z","UCdEczn3MVkx_4PnMZ10MVFA","Hoovies Garage","2","19.17.01","hoovies,garage,amg,review,test,tyler,hoover,giveaway,holidays,fiance,wife,problems,mercedes-benz","613806","20273","842","5747","https://i.ytimg.com/vi/-aBoLCwq4YE/default.jpg","False","False","Read my column on Autotrader here: https://www.autotrader.com/oversteerBuy Hoovie's Garage T-Shirts here: https://hooviesgarage.com/collections/allFollow me on Twitter! https://twitter.comFollow me on Facebook! https://www.facebook.com/hooviesgarage/"
"0yrGrh-j73s","Aitch - Miss Me With It (prod. Shinra) @OfficialAitch","2018-12-25T14:58:11.000Z","UCi1z2e3LwosX3kvAbWdBB2A","Aitch","10","19.17.01","aitch,officialaitch,40aitch,grime,manchester,music,sbtv,grm,grmdaily,linkuptv,ukmusic,ukgrime,bugzy,malone,manny,on,the,map,rapper,vibsing,straight,rhymez,miss me with it,aitch miss me with it,nq,northern quarterz,whyjay,svmi visuals,aitch daily duppy,aitch trust me,aitch straight rhymes,aitch fire in the booth,zeph,zeph prologue,zeph element,aitch reaction,grm daily aitch,aitch tracksuit love,aitch wait,wait aitch,shinra,trust me aitch","487486","18839","285","736","https://i.ytimg.com/vi/0yrGrh-j73s/default.jpg","False","False","Miss Me With It (prod. Shinra)Stream/Download: http://smarturl.it/vhd6crJoin The NQ Family for Exclusives: https://www.northernquarterz.com/subscribe---------Follow Aitch: Twitter: https://twitter.com/officialaitchInstagram: https://www.instagram.com/officialaitch/Soundcloud: https://soundcloud.com/officialaitchFacebook: https://www.facebook.com/officialaitch/Snapchat: https://www.snapchat.com/add/aitchnq---------Follow NQ: Twitter: https://twitter.com/thisisnqInstagram: https://www.instagram.com/thisisnq/Soundcloud: https://soundcloud.com/thisisnqFacebook: https://www.facebook.com/thisisnq/Snapchat: https://www.snapchat.com/add/thisisnq---------All Enquiries: aitch@northernquarterz.comNQ"
"1ZulOhCCEj8","BEST FOOD 2018 - My YouTube Rewind!","2018-12-26T13:00:01.000Z","UCyEd6QBSgat5kkC6svyjudA","Mark Wiens","19","19.17.01","rewind,youtube rewind,Mark Wiens,best food,best travel food,food vlog,food vlogger,food videos,travel vlogger,travel videos,travel food,street food,Pakistan,Mexico,Mexican food,Pakistani food,beef ribs,bbq,American food,American bbq","1298433","48425","1047","6045","https://i.ytimg.com/vi/1ZulOhCCEj8/default.jpg","False","False","Get more details about all 10 meals: https://goo.gl/K7YicXSUBSCRIBE http://bit.ly/MarkWiensSubscribe for 2 new videos every weekT-shirts and caps: https://goo.gl/6WdK1lWatch all 10 full videos: https://youtu.be/C5U3dMkYbogFirst, I want to say a huge thank you for your amazing support - for watching, sharing, liking, our videos, and for your positivity and encouragement throughout the year.I love to eat vegetables, but 2018 turned into a bit of a meat heavy year, but I probably had some of the best meat dishes I have ever had in my life.In this list of best food 2018, along with the top 10 meals in 2018, I also included 10 of my favorite travel destinations, and the camera / video gear I used throughout the year - you can see that on the blog: https://goo.gl/K7YicXFrom Mexico to Pakistani, it was an amazing year, and thank you again for your incredible support!Happy New Year!MUSIC: https://goo.gl/HwVjdoLogo: https://goo.gl/VhaLp5CAMERA GEAR I used to make this video (these are affiliate links):Main camera: http://amzn.to/2sV0XQOMain lens: http://amzn.to/2szLZNf2nd lens: http://amzn.to/2EjBeEgMicrophone: http://amzn.to/2rBKD3zDrone: http://amzn.to/2CrtAHzFOLLOW:Instagram: https://instagram.com/migrationologyFacebook: https://www.facebook.com/migrationologyThank you for watching!"
"-NONnckFT0I","Smith Throws Up In A Stunt Plane!","2018-12-26T19:07:18.000Z","UC7A_dLnSAjl7uROCdoNyjzg","Hat Films","20","19.17.01","ace combat 7,ace combat,stunt plane,sick,black out,blackout,blacked out,sick in a plane,hatfilms,hat films,hat,films,gaming,fun,funny,chris,trott,ross,hornby,alex,smith,satire,'satire'","107828","7867","50","549","https://i.ytimg.com/vi/-NONnckFT0I/default.jpg","False","False","Thanks to the guys at Ace Combat 7 for inviting us down, this was an unpaid endorsement. We hope you enjoy watching smith throw up in a stunt plane lol!Get 10% off ALL Yogs Merch: http://smarturl.it/HatfilmsMerchBecome a Member! https://hatfil.ms/joinSupport via Patreon! http://patreon.com/hatfilmsSubscribe and hit that bell! http://hatfil.ms/sub HAT FILMS EXTRA: https://www.youtube.com/c/hatfilmsextraHAT FILMS TWITCH: http://twitch.tv/hatfilms♥ FOLLOW US on Twitter, Reddit and Facebook:☼ http://hatfil.ms/twitter☼ http://hatfil.ms/reddit☼ http://hatfil.ms/fb♫ OFFICIAL MUSIC:http://hatfil.ms/bandcamphttp://hatfil.ms/itunes♪ HAT CHAT PODCAST Get it on iTunes free here: http://hatfil.ms/hatchat● Post Us Stuff:Hat Films - 4th Floor13 Queen SquareBristolBS1 4NTThank you so much for watching our videos and supporting us!"
"s3B-qp3U5G0","Melting Every Candle From Bath & Body Works Together","2018-12-24T22:11:26.000Z","UCbAwSkqJ1W_Eg7wr3cp5BUA","Safiya Nygaard","22","19.17.01","melting every candle from bath & body works together,melting candles,candles,wax,melting wax,oddly satisfying,melting holiday candles,holiday,bath & body works,scents,fragrances,perfumes,melting,candle,wick,haul,candle day,safiya bad makeup science,bad makeup science,safiya melting,safiya mixing,safiya,safiya nygaard,safiya and tyler","11898012","487627","9533","63842","https://i.ytimg.com/vi/s3B-qp3U5G0/default.jpg","False","False","Merry Christmas Eve, y'all! Here is a weird video we made where I melt every candle from Bath & Body Works together. I figured - it's worked for a myriad of makeup products like lipsticks and eyeshadows and highlighters - so why not try melting every single candle scent from one store together to see what kind of scent we get? It's not bad makeup science - it's bad holiday science! Or maybe bad wax science. Hmm.A big thanks to Daniel at Stone Candles for smelling our candle! You can check them out here:https://www.stonecandles.com/https://www.instagram.com/stonecandlebar/You can check out Angela's iconic channel here:https://www.youtube.com/user/Az4angelaThis video is NOT sponsored!Safiya's Instagram: https://www.instagram.com/safiyany/Twitter: https://twitter.com/safiyajnFacebook: https://www.facebook.com/safnygaard/Check out our merch here: https://fiendsbysaf.com/If your size is sold out, sign up for email updates!MUSICVia AudioNetworkAssistant Editors: Claire Wiley & Emily Linden"
"hNCmb-4oXJA","Us - Official Trailer [HD]","2018-12-25T14:00:08.000Z","UCq0OueAsdxH6b8nyAspwViw","Universal Pictures","24","19.17.01","[none]","11015271","160936","7540","23194","https://i.ytimg.com/vi/hNCmb-4oXJA/default.jpg","False","False","UsIn Theaters March 22, 2019https://www.UsMovie.comAfter sending shockwaves across contemporary culture and setting a new standard for provocative, socially-conscious horror films with his directorial debut, Get Out, Academy Award®-winning visionary Jordan Peele returns with another original nightmare that he has written, directed and produced.Set in present day along the iconic Northern California coastline, Us, from Monkeypaw Productions, stars Oscar® winner Lupita Nyong’o as Adelaide Wilson, a woman returning to her beachside childhood home with her husband, Gabe (Black Panther’s Winston Duke), and their two children (Shahadi Wright Joseph, Evan Alex) for an idyllic summer getaway. Haunted by an unexplainable and unresolved trauma from her past and compounded by a string of eerie coincidences, Adelaide feels her paranoia elevate to high-alert as she grows increasingly certain that something bad is going to befall her family.After spending a tense beach day with their friends, the Tylers (Emmy winner Elisabeth Moss, Tim Heidecker, Cali Sheldon, Noelle Sheldon), Adelaide and her family return to their vacation home. When darkness falls, the Wilsons discover the silhouette of four figures holding hands as they stand in the driveway. Us pits an endearing American family against a terrifying and uncanny opponent: doppelgängers of themselves. Writer and director Peele produces for his Monkeypaw Productions alongside Sean McKittrick, Jason Blum, and Monkeypaw’s Ian Cooper. Us will be released by Universal Pictures on Friday, March 22, 2019."
"R0BUwd0aCi8","Christmas/New Years Holiday Special - Who Gets Into Ultra Heaven (2018)","2018-12-26T16:00:02.000Z","UCaR-e8ComPih10DqPi3sdWg","Fact Fiend - With Karl Smallwood","23","19.17.01","fact,fiend,facts,karl,smallwood,writer,comedy,information,interesting,stand up,christmas,new,years,party,present,celebration,holiday,special,ultra,heaven,john,young,eddie,clarke,simon,shelton,mahoney,emma,chambers,jim,bowen,stephen,hawking,linda,brown,dale,winton,verne,troyer,margot,kidder,aretha,franklin,burt,reynolds,paul,allen,stan,lee,hillenburg,ingvar,kamprad,avicii,kofi,annan","123270","8786","103","1791","https://i.ytimg.com/vi/R0BUwd0aCi8/default.jpg","False","False","It's been requested a lot on Twitter so, for the first of our three holiday videos, we'll be taking a fond look at some of the notable people we've lost this year.Subscribe for more:https://www.youtube.com/channel/UCaR-e8ComPih10DqPi3sdWg?sub_confirmation=1-----------------------------------------Additional Content:http://www.factfiend.com/https://www.facebook.com/factfiend/Karl's t-shirt and others are available at:https://www.redbubble.com/people/factfiendKarl's Channel:https://www.youtube.com/channel/UCUaBEY5s2anSFnsX5oEvjdgKarl's Twitch:https://www.twitch.tv/karlswood-----------------------------------------Starring Karl Smallwoodhttps://www.facebook.com/karl.smallwood.3https://twitter.com/KarlSmallwoodhttps://www.instagram.com/karlswood/Filmed and Edited by Brad Rawlinsonhttps://www.youtube.com/user/bradrawlinsonvfxhttps://twitter.com/TheOvahDawghttps://www.instagram.com/bradrawlinson27/-----------------------------------------Image Sources and Further Reading:John YoungNASA [Public domain], via Wikimedia CommonsEddie Clarkehttps://www.facebook.com/OfficialMotorhead/photos/a.494647180567595/1796110130421287/?type=1&theaterSimon Sheltonhttps://vimeo.com/simonshelton/aboutJohn MahoneyScreenshot from Frasier (1993 - 2004) https://www.imdb.com/title/tt0106004/Emma ChambersPromotional Image for The Vicar of Dibley (1994–2015)https://www.imdb.com/title/tt0108981/Jim BowenMudhappy [CC BY 3.0 (https://creativecommons.org/licenses/by/3.0)], from Wikimedia CommonsStephen HawkingNASA [Public domain], via Wikimedia CommonsLinda BrownNYWT&S staff photo by Al Ravenna. [Public domain], via Wikimedia CommonsDale WintonPromotional Image for Supermarket Sweep (1990–2003)https://www.imdb.com/title/tt0180384/Verne TroyerEva Rinaldi [CC BY-SA 2.0 (https://creativecommons.org/licenses/by-sa/2.0)]Margot KidderScreenshot from Superman (1978)https://www.imdb.com/title/tt0078346/Aretha Franklinhttps://en.wikipedia.org/wiki/File:Aretha_Franklin_1968.jpgBurt Reynoldsphoto by Alan Light [CC BY 2.0 (https://creativecommons.org/licenses/by/2.0)]Paul AllenMiles Harris [CC BY-SA 3.0 (https://creativecommons.org/licenses/by-sa/3.0)], from Wikimedia CommonsStan LeeGage Skidmore [CC BY-SA 3.0 (https://creativecommons.org/licenses/by-sa/3.0)]Stephen HillenburgCarlos Cazurro Burgos (http://www.cazurro.com/) [CC BY-SA 3.0 (https://creativecommons.org/licenses/by-sa/3.0)], via Wikimedia CommonsIngvar KampradMinistry of Enterprise, Energy and Communications of Sweden/Sandra Baqirjazid [CC BY 2.0 (https://creativecommons.org/licenses/by/2.0)], via Wikimedia CommonsAviciiThe Perfect World Foundation [CC BY 3.0 (https://creativecommons.org/licenses/by/3.0)], via Wikimedia CommonsKofi AnnanKingkongphoto & www.celebrity-photos.com from Laurel  Maryland, USA [CC BY-SA 2.0 (https://creativecommons.org/licenses/by-sa/2.0)], via Wikimedia CommonsMusic:Two Finger Johnny Kevin MacLeod (incompetech.com)Licensed under Creative Commons: By Attribution 3.0 Licensehttp://creativecommons.org/licenses/by/3.0/"
"ve2hfpMOKnQ","TURBOS & TEMPLES 2 // JDM Feature Film 4K","2018-12-24T21:05:32.000Z","UCgJRL30YS6XFxq9Ga8W2J3A","Mighty Car Mods","2","19.17.01","mighty,car,mods,mcm,MCM,moog,marty,turbo,jdm,how,to,diy,do,it,yourself,nissan,subaru,supercharged,race,turbos and temples 2,TT2,super turbos and temples,March super turbo,K10 Micra,K11 Micra,4k,filmed in 4k,UHD,ultra high definition,ultra wide monitor,black magic cinema camera,gopro7,phantom 4","1272475","43324","518","5203","https://i.ytimg.com/vi/ve2hfpMOKnQ/default.jpg","False","False","Join Marty and Moog on an epic 2 part road trip across Japan in a car they've just bought off the internet. But before the trip kicks off, the boys have to decipher a cryptic note from the previous owner found on the steering wheel...With stunning cinematography and epic cars, this 90 minute sequel to Turbos & Temples  delves into Japanese culture in a way that only Mighty Car Mods can. ➡ PART 2: https://youtu.be/aTOmF9AwMNYMusic from this film is from these original albums: TURBOS&TEMPLES https://itunes.apple.com/au/album/turbos-temples-original-soundtrack/423621272KEI TO THE CITY https://itunes.apple.com/tm/album/kei-to-the-city/id829016181CHASING MIDNIGHT https://itunes.apple.com/ca/album/chasing-midnight-ep/id981952367Shop: http://www.mightycarmods.com/collections/Facebook: http://www.facebook.com/mightycarmodsForum: http://forums.mightycarmods.comAlso something to note around Mighty Car Mods: we are normal guys and are not trained mechanics. We like to make interesting car mods and show you how we've gone about it, but we can't promise that anything we show you will work for your particular car, or that you won't harm yourself, someone else, your car or your warranty doing it. Please be safe, be responsible and unless you know what you're doing, do not fool around with very serious machinery just because you've seen us make it look so easy. Talk to a qualified mechanic if you are in any doubt."
"JNOwVpClfSs","KNOCKOUT: Dillian Whyte knocks out Derek Chisora in 11th round! 🥊","2018-12-23T21:00:00.000Z","UC_JQGBtA7P0RwkRxd7xpJcA","Sky Sports Boxing","17","19.17.01","Sky sports,sky sports boxing,sky sports boxing stream,anthony joshua,anthony joshua highlights,david haye,tony bellew,amir khan,dillian whyte vs dereck chisora,dillian whyte,dillian whyte vs dereck chisora knockout,dillian whyte vs dereck chisora 2,dillian whyte vs anthony joshua,dillian whyte vs dereck chisora highlights,dereck chisora vs dillian whyte,derek chisora,dereck chisora,boxing knockouts","816230","4491","229","1029","https://i.ytimg.com/vi/JNOwVpClfSs/default.jpg","False","False","SUBSCRIBE ► http://bit.ly/SSBoxingSubDillian Whyte brutally knocked out Derek Chisora with a huge left hook to settle their heavyweight grudge match at The O2.Their rematch had been as pulsating as the first fight two years ago, which Whyte had won by split decision, but their rivalry was conclusively ended in the 11th round.►TWITTER: https://twitter.com/skysportsboxing►FACEBOOK: http://www.facebook.com/skysportsboxing►WEBSITE: http://www.skysports.com/boxing"
"byldfZxK0AU","What my trip to Japan was like","2018-12-23T19:07:34.000Z","UCGwu0nbY2wSkW8N-cghnLpA","Jaiden Animations","1","19.17.01","jaiden,animations,jaidenanimation,jaidenanimations,trip to japan,jaidenanimations japan,jaiden animations japan,i went to japan","5558818","376985","3129","74184","https://i.ytimg.com/vi/byldfZxK0AU/default.jpg","False","False","konichiwa :3calso i tried to keep the video under 10 mins but i just couldn't so sorry about that, hopefully it's not too long for ur viewing pleasureThanks to  Hannah for voicing the Japanese girl as well! https://www.youtube.com/user/WhiteEnglishGirl♥ The Team ♥Denny: https://www.instagram.com/90percentknuckles/MorganToast: https://morgantoast.tumblr.com/GinjaNinja: https://www.youtube.com/user/GinjaNinjaOwODavidBaronArt: http://davidbaronart.tumblr.com/Devon: https://www.instagram.com/devonkong/Duckdee: https://www.youtube.com/user/SirDuckD?app=desktopJaystarz: https://www.youtube.com/xjaystarzxRizatch: https://www.youtube.com/rizatchShoocharu: https://twitter.com/Shoocharu------------------------------------------------------------------------------------SUBSCRIBE for more animations!https://www.youtube.com/c/jaidenanimationsMERCH:https://jaidenanimations.com/TWITTER:https://twitter.com/JaidenAnimationINSTAGRAM:https://instagram.com/jaiden_animations/DEVIANTART:http://jaidenanimations.deviantart.com/Behind the Scenes:https://www.patreon.com/jaidenanimations?ty=hIf you're an animator, artist, gamer, or entertainer, then join us at Channel Frederator Network: https://frdr.us/JaidenWanna Send Fanart?You can send it to me through Twitter or DeviantArt (links above)------------------------------------------------------------------------------------Music: Fixing Elevators by ionicsBad recorder music: https://www.youtube.com/watch?v=pcBvkGFNCYY&t=13s------------------------------------------------------------------------------------And this tells me you read the description, which means you respect what I have to say! Thank you :D konichiwa again :3c"
