video_id,title,publishedAt,channelId,channelTitle,categoryId,trending_date,tags,view_count,likes,dislikes,comment_count,thumbnail_link,comments_disabled,ratings_disabled,description
"DYYtuKyMtY8","SPIDER-MAN: FAR FROM HOME - Official Teaser Trailer","2019-01-15T13:59:13.000Z","UCz97F7dMxBNOfGYu3rx8aCw","Sony Pictures Entertainment","24","19.17.01","spiderman,spider-man,far from home,spider-man: far from home,spiderman: far from home,far from home trailer,spider-man: far from home trailer,teaser trailer,official trailer,tom holland,zendaya,jake gyllenhaal,gyllenhaal,peter parker,sony,marvel studios,marvel,#spidermanfarfromhome,Michael Keaton,Quentin Beck,Mysterio,Spider Man Movie,Marvel comic,Sony Pictures Entertainment,Nick Fury,Cobie Smulders,Samuel L. Jackson,Far From Home Teaser","23228540","954857","18436","92623","https://i.ytimg.com/vi/DYYtuKyMtY8/default.jpg","False","False","Watch the #SpiderManFarFromHome teaser trailer now. 7.5.19https://spidermanfarfromhome.movieTrailer Music: “I Wanna Be Sedated” by RamonesFollow Us on Social:https://www.facebook.com/SpiderManMoviehttps://www.instagram.com/SpiderManMovie/https://twitter.com/SpiderManMovieSubscribe to Sony Pictures for exclusive content: http://bit.ly/SonyPicsSubscribePeter Parker returns in Spider-Man: Far From Home, the next chapter of the Spider-Man: Homecoming series! Our friendly neighborhood Super Hero decides to join his best friends Ned, MJ, and the rest of the gang on a European vacation. However, Peter’s plan to leave super heroics behind for a few weeks are quickly scrapped when he begrudgingly agrees to help Nick Fury uncover the mystery of several elemental creature attacks, creating havoc across the continent!#SpiderMan #PeterParker #TomHolland #JakeGyllenhaal #Zendaya #Marvel #Sony #Trailer #OfficialTrailer #SamuelLJackson #JonFavreau #CobieSmulders"
"koPmuEyP3a0","We Believe: The Best Men Can Be | Gillette (Short Film)","2019-01-14T03:01:18.000Z","UCUAMa2W6xG9Ega11nK1qe-w","Gillette","26","19.17.01","gillette,anti harassment,stop harassment,anti bullying,stop bullying,modern masculinity,crisis of masculinity,manhood,masculinity,me too movement,empowerment,campaign,diversity,empower,commercial,inspiration,gillette commercial,me too","15702184","379872","830415","335112","https://i.ytimg.com/vi/koPmuEyP3a0/default.jpg","False","False","Bullying. Harassment. Is this the best a man can get? It's only by challenging ourselves to do more, that we can get closer to our best. To say the right thing, to act the right way. We are taking action at http://www.thebestmencanbe.org. Join us.Watch our next Short Film: https://www.youtube.com/watch?v=kbHXIN6EzWoSubscribe for the latest Gillette videos: http://www.youtube.com/subscription_center?add_user=Gillette More Gillette Channels: Website: http://gillette.com/en-usFacebook: http://www.facebook.com/gilletteTwitter: http://www.twitter.com/gilletteInstagram: https://www.instagram.com/gillette/This Gillette commercial is about our belief in the best in men. #TheBestMenCanBe #Gillette"
"jPBK5pChcds","The moment Theresa May loses crucial Brexit deal vote","2019-01-15T20:19:34.000Z","UCIRYBXDze5krPDzAEOxFGVA","Guardian News","25","19.17.01","politics,gdnpfpnewspolitics,world,gdnpfpnewsworld,uk news,brexit,brexit latest,brexit news,theresa may,jeremy corbyn,theresa may loses vote,house of commons,brexit vote result,prime minister,may deal,may brexit deal,may loses vote,labour,snp,brexit deal vote,brexit vote,what happens next with brexit,corbyn,no confidence,labour brexit,tory brexit,may brexit vote,may brexit,vote,eu,european union,uk,gdnpfpnewsuk,may defeated,may defeated in parliament","294329","1703","88","1654","https://i.ytimg.com/vi/jPBK5pChcds/default.jpg","False","False","Theresa May has lost the vote on her crucial Brexit deal by 432 votes to 202 in what is the heaviest defeat of any British prime minister in the democratic era.  As a result Jeremy Corbyn has tabled a vote of no confidence, which will be debated in the House on WednesdaySubscribe to Guardian News on YouTube ► http://bit.ly/guardianwiressubToday in Focus podcast ► https://www.theguardian.com/news/series/todayinfocusSupport the Guardian ► https://theguardian.com/supportusThe Guardian YouTube network:The Guardian ► http://www.youtube.com/theguardianOwen Jones talks ► http://bit.ly/subsowenjonesGuardian Football ► http://is.gd/guardianfootballGuardian Sport ► http://bit.ly/GDNsportGuardian Culture ► http://is.gd/guardianculture"
"O8NRaq_1gNw","SISTERS APPAREL LOOKBOOK","2019-01-15T19:58:11.000Z","UCucot-Zp428OwkyRm2I7v2Q","James Charles","24","19.17.01","james,james charles,makeup artist,mua,covergirl,coverboy,cute,jeffree star,easy makeup,how-to,reviews,tutorials,funny videos,beauty tips,hacks,beauty,sisters apparel,james charles clothing line,sisters,hi sisters,sportswear,lookbook,women's fashion,fashion,james charles clothes,shane,loey lane,loeybug,emma chamberlain,ben azelart,dylan geick,nikita dragun,gabriel zamora","2473566","207361","9895","30395","https://i.ytimg.com/vi/O8NRaq_1gNw/default.jpg","False","False","HI SISTERS! For today's video, I'm bringing you my first ever lookbook from my inclusive, good & fresh brand, Sisters Apparel! I'm so excited to debut our new Sportswear Collection, as well as give you guys an idea as to how you can style our pieces!SISTER'S APPAREL » http://sisters-apparel.comSPORTSWEAR COLLECTION launching THIS FRIDAY 1/18 at 12PM PST!💞OUTFITS STYLED BY LIV Mhttp://instagram.com/styledbylivm🛎 Subscribe to my channel to join the sisterhood & hit the notification bell so you never miss an upload! » http://bit.ly/JamesCharles for new videos!__❤️ LET'S BE BFFSINSTAGRAM » http://instagram.com/jamescharlesTWITTER » http://twitter.com/jamescharlesSNAPCHAT » jamescharless__♡ MY AMAZING TEAMEDITOR: Louis & Anthony Gargiulahttp://instagram.com/louisgargiulahttp://instagram.com/anthonygargiulaCONTENT COORDINATOR: Eros Gomezhttp://instagram.com/erosmuaGRAPHICS: Michael Rusakovhttp://instagram.com/michael.ny"
"IU9ZkVvOLKo","Spider-Man Far From Home Trailer - Avengers Endgame and Mysterio Easter Eggs Breakdown","2019-01-15T18:46:26.000Z","UCDiFRMQWpcp8_KD4vwIVicw","Emergency Awesome","24","19.17.01","Spider-Man Far From Home Trailer,Spider-Man Far From Home Teaser Trailer,Emergency Awesome,Avengers Endgame Trailer,Avengers 4 Trailer,Avengers Endgame,Avengers 4,spider-man,Captain Marvel,Spider-Man Far From Home,Mysterio,Avengers 4 Title,Avengers 4 Trailer Reaction,Avengers Infinity War,Avengers,Trailer,Teaser,Clip,Preview,Scene,Promo,Theory,Explained,Marvel,Infinity War,Comics,emergencyawesome,Charlie Schneider,Spider-Man Far From Home Trailer Reaction","1070211","27384","518","7225","https://i.ytimg.com/vi/IU9ZkVvOLKo/default.jpg","False","False","Spider-Man Far From Home Trailer, Avengers Endgame, Spider-Man Easter Eggs, New Spider-Man Far From Home Suits, Mysterio Theory and Tom Holland ► https://bit.ly/AwesomeSubscribeAvengers 4 Endgame Trailer Easter Eggs ► http://bit.ly/2EjFc30Game Of Thrones Season 8 Trailer ► http://bit.ly/2SNws9aEmergency Awesome 2017 Hype Trailer ► https://bit.ly/2iD2GVLTwitch Channel https://twitch.tv/emergencyawesomeTwitter  https://twitter.com/awesomemergencyFacebook  https://facebook.com/emergencyawesomeInstagram  https://instagram.com/emergencyawesomeTumblr  https://robotchallenger.com::Playlists For Shows::New Emergency Awesome ► https://bit.ly/EmergencyAwesomeGame of Thrones Season 8 ► https://bit.ly/GameOfThronesSeason4Avengers Infinity War and Marvel Movies ► https://bit.ly/SpiderManAvengersMovieRick and Morty Season 4 ► https://bit.ly/RickandMortyS3Dragon Ball Super Episodes ► https://bit.ly/DragonBallSuperVideosSpider Man Far From Home ► https://bit.ly/SpiderManHomecomingThe Flash Season 4 ► https://bit.ly/JusticeLeagueDCEUDeadpool Videos ► https://bit.ly/DeadpoolMaximumEffortJustice League Batman and DC Movies ► https://bit.ly/JusticeLeagueDCEUStar Wars Episode 9 ► https://bit.ly/StarWarsEpisode8movieMy Website ► https://emergencyawesome.comTHANKS FOR WATCHING!!"
"vTyczkAkM2Y","Is the Latest Gillette Advert an Attack on Men? | Good Morning Britain","2019-01-15T12:04:54.000Z","UCq18eeL7D9Vd8DhjMcLh9QQ","Good Morning Britain","24","19.17.01","good morning britain,breakfast show,news,morning news,gmb,good morning britain interview,itv,piers morgan,susanna reid,Talk Shows - Topic,good morning britain debate,gmb debate,piers morgan debate,harriet minter,piers morgan harriet minter,peter lloyd,gillette commercial,gillette,gillette me too,men's rights activist,men's rights activism,metoo","268315","5974","1635","0","https://i.ytimg.com/vi/vTyczkAkM2Y/default.jpg","True","False","Gillette has recently come under fire from men's rights activists for their new 'The Best Men Can Be' advert which takes aim at sexual harassment, bullying, and toxic masculinity. Harriet Minter and Peter Lloyd debate whether or not the advert is a new attack on men.Subscribe now for more! http://bit.ly/1NbomQaBroadcast on 15/10/2019Like, follow and subscribe to Good Morning Britain!The Good Morning Britain YouTube channel delivers you the news that you’re waking up to in the morning. From exclusive interviews with some of the biggest names in politics and showbiz to heartwarming human interest stories and unmissable watch again moments. Join Susanna Reid, Piers Morgan, Ben Shephard, Kate Garraway, Charlotte Hawkins and Sean Fletcher every weekday on ITV from 6am.Website: http://bit.ly/1GsZuhaYouTube: http://bit.ly/1Ecy0g1Facebook: http://on.fb.me/1HEDRMbTwitter: http://bit.ly/1xdLqU3http://www.itv.com"
"uPCi5Rs7EuA","Model Rocket Battle 2 | Dude Perfect","2019-01-14T22:58:13.000Z","UCRijo3ddMTht_IHyNSNXpNQ","Dude Perfect","17","19.17.01","dude perfect,dude perfect stereotypes,dude perfect water bottle flip,bottle flip,water bottle flip,dude perfect bottle flip,dude perfect basketball,dp,dude perfect world record,edition,nerf,trick shots,trick shot,family,ping pong,bowling,clean,family friendly,bubble wrap,soccer,football,spinner,spinners,fidget spinners,dude,SpaceX,Space,Rocket,Launch,North Korea,blue origin,Elon Musk,Explosion,C4,Coby Wins,giant,loc precision","12830603","453207","7335","25413","https://i.ytimg.com/vi/uPCi5Rs7EuA/default.jpg","False","False","Launching giant model rockets is our new favorite hobby!► Click HERE to subscribe to Dude Perfect! http://bit.ly/SubDudePerfectMusic by The Score:► Click HERE to download Glory - https://republic.lnk.to/GloryDP► Click HERE to listen on Spotify - https://republic.lnk.to/GloryDP/spotify► Click HERE to visit The Score website - http://www.thescoremusic.com► Click HERE to listen on YouTube - https://youtu.be/i3ucSSVJTL4► Click HERE to watch our most recent videos! http://bit.ly/NewestDudePerfectVideoshttp://bit.ly/NewestDPVideos► SHOP our NEW Merchandise! - http://bit.ly/DPStore►Click HERE to join the exclusive Dude Perfect T-Shirt Club! http://bit.ly/DPTShirtClubPlay our NEW iPhone game!► PLAY Endless Ducker on iPhone -- http://smarturl.it/EndlessDucker► PLAY Endless Ducker on Android -- http://smarturl.it/EndlessDucker► VISIT our NEW STORE - http://bit.ly/DPStore► JOIN our NEWSLETTER - http://bit.ly/DPNewsletterEndCard► WATCH our STEREOTYPES - http://bit.ly/StereotypesPlaylistIn between videos we hang out with you guys on Instagram, Snapchat, Twitter, and Facebook so pick your favorite one and hang with us there too!http://Instagram.com/DudePerfecthttp://bit.ly/DudePerfectSnapchathttp://Twitter.com/DudePerfecthttp://Facebook.com/DudePerfectDo you have a GO BIG mindset? See for yourself in our book Go Big. ►http://amzn.to/OYdZ2sA special thanks to those of you who play our iPhone Games and read our book. You guys are amazing and all the great things you tell us about the game and the book make those projects so worthwhile for us! Dude Perfect GAME - http://smarturl.it/DPGameiPhoneDude Perfect BOOK - Go Big - http://amzn.to/OYdZ2sClick here if you want to learn more about Dude Perfect:http://www.dudeperfect.com/blog-2/Bonus points if you're still reading this! Comment: Where was Pandas rocket? As always...Go Big and God Bless!- Your friends at Dude PerfectBusiness or Media, please contact us at: Dude@DudePerfect.com------------5 Best Friends and a Panda.If you like Sports + Comedy, come join the Dude Perfect team!Best known for trick shots, stereotypes, battles, bottle flips, ping pong shots and all around competitive fun, Dude Perfect prides ourselves in making the absolute best family-friendly entertainment possible! Welcome to the crew! Pound it. Noggin. - Dude Perfect"
"EjIbmQsWtqc","Macro Pupil Constricting in Slow Motion - The Slow Mo Guys","2019-01-15T13:36:42.000Z","UCUK0HBIBWgM2c4vsPhkYY4w","The Slow Mo Guys","24","19.17.01","slomo,slow,mo,super,motion,Slow Motion,1000,1000fps,gav,dan,slowmoguys,phantom,guys,HD,flex,gavin,free,gavin free,high speed camera,the slow mo guys,2000,2000fps,5000,5000fps,speed of pupil dilation,dilation speed,dilation,pupil,speed,dialation,iris,eyeball,eye ball,constriction,macro,macro eye,Macro Pupil Constricting in Slow Motion,pupil constricting,slow mo eye","1823972","88844","666","4465","https://i.ytimg.com/vi/EjIbmQsWtqc/default.jpg","False","False","British people are not known for great eye contact, but Gav steps up his game by looking deeply into Dan's eyes... From about 2 millimeters away to find out how quickly a pupil constricts. Follow us on Instagram! https://www.instagram.com/gavinfree/https://www.instagram.com/danielgruchy/The Speed of Pupil Dilation - The Slow Mo GuysFilmed at 1000fps and 500fps with a Phantom Flex 4K"
"GYrdeguOXZQ","LOSING IT Over Sean Lock’s Worst Decision Ever! | 8 Out of 10 Cats Does Countdown","2019-01-15T18:00:01.000Z","UCz1hQ68G3XPVYEBoFDgSjcQ","Channel 4","24","19.17.01","Channel 4,All 4,4OD,Cats Countdown,Cats Does Countdown,8 out of 10 cats does countdown,8 out of 10 cats,2019,new,full episodes,watch online,new episodes,new series,series 17,season 17,episode 1,best of,best bits,funny,funniest moments,best moments,jimmy carr,sean lock,stand up,hecklers,mascots,british humour,british comedy,would i lie to you,QI,panel shows,johnny vegas,alan carr,lou sanders,inland rock,flannels,laughing,insults,ouzo,boozo","213937","2773","92","192","https://i.ytimg.com/vi/GYrdeguOXZQ/default.jpg","False","False","Subscribe to Channel 4: https://bit.ly/2v2I6SYWatch the FULL EPISODE: https://bit.ly/2vQu7RmJimmy Carr hosts as Sean Lock and Johnny Vegas take on guest captain Alan Carr and Lou Sanders.#CatsCountdown #SeanLock #JohnnyVegas #JimmyCarr #AlanCarr #LouSanders #FunniestMoments #Channel4 #Comedy #All4"
"MefR-ax3u4w","Does Kim Kardashian Regret ‘Jam (Turn It Up)’? | WWHL","2019-01-15T06:50:58.000Z","UCy6D16zE_mMEm1HVD20WFxA","Watch What Happens Live with Andy Cohen","24","19.17.01","What What Happens live,celebrity,Andy Cohen,bravo andy,Watch,What,Happens,Kim Kardashian,Regret,Jam (Turn It Up),Turn It Up,Jam,Kourtney Kardashian,honest opinion,music video,she’s glad,glad,kim kardashian (celebrity),kylie jenner,kanye west,famous people,andy cohen plead the fifth,andy cohen the view,bravo andy baby,bravo andy cohen show,watch what happens live,wwhl,wwhl after show,wwhl plead the fifth","637762","3623","383","390","https://i.ytimg.com/vi/MefR-ax3u4w/default.jpg","False","False","Khloe Kardashian and Kourtney Kardashian give their honest opinion of Kim Kardashian’s music video for “Jam (Turn It Up)” and Kim says why she’s glad she did it.►► Subscribe To WWHL: http://bravo.ly/WWHLSubWatch WWHL Sun-Thu 11/10c:WWHL Website: http://www.bravotv.com/watch-what-happens-liveFollow WWHL: https://twitter.com/BravoWWHLLike WWHL: https://www.facebook.com/WatchWhatHappensLiveWWHL Tumblr: http://bravowwhl.tumblr.com/'Watch What Happens: Live' is Bravo's late-night, interactive talk show that features guests from the world of entertainment, politics, and pop culture. Hosted by Andy Cohen, the series includes lively debates on everything from fashion, the latest on everyone's favorite Bravolebrities, and what celebrity is making headlines that week. Past guests who have joined Cohen in the Bravo Clubhouse include Sarah Jessica Parker, Tina Fey, Khloe Kardashian, Jennifer Lopez, Liam Neeson, Kelly Ripa, Jimmy Fallon, Anderson Cooper, Jennifer Lawrence, and Lance Bass.Watch More Bravo:Bravo Website: http://www.bravotv.com/Bravo Youtube: http://www.youtube.com/videobybravoFollow Bravo: http://www.twitter.com/bravotvLike Bravo: https://www.facebook.com/BRAVOPin Bravo: http://www.pinterest.com/bravobybravoBravo Instagram: http://www.instagram.com/bravotvBravo Tumblr: http://bravotv.tumblr.com/Does Kim Kardashian Regret ‘Jam (Turn It Up)’? | WWHL"
"wqan_jnSn24","NEW SIGNING! - HASHTAG UNITED vs FRENFORD FC","2019-01-15T16:30:19.000Z","UCeJ73ymlLhLctITwdi9iCVw","Hashtag United","17","19.17.01","hashtag united,hashtag fc,Spencer fc,Spencer Owen,football,soccer,non league football,non league,Sunday league,Sunday league football,football highlights,charlie morley,devs,frenford,soccer highlights,non-league highlights,hashtag non-league","153854","6008","67","522","https://i.ytimg.com/vi/wqan_jnSn24/default.jpg","False","False","► Subscribe so you don't miss the exciting run-in!: http://bit.ly/hashtagutd►Check out Awaydays channel: https://www.youtube.com/channel/UCGtJmyfY3I2-yWbNh-Ar5Rg► Follow us on Twitter! - http://twitter.com/HashtagUtd► Buy official Hashtag United merch - http://HashtagUtd.com► Follow us on Instagram! - http://instagram.com/HashtagUtd► Like us on Facebook! - http://facebook.com/HashtagUnitedFC★ HASHTAG UNITED TWITTER ★Manager:Devs -  https://twitter.com/Devs76Captain:Jack Harrison - https://twitter.com/jjharrison85Player/Asst Manager:Neil Richmond - https://twitter.com/NeilRicho10First Team:Ryan Adams - https://twitter.com/HashtagRAdamsSam Adams - https://twitter.com/SamAdams93Daniel Adjei - https://twitter.com/danielb_93Theo Baker - https://twitter.com/theobaker_Ryan Barker - https://twitter.com/_RyanBarker1Rich Beck - https://twitter.com/RichBeck4Dan Brown - https://twitter.com/danbrowndbeAndy Cade-Watts (AJW) - https://twitter.com/andyjw10Matt Carter - https://twitter.com/MJCarter04Aaron Couch - https://twitter.com/AaronCouch11Ricky Evans - https://twitter.com/RickyEvans14Tekkers Guru (Hussein Isa) - https://twitter.com/tsguru10Harry Honesty - https://twitter.com/HarryHonestyLee Hursit -  https://twitter.com/LeeHursit97Jacko - https://twitter.com/HashtagJackoJemel One Five - http://twitter.com/jemelonefiveAlbie Keith - https://twitter.com/albert_keith10Charlie Morley - https://twitter.com/charliemorley_Marcus Stamp - https://twitter.com/bigmarcs_  Wes Tanser - https://twitter.com/westanserFarai Tsingano - https://twitter.com/Farry321Tom Williams - https://twitter.com/MrTomWilliamsSunday League Team: Spencer - https://twitter.com/SpencerOwenSeb - https://twitter.com/sebcbrown4Ryan Coughlan -  https://twitter.com/RyanCoughlannSam Ecott - https://twitter.com/samecottJames Lovatt - http://instagram.com/_jameslovatt_Charlie Occleshaw -  https://twitter.com/Charlie_OccMitchell Preston -  https://twitter.com/Mitch3llPrestonJames Stevens - https://twitter.com/JamesStevens9George Vallentyne -  https://twitter.com/GVallentyneeJacob Webster -  https://twitter.com/JacobWebster23Ryan Barker - https://twitter.com/_RyanBarker1Ben Glander - https://twitter.com/ben_glanderMatt Creasey - https://twitter.com/mattcreasey31Michael Dill - https://twitter.com/mdill1Dave Hopwood - https://twitter.com/dave_hoppersOllie Shone - https://twitter.com/ollieshoneZac Clarke - https://twitter.com/_ZacClarke_Maverick Gore - https://twitter.com/GoreMaverickScott Willard -  https://twitter.com/_ScottWillard_Charlie Turner - https://twitter.com/CharlieTurner94Marius Hjerpeth - https://twitter.com/HjerpethJake Tillet - https://twitter.com/Jake_TillettMatt Stevens - https://twitter.com/Mstev15Paul Nash - https://twitter.com/Paul_Nash26Backroom:Physio:Stevie CB - https://twitter.com/carmichaelbrownKitman:https://twitter.com/IG_RuminMedia/Operations:Lewis Preston - https://twitter.com/LewisPrestonAlex Osipczak- https://twitter.com/alexosipczakNeil Smythe - https://twitter.com/neilsmytheMedia intern - https://twitter.com/TookeDanielMusic by Epidemic Sound."
"lUwRy0eVEHc","Top 10 Raw moments: WWE Top 10, January 14, 2019","2019-01-15T18:56:08.000Z","UCJ5v_MCY6GNUBTO8-D3XoAg","WWE","17","19.17.01","wwe,world wrestling entertainment,wrestling,wrestler,wrestle,superstars,कुश्ती,पहलवान,डब्लू डब्लू ई,मैच,सुपरस्टार,व्यावसायिक कुश्ती,مصارعه,WWE Top 10,Braun Strowman,Mr. McMahon,Finn Bálor,Bobby Lashley,Sasha Banks,Ronda Rousey,Drew McIntyre,Bayley,Nikki Cross,Otis Dozovic,Revival,sasha bankds,ronda rousey,drew mcintrye,otis dozovic,alexa bliss,dash wilder,scott dawson,raw highlights","1094928","21855","782","1311","https://i.ytimg.com/vi/lUwRy0eVEHc/default.jpg","False","False","WWE Top 10 takes you back to this week's Monday Night Raw to revisit the show's most thrilling, physical and controversial moments.GET YOUR 1st MONTH of WWE NETWORK for FREE: http://wwenetwork.com---------------------------------------------------------------------Follow WWE on YouTube for more exciting action!---------------------------------------------------------------------Subscribe to WWE on YouTube: http://bit.ly/1i64OdTCheck out WWE.com for news and updates: http://goo.gl/akf0J4Find the latest Superstar gear at WWEShop: http://shop.wwe.com---------------------------------------------Check out our other channels!---------------------------------------------The Bella Twins: https://www.youtube.com/thebellatwinsUpUpDownDown: https://www.youtube.com/upupdowndownWWEMusic: https://www.youtube.com/wwemusicTotal Divas: https://www.youtube.com/wwetotaldivas------------------------------------WWE on Social Media------------------------------------Twitter: https://twitter.com/wweFacebook: https://www.facebook.com/wweInstagram: https://www.instagram.com/wwe/Reddit: https://www.reddit.com/user/RealWWEGiphy: https://giphy.com/wwe"
"oUTMYmLKN1E","Yaya Toure picks incredibly attacking Ultimate XI of players he has played with! | MNF","2019-01-15T10:18:36.000Z","UCNAf1k0yIjyGu3k9BwAg3lg","Sky Sports Football","17","19.17.01","sky sports,premier league,Football League,La Liga,football,thierry henry,gary neville,jamie carragher,soccer saturday,soccer,Premiership,Sky Sports live,Sky,Sports,stream,the debate,the debate sky sports,sky sports football,Manchester City,Yaya Toure,Premier League,MNF,Monday Night Football,MCFC,Manchester City 3-0 Wolves,Sergio Aguero,Gabriel Jesus,Kevin De Bruyne,Puyol,Barcelona,Kolo Toure","191509","2747","113","830","https://i.ytimg.com/vi/oUTMYmLKN1E/default.jpg","False","False","SUBSCRIBE ► http://bit.ly/SSFootballSubYaya Toure picks his ultimate XI of players he has played with throughout his career, including only three defenders.Watch Premier League LIVE on Sky Sports here ► http://bit.ly/WatchSkyPL►TWITTER: https://twitter.com/skysportsfootball►FACEBOOK: http://www.facebook.com/skysports►WEBSITE: http://www.skysports.com/football►SOCCER AM: http://bit.ly/SoccerAMSub►SKY SPORTS BOXING: http://bit.ly/SSBoxingSub"
"wA38GCX4Tb0","Game of Thrones | Season 8 | Official Tease: Crypts of Winterfell (HBO)","2019-01-14T01:59:41.000Z","UCQzdMyuz0Lf4zo4uGcEujFw","GameofThrones","1","19.17.01","Game of Thrones,For The Throne,Season 8,Stark,Lannister,HBO,Final Season,GoT,Dragonstone,Tease,Winterfell,Crypt,Premiere Date,April","18234031","477621","9449","35228","https://i.ytimg.com/vi/wA38GCX4Tb0/default.jpg","False","False","Game of Thrones returns for its final season on April 14. #ForTheThrone"
"p1ehzhnO68c","Tyson Fury's first big interview of 2019 in full | AJ negotiations, next fight date, Wilder rematch","2019-01-14T18:58:47.000Z","UC4i_9WvfPRTuRWEaWyfKuFw","BT Sport","17","19.17.01","bt sport,bt sport official,tyson fury interview,tyson fury,tyson fury marbella,tyson fury bt sport,tyson fury deontay wilder,wilder fury rematch,wilder fury highlights,tyson fury highlights,tyson fury 12th round,tyson fury undertaker,boxing,boxing interview,boxing highlights,ben davison","357442","7772","218","1999","https://i.ytimg.com/vi/p1ehzhnO68c/default.jpg","False","False","Subscribe to our 'No Filter Boxing' YouTube channel ➡️ http://po.st/NoFilterYTIt's the interview you've all been waiting for... 🙌We're with Tyson Fury for his first big chat of 2019, discussing everything from Anthony Joshua to the Deontay Wilder rematch 👀Great to hear the big man sounding this motivated 👊 Subscribe to our YouTube channel for the best videos from BT Sport  ➡️ http://bit.ly/17YTeL5Twitter: http://twitter.com/btsportFacebook: http://www.facebook.com/btsportInstagram:http://instagram.com/btsportWebsite: http://sport.bt.com"
