video_id,title,publishedAt,channelId,channelTitle,categoryId,trending_date,tags,view_count,likes,dislikes,comment_count,thumbnail_link,comments_disabled,ratings_disabled,description
"A-kbmFiCMUI","Kohli, Dhoni too good for the Aussies | Second Gillette ODI","2019-01-15T11:55:51.000Z","UCkBY0aHJP9BwjZLDYxAQrKg","cricket.com.au","17","19.16.01","sp:ty=high,sp:dt=2019-01-15T03:20:00+00:00,sp:vl=en-US,sp:st=cricket,sp:li=icc,sp:ti:home=AUS,sp:ti:away=IND","16003226","159371","8438","10089","https://i.ytimg.com/vi/A-kbmFiCMUI/default.jpg","False","False","Shaun Marsh hit a brilliant century, Glenn Maxwell found form but India's giants were too good with another Virat Kohli ODI ton and a perfectly-timed finish from MS Dhoni helping India level the series 1-1"
"rYNTImeVOdw","Sakutumba Saparivara Samethamga | ETV Sankranthi Special Event | Full Episode | 15th January 2019","2019-01-15T07:48:45.000Z","UCSs9H1cyB3OHdy8wkit8ZKg","etvteluguindia","24","19.16.01","etv shows,eenadu television,dhee Jodi,jabardasth,extra jabardsth,etv20,etv comedy show,extra jabardasth,naga babu,roja,anchor anasuya,rashmi,dhanraj,chandra,venu,chanti,dhana dhan dhanraj,chamak chandra,chalaki chanti,raghava,rocket raghava,venu wonders,racha ravi,adhire abhi,shaking sheshu,super sreenu,sudigaali,Rocking rakesh,Adhire abhi,kiraak rp,hyper aadi,raising raju,venkey monkeys,durga rao","4044729","41834","4195","3972","https://i.ytimg.com/vi/rYNTImeVOdw/default.jpg","False","False","Sakutumba Saparivara Samethamga | ETV Sankranthi Special Event"
"jFGKJBPFdUA","Apna Time Aayega | Gully Boy | Ranveer Singh & Alia Bhatt | DIVINE | Dub Sharma | Zoya Akhtar","2019-01-14T06:30:04.000Z","UCFFbwnve3yF62-tVXkTyHqg","Zee Music Company","10","19.16.01","apna time aayega,Ranveer Singh Songs,Alia Bhatt Songs,Divine Songs,Gully Boy Songs,Gully Boys Songs,New Hindi Songs,Ranveer Rap Songs,Ranveer Singh Rap,Divine Rap,Ranveer Hip Hop,Divine Story,Farhan Akhtar Movie Songs,Apna Time Ayega rap,Rap Songs,New Rap Songs,Rap Song Ranveer,Time Aayega,nanga toh hi aaya hai,ghanta leke jayega,Tu nanga hi toh aaya hai,ghanta le kar jaayega.","17676131","454970","9701","18399","https://i.ytimg.com/vi/jFGKJBPFdUA/default.jpg","False","False","To stream & download Full Song - Gaana - https://bit.ly/2SR9wptJioSaavn - http://bit.ly/2RQBHaEWynk Music - http://bit.ly/2VTz3AriTunes -  https://apple.co/2RpF4pIGoogle Play - https://bit.ly/2sp7yRqAmazon Prime Music - https://amzn.to/2spdJVCHungama - http://bit.ly/2THVGWmAPNA TIME AAYEGA !! Presenting the First Song from Gully Boy sung by Ranveer Singh & composed by Dub Sharma & DIVINE. Excel Entertainment and Tiger Baby Present An Excel Entertainment productionComposer – Dub Sharma & DIVINE Singer – Ranveer SinghLyrics – DIVINE & Ankur TewariProduced By – Dub SharmaProgramming – Dub SharmaBacking Vocals – DIVINEStudio – Purple Haze StudiosMixing Engineer – Dub SharmaMastered by Graeme Durham at The Exchange UK.Music Supervisor – Ankur TewariDOP – Jay OzaWritten by Reema Kagti and Zoya AkhtarProducers - Ritesh Sidhwani, Zoya Akhtar and Farhan AkhtarDirected by Zoya AkhtarLyrics:Uth ja apni raakh seTu ud ja ab talaash meinParwaaz dekh parwaane kiAasmaan bhi sar uthaayegaAayega Apna Time AayegaMeray jaisa shaana lala tujhe na mil paayegaYeh shabdon ka jwaala meri bediyyan pighlaayegaJitna toonay boya hai tuUtna hee toh khaayegaAisa mera khwaab hai joDarr ko bhi sataayegaZinda mera khwaabKaise tu dafnaayegaAb hauslay se jee ne deAb khauf nahin hai seenay meinHar raastay ko cheerengayHum kaamyaabi chheenengaySab kuch mila paseenay seMatlab bana ab jeene meinKyon? Kyonki apna time aayega,Tu nanga hi toh aaya hai kya ghanta le kar jaayega.Apna time aayega x3Tu nanga hi toh aaya hai kya ghanta le kar jaayega.Apna time aayega x3Tu nanga hi toh aaya hai kya…Kissi ka haath Nahin tha sar par yahaan par aaya khud ki mehnat se mainJitni taakat kismet mein nahinUtni rehmat mein haiPhir bhi ladka sehmat nahin haiKyonki hairat nahin haiZaroorat yahaan marzi ki aurjurrat ki haiTaakat ki haiAafat kiHimaakat kiIbaadat kiAdaalat yehHai chahat kiMohobbat kiAmaanat ki haiJeetnay ki abAadat ki haiShauhrat ki ab Laalach nahin haiTeray bhai jaisa koiHardich nahin haiIss Harkat ne hibarkat di hai, kyon?Kyunki apna time aayega,Tu nanga hi toh aaya hai kya ghanta le kar jaayega.Apna time aayega x 3Tu nanga hi toh aaya hai kya ghanta le kar jaayega.Kya tu nanga hi toh aaya thhaa, Kya tu ghanta le kar jaayega.Apna time aayega,Apna time aayega na.#ZeeMusicOriginalsMusic on Zee Music CompanyConnect with us on :Twitter - https://www.twitter.com/ZeeMusicCompanyFacebook - https://www.facebook.com/zeemusiccompanyYouTube - http://bit.ly/TYZMC"
"DYYtuKyMtY8","SPIDER-MAN: FAR FROM HOME - Official Teaser Trailer","2019-01-15T13:59:13.000Z","UCz97F7dMxBNOfGYu3rx8aCw","Sony Pictures Entertainment","24","19.16.01","spiderman,spider-man,far from home,spider-man: far from home,spiderman: far from home,far from home trailer,spider-man: far from home trailer,teaser trailer,official trailer,tom holland,zendaya,jake gyllenhaal,gyllenhaal,peter parker,sony,marvel studios,marvel,#spidermanfarfromhome,Michael Keaton,Quentin Beck,Mysterio,Spider Man Movie,Marvel comic,Sony Pictures Entertainment,Nick Fury,Cobie Smulders,Samuel L. Jackson,Far From Home Teaser","15320716","727189","11546","71916","https://i.ytimg.com/vi/DYYtuKyMtY8/default.jpg","False","False","Watch the #SpiderManFarFromHome teaser trailer now. 7.5.19https://spidermanfarfromhome.movieFollow Us on Social:https://www.facebook.com/SpiderManMoviehttps://www.instagram.com/SpiderManMovie/https://twitter.com/SpiderManMovieSubscribe to Sony Pictures for exclusive content: http://bit.ly/SonyPicsSubscribePeter Parker returns in Spider-Man: Far From Home, the next chapter of the Spider-Man: Homecoming series! Our friendly neighborhood Super Hero decides to join his best friends Ned, MJ, and the rest of the gang on a European vacation. However, Peter’s plan to leave super heroics behind for a few weeks are quickly scrapped when he begrudgingly agrees to help Nick Fury uncover the mystery of several elemental creature attacks, creating havoc across the continent!#SpiderMan #PeterParker #TomHolland #JakeGyllenhaal #Zendaya #Marvel #Sony #Trailer #OfficialTrailer #SamuelLJackson #JonFavreau #CobieSmulders"
"4DOHUzTdS_8","MY REAL AGE | QNA 2019","2019-01-15T13:08:16.000Z","UCj22tfcQrWG7EMEKS0qLeEg","CarryMinati","23","19.16.01","CarryMinati,Carry,Indian,youtuber,#CarryMinati,roast,QnA 2019,Carryminati Qna 2019,bye pewdiepie","2130815","361617","5432","20169","https://i.ytimg.com/vi/4DOHUzTdS_8/default.jpg","False","False","CarryisLive :  https://www.youtube.com/channel/UC0IWRLai-BAwci_e9MylNGwThumbnail: Ritik Singh Snapchat► heyAjeyInstagram► https://www.instagram.com/carryminati/Facebook ► https://www.facebook.com/CarryDeol/Twitter ► https://twitter.com/CarryMinati About CarryMinati : Youthoob certified memberˍˍˍˍˍˍˍˍˍˍˍˍˍˍˍˍˍˍˍˍˍˍˍˍˍˍˍˍˍˍˍˍˍˍˍˍˍˍˍˍˍˍˍˍˍˍˍˍˍˍˍˍˍˍˍˍˍˍˍˍˍˍˍˍˍˍˍˍˍˍˍˍˍˍˍˍˍˍˍˍˍˍˍˍˍˍˍˍˍˍˍˍˍˍˍˍGAME► SOURCE► Disclaimer : DISCLAIMER: Please don't go out of your way to  or hate on anyone I talk about in my videos, this channel is to entertain people and I usually focus on joking about what the people are doing not the individual themselves, please don't go spreading hate it's all for laughs Copyright Disclaimer Under Section 107 of the Copyright Act 1976, allowance is made for fair use for purposes such as criticism, comment, news reporting, teaching, scholarship, and research. Fair use is a use permitted by copyright statute that might otherwise be infringing. Non-profit, educational or personal use tips the balance in favor of fair use.ˍˍˍˍˍˍˍˍˍˍˍˍˍˍˍˍˍˍˍˍˍˍˍˍˍˍˍˍˍˍˍˍˍˍˍˍˍˍˍˍˍˍˍˍˍˍˍˍˍˍˍˍˍˍˍˍˍˍˍˍˍˍˍˍˍˍˍˍˍˍˍˍˍˍˍˍˍˍˍˍˍˍˍˍˍˍˍˍˍˍˍˍˍˍˍˍˍ"
"qeNL9hktKG8","Kadaram Kondan Teaser | Kamal Haasan | Chiyaan Vikram | Rajesh M Selva | Ghibran |","2019-01-15T05:30:47.000Z","UChRi1dpwnsZcIo1LSwzY0Iw","Muzik247","10","19.16.01","Chiyaan Vikram,Vikram Movies,Vikram Hits,Tamil Action Movies,Vikram Films,akshara haasan,Tamil Movies,Tamil Movies 2019,2019 Tamil Films,Latest Tamil Films,Latest Tamil Movies,New Tamil Film Teasers,Latest Tamil Film Teasers,New Tamil Trailers,Latest Tamil Trailers,Ghibran,Kadaram Kondan,kadaaram kondan trailer,kadaaram kondan teaser,kadaram kondan teaser,kadaram kondan first look,vikram new movie,kamal hassan produced movie,Akshara Haasan new movie","3369808","202034","4716","5598","https://i.ytimg.com/vi/qeNL9hktKG8/default.jpg","False","False","Proudly Unveiling the Official Teaser of 'Kadaram Kondan' an  Action Thriller Starring Chiyaan Vikram in the lead, along with Akshara Haasan and Abi Hassan  among others. Produced by Kamal Haasan under the Banner Raajkamal Films International in association with R. Ravindran of Trident Arts.Written and Directed by Rajesh M Selva. Produced by Raajkamal Films International & Trident ArtsWritten and Directed by Rajesh M SelvaMusic and Background Score : GhibranCinematography                        : Srinivas R.GuthaEditor                                          : Praveen K LArt Director                                : Prem NavasOfficial Music Label                 :  Muzik 247🔔 Get alerts when we release any new video. TURN ON THE BELL ICON on the channel! 🔔SUBSCRIBE for more: http://bit.ly/2sw1fP6Connect with us on:♦ YouTube        : http://bit.ly/2sw1fP6♦ Facebook      : https://www.facebook.com/muzik247in♦ Twitter           : https://twitter.com/Muzik247in♦ Instagram     : https://bit.ly/2ixZwA7♦ G+                  : https://bit.ly/1QZtI3c© Muzik247 2019* ANTI-PIRACY WARNING *This content is Copyright to Muzik247. Any unauthorized reproduction, redistribution or re-upload is strictly prohibited from this material. Legal action will be taken against those who violate the copyright of the following material presented!#KadaramKondan #ChiyaanVikram #Ulaganayagan"
"xor-V7Tg9BM","Yajamana | Shivanandi Lyrical Video| Darshan Thoogudeepa | V Harikrishna| Media House Studio","2019-01-15T05:28:15.000Z","UCp8WoMOdQrSSPAJmQTGbNTw","DBeatsMusicWorld","24","19.16.01","dbeats,dbeats kannada,d beats music,DBeats music world,inkem inkem,dboss,darshan thoogudeepa,challenging star,dacchu,pailwaan,bulls,yejamana,Yajamana,yajamana,D50,kiccha sudeepa,kgf,yash,rocking star,salam rocky bhai,petta,rajnikanth,kannada songs,new kannada song,peppy song,trending song,super hit songs,vijay prakash,bahubali,mm keeravani,kaala bhairava","2702392","208983","11410","26470","https://i.ytimg.com/vi/xor-V7Tg9BM/default.jpg","False","False","Watch #Yajamana 's First song #Shivanandi #lyricalvideo . #yajamana is a #NewKannadaMovie starring #Darshan , #RashmikaMandanna, #TanyaHope, #ThakurAnoopSingh, #Dhananjay, #Ravishankar , #SadhuKokila, #MandyaRamesh and others. Yajamana is the 51st movie of Darshan Thoogudeepa.Song Name : #ShivanandiLyrics : Chethan Kumar ( Bahaddur Chethan)Singers : Kaala Bhairava, Santhosh Venky, Shashank Sheshagiri, Chinthan VikasMusic Director : V HarikrishnaProducers : Shylaja Nag & B. SureshaProduction Company : Media House StudioAudio Label : D BeatsCopyright : D Beats 2019#ChallengingStarDarshan#NinthaNodoYajamana#KannadAllaKannada#DBoss#BoxOfficeSulthan#D51"
"wA38GCX4Tb0","Game of Thrones | Season 8 | Official Tease: Crypts of Winterfell (HBO)","2019-01-14T01:59:41.000Z","UCQzdMyuz0Lf4zo4uGcEujFw","GameofThrones","1","19.16.01","Game of Thrones,For The Throne,Season 8,Stark,Lannister,HBO,Final Season,GoT,Dragonstone,Tease,Winterfell,Crypt,Premiere Date,April","16992869","458205","8948","33770","https://i.ytimg.com/vi/wA38GCX4Tb0/default.jpg","False","False","Game of Thrones returns for its final season on April 14. #ForTheThrone"
"3xtntVX3uCM","School PTM | Harsh Beniwal","2019-01-13T13:50:59.000Z","UCVmEbEQUGXHVm-O9pqa3JWg","Harsh Beniwal","23","19.16.01","harsh,beniwal,harsh beniwal,harsh beniwal PTM,harsh beniwal PTM video,PTM video,school PTM,Parents Teacher meeting video,harsh beniwal latest video,harsh beniwal new video,harsh beniwal parents teacher video,harsh beniwal school video,School Ptm,School,PTM,School Dairies,top video,funny video,harsh beniwal comedy video,harsh beniwal comedy,harsh beniwal top video,harsh beniwal popular video,bollywood","5181884","459336","14696","28883","https://i.ytimg.com/vi/3xtntVX3uCM/default.jpg","False","False","Hey Guys we are back with new relatable video ' School PTM'I hope you guys will love this video , Comment down apke parents konse hai ?Official merch - https://humourbeing.comCast Pratishtha SharmaHarsh BeniwalPurav JhaMohit ChhikaraMeghana YadavMayank MishraTared SachdevaShravan        Written byHarsh BeniwalGaurav AroraDirected byAakash Singh SirsaEdited bySarfaraz ZuberDOPNikhil RajvanshiAssociate DirectorNeha SinghArt DirectorMuzammil HayaatCostume StylistPria beniwalColor GradingSarfaraz ZuberThumbnail Muzammil HayaatBackground ScoreAmeen KhanProduction HeadHimanshu SharmaProduction ControllerSunny SharmaSpot BoyShravan PradeepEquipment partnerNazarbattu productionsLocation CourtesySwiss Cottage Schoolhttps://www.swisscottageschool.inSubscribe: https://www.youtube.com/c/TheBrainHumourLike|Share|CommentShow us some love on these platform too.Facebook: https://www.facebook.com/harshbeniwalofficialInstagram: https://www.instagram.com/harshbeniwal/Snapchat: Harshbeniwal"
"PdkL1Aquwb0","FilterCopy | Elder Sister vs. Younger Sister | बड़ी बहन vs. छोटी बहन | Ft. Yashaswini and Ronjini","2019-01-15T07:02:29.000Z","UC7IMq6lLHbptAnSucW1pClA","FilterCopy","23","19.16.01","filtercopy,filter copy,dice,dice media,pocket aces,netlix,prime video,sister,sisters,behen,family,bhai behen,parivaar,fight,sibling fight,sister fight,love,relationship,pyaar,ladai,amit bhadana,bb ki vines,ashish chanchlani,make joke of,beyounick,mostlysane,round2hell,realshit,buzzfeed,tsp,tvf,girliyapa,trending video,funny video,viral video,harsh beniwal","1455751","66650","1358","1924","https://i.ytimg.com/vi/PdkL1Aquwb0/default.jpg","False","False","...but the elder one is everyone's favourite.WRITER AASHISH THANAWALA DIRECTOR PALLAVI KEDIA DOP AJINKYA PANDIT ASSISTANT DIRECTOR AASHISH THANAWALA  CREATIVE PRODUCER NISHAAD JAVERI PRODUCER HITESH PARDESHI  CAST (in alphabetical order) PAROMITA CHATTERJEERONJINI CHAKRABORTYYASHASWINI DAYAMA   EXECUTIVE PRODUCER SANGEETHA RAO LINE PRODUCER  PRACHI JOSHI EDITOR JAICY MATHEW COLOR GRADING ANIRUDDHA PATANKARAJINKYA PANDIT SOUND DESIGN HARSHVARDHAN SINGH SUBTITLING KARTHIK MENON GRAPHICS MANOJ OMRESHREYA SETHIGAURAV JHAMB PIYA PAHWA VIDEO OPERATIONS RAUNAK RAMTEKE  SPOT CHANDAN KUMAR MAKEUP AND HAIR  JANAK THAPA  WARDROBE MAHENDRA R. PRASAD CAMERA ATTENDANT SONU CHAURASIYA  SOUND RECORDIST SOUMITRA KAMILA"
"vOxor1EpDZo","Dhilluku Dhuddu 2 Teaser 02 | Santhanam, Shritha Sivadas | Rambhala | Shabir","2019-01-14T10:28:17.000Z","UCLbdVvreihwZRL6kwuEUYsA","Think Music India","10","19.16.01","tamil songs,latest tamil songs,tamil love songs,tamil movies,tamil evergreen love songs,tamil cinema songs,tamil hit songs,tamil movie songs,tamil,tamil full movies,tamil comedy,songs,tamil love video songs,tamil gana songs,top 50 tamil songs,tamil old songs,tamil jukebox songs,top 10 love songs in tamil,80s tamil songs,new tamil love songs,new release tamil songs,Dhilluku Dhuddu 2 Teaser","2348451","140709","3520","3785","https://i.ytimg.com/vi/vOxor1EpDZo/default.jpg","False","False","#DhillukuDhuddu2 is a Tamil horror comedy movie written and directed by Rambhala. Produced by Handmade films, Dhilluku Dhuddu 2 movie features #Santhanam and Shritha Sivadas in the lead role along with Rajendran, Bipin, and Urvashi in the supporting roles. #Shabir has composed the music for this horror flick. #DhillukuDhuddu2 Crew:Written & Directed by RambhalaDOP - Deepak Kumar PadhyMusic - ShabirEditing - 'Gingee' MadhavanStunt - 'Bad Boy' HaridineshLyrics - Arunbharathi, Gaana Vinoth Choreography - SandyGemini VFX - Harihara SuthanSound Design - Sync CinemaProduction Executive - M.Senthil Stills - K.RajPro - Johnson Designs - ThandoraProject Designer - S.Raj Narayanan Co-Producer - C.Ramesh KumarProduced by - N.SanthanamAudio Label - Think Music© 2018 SPI Music Pvt. Ltd.For All Latest Updates:Subscribe to us on: http://www.youtube.com/thinkmusicindiaSubscribe to us on: http://www.dailymotion.com/thinkmusicindiaFollow us on: https://twitter.com/thinkmusicindiaLike us on: https://www.facebook.com/ThinkmusicofficialFollow us on: https://plus.google.com/+thinkmusicindiaFollow us on: https://www.instagram.com/thinkmusicofficialdhilluku dhuddu 2,dhilluku dhuddu,dhilluku dhuddu 2 official teaser,dhilluku dhuddu 2 teaser,dhilluku dhuddu 2 teaser reaction,dhilluku dhuddu 2 trailer,dhilluku dhuddu full movie,dhilluku dhuddu 2 movie update,dhilluku dhuddu 2 official trailer,dhilluku dhuddu-2,dhilluku dhuddu teaser,dhilluku dhuddu comedy,dhilluku dhuddu full songs,dhillukku dhuddu tamil movie,santhanam fight scene in dhilluku dhuddu"
"xNcABnT2fes","मुजरिम (2019) - Pawan Singh की सबसे बड़ी फिल्म 2019 | रोंगटे खड़े कर  देगी ये फिल्म 2019","2019-01-14T13:30:02.000Z","UCaP6L7U9mq8C3OehlBhwqgg","Bhojpuri Movies","1","19.16.01","पवन सिंह,pawan Singh,pawan Singh 2019,pawan singh bhojpuri movie 2019,pawan singh new movie 2019,pawan singh hd movie 2019,latest bhojpuri movie 2019,pawan movie 2019,hd 2019,new movie 2019,hd movie 2019,pawan singh new hd 2019,bhojpuri film 2019,bhojpuri hd movie 2019,bhojpuri movie 2019,pawan 2019,new bhojpuri movie 2019,pawan singh 2019 hd,2019,hd,pawan bhojpuri film 2019,pawan new 2019 film","4033692","11184","4944","1537","https://i.ytimg.com/vi/xNcABnT2fes/default.jpg","False","False","मुजरिम (2019) - Pawan Singh की सबसे बड़ी फिल्म 2019 | रोंगटे खड़े कर  देगी ये फिल्म 2019 मुजरिम (2019) - Pawan Singh की सबसे बड़ी फिल्म 2019 | रोंगटे खड़े कर  देगी ये फिल्म 2019 मुजरिम (2019) - Pawan Singh की सबसे बड़ी फिल्म 2019 | रोंगटे खड़े कर  देगी ये फिल्म 2019 मुजरिम (2019) - Pawan Singh की सबसे बड़ी फिल्म 2019 | रोंगटे खड़े कर  देगी ये फिल्म 2019"
"3RAcRmlyFqk","Furious Braun Strowman pushes over Mr. McMahon's limousine: Raw, Jan. 14, 2019","2019-01-15T01:58:19.000Z","UCJ5v_MCY6GNUBTO8-D3XoAg","WWE","17","19.16.01","wwe,world wrestling entertainment,wrestling,wrestler,wrestle,superstars,कुश्ती,पहलवान,डब्लू डब्लू ई,मैच,सुपरस्टार,व्यावसायिक कुश्ती,مصارعه,Raw,Braun Strowman,Vince McMahon,Baron Corbin,Elias Samson,sp:ty=high,sp:st=wrestling,sp:scp=athlete_in_match,sp:dt=2019-01-14T20:00:00-04:00,sp:ev=wwe-raw,sp:ath=wwe-brst,sp:ath=wwe-baco,wwe raw highlights,wwe raw,wwe raw results,wwe raw review,wwe monday night raw,royal rumble 2018,royal rumble 2019,braun flips car","3073216","64941","3843","5783","https://i.ytimg.com/vi/3RAcRmlyFqk/default.jpg","False","False","After being punished for tearing the door off Mr. McMahon's limousine, The Monster Among Men further destroys the vehicle by tipping it over.#RawGET YOUR 1st MONTH of WWE NETWORK for FREE: http://wwenetwork.com---------------------------------------------------------------------Follow WWE on YouTube for more exciting action!---------------------------------------------------------------------Subscribe to WWE on YouTube: http://bit.ly/1i64OdTCheck out WWE.com for news and updates: http://goo.gl/akf0J4Find the latest Superstar gear at WWEShop: http://shop.wwe.com---------------------------------------------Check out our other channels!---------------------------------------------The Bella Twins: https://www.youtube.com/thebellatwinsUpUpDownDown: https://www.youtube.com/upupdowndownWWEMusic: https://www.youtube.com/wwemusicTotal Divas: https://www.youtube.com/wwetotaldivas------------------------------------WWE on Social Media------------------------------------Twitter: https://twitter.com/wweFacebook: https://www.facebook.com/wweInstagram: https://www.instagram.com/wwe/Reddit: https://www.reddit.com/user/RealWWEGiphy: https://giphy.com/wwe"
"weaW3Q18Q8w","YOUR Dad Vs MY Dad ... ft. MyMissAnand | #Sketch #Roleplay #Fun #ShrutiArjunAnand","2019-01-15T13:00:14.000Z","UCIsotCCdTjStPCLyD9iBCCQ","Shruti Arjun Anand","26","19.16.01","shruti,shruti anand,shruti arjun anand,shrutiarjunanand,expectation,reality,comedy,vlog,vlogger,hindi blog,expectations,funniest,types of people,mymissanand,vlogs,funny,vloggers,family,miss anand,holi,blogging,anantya,roleplay,types of mom,laugh,kids,your mom vs my mom,skit,fun,sketch,family vlogs,tv serials,real life,blog,types of fathers,your dad vs my dad,types of dads,family vloggers,trending now,types of moms,my miss anand,role play,good vs bad,good,bad","721758","82211","2714","4135","https://i.ytimg.com/vi/weaW3Q18Q8w/default.jpg","False","False","SUBSCRIBE To MyMissAnand - https://goo.gl/urcJ3LSUBSCRIBE To ShrutiArjunAnand - https://goo.gl/Hb3Ka7 Back again with another fun collaboration with my cute little niece #MyMissAnand & this time its gonna be ”YOUR Dad Vs MY Dad” & I am sure you'll love this one as much as I did while filming this & do Share it with your DADs & MOMs ..Saal ka pehla video hai to 2,00,000 LIKES to bante hai yaaro aur haan jaldi se COMMENT karke batao which was your most favourite & relatable sequence?Follow me on INSTA: https://tinyurl.com/ShrutiArjunAnandCAST & CREW:Written By: Shruti AnandCreative Head: Shruti Anand Directed By: Vikram ChoudharyDOP: Om Arora Edited By: Vikram Choudhary Actors: Shruti Anand, Anantya Anand (aka MyMissAnand) CHECKOUT All My AWESOME Channels: SUBSCRIBE To ShrutiArjunAnand - https://goo.gl/1gmCTASUBSCRIBE To ShrutiVlogs - https://goo.gl/00seNeSUBSCRIBE To Anaysa - https://goo.gl/5A2h93SUBSCRIBE To MyMissAnand - https://goo.gl/mnBhXgSUBSCRIBE To CookWithNisha - https://goo.gl/Kep2iSSUBSCRIBE To LafanGAY - https://goo.gl/XRHDrqCamera Credit’s: https://instagram.com/extremepictureimagecreation~ XoXo~ Shruti NEW UPLOADS Tuesday & Friday!▷ CONNECT with us!!♥ ♥ YOUTUBE ♥ ♥ https://www.youtube.com/user/shrutiar...♥ ♥ WEB ♥ ♥ http://www.shrutiarjunanand.com/♥ ♥ INSTAGRAM ♥ ♥ https://www.instagram.com/shrutiarjun...♥ ♥ FACEBOOK ♥ ♥ https://www.facebook.com/shrutiarjuna...♥ ♥ TWITTER ♥ ♥ https://twitter.com/shruti_ilim♥ ♥ SNAPCHAT ♥ ♥ @Shruti_ILIM♥ ♥ BUSINESS INQUIRY ♥ ♥ contactus@shrutiarjunanand.comAUDIO DISCLAIMER/CREDITS –Music from Epidemic Sound (http://www.epidemicsound.com)DISCLAIMER: All products used in my videos, regardless of whether the video is sponsored or not, are the products that I love using unless otherwise stated in case of first impression reviews. The information provided on this channel is for general purposes only and should NOT be considered as professional advice. We are not a licensed professional or a medical practitioner so always make sure you consult a professional in case of need. We always try to keep our channel and its content updated but we cannot guarantee it. All opinions expressed here are our own and we are not compensated by any brand, advertiser, PR representative or affiliate for the same unless explicitly stated in our videos and/or description box. We never try to push products on anyone but we do make recommendations based on our personal experience. All the content published on this channel is our own creative work and is protected under copyright law and in case you need to use our content for any purpose please write to us - contactus@shrutiarjunanand.com *  blogger comedy funniest family channel good vs  hilarious vlogging a day in my life miss anand funy vlogger vloggers new year good vs blogging anantya roleplay how to vlog indian youtuber hindi vlog in real life sketch women's health monthly ylyl chit chat cute letsplay gameplayCategoryHowto & Style trending now"
"TJ_UxUTuHXc","Vinaya Vidheya Rama - MASS HIT - Ram Charan, Kiara Advani | Boyapati Srinu","2019-01-13T06:23:29.000Z","UCumU_6FNxfHXTmeeFCYz6Yw","DVV Entertainment","24","19.16.01","Vinaya Vidheya Rama,Vinaya Vidheya Rama Teaser,Vinaya Vidheya Rama First Look,Vinaya Vidheya Rama Ram Charan,Vinaya Vidheya Rama Telugu Movie,Vinaya Vidheya Rama New Movie,Vinaya Vidheya Rama Latest 2018,VVR 2018,VVR Telugu Movie,Ram Charan VVR Movie,VVR Teaser,Ram Charan,Kiara Advani,Boyapati Srinu,Devi Sri Prasad,Telugu Mass Scenes,Telugu Fights,Vinaya Vidheya Rama Trailer,Vinaya Vidheya Rama Video Songs,Vinaya Vidheya Rama Songs","3224305","35857","6082","2625","https://i.ytimg.com/vi/TJ_UxUTuHXc/default.jpg","False","False","Watch Vinaya Vidheya Rama Family Trailer.. Starring Ram Charan, Kiara Advani, Vivek Oberoi.  #VinayaVidheyaRama, #MASSHIT, #RamCharan, VVR TrailerStory - Screenplay - Direction : Boyapati SreenuProducer : DVV DanayyaMusic : Devi Sri PrasadDOP : Rishi Punjabi - Arthur A Wilson Editing : Kotagiri Venkateswara Rao, ThammirajuArt : A.S.Prakash Stunts : Kanal Kannan Executive Producer - V.Y. Praveen KumarLine Producer : Vijay JagarlamudiCo Producer : Kalyan DVVDigital Partners : Walls & TrendsPRO : Vamsi Kaka, NaniStills : JeevanPublicity : Dhani AelayChief Co Director : Bandi Ramesh - Ravi Nandipati"
