video_id,title,publishedAt,channelId,channelTitle,categoryId,trending_date,tags,view_count,likes,dislikes,comment_count,thumbnail_link,comments_disabled,ratings_disabled,description
"KCwjouq0DbI","Sembaruthi - செம்பருத்தி | Preview | Episode - 374 | 15/01/19 | Zee Tamil","2019-01-15T08:13:24.000Z","UC_wIGmvdyAQLtl-U2nHV9rg","Zee Tamil","24","19.16.01","Sembarathi,Sembarathi zee tamil,Sembarathi full episodes,Sembarathi best scenes,Sembarathi webisodes,sembaruthi today promo,sambarathi latest scnene today,sembarathi today videos,tamil best serial 2018,#tamil serials,zee tamil,zee tamil serials,zee tamil shows,tamil tv serials,tamil tv shows,zee tamil live,watch online free,#drama,Zee tamil entertainment,#Story,zee5","513015","2681","266","135","https://i.ytimg.com/vi/KCwjouq0DbI/default.jpg","False","False","Subscribe & Watch all episodes BEFORE TV: http://bit.ly/2EzC6HuZEE5 Now Available in 190+ Countries, Click Here: http://bit.ly/WatchNowOnZEE5To watch FULL episode of Sembarathi, CLICK here - https://www.zee5.com/tvshows/details/sembarathi/0-6-675Watch Latest Zee Tamil Serials & Shows Full Episodes Online on ZEE5 App. Please Click below to DOWNLOAD the ZEE5 app: - Playstore: https://play.google.com/store/apps/details?id=com.graymatrix.did- iTunes: https://itunes.apple.com/in/app/ozee-tv-shows-movies-more/id743691886Visit our website - https://www.zee5.com For more  Latest Updates Connect with us on Social Media: - Facebook - https://www.facebook.com/ZEE5/ - Instagram - https://www.instagram.com/zee5 - Twitter - https://twitter.com/ZEE5IndiaSembarathi is a Tamil romantic family television series starring Priya Raman, Shabanaa and Karthik in the lead. This is a story of a poor girl Parvathi, whose father works as a driver to Akhilandeshwari, who is rich and arrogant woman. The journey of hardships that Parvathi goes through, after she is married to Adithya, son of Akhilandeshwari, is something you can’t give a miss.#tamil #zeetamil #zeetamilserials #tamilserials #tamiltvserials #tamizhserials #zeeserials #ztamil #tamiltvshow #tamilnadagam #tamilentertainment #tamilcomedy"
"v4929AH5TJM","അമ്മയോളം വരില്ല മറ്റൊന്നും ഈ വീഡിയോ കണ്ടപ്പോൾ ശരിക്കും രോമാഞ്ചം വന്നു | This Mother Amazing","2019-01-15T10:37:40.000Z","UCYKQrn-CZYIoFjF1SKSyyOQ","Media Blasters","22","19.16.01","latest film news,female gossip,star news,movie central,film court,vekkada vedi,malayalam creations,metro matinee,gossips,comedy,entertaiment,music 247,gossip bazaar,Mollywood Gossips,Mollwood Gossips,sony music,new films,new songs,cricket,mohanlal,mammootty,vijay,surya,salmaan khan,amir khan,bahubali,2.0,making video,asianet news live,manorama live,friday film house,Media One,Flowers,Colours","396006","8804","460","412","https://i.ytimg.com/vi/v4929AH5TJM/default.jpg","False","False","Watch അമ്മയോളം വരില്ല മറ്റൊന്നും ഈ വീഡിയോ കണ്ടപ്പോൾ ശരിക്കും രോമാഞ്ചം വന്നു This Mother Amazing"
"HuIb3XTQVJw","Im most handsome 2018! *gamer girls react*","2019-01-14T19:23:51.000Z","UC-lHJZR3Gqxm24_Vd_AJ5Yw","PewDiePie","24","19.16.01","SATIRE,Im most handsome 2018,gamer girls,reaction,react,gamer girls react,most handsome man,pewdiepie,pewds,pewdie,pdp,lwiay,pewdiepie lwiay,pokimane,lords mobile,ads,ad,lords mobile ad,mobile ads,handsome man,most handsome man winner,handsome,gamer girls reaction,gamer,girls,gaming,entertainment","6396479","637034","4878","52588","https://i.ytimg.com/vi/HuIb3XTQVJw/default.jpg","False","False","N E W  M E R C H  : https://represent.com/pewdiepie 🔥 (◡‿◡✿)(For disclosure Im sponsored by Gfuel)Jesus video: https://www.youtube.com/watch?v=3D5pTs3vaxgMobile Strike Girl: https://www.youtube.com/channel/UCgnLAU5wMVHeXVDfNo7DU9AMinecraft Bch Lasagna: https://www.youtube.com/watch?v=yRNSI-y_uIoMost handsome 100 list https://www.youtube.com/watch?v=1UeJcSlVrd0Submit M E M E S: https://www.reddit.com/r/PewdiepieSubmissions/ ༼♥ل͜♥༽ __AD| Shop my headphones: http://rzr.to/edgar__TSUKI: https://tsuki-co-uk.myshopify.com__:::::::My Setup:::::::: (Affiliate links)Chair:: ONLY 399 !USA & Asia: https://usa.clutchchairz.com/product/pewdiepie-edition-throttle-series/Europe: https://europe.clutchchairz.com/en/product/throttle-series-pewdiepie-edition/Canada: https://canada.clutchchairz.com/product/throttle-series-pewdiepie-edition/Elgato green screen: http://e.lga.to/PewDiePie (Affiliate)__:::::::Check out: ::::::::http://store.steampowered.com/app/703840/Animal_Super_Squad/(A game I helped make and affiliated with)__Outro:Animation: https://www.youtube.com/user/jae55555Song: https://www.youtube.com/channel/UC3e8EMTOn4g6ZSKggHTnNng"
"2ovMVK2Rztc","Patas 2 | 14th January 2019 | Full Episode 974 | ETV Plus","2019-01-14T17:01:37.000Z","UCi1m4TnmmXGUIY4roVtvjDA","ETV Plus India","23","19.16.01","etv Plus,etv comedy show,3 Idiots,anchor ravi,Chinnadana Neekosam,express raja,hungama,Kick,Nandini Vs Nandini,Pataas,jabardasth,extra jabardasth,naga babu,roja,anchor anasuya,pove pora,comedy short films,yadamma raju,chalaki chanti,sudigali sudeer,anchor suma,comedy show,anchor sreemukhi,comedy skits in telugu,telugu comedy tracks,racha ravi,allare allari,sardaga kasepu,ejunction,anchor pradeep,pataas punches,anchor vishnupriya,getup srinu","232665","1788","206","196","https://i.ytimg.com/vi/2ovMVK2Rztc/default.jpg","False","False",""
"azf1unuHmb8","అడ్డంగా దొరికిన తలసాని  సస్పెండ్ చేయబోతున్న కెసిఆర్ | Kcr to Suspend Talasani Srinivas Yadav |Taja30","2019-01-15T02:03:01.000Z","UCk_LLcOS5hWWgcMHH87HCNA","Taja30","25","19.16.01","telugu news,telugu live news,taja30,trs,Kcr,అడ్డంగా దొరికిన తలసాని సస్పెండ్ చేయబోతున్న కెసిఆర్,Kcr to Suspend Talasani Srinivas Yadav,trs government,Telangana","103145","641","332","140","https://i.ytimg.com/vi/azf1unuHmb8/default.jpg","False","False","అడ్డంగా దొరికిన తలసాని  సస్పెండ్ చేయబోతున్న కెసిఆర్ | Kcr to Suspend Talasani Srinivas Yadav |Taja30Taja30 channel is a product of www.taja30news.com. In the Ocean of Youtube, Taja30 brings you the quality video content. It mainly focus on Telugu News, Telangana Politics, AndhraPradesh Politics, Telangana Elections, Telugu live news, Telugu Live  of famous Politicians like CM ChandraBabu Naidu, Cm KCR, YS Jagan , Pawan kalyan, Narendra Modi. It covers various Political Party News of TDP Party, Janasena Party, YSRCP Party, BJP Party, TRS Party, Congress Party and most important happeings around the world. To get the updates subscribe to Taja30https://www.youtube.com/channel/UCk_LLcOS5hWWgcMHH87HCNA"
"IPraMQ-jYN8","Extra Jabardasth| 11th January 2019 | Full Episode | ETV Telugu","2019-01-11T18:30:00.000Z","UCnoqvTW4YZExfDeq7_Wmd-w","ETV Jabardasth","22","19.16.01","etv shows,eenadu television,padutha theeyaga,super2,dhee Jodi,jabardasth,extra jabardsth,etv20,etv comedy show,extra jabardasth,naga babu,roja,anchor anasuya,rashmi,dhanraj,chandra,venu,chanti,dhana dhan dhanraj,comedy short films,chamak chandra,chalaki chanti,raghava,rocket raghava,roller raghu,venu wonders,comedy skits in telugu,telugu comedy tracks,allari harish,yedukondalu,racha ravi,adhire abhi,fata fut fun,Rocking rakesh","1856893","7781","1722","756","https://i.ytimg.com/vi/IPraMQ-jYN8/default.jpg","False","False","A comedy show, in which comedians like Sudigaali Sudheer, Chammak Chandra and Hyper Aadi perform side|splitting comedy skits."
"7-4Yrw8_o2A","Dhoni played a strong character role to Kohli's lead role - Harsha Bhogle","2019-01-15T16:22:32.000Z","UCSRQXk5yErn4e14vN76upOw","Cricbuzz","17","19.16.01","Australia vs India,Virat Kohli,MS Dhoni","251514","4233","91","363","https://i.ytimg.com/vi/7-4Yrw8_o2A/default.jpg","False","False","After India levelled the series 1-1 in Adelaide, Harsha Bhogle analyses Kohli's century in yet another run chase, Dhoni the finisher and more, in a chat with Adam Collins. #AUSvsIND #ViratKohli #Dhoni Watch the video on Cricbuzz - https://www.cricbuzz.com/cricket-videos/35151/dhoni-played-a-strong-character-role-to-kohlis-lead-role-harsha-bhogleWatch more cricket videos - https://www.cricbuzz.com/cricket-videosFor more cricket updates and content - https://www.cricbuzz.com/For more updates on cricket follow us on facebook - https://www.facebook.com/cricbuzz/Follow us on twitter to get cricket related news - https://twitter.com/cricbuzz"
"aYcq4YZRzF0","पोट धरून हसाल l कुटे महाराज यांच धम्माल कॉमेडी भारुड l Kute Maharaj Latest Comedy Bharud","2019-01-14T10:30:00.000Z","UCTW7-0x11i8y0vJKWcMr2vQ","Marathi Tadka","24","19.16.01","Marathi Tadka,मराठी तड़का,तुफान विनोदी भारुड,कॉमेडी भारूड,जबरदस्त भारूड,जबरदस्त विनोदी भारूड,भारुड,भारूड,वारकरी भारूड,सोंगी भारूड,मराठी भारूड,तडका भारूड,bharud,marathi bharud,viral marathi bharud,viral bharud,songi bharud,latest bharud,eknatha bharud,pot dharun hasal,hasun hasun pot dukhel,पोट धरून हसाल,हसून हसून पोट दुखेल,कीर्तन,भजन,गजर भक्तीचा,मन मंदिरा,वारकरी संप्रदाय","319845","2343","312","252","https://i.ytimg.com/vi/aYcq4YZRzF0/default.jpg","False","False","पोट धरून हसाल l कुटे महाराज यांच धम्माल कॉमेडी भारुडप्रभाकर महाराज कुटे यांचा मोबाईल नंबर : 9552814727Please Like, Share and Subscribe - Marathi Tadka☛ You tube  :  https://www.youtube.com/c/MarathiTadkaOfficial☛ Facebook :  https://www.facebook.com/marathitadkaOfficial☛ Instagram :  https://www.instagram.com/marathitadkaa☛ Twitter :  https://twitter.com/marathitadkaa☛ Website : http://marathitadka.com/☛ Write us   :  marathitadkateam@gmail.com☛ Whatsapp  :  8100007744Thank You!!"
"gy0lPwRJ73I","Petta Parak Promo | Pongal Special | Tomorrow at 5.30pm | SunTV","2019-01-14T10:09:03.000Z","UCBnxEdpoZwstJqC1yZpOjRA","Sun TV","24","19.16.01","SunTV,SunTvTamizh,Tamil Channel","305865","7049","297","232","https://i.ytimg.com/vi/gy0lPwRJ73I/default.jpg","False","False","Watch all Sun TV Programs on Sun NXT Click: http://bit.ly/SUNTVLIVEWatch 4000+ Movies, 40+ Live TV Channels, TV Shows, Music Videos, Comedy and exclusives on Sun NXT anytime anywhere.Download Sun NXT Now to Enjoy Unlimited entertainment,Android: http://bit.ly/SunNxtAdroidiOS: India - http://bit.ly/sunNXTiOS Rest of the World - http://bit.ly/ussunnxtor Visit https://www.sunnxt.com Follow Us On Our Social Media Links Facebook : https://www.facebook.com/SunTVTwitter : https://twitter.com/SunTVInstagram : https://www.instagram.com/suntv"
"8EuunX-kamk","வட சென்னைக்குப் போகிறார் விஜய் | #508 | Valai Pechu","2019-01-15T12:24:38.000Z","UCRTmSft-1I9f0yzTnz32oMg","Valai Pechu","24","19.16.01","Vijay,Thalapathy Vijay,Thalapathy 63,Vijay 63,A R Murugadoss,Keerthi Suresh,Altee,Viswasam,Thala,Ajith,Ajithkumar,Petta,Rajinikanth,Rajini,Nayanthaya,Suriya,Karthi,Valai Pechu,Valai Pechu Videos","116422","3106","309","637","https://i.ytimg.com/vi/8EuunX-kamk/default.jpg","False","False","வட சென்னைக்குப் போகிறார் விஜய் | #508 | Valai Pechu"
"BV4_GQPUCmI","Papam Pasivallu || Episode 6 || The Sotari Brothers || Wirally Originals","2019-01-15T12:00:00.000Z","UCYhE3LuAdW98CdwoemBsrdA","Wirally","24","19.16.01","wirally,telugu comedy series,telugu web series,web series,wirally web series,Telugu Latest Web Series,Wirally Telugu Web Series,Comedy Web Series,Wirally Telugu Videos,VVP Web Series,Vaddante Vasthave Prema,Vaddante,Vasthave,Prema,Web,Series","106472","2681","87","148","https://i.ytimg.com/vi/BV4_GQPUCmI/default.jpg","False","False","#TamadaMedia #WirallyPowered By Tamada MediaEnjoy and stay connected with us!!Facebook: https://www.facebook.com/WirallyTwitter: https://twitter.com/GoWirally"
"OphrAFCtbTU","సంచలనం చేస్తున్న గీత మాధురి సంక్రాంతి స్పెషల్ సాంగ్ 2019 | Geethamadhuri | Dr PRKGoud | TFCCLIVE","2019-01-13T10:43:41.000Z","UCTJJXy5z-MALmQGcoueZW7g","TFCC LIVE","10","19.16.01","tfcc,tfcclive,geetha madhuri,singer geetha madhuri songs,geetha madhuri sankranti special song,geetha madhuri sankranthi song,geetha madhuri sankranthi song 2019,geetha madhuri songs,tfcc sankranthi songs,sankranthi songs,sankranthi sambaralu 2019,sankranthi muggulu 2019,sankranti,sankranthi special songs,sankranthi hit songs,sankranthi top songs,pongal songs 2019,pongal special songs","730578","4962","1190","400","https://i.ytimg.com/vi/OphrAFCtbTU/default.jpg","False","False","సంచలనం చేస్తున్న గీత మాధురి సంక్రాంతి స్పెషల్ సాంగ్ 2019 | Geethamadhuri | Dr PRKGoud | TFCCLIVE#Geethamadhuri #Dr PRK Goud #TFCCLivePlease Subscribe Our TFCC Channel :  https://goo.gl/8NYqezlatest movies trailers  #https://www.youtube.com/playlist?list=PL4xJjgB-e3XOBPGUV20x5zEqbgar_1SN-latest movies audio release functions #https://www.youtube.com/playlist?list=PL4xJjgB-e3XOBPGUV20x5zEqbgar_1SN-Latest Movie Press Meets #https://www.youtube.com/playlist?list=PL4xJjgB-e3XND4ILvQ10NNh7YkPaI8blhlatest dance video songs #https://www.youtube.com/playlist?list=PL4xJjgB-e3XMJcSwGiRKA93nMP81RitoePrathani Ramakrishna  Goud Videos #https://www.youtube.com/playlist?list=PL4xJjgB-e3XN06pc9baVFT3ZacF0SyoUBpolitical videos #https://www.youtube.com/playlist?list=PL4xJjgB-e3XOnNJVcK_JwZyNR_dZJ7sKLsuccess meets #https://www.youtube.com/playlist?list=PL4xJjgB-e3XMdx0aAM9AGsQMIcv_5D96jinterviews #https://www.youtube.com/playlist?list=PL4xJjgB-e3XMe0Qmi30sclTTOBfZEFTabFollow us on: Website - http://www.tfccrk.comFacebook - https://www.facebook.com/tfccliveTwitter - https://twitter.com/tfccliveInstagram - http://instagram.com/tfcclivePinterest - http://www.pinterest.com/tfccrkTumblr - http://tfccrk.tumblr.com/"
"rrtqMKqvhcw","Simple New  Bhogi Kundala Muggulu ||  Easy Design 15*1 Dots  || Latest || Rangoli & Fashion World","2019-01-13T02:09:52.000Z","UCldsreMxmgAXPTF4fQFePXg","Rangoli & Fashion World","22","19.16.01","blouse designs,bangle designs,simple rangoli design,gold jewellery,easy muggulu,chukkala muggulu,sankranthi muggulu,radham muggulu,kolam,rangoli,designs,telugu muggulu,dots,pongal,bhogi,new year,festival,vinayaka chavithi,chaturdhi,navaratri,dassara,dussara,dewali,deepavali,divali,durgastami,batukamma,siva ratrishivarathri mandana Chowkpurana Alpana Aripana Howk pujan,Golam kolam,easy rangoli,pot kolam,bhogi kundala muggulu,new kolangal","895991","2680","672","138","https://i.ytimg.com/vi/rrtqMKqvhcw/default.jpg","False","False","Latest New Simple Bhogi Kundala Muggulu 1 5 x 1 dots #simple#latest#bhogikundalamuggulu#easyrangoliLike us on Facebook https://www.facebook.com/rangolisujatha/?modal=admin_todo_tour Follow on Twitter :https://twitter.com/rangolifworldYoutube : Subscribe:https://www.youtube.com/channel/UCldsreMxmgAXPTF4fQFePXg"
"RqQkGPhGjUw","Har Ghar Di Kahaani  | ( Full HD ) | Tanishq Kaur Ft. Rahul Jungral | New Punjabi Songs 2019","2019-01-15T04:27:20.000Z","UC9Gjog4enoDWRWTaYuamx1g","Jass Records","10","19.16.01","New punjabi songs 2019,Latest punjabi songs 2019,New punjabi song 2019,Latest punjabi song 2019,punjabi songs,punjabi songs 2019,punjabi songs 2019 latest,punjabi songs 2019 latest this week,punjabi songs latest,punjabi songs new,punjabi songs new 2019,punjabi songs new 2019 this week,new songs,latest songs,newPunjabi,new songs 2019,latest songs 2019,punjabi songs 2019 new,Har Ghar Di Kahaani,Tanishq Kaur,Jass Records","1076166","6302","345","748","https://i.ytimg.com/vi/RqQkGPhGjUw/default.jpg","False","False","Har Ghar Di Kahaani  | ( Full HD  ) | Tanishq Kaur Ft.Rahul Jungral | New Punjabi Songs 2019 | Latest Punjabi Songs 2019 | Jass RecordsSubscribe To Our Channel https://www.youtube.com/user/officialjassrecordsDownload from Tunes  |https://itunes.apple.com/in/album/har-ghar-di-kahaani-single/1449262890Download from Musicout |https://musicout.com/download/Har-Ghar-Di-Kahaani-Tanishq-kaurDownload from Saavn  |https://www.jiosaavn.com/album/har-ghar-di-kahaani/CT7slG4ZGfM_ Download from Hungama |https://www.hungama.com/album/har-ghar-di-kahaani/45983111/Download from Gaana |https://gaana.com/album/har-ghar-di-kahaaniTitle | Har Ghar Di KahaaniSinger | Tanishq Kaurhttps://m.facebook.com/Tanishqkaur1/https://www.instagram.com/tanishqkaur_Ft. | Rahul JungralLyricis & Composition | Arsh BadhniMusic | NixonOnline Promotions By - Kixtix Media & Being Digitalhttps://www.kixtix.inMixing & Mastering | ArronDirector | Mohit Middha  / Puneet S BediVideo By | Frame Singh Producer | Jagjitpal SinghPresentaion | Jasvirpal Singhhttps://m.facebook.com/jasvirpaljassrecords/Publicity Design By | Impressive Design Studio / The Town MediaLabel | Jass recordsfacebook - http://www.Facebook.Com/Officialjassrecordsinstagram :- https://www.instagram.com/jassrecord/twitter :- https://twitter.com/jassrecords1Spl Thanks | Gurinder Singh , Vipen Joshi , Guri Singh Rao , Tejwant Kittu (This Song Is Subject To Copyright of Jass Records)"
"MXKoZs-Koxw","Redmi Note 7 Sale,Samsung S10X 6 Camera's,PUBG Royale Pass 5,Windows 7 Ends,Mi Braided Cable-#738","2019-01-15T14:49:09.000Z","UC8vlDm5xvbxOrCvdu9UNOiA","Techno Ruhez","28","19.16.01","Redmi Note 7 Sale,redmi note 7,samsung s10 x,samsung galaxy s10 5g,pubg royale pass season 5,pubg,pubg mobile tricks,windows 7 ends,windows 7 tricks,Mi Braided Cable,techno ruhez,unboxing,india,hindi,tech news,technology,review,daily tech updates,tech news daily,best tech news,top tech news,technews,latest tech news,latest,latest updates,trick,online,daily news,hindi news,jio latest news,5g india,news","71116","9371","190","649","https://i.ytimg.com/vi/MXKoZs-Koxw/default.jpg","False","False","Hello Everyone Welcome To My Daily Tech News # 738My New Non-Tech Channel : https://goo.gl/vL0mh2News Covered :Redmi Note 7 Sale,Samsung S10X 6 Camera's,PUBG Royale Pass 5,Windows 7 Ends,Mi Braided Cable--------------------------------------------------------------------------------------------------Intro & Background Music : ‘Music by Epidemic Sound http://www.epidemicsound.com-----------------------------------------------------------------------------------------------Follow and Like my Page on Facebook: https://www.facebook.com/technoruhezFollow me on google plus: https://plus.google.com/+TechnoruhezFollow me on twitter: https://twitter.com/AmreliaRuhezFollow me on Instagram: https://www.instagram.com/technoruhez/Do Leave A Like And Subscribe For More Awesome Videos Like This DailyFor Business Enquiries: technoreviewww@gmail.com------------------------------------------------------------------------------------------------------My Gears Camera - Canon 200D : https://amzn.to/2BH97hSMonitor - AOC : https://amzn.to/2IWI9ovLight - https://amzn.to/2ISWcLVMic - https://amzn.to/2vguiY3My Laptop : http://fkrt.it/AlnD4LuuuNTechno Ruhez Channel ki Madad Kijiye aur Niche diye gaye link se Purchase KijiyeFlipkart : http://fkrt.it/vOdVL2NNNNAmazon : https://amzn.to/2GYuqx2-----------------------------------------------------------------------------------------------------NOTE : All content used is copyright to Techno Ruhez, Use or commercial display or editing of the content without proper authorization is not allowed"
"pxFlY6lZLB4","#राधाकृष्ण | कृष्ण का गोपादेवी रूप","2019-01-14T17:34:19.000Z","UCCy2rLnGdwoJcSAtixNdsPQ","STAR भारत","22","19.16.01","Star,Star Bharat,Radha Krishn,Prem ki Pariksha,Sumedh,Mallika,राधाकृष्ण,राधावतार,प्रोमो,शो प्रोमो","301441","5906","106","343","https://i.ytimg.com/vi/pxFlY6lZLB4/default.jpg","False","False","राधा मिलन की चाह में कृष्ण स्वयं बन रहे हैं राधा!देखिए कृष्ण का अद्भुत रूप,राधाकृष्ण,15 से 19 जनवरी, रात 9 बजे, सिर्फ़ STAR भारत पर!  #राधाकृष्ण | #RadhaKrishn"
