video_id,title,publishedAt,channelId,channelTitle,categoryId,trending_date,tags,view_count,likes,dislikes,comment_count,thumbnail_link,comments_disabled,ratings_disabled,description
"F39OH1gqE4w","Stan & Ollie reviewed by Mark Kermode","2019-01-11T15:29:25.000Z","UCCxKPNMqjnqbxVEt1tyDUsA","kermodeandmayo","1","19.17.01","Jon S. Baird,John C. Reilly,Steve Coogan,Shirley Henderson,Nina Arianda,Rufus Jones,Stan & Ollie,Kermode and Mayo’s Film Review,BBC,5live","103970","1132","38","327","https://i.ytimg.com/vi/F39OH1gqE4w/default.jpg","False","False","Mark Kermode reviews Stan & Ollie. Stan Laurel and Oliver Hardy, late in their careers and far from their heyday, embark on a live tour of the UK as they prepare to make a new film in England.Please tell us what you think of the film -- or Mark’s review of the film. We love to include your views on the show every Friday.If you like this, why not subscribe to our podcast for more reviews, interviews and general wittering of the highest order: https://www.bbc.co.uk/programmes/b00lvdrj/episodes/downloadsTwitter: @Wittertainmenthttp://www.bbc.co.uk/5liveFridays at 2pm on BBC 5 live."
"s8hW4bzMx8E","BHAD BHABIE feat. Tory Lanez Babyface Savage (Official Music Video) | Danielle Bregoli","2019-01-10T19:50:06.000Z","UC7rVvFP90pl7tAtPsVIhfww","Bhad Bhabie","10","19.17.01","danielle bregoli,cash me ousside,cash me outside,dr phil,how bow dah,catch me outside,catch me ousside,hi bich,watch know,watch now,these hoes,Danielle Bregoli Song,music,new music,hip hop,hi bitch video,new danielle bregoli,gucci flip flops,Trust Me,Bhad Bhabie,15,Mixtape,15 Mixtape,tory lanez,babyface savage,torey lanez,baby face savage,drop a lil check","6976586","360732","37256","41334","https://i.ytimg.com/vi/s8hW4bzMx8E/default.jpg","False","False","Stream Babyface Savage feat. Tory Lanez now at https://Atlantic.lnk.to/BabyfaceSavageAY 👼🗜⚔️My debut mixtape 15 OUT NOW 👉https://atlantic.lnk.to/15ID !  📀🐕 Watch “Gucci Flip Flop Remix” feat. Snoop Dogg & Plies 👉 https://youtu.be/Phh6U8ezy-4🔊 Stream “Gucci Flip Flop REMIX” feat. Snoop Dogg & Plies ⏯ https://Atlantic.lnk.to/GucciFlipFlopsRemixID⚙️Geek'd up💰music video 🚔 feat. Lil Baby 👉 https://youtu.be/66h5dGoQ1IU🥇WaTch “Yung And Bhad” feat. City Girls (Official Audio) ➡️ https://youtu.be/uzWbo-F09RE👂🏻StrEam Yung And Bhad  feat. City Girls⏯ https://Atlantic.lnk.to/yungandbhadID❶❺ StReAm 15 (INTRO) freestyle 👉https://youtu.be/yN5Gmwrly5o👀 WaTcH “Trust Me” music video ➡️ https://youtu.be/459G-8RtOa4🤫 “Trust Me” lyric video ⏯ https://youtu.be/8Opipibemf8❓Stream ”Trust Me” ➡️ https://Atlantic.lnk.to/trustmeID🔥 “Gucci Flip Flops” music video ⏯ https://youtu.be/tsp7IOr7Q9A⛵️StReAm ”Gucci Flip Flops” ⏯ http://Atlantic.lnk.to/gucciflipflops👋🏻 🐩HI BICH REMIX ➡️  https://youtu.be/M1fKcktiPuk👜STREAM Hi Bich Remix ➡️  https://Atlantic.lnk.to/HiBichRemix🚙BOTH OF EM music video ➡️   https://youtu.be/G4MtkhJehhk🚓STREAM Both Of Em➡️ https://atlantic.lnk.to/BothOfEm👯‍♀️I GOT IT music video ➡️   https://youtu.be/WlZu4RmD_oU💵STREAM I Got It ➡️  https://lnk.to/IGotIt🏆MAMA DON'T WORRY MUSIC VIDEO➡️   https://youtu.be/Ku-WC1EaPXI 🖤 STREAM Mama Don't Worry (Still Ain't Dirty) ➡️   https://lnk.to/MamaDontWorry👋🏻Hi Bich / Whachu Know music video ➡️     https://youtu.be/1NyMSWqIJDQ 🚨STREAM Hi Bich ➡️   https://Atlantic.lnk.to/hibich  🖤💀🎤🔥 🔥STREAM Whachu Know ➡️  https://Atlantic.lnk.to/whachuknow↘️➡️FOLLOW BHAD BHABIE ⬅️↖️https://bhadbhabie.com/MERCH - https://bhadgoods.comInstagram- https://www.instagram.com/bhadbhabieTwitter- https://twitter.com/BhadBhabieFacebook- https://www.facebook.com/realbhadbhabie/YouTube- https://Atlantic.lnk.to/BhadBhabieSubscribeSnapchat- http://drop.lk/BhadBhabieSnapSpotify - https://open.spotify.com/artist/7DuTB6wdzqFJGFLSH17k8e?si=9zwVLVKsTIyWIcfAZyjJdwSoundcloud- https://soundcloud.com/bhadbhabie"
"BQ4urlTdSUI","Try Not To Eat Challenge - Simpsons Food | People Vs. Food","2019-01-10T20:00:01.000Z","UCHEf6T_gVq4tlW5i91ESiWg","REACT","24","19.17.01","Try Not To Eat Challenge,the simpsons,simpsons,try not to eat,simpsons food,homer simpson,Try Not To Eat Challenge - Simpsons Food,people vs food,vs food,react,reaction,thefinebros,fine brothers,fine brothers entertainment,finebros,fine bros,fbe,laugh challenge,try not to laugh,try to watch without laughing or grinning,react gaming,do they know it,staff reacts,lyric breakdown,poker face,the 10s,guess that,PvF1908","2889746","60573","2809","6804","https://i.ytimg.com/vi/BQ4urlTdSUI/default.jpg","False","False","Simpsons food tried by Adults. SUBSCRIBE & HIT THE 🔔. New Videos 12pm PT on REACT: http://fbereact.com/SubscribeREACTWatch More from React: http://fbereact.com/REACTallepisodesWatch More from FBE: http://fbereact.com/FBEallreactepisodesJoin us LIVE on FBE2 every Tuesday and Friday at 3pm PST.Sign Up for Our Newsletter: http://fbereact.com/infoFBE’s goal is to credit the original links to the content featured in its shows. If you see incorrect or missing attribution please reach out to credits@fbeteam.comReactors Featured:Aryhttps://www.instagram.com/prettyseed/Danielhttps://www.instagram.com/masterdoo/Emilyhttps://www.youtube.com/emilytangerineJameshttps://www.instagram.com/react_james/Jimhttps://twitter.com/MrDeCoyoteJonathanhttps://www.instagram.com/jonnotthin/Sergiohttps://www.instagram.com/_sergiodelatorre/Shanthttps://www.instagram.com/shantgoorjian/Torihttps://www.instagram.com/justxtori/MERCH 👕 https://www.shopfbe.comFollow FBE:FBE WEBSITE: https://fbeteam.com/FBE: http://www.youtube.com/FBEREACT: http://www.youtube.com/REACTFBE2: https://www.youtube.com/FBE2FBELive: https://www.youtube.com/fbeliveFACEBOOK: http://www.facebook.com/FBEFACEBOOK: http://www.facebook.com/FBEShowsTWITTER: http://www.twitter.com/fbeINSTAGRAM: http://www.instagram.com/fbeSNAPCHAT: https://fbereact.com/snapchatDISCORD: https://fbereact.com/FBEdiscordTWITCH: https://www.twitch.tv/fbeliveAMAZON: https://www.amazon.com/v/FBEROKU: http://fbereact.com/FBERokuXUMO: https://fbereact.com/xumoSEND US STUFF:FBEP.O. BOX 4324Valley Village, CA 91617-4324Executive Produced by Benny Fine & Rafi FineHead of Post Production - Nick BergtholdDirector of Production - Levi SmockProducer - Katie HarperProduction Coordinator - Alberto AguirreAssistant Production Coordinator - Kristy KieferStudio Technician - Sam KimJr. Studio Technicians - Jayden RomeroProduction Assistant - Stefan FiorEditor - Karen RivasPost Supervisor - Emily McGuinessThumbnail Graphics - Brynn Shuller & Lindsey KindtSet Design - Melissa JudsonGraphics & Animation - Will HylerChef - Bryan AchayTheme Music - Cyrus Ghahremani“A Lovely Night” by Josh Molen (http://www.TheTunePeddler.com)© FBE, IncTry Not To Eat Challenge - Simpsons Food | People Vs. Food"
"TJ2yVoK7Kj8","Film Theory: The Spiderman 2 Mystery! Why Spiderman Lost His Powers!","2019-01-10T20:06:16.000Z","UC3sznuotAs2ohg_U__Jzj_Q","The Film Theorists","1","19.17.01","spiderman,peter parker,marvel,spider-man,spider man into the spider verse,spiderman 2,spiderman far from home,spiderman far from home trailer,infinity war spiderman,spiderman fortnite,spider-man far from home,spider-man into the spider-verse,spider-man far from home trailer,spider man,avengers infinity war spiderman scene,spiderman ps4,spider-man ps4,film theorists,film theory,matpat,film theory spiderman,film theory marvel","3493838","112163","7217","17094","https://i.ytimg.com/vi/TJ2yVoK7Kj8/default.jpg","False","False","SUBSCRIBE for More Film Theories! ► http://bit.ly/1dI8VBHSpiderman is DEAD! ►► https://bit.ly/2AEv4P0Venom is the VICTIM! ► https://bit.ly/2Co1aPhWe've seen a lot of Spider-Man lately. Spider-Man: Into The Spider-Verse, Spider-Man: Homecoming, and soon Spider-Man: Far From Home. Before that we saw Andrew Garfield slinging webs with Emma Stone for a couple movies, but I want you to think FURTHER back. That's right, I'm talking Tobey Maguire Spider-Man. Remember how at the end of his first movie EVERYTHING had gone wrong? Norman Osborn - the Green Goblin - was gone, his best friend was fatherless, Uncle Ben did what all Uncle Ben's do, etc.. It was all very sad. In Spider-Man 2, we see a Spider-Man without his powers. I want to talk about WHY he lost his powers. What made our friendly, neighborhood Spider-Man just plain, old Peter Parker? Need Royalty Free Music for your Content? Try Epidemic Sound.Get A 30 Day Free Trial Now! ► http://share.epidemicsound.com/FilmTh...#Spiderman #PeterParker #Marvel #Spiderman2 #IntoTheSpiderVerse #SpiderVerse #TobeyMaguire  #FilmTheoryMORE FILM THEORIESThanos Was RIGHT! ► https://youtu.be/3eQP6JoxtKk Ant Man's GIANT Problem  ► https://bit.ly/2L2pxZaSpiderman is DEAD! ►► https://bit.ly/2HpyASIMarvel's Ant-Man Could KILL Us All! ►► https://bit.ly/2HtsDjLDid Deadpool WRITE Deadpool?!? ► https://bit.ly/2HtAq17Like the theme song and remix for this episode? Thanks to CARF! https://www.youtube.com/user/carfmobileSOCIAL MEDIA:Twitter: @MatPatGTFacebook: facebook.com/GameTheoristsInstagram:  instagram.com/matpatgtCredits:Writers: Matthew Patrick and Zach StewartEditors: Alex Sedge Sedgwick, Marc Schneider,  and Mat4yoSound Editor: Yosi BermanSources:https://www.ncbi.nlm.nih.gov/pmc/articles/PMC1414693/https://www.sciencedirect.com/science/article/abs/pii/S1755296615000022https://europepmc.org/abstract/med/17725082https://www.tandfonline.com/doi/abs/10.1080/16506073.2014.916745https://adaa.org/understanding-anxiety/posttraumatic-stress-disorder-ptsd/symptoms"
"3E78T8h5EhA","Post Malone & Swae Lee - Sunflower","2019-01-10T05:09:46.000Z","UCeLHszkByNZtPKcaVXOCOQQ","Post Malone","10","19.17.01","posty,post,post malone,congratulations,hip hop,rap,white iverson,Swae Lee,Sunflowerr,Spider-Man,Spider-Verse,Spider-Man: Into The Spider-Verse,spiderr verse,spider man,spider man into the spider verse song,rae sremmurd","9322981","323982","4287","15789","https://i.ytimg.com/vi/3E78T8h5EhA/default.jpg","False","False","Sunflower is the #1 hit-single from the official soundtrack album Spider-Man™: Into the Spider-Verse. Get the song here: https://postmalone.lnk.to/sunflowerYDGet more Spider-Verse music here, like a limited edition 7-inch vinyl, cassette or LP picture-disc: https://postmalone.lnk.to/sunflowerYD/artiststoreThe single re-teams Post Malone & Swae Lee after the two joined forces for “Spoil My Night” from the year’s biggest multi-platinum album, beerbongs & bentleys.For more info on Post Malone:http://www.postmalone.comhttps://instagram.com/postmalonehttps://twitter.com/postmalonehttps://facebook.com/postmaloneFor more info on Swae Lee:https://instagram.com/swaeleehttps://twitter.com/goSwaeLeehttps://facebook.com/swaeleeFollow Spider-Man™: Into the Spider-Verse:https://www.facebook.com/SpiderVerseMoviehttps://www.twitter.com/SpiderVersehttps://instagram.com/SpiderVerseMoviePhil Lord and Christopher Miller, the creative minds behind The Lego Movie and 21 Jump Street, bring their unique talents to a fresh vision of a different Spider-Man Universe, with a groundbreaking visual style that’s the first of its kind. Spider-Man™: Into the Spider-Verse introduces Brooklyn teen Miles Morales, and the limitless possibilities of the Spider-Verse, where more than one can wear the mask.Cast: Shameik MooreHailee SteinfeldMahershala AliJake JohnsonLiev SchreiberBrian Tyree HenryLuna Lauren VelezLily TomlinNicolas CageJohn MulaneyKimiko Glenn©2018 Columbia Pictures Industries, Inc. All Rights Reserved. MARVEL and all related character names© & ™ 2018 MARVEL#PostMalone #SwaeLee #Sunflower #IntoTheSpiderVerse #SpiderMan #Marvel #MilesMorales"
"Rslps0Yxbdw","I made a Catapult Toaster, CATCH","2019-01-10T16:00:07.000Z","UCp68_FLety0O-n9QU6phsgw","colinfurze","2","19.17.01","colinfurze,toaster,catapult,invention,slingshot,amazing,funny,making of,how to,building,wallace and gromit,fallout,fallout76,vaultboy","792989","56293","453","3614","https://i.ytimg.com/vi/Rslps0Yxbdw/default.jpg","False","False","How far does your Toaster chuck!!!Subscribe for more crazy inventions projects and builds http://bit.ly/2I6f0bv Follow me on Social Media to see what I'm up to before the video is releasedInstagram https://www.instagram.com/realcolinfurze/Twitter https://twitter.com/colin_furzeFacebook https://www.facebook.com/Colin-furze-521680751253584MusicThe 1st and 2nd tracks are by 21 Taras 1sr track is called Sleep Softly and 2nd The Ego and the Universe more on them herehttps://21tarasband.bandcamp.com/https://www.21tarasband.com/https://twitter.com/21TarasBandhttps://www.instagram.com/21tarasband/https://www.youtube.com/channel/UCgC0BYNIG1KDsqGoiu1iQoAThe Last Track is called Street Rat and is by Bedspin more on them here http://bedspin.bandcamp.comIn a band? Want your music on my videos! Send your tracks to furzemail@yahoo.co.uk as all music on this channel is from viewers#invention #furze #toasterpult"
"hEM5TKzUI8Q","The Oscars Jokes Kevin Hart Would Have Told","2019-01-10T08:45:00.000Z","UCMtFAi84ehTSYSE9XoHefig","The Late Show with Stephen Colbert","24","19.17.01","The Late Show,Late Show,Stephen Colbert,Steven Colbert,Colbert,celebrity,celeb,celebrities,late night,talk show,comedian,comedy,CBS,joke,jokes,funny,funny video,funny videos,humor,hollywood,famous","2991236","31274","5231","7282","https://i.ytimg.com/vi/hEM5TKzUI8Q/default.jpg","False","False","'The Upside' star Kevin Hart tries out the material he was preparing for the Oscars ceremony.Subscribe To The Late Show Channel HERE: http://bit.ly/ColbertYouTubeFor more content from The Late Show with Stephen Colbert, click HERE: http://bit.ly/1AKISnRWatch full episodes of The Late Show HERE: http://bit.ly/1Puei40Like The Late Show on Facebook HERE: http://on.fb.me/1df139YFollow The Late Show on Twitter HERE: http://bit.ly/1dMzZzGFollow The Late Show on Google+ HERE: http://bit.ly/1JlGgzwFollow The Late Show on Instagram HERE: http://bit.ly/29wfREjFollow The Late Show on Tumblr HERE: http://bit.ly/29DVvtRWatch The Late Show with Stephen Colbert weeknights at 11:35 PM ET/10:35 PM CT. Only on CBS.Get the CBS app for iPhone & iPad! Click HERE: http://bit.ly/12rLxgeGet new episodes of shows you love across devices the next day, stream live TV, and watch full seasons of CBS fan favorites anytime, anywhere with CBS All Access. Try it free! http://bit.ly/1OQA29B---The Late Show with Stephen Colbert is the premier late night talk show on CBS, airing at 11:35pm EST, streaming online via CBS All Access, and delivered to the International Space Station on a USB drive taped to a weather balloon. Every night, viewers can expect: Comedy, humor, funny moments, witty interviews, celebrities, famous people, movie stars, bits, humorous celebrities doing bits, funny celebs, big group photos of every star from Hollywood, even the reclusive ones, plus also jokes."
"LGjRto8eaPg","Delusional Owner Thinks He Gets The Same Produce As The White House | Kitchen Nightmares","2019-01-09T17:00:02.000Z","UCUZzyuAlhHNP3oiuMjn7RfQ","Kitchen Nightmares","24","19.17.01","Gordon Ramsay kitchen nightmares,Gordon Ramsay best insults,kitchen nightmares full episodes,kitchen nightmares online,kitchen nightmares watch online,kitchen nightmares HD,kitchen nightmares best moments,Gordon Ramsay,Kitchen Nightmares","4020666","35369","1261","4982","https://i.ytimg.com/vi/LGjRto8eaPg/default.jpg","False","False","And micro carrots for garnish? If you liked this clip check out the rest of Gordon's channels:http://www.youtube.com/gordonramsayhttp://www.youtube.com/thefwordhttp://www.youtube.com/kitchennightmaresMore Gordon Ramsay:Website: http://www.gordonramsay.comFacebook: http://www.facebook.com/GordonRamsay01Twitter: http://www.twitter.com/GordonRamsay"
"xl0Wzw3OyBo","#MostHated S1 X Lottie Jade  - Number One (Prod By JB104) [Music Video] Link Up TV","2019-01-09T20:03:30.000Z","UCz7h6Eshwht37ryP7up2NmQ","Link Up TV","10","19.17.01","linkuptv,link,up,tv,thelinkup.com,tim,westwood,1xtra,djvlad,ukf,grime,free,freestyle,hip-hop,rap,city,hiphop,pacman,mixtapes,music,video,urban,degree,hosting,claim,credit,donate,insurance,loans,mortgage,london,uk,sbtv,grm,grimedaily,sb.tv,jumpoff,charlie,sloth,spiff,dontflop,p110,jdzmedia,grimereport,zane,beats,mobo,big,shaq,stormzy,hus,Drake,Behind,Barz,Behindbarz","207968","7929","643","848","https://i.ytimg.com/vi/xl0Wzw3OyBo/default.jpg","False","False","👉 SUBSCRIBE & ENABLE 🔔 for more: http://goo.gl/cBSDnP📱 INSTALL our UK mixtapes APP for iOS & Android: http://splt.cc/lutv➡️ Visit our website for the latest videos: http://splt.cc/thelinkupFACEBOOK: http://goo.gl/vDzP6 -- TWITTER: http://goo.gl/ZvbkKBrowse Our Online Shop: http://goo.gl/IkVjZX- - - - - - - - - - - - - - - - - - - - - - - - - - - - - - - - For enquiries visit our website or see email list below:Advertising Enquiries - advertising@linkuptv.co.ukMixtape Promotion - mixtapes@linkuptv.co.ukVideo Production - production@linkuptv.co.ukUpload your video to our YouTube Channel - http://goo.gl/rd1UTzAppear On Freestyle Show - freestyle@linkuptv.co.uk- - - - - - - - - - - - - - - - - - - - - - - - - - - - - - - -If you believe this video breaches your copyright, please direct your DMCA related emails to enea@linkuptv.co.uk"
"aZoBDIRP1KQ","James McAvoy & Jennifer Lawrence Play The Circle Game! | The Graham Norton Show CLASSIC CLIP","2019-01-09T17:00:02.000Z","UC4PziMH5MvvsmqM0VCZTy-g","The Graham Norton Show","24","19.17.01","Graham Norton,Graham Norton Show Official,Chat Show,the Graham Norton show,Graham Norton new,Graham Norton full episode,Graham Norton 2018,Graham Norton 2017,graham norton,graham norton full episodes,graham norton 2018,graham norton 2019,james mcavoy,jennifer lawrence,james mcavoy graham norton,james mcavoy graham norton jennifer lawrence,james mcavoy graham norton full episode,jennifer lawrence graham norton,jennifer lawrence graham norton full","722821","7413","194","584","https://i.ytimg.com/vi/aZoBDIRP1KQ/default.jpg","False","False","James McAvoy will be back this week!Subscribe for weekly updates: http://www.youtube.com/subscription_center?add_user=officialgrahamnorton"
"Qq-MBEexMGM","MY CRATE OF TOOLS ARRIVED!!!","2019-01-10T01:38:11.000Z","UCWizIdwZdmr43zfxlCktmNw","Alec Steele","24","19.17.01","alec steele,alex steele,steel,alec,damascus,blacksmith,make,forge,anvil,mill,lathe,weld,tig,mig,engineering,blacksmithing,blade,bladesmithing,knife,knifemaking,sword,handmade,diy,craft,woodworking,forged in fire,axe,fabrication,art","495621","21608","253","2570","https://i.ytimg.com/vi/Qq-MBEexMGM/default.jpg","False","False","GET T-SHIRTS: http://alecsteeleshop.com/FOLLOW ON INSTAGRAM: https://www.instagram.com/alecsteele/LEARN BLACKSMITHING ONLINE: http://beginblacksmithing.com/PATREON: https://www.patreon.com/alecsteeleMUSIC:Epidemic Sound - https://goo.gl/iThmfx - signing up at this link supports the show! ------------------------------------------------AMAZON AFFILIATE LINKS TO GEAR I LIKE: --------------CAMERA + MAIN LENS: http://amzn.to/2CrLyYPWIDE LENS: http://amzn.to/2CsAZouTRIPOD: http://amzn.to/2GpBX7fMIC: http://amzn.to/2CrBmiQSD CARD: http://amzn.to/2sF0i7gCOMPUTER: http://amzn.to/2C4i0ooBEST HAND CREAM http://amzn.to/2Bz4tnLLOTS OF SHARPIES: http://amzn.to/2CsDwyRFAVOURITE PEN: http://amzn.to/2Ho4jQIWELDING HOOD + POWERED RESPIRATOR: http://amzn.to/2ENWV2EGRINDING HELMET + POWERED RESPIRATOR: http://amzn.to/2EKsSZIGRINDING HELMET (works with both powered respirators, buy plenty disposable screen protectors): http://amzn.to/2F9aZRUHALF MASK RESPIRATOR (BEST ON MARKET): http://amzn.to/2HoFqV9FILTERS: http://amzn.to/2FaSLzpEARMUFFS FOR HELMET: http://amzn.to/2Hq0IkTGLOVES I LIKE TO GRIND IN: http://amzn.to/2HlsNdnEARMUFFS: http://amzn.to/2Byqza0---------------------------------------------------------Instagrams: Alec: @alecsteele Will: @will_stelter Jamie (editor): @jamie.popplehttps://www.patreon.com/alecsteeleINSTAGRAM @alecsteeleFACEBOOK PAGE  https://www.facebook.com/alecsteelebl...SNAPCHAT @ALEC-STEELEMy name is Alec Steele and I am a 20 year old blacksmith from Norfolk in the United Kingdom, now living in Montana in the USA! I upload a vlog from my day at the workshop almost every single day. Lots of sparks, lots of making, lots of fantastic-ness. Great to have you here following along!What do I make? LOTS of Damascus steel, knives, swords, axes and more and of course, I always love hearing your suggestions for future projects in the comments below!So if you want to see lots of forging fun, blacksmithing badassery, cinematic hammering and more in my Daily Vlog - please subscribe here by hitting that red button! FACEBOOK PAGE  https://www.facebook.com/alecsteelebl...INSTAGRAM @alecsteeleSNAPCHAT @ALEC-STEELEMUSIC - goo.gl/iThmfx signing up at this link supports the show! Alec Steele Blacksmith 2018"
"Ht0SjXultSc","Has FENTY Done It Again?! Pro Filt'r Concealer & Setting Powder Review | Jackie Aina","2019-01-09T20:26:57.000Z","UCzJIliq68IHSn-Kwgjeg2AQ","Jackie Aina","26","19.17.01","fenty beauty,fenty concealer swatches,fenty setting powder,fenty setting powder review,pro filt'r instant retouch setting powder,pro fllt'r setting powder,pro filt'r instant retouch concealer,pro filt'r concealer,pro filter concealer fenty,rihanna makeup line","1186413","71658","1818","5065","https://i.ytimg.com/vi/Ht0SjXultSc/default.jpg","False","False","Hey babes! So today we will be discussing and reviewing Fenty's new Pro Filt'r Concealer and Pro Filt'r Instant Retouch setting powder. Let's see if she's really worth all the hype! Today's video is done in partnership with Fenty Beauty! P R O D U C T S  M E N T I O N E D:Pro Filt'r Concealer http://bit.ly/2Riq2SMPro Filt'r Setting Powder http://bit.ly/2Cfe6a6C O N N E C T  W I T H   M E:instagram: @jackieainasnapchat: jackieainafacebook: Jackie Ainatwitter: @jackieainaB U S I N E S S:For business inquiries please contact jackie@rare.global*Some affiliate links are used, which means I may receive a commission should you decide to click that link and make a purchase. My content is 100% not influenced by brands, PR products received, usage of affiliate links, or brand partnerships.Changing the standard of beauty, one tutorial at a time :)Phil 4:13"
"qQ4bLGfQfxQ","Twins Only Say YES To Each Other For A Day","2019-01-08T21:00:27.000Z","UCITqR49EAUY8i1vZtXTwe-A","Dolan Twins","23","19.17.01","Dolan,Twins,Grayson Dolan,Ethan Dolan,Saying yes for a day,say yes","6883031","497752","8691","44703","https://i.ytimg.com/vi/qQ4bLGfQfxQ/default.jpg","False","False","We tried to fix our brotherly arguing problem but idk if it worked :/SUBSCRIBE -  https://www.youtube.com/user/TheDolan...Last Week's Video - https://www.youtube.com/watch?v=P2VvfzJYNps&t=651sMerch - https://dolantwins.comEthan’s StuffINSTAGRAM - https://instagram.com/ethandolan/TWITTER - https://twitter.com/EthanDolanSNAPCHAT - EthanDolanGrayson’s ThingsINSTAGRAM - https://instagram.com/graysondolan/TWITTER - https://twitter.com/GraysonDolanSNAPCHAT - GraysonDolan"
"SM0_bORHaas","Carmen de la Salciua si Susanu - Paraseste-ma te rog [oficial video] 2019","2019-01-09T09:58:45.000Z","UCt7Prw97_jb8oAlKnO3oVcQ","Nek Music Tv","10","19.17.01","carmen de la salciua,susanu","2602847","54854","3053","2081","https://i.ytimg.com/vi/SM0_bORHaas/default.jpg","False","False","Subscribe to NekMusic:http://www.youtube.com/user/nekmusicproductionMuzica SusanuText SusanuOrchestratie SusanuVideoNekMusic onlinehttps://www.youtube.com/user/nekmusicproductionhttps://www.facebook.com/nekmusicproductionhttp://www.nekmusic.ro/Nek Music Production ® . Contact:nekmusic.ro@gmail.comToate drepturile sunt rezervate. Orice upload neautorizat al acestui videoclip este ilegal si poate fi raportat oricand la Youtube. All rights reserved. Unauthorized reproduction is a violation of applicable laws. In order to avoid copyright infringement, please do not upload this video on your channel."
