video_id,title,publishedAt,channelId,channelTitle,categoryId,trending_date,tags,view_count,likes,dislikes,comment_count,thumbnail_link,comments_disabled,ratings_disabled,description
"1OnX5akenrM","अंजना ओम कश्यप के शो में मोदी Vs गठबंधन पर जोरदार बहस EXCLUSIVE| News Tak","2019-01-14T14:56:05.000Z","UCAUNFgpgVisKPL3yq_-Nj-Q","News Tak","25","19.16.01","hindi news,news video,latest news,“newstak,news”,channel”,“news”,“,newstak”,news tak,news tak channel,newstak channel,news videos,news videos in hindi,news tak newstak,news tak india,news tak live,newstak live,newstak india,newstak exclusive,news tak exclusive,news tak videos,newstak videos,exclusive news tak videos,exclusive newstak videos,news tak today,news tak official,newstak official,newstak aajtak,news tak aaj tak","310705","2497","728","2119","https://i.ytimg.com/vi/1OnX5akenrM/default.jpg","False","False","यूपी में अखिलेश और मायावती ने गठबंधन कर गजब की चुनावी गर्मी पैदा कर दी है, असंभव दिखने वाली दोस्ती आज लखनऊ में हकीकत बनती दिखी. यूपी  में एसपी-बीएसपी ने गठबंधन की गुत्थी सुलझाते हुए साथ-साथ चलने का फैसला कर लिया है और ये 2019 में बीजेपी की राह का सबसे बड़ा रोड़ा साबित होने वाला है. वीडियो में देखिए गठबंधन पर कैसे दोनों खेमों से वार-पलटवार हो रहे हैं. Akhilesh-Maya coalition has changed the dimension of the elections. In Lucknow, Akhilesh and Mayawati turned into friends from foe. In Uttar Pradesh, clearing all the doubts related to coalition, Akhilesh Yadav and Mayawati have decided to walk together for 2019 general elections. This coalition is going to be the biggest hurdle of the BJP, in 2019 general elections. Watch this video to witness how both the sides are doing attacks-counter attacks on each other over the coalition....About News Tak (न्यूज़ तक):न्यूज़ तक (news tak) आपको देता है ख़बरों का बिल्कुल नया अंदाज । 40 सेकंड के छोटे गरमा-गरम वीडियो तो हैं ही साथ में न्यूज़ तक (news tak) के यू ट्यूब प्लेटफॉर्म पर आपको मिलेंगे दिलचस्प और EXCLUSIVE इंटरव्यू, वो भी अनकट..यहां आपको मिलेगा न्यूज़तक (news tak) स्पेशल, न्यूज़ तक (news tak) LIVE और भी बहुत कुछ। राजनीति, बॉलीवुड, देश-विदेश हर तरह की ख़बरों से जुड़े मनोरंजक वीडियो के लिए देखिए सिर्फ न्यूज़ तक (news tak)। क्या है वायरल होने वाले वीडियो की सच्चाई? ख़बर में ऐसा क्या था खास जो आप नहीं देख पाए? कोई भी ख़बर वायरल होने से पहले आप तक पहुंचाएगा न्यूज़ तक (news tak) । हर रोज दिलचस्प और गरमा-गरम वीडियो के लिए सब्सक्राइब कीजिए न्यूज़ तक (news tak)। ये है न्यूज़तक (news tak) का Official Channel.News Tak is the most revolutionary and credible news channel on YouTube. News Tak brings news to you in an innovative VOD style that is set to capture and satiate your thirst for NEWS. This is the most credible source of Live videos that bring to you PC done by all political parties. From exclusive interviews to politics, bolly & Viral videos, anything and everything that is happening around the world is on News Tak. We ensure that the truth behind viral videos reaches you.We save you from rumours. This is the most reliable source of news that you can rely on. Subscribe to the official channel of News Tak here.You can follow News Tak on:News Tak Youtube: https://www.youtube.com/newstakNews Tak Facebook: https://www.facebook.com/newstakofficialNews Tak Twitter: https://twitter.com/newstakofficialNews Tak Instagram: https://www.instagram.com/newstakofficial/"
"D9mzeresviI","School Picnic | RishhSome","2019-01-15T15:17:21.000Z","UCz6l7YPnfyxvbVD7LVuNEow","Rishhsome","23","19.16.01","rishhsome,vines,rishabh rana,rishabh,funny,laugh,delhi,india,popular indian,funny videos,desi vines,dumb,dumbest,cute,desi popular,picnic,school,backbencher,harsh beniwal,school ptm,trending,school bus,rishome,rishisome,rishomme,rishabh puri,mayank bhardwaj,nostalgia,adventure,student,teacher,pti,water park,amusement park,classroom,friends,love,romance,fight,kids,madam,sports,vedio","301497","32703","1606","1746","https://i.ytimg.com/vi/D9mzeresviI/default.jpg","False","False","*SMOKING AND DRINKING ARE INJURIOUS TO HEALTH*The story of every school picnic. How backbenchers used to behave vs how the frontbenchers used to behave. Also we have shown a love angle between PTI and a teacher. Ride the rolercoaster of nostalgia and share with your friends.Managed By FameGameBusiness: rishhsome@famegame.in🔥⚡️WATCH LIT GIRL: https://www.youtube.com/watch?v=H9fFd... ⚡🔥Cast:Rishabh Ranahttps://www.instagram.com/rishhsome/Shiva Sharmahttps://www.instagram.com/shiva.sharm...Sakshi Chaudharyhttps://www.instagram.com/sakshi.chaudhary/Anushka Sharmahttps://www.instagram.com/reel_anushka/VarnikaLucky Sharmahttps://www.instagram.com/badla_hua_naam/Chetan Jangrahttps://www.instagram.com/jangra_1/Himanshu Gaurhttps://www.instagram.com/doctor_strangest/Vikram Bhuihttps://www.instagram.com/vikramamar/Rishabh PuriMayank BhardwajSrishti VaidRhea MehtaDirector:Rishabh RanaScript Writers:RishabhShivaLuckyDOP:Priyanshu VatsPost Production Head:Ankit Motgharehttps://www.instagram.com/bhot_shi_ankit/Post Production Assistant:Aarav Yadavhttps://www.instagram.com/aaravydv96/Graphics:Vijay KumarSocial Media:Mayank MishraSound and Lights:KamalLocation Courtesy:Shri Ram Shiksha Mandir School, ZindpurAdventure Island, RohiniManaged By FameGameBusiness: rishhsome@famegame.in"
"EitqHxbEhBs","Nenjam Marappathillai | 14th to 18th January 2019 - Promo","2019-01-14T04:52:51.000Z","UCvrhwpnp2DHYQ1CbXby9ypQ","Vijay Television","24","19.16.01","Star,Star Vijay TV,Vijay TV,Vijay,Redefining Entertainment,தமிழ்,விஜய்,டிவி,தொலைக்காட்சி,Tamil TV,Tamil Shows,AmithBhargav,Nisha,Saranya,NenjamMarappathillai,நெஞ்சம் மறப்பதில்லை,hotstar,promo,newfiction","856452","8357","665","506","https://i.ytimg.com/vi/EitqHxbEhBs/default.jpg","False","False","#AmithBhargav #Nisha #Saranya #fiction #VijayTV #VijayTelevision #StarVijayTV #StarVijay #TamilTV #RedefiningEntertainment நெஞ்சம் மறப்பதில்லை I திங்கள் முதல் வெள்ளி வரை இரவு 8:30 மணிக்கு உங்கள் விஜயில்.. Click here http://www.hotstar.com/tv/nenjam-marapathillai/15382 to watch the show on hotstar.."
"pU8ZwGKRCJg","देखिये,हार के बाद बोखलाया ऑस्ट्रेलियाआई कप्तान और धोनी पर भड़कते हुए कह डाली दिल देहला देने वाली बात","2019-01-15T16:12:43.000Z","UC2h1GsM_Ls1Cg6M-Mk42UYQ","Sports Edge","17","19.16.01","india vs australia,virat kohli,ms dhoni,kohli in press confrence,kohli on dhoni,ipl,ipl 2019,world cup 2019,finch on dhoni,finch press confrence after losing 2nd odi,aaron finch on losing 2nd odi,aaron finch on dhoni after losing in 2nd odi,aaron finch angry on dhoni,aaron finch,aaron finch interview,sports edge,sports edge cricket news,sports edge cricket channel","477845","14865","1917","568","https://i.ytimg.com/vi/pU8ZwGKRCJg/default.jpg","False","False","Download The App-https://play.google.com/store/apps/details?id=com.edge.rajaksw.edgenewsदेखिये,हार के बाद बोखलाया ऑस्ट्रेलियाआई कप्तान और धोनी पर भदकते हुए कह डाली दिल देहला देने वाली बात#indiawon2ndodi #msdhoni #finchSubscribe SPORTS EDGE NEWS For Latest Cricket News and Videos...YouTube: https://www.youtube.com/c/SportsEdge007COPYRIGHT DISCLAIMER_Copyright Disclaimer Under Section 107 of the Copyright Act 1976, allowance is made for fair use for purposes such as criticism, comment, news reporting, teaching, scholarship, and research. Fair use is a use permitted by copyright statute that might otherwise be infringing. Non-profit, educational or personal use tips the balance in favour of fair use."
"xhGnNugsBFk","AADAT SE MAJBOOR || HUNNY SHARMA || Feat :- Arshad warsi Fraud Saiyyan","2019-01-14T07:47:05.000Z","UCrZAk8NGdX_poApOHyhKjzA","HUNNY SHARMA","23","19.16.01","HUNNY SHARMA,SHUBHAM,SHARMA,HUNNY SHARMA NEW VIDEO,DORAEMON,DESI,DESI DORAEMON,HUNNY SHARMA DESI DOREMON,TIME MACHINE,part3,ultiduniya,parllelworld,FRUAD SAIYYAN,ARSHAD WARSI,NEW VIDEO,FEAT ARSHAD WARSI","775517","66185","2116","2189","https://i.ytimg.com/vi/xhGnNugsBFk/default.jpg","False","False","CHECKOUT MY LATEST VIDEO :- https://youtu.be/rdXI9YIwakwFollow me also on :-Instagram - https://www.instagram.com/HUNNYSHARMA02Facebook - https://www.facebook.com/HUNNYSHARMADirected by :- MOHIT KUSH & SAQIB KHAN No Offence Video is Just for Entertainment Purpose. Video By - Hunny sharma -----------------------------------------------------------------Disclaimer - This video is just for Fun and making you all laugh. I make video only to entertain people and make them laugh . People don't get offended by video . Because it is just for the purpose of entertainment . Disclaimer:Please don't go out of your way to or hate on anyone I talk about in my videos, this channel is to entertain people and I usually focus on joking about what the people are doing not the individual themselves, please don't go spreading hate it's all for laughs Copyright Disclaimer Under Section 107 of the Copyright Act 1976, allowance is made for fair use for purposes such as criticism, comment, news reporting, teaching, scholarship, and research. Fair use is a use permitted by copyright statute that might otherwise be infringing. Non-profit, educational or personal use tips the balance in favor of fair use. Thank You Soo much.....!!!"
"ySzwFVwRVbg","EDUCATION SYSTEM IN INDIA | Feat. Emraan Hashmi & LUL | Aashqeen","2019-01-14T14:04:37.000Z","UCc3b8uaQNySMagDbHsm52Tg","Aashqeen","23","19.16.01","aashqeen,ashqin,ashqeen funny,comedy video,emraan hashmi,why cheat india,lul,harsh beniwal,be younick,cheat india movie,dil mein ho tum,daaru wargi guru randhawa","740054","68251","1953","2941","https://i.ytimg.com/vi/ySzwFVwRVbg/default.jpg","False","False","What happens when Lul meets Emraan Hashmi? And how their meeting is revolving around our Education System? Watch the full video and see what happens next.#AashqeenFollow Me On Instagram @AashqeenLink : https://www.instagram.com/aashqeen/?h...Also Hit LIKE and Do COMMENT.SHARE this video & SUBSCRIBE the channel for more videos.Cast :AashqeenEmraan HashmiRiyaz AshrafRaman JainKeshav ToshiniwalDOP :Lakhan Verma : https://www.instagram.com/soni.lakhanShubhamEditing :Lakhan VermaTamilMake-up Artist: Prabhat GiriSpecial Thanks to RVCJ : https://www.youtube.com/user/RajnikantVsCIDJokeLocation Courtesy : Hacker Space, NoidaAbout the Movie:Gulshan Kumar and T-series films present in association with Emraan Hashmi Films and Ellipsis Entertainment. An Ellipsis Entertainment and Emraan Hashmi Films Production.Presenting the Official trailer of the upcoming movie of 2019 WHY CHEAT INDIA, The movie features Emraan Hashmi and Shreya Dhanwanthary in the lead roles. The upcoming movie is written and directed By Soumik Sen , Produced by Bhushan Kumar, Krishan Kumar,Tanuj Garg ,Atul Kasbekar & Parveen Hashmi. Co-Producers are Vinod Bhanushali, Sunny Khanna, Shanti Sivaram Maini, Swati Iyer Chawla, Piya Sawhney.The film Releasing On ►  18 January 2019Come Connect with me on:Facebook: https://www.facebook.com/aashqeen1/Twitter: https://twitter.com/aashqeen1"
"oTu72o6R1BI","UNLIMITED FUN: DD Roasts VJ Ashiq | Dhivyadharshini Handbag Secrets Revealed!","2019-01-15T12:34:27.000Z","UCSbUX_gKMur5FPcTbH2L5mA","Galatta Tamil | கலாட்டா தமிழ்","24","19.16.01","Dhivyadharshini,dd handbag secrets,behindwoods ashiq,vj ashiq handbag,vj ashiq whats inside your handbag,galatta tamil handbag,handbag secret revealed,dd handbag secrets revealed,dd rost vj ashiq,vj ashiq and dd,dd interview,dd interview about her divorce,dd interview with nayanthara,dd interview with vijay,dd,vijay tv,koffee with dd,whats inside my handbag tamil,handbag secrets,behindwoods ashiq interview,vj ashiq handbag aishwarya,behindwoods vj ashiq","245599","5089","327","590","https://i.ytimg.com/vi/oTu72o6R1BI/default.jpg","False","False","Voting page for BOFTA-Galatta Film Debut Awards: https://www.galatta.com/galatta_debut_award_2018/UNLIMITED FUN: DD Rosts VJ Ashiq | Dhivyadharshini Handbag Secrets Revealed!  Stay tuned to Galatta Tamil for latest updates on Cinema and Politics. Like and Share your favourite videos and Comment your views too. Subscribe to GALATTA TAMIL : http://goo.gl/J4TyOo#DDhandbag #20YearsOfDDAlso, Like and Follow us on:Facebook: https://www.facebook.com/GalattaMediaTwitter: https://twitter.com/galattadotcomWebsite: http://www.galatta.comInstagram: https://www.instagram.com/stories/galattadotcom/"
"8tAF4zQEvz0","CAN WE MAKE THIS HAPPEN ?","2019-01-14T10:00:00.000Z","UCNn6AaHharXIbkRleXGboiQ","Mumbiker Nikhil","22","19.16.01","blogs,vlog,mumbiker,nikhil,iit bombay,mumbai,india,audi,qatar,doha,travel,sony,triumph tiger,jio,airtel,iphone xs,food,youtube,youtube india,trending","646446","52185","1530","3978","https://i.ytimg.com/vi/8tAF4zQEvz0/default.jpg","False","False","Riding for 27 hours : https://goo.gl/UPj3UiMy Merch : https://labelmn.com/SHOP MY MIVI DEVICES : https://www.mivi.in/mn2019Additional Discount Coupon Code: MN2019"
"8MuS1EPZ_5U","Never Stop Learning. Feat. Nawazuddin Siddiqui | MostlySane | Thackeray","2019-01-15T12:01:14.000Z","UCvCyIiKSCA1fHKSCOKJyjXA","MostlySane","23","19.16.01","Nawazuddin Siddiqu,Thackeray,mostly sane,intreview,Shiv Sena,Amrita Rao,biopic,conversation with nawazuddin,mumbai,shiva shena chief,thackeray dailogues,thackeray trailer,thackeray movie promotion,real talk tuesday,nawazuddin intreview,viacom,question & answer,thackeray nawazuddin,shiv sena supremo","265687","28094","419","1771","https://i.ytimg.com/vi/8MuS1EPZ_5U/default.jpg","False","False","Click here to Subscribe :- http://bit.ly/PrajaktaKoliHey guys so here's Nawazuddin Siddiqui unplugged as he sat down with me for a conversation. A big thank you for him being so awesome. Be sure to watch Thackeray in cinemas on 25th January. Watch the Trailer for Thackeray :- http://bit.ly/Thackeray_OfficialTrailer#Thackeray #NawazuddinSiddiqui #MostlySaneLink To My Blog - https://mostlysane.inLike me on Facebook @ https://www.facebook.com/MostlySaneOfficialFollow me on Twitter @ https://twitter.com/iamMostlySane Follow me on Instagram @ https://instagram.com/MostlySane Email me at :- iammostlysane@gmail.com Digitally Powered by One Digital Entertainment [https://www.facebook.com/onedigitalentertainment][http://www.onedigitalentertainment.com]You can write to me and send me letters here - 407-411 Standford Plaza, Off Lokhandwala Link Road, Next to Orritel Hotel, Andheri West, Mumbai, Maharashtra 400053"
"tEVCy-ImRuA","Kumkum Bhagya - Episode 1276 - Jan 15, 2019 | Preview | Download ZEE5 App Now","2019-01-15T09:32:56.000Z","UCppHT7SZKKvar4Oc9J4oljQ","Zee TV","24","19.16.01","kumkum bhagya latest episode,zee tv,kumkum bhagya today full episode,kumkum bhagya full episode today,kumkum bhagya full episode,Kumkum Bhagya,kumkum bhagya last episode,kundali bhagya zee tv,kumkum bhagya serial,kumkum bhagya serial full episodes,kumkum bhagya today episode,zee tv serial,zee tv show,hindi serial,hindi tv show,kumkum bhagya watch online,abhi,pragya,tanu,romantic drama serial,28 september 2018","368058","1740","130","93","https://i.ytimg.com/vi/tEVCy-ImRuA/default.jpg","False","False","To watch FULL episode of Kumkum Bhagya, CLICK here - https://www.zee5.com/tvshows/details/kumkum-bhagya/0-6-127/episodesKumkum Bhagya' is a show following the life of a Punjabi matriarch Sarla Arora who runs a marriage hall and lives with the hope of seeing her two daughters Pragya and Bulbul who're poles apart, happily married some day.Pragya, the elder daughter, who is practical, hardworking and committed to supporting her family though she's barely finished her own studies, she teaches at a college to ensure that her mother Sarla's meager earnings from the 'Kumkum Bhagya' marriage hall never fall short in making the two ends meet. In the midst of all this pressure on her, she's forgotten how to unwind or pursue any passions of her own. Bulbul, the younger daughter who has her head in the clouds. She's vivacious, smart, stylish and a complete dreamer. It barely occurs to her to snap out her own make-believe, rose-tinted world and be of any real use to her family. The show takes us through the lives of the 2 sisters, their hopes dreams and aspirations.Simultaneously runs the story of Abhi who is Rockstar with a cult following of his own and Suresh, the college professor who works closely with Pragya. Having led a tough life in the military and lost most of his close ones, he is an embittered soul with much angst and pent-up frustration about life....The feel of your language is in your entertainment too! Watch your favourite TV shows, movies, original shows, in 12 languages, because every language has a super feel!To Feel ZEE5 in Your Language, DOWNLOAD the app now ZEE5 Now available in 190+ countries. Click Here http://bit.ly/WatchNowOnZEE5- Playstore: https://play.google.com/store/apps/details?id=com.graymatrix.did- iTunes: https://itunes.apple.com/in/app/ozee-tv-shows-movies-more/id743691886Visit our website - https://www.zee5.com Connect with us on Social Media: - Facebook - https://www.facebook.com/ZEE5/ - Instagram - https://www.instagram.com/zee5 - Twitter - https://twitter.com/ZEE5India"
"t1-sh2myc8g","Bithiri Sathi Acts As Sankranthi Haridasu And Basavanna | Sankranthi Festival | Teenmaar News | V6","2019-01-14T16:02:36.000Z","UCDCMjD1XIAsCZsYHNMGVcog","V6 News Telugu","25","19.16.01","Bithiri Sathi,Sankranthi Haridasu,Sankranthi Basavanna,Bithiri Sathi As Haridasu,Bithiri Sathi As Basavanna,Sankranthi Festival,teenmaar bithiri sathi,teenmaar news,v6 teenmaar news,teenmaar sathi,v6 teenmaar,v6 sathi,v6 savitri,teenmaar,bithiri sathi v6 news,telangana news,sathi videos,teenmaar latest video,teenmaar videos,V6 News,V6 Live News,Telangana News,V6 Telugu News,V6 Youtube,Breaking news,Telugu Live TV,V6news.tv,v6telugu live tv","786357","6964","690","546","https://i.ytimg.com/vi/t1-sh2myc8g/default.jpg","False","False","Bithiri Sathi Acts As Sankranthi Haridasu And Basavanna | Sankranthi Festival | Teenmaar News | V6 NewsSubscribe Youtube at http://goo.gl/t2pFrqFacebook : http://www.facebook.com/V6News.tvVisit our Website : http://V6news.tvTwitter : https://twitter.com/V6NewsV6 Velugu Telugu Daily News Paperhttp://epaper.v6velugu.com/V6 News Popular ProgramsWatch V6 #TeenmaarNewshttps://goo.gl/aMw2Q7Watch V6 Good Morning Telangana Special Debatehttps://goo.gl/5ft6Vp6PM Special Bulletin on Telanganahttps://goo.gl/xbm4ev10PM Special Bulletin on Hamara Hyderabadhttps://goo.gl/YYseoG#V6News, Official YouTube V6 News Channel owned by #VILMedia #Pvt #Ltd.V6 News Telugu #LiveTV, a 24 Hour Telugu News #Broadcaster, dedicated to report News across Telangana and other parts of the #World through live #Reports,#BreakingNews, #Sports updates, #Weather Reports, #Entertainment, #Business Trends, Exclusive #Interviews,  and #CurrentAffairs.The channel Airs programs like #TeenmaarNews, #TelanganaTheertham, #CinemaTalkies, #BithiriSathi Satires etc'.#Movies,#Technology."
"26Zp59g3Fws","Ind vs Aus 2nd ODI : Dhoni ने छक्का मारकर जीता दिया मैच, सब रह गए हैरान | Headlines Sports","2019-01-15T12:38:30.000Z","UCPACfH7u4cAD2APtM_7TJZQ","Headlines Sports","17","19.16.01","Virat Kohli,Ms Dhoni,Dhoni VsKartik,Kartik Vs Dhoni,India Vs Australia,Australia Vs India,2nd Odi,India Vs Australia 2nd Odi,India Win,Australia Loss match","130289","2409","357","104","https://i.ytimg.com/vi/26Zp59g3Fws/default.jpg","False","False","#ViratKohli #MsDhoni #HeadlinesSportsInd vs Aus 2nd ODI : Dhoni ने छक्का मारकर जीता दिया मैच, सब रह गए हैरान🔊 LIKE ➡ SHARE ➡ SUBSCRIBEPlease subscribe the channel and you will get new video notification next time. Here is the subscription link:https://www.youtube.com/channel/UCPACfH7u4cAD2APtM_7TJZQShare This Video : Follow Us With FacebookFacebook:- https://www.facebook.com/Headlinessports/"
"RZ6nRRmnuNs","मकर संक्रांति Mahakumbh Mela 2019 Special सोमवार शिवजी माँ गंगा के भजन I Shiv Bhajan, Ganga Bhajan","2019-01-14T00:30:08.000Z","UCaayLD9i5x4MmIoVZxXSv_g","T-Series Bhakti Sagar","10","19.16.01","t-series bhakti sagar,top devotional song,bhakti songs,ganga bhajans,ganga bhajan songs,ganga bhagirathi,goddess ganga aarti,devi bhajan,har har gange,ganga aarti,anuradha paduwal ganga bhajans,maano to main गंगा मैया में जब तक,मानो तो मैं गंगा माँ हूँ,ganga,devotional songs,mata,monday morning shiv bhajans,morning shiv bhajans,mahakumbh,triveni,gaya,prayag,महाकुम्भ,महाकुंभ,मेला,makar sankranti,sakranti,kumbh,mela,2019,महाकुंभ 2019,allahabad kumbh mela 2019","1200385","5364","1240","754","https://i.ytimg.com/vi/RZ6nRRmnuNs/default.jpg","False","False","Subscribe: http://www.youtube.com/tseriesbhaktiHar Har Mahadev Shivji 00:00Ganga Ki Har Mauj Mein Maine 7:40Om Jai Gangadhar Aarti 14:04Mann Ko Paawan Kardo Ganga 23:14Ganga Amritwani 29:06Har Har Gange 33:53Gange Namami 41:19Ganga Aarti 49:16Ganga Ki Mahima Apaar 53:26Music Label: T-SeriesShiv Bhajan: Har Har Mahadev ShivjiSinger: Anuradha Paudwal Music Director: Shekhar Sen Lyricist: Pt. Gyanchand Shastri Album: Ganga Lahari Shiv Bhajan: Ganga Ki Har Mauj Mein Maine Shiv Ki Moorat Dekhi HaiSinger: Hariharan Music Director: Surinder Kohli Lyricist: Balbir Nirdosh Album: Chal Kaanwariya Shiv Ke DhamShiv Bhajan: Aarti (Om Jai Gangadhar Har)Singer: Anuradha Paudwal Lyricist: Bharat Acharya Album: Shri Shiv Mahimn Stotram, Shri Shiv Tandav Stotram Ganga Bhajan: Mann Ko Pawan Kar Do Ganga Singer: Anuradha Paudwal Music Director: Manishankar Lyricist: Pt Kiran Mishar Album: Mahakumbh MahimaGanga Bhajan: Ganga Amritwani Singer: Anuradha Paudwal Music Director: Surinder Kohli Lyricist: Balbir Nirdosh Album: Ganga AmritwaniGanga Bhajan: Har Har Gange Har Har Gange Hey Bhagirathi Hey Gange Singer: Anuradha Paudwal Music Director: Nikhil-Vinay Lyricist: Traditional Album: Ganga MaaGanga Bhajan: Gange Namami NamamiSinger: Anuradha Paudwal Music Director: Nikhil-Vinay Album: PAAVAN HARIDWAR MAHAKUMBHGanga Bhajan: Om Jai Gange Mata Singer: Anuradha Paudwal  Lyricist: Saral Kavi Album: Maa Gange Patit PaawniGanga Bhajan: Ganga Ki Mahima Apaar Singer: Anuradha Paudwal, Kavita Paudwal Music Director: Surinder Kohli Lyricist: Shrikant Mishra Album: Ganga Maiya Var DeIf You like the video don't forget to share with others & also share your views.Stay connected with us!!!► Subscribe: http://www.youtube.com/tseriesbhakti► Like us on Facebook: http://www.facebook.com/tseriesbhaktisagar► Follow us on Twitter: https://twitter.com/tseriesbhaktiFor Spiritual Voice Alerts, Airtel subscribers Dial 589991 (toll free) To set popular Bhakti Dhun as your HelloTune, Airtel subscribers Dial 57878881"
