video_id,title,publishedAt,channelId,channelTitle,categoryId,trending_date,tags,view_count,likes,dislikes,comment_count,thumbnail_link,comments_disabled,ratings_disabled,description
"EHdSLrqYlno","Sembaruthi Today Full Episode 15.01.19 ஆதி கையில் கிடைத்த ஆதாரம்","2019-01-15T05:58:46.000Z","UCu37EYTCokmDZhxFAQ5prGA","Apple TV","22","19.16.01","Sembaruthi Today Full Episode 15.01.19,Sembaruthi Serial 15/01/2019 today Review,sembaruthi serial today episode 15/01/2019,sembaruthi serial today Jan-15,sembaruthi serial,sembaruthi serial full episode,sembaruthi serial today promo,sembaruthi serial promo,sembaruthi serial episode 15.01.19,sembaruthi serial latest episode,sembaruthi,sembaruthi serial today full episode,sembaruthi serial today episode live,zee tamil sembaruthi,sembaruthi serial today episode","93599","734","66","61","https://i.ytimg.com/vi/EHdSLrqYlno/default.jpg","False","False","#sembaruthi#zeetamil#sembaruthipromoCredits - zee tamilSembaruthi Today Full Episode 15.01.19 ஆதி கையில் கிடைத்த ஆதாரம் __செம்பருத்தி ஆதியை பற்றிய 10 சுவாரஸ்ய தகவல்கள் :https://youtu.be/DYoU-nMFVJwsubscribe and support : https://www.youtube.com/channel/UCu37EYTCokmDZhxFAQ5prGAFAIR-USE COPYRIGHT DISCLAIM* Copyright Disclaimer Under Section 107 of the Copyright Act 1976, allowance is made for fair use for purposes such as review, criticism, commenting, news reporting, teaching, scholarship, and research. -This video has no negative impact on the original works (It would actually be positive for them)-This video is also for entertaining purposes.-It is not transformative in nature.-I only used bits and pieces of fair use image to get the point across where necessary.We make these videos with the intention of entertaining others. #tamilnadu#tamilspeedy#sembaruthitoday#sembaruthitodayepisode#zeetamilsembaruthi#shabanasembaruthi#sembaruthiserialreview------------------------------------------------------------------------------------------------------------THANK YOU ALL"
"Wzp6JU4gK3Q","Honor View 20 Unboxing & Overview with Punch Hole Camera!","2019-01-14T08:43:21.000Z","UCO2WJZKQoDW4Te6NHx4KfTg","Geekyranjit","28","19.16.01","honor view 20 unboxing,honor view 20 india,honor view 20,honor view 20 camera,honor view 20 review,geekyranjit,honor magic,honor puch hole","223052","7643","288","977","https://i.ytimg.com/vi/Wzp6JU4gK3Q/default.jpg","False","False","Honor View 20 is a premium smartphone by Honor it's powered by the flagship Kirin 980 SOC it has a 6.4 IPS LCD Screen with a punch hole 25MP front facing camera and also has a 48MP rear camera comes with 6/8GB RAM and 128/256 GB storage and I give you an overview and also some camera samples.Honor View 20 will be sold in India via https://amzn.to/2Rslucj"
"Yv-nPSjIoR0","Fun Bucket JUNIORS | Episode 83 | Kids Funny Videos | Comedy Web Series | By Sai Teja   TeluguOne","2019-01-14T10:50:05.000Z","UCXjhJbviBl0M4JAC3cxDXqA","TeluguOne","23","19.16.01","fun bucket juniors,TeluguOne,fun bucket,telugu comedy web series,kids comedy,fun bucket gullu comedy,kids jokes,telugu funny comedy jokes,fun bucket jaswica,fun bucket ammu comedy,teluguone comedy web series,student jokes,father and daughter jokes,brothers jokes telugu,teacher and students jokes,fun bucket juniors jokes,brother and sister jokes,comedy web series,ammu and trishool jokes,daughter and father joke,children jokes telugu,teluguone comedy","132199","1772","155","249","https://i.ytimg.com/vi/Yv-nPSjIoR0/default.jpg","False","False","Watch Fun Bucket Juniors Episode 83 Kids Telugu Comedy Videos / Funny Videos 2019 directed by Sai Teja Produced by Ravi Shankar Kantamneni. #FunBucketJuniors #TeluguOne #FunBucketJuniorsJokes #KidsComedyTeluguFun Bucket JUNIORS | Episode 82 - https://youtu.be/FHrGVLrHV4oBEST OF FUN BUCKET JUNIORS Vol 10 - https://youtu.be/67HtIwaz4hwFun Bucket Juniors Episode 81 - https://youtu.be/rG0EnqvGrtkBEST OF FUN BUCKET JUNIORS Vol 9 - https://youtu.be/CEIk_AYArWsFun Bucket Juniors Episode 80 - https://youtu.be/HnI8KeMeQ1UBEST OF FUN BUCKET JUNIORS Vol 8 - https://youtu.be/-ztobsc_gOUFun Bucket Juniors Episode 79 - https://youtu.be/OWUzyR0FBBkBEST OF FUN BUCKET JUNIORS Vol 7 - https://youtu.be/AZv33H-kyMMFun Bucket Juniors Episode 78 - https://youtu.be/VGwDUZvLILQFun Bucket Juniors Episode 77 - https://youtu.be/kTaDHP_eVlgBEST OF FUN BUCKET JUNIORS Vol 6 - https://youtu.be/J0A9yjRyLhoFun Bucket Juniors Episode 76 - https://youtu.be/TwVF6t6CtdQBEST OF FUN BUCKET JUNIORS Vol 5 - https://youtu.be/3-La4qpw8BMFun Bucket Juniors Episode 75 - https://youtu.be/Ou_oFAmG1L4BEST OF FUN BUCKET JUNIORS Vol 4 - https://youtu.be/bgQI0ThWZZ0Fun Bucket Juniors Episode 74 - https://youtu.be/KIbTg98GZgkBEST OF FUN BUCKET JUNIORS Vol 3 - https://youtu.be/kxBXFxlRtqUFun Bucket Juniors Episode 73 - https://youtu.be/QA9O-pst2GgBEST OF FUN BUCKET JUNIORS Vol 2 - https://youtu.be/TlDqgZMF0XEFun Bucket Juniors Episode 72 - https://youtu.be/pWpbLUuyVAIBEST OF FUN BUCKET JUNIORS Vol 1 - https://youtu.be/VZC9Nk1jjfMFun Bucket Juniors Episode 71 - https://youtu.be/jU2jnqvSzcQFun Bucket Juniors Best of Ammu Vs Babai - https://youtu.be/PuTdCny4FsoWeb Series : Fun Bucket Juniors (Telugu)Cast : Baby Jaswica, Baby Snehitha, Master Gullu, Master Ikshwak, Master Hemanth, Baby Pragnya, Trishool Jeethuri, Rajesh Vulli, Srinivas, Prabhu DumboEditing : Syam VadavalliAssistant Director : NagendraAssistant Cameraman : Mallesh BandarProducer : Ravi Shankar KantamneniScript - Camera & Direction : Sai Tejae-Mail : funbucketjuniorsupdates@gmail.com"
"6rU7bxZ9fGY","Pratidin 15 January 2019 | ପ୍ରତିଦିନ - ଖବର ଓଡ଼ିଆରେ | OTV","2019-01-15T14:46:33.000Z","UCCgLMMp4lv7fSD2sBz1Ai6Q","OTV","25","19.16.01","“otv”,“odishatv”,odisha tv news,odisha news,odisha latest news,odisha politics,Bhubaneswar,cuttack,Rourkela,Sambalpur,national news,odisha breaking news,odisha current news,odia news,news in odia,no 1 odia news channel,odia news live,news,live,odia tv","32938","415","37","20","https://i.ytimg.com/vi/6rU7bxZ9fGY/default.jpg","False","False","OdishaTV is Odisha's no 1 News Channel. OTV being the first private satellite TV channel in Odisha carries the onus of charting a course that behoves its pioneering efforts.Accordingly its charter objectives are FREE, FAIR and UNBIASED. OTV delivers reliable information across all platforms: TV, Internet and Mobile.Stay tuned for all the breaking news !Visit Our Website https://odishatv.in/Android App: bit.ly/OTVAndroidAppiOS App: http://bit.ly/OTViOSAppWatch Live: http://live.odishatv.in/YouTube: https://goo.gl/Ehz6OPFacebook: https://www.facebook.com/otvnewsCircle on G+: google.com/+otvodishaTwitter: https://twitter.com/otvnewsInstagram: https://www.instagram.com/otvnews/#Odisha #OdishaNews"
"0WbEedcWgdM","Making A Simple Water Fountain | ഒരു കുഞ്ഞൻ വെള്ളച്ചാട്ടം  | M4 Tech |","2019-01-14T15:45:02.000Z","UClfll_TO6FpOPLUg4Aawhlw","M4 Tech","24","19.16.01","m4 tech,m4tech,m4 tech malayalam,m4 tech malayalam new videos,m4tech malayalam,jio joseph,jio joseph videos,jio joseph m4tech,water falls,mini water falls,water founden,water fountain,water fountain homemade,mini water fountain,simple water falls,simple water fountain","109049","11118","169","1308","https://i.ytimg.com/vi/0WbEedcWgdM/default.jpg","False","False","Music    :Disfigure - Blank [NCS Release]Music Url:https://www.youtube.com/watch?v=p7ZsBPK656sChannel  :NoCopyrightSoundsFollow Us On Facebook : https://www.facebook.com/M4TechOfficialFollow Us On Instagram : https://www.instagram.com/m4techofficial/"
"XVPwQCDVzvM","संक्रांतीच्या मनःपूर्वक शुभेच्छा | पहिलं e HaldiKunku | Free Masale | चला पटापट माहिती कळवा","2019-01-15T06:05:19.000Z","UCmbua9iiakRr6nuCXxxsKSQ","MadhurasRecipe Marathi","26","19.16.01","Madhurasrecipe,Marathi Recipe,Maharashtrian Recipes,Marathi Padarth,Maharashtrian Padarth,MadhurasRecipe,E-HaldiKunku,haldi kunku,haldi kunku rangoli,e haldikunku,haldikunku madhuras recipe,makar sankranti special,makar sankranti date 2019,makar sankranti 2019 date,makar sankranti recipe,makar sankranti,makar sankranti 2019,मकर संक्रांति 2019","65963","2160","194","1296","https://i.ytimg.com/vi/XVPwQCDVzvM/default.jpg","False","False","ई-हळदीकुंकुवाच्या फ्री सॅम्पल साठी या लिंक वर क्लिक करा आणि तुमचा डिटेल पत्ता व कॉन्टॅक्ट नंबर पाठवाhttp://bit.ly/MadhuraHaldiKumkumPlease take a moment to like and subscribe ✿◕ ‿ ◕✿http://www.youtube.com/c/MadhurasRecipeMarathi?sub_confirmation=1मधुराजरेसिपी चे मसाले ऑर्डर करण्यासाठी इथे क्लीक करा - https://amzn.to/2Cq0jz4#MadhurasRecipeMasale / #MRM मधुराजरेसिपी चे पुस्तक ऑर्डर करण्यासाठी इथे क्लीक करा https://amzn.to/2SuyATBhttp://amzn.in/d/jl7MY8lमधुरजरेसीपी पुस्तक घरपोहच मिळण्याकरता, तुमचे नाव आणि पत्ता ९८८११८६६६३ नंबरवर व्हाट्सअँप करा. हा नंबर मधुराच्या नसून हा माय मिरर पुब्लिकेशनचा नंबर आहे. मधुराज रेसिपी बुक किंवा मसाले ऑर्डर कसे करायचे यासाठी हा विडिओ पहाhttps://youtu.be/9Db_owqWJe4---------------------------------------------------------------------------------------------Click for detail Recipe - http://www.madhurasrecipe.com/regional-recipe/marathi-video-recipesVisit Facebook page - https://business.facebook.com/madhurasrecipeFor Business inquiries please email us on madhurasrecipe@gmail.com Subscribe to my other channelsMadharasrecipehttp://www.youtube.com/c/madhurasrecipe?sub_confirmation=1Hindi channelhttps://www.youtube.com/channel/UCIdtPLjTb111r4iubQ9Mq5A?sub_confirmation=1"
"59Q0LEmGW-w","Bella's pink puppy","2019-01-15T22:03:44.000Z","UC4nnJfWA4Ufzww5bzx4p-1w","Twin Baby Diaries","22","19.16.01","[none]","47729","3582","17","151","https://i.ytimg.com/vi/59Q0LEmGW-w/default.jpg","False","False","Thanks to#biggboss for returning #bellas #pinkpuppy🐶 she was so ecstatic and Happy when she saw it, but there was a lil pain to see it turn yellow.... babies are truly ther purest souls on this planet.for the full video look up at the @twinbabydiaries #youtube page"
"Y6m6YOLXsCo","Why Narendra Modi Wanted Alok Verma Out At Any Cost","2019-01-14T16:13:50.000Z","UChWtJey46brNr7qHQpN6KLQ","The Wire","25","19.16.01","The Wire,The Wire Video,Arfa Khanum Sherwani,Rohini Singh,Sanjay Hegde,Alok Verma,Rakesh Asthana,Narendra Modi,BJP Government,CVC,CBI,New Delhi,India,Suprem Court,Democracy,A K Sikri,Judgement,CBI Headquater","91665","5335","250","668","https://i.ytimg.com/vi/Y6m6YOLXsCo/default.jpg","False","False","मोदी सरकार के ज़रिये आलोक वर्मा को हटाने के लिये एड़ी-चोटी का ज़ोर लगाने और लोकतांत्रिक संस्थाओं की आज़ादी से खिलवाड़ करने पर चर्चा कर रही हैं द वायर की सीनियर एडिटर आरफ़ा ख़ानम शेरवानी. Click here to support The Wire: https://thewire.in/support"
"FN6d5u257OA","#शिखरसम्मेलनबिहार से शत्रुघ्न सिन्हा Live | ABP News Hindi","2019-01-15T13:44:33.000Z","UCmphdqZNmqL72WJ2uyiNw5w","ABP NEWS HINDI","25","19.16.01","shikhar sammelan abp news,shikhar sammelan abp news today,shikhar sammelan bihar,shikhar sammelan 2019,sp bsp alliance 2019,sp bsp gathbandhan,abp news,abp news hindi,tejaswi yadav latest speech,abp news live,abp hindi,abp live,aaj tak live,abp news hindi live,tejashwi yadav news,nitish kumar,chirag paswan,bjp vs congress,chirag news,bihar news,gathbandhan,breaking news,ram mandir news,pm modi,shatrughan sinha live,shatrughan sinha latest news","31961","1039","105","201","https://i.ytimg.com/vi/FN6d5u257OA/default.jpg","False","False","#शिखरसम्मेलनबिहार से शत्रुघ्न सिन्हा LIVESubscribe Our Channel: https://www.youtube.com/channel/UCmphdqZNmqL72WJ2uyiNw5w?sub_confirmation=1About Channel:ABP News एक समाचार चैनल है जो नवीनतम शीर्ष समाचारों, खेल, व्यवसाय, मनोरंजन, राजनीति और कई और अन्य कवरेज प्रदान करता है। यह चैनल मुख्य रूप से भारत के विभिन्न हिस्सों से नवीनतम समाचारों का विस्तृत विवरण प्रदान करता है।ABP News is a news hub which provides you with the comprehensive up-to-date news coverage from all over India and World. Get the latest top stories, current affairs, sports, business, entertainment, politics, astrology, spirituality, and many more here only on ABP News.ABP News is a popular Hindi News Channel made its debut as STAR News in March 2004 and was rebranded to ABP News from 1st June 2012.The vision of the channel is 'Aapko Rakhe Aagey' -the promise of keeping each individual ahead and informed. ABP News is best defined as a responsible channel with a fair and balanced approach that combines prompt reporting with insightful analysis of news and current affairs.ABP News maintains the repute of being a people's channel. Its cutting-edge formats, state-of-the-art newsrooms commands the attention of 48 million Indians weekly.Watch Live on http://abpnews.abplive.in/live-tvABP Hindi: http://abpnews.abplive.in/ABP English: http://www.abplive.in/Download ABP App for Apple: https://itunes.apple.com/in/app/abp-live-abp-news-abp-ananda/id811114904?mt=8Download ABP App for Android: https://play.google.com/store/apps/details?id=com.winit.starnews.hin&hl=enSocial Media Handles:Instagram: https://www.instagram.com/abpnewstv/Facebook: https://www.facebook.com/abpnews/Twitter: https://twitter.com/abpnewstvGoogle+: https://plus.google.com/+abpnews"
"Liq_5msemko","बिज़नस का ब्रहमास्त्र | Business Ideas By Him eesh Madaan","2019-01-15T14:49:44.000Z","UCZQDF0x18Xe6RZayvod99zA","Him-eesh Madaan","27","19.16.01","business ideas,business ideas in hindi,small business ideas,how to start a business,new business ideas,best business ideas,business ideas in india,innovation,business ideas for women,low investment business,new business ideas in hindi,top 10 business ideas,in india,in hindi,scamper,how to start a business in hindi,how to start a business in india,business ki baat,business tips hindi,business tips,no investment,paise kaise kamaye,himeesh madaan","34725","4005","55","636","https://i.ytimg.com/vi/Liq_5msemko/default.jpg","False","False","Download Document  Here: http://impact.himeesh.com/innovationIn this video, we are going to discuss how to think of new business ideas and innovate in any field to get success in life, career and business. This video contains over 25 examples of innovative business ideas which have lead to great success. To get some real insights on innovation watch this video by Himesh Madaan to give your career a fresh start for that much needed kick.Curated by: Team Him-eesh►Follow us on Instagram: https://www.instagram.com/himeeshmadaan/►Like Us On Facebook: https://www.facebook.com/himeeshmadaan/►Follow us on Twitter: https://twitter.com/himeeshmadaanYou can watch more related videos:► Find Business Ideas: https://www.youtube.com/watch?v=CG8DAfXGzmk► How to find business ideas: https://www.youtube.com/watch?v=YqzTLD_z77w#businessideas #himeeshmadaan  #businesstips"
"78COnhu86hs","Braun Strowman FLIPS Vince McMahon' Car ! Braun Strowman Flips Limo Car ! WWE Raw 14 January 2019 !","2019-01-15T03:31:31.000Z","UCetiwiWVoUBvIHIzYFaEiEw","Wrestle Chatter","24","19.16.01","braun strowman flips limo car,braun strowman flips limousine car,braun strowman flips vince mcmahon' car,braun strowman flips vince mcmahon car,braun strowman destroyed vince mcmahon car,wwe raw 14 january 2019 highlights,wwe raw highlights,braun strowman flip,vince mcmahon car,wwe,raw,highlights,braun strowman flips car","40413","4538","187","344","https://i.ytimg.com/vi/78COnhu86hs/default.jpg","False","False","Topics Covered In Video-1)Braun Strowman Flips Limousine Car !2)Braun Strowman Flips Vince McMahon' Car !3)Braun Strowman Destroyed & Flips Limo Car !4)WWE Monday Night Raw 14 January 2019 Highlights#WWERaw #BraunStrowman #VinceMcMahonBraun Strowman FLIPS Vince McMahon' Car ! Braun Strowman Flips Limo Car ! WWE Raw 14 January 2019 !Braun Strowman Flips Truck [REAL OR FAKE] :- https://www.youtube.com/watch?v=lAHlRDuotsIMEMPHIS — Braun Strowman received a $100,000 fine and was removed from the Universal Championship Match at WWE Royal Rumble after he tore a door off Mr. McMahon’s limousine during tonight’s edition of Monday Night Raw.When Baron Corbin provoked The Monster Among Men in the arena, Strowman chased The Lone Wolf backstage and, as Corbin hid in Mr. McMahon’s limo, Strowman ripped the door off the vehicle. The Chairman then verbally berated Strowman, stripping The Monster of his Universal Title opportunity and giving Strowman one of the biggest fines in WWE history. Following his severe punishment, the frustrated Strowman flipped over the vehicle and was escorted from the building shortly thereafter.My Second Channel For Masala Videos [ The RohiTreasure ] :- https://www.youtube.com/channel/UCJWATIXQplD0NUiFSqEpLngSocial Accounts:-Facebook:-  https://facebook.com/wrestlechatterInstagram:- https://instagram.com/wrestlechatterTwitter:-       https://twitter.com/wrestle_chatterMusic Credit-https://goo.gl/ZavNjAPhoto Credit-https://www.wwe.com/  (WWE)If you like our videos, PLEASE don't forget to like and share to your friends via Facebook, Whatsapp and other social platforms. Hit SUBSCRIBE & NOTIFICATION BELL icon button if you don't want to miss any video of our channel.About-Wrestle Chatter youtube channel runs by Rohit Pant. This channel provides content related to wrestling(WWE) and other interesting stuff that you must watch."
"f1Og_EyKZME","Koffee With Karan: Abhishek and Shweta Bachchan","2019-01-13T16:30:00.000Z","UCa0ZcLPHL2QY1p1xqBCYedQ","Star World","24","19.16.01","[none]","1047994","8755","779","1010","https://i.ytimg.com/vi/f1Og_EyKZME/default.jpg","False","False",""
"eYkLjyH02sM","मुंबईकरांचे सात दिवस हाल 'करून दाखवले' | 15 JAN 2019 | NEWS18 LOKMAT","2019-01-15T04:44:11.000Z","UCrcpw88HvKJ0skdsHniCJtQ","News18 Lokmat","25","19.16.01","marathi news,news,latest marathi news,latest news,breaking news,rajshri marathi,news18lokmat,news18 lokmat,IBN lokmat,marathi batmyaa,zee 24 taas,tv9 marathi,maharashtra batmyaa,Beed news,maharashtra,maharashtra city news,maharashtra news latest,maharashtra current news,maharastra news live,maharastra news today,maharashtra politics,maharashtra baatmya,best strike,best strike news,best strike news today","40118","287","40","64","https://i.ytimg.com/vi/eYkLjyH02sM/default.jpg","False","False","#BEST BUS STRIKEFollow us: https://lokmat.news18.com/https://twitter.com/news18lokmat?lang=enNews18 India’s leading News Network, and the Lokmat Group, Maharashtra’s leading Newspaper group, present News18Lokmat (formerly- IBN-Lokmat ) - a 24-hour Marathi News and Current Affairs Channel. The legacy of these two renowned media powerhouses will give News18Lokmat a sense of immense credibility as well as access to a vast audience base. Going on air from April 6, News18Lokmat will be a world-class credible News channel for the highly aware and conscious ‘Progressive Marathi’.Through its content, programming, state-of-the-art broadcast centre, extensive infrastructure and international production quality, news18Lokmat will embark on the principle of delivering news with the spirit of ‘Dhyas Janmansancha’. As credible journalism empowers people it gives them the inner confidence to take control of their surroundings and bring about change. News18Lokmat seeks to do just that and more. With reporters in every district of Maharashtra, and access"
"aaMlF4vlj3w","Petta Vs Viswasam வசூலில் யார் அதிகம் ? Tirupur Subramaniam Phone Interview","2019-01-14T14:37:43.000Z","UCnw6jUU0KaCjgAiRsbuiCgg","Cineulagam","24","19.16.01","TirupurSubramaniam,PettaBoxOffice,ViswasamBoxOffice,Petta,Rajinikanth,Viswasam,Ajith,Nayanthara,PettaViswasamFirstDayCollection,RajiniLatest,RajinikanthUpdates,PongalMovieRelease","150830","2608","222","674","https://i.ytimg.com/vi/aaMlF4vlj3w/default.jpg","False","False","Petta Vs Viswasam வசூலில் யார் அதிகம் ? Tirupur Subramaniam Phone Interview #TirupurSubramaniam  #PettaBoxOffice #ViswasamBoxOffice #Petta #Viswasam #Rajinikanth #Ajith #Nayanthara #PettaViswasamFirstDayCollection  #RajiniLatest #RajinikanthUpdates #PongalMovieRelease Log-on to http://www.cineulagam.comSubscribe: http://www.youtube.com/subscription_center?add_user=cineulagamFacebook: http://www.facebook.com/cineulagam"
"c1MywVcgOt4","Veera Na Lidha Laganiya | KAJAL MAHERIYA | વીરા ના લીધા લગનિયા | કાજલ મહેરિયા | Marriage Song 2019","2019-01-13T01:30:00.000Z","UCpZVXyR7lix525VPi3Vc5mg","Studio Saraswati Official","10","19.16.01","tahukar,jay mogal,maa mogal,rdc Gujarati,studio saraswati,latest garba,kajal maheriya,yuvraj suvada,Veera Na Lidha Laganiya,કાજલ મહેરિયા,Marriage Song 2019,Kajal Maheriya Latest Song,Kajal Maheriya New Song,Latest Marriage Song,New Marriage Song,New Marriage Song 2019,વીરા ના લીધા લગનિયા","826806","13032","952","559","https://i.ytimg.com/vi/c1MywVcgOt4/default.jpg","False","False","Produce & Present By STUDIO SARASWATI - Junagadh.Producer MANOJ N JOBANPUTRA.Lyrics : JEET VAGHELA.Music : RAHUL - RAVI ( Navrang Studio )DOP -,Editing - Director - Concept : CHANAKYA THAKOR.Artist : YUVRAJ SUVADA, KAJAL MAHERIYA, VAISHALI ACHARYA, JAYESH PRAJAPATI, RISHIKESH MEHRA, PAYAL ZALA, MITTAL THAKOR.Child Artist : TAKSH PATEL, DWIJ DESAI, PANTH DESAI, HRIDAAN THAKOR, BHOOMI CHAVDA, HETAXI ZALA, MAHI ZALA.Sp Thanks : BABAKHAN MODHERA & TEAM, JAYDEEP PRAJAPATI & FAMILY MEMBERS, SHREE NAVKAR BAND, RINKU DERIYA ( Deriya Beats) Mahesana.Dance Group : VIKRAM VAGHELA & GROUP. રોજ નવા અપડૅટ ની માહિતી માટે ૩ ચેનલ ને subcribe કરો.- STUDIO MAA MOGALwww.youtube.com/channel/UCXrYZPDM4U9M-Bk1L-Kcmpw?sub_confirmation=1- STUDIO SARASWATI OFFICIALwww.youtube.com/channel/UCpZVXyR7lix525VPi3Vc5mg?sub_confirmation=1- STUDIO SARASWATI  OFFICIAL CHANNEL"
"Y2fe5L5oXHM","Paaru | Episode - 32 | Preview | 15 Jan 2019 | #ZeeKannada Serial","2019-01-15T07:58:23.000Z","UC4xZrjsfEiomEbE9OUjN4-g","Zee Kannada","24","19.16.01","paaru,paaru kannada serial song,paaru kannada new serial,paaru kannada serial promo,paaru kannada new serial song,paaru kannada serial,#tvshows,zee Kannada,kannada,kannada serials,soap,kannada tv serial,TV Shows,watch online,kannada serial,popular kannada serial,#zee,#story,#onlinetvchannel,#zeekannadaserial,#zeekannadashow,#zeeshows,#zeesoaps,kannada shows,serial,Online Tv Channel","41892","82","14","0","https://i.ytimg.com/vi/Y2fe5L5oXHM/default.jpg","False","False","Subscribe & Watch full episodes BEFORE TVZEE5 : http://bit.ly/2GxMe6aZEE5 Now available in 190+ countries. Click Here http://bit.ly/WatchNowOnZEE5To watch FULL episode of #zeeshow Paaru | CLICK here - https://www.zee5.com/tvshows/details/paaru/0-6-1179/latestThe feel of your language is in your #entertainment too! Watch your favourite #TVshows| movies| original shows| in 12 languages| because every language has a super feel!ZEE5 Now available in 190+ countries. Click Here http://bit.ly/WatchNowOnZEE5 To Feel ZEE5 in Your Language| DOWNLOAD the app now - Playstore: https://play.google.com/store/apps/details?id=com.graymatrix.did- iTunes: https://itunes.apple.com/in/app/ozee-tv-shows-movies-more/id743691886Visit our website - https://www.zee5.com Connect with us on Social Media: - Facebook - https://www.facebook.com/ZEE5/ - Instagram - https://www.instagram.com/zee5 - Twitter - https://twitter.com/ZEE5IndiaPaaru is a Kannada drama television series starring Vinaya Prasad and others. The story revolves around Akhilandeshwari, an arrogant and rich woman, who has the final say in everything. Situations change when Paaru, a poor village girl, enters Akhilandeshwari's house to stay with the family. What happens when Akhilandeshwari and Paaru meet under one roof forms the rest of the story."
